WorkOrder_Asset,WorkOrder_Description,Work_Order,Location,Location_Normalized,Notes,Lead,Reported_Date,Reported_Timestamp,Target_Finish,Target_Finish_Timestamp,Actual_Finish,Actual_Finish_Timestamp,Priority,Priority_Int,Priority_InvalidValue,Work_Type,Status,History,Is_dynamic,Dynamic_Job_Plan_applied,Site,Assets,Asset_Descriptions,Parent,IsProblematic,Plant_Area,Area,Tag_Full,INstrumentation_Location,Instrumentation_Type_,Instrumentation_Data_Type,Instrumentation_Data_Type_Meaning,INstrumentation_Type_Description,Role,Instrumentation_Description,Related_Location_Cleaned,Shutdown_Number,Shutdown_Start,Shutdown_End,Shutdown_Length_Hours,Shutdown_Length_Days,Completed_DuringShutdown,Reported_1HrBeforeShutdown,Reported_6HrBeforeShutdown,Reported_24HrBeforeShutdown,Reported_DuringShutdown,Completed_Within24HrsAfterShutdown,Completed_Within1HrsAfterShutdown,Completed_Within1HrsBeforeShutdown,Match_Priority,rn
1314,Install safety treads on the staircase to security trailer,23-31302,BU-ADMIN,BU-ADMIN,,,1-5-23 12:42 PM,2023-01-05T12:42:00.000Z,1-13-23 12:00 PM,2023-01-13T12:00:00.000Z,1-6-23 4:00 PM,2023-01-06T16:00:00.000Z,1,1,,SA,CLOSE,Y,,NO,CHATHAM,,,,,,,,,,,,,,,,1,2023-01-06T09:50:00.000Z,2023-01-06T10:50:00.000Z,115.0,4.791666666666667,No,No,No,Yes,No,Yes,No,No,4,1
4868,Clean Weigh Belt,23-31303,SC-1301,SC-1301,,,1-5-23 12:49 PM,2023-01-05T12:49:00.000Z,1-12-23 11:54 AM,2023-01-12T11:54:00.000Z,1-10-23 1:24 PM,2023-01-10T13:24:00.000Z,4,4,,CO,CLOSE,Y,,NO,CHATHAM,,,,,,,,,,,,,,,,1,2023-01-06T09:50:00.000Z,2023-01-06T10:50:00.000Z,115.0,4.791666666666667,No,No,No,Yes,No,No,No,No,4,1
6309,TA 23 Gasket Failure of Chevron wash to V-1630,23-31310,V-1630,V-1630,,OC-MECH,1-5-23 3:33 PM,2023-01-05T15:33:00.000Z,4-24-23 11:12 AM,2023-04-24T11:12:00.000Z,5-24-23 8:22 AM,2023-05-24T08:22:00.000Z,4,4,,CO,CLOSE,Y,,NO,CHATHAM,,,,,,,,,,,,,,,,1,2023-01-06T09:50:00.000Z,2023-01-06T10:50:00.000Z,115.0,4.791666666666667,No,No,No,Yes,No,No,No,No,4,1
1487,SD23 - CIP return v/v to E-1400 is passing,23-31312,E-1400,E-1400,,,1-5-23 3:35 PM,2023-01-05T15:35:00.000Z,,,3-9-23 8:38 AM,2023-03-09T08:38:00.000Z,4,4,,SD,CLOSE,Y,,NO,CHATHAM,,,,,,,,,,,,,,,,1,2023-01-06T09:50:00.000Z,2023-01-06T10:50:00.000Z,115.0,4.791666666666667,No,No,No,Yes,No,No,No,No,4,1
6728,Steve M/Viraj- Commission P-1308B Monday,23-31313,P-1305B,P-1305B,,,1-5-23 4:09 PM,2023-01-05T16:09:00.000Z,1-9-23 4:09 PM,2023-01-09T16:09:00.000Z,1-9-23 5:39 PM,2023-01-09T17:39:00.000Z,4,4,,CO,CLOSE,Y,,NO,CHATHAM,,,,,,,,,,,,,,,,1,2023-01-06T09:50:00.000Z,2023-01-06T10:50:00.000Z,115.0,4.791666666666667,No,No,No,Yes,No,No,No,No,4,1
9816,komatsu loader driving issue,23-31314,LD-2100,LD-2100,,,1-6-23 7:13 AM,2023-01-06T07:13:00.000Z,1-6-23 1:00 PM,2023-01-06T13:00:00.000Z,1-6-23 3:13 PM,2023-01-06T15:13:00.000Z,2,2,,RM,CLOSE,Y,,NO,CHATHAM,,,,,,,,,,,,,,,,1,2023-01-06T09:50:00.000Z,2023-01-06T10:50:00.000Z,115.0,4.791666666666667,No,No,Yes,Yes,No,Yes,No,No,4,1
1117,remove strainer/Clean and inspect,23-31319,P-1844,P-1844,,,1-6-23 8:04 AM,2023-01-06T08:04:00.000Z,1-13-23 2:58 PM,2023-01-13T14:58:00.000Z,1-12-23 6:27 AM,2023-01-12T06:27:00.000Z,4,4,,CO,CLOSE,Y,,NO,CHATHAM,1117,GOULDS PUMP 3196 MTi,,No,DRYER A,,,,,,,,,,,1,2023-01-06T09:50:00.000Z,2023-01-06T10:50:00.000Z,115.0,4.791666666666667,No,No,Yes,Yes,No,No,No,No,4,1
,,23-31320,,,,,1-6-23 8:05 AM,2023-01-06T08:05:00.000Z,1-13-23 2:58 PM,2023-01-13T14:58:00.000Z,1-6-23 3:14 PM,2023-01-06T15:14:00.000Z,4,4,,CO,CLOSE,Y,,NO,CHATHAM,,,,,,,,,,,,,,,,1,2023-01-06T09:50:00.000Z,2023-01-06T10:50:00.000Z,115.0,4.791666666666667,No,No,Yes,Yes,No,Yes,No,No,4,1
1117,reinstall,23-31322,P-1844,P-1844,,,1-6-23 8:06 AM,2023-01-06T08:06:00.000Z,1-13-23 2:58 PM,2023-01-13T14:58:00.000Z,1-12-23 6:27 AM,2023-01-12T06:27:00.000Z,4,4,,CO,CLOSE,Y,,NO,CHATHAM,1117,GOULDS PUMP 3196 MTi,,No,DRYER A,,,,,,,,,,,1,2023-01-06T09:50:00.000Z,2023-01-06T10:50:00.000Z,115.0,4.791666666666667,No,No,Yes,Yes,No,No,No,No,4,1
2536,Reapply silicone around insulation on dryer cyclones,23-31323,CY-1829,CY-1829,,,1-6-23 8:29 AM,2023-01-06T08:29:00.000Z,2-23-23 1:03 PM,2023-02-23T13:03:00.000Z,2-6-23 2:20 PM,2023-02-06T14:20:00.000Z,4,4,,CO,CLOSE,Y,,NO,CHATHAM,2536,"CYCLONE ASSEMBLY, LEFT HAND, DEDERT MODEL# CYCL-12 B",,No,DRYER A,CH-DRYER_A,CH-DRYER_A:IT18152.MEAS,IT-18152,IT,MEAS,Measured value (PV),Current transmitter (motor amps),Measurement,CY1829 TOP TEMP,CY-1829,1,2023-01-06T09:50:00.000Z,2023-01-06T10:50:00.000Z,115.0,4.791666666666667,No,No,Yes,Yes,No,No,No,No,4,1
1491,E-1403 Replacement Project Tie Points,23-31325,E-1403,E-1403,,,1-6-23 8:38 AM,2023-01-06T08:38:00.000Z,4-21-23 2:44 PM,2023-04-21T14:44:00.000Z,5-5-23 3:27 PM,2023-05-05T15:27:00.000Z,4,4,,CP,CLOSE,Y,,NO,CHATHAM,,,,,,,,,,,,,,,,1,2023-01-06T09:50:00.000Z,2023-01-06T10:50:00.000Z,115.0,4.791666666666667,No,No,Yes,Yes,No,No,No,No,4,1
5457,Heat Trace/thermostat on GA recirculation line - ON,23-31326,TK-1310A,TK-1310A,,,1-6-23 8:49 AM,2023-01-06T08:49:00.000Z,1-20-23 8:11 AM,2023-01-20T08:11:00.000Z,1-6-23 8:52 AM,2023-01-06T08:52:00.000Z,4,4,,CO,CLOSE,Y,,NO,CHATHAM,,,,,,,,,,,,,,,,1,2023-01-06T09:50:00.000Z,2023-01-06T10:50:00.000Z,115.0,4.791666666666667,No,No,Yes,Yes,No,No,No,Yes,4,1
5468,Internal Inspection TK1601,23-31327,TK-1601,TK-1601,,,1-6-23 8:54 AM,2023-01-06T08:54:00.000Z,4-22-23 8:42 AM,2023-04-22T08:42:00.000Z,5-16-23 2:35 PM,2023-05-16T14:35:00.000Z,4,4,,PM,CLOSE,Y,,NO,CHATHAM,,,,,,,,,,,,,,,,1,2023-01-06T09:50:00.000Z,2023-01-06T10:50:00.000Z,115.0,4.791666666666667,No,Yes,Yes,Yes,No,No,No,No,4,1
5449,Level Transimiter on TK11402,23-31328,TK-11402,TK-11402,,,1-6-23 9:00 AM,2023-01-06T09:00:00.000Z,1-18-23 6:37 AM,2023-01-18T06:37:00.000Z,,,4,4,,CO,CAN,Y,,NO,CHATHAM,,,,,,,,,,,,,,,,1,2023-01-06T09:50:00.000Z,2023-01-06T10:50:00.000Z,115.0,4.791666666666667,No,Yes,Yes,Yes,No,No,No,No,4,1
,Women's washroom toilets are inadequate,23-31329,BU-ADMIN,BU-ADMIN,,,1-6-23 9:05 AM,2023-01-06T09:05:00.000Z,1-11-23 10:10 AM,2023-01-11T10:10:00.000Z,1-31-23 8:15 AM,2023-01-31T08:15:00.000Z,4,4,,RM,CLOSE,Y,,NO,CHATHAM,,,,,,,,,,,,,,,,1,2023-01-06T09:50:00.000Z,2023-01-06T10:50:00.000Z,115.0,4.791666666666667,No,Yes,Yes,Yes,No,No,No,No,4,1
1453,DA 3602 PIC 69106 Frozen,23-31252,DA-3602,DA-3602,,,1-3-23 8:27 AM,2023-01-03T08:27:00.000Z,1-28-23 12:39 AM,2023-01-28T00:39:00.000Z,1-12-23 2:11 AM,2023-01-12T02:11:00.000Z,4,4,,CO,CLOSE,Y,,NO,CHATHAM,,,,,,,,,,,,,,,,2,2023-01-11T04:50:00.000Z,2023-01-11T20:00:00.000Z,477.5,19.895833333333332,No,No,No,No,No,Yes,No,No,5,1
,Steam leaking from trap off RC2 steam feed to reboiler,23-31256,1500-PD-15H,1500-PD-15H,,,1-3-23 9:10 AM,2023-01-03T09:10:00.000Z,1-6-23 1:02 PM,2023-01-06T13:02:00.000Z,1-11-23 7:28 AM,2023-01-11T07:28:00.000Z,4,4,,RM,CLOSE,Y,,NO,CHATHAM,,,,,,,,,,,,,,,,2,2023-01-11T04:50:00.000Z,2023-01-11T20:00:00.000Z,477.5,19.895833333333332,Yes,No,No,No,No,No,No,No,1,1
1117,Clean and inspect witches hat upstream of P1844,23-31315,P-1844,P-1844,,,1-6-23 7:24 AM,2023-01-06T07:24:00.000Z,1-13-23 2:58 PM,2023-01-13T14:58:00.000Z,1-11-23 4:58 PM,2023-01-11T16:58:00.000Z,4,4,,CO,CLOSE,Y,,NO,CHATHAM,1117,GOULDS PUMP 3196 MTi,,No,DRYER A,,,,,,,,,,,2,2023-01-11T04:50:00.000Z,2023-01-11T20:00:00.000Z,477.5,19.895833333333332,Yes,No,No,No,No,No,No,No,1,1
1233,Requesting I/E to investigate RC1 base strength analyzer limits (AT-15816),23-31330,AT-15816,AT-15816,,,1-6-23 9:09 AM,2023-01-06T09:09:00.000Z,1-31-23 11:29 AM,2023-01-31T11:29:00.000Z,1-11-23 12:36 PM,2023-01-11T12:36:00.000Z,4,4,,CO,CLOSE,Y,,NO,CHATHAM,,,,,,,,,,,,,,,,2,2023-01-11T04:50:00.000Z,2023-01-11T20:00:00.000Z,477.5,19.895833333333332,Yes,No,No,No,No,No,No,No,1,1
2667,Verify Operation on Actuators/see Mike J,23-31342,HV-84597,HV-84597,,,1-6-23 2:16 PM,2023-01-06T14:16:00.000Z,1-13-23 2:16 PM,2023-01-13T14:16:00.000Z,1-11-23 3:16 PM,2023-01-11T15:16:00.000Z,4,4,,CO,CLOSE,Y,,NO,CHATHAM,,,,,,,,,,,,,,,,2,2023-01-11T04:50:00.000Z,2023-01-11T20:00:00.000Z,477.5,19.895833333333332,Yes,No,No,No,No,No,No,No,1,1
1511,Cooling water PSV leak on E-1553,23-31558,E-1553,E-1553,,,1-9-23 7:37 AM,2023-01-09T07:37:00.000Z,1-13-23 8:00 PM,2023-01-13T20:00:00.000Z,1-12-23 4:01 PM,2023-01-12T16:01:00.000Z,4,4,,CO,CLOSE,Y,,NO,CHATHAM,,,,,,,,,,,,,,,,2,2023-01-11T04:50:00.000Z,2023-01-11T20:00:00.000Z,477.5,19.895833333333332,No,No,No,No,No,Yes,No,No,5,1
,BL-1829- inspect aluminum air seal rings,23-31559,BL-1829,BL-1829,,,1-9-23 7:42 AM,2023-01-09T07:42:00.000Z,1-12-23 5:00 PM,2023-01-12T17:00:00.000Z,1-11-23 7:30 AM,2023-01-11T07:30:00.000Z,4,4,,CO,CLOSE,Y,,NO,CHATHAM,"10034, 2868","BLOWER, HOWDEN, FAN MODEL E40S-8700 SWSI CCW TAU Arrg't7, 600HP / 1200RPM / TEFC / 575V/3PH/60HZ / 5810B FRAME",,Yes,DRYER A,CH-DRYER_A,CH-DRYER_A:SY18153B.OUT,SY-18153B,SY,OUT,Controller output / demand (CO),Speed output (VFD demand),Output/Demand,BL1829 CURRENT INDICATION,BL-1829,2,2023-01-11T04:50:00.000Z,2023-01-11T20:00:00.000Z,477.5,19.895833333333332,Yes,No,No,No,No,No,No,No,1,1
,Test auto lube system on A dryer,23-31560,DR-1826,DR-1826,,,1-9-23 7:43 AM,2023-01-09T07:43:00.000Z,1-12-23 5:00 PM,2023-01-12T17:00:00.000Z,1-11-23 9:00 AM,2023-01-11T09:00:00.000Z,4,4,,CO,CLOSE,Y,,NO,CHATHAM,"2541, 2542, 2543, 2544, 2545, 2547, 2549, 2550, 2552, 2553, 2554, 2555, 2556, 2557, 2558, 2559","SWISS COMBI ROTARY DRYER DRUM, SEW GEARBOX - LEFT HAND DRIVE -, SEW GEARBOX - LEFT HAND DRIVE, SEW GEARBOX - RIGHT HAND DRIVE, SEW GEARBOX - RIGHT HAND DRIVE, MOTOR / 25HP / 1800RPM / TEFC / 575V/3PH/60HZ / FRAME# 284TC, MOTOR / 25HP / 1800RPM / TEFC / 575V/3PH/60HZ / FRAME# 284TC, MOTOR / 25HP / 1800RPM / TEFC / 575V/3PH/60HZ / FRAME# 284TC, MOTOR / 25HP / 1800RPM / TEFC / 575V/3PH/60HZ / FRAME# 284TC, TRUNNION (A) - LEFT HAND DRIVE, TRUNNION (B)- RIGHT HAND DRIVE, TRUNNION (D) - LEFT HAND DRIVE, TRUNNION (C) - RIGHT HAND DRIVE, THRUST ROLLER ASSEMBLY, THRUST ROLLER ASSEMBLY, TRUNNION LUBRICATION SYSTEM",,No,DRYER A,CH-DRA_CYCLNS,CH-DRA_CYCLNS:TT18168B.MEAS,TT-18168B,TT,MEAS,Measured value (PV),Temperature transmitter,Measurement,DRUM DR1826 MOTOR A AMPERAGE,DR-1826,2,2023-01-11T04:50:00.000Z,2023-01-11T20:00:00.000Z,477.5,19.895833333333332,Yes,No,No,No,No,No,No,No,1,1
,Fabricate and install new bracket for wireless IT pole and secure to building. Cut off base,23-31603,0000,0000,,,1-9-23 2:29 PM,2023-01-09T14:29:00.000Z,1-11-23 2:26 PM,2023-01-11T14:26:00.000Z,1-11-23 10:16 AM,2023-01-11T10:16:00.000Z,1,1,,CP,CLOSE,Y,,NO,CHATHAM,,,,,,,,,,,,,,,,2,2023-01-11T04:50:00.000Z,2023-01-11T20:00:00.000Z,477.5,19.895833333333332,Yes,No,No,No,No,No,No,No,1,1
,CV-1830 Open end for water to drain,23-31639,CV-1830,CV-1830,,,1-10-23 10:08 AM,2023-01-10T10:08:00.000Z,1-11-23 10:08 AM,2023-01-11T10:08:00.000Z,1-10-23 11:36 AM,2023-01-10T11:36:00.000Z,4,4,,CO,CLOSE,Y,,NO,CHATHAM,"2490, 2515","20 HP / 1760 RPM / TEFC / 575V/3PH/60HZ / FRAME#256T, DORRIS 315TR25 SHAFT MOUNTED SPEED REDUCER",,No,DRYER A,CH-DRYER_A,CH-DRYER_A:CV1830.STAIND,CV-1830,CV,STAIND,"Status indication (open/closed, run/stop)",Conveyor (asset),Equipment status,RECYCLE DRAG CONVEYOR,,2,2023-01-11T04:50:00.000Z,2023-01-11T20:00:00.000Z,477.5,19.895833333333332,No,No,No,Yes,No,No,No,No,4,1
,OPEN FOR WATER TO DRAIN,23-31640,CV-1830,CV-1830,,,1-10-23 10:09 AM,2023-01-10T10:09:00.000Z,2-23-23 10:08 AM,2023-02-23T10:08:00.000Z,1-10-23 11:36 AM,2023-01-10T11:36:00.000Z,4,4,,CO,CLOSE,Y,,NO,CHATHAM,"2490, 2515","20 HP / 1760 RPM / TEFC / 575V/3PH/60HZ / FRAME#256T, DORRIS 315TR25 SHAFT MOUNTED SPEED REDUCER",,No,DRYER A,CH-DRYER_A,CH-DRYER_A:CV1830.STAIND,CV-1830,CV,STAIND,"Status indication (open/closed, run/stop)",Conveyor (asset),Equipment status,RECYCLE DRAG CONVEYOR,,2,2023-01-11T04:50:00.000Z,2023-01-11T20:00:00.000Z,477.5,19.895833333333332,No,No,No,Yes,No,No,No,No,4,1
,INSPECT SCREW CONVEYOR,23-31651,CV-1826B,CV-1826B,,,1-10-23 10:48 AM,2023-01-10T10:48:00.000Z,1-10-23 7:00 AM,2023-01-10T07:00:00.000Z,5-19-23 2:03 PM,2023-05-19T14:03:00.000Z,2,2,,PM,CLOSE,Y,,NO,CHATHAM,"2487, 2508","7.5 HP / 3520 RPM / TEFC / 575V/3PH/60HZ / FRAME#213TC, SEW PARALLEL SHAFT HELICAL GEAR UNIT FHZ127 R77 AM213/215",,No,DRYER A,CH-DRA_CYCLNS,CH-DRA_CYCLNS:IT18172.MEAS,IT-18172,IT,MEAS,Measured value (PV),Current transmitter (motor amps),Measurement,CV1826B CURRENT INDICATION,CV-1826B,2,2023-01-11T04:50:00.000Z,2023-01-11T20:00:00.000Z,477.5,19.895833333333332,No,No,No,Yes,No,No,No,No,4,1
,INSPECT PILLOW BLOCK BEARINGS,23-31649,CV-1826B,CV-1826B,,,1-10-23 10:48 AM,2023-01-10T10:48:00.000Z,1-10-23 7:00 AM,2023-01-10T07:00:00.000Z,5-19-23 2:03 PM,2023-05-19T14:03:00.000Z,2,2,,PM,CLOSE,Y,,NO,CHATHAM,"2487, 2508","7.5 HP / 3520 RPM / TEFC / 575V/3PH/60HZ / FRAME#213TC, SEW PARALLEL SHAFT HELICAL GEAR UNIT FHZ127 R77 AM213/215",,No,DRYER A,CH-DRA_CYCLNS,CH-DRA_CYCLNS:IT18172.MEAS,IT-18172,IT,MEAS,Measured value (PV),Current transmitter (motor amps),Measurement,CV1826B CURRENT INDICATION,CV-1826B,2,2023-01-11T04:50:00.000Z,2023-01-11T20:00:00.000Z,477.5,19.895833333333332,No,No,No,Yes,No,No,No,No,4,1
,INSPECT CONVEYOR TROUGH,23-31652,CV-1826B,CV-1826B,,,1-10-23 10:48 AM,2023-01-10T10:48:00.000Z,1-10-23 7:00 AM,2023-01-10T07:00:00.000Z,5-19-23 2:03 PM,2023-05-19T14:03:00.000Z,2,2,,PM,CLOSE,Y,,NO,CHATHAM,"2487, 2508","7.5 HP / 3520 RPM / TEFC / 575V/3PH/60HZ / FRAME#213TC, SEW PARALLEL SHAFT HELICAL GEAR UNIT FHZ127 R77 AM213/215",,No,DRYER A,CH-DRA_CYCLNS,CH-DRA_CYCLNS:IT18172.MEAS,IT-18172,IT,MEAS,Measured value (PV),Current transmitter (motor amps),Measurement,CV1826B CURRENT INDICATION,CV-1826B,2,2023-01-11T04:50:00.000Z,2023-01-11T20:00:00.000Z,477.5,19.895833333333332,No,No,No,Yes,No,No,No,No,4,1
,CV-1826B MECHANICAL PM,23-31646,CV-1826B,CV-1826B,,,1-10-23 10:48 AM,2023-01-10T10:48:00.000Z,2-23-23 10:00 AM,2023-02-23T10:00:00.000Z,5-19-23 2:03 PM,2023-05-19T14:03:00.000Z,4,4,,PM,CLOSE,Y,N,NO,CHATHAM,"2487, 2508","7.5 HP / 3520 RPM / TEFC / 575V/3PH/60HZ / FRAME#213TC, SEW PARALLEL SHAFT HELICAL GEAR UNIT FHZ127 R77 AM213/215",,No,DRYER A,CH-DRA_CYCLNS,CH-DRA_CYCLNS:IT18172.MEAS,IT-18172,IT,MEAS,Measured value (PV),Current transmitter (motor amps),Measurement,CV1826B CURRENT INDICATION,CV-1826B,2,2023-01-11T04:50:00.000Z,2023-01-11T20:00:00.000Z,477.5,19.895833333333332,No,No,No,Yes,No,No,No,No,4,1
,CHECK CONDITION OF THE PACKING IN THE STUFFING BOX,23-31647,CV-1826B,CV-1826B,,,1-10-23 10:48 AM,2023-01-10T10:48:00.000Z,1-10-23 7:00 AM,2023-01-10T07:00:00.000Z,5-19-23 2:03 PM,2023-05-19T14:03:00.000Z,2,2,,PM,CLOSE,Y,,NO,CHATHAM,"2487, 2508","7.5 HP / 3520 RPM / TEFC / 575V/3PH/60HZ / FRAME#213TC, SEW PARALLEL SHAFT HELICAL GEAR UNIT FHZ127 R77 AM213/215",,No,DRYER A,CH-DRA_CYCLNS,CH-DRA_CYCLNS:IT18172.MEAS,IT-18172,IT,MEAS,Measured value (PV),Current transmitter (motor amps),Measurement,CV1826B CURRENT INDICATION,CV-1826B,2,2023-01-11T04:50:00.000Z,2023-01-11T20:00:00.000Z,477.5,19.895833333333332,No,No,No,Yes,No,No,No,No,4,1
,CHECK PACKING GLAND LUBRICANT.  ADD GREASE  AS NECESSARY,23-31648,CV-1826B,CV-1826B,,,1-10-23 10:48 AM,2023-01-10T10:48:00.000Z,1-10-23 7:00 AM,2023-01-10T07:00:00.000Z,5-19-23 2:03 PM,2023-05-19T14:03:00.000Z,2,2,,PM,CLOSE,Y,,NO,CHATHAM,"2487, 2508","7.5 HP / 3520 RPM / TEFC / 575V/3PH/60HZ / FRAME#213TC, SEW PARALLEL SHAFT HELICAL GEAR UNIT FHZ127 R77 AM213/215",,No,DRYER A,CH-DRA_CYCLNS,CH-DRA_CYCLNS:IT18172.MEAS,IT-18172,IT,MEAS,Measured value (PV),Current transmitter (motor amps),Measurement,CV1826B CURRENT INDICATION,CV-1826B,2,2023-01-11T04:50:00.000Z,2023-01-11T20:00:00.000Z,477.5,19.895833333333332,No,No,No,Yes,No,No,No,No,4,1
,INSPECT GEARBOX,23-31650,CV-1826B,CV-1826B,,,1-10-23 10:48 AM,2023-01-10T10:48:00.000Z,1-10-23 7:00 AM,2023-01-10T07:00:00.000Z,5-19-23 2:03 PM,2023-05-19T14:03:00.000Z,2,2,,PM,CLOSE,Y,,NO,CHATHAM,"2487, 2508","7.5 HP / 3520 RPM / TEFC / 575V/3PH/60HZ / FRAME#213TC, SEW PARALLEL SHAFT HELICAL GEAR UNIT FHZ127 R77 AM213/215",,No,DRYER A,CH-DRA_CYCLNS,CH-DRA_CYCLNS:IT18172.MEAS,IT-18172,IT,MEAS,Measured value (PV),Current transmitter (motor amps),Measurement,CV1826B CURRENT INDICATION,CV-1826B,2,2023-01-11T04:50:00.000Z,2023-01-11T20:00:00.000Z,477.5,19.895833333333332,No,No,No,Yes,No,No,No,No,4,1
,CHECK PACKING GLAND LUBRICANT.  ADD GREASE  AS NECESSARY,23-31655,CV-1826A,CV-1826A,,,1-10-23 10:51 AM,2023-01-10T10:51:00.000Z,1-10-23 7:00 AM,2023-01-10T07:00:00.000Z,1-10-23 10:53 AM,2023-01-10T10:53:00.000Z,2,2,,PM,CLOSE,Y,,NO,CHATHAM,"2486, 2507","7.5 HP / 3520 RPM / TEFC / 575V/3PH/60HZ / FRAME#213TC, SEW PARALLEL SHAFT HELICAL GEAR UNIT FHZ127 R77 AM213/215",,No,DRYER A,CH-DRA_CYCLNS,CH-DRA_CYCLNS:SSL18171.CIN,SSL-18171,SSL,CIN,Contact input (discrete),Speed switch (motion proof),Discrete Input,CV1826A CURRENT INDICATION,CV-1826A,2,2023-01-11T04:50:00.000Z,2023-01-11T20:00:00.000Z,477.5,19.895833333333332,No,No,No,Yes,No,No,No,No,4,1
,INSPECT CONVEYOR TROUGH,23-31659,CV-1826A,CV-1826A,,,1-10-23 10:51 AM,2023-01-10T10:51:00.000Z,1-10-23 7:00 AM,2023-01-10T07:00:00.000Z,1-10-23 10:53 AM,2023-01-10T10:53:00.000Z,2,2,,PM,CLOSE,Y,,NO,CHATHAM,"2486, 2507","7.5 HP / 3520 RPM / TEFC / 575V/3PH/60HZ / FRAME#213TC, SEW PARALLEL SHAFT HELICAL GEAR UNIT FHZ127 R77 AM213/215",,No,DRYER A,CH-DRA_CYCLNS,CH-DRA_CYCLNS:SSL18171.CIN,SSL-18171,SSL,CIN,Contact input (discrete),Speed switch (motion proof),Discrete Input,CV1826A CURRENT INDICATION,CV-1826A,2,2023-01-11T04:50:00.000Z,2023-01-11T20:00:00.000Z,477.5,19.895833333333332,No,No,No,Yes,No,No,No,No,4,1
,INSPECT SCREW CONVEYOR,23-31658,CV-1826A,CV-1826A,,,1-10-23 10:51 AM,2023-01-10T10:51:00.000Z,1-10-23 7:00 AM,2023-01-10T07:00:00.000Z,1-10-23 10:53 AM,2023-01-10T10:53:00.000Z,2,2,,PM,CLOSE,Y,,NO,CHATHAM,"2486, 2507","7.5 HP / 3520 RPM / TEFC / 575V/3PH/60HZ / FRAME#213TC, SEW PARALLEL SHAFT HELICAL GEAR UNIT FHZ127 R77 AM213/215",,No,DRYER A,CH-DRA_CYCLNS,CH-DRA_CYCLNS:SSL18171.CIN,SSL-18171,SSL,CIN,Contact input (discrete),Speed switch (motion proof),Discrete Input,CV1826A CURRENT INDICATION,CV-1826A,2,2023-01-11T04:50:00.000Z,2023-01-11T20:00:00.000Z,477.5,19.895833333333332,No,No,No,Yes,No,No,No,No,4,1
,INSPECT GEARBOX,23-31664,CV-1826A,CV-1826A,,,1-10-23 10:51 AM,2023-01-10T10:51:00.000Z,1-10-23 7:00 AM,2023-01-10T07:00:00.000Z,3-16-23 8:56 AM,2023-03-16T08:56:00.000Z,2,2,,PM,CLOSE,Y,,NO,CHATHAM,"2486, 2507","7.5 HP / 3520 RPM / TEFC / 575V/3PH/60HZ / FRAME#213TC, SEW PARALLEL SHAFT HELICAL GEAR UNIT FHZ127 R77 AM213/215",,No,DRYER A,CH-DRA_CYCLNS,CH-DRA_CYCLNS:SSL18171.CIN,SSL-18171,SSL,CIN,Contact input (discrete),Speed switch (motion proof),Discrete Input,CV1826A CURRENT INDICATION,CV-1826A,2,2023-01-11T04:50:00.000Z,2023-01-11T20:00:00.000Z,477.5,19.895833333333332,No,No,No,Yes,No,No,No,No,4,1
,INSPECT SCREW CONVEYOR,23-31665,CV-1826A,CV-1826A,,,1-10-23 10:51 AM,2023-01-10T10:51:00.000Z,1-10-23 7:00 AM,2023-01-10T07:00:00.000Z,3-16-23 8:56 AM,2023-03-16T08:56:00.000Z,2,2,,PM,CLOSE,Y,,NO,CHATHAM,"2486, 2507","7.5 HP / 3520 RPM / TEFC / 575V/3PH/60HZ / FRAME#213TC, SEW PARALLEL SHAFT HELICAL GEAR UNIT FHZ127 R77 AM213/215",,No,DRYER A,CH-DRA_CYCLNS,CH-DRA_CYCLNS:SSL18171.CIN,SSL-18171,SSL,CIN,Contact input (discrete),Speed switch (motion proof),Discrete Input,CV1826A CURRENT INDICATION,CV-1826A,2,2023-01-11T04:50:00.000Z,2023-01-11T20:00:00.000Z,477.5,19.895833333333332,No,No,No,Yes,No,No,No,No,4,1
,CHECK CONDITION OF THE PACKING IN THE STUFFING BOX,23-31654,CV-1826A,CV-1826A,,,1-10-23 10:51 AM,2023-01-10T10:51:00.000Z,1-10-23 7:00 AM,2023-01-10T07:00:00.000Z,1-10-23 10:53 AM,2023-01-10T10:53:00.000Z,2,2,,PM,CLOSE,Y,,NO,CHATHAM,"2486, 2507","7.5 HP / 3520 RPM / TEFC / 575V/3PH/60HZ / FRAME#213TC, SEW PARALLEL SHAFT HELICAL GEAR UNIT FHZ127 R77 AM213/215",,No,DRYER A,CH-DRA_CYCLNS,CH-DRA_CYCLNS:SSL18171.CIN,SSL-18171,SSL,CIN,Contact input (discrete),Speed switch (motion proof),Discrete Input,CV1826A CURRENT INDICATION,CV-1826A,2,2023-01-11T04:50:00.000Z,2023-01-11T20:00:00.000Z,477.5,19.895833333333332,No,No,No,Yes,No,No,No,No,4,1
,INSPECT GEARBOX,23-31657,CV-1826A,CV-1826A,,,1-10-23 10:51 AM,2023-01-10T10:51:00.000Z,1-10-23 7:00 AM,2023-01-10T07:00:00.000Z,1-10-23 10:53 AM,2023-01-10T10:53:00.000Z,2,2,,PM,CLOSE,Y,,NO,CHATHAM,"2486, 2507","7.5 HP / 3520 RPM / TEFC / 575V/3PH/60HZ / FRAME#213TC, SEW PARALLEL SHAFT HELICAL GEAR UNIT FHZ127 R77 AM213/215",,No,DRYER A,CH-DRA_CYCLNS,CH-DRA_CYCLNS:SSL18171.CIN,SSL-18171,SSL,CIN,Contact input (discrete),Speed switch (motion proof),Discrete Input,CV1826A CURRENT INDICATION,CV-1826A,2,2023-01-11T04:50:00.000Z,2023-01-11T20:00:00.000Z,477.5,19.895833333333332,No,No,No,Yes,No,No,No,No,4,1
,CHECK CONDITION OF THE PACKING IN THE STUFFING BOX,23-31661,CV-1826A,CV-1826A,,,1-10-23 10:51 AM,2023-01-10T10:51:00.000Z,1-10-23 7:00 AM,2023-01-10T07:00:00.000Z,3-16-23 8:56 AM,2023-03-16T08:56:00.000Z,2,2,,PM,CLOSE,Y,,NO,CHATHAM,"2486, 2507","7.5 HP / 3520 RPM / TEFC / 575V/3PH/60HZ / FRAME#213TC, SEW PARALLEL SHAFT HELICAL GEAR UNIT FHZ127 R77 AM213/215",,No,DRYER A,CH-DRA_CYCLNS,CH-DRA_CYCLNS:SSL18171.CIN,SSL-18171,SSL,CIN,Contact input (discrete),Speed switch (motion proof),Discrete Input,CV1826A CURRENT INDICATION,CV-1826A,2,2023-01-11T04:50:00.000Z,2023-01-11T20:00:00.000Z,477.5,19.895833333333332,No,No,No,Yes,No,No,No,No,4,1
,CHECK PACKING GLAND LUBRICANT.  ADD GREASE  AS NECESSARY,23-31662,CV-1826A,CV-1826A,,,1-10-23 10:51 AM,2023-01-10T10:51:00.000Z,1-10-23 7:00 AM,2023-01-10T07:00:00.000Z,3-16-23 8:56 AM,2023-03-16T08:56:00.000Z,2,2,,PM,CLOSE,Y,,NO,CHATHAM,"2486, 2507","7.5 HP / 3520 RPM / TEFC / 575V/3PH/60HZ / FRAME#213TC, SEW PARALLEL SHAFT HELICAL GEAR UNIT FHZ127 R77 AM213/215",,No,DRYER A,CH-DRA_CYCLNS,CH-DRA_CYCLNS:SSL18171.CIN,SSL-18171,SSL,CIN,Contact input (discrete),Speed switch (motion proof),Discrete Input,CV1826A CURRENT INDICATION,CV-1826A,2,2023-01-11T04:50:00.000Z,2023-01-11T20:00:00.000Z,477.5,19.895833333333332,No,No,No,Yes,No,No,No,No,4,1
,CV-1826A MECHANICAL PM,23-31653,CV-1826A,CV-1826A,,,1-10-23 10:51 AM,2023-01-10T10:51:00.000Z,1-10-23 10:00 AM,2023-01-10T10:00:00.000Z,1-10-23 10:53 AM,2023-01-10T10:53:00.000Z,2,2,,PM,CLOSE,Y,N,NO,CHATHAM,"2486, 2507","7.5 HP / 3520 RPM / TEFC / 575V/3PH/60HZ / FRAME#213TC, SEW PARALLEL SHAFT HELICAL GEAR UNIT FHZ127 R77 AM213/215",,No,DRYER A,CH-DRA_CYCLNS,CH-DRA_CYCLNS:SSL18171.CIN,SSL-18171,SSL,CIN,Contact input (discrete),Speed switch (motion proof),Discrete Input,CV1826A CURRENT INDICATION,CV-1826A,2,2023-01-11T04:50:00.000Z,2023-01-11T20:00:00.000Z,477.5,19.895833333333332,No,No,No,Yes,No,No,No,No,4,1
,INSPECT PILLOW BLOCK BEARINGS,23-31656,CV-1826A,CV-1826A,,,1-10-23 10:51 AM,2023-01-10T10:51:00.000Z,1-10-23 7:00 AM,2023-01-10T07:00:00.000Z,1-10-23 10:53 AM,2023-01-10T10:53:00.000Z,2,2,,PM,CLOSE,Y,,NO,CHATHAM,"2486, 2507","7.5 HP / 3520 RPM / TEFC / 575V/3PH/60HZ / FRAME#213TC, SEW PARALLEL SHAFT HELICAL GEAR UNIT FHZ127 R77 AM213/215",,No,DRYER A,CH-DRA_CYCLNS,CH-DRA_CYCLNS:SSL18171.CIN,SSL-18171,SSL,CIN,Contact input (discrete),Speed switch (motion proof),Discrete Input,CV1826A CURRENT INDICATION,CV-1826A,2,2023-01-11T04:50:00.000Z,2023-01-11T20:00:00.000Z,477.5,19.895833333333332,No,No,No,Yes,No,No,No,No,4,1
,CV-1826A MECHANICAL PM,23-31660,CV-1826A,CV-1826A,,,1-10-23 10:51 AM,2023-01-10T10:51:00.000Z,2-23-23 10:00 AM,2023-02-23T10:00:00.000Z,3-16-23 8:56 AM,2023-03-16T08:56:00.000Z,4,4,,PM,CLOSE,Y,N,NO,CHATHAM,"2486, 2507","7.5 HP / 3520 RPM / TEFC / 575V/3PH/60HZ / FRAME#213TC, SEW PARALLEL SHAFT HELICAL GEAR UNIT FHZ127 R77 AM213/215",,No,DRYER A,CH-DRA_CYCLNS,CH-DRA_CYCLNS:SSL18171.CIN,SSL-18171,SSL,CIN,Contact input (discrete),Speed switch (motion proof),Discrete Input,CV1826A CURRENT INDICATION,CV-1826A,2,2023-01-11T04:50:00.000Z,2023-01-11T20:00:00.000Z,477.5,19.895833333333332,No,No,No,Yes,No,No,No,No,4,1
,INSPECT PILLOW BLOCK BEARINGS,23-31663,CV-1826A,CV-1826A,,,1-10-23 10:51 AM,2023-01-10T10:51:00.000Z,1-10-23 7:00 AM,2023-01-10T07:00:00.000Z,3-16-23 8:56 AM,2023-03-16T08:56:00.000Z,2,2,,PM,CLOSE,Y,,NO,CHATHAM,"2486, 2507","7.5 HP / 3520 RPM / TEFC / 575V/3PH/60HZ / FRAME#213TC, SEW PARALLEL SHAFT HELICAL GEAR UNIT FHZ127 R77 AM213/215",,No,DRYER A,CH-DRA_CYCLNS,CH-DRA_CYCLNS:SSL18171.CIN,SSL-18171,SSL,CIN,Contact input (discrete),Speed switch (motion proof),Discrete Input,CV1826A CURRENT INDICATION,CV-1826A,2,2023-01-11T04:50:00.000Z,2023-01-11T20:00:00.000Z,477.5,19.895833333333332,No,No,No,Yes,No,No,No,No,4,1
,INSPECT CONVEYOR TROUGH,23-31666,CV-1826A,CV-1826A,,,1-10-23 10:51 AM,2023-01-10T10:51:00.000Z,1-10-23 7:00 AM,2023-01-10T07:00:00.000Z,3-16-23 8:56 AM,2023-03-16T08:56:00.000Z,2,2,,PM,CLOSE,Y,,NO,CHATHAM,"2486, 2507","7.5 HP / 3520 RPM / TEFC / 575V/3PH/60HZ / FRAME#213TC, SEW PARALLEL SHAFT HELICAL GEAR UNIT FHZ127 R77 AM213/215",,No,DRYER A,CH-DRA_CYCLNS,CH-DRA_CYCLNS:SSL18171.CIN,SSL-18171,SSL,CIN,Contact input (discrete),Speed switch (motion proof),Discrete Input,CV1826A CURRENT INDICATION,CV-1826A,2,2023-01-11T04:50:00.000Z,2023-01-11T20:00:00.000Z,477.5,19.895833333333332,No,No,No,Yes,No,No,No,No,4,1
7742,Heat trace on pH probe line is off,23-31667,AT-13522,AT-13522,,,1-10-23 11:00 AM,2023-01-10T11:00:00.000Z,1-11-23 2:31 PM,2023-01-11T14:31:00.000Z,1-10-23 11:01 AM,2023-01-10T11:01:00.000Z,4,4,,CO,CLOSE,Y,,NO,CHATHAM,,,,,,,,,,,,,,,,2,2023-01-11T04:50:00.000Z,2023-01-11T20:00:00.000Z,477.5,19.895833333333332,No,No,No,Yes,No,No,No,No,4,1
2522,MODIFY GRATING AS NEEDED,23-31668,CV-1827,CV-1827,,,1-10-23 11:01 AM,2023-01-10T11:01:00.000Z,2-23-23 2:11 AM,2023-02-23T02:11:00.000Z,,,4,4,,CO,CAN,Y,,NO,CHATHAM,"2488, 2509","5 HP / 1800 RPM / TEFC / 575V/3PH/60HZ / FRAME#184T, DORRIS 115TR25 SHAFT MOUNTED SPEED REDUCER",,No,DRYER A,CH-DRA_CYCLNS,CH-DRA_CYCLNS:SSL18172.CIN,SSL-18172,SSL,CIN,Contact input (discrete),Speed switch (motion proof),Discrete Input,CV1827 CURRENT INDICATION,CV-1827,2,2023-01-11T04:50:00.000Z,2023-01-11T20:00:00.000Z,477.5,19.895833333333332,No,No,No,Yes,No,No,No,No,4,1
1103,Inspect and clean suction piping for HC reflux pumps (P6562A&B),23-31669,P-6562B,P-6562B,,,1-10-23 11:02 AM,2023-01-10T11:02:00.000Z,4-21-23 10:39 AM,2023-04-21T10:39:00.000Z,4-28-23 6:23 AM,2023-04-28T06:23:00.000Z,4,4,,SD,CLOSE,Y,,NO,CHATHAM,,,,,,,,,,,,,,,,2,2023-01-11T04:50:00.000Z,2023-01-11T20:00:00.000Z,477.5,19.895833333333332,No,No,No,Yes,No,No,No,No,4,1
1643,"SD23 - remove, inspect, reinstall HC eductor EJ6562",23-31671,EJ-6562,EJ-6562,,,1-10-23 11:04 AM,2023-01-10T11:04:00.000Z,4-21-23 10:38 AM,2023-04-21T10:38:00.000Z,4-28-23 6:23 AM,2023-04-28T06:23:00.000Z,4,4,,SD,CLOSE,Y,,NO,CHATHAM,,,,,,,,,,,,,,,,2,2023-01-11T04:50:00.000Z,2023-01-11T20:00:00.000Z,477.5,19.895833333333332,No,No,No,Yes,No,No,No,No,4,1
,Inspect and repair as needed Cooling tower Basin,23-31673,CT-3201,CT-3201,,,1-10-23 11:05 AM,2023-01-10T11:05:00.000Z,4-14-23 11:07 AM,2023-04-14T11:07:00.000Z,5-2-23 9:18 AM,2023-05-02T09:18:00.000Z,4,4,,CO,CLOSE,Y,,NO,CHATHAM,,,,,,,,,,,,,,,,2,2023-01-11T04:50:00.000Z,2023-01-11T20:00:00.000Z,477.5,19.895833333333332,No,No,No,Yes,No,No,No,No,4,1
2522,CLEAN HATCH,23-31672,CV-1827,CV-1827,,,1-10-23 11:05 AM,2023-01-10T11:05:00.000Z,2-23-23 2:11 AM,2023-02-23T02:11:00.000Z,,,4,4,,CO,CAN,Y,,NO,CHATHAM,"2488, 2509","5 HP / 1800 RPM / TEFC / 575V/3PH/60HZ / FRAME#184T, DORRIS 115TR25 SHAFT MOUNTED SPEED REDUCER",,No,DRYER A,CH-DRA_CYCLNS,CH-DRA_CYCLNS:SSL18172.CIN,SSL-18172,SSL,CIN,Contact input (discrete),Speed switch (motion proof),Discrete Input,CV1827 CURRENT INDICATION,CV-1827,2,2023-01-11T04:50:00.000Z,2023-01-11T20:00:00.000Z,477.5,19.895833333333332,No,No,No,Yes,No,No,No,No,4,1
1575,SD23 - Replace HC reflux cooler plate pack (E6563),23-31674,E-6563,E-6563,,,1-10-23 11:06 AM,2023-01-10T11:06:00.000Z,4-21-23 9:06 AM,2023-04-21T09:06:00.000Z,4-28-23 6:25 AM,2023-04-28T06:25:00.000Z,4,4,,SD,CLOSE,Y,,NO,CHATHAM,,,,,,,,,,,,,,,,2,2023-01-11T04:50:00.000Z,2023-01-11T20:00:00.000Z,477.5,19.895833333333332,No,No,No,Yes,No,No,No,No,4,1
,Open man ways on TGF condenser,23-31675,,,,,1-10-23 11:07 AM,2023-01-10T11:07:00.000Z,1-11-23 4:30 PM,2023-01-11T16:30:00.000Z,1-11-23 2:09 PM,2023-01-11T14:09:00.000Z,4,4,,CO,CLOSE,Y,,NO,CHATHAM,,,,,,,,,,,,,,,,2,2023-01-11T04:50:00.000Z,2023-01-11T20:00:00.000Z,477.5,19.895833333333332,Yes,No,No,Yes,No,No,No,No,4,1
1575,Remove spade from E6563 (HC reflux cooler) bypass,23-31676,E-6563,E-6563,,,1-10-23 11:08 AM,2023-01-10T11:08:00.000Z,4-21-23 9:02 AM,2023-04-21T09:02:00.000Z,4-28-23 6:25 AM,2023-04-28T06:25:00.000Z,4,4,,SD,CLOSE,Y,,NO,CHATHAM,,,,,,,,,,,,,,,,2,2023-01-11T04:50:00.000Z,2023-01-11T20:00:00.000Z,477.5,19.895833333333332,No,No,No,Yes,No,No,No,No,4,1
,"2023 TA Remove, inspect, and clean CG1 oil cooler",23-31684,ME-3601A,ME-3601A,,,1-10-23 11:08 AM,2023-01-10T11:08:00.000Z,5-26-23 9:46 AM,2023-05-26T09:46:00.000Z,5-2-23 9:00 AM,2023-05-02T09:00:00.000Z,4,4,,SD,CLOSE,Y,,NO,CHATHAM,,,,,,,,,,,,,,,,2,2023-01-11T04:50:00.000Z,2023-01-11T20:00:00.000Z,477.5,19.895833333333332,No,No,No,Yes,No,No,No,No,4,1
,CV-1828 MECHANICAL PM,23-31686,CV-1828,CV-1828,,,1-10-23 11:13 AM,2023-01-10T11:13:00.000Z,2-23-23 10:00 AM,2023-02-23T10:00:00.000Z,3-16-23 8:57 AM,2023-03-16T08:57:00.000Z,4,4,,PM,CLOSE,Y,N,NO,CHATHAM,"2489, 2514","40 HP / 1800 RPM / TEFC / 575V/3PH/60HZ / FRAME#324T, DORRIS 307TR25F2 SHAFT MOUNTED SPEED REDUCER",,Yes,DRYER A,CH-DRA_CYCLNS,CH-DRA_CYCLNS:TT18169C.MEAS,TT-18169C,TT,MEAS,Measured value (PV),Temperature transmitter,Measurement,CV1828 CURRENT INDICATION,CV-1828,2,2023-01-11T04:50:00.000Z,2023-01-11T20:00:00.000Z,477.5,19.895833333333332,No,No,No,Yes,No,No,No,No,4,1
,INSPECT TROUGH GASKETS FOR LEAKAGE,23-31688,CV-1828,CV-1828,,,1-10-23 11:13 AM,2023-01-10T11:13:00.000Z,1-10-23 7:00 AM,2023-01-10T07:00:00.000Z,3-16-23 8:57 AM,2023-03-16T08:57:00.000Z,4,4,,PM,CLOSE,Y,,NO,CHATHAM,"2489, 2514","40 HP / 1800 RPM / TEFC / 575V/3PH/60HZ / FRAME#324T, DORRIS 307TR25F2 SHAFT MOUNTED SPEED REDUCER",,Yes,DRYER A,CH-DRA_CYCLNS,CH-DRA_CYCLNS:TT18169C.MEAS,TT-18169C,TT,MEAS,Measured value (PV),Temperature transmitter,Measurement,CV1828 CURRENT INDICATION,CV-1828,2,2023-01-11T04:50:00.000Z,2023-01-11T20:00:00.000Z,477.5,19.895833333333332,No,No,No,Yes,No,No,No,No,4,1
,INSPECT PILLOW BLOCK BEARINGS,23-31689,CV-1828,CV-1828,,,1-10-23 11:13 AM,2023-01-10T11:13:00.000Z,1-10-23 7:00 AM,2023-01-10T07:00:00.000Z,3-16-23 8:57 AM,2023-03-16T08:57:00.000Z,4,4,,PM,CLOSE,Y,,NO,CHATHAM,"2489, 2514","40 HP / 1800 RPM / TEFC / 575V/3PH/60HZ / FRAME#324T, DORRIS 307TR25F2 SHAFT MOUNTED SPEED REDUCER",,Yes,DRYER A,CH-DRA_CYCLNS,CH-DRA_CYCLNS:TT18169C.MEAS,TT-18169C,TT,MEAS,Measured value (PV),Temperature transmitter,Measurement,CV1828 CURRENT INDICATION,CV-1828,2,2023-01-11T04:50:00.000Z,2023-01-11T20:00:00.000Z,477.5,19.895833333333332,No,No,No,Yes,No,No,No,No,4,1
,INSPECT CONVEYOR TROUGH,23-31692,CV-1828,CV-1828,,,1-10-23 11:13 AM,2023-01-10T11:13:00.000Z,1-10-23 7:00 AM,2023-01-10T07:00:00.000Z,3-16-23 8:57 AM,2023-03-16T08:57:00.000Z,4,4,,PM,CLOSE,Y,,NO,CHATHAM,"2489, 2514","40 HP / 1800 RPM / TEFC / 575V/3PH/60HZ / FRAME#324T, DORRIS 307TR25F2 SHAFT MOUNTED SPEED REDUCER",,Yes,DRYER A,CH-DRA_CYCLNS,CH-DRA_CYCLNS:TT18169C.MEAS,TT-18169C,TT,MEAS,Measured value (PV),Temperature transmitter,Measurement,CV1828 CURRENT INDICATION,CV-1828,2,2023-01-11T04:50:00.000Z,2023-01-11T20:00:00.000Z,477.5,19.895833333333332,No,No,No,Yes,No,No,No,No,4,1
,CHECK COUPLING BOLTS,23-31687,CV-1828,CV-1828,,,1-10-23 11:13 AM,2023-01-10T11:13:00.000Z,1-10-23 7:00 AM,2023-01-10T07:00:00.000Z,3-16-23 8:57 AM,2023-03-16T08:57:00.000Z,4,4,,PM,CLOSE,Y,,NO,CHATHAM,"2489, 2514","40 HP / 1800 RPM / TEFC / 575V/3PH/60HZ / FRAME#324T, DORRIS 307TR25F2 SHAFT MOUNTED SPEED REDUCER",,Yes,DRYER A,CH-DRA_CYCLNS,CH-DRA_CYCLNS:TT18169C.MEAS,TT-18169C,TT,MEAS,Measured value (PV),Temperature transmitter,Measurement,CV1828 CURRENT INDICATION,CV-1828,2,2023-01-11T04:50:00.000Z,2023-01-11T20:00:00.000Z,477.5,19.895833333333332,No,No,No,Yes,No,No,No,No,4,1
,INSPECT GEARBOX,23-31690,CV-1828,CV-1828,,,1-10-23 11:13 AM,2023-01-10T11:13:00.000Z,1-10-23 7:00 AM,2023-01-10T07:00:00.000Z,3-16-23 8:57 AM,2023-03-16T08:57:00.000Z,4,4,,PM,CLOSE,Y,,NO,CHATHAM,"2489, 2514","40 HP / 1800 RPM / TEFC / 575V/3PH/60HZ / FRAME#324T, DORRIS 307TR25F2 SHAFT MOUNTED SPEED REDUCER",,Yes,DRYER A,CH-DRA_CYCLNS,CH-DRA_CYCLNS:TT18169C.MEAS,TT-18169C,TT,MEAS,Measured value (PV),Temperature transmitter,Measurement,CV1828 CURRENT INDICATION,CV-1828,2,2023-01-11T04:50:00.000Z,2023-01-11T20:00:00.000Z,477.5,19.895833333333332,No,No,No,Yes,No,No,No,No,4,1
,INSPECT SCREW CONVEYOR,23-31691,CV-1828,CV-1828,,,1-10-23 11:13 AM,2023-01-10T11:13:00.000Z,1-10-23 7:00 AM,2023-01-10T07:00:00.000Z,3-16-23 8:57 AM,2023-03-16T08:57:00.000Z,4,4,,PM,CLOSE,Y,,NO,CHATHAM,"2489, 2514","40 HP / 1800 RPM / TEFC / 575V/3PH/60HZ / FRAME#324T, DORRIS 307TR25F2 SHAFT MOUNTED SPEED REDUCER",,Yes,DRYER A,CH-DRA_CYCLNS,CH-DRA_CYCLNS:TT18169C.MEAS,TT-18169C,TT,MEAS,Measured value (PV),Temperature transmitter,Measurement,CV1828 CURRENT INDICATION,CV-1828,2,2023-01-11T04:50:00.000Z,2023-01-11T20:00:00.000Z,477.5,19.895833333333332,No,No,No,Yes,No,No,No,No,4,1
,CV-1830 Open end for water to drain,23-31714,CV-1830,CV-1830,,,1-10-23 11:20 AM,2023-01-10T11:20:00.000Z,,,1-10-23 11:22 AM,2023-01-10T11:22:00.000Z,4,4,,CO,CLOSE,Y,,NO,CHATHAM,"2490, 2515","20 HP / 1760 RPM / TEFC / 575V/3PH/60HZ / FRAME#256T, DORRIS 315TR25 SHAFT MOUNTED SPEED REDUCER",,No,DRYER A,CH-DRYER_A,CH-DRYER_A:CV1830.STAIND,CV-1830,CV,STAIND,"Status indication (open/closed, run/stop)",Conveyor (asset),Equipment status,RECYCLE DRAG CONVEYOR,,2,2023-01-11T04:50:00.000Z,2023-01-11T20:00:00.000Z,477.5,19.895833333333332,No,No,No,Yes,No,No,No,No,4,1
,OPEN FOR WATER TO DRAIN,23-31715,CV-1830,CV-1830,,,1-10-23 11:20 AM,2023-01-10T11:20:00.000Z,,,1-10-23 11:22 AM,2023-01-10T11:22:00.000Z,4,4,,CO,CLOSE,Y,,NO,CHATHAM,"2490, 2515","20 HP / 1760 RPM / TEFC / 575V/3PH/60HZ / FRAME#256T, DORRIS 315TR25 SHAFT MOUNTED SPEED REDUCER",,No,DRYER A,CH-DRYER_A,CH-DRYER_A:CV1830.STAIND,CV-1830,CV,STAIND,"Status indication (open/closed, run/stop)",Conveyor (asset),Equipment status,RECYCLE DRAG CONVEYOR,,2,2023-01-11T04:50:00.000Z,2023-01-11T20:00:00.000Z,477.5,19.895833333333332,No,No,No,Yes,No,No,No,No,4,1
,Remove Blank and Re-install spool on Exhaust Ducting,23-31731,DR-1826,DR-1826,,,1-10-23 11:27 AM,2023-01-10T11:27:00.000Z,,,1-11-23 3:27 PM,2023-01-11T15:27:00.000Z,4,4,,CO,CLOSE,Y,,NO,CHATHAM,"2541, 2542, 2543, 2544, 2545, 2547, 2549, 2550, 2552, 2553, 2554, 2555, 2556, 2557, 2558, 2559","SWISS COMBI ROTARY DRYER DRUM, SEW GEARBOX - LEFT HAND DRIVE -, SEW GEARBOX - LEFT HAND DRIVE, SEW GEARBOX - RIGHT HAND DRIVE, SEW GEARBOX - RIGHT HAND DRIVE, MOTOR / 25HP / 1800RPM / TEFC / 575V/3PH/60HZ / FRAME# 284TC, MOTOR / 25HP / 1800RPM / TEFC / 575V/3PH/60HZ / FRAME# 284TC, MOTOR / 25HP / 1800RPM / TEFC / 575V/3PH/60HZ / FRAME# 284TC, MOTOR / 25HP / 1800RPM / TEFC / 575V/3PH/60HZ / FRAME# 284TC, TRUNNION (A) - LEFT HAND DRIVE, TRUNNION (B)- RIGHT HAND DRIVE, TRUNNION (D) - LEFT HAND DRIVE, TRUNNION (C) - RIGHT HAND DRIVE, THRUST ROLLER ASSEMBLY, THRUST ROLLER ASSEMBLY, TRUNNION LUBRICATION SYSTEM",,No,DRYER A,CH-DRA_CYCLNS,CH-DRA_CYCLNS:TT18168B.MEAS,TT-18168B,TT,MEAS,Measured value (PV),Temperature transmitter,Measurement,DRUM DR1826 MOTOR A AMPERAGE,DR-1826,2,2023-01-11T04:50:00.000Z,2023-01-11T20:00:00.000Z,477.5,19.895833333333332,Yes,No,No,Yes,No,No,No,No,4,1
1477,Install spades on E-11402 for commissioning pressure test,23-31746,E-11402,E-11402,,,1-10-23 11:47 AM,2023-01-10T11:47:00.000Z,1-20-23 11:15 AM,2023-01-20T11:15:00.000Z,1-17-23 3:15 PM,2023-01-17T15:15:00.000Z,4,4,,CO,CLOSE,Y,,NO,CHATHAM,,,,,,,,,,,,,,,,2,2023-01-11T04:50:00.000Z,2023-01-11T20:00:00.000Z,477.5,19.895833333333332,No,No,No,Yes,No,No,No,No,4,1
4669,Investigate heat trace at PT57418 on RC3,23-31747,PT-57418,PT-57418,,,1-10-23 11:59 AM,2023-01-10T11:59:00.000Z,4-23-23 10:28 AM,2023-04-23T10:28:00.000Z,6-14-23 1:12 PM,2023-06-14T13:12:00.000Z,4,4,,CO,CLOSE,Y,,NO,CHATHAM,,,,,,,,,,,,,,,,2,2023-01-11T04:50:00.000Z,2023-01-11T20:00:00.000Z,477.5,19.895833333333332,No,No,No,Yes,No,No,No,No,4,1
,INSPECT BL-1825,23-31751,BL-1825,BL-1825,,,1-10-23 1:17 PM,2023-01-10T13:17:00.000Z,3-26-23 1:17 PM,2023-03-26T13:17:00.000Z,,,4,4,,PM,CAN,Y,,NO,CHATHAM,"10032, 10033","BLOWER, HOWDEN, FAN MODEL E20S-7125, 300HP / 1200RPM / TEFC / 575V/3PH/60HZ / 5009B FRAME",,No,DRYER A,CH-DRA_COMB_AIR,CH-DRA_COMB_AIR:SY18114.OUT,SY-18114,SY,OUT,Controller output / demand (CO),Speed output (VFD demand),Output/Demand,BL1825 CURRENT INDICATION,BL-1825,2,2023-01-11T04:50:00.000Z,2023-01-11T20:00:00.000Z,477.5,19.895833333333332,No,No,No,Yes,No,No,No,No,4,1
,REMOVE INSULATION,23-31752,BL-1825,BL-1825,,,1-10-23 1:18 PM,2023-01-10T13:18:00.000Z,2-23-23 1:17 PM,2023-02-23T13:17:00.000Z,,,4,4,,SD,CAN,Y,,NO,CHATHAM,"10032, 10033","BLOWER, HOWDEN, FAN MODEL E20S-7125, 300HP / 1200RPM / TEFC / 575V/3PH/60HZ / 5009B FRAME",,No,DRYER A,CH-DRA_COMB_AIR,CH-DRA_COMB_AIR:SY18114.OUT,SY-18114,SY,OUT,Controller output / demand (CO),Speed output (VFD demand),Output/Demand,BL1825 CURRENT INDICATION,BL-1825,2,2023-01-11T04:50:00.000Z,2023-01-11T20:00:00.000Z,477.5,19.895833333333332,No,No,No,Yes,No,No,No,No,4,1
,OPEN MANWAY,23-31753,BL-1825,BL-1825,,,1-10-23 1:18 PM,2023-01-10T13:18:00.000Z,2-23-23 1:17 PM,2023-02-23T13:17:00.000Z,,,4,4,,SD,CAN,Y,,NO,CHATHAM,"10032, 10033","BLOWER, HOWDEN, FAN MODEL E20S-7125, 300HP / 1200RPM / TEFC / 575V/3PH/60HZ / 5009B FRAME",,No,DRYER A,CH-DRA_COMB_AIR,CH-DRA_COMB_AIR:SY18114.OUT,SY-18114,SY,OUT,Controller output / demand (CO),Speed output (VFD demand),Output/Demand,BL1825 CURRENT INDICATION,BL-1825,2,2023-01-11T04:50:00.000Z,2023-01-11T20:00:00.000Z,477.5,19.895833333333332,No,No,No,Yes,No,No,No,No,4,1
,INSPECT BLOWER 1825,23-31754,BL-1825,BL-1825,,,1-10-23 1:18 PM,2023-01-10T13:18:00.000Z,2-23-23 1:17 PM,2023-02-23T13:17:00.000Z,,,4,4,,SD,CAN,Y,,NO,CHATHAM,"10032, 10033","BLOWER, HOWDEN, FAN MODEL E20S-7125, 300HP / 1200RPM / TEFC / 575V/3PH/60HZ / 5009B FRAME",,No,DRYER A,CH-DRA_COMB_AIR,CH-DRA_COMB_AIR:SY18114.OUT,SY-18114,SY,OUT,Controller output / demand (CO),Speed output (VFD demand),Output/Demand,BL1825 CURRENT INDICATION,BL-1825,2,2023-01-11T04:50:00.000Z,2023-01-11T20:00:00.000Z,477.5,19.895833333333332,No,No,No,Yes,No,No,No,No,4,1
,RE-INSTALL INSULATION,23-31756,BL-1825,BL-1825,,,1-10-23 1:19 PM,2023-01-10T13:19:00.000Z,2-23-23 1:17 PM,2023-02-23T13:17:00.000Z,,,4,4,,SD,CAN,Y,,NO,CHATHAM,"10032, 10033","BLOWER, HOWDEN, FAN MODEL E20S-7125, 300HP / 1200RPM / TEFC / 575V/3PH/60HZ / 5009B FRAME",,No,DRYER A,CH-DRA_COMB_AIR,CH-DRA_COMB_AIR:SY18114.OUT,SY-18114,SY,OUT,Controller output / demand (CO),Speed output (VFD demand),Output/Demand,BL1825 CURRENT INDICATION,BL-1825,2,2023-01-11T04:50:00.000Z,2023-01-11T20:00:00.000Z,477.5,19.895833333333332,No,No,No,Yes,No,No,No,No,4,1
,CLOSE MANWAY,23-31755,BL-1825,BL-1825,,,1-10-23 1:19 PM,2023-01-10T13:19:00.000Z,2-23-23 1:17 PM,2023-02-23T13:17:00.000Z,,,4,4,,SD,CAN,Y,,NO,CHATHAM,"10032, 10033","BLOWER, HOWDEN, FAN MODEL E20S-7125, 300HP / 1200RPM / TEFC / 575V/3PH/60HZ / 5009B FRAME",,No,DRYER A,CH-DRA_COMB_AIR,CH-DRA_COMB_AIR:SY18114.OUT,SY-18114,SY,OUT,Controller output / demand (CO),Speed output (VFD demand),Output/Demand,BL1825 CURRENT INDICATION,BL-1825,2,2023-01-11T04:50:00.000Z,2023-01-11T20:00:00.000Z,477.5,19.895833333333332,No,No,No,Yes,No,No,No,No,4,1
,INSPECT DRYER A BLOWER 1829,23-31769,BL-1829,BL-1829,,,1-10-23 1:41 PM,2023-01-10T13:41:00.000Z,3-27-23 1:41 PM,2023-03-27T13:41:00.000Z,3-17-23 1:11 PM,2023-03-17T13:11:00.000Z,4,4,,PM,CLOSE,Y,N,NO,CHATHAM,"10034, 2868","BLOWER, HOWDEN, FAN MODEL E40S-8700 SWSI CCW TAU Arrg't7, 600HP / 1200RPM / TEFC / 575V/3PH/60HZ / 5810B FRAME",,Yes,DRYER A,CH-DRYER_A,CH-DRYER_A:SY18153B.OUT,SY-18153B,SY,OUT,Controller output / demand (CO),Speed output (VFD demand),Output/Demand,BL1829 CURRENT INDICATION,BL-1829,2,2023-01-11T04:50:00.000Z,2023-01-11T20:00:00.000Z,477.5,19.895833333333332,No,No,No,Yes,No,No,No,No,4,1
,INSPECT BLOWER,23-31772,,,,,1-10-23 1:41 PM,2023-01-10T13:41:00.000Z,,,3-17-23 1:11 PM,2023-03-17T13:11:00.000Z,4,4,,,CLOSE,Y,,NO,CHATHAM,,,,,,,,,,,,,,,,2,2023-01-11T04:50:00.000Z,2023-01-11T20:00:00.000Z,477.5,19.895833333333332,No,No,No,Yes,No,No,No,No,4,1
,REMOVE INSULATION,23-31770,,,,,1-10-23 1:41 PM,2023-01-10T13:41:00.000Z,,,3-17-23 1:11 PM,2023-03-17T13:11:00.000Z,4,4,,,CLOSE,Y,,NO,CHATHAM,,,,,,,,,,,,,,,,2,2023-01-11T04:50:00.000Z,2023-01-11T20:00:00.000Z,477.5,19.895833333333332,No,No,No,Yes,No,No,No,No,4,1
,CLOSE MANWAY,23-31773,,,,,1-10-23 1:41 PM,2023-01-10T13:41:00.000Z,,,3-17-23 1:11 PM,2023-03-17T13:11:00.000Z,4,4,,,CLOSE,Y,,NO,CHATHAM,,,,,,,,,,,,,,,,2,2023-01-11T04:50:00.000Z,2023-01-11T20:00:00.000Z,477.5,19.895833333333332,No,No,No,Yes,No,No,No,No,4,1
,OPEN MANYWAY,23-31771,,,,,1-10-23 1:41 PM,2023-01-10T13:41:00.000Z,,,3-17-23 1:11 PM,2023-03-17T13:11:00.000Z,4,4,,,CLOSE,Y,,NO,CHATHAM,,,,,,,,,,,,,,,,2,2023-01-11T04:50:00.000Z,2023-01-11T20:00:00.000Z,477.5,19.895833333333332,No,No,No,Yes,No,No,No,No,4,1
,RE-INSTALL INSULATION,23-31774,,,,,1-10-23 1:41 PM,2023-01-10T13:41:00.000Z,,,3-17-23 1:11 PM,2023-03-17T13:11:00.000Z,4,4,,,CLOSE,Y,,NO,CHATHAM,,,,,,,,,,,,,,,,2,2023-01-11T04:50:00.000Z,2023-01-11T20:00:00.000Z,477.5,19.895833333333332,No,No,No,Yes,No,No,No,No,4,1
,REMOVE INSULATION,23-31782,,,,,1-10-23 1:44 PM,2023-01-10T13:44:00.000Z,,,3-16-23 6:51 AM,2023-03-16T06:51:00.000Z,4,4,,,CLOSE,Y,,NO,CHATHAM,,,,,,,,,,,,,,,,2,2023-01-11T04:50:00.000Z,2023-01-11T20:00:00.000Z,477.5,19.895833333333332,No,No,No,Yes,No,No,No,No,4,1
,OPEN MANYWAY,23-31783,,,,,1-10-23 1:44 PM,2023-01-10T13:44:00.000Z,,,3-16-23 6:51 AM,2023-03-16T06:51:00.000Z,4,4,,,CLOSE,Y,,NO,CHATHAM,,,,,,,,,,,,,,,,2,2023-01-11T04:50:00.000Z,2023-01-11T20:00:00.000Z,477.5,19.895833333333332,No,No,No,Yes,No,No,No,No,4,1
,INSPECT DRYER A BLOWER 1832,23-31781,BL-1832,BL-1832,,,1-10-23 1:44 PM,2023-01-10T13:44:00.000Z,,,3-16-23 6:51 AM,2023-03-16T06:51:00.000Z,4,4,,PM,CLOSE,Y,N,NO,CHATHAM,"10036, 10037","BLOWER, HOWDEN, FAN MODEL EPB4S-5750, 200HP / 1800RPM / TEFC / 575V/3PH/60HZ / 447T FRAME",,No,DRYER A,CH-DRA_COMB_AIR,CH-DRA_COMB_AIR:BL1832.STAIND,BL-1832,BL,STAIND,"Status indication (open/closed, run/stop)",Blower (asset),Equipment status,COMBUSTION AIR FAN,,2,2023-01-11T04:50:00.000Z,2023-01-11T20:00:00.000Z,477.5,19.895833333333332,No,No,No,Yes,No,No,No,No,4,1
,CLOSE MANWAY,23-31785,,,,,1-10-23 1:44 PM,2023-01-10T13:44:00.000Z,,,3-16-23 6:51 AM,2023-03-16T06:51:00.000Z,4,4,,,CLOSE,Y,,NO,CHATHAM,,,,,,,,,,,,,,,,2,2023-01-11T04:50:00.000Z,2023-01-11T20:00:00.000Z,477.5,19.895833333333332,No,No,No,Yes,No,No,No,No,4,1
,INSPECT BLOWER,23-31784,,,,,1-10-23 1:44 PM,2023-01-10T13:44:00.000Z,,,3-16-23 6:51 AM,2023-03-16T06:51:00.000Z,4,4,,,CLOSE,Y,,NO,CHATHAM,,,,,,,,,,,,,,,,2,2023-01-11T04:50:00.000Z,2023-01-11T20:00:00.000Z,477.5,19.895833333333332,No,No,No,Yes,No,No,No,No,4,1
,RE-INSTALL INSULATION,23-31786,,,,,1-10-23 1:44 PM,2023-01-10T13:44:00.000Z,,,3-16-23 6:51 AM,2023-03-16T06:51:00.000Z,4,4,,,CLOSE,Y,,NO,CHATHAM,,,,,,,,,,,,,,,,2,2023-01-11T04:50:00.000Z,2023-01-11T20:00:00.000Z,477.5,19.895833333333332,No,No,No,Yes,No,No,No,No,4,1
,INSPECT CV-1715,23-31788,CV-1715,CV-1715,,,1-10-23 2:03 PM,2023-01-10T14:03:00.000Z,2-23-23 2:03 PM,2023-02-23T14:03:00.000Z,2-13-23 9:53 AM,2023-02-13T09:53:00.000Z,4,4,,SD,CLOSE,Y,,NO,CHATHAM,,,,,,,,,,,,,,,,2,2023-01-11T04:50:00.000Z,2023-01-11T20:00:00.000Z,477.5,19.895833333333332,No,No,No,Yes,No,No,No,No,4,1
,CV-1715 PM and Inspection,23-31787,CV-1715,CV-1715,,,1-10-23 2:03 PM,2023-01-10T14:03:00.000Z,4-23-23 2:03 PM,2023-04-23T14:03:00.000Z,2-13-23 9:53 AM,2023-02-13T09:53:00.000Z,4,4,,SD,CLOSE,Y,,NO,CHATHAM,,,,,,,,,,,,,,,,2,2023-01-11T04:50:00.000Z,2023-01-11T20:00:00.000Z,477.5,19.895833333333332,No,No,No,Yes,No,No,No,No,4,1
,CV-1716 PM and Inspection,23-31791,CV-1716,CV-1716,,,1-10-23 2:07 PM,2023-01-10T14:07:00.000Z,2-23-23 2:08 PM,2023-02-23T14:08:00.000Z,5-19-23 2:03 PM,2023-05-19T14:03:00.000Z,4,4,,PM,CLOSE,Y,,NO,CHATHAM,,,,,,,,,,,,,,,,2,2023-01-11T04:50:00.000Z,2023-01-11T20:00:00.000Z,477.5,19.895833333333332,No,No,No,Yes,No,No,No,No,4,1
,INSPECT CV-1716,23-31792,CV-1716,CV-1716,,,1-10-23 2:08 PM,2023-01-10T14:08:00.000Z,,,5-19-23 2:03 PM,2023-05-19T14:03:00.000Z,4,4,,SD,CLOSE,Y,,NO,CHATHAM,,,,,,,,,,,,,,,,2,2023-01-11T04:50:00.000Z,2023-01-11T20:00:00.000Z,477.5,19.895833333333332,No,No,No,Yes,No,No,No,No,4,1
,INSPECT CV-1719,23-31794,CV-1719,CV-1719,,,1-10-23 2:10 PM,2023-01-10T14:10:00.000Z,2-23-23 2:10 PM,2023-02-23T14:10:00.000Z,2-13-23 9:54 AM,2023-02-13T09:54:00.000Z,4,4,,SD,CLOSE,Y,,NO,CHATHAM,,,,,,,,,,,,,,,,2,2023-01-11T04:50:00.000Z,2023-01-11T20:00:00.000Z,477.5,19.895833333333332,No,No,No,Yes,No,No,No,No,4,1
,CV-1719 PM and Inspection,23-31793,CV-1719,CV-1719,,,1-10-23 2:10 PM,2023-01-10T14:10:00.000Z,2-23-23 2:10 PM,2023-02-23T14:10:00.000Z,2-13-23 9:54 AM,2023-02-13T09:54:00.000Z,4,4,,PM,CLOSE,Y,,NO,CHATHAM,,,,,,,,,,,,,,,,2,2023-01-11T04:50:00.000Z,2023-01-11T20:00:00.000Z,477.5,19.895833333333332,No,No,No,Yes,No,No,No,No,4,1
,Repair Insulation @ tk 1307 acid line,23-31795,,,,,1-10-23 2:12 PM,2023-01-10T14:12:00.000Z,1-13-23 2:12 PM,2023-01-13T14:12:00.000Z,1-11-23 6:10 AM,2023-01-11T06:10:00.000Z,4,4,,CO,CLOSE,Y,,NO,CHATHAM,,,,,,,,,,,,,,,,2,2023-01-11T04:50:00.000Z,2023-01-11T20:00:00.000Z,477.5,19.895833333333332,Yes,No,No,Yes,No,No,No,No,4,1
3767,Repair Pump shaft-Taylor Weld/Kris Machine,23-31796,P-4114,P-4114,,,1-10-23 3:02 PM,2023-01-10T15:02:00.000Z,1-27-23 1:31 PM,2023-01-27T13:31:00.000Z,1-25-23 3:31 AM,2023-01-25T03:31:00.000Z,4,4,,CO,CLOSE,Y,,NO,CHATHAM,,,,,,,,,,,,,,,,2,2023-01-11T04:50:00.000Z,2023-01-11T20:00:00.000Z,477.5,19.895833333333332,No,No,No,Yes,No,No,No,No,4,1
3767,Rebuild P-4114 R/A,23-31797,P-4114,P-4114,,,1-10-23 3:05 PM,2023-01-10T15:05:00.000Z,2-10-23 1:33 PM,2023-02-10T13:33:00.000Z,1-30-23 7:33 PM,2023-01-30T19:33:00.000Z,4,4,,CO,CLOSE,Y,,NO,CHATHAM,,,,,,,,,,,,,,,,2,2023-01-11T04:50:00.000Z,2023-01-11T20:00:00.000Z,477.5,19.895833333333332,No,No,No,Yes,No,No,No,No,4,1
,Small leak on Propanol Side Draw on C6571,23-31798,C-6571,C-6571,,,1-10-23 3:09 PM,2023-01-10T15:09:00.000Z,1-20-23 10:45 AM,2023-01-20T10:45:00.000Z,1-23-23 11:00 AM,2023-01-23T11:00:00.000Z,4,4,,CO,CLOSE,Y,,NO,CHATHAM,,,,,,,,,,,,,,,,2,2023-01-11T04:50:00.000Z,2023-01-11T20:00:00.000Z,477.5,19.895833333333332,No,No,No,Yes,No,No,No,No,4,1
3715,P-2407B Intermittently Overloads,23-31799,P-2407B,P-2407B,,,1-11-23 7:10 AM,2023-01-11T07:10:00.000Z,1-13-23 4:33 PM,2023-01-13T16:33:00.000Z,1-12-23 7:30 AM,2023-01-12T07:30:00.000Z,4,4,,CO,CLOSE,Y,,NO,CHATHAM,,,,,,,,,,,,,,,,2,2023-01-11T04:50:00.000Z,2023-01-11T20:00:00.000Z,477.5,19.895833333333332,No,No,No,No,Yes,Yes,No,No,5,1
7755,Investigate GA leak on piping to TK1401,23-31800,FT-14211,FT-14211,,,1-11-23 9:25 AM,2023-01-11T09:25:00.000Z,1-11-23 2:00 PM,2023-01-11T14:00:00.000Z,1-12-23 11:24 AM,2023-01-12T11:24:00.000Z,1,1,,RM,CLOSE,Y,,NO,CHATHAM,,,,,,,,,,,,,,,,2,2023-01-11T04:50:00.000Z,2023-01-11T20:00:00.000Z,477.5,19.895833333333332,No,No,No,No,Yes,Yes,No,No,5,1
,Install MCC bucket for new Power Panel MCC3821,23-31807,,,,,1-11-23 11:29 AM,2023-01-11T11:29:00.000Z,1-12-23 11:29 AM,2023-01-12T11:29:00.000Z,1-11-23 12:14 PM,2023-01-11T12:14:00.000Z,4,4,,CO,CLOSE,Y,,NO,CHATHAM,,,,,,,,,,,,,,,,2,2023-01-11T04:50:00.000Z,2023-01-11T20:00:00.000Z,477.5,19.895833333333332,Yes,No,No,No,Yes,No,No,No,1,1
3714,P-2407A status,23-31816,P-2407A,P-2407A,,,1-11-23 12:39 PM,2023-01-11T12:39:00.000Z,1-12-23 4:41 PM,2023-01-12T16:41:00.000Z,1-11-23 5:10 PM,2023-01-11T17:10:00.000Z,2,2,,CO,CLOSE,Y,,NO,CHATHAM,,,,,,,,,,,,,,,,2,2023-01-11T04:50:00.000Z,2023-01-11T20:00:00.000Z,477.5,19.895833333333332,Yes,No,No,No,Yes,No,No,No,1,1
2560,Replace Exchanger door gaskets,23-31825,E-1825,E-1825,,,1-12-23 6:39 AM,2023-01-12T06:39:00.000Z,1-11-23 3:30 PM,2023-01-11T15:30:00.000Z,1-12-23 1:10 PM,2023-01-12T13:10:00.000Z,4,4,,PM,CLOSE,Y,,NO,CHATHAM,2560,ecoDRY HEAT EXCHANGER,,No,DRYER A,CH-DRYER_A,CH-DRYER_A:SI18143A.MEAS,SI-18143A,SI,MEAS,Measured value (PV),Speed indication (feedback),Measurement,E1825 HEX LOWER DOOR,E-1825,2,2023-01-11T04:50:00.000Z,2023-01-11T20:00:00.000Z,477.5,19.895833333333332,No,No,No,No,No,Yes,No,No,5,1
,Steve M sort DCS components,23-31299,,,,,1-12-23 7:23 AM,2023-01-12T07:23:00.000Z,1-20-23 7:23 AM,2023-01-20T07:23:00.000Z,1-12-23 3:07 PM,2023-01-12T15:07:00.000Z,4,4,,CO,CLOSE,Y,,NO,CHATHAM,,,,,,,,,,,,,,,,2,2023-01-11T04:50:00.000Z,2023-01-11T20:00:00.000Z,477.5,19.895833333333332,No,No,No,No,No,Yes,No,No,5,1
3603,Rewire Groud Fault XFER 3821,23-31828,XFMR-3821,XFMR-3821,,,1-12-23 8:37 AM,2023-01-12T08:37:00.000Z,1-19-23 8:03 AM,2023-01-19T08:03:00.000Z,1-12-23 8:54 AM,2023-01-12T08:54:00.000Z,4,4,,CO,CLOSE,Y,,NO,CHATHAM,,,,,,,,,,,,,,,,2,2023-01-11T04:50:00.000Z,2023-01-11T20:00:00.000Z,477.5,19.895833333333332,No,No,No,No,No,Yes,No,No,5,1
3603,REWIRE CONTACTS TO DCS,23-31829,XFMR-3821,XFMR-3821,,,1-12-23 8:41 AM,2023-01-12T08:41:00.000Z,1-19-23 8:03 AM,2023-01-19T08:03:00.000Z,1-12-23 8:54 AM,2023-01-12T08:54:00.000Z,4,4,,CO,CLOSE,Y,,NO,CHATHAM,,,,,,,,,,,,,,,,2,2023-01-11T04:50:00.000Z,2023-01-11T20:00:00.000Z,477.5,19.895833333333332,No,No,No,No,No,Yes,No,No,5,1
3603,Rewire Groud Fault XFER 3821,23-31833,XFMR-3821,XFMR-3821,,,1-12-23 8:54 AM,2023-01-12T08:54:00.000Z,1-26-23 8:55 AM,2023-01-26T08:55:00.000Z,1-12-23 9:36 AM,2023-01-12T09:36:00.000Z,4,4,,CO,CLOSE,Y,,NO,CHATHAM,,,,,,,,,,,,,,,,2,2023-01-11T04:50:00.000Z,2023-01-11T20:00:00.000Z,477.5,19.895833333333332,No,No,No,No,No,Yes,No,No,5,1
3603,REWIRE CONTACTS INTO DCS,23-31835,XFMR-3821,XFMR-3821,,,1-12-23 8:55 AM,2023-01-12T08:55:00.000Z,,,1-12-23 9:36 AM,2023-01-12T09:36:00.000Z,4,4,,CO,CLOSE,Y,,NO,CHATHAM,,,,,,,,,,,,,,,,2,2023-01-11T04:50:00.000Z,2023-01-11T20:00:00.000Z,477.5,19.895833333333332,No,No,No,No,No,Yes,No,No,5,1
,2100 AREA - MOTOR BEARING GREASING,23-31357,2100,2100,,,1-9-23 1:46 AM,2023-01-09T01:46:00.000Z,2-1-23 1:00 AM,2023-02-01T01:00:00.000Z,2-1-23 1:00 AM,2023-02-01T01:00:00.000Z,4,4,,PM,CLOSE,Y,N,NO,CHATHAM,,,,,,,,,,,,,,,,3,2023-01-31T02:20:00.000Z,2023-01-31T03:10:00.000Z,4.833333333333333,0.2013888888888889,No,No,No,No,No,Yes,No,No,5,1
,ELECTRIC HEAT TRACING CHECK - PM SERVICE,23-31366,3800,3800,,,1-9-23 1:46 AM,2023-01-09T01:46:00.000Z,2-1-23 8:00 AM,2023-02-01T08:00:00.000Z,2-1-23 3:00 AM,2023-02-01T03:00:00.000Z,4,4,,PM,CLOSE,Y,N,NO,CHATHAM,,,,,,,,,,,,,,,,3,2023-01-31T02:20:00.000Z,2023-01-31T03:10:00.000Z,4.833333333333333,0.2013888888888889,No,No,No,No,No,Yes,No,No,5,1
1227,PH PROBE CLEANING AND CALIBRATION WEEKLY PM,23-31396,AT-13519,AT-13519,,,1-9-23 1:47 AM,2023-01-09T01:47:00.000Z,2-2-23 1:00 AM,2023-02-02T01:00:00.000Z,1-31-23 4:13 PM,2023-01-31T16:13:00.000Z,4,4,,PM,CLOSE,Y,,NO,CHATHAM,,,,,,,,,,,,,,,,3,2023-01-31T02:20:00.000Z,2023-01-31T03:10:00.000Z,4.833333333333333,0.2013888888888889,No,No,No,No,No,Yes,No,No,5,1
5517,Dispose of old tank,23-31851,TK-3604,TK-3604,,,1-12-23 11:14 AM,2023-01-12T11:14:00.000Z,1-31-23 9:30 AM,2023-01-31T09:30:00.000Z,1-31-23 8:13 AM,2023-01-31T08:13:00.000Z,4,4,,CO,CLOSE,Y,,NO,CHATHAM,,,,,,,,,,,,,,,,3,2023-01-31T02:20:00.000Z,2023-01-31T03:10:00.000Z,4.833333333333333,0.2013888888888889,No,No,No,No,No,Yes,No,No,5,1
5517,REMOVE TANK OFF-SITE AND DISPOSE,23-31852,TK-3604,TK-3604,,,1-12-23 11:16 AM,2023-01-12T11:16:00.000Z,1-31-23 9:30 AM,2023-01-31T09:30:00.000Z,1-31-23 8:13 AM,2023-01-31T08:13:00.000Z,4,4,,CO,CLOSE,Y,,NO,CHATHAM,,,,,,,,,,,,,,,,3,2023-01-31T02:20:00.000Z,2023-01-31T03:10:00.000Z,4.833333333333333,0.2013888888888889,No,No,No,No,No,Yes,No,No,5,1
1077,Change out electric motor on P1582A,23-32754,P-1582A,P-1582A,,,1-25-23 8:56 AM,2023-01-25T08:56:00.000Z,2-17-23 9:43 AM,2023-02-17T09:43:00.000Z,1-31-23 2:43 PM,2023-01-31T14:43:00.000Z,4,4,,CO,CLOSE,Y,,NO,CHATHAM,,,,,,,,,,,,,,,,3,2023-01-31T02:20:00.000Z,2023-01-31T03:10:00.000Z,4.833333333333333,0.2013888888888889,No,No,No,No,No,Yes,No,No,5,1
,Replace heat trace thermostat @ DA 3602,23-32809,,,,,1-26-23 3:16 PM,2023-01-26T15:16:00.000Z,2-3-23 3:16 PM,2023-02-03T15:16:00.000Z,1-31-23 4:16 PM,2023-01-31T16:16:00.000Z,4,4,,CO,CLOSE,Y,,NO,CHATHAM,,,,,,,,,,,,,,,,3,2023-01-31T02:20:00.000Z,2023-01-31T03:10:00.000Z,4.833333333333333,0.2013888888888889,No,No,No,No,No,Yes,No,No,5,1
5517,Weld anchor feet onto new tank and mount onto pad,23-32818,TK-3604,TK-3604,,,1-27-23 10:57 AM,2023-01-27T10:57:00.000Z,2-10-23 10:57 AM,2023-02-10T10:57:00.000Z,1-31-23 3:57 PM,2023-01-31T15:57:00.000Z,4,4,,CO,CLOSE,Y,,NO,CHATHAM,,,,,,,,,,,,,,,,3,2023-01-31T02:20:00.000Z,2023-01-31T03:10:00.000Z,4.833333333333333,0.2013888888888889,No,No,No,No,No,Yes,No,No,5,1
,Water Damaged Ceiling Tiles,23-32824,BU-ADMIN,BU-ADMIN,,,1-27-23 3:59 PM,2023-01-27T15:59:00.000Z,2-10-23 11:55 AM,2023-02-10T11:55:00.000Z,1-31-23 2:02 PM,2023-01-31T14:02:00.000Z,4,4,,CO,CLOSE,Y,,NO,CHATHAM,,,,,,,,,,,,,,,,3,2023-01-31T02:20:00.000Z,2023-01-31T03:10:00.000Z,4.833333333333333,0.2013888888888889,No,No,No,No,No,Yes,No,No,5,1
,Replace Lightbulbs,23-33045,BU-ADMIN,BU-ADMIN,,,1-30-23 7:12 AM,2023-01-30T07:12:00.000Z,2-3-23 12:17 PM,2023-02-03T12:17:00.000Z,2-2-23 1:19 PM,2023-02-02T13:19:00.000Z,4,4,,CO,CLOSE,Y,,NO,CHATHAM,,,,,,,,,,,,,,,,3,2023-01-31T02:20:00.000Z,2023-01-31T03:10:00.000Z,4.833333333333333,0.2013888888888889,No,No,No,Yes,No,No,No,No,4,1
1361,TA24 Spring - Steam out RC1 for internal inspection (ops task + maintenance),23-33046,C-1521,C-1521,,,1-30-23 10:01 AM,2023-01-30T10:01:00.000Z,5-31-24 8:52 AM,2024-05-31T08:52:00.000Z,6-6-24 8:12 AM,2024-06-06T08:12:00.000Z,4,4,,PM,CLOSE,Y,,NO,CHATHAM,,,,,,,,,,,,,,,,3,2023-01-31T02:20:00.000Z,2023-01-31T03:10:00.000Z,4.833333333333333,0.2013888888888889,No,No,No,Yes,No,No,No,No,4,1
5000,WELD REPAIR AT BASE OF ST-1801D.  REPAIR DEFICIENCIES FOUND DURING ACUREN INSPECTION,23-33047,ST-1801D,ST-1801D,,,1-30-23 10:03 AM,2023-01-30T10:03:00.000Z,4-30-23 10:00 AM,2023-04-30T10:00:00.000Z,,,4,4,,CO,CAN,Y,,NO,CHATHAM,5000,"STACK, FENCO, 250' SELF SUPPORTING,",,No,TGF,,,,,,,,,,,3,2023-01-31T02:20:00.000Z,2023-01-31T03:10:00.000Z,4.833333333333333,0.2013888888888889,No,No,No,Yes,No,No,No,No,4,1
6332,TA23 - Open manway on HC reflux drum V6562 to inspect for solid build-up (no CSE),23-33051,V-6562,V-6562,,,1-30-23 12:33 PM,2023-01-30T12:33:00.000Z,4-21-23 10:30 AM,2023-04-21T10:30:00.000Z,4-28-23 6:21 AM,2023-04-28T06:21:00.000Z,4,4,,SD,CLOSE,Y,,NO,CHATHAM,,,,,,,,,,,,,,,,3,2023-01-31T02:20:00.000Z,2023-01-31T03:10:00.000Z,4.833333333333333,0.2013888888888889,No,No,No,Yes,No,No,No,No,4,1
1101,TA23 - Roll out suction valve on HC reboiler pump P6561B to water flush solids from column,23-33052,P-6561B,P-6561B,,,1-30-23 12:34 PM,2023-01-30T12:34:00.000Z,10-31-23 10:47 AM,2023-10-31T10:47:00.000Z,11-9-23 9:37 AM,2023-11-09T09:37:00.000Z,4,4,,CO,CLOSE,Y,,NO,CHATHAM,,,,,,,,,,,,,,,,3,2023-01-31T02:20:00.000Z,2023-01-31T03:10:00.000Z,4.833333333333333,0.2013888888888889,No,No,No,Yes,No,No,No,No,4,1
1096,TA23 - Roll out RC3 bottoms pump suction valve to water flush column to grade,23-33053,P-6570A,P-6570A,,,1-30-23 12:35 PM,2023-01-30T12:35:00.000Z,10-31-23 10:40 AM,2023-10-31T10:40:00.000Z,11-9-23 9:37 AM,2023-11-09T09:37:00.000Z,4,4,,CO,CLOSE,Y,,NO,CHATHAM,,,,,,,,,,,,,,,,3,2023-01-31T02:20:00.000Z,2023-01-31T03:10:00.000Z,4.833333333333333,0.2013888888888889,No,No,No,Yes,No,No,No,No,4,1
1585,MSU 3 actuator - heat trace/possible actuator replace,23-33055,E-6584,E-6584,,,1-30-23 12:37 PM,2023-01-30T12:37:00.000Z,1-31-23 10:51 AM,2023-01-31T10:51:00.000Z,1-31-23 8:00 AM,2023-01-31T08:00:00.000Z,4,4,,CO,CLOSE,Y,,NO,CHATHAM,,,,,,,,,,,,,,,,3,2023-01-31T02:20:00.000Z,2023-01-31T03:10:00.000Z,4.833333333333333,0.2013888888888889,No,No,No,Yes,No,Yes,No,No,4,1
3404,"Replace bulbs in Mill \"C\" building",23-33056,MI-1201C,MI-1201C,,,1-30-23 12:42 PM,2023-01-30T12:42:00.000Z,2-3-23 12:42 PM,2023-02-03T12:42:00.000Z,1-31-23 2:43 PM,2023-01-31T14:43:00.000Z,4,4,,CO,CLOSE,Y,,NO,CHATHAM,,,,,,,,,,,,,,,,3,2023-01-31T02:20:00.000Z,2023-01-31T03:10:00.000Z,4.833333333333333,0.2013888888888889,No,No,No,Yes,No,Yes,No,No,4,1
1161,Change out motor and rotating assembly on the pump,23-33058,P-6586B,P-6586B,,,1-30-23 12:57 PM,2023-01-30T12:57:00.000Z,2-10-23 12:57 PM,2023-02-10T12:57:00.000Z,2-7-23 9:27 PM,2023-02-07T21:27:00.000Z,4,4,,CO,CLOSE,Y,,NO,CHATHAM,,,,,,,,,,,,,,,,3,2023-01-31T02:20:00.000Z,2023-01-31T03:10:00.000Z,4.833333333333333,0.2013888888888889,No,No,No,Yes,No,No,No,No,4,1
,Lift new oil and grease up into Decanter building & empty garbage,23-33059,CE-1711,CE-1711,,,1-30-23 1:03 PM,2023-01-30T13:03:00.000Z,2-3-23 1:03 PM,2023-02-03T13:03:00.000Z,1-31-23 3:06 PM,2023-01-31T15:06:00.000Z,4,4,,CO,CLOSE,Y,,NO,CHATHAM,,,,,,,,,,,,,,,,3,2023-01-31T02:20:00.000Z,2023-01-31T03:10:00.000Z,4.833333333333333,0.2013888888888889,No,No,No,Yes,No,Yes,No,No,4,1
1316,Re-install sump pump between R&D and bio-thane,23-33060,BU-BIOTH,BU-BIOTH,,,1-30-23 2:25 PM,2023-01-30T14:25:00.000Z,2-1-23 2:30 PM,2023-02-01T14:30:00.000Z,2-9-23 10:02 AM,2023-02-09T10:02:00.000Z,4,4,,CO,CLOSE,Y,,NO,CHATHAM,,,,,,,,,,,,,,,,3,2023-01-31T02:20:00.000Z,2023-01-31T03:10:00.000Z,4.833333333333333,0.2013888888888889,No,No,No,Yes,No,No,No,No,4,1
,Change oil in gearbox and investigate oil leak,23-33061,,,,,1-30-23 2:33 PM,2023-01-30T14:33:00.000Z,2-3-23 2:33 PM,2023-02-03T14:33:00.000Z,2-3-23 4:33 PM,2023-02-03T16:33:00.000Z,4,4,,CO,CLOSE,Y,,NO,CHATHAM,,,,,,,,,,,,,,,,3,2023-01-31T02:20:00.000Z,2023-01-31T03:10:00.000Z,4.833333333333333,0.2013888888888889,No,No,No,Yes,No,No,No,No,4,1
1069,Tie in dedicated seal water line,23-33062,P-1511B,P-1511B,,,1-30-23 3:09 PM,2023-01-30T15:09:00.000Z,1-30-23 5:00 PM,2023-01-30T17:00:00.000Z,1-30-23 4:10 PM,2023-01-30T16:10:00.000Z,4,4,,CO,CLOSE,Y,,NO,CHATHAM,,,,,,,,,,,,,,,,3,2023-01-31T02:20:00.000Z,2023-01-31T03:10:00.000Z,4.833333333333333,0.2013888888888889,No,No,No,Yes,No,No,No,No,4,1
,Remove battery from company truck,23-33063,BU-ADMIN,BU-ADMIN,,,1-30-23 3:12 PM,2023-01-30T15:12:00.000Z,1-30-23 5:30 PM,2023-01-30T17:30:00.000Z,1-30-23 3:43 PM,2023-01-30T15:43:00.000Z,4,4,,CO,CLOSE,Y,,NO,CHATHAM,,,,,,,,,,,,,,,,3,2023-01-31T02:20:00.000Z,2023-01-31T03:10:00.000Z,4.833333333333333,0.2013888888888889,No,No,No,Yes,No,No,No,No,4,1
7727,Troubleshoot Ammonia sensor out of range (bad IO),23-33064,AT-24321C,AT-24321C,,STEVE.MOORE,1-30-23 3:25 PM,2023-01-30T15:25:00.000Z,1-30-23 3:31 PM,2023-01-30T15:31:00.000Z,1-31-23 7:18 AM,2023-01-31T07:18:00.000Z,2,2,,RM,CLOSE,Y,,NO,CHATHAM,,,,,,,,,,,,,,,,3,2023-01-31T02:20:00.000Z,2023-01-31T03:10:00.000Z,4.833333333333333,0.2013888888888889,No,No,No,Yes,No,Yes,No,No,4,1
1497,E-1503 Blank Exchanger to V-1501 for Removal,23-33065,E-1503,E-1503,,,1-30-23 3:37 PM,2023-01-30T15:37:00.000Z,4-30-23 4:00 PM,2023-04-30T16:00:00.000Z,5-16-23 2:19 PM,2023-05-16T14:19:00.000Z,4,4,,SD,CLOSE,Y,,NO,CHATHAM,,,,,,,,,,,,,,,,3,2023-01-31T02:20:00.000Z,2023-01-31T03:10:00.000Z,4.833333333333333,0.2013888888888889,No,No,No,Yes,No,No,No,No,4,1
,"2023 TA, Electrical PM  (Middle)",23-33067,3800,3800,,,1-30-23 3:42 PM,2023-01-30T15:42:00.000Z,4-16-23 6:00 PM,2023-04-16T18:00:00.000Z,5-2-23 8:37 AM,2023-05-02T08:37:00.000Z,4,4,,SD,CLOSE,Y,,NO,CHATHAM,,,,,,,,,,,,,,,,3,2023-01-31T02:20:00.000Z,2023-01-31T03:10:00.000Z,4.833333333333333,0.2013888888888889,No,No,No,Yes,No,No,No,No,4,1
,FT-32401 CT Blowdown Replacement,23-33068,3200-26K-04,3200-26K-04,,,1-30-23 3:43 PM,2023-01-30T15:43:00.000Z,4-30-23 3:15 PM,2023-04-30T15:15:00.000Z,7-31-23 9:50 AM,2023-07-31T09:50:00.000Z,4,4,,CP,CLOSE,Y,,NO,CHATHAM,,,,,,,,,,,,,,,,3,2023-01-31T02:20:00.000Z,2023-01-31T03:10:00.000Z,4.833333333333333,0.2013888888888889,No,No,No,Yes,No,No,No,No,4,1
,Forklift needed to load empty totes,23-33069,MAINTENANCE,MAINTENANCE,,,1-30-23 3:47 PM,2023-01-30T15:47:00.000Z,2-6-23 1:14 PM,2023-02-06T13:14:00.000Z,2-2-23 2:01 PM,2023-02-02T14:01:00.000Z,4,4,,CO,CLOSE,Y,,NO,CHATHAM,,,,,,,,,,,,,,,,3,2023-01-31T02:20:00.000Z,2023-01-31T03:10:00.000Z,4.833333333333333,0.2013888888888889,No,No,No,Yes,No,No,No,No,4,1
1292,Install new duct elbow at Dryer D,23-33070,BL-1803D,BL-1803D,,,1-30-23 3:50 PM,2023-01-30T15:50:00.000Z,2-24-23 2:11 PM,2023-02-24T14:11:00.000Z,2-9-23 7:20 AM,2023-02-09T07:20:00.000Z,4,4,,CO,CLOSE,Y,,NO,CHATHAM,1292,"BLOWER, NYB, SERIES 30 GI, MODEL 854, DH, 88,000CFM, 11.4in wg, 735RPM,",,No,DRYER D,CH-DRYER_D_BLR,CH-DRYER_D_BLR:BL1803D.STAIND,BL-1803D,BL,STAIND,"Status indication (open/closed, run/stop)",Blower (asset),Equipment status,HOT WATER PRESSURE,,3,2023-01-31T02:20:00.000Z,2023-01-31T03:10:00.000Z,4.833333333333333,0.2013888888888889,No,No,No,Yes,No,No,No,No,4,1
,112 deck old Distillation - grating clip install,23-33071,1500,1500,,,1-30-23 3:51 PM,2023-01-30T15:51:00.000Z,2-10-23 1:15 PM,2023-02-10T13:15:00.000Z,2-6-23 1:48 PM,2023-02-06T13:48:00.000Z,4,4,,CO,CLOSE,Y,,NO,CHATHAM,,,,,,,,,,,,,,,,3,2023-01-31T02:20:00.000Z,2023-01-31T03:10:00.000Z,4.833333333333333,0.2013888888888889,No,No,No,Yes,No,No,No,No,4,1
6670,K3301B AUTO drain on moisture separator is stuck open,23-33072,K-3301B,K-3301B,,,1-30-23 3:54 PM,2023-01-30T15:54:00.000Z,2-4-23 1:22 PM,2023-02-04T13:22:00.000Z,1-31-23 2:22 PM,2023-01-31T14:22:00.000Z,4,4,,CO,CLOSE,Y,,NO,CHATHAM,,,,,,,,,,,,,,,,3,2023-01-31T02:20:00.000Z,2023-01-31T03:10:00.000Z,4.833333333333333,0.2013888888888889,No,No,No,Yes,No,Yes,No,No,4,1
3622,Cyclone 1826 Probe B (LSH-18166B) will not clear,23-33073,LSH-18166B,LSH-18166B,,,1-31-23 7:14 AM,2023-01-31T07:14:00.000Z,2-1-23 5:01 AM,2023-02-01T05:01:00.000Z,1-31-23 5:45 AM,2023-01-31T05:45:00.000Z,2,2,,CO,CLOSE,Y,,NO,CHATHAM,3622,RF CAPACITANCE LEVEL SENSOR,,No,DRYER A,,,,,,,,,,,3,2023-01-31T02:20:00.000Z,2023-01-31T03:10:00.000Z,4.833333333333333,0.2013888888888889,No,No,No,No,No,Yes,No,No,5,1
1290,Take thermal image of BL-1802 motor,23-33074,BL-1802,BL-1802,,,1-31-23 7:56 AM,2023-01-31T07:56:00.000Z,2-3-23 7:56 AM,2023-02-03T07:56:00.000Z,1-31-23 8:57 AM,2023-01-31T08:57:00.000Z,4,4,,CO,CLOSE,Y,,NO,CHATHAM,"1290, 7029","BLOWER, IAP, MODEL XRT SIZE 445, CW/UB, Arrg't 12, 250HP / 1785RPM / TEFC / 575V/3PH/60HZ / 504/5T FRAME",,No,DRYER D,,,,,,,,,,,3,2023-01-31T02:20:00.000Z,2023-01-31T03:10:00.000Z,4.833333333333333,0.2013888888888889,No,No,No,No,No,Yes,No,No,5,1
3847,P-6612 Tween Pump Not hitting setpoint,23-33159,P-6612,P-6612,,,1-31-23 2:17 PM,2023-01-31T14:17:00.000Z,2-7-23 9:38 AM,2023-02-07T09:38:00.000Z,1-31-23 2:38 PM,2023-01-31T14:38:00.000Z,4,4,,CO,CLOSE,Y,,NO,CHATHAM,,,,,,,,,,,,,,,,3,2023-01-31T02:20:00.000Z,2023-01-31T03:10:00.000Z,4.833333333333333,0.2013888888888889,No,No,No,No,No,Yes,No,No,5,1
2533,OPEN MAYWAY,23-31605,CY-1826,CY-1826,,,1-9-23 3:18 PM,2023-01-09T15:18:00.000Z,9-1-22 12:00 AM,2022-09-01T00:00:00.000Z,1-31-23 6:58 AM,2023-01-31T06:58:00.000Z,4,4,,SD,CLOSE,Y,,NO,CHATHAM,2533,"CYCLONE ASSEMBLY, RIGHT HAND, DEDERT MODEL# CYCL-11 A",,No,DRYER A,CH-DRYER_A,CH-DRYER_A:TIC18147B.OUT,TIC-18147B,TIC,OUT,Controller output / demand (CO),Temperature indicating controller,Output/Demand,CY1826 TOP TEMP,CY-1826,4,2023-01-31T07:10:00.000Z,2023-01-31T07:40:00.000Z,86.5,3.6041666666666665,No,No,No,No,No,No,No,Yes,3,1
2533,HPW WASH CY-1826 CYCLONE,23-31606,CY-1826,CY-1826,,,1-10-23 8:16 AM,2023-01-10T08:16:00.000Z,9-1-22 12:00 AM,2022-09-01T00:00:00.000Z,1-31-23 6:58 AM,2023-01-31T06:58:00.000Z,4,4,,SD,CLOSE,Y,,NO,CHATHAM,2533,"CYCLONE ASSEMBLY, RIGHT HAND, DEDERT MODEL# CYCL-11 A",,No,DRYER A,CH-DRYER_A,CH-DRYER_A:TIC18147B.OUT,TIC-18147B,TIC,OUT,Controller output / demand (CO),Temperature indicating controller,Output/Demand,CY1826 TOP TEMP,CY-1826,4,2023-01-31T07:10:00.000Z,2023-01-31T07:40:00.000Z,86.5,3.6041666666666665,No,No,No,No,No,No,No,Yes,3,1
2533,CLOSE MANWAY,23-31607,CY-1826,CY-1826,,,1-10-23 8:18 AM,2023-01-10T08:18:00.000Z,9-1-22 12:00 AM,2022-09-01T00:00:00.000Z,1-31-23 6:58 AM,2023-01-31T06:58:00.000Z,4,4,,SD,CLOSE,Y,,NO,CHATHAM,2533,"CYCLONE ASSEMBLY, RIGHT HAND, DEDERT MODEL# CYCL-11 A",,No,DRYER A,CH-DRYER_A,CH-DRYER_A:TIC18147B.OUT,TIC-18147B,TIC,OUT,Controller output / demand (CO),Temperature indicating controller,Output/Demand,CY1826 TOP TEMP,CY-1826,4,2023-01-31T07:10:00.000Z,2023-01-31T07:40:00.000Z,86.5,3.6041666666666665,No,No,No,No,No,No,No,Yes,3,1
5517,GROUNDING NEW TANK AS REQ'D,23-31847,TK-3604,TK-3604,,,1-12-23 10:56 AM,2023-01-12T10:56:00.000Z,2-28-23 9:30 AM,2023-02-28T09:30:00.000Z,1-31-23 7:18 AM,2023-01-31T07:18:00.000Z,4,4,,CO,CLOSE,Y,,NO,CHATHAM,,,,,,,,,,,,,,,,4,2023-01-31T07:10:00.000Z,2023-01-31T07:40:00.000Z,86.5,3.6041666666666665,Yes,No,No,No,No,No,No,No,1,1
,Install stiffeners and added welding as per inspection.,23-33211,DR-1801D,DR-1801D,,,2-3-23 6:24 AM,2023-02-03T06:24:00.000Z,2-7-23 6:24 AM,2023-02-07T06:24:00.000Z,2-7-23 3:45 PM,2023-02-07T15:45:00.000Z,4,4,,CO,CLOSE,Y,,NO,CHATHAM,"1466, 1597, 7011","ROTARY DRYER, ICM, DR-1801D BURNER MANAGEMENT SYSTEM, GEARBOX, DORRIS, 415TR25, SER# 31396 or SER#27639",,No,DRYER D,CH-DRYER_D,CH-DRYER_D:DR1801D.STAIND,DR-1801D,DR,STAIND,"Status indication (open/closed, run/stop)",Drum/Drive (asset),Equipment status,RECYCLE DRAG CONVEYOR,,10,2023-02-04T00:30:00.000Z,2023-02-04T01:10:00.000Z,126.33333333333333,5.263888888888889,No,No,No,Yes,No,No,No,No,4,1
,HPW PCOSS piping - see attached drawing,23-33212,SKID-6601,SKID-6601,,,2-3-23 3:13 PM,2023-02-03T15:13:00.000Z,4-24-23 3:13 PM,2023-04-24T15:13:00.000Z,5-19-23 1:59 PM,2023-05-19T13:59:00.000Z,4,4,,SD,CLOSE,Y,,NO,CHATHAM,,,,,,,,,,,,,,,,10,2023-02-04T00:30:00.000Z,2023-02-04T01:10:00.000Z,126.33333333333333,5.263888888888889,No,No,No,Yes,No,No,No,No,4,1
,CE-1711 discharge boot is leaking on the NE corner of the flange again.,23-33213,1700-26K-07,1700-26K-07,,,2-3-23 3:16 PM,2023-02-03T15:16:00.000Z,2-17-23 3:13 PM,2023-02-17T15:13:00.000Z,5-17-23 2:29 PM,2023-05-17T14:29:00.000Z,2,2,,RM,CLOSE,Y,,NO,CHATHAM,,,,,,,,,,,,,,,,10,2023-02-04T00:30:00.000Z,2023-02-04T01:10:00.000Z,126.33333333333333,5.263888888888889,No,No,No,Yes,No,No,No,No,4,1
4865,SA-2101 CORN PROBE - MECHANICAL  PM,23-31364,SA-2101,SA-2101,,,1-9-23 1:46 AM,2023-01-09T01:46:00.000Z,2-6-23 7:30 AM,2023-02-06T07:30:00.000Z,2-10-23 4:25 PM,2023-02-10T16:25:00.000Z,4,4,,PM,CLOSE,Y,N,NO,CHATHAM,,,,,,,,,,,,,,,,13,2023-02-10T03:00:00.000Z,2023-02-10T16:10:00.000Z,13.833333333333334,0.5763888888888888,No,No,No,No,No,Yes,Yes,No,5,1
4865,Corn Probe Weekly PM,23-31365,SA-2101,SA-2101,,,1-9-23 1:46 AM,2023-01-09T01:46:00.000Z,2-6-23 7:30 AM,2023-02-06T07:30:00.000Z,2-10-23 4:25 PM,2023-02-10T16:25:00.000Z,4,4,,PM,CLOSE,Y,,NO,CHATHAM,,,,,,,,,,,,,,,,13,2023-02-10T03:00:00.000Z,2023-02-10T16:10:00.000Z,13.833333333333334,0.5763888888888888,No,No,No,No,No,Yes,Yes,No,5,1
,Monitor & fill salt boxes,23-31392,CHATHAM,CHATHAM,,,1-9-23 1:47 AM,2023-01-09T01:47:00.000Z,2-6-23 1:00 AM,2023-02-06T01:00:00.000Z,2-10-23 4:14 PM,2023-02-10T16:14:00.000Z,4,4,,PM,CLOSE,Y,,NO,CHATHAM,,,,,,,,,,,,,,,,13,2023-02-10T03:00:00.000Z,2023-02-10T16:10:00.000Z,13.833333333333334,0.5763888888888888,No,No,No,No,No,Yes,Yes,No,5,1
,MI-1201B - WEEKLY PM & ROTATION CHANGE,23-31402,MI-1201B,MI-1201B,,,1-9-23 1:47 AM,2023-01-09T01:47:00.000Z,2-6-23 12:00 AM,2023-02-06T00:00:00.000Z,2-10-23 4:14 PM,2023-02-10T16:14:00.000Z,4,4,,PM,CLOSE,Y,,NO,CHATHAM,,,,,,,,,,,,,,,,13,2023-02-10T03:00:00.000Z,2023-02-10T16:10:00.000Z,13.833333333333334,0.5763888888888888,No,No,No,No,No,Yes,Yes,No,5,1
,MI-1201B - GREASE CHANGE OUT,23-31403,MI-1201B,MI-1201B,,,1-9-23 1:47 AM,2023-01-09T01:47:00.000Z,2-6-23 12:00 AM,2023-02-06T00:00:00.000Z,2-10-23 4:14 PM,2023-02-10T16:14:00.000Z,4,4,,PM,CLOSE,Y,,NO,CHATHAM,,,,,,,,,,,,,,,,13,2023-02-10T03:00:00.000Z,2023-02-10T16:10:00.000Z,13.833333333333334,0.5763888888888888,No,No,No,No,No,Yes,Yes,No,5,1
,MI-1201B - MECHANICAL PM,23-31401,MI-1201B,MI-1201B,,,1-9-23 1:47 AM,2023-01-09T01:47:00.000Z,2-6-23 1:00 AM,2023-02-06T01:00:00.000Z,2-10-23 4:14 PM,2023-02-10T16:14:00.000Z,4,4,,PM,CLOSE,Y,N,NO,CHATHAM,,,,,,,,,,,,,,,,13,2023-02-10T03:00:00.000Z,2023-02-10T16:10:00.000Z,13.833333333333334,0.5763888888888888,No,No,No,No,No,Yes,Yes,No,5,1
1293,BL-1804D WEEKLY GREASING,23-31416,BL-1804D,BL-1804D,,,1-9-23 1:47 AM,2023-01-09T01:47:00.000Z,2-6-23 12:00 AM,2023-02-06T00:00:00.000Z,2-10-23 4:19 PM,2023-02-10T16:19:00.000Z,4,4,,PM,CLOSE,Y,,NO,CHATHAM,"1293, 6864","BLOWER, NYB, MODEL 714 SERIES 45, GENERAL INDUSTRIAL, CW/UB, Arrg't 8, MOTOR / 450HP / 1200RPM / TEFC / 2300V/3PH/60HZ / FR# 5808C",,No,DRYER D,CH-DRYER_D_BLR,CH-DRYER_D_BLR:BL1804D.STAIND,BL-1804D,BL,STAIND,"Status indication (open/closed, run/stop)",Blower (asset),Equipment status,CYCLONE INLET PRESSURE,,13,2023-02-10T03:00:00.000Z,2023-02-10T16:10:00.000Z,13.833333333333334,0.5763888888888888,No,No,No,No,No,Yes,Yes,No,5,1
,Monday route - Fill plant salt boxes,23-31391,CHATHAM,CHATHAM,,,1-9-23 1:47 AM,2023-01-09T01:47:00.000Z,2-6-23 12:00 AM,2023-02-06T00:00:00.000Z,2-10-23 4:14 PM,2023-02-10T16:14:00.000Z,4,4,,PM,CLOSE,Y,N,NO,CHATHAM,,,,,,,,,,,,,,,,13,2023-02-10T03:00:00.000Z,2023-02-10T16:10:00.000Z,13.833333333333334,0.5763888888888888,No,No,No,No,No,Yes,Yes,No,5,1
,Weekly Vibration check (GFE I/E),23-31404,MI-1201B,MI-1201B,,,1-9-23 1:47 AM,2023-01-09T01:47:00.000Z,2-6-23 12:00 AM,2023-02-06T00:00:00.000Z,2-10-23 4:14 PM,2023-02-10T16:14:00.000Z,4,4,,PM,CLOSE,Y,,NO,CHATHAM,,,,,,,,,,,,,,,,13,2023-02-10T03:00:00.000Z,2023-02-10T16:10:00.000Z,13.833333333333334,0.5763888888888888,No,No,No,No,No,Yes,Yes,No,5,1
1293,BL-1804D - WEEKLY BEARING GREASING,23-31415,BL-1804D,BL-1804D,,,1-9-23 1:47 AM,2023-01-09T01:47:00.000Z,2-6-23 12:00 AM,2023-02-06T00:00:00.000Z,2-10-23 4:19 PM,2023-02-10T16:19:00.000Z,4,4,,PM,CLOSE,Y,N,NO,CHATHAM,"1293, 6864","BLOWER, NYB, MODEL 714 SERIES 45, GENERAL INDUSTRIAL, CW/UB, Arrg't 8, MOTOR / 450HP / 1200RPM / TEFC / 2300V/3PH/60HZ / FR# 5808C",,No,DRYER D,CH-DRYER_D_BLR,CH-DRYER_D_BLR:BL1804D.STAIND,BL-1804D,BL,STAIND,"Status indication (open/closed, run/stop)",Blower (asset),Equipment status,CYCLONE INLET PRESSURE,,13,2023-02-10T03:00:00.000Z,2023-02-10T16:10:00.000Z,13.833333333333334,0.5763888888888888,No,No,No,No,No,Yes,Yes,No,5,1
,Rotor- lubricate,23-31442,CE-1711,CE-1711,,,1-9-23 1:48 AM,2023-01-09T01:48:00.000Z,2-2-23 7:00 AM,2023-02-02T07:00:00.000Z,2-10-23 7:38 AM,2023-02-10T07:38:00.000Z,2,2,,PM,CLOSE,Y,,NO,CHATHAM,,,,,,,,,,,,,,,,13,2023-02-10T03:00:00.000Z,2023-02-10T16:10:00.000Z,13.833333333333334,0.5763888888888888,Yes,No,No,No,No,No,No,No,1,1
,Housing- Check housing inside and outside for deposits.,23-31440,CE-1711,CE-1711,,,1-9-23 1:48 AM,2023-01-09T01:48:00.000Z,2-2-23 7:00 AM,2023-02-02T07:00:00.000Z,2-10-23 7:38 AM,2023-02-10T07:38:00.000Z,2,2,,PM,CLOSE,Y,,NO,CHATHAM,,,,,,,,,,,,,,,,13,2023-02-10T03:00:00.000Z,2023-02-10T16:10:00.000Z,13.833333333333334,0.5763888888888888,Yes,No,No,No,No,No,No,No,1,1
,Gear Box - Check for tightness and arrange refurbish if necessary,23-31441,CE-1711,CE-1711,,,1-9-23 1:48 AM,2023-01-09T01:48:00.000Z,2-2-23 7:00 AM,2023-02-02T07:00:00.000Z,2-10-23 7:38 AM,2023-02-10T07:38:00.000Z,2,2,,PM,CLOSE,Y,,NO,CHATHAM,,,,,,,,,,,,,,,,13,2023-02-10T03:00:00.000Z,2023-02-10T16:10:00.000Z,13.833333333333334,0.5763888888888888,Yes,No,No,No,No,No,No,No,1,1
,"Rotor- Check wear protectionat solids discharge for wear, exchange if necessary",23-31443,CE-1711,CE-1711,,,1-9-23 1:48 AM,2023-01-09T01:48:00.000Z,2-2-23 7:00 AM,2023-02-02T07:00:00.000Z,2-10-23 7:38 AM,2023-02-10T07:38:00.000Z,2,2,,PM,CLOSE,Y,,NO,CHATHAM,,,,,,,,,,,,,,,,13,2023-02-10T03:00:00.000Z,2023-02-10T16:10:00.000Z,13.833333333333334,0.5763888888888888,Yes,No,No,No,No,No,No,No,1,1
,"Diverter Valve- lubricate spindles, guide bars , bearing",23-31444,CE-1711,CE-1711,,,1-9-23 1:48 AM,2023-01-09T01:48:00.000Z,2-2-23 7:00 AM,2023-02-02T07:00:00.000Z,2-10-23 7:38 AM,2023-02-10T07:38:00.000Z,2,2,,PM,CLOSE,Y,,NO,CHATHAM,,,,,,,,,,,,,,,,13,2023-02-10T03:00:00.000Z,2023-02-10T16:10:00.000Z,13.833333333333334,0.5763888888888888,Yes,No,No,No,No,No,No,No,1,1
1292,BL-1803D HPW,23-31562,BL-1803D,BL-1803D,,,1-9-23 9:23 AM,2023-01-09T09:23:00.000Z,2-23-23 9:23 AM,2023-02-23T09:23:00.000Z,2-10-23 6:41 AM,2023-02-10T06:41:00.000Z,4,4,,PM,CLOSE,Y,,NO,CHATHAM,1292,"BLOWER, NYB, SERIES 30 GI, MODEL 854, DH, 88,000CFM, 11.4in wg, 735RPM,",,No,DRYER D,CH-DRYER_D_BLR,CH-DRYER_D_BLR:BL1803D.STAIND,BL-1803D,BL,STAIND,"Status indication (open/closed, run/stop)",Blower (asset),Equipment status,HOT WATER PRESSURE,,13,2023-02-10T03:00:00.000Z,2023-02-10T16:10:00.000Z,13.833333333333334,0.5763888888888888,Yes,No,No,No,No,No,No,No,1,1
1292,OPEN MANWAY,23-31563,BL-1803D,BL-1803D,,,1-9-23 9:33 AM,2023-01-09T09:33:00.000Z,2-23-23 9:23 AM,2023-02-23T09:23:00.000Z,2-10-23 6:41 AM,2023-02-10T06:41:00.000Z,4,4,,PM,CLOSE,Y,,NO,CHATHAM,1292,"BLOWER, NYB, SERIES 30 GI, MODEL 854, DH, 88,000CFM, 11.4in wg, 735RPM,",,No,DRYER D,CH-DRYER_D_BLR,CH-DRYER_D_BLR:BL1803D.STAIND,BL-1803D,BL,STAIND,"Status indication (open/closed, run/stop)",Blower (asset),Equipment status,HOT WATER PRESSURE,,13,2023-02-10T03:00:00.000Z,2023-02-10T16:10:00.000Z,13.833333333333334,0.5763888888888888,Yes,No,No,No,No,No,No,No,1,1
1292,ORETC TO CLEAN,23-31564,BL-1803D,BL-1803D,,,1-9-23 9:34 AM,2023-01-09T09:34:00.000Z,2-23-23 9:23 AM,2023-02-23T09:23:00.000Z,2-10-23 6:41 AM,2023-02-10T06:41:00.000Z,4,4,,PM,CLOSE,Y,,NO,CHATHAM,1292,"BLOWER, NYB, SERIES 30 GI, MODEL 854, DH, 88,000CFM, 11.4in wg, 735RPM,",,No,DRYER D,CH-DRYER_D_BLR,CH-DRYER_D_BLR:BL1803D.STAIND,BL-1803D,BL,STAIND,"Status indication (open/closed, run/stop)",Blower (asset),Equipment status,HOT WATER PRESSURE,,13,2023-02-10T03:00:00.000Z,2023-02-10T16:10:00.000Z,13.833333333333334,0.5763888888888888,Yes,No,No,No,No,No,No,No,1,1
1292,CLOSE MANYWAY,23-31565,BL-1803D,BL-1803D,,,1-9-23 9:35 AM,2023-01-09T09:35:00.000Z,2-23-23 9:23 AM,2023-02-23T09:23:00.000Z,2-10-23 6:41 AM,2023-02-10T06:41:00.000Z,4,4,,PM,CLOSE,Y,,NO,CHATHAM,1292,"BLOWER, NYB, SERIES 30 GI, MODEL 854, DH, 88,000CFM, 11.4in wg, 735RPM,",,No,DRYER D,CH-DRYER_D_BLR,CH-DRYER_D_BLR:BL1803D.STAIND,BL-1803D,BL,STAIND,"Status indication (open/closed, run/stop)",Blower (asset),Equipment status,HOT WATER PRESSURE,,13,2023-02-10T03:00:00.000Z,2023-02-10T16:10:00.000Z,13.833333333333334,0.5763888888888888,Yes,No,No,No,No,No,No,No,1,1
1293,BL-1804D HPW,23-31567,BL-1804D,BL-1804D,,OC-MECH,1-9-23 9:44 AM,2023-01-09T09:44:00.000Z,2-23-23 9:44 AM,2023-02-23T09:44:00.000Z,2-10-23 6:41 AM,2023-02-10T06:41:00.000Z,4,4,,PM,CLOSE,Y,,NO,CHATHAM,"1293, 6864","BLOWER, NYB, MODEL 714 SERIES 45, GENERAL INDUSTRIAL, CW/UB, Arrg't 8, MOTOR / 450HP / 1200RPM / TEFC / 2300V/3PH/60HZ / FR# 5808C",,No,DRYER D,CH-DRYER_D_BLR,CH-DRYER_D_BLR:BL1804D.STAIND,BL-1804D,BL,STAIND,"Status indication (open/closed, run/stop)",Blower (asset),Equipment status,CYCLONE INLET PRESSURE,,13,2023-02-10T03:00:00.000Z,2023-02-10T16:10:00.000Z,13.833333333333334,0.5763888888888888,Yes,No,No,No,No,No,No,No,1,1
1293,OPEN MANWAY,23-31568,BL-1804D,BL-1804D,,,1-9-23 9:46 AM,2023-01-09T09:46:00.000Z,2-23-23 9:44 AM,2023-02-23T09:44:00.000Z,2-10-23 6:41 AM,2023-02-10T06:41:00.000Z,4,4,,PM,CLOSE,Y,,NO,CHATHAM,"1293, 6864","BLOWER, NYB, MODEL 714 SERIES 45, GENERAL INDUSTRIAL, CW/UB, Arrg't 8, MOTOR / 450HP / 1200RPM / TEFC / 2300V/3PH/60HZ / FR# 5808C",,No,DRYER D,CH-DRYER_D_BLR,CH-DRYER_D_BLR:BL1804D.STAIND,BL-1804D,BL,STAIND,"Status indication (open/closed, run/stop)",Blower (asset),Equipment status,CYCLONE INLET PRESSURE,,13,2023-02-10T03:00:00.000Z,2023-02-10T16:10:00.000Z,13.833333333333334,0.5763888888888888,Yes,No,No,No,No,No,No,No,1,1
1293,HPW WASH BLOWER,23-31569,BL-1804D,BL-1804D,,,1-9-23 9:47 AM,2023-01-09T09:47:00.000Z,2-23-23 9:44 AM,2023-02-23T09:44:00.000Z,2-10-23 6:41 AM,2023-02-10T06:41:00.000Z,4,4,,PM,CLOSE,Y,,NO,CHATHAM,"1293, 6864","BLOWER, NYB, MODEL 714 SERIES 45, GENERAL INDUSTRIAL, CW/UB, Arrg't 8, MOTOR / 450HP / 1200RPM / TEFC / 2300V/3PH/60HZ / FR# 5808C",,No,DRYER D,CH-DRYER_D_BLR,CH-DRYER_D_BLR:BL1804D.STAIND,BL-1804D,BL,STAIND,"Status indication (open/closed, run/stop)",Blower (asset),Equipment status,CYCLONE INLET PRESSURE,,13,2023-02-10T03:00:00.000Z,2023-02-10T16:10:00.000Z,13.833333333333334,0.5763888888888888,Yes,No,No,No,No,No,No,No,1,1
1293,CLOSE MANWAY,23-31570,BL-1804D,BL-1804D,,,1-9-23 9:47 AM,2023-01-09T09:47:00.000Z,2-23-23 9:44 AM,2023-02-23T09:44:00.000Z,2-10-23 6:41 AM,2023-02-10T06:41:00.000Z,4,4,,PM,CLOSE,Y,,NO,CHATHAM,"1293, 6864","BLOWER, NYB, MODEL 714 SERIES 45, GENERAL INDUSTRIAL, CW/UB, Arrg't 8, MOTOR / 450HP / 1200RPM / TEFC / 2300V/3PH/60HZ / FR# 5808C",,No,DRYER D,CH-DRYER_D_BLR,CH-DRYER_D_BLR:BL1804D.STAIND,BL-1804D,BL,STAIND,"Status indication (open/closed, run/stop)",Blower (asset),Equipment status,CYCLONE INLET PRESSURE,,13,2023-02-10T03:00:00.000Z,2023-02-10T16:10:00.000Z,13.833333333333334,0.5763888888888888,Yes,No,No,No,No,No,No,No,1,1
,EMERGENCY/ EXIT LIGHT MONTHLY INSPECTION,23-31929,CHATHAM,CHATHAM,,,1-16-23 1:46 AM,2023-01-16T01:46:00.000Z,2-10-23 3:00 AM,2023-02-10T03:00:00.000Z,2-10-23 1:35 PM,2023-02-10T13:35:00.000Z,4,4,,PM,CLOSE,Y,,NO,CHATHAM,,,,,,,,,,,,,,,,13,2023-02-10T03:00:00.000Z,2023-02-10T16:10:00.000Z,13.833333333333334,0.5763888888888888,Yes,No,No,No,No,No,No,No,1,1
,EMERGENCY LIGHTING - PM SERVICE,23-31928,CHATHAM,CHATHAM,,,1-16-23 1:46 AM,2023-01-16T01:46:00.000Z,2-10-23 3:00 AM,2023-02-10T03:00:00.000Z,2-10-23 2:00 AM,2023-02-10T02:00:00.000Z,4,4,,PM,CLOSE,Y,N,NO,CHATHAM,,,,,,,,,,,,,,,,13,2023-02-10T03:00:00.000Z,2023-02-10T16:10:00.000Z,13.833333333333334,0.5763888888888888,No,No,No,No,No,No,No,Yes,3,1
7138,ACCULOAD SCULLY CABLE -PM SERVICE,23-31942,FQIC-2203,FQIC-2203,,,1-16-23 1:47 AM,2023-01-16T01:47:00.000Z,2-10-23 12:30 AM,2023-02-10T00:30:00.000Z,2-10-23 2:29 PM,2023-02-10T14:29:00.000Z,4,4,,PM,CLOSE,Y,N,NO,CHATHAM,,,,,,,,,,,,,,,,13,2023-02-10T03:00:00.000Z,2023-02-10T16:10:00.000Z,13.833333333333334,0.5763888888888888,Yes,No,No,No,No,No,No,No,1,1
7138,ACCULOAD SCULLY CABLE BI-WEEKLY PM,23-31943,FQIC-2203,FQIC-2203,,,1-16-23 1:47 AM,2023-01-16T01:47:00.000Z,2-10-23 12:30 AM,2023-02-10T00:30:00.000Z,2-10-23 2:29 PM,2023-02-10T14:29:00.000Z,4,4,,PM,CLOSE,Y,,NO,CHATHAM,,,,,,,,,,,,,,,,13,2023-02-10T03:00:00.000Z,2023-02-10T16:10:00.000Z,13.833333333333334,0.5763888888888888,Yes,No,No,No,No,No,No,No,1,1
7174,CONDUCTIVITY METER /PH PROBE CLEAN & CALIBRATE PM,23-31982,AE-84404,AE-84404,,,1-16-23 1:48 AM,2023-01-16T01:48:00.000Z,2-9-23 2:00 AM,2023-02-09T02:00:00.000Z,2-10-23 6:53 AM,2023-02-10T06:53:00.000Z,4,4,,PM,CLOSE,Y,,NO,CHATHAM,,,,,,,,,,,,,,,,13,2023-02-10T03:00:00.000Z,2023-02-10T16:10:00.000Z,13.833333333333334,0.5763888888888888,Yes,No,No,No,No,No,No,No,1,1
1227,PH PROBE CLEANING AND CALIBRATION WEEKLY PM,23-32008,AT-13519,AT-13519,,,1-16-23 1:48 AM,2023-01-16T01:48:00.000Z,2-9-23 1:00 AM,2023-02-09T01:00:00.000Z,2-10-23 6:53 AM,2023-02-10T06:53:00.000Z,4,4,,PM,CLOSE,Y,,NO,CHATHAM,,,,,,,,,,,,,,,,13,2023-02-10T03:00:00.000Z,2023-02-10T16:10:00.000Z,13.833333333333334,0.5763888888888888,Yes,No,No,No,No,No,No,No,1,1
1230,PH PROBE CLEANING AND CALIBRATION WEEKLY PM,23-32010,AT-14125,AT-14125,,,1-16-23 1:48 AM,2023-01-16T01:48:00.000Z,2-9-23 1:00 AM,2023-02-09T01:00:00.000Z,2-10-23 6:53 AM,2023-02-10T06:53:00.000Z,4,4,,PM,CLOSE,Y,,NO,CHATHAM,,,,,,,,,,,,,,,,13,2023-02-10T03:00:00.000Z,2023-02-10T16:10:00.000Z,13.833333333333334,0.5763888888888888,Yes,No,No,No,No,No,No,No,1,1
,MI-1201A - MECHANICAL PM,23-32026,MI-1201A,MI-1201A,,,1-16-23 1:49 AM,2023-01-16T01:49:00.000Z,2-9-23 1:00 AM,2023-02-09T01:00:00.000Z,2-10-23 4:11 PM,2023-02-10T16:11:00.000Z,4,4,,PM,CLOSE,Y,N,NO,CHATHAM,,,,,,,,,,,,,,,,13,2023-02-10T03:00:00.000Z,2023-02-10T16:10:00.000Z,13.833333333333334,0.5763888888888888,No,No,No,No,No,Yes,Yes,No,5,1
,MI-1201A - GREASE CHANGE OUT,23-32028,MI-1201A,MI-1201A,,,1-16-23 1:49 AM,2023-01-16T01:49:00.000Z,2-9-23 12:00 AM,2023-02-09T00:00:00.000Z,2-10-23 4:11 PM,2023-02-10T16:11:00.000Z,4,4,,PM,CLOSE,Y,,NO,CHATHAM,,,,,,,,,,,,,,,,13,2023-02-10T03:00:00.000Z,2023-02-10T16:10:00.000Z,13.833333333333334,0.5763888888888888,No,No,No,No,No,Yes,Yes,No,5,1
,Weekly Vibration check (GFE I/E),23-32029,MI-1201A,MI-1201A,,,1-16-23 1:49 AM,2023-01-16T01:49:00.000Z,2-9-23 12:00 AM,2023-02-09T00:00:00.000Z,2-10-23 4:11 PM,2023-02-10T16:11:00.000Z,4,4,,PM,CLOSE,Y,,NO,CHATHAM,,,,,,,,,,,,,,,,13,2023-02-10T03:00:00.000Z,2023-02-10T16:10:00.000Z,13.833333333333334,0.5763888888888888,No,No,No,No,No,Yes,Yes,No,5,1
,MI-1201A - WEEKLY PM & ROTATION CHANGE,23-32027,MI-1201A,MI-1201A,,,1-16-23 1:49 AM,2023-01-16T01:49:00.000Z,2-9-23 12:00 AM,2023-02-09T00:00:00.000Z,2-10-23 4:11 PM,2023-02-10T16:11:00.000Z,4,4,,PM,CLOSE,Y,,NO,CHATHAM,,,,,,,,,,,,,,,,13,2023-02-10T03:00:00.000Z,2023-02-10T16:10:00.000Z,13.833333333333334,0.5763888888888888,No,No,No,No,No,Yes,Yes,No,5,1
1431,CV-2104 (BN-2105 Cleanout Conveyor) has a bent paddle,23-32664,CV-2104,CV-2104,,,1-23-23 7:10 AM,2023-01-23T07:10:00.000Z,1-22-23 11:35 AM,2023-01-22T11:35:00.000Z,2-10-23 7:45 AM,2023-02-10T07:45:00.000Z,2,2,,CO,CLOSE,Y,,NO,CHATHAM,,,,,,,,,,,,,,,,13,2023-02-10T03:00:00.000Z,2023-02-10T16:10:00.000Z,13.833333333333334,0.5763888888888888,Yes,No,No,No,No,No,No,No,1,1
1293,DISMANTLE SCAFF 1804D NORTH,23-32696,BL-1804D,BL-1804D,,,1-24-23 9:13 AM,2023-01-24T09:13:00.000Z,2-23-23 9:44 AM,2023-02-23T09:44:00.000Z,2-10-23 6:41 AM,2023-02-10T06:41:00.000Z,4,4,,PM,CLOSE,Y,,NO,CHATHAM,"1293, 6864","BLOWER, NYB, MODEL 714 SERIES 45, GENERAL INDUSTRIAL, CW/UB, Arrg't 8, MOTOR / 450HP / 1200RPM / TEFC / 2300V/3PH/60HZ / FR# 5808C",,No,DRYER D,CH-DRYER_D_BLR,CH-DRYER_D_BLR:BL1804D.STAIND,BL-1804D,BL,STAIND,"Status indication (open/closed, run/stop)",Blower (asset),Equipment status,CYCLONE INLET PRESSURE,,13,2023-02-10T03:00:00.000Z,2023-02-10T16:10:00.000Z,13.833333333333334,0.5763888888888888,Yes,No,No,No,No,No,No,No,1,1
1293,BUILD SCAFF 1804D NORTH,23-32695,BL-1804D,BL-1804D,,,1-24-23 9:13 AM,2023-01-24T09:13:00.000Z,2-23-23 9:44 AM,2023-02-23T09:44:00.000Z,2-10-23 6:41 AM,2023-02-10T06:41:00.000Z,4,4,,PM,CLOSE,Y,,NO,CHATHAM,"1293, 6864","BLOWER, NYB, MODEL 714 SERIES 45, GENERAL INDUSTRIAL, CW/UB, Arrg't 8, MOTOR / 450HP / 1200RPM / TEFC / 2300V/3PH/60HZ / FR# 5808C",,No,DRYER D,CH-DRYER_D_BLR,CH-DRYER_D_BLR:BL1804D.STAIND,BL-1804D,BL,STAIND,"Status indication (open/closed, run/stop)",Blower (asset),Equipment status,CYCLONE INLET PRESSURE,,13,2023-02-10T03:00:00.000Z,2023-02-10T16:10:00.000Z,13.833333333333334,0.5763888888888888,Yes,No,No,No,No,No,No,No,1,1
1293,BUILD SCAFF 1804D SOUTH,23-32697,BL-1804D,BL-1804D,,,1-24-23 9:15 AM,2023-01-24T09:15:00.000Z,2-23-23 9:44 AM,2023-02-23T09:44:00.000Z,2-10-23 6:41 AM,2023-02-10T06:41:00.000Z,4,4,,PM,CLOSE,Y,,NO,CHATHAM,"1293, 6864","BLOWER, NYB, MODEL 714 SERIES 45, GENERAL INDUSTRIAL, CW/UB, Arrg't 8, MOTOR / 450HP / 1200RPM / TEFC / 2300V/3PH/60HZ / FR# 5808C",,No,DRYER D,CH-DRYER_D_BLR,CH-DRYER_D_BLR:BL1804D.STAIND,BL-1804D,BL,STAIND,"Status indication (open/closed, run/stop)",Blower (asset),Equipment status,CYCLONE INLET PRESSURE,,13,2023-02-10T03:00:00.000Z,2023-02-10T16:10:00.000Z,13.833333333333334,0.5763888888888888,Yes,No,No,No,No,No,No,No,1,1
1293,DISMANTLE SCAFF 1804D SOUTH,23-32698,BL-1804D,BL-1804D,,,1-24-23 9:16 AM,2023-01-24T09:16:00.000Z,2-23-23 9:44 AM,2023-02-23T09:44:00.000Z,2-10-23 6:41 AM,2023-02-10T06:41:00.000Z,4,4,,PM,CLOSE,Y,,NO,CHATHAM,"1293, 6864","BLOWER, NYB, MODEL 714 SERIES 45, GENERAL INDUSTRIAL, CW/UB, Arrg't 8, MOTOR / 450HP / 1200RPM / TEFC / 2300V/3PH/60HZ / FR# 5808C",,No,DRYER D,CH-DRYER_D_BLR,CH-DRYER_D_BLR:BL1804D.STAIND,BL-1804D,BL,STAIND,"Status indication (open/closed, run/stop)",Blower (asset),Equipment status,CYCLONE INLET PRESSURE,,13,2023-02-10T03:00:00.000Z,2023-02-10T16:10:00.000Z,13.833333333333334,0.5763888888888888,Yes,No,No,No,No,No,No,No,1,1
1092,Change out motor P1562A,23-32757,P-1562A,P-1562A,,,1-25-23 9:03 AM,2023-01-25T09:03:00.000Z,2-10-23 9:32 AM,2023-02-10T09:32:00.000Z,2-10-23 2:30 PM,2023-02-10T14:30:00.000Z,4,4,,CO,CLOSE,Y,,NO,CHATHAM,,,,,,,,,,,,,,,,13,2023-02-10T03:00:00.000Z,2023-02-10T16:10:00.000Z,13.833333333333334,0.5763888888888888,Yes,No,No,No,No,No,No,No,1,1
1431,CV-2104 (BN-2105 Cleanout Conveyor) has a bent paddle,23-32776,CV-2104,CV-2104,,,1-25-23 4:41 PM,2023-01-25T16:41:00.000Z,,,2-10-23 7:45 AM,2023-02-10T07:45:00.000Z,2,2,,CO,CLOSE,Y,,NO,CHATHAM,,,,,,,,,,,,,,,,13,2023-02-10T03:00:00.000Z,2023-02-10T16:10:00.000Z,13.833333333333334,0.5763888888888888,Yes,No,No,No,No,No,No,No,1,1
,Inspection of CE-1712 failed bowl at Sandrin,23-32823,,,,,1-27-23 3:45 PM,2023-01-27T15:45:00.000Z,2-3-23 3:46 PM,2023-02-03T15:46:00.000Z,2-10-23 4:12 PM,2023-02-10T16:12:00.000Z,4,4,,CO,CLOSE,Y,,NO,CHATHAM,,,,,,,,,,,,,,,,13,2023-02-10T03:00:00.000Z,2023-02-10T16:10:00.000Z,13.833333333333334,0.5763888888888888,No,No,No,No,No,Yes,Yes,No,5,1
1103,Change out motor,23-33057,P-6562B,P-6562B,,,1-30-23 12:52 PM,2023-01-30T12:52:00.000Z,2-10-23 12:52 PM,2023-02-10T12:52:00.000Z,2-10-23 2:30 PM,2023-02-10T14:30:00.000Z,4,4,,CO,CLOSE,Y,,NO,CHATHAM,,,,,,,,,,,,,,,,13,2023-02-10T03:00:00.000Z,2023-02-10T16:10:00.000Z,13.833333333333334,0.5763888888888888,Yes,No,No,No,No,No,No,No,1,1
,HPW CV-1720 before Dryer D placed back in service,23-33094,CV-1720,CV-1720,,,1-31-23 12:52 PM,2023-01-31T12:52:00.000Z,2-17-23 9:05 AM,2023-02-17T09:05:00.000Z,2-10-23 6:41 AM,2023-02-10T06:41:00.000Z,4,4,,CO,CLOSE,Y,,NO,CHATHAM,,,,,,,,,,,,,,,,13,2023-02-10T03:00:00.000Z,2023-02-10T16:10:00.000Z,13.833333333333334,0.5763888888888888,Yes,No,No,No,No,No,No,No,1,1
1292,"BL-1803D replace latches on inspection door, 2nd level",23-33160,BL-1803D,BL-1803D,,,1-31-23 2:20 PM,2023-01-31T14:20:00.000Z,10-31-22 11:40 AM,2022-10-31T11:40:00.000Z,2-10-23 1:32 PM,2023-02-10T13:32:00.000Z,4,4,,SD,CLOSE,Y,,NO,CHATHAM,1292,"BLOWER, NYB, SERIES 30 GI, MODEL 854, DH, 88,000CFM, 11.4in wg, 735RPM,",,No,DRYER D,CH-DRYER_D_BLR,CH-DRYER_D_BLR:BL1803D.STAIND,BL-1803D,BL,STAIND,"Status indication (open/closed, run/stop)",Blower (asset),Equipment status,HOT WATER PRESSURE,,13,2023-02-10T03:00:00.000Z,2023-02-10T16:10:00.000Z,13.833333333333334,0.5763888888888888,Yes,No,No,No,No,No,No,No,1,1
3569,Pressure wash DryerD mixer - filled with mold DR0,23-33161,MX-1801D,MX-1801D,,,1-31-23 2:24 PM,2023-01-31T14:24:00.000Z,2-23-23 7:48 AM,2023-02-23T07:48:00.000Z,2-10-23 6:45 AM,2023-02-10T06:45:00.000Z,4,4,,CO,CLOSE,Y,,NO,CHATHAM,3569,DRYER D WET CAKE MIXER (MCC-3806),,No,DRYER D,CH-DRYER_D,CH-DRYER_D:MX1801D.STAIND,MX-1801D,MX,STAIND,"Status indication (open/closed, run/stop)",Mixer (asset),Equipment status,DRUM DR1826 MOTOR D AMPERAGE,DR-1826,13,2023-02-10T03:00:00.000Z,2023-02-10T16:10:00.000Z,13.833333333333334,0.5763888888888888,Yes,No,No,No,No,No,No,No,1,1
,"Rebuild Spare Thrust Roller for Dryer \"A\"",23-33163,DR-1826,DR-1826,,,1-31-23 2:49 PM,2023-01-31T14:49:00.000Z,,,2-10-23 7:49 AM,2023-02-10T07:49:00.000Z,4,4,,CO,CLOSE,Y,,NO,CHATHAM,"2541, 2542, 2543, 2544, 2545, 2547, 2549, 2550, 2552, 2553, 2554, 2555, 2556, 2557, 2558, 2559","SWISS COMBI ROTARY DRYER DRUM, SEW GEARBOX - LEFT HAND DRIVE -, SEW GEARBOX - LEFT HAND DRIVE, SEW GEARBOX - RIGHT HAND DRIVE, SEW GEARBOX - RIGHT HAND DRIVE, MOTOR / 25HP / 1800RPM / TEFC / 575V/3PH/60HZ / FRAME# 284TC, MOTOR / 25HP / 1800RPM / TEFC / 575V/3PH/60HZ / FRAME# 284TC, MOTOR / 25HP / 1800RPM / TEFC / 575V/3PH/60HZ / FRAME# 284TC, MOTOR / 25HP / 1800RPM / TEFC / 575V/3PH/60HZ / FRAME# 284TC, TRUNNION (A) - LEFT HAND DRIVE, TRUNNION (B)- RIGHT HAND DRIVE, TRUNNION (D) - LEFT HAND DRIVE, TRUNNION (C) - RIGHT HAND DRIVE, THRUST ROLLER ASSEMBLY, THRUST ROLLER ASSEMBLY, TRUNNION LUBRICATION SYSTEM",,No,DRYER A,CH-DRA_CYCLNS,CH-DRA_CYCLNS:TT18168B.MEAS,TT-18168B,TT,MEAS,Measured value (PV),Temperature transmitter,Measurement,DRUM DR1826 MOTOR A AMPERAGE,DR-1826,13,2023-02-10T03:00:00.000Z,2023-02-10T16:10:00.000Z,13.833333333333334,0.5763888888888888,Yes,No,No,No,No,No,No,No,1,1
5000,Add and remove blank to main stack from dryer A,23-33172,ST-1801D,ST-1801D,,,2-1-23 7:28 AM,2023-02-01T07:28:00.000Z,2-10-23 1:45 PM,2023-02-10T13:45:00.000Z,2-10-23 1:31 PM,2023-02-10T13:31:00.000Z,4,4,,CO,CLOSE,Y,,NO,CHATHAM,5000,"STACK, FENCO, 250' SELF SUPPORTING,",,No,TGF,,,,,,,,,,,13,2023-02-10T03:00:00.000Z,2023-02-10T16:10:00.000Z,13.833333333333334,0.5763888888888888,Yes,No,No,No,No,No,No,No,1,1
,Mill C Wiring,23-33199,,,,,2-2-23 10:20 AM,2023-02-02T10:20:00.000Z,2-17-23 10:20 AM,2023-02-17T10:20:00.000Z,2-10-23 10:50 AM,2023-02-10T10:50:00.000Z,4,4,,CO,CLOSE,Y,,NO,CHATHAM,,,,,,,,,,,,,,,,13,2023-02-10T03:00:00.000Z,2023-02-10T16:10:00.000Z,13.833333333333334,0.5763888888888888,Yes,No,No,No,No,No,No,No,1,1
2559,BUILD TEST EJECTOR SYSTEM TO TROUBLESHOOT DRYER A SYSTEM FAULT,23-33205,DR-1826,DR-1826,,,2-2-23 10:38 AM,2023-02-02T10:38:00.000Z,2-17-23 5:30 PM,2023-02-17T17:30:00.000Z,2-10-23 4:14 PM,2023-02-10T16:14:00.000Z,4,4,,CO,CLOSE,Y,,NO,CHATHAM,"2541, 2542, 2543, 2544, 2545, 2547, 2549, 2550, 2552, 2553, 2554, 2555, 2556, 2557, 2558, 2559","SWISS COMBI ROTARY DRYER DRUM, SEW GEARBOX - LEFT HAND DRIVE -, SEW GEARBOX - LEFT HAND DRIVE, SEW GEARBOX - RIGHT HAND DRIVE, SEW GEARBOX - RIGHT HAND DRIVE, MOTOR / 25HP / 1800RPM / TEFC / 575V/3PH/60HZ / FRAME# 284TC, MOTOR / 25HP / 1800RPM / TEFC / 575V/3PH/60HZ / FRAME# 284TC, MOTOR / 25HP / 1800RPM / TEFC / 575V/3PH/60HZ / FRAME# 284TC, MOTOR / 25HP / 1800RPM / TEFC / 575V/3PH/60HZ / FRAME# 284TC, TRUNNION (A) - LEFT HAND DRIVE, TRUNNION (B)- RIGHT HAND DRIVE, TRUNNION (D) - LEFT HAND DRIVE, TRUNNION (C) - RIGHT HAND DRIVE, THRUST ROLLER ASSEMBLY, THRUST ROLLER ASSEMBLY, TRUNNION LUBRICATION SYSTEM",,No,DRYER A,CH-DRA_CYCLNS,CH-DRA_CYCLNS:TT18168B.MEAS,TT-18168B,TT,MEAS,Measured value (PV),Temperature transmitter,Measurement,DRUM DR1826 MOTOR A AMPERAGE,DR-1826,13,2023-02-10T03:00:00.000Z,2023-02-10T16:10:00.000Z,13.833333333333334,0.5763888888888888,No,No,No,No,No,Yes,Yes,No,5,1
,Utility Water outside of North West Mash Building Door Leak,23-33656,1300,1300,,,2-7-23 8:16 AM,2023-02-07T08:16:00.000Z,2-17-23 3:22 AM,2023-02-17T03:22:00.000Z,2-10-23 4:14 PM,2023-02-10T16:14:00.000Z,4,4,,CO,CLOSE,Y,,NO,CHATHAM,,,,,,,,,,,,,,,,13,2023-02-10T03:00:00.000Z,2023-02-10T16:10:00.000Z,13.833333333333334,0.5763888888888888,No,No,No,No,No,Yes,Yes,No,5,1
,Forklift needed to load waste alcohol totes,23-33685,MAINTENANCE,MAINTENANCE,,,2-9-23 7:09 AM,2023-02-09T07:09:00.000Z,2-8-23 3:14 PM,2023-02-08T15:14:00.000Z,2-10-23 4:12 PM,2023-02-10T16:12:00.000Z,4,4,,CO,CLOSE,Y,,NO,CHATHAM,,,,,,,,,,,,,,,,13,2023-02-10T03:00:00.000Z,2023-02-10T16:10:00.000Z,13.833333333333334,0.5763888888888888,No,No,No,Yes,No,Yes,Yes,No,4,1
1297,Repair BL 2501B,23-33686,BL-2501B,BL-2501B,,,2-9-23 7:25 AM,2023-02-09T07:25:00.000Z,2-22-23 9:34 PM,2023-02-22T21:34:00.000Z,2-8-23 11:04 PM,2023-02-08T23:04:00.000Z,4,4,,CO,CLOSE,Y,,NO,CHATHAM,,,,,,,,,,,,,,,,13,2023-02-10T03:00:00.000Z,2023-02-10T16:10:00.000Z,13.833333333333334,0.5763888888888888,No,No,No,Yes,No,No,No,No,4,1
,REMOVE INSULATION BLANKETS ON ALL AREAS,23-33687,3400-26K-01,3400-26K-01,,,2-9-23 7:41 AM,2023-02-09T07:41:00.000Z,5-12-23 4:50 PM,2023-05-12T16:50:00.000Z,5-25-23 10:30 AM,2023-05-25T10:30:00.000Z,4,4,,SD,CLOSE,Y,,NO,CHATHAM,,,,,,,,,,,,,,,,13,2023-02-10T03:00:00.000Z,2023-02-10T16:10:00.000Z,13.833333333333334,0.5763888888888888,No,No,No,Yes,No,No,No,No,4,1
,RE-INSTALL INSUALTION ON ALL VALVES,23-33695,3400-26K-01,3400-26K-01,,,2-9-23 7:57 AM,2023-02-09T07:57:00.000Z,5-12-23 4:50 PM,2023-05-12T16:50:00.000Z,2-12-24 11:18 AM,2024-02-12T11:18:00.000Z,4,4,,SD,CLOSE,Y,,NO,CHATHAM,,,,,,,,,,,,,,,,13,2023-02-10T03:00:00.000Z,2023-02-10T16:10:00.000Z,13.833333333333334,0.5763888888888888,No,No,No,Yes,No,No,No,No,4,1
6756,REPAIR WASHED OUT PIPE WALL INSIDE OF REDUCER,23-33696,FV-15426,FV-15426,,,2-9-23 8:12 AM,2023-02-09T08:12:00.000Z,4-29-23 4:02 PM,2023-04-29T16:02:00.000Z,4-28-23 6:14 AM,2023-04-28T06:14:00.000Z,4,4,,SD,CLOSE,Y,,NO,CHATHAM,,,,,,,,,,,,,,,,13,2023-02-10T03:00:00.000Z,2023-02-10T16:10:00.000Z,13.833333333333334,0.5763888888888888,No,No,No,Yes,No,No,No,No,4,1
,"2\" utility water line North of Dryer D in the pipe rack gong to Alcohol Loading has 3 split valves.",23-33700,1800,1800,,,2-9-23 8:23 AM,2023-02-09T08:23:00.000Z,2-9-23 9:00 AM,2023-02-09T09:00:00.000Z,2-9-23 8:05 AM,2023-02-09T08:05:00.000Z,1,1,,RM,CLOSE,Y,,NO,CHATHAM,,,,,,,,,,,,,,,,13,2023-02-10T03:00:00.000Z,2023-02-10T16:10:00.000Z,13.833333333333334,0.5763888888888888,No,No,No,Yes,No,No,No,No,4,1
1453,DISMANTLE SCAFF,23-33704,DA-3602,DA-3602,,,2-9-23 8:41 AM,2023-02-09T08:41:00.000Z,4-17-23 12:01 PM,2023-04-17T12:01:00.000Z,5-2-23 9:14 AM,2023-05-02T09:14:00.000Z,4,4,,SD,CLOSE,Y,,NO,CHATHAM,,,,,,,,,,,,,,,,13,2023-02-10T03:00:00.000Z,2023-02-10T16:10:00.000Z,13.833333333333334,0.5763888888888888,No,No,No,Yes,No,No,No,No,4,1
1453,BUILD SCAFF TO ACCESS VAC BREAKER,23-33701,DA-3602,DA-3602,,,2-9-23 8:41 AM,2023-02-09T08:41:00.000Z,4-17-23 12:01 PM,2023-04-17T12:01:00.000Z,5-2-23 9:14 AM,2023-05-02T09:14:00.000Z,4,4,,SD,CLOSE,Y,,NO,CHATHAM,,,,,,,,,,,,,,,,13,2023-02-10T03:00:00.000Z,2023-02-10T16:10:00.000Z,13.833333333333334,0.5763888888888888,No,No,No,Yes,No,No,No,No,4,1
1453,REMOVE VAC BREAKER,23-33702,DA-3602,DA-3602,,,2-9-23 8:41 AM,2023-02-09T08:41:00.000Z,4-17-23 12:01 PM,2023-04-17T12:01:00.000Z,5-2-23 9:14 AM,2023-05-02T09:14:00.000Z,4,4,,SD,CLOSE,Y,,NO,CHATHAM,,,,,,,,,,,,,,,,13,2023-02-10T03:00:00.000Z,2023-02-10T16:10:00.000Z,13.833333333333334,0.5763888888888888,No,No,No,Yes,No,No,No,No,4,1
1453,RE-INSTALL VAC BREAKER,23-33703,DA-3602,DA-3602,,,2-9-23 8:41 AM,2023-02-09T08:41:00.000Z,4-17-23 12:01 PM,2023-04-17T12:01:00.000Z,5-2-23 9:14 AM,2023-05-02T09:14:00.000Z,4,4,,SD,CLOSE,Y,,NO,CHATHAM,,,,,,,,,,,,,,,,13,2023-02-10T03:00:00.000Z,2023-02-10T16:10:00.000Z,13.833333333333334,0.5763888888888888,No,No,No,Yes,No,No,No,No,4,1
6669,Sticking exhaust valves on Air Dryer A,23-33707,K-3301A,K-3301A,,,2-9-23 10:37 AM,2023-02-09T10:37:00.000Z,2-22-23 8:06 AM,2023-02-22T08:06:00.000Z,2-14-23 8:18 AM,2023-02-14T08:18:00.000Z,4,4,,CO,CLOSE,Y,,NO,CHATHAM,,,,,,,,,,,,,,,,13,2023-02-10T03:00:00.000Z,2023-02-10T16:10:00.000Z,13.833333333333334,0.5763888888888888,No,No,No,Yes,No,No,No,No,4,1
6670,Sticking exhaust valves on Air Dryer B,23-33708,K-3301B,K-3301B,,,2-9-23 10:50 AM,2023-02-09T10:50:00.000Z,2-22-23 7:53 AM,2023-02-22T07:53:00.000Z,2-15-23 8:12 AM,2023-02-15T08:12:00.000Z,4,4,,CO,CLOSE,Y,,NO,CHATHAM,,,,,,,,,,,,,,,,13,2023-02-10T03:00:00.000Z,2023-02-10T16:10:00.000Z,13.833333333333334,0.5763888888888888,No,No,No,Yes,No,No,No,No,4,1
1314,Admin building ltg Upgrades,23-33709,BU-ADMIN,BU-ADMIN,,,2-9-23 11:07 AM,2023-02-09T11:07:00.000Z,2-28-23 11:07 AM,2023-02-28T11:07:00.000Z,2-23-23 11:37 AM,2023-02-23T11:37:00.000Z,4,4,,CO,CLOSE,Y,,NO,CHATHAM,,,,,,,,,,,,,,,,13,2023-02-10T03:00:00.000Z,2023-02-10T16:10:00.000Z,13.833333333333334,0.5763888888888888,No,No,No,Yes,No,No,No,No,4,1
1161,P6586B Rebuild Ra 1048,23-33710,P-6586B,P-6586B,,,2-9-23 11:19 AM,2023-02-09T11:19:00.000Z,2-24-23 3:38 PM,2023-02-24T15:38:00.000Z,2-22-23 11:38 PM,2023-02-22T23:38:00.000Z,4,4,,CO,CLOSE,Y,,NO,CHATHAM,,,,,,,,,,,,,,,,13,2023-02-10T03:00:00.000Z,2023-02-10T16:10:00.000Z,13.833333333333334,0.5763888888888888,No,No,No,Yes,No,No,No,No,4,1
1161,"P6586B Rebuild 1.75\" AST 70 seal",23-33711,P-6586B,P-6586B,,,2-9-23 11:33 AM,2023-02-09T11:33:00.000Z,2-24-23 8:37 AM,2023-02-24T08:37:00.000Z,2-22-23 11:37 AM,2023-02-22T11:37:00.000Z,4,4,,CO,CLOSE,Y,,NO,CHATHAM,,,,,,,,,,,,,,,,13,2023-02-10T03:00:00.000Z,2023-02-10T16:10:00.000Z,13.833333333333334,0.5763888888888888,No,No,No,Yes,No,No,No,No,4,1
2566,**Next Dryer A Outage** Steve M install NO CR171,23-33713,H-1825,H-1825,,,2-9-23 11:42 AM,2023-02-09T11:42:00.000Z,2-23-23 3:04 PM,2023-02-23T15:04:00.000Z,2-10-23 10:14 AM,2023-02-10T10:14:00.000Z,4,4,,CO,CLOSE,Y,,NO,CHATHAM,"2565, 2566","BURNER, COMENCO, MODEL PAH-1285-56.0-KZI, THERMAL OXIDIZER, BURNER VALVE TRAIN (H-1825)",,No,DRYER A,CH-DRYER_A,CH-DRYER_A:SI18153B.MEAS,SI-18153B,SI,MEAS,Measured value (PV),Speed indication (feedback),Measurement,H1825 EXCESS O2 SENSOR 1,H-1825,13,2023-02-10T03:00:00.000Z,2023-02-10T16:10:00.000Z,13.833333333333334,0.5763888888888888,Yes,No,No,Yes,No,No,No,No,4,1
1117,Assess heat trace panel capacity at TGF condenser,23-33714,P-1844,P-1844,,,2-9-23 11:46 AM,2023-02-09T11:46:00.000Z,2-24-23 8:19 AM,2023-02-24T08:19:00.000Z,2-13-23 8:49 AM,2023-02-13T08:49:00.000Z,4,4,,CO,CLOSE,Y,,NO,CHATHAM,1117,GOULDS PUMP 3196 MTi,,No,DRYER A,,,,,,,,,,,13,2023-02-10T03:00:00.000Z,2023-02-10T16:10:00.000Z,13.833333333333334,0.5763888888888888,No,No,No,Yes,No,No,No,No,4,1
1117,Check for available spares at junction boxes and DCS I/O availability,23-33715,P-1844,P-1844,,,2-9-23 11:48 AM,2023-02-09T11:48:00.000Z,2-24-23 8:38 AM,2023-02-24T08:38:00.000Z,2-13-23 9:08 AM,2023-02-13T09:08:00.000Z,4,4,,CO,CLOSE,Y,,NO,CHATHAM,1117,GOULDS PUMP 3196 MTi,,No,DRYER A,,,,,,,,,,,13,2023-02-10T03:00:00.000Z,2023-02-10T16:10:00.000Z,13.833333333333334,0.5763888888888888,No,No,No,Yes,No,No,No,No,4,1
1117,Assess heat trace panel capacity at TGF condenser,23-33716,P-1844,P-1844,,,2-9-23 12:51 PM,2023-02-09T12:51:00.000Z,2-24-23 8:19 AM,2023-02-24T08:19:00.000Z,2-9-23 12:52 PM,2023-02-09T12:52:00.000Z,4,4,,CO,CLOSE,Y,,NO,CHATHAM,1117,GOULDS PUMP 3196 MTi,,No,DRYER A,,,,,,,,,,,13,2023-02-10T03:00:00.000Z,2023-02-10T16:10:00.000Z,13.833333333333334,0.5763888888888888,No,No,No,Yes,No,No,No,No,4,1
6645,PVSV-23306 - Recommended for Servicing,23-33718,PVRV-23306,PVRV-23306,,,2-9-23 1:08 PM,2023-02-09T13:08:00.000Z,,,5-2-23 10:31 AM,2023-05-02T10:31:00.000Z,4,4,,SD,CLOSE,Y,,NO,CHATHAM,,,,,,,,,,,,,,,,13,2023-02-10T03:00:00.000Z,2023-02-10T16:10:00.000Z,13.833333333333334,0.5763888888888888,No,No,No,Yes,No,No,No,No,4,1
,PVSV-23207 - Recommended for Servicing,23-33719,PVRV-23207,PVRV-23207,,,2-9-23 1:09 PM,2023-02-09T13:09:00.000Z,,,2-17-23 10:07 AM,2023-02-17T10:07:00.000Z,4,4,,SD,CLOSE,Y,,NO,CHATHAM,,,,,,,,,,,,,,,,13,2023-02-10T03:00:00.000Z,2023-02-10T16:10:00.000Z,13.833333333333334,0.5763888888888888,No,No,No,Yes,No,No,No,No,4,1
,PVSV-23209 - Recommended for Servicing,23-33720,PVRV-23209,PVRV-23209,,,2-9-23 1:10 PM,2023-02-09T13:10:00.000Z,,,2-17-23 10:08 AM,2023-02-17T10:08:00.000Z,4,4,,SD,CLOSE,Y,,NO,CHATHAM,,,,,,,,,,,,,,,,13,2023-02-10T03:00:00.000Z,2023-02-10T16:10:00.000Z,13.833333333333334,0.5763888888888888,No,No,No,Yes,No,No,No,No,4,1
,CV-1719 Modifications for Clean Out,23-33725,CV-1719,CV-1719,In dryer weekly meeting on 8/17/23 it was decided that this solution was not the proper one and an alternative way to prevent the need to CV-1719 to have carryover when the wet loadout was down was needed.  A new design needs to be created and presented for the capital business case cycle.  - Mike J,,2-9-23 3:47 PM,2023-02-09T15:47:00.000Z,3-17-23 10:15 AM,2023-03-17T10:15:00.000Z,,,4,4,,EC,CAN,Y,,NO,CHATHAM,,,,,,,,,,,,,,,,13,2023-02-10T03:00:00.000Z,2023-02-10T16:10:00.000Z,13.833333333333334,0.5763888888888888,No,No,No,Yes,No,No,No,No,4,1
6389,Inlet conductivity probe is not working,23-33726,WS-3502B,WS-3502B,,,2-9-23 3:57 PM,2023-02-09T15:57:00.000Z,2-25-23 3:28 PM,2023-02-25T15:28:00.000Z,2-14-23 4:29 PM,2023-02-14T16:29:00.000Z,4,4,,RM,CLOSE,Y,,NO,CHATHAM,,,,,,,,,,,,,,,,13,2023-02-10T03:00:00.000Z,2023-02-10T16:10:00.000Z,13.833333333333334,0.5763888888888888,No,No,No,Yes,No,No,No,No,4,1
2621,Fuel to Fuel Storage Tank / Off-spec Tank,23-33735,HV-22105,HV-22105,,,2-10-23 7:15 AM,2023-02-10T07:15:00.000Z,2-11-23 1:00 AM,2023-02-11T01:00:00.000Z,2-10-23 2:00 AM,2023-02-10T02:00:00.000Z,2,2,,CO,CLOSE,Y,,NO,CHATHAM,,,,,,,,,,,,,,,,13,2023-02-10T03:00:00.000Z,2023-02-10T16:10:00.000Z,13.833333333333334,0.5763888888888888,No,No,No,No,Yes,No,No,Yes,3,1
1456,Stuck air pulser on DC-1802,23-33758,DC-1802,DC-1802,,,2-10-23 9:07 AM,2023-02-10T09:07:00.000Z,2-10-23 12:00 PM,2023-02-10T12:00:00.000Z,2-10-23 11:00 AM,2023-02-10T11:00:00.000Z,1,1,,CO,CLOSE,Y,,NO,CHATHAM,1456,DDGS COOLING BAG HOUSE DUST COLLECTOR,,No,DDG,,,,,,,,,,,13,2023-02-10T03:00:00.000Z,2023-02-10T16:10:00.000Z,13.833333333333334,0.5763888888888888,Yes,No,No,No,Yes,No,No,No,1,1
,Wire CR171 NO @BMS panel,23-33766,,,,,2-10-23 10:14 AM,2023-02-10T10:14:00.000Z,2-28-23 10:14 AM,2023-02-28T10:14:00.000Z,2-10-23 11:00 AM,2023-02-10T11:00:00.000Z,4,4,,CO,CLOSE,Y,,NO,CHATHAM,,,,,,,,,,,,,,,,13,2023-02-10T03:00:00.000Z,2023-02-10T16:10:00.000Z,13.833333333333334,0.5763888888888888,Yes,No,No,No,Yes,No,No,No,1,1
2537,"DC-1834 \"D\" blast puck leaking air.",23-33768,DC-1834,DC-1834,,,2-10-23 10:24 AM,2023-02-10T10:24:00.000Z,2-10-23 11:30 AM,2023-02-10T11:30:00.000Z,2-10-23 9:00 AM,2023-02-10T09:00:00.000Z,2,2,,CO,CLOSE,Y,,NO,CHATHAM,"2538, 2539, 6996","FIKE FLAMELESS VENT - E34-004-3636, FIKE FLAMELESS VENT - E34-004-3636, DUST COLLECTOR, IMF, MODEL XXX",6996,Yes,DRYER A,,,,,,,,,,,13,2023-02-10T03:00:00.000Z,2023-02-10T16:10:00.000Z,13.833333333333334,0.5763888888888888,Yes,No,No,No,Yes,No,No,No,1,1
1290,BL1802 Motor running high amps,23-33712,BL-1802,BL-1802,,,2-9-23 11:38 AM,2023-02-09T11:38:00.000Z,2-11-23 7:41 AM,2023-02-11T07:41:00.000Z,2-10-23 7:30 PM,2023-02-10T19:30:00.000Z,4,4,,CO,CLOSE,Y,,NO,CHATHAM,"1290, 7029","BLOWER, IAP, MODEL XRT SIZE 445, CW/UB, Arrg't 12, 250HP / 1785RPM / TEFC / 575V/3PH/60HZ / 504/5T FRAME",,No,DRYER D,,,,,,,,,,,18,2023-02-10T18:50:00.000Z,2023-02-10T19:50:00.000Z,91.66666666666667,3.8194444444444446,Yes,No,No,No,No,No,No,No,1,1
5528,BUILD SCAFF TO SNAKE TIE POINTS,23-33727,TK-6606,TK-6606,,,2-10-23 6:36 AM,2023-02-10T06:36:00.000Z,4-23-23 12:00 AM,2023-04-23T00:00:00.000Z,5-16-23 3:17 PM,2023-05-16T15:17:00.000Z,4,4,,PM,CLOSE,Y,,NO,CHATHAM,,,,,,,,,,,,,,,,18,2023-02-10T18:50:00.000Z,2023-02-10T19:50:00.000Z,91.66666666666667,3.8194444444444446,No,No,No,Yes,No,No,No,No,4,1
5528,DISMANTLE SCAFF,23-33728,TK-6606,TK-6606,,,2-10-23 6:37 AM,2023-02-10T06:37:00.000Z,4-23-23 12:00 AM,2023-04-23T00:00:00.000Z,5-16-23 3:17 PM,2023-05-16T15:17:00.000Z,4,4,,PM,CLOSE,Y,,NO,CHATHAM,,,,,,,,,,,,,,,,18,2023-02-10T18:50:00.000Z,2023-02-10T19:50:00.000Z,91.66666666666667,3.8194444444444446,No,No,No,Yes,No,No,No,No,4,1
5528,POST-CLEAN LINES AFTER S/D,23-33729,TK-6606,TK-6606,,,2-10-23 6:39 AM,2023-02-10T06:39:00.000Z,4-23-23 12:00 AM,2023-04-23T00:00:00.000Z,5-16-23 3:17 PM,2023-05-16T15:17:00.000Z,4,4,,PM,CLOSE,Y,,NO,CHATHAM,,,,,,,,,,,,,,,,18,2023-02-10T18:50:00.000Z,2023-02-10T19:50:00.000Z,91.66666666666667,3.8194444444444446,No,No,No,Yes,No,No,No,No,4,1
5529,BUILD SCAFF TO SNAKE TIE POINTS,23-33730,TK-6607,TK-6607,,,2-10-23 6:43 AM,2023-02-10T06:43:00.000Z,4-23-23 12:00 AM,2023-04-23T00:00:00.000Z,5-16-23 3:16 PM,2023-05-16T15:16:00.000Z,4,4,,PM,CLOSE,Y,,NO,CHATHAM,,,,,,,,,,,,,,,,18,2023-02-10T18:50:00.000Z,2023-02-10T19:50:00.000Z,91.66666666666667,3.8194444444444446,No,No,No,Yes,No,No,No,No,4,1
5529,POST-CLEAN LINES AFTER S/D,23-33731,TK-6607,TK-6607,,,2-10-23 6:43 AM,2023-02-10T06:43:00.000Z,4-23-23 12:00 AM,2023-04-23T00:00:00.000Z,5-16-23 3:16 PM,2023-05-16T15:16:00.000Z,4,4,,PM,CLOSE,Y,,NO,CHATHAM,,,,,,,,,,,,,,,,18,2023-02-10T18:50:00.000Z,2023-02-10T19:50:00.000Z,91.66666666666667,3.8194444444444446,No,No,No,Yes,No,No,No,No,4,1
5529,DISMANTLE SCAFF,23-33732,TK-6607,TK-6607,,,2-10-23 6:44 AM,2023-02-10T06:44:00.000Z,4-23-23 12:00 AM,2023-04-23T00:00:00.000Z,5-16-23 3:16 PM,2023-05-16T15:16:00.000Z,4,4,,PM,CLOSE,Y,,NO,CHATHAM,,,,,,,,,,,,,,,,18,2023-02-10T18:50:00.000Z,2023-02-10T19:50:00.000Z,91.66666666666667,3.8194444444444446,No,No,No,Yes,No,No,No,No,4,1
5528,OPEN BOTTOM TANK VALVES WHEN POWER DOWN,23-33733,TK-6606,TK-6606,,,2-10-23 7:10 AM,2023-02-10T07:10:00.000Z,4-23-23 12:00 AM,2023-04-23T00:00:00.000Z,5-16-23 3:17 PM,2023-05-16T15:17:00.000Z,4,4,,PM,CLOSE,Y,,NO,CHATHAM,,,,,,,,,,,,,,,,18,2023-02-10T18:50:00.000Z,2023-02-10T19:50:00.000Z,91.66666666666667,3.8194444444444446,No,No,No,Yes,No,No,No,No,4,1
5529,OPEN BOTTOM TANK VALVES WHEN POWER LOSS,23-33734,TK-6607,TK-6607,,,2-10-23 7:12 AM,2023-02-10T07:12:00.000Z,4-23-23 12:00 AM,2023-04-23T00:00:00.000Z,5-16-23 3:16 PM,2023-05-16T15:16:00.000Z,4,4,,PM,CLOSE,Y,,NO,CHATHAM,,,,,,,,,,,,,,,,18,2023-02-10T18:50:00.000Z,2023-02-10T19:50:00.000Z,91.66666666666667,3.8194444444444446,No,No,No,Yes,No,No,No,No,4,1
2619,Troubleshoot TK-2201  Outlet Valve,23-33738,HV-22102,HV-22102,,,2-10-23 7:21 AM,2023-02-10T07:21:00.000Z,2-11-23 12:58 AM,2023-02-11T00:58:00.000Z,2-10-23 1:58 AM,2023-02-10T01:58:00.000Z,2,2,,CO,CLOSE,Y,,NO,CHATHAM,,,,,,,,,,,,,,,,18,2023-02-10T18:50:00.000Z,2023-02-10T19:50:00.000Z,91.66666666666667,3.8194444444444446,No,No,No,Yes,No,No,No,No,4,1
1272,DISMANTLE BOTH SCAFFOLDS,23-33750,B-3602,B-3602,,,2-10-23 7:50 AM,2023-02-10T07:50:00.000Z,4-23-23 12:30 PM,2023-04-23T12:30:00.000Z,11-3-24 6:09 PM,2024-11-03T18:09:00.000Z,4,4,,CO,CLOSE,Y,,NO,CHATHAM,,,,,,,,,,,,,,,,18,2023-02-10T18:50:00.000Z,2023-02-10T19:50:00.000Z,91.66666666666667,3.8194444444444446,No,No,No,Yes,No,No,No,No,4,1
1412,CV1746/CV1747 coupling shafting are worn badly,23-33751,CV-1747,CV-1747,,,2-10-23 7:53 AM,2023-02-10T07:53:00.000Z,4-30-23 6:19 AM,2023-04-30T06:19:00.000Z,5-24-23 2:36 PM,2023-05-24T14:36:00.000Z,4,4,,CO,CLOSE,Y,,NO,CHATHAM,,,,,,,,,,,,,,,,18,2023-02-10T18:50:00.000Z,2023-02-10T19:50:00.000Z,91.66666666666667,3.8194444444444446,No,No,No,Yes,No,No,No,No,4,1
1297,Repair/Replace BL 2501B Discharge Valve,23-33752,BL-2501B,BL-2501B,,,2-10-23 7:57 AM,2023-02-10T07:57:00.000Z,4-30-23 9:37 PM,2023-04-30T21:37:00.000Z,5-5-23 2:55 PM,2023-05-05T14:55:00.000Z,4,4,,SD,CLOSE,Y,,NO,CHATHAM,,,,,,,,,,,,,,,,18,2023-02-10T18:50:00.000Z,2023-02-10T19:50:00.000Z,91.66666666666667,3.8194444444444446,No,No,No,Yes,No,No,No,No,4,1
1647,BUILD SCAFF FOR WIND BREAK,23-33753,EV-1615B,EV-1615B,,,2-10-23 8:57 AM,2023-02-10T08:57:00.000Z,4-23-23 12:00 AM,2023-04-23T00:00:00.000Z,11-9-23 9:46 AM,2023-11-09T09:46:00.000Z,4,4,,PM,CLOSE,Y,,NO,CHATHAM,,,,,,,,,,,,,,,,18,2023-02-10T18:50:00.000Z,2023-02-10T19:50:00.000Z,91.66666666666667,3.8194444444444446,No,No,No,Yes,No,No,No,No,4,1
1647,REMOVE MAYWAY FOR ENTRY,23-33754,EV-1615B,EV-1615B,,,2-10-23 8:59 AM,2023-02-10T08:59:00.000Z,4-23-23 12:00 AM,2023-04-23T00:00:00.000Z,11-9-23 9:46 AM,2023-11-09T09:46:00.000Z,4,4,,PM,CLOSE,Y,,NO,CHATHAM,,,,,,,,,,,,,,,,18,2023-02-10T18:50:00.000Z,2023-02-10T19:50:00.000Z,91.66666666666667,3.8194444444444446,No,No,No,Yes,No,No,No,No,4,1
1647,SENTRY FOR CSE FOR DURATION OF JOB,23-33755,EV-1615B,EV-1615B,,,2-10-23 9:00 AM,2023-02-10T09:00:00.000Z,4-23-23 12:00 AM,2023-04-23T00:00:00.000Z,11-9-23 9:46 AM,2023-11-09T09:46:00.000Z,4,4,,PM,CLOSE,Y,,NO,CHATHAM,,,,,,,,,,,,,,,,18,2023-02-10T18:50:00.000Z,2023-02-10T19:50:00.000Z,91.66666666666667,3.8194444444444446,No,No,No,Yes,No,No,No,No,4,1
1647,RE-INSTALL MAY WAY W/T GASKET,23-33756,EV-1615B,EV-1615B,,,2-10-23 9:01 AM,2023-02-10T09:01:00.000Z,4-23-23 12:00 AM,2023-04-23T00:00:00.000Z,11-9-23 9:46 AM,2023-11-09T09:46:00.000Z,4,4,,PM,CLOSE,Y,,NO,CHATHAM,,,,,,,,,,,,,,,,18,2023-02-10T18:50:00.000Z,2023-02-10T19:50:00.000Z,91.66666666666667,3.8194444444444446,No,No,No,Yes,No,No,No,No,4,1
1647,REMOVE SCAFF,23-33757,EV-1615B,EV-1615B,,,2-10-23 9:02 AM,2023-02-10T09:02:00.000Z,4-23-23 12:00 AM,2023-04-23T00:00:00.000Z,11-9-23 9:46 AM,2023-11-09T09:46:00.000Z,4,4,,PM,CLOSE,Y,,NO,CHATHAM,,,,,,,,,,,,,,,,18,2023-02-10T18:50:00.000Z,2023-02-10T19:50:00.000Z,91.66666666666667,3.8194444444444446,No,No,No,Yes,No,No,No,No,4,1
4754,Repair Utility Water Stations behind Dryer D,23-33759,PUWD-3501,PUWD-3501,,,2-10-23 9:20 AM,2023-02-10T09:20:00.000Z,3-17-23 9:20 AM,2023-03-17T09:20:00.000Z,3-14-23 12:20 PM,2023-03-14T12:20:00.000Z,4,4,,CO,CLOSE,Y,,NO,CHATHAM,,,,,,,,,,,,,,,,18,2023-02-10T18:50:00.000Z,2023-02-10T19:50:00.000Z,91.66666666666667,3.8194444444444446,No,No,No,Yes,No,No,No,No,4,1
1646,BUILD SCAFF AROUND TOP FOR CLEANING,23-33760,EV-1615A,EV-1615A,,,2-10-23 9:47 AM,2023-02-10T09:47:00.000Z,4-23-23 12:00 AM,2023-04-23T00:00:00.000Z,5-16-23 2:29 PM,2023-05-16T14:29:00.000Z,4,4,,PM,CLOSE,Y,,NO,CHATHAM,,,,,,,,,,,,,,,,18,2023-02-10T18:50:00.000Z,2023-02-10T19:50:00.000Z,91.66666666666667,3.8194444444444446,No,No,No,Yes,No,No,No,No,4,1
1646,SENTRY FOR CSE FOR DURATION OF JOB,23-33762,EV-1615A,EV-1615A,,,2-10-23 9:56 AM,2023-02-10T09:56:00.000Z,4-23-23 12:00 AM,2023-04-23T00:00:00.000Z,5-16-23 2:29 PM,2023-05-16T14:29:00.000Z,4,4,,PM,CLOSE,Y,,NO,CHATHAM,,,,,,,,,,,,,,,,18,2023-02-10T18:50:00.000Z,2023-02-10T19:50:00.000Z,91.66666666666667,3.8194444444444446,No,No,No,Yes,No,No,No,No,4,1
1646,REMOVE MAYWAY FOR ENTRY,23-33761,EV-1615A,EV-1615A,,,2-10-23 9:56 AM,2023-02-10T09:56:00.000Z,4-23-23 12:00 AM,2023-04-23T00:00:00.000Z,5-16-23 2:29 PM,2023-05-16T14:29:00.000Z,4,4,,PM,CLOSE,Y,,NO,CHATHAM,,,,,,,,,,,,,,,,18,2023-02-10T18:50:00.000Z,2023-02-10T19:50:00.000Z,91.66666666666667,3.8194444444444446,No,No,No,Yes,No,No,No,No,4,1
1646,RE-INSTALL MAY WAY W/T GASKET,23-33763,EV-1615A,EV-1615A,,,2-10-23 9:57 AM,2023-02-10T09:57:00.000Z,4-23-23 12:00 AM,2023-04-23T00:00:00.000Z,5-16-23 2:29 PM,2023-05-16T14:29:00.000Z,4,4,,PM,CLOSE,Y,,NO,CHATHAM,,,,,,,,,,,,,,,,18,2023-02-10T18:50:00.000Z,2023-02-10T19:50:00.000Z,91.66666666666667,3.8194444444444446,No,No,No,Yes,No,No,No,No,4,1
1646,REMOVE SCAFF,23-33764,EV-1615A,EV-1615A,,,2-10-23 9:57 AM,2023-02-10T09:57:00.000Z,4-23-23 12:00 AM,2023-04-23T00:00:00.000Z,5-16-23 2:29 PM,2023-05-16T14:29:00.000Z,4,4,,PM,CLOSE,Y,,NO,CHATHAM,,,,,,,,,,,,,,,,18,2023-02-10T18:50:00.000Z,2023-02-10T19:50:00.000Z,91.66666666666667,3.8194444444444446,No,No,No,Yes,No,No,No,No,4,1
,"MOC-052, Seperate main dist and HPA 60 to two manual activation buttons ( in main control room)",23-33765,3100-26K-01,3100-26K-01,,,2-10-23 9:59 AM,2023-02-10T09:59:00.000Z,3-31-23 5:15 PM,2023-03-31T17:15:00.000Z,2-23-23 11:29 AM,2023-02-23T11:29:00.000Z,4,4,,CO,CLOSE,Y,,NO,CHATHAM,,,,,,,,,,,,,,,,18,2023-02-10T18:50:00.000Z,2023-02-10T19:50:00.000Z,91.66666666666667,3.8194444444444446,No,No,No,Yes,No,No,No,No,4,1
6388,Primary Pressure Transmitter not working,23-33767,WS-3502A,WS-3502A,,,2-10-23 10:19 AM,2023-02-10T10:19:00.000Z,2-25-23 3:23 PM,2023-02-25T15:23:00.000Z,2-14-23 4:25 PM,2023-02-14T16:25:00.000Z,4,4,,CO,CLOSE,Y,,NO,CHATHAM,,,,,,,,,,,,,,,,18,2023-02-10T18:50:00.000Z,2023-02-10T19:50:00.000Z,91.66666666666667,3.8194444444444446,No,No,No,Yes,No,No,No,No,4,1
4512,PSV-58126 Passing (MSU3 Cooling Water),23-33769,PSV-58126,PSV-58126,,,2-10-23 10:46 AM,2023-02-10T10:46:00.000Z,5-1-23 10:46 AM,2023-05-01T10:46:00.000Z,5-2-23 10:56 AM,2023-05-02T10:56:00.000Z,4,4,,CO,CLOSE,Y,,NO,CHATHAM,,,,,,,,,,,,,,,,18,2023-02-10T18:50:00.000Z,2023-02-10T19:50:00.000Z,91.66666666666667,3.8194444444444446,No,No,No,Yes,No,No,No,No,4,1
1642,REMOVE OLD VALVE,23-33771,EJ-4101,EJ-4101,,,2-10-23 11:06 AM,2023-02-10T11:06:00.000Z,12-9-22 1:11 PM,2022-12-09T13:11:00.000Z,2-28-23 3:56 PM,2023-02-28T15:56:00.000Z,4,4,,RM,CLOSE,Y,,NO,CHATHAM,,,,,,,,,,,,,,,,18,2023-02-10T18:50:00.000Z,2023-02-10T19:50:00.000Z,91.66666666666667,3.8194444444444446,No,No,No,Yes,No,No,No,No,4,1
1642,INSTALL NEW VALVE,23-33772,EJ-4101,EJ-4101,,,2-10-23 11:06 AM,2023-02-10T11:06:00.000Z,4-30-23 1:11 PM,2023-04-30T13:11:00.000Z,2-28-23 3:56 PM,2023-02-28T15:56:00.000Z,4,4,,RM,CLOSE,Y,,NO,CHATHAM,,,,,,,,,,,,,,,,18,2023-02-10T18:50:00.000Z,2023-02-10T19:50:00.000Z,91.66666666666667,3.8194444444444446,No,No,No,Yes,No,No,No,No,4,1
1458,Investigate XA32807 status alarm,23-33774,DCS-CONTROL,DCS-CONTROL,,VIRAJ.PATEL,2-10-23 12:10 PM,2023-02-10T12:10:00.000Z,2-28-23 11:23 AM,2023-02-28T11:23:00.000Z,2-15-23 9:29 AM,2023-02-15T09:29:00.000Z,4,4,,EC,CLOSE,Y,,NO,CHATHAM,,,,,,,,,,,,,,,,18,2023-02-10T18:50:00.000Z,2023-02-10T19:50:00.000Z,91.66666666666667,3.8194444444444446,No,No,No,Yes,No,No,No,No,4,1
,DCS issue  HV-22102 and LV22102B,23-33775,,,,VIRAJ.PATEL,2-10-23 12:17 PM,2023-02-10T12:17:00.000Z,12-22-23 12:17 PM,2023-12-22T12:17:00.000Z,,,4,4,,EC,INPRG,N,,NO,CHATHAM,,,,,,,,,,,,,,,,18,2023-02-10T18:50:00.000Z,2023-02-10T19:50:00.000Z,91.66666666666667,3.8194444444444446,No,No,No,Yes,No,No,No,No,4,1
,Weather Stripping on Laboratory Emergency Exit Door,23-33776,BU-ADMIN,BU-ADMIN,,,2-10-23 12:20 PM,2023-02-10T12:20:00.000Z,2-28-23 11:04 AM,2023-02-28T11:04:00.000Z,2-16-23 12:06 PM,2023-02-16T12:06:00.000Z,4,4,,CO,CLOSE,Y,,NO,CHATHAM,,,,,,,,,,,,,,,,18,2023-02-10T18:50:00.000Z,2023-02-10T19:50:00.000Z,91.66666666666667,3.8194444444444446,No,No,No,Yes,No,No,No,No,4,1
,TA23 - Replace broken wood in tower,23-33781,CT-3201,CT-3201,,,2-10-23 2:24 PM,2023-02-10T14:24:00.000Z,4-30-23 1:43 PM,2023-04-30T13:43:00.000Z,3-13-23 9:23 AM,2023-03-13T09:23:00.000Z,4,4,,SD,CLOSE,Y,,NO,CHATHAM,,,,,,,,,,,,,,,,18,2023-02-10T18:50:00.000Z,2023-02-10T19:50:00.000Z,91.66666666666667,3.8194444444444446,No,No,Yes,Yes,No,No,No,No,4,1
4118,TA23 - Replace main nat gas pressure gauge,23-33782,PI-34103,PI-34103,,,2-10-23 2:26 PM,2023-02-10T14:26:00.000Z,4-30-23 1:45 PM,2023-04-30T13:45:00.000Z,5-25-23 10:34 AM,2023-05-25T10:34:00.000Z,4,4,,CO,CLOSE,Y,,NO,CHATHAM,,,,,,,,,,,,,,,,18,2023-02-10T18:50:00.000Z,2023-02-10T19:50:00.000Z,91.66666666666667,3.8194444444444446,No,No,Yes,Yes,No,No,No,No,4,1
5475,Found Work TA22BI-Steam Isolation Valves to TK-1902 Replacement,23-33783,TK-1902,TK-1902,,,2-10-23 2:27 PM,2023-02-10T14:27:00.000Z,,,5-8-23 12:04 PM,2023-05-08T12:04:00.000Z,4,4,,SD,CLOSE,Y,,NO,CHATHAM,,,,,,,,,,,,,,,,18,2023-02-10T18:50:00.000Z,2023-02-10T19:50:00.000Z,91.66666666666667,3.8194444444444446,No,No,Yes,Yes,No,No,No,No,4,1
5475,Blank/ Remove Blank for Internal Inspection TK1902 (Acuren),23-33785,TK-1902,TK-1902,,,2-10-23 2:50 PM,2023-02-10T14:50:00.000Z,2-15-23 2:50 PM,2023-02-15T14:50:00.000Z,2-14-23 5:50 AM,2023-02-14T05:50:00.000Z,4,4,,CO,CLOSE,Y,,NO,CHATHAM,,,,,,,,,,,,,,,,18,2023-02-10T18:50:00.000Z,2023-02-10T19:50:00.000Z,91.66666666666667,3.8194444444444446,No,No,Yes,Yes,No,No,No,No,4,1
5466,OPEN MANWAY,23-33789,TK-1404,TK-1404,,,2-10-23 3:12 PM,2023-02-10T15:12:00.000Z,4-28-23 1:36 PM,2023-04-28T13:36:00.000Z,5-16-23 2:31 PM,2023-05-16T14:31:00.000Z,4,4,,SD,CLOSE,Y,,NO,CHATHAM,,,,,,,,,,,,,,,,18,2023-02-10T18:50:00.000Z,2023-02-10T19:50:00.000Z,91.66666666666667,3.8194444444444446,No,No,Yes,Yes,No,No,No,No,4,1
5466,INSPECT TANK,23-33791,TK-1404,TK-1404,,,2-10-23 3:12 PM,2023-02-10T15:12:00.000Z,4-28-23 1:36 PM,2023-04-28T13:36:00.000Z,5-16-23 2:31 PM,2023-05-16T14:31:00.000Z,4,4,,SD,CLOSE,Y,,NO,CHATHAM,,,,,,,,,,,,,,,,18,2023-02-10T18:50:00.000Z,2023-02-10T19:50:00.000Z,91.66666666666667,3.8194444444444446,No,No,Yes,Yes,No,No,No,No,4,1
5466,HPW TANK/VESSEL FOR INSPECTION,23-33790,TK-1404,TK-1404,,,2-10-23 3:12 PM,2023-02-10T15:12:00.000Z,4-28-23 1:36 PM,2023-04-28T13:36:00.000Z,5-16-23 2:31 PM,2023-05-16T14:31:00.000Z,4,4,,SD,CLOSE,Y,,NO,CHATHAM,,,,,,,,,,,,,,,,18,2023-02-10T18:50:00.000Z,2023-02-10T19:50:00.000Z,91.66666666666667,3.8194444444444446,No,No,Yes,Yes,No,No,No,No,4,1
5466,CLOSE MANWAY,23-33792,TK-1404,TK-1404,,,2-10-23 3:13 PM,2023-02-10T15:13:00.000Z,4-28-23 1:36 PM,2023-04-28T13:36:00.000Z,5-16-23 2:31 PM,2023-05-16T14:31:00.000Z,4,4,,SD,CLOSE,Y,,NO,CHATHAM,,,,,,,,,,,,,,,,18,2023-02-10T18:50:00.000Z,2023-02-10T19:50:00.000Z,91.66666666666667,3.8194444444444446,No,No,Yes,Yes,No,No,No,No,4,1
3593,REMOVE SIGHT GLASS FOR HPW,23-33793,TK-1710,TK-1710,,,2-10-23 3:16 PM,2023-02-10T15:16:00.000Z,5-12-23 2:22 PM,2023-05-12T14:22:00.000Z,5-16-23 2:36 PM,2023-05-16T14:36:00.000Z,4,4,,SD,CLOSE,Y,,NO,CHATHAM,,,,,,,,,,,,,,,,18,2023-02-10T18:50:00.000Z,2023-02-10T19:50:00.000Z,91.66666666666667,3.8194444444444446,No,No,Yes,Yes,No,No,No,No,4,1
3593,HPW/SPINNER TANK/VESSEL,23-33794,TK-1710,TK-1710,,,2-10-23 3:17 PM,2023-02-10T15:17:00.000Z,5-12-23 2:22 PM,2023-05-12T14:22:00.000Z,5-16-23 2:36 PM,2023-05-16T14:36:00.000Z,4,4,,SD,CLOSE,Y,,NO,CHATHAM,,,,,,,,,,,,,,,,18,2023-02-10T18:50:00.000Z,2023-02-10T19:50:00.000Z,91.66666666666667,3.8194444444444446,No,No,Yes,Yes,No,No,No,No,4,1
3593,REMOVE SPOOL AT BASE FOR DRAINING,23-33795,TK-1710,TK-1710,,,2-10-23 3:17 PM,2023-02-10T15:17:00.000Z,5-12-23 2:22 PM,2023-05-12T14:22:00.000Z,5-16-23 2:36 PM,2023-05-16T14:36:00.000Z,4,4,,SD,CLOSE,Y,,NO,CHATHAM,,,,,,,,,,,,,,,,18,2023-02-10T18:50:00.000Z,2023-02-10T19:50:00.000Z,91.66666666666667,3.8194444444444446,No,No,Yes,Yes,No,No,No,No,4,1
3593,RE-INSTALL SPOOL,23-33796,TK-1710,TK-1710,,,2-10-23 3:18 PM,2023-02-10T15:18:00.000Z,5-12-23 2:22 PM,2023-05-12T14:22:00.000Z,5-16-23 2:36 PM,2023-05-16T14:36:00.000Z,4,4,,SD,CLOSE,Y,,NO,CHATHAM,,,,,,,,,,,,,,,,18,2023-02-10T18:50:00.000Z,2023-02-10T19:50:00.000Z,91.66666666666667,3.8194444444444446,No,No,Yes,Yes,No,No,No,No,4,1
1297,Remove BL-2501B for bearing change out & Re-install,23-33797,BL-2501B,BL-2501B,,,2-10-23 3:58 PM,2023-02-10T15:58:00.000Z,2-14-23 3:58 PM,2023-02-14T15:58:00.000Z,2-14-23 5:12 PM,2023-02-14T17:12:00.000Z,2,2,,CO,CLOSE,Y,,NO,CHATHAM,,,,,,,,,,,,,,,,18,2023-02-10T18:50:00.000Z,2023-02-10T19:50:00.000Z,91.66666666666667,3.8194444444444446,No,No,Yes,Yes,No,No,No,No,4,1
1092,Change out motor P1562A,23-33798,P-1562A,P-1562A,,,2-10-23 4:30 PM,2023-02-10T16:30:00.000Z,,,2-16-23 10:33 AM,2023-02-16T10:33:00.000Z,4,4,,CO,CLOSE,Y,,NO,CHATHAM,,,,,,,,,,,,,,,,18,2023-02-10T18:50:00.000Z,2023-02-10T19:50:00.000Z,91.66666666666667,3.8194444444444446,No,No,Yes,Yes,No,No,No,No,4,1
1103,Change out motor,23-33799,P-6562B,P-6562B,,,2-10-23 4:34 PM,2023-02-10T16:34:00.000Z,,,2-14-23 5:08 PM,2023-02-14T17:08:00.000Z,4,4,,CO,CLOSE,Y,,NO,CHATHAM,,,,,,,,,,,,,,,,18,2023-02-10T18:50:00.000Z,2023-02-10T19:50:00.000Z,91.66666666666667,3.8194444444444446,No,No,Yes,Yes,No,No,No,No,4,1
2044,I/E to install new insertion flowmeter at FT-32301,23-34207,FT-32301,FT-32301,,,2-17-23 11:05 AM,2023-02-17T11:05:00.000Z,2-16-23 4:45 PM,2023-02-16T16:45:00.000Z,2-28-23 7:54 PM,2023-02-28T19:54:00.000Z,4,4,,CP,CLOSE,Y,,NO,CHATHAM,,,,,,,,,,,,,,,,21,2023-02-17T15:50:00.000Z,2023-02-17T18:10:00.000Z,122.16666666666667,5.090277777777778,No,No,Yes,Yes,No,No,No,No,4,1
,Broken sample  port valves,23-34208,2370,2370,,,2-17-23 2:15 PM,2023-02-17T14:15:00.000Z,2-18-23 2:09 PM,2023-02-18T14:09:00.000Z,2-21-23 4:10 PM,2023-02-21T16:10:00.000Z,1,1,,RM,CLOSE,Y,,NO,CHATHAM,,,,,,,,,,,,,,,,21,2023-02-17T15:50:00.000Z,2023-02-17T18:10:00.000Z,122.16666666666667,5.090277777777778,No,No,Yes,Yes,No,No,No,No,4,1
,Clean up for Wednesday Tour,23-34209,BU-ADMIN,BU-ADMIN,,,2-17-23 3:37 PM,2023-02-17T15:37:00.000Z,2-21-23 12:00 PM,2023-02-21T12:00:00.000Z,2-21-23 10:00 AM,2023-02-21T10:00:00.000Z,4,4,,CO,CLOSE,Y,,NO,CHATHAM,,,,,,,,,,,,,,,,21,2023-02-17T15:50:00.000Z,2023-02-17T18:10:00.000Z,122.16666666666667,5.090277777777778,No,Yes,Yes,Yes,No,No,No,No,4,1
,"CE-1711, CE-1712, CE-1713, CE-1714",23-34607,CE-1711,CE-1711,,VIRAJ.PATEL,2-24-23 2:53 PM,2023-02-24T14:53:00.000Z,2-28-23 2:51 PM,2023-02-28T14:51:00.000Z,,,4,4,,EC,CAN,Y,,NO,CHATHAM,,,,,,,,,,,,,,,,23,2023-02-25T11:20:00.000Z,2023-02-25T11:40:00.000Z,2.1666666666666665,0.09027777777777778,No,No,No,Yes,No,No,No,No,4,1
2541,Keith L - Adjust Backup speed switch DR1826 (SSL18141B),23-32796,DR-1826,DR-1826,,,1-26-23 12:30 PM,2023-01-26T12:30:00.000Z,3-26-23 11:00 AM,2023-03-26T11:00:00.000Z,3-20-23 9:33 AM,2023-03-20T09:33:00.000Z,4,4,,CO,CLOSE,Y,,NO,CHATHAM,"2541, 2542, 2543, 2544, 2545, 2547, 2549, 2550, 2552, 2553, 2554, 2555, 2556, 2557, 2558, 2559","SWISS COMBI ROTARY DRYER DRUM, SEW GEARBOX - LEFT HAND DRIVE -, SEW GEARBOX - LEFT HAND DRIVE, SEW GEARBOX - RIGHT HAND DRIVE, SEW GEARBOX - RIGHT HAND DRIVE, MOTOR / 25HP / 1800RPM / TEFC / 575V/3PH/60HZ / FRAME# 284TC, MOTOR / 25HP / 1800RPM / TEFC / 575V/3PH/60HZ / FRAME# 284TC, MOTOR / 25HP / 1800RPM / TEFC / 575V/3PH/60HZ / FRAME# 284TC, MOTOR / 25HP / 1800RPM / TEFC / 575V/3PH/60HZ / FRAME# 284TC, TRUNNION (A) - LEFT HAND DRIVE, TRUNNION (B)- RIGHT HAND DRIVE, TRUNNION (D) - LEFT HAND DRIVE, TRUNNION (C) - RIGHT HAND DRIVE, THRUST ROLLER ASSEMBLY, THRUST ROLLER ASSEMBLY, TRUNNION LUBRICATION SYSTEM",,No,DRYER A,CH-DRA_CYCLNS,CH-DRA_CYCLNS:TT18168B.MEAS,TT-18168B,TT,MEAS,Measured value (PV),Temperature transmitter,Measurement,DRUM DR1826 MOTOR A AMPERAGE,DR-1826,26,2023-03-20T03:50:00.000Z,2023-03-20T18:30:00.000Z,121.66666666666667,5.069444444444445,Yes,No,No,No,No,No,No,No,1,1
4865,SA-2101 CORN PROBE - MECHANICAL  PM,23-33830,SA-2101,SA-2101,,,2-13-23 1:46 AM,2023-02-13T01:46:00.000Z,3-13-23 7:30 AM,2023-03-13T07:30:00.000Z,3-21-23 10:56 AM,2023-03-21T10:56:00.000Z,4,4,,PM,CLOSE,Y,N,NO,CHATHAM,,,,,,,,,,,,,,,,26,2023-03-20T03:50:00.000Z,2023-03-20T18:30:00.000Z,121.66666666666667,5.069444444444445,No,No,No,No,No,Yes,No,No,5,1
4865,Corn Probe Weekly PM,23-33831,SA-2101,SA-2101,,,2-13-23 1:46 AM,2023-02-13T01:46:00.000Z,3-13-23 7:30 AM,2023-03-13T07:30:00.000Z,3-21-23 10:56 AM,2023-03-21T10:56:00.000Z,4,4,,PM,CLOSE,Y,,NO,CHATHAM,,,,,,,,,,,,,,,,26,2023-03-20T03:50:00.000Z,2023-03-20T18:30:00.000Z,121.66666666666667,5.069444444444445,No,No,No,No,No,Yes,No,No,5,1
3081,BIOTHANE FLOAT OP CHECK- (LSH-41401) - PM SERVICE,23-34227,LSH-41401,LSH-41401,,,2-20-23 1:46 AM,2023-02-20T01:46:00.000Z,3-20-23 12:30 AM,2023-03-20T00:30:00.000Z,3-21-23 12:30 AM,2023-03-21T00:30:00.000Z,4,4,,PM,CLOSE,Y,N,NO,CHATHAM,,,,,,,,,,,,,,,,26,2023-03-20T03:50:00.000Z,2023-03-20T18:30:00.000Z,121.66666666666667,5.069444444444445,No,No,No,No,No,Yes,No,No,5,1
,"Area Asset Checks-2200, 2300, 3200, 3600, 4100",23-34341,2200,2200,,,2-20-23 1:48 AM,2023-02-20T01:48:00.000Z,3-20-23 12:00 AM,2023-03-20T00:00:00.000Z,3-21-23 1:00 AM,2023-03-21T01:00:00.000Z,4,4,,PM,CLOSE,Y,N,NO,CHATHAM,,,,,,,,,,,,,,,,26,2023-03-20T03:50:00.000Z,2023-03-20T18:30:00.000Z,121.66666666666667,5.069444444444445,No,No,No,No,No,Yes,No,No,5,1
,"Area Asset Checks-1830, 1840, DDG Cooler",23-34343,1800,1800,,,2-20-23 1:48 AM,2023-02-20T01:48:00.000Z,3-20-23 12:00 AM,2023-03-20T00:00:00.000Z,3-21-23 1:00 AM,2023-03-21T01:00:00.000Z,4,4,,PM,CLOSE,Y,N,NO,CHATHAM,,,,,,,,,,,,,,,,26,2023-03-20T03:50:00.000Z,2023-03-20T18:30:00.000Z,121.66666666666667,5.069444444444445,No,No,No,No,No,Yes,No,No,5,1
,"Area Asset Checks-1600, 1660, 1700",23-34349,1600,1600,,,2-20-23 1:48 AM,2023-02-20T01:48:00.000Z,3-20-23 12:00 AM,2023-03-20T00:00:00.000Z,3-21-23 1:00 AM,2023-03-21T01:00:00.000Z,4,4,,PM,CLOSE,Y,N,NO,CHATHAM,,,,,,,,,,,,,,,,26,2023-03-20T03:50:00.000Z,2023-03-20T18:30:00.000Z,121.66666666666667,5.069444444444445,No,No,No,No,No,Yes,No,No,5,1
,"Area Asset Checks-1830, 1840, DDG Cooler",23-34353,1800,1800,,,2-20-23 1:48 AM,2023-02-20T01:48:00.000Z,3-20-23 12:00 AM,2023-03-20T00:00:00.000Z,3-21-23 1:00 AM,2023-03-21T01:00:00.000Z,4,4,,PM,CLOSE,Y,N,NO,CHATHAM,,,,,,,,,,,,,,,,26,2023-03-20T03:50:00.000Z,2023-03-20T18:30:00.000Z,121.66666666666667,5.069444444444445,No,No,No,No,No,Yes,No,No,5,1
,"Area Asset Checks-2200, 2300, 3200, 3600, 4100",23-34351,2200,2200,,,2-20-23 1:48 AM,2023-02-20T01:48:00.000Z,3-20-23 12:00 AM,2023-03-20T00:00:00.000Z,3-21-23 12:30 AM,2023-03-21T00:30:00.000Z,4,4,,PM,CLOSE,Y,N,NO,CHATHAM,,,,,,,,,,,,,,,,26,2023-03-20T03:50:00.000Z,2023-03-20T18:30:00.000Z,121.66666666666667,5.069444444444445,No,No,No,No,No,Yes,No,No,5,1
1178,Install new sight glass on p-1511A sight glass,23-34543,P-1511A,P-1511A,,,2-22-23 7:22 AM,2023-02-22T07:22:00.000Z,3-10-23 3:42 PM,2023-03-10T15:42:00.000Z,3-20-23 5:42 PM,2023-03-20T17:42:00.000Z,4,4,,CO,CLOSE,Y,,NO,CHATHAM,,,,,,,,,,,,,,,,26,2023-03-20T03:50:00.000Z,2023-03-20T18:30:00.000Z,121.66666666666667,5.069444444444445,Yes,No,No,No,No,No,No,No,1,1
3382,IR scan prior to shutdown,23-35390,MCC-3806,MCC-3806,,,3-10-23 9:38 AM,2023-03-10T09:38:00.000Z,3-25-23 9:40 AM,2023-03-25T09:40:00.000Z,3-21-23 12:40 PM,2023-03-21T12:40:00.000Z,4,4,,PD,CLOSE,Y,,NO,CHATHAM,,,,,,,,,,,,,,,,26,2023-03-20T03:50:00.000Z,2023-03-20T18:30:00.000Z,121.66666666666667,5.069444444444445,No,No,No,No,No,Yes,No,No,5,1
,CV-1827 MECHANICAL PM,23-35544,CV-1827,CV-1827,,,3-13-23 1:48 AM,2023-03-13T01:48:00.000Z,4-10-23 10:00 AM,2023-04-10T10:00:00.000Z,3-20-23 8:00 AM,2023-03-20T08:00:00.000Z,4,4,,PM,CLOSE,Y,N,NO,CHATHAM,"2488, 2509","5 HP / 1800 RPM / TEFC / 575V/3PH/60HZ / FRAME#184T, DORRIS 115TR25 SHAFT MOUNTED SPEED REDUCER",,No,DRYER A,CH-DRA_CYCLNS,CH-DRA_CYCLNS:SSL18172.CIN,SSL-18172,SSL,CIN,Contact input (discrete),Speed switch (motion proof),Discrete Input,CV1827 CURRENT INDICATION,CV-1827,26,2023-03-20T03:50:00.000Z,2023-03-20T18:30:00.000Z,121.66666666666667,5.069444444444445,Yes,No,No,No,No,No,No,No,1,1
,R&D Lab -  Lab evap Electrical issue,23-35944,R&D LAB,R&D LAB,,,3-15-23 3:08 PM,2023-03-15T15:08:00.000Z,3-24-23 2:57 PM,2023-03-24T14:57:00.000Z,3-21-23 3:57 PM,2023-03-21T15:57:00.000Z,4,4,,CO,CLOSE,Y,,NO,CHATHAM,,,,,,,,,,,,,,,,26,2023-03-20T03:50:00.000Z,2023-03-20T18:30:00.000Z,121.66666666666667,5.069444444444445,No,No,No,No,No,Yes,No,No,5,1
1595,REPLACE SURGE PROTECTORS FOR BIOTHANE BLDNG,23-35954,DP-L,DP-L,,,3-16-23 8:08 AM,2023-03-16T08:08:00.000Z,3-26-23 8:12 AM,2023-03-26T08:12:00.000Z,3-20-23 9:42 AM,2023-03-20T09:42:00.000Z,4,4,,CO,CLOSE,Y,,NO,CHATHAM,,,,,,,,,,,,,,,,26,2023-03-20T03:50:00.000Z,2023-03-20T18:30:00.000Z,121.66666666666667,5.069444444444445,Yes,No,No,No,No,No,No,No,1,1
,INSPECT DRYER BLOWER,23-35976,BL-1829,BL-1829,,,3-17-23 1:13 PM,2023-03-17T13:13:00.000Z,3-25-23 1:15 PM,2023-03-25T13:15:00.000Z,3-20-23 3:15 PM,2023-03-20T15:15:00.000Z,4,4,,CO,CLOSE,Y,N,NO,CHATHAM,"10034, 2868","BLOWER, HOWDEN, FAN MODEL E40S-8700 SWSI CCW TAU Arrg't7, 600HP / 1200RPM / TEFC / 575V/3PH/60HZ / 5810B FRAME",,Yes,DRYER A,CH-DRYER_A,CH-DRYER_A:SY18153B.OUT,SY-18153B,SY,OUT,Controller output / demand (CO),Speed output (VFD demand),Output/Demand,BL1829 CURRENT INDICATION,BL-1829,26,2023-03-20T03:50:00.000Z,2023-03-20T18:30:00.000Z,121.66666666666667,5.069444444444445,Yes,No,No,No,No,No,No,No,1,1
,1300 AREA - AGITATOR MECHANICAL PM,23-36001,1300,1300,,,3-20-23 1:46 AM,2023-03-20T01:46:00.000Z,4-17-23 3:00 AM,2023-04-17T03:00:00.000Z,5-18-23 9:57 AM,2023-05-18T09:57:00.000Z,4,4,,PM,CLOSE,Y,N,NO,CHATHAM,,,,,,,,,,,,,,,,26,2023-03-20T03:50:00.000Z,2023-03-20T18:30:00.000Z,121.66666666666667,5.069444444444445,No,No,Yes,Yes,No,No,No,No,4,1
,AGITATOR GEARBOX MONTHLY PM CHECKS,23-36005,1400,1400,,,3-20-23 1:46 AM,2023-03-20T01:46:00.000Z,4-17-23 1:30 AM,2023-04-17T01:30:00.000Z,5-18-23 9:57 AM,2023-05-18T09:57:00.000Z,4,4,,PM,CLOSE,Y,,NO,CHATHAM,,,,,,,,,,,,,,,,26,2023-03-20T03:50:00.000Z,2023-03-20T18:30:00.000Z,121.66666666666667,5.069444444444445,No,No,Yes,Yes,No,No,No,No,4,1
,1600/1700/1900 AREA - AGITATOR MECHANICAL PM,23-36007,1600,1600,,,3-20-23 1:46 AM,2023-03-20T01:46:00.000Z,4-17-23 12:20 AM,2023-04-17T00:20:00.000Z,5-18-23 9:57 AM,2023-05-18T09:57:00.000Z,4,4,,PM,CLOSE,Y,N,NO,CHATHAM,,,,,,,,,,,,,,,,26,2023-03-20T03:50:00.000Z,2023-03-20T18:30:00.000Z,121.66666666666667,5.069444444444445,No,No,Yes,Yes,No,No,No,No,4,1
4865,SA-2101 CORN SAMPLER/ PROBE PM - GHR0,23-36012,SA-2101,SA-2101,,,3-20-23 1:46 AM,2023-03-20T01:46:00.000Z,4-25-23 8:30 AM,2023-04-25T08:30:00.000Z,5-1-23 8:45 AM,2023-05-01T08:45:00.000Z,4,4,,SD,CLOSE,Y,N,NO,CHATHAM,,,,,,,,,,,,,,,,26,2023-03-20T03:50:00.000Z,2023-03-20T18:30:00.000Z,121.66666666666667,5.069444444444445,No,No,Yes,Yes,No,No,No,No,4,1
4865,SA-2101 CORN PROBE - MECHANICAL  PM,23-36014,SA-2101,SA-2101,,,3-20-23 1:46 AM,2023-03-20T01:46:00.000Z,4-17-23 7:30 AM,2023-04-17T07:30:00.000Z,5-1-23 8:45 AM,2023-05-01T08:45:00.000Z,4,4,,PM,CLOSE,Y,N,NO,CHATHAM,,,,,,,,,,,,,,,,26,2023-03-20T03:50:00.000Z,2023-03-20T18:30:00.000Z,121.66666666666667,5.069444444444445,No,No,Yes,Yes,No,No,No,No,4,1
1031,OIL CHANGE ON GOULDS PUMPS,23-36017,P-1409,P-1409,,,3-20-23 1:46 AM,2023-03-20T01:46:00.000Z,4-13-23 12:30 AM,2023-04-13T00:30:00.000Z,5-18-23 9:56 AM,2023-05-18T09:56:00.000Z,4,4,,PM,CLOSE,Y,,NO,CHATHAM,,,,,,,,,,,,,,,,26,2023-03-20T03:50:00.000Z,2023-03-20T18:30:00.000Z,121.66666666666667,5.069444444444445,No,No,Yes,Yes,No,No,No,No,4,1
,GREASE BEARING USING ULTRASONIC,23-35994,1300,1300,,,3-20-23 1:46 AM,2023-03-20T01:46:00.000Z,4-17-23 12:00 AM,2023-04-17T00:00:00.000Z,5-18-23 9:57 AM,2023-05-18T09:57:00.000Z,4,4,,PM,CLOSE,Y,,NO,CHATHAM,,,,,,,,,,,,,,,,26,2023-03-20T03:50:00.000Z,2023-03-20T18:30:00.000Z,121.66666666666667,5.069444444444445,No,No,Yes,Yes,No,No,No,No,4,1
,1400 AREA - AGITATOR MECHANICAL PM,23-36004,1400,1400,,,3-20-23 1:46 AM,2023-03-20T01:46:00.000Z,4-17-23 3:00 AM,2023-04-17T03:00:00.000Z,5-18-23 9:57 AM,2023-05-18T09:57:00.000Z,4,4,,PM,CLOSE,Y,N,NO,CHATHAM,,,,,,,,,,,,,,,,26,2023-03-20T03:50:00.000Z,2023-03-20T18:30:00.000Z,121.66666666666667,5.069444444444445,No,No,Yes,Yes,No,No,No,No,4,1
,1600 AREA - TEMPERATURE CHECKS,23-36009,1600,1600,,,3-20-23 1:46 AM,2023-03-20T01:46:00.000Z,4-17-23 1:30 AM,2023-04-17T01:30:00.000Z,5-18-23 9:57 AM,2023-05-18T09:57:00.000Z,4,4,,PM,CLOSE,Y,,NO,CHATHAM,,,,,,,,,,,,,,,,26,2023-03-20T03:50:00.000Z,2023-03-20T18:30:00.000Z,121.66666666666667,5.069444444444445,No,No,Yes,Yes,No,No,No,No,4,1
1031,CHECK THE IMPROSEALS FOR OIL LEAKAGE,23-36019,P-1409,P-1409,,,3-20-23 1:46 AM,2023-03-20T01:46:00.000Z,4-13-23 12:15 AM,2023-04-13T00:15:00.000Z,5-18-23 9:56 AM,2023-05-18T09:56:00.000Z,4,4,,PM,CLOSE,Y,,NO,CHATHAM,,,,,,,,,,,,,,,,26,2023-03-20T03:50:00.000Z,2023-03-20T18:30:00.000Z,121.66666666666667,5.069444444444445,No,No,Yes,Yes,No,No,No,No,4,1
1051,REMOVE COUPLING GUARD AND INSPECT OMEGA ELEMENT,23-36022,P-1552A,P-1552A,,,3-20-23 1:46 AM,2023-03-20T01:46:00.000Z,5-15-23 12:15 AM,2023-05-15T00:15:00.000Z,6-13-23 10:41 AM,2023-06-13T10:41:00.000Z,4,4,,PM,CLOSE,Y,,NO,CHATHAM,,,,,,,,,,,,,,,,26,2023-03-20T03:50:00.000Z,2023-03-20T18:30:00.000Z,121.66666666666667,5.069444444444445,No,No,Yes,Yes,No,No,No,No,4,1
,CLEAN HEAD SHAFT GREASE FITTINGS OFF,23-35991,1300,1300,,,3-20-23 1:46 AM,2023-03-20T01:46:00.000Z,4-17-23 12:00 AM,2023-04-17T00:00:00.000Z,5-18-23 9:57 AM,2023-05-18T09:57:00.000Z,4,4,,PM,CLOSE,Y,,NO,CHATHAM,,,,,,,,,,,,,,,,26,2023-03-20T03:50:00.000Z,2023-03-20T18:30:00.000Z,121.66666666666667,5.069444444444445,No,No,Yes,Yes,No,No,No,No,4,1
3081,BIOTHANE FLOAT OP CHECK- (LSH-41401) - PM SERVICE,23-36010,LSH-41401,LSH-41401,,,3-20-23 1:46 AM,2023-03-20T01:46:00.000Z,4-17-23 12:30 AM,2023-04-17T00:30:00.000Z,5-18-23 9:56 AM,2023-05-18T09:56:00.000Z,4,4,,PM,CLOSE,Y,N,NO,CHATHAM,,,,,,,,,,,,,,,,26,2023-03-20T03:50:00.000Z,2023-03-20T18:30:00.000Z,121.66666666666667,5.069444444444445,No,No,Yes,Yes,No,No,No,No,4,1
3081,Check operation of biothane float in diked area,23-36011,LSH-41401,LSH-41401,,,3-20-23 1:46 AM,2023-03-20T01:46:00.000Z,4-17-23 12:30 AM,2023-04-17T00:30:00.000Z,5-18-23 9:56 AM,2023-05-18T09:56:00.000Z,4,4,,PM,CLOSE,Y,,NO,CHATHAM,,,,,,,,,,,,,,,,26,2023-03-20T03:50:00.000Z,2023-03-20T18:30:00.000Z,121.66666666666667,5.069444444444445,No,No,Yes,Yes,No,No,No,No,4,1
,GREASE DRIVE END BEARING,23-35996,1300,1300,,,3-20-23 1:46 AM,2023-03-20T01:46:00.000Z,4-17-23 12:00 AM,2023-04-17T00:00:00.000Z,5-18-23 9:57 AM,2023-05-18T09:57:00.000Z,4,4,,PM,CLOSE,Y,,NO,CHATHAM,,,,,,,,,,,,,,,,26,2023-03-20T03:50:00.000Z,2023-03-20T18:30:00.000Z,121.66666666666667,5.069444444444445,No,No,Yes,Yes,No,No,No,No,4,1
,GREASE NON-DRIVE END BEARING - SEE OPERATION #20,23-35998,1300,1300,,,3-20-23 1:46 AM,2023-03-20T01:46:00.000Z,4-17-23 12:00 AM,2023-04-17T00:00:00.000Z,5-18-23 9:57 AM,2023-05-18T09:57:00.000Z,4,4,,PM,CLOSE,Y,,NO,CHATHAM,,,,,,,,,,,,,,,,26,2023-03-20T03:50:00.000Z,2023-03-20T18:30:00.000Z,121.66666666666667,5.069444444444445,No,No,Yes,Yes,No,No,No,No,4,1
,AGITATOR PM,23-36008,1600,1600,,,3-20-23 1:46 AM,2023-03-20T01:46:00.000Z,4-17-23 1:30 AM,2023-04-17T01:30:00.000Z,5-18-23 9:57 AM,2023-05-18T09:57:00.000Z,4,4,,PM,CLOSE,Y,,NO,CHATHAM,,,,,,,,,,,,,,,,26,2023-03-20T03:50:00.000Z,2023-03-20T18:30:00.000Z,121.66666666666667,5.069444444444445,No,No,Yes,Yes,No,No,No,No,4,1
4865,Corn Probe Weekly PM,23-36015,SA-2101,SA-2101,,,3-20-23 1:46 AM,2023-03-20T01:46:00.000Z,4-17-23 7:30 AM,2023-04-17T07:30:00.000Z,5-1-23 8:45 AM,2023-05-01T08:45:00.000Z,4,4,,PM,CLOSE,Y,,NO,CHATHAM,,,,,,,,,,,,,,,,26,2023-03-20T03:50:00.000Z,2023-03-20T18:30:00.000Z,121.66666666666667,5.069444444444445,No,No,Yes,Yes,No,No,No,No,4,1
1031,P-1409A - OIL CHANGE/ PM SERVICE,23-36016,P-1409,P-1409,,,3-20-23 1:46 AM,2023-03-20T01:46:00.000Z,4-13-23 1:00 AM,2023-04-13T01:00:00.000Z,5-18-23 9:56 AM,2023-05-18T09:56:00.000Z,4,4,,PM,CLOSE,Y,N,NO,CHATHAM,,,,,,,,,,,,,,,,26,2023-03-20T03:50:00.000Z,2023-03-20T18:30:00.000Z,121.66666666666667,5.069444444444445,No,No,Yes,Yes,No,No,No,No,4,1
1125,P-2203A - OIL CHANGE/ PM SERVICE,23-36024,P-2203A,P-2203A,,,3-20-23 1:46 AM,2023-03-20T01:46:00.000Z,4-11-23 1:00 AM,2023-04-11T01:00:00.000Z,5-18-23 9:56 AM,2023-05-18T09:56:00.000Z,4,4,,PM,CLOSE,Y,N,NO,CHATHAM,,,,,,,,,,,,,,,,26,2023-03-20T03:50:00.000Z,2023-03-20T18:30:00.000Z,121.66666666666667,5.069444444444445,No,No,Yes,Yes,No,No,No,No,4,1
,1300 AREA MECHANICAL EQUIPMENT GREASING,23-35990,1300,1300,,,3-20-23 1:46 AM,2023-03-20T01:46:00.000Z,4-17-23 6:00 AM,2023-04-17T06:00:00.000Z,5-18-23 9:57 AM,2023-05-18T09:57:00.000Z,4,4,,PM,CLOSE,Y,N,NO,CHATHAM,,,,,,,,,,,,,,,,26,2023-03-20T03:50:00.000Z,2023-03-20T18:30:00.000Z,121.66666666666667,5.069444444444445,No,No,Yes,Yes,No,No,No,No,4,1
,GREASE BEARINGS USING ULTRASONIC,23-35992,1300,1300,,,3-20-23 1:46 AM,2023-03-20T01:46:00.000Z,4-17-23 12:00 AM,2023-04-17T00:00:00.000Z,5-18-23 9:57 AM,2023-05-18T09:57:00.000Z,4,4,,PM,CLOSE,Y,,NO,CHATHAM,,,,,,,,,,,,,,,,26,2023-03-20T03:50:00.000Z,2023-03-20T18:30:00.000Z,121.66666666666667,5.069444444444445,No,No,Yes,Yes,No,No,No,No,4,1
,CLEAN TAIL SHAFT GREASE FITTINGS OFF,23-35993,1300,1300,,,3-20-23 1:46 AM,2023-03-20T01:46:00.000Z,4-17-23 12:00 AM,2023-04-17T00:00:00.000Z,5-18-23 9:57 AM,2023-05-18T09:57:00.000Z,4,4,,PM,CLOSE,Y,,NO,CHATHAM,,,,,,,,,,,,,,,,26,2023-03-20T03:50:00.000Z,2023-03-20T18:30:00.000Z,121.66666666666667,5.069444444444445,No,No,Yes,Yes,No,No,No,No,4,1
,CLEAN DRIVE END BEARING GREASE FITTING OFF,23-35995,1300,1300,,,3-20-23 1:46 AM,2023-03-20T01:46:00.000Z,4-17-23 12:00 AM,2023-04-17T00:00:00.000Z,5-18-23 9:57 AM,2023-05-18T09:57:00.000Z,4,4,,PM,CLOSE,Y,,NO,CHATHAM,,,,,,,,,,,,,,,,26,2023-03-20T03:50:00.000Z,2023-03-20T18:30:00.000Z,121.66666666666667,5.069444444444445,No,No,Yes,Yes,No,No,No,No,4,1
,CLEAN NON-DRIVE END BEARING GREASE FITTING OFF,23-35997,1300,1300,,,3-20-23 1:46 AM,2023-03-20T01:46:00.000Z,4-17-23 12:00 AM,2023-04-17T00:00:00.000Z,5-18-23 9:57 AM,2023-05-18T09:57:00.000Z,4,4,,PM,CLOSE,Y,,NO,CHATHAM,,,,,,,,,,,,,,,,26,2023-03-20T03:50:00.000Z,2023-03-20T18:30:00.000Z,121.66666666666667,5.069444444444445,No,No,Yes,Yes,No,No,No,No,4,1
,CLEAN BLOWER SHAFT GREASE FITTINGS OFF,23-35999,1300,1300,,,3-20-23 1:46 AM,2023-03-20T01:46:00.000Z,4-17-23 12:00 AM,2023-04-17T00:00:00.000Z,5-18-23 9:57 AM,2023-05-18T09:57:00.000Z,4,4,,PM,CLOSE,Y,,NO,CHATHAM,,,,,,,,,,,,,,,,26,2023-03-20T03:50:00.000Z,2023-03-20T18:30:00.000Z,121.66666666666667,5.069444444444445,No,No,Yes,Yes,No,No,No,No,4,1
,GREASE BEARINGS USING ULTRASONIC,23-36000,1300,1300,,,3-20-23 1:46 AM,2023-03-20T01:46:00.000Z,4-17-23 12:00 AM,2023-04-17T00:00:00.000Z,5-18-23 9:57 AM,2023-05-18T09:57:00.000Z,4,4,,PM,CLOSE,Y,,NO,CHATHAM,,,,,,,,,,,,,,,,26,2023-03-20T03:50:00.000Z,2023-03-20T18:30:00.000Z,121.66666666666667,5.069444444444445,No,No,Yes,Yes,No,No,No,No,4,1
,EURODRIVE AGITATOR GEARBOX PM,23-36002,1300,1300,,,3-20-23 1:46 AM,2023-03-20T01:46:00.000Z,4-17-23 1:30 AM,2023-04-17T01:30:00.000Z,5-18-23 9:57 AM,2023-05-18T09:57:00.000Z,4,4,,PM,CLOSE,Y,,NO,CHATHAM,,,,,,,,,,,,,,,,26,2023-03-20T03:50:00.000Z,2023-03-20T18:30:00.000Z,121.66666666666667,5.069444444444445,No,No,Yes,Yes,No,No,No,No,4,1
,1300 AREA - AGITATOR TEMPERATURE CHECKS,23-36003,1300,1300,,,3-20-23 1:46 AM,2023-03-20T01:46:00.000Z,4-17-23 1:30 AM,2023-04-17T01:30:00.000Z,5-18-23 9:57 AM,2023-05-18T09:57:00.000Z,4,4,,PM,CLOSE,Y,,NO,CHATHAM,,,,,,,,,,,,,,,,26,2023-03-20T03:50:00.000Z,2023-03-20T18:30:00.000Z,121.66666666666667,5.069444444444445,No,No,Yes,Yes,No,No,No,No,4,1
,1400 AREA - AGITATOR TEMPERATURE CHECKS,23-36006,1400,1400,,,3-20-23 1:46 AM,2023-03-20T01:46:00.000Z,4-17-23 1:30 AM,2023-04-17T01:30:00.000Z,5-18-23 9:57 AM,2023-05-18T09:57:00.000Z,4,4,,PM,CLOSE,Y,,NO,CHATHAM,,,,,,,,,,,,,,,,26,2023-03-20T03:50:00.000Z,2023-03-20T18:30:00.000Z,121.66666666666667,5.069444444444445,No,No,Yes,Yes,No,No,No,No,4,1
4865,CORN PROBE PM + GREASING,23-36013,SA-2101,SA-2101,,,3-20-23 1:46 AM,2023-03-20T01:46:00.000Z,4-25-23 8:30 AM,2023-04-25T08:30:00.000Z,5-1-23 8:45 AM,2023-05-01T08:45:00.000Z,4,4,,SD,CLOSE,Y,,NO,CHATHAM,,,,,,,,,,,,,,,,26,2023-03-20T03:50:00.000Z,2023-03-20T18:30:00.000Z,121.66666666666667,5.069444444444445,No,No,Yes,Yes,No,No,No,No,4,1
1031,REMOVE COUPLING GUARD AND INSPECT OMEGA ELEMENT,23-36018,P-1409,P-1409,,,3-20-23 1:46 AM,2023-03-20T01:46:00.000Z,4-13-23 12:15 AM,2023-04-13T00:15:00.000Z,5-18-23 9:56 AM,2023-05-18T09:56:00.000Z,4,4,,PM,CLOSE,Y,,NO,CHATHAM,,,,,,,,,,,,,,,,26,2023-03-20T03:50:00.000Z,2023-03-20T18:30:00.000Z,121.66666666666667,5.069444444444445,No,No,Yes,Yes,No,No,No,No,4,1
1051,P-1552A - OIL CHANGE/ PM SERVICE,23-36020,P-1552A,P-1552A,,,3-20-23 1:46 AM,2023-03-20T01:46:00.000Z,5-15-23 1:00 AM,2023-05-15T01:00:00.000Z,6-13-23 10:41 AM,2023-06-13T10:41:00.000Z,4,4,,PM,CLOSE,Y,N,NO,CHATHAM,,,,,,,,,,,,,,,,26,2023-03-20T03:50:00.000Z,2023-03-20T18:30:00.000Z,121.66666666666667,5.069444444444445,No,No,Yes,Yes,No,No,No,No,4,1
1051,OIL CHANGE ON GOULDS PUMPS,23-36021,P-1552A,P-1552A,,,3-20-23 1:46 AM,2023-03-20T01:46:00.000Z,5-15-23 12:30 AM,2023-05-15T00:30:00.000Z,6-13-23 10:41 AM,2023-06-13T10:41:00.000Z,4,4,,PM,CLOSE,Y,,NO,CHATHAM,,,,,,,,,,,,,,,,26,2023-03-20T03:50:00.000Z,2023-03-20T18:30:00.000Z,121.66666666666667,5.069444444444445,No,No,Yes,Yes,No,No,No,No,4,1
1051,CHECK THE IMPROSEALS FOR OIL LEAKAGE,23-36023,P-1552A,P-1552A,,,3-20-23 1:46 AM,2023-03-20T01:46:00.000Z,5-15-23 12:15 AM,2023-05-15T00:15:00.000Z,6-13-23 10:41 AM,2023-06-13T10:41:00.000Z,4,4,,PM,CLOSE,Y,,NO,CHATHAM,,,,,,,,,,,,,,,,26,2023-03-20T03:50:00.000Z,2023-03-20T18:30:00.000Z,121.66666666666667,5.069444444444445,No,No,Yes,Yes,No,No,No,No,4,1
1125,CHECK THE IMPROSEALS FOR OIL LEAKAGE,23-36027,P-2203A,P-2203A,,,3-20-23 1:47 AM,2023-03-20T01:47:00.000Z,4-11-23 12:15 AM,2023-04-11T00:15:00.000Z,5-18-23 9:56 AM,2023-05-18T09:56:00.000Z,4,4,,PM,CLOSE,Y,,NO,CHATHAM,,,,,,,,,,,,,,,,26,2023-03-20T03:50:00.000Z,2023-03-20T18:30:00.000Z,121.66666666666667,5.069444444444445,No,No,Yes,Yes,No,No,No,No,4,1
,TRANSFORMER - (XFMR-3804)  - PM SERVICE,23-36048,3800,3800,,,3-20-23 1:47 AM,2023-03-20T01:47:00.000Z,4-17-23 12:45 AM,2023-04-17T00:45:00.000Z,5-18-23 10:22 AM,2023-05-18T10:22:00.000Z,4,4,,PM,CLOSE,Y,N,NO,CHATHAM,,,,,,,,,,,,,,,,26,2023-03-20T03:50:00.000Z,2023-03-20T18:30:00.000Z,121.66666666666667,5.069444444444445,No,No,Yes,Yes,No,No,No,No,4,1
,TRANSFORMER - (XFMR-3806)  - PM SERVICE,23-36052,3800,3800,,,3-20-23 1:47 AM,2023-03-20T01:47:00.000Z,4-17-23 12:45 AM,2023-04-17T00:45:00.000Z,5-18-23 10:21 AM,2023-05-18T10:21:00.000Z,4,4,,PM,CLOSE,Y,N,NO,CHATHAM,,,,,,,,,,,,,,,,26,2023-03-20T03:50:00.000Z,2023-03-20T18:30:00.000Z,121.66666666666667,5.069444444444445,No,No,Yes,Yes,No,No,No,No,4,1
1125,OIL CHANGE ON GOULDS PUMPS,23-36025,P-2203A,P-2203A,,,3-20-23 1:47 AM,2023-03-20T01:47:00.000Z,4-11-23 12:30 AM,2023-04-11T00:30:00.000Z,5-18-23 9:56 AM,2023-05-18T09:56:00.000Z,4,4,,PM,CLOSE,Y,,NO,CHATHAM,,,,,,,,,,,,,,,,26,2023-03-20T03:50:00.000Z,2023-03-20T18:30:00.000Z,121.66666666666667,5.069444444444445,No,No,Yes,Yes,No,No,No,No,4,1
1133,P-2204A - OIL CHANGE /PM SERVICE,23-36028,P-2204,P-2204,,,3-20-23 1:47 AM,2023-03-20T01:47:00.000Z,4-11-23 1:00 AM,2023-04-11T01:00:00.000Z,5-18-23 9:56 AM,2023-05-18T09:56:00.000Z,4,4,,PM,CLOSE,Y,N,NO,CHATHAM,,,,,,,,,,,,,,,,26,2023-03-20T03:50:00.000Z,2023-03-20T18:30:00.000Z,121.66666666666667,5.069444444444445,No,No,Yes,Yes,No,No,No,No,4,1
7138,ACCULOAD SCULLY CABLE -PM SERVICE,23-36038,FQIC-2203,FQIC-2203,,,3-20-23 1:47 AM,2023-03-20T01:47:00.000Z,4-14-23 12:30 AM,2023-04-14T00:30:00.000Z,5-18-23 9:55 AM,2023-05-18T09:55:00.000Z,4,4,,PM,CLOSE,Y,N,NO,CHATHAM,,,,,,,,,,,,,,,,26,2023-03-20T03:50:00.000Z,2023-03-20T18:30:00.000Z,121.66666666666667,5.069444444444445,No,No,Yes,Yes,No,No,No,No,4,1
,TRANSFORMER  MONTHLY CHECK,23-36045,3800,3800,,,3-20-23 1:47 AM,2023-03-20T01:47:00.000Z,4-17-23 12:45 AM,2023-04-17T00:45:00.000Z,5-18-23 10:22 AM,2023-05-18T10:22:00.000Z,4,4,,PM,CLOSE,Y,,NO,CHATHAM,,,,,,,,,,,,,,,,26,2023-03-20T03:50:00.000Z,2023-03-20T18:30:00.000Z,121.66666666666667,5.069444444444445,No,No,Yes,Yes,No,No,No,No,4,1
,TRANSFORMER  MONTHLY CHECK,23-36047,3800,3800,,,3-20-23 1:47 AM,2023-03-20T01:47:00.000Z,4-17-23 12:45 AM,2023-04-17T00:45:00.000Z,5-18-23 10:22 AM,2023-05-18T10:22:00.000Z,4,4,,PM,CLOSE,Y,,NO,CHATHAM,,,,,,,,,,,,,,,,26,2023-03-20T03:50:00.000Z,2023-03-20T18:30:00.000Z,121.66666666666667,5.069444444444445,No,No,Yes,Yes,No,No,No,No,4,1
,TRANSFORMER  MONTHLY CHECK,23-36053,3800,3800,,,3-20-23 1:47 AM,2023-03-20T01:47:00.000Z,4-17-23 12:45 AM,2023-04-17T00:45:00.000Z,5-18-23 10:21 AM,2023-05-18T10:21:00.000Z,4,4,,PM,CLOSE,Y,,NO,CHATHAM,,,,,,,,,,,,,,,,26,2023-03-20T03:50:00.000Z,2023-03-20T18:30:00.000Z,121.66666666666667,5.069444444444445,No,No,Yes,Yes,No,No,No,No,4,1
1133,CHECK THE IMPROSEALS FOR OIL LEAKAGE,23-36031,P-2204,P-2204,,,3-20-23 1:47 AM,2023-03-20T01:47:00.000Z,4-11-23 12:15 AM,2023-04-11T00:15:00.000Z,5-18-23 9:56 AM,2023-05-18T09:56:00.000Z,4,4,,PM,CLOSE,Y,,NO,CHATHAM,,,,,,,,,,,,,,,,26,2023-03-20T03:50:00.000Z,2023-03-20T18:30:00.000Z,121.66666666666667,5.069444444444445,No,No,Yes,Yes,No,No,No,No,4,1
1136,P-2205A - OIL CHANGE/ PM SERVICE,23-36032,P-2205,P-2205,,,3-20-23 1:47 AM,2023-03-20T01:47:00.000Z,4-11-23 1:00 AM,2023-04-11T01:00:00.000Z,5-18-23 9:56 AM,2023-05-18T09:56:00.000Z,4,4,,PM,CLOSE,Y,N,NO,CHATHAM,,,,,,,,,,,,,,,,26,2023-03-20T03:50:00.000Z,2023-03-20T18:30:00.000Z,121.66666666666667,5.069444444444445,No,No,Yes,Yes,No,No,No,No,4,1
1136,REMOVE COUPLING GUARD AND INSPECT OMEGA ELEMENT,23-36034,P-2205,P-2205,,,3-20-23 1:47 AM,2023-03-20T01:47:00.000Z,4-11-23 12:15 AM,2023-04-11T00:15:00.000Z,5-18-23 9:56 AM,2023-05-18T09:56:00.000Z,4,4,,PM,CLOSE,Y,,NO,CHATHAM,,,,,,,,,,,,,,,,26,2023-03-20T03:50:00.000Z,2023-03-20T18:30:00.000Z,121.66666666666667,5.069444444444445,No,No,Yes,Yes,No,No,No,No,4,1
1136,CHECK THE IMPROSEALS FOR OIL LEAKAGE,23-36035,P-2205,P-2205,,,3-20-23 1:47 AM,2023-03-20T01:47:00.000Z,4-11-23 12:15 AM,2023-04-11T00:15:00.000Z,5-18-23 9:56 AM,2023-05-18T09:56:00.000Z,4,4,,PM,CLOSE,Y,,NO,CHATHAM,,,,,,,,,,,,,,,,26,2023-03-20T03:50:00.000Z,2023-03-20T18:30:00.000Z,121.66666666666667,5.069444444444445,No,No,Yes,Yes,No,No,No,No,4,1
1323,Follow procedure in Scott/Bacharach catalogue,23-36057,BU-GHR,BU-GHR,,,3-20-23 1:47 AM,2023-03-20T01:47:00.000Z,4-12-23 1:00 AM,2023-04-12T01:00:00.000Z,6-26-23 10:28 AM,2023-06-26T10:28:00.000Z,4,4,,PM,CLOSE,Y,,NO,CHATHAM,,,,,,,,,,,,,,,,26,2023-03-20T03:50:00.000Z,2023-03-20T18:30:00.000Z,121.66666666666667,5.069444444444445,No,No,Yes,Yes,No,No,No,No,4,1
1125,REMOVE COUPLING GUARD AND INSPECT OMEGA ELEMENT,23-36026,P-2203A,P-2203A,,,3-20-23 1:47 AM,2023-03-20T01:47:00.000Z,4-11-23 12:15 AM,2023-04-11T00:15:00.000Z,5-18-23 9:56 AM,2023-05-18T09:56:00.000Z,4,4,,PM,CLOSE,Y,,NO,CHATHAM,,,,,,,,,,,,,,,,26,2023-03-20T03:50:00.000Z,2023-03-20T18:30:00.000Z,121.66666666666667,5.069444444444445,No,No,Yes,Yes,No,No,No,No,4,1
1133,OIL CHANGE ON GOULDS PUMPS,23-36029,P-2204,P-2204,,,3-20-23 1:47 AM,2023-03-20T01:47:00.000Z,4-11-23 12:30 AM,2023-04-11T00:30:00.000Z,5-18-23 9:56 AM,2023-05-18T09:56:00.000Z,4,4,,PM,CLOSE,Y,,NO,CHATHAM,,,,,,,,,,,,,,,,26,2023-03-20T03:50:00.000Z,2023-03-20T18:30:00.000Z,121.66666666666667,5.069444444444445,No,No,Yes,Yes,No,No,No,No,4,1
1136,OIL CHANGE ON GOULDS PUMPS,23-36033,P-2205,P-2205,,,3-20-23 1:47 AM,2023-03-20T01:47:00.000Z,4-11-23 12:30 AM,2023-04-11T00:30:00.000Z,5-18-23 9:56 AM,2023-05-18T09:56:00.000Z,4,4,,PM,CLOSE,Y,,NO,CHATHAM,,,,,,,,,,,,,,,,26,2023-03-20T03:50:00.000Z,2023-03-20T18:30:00.000Z,121.66666666666667,5.069444444444445,No,No,Yes,Yes,No,No,No,No,4,1
7138,ACCULOAD SCULLY CABLE BI-WEEKLY PM,23-36039,FQIC-2203,FQIC-2203,,,3-20-23 1:47 AM,2023-03-20T01:47:00.000Z,4-14-23 12:30 AM,2023-04-14T00:30:00.000Z,5-18-23 9:55 AM,2023-05-18T09:55:00.000Z,4,4,,PM,CLOSE,Y,,NO,CHATHAM,,,,,,,,,,,,,,,,26,2023-03-20T03:50:00.000Z,2023-03-20T18:30:00.000Z,121.66666666666667,5.069444444444445,No,No,Yes,Yes,No,No,No,No,4,1
4868,SC-1301 - MECHANICAL CHECKS,23-36040,SC-1301,SC-1301,,,3-20-23 1:47 AM,2023-03-20T01:47:00.000Z,4-17-23 1:00 AM,2023-04-17T01:00:00.000Z,5-2-23 8:49 AM,2023-05-02T08:49:00.000Z,4,4,,PM,CLOSE,Y,N,NO,CHATHAM,,,,,,,,,,,,,,,,26,2023-03-20T03:50:00.000Z,2023-03-20T18:30:00.000Z,121.66666666666667,5.069444444444445,No,No,Yes,Yes,No,No,No,No,4,1
,TRANSFORMER  MONTHLY CHECK,23-36049,3800,3800,,,3-20-23 1:47 AM,2023-03-20T01:47:00.000Z,4-17-23 12:45 AM,2023-04-17T00:45:00.000Z,5-18-23 10:22 AM,2023-05-18T10:22:00.000Z,4,4,,PM,CLOSE,Y,,NO,CHATHAM,,,,,,,,,,,,,,,,26,2023-03-20T03:50:00.000Z,2023-03-20T18:30:00.000Z,121.66666666666667,5.069444444444445,No,No,Yes,Yes,No,No,No,No,4,1
1133,REMOVE COUPLING GUARD AND INSPECT OMEGA ELEMENT,23-36030,P-2204,P-2204,,,3-20-23 1:47 AM,2023-03-20T01:47:00.000Z,4-11-23 12:15 AM,2023-04-11T00:15:00.000Z,5-18-23 9:56 AM,2023-05-18T09:56:00.000Z,4,4,,PM,CLOSE,Y,,NO,CHATHAM,,,,,,,,,,,,,,,,26,2023-03-20T03:50:00.000Z,2023-03-20T18:30:00.000Z,121.66666666666667,5.069444444444445,No,No,Yes,Yes,No,No,No,No,4,1
4868,SC-1301 MECHANICAL CHECKS,23-36041,SC-1301,SC-1301,,,3-20-23 1:47 AM,2023-03-20T01:47:00.000Z,4-17-23 1:00 AM,2023-04-17T01:00:00.000Z,5-2-23 8:49 AM,2023-05-02T08:49:00.000Z,4,4,,PM,CLOSE,Y,,NO,CHATHAM,,,,,,,,,,,,,,,,26,2023-03-20T03:50:00.000Z,2023-03-20T18:30:00.000Z,121.66666666666667,5.069444444444445,No,No,Yes,Yes,No,No,No,No,4,1
,TRANSFORMER - (XFMR-3801)  - PM SERVICE,23-36042,3800,3800,,,3-20-23 1:47 AM,2023-03-20T01:47:00.000Z,4-17-23 12:45 AM,2023-04-17T00:45:00.000Z,5-18-23 10:22 AM,2023-05-18T10:22:00.000Z,4,4,,PM,CLOSE,Y,N,NO,CHATHAM,,,,,,,,,,,,,,,,26,2023-03-20T03:50:00.000Z,2023-03-20T18:30:00.000Z,121.66666666666667,5.069444444444445,No,No,Yes,Yes,No,No,No,No,4,1
,TRANSFORMER  MONTHLY CHECK,23-36043,3800,3800,,,3-20-23 1:47 AM,2023-03-20T01:47:00.000Z,4-17-23 12:45 AM,2023-04-17T00:45:00.000Z,5-18-23 10:22 AM,2023-05-18T10:22:00.000Z,4,4,,PM,CLOSE,Y,,NO,CHATHAM,,,,,,,,,,,,,,,,26,2023-03-20T03:50:00.000Z,2023-03-20T18:30:00.000Z,121.66666666666667,5.069444444444445,No,No,Yes,Yes,No,No,No,No,4,1
,TRANSFORMER - (XFMR-3802)  - PM SERVICE,23-36044,3800,3800,,,3-20-23 1:47 AM,2023-03-20T01:47:00.000Z,4-17-23 12:45 AM,2023-04-17T00:45:00.000Z,5-18-23 10:22 AM,2023-05-18T10:22:00.000Z,4,4,,PM,CLOSE,Y,N,NO,CHATHAM,,,,,,,,,,,,,,,,26,2023-03-20T03:50:00.000Z,2023-03-20T18:30:00.000Z,121.66666666666667,5.069444444444445,No,No,Yes,Yes,No,No,No,No,4,1
,TRANSFORMER - (XFMR-3803)  - PM SERVICE,23-36046,3800,3800,,,3-20-23 1:47 AM,2023-03-20T01:47:00.000Z,4-17-23 12:45 AM,2023-04-17T00:45:00.000Z,5-18-23 10:22 AM,2023-05-18T10:22:00.000Z,4,4,,PM,CLOSE,Y,N,NO,CHATHAM,,,,,,,,,,,,,,,,26,2023-03-20T03:50:00.000Z,2023-03-20T18:30:00.000Z,121.66666666666667,5.069444444444445,No,No,Yes,Yes,No,No,No,No,4,1
,TRANSFORMER - (XFMR-3805)  - PM SERVICE,23-36050,3800,3800,,,3-20-23 1:47 AM,2023-03-20T01:47:00.000Z,4-17-23 12:45 AM,2023-04-17T00:45:00.000Z,5-18-23 10:21 AM,2023-05-18T10:21:00.000Z,4,4,,PM,CLOSE,Y,N,NO,CHATHAM,,,,,,,,,,,,,,,,26,2023-03-20T03:50:00.000Z,2023-03-20T18:30:00.000Z,121.66666666666667,5.069444444444445,No,No,Yes,Yes,No,No,No,No,4,1
,TRANSFORMER  MONTHLY CHECK,23-36051,3800,3800,,,3-20-23 1:47 AM,2023-03-20T01:47:00.000Z,4-17-23 12:45 AM,2023-04-17T00:45:00.000Z,5-18-23 10:21 AM,2023-05-18T10:21:00.000Z,4,4,,PM,CLOSE,Y,,NO,CHATHAM,,,,,,,,,,,,,,,,26,2023-03-20T03:50:00.000Z,2023-03-20T18:30:00.000Z,121.66666666666667,5.069444444444445,No,No,Yes,Yes,No,No,No,No,4,1
1323,GAS DETECTOR - (4600 MB) - PM SERVICE,23-36056,BU-GHR,BU-GHR,,,3-20-23 1:47 AM,2023-03-20T01:47:00.000Z,4-12-23 1:00 AM,2023-04-12T01:00:00.000Z,6-26-23 10:28 AM,2023-06-26T10:28:00.000Z,4,4,,PM,CLOSE,Y,N,NO,CHATHAM,,,,,,,,,,,,,,,,26,2023-03-20T03:50:00.000Z,2023-03-20T18:30:00.000Z,121.66666666666667,5.069444444444445,No,No,Yes,Yes,No,No,No,No,4,1
1293,BL-1804D - WEEKLY BEARING GREASING,23-36086,BL-1804D,BL-1804D,,,3-20-23 1:48 AM,2023-03-20T01:48:00.000Z,4-17-23 12:00 AM,2023-04-17T00:00:00.000Z,5-18-23 10:19 AM,2023-05-18T10:19:00.000Z,4,4,,PM,CLOSE,Y,N,NO,CHATHAM,"1293, 6864","BLOWER, NYB, MODEL 714 SERIES 45, GENERAL INDUSTRIAL, CW/UB, Arrg't 8, MOTOR / 450HP / 1200RPM / TEFC / 2300V/3PH/60HZ / FR# 5808C",,No,DRYER D,CH-DRYER_D_BLR,CH-DRYER_D_BLR:BL1804D.STAIND,BL-1804D,BL,STAIND,"Status indication (open/closed, run/stop)",Blower (asset),Equipment status,CYCLONE INLET PRESSURE,,26,2023-03-20T03:50:00.000Z,2023-03-20T18:30:00.000Z,121.66666666666667,5.069444444444445,No,No,Yes,Yes,No,No,No,No,4,1
7174,DRYER SCRUBBER PH PROBE PM,23-36058,AE-84404,AE-84404,,,3-20-23 1:48 AM,2023-03-20T01:48:00.000Z,4-13-23 1:00 AM,2023-04-13T01:00:00.000Z,5-18-23 10:21 AM,2023-05-18T10:21:00.000Z,4,4,,PM,CLOSE,Y,N,NO,CHATHAM,,,,,,,,,,,,,,,,26,2023-03-20T03:50:00.000Z,2023-03-20T18:30:00.000Z,121.66666666666667,5.069444444444445,No,No,Yes,Yes,No,No,No,No,4,1
6798,CRITICAL MOTOR TESTING,23-36069,BL-3605,BL-3605,,,3-20-23 1:48 AM,2023-03-20T01:48:00.000Z,4-18-24 12:00 AM,2024-04-18T00:00:00.000Z,5-15-24 7:41 AM,2024-05-15T07:41:00.000Z,4,4,,PM,CLOSE,Y,N,NO,CHATHAM,,,,,,,,,,,,,,,,26,2023-03-20T03:50:00.000Z,2023-03-20T18:30:00.000Z,121.66666666666667,5.069444444444445,No,No,Yes,Yes,No,No,No,No,4,1
1227,PH PROBE CLEANING AND CALIBRATION PM,23-36071,AT-13519,AT-13519,,,3-20-23 1:48 AM,2023-03-20T01:48:00.000Z,4-13-23 12:00 AM,2023-04-13T00:00:00.000Z,5-18-23 10:20 AM,2023-05-18T10:20:00.000Z,4,4,,PM,CLOSE,Y,N,NO,CHATHAM,,,,,,,,,,,,,,,,26,2023-03-20T03:50:00.000Z,2023-03-20T18:30:00.000Z,121.66666666666667,5.069444444444445,No,No,Yes,Yes,No,No,No,No,4,1
1227,PH PROBE CLEANING AND CALIBRATION WEEKLY PM,23-36072,AT-13519,AT-13519,,,3-20-23 1:48 AM,2023-03-20T01:48:00.000Z,4-13-23 1:00 AM,2023-04-13T01:00:00.000Z,5-18-23 10:20 AM,2023-05-18T10:20:00.000Z,4,4,,PM,CLOSE,Y,,NO,CHATHAM,,,,,,,,,,,,,,,,26,2023-03-20T03:50:00.000Z,2023-03-20T18:30:00.000Z,121.66666666666667,5.069444444444445,No,No,Yes,Yes,No,No,No,No,4,1
,Weekly Vibration check (GFE I/E),23-36077,MI-1201B,MI-1201B,,,3-20-23 1:48 AM,2023-03-20T01:48:00.000Z,4-17-23 12:00 AM,2023-04-17T00:00:00.000Z,5-18-23 9:47 AM,2023-05-18T09:47:00.000Z,4,4,,PM,CLOSE,Y,,NO,CHATHAM,,,,,,,,,,,,,,,,26,2023-03-20T03:50:00.000Z,2023-03-20T18:30:00.000Z,121.66666666666667,5.069444444444445,No,No,Yes,Yes,No,No,No,No,4,1
,TRANSFORMER  MONTHLY CHECK,23-36082,3800,3800,,,3-20-23 1:48 AM,2023-03-20T01:48:00.000Z,4-17-23 12:45 AM,2023-04-17T00:45:00.000Z,5-18-23 10:20 AM,2023-05-18T10:20:00.000Z,4,4,,PM,CLOSE,Y,,NO,CHATHAM,,,,,,,,,,,,,,,,26,2023-03-20T03:50:00.000Z,2023-03-20T18:30:00.000Z,121.66666666666667,5.069444444444445,No,No,Yes,Yes,No,No,No,No,4,1
,TRANSFORMER  MONTHLY CHECK,23-36084,3800,3800,,,3-20-23 1:48 AM,2023-03-20T01:48:00.000Z,4-17-23 12:45 AM,2023-04-17T00:45:00.000Z,5-18-23 10:20 AM,2023-05-18T10:20:00.000Z,4,4,,PM,CLOSE,Y,,NO,CHATHAM,,,,,,,,,,,,,,,,26,2023-03-20T03:50:00.000Z,2023-03-20T18:30:00.000Z,121.66666666666667,5.069444444444445,No,No,Yes,Yes,No,No,No,No,4,1
,TRANSFORMER - (XFMR-3804B)  - PM SERVICE,23-36081,3800,3800,,,3-20-23 1:48 AM,2023-03-20T01:48:00.000Z,4-17-23 12:45 AM,2023-04-17T00:45:00.000Z,5-18-23 10:20 AM,2023-05-18T10:20:00.000Z,4,4,,PM,CLOSE,Y,N,NO,CHATHAM,,,,,,,,,,,,,,,,26,2023-03-20T03:50:00.000Z,2023-03-20T18:30:00.000Z,121.66666666666667,5.069444444444445,No,No,Yes,Yes,No,No,No,No,4,1
7174,CONDUCTIVITY METER /PH PROBE CLEAN & CALIBRATE PM,23-36059,AE-84404,AE-84404,,,3-20-23 1:48 AM,2023-03-20T01:48:00.000Z,4-13-23 2:00 AM,2023-04-13T02:00:00.000Z,5-18-23 10:21 AM,2023-05-18T10:21:00.000Z,4,4,,PM,CLOSE,Y,,NO,CHATHAM,,,,,,,,,,,,,,,,26,2023-03-20T03:50:00.000Z,2023-03-20T18:30:00.000Z,121.66666666666667,5.069444444444445,No,No,Yes,Yes,No,No,No,No,4,1
1299,CRITICAL MOTOR TESTING (600 VAC 3 PHASE),23-36066,BL-3602,BL-3602,,,3-20-23 1:48 AM,2023-03-20T01:48:00.000Z,4-13-23 12:00 AM,2023-04-13T00:00:00.000Z,5-15-24 7:41 AM,2024-05-15T07:41:00.000Z,4,4,,PM,CLOSE,Y,,NO,CHATHAM,,,,,,,,,,,,,,,,26,2023-03-20T03:50:00.000Z,2023-03-20T18:30:00.000Z,121.66666666666667,5.069444444444445,No,No,Yes,Yes,No,No,No,No,4,1
1230,PH PROBE CLEANING AND CALIBRATION WEEKLY PM,23-36074,AT-14125,AT-14125,,,3-20-23 1:48 AM,2023-03-20T01:48:00.000Z,4-13-23 1:00 AM,2023-04-13T01:00:00.000Z,5-18-23 10:20 AM,2023-05-18T10:20:00.000Z,4,4,,PM,CLOSE,Y,,NO,CHATHAM,,,,,,,,,,,,,,,,26,2023-03-20T03:50:00.000Z,2023-03-20T18:30:00.000Z,121.66666666666667,5.069444444444445,No,No,Yes,Yes,No,No,No,No,4,1
,MI-1201B - MECHANICAL PM,23-36075,MI-1201B,MI-1201B,,,3-20-23 1:48 AM,2023-03-20T01:48:00.000Z,4-17-23 12:30 AM,2023-04-17T00:30:00.000Z,5-18-23 9:47 AM,2023-05-18T09:47:00.000Z,4,4,,PM,CLOSE,Y,N,NO,CHATHAM,,,,,,,,,,,,,,,,26,2023-03-20T03:50:00.000Z,2023-03-20T18:30:00.000Z,121.66666666666667,5.069444444444445,No,No,Yes,Yes,No,No,No,No,4,1
,C-MI-1201B - MECHANICAL PM,23-36076,MI-1201B,MI-1201B,,,3-20-23 1:48 AM,2023-03-20T01:48:00.000Z,4-17-23 12:00 AM,2023-04-17T00:00:00.000Z,5-18-23 9:47 AM,2023-05-18T09:47:00.000Z,4,4,,PM,CLOSE,Y,,NO,CHATHAM,,,,,,,,,,,,,,,,26,2023-03-20T03:50:00.000Z,2023-03-20T18:30:00.000Z,121.66666666666667,5.069444444444445,No,No,Yes,Yes,No,No,No,No,4,1
,HAMMERMILL WEEKLY PM & ROTATION CHANGE,23-36079,MI-1201A,MI-1201A,,,3-20-23 1:48 AM,2023-03-20T01:48:00.000Z,4-13-23 12:00 AM,2023-04-13T00:00:00.000Z,5-18-23 9:47 AM,2023-05-18T09:47:00.000Z,4,4,,PM,CLOSE,Y,,NO,CHATHAM,,,,,,,,,,,,,,,,26,2023-03-20T03:50:00.000Z,2023-03-20T18:30:00.000Z,121.66666666666667,5.069444444444445,No,No,Yes,Yes,No,No,No,No,4,1
,Weekly Vibration check (GFE I/E),23-36080,MI-1201A,MI-1201A,,,3-20-23 1:48 AM,2023-03-20T01:48:00.000Z,4-13-23 12:00 AM,2023-04-13T00:00:00.000Z,5-18-23 9:47 AM,2023-05-18T09:47:00.000Z,4,4,,PM,CLOSE,Y,,NO,CHATHAM,,,,,,,,,,,,,,,,26,2023-03-20T03:50:00.000Z,2023-03-20T18:30:00.000Z,121.66666666666667,5.069444444444445,No,No,Yes,Yes,No,No,No,No,4,1
,TRANSFORMER - (XFMR-3816)  - PM SERVICE,23-36063,3800,3800,,,3-20-23 1:48 AM,2023-03-20T01:48:00.000Z,4-17-23 12:45 AM,2023-04-17T00:45:00.000Z,5-18-23 10:20 AM,2023-05-18T10:20:00.000Z,4,4,,PM,CLOSE,Y,N,NO,CHATHAM,,,,,,,,,,,,,,,,26,2023-03-20T03:50:00.000Z,2023-03-20T18:30:00.000Z,121.66666666666667,5.069444444444445,No,No,Yes,Yes,No,No,No,No,4,1
6798,CRITICAL MOTOR TESTING (600 VAC 3 PHASE),23-36070,BL-3605,BL-3605,,,3-20-23 1:48 AM,2023-03-20T01:48:00.000Z,4-13-23 12:00 AM,2023-04-13T00:00:00.000Z,5-15-24 7:41 AM,2024-05-15T07:41:00.000Z,4,4,,PM,CLOSE,Y,,NO,CHATHAM,,,,,,,,,,,,,,,,26,2023-03-20T03:50:00.000Z,2023-03-20T18:30:00.000Z,121.66666666666667,5.069444444444445,No,No,Yes,Yes,No,No,No,No,4,1
,MI-1201A - MECHANICAL PM,23-36078,MI-1201A,MI-1201A,,,3-20-23 1:48 AM,2023-03-20T01:48:00.000Z,4-13-23 12:30 AM,2023-04-13T00:30:00.000Z,5-18-23 9:47 AM,2023-05-18T09:47:00.000Z,4,4,,PM,CLOSE,Y,N,NO,CHATHAM,,,,,,,,,,,,,,,,26,2023-03-20T03:50:00.000Z,2023-03-20T18:30:00.000Z,121.66666666666667,5.069444444444445,No,No,Yes,Yes,No,No,No,No,4,1
,TRANSFORMER - (XFMR-3818)  - PM SERVICE,23-36083,3800,3800,,,3-20-23 1:48 AM,2023-03-20T01:48:00.000Z,4-17-23 12:45 AM,2023-04-17T00:45:00.000Z,5-18-23 10:20 AM,2023-05-18T10:20:00.000Z,4,4,,PM,CLOSE,Y,N,NO,CHATHAM,,,,,,,,,,,,,,,,26,2023-03-20T03:50:00.000Z,2023-03-20T18:30:00.000Z,121.66666666666667,5.069444444444445,No,No,Yes,Yes,No,No,No,No,4,1
,TRANSFORMER  MONTHLY CHECK,23-36064,3800,3800,,,3-20-23 1:48 AM,2023-03-20T01:48:00.000Z,4-17-23 12:45 AM,2023-04-17T00:45:00.000Z,5-18-23 10:20 AM,2023-05-18T10:20:00.000Z,4,4,,PM,CLOSE,Y,,NO,CHATHAM,,,,,,,,,,,,,,,,26,2023-03-20T03:50:00.000Z,2023-03-20T18:30:00.000Z,121.66666666666667,5.069444444444445,No,No,Yes,Yes,No,No,No,No,4,1
1299,CRITICAL MOTOR TESTING,23-36065,BL-3602,BL-3602,,,3-20-23 1:48 AM,2023-03-20T01:48:00.000Z,4-18-24 12:00 AM,2024-04-18T00:00:00.000Z,5-15-24 7:41 AM,2024-05-15T07:41:00.000Z,4,4,,PM,CLOSE,Y,N,NO,CHATHAM,,,,,,,,,,,,,,,,26,2023-03-20T03:50:00.000Z,2023-03-20T18:30:00.000Z,121.66666666666667,5.069444444444445,No,No,Yes,Yes,No,No,No,No,4,1
1033,CRITICAL MOTOR TESTING,23-36067,P-1401,P-1401,,,3-20-23 1:48 AM,2023-03-20T01:48:00.000Z,4-9-24 12:00 AM,2024-04-09T00:00:00.000Z,5-22-24 7:49 AM,2024-05-22T07:49:00.000Z,4,4,,PM,CLOSE,Y,N,NO,CHATHAM,,,,,,,,,,,,,,,,26,2023-03-20T03:50:00.000Z,2023-03-20T18:30:00.000Z,121.66666666666667,5.069444444444445,No,No,Yes,Yes,No,No,No,No,4,1
1033,CRITICAL MOTOR TESTING (4160 VAC 3 PHASE),23-36068,P-1401,P-1401,,,3-20-23 1:48 AM,2023-03-20T01:48:00.000Z,4-13-23 12:00 AM,2023-04-13T00:00:00.000Z,5-22-24 7:49 AM,2024-05-22T07:49:00.000Z,4,4,,PM,CLOSE,Y,,NO,CHATHAM,,,,,,,,,,,,,,,,26,2023-03-20T03:50:00.000Z,2023-03-20T18:30:00.000Z,121.66666666666667,5.069444444444445,No,No,Yes,Yes,No,No,No,No,4,1
1230,PH PROBE CLEANING AND CALIBRATION PM,23-36073,AT-14125,AT-14125,,,3-20-23 1:48 AM,2023-03-20T01:48:00.000Z,4-13-23 12:00 AM,2023-04-13T00:00:00.000Z,5-18-23 10:20 AM,2023-05-18T10:20:00.000Z,4,4,,PM,CLOSE,Y,N,NO,CHATHAM,,,,,,,,,,,,,,,,26,2023-03-20T03:50:00.000Z,2023-03-20T18:30:00.000Z,121.66666666666667,5.069444444444445,No,No,Yes,Yes,No,No,No,No,4,1
,"Area Asset Checks-1600, 1660, 1700",23-36092,1600,1600,,,3-20-23 1:49 AM,2023-03-20T01:49:00.000Z,4-17-23 12:00 AM,2023-04-17T00:00:00.000Z,5-18-23 9:50 AM,2023-05-18T09:50:00.000Z,4,4,,PM,CLOSE,Y,N,NO,CHATHAM,,,,,,,,,,,,,,,,26,2023-03-20T03:50:00.000Z,2023-03-20T18:30:00.000Z,121.66666666666667,5.069444444444445,No,No,Yes,Yes,No,No,No,No,4,1
,"Area Asset Checks-1830, 1840, DDG Cooler",23-36097,1800,1800,,,3-20-23 1:49 AM,2023-03-20T01:49:00.000Z,4-17-23 12:00 AM,2023-04-17T00:00:00.000Z,5-18-23 9:49 AM,2023-05-18T09:49:00.000Z,4,4,,PM,CLOSE,Y,,NO,CHATHAM,,,,,,,,,,,,,,,,26,2023-03-20T03:50:00.000Z,2023-03-20T18:30:00.000Z,121.66666666666667,5.069444444444445,No,No,Yes,Yes,No,No,No,No,4,1
,PH PROBE CLEANING AND CALIBRATION WEEKLY PM,23-36109,AT-84505,AT-84505,,,3-20-23 1:49 AM,2023-03-20T01:49:00.000Z,4-13-23 1:00 AM,2023-04-13T01:00:00.000Z,5-18-23 10:19 AM,2023-05-18T10:19:00.000Z,4,4,,PM,CLOSE,Y,,NO,CHATHAM,,,,,,,,,,,,,,,,26,2023-03-20T03:50:00.000Z,2023-03-20T18:30:00.000Z,121.66666666666667,5.069444444444445,No,No,Yes,Yes,No,No,No,No,4,1
,"Area Asset Checks-1500, 6500 (Distillation)",23-36091,1500,1500,,,3-20-23 1:49 AM,2023-03-20T01:49:00.000Z,4-17-23 12:00 AM,2023-04-17T00:00:00.000Z,5-18-23 9:50 AM,2023-05-18T09:50:00.000Z,4,4,,PM,CLOSE,Y,,NO,CHATHAM,,,,,,,,,,,,,,,,26,2023-03-20T03:50:00.000Z,2023-03-20T18:30:00.000Z,121.66666666666667,5.069444444444445,No,No,Yes,Yes,No,No,No,No,4,1
,"Area Asset Checks-2200, 2300, 3200, 3600, 4100",23-36094,2200,2200,,,3-20-23 1:49 AM,2023-03-20T01:49:00.000Z,4-17-23 12:00 AM,2023-04-17T00:00:00.000Z,5-18-23 9:49 AM,2023-05-18T09:49:00.000Z,4,4,,PM,CLOSE,Y,N,NO,CHATHAM,,,,,,,,,,,,,,,,26,2023-03-20T03:50:00.000Z,2023-03-20T18:30:00.000Z,121.66666666666667,5.069444444444445,No,No,Yes,Yes,No,No,No,No,4,1
,"Area Asset Checks-2100, 1200, 1300, 1400 (Corn, Mill, Mash, Fermentation)",23-36098,2100,2100,,,3-20-23 1:49 AM,2023-03-20T01:49:00.000Z,4-17-23 12:00 AM,2023-04-17T00:00:00.000Z,5-18-23 9:49 AM,2023-05-18T09:49:00.000Z,4,4,,PM,CLOSE,Y,N,NO,CHATHAM,,,,,,,,,,,,,,,,26,2023-03-20T03:50:00.000Z,2023-03-20T18:30:00.000Z,121.66666666666667,5.069444444444445,No,No,Yes,Yes,No,No,No,No,4,1
,"Area Asset Checks-1500, 6500",23-36100,1500,1500,,,3-20-23 1:49 AM,2023-03-20T01:49:00.000Z,4-17-23 12:00 AM,2023-04-17T00:00:00.000Z,5-18-23 9:49 AM,2023-05-18T09:49:00.000Z,4,4,,PM,CLOSE,Y,N,NO,CHATHAM,,,,,,,,,,,,,,,,26,2023-03-20T03:50:00.000Z,2023-03-20T18:30:00.000Z,121.66666666666667,5.069444444444445,No,No,Yes,Yes,No,No,No,No,4,1
,"Area Asset Checks-1830, 1840, DDG Cooler",23-36106,1800,1800,,,3-20-23 1:49 AM,2023-03-20T01:49:00.000Z,4-17-23 12:00 AM,2023-04-17T00:00:00.000Z,5-18-23 9:48 AM,2023-05-18T09:48:00.000Z,4,4,,PM,CLOSE,Y,N,NO,CHATHAM,,,,,,,,,,,,,,,,26,2023-03-20T03:50:00.000Z,2023-03-20T18:30:00.000Z,121.66666666666667,5.069444444444445,No,No,Yes,Yes,No,No,No,No,4,1
,C-1803D pH Meter-Weekly PM,23-36108,AT-84505,AT-84505,,,3-20-23 1:49 AM,2023-03-20T01:49:00.000Z,4-13-23 12:00 AM,2023-04-13T00:00:00.000Z,5-18-23 10:19 AM,2023-05-18T10:19:00.000Z,4,4,,PM,CLOSE,Y,N,NO,CHATHAM,,,,,,,,,,,,,,,,26,2023-03-20T03:50:00.000Z,2023-03-20T18:30:00.000Z,121.66666666666667,5.069444444444445,No,No,Yes,Yes,No,No,No,No,4,1
,"Area Asset Checks-2100, 1200, 1300, 1400 (Corn, Mill, Mash, Fermentation)",23-36089,2100,2100,,,3-20-23 1:49 AM,2023-03-20T01:49:00.000Z,4-17-23 5:00 AM,2023-04-17T05:00:00.000Z,5-18-23 9:50 AM,2023-05-18T09:50:00.000Z,4,4,,PM,CLOSE,Y,,NO,CHATHAM,,,,,,,,,,,,,,,,26,2023-03-20T03:50:00.000Z,2023-03-20T18:30:00.000Z,121.66666666666667,5.069444444444445,No,No,Yes,Yes,No,No,No,No,4,1
,"Area Asset Checks-1500, 6500",23-36090,1500,1500,,,3-20-23 1:49 AM,2023-03-20T01:49:00.000Z,4-17-23 12:00 AM,2023-04-17T00:00:00.000Z,5-18-23 9:50 AM,2023-05-18T09:50:00.000Z,4,4,,PM,CLOSE,Y,N,NO,CHATHAM,,,,,,,,,,,,,,,,26,2023-03-20T03:50:00.000Z,2023-03-20T18:30:00.000Z,121.66666666666667,5.069444444444445,No,No,Yes,Yes,No,No,No,No,4,1
,"Area Asset Checks-1830, 1840, DDG Cooler",23-36096,1800,1800,,,3-20-23 1:49 AM,2023-03-20T01:49:00.000Z,4-17-23 12:00 AM,2023-04-17T00:00:00.000Z,5-18-23 9:49 AM,2023-05-18T09:49:00.000Z,4,4,,PM,CLOSE,Y,N,NO,CHATHAM,,,,,,,,,,,,,,,,26,2023-03-20T03:50:00.000Z,2023-03-20T18:30:00.000Z,121.66666666666667,5.069444444444445,No,No,Yes,Yes,No,No,No,No,4,1
,"Area Asset Checks-2200, 2300, 3200, 3600, 4100",23-36104,2200,2200,,,3-20-23 1:49 AM,2023-03-20T01:49:00.000Z,4-17-23 12:00 AM,2023-04-17T00:00:00.000Z,5-18-23 9:48 AM,2023-05-18T09:48:00.000Z,4,4,,PM,CLOSE,Y,N,NO,CHATHAM,,,,,,,,,,,,,,,,26,2023-03-20T03:50:00.000Z,2023-03-20T18:30:00.000Z,121.66666666666667,5.069444444444445,No,No,Yes,Yes,No,No,No,No,4,1
1293,BL-1804D WEEKLY GREASING,23-36087,BL-1804D,BL-1804D,,,3-20-23 1:49 AM,2023-03-20T01:49:00.000Z,4-17-23 12:00 AM,2023-04-17T00:00:00.000Z,5-18-23 10:19 AM,2023-05-18T10:19:00.000Z,4,4,,PM,CLOSE,Y,,NO,CHATHAM,"1293, 6864","BLOWER, NYB, MODEL 714 SERIES 45, GENERAL INDUSTRIAL, CW/UB, Arrg't 8, MOTOR / 450HP / 1200RPM / TEFC / 2300V/3PH/60HZ / FR# 5808C",,No,DRYER D,CH-DRYER_D_BLR,CH-DRYER_D_BLR:BL1804D.STAIND,BL-1804D,BL,STAIND,"Status indication (open/closed, run/stop)",Blower (asset),Equipment status,CYCLONE INLET PRESSURE,,26,2023-03-20T03:50:00.000Z,2023-03-20T18:30:00.000Z,121.66666666666667,5.069444444444445,No,No,Yes,Yes,No,No,No,No,4,1
,"Area Asset Checks-2100, 1200, 1300, 1400 (Corn, Mill, Mash, Fermentation)",23-36088,2100,2100,,,3-20-23 1:49 AM,2023-03-20T01:49:00.000Z,4-17-23 12:00 AM,2023-04-17T00:00:00.000Z,5-18-23 9:50 AM,2023-05-18T09:50:00.000Z,4,4,,PM,CLOSE,Y,N,NO,CHATHAM,,,,,,,,,,,,,,,,26,2023-03-20T03:50:00.000Z,2023-03-20T18:30:00.000Z,121.66666666666667,5.069444444444445,No,No,Yes,Yes,No,No,No,No,4,1
,"Area Asset Checks-1600, 1660, 1700 (Evaps, Corn oil, Decanyers)",23-36093,1600,1600,,,3-20-23 1:49 AM,2023-03-20T01:49:00.000Z,4-17-23 12:00 AM,2023-04-17T00:00:00.000Z,5-18-23 9:50 AM,2023-05-18T09:50:00.000Z,4,4,,PM,CLOSE,Y,,NO,CHATHAM,,,,,,,,,,,,,,,,26,2023-03-20T03:50:00.000Z,2023-03-20T18:30:00.000Z,121.66666666666667,5.069444444444445,No,No,Yes,Yes,No,No,No,No,4,1
,"Area Asset Checks-2200, 2300, 3200, 3600, 4100",23-36095,2200,2200,,,3-20-23 1:49 AM,2023-03-20T01:49:00.000Z,4-17-23 12:00 AM,2023-04-17T00:00:00.000Z,5-18-23 9:49 AM,2023-05-18T09:49:00.000Z,4,4,,PM,CLOSE,Y,,NO,CHATHAM,,,,,,,,,,,,,,,,26,2023-03-20T03:50:00.000Z,2023-03-20T18:30:00.000Z,121.66666666666667,5.069444444444445,No,No,Yes,Yes,No,No,No,No,4,1
,"Area Asset Checks-2100, 1200, 1300, 1400 (Corn, Mill, Mash, Fermentation)",23-36099,2100,2100,,,3-20-23 1:49 AM,2023-03-20T01:49:00.000Z,4-17-23 2:30 AM,2023-04-17T02:30:00.000Z,5-18-23 9:49 AM,2023-05-18T09:49:00.000Z,4,4,,PM,CLOSE,Y,,NO,CHATHAM,,,,,,,,,,,,,,,,26,2023-03-20T03:50:00.000Z,2023-03-20T18:30:00.000Z,121.66666666666667,5.069444444444445,No,No,Yes,Yes,No,No,No,No,4,1
,"Area Asset Checks-1500, 6500 (Distillation)",23-36101,1500,1500,,,3-20-23 1:49 AM,2023-03-20T01:49:00.000Z,4-17-23 12:00 AM,2023-04-17T00:00:00.000Z,5-18-23 9:49 AM,2023-05-18T09:49:00.000Z,4,4,,PM,CLOSE,Y,,NO,CHATHAM,,,,,,,,,,,,,,,,26,2023-03-20T03:50:00.000Z,2023-03-20T18:30:00.000Z,121.66666666666667,5.069444444444445,No,No,Yes,Yes,No,No,No,No,4,1
,"Area Asset Checks-1600, 1660, 1700",23-36102,1600,1600,,,3-20-23 1:49 AM,2023-03-20T01:49:00.000Z,4-17-23 12:00 AM,2023-04-17T00:00:00.000Z,5-18-23 9:48 AM,2023-05-18T09:48:00.000Z,4,4,,PM,CLOSE,Y,N,NO,CHATHAM,,,,,,,,,,,,,,,,26,2023-03-20T03:50:00.000Z,2023-03-20T18:30:00.000Z,121.66666666666667,5.069444444444445,No,No,Yes,Yes,No,No,No,No,4,1
,"Area Asset Checks-1600, 1660, 1700 (Evaps, Corn oil, Decanyers)",23-36103,1600,1600,,,3-20-23 1:49 AM,2023-03-20T01:49:00.000Z,4-17-23 12:00 AM,2023-04-17T00:00:00.000Z,5-18-23 9:48 AM,2023-05-18T09:48:00.000Z,4,4,,PM,CLOSE,Y,,NO,CHATHAM,,,,,,,,,,,,,,,,26,2023-03-20T03:50:00.000Z,2023-03-20T18:30:00.000Z,121.66666666666667,5.069444444444445,No,No,Yes,Yes,No,No,No,No,4,1
,"Area Asset Checks-2200, 2300, 3200, 3600, 4100",23-36105,2200,2200,,,3-20-23 1:49 AM,2023-03-20T01:49:00.000Z,4-17-23 12:00 AM,2023-04-17T00:00:00.000Z,5-18-23 9:48 AM,2023-05-18T09:48:00.000Z,4,4,,PM,CLOSE,Y,,NO,CHATHAM,,,,,,,,,,,,,,,,26,2023-03-20T03:50:00.000Z,2023-03-20T18:30:00.000Z,121.66666666666667,5.069444444444445,No,No,Yes,Yes,No,No,No,No,4,1
,"Area Asset Checks-1830, 1840, DDG Cooler",23-36107,1800,1800,,,3-20-23 1:49 AM,2023-03-20T01:49:00.000Z,4-17-23 12:00 AM,2023-04-17T00:00:00.000Z,5-18-23 9:48 AM,2023-05-18T09:48:00.000Z,4,4,,PM,CLOSE,Y,,NO,CHATHAM,,,,,,,,,,,,,,,,26,2023-03-20T03:50:00.000Z,2023-03-20T18:30:00.000Z,121.66666666666667,5.069444444444445,No,No,Yes,Yes,No,No,No,No,4,1
,INSTALL AUTO LUBE INJECTORS,23-36258,DR-1826,DR-1826,,,3-20-23 7:18 AM,2023-03-20T07:18:00.000Z,3-26-23 7:18 AM,2023-03-26T07:18:00.000Z,3-20-23 2:19 PM,2023-03-20T14:19:00.000Z,4,4,,CO,CLOSE,Y,,NO,CHATHAM,"2541, 2542, 2543, 2544, 2545, 2547, 2549, 2550, 2552, 2553, 2554, 2555, 2556, 2557, 2558, 2559","SWISS COMBI ROTARY DRYER DRUM, SEW GEARBOX - LEFT HAND DRIVE -, SEW GEARBOX - LEFT HAND DRIVE, SEW GEARBOX - RIGHT HAND DRIVE, SEW GEARBOX - RIGHT HAND DRIVE, MOTOR / 25HP / 1800RPM / TEFC / 575V/3PH/60HZ / FRAME# 284TC, MOTOR / 25HP / 1800RPM / TEFC / 575V/3PH/60HZ / FRAME# 284TC, MOTOR / 25HP / 1800RPM / TEFC / 575V/3PH/60HZ / FRAME# 284TC, MOTOR / 25HP / 1800RPM / TEFC / 575V/3PH/60HZ / FRAME# 284TC, TRUNNION (A) - LEFT HAND DRIVE, TRUNNION (B)- RIGHT HAND DRIVE, TRUNNION (D) - LEFT HAND DRIVE, TRUNNION (C) - RIGHT HAND DRIVE, THRUST ROLLER ASSEMBLY, THRUST ROLLER ASSEMBLY, TRUNNION LUBRICATION SYSTEM",,No,DRYER A,CH-DRA_CYCLNS,CH-DRA_CYCLNS:TT18168B.MEAS,TT-18168B,TT,MEAS,Measured value (PV),Temperature transmitter,Measurement,DRUM DR1826 MOTOR A AMPERAGE,DR-1826,26,2023-03-20T03:50:00.000Z,2023-03-20T18:30:00.000Z,121.66666666666667,5.069444444444445,Yes,No,No,No,Yes,No,No,No,1,1
,SWAP OUT DRIVE END BEARING ON BLOWER,23-36259,BL-1829,BL-1829,,,3-20-23 7:25 AM,2023-03-20T07:25:00.000Z,3-26-23 7:25 AM,2023-03-26T07:25:00.000Z,3-20-23 12:27 PM,2023-03-20T12:27:00.000Z,4,4,,CO,CLOSE,Y,,NO,CHATHAM,"10034, 2868","BLOWER, HOWDEN, FAN MODEL E40S-8700 SWSI CCW TAU Arrg't7, 600HP / 1200RPM / TEFC / 575V/3PH/60HZ / 5810B FRAME",,Yes,DRYER A,CH-DRYER_A,CH-DRYER_A:SY18153B.OUT,SY-18153B,SY,OUT,Controller output / demand (CO),Speed output (VFD demand),Output/Demand,BL1829 CURRENT INDICATION,BL-1829,26,2023-03-20T03:50:00.000Z,2023-03-20T18:30:00.000Z,121.66666666666667,5.069444444444445,Yes,No,No,No,Yes,No,No,No,1,1
,SWAP NON-DRIVE END BEARING ON BLOWER,23-36260,BL-1829,BL-1829,,,3-20-23 7:29 AM,2023-03-20T07:29:00.000Z,3-26-23 7:29 AM,2023-03-26T07:29:00.000Z,3-21-23 3:19 PM,2023-03-21T15:19:00.000Z,4,4,,CO,CLOSE,Y,,NO,CHATHAM,"10034, 2868","BLOWER, HOWDEN, FAN MODEL E40S-8700 SWSI CCW TAU Arrg't7, 600HP / 1200RPM / TEFC / 575V/3PH/60HZ / 5810B FRAME",,Yes,DRYER A,CH-DRYER_A,CH-DRYER_A:SY18153B.OUT,SY-18153B,SY,OUT,Controller output / demand (CO),Speed output (VFD demand),Output/Demand,BL1829 CURRENT INDICATION,BL-1829,26,2023-03-20T03:50:00.000Z,2023-03-20T18:30:00.000Z,121.66666666666667,5.069444444444445,No,No,No,No,Yes,Yes,No,No,5,1
,CHANGE OUT FEED END DRUM SEAL DRYER A,23-36269,DR-1826,DR-1826,,,3-20-23 10:19 AM,2023-03-20T10:19:00.000Z,3-26-23 10:19 AM,2023-03-26T10:19:00.000Z,3-20-23 11:20 AM,2023-03-20T11:20:00.000Z,2,2,,CO,CLOSE,Y,,NO,CHATHAM,"2541, 2542, 2543, 2544, 2545, 2547, 2549, 2550, 2552, 2553, 2554, 2555, 2556, 2557, 2558, 2559","SWISS COMBI ROTARY DRYER DRUM, SEW GEARBOX - LEFT HAND DRIVE -, SEW GEARBOX - LEFT HAND DRIVE, SEW GEARBOX - RIGHT HAND DRIVE, SEW GEARBOX - RIGHT HAND DRIVE, MOTOR / 25HP / 1800RPM / TEFC / 575V/3PH/60HZ / FRAME# 284TC, MOTOR / 25HP / 1800RPM / TEFC / 575V/3PH/60HZ / FRAME# 284TC, MOTOR / 25HP / 1800RPM / TEFC / 575V/3PH/60HZ / FRAME# 284TC, MOTOR / 25HP / 1800RPM / TEFC / 575V/3PH/60HZ / FRAME# 284TC, TRUNNION (A) - LEFT HAND DRIVE, TRUNNION (B)- RIGHT HAND DRIVE, TRUNNION (D) - LEFT HAND DRIVE, TRUNNION (C) - RIGHT HAND DRIVE, THRUST ROLLER ASSEMBLY, THRUST ROLLER ASSEMBLY, TRUNNION LUBRICATION SYSTEM",,No,DRYER A,CH-DRA_CYCLNS,CH-DRA_CYCLNS:TT18168B.MEAS,TT-18168B,TT,MEAS,Measured value (PV),Temperature transmitter,Measurement,DRUM DR1826 MOTOR A AMPERAGE,DR-1826,26,2023-03-20T03:50:00.000Z,2023-03-20T18:30:00.000Z,121.66666666666667,5.069444444444445,Yes,No,No,No,Yes,No,No,No,1,1
1359,No Working Lights on BC,23-36286,C-1511,C-1511,,,3-21-23 11:06 AM,2023-03-21T11:06:00.000Z,3-30-23 1:51 AM,2023-03-30T01:51:00.000Z,3-21-23 5:52 AM,2023-03-21T05:52:00.000Z,2,2,,CO,CLOSE,Y,,NO,CHATHAM,,,,,,,,,,,,,,,,26,2023-03-20T03:50:00.000Z,2023-03-20T18:30:00.000Z,121.66666666666667,5.069444444444445,No,No,No,No,No,Yes,No,No,5,1
1069,Light at P-1511's inop,23-36288,P-1511B,P-1511B,,,3-21-23 1:08 PM,2023-03-21T13:08:00.000Z,3-30-23 2:41 AM,2023-03-30T02:41:00.000Z,3-21-23 3:41 AM,2023-03-21T03:41:00.000Z,2,2,,CO,CLOSE,Y,,NO,CHATHAM,,,,,,,,,,,,,,,,26,2023-03-20T03:50:00.000Z,2023-03-20T18:30:00.000Z,121.66666666666667,5.069444444444445,No,No,No,No,No,Yes,No,No,5,1
,Clean around bowl and clean flush nozzles,23-36401,CE-1712,CE-1712,,,3-24-23 11:19 AM,2023-03-24T11:19:00.000Z,4-2-23 11:19 AM,2023-04-02T11:19:00.000Z,3-27-23 8:27 AM,2023-03-27T08:27:00.000Z,4,4,,CO,CLOSE,Y,,NO,CHATHAM,,,,,,,,,,,,,,,,28,2023-03-25T09:00:00.000Z,2023-03-25T09:20:00.000Z,143.33333333333334,5.972222222222222,No,No,No,Yes,No,No,No,No,4,1
3563,Remove Guards for HPW,23-36402,MX-1302,MX-1302,,,3-24-23 11:26 AM,2023-03-24T11:26:00.000Z,4-30-23 8:15 AM,2023-04-30T08:15:00.000Z,5-5-23 2:21 PM,2023-05-05T14:21:00.000Z,4,4,,CO,CLOSE,Y,,NO,CHATHAM,,,,,,,,,,,,,,,,28,2023-03-25T09:00:00.000Z,2023-03-25T09:20:00.000Z,143.33333333333334,5.972222222222222,No,No,No,Yes,No,No,No,No,4,1
3563,DISCONNECT / REMOVE MOTOR,23-36404,MX-1302,MX-1302,,,3-24-23 11:51 AM,2023-03-24T11:51:00.000Z,4-30-23 8:15 AM,2023-04-30T08:15:00.000Z,5-5-23 2:21 PM,2023-05-05T14:21:00.000Z,4,4,,CO,CLOSE,Y,,NO,CHATHAM,,,,,,,,,,,,,,,,28,2023-03-25T09:00:00.000Z,2023-03-25T09:20:00.000Z,143.33333333333334,5.972222222222222,No,No,No,Yes,No,No,No,No,4,1
3563,HPW Mixer and Bearings (as Needed),23-36403,MX-1302,MX-1302,,,3-24-23 11:51 AM,2023-03-24T11:51:00.000Z,4-30-23 8:15 AM,2023-04-30T08:15:00.000Z,5-5-23 2:21 PM,2023-05-05T14:21:00.000Z,4,4,,CO,CLOSE,Y,,NO,CHATHAM,,,,,,,,,,,,,,,,28,2023-03-25T09:00:00.000Z,2023-03-25T09:20:00.000Z,143.33333333333334,5.972222222222222,No,No,No,Yes,No,No,No,No,4,1
3563,REMOVE TRANSFER CASE,23-36406,MX-1302,MX-1302,,,3-24-23 1:36 PM,2023-03-24T13:36:00.000Z,4-30-23 8:15 AM,2023-04-30T08:15:00.000Z,5-5-23 2:21 PM,2023-05-05T14:21:00.000Z,4,4,,CO,CLOSE,Y,,NO,CHATHAM,,,,,,,,,,,,,,,,28,2023-03-25T09:00:00.000Z,2023-03-25T09:20:00.000Z,143.33333333333334,5.972222222222222,No,No,No,Yes,No,No,No,No,4,1
3563,REMOVE SEW GEAR BOX,23-36405,MX-1302,MX-1302,,,3-24-23 1:36 PM,2023-03-24T13:36:00.000Z,4-30-23 8:15 AM,2023-04-30T08:15:00.000Z,5-5-23 2:21 PM,2023-05-05T14:21:00.000Z,4,4,,CO,CLOSE,Y,,NO,CHATHAM,,,,,,,,,,,,,,,,28,2023-03-25T09:00:00.000Z,2023-03-25T09:20:00.000Z,143.33333333333334,5.972222222222222,No,No,No,Yes,No,No,No,No,4,1
3563,REMOVE TAIL END BEARINGS,23-36408,MX-1302,MX-1302,,,3-24-23 1:37 PM,2023-03-24T13:37:00.000Z,4-30-23 8:15 AM,2023-04-30T08:15:00.000Z,5-5-23 2:21 PM,2023-05-05T14:21:00.000Z,4,4,,CO,CLOSE,Y,,NO,CHATHAM,,,,,,,,,,,,,,,,28,2023-03-25T09:00:00.000Z,2023-03-25T09:20:00.000Z,143.33333333333334,5.972222222222222,No,No,No,Yes,No,No,No,No,4,1
3563,REMOVE DE COUPLINGS/SPPT BRNGS,23-36407,MX-1302,MX-1302,,,3-24-23 1:37 PM,2023-03-24T13:37:00.000Z,4-30-23 8:15 AM,2023-04-30T08:15:00.000Z,5-5-23 2:21 PM,2023-05-05T14:21:00.000Z,4,4,,CO,CLOSE,Y,,NO,CHATHAM,,,,,,,,,,,,,,,,28,2023-03-25T09:00:00.000Z,2023-03-25T09:20:00.000Z,143.33333333333334,5.972222222222222,No,No,No,Yes,No,No,No,No,4,1
3563,REMOVE MIXING SCREWS,23-36409,MX-1302,MX-1302,,,3-24-23 1:38 PM,2023-03-24T13:38:00.000Z,4-30-23 8:15 AM,2023-04-30T08:15:00.000Z,5-5-23 2:21 PM,2023-05-05T14:21:00.000Z,4,4,,CO,CLOSE,Y,,NO,CHATHAM,,,,,,,,,,,,,,,,28,2023-03-25T09:00:00.000Z,2023-03-25T09:20:00.000Z,143.33333333333334,5.972222222222222,No,No,No,Yes,No,No,No,No,4,1
3563,CRANE SUPPORT REMOVAL,23-36410,MX-1302,MX-1302,,,3-24-23 1:38 PM,2023-03-24T13:38:00.000Z,4-30-23 8:15 AM,2023-04-30T08:15:00.000Z,5-5-23 2:21 PM,2023-05-05T14:21:00.000Z,4,4,,CO,CLOSE,Y,,NO,CHATHAM,,,,,,,,,,,,,,,,28,2023-03-25T09:00:00.000Z,2023-03-25T09:20:00.000Z,143.33333333333334,5.972222222222222,No,No,No,Yes,No,No,No,No,4,1
3563,SHIP SCREWS TO SANDRIN FOR SHAFT REPAIRS,23-36412,MX-1302,MX-1302,,,3-24-23 1:39 PM,2023-03-24T13:39:00.000Z,4-30-23 8:15 AM,2023-04-30T08:15:00.000Z,5-5-23 2:21 PM,2023-05-05T14:21:00.000Z,4,4,,CO,CLOSE,Y,,NO,CHATHAM,,,,,,,,,,,,,,,,28,2023-03-25T09:00:00.000Z,2023-03-25T09:20:00.000Z,143.33333333333334,5.972222222222222,No,No,No,Yes,No,No,No,No,4,1
3563,LOAD SCREWS ON TRUCK SHIPMENT,23-36411,MX-1302,MX-1302,,,3-24-23 1:39 PM,2023-03-24T13:39:00.000Z,4-30-23 8:15 AM,2023-04-30T08:15:00.000Z,5-5-23 2:21 PM,2023-05-05T14:21:00.000Z,4,4,,CO,CLOSE,Y,,NO,CHATHAM,,,,,,,,,,,,,,,,28,2023-03-25T09:00:00.000Z,2023-03-25T09:20:00.000Z,143.33333333333334,5.972222222222222,No,No,No,Yes,No,No,No,No,4,1
3563,CRANE SUPPORT LOADING FOR SHIPPING,23-36413,MX-1302,MX-1302,,,3-24-23 1:40 PM,2023-03-24T13:40:00.000Z,4-30-23 8:15 AM,2023-04-30T08:15:00.000Z,5-5-23 2:21 PM,2023-05-05T14:21:00.000Z,4,4,,CO,CLOSE,Y,,NO,CHATHAM,,,,,,,,,,,,,,,,28,2023-03-25T09:00:00.000Z,2023-03-25T09:20:00.000Z,143.33333333333334,5.972222222222222,No,No,No,Yes,No,No,No,No,4,1
3563,CRANE SUPPORT UNLOADING,23-36415,MX-1302,MX-1302,,,3-24-23 1:41 PM,2023-03-24T13:41:00.000Z,4-30-23 8:15 AM,2023-04-30T08:15:00.000Z,5-5-23 2:21 PM,2023-05-05T14:21:00.000Z,4,4,,CO,CLOSE,Y,,NO,CHATHAM,,,,,,,,,,,,,,,,28,2023-03-25T09:00:00.000Z,2023-03-25T09:20:00.000Z,143.33333333333334,5.972222222222222,No,No,No,Yes,No,No,No,No,4,1
3563,UNLOAD SCREWS FOR RE-INSTALL,23-36414,MX-1302,MX-1302,,,3-24-23 1:41 PM,2023-03-24T13:41:00.000Z,4-30-23 8:15 AM,2023-04-30T08:15:00.000Z,5-5-23 2:21 PM,2023-05-05T14:21:00.000Z,4,4,,CO,CLOSE,Y,,NO,CHATHAM,,,,,,,,,,,,,,,,28,2023-03-25T09:00:00.000Z,2023-03-25T09:20:00.000Z,143.33333333333334,5.972222222222222,No,No,No,Yes,No,No,No,No,4,1
3563,RE-INSTALL MIXIN SCREWS,23-36416,MX-1302,MX-1302,,,3-24-23 1:41 PM,2023-03-24T13:41:00.000Z,4-30-23 8:15 AM,2023-04-30T08:15:00.000Z,5-5-23 2:21 PM,2023-05-05T14:21:00.000Z,4,4,,CO,CLOSE,Y,,NO,CHATHAM,,,,,,,,,,,,,,,,28,2023-03-25T09:00:00.000Z,2023-03-25T09:20:00.000Z,143.33333333333334,5.972222222222222,No,No,No,Yes,No,No,No,No,4,1
3563,INSTALL NEW TAIL BRG SUPPORT BRG,23-36417,MX-1302,MX-1302,,,3-24-23 1:42 PM,2023-03-24T13:42:00.000Z,4-30-23 8:15 AM,2023-04-30T08:15:00.000Z,5-5-23 2:21 PM,2023-05-05T14:21:00.000Z,4,4,,CO,CLOSE,Y,,NO,CHATHAM,,,,,,,,,,,,,,,,28,2023-03-25T09:00:00.000Z,2023-03-25T09:20:00.000Z,143.33333333333334,5.972222222222222,No,No,No,Yes,No,No,No,No,4,1
3563,INSTALL NEW CLINCH SEAL ON DE+NDE,23-36418,MX-1302,MX-1302,,,3-24-23 1:42 PM,2023-03-24T13:42:00.000Z,4-30-23 8:15 AM,2023-04-30T08:15:00.000Z,5-5-23 2:21 PM,2023-05-05T14:21:00.000Z,4,4,,CO,CLOSE,Y,,NO,CHATHAM,,,,,,,,,,,,,,,,28,2023-03-25T09:00:00.000Z,2023-03-25T09:20:00.000Z,143.33333333333334,5.972222222222222,No,No,No,Yes,No,No,No,No,4,1
3563,RE-INSTALLTRANS CASE + SEW G BOX,23-36419,MX-1302,MX-1302,,,3-24-23 1:45 PM,2023-03-24T13:45:00.000Z,4-30-23 8:15 AM,2023-04-30T08:15:00.000Z,5-5-23 2:21 PM,2023-05-05T14:21:00.000Z,4,4,,CO,CLOSE,Y,,NO,CHATHAM,,,,,,,,,,,,,,,,28,2023-03-25T09:00:00.000Z,2023-03-25T09:20:00.000Z,143.33333333333334,5.972222222222222,No,No,No,Yes,No,No,No,No,4,1
3563,RE-INSTALL / RECONNECT MOTOR,23-36420,MX-1302,MX-1302,,,3-24-23 1:45 PM,2023-03-24T13:45:00.000Z,4-30-23 8:15 AM,2023-04-30T08:15:00.000Z,5-5-23 2:21 PM,2023-05-05T14:21:00.000Z,4,4,,CO,CLOSE,Y,,NO,CHATHAM,,,,,,,,,,,,,,,,28,2023-03-25T09:00:00.000Z,2023-03-25T09:20:00.000Z,143.33333333333334,5.972222222222222,No,No,No,Yes,No,No,No,No,4,1
3563,ROTATION CHECK ON MOTOR,23-36421,MX-1302,MX-1302,,,3-24-23 1:46 PM,2023-03-24T13:46:00.000Z,4-30-23 8:15 AM,2023-04-30T08:15:00.000Z,5-5-23 2:21 PM,2023-05-05T14:21:00.000Z,4,4,,CO,CLOSE,Y,,NO,CHATHAM,,,,,,,,,,,,,,,,28,2023-03-25T09:00:00.000Z,2023-03-25T09:20:00.000Z,143.33333333333334,5.972222222222222,No,No,No,Yes,No,No,No,No,4,1
3563,INSTALL BELTS/SHEAVES/RE-COUPLE SHAFT,23-36422,MX-1302,MX-1302,,,3-24-23 1:46 PM,2023-03-24T13:46:00.000Z,4-30-23 8:15 AM,2023-04-30T08:15:00.000Z,5-5-23 2:21 PM,2023-05-05T14:21:00.000Z,4,4,,CO,CLOSE,Y,,NO,CHATHAM,,,,,,,,,,,,,,,,28,2023-03-25T09:00:00.000Z,2023-03-25T09:20:00.000Z,143.33333333333334,5.972222222222222,No,No,No,Yes,No,No,No,No,4,1
3563,RE-INSTALL GUARDS,23-36423,MX-1302,MX-1302,,,3-24-23 1:47 PM,2023-03-24T13:47:00.000Z,4-30-23 8:15 AM,2023-04-30T08:15:00.000Z,5-5-23 2:21 PM,2023-05-05T14:21:00.000Z,4,4,,CO,CLOSE,Y,,NO,CHATHAM,,,,,,,,,,,,,,,,28,2023-03-25T09:00:00.000Z,2023-03-25T09:20:00.000Z,143.33333333333334,5.972222222222222,No,No,No,Yes,No,No,No,No,4,1
,"Area Asset Checks-2200, 2300, 3200, 3600, 4100",23-34751,2200,2200,,,2-27-23 1:49 AM,2023-02-27T01:49:00.000Z,3-27-23 12:00 AM,2023-03-27T00:00:00.000Z,3-31-23 2:38 PM,2023-03-31T14:38:00.000Z,4,4,,PM,CLOSE,Y,,NO,CHATHAM,,,,,,,,,,,,,,,,29,2023-03-31T08:20:00.000Z,2023-03-31T08:50:00.000Z,33.333333333333336,1.3888888888888888,No,No,No,No,No,Yes,No,No,5,1
7138,ACCULOAD SCULLY CABLE BI-WEEKLY PM,23-34987,FQIC-2203,FQIC-2203,,,3-6-23 1:46 AM,2023-03-06T01:46:00.000Z,3-31-23 12:30 AM,2023-03-31T00:30:00.000Z,3-31-23 11:54 AM,2023-03-31T11:54:00.000Z,4,4,,PM,CLOSE,Y,,NO,CHATHAM,,,,,,,,,,,,,,,,29,2023-03-31T08:20:00.000Z,2023-03-31T08:50:00.000Z,33.333333333333336,1.3888888888888888,No,No,No,No,No,Yes,No,No,5,1
7174,CONDUCTIVITY METER /PH PROBE CLEAN & CALIBRATE PM,23-35007,AE-84404,AE-84404,,,3-6-23 1:47 AM,2023-03-06T01:47:00.000Z,3-30-23 2:00 AM,2023-03-30T02:00:00.000Z,3-31-23 3:26 PM,2023-03-31T15:26:00.000Z,4,4,,PM,CLOSE,Y,,NO,CHATHAM,,,,,,,,,,,,,,,,29,2023-03-31T08:20:00.000Z,2023-03-31T08:50:00.000Z,33.333333333333336,1.3888888888888888,No,No,No,No,No,Yes,No,No,5,1
1421,EXTRACT OIL SAMPLE,23-35014,CV-1805,CV-1805,,,3-6-23 1:47 AM,2023-03-06T01:47:00.000Z,3-28-23 12:30 AM,2023-03-28T00:30:00.000Z,3-31-23 10:59 AM,2023-03-31T10:59:00.000Z,4,4,,PD,CLOSE,Y,,NO,CHATHAM,1421,PRODUCT DISCHARGE SCREW CONVEYOR (MCC-3814),,No,DDG,,,,,,,,,,,29,2023-03-31T08:20:00.000Z,2023-03-31T08:50:00.000Z,33.333333333333336,1.3888888888888888,No,No,No,No,No,Yes,No,No,5,1
1421,GIVE SAMPLE TO SHIPPER/RECEIVER,23-35016,CV-1805,CV-1805,,,3-6-23 1:47 AM,2023-03-06T01:47:00.000Z,3-28-23 12:00 AM,2023-03-28T00:00:00.000Z,3-31-23 11:00 AM,2023-03-31T11:00:00.000Z,4,4,,PD,CLOSE,Y,,NO,CHATHAM,1421,PRODUCT DISCHARGE SCREW CONVEYOR (MCC-3814),,No,DDG,,,,,,,,,,,29,2023-03-31T08:20:00.000Z,2023-03-31T08:50:00.000Z,33.333333333333336,1.3888888888888888,No,No,No,No,No,Yes,No,No,5,1
1227,PH PROBE CLEANING AND CALIBRATION WEEKLY PM,23-35009,AT-13519,AT-13519,,,3-6-23 1:47 AM,2023-03-06T01:47:00.000Z,3-30-23 1:00 AM,2023-03-30T01:00:00.000Z,3-31-23 11:22 AM,2023-03-31T11:22:00.000Z,4,4,,PM,CLOSE,Y,,NO,CHATHAM,,,,,,,,,,,,,,,,29,2023-03-31T08:20:00.000Z,2023-03-31T08:50:00.000Z,33.333333333333336,1.3888888888888888,No,No,No,No,No,Yes,No,No,5,1
1230,PH PROBE CLEANING AND CALIBRATION WEEKLY PM,23-35011,AT-14125,AT-14125,,,3-6-23 1:47 AM,2023-03-06T01:47:00.000Z,3-30-23 1:00 AM,2023-03-30T01:00:00.000Z,3-31-23 3:27 PM,2023-03-31T15:27:00.000Z,4,4,,PM,CLOSE,Y,,NO,CHATHAM,,,,,,,,,,,,,,,,29,2023-03-31T08:20:00.000Z,2023-03-31T08:50:00.000Z,33.333333333333336,1.3888888888888888,No,No,No,No,No,Yes,No,No,5,1
1421,PREPARATION,23-35013,CV-1805,CV-1805,,,3-6-23 1:47 AM,2023-03-06T01:47:00.000Z,3-28-23 12:00 AM,2023-03-28T00:00:00.000Z,3-31-23 10:59 AM,2023-03-31T10:59:00.000Z,4,4,,PD,CLOSE,Y,,NO,CHATHAM,1421,PRODUCT DISCHARGE SCREW CONVEYOR (MCC-3814),,No,DDG,,,,,,,,,,,29,2023-03-31T08:20:00.000Z,2023-03-31T08:50:00.000Z,33.333333333333336,1.3888888888888888,No,No,No,No,No,Yes,No,No,5,1
,HAMMERMILL WEEKLY PM & ROTATION CHANGE,23-35034,MI-1201A,MI-1201A,,,3-6-23 1:47 AM,2023-03-06T01:47:00.000Z,3-30-23 12:00 AM,2023-03-30T00:00:00.000Z,3-31-23 11:24 AM,2023-03-31T11:24:00.000Z,4,4,,PM,CLOSE,Y,,NO,CHATHAM,,,,,,,,,,,,,,,,29,2023-03-31T08:20:00.000Z,2023-03-31T08:50:00.000Z,33.333333333333336,1.3888888888888888,No,No,No,No,No,Yes,No,No,5,1
1421,CHECK OIL LEVEL,23-35015,CV-1805,CV-1805,,,3-6-23 1:47 AM,2023-03-06T01:47:00.000Z,3-28-23 12:30 AM,2023-03-28T00:30:00.000Z,3-31-23 10:59 AM,2023-03-31T10:59:00.000Z,4,4,,PD,CLOSE,Y,,NO,CHATHAM,1421,PRODUCT DISCHARGE SCREW CONVEYOR (MCC-3814),,No,DDG,,,,,,,,,,,29,2023-03-31T08:20:00.000Z,2023-03-31T08:50:00.000Z,33.333333333333336,1.3888888888888888,No,No,No,No,No,Yes,No,No,5,1
,Weekly Vibration check (GFE I/E),23-35035,MI-1201A,MI-1201A,,,3-6-23 1:47 AM,2023-03-06T01:47:00.000Z,3-30-23 12:00 AM,2023-03-30T00:00:00.000Z,3-31-23 11:24 AM,2023-03-31T11:24:00.000Z,4,4,,PM,CLOSE,Y,,NO,CHATHAM,,,,,,,,,,,,,,,,29,2023-03-31T08:20:00.000Z,2023-03-31T08:50:00.000Z,33.333333333333336,1.3888888888888888,No,No,No,No,No,Yes,No,No,5,1
,PH PROBE CLEANING AND CALIBRATION WEEKLY PM,23-35070,AT-84505,AT-84505,,,3-6-23 1:48 AM,2023-03-06T01:48:00.000Z,3-30-23 1:00 AM,2023-03-30T01:00:00.000Z,3-31-23 3:27 PM,2023-03-31T15:27:00.000Z,4,4,,PM,CLOSE,Y,,NO,CHATHAM,,,,,,,,,,,,,,,,29,2023-03-31T08:20:00.000Z,2023-03-31T08:50:00.000Z,33.333333333333336,1.3888888888888888,No,No,No,No,No,Yes,No,No,5,1
1436,Mill C hand Operation of Equipment,23-36360,CV-2110,CV-2110,,,3-23-23 2:03 PM,2023-03-23T14:03:00.000Z,4-2-23 2:03 PM,2023-04-02T14:03:00.000Z,3-31-23 3:03 PM,2023-03-31T15:03:00.000Z,4,4,,CO,CLOSE,Y,,NO,CHATHAM,,,,,,,,,,,,,,,,29,2023-03-31T08:20:00.000Z,2023-03-31T08:50:00.000Z,33.333333333333336,1.3888888888888888,No,No,No,No,No,Yes,No,No,5,1
,Mill C hand operation of equipment,23-36362,CV-1202C,CV-1202C,,,3-23-23 2:10 PM,2023-03-23T14:10:00.000Z,4-2-23 2:10 PM,2023-04-02T14:10:00.000Z,3-31-23 3:10 PM,2023-03-31T15:10:00.000Z,4,4,,CO,CLOSE,Y,,NO,CHATHAM,,,,,,,,,,,,,,,,29,2023-03-31T08:20:00.000Z,2023-03-31T08:50:00.000Z,33.333333333333336,1.3888888888888888,No,No,No,No,No,Yes,No,No,5,1
,R&D Lab 540 Park Av GC copper line broken,23-36823,R&D LAB,R&D LAB,,,3-30-23 11:06 AM,2023-03-30T11:06:00.000Z,4-6-23 10:07 AM,2023-04-06T10:07:00.000Z,3-30-23 11:22 AM,2023-03-30T11:22:00.000Z,2,2,,CO,CLOSE,Y,,NO,CHATHAM,,,,,,,,,,,,,,,,29,2023-03-31T08:20:00.000Z,2023-03-31T08:50:00.000Z,33.333333333333336,1.3888888888888888,No,No,No,Yes,No,No,No,No,4,1
1119,REMOVE INSUALTION,23-36825,P-1840A,P-1840A,,,3-30-23 12:00 PM,2023-03-30T12:00:00.000Z,2-8-22 10:52 AM,2022-02-08T10:52:00.000Z,5-25-23 11:01 AM,2023-05-25T11:01:00.000Z,4,4,,CO,CLOSE,Y,,NO,CHATHAM,1119,GOULDS PUMP 3196 XLTi,,No,DRYER A,,,,,,,,,,,29,2023-03-31T08:20:00.000Z,2023-03-31T08:50:00.000Z,33.333333333333336,1.3888888888888888,No,No,No,Yes,No,No,No,No,4,1
1119,BUILD SCAFF TO ACCESS VALVE,23-36824,P-1840A,P-1840A,,,3-30-23 12:00 PM,2023-03-30T12:00:00.000Z,2-8-22 10:52 AM,2022-02-08T10:52:00.000Z,5-25-23 11:01 AM,2023-05-25T11:01:00.000Z,4,4,,CO,CLOSE,Y,,NO,CHATHAM,1119,GOULDS PUMP 3196 XLTi,,No,DRYER A,,,,,,,,,,,29,2023-03-31T08:20:00.000Z,2023-03-31T08:50:00.000Z,33.333333333333336,1.3888888888888888,No,No,No,Yes,No,No,No,No,4,1
1119,REMOVE VALVE,23-36826,P-1840A,P-1840A,,,3-30-23 12:00 PM,2023-03-30T12:00:00.000Z,2-8-22 10:52 AM,2022-02-08T10:52:00.000Z,5-25-23 11:01 AM,2023-05-25T11:01:00.000Z,4,4,,CO,CLOSE,Y,,NO,CHATHAM,1119,GOULDS PUMP 3196 XLTi,,No,DRYER A,,,,,,,,,,,29,2023-03-31T08:20:00.000Z,2023-03-31T08:50:00.000Z,33.333333333333336,1.3888888888888888,No,No,No,Yes,No,No,No,No,4,1
1119,INSTALL NEW VALVE,23-36827,P-1840A,P-1840A,,,3-30-23 12:00 PM,2023-03-30T12:00:00.000Z,2-8-22 10:52 AM,2022-02-08T10:52:00.000Z,5-25-23 11:01 AM,2023-05-25T11:01:00.000Z,4,4,,CO,CLOSE,Y,,NO,CHATHAM,1119,GOULDS PUMP 3196 XLTi,,No,DRYER A,,,,,,,,,,,29,2023-03-31T08:20:00.000Z,2023-03-31T08:50:00.000Z,33.333333333333336,1.3888888888888888,No,No,No,Yes,No,No,No,No,4,1
1119,RE-INSTALL INSULATON,23-36828,P-1840A,P-1840A,,,3-30-23 12:01 PM,2023-03-30T12:01:00.000Z,2-8-22 10:52 AM,2022-02-08T10:52:00.000Z,5-25-23 11:01 AM,2023-05-25T11:01:00.000Z,4,4,,CO,CLOSE,Y,,NO,CHATHAM,1119,GOULDS PUMP 3196 XLTi,,No,DRYER A,,,,,,,,,,,29,2023-03-31T08:20:00.000Z,2023-03-31T08:50:00.000Z,33.333333333333336,1.3888888888888888,No,No,No,Yes,No,No,No,No,4,1
1119,REMOVE SCAFF,23-36829,P-1840A,P-1840A,,,3-30-23 12:02 PM,2023-03-30T12:02:00.000Z,2-8-22 10:52 AM,2022-02-08T10:52:00.000Z,5-25-23 11:01 AM,2023-05-25T11:01:00.000Z,4,4,,CO,CLOSE,Y,,NO,CHATHAM,1119,GOULDS PUMP 3196 XLTi,,No,DRYER A,,,,,,,,,,,29,2023-03-31T08:20:00.000Z,2023-03-31T08:50:00.000Z,33.333333333333336,1.3888888888888888,No,No,No,Yes,No,No,No,No,4,1
3845,replace seal on p-6610,23-36862,P-6610,P-6610,,,3-31-23 3:22 PM,2023-03-31T15:22:00.000Z,4-7-23 3:22 PM,2023-04-07T15:22:00.000Z,3-31-23 8:22 PM,2023-03-31T20:22:00.000Z,2,2,,CO,CLOSE,Y,,NO,CHATHAM,,,,,,,,,,,,,,,,29,2023-03-31T08:20:00.000Z,2023-03-31T08:50:00.000Z,33.333333333333336,1.3888888888888888,No,No,No,No,No,Yes,No,No,5,1
,TA23 Spring: Found Work S&R,23-36864,CHATHAM,CHATHAM,,,4-1-23 12:36 PM,2023-04-01T12:36:00.000Z,4-28-23 12:36 PM,2023-04-28T12:36:00.000Z,6-13-23 8:38 AM,2023-06-13T08:38:00.000Z,4,4,,SD,CLOSE,Y,,NO,CHATHAM,,,,,,,,,,,,,,,,36,2023-04-02T02:50:00.000Z,2023-04-02T09:30:00.000Z,8.833333333333334,0.3680555555555556,No,No,No,Yes,No,No,No,No,4,1
,TA23 Spring: Found Work Dryers and Evaps,23-36867,CHATHAM,CHATHAM,,,4-1-23 12:39 PM,2023-04-01T12:39:00.000Z,,,6-13-23 8:37 AM,2023-06-13T08:37:00.000Z,4,4,,SD,CLOSE,Y,,NO,CHATHAM,,,,,,,,,,,,,,,,36,2023-04-02T02:50:00.000Z,2023-04-02T09:30:00.000Z,8.833333333333334,0.3680555555555556,No,No,No,Yes,No,No,No,No,4,1
,TA23 Spring: Found Work Mash and Ferm,23-36866,CHATHAM,CHATHAM,,,4-1-23 12:39 PM,2023-04-01T12:39:00.000Z,,,6-13-23 8:37 AM,2023-06-13T08:37:00.000Z,4,4,,SD,CLOSE,Y,,NO,CHATHAM,,,,,,,,,,,,,,,,36,2023-04-02T02:50:00.000Z,2023-04-02T09:30:00.000Z,8.833333333333334,0.3680555555555556,No,No,No,Yes,No,No,No,No,4,1
,TA23 Spring: Found Work Utilities,23-36865,CHATHAM,CHATHAM,,,4-1-23 12:39 PM,2023-04-01T12:39:00.000Z,,,6-13-23 8:38 AM,2023-06-13T08:38:00.000Z,4,4,,SD,CLOSE,Y,,NO,CHATHAM,,,,,,,,,,,,,,,,36,2023-04-02T02:50:00.000Z,2023-04-02T09:30:00.000Z,8.833333333333334,0.3680555555555556,No,No,No,Yes,No,No,No,No,4,1
,TA23 Spring: Found Work Distillation,23-36868,CHATHAM,CHATHAM,,,4-1-23 12:40 PM,2023-04-01T12:40:00.000Z,,,6-13-23 8:36 AM,2023-06-13T08:36:00.000Z,4,4,,SD,CLOSE,Y,,NO,CHATHAM,,,,,,,,,,,,,,,,36,2023-04-02T02:50:00.000Z,2023-04-02T09:30:00.000Z,8.833333333333334,0.3680555555555556,No,No,No,Yes,No,No,No,No,4,1
,Phase 2 Replace all building exterior door knobs with push paddles,23-31318,CHATHAM,CHATHAM,,,1-6-23 7:50 AM,2023-01-06T07:50:00.000Z,,,4-11-23 9:21 AM,2023-04-11T09:21:00.000Z,4,4,,CO,CLOSE,Y,,NO,CHATHAM,,,,,,,,,,,,,,,,39,2023-04-02T16:50:00.000Z,2023-04-26T00:40:00.000Z,560.8333333333334,23.368055555555557,Yes,No,No,No,No,No,No,No,1,1
,Add second inspection/cleaning door,23-31588,BL-1829,BL-1829,,,1-9-23 11:23 AM,2023-01-09T11:23:00.000Z,2-23-23 5:46 PM,2023-02-23T17:46:00.000Z,4-12-23 3:47 PM,2023-04-12T15:47:00.000Z,4,4,,CO,CLOSE,Y,,NO,CHATHAM,"10034, 2868","BLOWER, HOWDEN, FAN MODEL E40S-8700 SWSI CCW TAU Arrg't7, 600HP / 1200RPM / TEFC / 575V/3PH/60HZ / 5810B FRAME",,Yes,DRYER A,CH-DRYER_A,CH-DRYER_A:SY18153B.OUT,SY-18153B,SY,OUT,Controller output / demand (CO),Speed output (VFD demand),Output/Demand,BL1829 CURRENT INDICATION,BL-1829,39,2023-04-02T16:50:00.000Z,2023-04-26T00:40:00.000Z,560.8333333333334,23.368055555555557,Yes,No,No,No,No,No,No,No,1,1
,"BL1802,BL1803D,BL1804D,Demo decanter points,MX1801D",23-31592,,,,,1-9-23 11:51 AM,2023-01-09T11:51:00.000Z,2-23-23 11:51 AM,2023-02-23T11:51:00.000Z,4-5-23 2:01 PM,2023-04-05T14:01:00.000Z,4,4,,PM,CLOSE,Y,,NO,CHATHAM,,,,,,,,,,,,,,,,39,2023-04-02T16:50:00.000Z,2023-04-26T00:40:00.000Z,560.8333333333334,23.368055555555557,Yes,No,No,No,No,No,No,No,1,1
,CLEAN BL-1802 DECANTER POINTS,23-31593,,,,,1-9-23 11:52 AM,2023-01-09T11:52:00.000Z,2-23-23 11:51 AM,2023-02-23T11:51:00.000Z,4-5-23 2:01 PM,2023-04-05T14:01:00.000Z,4,4,,PM,CLOSE,Y,,NO,CHATHAM,,,,,,,,,,,,,,,,39,2023-04-02T16:50:00.000Z,2023-04-26T00:40:00.000Z,560.8333333333334,23.368055555555557,Yes,No,No,No,No,No,No,No,1,1
,CLEAN BL-1803D DECANTER POINTS,23-31594,,,,,1-9-23 11:53 AM,2023-01-09T11:53:00.000Z,2-23-23 11:51 AM,2023-02-23T11:51:00.000Z,4-5-23 2:01 PM,2023-04-05T14:01:00.000Z,4,4,,PM,CLOSE,Y,,NO,CHATHAM,,,,,,,,,,,,,,,,39,2023-04-02T16:50:00.000Z,2023-04-26T00:40:00.000Z,560.8333333333334,23.368055555555557,Yes,No,No,No,No,No,No,No,1,1
,CLEAN BL-1804D DECANTER POINTS,23-31595,,,,,1-9-23 11:53 AM,2023-01-09T11:53:00.000Z,2-23-23 11:51 AM,2023-02-23T11:51:00.000Z,4-5-23 2:01 PM,2023-04-05T14:01:00.000Z,4,4,,PM,CLOSE,Y,,NO,CHATHAM,,,,,,,,,,,,,,,,39,2023-04-02T16:50:00.000Z,2023-04-26T00:40:00.000Z,560.8333333333334,23.368055555555557,Yes,No,No,No,No,No,No,No,1,1
,CLEAN MX1801D POINTS,23-31596,,,,,1-9-23 11:54 AM,2023-01-09T11:54:00.000Z,2-23-23 11:51 AM,2023-02-23T11:51:00.000Z,4-5-23 2:01 PM,2023-04-05T14:01:00.000Z,4,4,,PM,CLOSE,Y,,NO,CHATHAM,,,,,,,,,,,,,,,,39,2023-04-02T16:50:00.000Z,2023-04-26T00:40:00.000Z,560.8333333333334,23.368055555555557,Yes,No,No,No,No,No,No,No,1,1
,ASSIST IN CLEANING POINTS,23-31597,,,,,1-9-23 11:57 AM,2023-01-09T11:57:00.000Z,2-23-23 11:51 AM,2023-02-23T11:51:00.000Z,4-5-23 2:01 PM,2023-04-05T14:01:00.000Z,4,4,,PM,CLOSE,Y,,NO,CHATHAM,,,,,,,,,,,,,,,,39,2023-04-02T16:50:00.000Z,2023-04-26T00:40:00.000Z,560.8333333333334,23.368055555555557,Yes,No,No,No,No,No,No,No,1,1
2561,Isolation for CSE,23-31598,E-1834,E-1834,,,1-9-23 1:57 PM,2023-01-09T13:57:00.000Z,2-23-23 11:34 AM,2023-02-23T11:34:00.000Z,4-5-23 2:01 PM,2023-04-05T14:01:00.000Z,4,4,,CO,CLOSE,Y,,NO,CHATHAM,2561,DRYER A - DDG PRODUCT COOLER,,Yes,DRYER A,CH-DR_DUSTCOLL,CH-DR_DUSTCOLL:E1834.STAIND,E-1834,E,STAIND,"Status indication (open/closed, run/stop)",Equipment device status,Equipment Status,DOSING BIN SCREW CVYR B,,39,2023-04-02T16:50:00.000Z,2023-04-26T00:40:00.000Z,560.8333333333334,23.368055555555557,Yes,No,No,No,No,No,No,No,1,1
2561,Inspect shaft and gear box for disconnect,23-31599,E-1834,E-1834,,,1-9-23 1:57 PM,2023-01-09T13:57:00.000Z,2-23-23 11:34 AM,2023-02-23T11:34:00.000Z,4-5-23 2:01 PM,2023-04-05T14:01:00.000Z,4,4,,CO,CLOSE,Y,,NO,CHATHAM,2561,DRYER A - DDG PRODUCT COOLER,,Yes,DRYER A,CH-DR_DUSTCOLL,CH-DR_DUSTCOLL:E1834.STAIND,E-1834,E,STAIND,"Status indication (open/closed, run/stop)",Equipment device status,Equipment Status,DOSING BIN SCREW CVYR B,,39,2023-04-02T16:50:00.000Z,2023-04-26T00:40:00.000Z,560.8333333333334,23.368055555555557,Yes,No,No,No,No,No,No,No,1,1
2561,Repair if possible or move to SD,23-31600,E-1834,E-1834,,,1-9-23 1:58 PM,2023-01-09T13:58:00.000Z,2-23-23 11:34 AM,2023-02-23T11:34:00.000Z,4-5-23 2:01 PM,2023-04-05T14:01:00.000Z,4,4,,CO,CLOSE,Y,,NO,CHATHAM,2561,DRYER A - DDG PRODUCT COOLER,,Yes,DRYER A,CH-DR_DUSTCOLL,CH-DR_DUSTCOLL:E1834.STAIND,E-1834,E,STAIND,"Status indication (open/closed, run/stop)",Equipment device status,Equipment Status,DOSING BIN SCREW CVYR B,,39,2023-04-02T16:50:00.000Z,2023-04-26T00:40:00.000Z,560.8333333333334,23.368055555555557,Yes,No,No,No,No,No,No,No,1,1
2561,Close up manways,23-31601,E-1834,E-1834,,,1-9-23 1:58 PM,2023-01-09T13:58:00.000Z,2-23-23 11:34 AM,2023-02-23T11:34:00.000Z,4-5-23 2:01 PM,2023-04-05T14:01:00.000Z,4,4,,CO,CLOSE,Y,,NO,CHATHAM,2561,DRYER A - DDG PRODUCT COOLER,,Yes,DRYER A,CH-DR_DUSTCOLL,CH-DR_DUSTCOLL:E1834.STAIND,E-1834,E,STAIND,"Status indication (open/closed, run/stop)",Equipment device status,Equipment Status,DOSING BIN SCREW CVYR B,,39,2023-04-02T16:50:00.000Z,2023-04-26T00:40:00.000Z,560.8333333333334,23.368055555555557,Yes,No,No,No,No,No,No,No,1,1
10036,INSPECT BL-1832,23-31604,BL-1832,BL-1832,,,1-9-23 2:59 PM,2023-01-09T14:59:00.000Z,2-23-23 1:57 PM,2023-02-23T13:57:00.000Z,4-5-23 2:01 PM,2023-04-05T14:01:00.000Z,4,4,,SD,CLOSE,Y,,NO,CHATHAM,"10036, 10037","BLOWER, HOWDEN, FAN MODEL EPB4S-5750, 200HP / 1800RPM / TEFC / 575V/3PH/60HZ / 447T FRAME",,No,DRYER A,CH-DRA_COMB_AIR,CH-DRA_COMB_AIR:BL1832.STAIND,BL-1832,BL,STAIND,"Status indication (open/closed, run/stop)",Blower (asset),Equipment status,COMBUSTION AIR FAN,,39,2023-04-02T16:50:00.000Z,2023-04-26T00:40:00.000Z,560.8333333333334,23.368055555555557,Yes,No,No,No,No,No,No,No,1,1
,REMOVE MANWAY,23-31619,,,,,1-10-23 9:15 AM,2023-01-10T09:15:00.000Z,,,4-12-23 3:38 PM,2023-04-12T15:38:00.000Z,,,,,CLOSE,Y,,NO,CHATHAM,,,,,,,,,,,,,,,,39,2023-04-02T16:50:00.000Z,2023-04-26T00:40:00.000Z,560.8333333333334,23.368055555555557,Yes,No,No,No,No,No,No,No,1,1
,HPW CYCLONE,23-31620,,,,,1-10-23 9:15 AM,2023-01-10T09:15:00.000Z,,,4-12-23 3:38 PM,2023-04-12T15:38:00.000Z,,,,,CLOSE,Y,,NO,CHATHAM,,,,,,,,,,,,,,,,39,2023-04-02T16:50:00.000Z,2023-04-26T00:40:00.000Z,560.8333333333334,23.368055555555557,Yes,No,No,No,No,No,No,No,1,1
2534,HPW WASH CYCLONE 1827,23-31618,CY-1827,CY-1827,,,1-10-23 9:15 AM,2023-01-10T09:15:00.000Z,2-23-23 9:17 AM,2023-02-23T09:17:00.000Z,4-12-23 3:38 PM,2023-04-12T15:38:00.000Z,4,4,,PM,CLOSE,Y,N,NO,CHATHAM,2534,"CYCLONE ASSEMBLY, RIGHT HAND, DEDERT MODEL# CYCL-11 B",,No,DRYER A,CH-DRYER_A,CH-DRYER_A:IT18149.MEAS,IT-18149,IT,MEAS,Measured value (PV),Current transmitter (motor amps),Measurement,CY1827 TOP TEMP,CY-1827,39,2023-04-02T16:50:00.000Z,2023-04-26T00:40:00.000Z,560.8333333333334,23.368055555555557,Yes,No,No,No,No,No,No,No,1,1
,RE-INSTALL MAYWAY,23-31621,,,,,1-10-23 9:15 AM,2023-01-10T09:15:00.000Z,,,4-12-23 3:38 PM,2023-04-12T15:38:00.000Z,,,,,CLOSE,Y,,NO,CHATHAM,,,,,,,,,,,,,,,,39,2023-04-02T16:50:00.000Z,2023-04-26T00:40:00.000Z,560.8333333333334,23.368055555555557,Yes,No,No,No,No,No,No,No,1,1
,HPW CYCLONE,23-31624,,,,,1-10-23 9:20 AM,2023-01-10T09:20:00.000Z,,,4-12-23 3:37 PM,2023-04-12T15:37:00.000Z,,,,,CLOSE,Y,,NO,CHATHAM,,,,,,,,,,,,,,,,39,2023-04-02T16:50:00.000Z,2023-04-26T00:40:00.000Z,560.8333333333334,23.368055555555557,Yes,No,No,No,No,No,No,No,1,1
,REMOVE MANWAY,23-31623,,,,,1-10-23 9:20 AM,2023-01-10T09:20:00.000Z,,,4-12-23 3:37 PM,2023-04-12T15:37:00.000Z,,,,,CLOSE,Y,,NO,CHATHAM,,,,,,,,,,,,,,,,39,2023-04-02T16:50:00.000Z,2023-04-26T00:40:00.000Z,560.8333333333334,23.368055555555557,Yes,No,No,No,No,No,No,No,1,1
2535,HPW WASH 1828 CYCLONES,23-31622,CY-1828,CY-1828,,,1-10-23 9:20 AM,2023-01-10T09:20:00.000Z,2-23-23 9:20 AM,2023-02-23T09:20:00.000Z,4-12-23 3:37 PM,2023-04-12T15:37:00.000Z,4,4,,PM,CLOSE,Y,N,NO,CHATHAM,2535,"CYCLONE ASSEMBLY, LEFT HAND, DEDERT MODEL #CYCL-12 A",,No,DRYER A,CH-DRYER_A,CH-DRYER_A:IT18151.MEAS,IT-18151,IT,MEAS,Measured value (PV),Current transmitter (motor amps),Measurement,CY1828 MID TEMP,CY-1828,39,2023-04-02T16:50:00.000Z,2023-04-26T00:40:00.000Z,560.8333333333334,23.368055555555557,Yes,No,No,No,No,No,No,No,1,1
,RE-INSTALL MAYWAY,23-31625,,,,,1-10-23 9:20 AM,2023-01-10T09:20:00.000Z,,,4-12-23 3:37 PM,2023-04-12T15:37:00.000Z,,,,,CLOSE,Y,,NO,CHATHAM,,,,,,,,,,,,,,,,39,2023-04-02T16:50:00.000Z,2023-04-26T00:40:00.000Z,560.8333333333334,23.368055555555557,Yes,No,No,No,No,No,No,No,1,1
2536,HPW WASH 1829 CYCLONE,23-31626,CY-1829,CY-1829,,,1-10-23 9:24 AM,2023-01-10T09:24:00.000Z,2-23-23 10:02 AM,2023-02-23T10:02:00.000Z,4-12-23 3:37 PM,2023-04-12T15:37:00.000Z,4,4,,PM,CLOSE,Y,N,NO,CHATHAM,2536,"CYCLONE ASSEMBLY, LEFT HAND, DEDERT MODEL# CYCL-12 B",,No,DRYER A,CH-DRYER_A,CH-DRYER_A:IT18152.MEAS,IT-18152,IT,MEAS,Measured value (PV),Current transmitter (motor amps),Measurement,CY1829 TOP TEMP,CY-1829,39,2023-04-02T16:50:00.000Z,2023-04-26T00:40:00.000Z,560.8333333333334,23.368055555555557,Yes,No,No,No,No,No,No,No,1,1
,RE-INSTALL MAYWAY,23-31629,,,,,1-10-23 9:25 AM,2023-01-10T09:25:00.000Z,,,4-12-23 3:37 PM,2023-04-12T15:37:00.000Z,,,,,CLOSE,Y,,NO,CHATHAM,,,,,,,,,,,,,,,,39,2023-04-02T16:50:00.000Z,2023-04-26T00:40:00.000Z,560.8333333333334,23.368055555555557,Yes,No,No,No,No,No,No,No,1,1
,REMOVE MANWAY,23-31627,,,,,1-10-23 9:25 AM,2023-01-10T09:25:00.000Z,,,4-12-23 3:37 PM,2023-04-12T15:37:00.000Z,,,,,CLOSE,Y,,NO,CHATHAM,,,,,,,,,,,,,,,,39,2023-04-02T16:50:00.000Z,2023-04-26T00:40:00.000Z,560.8333333333334,23.368055555555557,Yes,No,No,No,No,No,No,No,1,1
,HPW CYCLONE,23-31628,,,,,1-10-23 9:25 AM,2023-01-10T09:25:00.000Z,,,4-12-23 3:37 PM,2023-04-12T15:37:00.000Z,,,,,CLOSE,Y,,NO,CHATHAM,,,,,,,,,,,,,,,,39,2023-04-02T16:50:00.000Z,2023-04-26T00:40:00.000Z,560.8333333333334,23.368055555555557,Yes,No,No,No,No,No,No,No,1,1
,CV-1827 MECHANICAL PM,23-31677,CV-1827,CV-1827,,,1-10-23 11:08 AM,2023-01-10T11:08:00.000Z,2-28-23 10:00 AM,2023-02-28T10:00:00.000Z,4-5-23 2:01 PM,2023-04-05T14:01:00.000Z,4,4,,PM,CLOSE,Y,N,NO,CHATHAM,"2488, 2509","5 HP / 1800 RPM / TEFC / 575V/3PH/60HZ / FRAME#184T, DORRIS 115TR25 SHAFT MOUNTED SPEED REDUCER",,No,DRYER A,CH-DRA_CYCLNS,CH-DRA_CYCLNS:SSL18172.CIN,SSL-18172,SSL,CIN,Contact input (discrete),Speed switch (motion proof),Discrete Input,CV1827 CURRENT INDICATION,CV-1827,39,2023-04-02T16:50:00.000Z,2023-04-26T00:40:00.000Z,560.8333333333334,23.368055555555557,Yes,No,No,No,No,No,No,No,1,1
,CHECK COUPLING BOLTS,23-31678,CV-1827,CV-1827,,,1-10-23 11:08 AM,2023-01-10T11:08:00.000Z,1-10-23 7:00 AM,2023-01-10T07:00:00.000Z,4-5-23 2:01 PM,2023-04-05T14:01:00.000Z,4,4,,PM,CLOSE,Y,,NO,CHATHAM,"2488, 2509","5 HP / 1800 RPM / TEFC / 575V/3PH/60HZ / FRAME#184T, DORRIS 115TR25 SHAFT MOUNTED SPEED REDUCER",,No,DRYER A,CH-DRA_CYCLNS,CH-DRA_CYCLNS:SSL18172.CIN,SSL-18172,SSL,CIN,Contact input (discrete),Speed switch (motion proof),Discrete Input,CV1827 CURRENT INDICATION,CV-1827,39,2023-04-02T16:50:00.000Z,2023-04-26T00:40:00.000Z,560.8333333333334,23.368055555555557,Yes,No,No,No,No,No,No,No,1,1
,INSPECT PILLOW BLOCK BEARINGS,23-31680,CV-1827,CV-1827,,,1-10-23 11:08 AM,2023-01-10T11:08:00.000Z,1-10-23 7:00 AM,2023-01-10T07:00:00.000Z,4-5-23 2:01 PM,2023-04-05T14:01:00.000Z,4,4,,PM,CLOSE,Y,,NO,CHATHAM,"2488, 2509","5 HP / 1800 RPM / TEFC / 575V/3PH/60HZ / FRAME#184T, DORRIS 115TR25 SHAFT MOUNTED SPEED REDUCER",,No,DRYER A,CH-DRA_CYCLNS,CH-DRA_CYCLNS:SSL18172.CIN,SSL-18172,SSL,CIN,Contact input (discrete),Speed switch (motion proof),Discrete Input,CV1827 CURRENT INDICATION,CV-1827,39,2023-04-02T16:50:00.000Z,2023-04-26T00:40:00.000Z,560.8333333333334,23.368055555555557,Yes,No,No,No,No,No,No,No,1,1
,INSPECT GEARBOX,23-31681,CV-1827,CV-1827,,,1-10-23 11:08 AM,2023-01-10T11:08:00.000Z,1-10-23 7:00 AM,2023-01-10T07:00:00.000Z,4-5-23 2:01 PM,2023-04-05T14:01:00.000Z,4,4,,PM,CLOSE,Y,,NO,CHATHAM,"2488, 2509","5 HP / 1800 RPM / TEFC / 575V/3PH/60HZ / FRAME#184T, DORRIS 115TR25 SHAFT MOUNTED SPEED REDUCER",,No,DRYER A,CH-DRA_CYCLNS,CH-DRA_CYCLNS:SSL18172.CIN,SSL-18172,SSL,CIN,Contact input (discrete),Speed switch (motion proof),Discrete Input,CV1827 CURRENT INDICATION,CV-1827,39,2023-04-02T16:50:00.000Z,2023-04-26T00:40:00.000Z,560.8333333333334,23.368055555555557,Yes,No,No,No,No,No,No,No,1,1
,INSPECT SCREW CONVEYOR,23-31682,CV-1827,CV-1827,,,1-10-23 11:08 AM,2023-01-10T11:08:00.000Z,1-10-23 7:00 AM,2023-01-10T07:00:00.000Z,4-5-23 2:01 PM,2023-04-05T14:01:00.000Z,4,4,,PM,CLOSE,Y,,NO,CHATHAM,"2488, 2509","5 HP / 1800 RPM / TEFC / 575V/3PH/60HZ / FRAME#184T, DORRIS 115TR25 SHAFT MOUNTED SPEED REDUCER",,No,DRYER A,CH-DRA_CYCLNS,CH-DRA_CYCLNS:SSL18172.CIN,SSL-18172,SSL,CIN,Contact input (discrete),Speed switch (motion proof),Discrete Input,CV1827 CURRENT INDICATION,CV-1827,39,2023-04-02T16:50:00.000Z,2023-04-26T00:40:00.000Z,560.8333333333334,23.368055555555557,Yes,No,No,No,No,No,No,No,1,1
,INSPECT TROUGH GASKETS FOR LEAKAGE,23-31679,CV-1827,CV-1827,,,1-10-23 11:08 AM,2023-01-10T11:08:00.000Z,1-10-23 7:00 AM,2023-01-10T07:00:00.000Z,4-5-23 2:01 PM,2023-04-05T14:01:00.000Z,4,4,,PM,CLOSE,Y,,NO,CHATHAM,"2488, 2509","5 HP / 1800 RPM / TEFC / 575V/3PH/60HZ / FRAME#184T, DORRIS 115TR25 SHAFT MOUNTED SPEED REDUCER",,No,DRYER A,CH-DRA_CYCLNS,CH-DRA_CYCLNS:SSL18172.CIN,SSL-18172,SSL,CIN,Contact input (discrete),Speed switch (motion proof),Discrete Input,CV1827 CURRENT INDICATION,CV-1827,39,2023-04-02T16:50:00.000Z,2023-04-26T00:40:00.000Z,560.8333333333334,23.368055555555557,Yes,No,No,No,No,No,No,No,1,1
,INSPECT CONVEYOR TROUGH,23-31683,CV-1827,CV-1827,,,1-10-23 11:08 AM,2023-01-10T11:08:00.000Z,2-23-23 12:00 PM,2023-02-23T12:00:00.000Z,4-5-23 2:01 PM,2023-04-05T14:01:00.000Z,4,4,,PM,CLOSE,Y,,NO,CHATHAM,"2488, 2509","5 HP / 1800 RPM / TEFC / 575V/3PH/60HZ / FRAME#184T, DORRIS 115TR25 SHAFT MOUNTED SPEED REDUCER",,No,DRYER A,CH-DRA_CYCLNS,CH-DRA_CYCLNS:SSL18172.CIN,SSL-18172,SSL,CIN,Contact input (discrete),Speed switch (motion proof),Discrete Input,CV1827 CURRENT INDICATION,CV-1827,39,2023-04-02T16:50:00.000Z,2023-04-26T00:40:00.000Z,560.8333333333334,23.368055555555557,Yes,No,No,No,No,No,No,No,1,1
,CHECK COUPLING BOLTS,23-31694,CV-1830,CV-1830,,,1-10-23 11:15 AM,2023-01-10T11:15:00.000Z,1-10-23 7:00 AM,2023-01-10T07:00:00.000Z,4-5-23 2:01 PM,2023-04-05T14:01:00.000Z,4,4,,PM,CLOSE,Y,,NO,CHATHAM,"2490, 2515","20 HP / 1760 RPM / TEFC / 575V/3PH/60HZ / FRAME#256T, DORRIS 315TR25 SHAFT MOUNTED SPEED REDUCER",,No,DRYER A,CH-DRYER_A,CH-DRYER_A:CV1830.STAIND,CV-1830,CV,STAIND,"Status indication (open/closed, run/stop)",Conveyor (asset),Equipment status,RECYCLE DRAG CONVEYOR,,39,2023-04-02T16:50:00.000Z,2023-04-26T00:40:00.000Z,560.8333333333334,23.368055555555557,Yes,No,No,No,No,No,No,No,1,1
,INSPECT TROUGH GASKETS FOR LEAKAGE,23-31695,CV-1830,CV-1830,,,1-10-23 11:15 AM,2023-01-10T11:15:00.000Z,1-10-23 7:00 AM,2023-01-10T07:00:00.000Z,4-5-23 2:01 PM,2023-04-05T14:01:00.000Z,4,4,,PM,CLOSE,Y,,NO,CHATHAM,"2490, 2515","20 HP / 1760 RPM / TEFC / 575V/3PH/60HZ / FRAME#256T, DORRIS 315TR25 SHAFT MOUNTED SPEED REDUCER",,No,DRYER A,CH-DRYER_A,CH-DRYER_A:CV1830.STAIND,CV-1830,CV,STAIND,"Status indication (open/closed, run/stop)",Conveyor (asset),Equipment status,RECYCLE DRAG CONVEYOR,,39,2023-04-02T16:50:00.000Z,2023-04-26T00:40:00.000Z,560.8333333333334,23.368055555555557,Yes,No,No,No,No,No,No,No,1,1
,INSPECT PILLOW BLOCK BEARINGS,23-31696,CV-1830,CV-1830,,,1-10-23 11:15 AM,2023-01-10T11:15:00.000Z,1-10-23 7:00 AM,2023-01-10T07:00:00.000Z,4-5-23 2:01 PM,2023-04-05T14:01:00.000Z,4,4,,PM,CLOSE,Y,,NO,CHATHAM,"2490, 2515","20 HP / 1760 RPM / TEFC / 575V/3PH/60HZ / FRAME#256T, DORRIS 315TR25 SHAFT MOUNTED SPEED REDUCER",,No,DRYER A,CH-DRYER_A,CH-DRYER_A:CV1830.STAIND,CV-1830,CV,STAIND,"Status indication (open/closed, run/stop)",Conveyor (asset),Equipment status,RECYCLE DRAG CONVEYOR,,39,2023-04-02T16:50:00.000Z,2023-04-26T00:40:00.000Z,560.8333333333334,23.368055555555557,Yes,No,No,No,No,No,No,No,1,1
,CV-1830 MECHANICAL PM,23-31693,CV-1830,CV-1830,,,1-10-23 11:15 AM,2023-01-10T11:15:00.000Z,2-23-23 10:00 AM,2023-02-23T10:00:00.000Z,4-5-23 2:01 PM,2023-04-05T14:01:00.000Z,4,4,,PM,CLOSE,Y,N,NO,CHATHAM,"2490, 2515","20 HP / 1760 RPM / TEFC / 575V/3PH/60HZ / FRAME#256T, DORRIS 315TR25 SHAFT MOUNTED SPEED REDUCER",,No,DRYER A,CH-DRYER_A,CH-DRYER_A:CV1830.STAIND,CV-1830,CV,STAIND,"Status indication (open/closed, run/stop)",Conveyor (asset),Equipment status,RECYCLE DRAG CONVEYOR,,39,2023-04-02T16:50:00.000Z,2023-04-26T00:40:00.000Z,560.8333333333334,23.368055555555557,Yes,No,No,No,No,No,No,No,1,1
,INSPECT GEARBOX,23-31697,CV-1830,CV-1830,,,1-10-23 11:15 AM,2023-01-10T11:15:00.000Z,1-10-23 7:00 AM,2023-01-10T07:00:00.000Z,4-5-23 2:01 PM,2023-04-05T14:01:00.000Z,4,4,,PM,CLOSE,Y,,NO,CHATHAM,"2490, 2515","20 HP / 1760 RPM / TEFC / 575V/3PH/60HZ / FRAME#256T, DORRIS 315TR25 SHAFT MOUNTED SPEED REDUCER",,No,DRYER A,CH-DRYER_A,CH-DRYER_A:CV1830.STAIND,CV-1830,CV,STAIND,"Status indication (open/closed, run/stop)",Conveyor (asset),Equipment status,RECYCLE DRAG CONVEYOR,,39,2023-04-02T16:50:00.000Z,2023-04-26T00:40:00.000Z,560.8333333333334,23.368055555555557,Yes,No,No,No,No,No,No,No,1,1
,INSPECT SCREW CONVEYOR,23-31698,CV-1830,CV-1830,,,1-10-23 11:15 AM,2023-01-10T11:15:00.000Z,1-10-23 7:00 AM,2023-01-10T07:00:00.000Z,4-5-23 2:01 PM,2023-04-05T14:01:00.000Z,4,4,,PM,CLOSE,Y,,NO,CHATHAM,"2490, 2515","20 HP / 1760 RPM / TEFC / 575V/3PH/60HZ / FRAME#256T, DORRIS 315TR25 SHAFT MOUNTED SPEED REDUCER",,No,DRYER A,CH-DRYER_A,CH-DRYER_A:CV1830.STAIND,CV-1830,CV,STAIND,"Status indication (open/closed, run/stop)",Conveyor (asset),Equipment status,RECYCLE DRAG CONVEYOR,,39,2023-04-02T16:50:00.000Z,2023-04-26T00:40:00.000Z,560.8333333333334,23.368055555555557,Yes,No,No,No,No,No,No,No,1,1
,INSPECT CONVEYOR TROUGH,23-31699,CV-1830,CV-1830,,,1-10-23 11:15 AM,2023-01-10T11:15:00.000Z,1-10-23 7:00 AM,2023-01-10T07:00:00.000Z,4-5-23 2:01 PM,2023-04-05T14:01:00.000Z,4,4,,PM,CLOSE,Y,,NO,CHATHAM,"2490, 2515","20 HP / 1760 RPM / TEFC / 575V/3PH/60HZ / FRAME#256T, DORRIS 315TR25 SHAFT MOUNTED SPEED REDUCER",,No,DRYER A,CH-DRYER_A,CH-DRYER_A:CV1830.STAIND,CV-1830,CV,STAIND,"Status indication (open/closed, run/stop)",Conveyor (asset),Equipment status,RECYCLE DRAG CONVEYOR,,39,2023-04-02T16:50:00.000Z,2023-04-26T00:40:00.000Z,560.8333333333334,23.368055555555557,Yes,No,No,No,No,No,No,No,1,1
,CHECK COUPLING BOLTS,23-31701,CV-1831,CV-1831,,,1-10-23 11:18 AM,2023-01-10T11:18:00.000Z,1-10-23 7:00 AM,2023-01-10T07:00:00.000Z,4-5-23 2:01 PM,2023-04-05T14:01:00.000Z,4,4,,PM,CLOSE,Y,,NO,CHATHAM,"2491, 2516","10 HP / 1800 RPM / TEFC / 575V/3PH/60HZ / FRAME#215T, DORRIS 207TR25 SHAFT MOUNTED SPEED REDUCER",,No,DRYER A,CH-DRYER_A,CH-DRYER_A:IT18143D.MEAS,IT-18143D,IT,MEAS,Measured value (PV),Current transmitter (motor amps),Measurement,CV1831 CURRENT INDICATION,CV-1831,39,2023-04-02T16:50:00.000Z,2023-04-26T00:40:00.000Z,560.8333333333334,23.368055555555557,Yes,No,No,No,No,No,No,No,1,1
,INSPECT PILLOW BLOCK BEARINGS,23-31703,CV-1831,CV-1831,,,1-10-23 11:18 AM,2023-01-10T11:18:00.000Z,1-10-23 7:00 AM,2023-01-10T07:00:00.000Z,4-5-23 2:01 PM,2023-04-05T14:01:00.000Z,4,4,,PM,CLOSE,Y,,NO,CHATHAM,"2491, 2516","10 HP / 1800 RPM / TEFC / 575V/3PH/60HZ / FRAME#215T, DORRIS 207TR25 SHAFT MOUNTED SPEED REDUCER",,No,DRYER A,CH-DRYER_A,CH-DRYER_A:IT18143D.MEAS,IT-18143D,IT,MEAS,Measured value (PV),Current transmitter (motor amps),Measurement,CV1831 CURRENT INDICATION,CV-1831,39,2023-04-02T16:50:00.000Z,2023-04-26T00:40:00.000Z,560.8333333333334,23.368055555555557,Yes,No,No,No,No,No,No,No,1,1
,INSPECT CONVEYOR TROUGH,23-31706,CV-1831,CV-1831,,,1-10-23 11:18 AM,2023-01-10T11:18:00.000Z,1-10-23 7:00 AM,2023-01-10T07:00:00.000Z,4-5-23 2:01 PM,2023-04-05T14:01:00.000Z,4,4,,PM,CLOSE,Y,,NO,CHATHAM,"2491, 2516","10 HP / 1800 RPM / TEFC / 575V/3PH/60HZ / FRAME#215T, DORRIS 207TR25 SHAFT MOUNTED SPEED REDUCER",,No,DRYER A,CH-DRYER_A,CH-DRYER_A:IT18143D.MEAS,IT-18143D,IT,MEAS,Measured value (PV),Current transmitter (motor amps),Measurement,CV1831 CURRENT INDICATION,CV-1831,39,2023-04-02T16:50:00.000Z,2023-04-26T00:40:00.000Z,560.8333333333334,23.368055555555557,Yes,No,No,No,No,No,No,No,1,1
,CV-1831 MECHANICAL PM,23-31700,CV-1831,CV-1831,,,1-10-23 11:18 AM,2023-01-10T11:18:00.000Z,2-23-23 10:00 AM,2023-02-23T10:00:00.000Z,4-5-23 2:01 PM,2023-04-05T14:01:00.000Z,4,4,,PM,CLOSE,Y,N,NO,CHATHAM,"2491, 2516","10 HP / 1800 RPM / TEFC / 575V/3PH/60HZ / FRAME#215T, DORRIS 207TR25 SHAFT MOUNTED SPEED REDUCER",,No,DRYER A,CH-DRYER_A,CH-DRYER_A:IT18143D.MEAS,IT-18143D,IT,MEAS,Measured value (PV),Current transmitter (motor amps),Measurement,CV1831 CURRENT INDICATION,CV-1831,39,2023-04-02T16:50:00.000Z,2023-04-26T00:40:00.000Z,560.8333333333334,23.368055555555557,Yes,No,No,No,No,No,No,No,1,1
,INSPECT GEARBOX,23-31704,CV-1831,CV-1831,,,1-10-23 11:18 AM,2023-01-10T11:18:00.000Z,1-10-23 7:00 AM,2023-01-10T07:00:00.000Z,4-5-23 2:01 PM,2023-04-05T14:01:00.000Z,4,4,,PM,CLOSE,Y,,NO,CHATHAM,"2491, 2516","10 HP / 1800 RPM / TEFC / 575V/3PH/60HZ / FRAME#215T, DORRIS 207TR25 SHAFT MOUNTED SPEED REDUCER",,No,DRYER A,CH-DRYER_A,CH-DRYER_A:IT18143D.MEAS,IT-18143D,IT,MEAS,Measured value (PV),Current transmitter (motor amps),Measurement,CV1831 CURRENT INDICATION,CV-1831,39,2023-04-02T16:50:00.000Z,2023-04-26T00:40:00.000Z,560.8333333333334,23.368055555555557,Yes,No,No,No,No,No,No,No,1,1
,INSPECT SCREW CONVEYOR,23-31705,CV-1831,CV-1831,,,1-10-23 11:18 AM,2023-01-10T11:18:00.000Z,1-10-23 7:00 AM,2023-01-10T07:00:00.000Z,4-5-23 2:01 PM,2023-04-05T14:01:00.000Z,4,4,,PM,CLOSE,Y,,NO,CHATHAM,"2491, 2516","10 HP / 1800 RPM / TEFC / 575V/3PH/60HZ / FRAME#215T, DORRIS 207TR25 SHAFT MOUNTED SPEED REDUCER",,No,DRYER A,CH-DRYER_A,CH-DRYER_A:IT18143D.MEAS,IT-18143D,IT,MEAS,Measured value (PV),Current transmitter (motor amps),Measurement,CV1831 CURRENT INDICATION,CV-1831,39,2023-04-02T16:50:00.000Z,2023-04-26T00:40:00.000Z,560.8333333333334,23.368055555555557,Yes,No,No,No,No,No,No,No,1,1
,INSPECT TROUGH GASKETS FOR LEAKAGE,23-31702,CV-1831,CV-1831,,,1-10-23 11:18 AM,2023-01-10T11:18:00.000Z,1-10-23 7:00 AM,2023-01-10T07:00:00.000Z,4-5-23 2:01 PM,2023-04-05T14:01:00.000Z,4,4,,PM,CLOSE,Y,,NO,CHATHAM,"2491, 2516","10 HP / 1800 RPM / TEFC / 575V/3PH/60HZ / FRAME#215T, DORRIS 207TR25 SHAFT MOUNTED SPEED REDUCER",,No,DRYER A,CH-DRYER_A,CH-DRYER_A:IT18143D.MEAS,IT-18143D,IT,MEAS,Measured value (PV),Current transmitter (motor amps),Measurement,CV1831 CURRENT INDICATION,CV-1831,39,2023-04-02T16:50:00.000Z,2023-04-26T00:40:00.000Z,560.8333333333334,23.368055555555557,Yes,No,No,No,No,No,No,No,1,1
,CV-1832 MECHANICAL PM,23-31707,CV-1832,CV-1832,,,1-10-23 11:20 AM,2023-01-10T11:20:00.000Z,2-23-23 10:00 AM,2023-02-23T10:00:00.000Z,4-5-23 2:01 PM,2023-04-05T14:01:00.000Z,4,4,,PM,CLOSE,Y,N,NO,CHATHAM,"2492, 2517","10 HP / 1800 RPM / TEFC / 575V/3PH/60HZ / FRAME#215T, DORRIS 207TR25 SHAFT MOUNTED SPEED REDUCER",,No,DRYER A,CH-DRYER_A,CH-DRYER_A:SI18143D.MEAS,SI-18143D,SI,MEAS,Measured value (PV),Speed indication (feedback),Measurement,CV1832 CURRENT INDICATION,CV-1832,39,2023-04-02T16:50:00.000Z,2023-04-26T00:40:00.000Z,560.8333333333334,23.368055555555557,Yes,No,No,No,No,No,No,No,1,1
,INSPECT TROUGH GASKETS FOR LEAKAGE,23-31709,CV-1832,CV-1832,,,1-10-23 11:20 AM,2023-01-10T11:20:00.000Z,1-10-23 7:00 AM,2023-01-10T07:00:00.000Z,4-5-23 2:01 PM,2023-04-05T14:01:00.000Z,4,4,,PM,CLOSE,Y,,NO,CHATHAM,"2492, 2517","10 HP / 1800 RPM / TEFC / 575V/3PH/60HZ / FRAME#215T, DORRIS 207TR25 SHAFT MOUNTED SPEED REDUCER",,No,DRYER A,CH-DRYER_A,CH-DRYER_A:SI18143D.MEAS,SI-18143D,SI,MEAS,Measured value (PV),Speed indication (feedback),Measurement,CV1832 CURRENT INDICATION,CV-1832,39,2023-04-02T16:50:00.000Z,2023-04-26T00:40:00.000Z,560.8333333333334,23.368055555555557,Yes,No,No,No,No,No,No,No,1,1
,INSPECT PILLOW BLOCK BEARINGS,23-31710,CV-1832,CV-1832,,,1-10-23 11:20 AM,2023-01-10T11:20:00.000Z,1-10-23 7:00 AM,2023-01-10T07:00:00.000Z,4-5-23 2:01 PM,2023-04-05T14:01:00.000Z,4,4,,PM,CLOSE,Y,,NO,CHATHAM,"2492, 2517","10 HP / 1800 RPM / TEFC / 575V/3PH/60HZ / FRAME#215T, DORRIS 207TR25 SHAFT MOUNTED SPEED REDUCER",,No,DRYER A,CH-DRYER_A,CH-DRYER_A:SI18143D.MEAS,SI-18143D,SI,MEAS,Measured value (PV),Speed indication (feedback),Measurement,CV1832 CURRENT INDICATION,CV-1832,39,2023-04-02T16:50:00.000Z,2023-04-26T00:40:00.000Z,560.8333333333334,23.368055555555557,Yes,No,No,No,No,No,No,No,1,1
,INSPECT SCREW CONVEYOR,23-31712,CV-1832,CV-1832,,,1-10-23 11:20 AM,2023-01-10T11:20:00.000Z,1-10-23 7:00 AM,2023-01-10T07:00:00.000Z,4-5-23 2:01 PM,2023-04-05T14:01:00.000Z,4,4,,PM,CLOSE,Y,,NO,CHATHAM,"2492, 2517","10 HP / 1800 RPM / TEFC / 575V/3PH/60HZ / FRAME#215T, DORRIS 207TR25 SHAFT MOUNTED SPEED REDUCER",,No,DRYER A,CH-DRYER_A,CH-DRYER_A:SI18143D.MEAS,SI-18143D,SI,MEAS,Measured value (PV),Speed indication (feedback),Measurement,CV1832 CURRENT INDICATION,CV-1832,39,2023-04-02T16:50:00.000Z,2023-04-26T00:40:00.000Z,560.8333333333334,23.368055555555557,Yes,No,No,No,No,No,No,No,1,1
,INSPECT CONVEYOR TROUGH,23-31713,CV-1832,CV-1832,,,1-10-23 11:20 AM,2023-01-10T11:20:00.000Z,1-10-23 7:00 AM,2023-01-10T07:00:00.000Z,4-5-23 2:01 PM,2023-04-05T14:01:00.000Z,4,4,,PM,CLOSE,Y,,NO,CHATHAM,"2492, 2517","10 HP / 1800 RPM / TEFC / 575V/3PH/60HZ / FRAME#215T, DORRIS 207TR25 SHAFT MOUNTED SPEED REDUCER",,No,DRYER A,CH-DRYER_A,CH-DRYER_A:SI18143D.MEAS,SI-18143D,SI,MEAS,Measured value (PV),Speed indication (feedback),Measurement,CV1832 CURRENT INDICATION,CV-1832,39,2023-04-02T16:50:00.000Z,2023-04-26T00:40:00.000Z,560.8333333333334,23.368055555555557,Yes,No,No,No,No,No,No,No,1,1
,CHECK COUPLING BOLTS,23-31708,CV-1832,CV-1832,,,1-10-23 11:20 AM,2023-01-10T11:20:00.000Z,1-10-23 7:00 AM,2023-01-10T07:00:00.000Z,4-5-23 2:01 PM,2023-04-05T14:01:00.000Z,4,4,,PM,CLOSE,Y,,NO,CHATHAM,"2492, 2517","10 HP / 1800 RPM / TEFC / 575V/3PH/60HZ / FRAME#215T, DORRIS 207TR25 SHAFT MOUNTED SPEED REDUCER",,No,DRYER A,CH-DRYER_A,CH-DRYER_A:SI18143D.MEAS,SI-18143D,SI,MEAS,Measured value (PV),Speed indication (feedback),Measurement,CV1832 CURRENT INDICATION,CV-1832,39,2023-04-02T16:50:00.000Z,2023-04-26T00:40:00.000Z,560.8333333333334,23.368055555555557,Yes,No,No,No,No,No,No,No,1,1
,INSPECT GEARBOX,23-31711,CV-1832,CV-1832,,,1-10-23 11:20 AM,2023-01-10T11:20:00.000Z,1-10-23 7:00 AM,2023-01-10T07:00:00.000Z,4-5-23 2:01 PM,2023-04-05T14:01:00.000Z,4,4,,PM,CLOSE,Y,,NO,CHATHAM,"2492, 2517","10 HP / 1800 RPM / TEFC / 575V/3PH/60HZ / FRAME#215T, DORRIS 207TR25 SHAFT MOUNTED SPEED REDUCER",,No,DRYER A,CH-DRYER_A,CH-DRYER_A:SI18143D.MEAS,SI-18143D,SI,MEAS,Measured value (PV),Speed indication (feedback),Measurement,CV1832 CURRENT INDICATION,CV-1832,39,2023-04-02T16:50:00.000Z,2023-04-26T00:40:00.000Z,560.8333333333334,23.368055555555557,Yes,No,No,No,No,No,No,No,1,1
,CV-1833 MECHANICAL PM,23-31717,CV-1833,CV-1833,,,1-10-23 11:23 AM,2023-01-10T11:23:00.000Z,2-23-23 10:00 AM,2023-02-23T10:00:00.000Z,4-5-23 2:01 PM,2023-04-05T14:01:00.000Z,4,4,,PM,CLOSE,Y,N,NO,CHATHAM,"2493, 2518","7.5 HP / 1800 RPM / TEFC / 575V/3PH/60HZ / FRAME#213T, DORRIS 207TR25 SHAFT MOUNTED SPEED REDUCER",,No,DRYER A,CH-DRA_CYCLNS,CH-DRA_CYCLNS:IT18171.MEAS,IT-18171,IT,MEAS,Measured value (PV),Current transmitter (motor amps),Measurement,CV1833 MOTOR CURRENT,CV-1833,39,2023-04-02T16:50:00.000Z,2023-04-26T00:40:00.000Z,560.8333333333334,23.368055555555557,Yes,No,No,No,No,No,No,No,1,1
,CHECK COUPLING BOLTS,23-31718,CV-1833,CV-1833,,,1-10-23 11:23 AM,2023-01-10T11:23:00.000Z,1-10-23 7:00 AM,2023-01-10T07:00:00.000Z,4-5-23 2:01 PM,2023-04-05T14:01:00.000Z,4,4,,PM,CLOSE,Y,,NO,CHATHAM,"2493, 2518","7.5 HP / 1800 RPM / TEFC / 575V/3PH/60HZ / FRAME#213T, DORRIS 207TR25 SHAFT MOUNTED SPEED REDUCER",,No,DRYER A,CH-DRA_CYCLNS,CH-DRA_CYCLNS:IT18171.MEAS,IT-18171,IT,MEAS,Measured value (PV),Current transmitter (motor amps),Measurement,CV1833 MOTOR CURRENT,CV-1833,39,2023-04-02T16:50:00.000Z,2023-04-26T00:40:00.000Z,560.8333333333334,23.368055555555557,Yes,No,No,No,No,No,No,No,1,1
,INSPECT TROUGH GASKETS FOR LEAKAGE,23-31719,CV-1833,CV-1833,,,1-10-23 11:23 AM,2023-01-10T11:23:00.000Z,1-10-23 7:00 AM,2023-01-10T07:00:00.000Z,4-5-23 2:01 PM,2023-04-05T14:01:00.000Z,4,4,,PM,CLOSE,Y,,NO,CHATHAM,"2493, 2518","7.5 HP / 1800 RPM / TEFC / 575V/3PH/60HZ / FRAME#213T, DORRIS 207TR25 SHAFT MOUNTED SPEED REDUCER",,No,DRYER A,CH-DRA_CYCLNS,CH-DRA_CYCLNS:IT18171.MEAS,IT-18171,IT,MEAS,Measured value (PV),Current transmitter (motor amps),Measurement,CV1833 MOTOR CURRENT,CV-1833,39,2023-04-02T16:50:00.000Z,2023-04-26T00:40:00.000Z,560.8333333333334,23.368055555555557,Yes,No,No,No,No,No,No,No,1,1
,Remove end plate to allow for drainage.,23-31716,CV-1830,CV-1830,,,1-10-23 11:23 AM,2023-01-10T11:23:00.000Z,2-23-23 4:30 PM,2023-02-23T16:30:00.000Z,4-5-23 3:26 PM,2023-04-05T15:26:00.000Z,4,4,,SD,CLOSE,Y,,NO,CHATHAM,"2490, 2515","20 HP / 1760 RPM / TEFC / 575V/3PH/60HZ / FRAME#256T, DORRIS 315TR25 SHAFT MOUNTED SPEED REDUCER",,No,DRYER A,CH-DRYER_A,CH-DRYER_A:CV1830.STAIND,CV-1830,CV,STAIND,"Status indication (open/closed, run/stop)",Conveyor (asset),Equipment status,RECYCLE DRAG CONVEYOR,,39,2023-04-02T16:50:00.000Z,2023-04-26T00:40:00.000Z,560.8333333333334,23.368055555555557,Yes,No,No,No,No,No,No,No,1,1
,INSPECT PILLOW BLOCK BEARINGS,23-31720,CV-1833,CV-1833,,,1-10-23 11:23 AM,2023-01-10T11:23:00.000Z,1-10-23 7:00 AM,2023-01-10T07:00:00.000Z,4-5-23 2:01 PM,2023-04-05T14:01:00.000Z,4,4,,PM,CLOSE,Y,,NO,CHATHAM,"2493, 2518","7.5 HP / 1800 RPM / TEFC / 575V/3PH/60HZ / FRAME#213T, DORRIS 207TR25 SHAFT MOUNTED SPEED REDUCER",,No,DRYER A,CH-DRA_CYCLNS,CH-DRA_CYCLNS:IT18171.MEAS,IT-18171,IT,MEAS,Measured value (PV),Current transmitter (motor amps),Measurement,CV1833 MOTOR CURRENT,CV-1833,39,2023-04-02T16:50:00.000Z,2023-04-26T00:40:00.000Z,560.8333333333334,23.368055555555557,Yes,No,No,No,No,No,No,No,1,1
,INSPECT SCREW CONVEYOR,23-31722,CV-1833,CV-1833,,,1-10-23 11:23 AM,2023-01-10T11:23:00.000Z,1-10-23 7:00 AM,2023-01-10T07:00:00.000Z,4-5-23 2:01 PM,2023-04-05T14:01:00.000Z,4,4,,PM,CLOSE,Y,,NO,CHATHAM,"2493, 2518","7.5 HP / 1800 RPM / TEFC / 575V/3PH/60HZ / FRAME#213T, DORRIS 207TR25 SHAFT MOUNTED SPEED REDUCER",,No,DRYER A,CH-DRA_CYCLNS,CH-DRA_CYCLNS:IT18171.MEAS,IT-18171,IT,MEAS,Measured value (PV),Current transmitter (motor amps),Measurement,CV1833 MOTOR CURRENT,CV-1833,39,2023-04-02T16:50:00.000Z,2023-04-26T00:40:00.000Z,560.8333333333334,23.368055555555557,Yes,No,No,No,No,No,No,No,1,1
,INSPECT CONVEYOR TROUGH,23-31723,CV-1833,CV-1833,,,1-10-23 11:23 AM,2023-01-10T11:23:00.000Z,1-10-23 7:00 AM,2023-01-10T07:00:00.000Z,4-5-23 2:01 PM,2023-04-05T14:01:00.000Z,4,4,,PM,CLOSE,Y,,NO,CHATHAM,"2493, 2518","7.5 HP / 1800 RPM / TEFC / 575V/3PH/60HZ / FRAME#213T, DORRIS 207TR25 SHAFT MOUNTED SPEED REDUCER",,No,DRYER A,CH-DRA_CYCLNS,CH-DRA_CYCLNS:IT18171.MEAS,IT-18171,IT,MEAS,Measured value (PV),Current transmitter (motor amps),Measurement,CV1833 MOTOR CURRENT,CV-1833,39,2023-04-02T16:50:00.000Z,2023-04-26T00:40:00.000Z,560.8333333333334,23.368055555555557,Yes,No,No,No,No,No,No,No,1,1
,INSPECT GEARBOX,23-31721,CV-1833,CV-1833,,,1-10-23 11:23 AM,2023-01-10T11:23:00.000Z,1-10-23 7:00 AM,2023-01-10T07:00:00.000Z,4-5-23 2:01 PM,2023-04-05T14:01:00.000Z,4,4,,PM,CLOSE,Y,,NO,CHATHAM,"2493, 2518","7.5 HP / 1800 RPM / TEFC / 575V/3PH/60HZ / FRAME#213T, DORRIS 207TR25 SHAFT MOUNTED SPEED REDUCER",,No,DRYER A,CH-DRA_CYCLNS,CH-DRA_CYCLNS:IT18171.MEAS,IT-18171,IT,MEAS,Measured value (PV),Current transmitter (motor amps),Measurement,CV1833 MOTOR CURRENT,CV-1833,39,2023-04-02T16:50:00.000Z,2023-04-26T00:40:00.000Z,560.8333333333334,23.368055555555557,Yes,No,No,No,No,No,No,No,1,1
,CHECK COUPLING BOLTS,23-31725,CV-1834,CV-1834,,,1-10-23 11:26 AM,2023-01-10T11:26:00.000Z,1-10-23 7:00 AM,2023-01-10T07:00:00.000Z,4-5-23 2:01 PM,2023-04-05T14:01:00.000Z,4,4,,PM,CLOSE,Y,,NO,CHATHAM,"2494, 2519","7.5 HP / 1800 RPM / TEFC / 575V/3PH/60HZ / FRAME#213T, DORRIS 203TR25 SHAFT MOUNTED SPEED REDUCER",,No,DRYER A,CH-DR_DUSTCOLL,CH-DR_DUSTCOLL:CV1834.STAIND,CV-1834,CV,STAIND,"Status indication (open/closed, run/stop)",Conveyor (asset),Equipment Status,DOSING BIN SCREW CVYR A,,39,2023-04-02T16:50:00.000Z,2023-04-26T00:40:00.000Z,560.8333333333334,23.368055555555557,Yes,No,No,No,No,No,No,No,1,1
,INSPECT PILLOW BLOCK BEARINGS,23-31727,CV-1834,CV-1834,,,1-10-23 11:26 AM,2023-01-10T11:26:00.000Z,1-10-23 7:00 AM,2023-01-10T07:00:00.000Z,4-5-23 2:01 PM,2023-04-05T14:01:00.000Z,4,4,,PM,CLOSE,Y,,NO,CHATHAM,"2494, 2519","7.5 HP / 1800 RPM / TEFC / 575V/3PH/60HZ / FRAME#213T, DORRIS 203TR25 SHAFT MOUNTED SPEED REDUCER",,No,DRYER A,CH-DR_DUSTCOLL,CH-DR_DUSTCOLL:CV1834.STAIND,CV-1834,CV,STAIND,"Status indication (open/closed, run/stop)",Conveyor (asset),Equipment Status,DOSING BIN SCREW CVYR A,,39,2023-04-02T16:50:00.000Z,2023-04-26T00:40:00.000Z,560.8333333333334,23.368055555555557,Yes,No,No,No,No,No,No,No,1,1
,INSPECT SCREW CONVEYOR,23-31729,CV-1834,CV-1834,,,1-10-23 11:26 AM,2023-01-10T11:26:00.000Z,1-10-23 7:00 AM,2023-01-10T07:00:00.000Z,4-5-23 2:01 PM,2023-04-05T14:01:00.000Z,4,4,,PM,CLOSE,Y,,NO,CHATHAM,"2494, 2519","7.5 HP / 1800 RPM / TEFC / 575V/3PH/60HZ / FRAME#213T, DORRIS 203TR25 SHAFT MOUNTED SPEED REDUCER",,No,DRYER A,CH-DR_DUSTCOLL,CH-DR_DUSTCOLL:CV1834.STAIND,CV-1834,CV,STAIND,"Status indication (open/closed, run/stop)",Conveyor (asset),Equipment Status,DOSING BIN SCREW CVYR A,,39,2023-04-02T16:50:00.000Z,2023-04-26T00:40:00.000Z,560.8333333333334,23.368055555555557,Yes,No,No,No,No,No,No,No,1,1
,INSPECT CONVEYOR TROUGH,23-31730,CV-1834,CV-1834,,,1-10-23 11:26 AM,2023-01-10T11:26:00.000Z,1-10-23 7:00 AM,2023-01-10T07:00:00.000Z,4-5-23 2:01 PM,2023-04-05T14:01:00.000Z,4,4,,PM,CLOSE,Y,,NO,CHATHAM,"2494, 2519","7.5 HP / 1800 RPM / TEFC / 575V/3PH/60HZ / FRAME#213T, DORRIS 203TR25 SHAFT MOUNTED SPEED REDUCER",,No,DRYER A,CH-DR_DUSTCOLL,CH-DR_DUSTCOLL:CV1834.STAIND,CV-1834,CV,STAIND,"Status indication (open/closed, run/stop)",Conveyor (asset),Equipment Status,DOSING BIN SCREW CVYR A,,39,2023-04-02T16:50:00.000Z,2023-04-26T00:40:00.000Z,560.8333333333334,23.368055555555557,Yes,No,No,No,No,No,No,No,1,1
,CV-1834 MECHANICAL PM,23-31724,CV-1834,CV-1834,,,1-10-23 11:26 AM,2023-01-10T11:26:00.000Z,2-23-23 10:00 AM,2023-02-23T10:00:00.000Z,4-5-23 2:01 PM,2023-04-05T14:01:00.000Z,4,4,,PM,CLOSE,Y,N,NO,CHATHAM,"2494, 2519","7.5 HP / 1800 RPM / TEFC / 575V/3PH/60HZ / FRAME#213T, DORRIS 203TR25 SHAFT MOUNTED SPEED REDUCER",,No,DRYER A,CH-DR_DUSTCOLL,CH-DR_DUSTCOLL:CV1834.STAIND,CV-1834,CV,STAIND,"Status indication (open/closed, run/stop)",Conveyor (asset),Equipment Status,DOSING BIN SCREW CVYR A,,39,2023-04-02T16:50:00.000Z,2023-04-26T00:40:00.000Z,560.8333333333334,23.368055555555557,Yes,No,No,No,No,No,No,No,1,1
,INSPECT TROUGH GASKETS FOR LEAKAGE,23-31726,CV-1834,CV-1834,,,1-10-23 11:26 AM,2023-01-10T11:26:00.000Z,1-10-23 7:00 AM,2023-01-10T07:00:00.000Z,4-5-23 2:01 PM,2023-04-05T14:01:00.000Z,4,4,,PM,CLOSE,Y,,NO,CHATHAM,"2494, 2519","7.5 HP / 1800 RPM / TEFC / 575V/3PH/60HZ / FRAME#213T, DORRIS 203TR25 SHAFT MOUNTED SPEED REDUCER",,No,DRYER A,CH-DR_DUSTCOLL,CH-DR_DUSTCOLL:CV1834.STAIND,CV-1834,CV,STAIND,"Status indication (open/closed, run/stop)",Conveyor (asset),Equipment Status,DOSING BIN SCREW CVYR A,,39,2023-04-02T16:50:00.000Z,2023-04-26T00:40:00.000Z,560.8333333333334,23.368055555555557,Yes,No,No,No,No,No,No,No,1,1
,INSPECT GEARBOX,23-31728,CV-1834,CV-1834,,,1-10-23 11:26 AM,2023-01-10T11:26:00.000Z,1-10-23 7:00 AM,2023-01-10T07:00:00.000Z,4-5-23 2:01 PM,2023-04-05T14:01:00.000Z,4,4,,PM,CLOSE,Y,,NO,CHATHAM,"2494, 2519","7.5 HP / 1800 RPM / TEFC / 575V/3PH/60HZ / FRAME#213T, DORRIS 203TR25 SHAFT MOUNTED SPEED REDUCER",,No,DRYER A,CH-DR_DUSTCOLL,CH-DR_DUSTCOLL:CV1834.STAIND,CV-1834,CV,STAIND,"Status indication (open/closed, run/stop)",Conveyor (asset),Equipment Status,DOSING BIN SCREW CVYR A,,39,2023-04-02T16:50:00.000Z,2023-04-26T00:40:00.000Z,560.8333333333334,23.368055555555557,Yes,No,No,No,No,No,No,No,1,1
,INSPECT GEAR REDUCER,23-31738,CV-1835,CV-1835,,,1-10-23 11:28 AM,2023-01-10T11:28:00.000Z,1-10-23 7:00 AM,2023-01-10T07:00:00.000Z,4-5-23 2:01 PM,2023-04-05T14:01:00.000Z,4,4,,PM,CLOSE,Y,,NO,CHATHAM,"2495, 2520, 2529","10 HP / 1800 RPM / TEFC / 575V/3PH/60HZ / FRAME#215T, DORRIS 207TR25 SHAFT MOUNTED SPEED REDUCER, TRAMCO, CHAIN, BULK FLO 15 x 8, 2062 CFH, 99.5 FPM",,No,DRYER A,,,,,,,,,,,39,2023-04-02T16:50:00.000Z,2023-04-26T00:40:00.000Z,560.8333333333334,23.368055555555557,Yes,No,No,No,No,No,No,No,1,1
,CHECK TROUGH WEAR / ALIGNMENT AND SEALS,23-31733,CV-1835,CV-1835,,,1-10-23 11:28 AM,2023-01-10T11:28:00.000Z,1-10-23 7:00 AM,2023-01-10T07:00:00.000Z,4-5-23 2:01 PM,2023-04-05T14:01:00.000Z,4,4,,PM,CLOSE,Y,,NO,CHATHAM,"2495, 2520, 2529","10 HP / 1800 RPM / TEFC / 575V/3PH/60HZ / FRAME#215T, DORRIS 207TR25 SHAFT MOUNTED SPEED REDUCER, TRAMCO, CHAIN, BULK FLO 15 x 8, 2062 CFH, 99.5 FPM",,No,DRYER A,,,,,,,,,,,39,2023-04-02T16:50:00.000Z,2023-04-26T00:40:00.000Z,560.8333333333334,23.368055555555557,Yes,No,No,No,No,No,No,No,1,1
,INSPECT NUTS AND BOLTS ON TROUGH SECTIONS,23-31736,CV-1835,CV-1835,,,1-10-23 11:28 AM,2023-01-10T11:28:00.000Z,1-10-23 7:00 AM,2023-01-10T07:00:00.000Z,4-5-23 2:01 PM,2023-04-05T14:01:00.000Z,4,4,,PM,CLOSE,Y,,NO,CHATHAM,"2495, 2520, 2529","10 HP / 1800 RPM / TEFC / 575V/3PH/60HZ / FRAME#215T, DORRIS 207TR25 SHAFT MOUNTED SPEED REDUCER, TRAMCO, CHAIN, BULK FLO 15 x 8, 2062 CFH, 99.5 FPM",,No,DRYER A,,,,,,,,,,,39,2023-04-02T16:50:00.000Z,2023-04-26T00:40:00.000Z,560.8333333333334,23.368055555555557,Yes,No,No,No,No,No,No,No,1,1
,INSPECT FLIGHTS,23-31735,CV-1835,CV-1835,,,1-10-23 11:28 AM,2023-01-10T11:28:00.000Z,1-10-23 7:00 AM,2023-01-10T07:00:00.000Z,4-5-23 2:01 PM,2023-04-05T14:01:00.000Z,4,4,,PM,CLOSE,Y,,NO,CHATHAM,"2495, 2520, 2529","10 HP / 1800 RPM / TEFC / 575V/3PH/60HZ / FRAME#215T, DORRIS 207TR25 SHAFT MOUNTED SPEED REDUCER, TRAMCO, CHAIN, BULK FLO 15 x 8, 2062 CFH, 99.5 FPM",,No,DRYER A,,,,,,,,,,,39,2023-04-02T16:50:00.000Z,2023-04-26T00:40:00.000Z,560.8333333333334,23.368055555555557,Yes,No,No,No,No,No,No,No,1,1
,"INSPECT SPROCKETS, CHAIN AND TAKEUP",23-31737,CV-1835,CV-1835,,,1-10-23 11:28 AM,2023-01-10T11:28:00.000Z,1-10-23 7:00 AM,2023-01-10T07:00:00.000Z,4-5-23 2:01 PM,2023-04-05T14:01:00.000Z,4,4,,PM,CLOSE,Y,,NO,CHATHAM,"2495, 2520, 2529","10 HP / 1800 RPM / TEFC / 575V/3PH/60HZ / FRAME#215T, DORRIS 207TR25 SHAFT MOUNTED SPEED REDUCER, TRAMCO, CHAIN, BULK FLO 15 x 8, 2062 CFH, 99.5 FPM",,No,DRYER A,,,,,,,,,,,39,2023-04-02T16:50:00.000Z,2023-04-26T00:40:00.000Z,560.8333333333334,23.368055555555557,Yes,No,No,No,No,No,No,No,1,1
,CV-1835 MECHANICAL PM,23-31732,CV-1835,CV-1835,,,1-10-23 11:28 AM,2023-01-10T11:28:00.000Z,2-23-23 10:00 AM,2023-02-23T10:00:00.000Z,4-5-23 2:01 PM,2023-04-05T14:01:00.000Z,4,4,,PM,CLOSE,Y,N,NO,CHATHAM,"2495, 2520, 2529","10 HP / 1800 RPM / TEFC / 575V/3PH/60HZ / FRAME#215T, DORRIS 207TR25 SHAFT MOUNTED SPEED REDUCER, TRAMCO, CHAIN, BULK FLO 15 x 8, 2062 CFH, 99.5 FPM",,No,DRYER A,,,,,,,,,,,39,2023-04-02T16:50:00.000Z,2023-04-26T00:40:00.000Z,560.8333333333334,23.368055555555557,Yes,No,No,No,No,No,No,No,1,1
,INSPECT HEAD / TAIL SHAFTS,23-31734,CV-1835,CV-1835,,,1-10-23 11:28 AM,2023-01-10T11:28:00.000Z,1-10-23 7:00 AM,2023-01-10T07:00:00.000Z,4-5-23 2:01 PM,2023-04-05T14:01:00.000Z,4,4,,PM,CLOSE,Y,,NO,CHATHAM,"2495, 2520, 2529","10 HP / 1800 RPM / TEFC / 575V/3PH/60HZ / FRAME#215T, DORRIS 207TR25 SHAFT MOUNTED SPEED REDUCER, TRAMCO, CHAIN, BULK FLO 15 x 8, 2062 CFH, 99.5 FPM",,No,DRYER A,,,,,,,,,,,39,2023-04-02T16:50:00.000Z,2023-04-26T00:40:00.000Z,560.8333333333334,23.368055555555557,Yes,No,No,No,No,No,No,No,1,1
,"INSPECT SPROCKETS, CHAIN AND TAKEUP",23-31744,CV-1836,CV-1836,,,1-10-23 11:31 AM,2023-01-10T11:31:00.000Z,1-10-23 7:00 AM,2023-01-10T07:00:00.000Z,4-5-23 2:01 PM,2023-04-05T14:01:00.000Z,4,4,,PM,CLOSE,Y,,NO,CHATHAM,"2496, 2521, 2530","20 HP / 1760 RPM / TEFC / 575V/3PH/60HZ / FRAME#256T, DORRIS 407TR40 SHAFT MOUNTED SPEED REDUCER, TRAMCO, CHAIN, BULK FLO 20 x 8, 3375 CFH, 100.1 FPM",,No,DRYER A,,,,,,,,,,,39,2023-04-02T16:50:00.000Z,2023-04-26T00:40:00.000Z,560.8333333333334,23.368055555555557,Yes,No,No,No,No,No,No,No,1,1
,CV-1836 MECHANICAL PM,23-31739,CV-1836,CV-1836,,,1-10-23 11:31 AM,2023-01-10T11:31:00.000Z,2-23-23 10:00 AM,2023-02-23T10:00:00.000Z,4-5-23 2:01 PM,2023-04-05T14:01:00.000Z,4,4,,PM,CLOSE,Y,N,NO,CHATHAM,"2496, 2521, 2530","20 HP / 1760 RPM / TEFC / 575V/3PH/60HZ / FRAME#256T, DORRIS 407TR40 SHAFT MOUNTED SPEED REDUCER, TRAMCO, CHAIN, BULK FLO 20 x 8, 3375 CFH, 100.1 FPM",,No,DRYER A,,,,,,,,,,,39,2023-04-02T16:50:00.000Z,2023-04-26T00:40:00.000Z,560.8333333333334,23.368055555555557,Yes,No,No,No,No,No,No,No,1,1
,INSPECT GEAR REDUCER,23-31745,CV-1836,CV-1836,,,1-10-23 11:31 AM,2023-01-10T11:31:00.000Z,1-10-23 7:00 AM,2023-01-10T07:00:00.000Z,4-5-23 2:01 PM,2023-04-05T14:01:00.000Z,4,4,,PM,CLOSE,Y,,NO,CHATHAM,"2496, 2521, 2530","20 HP / 1760 RPM / TEFC / 575V/3PH/60HZ / FRAME#256T, DORRIS 407TR40 SHAFT MOUNTED SPEED REDUCER, TRAMCO, CHAIN, BULK FLO 20 x 8, 3375 CFH, 100.1 FPM",,No,DRYER A,,,,,,,,,,,39,2023-04-02T16:50:00.000Z,2023-04-26T00:40:00.000Z,560.8333333333334,23.368055555555557,Yes,No,No,No,No,No,No,No,1,1
,CHECK TROUGH WEAR / ALIGNMENT AND SEALS,23-31740,CV-1836,CV-1836,,,1-10-23 11:31 AM,2023-01-10T11:31:00.000Z,1-10-23 7:00 AM,2023-01-10T07:00:00.000Z,4-5-23 2:01 PM,2023-04-05T14:01:00.000Z,4,4,,PM,CLOSE,Y,,NO,CHATHAM,"2496, 2521, 2530","20 HP / 1760 RPM / TEFC / 575V/3PH/60HZ / FRAME#256T, DORRIS 407TR40 SHAFT MOUNTED SPEED REDUCER, TRAMCO, CHAIN, BULK FLO 20 x 8, 3375 CFH, 100.1 FPM",,No,DRYER A,,,,,,,,,,,39,2023-04-02T16:50:00.000Z,2023-04-26T00:40:00.000Z,560.8333333333334,23.368055555555557,Yes,No,No,No,No,No,No,No,1,1
,INSPECT HEAD / TAIL SHAFTS,23-31741,CV-1836,CV-1836,,,1-10-23 11:31 AM,2023-01-10T11:31:00.000Z,1-10-23 7:00 AM,2023-01-10T07:00:00.000Z,4-5-23 2:01 PM,2023-04-05T14:01:00.000Z,4,4,,PM,CLOSE,Y,,NO,CHATHAM,"2496, 2521, 2530","20 HP / 1760 RPM / TEFC / 575V/3PH/60HZ / FRAME#256T, DORRIS 407TR40 SHAFT MOUNTED SPEED REDUCER, TRAMCO, CHAIN, BULK FLO 20 x 8, 3375 CFH, 100.1 FPM",,No,DRYER A,,,,,,,,,,,39,2023-04-02T16:50:00.000Z,2023-04-26T00:40:00.000Z,560.8333333333334,23.368055555555557,Yes,No,No,No,No,No,No,No,1,1
,INSPECT FLIGHTS,23-31742,CV-1836,CV-1836,,,1-10-23 11:31 AM,2023-01-10T11:31:00.000Z,1-10-23 7:00 AM,2023-01-10T07:00:00.000Z,4-5-23 2:01 PM,2023-04-05T14:01:00.000Z,4,4,,PM,CLOSE,Y,,NO,CHATHAM,"2496, 2521, 2530","20 HP / 1760 RPM / TEFC / 575V/3PH/60HZ / FRAME#256T, DORRIS 407TR40 SHAFT MOUNTED SPEED REDUCER, TRAMCO, CHAIN, BULK FLO 20 x 8, 3375 CFH, 100.1 FPM",,No,DRYER A,,,,,,,,,,,39,2023-04-02T16:50:00.000Z,2023-04-26T00:40:00.000Z,560.8333333333334,23.368055555555557,Yes,No,No,No,No,No,No,No,1,1
,INSPECT NUTS AND BOLTS ON TROUGH SECTIONS,23-31743,CV-1836,CV-1836,,,1-10-23 11:31 AM,2023-01-10T11:31:00.000Z,1-10-23 7:00 AM,2023-01-10T07:00:00.000Z,4-5-23 2:01 PM,2023-04-05T14:01:00.000Z,4,4,,PM,CLOSE,Y,,NO,CHATHAM,"2496, 2521, 2530","20 HP / 1760 RPM / TEFC / 575V/3PH/60HZ / FRAME#256T, DORRIS 407TR40 SHAFT MOUNTED SPEED REDUCER, TRAMCO, CHAIN, BULK FLO 20 x 8, 3375 CFH, 100.1 FPM",,No,DRYER A,,,,,,,,,,,39,2023-04-02T16:50:00.000Z,2023-04-26T00:40:00.000Z,560.8333333333334,23.368055555555557,Yes,No,No,No,No,No,No,No,1,1
2554,seal leaking quite bad on the South east trunnion gearbox,23-31839,DR-1826,DR-1826,,,1-12-23 9:45 AM,2023-01-12T09:45:00.000Z,4-21-23 6:37 AM,2023-04-21T06:37:00.000Z,4-12-23 3:40 PM,2023-04-12T15:40:00.000Z,4,4,,SD,CLOSE,Y,,NO,CHATHAM,"2541, 2542, 2543, 2544, 2545, 2547, 2549, 2550, 2552, 2553, 2554, 2555, 2556, 2557, 2558, 2559","SWISS COMBI ROTARY DRYER DRUM, SEW GEARBOX - LEFT HAND DRIVE -, SEW GEARBOX - LEFT HAND DRIVE, SEW GEARBOX - RIGHT HAND DRIVE, SEW GEARBOX - RIGHT HAND DRIVE, MOTOR / 25HP / 1800RPM / TEFC / 575V/3PH/60HZ / FRAME# 284TC, MOTOR / 25HP / 1800RPM / TEFC / 575V/3PH/60HZ / FRAME# 284TC, MOTOR / 25HP / 1800RPM / TEFC / 575V/3PH/60HZ / FRAME# 284TC, MOTOR / 25HP / 1800RPM / TEFC / 575V/3PH/60HZ / FRAME# 284TC, TRUNNION (A) - LEFT HAND DRIVE, TRUNNION (B)- RIGHT HAND DRIVE, TRUNNION (D) - LEFT HAND DRIVE, TRUNNION (C) - RIGHT HAND DRIVE, THRUST ROLLER ASSEMBLY, THRUST ROLLER ASSEMBLY, TRUNNION LUBRICATION SYSTEM",,No,DRYER A,CH-DRA_CYCLNS,CH-DRA_CYCLNS:TT18168B.MEAS,TT-18168B,TT,MEAS,Measured value (PV),Temperature transmitter,Measurement,DRUM DR1826 MOTOR A AMPERAGE,DR-1826,39,2023-04-02T16:50:00.000Z,2023-04-26T00:40:00.000Z,560.8333333333334,23.368055555555557,Yes,No,No,No,No,No,No,No,1,1
1115,"3/4\" Valve is near P1804 not holding",23-31861,P-1804,P-1804,,,1-12-23 3:14 PM,2023-01-12T15:14:00.000Z,6-1-23 2:39 PM,2023-06-01T14:39:00.000Z,4-25-23 8:33 AM,2023-04-25T08:33:00.000Z,4,4,,SD,CLOSE,Y,,NO,CHATHAM,1115,GOULDS PUMP 3196 STX,,No,TGF,CH-DRYER_D_SCBR,CH-DRYER_D_SCBR:P1804.STAIND,P-1804,P,STAIND,"Status indication (open/closed, run/stop)",Pump (asset),Equipment status,Pump Permissive P1836,P-1836,39,2023-04-02T16:50:00.000Z,2023-04-26T00:40:00.000Z,560.8333333333334,23.368055555555557,Yes,No,No,No,No,No,No,No,1,1
1386,SENSORS AND CONTROLS,23-32039,CE-6601,CE-6601,,,1-16-23 1:49 AM,2023-01-16T01:49:00.000Z,2-9-23 10:00 AM,2023-02-09T10:00:00.000Z,4-24-23 7:39 AM,2023-04-24T07:39:00.000Z,4,4,,PM,CLOSE,Y,,NO,CHATHAM,,,,,,,,,,,,,,,,39,2023-04-02T16:50:00.000Z,2023-04-26T00:40:00.000Z,560.8333333333334,23.368055555555557,Yes,No,No,No,No,No,No,No,1,1
1386,SPINDLE CHANGEOUT AND BOWL TEAR DOWN / CLEANING,23-32040,CE-6601,CE-6601,,,1-16-23 1:49 AM,2023-01-16T01:49:00.000Z,2-9-23 12:00 PM,2023-02-09T12:00:00.000Z,4-24-23 7:39 AM,2023-04-24T07:39:00.000Z,4,4,,PM,CLOSE,Y,,NO,CHATHAM,,,,,,,,,,,,,,,,39,2023-04-02T16:50:00.000Z,2023-04-26T00:40:00.000Z,560.8333333333334,23.368055555555557,Yes,No,No,No,No,No,No,No,1,1
1386,AUTOMATED VALVE OPERATIONAL CHECK,23-32037,CE-6601,CE-6601,,,1-16-23 1:49 AM,2023-01-16T01:49:00.000Z,2-9-23 10:00 AM,2023-02-09T10:00:00.000Z,4-24-23 7:39 AM,2023-04-24T07:39:00.000Z,4,4,,PM,CLOSE,Y,,NO,CHATHAM,,,,,,,,,,,,,,,,39,2023-04-02T16:50:00.000Z,2023-04-26T00:40:00.000Z,560.8333333333334,23.368055555555557,Yes,No,No,No,No,No,No,No,1,1
1386,SOLENOID OPERATIONAL CHECK,23-32038,CE-6601,CE-6601,,,1-16-23 1:49 AM,2023-01-16T01:49:00.000Z,2-9-23 9:00 AM,2023-02-09T09:00:00.000Z,4-24-23 7:39 AM,2023-04-24T07:39:00.000Z,4,4,,PM,CLOSE,Y,,NO,CHATHAM,,,,,,,,,,,,,,,,39,2023-04-02T16:50:00.000Z,2023-04-26T00:40:00.000Z,560.8333333333334,23.368055555555557,Yes,No,No,No,No,No,No,No,1,1
1386,CE-6601 - MECHANICAL PM,23-32036,CE-6601,CE-6601,,,1-16-23 1:49 AM,2023-01-16T01:49:00.000Z,2-9-23 8:00 PM,2023-02-09T20:00:00.000Z,4-24-23 7:39 AM,2023-04-24T07:39:00.000Z,4,4,,PM,CLOSE,Y,N,NO,CHATHAM,,,,,,,,,,,,,,,,39,2023-04-02T16:50:00.000Z,2023-04-26T00:40:00.000Z,560.8333333333334,23.368055555555557,Yes,No,No,No,No,No,No,No,1,1
1386,OIL CHANGE AND CLEANING OF OIL PAN,23-32041,CE-6601,CE-6601,,,1-16-23 1:49 AM,2023-01-16T01:49:00.000Z,2-9-23 10:00 AM,2023-02-09T10:00:00.000Z,4-24-23 7:39 AM,2023-04-24T07:39:00.000Z,4,4,,PM,CLOSE,Y,,NO,CHATHAM,,,,,,,,,,,,,,,,39,2023-04-02T16:50:00.000Z,2023-04-26T00:40:00.000Z,560.8333333333334,23.368055555555557,Yes,No,No,No,No,No,No,No,1,1
1386,DRIVE BELT CHANGEOUT.  INSPECT DRIVE COMPONENTS,23-32043,CE-6601,CE-6601,,,1-16-23 1:49 AM,2023-01-16T01:49:00.000Z,2-9-23 8:30 AM,2023-02-09T08:30:00.000Z,4-24-23 7:39 AM,2023-04-24T07:39:00.000Z,4,4,,PM,CLOSE,Y,,NO,CHATHAM,,,,,,,,,,,,,,,,39,2023-04-02T16:50:00.000Z,2023-04-26T00:40:00.000Z,560.8333333333334,23.368055555555557,Yes,No,No,No,No,No,No,No,1,1
1386,WATER SYSTEM INSPECTION AND CLEANING,23-32042,CE-6601,CE-6601,,,1-16-23 1:49 AM,2023-01-16T01:49:00.000Z,2-9-23 9:00 AM,2023-02-09T09:00:00.000Z,4-24-23 7:39 AM,2023-04-24T07:39:00.000Z,4,4,,PM,CLOSE,Y,,NO,CHATHAM,,,,,,,,,,,,,,,,39,2023-04-02T16:50:00.000Z,2023-04-26T00:40:00.000Z,560.8333333333334,23.368055555555557,Yes,No,No,No,No,No,No,No,1,1
1041,"TA23 Replace 1\" city water valve at TK1602",23-32285,P-1603A,P-1603A,,,1-17-23 3:14 PM,2023-01-17T15:14:00.000Z,4-23-23 8:26 AM,2023-04-23T08:26:00.000Z,4-25-23 9:21 AM,2023-04-25T09:21:00.000Z,4,4,,SD,CLOSE,Y,,NO,CHATHAM,,,,,,,,,,,,,,,,39,2023-04-02T16:50:00.000Z,2023-04-26T00:40:00.000Z,560.8333333333334,23.368055555555557,Yes,No,No,No,No,No,No,No,1,1
,Auto lube N/F assistance required,23-32287,DR-1826,DR-1826,,,1-17-23 3:20 PM,2023-01-17T15:20:00.000Z,2-23-23 5:30 PM,2023-02-23T17:30:00.000Z,4-12-23 3:39 PM,2023-04-12T15:39:00.000Z,4,4,,SD,CLOSE,Y,,NO,CHATHAM,"2541, 2542, 2543, 2544, 2545, 2547, 2549, 2550, 2552, 2553, 2554, 2555, 2556, 2557, 2558, 2559","SWISS COMBI ROTARY DRYER DRUM, SEW GEARBOX - LEFT HAND DRIVE -, SEW GEARBOX - LEFT HAND DRIVE, SEW GEARBOX - RIGHT HAND DRIVE, SEW GEARBOX - RIGHT HAND DRIVE, MOTOR / 25HP / 1800RPM / TEFC / 575V/3PH/60HZ / FRAME# 284TC, MOTOR / 25HP / 1800RPM / TEFC / 575V/3PH/60HZ / FRAME# 284TC, MOTOR / 25HP / 1800RPM / TEFC / 575V/3PH/60HZ / FRAME# 284TC, MOTOR / 25HP / 1800RPM / TEFC / 575V/3PH/60HZ / FRAME# 284TC, TRUNNION (A) - LEFT HAND DRIVE, TRUNNION (B)- RIGHT HAND DRIVE, TRUNNION (D) - LEFT HAND DRIVE, TRUNNION (C) - RIGHT HAND DRIVE, THRUST ROLLER ASSEMBLY, THRUST ROLLER ASSEMBLY, TRUNNION LUBRICATION SYSTEM",,No,DRYER A,CH-DRA_CYCLNS,CH-DRA_CYCLNS:TT18168B.MEAS,TT-18168B,TT,MEAS,Measured value (PV),Temperature transmitter,Measurement,DRUM DR1826 MOTOR A AMPERAGE,DR-1826,39,2023-04-02T16:50:00.000Z,2023-04-26T00:40:00.000Z,560.8333333333334,23.368055555555557,Yes,No,No,No,No,No,No,No,1,1
,BUILD SCAFF,23-32670,1840,1840,,,1-23-23 11:47 AM,2023-01-23T11:47:00.000Z,6-21-22 5:30 PM,2022-06-21T17:30:00.000Z,4-9-23 6:01 AM,2023-04-09T06:01:00.000Z,4,4,,SD,CLOSE,Y,,NO,CHATHAM,,,,,,,,,,,,,,,,39,2023-04-02T16:50:00.000Z,2023-04-26T00:40:00.000Z,560.8333333333334,23.368055555555557,Yes,No,No,No,No,No,No,No,1,1
,DISMANTLE SCAFF,23-32671,1840,1840,,,1-23-23 11:48 AM,2023-01-23T11:48:00.000Z,6-21-22 5:30 PM,2022-06-21T17:30:00.000Z,4-9-23 6:01 AM,2023-04-09T06:01:00.000Z,4,4,,SD,CLOSE,Y,,NO,CHATHAM,,,,,,,,,,,,,,,,39,2023-04-02T16:50:00.000Z,2023-04-26T00:40:00.000Z,560.8333333333334,23.368055555555557,Yes,No,No,No,No,No,No,No,1,1
1280,BE-2107 MOTOR REPLACEMENT,23-32906,BE-2107,BE-2107,,,1-30-23 1:48 AM,2023-01-30T01:48:00.000Z,6-22-23 12:00 AM,2023-06-22T00:00:00.000Z,4-12-23 3:30 PM,2023-04-12T15:30:00.000Z,4,4,,PM,CLOSE,Y,N,NO,CHATHAM,,,,,,,,,,,,,,,,39,2023-04-02T16:50:00.000Z,2023-04-26T00:40:00.000Z,560.8333333333334,23.368055555555557,Yes,No,No,No,No,No,No,No,1,1
2538,FIKE FLAMELESS VENTS FQIISQ -DC-1834-INSPECTION 3 MONTHS,23-32918,DC-1834,DC-1834,,,1-30-23 1:48 AM,2023-01-30T01:48:00.000Z,4-25-23 1:00 AM,2023-04-25T01:00:00.000Z,4-18-23 11:09 AM,2023-04-18T11:09:00.000Z,2,2,,SD,CLOSE,Y,,NO,CHATHAM,"2538, 2539, 6996","FIKE FLAMELESS VENT - E34-004-3636, FIKE FLAMELESS VENT - E34-004-3636, DUST COLLECTOR, IMF, MODEL XXX",6996,Yes,DRYER A,,,,,,,,,,,39,2023-04-02T16:50:00.000Z,2023-04-26T00:40:00.000Z,560.8333333333334,23.368055555555557,Yes,No,No,No,No,No,No,No,1,1
2538,FIKE FLAMELESS VENT 3 MONTH PM (REF. DC-1834),23-32917,DC-1834,DC-1834,,,1-30-23 1:48 AM,2023-01-30T01:48:00.000Z,4-25-23 12:00 AM,2023-04-25T00:00:00.000Z,4-18-23 11:09 AM,2023-04-18T11:09:00.000Z,4,4,,SD,CLOSE,Y,N,NO,CHATHAM,"2538, 2539, 6996","FIKE FLAMELESS VENT - E34-004-3636, FIKE FLAMELESS VENT - E34-004-3636, DUST COLLECTOR, IMF, MODEL XXX",6996,Yes,DRYER A,,,,,,,,,,,39,2023-04-02T16:50:00.000Z,2023-04-26T00:40:00.000Z,560.8333333333334,23.368055555555557,Yes,No,No,No,No,No,No,No,1,1
2539,FIKE FLAMELESS VENT 3 MONTH PM (REF. DC-1834),23-32919,DC-1834,DC-1834,,,1-30-23 1:48 AM,2023-01-30T01:48:00.000Z,4-25-23 12:00 AM,2023-04-25T00:00:00.000Z,4-18-23 11:09 AM,2023-04-18T11:09:00.000Z,4,4,,SD,CLOSE,Y,N,NO,CHATHAM,"2538, 2539, 6996","FIKE FLAMELESS VENT - E34-004-3636, FIKE FLAMELESS VENT - E34-004-3636, DUST COLLECTOR, IMF, MODEL XXX",6996,Yes,DRYER A,,,,,,,,,,,39,2023-04-02T16:50:00.000Z,2023-04-26T00:40:00.000Z,560.8333333333334,23.368055555555557,Yes,No,No,No,No,No,No,No,1,1
2539,FIKE FLAMELESS VENTS FQIISQ -DC-1834-INSPECTION 3 MONTHS,23-32920,DC-1834,DC-1834,,,1-30-23 1:48 AM,2023-01-30T01:48:00.000Z,4-25-23 1:00 AM,2023-04-25T01:00:00.000Z,4-18-23 11:09 AM,2023-04-18T11:09:00.000Z,2,2,,SD,CLOSE,Y,,NO,CHATHAM,"2538, 2539, 6996","FIKE FLAMELESS VENT - E34-004-3636, FIKE FLAMELESS VENT - E34-004-3636, DUST COLLECTOR, IMF, MODEL XXX",6996,Yes,DRYER A,,,,,,,,,,,39,2023-04-02T16:50:00.000Z,2023-04-26T00:40:00.000Z,560.8333333333334,23.368055555555557,Yes,No,No,No,No,No,No,No,1,1
,TA23 - Inspect RC3 from manway A2 (external inspection),23-33054,C-6571,C-6571,,,1-30-23 12:36 PM,2023-01-30T12:36:00.000Z,4-21-23 8:24 AM,2023-04-21T08:24:00.000Z,4-5-23 2:10 PM,2023-04-05T14:10:00.000Z,4,4,,SD,CLOSE,Y,,NO,CHATHAM,,,,,,,,,,,,,,,,39,2023-04-02T16:50:00.000Z,2023-04-26T00:40:00.000Z,560.8333333333334,23.368055555555557,Yes,No,No,No,No,No,No,No,1,1
,TA23 - Air gap IA/GP,23-33066,6000,6000,,,1-30-23 3:40 PM,2023-01-30T15:40:00.000Z,4-21-23 8:14 AM,2023-04-21T08:14:00.000Z,4-5-23 2:09 PM,2023-04-05T14:09:00.000Z,4,4,,SD,CLOSE,Y,,NO,CHATHAM,,,,,,,,,,,,,,,,39,2023-04-02T16:50:00.000Z,2023-04-26T00:40:00.000Z,560.8333333333334,23.368055555555557,Yes,No,No,No,No,No,No,No,1,1
3636,Relocate PT 18133,23-33082,PT-18133,PT-18133,,,1-31-23 10:01 AM,2023-01-31T10:01:00.000Z,2-23-23 10:01 AM,2023-02-23T10:01:00.000Z,4-5-23 2:01 PM,2023-04-05T14:01:00.000Z,4,4,,CO,CLOSE,Y,,NO,CHATHAM,3636,PRESSURE TRANSMITTER,,No,DRYER A,,,,,,,,,,,39,2023-04-02T16:50:00.000Z,2023-04-26T00:40:00.000Z,560.8333333333334,23.368055555555557,Yes,No,No,No,No,No,No,No,1,1
,DRYER- FEB 2023 OUTAGE PARENT,23-33088,,,,,1-31-23 10:44 AM,2023-01-31T10:44:00.000Z,3-31-23 10:44 AM,2023-03-31T10:44:00.000Z,4-5-23 2:01 PM,2023-04-05T14:01:00.000Z,4,4,,SD,CLOSE,Y,,NO,CHATHAM,,,,,,,,,,,,,,,,39,2023-04-02T16:50:00.000Z,2023-04-26T00:40:00.000Z,560.8333333333334,23.368055555555557,Yes,No,No,No,No,No,No,No,1,1
2561,HPW CLEAN (INSIDE) DDG COOLER E1834 DR0,23-33093,E-1834,E-1834,,,1-31-23 12:44 PM,2023-01-31T12:44:00.000Z,2-23-23 6:26 AM,2023-02-23T06:26:00.000Z,4-5-23 2:01 PM,2023-04-05T14:01:00.000Z,4,4,,CO,CLOSE,Y,,NO,CHATHAM,2561,DRYER A - DDG PRODUCT COOLER,,Yes,DRYER A,CH-DR_DUSTCOLL,CH-DR_DUSTCOLL:E1834.STAIND,E-1834,E,STAIND,"Status indication (open/closed, run/stop)",Equipment device status,Equipment Status,DOSING BIN SCREW CVYR B,,39,2023-04-02T16:50:00.000Z,2023-04-26T00:40:00.000Z,560.8333333333334,23.368055555555557,Yes,No,No,No,No,No,No,No,1,1
2561,HPW CLEAN (INSIDE) DDG COOLER E1834,23-33158,E-1834,E-1834,,,1-31-23 2:14 PM,2023-01-31T14:14:00.000Z,,,4-5-23 2:01 PM,2023-04-05T14:01:00.000Z,4,4,,CO,CLOSE,Y,,NO,CHATHAM,2561,DRYER A - DDG PRODUCT COOLER,,Yes,DRYER A,CH-DR_DUSTCOLL,CH-DR_DUSTCOLL:E1834.STAIND,E-1834,E,STAIND,"Status indication (open/closed, run/stop)",Equipment device status,Equipment Status,DOSING BIN SCREW CVYR B,,39,2023-04-02T16:50:00.000Z,2023-04-26T00:40:00.000Z,560.8333333333334,23.368055555555557,Yes,No,No,No,No,No,No,No,1,1
2958,TA23 Replace Drain Valve on Level Transmitter 15507,23-33194,LG-15507,LG-15507,,,2-2-23 9:39 AM,2023-02-02T09:39:00.000Z,4-21-23 7:13 AM,2023-04-21T07:13:00.000Z,4-25-23 8:18 AM,2023-04-25T08:18:00.000Z,4,4,,SD,CLOSE,Y,,NO,CHATHAM,,,,,,,,,,,,,,,,39,2023-04-02T16:50:00.000Z,2023-04-26T00:40:00.000Z,560.8333333333334,23.368055555555557,Yes,No,No,No,No,No,No,No,1,1
2560,HPW E-1825 Heat exchanger- steam Inlet - DR01,23-33463,E-1825,E-1825,,,2-6-23 1:50 AM,2023-02-06T01:50:00.000Z,4-23-23 12:00 AM,2023-04-23T00:00:00.000Z,4-12-23 3:36 PM,2023-04-12T15:36:00.000Z,4,4,,PM,CLOSE,Y,,NO,CHATHAM,2560,ecoDRY HEAT EXCHANGER,,No,DRYER A,CH-DRYER_A,CH-DRYER_A:SI18143A.MEAS,SI-18143A,SI,MEAS,Measured value (PV),Speed indication (feedback),Measurement,E1825 HEX LOWER DOOR,E-1825,39,2023-04-02T16:50:00.000Z,2023-04-26T00:40:00.000Z,560.8333333333334,23.368055555555557,Yes,No,No,No,No,No,No,No,1,1
,HPW BL-1829 Main Fan DR01,23-33465,BL-1829,BL-1829,,,2-6-23 1:50 AM,2023-02-06T01:50:00.000Z,3-1-23 12:00 AM,2023-03-01T00:00:00.000Z,4-12-23 3:36 PM,2023-04-12T15:36:00.000Z,4,4,,PM,CLOSE,Y,,NO,CHATHAM,"10034, 2868","BLOWER, HOWDEN, FAN MODEL E40S-8700 SWSI CCW TAU Arrg't7, 600HP / 1200RPM / TEFC / 575V/3PH/60HZ / 5810B FRAME",,Yes,DRYER A,CH-DRYER_A,CH-DRYER_A:SY18153B.OUT,SY-18153B,SY,OUT,Controller output / demand (CO),Speed output (VFD demand),Output/Demand,BL1829 CURRENT INDICATION,BL-1829,39,2023-04-02T16:50:00.000Z,2023-04-26T00:40:00.000Z,560.8333333333334,23.368055555555557,Yes,No,No,No,No,No,No,No,1,1
3605,HPW V-1825 Heat exchanger - steam turning box - middle DR01,23-33464,V-1825,V-1825,,,2-6-23 1:50 AM,2023-02-06T01:50:00.000Z,4-23-23 12:00 AM,2023-04-23T00:00:00.000Z,4-12-23 3:36 PM,2023-04-12T15:36:00.000Z,4,4,,PM,CLOSE,Y,,NO,CHATHAM,3605,MIXING CHAMBER - DRYER A,,No,DRYER A,,,,,,,,,,,39,2023-04-02T16:50:00.000Z,2023-04-26T00:40:00.000Z,560.8333333333334,23.368055555555557,Yes,No,No,No,No,No,No,No,1,1
2533,HPW CY-1826 Cylone and Ducting,23-33466,CY-1826,CY-1826,,,2-6-23 1:50 AM,2023-02-06T01:50:00.000Z,3-1-23 12:00 AM,2023-03-01T00:00:00.000Z,4-12-23 3:32 PM,2023-04-12T15:32:00.000Z,4,4,,PM,CLOSE,Y,,NO,CHATHAM,2533,"CYCLONE ASSEMBLY, RIGHT HAND, DEDERT MODEL# CYCL-11 A",,No,DRYER A,CH-DRYER_A,CH-DRYER_A:TIC18147B.OUT,TIC-18147B,TIC,OUT,Controller output / demand (CO),Temperature indicating controller,Output/Demand,CY1826 TOP TEMP,CY-1826,39,2023-04-02T16:50:00.000Z,2023-04-26T00:40:00.000Z,560.8333333333334,23.368055555555557,Yes,No,No,No,No,No,No,No,1,1
3605,BUILD SCAFF FOR HPW,23-34120,V-1825,V-1825,,,2-13-23 8:43 AM,2023-02-13T08:43:00.000Z,4-23-23 12:00 AM,2023-04-23T00:00:00.000Z,4-12-23 3:36 PM,2023-04-12T15:36:00.000Z,4,4,,SD,CLOSE,Y,,NO,CHATHAM,3605,MIXING CHAMBER - DRYER A,,No,DRYER A,,,,,,,,,,,39,2023-04-02T16:50:00.000Z,2023-04-26T00:40:00.000Z,560.8333333333334,23.368055555555557,Yes,No,No,No,No,No,No,No,1,1
3605,REMOVE MANWAYS,23-34121,V-1825,V-1825,,,2-13-23 8:44 AM,2023-02-13T08:44:00.000Z,4-23-23 12:00 AM,2023-04-23T00:00:00.000Z,4-12-23 3:36 PM,2023-04-12T15:36:00.000Z,4,4,,SD,CLOSE,Y,,NO,CHATHAM,3605,MIXING CHAMBER - DRYER A,,No,DRYER A,,,,,,,,,,,39,2023-04-02T16:50:00.000Z,2023-04-26T00:40:00.000Z,560.8333333333334,23.368055555555557,Yes,No,No,No,No,No,No,No,1,1
3605,HPW,23-34122,V-1825,V-1825,,,2-13-23 8:44 AM,2023-02-13T08:44:00.000Z,4-23-23 12:00 AM,2023-04-23T00:00:00.000Z,4-12-23 3:36 PM,2023-04-12T15:36:00.000Z,4,4,,SD,CLOSE,Y,,NO,CHATHAM,3605,MIXING CHAMBER - DRYER A,,No,DRYER A,,,,,,,,,,,39,2023-04-02T16:50:00.000Z,2023-04-26T00:40:00.000Z,560.8333333333334,23.368055555555557,Yes,No,No,No,No,No,No,No,1,1
3605,DISMANTLE SCAFF,23-34124,V-1825,V-1825,,,2-13-23 8:45 AM,2023-02-13T08:45:00.000Z,4-23-23 12:00 AM,2023-04-23T00:00:00.000Z,4-12-23 3:36 PM,2023-04-12T15:36:00.000Z,4,4,,SD,CLOSE,Y,,NO,CHATHAM,3605,MIXING CHAMBER - DRYER A,,No,DRYER A,,,,,,,,,,,39,2023-04-02T16:50:00.000Z,2023-04-26T00:40:00.000Z,560.8333333333334,23.368055555555557,Yes,No,No,No,No,No,No,No,1,1
3605,RE-INSTALL MANWAYS,23-34123,V-1825,V-1825,,,2-13-23 8:45 AM,2023-02-13T08:45:00.000Z,4-23-23 12:00 AM,2023-04-23T00:00:00.000Z,4-12-23 3:36 PM,2023-04-12T15:36:00.000Z,4,4,,SD,CLOSE,Y,,NO,CHATHAM,3605,MIXING CHAMBER - DRYER A,,No,DRYER A,,,,,,,,,,,39,2023-04-02T16:50:00.000Z,2023-04-26T00:40:00.000Z,560.8333333333334,23.368055555555557,Yes,No,No,No,No,No,No,No,1,1
1646,EV-1615A - Eddy Current (Tubular) Inspection Recommended,23-34203,EV-1615A,EV-1615A,,,2-16-23 2:01 PM,2023-02-16T14:01:00.000Z,4-30-23 12:56 PM,2023-04-30T12:56:00.000Z,4-5-23 1:34 PM,2023-04-05T13:34:00.000Z,4,4,,SD,CLOSE,Y,,NO,CHATHAM,,,,,,,,,,,,,,,,39,2023-04-02T16:50:00.000Z,2023-04-26T00:40:00.000Z,560.8333333333334,23.368055555555557,Yes,No,No,No,No,No,No,No,1,1
4418,PSV-24302 (V-2404) - 3 x 4 - 103 kpag - GFE,23-34265,PSV-24302,PSV-24302,,,2-20-23 1:47 AM,2023-02-20T01:47:00.000Z,4-15-23 1:30 AM,2023-04-15T01:30:00.000Z,4-5-23 1:29 PM,2023-04-05T13:29:00.000Z,4,4,,SD,CLOSE,Y,N,NO,CHATHAM,,,,,,,,,,,,,,,,39,2023-04-02T16:50:00.000Z,2023-04-26T00:40:00.000Z,560.8333333333334,23.368055555555557,Yes,No,No,No,No,No,No,No,1,1
4865,SA-2101 CORN PROBE - MECHANICAL  PM,23-34621,SA-2101,SA-2101,,,2-27-23 1:46 AM,2023-02-27T01:46:00.000Z,3-27-23 8:30 AM,2023-03-27T08:30:00.000Z,4-4-23 12:32 PM,2023-04-04T12:32:00.000Z,4,4,,PM,CLOSE,Y,N,NO,CHATHAM,,,,,,,,,,,,,,,,39,2023-04-02T16:50:00.000Z,2023-04-26T00:40:00.000Z,560.8333333333334,23.368055555555557,Yes,No,No,No,No,No,No,No,1,1
4865,CORN PROBE PM + GREASING,23-34622,SA-2101,SA-2101,,,2-27-23 1:46 AM,2023-02-27T01:46:00.000Z,3-27-23 8:30 AM,2023-03-27T08:30:00.000Z,4-4-23 12:32 PM,2023-04-04T12:32:00.000Z,4,4,,PM,CLOSE,Y,,NO,CHATHAM,,,,,,,,,,,,,,,,39,2023-04-02T16:50:00.000Z,2023-04-26T00:40:00.000Z,560.8333333333334,23.368055555555557,Yes,No,No,No,No,No,No,No,1,1
,Dryer A Mixer (MX-1827) HPW PM,23-34922,MX-1827,MX-1827,,,2-28-23 2:13 PM,2023-02-28T14:13:00.000Z,4-21-23 2:13 PM,2023-04-21T14:13:00.000Z,4-12-23 3:32 PM,2023-04-12T15:32:00.000Z,4,4,,PM,CLOSE,Y,,NO,CHATHAM,"2568, 2570","DR-1826 - HIGH SPEED MIXER, MOTOR / 150HP / 1200RPM / TEFC / 575V/3PH/60HZ / FRAME# 447T",,No,DRYER A,CH-DRA_CYCLNS,CH-DRA_CYCLNS:IT18173.MEAS,IT-18173,IT,MEAS,Measured value (PV),Current transmitter (motor amps),Measurement,MX1827 CURRENT INDICATION,MX-1827,39,2023-04-02T16:50:00.000Z,2023-04-26T00:40:00.000Z,560.8333333333334,23.368055555555557,Yes,No,No,No,No,No,No,No,1,1
4865,SA-2101 CORN PROBE - MECHANICAL  PM,23-34970,SA-2101,SA-2101,,,3-6-23 1:46 AM,2023-03-06T01:46:00.000Z,4-3-23 7:30 AM,2023-04-03T07:30:00.000Z,4-6-23 8:00 AM,2023-04-06T08:00:00.000Z,4,4,,PM,CLOSE,Y,N,NO,CHATHAM,,,,,,,,,,,,,,,,39,2023-04-02T16:50:00.000Z,2023-04-26T00:40:00.000Z,560.8333333333334,23.368055555555557,Yes,No,No,No,No,No,No,No,1,1
4868,SC-1301 MECHANICAL CHECKS,23-34989,SC-1301,SC-1301,,,3-6-23 1:46 AM,2023-03-06T01:46:00.000Z,4-3-23 1:00 AM,2023-04-03T01:00:00.000Z,4-3-23 11:13 AM,2023-04-03T11:13:00.000Z,4,4,,PM,CLOSE,Y,,NO,CHATHAM,,,,,,,,,,,,,,,,39,2023-04-02T16:50:00.000Z,2023-04-26T00:40:00.000Z,560.8333333333334,23.368055555555557,Yes,No,No,No,No,No,No,No,1,1
3081,Check operation of biothane float in diked area,23-34964,LSH-41401,LSH-41401,,,3-6-23 1:46 AM,2023-03-06T01:46:00.000Z,4-3-23 12:30 AM,2023-04-03T00:30:00.000Z,4-3-23 9:40 AM,2023-04-03T09:40:00.000Z,4,4,,PM,CLOSE,Y,,NO,CHATHAM,,,,,,,,,,,,,,,,39,2023-04-02T16:50:00.000Z,2023-04-26T00:40:00.000Z,560.8333333333334,23.368055555555557,Yes,No,No,No,No,No,No,No,1,1
3081,BIOTHANE FLOAT OP CHECK- (LSH-41401) - PM SERVICE,23-34963,LSH-41401,LSH-41401,,,3-6-23 1:46 AM,2023-03-06T01:46:00.000Z,4-3-23 12:30 AM,2023-04-03T00:30:00.000Z,4-3-23 12:30 AM,2023-04-03T00:30:00.000Z,4,4,,PM,CLOSE,Y,N,NO,CHATHAM,,,,,,,,,,,,,,,,39,2023-04-02T16:50:00.000Z,2023-04-26T00:40:00.000Z,560.8333333333334,23.368055555555557,Yes,No,No,No,No,No,No,No,1,1
3767,PUMP OIL CHANGE,23-34998,P-4114,P-4114,,,3-6-23 1:46 AM,2023-03-06T01:46:00.000Z,4-3-23 12:15 AM,2023-04-03T00:15:00.000Z,4-4-23 7:14 AM,2023-04-04T07:14:00.000Z,4,4,,PM,CLOSE,Y,,NO,CHATHAM,,,,,,,,,,,,,,,,39,2023-04-02T16:50:00.000Z,2023-04-26T00:40:00.000Z,560.8333333333334,23.368055555555557,Yes,No,No,No,No,No,No,No,1,1
4868,SC-1301 - MECHANICAL CHECKS,23-34988,SC-1301,SC-1301,,,3-6-23 1:46 AM,2023-03-06T01:46:00.000Z,4-3-23 1:00 AM,2023-04-03T01:00:00.000Z,4-3-23 12:30 AM,2023-04-03T00:30:00.000Z,4,4,,PM,CLOSE,Y,N,NO,CHATHAM,,,,,,,,,,,,,,,,39,2023-04-02T16:50:00.000Z,2023-04-26T00:40:00.000Z,560.8333333333334,23.368055555555557,Yes,No,No,No,No,No,No,No,1,1
4865,Corn Probe Weekly PM,23-34971,SA-2101,SA-2101,,,3-6-23 1:46 AM,2023-03-06T01:46:00.000Z,4-3-23 7:30 AM,2023-04-03T07:30:00.000Z,4-10-23 6:02 AM,2023-04-10T06:02:00.000Z,4,4,,PM,CLOSE,Y,,NO,CHATHAM,,,,,,,,,,,,,,,,39,2023-04-02T16:50:00.000Z,2023-04-26T00:40:00.000Z,560.8333333333334,23.368055555555557,Yes,No,No,No,No,No,No,No,1,1
,ELECTRIC HEAT TRACE MONTHLY  CHECKS - ( SEP - APR),23-34973,3800,3800,,,3-6-23 1:46 AM,2023-03-06T01:46:00.000Z,4-1-23 8:00 AM,2023-04-01T08:00:00.000Z,4-4-23 7:14 AM,2023-04-04T07:14:00.000Z,4,4,,PM,CLOSE,Y,,NO,CHATHAM,,,,,,,,,,,,,,,,39,2023-04-02T16:50:00.000Z,2023-04-26T00:40:00.000Z,560.8333333333334,23.368055555555557,Yes,No,No,No,No,No,No,No,1,1
3767,P-4114A - MECHANICAL PM,23-34996,P-4114,P-4114,,,3-6-23 1:46 AM,2023-03-06T01:46:00.000Z,4-3-23 12:30 AM,2023-04-03T00:30:00.000Z,4-3-23 6:00 AM,2023-04-03T06:00:00.000Z,4,4,,PM,CLOSE,Y,N,NO,CHATHAM,,,,,,,,,,,,,,,,39,2023-04-02T16:50:00.000Z,2023-04-26T00:40:00.000Z,560.8333333333334,23.368055555555557,Yes,No,No,No,No,No,No,No,1,1
3767,SEAL LUBRICATION,23-34997,P-4114,P-4114,,,3-6-23 1:46 AM,2023-03-06T01:46:00.000Z,4-3-23 12:15 AM,2023-04-03T00:15:00.000Z,4-4-23 7:14 AM,2023-04-04T07:14:00.000Z,4,4,,PM,CLOSE,Y,,NO,CHATHAM,,,,,,,,,,,,,,,,39,2023-04-02T16:50:00.000Z,2023-04-26T00:40:00.000Z,560.8333333333334,23.368055555555557,Yes,No,No,No,No,No,No,No,1,1
4622,PT-32104 PM TO FLUSH TRANSMITTER,23-35027,PT-32104,PT-32104,,,3-6-23 1:47 AM,2023-03-06T01:47:00.000Z,4-3-23 12:00 AM,2023-04-03T00:00:00.000Z,4-3-23 12:30 AM,2023-04-03T00:30:00.000Z,4,4,,PM,CLOSE,Y,N,NO,CHATHAM,,,,,,,,,,,,,,,,39,2023-04-02T16:50:00.000Z,2023-04-26T00:40:00.000Z,560.8333333333334,23.368055555555557,Yes,No,No,No,No,No,No,No,1,1
4622,PT-32104 PM TO FLUSH TRANSMITTER (3 MONTH),23-35028,PT-32104,PT-32104,,,3-6-23 1:47 AM,2023-03-06T01:47:00.000Z,4-3-23 12:00 AM,2023-04-03T00:00:00.000Z,4-6-23 10:04 AM,2023-04-06T10:04:00.000Z,4,4,,PM,CLOSE,Y,,NO,CHATHAM,,,,,,,,,,,,,,,,39,2023-04-02T16:50:00.000Z,2023-04-26T00:40:00.000Z,560.8333333333334,23.368055555555557,Yes,No,No,No,No,No,No,No,1,1
,"Area Asset Checks-1600, 1660, 1700 (Evaps, Corn oil, Decanyers)",23-35064,1600,1600,,,3-6-23 1:48 AM,2023-03-06T01:48:00.000Z,4-3-23 12:00 AM,2023-04-03T00:00:00.000Z,4-6-23 9:39 AM,2023-04-06T09:39:00.000Z,4,4,,PM,CLOSE,Y,,NO,CHATHAM,,,,,,,,,,,,,,,,39,2023-04-02T16:50:00.000Z,2023-04-26T00:40:00.000Z,560.8333333333334,23.368055555555557,Yes,No,No,No,No,No,No,No,1,1
,"Area Asset Checks-1830, 1840, DDG Cooler",23-35067,1800,1800,,,3-6-23 1:48 AM,2023-03-06T01:48:00.000Z,4-3-23 12:00 AM,2023-04-03T00:00:00.000Z,4-3-23 12:30 AM,2023-04-03T00:30:00.000Z,4,4,,PM,CLOSE,Y,N,NO,CHATHAM,,,,,,,,,,,,,,,,39,2023-04-02T16:50:00.000Z,2023-04-26T00:40:00.000Z,560.8333333333334,23.368055555555557,Yes,No,No,No,No,No,No,No,1,1
1293,BL-1804D WEEKLY GREASING,23-35048,BL-1804D,BL-1804D,,,3-6-23 1:48 AM,2023-03-06T01:48:00.000Z,4-3-23 12:00 AM,2023-04-03T00:00:00.000Z,4-3-23 11:12 AM,2023-04-03T11:12:00.000Z,4,4,,PM,CLOSE,Y,,NO,CHATHAM,"1293, 6864","BLOWER, NYB, MODEL 714 SERIES 45, GENERAL INDUSTRIAL, CW/UB, Arrg't 8, MOTOR / 450HP / 1200RPM / TEFC / 2300V/3PH/60HZ / FR# 5808C",,No,DRYER D,CH-DRYER_D_BLR,CH-DRYER_D_BLR:BL1804D.STAIND,BL-1804D,BL,STAIND,"Status indication (open/closed, run/stop)",Blower (asset),Equipment status,CYCLONE INLET PRESSURE,,39,2023-04-02T16:50:00.000Z,2023-04-26T00:40:00.000Z,560.8333333333334,23.368055555555557,Yes,No,No,No,No,No,No,No,1,1
,"Area Asset Checks-1500, 6500",23-35061,1500,1500,,,3-6-23 1:48 AM,2023-03-06T01:48:00.000Z,4-3-23 12:00 AM,2023-04-03T00:00:00.000Z,4-3-23 12:30 AM,2023-04-03T00:30:00.000Z,4,4,,PM,CLOSE,Y,N,NO,CHATHAM,,,,,,,,,,,,,,,,39,2023-04-02T16:50:00.000Z,2023-04-26T00:40:00.000Z,560.8333333333334,23.368055555555557,Yes,No,No,No,No,No,No,No,1,1
,"Area Asset Checks-1500, 6500 (Distillation)",23-35062,1500,1500,,,3-6-23 1:48 AM,2023-03-06T01:48:00.000Z,4-3-23 12:00 AM,2023-04-03T00:00:00.000Z,4-4-23 9:28 AM,2023-04-04T09:28:00.000Z,4,4,,PM,CLOSE,Y,,NO,CHATHAM,,,,,,,,,,,,,,,,39,2023-04-02T16:50:00.000Z,2023-04-26T00:40:00.000Z,560.8333333333334,23.368055555555557,Yes,No,No,No,No,No,No,No,1,1
,"Area Asset Checks-1830, 1840, DDG Cooler",23-35068,1800,1800,,,3-6-23 1:48 AM,2023-03-06T01:48:00.000Z,4-3-23 12:00 AM,2023-04-03T00:00:00.000Z,4-4-23 9:28 AM,2023-04-04T09:28:00.000Z,4,4,,PM,CLOSE,Y,,NO,CHATHAM,,,,,,,,,,,,,,,,39,2023-04-02T16:50:00.000Z,2023-04-26T00:40:00.000Z,560.8333333333334,23.368055555555557,Yes,No,No,No,No,No,No,No,1,1
,"Area Asset Checks-1500, 6500",23-35051,1500,1500,,,3-6-23 1:48 AM,2023-03-06T01:48:00.000Z,4-3-23 12:00 AM,2023-04-03T00:00:00.000Z,4-3-23 1:00 AM,2023-04-03T01:00:00.000Z,4,4,,PM,CLOSE,Y,N,NO,CHATHAM,,,,,,,,,,,,,,,,39,2023-04-02T16:50:00.000Z,2023-04-26T00:40:00.000Z,560.8333333333334,23.368055555555557,Yes,No,No,No,No,No,No,No,1,1
,"Area Asset Checks-1500, 6500 (Distillation)",23-35052,1500,1500,,,3-6-23 1:48 AM,2023-03-06T01:48:00.000Z,4-3-23 12:00 AM,2023-04-03T00:00:00.000Z,4-3-23 11:12 AM,2023-04-03T11:12:00.000Z,4,4,,PM,CLOSE,Y,,NO,CHATHAM,,,,,,,,,,,,,,,,39,2023-04-02T16:50:00.000Z,2023-04-26T00:40:00.000Z,560.8333333333334,23.368055555555557,Yes,No,No,No,No,No,No,No,1,1
,"Area Asset Checks-2100, 1200, 1300, 1400 (Corn, Mill, Mash, Fermentation)",23-35059,2100,2100,,,3-6-23 1:48 AM,2023-03-06T01:48:00.000Z,4-3-23 12:00 AM,2023-04-03T00:00:00.000Z,4-3-23 12:30 AM,2023-04-03T00:30:00.000Z,4,4,,PM,CLOSE,Y,N,NO,CHATHAM,,,,,,,,,,,,,,,,39,2023-04-02T16:50:00.000Z,2023-04-26T00:40:00.000Z,560.8333333333334,23.368055555555557,Yes,No,No,No,No,No,No,No,1,1
,"Area Asset Checks-2100, 1200, 1300, 1400 (Corn, Mill, Mash, Fermentation)",23-35060,2100,2100,,,3-6-23 1:48 AM,2023-03-06T01:48:00.000Z,4-3-23 2:30 AM,2023-04-03T02:30:00.000Z,4-4-23 9:27 AM,2023-04-04T09:27:00.000Z,4,4,,PM,CLOSE,Y,,NO,CHATHAM,,,,,,,,,,,,,,,,39,2023-04-02T16:50:00.000Z,2023-04-26T00:40:00.000Z,560.8333333333334,23.368055555555557,Yes,No,No,No,No,No,No,No,1,1
,"Area Asset Checks-1600, 1660, 1700",23-35063,1600,1600,,,3-6-23 1:48 AM,2023-03-06T01:48:00.000Z,4-3-23 12:00 AM,2023-04-03T00:00:00.000Z,4-6-23 12:30 AM,2023-04-06T00:30:00.000Z,4,4,,PM,CLOSE,Y,N,NO,CHATHAM,,,,,,,,,,,,,,,,39,2023-04-02T16:50:00.000Z,2023-04-26T00:40:00.000Z,560.8333333333334,23.368055555555557,Yes,No,No,No,No,No,No,No,1,1
,"Area Asset Checks-2200, 2300, 3200, 3600, 4100",23-35066,2200,2200,,,3-6-23 1:48 AM,2023-03-06T01:48:00.000Z,4-3-23 12:00 AM,2023-04-03T00:00:00.000Z,4-3-23 4:27 PM,2023-04-03T16:27:00.000Z,4,4,,PM,CLOSE,Y,,NO,CHATHAM,,,,,,,,,,,,,,,,39,2023-04-02T16:50:00.000Z,2023-04-26T00:40:00.000Z,560.8333333333334,23.368055555555557,Yes,No,No,No,No,No,No,No,1,1
1293,BL-1804D - WEEKLY BEARING GREASING,23-35047,BL-1804D,BL-1804D,,,3-6-23 1:48 AM,2023-03-06T01:48:00.000Z,4-3-23 12:00 AM,2023-04-03T00:00:00.000Z,4-3-23 12:30 AM,2023-04-03T00:30:00.000Z,4,4,,PM,CLOSE,Y,N,NO,CHATHAM,"1293, 6864","BLOWER, NYB, MODEL 714 SERIES 45, GENERAL INDUSTRIAL, CW/UB, Arrg't 8, MOTOR / 450HP / 1200RPM / TEFC / 2300V/3PH/60HZ / FR# 5808C",,No,DRYER D,CH-DRYER_D_BLR,CH-DRYER_D_BLR:BL1804D.STAIND,BL-1804D,BL,STAIND,"Status indication (open/closed, run/stop)",Blower (asset),Equipment status,CYCLONE INLET PRESSURE,,39,2023-04-02T16:50:00.000Z,2023-04-26T00:40:00.000Z,560.8333333333334,23.368055555555557,Yes,No,No,No,No,No,No,No,1,1
,"Area Asset Checks-2200, 2300, 3200, 3600, 4100",23-35065,2200,2200,,,3-6-23 1:48 AM,2023-03-06T01:48:00.000Z,4-3-23 12:00 AM,2023-04-03T00:00:00.000Z,4-3-23 1:00 AM,2023-04-03T01:00:00.000Z,4,4,,PM,CLOSE,Y,N,NO,CHATHAM,,,,,,,,,,,,,,,,39,2023-04-02T16:50:00.000Z,2023-04-26T00:40:00.000Z,560.8333333333334,23.368055555555557,Yes,No,No,No,No,No,No,No,1,1
1115,REMOVE OLD VALVE,23-35273,P-1804,P-1804,,,3-8-23 6:50 AM,2023-03-08T06:50:00.000Z,6-1-23 2:39 PM,2023-06-01T14:39:00.000Z,4-25-23 8:33 AM,2023-04-25T08:33:00.000Z,4,4,,SD,CLOSE,Y,,NO,CHATHAM,1115,GOULDS PUMP 3196 STX,,No,TGF,CH-DRYER_D_SCBR,CH-DRYER_D_SCBR:P1804.STAIND,P-1804,P,STAIND,"Status indication (open/closed, run/stop)",Pump (asset),Equipment status,Pump Permissive P1836,P-1836,39,2023-04-02T16:50:00.000Z,2023-04-26T00:40:00.000Z,560.8333333333334,23.368055555555557,Yes,No,No,No,No,No,No,No,1,1
1115,REMOVE INSULATION,23-35272,P-1804,P-1804,,,3-8-23 6:50 AM,2023-03-08T06:50:00.000Z,6-1-23 2:39 PM,2023-06-01T14:39:00.000Z,4-25-23 8:33 AM,2023-04-25T08:33:00.000Z,4,4,,SD,CLOSE,Y,,NO,CHATHAM,1115,GOULDS PUMP 3196 STX,,No,TGF,CH-DRYER_D_SCBR,CH-DRYER_D_SCBR:P1804.STAIND,P-1804,P,STAIND,"Status indication (open/closed, run/stop)",Pump (asset),Equipment status,Pump Permissive P1836,P-1836,39,2023-04-02T16:50:00.000Z,2023-04-26T00:40:00.000Z,560.8333333333334,23.368055555555557,Yes,No,No,No,No,No,No,No,1,1
1115,WELD IN NEW VALVE,23-35274,P-1804,P-1804,,,3-8-23 6:51 AM,2023-03-08T06:51:00.000Z,6-1-23 2:39 PM,2023-06-01T14:39:00.000Z,4-25-23 8:33 AM,2023-04-25T08:33:00.000Z,4,4,,SD,CLOSE,Y,,NO,CHATHAM,1115,GOULDS PUMP 3196 STX,,No,TGF,CH-DRYER_D_SCBR,CH-DRYER_D_SCBR:P1804.STAIND,P-1804,P,STAIND,"Status indication (open/closed, run/stop)",Pump (asset),Equipment status,Pump Permissive P1836,P-1836,39,2023-04-02T16:50:00.000Z,2023-04-26T00:40:00.000Z,560.8333333333334,23.368055555555557,Yes,No,No,No,No,No,No,No,1,1
1115,RE-INSTALL INSULATION,23-35275,P-1804,P-1804,,,3-8-23 6:51 AM,2023-03-08T06:51:00.000Z,6-1-23 2:39 PM,2023-06-01T14:39:00.000Z,4-25-23 8:33 AM,2023-04-25T08:33:00.000Z,4,4,,SD,CLOSE,Y,,NO,CHATHAM,1115,GOULDS PUMP 3196 STX,,No,TGF,CH-DRYER_D_SCBR,CH-DRYER_D_SCBR:P1804.STAIND,P-1804,P,STAIND,"Status indication (open/closed, run/stop)",Pump (asset),Equipment status,Pump Permissive P1836,P-1836,39,2023-04-02T16:50:00.000Z,2023-04-26T00:40:00.000Z,560.8333333333334,23.368055555555557,Yes,No,No,No,No,No,No,No,1,1
6651,Alcohol Loading Kubota Won't Shift Gears,23-35283,MTC-0012,MTC-0012,,,3-8-23 7:18 AM,2023-03-08T07:18:00.000Z,3-31-23 5:00 PM,2023-03-31T17:00:00.000Z,4-25-23 7:32 AM,2023-04-25T07:32:00.000Z,4,4,,RM,CLOSE,Y,,NO,CHATHAM,,,,,,,,,,,,,,,,39,2023-04-02T16:50:00.000Z,2023-04-26T00:40:00.000Z,560.8333333333334,23.368055555555557,Yes,No,No,No,No,No,No,No,1,1
6651,INSPECT KUBOTA GEARS,23-35288,MTC-0012,MTC-0012,,,3-8-23 7:54 AM,2023-03-08T07:54:00.000Z,3-31-23 5:00 PM,2023-03-31T17:00:00.000Z,4-25-23 7:32 AM,2023-04-25T07:32:00.000Z,4,4,,RM,CLOSE,Y,,NO,CHATHAM,,,,,,,,,,,,,,,,39,2023-04-02T16:50:00.000Z,2023-04-26T00:40:00.000Z,560.8333333333334,23.368055555555557,Yes,No,No,No,No,No,No,No,1,1
,BUILD SCAFF FOR BLINDING ELEV 112,23-35303,CT-3201,CT-3201,,,3-8-23 11:03 AM,2023-03-08T11:03:00.000Z,4-13-23 12:00 AM,2023-04-13T00:00:00.000Z,4-12-23 9:46 AM,2023-04-12T09:46:00.000Z,4,4,,PM,CLOSE,Y,,NO,CHATHAM,,,,,,,,,,,,,,,,39,2023-04-02T16:50:00.000Z,2023-04-26T00:40:00.000Z,560.8333333333334,23.368055555555557,Yes,No,No,No,No,No,No,No,1,1
,REMOVE SCAFF,23-35304,CT-3201,CT-3201,,,3-8-23 11:04 AM,2023-03-08T11:04:00.000Z,4-13-23 12:00 AM,2023-04-13T00:00:00.000Z,4-12-23 9:46 AM,2023-04-12T09:46:00.000Z,4,4,,PM,CLOSE,Y,,NO,CHATHAM,,,,,,,,,,,,,,,,39,2023-04-02T16:50:00.000Z,2023-04-26T00:40:00.000Z,560.8333333333334,23.368055555555557,Yes,No,No,No,No,No,No,No,1,1
,BLIND SYSTEM,23-35305,CT-3201,CT-3201,,,3-8-23 11:05 AM,2023-03-08T11:05:00.000Z,4-13-23 12:00 AM,2023-04-13T00:00:00.000Z,4-12-23 9:46 AM,2023-04-12T09:46:00.000Z,4,4,,PM,CLOSE,Y,,NO,CHATHAM,,,,,,,,,,,,,,,,39,2023-04-02T16:50:00.000Z,2023-04-26T00:40:00.000Z,560.8333333333334,23.368055555555557,Yes,No,No,No,No,No,No,No,1,1
,CONFINED SPACE FOR SUMP,23-35306,CT-3201,CT-3201,,,3-8-23 11:14 AM,2023-03-08T11:14:00.000Z,4-13-23 12:00 AM,2023-04-13T00:00:00.000Z,4-12-23 9:46 AM,2023-04-12T09:46:00.000Z,4,4,,PM,CLOSE,Y,,NO,CHATHAM,,,,,,,,,,,,,,,,39,2023-04-02T16:50:00.000Z,2023-04-26T00:40:00.000Z,560.8333333333334,23.368055555555557,Yes,No,No,No,No,No,No,No,1,1
,BUILD SCAFF FOR CWR/CWS,23-35307,CT-3201,CT-3201,,,3-8-23 11:17 AM,2023-03-08T11:17:00.000Z,4-13-23 12:00 AM,2023-04-13T00:00:00.000Z,4-12-23 9:46 AM,2023-04-12T09:46:00.000Z,4,4,,PM,CLOSE,Y,,NO,CHATHAM,,,,,,,,,,,,,,,,39,2023-04-02T16:50:00.000Z,2023-04-26T00:40:00.000Z,560.8333333333334,23.368055555555557,Yes,No,No,No,No,No,No,No,1,1
,BUILD SCAFF FOR CSE PLATFORM,23-35308,CT-3201,CT-3201,,,3-8-23 11:18 AM,2023-03-08T11:18:00.000Z,4-13-23 12:00 AM,2023-04-13T00:00:00.000Z,4-12-23 9:46 AM,2023-04-12T09:46:00.000Z,4,4,,PM,CLOSE,Y,,NO,CHATHAM,,,,,,,,,,,,,,,,39,2023-04-02T16:50:00.000Z,2023-04-26T00:40:00.000Z,560.8333333333334,23.368055555555557,Yes,No,No,No,No,No,No,No,1,1
2958,INSTALL NEW VALVE,23-35310,LG-15507,LG-15507,,,3-8-23 12:13 PM,2023-03-08T12:13:00.000Z,4-21-23 7:13 AM,2023-04-21T07:13:00.000Z,4-25-23 8:18 AM,2023-04-25T08:18:00.000Z,4,4,,SD,CLOSE,Y,,NO,CHATHAM,,,,,,,,,,,,,,,,39,2023-04-02T16:50:00.000Z,2023-04-26T00:40:00.000Z,560.8333333333334,23.368055555555557,Yes,No,No,No,No,No,No,No,1,1
2958,REMOVE OLD VALVE,23-35309,LG-15507,LG-15507,,,3-8-23 12:13 PM,2023-03-08T12:13:00.000Z,4-21-23 7:13 AM,2023-04-21T07:13:00.000Z,4-25-23 8:18 AM,2023-04-25T08:18:00.000Z,4,4,,SD,CLOSE,Y,,NO,CHATHAM,,,,,,,,,,,,,,,,39,2023-04-02T16:50:00.000Z,2023-04-26T00:40:00.000Z,560.8333333333334,23.368055555555557,Yes,No,No,No,No,No,No,No,1,1
,REMOVE INSULATION,23-35367,E-6585,E-6585,,,3-9-23 3:16 PM,2023-03-09T15:16:00.000Z,11-29-23 1:04 PM,2023-11-29T13:04:00.000Z,4-25-23 9:43 AM,2023-04-25T09:43:00.000Z,4,4,,SD,CLOSE,Y,,NO,CHATHAM,,,,,,,,,,,,,,,,39,2023-04-02T16:50:00.000Z,2023-04-26T00:40:00.000Z,560.8333333333334,23.368055555555557,Yes,No,No,No,No,No,No,No,1,1
,CUT OUT/REMOVE OLD VALVE,23-35368,E-6585,E-6585,,,3-9-23 3:22 PM,2023-03-09T15:22:00.000Z,11-29-23 1:04 PM,2023-11-29T13:04:00.000Z,4-25-23 9:43 AM,2023-04-25T09:43:00.000Z,4,4,,SD,CLOSE,Y,,NO,CHATHAM,,,,,,,,,,,,,,,,39,2023-04-02T16:50:00.000Z,2023-04-26T00:40:00.000Z,560.8333333333334,23.368055555555557,Yes,No,No,No,No,No,No,No,1,1
,INSPECT QA/QC VALVE WELDS,23-35370,E-6585,E-6585,,,3-9-23 3:22 PM,2023-03-09T15:22:00.000Z,11-29-23 1:04 PM,2023-11-29T13:04:00.000Z,4-25-23 9:43 AM,2023-04-25T09:43:00.000Z,4,4,,SD,CLOSE,Y,,NO,CHATHAM,,,,,,,,,,,,,,,,39,2023-04-02T16:50:00.000Z,2023-04-26T00:40:00.000Z,560.8333333333334,23.368055555555557,Yes,No,No,No,No,No,No,No,1,1
,INSTALL/WELD IN NEW VALVE,23-35369,E-6585,E-6585,,,3-9-23 3:22 PM,2023-03-09T15:22:00.000Z,11-29-23 1:04 PM,2023-11-29T13:04:00.000Z,4-25-23 9:43 AM,2023-04-25T09:43:00.000Z,4,4,,SD,CLOSE,Y,,NO,CHATHAM,,,,,,,,,,,,,,,,39,2023-04-02T16:50:00.000Z,2023-04-26T00:40:00.000Z,560.8333333333334,23.368055555555557,Yes,No,No,No,No,No,No,No,1,1
,RE-INSTALL INSULATION,23-35371,E-6585,E-6585,,,3-9-23 3:22 PM,2023-03-09T15:22:00.000Z,11-29-23 1:04 PM,2023-11-29T13:04:00.000Z,4-25-23 9:43 AM,2023-04-25T09:43:00.000Z,4,4,,SD,CLOSE,Y,,NO,CHATHAM,,,,,,,,,,,,,,,,39,2023-04-02T16:50:00.000Z,2023-04-26T00:40:00.000Z,560.8333333333334,23.368055555555557,Yes,No,No,No,No,No,No,No,1,1
,BUILD SCAFF,23-35372,E-6585,E-6585,,,3-9-23 3:25 PM,2023-03-09T15:25:00.000Z,11-29-23 1:04 PM,2023-11-29T13:04:00.000Z,4-25-23 9:43 AM,2023-04-25T09:43:00.000Z,4,4,,SD,CLOSE,Y,,NO,CHATHAM,,,,,,,,,,,,,,,,39,2023-04-02T16:50:00.000Z,2023-04-26T00:40:00.000Z,560.8333333333334,23.368055555555557,Yes,No,No,No,No,No,No,No,1,1
,REMOVE SCAFF,23-35373,E-6585,E-6585,,,3-9-23 3:26 PM,2023-03-09T15:26:00.000Z,11-29-23 1:04 PM,2023-11-29T13:04:00.000Z,4-25-23 9:43 AM,2023-04-25T09:43:00.000Z,4,4,,SD,CLOSE,Y,,NO,CHATHAM,,,,,,,,,,,,,,,,39,2023-04-02T16:50:00.000Z,2023-04-26T00:40:00.000Z,560.8333333333334,23.368055555555557,Yes,No,No,No,No,No,No,No,1,1
,DDG AREA EQUIPMENT GREASE P.M.,23-35432,1800,1800,,,3-13-23 1:45 AM,2023-03-13T01:45:00.000Z,4-4-23 12:00 AM,2023-04-04T00:00:00.000Z,4-4-23 10:37 AM,2023-04-04T10:37:00.000Z,4,4,,PM,CLOSE,Y,,NO,CHATHAM,,,,,,,,,,,,,,,,39,2023-04-02T16:50:00.000Z,2023-04-26T00:40:00.000Z,560.8333333333334,23.368055555555557,Yes,No,No,No,No,No,No,No,1,1
7138,ACCULOAD SCULLY CABLE BI-WEEKLY PM,23-35438,FQIC-2203,FQIC-2203,,,3-13-23 1:45 AM,2023-03-13T01:45:00.000Z,4-7-23 12:30 AM,2023-04-07T00:30:00.000Z,4-6-23 9:39 AM,2023-04-06T09:39:00.000Z,4,4,,PM,CLOSE,Y,,NO,CHATHAM,,,,,,,,,,,,,,,,39,2023-04-02T16:50:00.000Z,2023-04-26T00:40:00.000Z,560.8333333333334,23.368055555555557,Yes,No,No,No,No,No,No,No,1,1
7138,ACCULOAD SCULLY CABLE -PM SERVICE,23-35437,FQIC-2203,FQIC-2203,,,3-13-23 1:45 AM,2023-03-13T01:45:00.000Z,4-7-23 12:30 AM,2023-04-07T00:30:00.000Z,4-6-23 12:30 AM,2023-04-06T00:30:00.000Z,4,4,,PM,CLOSE,Y,N,NO,CHATHAM,,,,,,,,,,,,,,,,39,2023-04-02T16:50:00.000Z,2023-04-26T00:40:00.000Z,560.8333333333334,23.368055555555557,Yes,No,No,No,No,No,No,No,1,1
,1800 AREA - EQUIPMENT GREASING - DDG STORAGE AREA,23-35431,1800,1800,,,3-13-23 1:45 AM,2023-03-13T01:45:00.000Z,4-4-23 12:00 AM,2023-04-04T00:00:00.000Z,4-4-23 1:15 AM,2023-04-04T01:15:00.000Z,4,4,,PM,CLOSE,Y,N,NO,CHATHAM,,,,,,,,,,,,,,,,39,2023-04-02T16:50:00.000Z,2023-04-26T00:40:00.000Z,560.8333333333334,23.368055555555557,Yes,No,No,No,No,No,No,No,1,1
3409,ME-3601 - ENCLOSURE FAN GREASING,23-35468,FA-7417,FA-7417,,,3-13-23 1:46 AM,2023-03-13T01:46:00.000Z,4-8-23 12:00 AM,2023-04-08T00:00:00.000Z,4-4-23 12:30 AM,2023-04-04T00:30:00.000Z,4,4,,PM,CLOSE,Y,N,NO,CHATHAM,,,,,,,,,,,,,,,,39,2023-04-02T16:50:00.000Z,2023-04-26T00:40:00.000Z,560.8333333333334,23.368055555555557,Yes,No,No,No,No,No,No,No,1,1
3409,1 MTH GREASE USING EP-2,23-35469,FA-7417,FA-7417,,,3-13-23 1:46 AM,2023-03-13T01:46:00.000Z,4-8-23 12:00 AM,2023-04-08T00:00:00.000Z,4-4-23 8:40 AM,2023-04-04T08:40:00.000Z,4,4,,PM,CLOSE,Y,,NO,CHATHAM,,,,,,,,,,,,,,,,39,2023-04-02T16:50:00.000Z,2023-04-26T00:40:00.000Z,560.8333333333334,23.368055555555557,Yes,No,No,No,No,No,No,No,1,1
7174,CONDUCTIVITY METER /PH PROBE CLEAN & CALIBRATE PM,23-35471,AE-84404,AE-84404,,,3-13-23 1:46 AM,2023-03-13T01:46:00.000Z,4-6-23 2:00 AM,2023-04-06T02:00:00.000Z,4-12-23 12:36 PM,2023-04-12T12:36:00.000Z,4,4,,PM,CLOSE,Y,,NO,CHATHAM,,,,,,,,,,,,,,,,39,2023-04-02T16:50:00.000Z,2023-04-26T00:40:00.000Z,560.8333333333334,23.368055555555557,Yes,No,No,No,No,No,No,No,1,1
7174,DRYER SCRUBBER PH PROBE PM,23-35470,AE-84404,AE-84404,,,3-13-23 1:46 AM,2023-03-13T01:46:00.000Z,4-6-23 1:00 AM,2023-04-06T01:00:00.000Z,4-6-23 12:12 AM,2023-04-06T00:12:00.000Z,4,4,,PM,CLOSE,Y,N,NO,CHATHAM,,,,,,,,,,,,,,,,39,2023-04-02T16:50:00.000Z,2023-04-26T00:40:00.000Z,560.8333333333334,23.368055555555557,Yes,No,No,No,No,No,No,No,1,1
,ANNUAL INSPECTION AND TEST,23-35484,,,,,3-13-23 1:47 AM,2023-03-13T01:47:00.000Z,4-17-23 8:00 AM,2023-04-17T08:00:00.000Z,4-5-23 11:46 AM,2023-04-05T11:46:00.000Z,4,4,,SD,CLOSE,Y,,NO,CHATHAM,,,,,,,,,,,,,,,,39,2023-04-02T16:50:00.000Z,2023-04-26T00:40:00.000Z,560.8333333333334,23.368055555555557,Yes,No,No,No,No,No,No,No,1,1
,VFD FILTER CLEANING,23-35490,CHATHAM,CHATHAM,,,3-13-23 1:47 AM,2023-03-13T01:47:00.000Z,4-8-23 12:00 AM,2023-04-08T00:00:00.000Z,4-5-23 12:30 AM,2023-04-05T00:30:00.000Z,4,4,,PM,CLOSE,Y,N,NO,CHATHAM,,,,,,,,,,,,,,,,39,2023-04-02T16:50:00.000Z,2023-04-26T00:40:00.000Z,560.8333333333334,23.368055555555557,Yes,No,No,No,No,No,No,No,1,1
,C-MI-1201B - MECHANICAL PM,23-35493,MI-1201B,MI-1201B,,,3-13-23 1:47 AM,2023-03-13T01:47:00.000Z,4-10-23 12:00 AM,2023-04-10T00:00:00.000Z,4-12-23 6:29 PM,2023-04-12T18:29:00.000Z,4,4,,PM,CLOSE,Y,,NO,CHATHAM,,,,,,,,,,,,,,,,39,2023-04-02T16:50:00.000Z,2023-04-26T00:40:00.000Z,560.8333333333334,23.368055555555557,Yes,No,No,No,No,No,No,No,1,1
,Weekly Vibration check (GFE I/E),23-35494,MI-1201B,MI-1201B,,,3-13-23 1:47 AM,2023-03-13T01:47:00.000Z,4-10-23 12:00 AM,2023-04-10T00:00:00.000Z,4-12-23 6:29 PM,2023-04-12T18:29:00.000Z,4,4,,PM,CLOSE,Y,,NO,CHATHAM,,,,,,,,,,,,,,,,39,2023-04-02T16:50:00.000Z,2023-04-26T00:40:00.000Z,560.8333333333334,23.368055555555557,Yes,No,No,No,No,No,No,No,1,1
,MI-1201A - MECHANICAL PM,23-35495,MI-1201A,MI-1201A,,,3-13-23 1:47 AM,2023-03-13T01:47:00.000Z,4-6-23 12:30 AM,2023-04-06T00:30:00.000Z,4-6-23 1:00 AM,2023-04-06T01:00:00.000Z,4,4,,PM,CLOSE,Y,N,NO,CHATHAM,,,,,,,,,,,,,,,,39,2023-04-02T16:50:00.000Z,2023-04-26T00:40:00.000Z,560.8333333333334,23.368055555555557,Yes,No,No,No,No,No,No,No,1,1
,MI-1201A - WEEKLY PM & ROTATION CHANGE,23-35496,MI-1201A,MI-1201A,,,3-13-23 1:47 AM,2023-03-13T01:47:00.000Z,4-6-23 1:30 AM,2023-04-06T01:30:00.000Z,4-10-23 6:02 AM,2023-04-10T06:02:00.000Z,4,4,,PM,CLOSE,Y,,NO,CHATHAM,,,,,,,,,,,,,,,,39,2023-04-02T16:50:00.000Z,2023-04-26T00:40:00.000Z,560.8333333333334,23.368055555555557,Yes,No,No,No,No,No,No,No,1,1
7709,"Inspection of lab fume hood, change belts as required",23-35522,FU-0002,FU-0002,,,3-13-23 1:47 AM,2023-03-13T01:47:00.000Z,4-5-23 12:00 AM,2023-04-05T00:00:00.000Z,4-5-23 1:27 PM,2023-04-05T13:27:00.000Z,4,4,,PM,CLOSE,Y,,NO,CHATHAM,,,,,,,,,,,,,,,,39,2023-04-02T16:50:00.000Z,2023-04-26T00:40:00.000Z,560.8333333333334,23.368055555555557,Yes,No,No,No,No,No,No,No,1,1
3396,ME-3602A - LUBE OIL SAMPLE,23-35499,ME-3602A,ME-3602A,,,3-13-23 1:47 AM,2023-03-13T01:47:00.000Z,4-8-23 12:30 AM,2023-04-08T00:30:00.000Z,4-5-23 12:30 AM,2023-04-05T00:30:00.000Z,4,4,,PM,CLOSE,Y,N,NO,CHATHAM,,,,,,,,,,,,,,,,39,2023-04-02T16:50:00.000Z,2023-04-26T00:40:00.000Z,560.8333333333334,23.368055555555557,Yes,No,No,No,No,No,No,No,1,1
7710,R &D LAB FUME HOOD INSPECTION (PARK AVE.),23-35519,FU-0001,FU-0001,,,3-13-23 1:47 AM,2023-03-13T01:47:00.000Z,4-5-23 12:00 AM,2023-04-05T00:00:00.000Z,4-5-23 12:30 AM,2023-04-05T00:30:00.000Z,4,4,,PM,CLOSE,Y,N,NO,CHATHAM,,,,,,,,,,,,,,,,39,2023-04-02T16:50:00.000Z,2023-04-26T00:40:00.000Z,560.8333333333334,23.368055555555557,Yes,No,No,No,No,No,No,No,1,1
,'-DATED TAG MUST BE ATTACHED AT COMPLETION OF INSPECTION,23-35485,,,,,3-13-23 1:47 AM,2023-03-13T01:47:00.000Z,4-17-23 8:00 AM,2023-04-17T08:00:00.000Z,4-5-23 11:46 AM,2023-04-05T11:46:00.000Z,4,4,,SD,CLOSE,Y,,NO,CHATHAM,,,,,,,,,,,,,,,,39,2023-04-02T16:50:00.000Z,2023-04-26T00:40:00.000Z,560.8333333333334,23.368055555555557,Yes,No,No,No,No,No,No,No,1,1
1230,PH PROBE CLEANING AND CALIBRATION WEEKLY PM,23-35489,AT-14125,AT-14125,,,3-13-23 1:47 AM,2023-03-13T01:47:00.000Z,4-6-23 1:00 AM,2023-04-06T01:00:00.000Z,4-12-23 12:36 PM,2023-04-12T12:36:00.000Z,4,4,,PM,CLOSE,Y,,NO,CHATHAM,,,,,,,,,,,,,,,,39,2023-04-02T16:50:00.000Z,2023-04-26T00:40:00.000Z,560.8333333333334,23.368055555555557,Yes,No,No,No,No,No,No,No,1,1
,MI-1201B - MECHANICAL PM,23-35492,MI-1201B,MI-1201B,,,3-13-23 1:47 AM,2023-03-13T01:47:00.000Z,4-10-23 12:30 AM,2023-04-10T00:30:00.000Z,4-12-23 6:29 PM,2023-04-12T18:29:00.000Z,4,4,,PM,CLOSE,Y,N,NO,CHATHAM,,,,,,,,,,,,,,,,39,2023-04-02T16:50:00.000Z,2023-04-26T00:40:00.000Z,560.8333333333334,23.368055555555557,Yes,No,No,No,No,No,No,No,1,1
3396,PREPARATION,23-35500,ME-3602A,ME-3602A,,,3-13-23 1:47 AM,2023-03-13T01:47:00.000Z,4-8-23 12:00 AM,2023-04-08T00:00:00.000Z,4-5-23 1:30 PM,2023-04-05T13:30:00.000Z,4,4,,PM,CLOSE,Y,,NO,CHATHAM,,,,,,,,,,,,,,,,39,2023-04-02T16:50:00.000Z,2023-04-26T00:40:00.000Z,560.8333333333334,23.368055555555557,Yes,No,No,No,No,No,No,No,1,1
3396,GIVE SAMPLE TO SHIPPER/RECEIVER,23-35503,ME-3602A,ME-3602A,,,3-13-23 1:47 AM,2023-03-13T01:47:00.000Z,4-8-23 12:00 AM,2023-04-08T00:00:00.000Z,4-5-23 1:30 PM,2023-04-05T13:30:00.000Z,4,4,,PM,CLOSE,Y,,NO,CHATHAM,,,,,,,,,,,,,,,,39,2023-04-02T16:50:00.000Z,2023-04-26T00:40:00.000Z,560.8333333333334,23.368055555555557,Yes,No,No,No,No,No,No,No,1,1
7709,R &D LAB FUME HOOD INSPECTION (PARK AVE.),23-35521,FU-0002,FU-0002,,,3-13-23 1:47 AM,2023-03-13T01:47:00.000Z,4-5-23 12:00 AM,2023-04-05T00:00:00.000Z,4-5-23 12:30 AM,2023-04-05T00:30:00.000Z,4,4,,PM,CLOSE,Y,N,NO,CHATHAM,,,,,,,,,,,,,,,,39,2023-04-02T16:50:00.000Z,2023-04-26T00:40:00.000Z,560.8333333333334,23.368055555555557,Yes,No,No,No,No,No,No,No,1,1
,POTABLE WATER BACKFLOW PREVENTER  PM,23-35483,,,,,3-13-23 1:47 AM,2023-03-13T01:47:00.000Z,4-17-23 8:00 AM,2023-04-17T08:00:00.000Z,4-5-23 11:46 AM,2023-04-05T11:46:00.000Z,4,4,,SD,CLOSE,Y,N,NO,CHATHAM,,,,,,,,,,,,,,,,39,2023-04-02T16:50:00.000Z,2023-04-26T00:40:00.000Z,560.8333333333334,23.368055555555557,Yes,No,No,No,No,No,No,No,1,1
1230,PH PROBE CLEANING AND CALIBRATION PM,23-35488,AT-14125,AT-14125,,,3-13-23 1:47 AM,2023-03-13T01:47:00.000Z,4-6-23 12:00 AM,2023-04-06T00:00:00.000Z,4-6-23 12:12 AM,2023-04-06T00:12:00.000Z,4,4,,PM,CLOSE,Y,N,NO,CHATHAM,,,,,,,,,,,,,,,,39,2023-04-02T16:50:00.000Z,2023-04-26T00:40:00.000Z,560.8333333333334,23.368055555555557,Yes,No,No,No,No,No,No,No,1,1
1227,PH PROBE CLEANING AND CALIBRATION PM,23-35486,AT-13519,AT-13519,,,3-13-23 1:47 AM,2023-03-13T01:47:00.000Z,4-6-23 12:00 AM,2023-04-06T00:00:00.000Z,4-6-23 12:12 AM,2023-04-06T00:12:00.000Z,4,4,,PM,CLOSE,Y,N,NO,CHATHAM,,,,,,,,,,,,,,,,39,2023-04-02T16:50:00.000Z,2023-04-26T00:40:00.000Z,560.8333333333334,23.368055555555557,Yes,No,No,No,No,No,No,No,1,1
1227,PH PROBE CLEANING AND CALIBRATION WEEKLY PM,23-35487,AT-13519,AT-13519,,,3-13-23 1:47 AM,2023-03-13T01:47:00.000Z,4-6-23 1:00 AM,2023-04-06T01:00:00.000Z,4-12-23 12:36 PM,2023-04-12T12:36:00.000Z,4,4,,PM,CLOSE,Y,,NO,CHATHAM,,,,,,,,,,,,,,,,39,2023-04-02T16:50:00.000Z,2023-04-26T00:40:00.000Z,560.8333333333334,23.368055555555557,Yes,No,No,No,No,No,No,No,1,1
,VFD FILTER CLEANING,23-35491,CHATHAM,CHATHAM,,,3-13-23 1:47 AM,2023-03-13T01:47:00.000Z,4-8-23 12:00 AM,2023-04-08T00:00:00.000Z,4-5-23 11:30 AM,2023-04-05T11:30:00.000Z,4,4,,PM,CLOSE,Y,,NO,CHATHAM,,,,,,,,,,,,,,,,39,2023-04-02T16:50:00.000Z,2023-04-26T00:40:00.000Z,560.8333333333334,23.368055555555557,Yes,No,No,No,No,No,No,No,1,1
,MI-1201A - VISUAL GREASE CHECK,23-35497,MI-1201A,MI-1201A,,,3-13-23 1:47 AM,2023-03-13T01:47:00.000Z,4-6-23 12:30 AM,2023-04-06T00:30:00.000Z,4-10-23 6:02 AM,2023-04-10T06:02:00.000Z,4,4,,PM,CLOSE,Y,,NO,CHATHAM,,,,,,,,,,,,,,,,39,2023-04-02T16:50:00.000Z,2023-04-26T00:40:00.000Z,560.8333333333334,23.368055555555557,Yes,No,No,No,No,No,No,No,1,1
,Weekly Vibration check (GFE I/E),23-35498,MI-1201A,MI-1201A,,,3-13-23 1:47 AM,2023-03-13T01:47:00.000Z,4-6-23 12:00 AM,2023-04-06T00:00:00.000Z,4-10-23 6:02 AM,2023-04-10T06:02:00.000Z,4,4,,PM,CLOSE,Y,,NO,CHATHAM,,,,,,,,,,,,,,,,39,2023-04-02T16:50:00.000Z,2023-04-26T00:40:00.000Z,560.8333333333334,23.368055555555557,Yes,No,No,No,No,No,No,No,1,1
3396,EXTRACT OIL SAMPLE,23-35501,ME-3602A,ME-3602A,,,3-13-23 1:47 AM,2023-03-13T01:47:00.000Z,4-8-23 12:30 AM,2023-04-08T00:30:00.000Z,4-5-23 1:30 PM,2023-04-05T13:30:00.000Z,4,4,,PM,CLOSE,Y,,NO,CHATHAM,,,,,,,,,,,,,,,,39,2023-04-02T16:50:00.000Z,2023-04-26T00:40:00.000Z,560.8333333333334,23.368055555555557,Yes,No,No,No,No,No,No,No,1,1
3396,CHECK OIL LEVEL,23-35502,ME-3602A,ME-3602A,,,3-13-23 1:47 AM,2023-03-13T01:47:00.000Z,4-8-23 12:30 AM,2023-04-08T00:30:00.000Z,4-5-23 1:30 PM,2023-04-05T13:30:00.000Z,4,4,,PM,CLOSE,Y,,NO,CHATHAM,,,,,,,,,,,,,,,,39,2023-04-02T16:50:00.000Z,2023-04-26T00:40:00.000Z,560.8333333333334,23.368055555555557,Yes,No,No,No,No,No,No,No,1,1
7710,"Inspection of lab fume hood, change belts as required",23-35520,FU-0001,FU-0001,,,3-13-23 1:47 AM,2023-03-13T01:47:00.000Z,4-5-23 12:00 AM,2023-04-05T00:00:00.000Z,4-5-23 1:27 PM,2023-04-05T13:27:00.000Z,4,4,,PM,CLOSE,Y,,NO,CHATHAM,,,,,,,,,,,,,,,,39,2023-04-02T16:50:00.000Z,2023-04-26T00:40:00.000Z,560.8333333333334,23.368055555555557,Yes,No,No,No,No,No,No,No,1,1
,CV-1828 MECHANICAL PM,23-35551,CV-1828,CV-1828,,,3-13-23 1:48 AM,2023-03-13T01:48:00.000Z,4-10-23 10:00 AM,2023-04-10T10:00:00.000Z,4-12-23 6:29 PM,2023-04-12T18:29:00.000Z,4,4,,PM,CLOSE,Y,N,NO,CHATHAM,"2489, 2514","40 HP / 1800 RPM / TEFC / 575V/3PH/60HZ / FRAME#324T, DORRIS 307TR25F2 SHAFT MOUNTED SPEED REDUCER",,Yes,DRYER A,CH-DRA_CYCLNS,CH-DRA_CYCLNS:TT18169C.MEAS,TT-18169C,TT,MEAS,Measured value (PV),Temperature transmitter,Measurement,CV1828 CURRENT INDICATION,CV-1828,39,2023-04-02T16:50:00.000Z,2023-04-26T00:40:00.000Z,560.8333333333334,23.368055555555557,Yes,No,No,No,No,No,No,No,1,1
,INSPECT PILLOW BLOCK BEARINGS,23-35561,CV-1830,CV-1830,,,3-13-23 1:48 AM,2023-03-13T01:48:00.000Z,4-10-23 7:00 AM,2023-04-10T07:00:00.000Z,4-12-23 6:29 PM,2023-04-12T18:29:00.000Z,4,4,,PM,CLOSE,Y,,NO,CHATHAM,"2490, 2515","20 HP / 1760 RPM / TEFC / 575V/3PH/60HZ / FRAME#256T, DORRIS 315TR25 SHAFT MOUNTED SPEED REDUCER",,No,DRYER A,CH-DRYER_A,CH-DRYER_A:CV1830.STAIND,CV-1830,CV,STAIND,"Status indication (open/closed, run/stop)",Conveyor (asset),Equipment status,RECYCLE DRAG CONVEYOR,,39,2023-04-02T16:50:00.000Z,2023-04-26T00:40:00.000Z,560.8333333333334,23.368055555555557,Yes,No,No,No,No,No,No,No,1,1
,INSPECT PILLOW BLOCK BEARINGS,23-35554,CV-1828,CV-1828,,,3-13-23 1:48 AM,2023-03-13T01:48:00.000Z,4-10-23 7:00 AM,2023-04-10T07:00:00.000Z,4-12-23 6:29 PM,2023-04-12T18:29:00.000Z,4,4,,PM,CLOSE,Y,,NO,CHATHAM,"2489, 2514","40 HP / 1800 RPM / TEFC / 575V/3PH/60HZ / FRAME#324T, DORRIS 307TR25F2 SHAFT MOUNTED SPEED REDUCER",,Yes,DRYER A,CH-DRA_CYCLNS,CH-DRA_CYCLNS:TT18169C.MEAS,TT-18169C,TT,MEAS,Measured value (PV),Temperature transmitter,Measurement,CV1828 CURRENT INDICATION,CV-1828,39,2023-04-02T16:50:00.000Z,2023-04-26T00:40:00.000Z,560.8333333333334,23.368055555555557,Yes,No,No,No,No,No,No,No,1,1
,INSPECT GEARBOX,23-35562,CV-1830,CV-1830,,,3-13-23 1:48 AM,2023-03-13T01:48:00.000Z,4-10-23 7:00 AM,2023-04-10T07:00:00.000Z,4-12-23 6:29 PM,2023-04-12T18:29:00.000Z,4,4,,PM,CLOSE,Y,,NO,CHATHAM,"2490, 2515","20 HP / 1760 RPM / TEFC / 575V/3PH/60HZ / FRAME#256T, DORRIS 315TR25 SHAFT MOUNTED SPEED REDUCER",,No,DRYER A,CH-DRYER_A,CH-DRYER_A:CV1830.STAIND,CV-1830,CV,STAIND,"Status indication (open/closed, run/stop)",Conveyor (asset),Equipment status,RECYCLE DRAG CONVEYOR,,39,2023-04-02T16:50:00.000Z,2023-04-26T00:40:00.000Z,560.8333333333334,23.368055555555557,Yes,No,No,No,No,No,No,No,1,1
,PH PROBE CLEANING AND CALIBRATION WEEKLY PM,23-35536,AT-84505,AT-84505,,,3-13-23 1:48 AM,2023-03-13T01:48:00.000Z,4-6-23 1:00 AM,2023-04-06T01:00:00.000Z,4-12-23 12:36 PM,2023-04-12T12:36:00.000Z,4,4,,PM,CLOSE,Y,,NO,CHATHAM,,,,,,,,,,,,,,,,39,2023-04-02T16:50:00.000Z,2023-04-26T00:40:00.000Z,560.8333333333334,23.368055555555557,Yes,No,No,No,No,No,No,No,1,1
,INSPECT GEARBOX,23-35555,CV-1828,CV-1828,,,3-13-23 1:48 AM,2023-03-13T01:48:00.000Z,4-10-23 7:00 AM,2023-04-10T07:00:00.000Z,4-12-23 6:29 PM,2023-04-12T18:29:00.000Z,4,4,,PM,CLOSE,Y,,NO,CHATHAM,"2489, 2514","40 HP / 1800 RPM / TEFC / 575V/3PH/60HZ / FRAME#324T, DORRIS 307TR25F2 SHAFT MOUNTED SPEED REDUCER",,Yes,DRYER A,CH-DRA_CYCLNS,CH-DRA_CYCLNS:TT18169C.MEAS,TT-18169C,TT,MEAS,Measured value (PV),Temperature transmitter,Measurement,CV1828 CURRENT INDICATION,CV-1828,39,2023-04-02T16:50:00.000Z,2023-04-26T00:40:00.000Z,560.8333333333334,23.368055555555557,Yes,No,No,No,No,No,No,No,1,1
,INSPECT CONVEYOR TROUGH,23-35564,CV-1830,CV-1830,,,3-13-23 1:48 AM,2023-03-13T01:48:00.000Z,4-10-23 7:00 AM,2023-04-10T07:00:00.000Z,4-12-23 6:29 PM,2023-04-12T18:29:00.000Z,4,4,,PM,CLOSE,Y,,NO,CHATHAM,"2490, 2515","20 HP / 1760 RPM / TEFC / 575V/3PH/60HZ / FRAME#256T, DORRIS 315TR25 SHAFT MOUNTED SPEED REDUCER",,No,DRYER A,CH-DRYER_A,CH-DRYER_A:CV1830.STAIND,CV-1830,CV,STAIND,"Status indication (open/closed, run/stop)",Conveyor (asset),Equipment status,RECYCLE DRAG CONVEYOR,,39,2023-04-02T16:50:00.000Z,2023-04-26T00:40:00.000Z,560.8333333333334,23.368055555555557,Yes,No,No,No,No,No,No,No,1,1
,CHECK COUPLING BOLTS,23-35552,CV-1828,CV-1828,,,3-13-23 1:48 AM,2023-03-13T01:48:00.000Z,4-10-23 7:00 AM,2023-04-10T07:00:00.000Z,4-12-23 6:29 PM,2023-04-12T18:29:00.000Z,4,4,,PM,CLOSE,Y,,NO,CHATHAM,"2489, 2514","40 HP / 1800 RPM / TEFC / 575V/3PH/60HZ / FRAME#324T, DORRIS 307TR25F2 SHAFT MOUNTED SPEED REDUCER",,Yes,DRYER A,CH-DRA_CYCLNS,CH-DRA_CYCLNS:TT18169C.MEAS,TT-18169C,TT,MEAS,Measured value (PV),Temperature transmitter,Measurement,CV1828 CURRENT INDICATION,CV-1828,39,2023-04-02T16:50:00.000Z,2023-04-26T00:40:00.000Z,560.8333333333334,23.368055555555557,Yes,No,No,No,No,No,No,No,1,1
,INSPECT TROUGH GASKETS FOR LEAKAGE,23-35553,CV-1828,CV-1828,,,3-13-23 1:48 AM,2023-03-13T01:48:00.000Z,4-10-23 7:00 AM,2023-04-10T07:00:00.000Z,4-12-23 6:29 PM,2023-04-12T18:29:00.000Z,4,4,,PM,CLOSE,Y,,NO,CHATHAM,"2489, 2514","40 HP / 1800 RPM / TEFC / 575V/3PH/60HZ / FRAME#324T, DORRIS 307TR25F2 SHAFT MOUNTED SPEED REDUCER",,Yes,DRYER A,CH-DRA_CYCLNS,CH-DRA_CYCLNS:TT18169C.MEAS,TT-18169C,TT,MEAS,Measured value (PV),Temperature transmitter,Measurement,CV1828 CURRENT INDICATION,CV-1828,39,2023-04-02T16:50:00.000Z,2023-04-26T00:40:00.000Z,560.8333333333334,23.368055555555557,Yes,No,No,No,No,No,No,No,1,1
,CV-1830 MECHANICAL PM,23-35558,CV-1830,CV-1830,,,3-13-23 1:48 AM,2023-03-13T01:48:00.000Z,4-10-23 10:00 AM,2023-04-10T10:00:00.000Z,4-12-23 6:29 PM,2023-04-12T18:29:00.000Z,4,4,,PM,CLOSE,Y,N,NO,CHATHAM,"2490, 2515","20 HP / 1760 RPM / TEFC / 575V/3PH/60HZ / FRAME#256T, DORRIS 315TR25 SHAFT MOUNTED SPEED REDUCER",,No,DRYER A,CH-DRYER_A,CH-DRYER_A:CV1830.STAIND,CV-1830,CV,STAIND,"Status indication (open/closed, run/stop)",Conveyor (asset),Equipment status,RECYCLE DRAG CONVEYOR,,39,2023-04-02T16:50:00.000Z,2023-04-26T00:40:00.000Z,560.8333333333334,23.368055555555557,Yes,No,No,No,No,No,No,No,1,1
,INSPECT SCREW CONVEYOR,23-35563,CV-1830,CV-1830,,,3-13-23 1:48 AM,2023-03-13T01:48:00.000Z,4-10-23 7:00 AM,2023-04-10T07:00:00.000Z,4-12-23 6:29 PM,2023-04-12T18:29:00.000Z,4,4,,PM,CLOSE,Y,,NO,CHATHAM,"2490, 2515","20 HP / 1760 RPM / TEFC / 575V/3PH/60HZ / FRAME#256T, DORRIS 315TR25 SHAFT MOUNTED SPEED REDUCER",,No,DRYER A,CH-DRYER_A,CH-DRYER_A:CV1830.STAIND,CV-1830,CV,STAIND,"Status indication (open/closed, run/stop)",Conveyor (asset),Equipment status,RECYCLE DRAG CONVEYOR,,39,2023-04-02T16:50:00.000Z,2023-04-26T00:40:00.000Z,560.8333333333334,23.368055555555557,Yes,No,No,No,No,No,No,No,1,1
,C-1803D pH Meter-Weekly PM,23-35535,AT-84505,AT-84505,,,3-13-23 1:48 AM,2023-03-13T01:48:00.000Z,4-6-23 12:00 AM,2023-04-06T00:00:00.000Z,4-6-23 12:12 AM,2023-04-06T00:12:00.000Z,4,4,,PM,CLOSE,Y,N,NO,CHATHAM,,,,,,,,,,,,,,,,39,2023-04-02T16:50:00.000Z,2023-04-26T00:40:00.000Z,560.8333333333334,23.368055555555557,Yes,No,No,No,No,No,No,No,1,1
,INSPECT SCREW CONVEYOR,23-35556,CV-1828,CV-1828,,,3-13-23 1:48 AM,2023-03-13T01:48:00.000Z,4-10-23 7:00 AM,2023-04-10T07:00:00.000Z,4-12-23 6:29 PM,2023-04-12T18:29:00.000Z,4,4,,PM,CLOSE,Y,,NO,CHATHAM,"2489, 2514","40 HP / 1800 RPM / TEFC / 575V/3PH/60HZ / FRAME#324T, DORRIS 307TR25F2 SHAFT MOUNTED SPEED REDUCER",,Yes,DRYER A,CH-DRA_CYCLNS,CH-DRA_CYCLNS:TT18169C.MEAS,TT-18169C,TT,MEAS,Measured value (PV),Temperature transmitter,Measurement,CV1828 CURRENT INDICATION,CV-1828,39,2023-04-02T16:50:00.000Z,2023-04-26T00:40:00.000Z,560.8333333333334,23.368055555555557,Yes,No,No,No,No,No,No,No,1,1
,INSPECT CONVEYOR TROUGH,23-35557,CV-1828,CV-1828,,,3-13-23 1:48 AM,2023-03-13T01:48:00.000Z,4-10-23 7:00 AM,2023-04-10T07:00:00.000Z,4-12-23 6:29 PM,2023-04-12T18:29:00.000Z,4,4,,PM,CLOSE,Y,,NO,CHATHAM,"2489, 2514","40 HP / 1800 RPM / TEFC / 575V/3PH/60HZ / FRAME#324T, DORRIS 307TR25F2 SHAFT MOUNTED SPEED REDUCER",,Yes,DRYER A,CH-DRA_CYCLNS,CH-DRA_CYCLNS:TT18169C.MEAS,TT-18169C,TT,MEAS,Measured value (PV),Temperature transmitter,Measurement,CV1828 CURRENT INDICATION,CV-1828,39,2023-04-02T16:50:00.000Z,2023-04-26T00:40:00.000Z,560.8333333333334,23.368055555555557,Yes,No,No,No,No,No,No,No,1,1
,CHECK COUPLING BOLTS,23-35559,CV-1830,CV-1830,,,3-13-23 1:48 AM,2023-03-13T01:48:00.000Z,4-10-23 7:00 AM,2023-04-10T07:00:00.000Z,4-12-23 6:29 PM,2023-04-12T18:29:00.000Z,4,4,,PM,CLOSE,Y,,NO,CHATHAM,"2490, 2515","20 HP / 1760 RPM / TEFC / 575V/3PH/60HZ / FRAME#256T, DORRIS 315TR25 SHAFT MOUNTED SPEED REDUCER",,No,DRYER A,CH-DRYER_A,CH-DRYER_A:CV1830.STAIND,CV-1830,CV,STAIND,"Status indication (open/closed, run/stop)",Conveyor (asset),Equipment status,RECYCLE DRAG CONVEYOR,,39,2023-04-02T16:50:00.000Z,2023-04-26T00:40:00.000Z,560.8333333333334,23.368055555555557,Yes,No,No,No,No,No,No,No,1,1
,INSPECT TROUGH GASKETS FOR LEAKAGE,23-35560,CV-1830,CV-1830,,,3-13-23 1:48 AM,2023-03-13T01:48:00.000Z,4-10-23 7:00 AM,2023-04-10T07:00:00.000Z,4-12-23 6:29 PM,2023-04-12T18:29:00.000Z,4,4,,PM,CLOSE,Y,,NO,CHATHAM,"2490, 2515","20 HP / 1760 RPM / TEFC / 575V/3PH/60HZ / FRAME#256T, DORRIS 315TR25 SHAFT MOUNTED SPEED REDUCER",,No,DRYER A,CH-DRYER_A,CH-DRYER_A:CV1830.STAIND,CV-1830,CV,STAIND,"Status indication (open/closed, run/stop)",Conveyor (asset),Equipment status,RECYCLE DRAG CONVEYOR,,39,2023-04-02T16:50:00.000Z,2023-04-26T00:40:00.000Z,560.8333333333334,23.368055555555557,Yes,No,No,No,No,No,No,No,1,1
1280,REPLACE MOTOR,23-35858,BE-2107,BE-2107,,,3-14-23 8:09 AM,2023-03-14T08:09:00.000Z,6-22-23 12:00 AM,2023-06-22T00:00:00.000Z,4-12-23 3:30 PM,2023-04-12T15:30:00.000Z,4,4,,PM,CLOSE,Y,,NO,CHATHAM,,,,,,,,,,,,,,,,39,2023-04-02T16:50:00.000Z,2023-04-26T00:40:00.000Z,560.8333333333334,23.368055555555557,Yes,No,No,No,No,No,No,No,1,1
,TA23 Frac Tank Order and Staging,23-35900,CHATHAM,CHATHAM,,,3-14-23 1:36 PM,2023-03-14T13:36:00.000Z,6-30-23 1:36 PM,2023-06-30T13:36:00.000Z,4-12-23 6:28 PM,2023-04-12T18:28:00.000Z,4,4,,SD,CLOSE,Y,,NO,CHATHAM,,,,,,,,,,,,,,,,39,2023-04-02T16:50:00.000Z,2023-04-26T00:40:00.000Z,560.8333333333334,23.368055555555557,Yes,No,No,No,No,No,No,No,1,1
1041,BUILD SCAFF TO ACEES VALVE,23-35922,P-1603A,P-1603A,,,3-15-23 12:21 PM,2023-03-15T12:21:00.000Z,4-23-23 8:26 AM,2023-04-23T08:26:00.000Z,4-25-23 9:21 AM,2023-04-25T09:21:00.000Z,4,4,,SD,CLOSE,Y,,NO,CHATHAM,,,,,,,,,,,,,,,,39,2023-04-02T16:50:00.000Z,2023-04-26T00:40:00.000Z,560.8333333333334,23.368055555555557,Yes,No,No,No,No,No,No,No,1,1
1041,REMOVE OLD VALVE,23-35924,P-1603A,P-1603A,,,3-15-23 12:21 PM,2023-03-15T12:21:00.000Z,4-23-23 8:26 AM,2023-04-23T08:26:00.000Z,4-25-23 9:21 AM,2023-04-25T09:21:00.000Z,4,4,,SD,CLOSE,Y,,NO,CHATHAM,,,,,,,,,,,,,,,,39,2023-04-02T16:50:00.000Z,2023-04-26T00:40:00.000Z,560.8333333333334,23.368055555555557,Yes,No,No,No,No,No,No,No,1,1
1041,REMOVE INSULATION,23-35923,P-1603A,P-1603A,,,3-15-23 12:21 PM,2023-03-15T12:21:00.000Z,4-23-23 8:26 AM,2023-04-23T08:26:00.000Z,4-25-23 9:21 AM,2023-04-25T09:21:00.000Z,4,4,,SD,CLOSE,Y,,NO,CHATHAM,,,,,,,,,,,,,,,,39,2023-04-02T16:50:00.000Z,2023-04-26T00:40:00.000Z,560.8333333333334,23.368055555555557,Yes,No,No,No,No,No,No,No,1,1
1041,REMOVE SCAFF,23-35927,P-1603A,P-1603A,,,3-15-23 12:22 PM,2023-03-15T12:22:00.000Z,4-23-23 8:26 AM,2023-04-23T08:26:00.000Z,4-25-23 9:21 AM,2023-04-25T09:21:00.000Z,4,4,,SD,CLOSE,Y,,NO,CHATHAM,,,,,,,,,,,,,,,,39,2023-04-02T16:50:00.000Z,2023-04-26T00:40:00.000Z,560.8333333333334,23.368055555555557,Yes,No,No,No,No,No,No,No,1,1
1041,INSTALL NEW VALVE,23-35925,P-1603A,P-1603A,,,3-15-23 12:22 PM,2023-03-15T12:22:00.000Z,4-23-23 8:26 AM,2023-04-23T08:26:00.000Z,4-25-23 9:21 AM,2023-04-25T09:21:00.000Z,4,4,,SD,CLOSE,Y,,NO,CHATHAM,,,,,,,,,,,,,,,,39,2023-04-02T16:50:00.000Z,2023-04-26T00:40:00.000Z,560.8333333333334,23.368055555555557,Yes,No,No,No,No,No,No,No,1,1
1041,RE-INSTALL INSUALTION,23-35926,P-1603A,P-1603A,,,3-15-23 12:22 PM,2023-03-15T12:22:00.000Z,4-23-23 8:26 AM,2023-04-23T08:26:00.000Z,4-25-23 9:21 AM,2023-04-25T09:21:00.000Z,4,4,,SD,CLOSE,Y,,NO,CHATHAM,,,,,,,,,,,,,,,,39,2023-04-02T16:50:00.000Z,2023-04-26T00:40:00.000Z,560.8333333333334,23.368055555555557,Yes,No,No,No,No,No,No,No,1,1
,Remove fence section to allow scaffold,23-35969,BL-1829,BL-1829,,,3-17-23 10:33 AM,2023-03-17T10:33:00.000Z,3-1-23 12:00 AM,2023-03-01T00:00:00.000Z,4-12-23 3:36 PM,2023-04-12T15:36:00.000Z,4,4,,PM,CLOSE,Y,,NO,CHATHAM,"10034, 2868","BLOWER, HOWDEN, FAN MODEL E40S-8700 SWSI CCW TAU Arrg't7, 600HP / 1200RPM / TEFC / 575V/3PH/60HZ / 5810B FRAME",,Yes,DRYER A,CH-DRYER_A,CH-DRYER_A:SY18153B.OUT,SY-18153B,SY,OUT,Controller output / demand (CO),Speed output (VFD demand),Output/Demand,BL1829 CURRENT INDICATION,BL-1829,39,2023-04-02T16:50:00.000Z,2023-04-26T00:40:00.000Z,560.8333333333334,23.368055555555557,Yes,No,No,No,No,No,No,No,1,1
,Open 2 manway doors and open drains,23-35971,BL-1829,BL-1829,,,3-17-23 10:34 AM,2023-03-17T10:34:00.000Z,3-1-23 12:00 AM,2023-03-01T00:00:00.000Z,4-12-23 3:36 PM,2023-04-12T15:36:00.000Z,4,4,,PM,CLOSE,Y,,NO,CHATHAM,"10034, 2868","BLOWER, HOWDEN, FAN MODEL E40S-8700 SWSI CCW TAU Arrg't7, 600HP / 1200RPM / TEFC / 575V/3PH/60HZ / 5810B FRAME",,Yes,DRYER A,CH-DRYER_A,CH-DRYER_A:SY18153B.OUT,SY-18153B,SY,OUT,Controller output / demand (CO),Speed output (VFD demand),Output/Demand,BL1829 CURRENT INDICATION,BL-1829,39,2023-04-02T16:50:00.000Z,2023-04-26T00:40:00.000Z,560.8333333333334,23.368055555555557,Yes,No,No,No,No,No,No,No,1,1
,Build Scaffold required to access East door,23-35970,BL-1829,BL-1829,,,3-17-23 10:34 AM,2023-03-17T10:34:00.000Z,3-1-23 12:00 AM,2023-03-01T00:00:00.000Z,4-12-23 3:36 PM,2023-04-12T15:36:00.000Z,4,4,,PM,CLOSE,Y,,NO,CHATHAM,"10034, 2868","BLOWER, HOWDEN, FAN MODEL E40S-8700 SWSI CCW TAU Arrg't7, 600HP / 1200RPM / TEFC / 575V/3PH/60HZ / 5810B FRAME",,Yes,DRYER A,CH-DRYER_A,CH-DRYER_A:SY18153B.OUT,SY-18153B,SY,OUT,Controller output / demand (CO),Speed output (VFD demand),Output/Demand,BL1829 CURRENT INDICATION,BL-1829,39,2023-04-02T16:50:00.000Z,2023-04-26T00:40:00.000Z,560.8333333333334,23.368055555555557,Yes,No,No,No,No,No,No,No,1,1
,HPW blades,23-35972,BL-1829,BL-1829,,,3-17-23 10:34 AM,2023-03-17T10:34:00.000Z,3-1-23 12:00 AM,2023-03-01T00:00:00.000Z,4-12-23 3:36 PM,2023-04-12T15:36:00.000Z,4,4,,PM,CLOSE,Y,,NO,CHATHAM,"10034, 2868","BLOWER, HOWDEN, FAN MODEL E40S-8700 SWSI CCW TAU Arrg't7, 600HP / 1200RPM / TEFC / 575V/3PH/60HZ / 5810B FRAME",,Yes,DRYER A,CH-DRYER_A,CH-DRYER_A:SY18153B.OUT,SY-18153B,SY,OUT,Controller output / demand (CO),Speed output (VFD demand),Output/Demand,BL1829 CURRENT INDICATION,BL-1829,39,2023-04-02T16:50:00.000Z,2023-04-26T00:40:00.000Z,560.8333333333334,23.368055555555557,Yes,No,No,No,No,No,No,No,1,1
,Replace fence,23-35975,BL-1829,BL-1829,,,3-17-23 10:35 AM,2023-03-17T10:35:00.000Z,3-1-23 12:00 AM,2023-03-01T00:00:00.000Z,4-12-23 3:36 PM,2023-04-12T15:36:00.000Z,4,4,,PM,CLOSE,Y,,NO,CHATHAM,"10034, 2868","BLOWER, HOWDEN, FAN MODEL E40S-8700 SWSI CCW TAU Arrg't7, 600HP / 1200RPM / TEFC / 575V/3PH/60HZ / 5810B FRAME",,Yes,DRYER A,CH-DRYER_A,CH-DRYER_A:SY18153B.OUT,SY-18153B,SY,OUT,Controller output / demand (CO),Speed output (VFD demand),Output/Demand,BL1829 CURRENT INDICATION,BL-1829,39,2023-04-02T16:50:00.000Z,2023-04-26T00:40:00.000Z,560.8333333333334,23.368055555555557,Yes,No,No,No,No,No,No,No,1,1
,Close drain and manways,23-35973,BL-1829,BL-1829,,,3-17-23 10:35 AM,2023-03-17T10:35:00.000Z,3-1-23 12:00 AM,2023-03-01T00:00:00.000Z,4-12-23 3:36 PM,2023-04-12T15:36:00.000Z,4,4,,PM,CLOSE,Y,,NO,CHATHAM,"10034, 2868","BLOWER, HOWDEN, FAN MODEL E40S-8700 SWSI CCW TAU Arrg't7, 600HP / 1200RPM / TEFC / 575V/3PH/60HZ / 5810B FRAME",,Yes,DRYER A,CH-DRYER_A,CH-DRYER_A:SY18153B.OUT,SY-18153B,SY,OUT,Controller output / demand (CO),Speed output (VFD demand),Output/Demand,BL1829 CURRENT INDICATION,BL-1829,39,2023-04-02T16:50:00.000Z,2023-04-26T00:40:00.000Z,560.8333333333334,23.368055555555557,Yes,No,No,No,No,No,No,No,1,1
,Remove Scaffold,23-35974,BL-1829,BL-1829,,,3-17-23 10:35 AM,2023-03-17T10:35:00.000Z,3-1-23 12:00 AM,2023-03-01T00:00:00.000Z,4-12-23 3:36 PM,2023-04-12T15:36:00.000Z,4,4,,PM,CLOSE,Y,,NO,CHATHAM,"10034, 2868","BLOWER, HOWDEN, FAN MODEL E40S-8700 SWSI CCW TAU Arrg't7, 600HP / 1200RPM / TEFC / 575V/3PH/60HZ / 5810B FRAME",,Yes,DRYER A,CH-DRYER_A,CH-DRYER_A:SY18153B.OUT,SY-18153B,SY,OUT,Controller output / demand (CO),Speed output (VFD demand),Output/Demand,BL1829 CURRENT INDICATION,BL-1829,39,2023-04-02T16:50:00.000Z,2023-04-26T00:40:00.000Z,560.8333333333334,23.368055555555557,Yes,No,No,No,No,No,No,No,1,1
,SAFETY SHOWER FLUSH & CHECK - PM SERVICE,23-36036,CHATHAM,CHATHAM,,,3-20-23 1:47 AM,2023-03-20T01:47:00.000Z,4-17-23 1:30 AM,2023-04-17T01:30:00.000Z,4-12-23 6:27 PM,2023-04-12T18:27:00.000Z,4,4,,PM,CLOSE,Y,N,NO,CHATHAM,,,,,,,,,,,,,,,,39,2023-04-02T16:50:00.000Z,2023-04-26T00:40:00.000Z,560.8333333333334,23.368055555555557,Yes,No,No,No,No,No,No,No,1,1
,SAFETY SHOWER WEEKLY FLUSH,23-36037,CHATHAM,CHATHAM,,,3-20-23 1:47 AM,2023-03-20T01:47:00.000Z,4-17-23 1:30 AM,2023-04-17T01:30:00.000Z,4-12-23 6:27 PM,2023-04-12T18:27:00.000Z,4,4,,PM,CLOSE,Y,,NO,CHATHAM,,,,,,,,,,,,,,,,39,2023-04-02T16:50:00.000Z,2023-04-26T00:40:00.000Z,560.8333333333334,23.368055555555557,Yes,No,No,No,No,No,No,No,1,1
1450,INSPECTION OF EXPLOSION PANEL (TOP)  PM,23-36060,CY-1823,CY-1823,,,3-20-23 1:48 AM,2023-03-20T01:48:00.000Z,4-13-23 1:00 AM,2023-04-13T01:00:00.000Z,4-14-23 3:07 PM,2023-04-14T15:07:00.000Z,4,4,,PM,CLOSE,Y,N,NO,CHATHAM,1450,"\"CYCLONE ASSEMBLY, FEDCO MFG, 12'-0\"\" DIA\"",,No,DRYER A,,,,,,,,,,,39,2023-04-02T16:50:00.000Z,2023-04-26T00:40:00.000Z,560.8333333333334,23.368055555555557,Yes,No,No,No,No,No,No,No,1,1
1450,VISUAL INSPECTION OF EXPLOSION PANEL,23-36061,CY-1823,CY-1823,,,3-20-23 1:48 AM,2023-03-20T01:48:00.000Z,4-13-23 1:00 AM,2023-04-13T01:00:00.000Z,4-14-23 3:07 PM,2023-04-14T15:07:00.000Z,4,4,,PM,CLOSE,Y,,NO,CHATHAM,1450,"\"CYCLONE ASSEMBLY, FEDCO MFG, 12'-0\"\" DIA\"",,No,DRYER A,,,,,,,,,,,39,2023-04-02T16:50:00.000Z,2023-04-26T00:40:00.000Z,560.8333333333334,23.368055555555557,Yes,No,No,No,No,No,No,No,1,1
1450,REPLACEMENT OF PANEL (AS NEEDED),23-36062,CY-1823,CY-1823,,,3-20-23 1:48 AM,2023-03-20T01:48:00.000Z,4-13-23 12:00 AM,2023-04-13T00:00:00.000Z,4-14-23 3:07 PM,2023-04-14T15:07:00.000Z,4,4,,PM,CLOSE,Y,,NO,CHATHAM,1450,"\"CYCLONE ASSEMBLY, FEDCO MFG, 12'-0\"\" DIA\"",,No,DRYER A,,,,,,,,,,,39,2023-04-02T16:50:00.000Z,2023-04-26T00:40:00.000Z,560.8333333333334,23.368055555555557,Yes,No,No,No,No,No,No,No,1,1
,5S AND STOCKROOM AUDIT-WEEKLY PM,23-36085,MAINTENANCE,MAINTENANCE,,,3-20-23 1:48 AM,2023-03-20T01:48:00.000Z,4-17-23 12:00 AM,2023-04-17T00:00:00.000Z,4-12-23 6:27 PM,2023-04-12T18:27:00.000Z,4,4,,PM,CLOSE,Y,N,NO,CHATHAM,,,,,,,,,,,,,,,,39,2023-04-02T16:50:00.000Z,2023-04-26T00:40:00.000Z,560.8333333333334,23.368055555555557,Yes,No,No,No,No,No,No,No,1,1
,Grade all gravel areas on site to remove potholes from winter frost,23-36267,CHATHAM,CHATHAM,,,3-20-23 9:27 AM,2023-03-20T09:27:00.000Z,4-30-23 4:10 PM,2023-04-30T16:10:00.000Z,4-12-23 6:26 PM,2023-04-12T18:26:00.000Z,4,4,,CO,CLOSE,Y,,NO,CHATHAM,,,,,,,,,,,,,,,,39,2023-04-02T16:50:00.000Z,2023-04-26T00:40:00.000Z,560.8333333333334,23.368055555555557,Yes,No,No,No,No,No,No,No,1,1
,Kit/Stage blanks as per blank list from OPs,23-36268,CHATHAM,CHATHAM,,,3-20-23 9:29 AM,2023-03-20T09:29:00.000Z,4-10-23 1:15 PM,2023-04-10T13:15:00.000Z,4-12-23 6:26 PM,2023-04-12T18:26:00.000Z,4,4,,CO,CLOSE,Y,,NO,CHATHAM,,,,,,,,,,,,,,,,39,2023-04-02T16:50:00.000Z,2023-04-26T00:40:00.000Z,560.8333333333334,23.368055555555557,Yes,No,No,No,No,No,No,No,1,1
,Shutdown planning assistance,23-36306,0000,0000,,,3-22-23 6:49 AM,2023-03-22T06:49:00.000Z,3-26-23 6:49 AM,2023-03-26T06:49:00.000Z,4-6-23 7:20 AM,2023-04-06T07:20:00.000Z,4,4,,CO,CLOSE,Y,,NO,CHATHAM,,,,,,,,,,,,,,,,39,2023-04-02T16:50:00.000Z,2023-04-26T00:40:00.000Z,560.8333333333334,23.368055555555557,Yes,No,No,No,No,No,No,No,1,1
1363,No Working Lights on RC2 Column,23-36322,C-1571,C-1571,,,3-22-23 10:28 AM,2023-03-22T10:28:00.000Z,4-2-23 1:56 AM,2023-04-02T01:56:00.000Z,4-3-23 9:57 AM,2023-04-03T09:57:00.000Z,2,2,,CO,CLOSE,Y,,NO,CHATHAM,,,,,,,,,,,,,,,,39,2023-04-02T16:50:00.000Z,2023-04-26T00:40:00.000Z,560.8333333333334,23.368055555555557,Yes,No,No,No,No,No,No,No,1,1
5469,Lighting At the stillage tanks,23-36332,TK-1602,TK-1602,,,3-22-23 11:35 AM,2023-03-22T11:35:00.000Z,4-22-23 2:17 AM,2023-04-22T02:17:00.000Z,4-4-23 9:17 AM,2023-04-04T09:17:00.000Z,4,4,,CO,CLOSE,Y,,NO,CHATHAM,,,,,,,,,,,,,,,,39,2023-04-02T16:50:00.000Z,2023-04-26T00:40:00.000Z,560.8333333333334,23.368055555555557,Yes,No,No,No,No,No,No,No,1,1
6387,Water Softener B Flowmeter Leaking Please Investigate and Correct,23-36338,WS-3501B,WS-3501B,,,3-23-23 8:06 AM,2023-03-23T08:06:00.000Z,4-2-23 11:57 PM,2023-04-02T23:57:00.000Z,4-4-23 12:28 AM,2023-04-04T00:28:00.000Z,4,4,,CO,CLOSE,Y,,NO,CHATHAM,,,,,,,,,,,,,,,,39,2023-04-02T16:50:00.000Z,2023-04-26T00:40:00.000Z,560.8333333333334,23.368055555555557,Yes,No,No,No,No,No,No,No,1,1
1286,Mill C hand operation of equipment,23-36365,BL-1202,BL-1202,,,3-23-23 2:19 PM,2023-03-23T14:19:00.000Z,4-2-23 2:19 PM,2023-04-02T14:19:00.000Z,4-3-23 3:19 PM,2023-04-03T15:19:00.000Z,4,4,,CO,CLOSE,Y,,NO,CHATHAM,,,,,,,,,,,,,,,,39,2023-04-02T16:50:00.000Z,2023-04-26T00:40:00.000Z,560.8333333333334,23.368055555555557,Yes,No,No,No,No,No,No,No,1,1
,Install spinners on Tanks for shutdown,23-36398,0000,0000,,,3-24-23 10:19 AM,2023-03-24T10:19:00.000Z,4-2-23 10:19 AM,2023-04-02T10:19:00.000Z,4-6-23 1:19 PM,2023-04-06T13:19:00.000Z,4,4,,CO,CLOSE,Y,,NO,CHATHAM,,,,,,,,,,,,,,,,39,2023-04-02T16:50:00.000Z,2023-04-26T00:40:00.000Z,560.8333333333334,23.368055555555557,Yes,No,No,No,No,No,No,No,1,1
,1800 - PREPARE ACCESS COVERS - DR01,23-36544,1800,1800,,,3-27-23 1:47 AM,2023-03-27T01:47:00.000Z,7-23-23 2:00 AM,2023-07-23T02:00:00.000Z,4-12-23 6:22 PM,2023-04-12T18:22:00.000Z,4,4,,SD,CLOSE,Y,N,NO,CHATHAM,,,,,,,,,,,,,,,,39,2023-04-02T16:50:00.000Z,2023-04-26T00:40:00.000Z,560.8333333333334,23.368055555555557,Yes,No,No,No,No,No,No,No,1,1
1456,DC-1802 - INSPECT & TEST DUST COLLECTOR VALVES DR05,23-36537,DC-1802,DC-1802,,,3-27-23 1:47 AM,2023-03-27T01:47:00.000Z,7-23-23 1:00 AM,2023-07-23T01:00:00.000Z,4-12-23 6:23 PM,2023-04-12T18:23:00.000Z,4,4,,SD,CLOSE,Y,N,NO,CHATHAM,1456,DDGS COOLING BAG HOUSE DUST COLLECTOR,,No,DDG,,,,,,,,,,,39,2023-04-02T16:50:00.000Z,2023-04-26T00:40:00.000Z,560.8333333333334,23.368055555555557,Yes,No,No,No,No,No,No,No,1,1
,REPLACE GASKETS,23-36546,1800,1800,,,3-27-23 1:47 AM,2023-03-27T01:47:00.000Z,7-23-23 3:00 AM,2023-07-23T03:00:00.000Z,4-12-23 6:22 PM,2023-04-12T18:22:00.000Z,4,4,,SD,CLOSE,Y,,NO,CHATHAM,,,,,,,,,,,,,,,,39,2023-04-02T16:50:00.000Z,2023-04-26T00:40:00.000Z,560.8333333333334,23.368055555555557,Yes,No,No,No,No,No,No,No,1,1
,GATHER ALL ACCESS DOORS,23-36545,1800,1800,,,3-27-23 1:47 AM,2023-03-27T01:47:00.000Z,7-23-23 1:00 AM,2023-07-23T01:00:00.000Z,4-12-23 6:22 PM,2023-04-12T18:22:00.000Z,4,4,,SD,CLOSE,Y,,NO,CHATHAM,,,,,,,,,,,,,,,,39,2023-04-02T16:50:00.000Z,2023-04-26T00:40:00.000Z,560.8333333333334,23.368055555555557,Yes,No,No,No,No,No,No,No,1,1
,RETURN DOORS TO DRYER AREA,23-36547,1800,1800,,,3-27-23 1:47 AM,2023-03-27T01:47:00.000Z,7-23-23 12:30 AM,2023-07-23T00:30:00.000Z,4-12-23 6:22 PM,2023-04-12T18:22:00.000Z,4,4,,SD,CLOSE,Y,,NO,CHATHAM,,,,,,,,,,,,,,,,39,2023-04-02T16:50:00.000Z,2023-04-26T00:40:00.000Z,560.8333333333334,23.368055555555557,Yes,No,No,No,No,No,No,No,1,1
1456,INSPECT DUST COLLECTOR SOLENOID VALVES,23-36538,DC-1802,DC-1802,,,3-27-23 1:47 AM,2023-03-27T01:47:00.000Z,7-23-23 1:00 AM,2023-07-23T01:00:00.000Z,4-12-23 6:23 PM,2023-04-12T18:23:00.000Z,4,4,,SD,CLOSE,Y,,NO,CHATHAM,1456,DDGS COOLING BAG HOUSE DUST COLLECTOR,,No,DDG,,,,,,,,,,,39,2023-04-02T16:50:00.000Z,2023-04-26T00:40:00.000Z,560.8333333333334,23.368055555555557,Yes,No,No,No,No,No,No,No,1,1
1456,"INSPECT SOLENOID CONNECTOR FLEX HOSE, CHANGE AS REQUIRED",23-36539,DC-1802,DC-1802,,,3-27-23 1:47 AM,2023-03-27T01:47:00.000Z,7-23-23 12:00 AM,2023-07-23T00:00:00.000Z,4-12-23 6:23 PM,2023-04-12T18:23:00.000Z,4,4,,SD,CLOSE,Y,,NO,CHATHAM,1456,DDGS COOLING BAG HOUSE DUST COLLECTOR,,No,DDG,,,,,,,,,,,39,2023-04-02T16:50:00.000Z,2023-04-26T00:40:00.000Z,560.8333333333334,23.368055555555557,Yes,No,No,No,No,No,No,No,1,1
,REMOVE TUNNEL THERMOWELLS ON BOTH DRYERS,23-36559,1800,1800,,,3-27-23 1:48 AM,2023-03-27T01:48:00.000Z,7-23-23 1:00 AM,2023-07-23T01:00:00.000Z,4-12-23 6:22 PM,2023-04-12T18:22:00.000Z,4,4,,SD,CLOSE,Y,,NO,CHATHAM,,,,,,,,,,,,,,,,39,2023-04-02T16:50:00.000Z,2023-04-26T00:40:00.000Z,560.8333333333334,23.368055555555557,Yes,No,No,No,No,No,No,No,1,1
,REMOVE TUNNEL THERMOWELLS FOR SAFETY - DR02,23-36558,1800,1800,,,3-27-23 1:48 AM,2023-03-27T01:48:00.000Z,7-23-23 1:00 AM,2023-07-23T01:00:00.000Z,4-12-23 6:22 PM,2023-04-12T18:22:00.000Z,4,4,,SD,CLOSE,Y,N,NO,CHATHAM,,,,,,,,,,,,,,,,39,2023-04-02T16:50:00.000Z,2023-04-26T00:40:00.000Z,560.8333333333334,23.368055555555557,Yes,No,No,No,No,No,No,No,1,1
,C-MI-1201B - MECHANICAL PM,23-36588,MI-1201B,MI-1201B,,,3-27-23 1:49 AM,2023-03-27T01:49:00.000Z,4-24-23 12:00 AM,2023-04-24T00:00:00.000Z,4-12-23 6:20 PM,2023-04-12T18:20:00.000Z,4,4,,PM,CLOSE,Y,,NO,CHATHAM,,,,,,,,,,,,,,,,39,2023-04-02T16:50:00.000Z,2023-04-26T00:40:00.000Z,560.8333333333334,23.368055555555557,Yes,No,No,No,No,No,No,No,1,1
,5S AND STOCKROOM AUDIT-WEEKLY PM,23-36594,MAINTENANCE,MAINTENANCE,,,3-27-23 1:49 AM,2023-03-27T01:49:00.000Z,4-24-23 12:00 AM,2023-04-24T00:00:00.000Z,4-12-23 6:19 PM,2023-04-12T18:19:00.000Z,4,4,,PM,CLOSE,Y,N,NO,CHATHAM,,,,,,,,,,,,,,,,39,2023-04-02T16:50:00.000Z,2023-04-26T00:40:00.000Z,560.8333333333334,23.368055555555557,Yes,No,No,No,No,No,No,No,1,1
,Weekly Vibration check (GFE I/E),23-36589,MI-1201B,MI-1201B,,,3-27-23 1:49 AM,2023-03-27T01:49:00.000Z,4-24-23 12:00 AM,2023-04-24T00:00:00.000Z,4-12-23 6:20 PM,2023-04-12T18:20:00.000Z,4,4,,PM,CLOSE,Y,,NO,CHATHAM,,,,,,,,,,,,,,,,39,2023-04-02T16:50:00.000Z,2023-04-26T00:40:00.000Z,560.8333333333334,23.368055555555557,Yes,No,No,No,No,No,No,No,1,1
,C-1803D pH Meter-Weekly PM,23-36619,AT-84505,AT-84505,,,3-27-23 1:49 AM,2023-03-27T01:49:00.000Z,5-21-23 12:00 AM,2023-05-21T00:00:00.000Z,4-17-23 12:30 AM,2023-04-17T00:30:00.000Z,4,4,,PM,CLOSE,Y,N,NO,CHATHAM,,,,,,,,,,,,,,,,39,2023-04-02T16:50:00.000Z,2023-04-26T00:40:00.000Z,560.8333333333334,23.368055555555557,Yes,No,No,No,No,No,No,No,1,1
1230,PH PROBE CLEANING AND CALIBRATION PM,23-36585,AT-14125,AT-14125,,,3-27-23 1:49 AM,2023-03-27T01:49:00.000Z,5-21-23 12:00 AM,2023-05-21T00:00:00.000Z,4-17-23 12:30 AM,2023-04-17T00:30:00.000Z,4,4,,PM,CLOSE,Y,N,NO,CHATHAM,,,,,,,,,,,,,,,,39,2023-04-02T16:50:00.000Z,2023-04-26T00:40:00.000Z,560.8333333333334,23.368055555555557,Yes,No,No,No,No,No,No,No,1,1
,MI-1201B - MECHANICAL PM,23-36587,MI-1201B,MI-1201B,,,3-27-23 1:49 AM,2023-03-27T01:49:00.000Z,4-24-23 12:30 AM,2023-04-24T00:30:00.000Z,4-12-23 6:20 PM,2023-04-12T18:20:00.000Z,4,4,,PM,CLOSE,Y,N,NO,CHATHAM,,,,,,,,,,,,,,,,39,2023-04-02T16:50:00.000Z,2023-04-26T00:40:00.000Z,560.8333333333334,23.368055555555557,Yes,No,No,No,No,No,No,No,1,1
,MI-1201A - MECHANICAL PM,23-36590,MI-1201A,MI-1201A,,,3-27-23 1:49 AM,2023-03-27T01:49:00.000Z,4-20-23 12:30 AM,2023-04-20T00:30:00.000Z,4-12-23 6:20 PM,2023-04-12T18:20:00.000Z,4,4,,PM,CLOSE,Y,N,NO,CHATHAM,,,,,,,,,,,,,,,,39,2023-04-02T16:50:00.000Z,2023-04-26T00:40:00.000Z,560.8333333333334,23.368055555555557,Yes,No,No,No,No,No,No,No,1,1
,HAMMERMILL WEEKLY PM & ROTATION CHANGE,23-36591,MI-1201A,MI-1201A,,,3-27-23 1:49 AM,2023-03-27T01:49:00.000Z,4-20-23 12:00 AM,2023-04-20T00:00:00.000Z,4-12-23 6:20 PM,2023-04-12T18:20:00.000Z,4,4,,PM,CLOSE,Y,,NO,CHATHAM,,,,,,,,,,,,,,,,39,2023-04-02T16:50:00.000Z,2023-04-26T00:40:00.000Z,560.8333333333334,23.368055555555557,Yes,No,No,No,No,No,No,No,1,1
,Weekly Vibration check (GFE I/E),23-36592,MI-1201A,MI-1201A,,,3-27-23 1:49 AM,2023-03-27T01:49:00.000Z,4-20-23 12:00 AM,2023-04-20T00:00:00.000Z,4-12-23 6:20 PM,2023-04-12T18:20:00.000Z,4,4,,PM,CLOSE,Y,,NO,CHATHAM,,,,,,,,,,,,,,,,39,2023-04-02T16:50:00.000Z,2023-04-26T00:40:00.000Z,560.8333333333334,23.368055555555557,Yes,No,No,No,No,No,No,No,1,1
,2 Honda pumps not running properly,23-36744,MOBILEEQUIP,MOBILEEQUIP,,,3-27-23 7:36 AM,2023-03-27T07:36:00.000Z,4-8-23 4:59 PM,2023-04-08T16:59:00.000Z,4-3-23 6:31 PM,2023-04-03T18:31:00.000Z,4,4,,CO,CLOSE,Y,,NO,CHATHAM,,,,,,,,,,,,,,,,39,2023-04-02T16:50:00.000Z,2023-04-26T00:40:00.000Z,560.8333333333334,23.368055555555557,Yes,No,No,No,No,No,No,No,1,1
,Place tie off blocks in locations- as per Tyler,23-36749,MAINTENANCE,MAINTENANCE,,,3-27-23 10:50 AM,2023-03-27T10:50:00.000Z,4-8-23 10:44 AM,2023-04-08T10:44:00.000Z,4-12-23 6:19 PM,2023-04-12T18:19:00.000Z,4,4,,CO,CLOSE,Y,,NO,CHATHAM,,,,,,,,,,,,,,,,39,2023-04-02T16:50:00.000Z,2023-04-26T00:40:00.000Z,560.8333333333334,23.368055555555557,Yes,No,No,No,No,No,No,No,1,1
,Swap out Non DE Bearing in BL-1829,23-36752,BL-1829,BL-1829,,,3-27-23 12:56 PM,2023-03-27T12:56:00.000Z,4-30-23 11:10 AM,2023-04-30T11:10:00.000Z,4-12-23 3:45 PM,2023-04-12T15:45:00.000Z,4,4,,SD,CLOSE,Y,,NO,CHATHAM,"10034, 2868","BLOWER, HOWDEN, FAN MODEL E40S-8700 SWSI CCW TAU Arrg't7, 600HP / 1200RPM / TEFC / 575V/3PH/60HZ / 5810B FRAME",,Yes,DRYER A,CH-DRYER_A,CH-DRYER_A:SY18153B.OUT,SY-18153B,SY,OUT,Controller output / demand (CO),Speed output (VFD demand),Output/Demand,BL1829 CURRENT INDICATION,BL-1829,39,2023-04-02T16:50:00.000Z,2023-04-26T00:40:00.000Z,560.8333333333334,23.368055555555557,Yes,No,No,No,No,No,No,No,1,1
,Anhydrous rail loading accuload error,23-36757,0000,0000,,,3-28-23 7:37 AM,2023-03-28T07:37:00.000Z,4-9-23 8:56 PM,2023-04-09T20:56:00.000Z,4-3-23 9:56 PM,2023-04-03T21:56:00.000Z,4,4,,CO,CLOSE,Y,,NO,CHATHAM,,,,,,,,,,,,,,,,39,2023-04-02T16:50:00.000Z,2023-04-26T00:40:00.000Z,560.8333333333334,23.368055555555557,Yes,No,No,No,No,No,No,No,1,1
,SD2023 Connect power to break trailers,23-36781,CHATHAM,CHATHAM,,,3-28-23 3:17 PM,2023-03-28T15:17:00.000Z,4-9-23 11:23 AM,2023-04-09T11:23:00.000Z,4-3-23 11:35 AM,2023-04-03T11:35:00.000Z,4,4,,CO,CLOSE,Y,,NO,CHATHAM,,,,,,,,,,,,,,,,39,2023-04-02T16:50:00.000Z,2023-04-26T00:40:00.000Z,560.8333333333334,23.368055555555557,Yes,No,No,No,No,No,No,No,1,1
,Gravel placed in multiple areas,23-36790,0000,0000,,,3-29-23 9:37 AM,2023-03-29T09:37:00.000Z,5-31-23 8:32 AM,2023-05-31T08:32:00.000Z,4-12-23 6:18 PM,2023-04-12T18:18:00.000Z,4,4,,CO,CLOSE,Y,,NO,CHATHAM,,,,,,,,,,,,,,,,39,2023-04-02T16:50:00.000Z,2023-04-26T00:40:00.000Z,560.8333333333334,23.368055555555557,Yes,No,No,No,No,No,No,No,1,1
,Shutdown planning assistance #2,23-36832,,,,,3-31-23 9:29 AM,2023-03-31T09:29:00.000Z,4-12-23 9:29 AM,2023-04-12T09:29:00.000Z,4-5-23 10:29 AM,2023-04-05T10:29:00.000Z,4,4,,CO,CLOSE,Y,,NO,CHATHAM,,,,,,,,,,,,,,,,39,2023-04-02T16:50:00.000Z,2023-04-26T00:40:00.000Z,560.8333333333334,23.368055555555557,Yes,No,No,No,No,No,No,No,1,1
,Commissioning of NGS flow meter,23-36836,,,,,3-31-23 9:47 AM,2023-03-31T09:47:00.000Z,4-7-23 9:47 AM,2023-04-07T09:47:00.000Z,4-5-23 5:47 PM,2023-04-05T17:47:00.000Z,4,4,,CO,CLOSE,Y,,NO,CHATHAM,,,,,,,,,,,,,,,,39,2023-04-02T16:50:00.000Z,2023-04-26T00:40:00.000Z,560.8333333333334,23.368055555555557,Yes,No,No,No,No,No,No,No,1,1
3379,DCS upgrades/commisioning,23-36851,MCC-3804,MCC-3804,,,3-31-23 10:55 AM,2023-03-31T10:55:00.000Z,4-9-23 10:55 AM,2023-04-09T10:55:00.000Z,4-5-23 2:55 PM,2023-04-05T14:55:00.000Z,4,4,,CO,CLOSE,Y,,NO,CHATHAM,,,,,,,,,,,,,,,,39,2023-04-02T16:50:00.000Z,2023-04-26T00:40:00.000Z,560.8333333333334,23.368055555555557,Yes,No,No,No,No,No,No,No,1,1
,Generator cable prep for SD,23-36852,0000,0000,,,3-31-23 11:04 AM,2023-03-31T11:04:00.000Z,4-9-23 11:04 AM,2023-04-09T11:04:00.000Z,4-3-23 7:04 PM,2023-04-03T19:04:00.000Z,4,4,,CO,CLOSE,Y,,NO,CHATHAM,,,,,,,,,,,,,,,,39,2023-04-02T16:50:00.000Z,2023-04-26T00:40:00.000Z,560.8333333333334,23.368055555555557,Yes,No,No,No,No,No,No,No,1,1
2402,Clean conductivity probe for RO unit 1,23-36853,FY-35205,FY-35205,,,3-31-23 11:09 AM,2023-03-31T11:09:00.000Z,4-1-23 11:13 AM,2023-04-01T11:13:00.000Z,4-4-23 12:33 PM,2023-04-04T12:33:00.000Z,2,2,,CO,CLOSE,Y,,NO,CHATHAM,,,,,,,,,,,,,,,,39,2023-04-02T16:50:00.000Z,2023-04-26T00:40:00.000Z,560.8333333333334,23.368055555555557,Yes,No,No,No,No,No,No,No,1,1
3845,Repair heat trace around P-6610,23-36854,P-6610,P-6610,,,3-31-23 11:15 AM,2023-03-31T11:15:00.000Z,4-9-23 11:15 AM,2023-04-09T11:15:00.000Z,4-4-23 2:15 PM,2023-04-04T14:15:00.000Z,4,4,,CO,CLOSE,Y,,NO,CHATHAM,,,,,,,,,,,,,,,,39,2023-04-02T16:50:00.000Z,2023-04-26T00:40:00.000Z,560.8333333333334,23.368055555555557,Yes,No,No,No,No,No,No,No,1,1
,Troubleshoot heat trace circuits in corn oil area,23-36855,1660,1660,,,3-31-23 11:17 AM,2023-03-31T11:17:00.000Z,4-9-23 11:17 AM,2023-04-09T11:17:00.000Z,4-4-23 2:17 PM,2023-04-04T14:17:00.000Z,4,4,,CO,CLOSE,Y,,NO,CHATHAM,,,,,,,,,,,,,,,,39,2023-04-02T16:50:00.000Z,2023-04-26T00:40:00.000Z,560.8333333333334,23.368055555555557,Yes,No,No,No,No,No,No,No,1,1
1281,Assemble belt/buckets ready for SD,23-36856,BE-2109,BE-2109,,,3-31-23 11:57 AM,2023-03-31T11:57:00.000Z,4-10-23 11:25 AM,2023-04-10T11:25:00.000Z,4-12-23 6:17 PM,2023-04-12T18:17:00.000Z,4,4,,PM,CLOSE,Y,,NO,CHATHAM,,,,,,,,,,,,,,,,39,2023-04-02T16:50:00.000Z,2023-04-26T00:40:00.000Z,560.8333333333334,23.368055555555557,Yes,No,No,No,No,No,No,No,1,1
1314,"\"Viraj or Other DCS Expert\"  DCS screen in Main Operations Control Room is not working.",23-36857,BU-ADMIN,BU-ADMIN,,VIRAJ.PATEL,3-31-23 1:10 PM,2023-03-31T13:10:00.000Z,4-10-23 10:17 AM,2023-04-10T10:17:00.000Z,4-13-23 8:11 AM,2023-04-13T08:11:00.000Z,2,2,,EC,CLOSE,Y,,NO,CHATHAM,,,,,,,,,,,,,,,,39,2023-04-02T16:50:00.000Z,2023-04-26T00:40:00.000Z,560.8333333333334,23.368055555555557,Yes,No,No,No,No,No,No,No,1,1
1318,Support piping where FT-23106 excise meter used to be. It is now air gapped,23-36858,BU-CLOSE,BU-CLOSE,,,3-31-23 1:15 PM,2023-03-31T13:15:00.000Z,4-4-23 10:20 AM,2023-04-04T10:20:00.000Z,4-5-23 11:55 AM,2023-04-05T11:55:00.000Z,2,2,,CO,CLOSE,Y,,NO,CHATHAM,,,,,,,,,,,,,,,,39,2023-04-02T16:50:00.000Z,2023-04-26T00:40:00.000Z,560.8333333333334,23.368055555555557,Yes,No,No,No,No,No,No,No,1,1
,Clear out skids and totes at SD gate,23-36859,MAINTENANCE,MAINTENANCE,,,3-31-23 1:22 PM,2023-03-31T13:22:00.000Z,4-8-23 1:13 PM,2023-04-08T13:13:00.000Z,4-12-23 6:17 PM,2023-04-12T18:17:00.000Z,4,4,,CO,CLOSE,Y,,NO,CHATHAM,,,,,,,,,,,,,,,,39,2023-04-02T16:50:00.000Z,2023-04-26T00:40:00.000Z,560.8333333333334,23.368055555555557,Yes,No,No,No,No,No,No,No,1,1
,SAFETY SHOWER FLUSH & CHECK - PM SERVICE,23-36888,CHATHAM,CHATHAM,,,4-3-23 1:45 AM,2023-04-03T01:45:00.000Z,5-1-23 1:30 AM,2023-05-01T01:30:00.000Z,4-12-23 6:16 PM,2023-04-12T18:16:00.000Z,4,4,,PM,CLOSE,Y,N,NO,CHATHAM,,,,,,,,,,,,,,,,39,2023-04-02T16:50:00.000Z,2023-04-26T00:40:00.000Z,560.8333333333334,23.368055555555557,Yes,No,No,No,Yes,No,No,No,1,1
,SAFETY SHOWER WEEKLY FLUSH,23-36889,CHATHAM,CHATHAM,,,4-3-23 1:45 AM,2023-04-03T01:45:00.000Z,5-1-23 1:30 AM,2023-05-01T01:30:00.000Z,4-12-23 6:16 PM,2023-04-12T18:16:00.000Z,4,4,,PM,CLOSE,Y,,NO,CHATHAM,,,,,,,,,,,,,,,,39,2023-04-02T16:50:00.000Z,2023-04-26T00:40:00.000Z,560.8333333333334,23.368055555555557,Yes,No,No,No,Yes,No,No,No,1,1
,HAMMERMILL WEEKLY PM & ROTATION CHANGE,23-36936,MI-1201A,MI-1201A,,,4-3-23 1:47 AM,2023-04-03T01:47:00.000Z,4-27-23 12:00 AM,2023-04-27T00:00:00.000Z,4-12-23 6:15 PM,2023-04-12T18:15:00.000Z,4,4,,PM,CLOSE,Y,,NO,CHATHAM,,,,,,,,,,,,,,,,39,2023-04-02T16:50:00.000Z,2023-04-26T00:40:00.000Z,560.8333333333334,23.368055555555557,Yes,No,No,No,Yes,No,No,No,1,1
,Weekly Vibration check (GFE I/E),23-36937,MI-1201A,MI-1201A,,,4-3-23 1:47 AM,2023-04-03T01:47:00.000Z,4-27-23 12:00 AM,2023-04-27T00:00:00.000Z,4-12-23 6:15 PM,2023-04-12T18:15:00.000Z,4,4,,PM,CLOSE,Y,,NO,CHATHAM,,,,,,,,,,,,,,,,39,2023-04-02T16:50:00.000Z,2023-04-26T00:40:00.000Z,560.8333333333334,23.368055555555557,Yes,No,No,No,Yes,No,No,No,1,1
,MI-1201A - MECHANICAL PM,23-36935,MI-1201A,MI-1201A,,,4-3-23 1:47 AM,2023-04-03T01:47:00.000Z,4-27-23 12:30 AM,2023-04-27T00:30:00.000Z,4-12-23 6:15 PM,2023-04-12T18:15:00.000Z,4,4,,PM,CLOSE,Y,N,NO,CHATHAM,,,,,,,,,,,,,,,,39,2023-04-02T16:50:00.000Z,2023-04-26T00:40:00.000Z,560.8333333333334,23.368055555555557,Yes,No,No,No,Yes,No,No,No,1,1
,Alcohol Loading Men's Washroom,23-37109,2100-26K-01,2100-26K-01,,,4-3-23 8:10 AM,2023-04-03T08:10:00.000Z,4-3-23 8:30 AM,2023-04-03T08:30:00.000Z,4-4-23 3:43 PM,2023-04-04T15:43:00.000Z,2,2,,RM,CLOSE,Y,,NO,CHATHAM,,,,,,,,,,,,,,,,39,2023-04-02T16:50:00.000Z,2023-04-26T00:40:00.000Z,560.8333333333334,23.368055555555557,Yes,No,No,No,Yes,No,No,No,1,1
,Grease Cooling tower fan motors,23-37111,CT-3201,CT-3201,,,4-3-23 8:29 AM,2023-04-03T08:29:00.000Z,4-3-23 5:30 PM,2023-04-03T17:30:00.000Z,4-3-23 10:02 AM,2023-04-03T10:02:00.000Z,2,2,,CO,CLOSE,Y,,NO,CHATHAM,,,,,,,,,,,,,,,,39,2023-04-02T16:50:00.000Z,2023-04-26T00:40:00.000Z,560.8333333333334,23.368055555555557,Yes,No,No,No,Yes,No,No,No,1,1
1274,Install slide plates for bin cleanout on BE-1201,23-37112,BE-1201,BE-1201,,,4-3-23 8:30 AM,2023-04-03T08:30:00.000Z,4-9-23 8:30 AM,2023-04-09T08:30:00.000Z,4-3-23 10:32 AM,2023-04-03T10:32:00.000Z,4,4,,CO,CLOSE,Y,,NO,CHATHAM,,,,,,,,,,,,,,,,39,2023-04-02T16:50:00.000Z,2023-04-26T00:40:00.000Z,560.8333333333334,23.368055555555557,Yes,No,No,No,Yes,No,No,No,1,1
3396,Trouble Shoot CG2 I/O cards and install power converter upon arrival,23-37140,ME-3602A,ME-3602A,,,4-3-23 12:36 PM,2023-04-03T12:36:00.000Z,4-9-23 5:45 PM,2023-04-09T17:45:00.000Z,4-4-23 1:30 PM,2023-04-04T13:30:00.000Z,2,2,,CO,CLOSE,Y,,NO,CHATHAM,,,,,,,,,,,,,,,,39,2023-04-02T16:50:00.000Z,2023-04-26T00:40:00.000Z,560.8333333333334,23.368055555555557,Yes,No,No,No,Yes,No,No,No,1,1
2044,New FT-32301 is reading erratic,23-37158,FT-32301,FT-32301,,,4-4-23 7:27 AM,2023-04-04T07:27:00.000Z,4-9-23 10:18 PM,2023-04-09T22:18:00.000Z,4-4-23 10:51 PM,2023-04-04T22:51:00.000Z,2,2,,RM,CLOSE,Y,,NO,CHATHAM,,,,,,,,,,,,,,,,39,2023-04-02T16:50:00.000Z,2023-04-26T00:40:00.000Z,560.8333333333334,23.368055555555557,Yes,No,No,No,Yes,No,No,No,1,1
3388,MCC-3819 A/C Unit Failed,23-37177,MCC-3819,MCC-3819,,,4-4-23 11:04 PM,2023-04-04T23:04:00.000Z,4-9-23 10:46 PM,2023-04-09T22:46:00.000Z,4-5-23 12:48 AM,2023-04-05T00:48:00.000Z,1,1,,RM,CLOSE,Y,,NO,CHATHAM,,,,,,,,,,,,,,,,39,2023-04-02T16:50:00.000Z,2023-04-26T00:40:00.000Z,560.8333333333334,23.368055555555557,Yes,No,No,No,Yes,No,No,No,1,1
1323,Turn on Water at grain receiving (turned off for winter months),23-37203,BU-GHR,BU-GHR,,,4-5-23 12:30 PM,2023-04-05T12:30:00.000Z,4-11-23 1:24 PM,2023-04-11T13:24:00.000Z,4-12-23 6:10 PM,2023-04-12T18:10:00.000Z,4,4,,PM,CLOSE,Y,,NO,CHATHAM,,,,,,,,,,,,,,,,39,2023-04-02T16:50:00.000Z,2023-04-26T00:40:00.000Z,560.8333333333334,23.368055555555557,Yes,No,No,No,Yes,No,No,No,1,1
5469,TK1602 Sample port - Camlock fitting for 1 inch hose,23-37208,TK-1602,TK-1602,,,4-5-23 2:47 PM,2023-04-05T14:47:00.000Z,4-7-23 2:27 PM,2023-04-07T14:27:00.000Z,4-6-23 3:55 PM,2023-04-06T15:55:00.000Z,2,2,,CO,CLOSE,Y,,NO,CHATHAM,,,,,,,,,,,,,,,,39,2023-04-02T16:50:00.000Z,2023-04-26T00:40:00.000Z,560.8333333333334,23.368055555555557,Yes,No,No,No,Yes,No,No,No,1,1
5475,Antifoam Trial- camlock fitting and valves control for chemical hose connection,23-37210,TK-1902,TK-1902,,,4-5-23 2:51 PM,2023-04-05T14:51:00.000Z,4-7-23 12:12 PM,2023-04-07T12:12:00.000Z,4-10-23 10:35 AM,2023-04-10T10:35:00.000Z,2,2,,CO,CLOSE,Y,,NO,CHATHAM,,,,,,,,,,,,,,,,39,2023-04-02T16:50:00.000Z,2023-04-26T00:40:00.000Z,560.8333333333334,23.368055555555557,Yes,No,No,No,Yes,No,No,No,1,1
2472,VISUAL INSPECTION,23-37322,GW-1601,GW-1601,,,4-10-23 1:47 AM,2023-04-10T01:47:00.000Z,5-8-23 12:00 AM,2023-05-08T00:00:00.000Z,4-12-23 6:09 PM,2023-04-12T18:09:00.000Z,4,4,,PM,CLOSE,Y,,NO,CHATHAM,,,,,,,,,,,,,,,,39,2023-04-02T16:50:00.000Z,2023-04-26T00:40:00.000Z,560.8333333333334,23.368055555555557,Yes,No,No,No,Yes,No,No,No,1,1
2473,CHECK NUTS AND BOLTS,23-37324,GW-2301,GW-2301,,,4-10-23 1:47 AM,2023-04-10T01:47:00.000Z,5-8-23 12:00 AM,2023-05-08T00:00:00.000Z,4-12-23 6:08 PM,2023-04-12T18:08:00.000Z,4,4,,PM,CLOSE,Y,,NO,CHATHAM,,,,,,,,,,,,,,,,39,2023-04-02T16:50:00.000Z,2023-04-26T00:40:00.000Z,560.8333333333334,23.368055555555557,Yes,No,No,No,Yes,No,No,No,1,1
2473,VISUAL INSPECTION,23-37325,GW-2301,GW-2301,,,4-10-23 1:47 AM,2023-04-10T01:47:00.000Z,5-8-23 12:00 AM,2023-05-08T00:00:00.000Z,4-12-23 6:08 PM,2023-04-12T18:08:00.000Z,4,4,,PM,CLOSE,Y,,NO,CHATHAM,,,,,,,,,,,,,,,,39,2023-04-02T16:50:00.000Z,2023-04-26T00:40:00.000Z,560.8333333333334,23.368055555555557,Yes,No,No,No,Yes,No,No,No,1,1
2472,STILLAGE TRUCK GANGWAY PM,23-37320,GW-1601,GW-1601,,,4-10-23 1:47 AM,2023-04-10T01:47:00.000Z,5-8-23 12:00 AM,2023-05-08T00:00:00.000Z,4-12-23 6:09 PM,2023-04-12T18:09:00.000Z,4,4,,PM,CLOSE,Y,N,NO,CHATHAM,,,,,,,,,,,,,,,,39,2023-04-02T16:50:00.000Z,2023-04-26T00:40:00.000Z,560.8333333333334,23.368055555555557,Yes,No,No,No,Yes,No,No,No,1,1
2472,CHECK NUTS AND BOLTS,23-37321,GW-1601,GW-1601,,,4-10-23 1:47 AM,2023-04-10T01:47:00.000Z,5-8-23 12:00 AM,2023-05-08T00:00:00.000Z,4-12-23 6:09 PM,2023-04-12T18:09:00.000Z,4,4,,PM,CLOSE,Y,,NO,CHATHAM,,,,,,,,,,,,,,,,39,2023-04-02T16:50:00.000Z,2023-04-26T00:40:00.000Z,560.8333333333334,23.368055555555557,Yes,No,No,No,Yes,No,No,No,1,1
2473,EAST TRUCK LOADING GANGWAY PM,23-37323,GW-2301,GW-2301,,,4-10-23 1:47 AM,2023-04-10T01:47:00.000Z,5-8-23 12:00 AM,2023-05-08T00:00:00.000Z,4-12-23 6:08 PM,2023-04-12T18:08:00.000Z,4,4,,PM,CLOSE,Y,N,NO,CHATHAM,,,,,,,,,,,,,,,,39,2023-04-02T16:50:00.000Z,2023-04-26T00:40:00.000Z,560.8333333333334,23.368055555555557,Yes,No,No,No,Yes,No,No,No,1,1
2474,WEST TRUCK LOADING GANGWAY  PM,23-37326,GW-2302,GW-2302,,,4-10-23 1:47 AM,2023-04-10T01:47:00.000Z,5-8-23 12:00 AM,2023-05-08T00:00:00.000Z,4-12-23 6:08 PM,2023-04-12T18:08:00.000Z,4,4,,PM,CLOSE,Y,N,NO,CHATHAM,,,,,,,,,,,,,,,,39,2023-04-02T16:50:00.000Z,2023-04-26T00:40:00.000Z,560.8333333333334,23.368055555555557,Yes,No,No,No,Yes,No,No,No,1,1
2474,VISUAL INSPECTION,23-37328,GW-2302,GW-2302,,,4-10-23 1:48 AM,2023-04-10T01:48:00.000Z,5-8-23 12:00 AM,2023-05-08T00:00:00.000Z,4-12-23 6:08 PM,2023-04-12T18:08:00.000Z,4,4,,PM,CLOSE,Y,,NO,CHATHAM,,,,,,,,,,,,,,,,39,2023-04-02T16:50:00.000Z,2023-04-26T00:40:00.000Z,560.8333333333334,23.368055555555557,Yes,No,No,No,Yes,No,No,No,1,1
2474,CHECK NUTS AND BOLTS,23-37327,GW-2302,GW-2302,,,4-10-23 1:48 AM,2023-04-10T01:48:00.000Z,5-8-23 12:00 AM,2023-05-08T00:00:00.000Z,4-12-23 6:08 PM,2023-04-12T18:08:00.000Z,4,4,,PM,CLOSE,Y,,NO,CHATHAM,,,,,,,,,,,,,,,,39,2023-04-02T16:50:00.000Z,2023-04-26T00:40:00.000Z,560.8333333333334,23.368055555555557,Yes,No,No,No,Yes,No,No,No,1,1
,SAND FILTER MEDIA LEVEL PM,23-37356,3200,3200,,,4-10-23 1:48 AM,2023-04-10T01:48:00.000Z,5-8-23 12:00 AM,2023-05-08T00:00:00.000Z,4-10-23 2:37 PM,2023-04-10T14:37:00.000Z,4,4,,PM,CLOSE,Y,N,NO,CHATHAM,,,,,,,,,,,,,,,,39,2023-04-02T16:50:00.000Z,2023-04-26T00:40:00.000Z,560.8333333333334,23.368055555555557,Yes,No,No,No,Yes,No,No,No,1,1
,SAND MEDIA LEVEL,23-37357,3200,3200,,,4-10-23 1:48 AM,2023-04-10T01:48:00.000Z,5-8-23 12:00 AM,2023-05-08T00:00:00.000Z,4-10-23 2:37 PM,2023-04-10T14:37:00.000Z,4,4,,PM,CLOSE,Y,,NO,CHATHAM,,,,,,,,,,,,,,,,39,2023-04-02T16:50:00.000Z,2023-04-26T00:40:00.000Z,560.8333333333334,23.368055555555557,Yes,No,No,No,Yes,No,No,No,1,1
5003,SLUDGE ANALYSIS FOR BIOTHANE DIGESTER,23-37358,T-4126,T-4126,,,4-10-23 1:48 AM,2023-04-10T01:48:00.000Z,5-8-23 12:00 AM,2023-05-08T00:00:00.000Z,4-10-23 2:32 PM,2023-04-10T14:32:00.000Z,4,4,,PM,CLOSE,Y,N,NO,CHATHAM,,,,,,,,,,,,,,,,39,2023-04-02T16:50:00.000Z,2023-04-26T00:40:00.000Z,560.8333333333334,23.368055555555557,Yes,No,No,No,Yes,No,No,No,1,1
5003,Agitate the Sludge Bed in the Biothane and preform and record the  Sludge Analysis for the Biothane,23-37359,T-4126,T-4126,,,4-10-23 1:48 AM,2023-04-10T01:48:00.000Z,5-8-23 12:00 AM,2023-05-08T00:00:00.000Z,4-10-23 2:32 PM,2023-04-10T14:32:00.000Z,4,4,,PM,CLOSE,Y,,NO,CHATHAM,,,,,,,,,,,,,,,,39,2023-04-02T16:50:00.000Z,2023-04-26T00:40:00.000Z,560.8333333333334,23.368055555555557,Yes,No,No,No,Yes,No,No,No,1,1
,5S AND STOCKROOM AUDIT-WEEKLY PM,23-37392,MAINTENANCE,MAINTENANCE,,,4-10-23 1:49 AM,2023-04-10T01:49:00.000Z,5-8-23 12:00 AM,2023-05-08T00:00:00.000Z,4-11-23 9:47 AM,2023-04-11T09:47:00.000Z,4,4,,PM,CLOSE,Y,N,NO,CHATHAM,,,,,,,,,,,,,,,,39,2023-04-02T16:50:00.000Z,2023-04-26T00:40:00.000Z,560.8333333333334,23.368055555555557,Yes,No,No,No,Yes,No,No,No,1,1
1412,Replace Tail End Bearing on CV-1747,23-37537,CV-1747,CV-1747,,,4-10-23 11:19 AM,2023-04-10T11:19:00.000Z,4-10-23 3:30 PM,2023-04-10T15:30:00.000Z,4-10-23 11:26 AM,2023-04-10T11:26:00.000Z,1,1,,RM,CLOSE,Y,,NO,CHATHAM,,,,,,,,,,,,,,,,39,2023-04-02T16:50:00.000Z,2023-04-26T00:40:00.000Z,560.8333333333334,23.368055555555557,Yes,No,No,No,Yes,No,No,No,1,1
,I/E - Verify new FT ranges and located FT-13125 and FT-36103 control wiring in DCS cabinet,23-37538,0000,0000,,,4-10-23 2:07 PM,2023-04-10T14:07:00.000Z,4-11-23 4:00 PM,2023-04-11T16:00:00.000Z,4-11-23 11:00 AM,2023-04-11T11:00:00.000Z,4,4,,CP,CLOSE,Y,,NO,CHATHAM,,,,,,,,,,,,,,,,39,2023-04-02T16:50:00.000Z,2023-04-26T00:40:00.000Z,560.8333333333334,23.368055555555557,Yes,No,No,No,Yes,No,No,No,1,1
4870,Install conduit stub ups for new truck scale,23-37542,SC-2001,SC-2001,,,4-11-23 6:37 AM,2023-04-11T06:37:00.000Z,5-5-23 9:31 AM,2023-05-05T09:31:00.000Z,4-11-23 2:31 PM,2023-04-11T14:31:00.000Z,4,4,,CP,CLOSE,Y,,NO,CHATHAM,,,,,,,,,,,,,,,,39,2023-04-02T16:50:00.000Z,2023-04-26T00:40:00.000Z,560.8333333333334,23.368055555555557,Yes,No,No,No,Yes,No,No,No,1,1
1330,Wilden Pump on Waste Oil Cart is not Functioning,23-37543,BU-UTIL,BU-UTIL,,,4-11-23 7:25 AM,2023-04-11T07:25:00.000Z,4-21-23 4:45 PM,2023-04-21T16:45:00.000Z,4-11-23 10:45 PM,2023-04-11T22:45:00.000Z,2,2,,RM,CLOSE,Y,,NO,CHATHAM,,,,,,,,,,,,,,,,39,2023-04-02T16:50:00.000Z,2023-04-26T00:40:00.000Z,560.8333333333334,23.368055555555557,Yes,No,No,No,Yes,No,No,No,1,1
,middle toilet in Women's change room small geyser,23-37594,BU-ADMIN,BU-ADMIN,,,4-13-23 12:35 AM,2023-04-13T00:35:00.000Z,4-14-23 10:37 AM,2023-04-14T10:37:00.000Z,4-25-23 10:52 AM,2023-04-25T10:52:00.000Z,2,2,,RM,CLOSE,Y,,NO,CHATHAM,,,,,,,,,,,,,,,,39,2023-04-02T16:50:00.000Z,2023-04-26T00:40:00.000Z,560.8333333333334,23.368055555555557,Yes,No,No,No,Yes,No,No,No,1,1
1052,Replace MSU2 area Utility Water Valve,23-37657,P-1592A,P-1592A,,,4-17-23 12:19 AM,2023-04-17T00:19:00.000Z,7-31-23 11:23 AM,2023-07-31T11:23:00.000Z,4-22-23 11:26 AM,2023-04-22T11:26:00.000Z,4,4,,CO,CLOSE,Y,,NO,CHATHAM,,,,,,,,,,,,,,,,39,2023-04-02T16:50:00.000Z,2023-04-26T00:40:00.000Z,560.8333333333334,23.368055555555557,Yes,No,No,No,Yes,No,No,No,1,1
,urinal in mens changeroom is plugged,23-38034,BU-ADMIN,BU-ADMIN,,,4-22-23 4:14 PM,2023-04-22T16:14:00.000Z,4-22-23 4:12 PM,2023-04-22T16:12:00.000Z,4-25-23 7:30 AM,2023-04-25T07:30:00.000Z,1,1,,RM,CLOSE,Y,,NO,CHATHAM,,,,,,,,,,,,,,,,39,2023-04-02T16:50:00.000Z,2023-04-26T00:40:00.000Z,560.8333333333334,23.368055555555557,Yes,No,No,No,Yes,No,No,No,1,1
,SAFETY SHOWER FLUSH & CHECK - PM SERVICE,23-38069,CHATHAM,CHATHAM,,,4-24-23 1:46 AM,2023-04-24T01:46:00.000Z,5-22-23 1:30 AM,2023-05-22T01:30:00.000Z,4-24-23 7:28 AM,2023-04-24T07:28:00.000Z,4,4,,PM,CLOSE,Y,N,NO,CHATHAM,,,,,,,,,,,,,,,,39,2023-04-02T16:50:00.000Z,2023-04-26T00:40:00.000Z,560.8333333333334,23.368055555555557,Yes,No,No,No,Yes,No,No,No,1,1
,SAFETY SHOWER WEEKLY FLUSH,23-38070,CHATHAM,CHATHAM,,,4-24-23 1:46 AM,2023-04-24T01:46:00.000Z,5-22-23 1:30 AM,2023-05-22T01:30:00.000Z,4-24-23 7:28 AM,2023-04-24T07:28:00.000Z,4,4,,PM,CLOSE,Y,,NO,CHATHAM,,,,,,,,,,,,,,,,39,2023-04-02T16:50:00.000Z,2023-04-26T00:40:00.000Z,560.8333333333334,23.368055555555557,Yes,No,No,No,Yes,No,No,No,1,1
,CULLIGAN WATER DISPENSER PM,23-38185,CHATHAM,CHATHAM,,,4-24-23 1:48 AM,2023-04-24T01:48:00.000Z,5-17-23 9:00 AM,2023-05-17T09:00:00.000Z,4-24-23 7:26 AM,2023-04-24T07:26:00.000Z,4,4,,PM,CLOSE,Y,N,NO,CHATHAM,,,,,,,,,,,,,,,,39,2023-04-02T16:50:00.000Z,2023-04-26T00:40:00.000Z,560.8333333333334,23.368055555555557,Yes,No,No,No,Yes,No,No,No,1,1
,CLEAN P.O.U. DISPENSER in Maintenance Shop,23-38189,CHATHAM,CHATHAM,,,4-24-23 1:48 AM,2023-04-24T01:48:00.000Z,5-17-23 9:30 AM,2023-05-17T09:30:00.000Z,4-24-23 7:26 AM,2023-04-24T07:26:00.000Z,4,4,,PM,CLOSE,Y,,NO,CHATHAM,,,,,,,,,,,,,,,,39,2023-04-02T16:50:00.000Z,2023-04-26T00:40:00.000Z,560.8333333333334,23.368055555555557,Yes,No,No,No,Yes,No,No,No,1,1
5003,SLUDGE ANALYSIS FOR BIOTHANE DIGESTER,23-38141,T-4126,T-4126,,,4-24-23 1:48 AM,2023-04-24T01:48:00.000Z,5-22-23 12:00 AM,2023-05-22T00:00:00.000Z,4-24-23 7:26 AM,2023-04-24T07:26:00.000Z,4,4,,PM,CLOSE,Y,N,NO,CHATHAM,,,,,,,,,,,,,,,,39,2023-04-02T16:50:00.000Z,2023-04-26T00:40:00.000Z,560.8333333333334,23.368055555555557,Yes,No,No,No,Yes,No,No,No,1,1
5003,Agitate the Sludge Bed in the Biothane and preform and record the  Sludge Analysis for the Biothane,23-38142,T-4126,T-4126,,,4-24-23 1:48 AM,2023-04-24T01:48:00.000Z,5-22-23 12:00 AM,2023-05-22T00:00:00.000Z,4-24-23 7:26 AM,2023-04-24T07:26:00.000Z,4,4,,PM,CLOSE,Y,,NO,CHATHAM,,,,,,,,,,,,,,,,39,2023-04-02T16:50:00.000Z,2023-04-26T00:40:00.000Z,560.8333333333334,23.368055555555557,Yes,No,No,No,Yes,No,No,No,1,1
,CLEAN BOTTLE DISPENSER in Main Control Room,23-38188,CHATHAM,CHATHAM,,,4-24-23 1:48 AM,2023-04-24T01:48:00.000Z,5-17-23 9:30 AM,2023-05-17T09:30:00.000Z,4-24-23 7:26 AM,2023-04-24T07:26:00.000Z,4,4,,PM,CLOSE,Y,,NO,CHATHAM,,,,,,,,,,,,,,,,39,2023-04-02T16:50:00.000Z,2023-04-26T00:40:00.000Z,560.8333333333334,23.368055555555557,Yes,No,No,No,Yes,No,No,No,1,1
,CLEAN P.O.U. DISPENSER on 2nd Floor Admin Building,23-38190,CHATHAM,CHATHAM,,,4-24-23 1:48 AM,2023-04-24T01:48:00.000Z,5-17-23 9:30 AM,2023-05-17T09:30:00.000Z,4-24-23 7:26 AM,2023-04-24T07:26:00.000Z,4,4,,PM,CLOSE,Y,,NO,CHATHAM,,,,,,,,,,,,,,,,39,2023-04-02T16:50:00.000Z,2023-04-26T00:40:00.000Z,560.8333333333334,23.368055555555557,Yes,No,No,No,Yes,No,No,No,1,1
,CLEAN P.O.U. DISPENSER at Security,23-38186,CHATHAM,CHATHAM,,,4-24-23 1:48 AM,2023-04-24T01:48:00.000Z,5-17-23 9:30 AM,2023-05-17T09:30:00.000Z,4-24-23 7:26 AM,2023-04-24T07:26:00.000Z,4,4,,PM,CLOSE,Y,,NO,CHATHAM,,,,,,,,,,,,,,,,39,2023-04-02T16:50:00.000Z,2023-04-26T00:40:00.000Z,560.8333333333334,23.368055555555557,Yes,No,No,No,Yes,No,No,No,1,1
,CLEAN P.O.U. DISPENSER at Main Lunch Room,23-38187,CHATHAM,CHATHAM,,,4-24-23 1:48 AM,2023-04-24T01:48:00.000Z,5-17-23 9:30 AM,2023-05-17T09:30:00.000Z,4-24-23 7:26 AM,2023-04-24T07:26:00.000Z,4,4,,PM,CLOSE,Y,,NO,CHATHAM,,,,,,,,,,,,,,,,39,2023-04-02T16:50:00.000Z,2023-04-26T00:40:00.000Z,560.8333333333334,23.368055555555557,Yes,No,No,No,Yes,No,No,No,1,1
,CLEAN BOTTLE DISPENSER in Cornland Control Room,23-38191,CHATHAM,CHATHAM,,,4-24-23 1:48 AM,2023-04-24T01:48:00.000Z,5-17-23 9:30 AM,2023-05-17T09:30:00.000Z,4-24-23 7:26 AM,2023-04-24T07:26:00.000Z,4,4,,PM,CLOSE,Y,,NO,CHATHAM,,,,,,,,,,,,,,,,39,2023-04-02T16:50:00.000Z,2023-04-26T00:40:00.000Z,560.8333333333334,23.368055555555557,Yes,No,No,No,Yes,No,No,No,1,1
,CLEAN P.O.U. DISPENSER at Alcohol Loading Control Room,23-38192,CHATHAM,CHATHAM,,,4-24-23 1:48 AM,2023-04-24T01:48:00.000Z,5-17-23 9:30 AM,2023-05-17T09:30:00.000Z,4-24-23 7:26 AM,2023-04-24T07:26:00.000Z,4,4,,PM,CLOSE,Y,,NO,CHATHAM,,,,,,,,,,,,,,,,39,2023-04-02T16:50:00.000Z,2023-04-26T00:40:00.000Z,560.8333333333334,23.368055555555557,Yes,No,No,No,Yes,No,No,No,1,1
,CLEAN P.O.U. DISPENSER in Utility Control Room,23-38193,CHATHAM,CHATHAM,,,4-24-23 1:48 AM,2023-04-24T01:48:00.000Z,5-17-23 9:30 AM,2023-05-17T09:30:00.000Z,4-24-23 7:26 AM,2023-04-24T07:26:00.000Z,4,4,,PM,CLOSE,Y,,NO,CHATHAM,,,,,,,,,,,,,,,,39,2023-04-02T16:50:00.000Z,2023-04-26T00:40:00.000Z,560.8333333333334,23.368055555555557,Yes,No,No,No,Yes,No,No,No,1,1
1457,DC 2101 leaking air,23-38395,DC-2101,DC-2101,,,4-24-23 7:11 AM,2023-04-24T07:11:00.000Z,4-23-23 6:25 AM,2023-04-23T06:25:00.000Z,4-24-23 7:12 AM,2023-04-24T07:12:00.000Z,1,1,,RM,CLOSE,Y,,NO,CHATHAM,,,,,,,,,,,,,,,,39,2023-04-02T16:50:00.000Z,2023-04-26T00:40:00.000Z,560.8333333333334,23.368055555555557,Yes,No,No,No,Yes,No,No,No,1,1
1041,"TA23 Found Work (created) When putting syrup valves back in, Haller broke an air line to FV-16509",23-38396,P-1603A,P-1603A,,,4-24-23 7:15 AM,2023-04-24T07:15:00.000Z,4-23-23 5:10 AM,2023-04-23T05:10:00.000Z,4-24-23 7:25 AM,2023-04-24T07:25:00.000Z,1,1,,RM,CLOSE,Y,,NO,CHATHAM,,,,,,,,,,,,,,,,39,2023-04-02T16:50:00.000Z,2023-04-26T00:40:00.000Z,560.8333333333334,23.368055555555557,Yes,No,No,No,Yes,No,No,No,1,1
7176,Found Work TA23 - AG1301 oil leaking out of dessicant breather on gearbox,23-38399,AG-1301,AG-1301,,,4-24-23 7:42 AM,2023-04-24T07:42:00.000Z,4-26-23 12:33 AM,2023-04-26T00:33:00.000Z,4-24-23 7:42 AM,2023-04-24T07:42:00.000Z,1,1,,CO,CLOSE,Y,,NO,CHATHAM,,,,,,,,,,,,,,,,39,2023-04-02T16:50:00.000Z,2023-04-26T00:40:00.000Z,560.8333333333334,23.368055555555557,Yes,No,No,No,Yes,No,No,No,1,1
4917,DDG Truck spout closed but did not reach its limit,23-38400,SG-2608,SG-2608,,,4-24-23 7:43 AM,2023-04-24T07:43:00.000Z,4-22-23 5:22 PM,2023-04-22T17:22:00.000Z,4-25-23 12:25 PM,2023-04-25T12:25:00.000Z,2,2,,CO,CLOSE,Y,,NO,CHATHAM,,,,,,,,,,,,,,,,39,2023-04-02T16:50:00.000Z,2023-04-26T00:40:00.000Z,560.8333333333334,23.368055555555557,Yes,No,No,No,Yes,No,No,No,1,1
,Rebuild Hydro Heater (jammed),23-38413,EJ-1302,EJ-1302,,,4-24-23 10:25 AM,2023-04-24T10:25:00.000Z,4-24-23 4:30 PM,2023-04-24T16:30:00.000Z,4-24-23 10:33 AM,2023-04-24T10:33:00.000Z,2,2,,CO,CLOSE,Y,,NO,CHATHAM,,,,,,,,,,,,,,,,39,2023-04-02T16:50:00.000Z,2023-04-26T00:40:00.000Z,560.8333333333334,23.368055555555557,Yes,No,No,No,Yes,No,No,No,1,1
1323,PLC not working; DCS need new password in grain office - Viraj,23-38415,BU-GHR,BU-GHR,,,4-24-23 11:20 AM,2023-04-24T11:20:00.000Z,4-21-23 5:31 PM,2023-04-21T17:31:00.000Z,4-24-23 11:21 AM,2023-04-24T11:21:00.000Z,2,2,,RM,CLOSE,Y,,NO,CHATHAM,,,,,,,,,,,,,,,,39,2023-04-02T16:50:00.000Z,2023-04-26T00:40:00.000Z,560.8333333333334,23.368055555555557,Yes,No,No,No,Yes,No,No,No,1,1
,oil  leak in Kato Generator needs to be removed and sent for repair,23-38454,ME-3601A,ME-3601A,,,4-25-23 2:16 PM,2023-04-25T14:16:00.000Z,4-25-23 2:45 PM,2023-04-25T14:45:00.000Z,4-25-23 9:53 PM,2023-04-25T21:53:00.000Z,2,2,,CO,CLOSE,Y,,NO,CHATHAM,,,,,,,,,,,,,,,,39,2023-04-02T16:50:00.000Z,2023-04-26T00:40:00.000Z,560.8333333333334,23.368055555555557,Yes,No,No,No,Yes,No,No,No,1,1
3857,DC-2101 not Pulsing,23-38431,PCV-21102,PCV-21102,,,4-25-23 6:30 AM,2023-04-25T06:30:00.000Z,4-26-23 6:24 AM,2023-04-26T06:24:00.000Z,4-26-23 10:48 AM,2023-04-26T10:48:00.000Z,1,1,,RM,CLOSE,Y,,NO,CHATHAM,,,,,,,,,,,,,,,,40,2023-04-26T01:40:00.000Z,2023-04-26T07:00:00.000Z,14.166666666666666,0.5902777777777778,No,No,No,Yes,No,Yes,No,No,4,1
,Install boot cleaner and ear plug dispenser at grain office,23-38443,2100,2100,,,4-25-23 11:03 AM,2023-04-25T11:03:00.000Z,5-12-23 4:00 PM,2023-05-12T16:00:00.000Z,5-2-23 6:50 AM,2023-05-02T06:50:00.000Z,4,4,,CO,CLOSE,Y,,NO,CHATHAM,,,,,,,,,,,,,,,,40,2023-04-26T01:40:00.000Z,2023-04-26T07:00:00.000Z,14.166666666666666,0.5902777777777778,No,No,No,Yes,No,No,No,No,4,1
6670,K-3301A/B AIR COMPRESSOR 8000/ 2YR,23-38445,K-3301B,K-3301B,,,4-25-23 11:04 AM,2023-04-25T11:04:00.000Z,4-25-23 2:00 AM,2023-04-25T02:00:00.000Z,5-15-23 10:50 AM,2023-05-15T10:50:00.000Z,4,4,,PM,CLOSE,Y,,NO,CHATHAM,,,,,,,,,,,,,,,,40,2023-04-26T01:40:00.000Z,2023-04-26T07:00:00.000Z,14.166666666666666,0.5902777777777778,No,No,No,Yes,No,No,No,No,4,1
6670,AIR COMPRESSOR - PM SERVICE,23-38444,K-3301B,K-3301B,,,4-25-23 11:04 AM,2023-04-25T11:04:00.000Z,5-30-23 2:00 AM,2023-05-30T02:00:00.000Z,5-15-23 10:50 AM,2023-05-15T10:50:00.000Z,4,4,,PM,CLOSE,Y,N,NO,CHATHAM,,,,,,,,,,,,,,,,40,2023-04-26T01:40:00.000Z,2023-04-26T07:00:00.000Z,14.166666666666666,0.5902777777777778,No,No,No,Yes,No,No,No,No,4,1
,TA23 - Steam to E6585 (MSU3 superheater) vent valve passing,23-38446,E-6585,E-6585,,,4-25-23 11:29 AM,2023-04-25T11:29:00.000Z,11-29-23 11:32 AM,2023-11-29T11:32:00.000Z,4-28-23 6:20 AM,2023-04-28T06:20:00.000Z,4,4,,CO,CLOSE,Y,,NO,CHATHAM,,,,,,,,,,,,,,,,40,2023-04-26T01:40:00.000Z,2023-04-26T07:00:00.000Z,14.166666666666666,0.5902777777777778,No,No,No,Yes,No,No,No,No,4,1
,inspect QA/QC valve welds,23-38448,E-6585,E-6585,,,4-25-23 11:39 AM,2023-04-25T11:39:00.000Z,11-29-23 11:32 AM,2023-11-29T11:32:00.000Z,4-28-23 6:20 AM,2023-04-28T06:20:00.000Z,4,4,,CO,CLOSE,Y,,NO,CHATHAM,,,,,,,,,,,,,,,,40,2023-04-26T01:40:00.000Z,2023-04-26T07:00:00.000Z,14.166666666666666,0.5902777777777778,No,No,No,Yes,No,No,No,No,4,1
,re-install insulation,23-38449,E-6585,E-6585,,,4-25-23 11:42 AM,2023-04-25T11:42:00.000Z,11-29-23 11:32 AM,2023-11-29T11:32:00.000Z,4-28-23 6:20 AM,2023-04-28T06:20:00.000Z,4,4,,CO,CLOSE,Y,,NO,CHATHAM,,,,,,,,,,,,,,,,40,2023-04-26T01:40:00.000Z,2023-04-26T07:00:00.000Z,14.166666666666666,0.5902777777777778,No,No,No,Yes,No,No,No,No,4,1
,remove scaffolding,23-38450,E-6585,E-6585,,,4-25-23 11:43 AM,2023-04-25T11:43:00.000Z,11-29-23 11:32 AM,2023-11-29T11:32:00.000Z,4-28-23 6:20 AM,2023-04-28T06:20:00.000Z,4,4,,CO,CLOSE,Y,,NO,CHATHAM,,,,,,,,,,,,,,,,40,2023-04-26T01:40:00.000Z,2023-04-26T07:00:00.000Z,14.166666666666666,0.5902777777777778,No,No,No,Yes,No,No,No,No,4,1
3396,Procure two new JAQUETs and 1 programing cable,23-38452,ME-3602A,ME-3602A,,,4-25-23 1:59 PM,2023-04-25T13:59:00.000Z,4-26-23 12:32 AM,2023-04-26T00:32:00.000Z,6-5-23 10:08 AM,2023-06-05T10:08:00.000Z,2,2,,RM,CLOSE,Y,,NO,CHATHAM,,,,,,,,,,,,,,,,40,2023-04-26T01:40:00.000Z,2023-04-26T07:00:00.000Z,14.166666666666666,0.5902777777777778,No,No,No,Yes,No,No,No,No,4,1
,Scaffold access required to open Utility water,23-38453,3500-26K-04,3500-26K-04,,,4-25-23 2:11 PM,2023-04-25T14:11:00.000Z,4-26-23 10:10 AM,2023-04-26T10:10:00.000Z,5-24-23 8:19 AM,2023-05-24T08:19:00.000Z,2,2,,CO,CLOSE,Y,,NO,CHATHAM,,,,,,,,,,,,,,,,40,2023-04-26T01:40:00.000Z,2023-04-26T07:00:00.000Z,14.166666666666666,0.5902777777777778,No,No,No,Yes,No,No,No,No,4,1
,P11402 Glycol pot full of mash,23-38455,1400-PD-14C,1400-PD-14C,,,4-25-23 2:22 PM,2023-04-25T14:22:00.000Z,4-26-23 5:12 PM,2023-04-26T17:12:00.000Z,5-3-23 6:44 AM,2023-05-03T06:44:00.000Z,2,2,,RM,CLOSE,Y,,NO,CHATHAM,,,,,,,,,,,,,,,,40,2023-04-26T01:40:00.000Z,2023-04-26T07:00:00.000Z,14.166666666666666,0.5902777777777778,No,No,No,Yes,No,No,No,No,4,1
P-2303A,TA23 replace gate valve at the presure gauge on p-2303,23-31311,CHATHAM,CHATHAM,,,1-5-23 3:34 PM,2023-01-05T15:34:00.000Z,,,4-27-23 10:12 AM,2023-04-27T10:12:00.000Z,4,4,,SD,CLOSE,Y,,NO,CHATHAM,,,,,,,,,,,,,,,,41,2023-04-26T15:50:00.000Z,2023-04-27T10:40:00.000Z,19.666666666666668,0.8194444444444444,Yes,No,No,No,No,No,No,No,1,1
1503,"Permanent Repair Steam leaks on 1\" lines to E-1511 A and B",23-32342,E-1511B,E-1511B,,,1-19-23 7:22 AM,2023-01-19T07:22:00.000Z,10-30-23 7:22 AM,2023-10-30T07:22:00.000Z,4-28-23 6:16 AM,2023-04-28T06:16:00.000Z,4,4,,CO,CLOSE,Y,,NO,CHATHAM,,,,,,,,,,,,,,,,41,2023-04-26T15:50:00.000Z,2023-04-27T10:40:00.000Z,19.666666666666668,0.8194444444444444,No,No,No,No,No,Yes,No,No,5,1
,TA23 - Inspect RC3 from manways,23-32689,C-6571,C-6571,,,1-24-23 7:50 AM,2023-01-24T07:50:00.000Z,4-21-23 8:24 AM,2023-04-21T08:24:00.000Z,4-27-23 10:04 AM,2023-04-27T10:04:00.000Z,4,4,,PM,CLOSE,Y,,NO,CHATHAM,,,,,,,,,,,,,,,,41,2023-04-26T15:50:00.000Z,2023-04-27T10:40:00.000Z,19.666666666666668,0.8194444444444444,Yes,No,No,No,No,No,No,No,1,1
,TA23 Replace Paper gasket on Propanol side draw on RC3,23-32691,C-6571,C-6571,,,1-24-23 7:53 AM,2023-01-24T07:53:00.000Z,4-30-23 10:40 AM,2023-04-30T10:40:00.000Z,4-27-23 10:09 AM,2023-04-27T10:09:00.000Z,4,4,,SD,CLOSE,Y,,NO,CHATHAM,,,,,,,,,,,,,,,,41,2023-04-26T15:50:00.000Z,2023-04-27T10:40:00.000Z,19.666666666666668,0.8194444444444444,Yes,No,No,No,No,No,No,No,1,1
1363,Repairs as reported from Sulzer RC2 (placeholder request),23-32723,C-1571,C-1571,,,1-24-23 2:41 PM,2023-01-24T14:41:00.000Z,10-31-23 9:22 AM,2023-10-31T09:22:00.000Z,4-27-23 10:02 AM,2023-04-27T10:02:00.000Z,4,4,,CO,CLOSE,Y,,NO,CHATHAM,,,,,,,,,,,,,,,,41,2023-04-26T15:50:00.000Z,2023-04-27T10:40:00.000Z,19.666666666666668,0.8194444444444444,Yes,No,No,No,No,No,No,No,1,1
1575,TA23 - Replace bypass valve around HC reflux cooler E6563,23-32729,E-6563,E-6563,,,1-24-23 2:44 PM,2023-01-24T14:44:00.000Z,4-21-23 1:13 PM,2023-04-21T13:13:00.000Z,4-28-23 6:26 AM,2023-04-28T06:26:00.000Z,4,4,,SD,CLOSE,Y,,NO,CHATHAM,,,,,,,,,,,,,,,,41,2023-04-26T15:50:00.000Z,2023-04-27T10:40:00.000Z,19.666666666666668,0.8194444444444444,No,No,No,No,No,Yes,No,No,5,1
1358,TA23 Internal Vessel Inspection C-1509,23-32733,C-1509,C-1509,,,1-24-23 3:55 PM,2023-01-24T15:55:00.000Z,4-28-23 8:01 AM,2023-04-28T08:01:00.000Z,4-27-23 10:00 AM,2023-04-27T10:00:00.000Z,4,4,,SD,CLOSE,Y,,NO,CHATHAM,,,,,,,,,,,,,,,,41,2023-04-26T15:50:00.000Z,2023-04-27T10:40:00.000Z,19.666666666666668,0.8194444444444444,Yes,No,No,No,No,No,No,No,1,1
,TA23 - Dryer A Survey,23-32734,DR-1826,DR-1826,,,1-24-23 3:57 PM,2023-01-24T15:57:00.000Z,4-24-23 10:03 AM,2023-04-24T10:03:00.000Z,4-27-23 10:58 AM,2023-04-27T10:58:00.000Z,4,4,,CP,CLOSE,Y,,NO,CHATHAM,"2541, 2542, 2543, 2544, 2545, 2547, 2549, 2550, 2552, 2553, 2554, 2555, 2556, 2557, 2558, 2559","SWISS COMBI ROTARY DRYER DRUM, SEW GEARBOX - LEFT HAND DRIVE -, SEW GEARBOX - LEFT HAND DRIVE, SEW GEARBOX - RIGHT HAND DRIVE, SEW GEARBOX - RIGHT HAND DRIVE, MOTOR / 25HP / 1800RPM / TEFC / 575V/3PH/60HZ / FRAME# 284TC, MOTOR / 25HP / 1800RPM / TEFC / 575V/3PH/60HZ / FRAME# 284TC, MOTOR / 25HP / 1800RPM / TEFC / 575V/3PH/60HZ / FRAME# 284TC, MOTOR / 25HP / 1800RPM / TEFC / 575V/3PH/60HZ / FRAME# 284TC, TRUNNION (A) - LEFT HAND DRIVE, TRUNNION (B)- RIGHT HAND DRIVE, TRUNNION (D) - LEFT HAND DRIVE, TRUNNION (C) - RIGHT HAND DRIVE, THRUST ROLLER ASSEMBLY, THRUST ROLLER ASSEMBLY, TRUNNION LUBRICATION SYSTEM",,No,DRYER A,CH-DRA_CYCLNS,CH-DRA_CYCLNS:TT18168B.MEAS,TT-18168B,TT,MEAS,Measured value (PV),Temperature transmitter,Measurement,DRUM DR1826 MOTOR A AMPERAGE,DR-1826,41,2023-04-26T15:50:00.000Z,2023-04-27T10:40:00.000Z,19.666666666666668,0.8194444444444444,No,No,No,No,No,Yes,Yes,No,5,1
1505,TA23 - Internal / Tubular inspection E-1512B,23-32735,E-1512B,E-1512B,,,1-24-23 3:58 PM,2023-01-24T15:58:00.000Z,4-28-23 8:12 AM,2023-04-28T08:12:00.000Z,4-27-23 10:07 AM,2023-04-27T10:07:00.000Z,4,4,,PM,CLOSE,Y,,NO,CHATHAM,,,,,,,,,,,,,,,,41,2023-04-26T15:50:00.000Z,2023-04-27T10:40:00.000Z,19.666666666666668,0.8194444444444444,Yes,No,No,No,No,No,No,No,1,1
1587,BUILD SCAFF FOR TO R&R VALVE,23-32777,E-6586,E-6586,,,1-26-23 6:51 AM,2023-01-26T06:51:00.000Z,4-30-23 12:00 PM,2023-04-30T12:00:00.000Z,4-28-23 6:19 AM,2023-04-28T06:19:00.000Z,4,4,,SD,CLOSE,Y,,NO,CHATHAM,,,,,,,,,,,,,,,,41,2023-04-26T15:50:00.000Z,2023-04-27T10:40:00.000Z,19.666666666666668,0.8194444444444444,No,No,No,No,No,Yes,No,No,5,1
1587,RE-INSTALL VALVES,23-32779,E-6586,E-6586,,,1-26-23 6:52 AM,2023-01-26T06:52:00.000Z,4-30-23 12:00 PM,2023-04-30T12:00:00.000Z,4-28-23 6:19 AM,2023-04-28T06:19:00.000Z,4,4,,SD,CLOSE,Y,,NO,CHATHAM,,,,,,,,,,,,,,,,41,2023-04-26T15:50:00.000Z,2023-04-27T10:40:00.000Z,19.666666666666668,0.8194444444444444,No,No,No,No,No,Yes,No,No,5,1
1587,REMOVE VALVES,23-32778,E-6586,E-6586,,,1-26-23 6:52 AM,2023-01-26T06:52:00.000Z,4-30-23 12:00 PM,2023-04-30T12:00:00.000Z,4-28-23 6:19 AM,2023-04-28T06:19:00.000Z,4,4,,SD,CLOSE,Y,,NO,CHATHAM,,,,,,,,,,,,,,,,41,2023-04-26T15:50:00.000Z,2023-04-27T10:40:00.000Z,19.666666666666668,0.8194444444444444,No,No,No,No,No,Yes,No,No,5,1
1587,DISMANTLE SCAFF,23-32780,E-6586,E-6586,,,1-26-23 6:53 AM,2023-01-26T06:53:00.000Z,4-30-23 12:00 PM,2023-04-30T12:00:00.000Z,4-28-23 6:19 AM,2023-04-28T06:19:00.000Z,4,4,,SD,CLOSE,Y,,NO,CHATHAM,,,,,,,,,,,,,,,,41,2023-04-26T15:50:00.000Z,2023-04-27T10:40:00.000Z,19.666666666666668,0.8194444444444444,No,No,No,No,No,Yes,No,No,5,1
1504,E-1512A internal Inspection,23-33175,E-1512,E-1512,,,2-1-23 10:52 AM,2023-02-01T10:52:00.000Z,4-23-23 12:53 PM,2023-04-23T12:53:00.000Z,4-27-23 10:06 AM,2023-04-27T10:06:00.000Z,4,4,,SD,CLOSE,Y,,NO,CHATHAM,,,,,,,,,,,,,,,,41,2023-04-26T15:50:00.000Z,2023-04-27T10:40:00.000Z,19.666666666666668,0.8194444444444444,Yes,No,No,No,No,No,No,No,1,1
2114,TA23 Steam to HPA60 utilities station pipe is leaking through the insulation,23-33176,FT-57405,FT-57405,,,2-1-23 11:42 AM,2023-02-01T11:42:00.000Z,4-23-23 12:52 PM,2023-04-23T12:52:00.000Z,4-28-23 6:16 AM,2023-04-28T06:16:00.000Z,4,4,,CO,CLOSE,Y,,NO,CHATHAM,,,,,,,,,,,,,,,,41,2023-04-26T15:50:00.000Z,2023-04-27T10:40:00.000Z,19.666666666666668,0.8194444444444444,No,No,No,No,No,Yes,No,No,5,1
1576,TA23 - Inspect and clean HC reflux preheater E6564 (thought to be fouled with mol sieve bead dust),23-33206,E-6564,E-6564,,,2-2-23 1:56 PM,2023-02-02T13:56:00.000Z,4-21-23 11:23 AM,2023-04-21T11:23:00.000Z,4-28-23 6:24 AM,2023-04-28T06:24:00.000Z,4,4,,SD,CLOSE,Y,,NO,CHATHAM,,,,,,,,,,,,,,,,41,2023-04-26T15:50:00.000Z,2023-04-27T10:40:00.000Z,19.666666666666668,0.8194444444444444,No,No,No,No,No,Yes,No,No,5,1
3714,P-2407A PM,23-33893,P-2407A,P-2407A,,,2-13-23 1:48 AM,2023-02-13T01:48:00.000Z,4-29-23 12:00 AM,2023-04-29T00:00:00.000Z,4-27-23 10:05 AM,2023-04-27T10:05:00.000Z,4,4,,SD,CLOSE,Y,N,NO,CHATHAM,,,,,,,,,,,,,,,,41,2023-04-26T15:50:00.000Z,2023-04-27T10:40:00.000Z,19.666666666666668,0.8194444444444444,Yes,No,No,No,No,No,No,No,1,1
3714,P-2407A 2 MONTH PM/SERVICE PUMP,23-33894,P-2407A,P-2407A,,,2-13-23 1:48 AM,2023-02-13T01:48:00.000Z,3-10-23 12:00 AM,2023-03-10T00:00:00.000Z,4-27-23 10:05 AM,2023-04-27T10:05:00.000Z,4,4,,PM,CLOSE,Y,,NO,CHATHAM,,,,,,,,,,,,,,,,41,2023-04-26T15:50:00.000Z,2023-04-27T10:40:00.000Z,19.666666666666668,0.8194444444444444,Yes,No,No,No,No,No,No,No,1,1
1087,Repair/Replace suction on P1560B,23-34142,P-1560B,P-1560B,,,2-13-23 12:05 PM,2023-02-13T12:05:00.000Z,4-24-23 12:05 PM,2023-04-24T12:05:00.000Z,4-27-23 10:11 AM,2023-04-27T10:11:00.000Z,4,4,,SD,CLOSE,Y,,NO,CHATHAM,,,,,,,,,,,,,,,,41,2023-04-26T15:50:00.000Z,2023-04-27T10:40:00.000Z,19.666666666666668,0.8194444444444444,Yes,No,No,No,No,No,No,No,1,1
1576,TA23 - Internal / Tubular inspection E-6564,23-34522,E-6564,E-6564,,,2-21-23 7:39 AM,2023-02-21T07:39:00.000Z,4-30-23 8:23 AM,2023-04-30T08:23:00.000Z,4-28-23 6:24 AM,2023-04-28T06:24:00.000Z,4,4,,SD,CLOSE,Y,,NO,CHATHAM,,,,,,,,,,,,,,,,41,2023-04-26T15:50:00.000Z,2023-04-27T10:40:00.000Z,19.666666666666668,0.8194444444444444,No,No,No,No,No,Yes,No,No,5,1
2197,REMOVE VALVE,23-35195,FV-15601,FV-15601,,,3-6-23 8:59 AM,2023-03-06T08:59:00.000Z,11-29-23 1:01 PM,2023-11-29T13:01:00.000Z,4-28-23 6:27 AM,2023-04-28T06:27:00.000Z,4,4,,SD,CLOSE,Y,,NO,CHATHAM,,,,,,,,,,,,,,,,41,2023-04-26T15:50:00.000Z,2023-04-27T10:40:00.000Z,19.666666666666668,0.8194444444444444,No,No,No,No,No,Yes,No,No,5,1
2197,INSTALL NEW VALVE,23-35196,FV-15601,FV-15601,,,3-6-23 9:00 AM,2023-03-06T09:00:00.000Z,11-29-23 1:01 PM,2023-11-29T13:01:00.000Z,4-28-23 6:27 AM,2023-04-28T06:27:00.000Z,4,4,,SD,CLOSE,Y,,NO,CHATHAM,,,,,,,,,,,,,,,,41,2023-04-26T15:50:00.000Z,2023-04-27T10:40:00.000Z,19.666666666666668,0.8194444444444444,No,No,No,No,No,Yes,No,No,5,1
2195,INSTALL NEW VALVE,23-35219,FV-15501,FV-15501,,,3-7-23 6:50 AM,2023-03-07T06:50:00.000Z,12-27-23 12:53 PM,2023-12-27T12:53:00.000Z,4-28-23 6:27 AM,2023-04-28T06:27:00.000Z,4,4,,SD,CLOSE,Y,,NO,CHATHAM,,,,,,,,,,,,,,,,41,2023-04-26T15:50:00.000Z,2023-04-27T10:40:00.000Z,19.666666666666668,0.8194444444444444,No,No,No,No,No,Yes,No,No,5,1
2195,REMOVE VALVE,23-35218,FV-15501,FV-15501,,,3-7-23 6:50 AM,2023-03-07T06:50:00.000Z,12-27-23 12:53 PM,2023-12-27T12:53:00.000Z,4-28-23 6:27 AM,2023-04-28T06:27:00.000Z,4,4,,SD,CLOSE,Y,,NO,CHATHAM,,,,,,,,,,,,,,,,41,2023-04-26T15:50:00.000Z,2023-04-27T10:40:00.000Z,19.666666666666668,0.8194444444444444,No,No,No,No,No,Yes,No,No,5,1
1359,BUILD SCAFF FOR BLINDING/BLANKS,23-35239,C-1511,C-1511,,,3-7-23 1:03 PM,2023-03-07T13:03:00.000Z,4-15-23 8:00 AM,2023-04-15T08:00:00.000Z,4-27-23 10:01 AM,2023-04-27T10:01:00.000Z,4,4,,PM,CLOSE,Y,,NO,CHATHAM,,,,,,,,,,,,,,,,41,2023-04-26T15:50:00.000Z,2023-04-27T10:40:00.000Z,19.666666666666668,0.8194444444444444,Yes,No,No,No,No,No,No,No,1,1
1359,REMOVE SCAFF COLUMN ENTRY CONTRACTOR TO PERFORM INSPECTION,23-35240,C-1511,C-1511,,,3-7-23 1:04 PM,2023-03-07T13:04:00.000Z,4-15-23 8:00 AM,2023-04-15T08:00:00.000Z,4-27-23 10:01 AM,2023-04-27T10:01:00.000Z,4,4,,PM,CLOSE,Y,,NO,CHATHAM,,,,,,,,,,,,,,,,41,2023-04-26T15:50:00.000Z,2023-04-27T10:40:00.000Z,19.666666666666668,0.8194444444444444,Yes,No,No,No,No,No,No,No,1,1
1363,BUILD SCAFF FOR BLINDING ELE 117,23-35247,C-1571,C-1571,,,3-7-23 1:22 PM,2023-03-07T13:22:00.000Z,10-23-23 12:00 PM,2023-10-23T12:00:00.000Z,4-27-23 10:02 AM,2023-04-27T10:02:00.000Z,4,4,,PM,CLOSE,Y,,NO,CHATHAM,,,,,,,,,,,,,,,,41,2023-04-26T15:50:00.000Z,2023-04-27T10:40:00.000Z,19.666666666666668,0.8194444444444444,Yes,No,No,No,No,No,No,No,1,1
1363,REMOVE SCAFF FOR BLINDING,23-35248,C-1571,C-1571,,,3-7-23 1:22 PM,2023-03-07T13:22:00.000Z,10-23-23 12:00 PM,2023-10-23T12:00:00.000Z,4-27-23 10:02 AM,2023-04-27T10:02:00.000Z,4,4,,PM,CLOSE,Y,,NO,CHATHAM,,,,,,,,,,,,,,,,41,2023-04-26T15:50:00.000Z,2023-04-27T10:40:00.000Z,19.666666666666668,0.8194444444444444,Yes,No,No,No,No,No,No,No,1,1
1507,BUILD SCAFF FOR ISO & INSPECT,23-35251,E-1522,E-1522,,,3-7-23 2:24 PM,2023-03-07T14:24:00.000Z,4-30-22 1:03 PM,2022-04-30T13:03:00.000Z,4-27-23 10:08 AM,2023-04-27T10:08:00.000Z,4,4,,SD,CLOSE,Y,,NO,CHATHAM,,,,,,,,,,,,,,,,41,2023-04-26T15:50:00.000Z,2023-04-27T10:40:00.000Z,19.666666666666668,0.8194444444444444,Yes,No,No,No,No,No,No,No,1,1
1507,OPEN HEAD PLATES,23-35254,E-1522,E-1522,,,3-7-23 2:39 PM,2023-03-07T14:39:00.000Z,4-30-22 1:03 PM,2022-04-30T13:03:00.000Z,4-27-23 10:08 AM,2023-04-27T10:08:00.000Z,4,4,,SD,CLOSE,Y,,NO,CHATHAM,,,,,,,,,,,,,,,,41,2023-04-26T15:50:00.000Z,2023-04-27T10:40:00.000Z,19.666666666666668,0.8194444444444444,Yes,No,No,No,No,No,No,No,1,1
1507,HPW TUBES,23-35255,E-1522,E-1522,,,3-7-23 2:40 PM,2023-03-07T14:40:00.000Z,4-30-22 1:03 PM,2022-04-30T13:03:00.000Z,4-27-23 10:08 AM,2023-04-27T10:08:00.000Z,4,4,,SD,CLOSE,Y,,NO,CHATHAM,,,,,,,,,,,,,,,,41,2023-04-26T15:50:00.000Z,2023-04-27T10:40:00.000Z,19.666666666666668,0.8194444444444444,Yes,No,No,No,No,No,No,No,1,1
1507,REMOVE SCAFF,23-35258,E-1522,E-1522,,,3-7-23 2:41 PM,2023-03-07T14:41:00.000Z,4-30-22 1:03 PM,2022-04-30T13:03:00.000Z,4-27-23 10:08 AM,2023-04-27T10:08:00.000Z,4,4,,SD,CLOSE,Y,,NO,CHATHAM,,,,,,,,,,,,,,,,41,2023-04-26T15:50:00.000Z,2023-04-27T10:40:00.000Z,19.666666666666668,0.8194444444444444,Yes,No,No,No,No,No,No,No,1,1
1507,INSPECT SHELL/TUBES AS PER PLAN,23-35256,E-1522,E-1522,,,3-7-23 2:41 PM,2023-03-07T14:41:00.000Z,4-30-22 1:03 PM,2022-04-30T13:03:00.000Z,4-27-23 10:08 AM,2023-04-27T10:08:00.000Z,4,4,,SD,CLOSE,Y,,NO,CHATHAM,,,,,,,,,,,,,,,,41,2023-04-26T15:50:00.000Z,2023-04-27T10:40:00.000Z,19.666666666666668,0.8194444444444444,Yes,No,No,No,No,No,No,No,1,1
1507,CLOSE HEAD PLATES,23-35257,E-1522,E-1522,,,3-7-23 2:41 PM,2023-03-07T14:41:00.000Z,4-30-22 1:03 PM,2022-04-30T13:03:00.000Z,4-27-23 10:08 AM,2023-04-27T10:08:00.000Z,4,4,,SD,CLOSE,Y,,NO,CHATHAM,,,,,,,,,,,,,,,,41,2023-04-26T15:50:00.000Z,2023-04-27T10:40:00.000Z,19.666666666666668,0.8194444444444444,Yes,No,No,No,No,No,No,No,1,1
1363,BUILD SCAFF FOR ELEV 112,23-35260,C-1571,C-1571,,,3-7-23 2:50 PM,2023-03-07T14:50:00.000Z,10-23-23 12:00 PM,2023-10-23T12:00:00.000Z,4-27-23 10:02 AM,2023-04-27T10:02:00.000Z,4,4,,PM,CLOSE,Y,,NO,CHATHAM,,,,,,,,,,,,,,,,41,2023-04-26T15:50:00.000Z,2023-04-27T10:40:00.000Z,19.666666666666668,0.8194444444444444,Yes,No,No,No,No,No,No,No,1,1
1363,BUILD SCAFF AT GRADE,23-35261,C-1571,C-1571,,,3-7-23 2:52 PM,2023-03-07T14:52:00.000Z,10-23-23 12:00 PM,2023-10-23T12:00:00.000Z,4-27-23 10:02 AM,2023-04-27T10:02:00.000Z,4,4,,PM,CLOSE,Y,,NO,CHATHAM,,,,,,,,,,,,,,,,41,2023-04-26T15:50:00.000Z,2023-04-27T10:40:00.000Z,19.666666666666668,0.8194444444444444,Yes,No,No,No,No,No,No,No,1,1
1518,BUILD SCAFF TO ACCESS VALVES,23-35262,E-1575,E-1575,,,3-7-23 2:57 PM,2023-03-07T14:57:00.000Z,4-23-23 1:04 PM,2023-04-23T13:04:00.000Z,4-28-23 6:27 AM,2023-04-28T06:27:00.000Z,4,4,,SD,CLOSE,Y,,NO,CHATHAM,,,,,,,,,,,,,,,,41,2023-04-26T15:50:00.000Z,2023-04-27T10:40:00.000Z,19.666666666666668,0.8194444444444444,No,No,No,No,No,Yes,No,No,5,1
1518,REMOVE OLD VALVE,23-35263,E-1575,E-1575,,,3-7-23 2:59 PM,2023-03-07T14:59:00.000Z,4-23-23 1:04 PM,2023-04-23T13:04:00.000Z,4-28-23 6:27 AM,2023-04-28T06:27:00.000Z,4,4,,SD,CLOSE,Y,,NO,CHATHAM,,,,,,,,,,,,,,,,41,2023-04-26T15:50:00.000Z,2023-04-27T10:40:00.000Z,19.666666666666668,0.8194444444444444,No,No,No,No,No,Yes,No,No,5,1
1518,INSTALL NEW VALVES,23-35264,E-1575,E-1575,,,3-7-23 3:00 PM,2023-03-07T15:00:00.000Z,4-23-23 1:04 PM,2023-04-23T13:04:00.000Z,4-28-23 6:27 AM,2023-04-28T06:27:00.000Z,4,4,,SD,CLOSE,Y,,NO,CHATHAM,,,,,,,,,,,,,,,,41,2023-04-26T15:50:00.000Z,2023-04-27T10:40:00.000Z,19.666666666666668,0.8194444444444444,No,No,No,No,No,Yes,No,No,5,1
1518,REMOVE SCAFF,23-35265,E-1575,E-1575,,,3-7-23 3:00 PM,2023-03-07T15:00:00.000Z,4-23-23 1:04 PM,2023-04-23T13:04:00.000Z,4-28-23 6:27 AM,2023-04-28T06:27:00.000Z,4,4,,SD,CLOSE,Y,,NO,CHATHAM,,,,,,,,,,,,,,,,41,2023-04-26T15:50:00.000Z,2023-04-27T10:40:00.000Z,19.666666666666668,0.8194444444444444,No,No,No,No,No,Yes,No,No,5,1
1501,REMOVE INSULATION,23-35289,E-1509,E-1509,,,3-8-23 8:10 AM,2023-03-08T08:10:00.000Z,11-1-23 12:43 PM,2023-11-01T12:43:00.000Z,4-28-23 6:28 AM,2023-04-28T06:28:00.000Z,4,4,,SD,CLOSE,Y,,NO,CHATHAM,,,,,,,,,,,,,,,,41,2023-04-26T15:50:00.000Z,2023-04-27T10:40:00.000Z,19.666666666666668,0.8194444444444444,No,No,No,No,No,Yes,No,No,5,1
1501,INSTALL NEW VALVE,23-35291,E-1509,E-1509,,,3-8-23 8:11 AM,2023-03-08T08:11:00.000Z,11-1-23 12:43 PM,2023-11-01T12:43:00.000Z,4-28-23 6:28 AM,2023-04-28T06:28:00.000Z,4,4,,SD,CLOSE,Y,,NO,CHATHAM,,,,,,,,,,,,,,,,41,2023-04-26T15:50:00.000Z,2023-04-27T10:40:00.000Z,19.666666666666668,0.8194444444444444,No,No,No,No,No,Yes,No,No,5,1
1501,REMOVE OLD VALVE,23-35290,E-1509,E-1509,,,3-8-23 8:11 AM,2023-03-08T08:11:00.000Z,11-1-23 12:43 PM,2023-11-01T12:43:00.000Z,4-28-23 6:28 AM,2023-04-28T06:28:00.000Z,4,4,,SD,CLOSE,Y,,NO,CHATHAM,,,,,,,,,,,,,,,,41,2023-04-26T15:50:00.000Z,2023-04-27T10:40:00.000Z,19.666666666666668,0.8194444444444444,No,No,No,No,No,Yes,No,No,5,1
1501,RE-INSTALL INSULATION,23-35292,E-1509,E-1509,,,3-8-23 8:12 AM,2023-03-08T08:12:00.000Z,11-1-23 12:43 PM,2023-11-01T12:43:00.000Z,4-28-23 6:28 AM,2023-04-28T06:28:00.000Z,4,4,,SD,CLOSE,Y,,NO,CHATHAM,,,,,,,,,,,,,,,,41,2023-04-26T15:50:00.000Z,2023-04-27T10:40:00.000Z,19.666666666666668,0.8194444444444444,No,No,No,No,No,Yes,No,No,5,1
,TA23-Operations - Distillation Prep Work,23-35301,1500,1500,,,3-8-23 10:15 AM,2023-03-08T10:15:00.000Z,5-1-23 10:15 AM,2023-05-01T10:15:00.000Z,4-27-23 9:58 AM,2023-04-27T09:58:00.000Z,4,4,,SD,CLOSE,Y,,NO,CHATHAM,,,,,,,,,,,,,,,,41,2023-04-26T15:50:00.000Z,2023-04-27T10:40:00.000Z,19.666666666666668,0.8194444444444444,Yes,No,No,No,No,No,No,No,1,1
3714,REMOVE PUMP/MOVE TO SHOP,23-35908,P-2407A,P-2407A,,,3-15-23 9:09 AM,2023-03-15T09:09:00.000Z,4-29-23 12:00 AM,2023-04-29T00:00:00.000Z,4-27-23 10:05 AM,2023-04-27T10:05:00.000Z,4,4,,SD,CLOSE,Y,,NO,CHATHAM,,,,,,,,,,,,,,,,41,2023-04-26T15:50:00.000Z,2023-04-27T10:40:00.000Z,19.666666666666668,0.8194444444444444,Yes,No,No,No,No,No,No,No,1,1
3714,RE-INSTALL PUMP,23-35909,P-2407A,P-2407A,,,3-15-23 9:09 AM,2023-03-15T09:09:00.000Z,4-29-23 12:00 AM,2023-04-29T00:00:00.000Z,4-27-23 10:05 AM,2023-04-27T10:05:00.000Z,4,4,,SD,CLOSE,Y,,NO,CHATHAM,,,,,,,,,,,,,,,,41,2023-04-26T15:50:00.000Z,2023-04-27T10:40:00.000Z,19.666666666666668,0.8194444444444444,Yes,No,No,No,No,No,No,No,1,1
,REPLACE O/H DOOR LIMIT SWITCH,23-35961,XV-18176B,XV-18176B,,,3-16-23 10:03 AM,2023-03-16T10:03:00.000Z,2-23-23 3:55 PM,2023-02-23T15:55:00.000Z,4-28-23 7:20 AM,2023-04-28T07:20:00.000Z,4,4,,CO,CLOSE,Y,,NO,CHATHAM,,,,,,,,,,,,,,,,41,2023-04-26T15:50:00.000Z,2023-04-27T10:40:00.000Z,19.666666666666668,0.8194444444444444,No,No,No,No,No,Yes,No,No,5,1
1575,"REMOVE OLD 4\" BUTTERFLY VALVE",23-36285,E-6563,E-6563,,,3-21-23 9:32 AM,2023-03-21T09:32:00.000Z,4-21-23 1:13 PM,2023-04-21T13:13:00.000Z,4-28-23 6:26 AM,2023-04-28T06:26:00.000Z,4,4,,SD,CLOSE,Y,,NO,CHATHAM,,,,,,,,,,,,,,,,41,2023-04-26T15:50:00.000Z,2023-04-27T10:40:00.000Z,19.666666666666668,0.8194444444444444,No,No,No,No,No,Yes,No,No,5,1
,1300 Area Exchanger Cooling Water Bypass Valves,23-36531,1300,1300,,,3-27-23 1:47 AM,2023-03-27T01:47:00.000Z,4-21-23 12:00 AM,2023-04-21T00:00:00.000Z,4-26-23 3:49 PM,2023-04-26T15:49:00.000Z,4,4,,PM,CLOSE,Y,N,NO,CHATHAM,,,,,,,,,,,,,,,,41,2023-04-26T15:50:00.000Z,2023-04-27T10:40:00.000Z,19.666666666666668,0.8194444444444444,No,No,No,No,No,No,No,Yes,3,1
,Distallation Bypass Valves,23-36536,1500,1500,,,3-27-23 1:47 AM,2023-03-27T01:47:00.000Z,4-21-23 12:00 AM,2023-04-21T00:00:00.000Z,4-26-23 3:50 PM,2023-04-26T15:50:00.000Z,4,4,,PM,CLOSE,Y,,NO,CHATHAM,,,,,,,,,,,,,,,,41,2023-04-26T15:50:00.000Z,2023-04-27T10:40:00.000Z,19.666666666666668,0.8194444444444444,Yes,No,No,No,No,No,No,No,1,1
,Mashing / Fermentation  Bypass Valves,23-36532,1300,1300,,,3-27-23 1:47 AM,2023-03-27T01:47:00.000Z,4-21-23 12:00 AM,2023-04-21T00:00:00.000Z,4-26-23 3:49 PM,2023-04-26T15:49:00.000Z,4,4,,PM,CLOSE,Y,,NO,CHATHAM,,,,,,,,,,,,,,,,41,2023-04-26T15:50:00.000Z,2023-04-27T10:40:00.000Z,19.666666666666668,0.8194444444444444,No,No,No,No,No,No,No,Yes,3,1
,1500 Area Exchanger Cooling Water Bypass Valves,23-36535,1500,1500,,,3-27-23 1:47 AM,2023-03-27T01:47:00.000Z,4-21-23 12:00 AM,2023-04-21T00:00:00.000Z,4-26-23 3:50 PM,2023-04-26T15:50:00.000Z,4,4,,PM,CLOSE,Y,N,NO,CHATHAM,,,,,,,,,,,,,,,,41,2023-04-26T15:50:00.000Z,2023-04-27T10:40:00.000Z,19.666666666666668,0.8194444444444444,Yes,No,No,No,No,No,No,No,1,1
,1400 Area Exchanger Cooling Water Bypass Valves,23-36533,1400,1400,,,3-27-23 1:47 AM,2023-03-27T01:47:00.000Z,4-21-23 12:00 AM,2023-04-21T00:00:00.000Z,4-26-23 3:49 PM,2023-04-26T15:49:00.000Z,4,4,,PM,CLOSE,Y,N,NO,CHATHAM,,,,,,,,,,,,,,,,41,2023-04-26T15:50:00.000Z,2023-04-27T10:40:00.000Z,19.666666666666668,0.8194444444444444,No,No,No,No,No,No,No,Yes,3,1
,Mashing / Fermentation Bypass Valves,23-36534,1400,1400,,,3-27-23 1:47 AM,2023-03-27T01:47:00.000Z,4-21-23 12:00 AM,2023-04-21T00:00:00.000Z,4-26-23 3:49 PM,2023-04-26T15:49:00.000Z,4,4,,PM,CLOSE,Y,,NO,CHATHAM,,,,,,,,,,,,,,,,41,2023-04-26T15:50:00.000Z,2023-04-27T10:40:00.000Z,19.666666666666668,0.8194444444444444,No,No,No,No,No,No,No,Yes,3,1
,"Area Asset Checks-2100, 1200, 1300, 1400 (Corn, Mill, Mash, Fermentation)",23-36599,2100,2100,,,3-27-23 1:49 AM,2023-03-27T01:49:00.000Z,4-24-23 12:00 AM,2023-04-24T00:00:00.000Z,4-27-23 11:15 AM,2023-04-27T11:15:00.000Z,4,4,,PM,CLOSE,Y,N,NO,CHATHAM,,,,,,,,,,,,,,,,41,2023-04-26T15:50:00.000Z,2023-04-27T10:40:00.000Z,19.666666666666668,0.8194444444444444,No,No,No,No,No,Yes,Yes,No,5,1
,"Area Asset Checks-1500, 6500 (Distillation)",23-36602,1500,1500,,,3-27-23 1:49 AM,2023-03-27T01:49:00.000Z,4-24-23 12:00 AM,2023-04-24T00:00:00.000Z,4-27-23 11:17 AM,2023-04-27T11:17:00.000Z,4,4,,PM,CLOSE,Y,,NO,CHATHAM,,,,,,,,,,,,,,,,41,2023-04-26T15:50:00.000Z,2023-04-27T10:40:00.000Z,19.666666666666668,0.8194444444444444,No,No,No,No,No,Yes,Yes,No,5,1
,"Area Asset Checks-1830, 1840, DDG Cooler",23-36608,1800,1800,,,3-27-23 1:49 AM,2023-03-27T01:49:00.000Z,4-24-23 12:00 AM,2023-04-24T00:00:00.000Z,4-27-23 11:17 AM,2023-04-27T11:17:00.000Z,4,4,,PM,CLOSE,Y,,NO,CHATHAM,,,,,,,,,,,,,,,,41,2023-04-26T15:50:00.000Z,2023-04-27T10:40:00.000Z,19.666666666666668,0.8194444444444444,No,No,No,No,No,Yes,Yes,No,5,1
,"Area Asset Checks-1600, 1660, 1700 (Evaps, Corn oil, Decanyers)",23-36604,1600,1600,,,3-27-23 1:49 AM,2023-03-27T01:49:00.000Z,4-24-23 12:00 AM,2023-04-24T00:00:00.000Z,4-27-23 11:17 AM,2023-04-27T11:17:00.000Z,4,4,,PM,CLOSE,Y,,NO,CHATHAM,,,,,,,,,,,,,,,,41,2023-04-26T15:50:00.000Z,2023-04-27T10:40:00.000Z,19.666666666666668,0.8194444444444444,No,No,No,No,No,Yes,Yes,No,5,1
,"Area Asset Checks-2200, 2300, 3200, 3600, 4100",23-36605,2200,2200,,,3-27-23 1:49 AM,2023-03-27T01:49:00.000Z,4-24-23 12:00 AM,2023-04-24T00:00:00.000Z,4-27-23 11:17 AM,2023-04-27T11:17:00.000Z,4,4,,PM,CLOSE,Y,N,NO,CHATHAM,,,,,,,,,,,,,,,,41,2023-04-26T15:50:00.000Z,2023-04-27T10:40:00.000Z,19.666666666666668,0.8194444444444444,No,No,No,No,No,Yes,Yes,No,5,1
,"Area Asset Checks-2200, 2300, 3200, 3600, 4100",23-36616,2200,2200,,,3-27-23 1:49 AM,2023-03-27T01:49:00.000Z,4-24-23 12:00 AM,2023-04-24T00:00:00.000Z,4-27-23 11:16 AM,2023-04-27T11:16:00.000Z,4,4,,PM,CLOSE,Y,,NO,CHATHAM,,,,,,,,,,,,,,,,41,2023-04-26T15:50:00.000Z,2023-04-27T10:40:00.000Z,19.666666666666668,0.8194444444444444,No,No,No,No,No,Yes,Yes,No,5,1
,"Area Asset Checks-1830, 1840, DDG Cooler",23-36617,1800,1800,,,3-27-23 1:49 AM,2023-03-27T01:49:00.000Z,4-24-23 12:00 AM,2023-04-24T00:00:00.000Z,4-27-23 11:16 AM,2023-04-27T11:16:00.000Z,4,4,,PM,CLOSE,Y,N,NO,CHATHAM,,,,,,,,,,,,,,,,41,2023-04-26T15:50:00.000Z,2023-04-27T10:40:00.000Z,19.666666666666668,0.8194444444444444,No,No,No,No,No,Yes,Yes,No,5,1
1293,BL-1804D - WEEKLY BEARING GREASING,23-36597,BL-1804D,BL-1804D,,,3-27-23 1:49 AM,2023-03-27T01:49:00.000Z,4-24-23 12:00 AM,2023-04-24T00:00:00.000Z,4-27-23 11:14 AM,2023-04-27T11:14:00.000Z,4,4,,PM,CLOSE,Y,N,NO,CHATHAM,"1293, 6864","BLOWER, NYB, MODEL 714 SERIES 45, GENERAL INDUSTRIAL, CW/UB, Arrg't 8, MOTOR / 450HP / 1200RPM / TEFC / 2300V/3PH/60HZ / FR# 5808C",,No,DRYER D,CH-DRYER_D_BLR,CH-DRYER_D_BLR:BL1804D.STAIND,BL-1804D,BL,STAIND,"Status indication (open/closed, run/stop)",Blower (asset),Equipment status,CYCLONE INLET PRESSURE,,41,2023-04-26T15:50:00.000Z,2023-04-27T10:40:00.000Z,19.666666666666668,0.8194444444444444,No,No,No,No,No,Yes,Yes,No,5,1
,"Area Asset Checks-2100, 1200, 1300, 1400 (Corn, Mill, Mash, Fermentation)",23-36600,2100,2100,,,3-27-23 1:49 AM,2023-03-27T01:49:00.000Z,4-24-23 5:00 AM,2023-04-24T05:00:00.000Z,4-27-23 11:15 AM,2023-04-27T11:15:00.000Z,4,4,,PM,CLOSE,Y,,NO,CHATHAM,,,,,,,,,,,,,,,,41,2023-04-26T15:50:00.000Z,2023-04-27T10:40:00.000Z,19.666666666666668,0.8194444444444444,No,No,No,No,No,Yes,Yes,No,5,1
,"Area Asset Checks-1600, 1660, 1700",23-36603,1600,1600,,,3-27-23 1:49 AM,2023-03-27T01:49:00.000Z,4-24-23 12:00 AM,2023-04-24T00:00:00.000Z,4-27-23 11:17 AM,2023-04-27T11:17:00.000Z,4,4,,PM,CLOSE,Y,N,NO,CHATHAM,,,,,,,,,,,,,,,,41,2023-04-26T15:50:00.000Z,2023-04-27T10:40:00.000Z,19.666666666666668,0.8194444444444444,No,No,No,No,No,Yes,Yes,No,5,1
,"Area Asset Checks-2200, 2300, 3200, 3600, 4100",23-36606,2200,2200,,,3-27-23 1:49 AM,2023-03-27T01:49:00.000Z,4-24-23 12:00 AM,2023-04-24T00:00:00.000Z,4-27-23 11:17 AM,2023-04-27T11:17:00.000Z,4,4,,PM,CLOSE,Y,,NO,CHATHAM,,,,,,,,,,,,,,,,41,2023-04-26T15:50:00.000Z,2023-04-27T10:40:00.000Z,19.666666666666668,0.8194444444444444,No,No,No,No,No,Yes,Yes,No,5,1
,"Area Asset Checks-2100, 1200, 1300, 1400 (Corn, Mill, Mash, Fermentation)",23-36609,2100,2100,,,3-27-23 1:49 AM,2023-03-27T01:49:00.000Z,4-24-23 12:00 AM,2023-04-24T00:00:00.000Z,4-27-23 11:16 AM,2023-04-27T11:16:00.000Z,4,4,,PM,CLOSE,Y,N,NO,CHATHAM,,,,,,,,,,,,,,,,41,2023-04-26T15:50:00.000Z,2023-04-27T10:40:00.000Z,19.666666666666668,0.8194444444444444,No,No,No,No,No,Yes,Yes,No,5,1
,"Area Asset Checks-1500, 6500 (Distillation)",23-36612,1500,1500,,,3-27-23 1:49 AM,2023-03-27T01:49:00.000Z,4-24-23 12:00 AM,2023-04-24T00:00:00.000Z,4-27-23 11:16 AM,2023-04-27T11:16:00.000Z,4,4,,PM,CLOSE,Y,,NO,CHATHAM,,,,,,,,,,,,,,,,41,2023-04-26T15:50:00.000Z,2023-04-27T10:40:00.000Z,19.666666666666668,0.8194444444444444,No,No,No,No,No,Yes,Yes,No,5,1
,"Area Asset Checks-1600, 1660, 1700 (Evaps, Corn oil, Decanyers)",23-36614,1600,1600,,,3-27-23 1:49 AM,2023-03-27T01:49:00.000Z,4-24-23 12:00 AM,2023-04-24T00:00:00.000Z,4-27-23 11:16 AM,2023-04-27T11:16:00.000Z,4,4,,PM,CLOSE,Y,,NO,CHATHAM,,,,,,,,,,,,,,,,41,2023-04-26T15:50:00.000Z,2023-04-27T10:40:00.000Z,19.666666666666668,0.8194444444444444,No,No,No,No,No,Yes,Yes,No,5,1
,"Area Asset Checks-2200, 2300, 3200, 3600, 4100",23-36615,2200,2200,,,3-27-23 1:49 AM,2023-03-27T01:49:00.000Z,4-24-23 12:00 AM,2023-04-24T00:00:00.000Z,4-27-23 11:16 AM,2023-04-27T11:16:00.000Z,4,4,,PM,CLOSE,Y,N,NO,CHATHAM,,,,,,,,,,,,,,,,41,2023-04-26T15:50:00.000Z,2023-04-27T10:40:00.000Z,19.666666666666668,0.8194444444444444,No,No,No,No,No,Yes,Yes,No,5,1
1293,BL-1804D WEEKLY GREASING,23-36598,BL-1804D,BL-1804D,,,3-27-23 1:49 AM,2023-03-27T01:49:00.000Z,4-24-23 12:00 AM,2023-04-24T00:00:00.000Z,4-27-23 11:14 AM,2023-04-27T11:14:00.000Z,4,4,,PM,CLOSE,Y,,NO,CHATHAM,"1293, 6864","BLOWER, NYB, MODEL 714 SERIES 45, GENERAL INDUSTRIAL, CW/UB, Arrg't 8, MOTOR / 450HP / 1200RPM / TEFC / 2300V/3PH/60HZ / FR# 5808C",,No,DRYER D,CH-DRYER_D_BLR,CH-DRYER_D_BLR:BL1804D.STAIND,BL-1804D,BL,STAIND,"Status indication (open/closed, run/stop)",Blower (asset),Equipment status,CYCLONE INLET PRESSURE,,41,2023-04-26T15:50:00.000Z,2023-04-27T10:40:00.000Z,19.666666666666668,0.8194444444444444,No,No,No,No,No,Yes,Yes,No,5,1
,"Area Asset Checks-1500, 6500",23-36601,1500,1500,,,3-27-23 1:49 AM,2023-03-27T01:49:00.000Z,4-24-23 12:00 AM,2023-04-24T00:00:00.000Z,4-27-23 11:17 AM,2023-04-27T11:17:00.000Z,4,4,,PM,CLOSE,Y,N,NO,CHATHAM,,,,,,,,,,,,,,,,41,2023-04-26T15:50:00.000Z,2023-04-27T10:40:00.000Z,19.666666666666668,0.8194444444444444,No,No,No,No,No,Yes,Yes,No,5,1
,"Area Asset Checks-1830, 1840, DDG Cooler",23-36607,1800,1800,,,3-27-23 1:49 AM,2023-03-27T01:49:00.000Z,4-24-23 12:00 AM,2023-04-24T00:00:00.000Z,4-27-23 11:17 AM,2023-04-27T11:17:00.000Z,4,4,,PM,CLOSE,Y,N,NO,CHATHAM,,,,,,,,,,,,,,,,41,2023-04-26T15:50:00.000Z,2023-04-27T10:40:00.000Z,19.666666666666668,0.8194444444444444,No,No,No,No,No,Yes,Yes,No,5,1
,"Area Asset Checks-2100, 1200, 1300, 1400 (Corn, Mill, Mash, Fermentation)",23-36610,2100,2100,,,3-27-23 1:49 AM,2023-03-27T01:49:00.000Z,4-24-23 2:30 AM,2023-04-24T02:30:00.000Z,4-27-23 11:16 AM,2023-04-27T11:16:00.000Z,4,4,,PM,CLOSE,Y,,NO,CHATHAM,,,,,,,,,,,,,,,,41,2023-04-26T15:50:00.000Z,2023-04-27T10:40:00.000Z,19.666666666666668,0.8194444444444444,No,No,No,No,No,Yes,Yes,No,5,1
,"Area Asset Checks-1500, 6500",23-36611,1500,1500,,,3-27-23 1:49 AM,2023-03-27T01:49:00.000Z,4-24-23 12:00 AM,2023-04-24T00:00:00.000Z,4-27-23 11:16 AM,2023-04-27T11:16:00.000Z,4,4,,PM,CLOSE,Y,N,NO,CHATHAM,,,,,,,,,,,,,,,,41,2023-04-26T15:50:00.000Z,2023-04-27T10:40:00.000Z,19.666666666666668,0.8194444444444444,No,No,No,No,No,Yes,Yes,No,5,1
,"Area Asset Checks-1600, 1660, 1700",23-36613,1600,1600,,,3-27-23 1:49 AM,2023-03-27T01:49:00.000Z,4-24-23 12:00 AM,2023-04-24T00:00:00.000Z,4-27-23 11:16 AM,2023-04-27T11:16:00.000Z,4,4,,PM,CLOSE,Y,N,NO,CHATHAM,,,,,,,,,,,,,,,,41,2023-04-26T15:50:00.000Z,2023-04-27T10:40:00.000Z,19.666666666666668,0.8194444444444444,No,No,No,No,No,Yes,Yes,No,5,1
,"Area Asset Checks-1830, 1840, DDG Cooler",23-36618,1800,1800,,,3-27-23 1:49 AM,2023-03-27T01:49:00.000Z,4-24-23 12:00 AM,2023-04-24T00:00:00.000Z,4-27-23 11:16 AM,2023-04-27T11:16:00.000Z,4,4,,PM,CLOSE,Y,,NO,CHATHAM,,,,,,,,,,,,,,,,41,2023-04-26T15:50:00.000Z,2023-04-27T10:40:00.000Z,19.666666666666668,0.8194444444444444,No,No,No,No,No,Yes,Yes,No,5,1
,BUILD SCAFF TO ACCESS VALVE,23-36766,1900,1900,,,3-28-23 12:27 PM,2023-03-28T12:27:00.000Z,4-24-23 9:58 PM,2023-04-24T21:58:00.000Z,4-28-23 6:15 AM,2023-04-28T06:15:00.000Z,4,4,,SD,CLOSE,Y,,NO,CHATHAM,,,,,,,,,,,,,,,,41,2023-04-26T15:50:00.000Z,2023-04-27T10:40:00.000Z,19.666666666666668,0.8194444444444444,No,No,No,No,No,Yes,No,No,5,1
,REMOVE INSUALTION BLANKET,23-36768,1900,1900,,,3-28-23 12:28 PM,2023-03-28T12:28:00.000Z,4-24-23 9:58 PM,2023-04-24T21:58:00.000Z,4-28-23 6:15 AM,2023-04-28T06:15:00.000Z,4,4,,SD,CLOSE,Y,,NO,CHATHAM,,,,,,,,,,,,,,,,41,2023-04-26T15:50:00.000Z,2023-04-27T10:40:00.000Z,19.666666666666668,0.8194444444444444,No,No,No,No,No,Yes,No,No,5,1
,REMOVE OLD VALVE,23-36767,1900,1900,,,3-28-23 12:28 PM,2023-03-28T12:28:00.000Z,4-24-23 9:58 PM,2023-04-24T21:58:00.000Z,4-28-23 6:15 AM,2023-04-28T06:15:00.000Z,4,4,,SD,CLOSE,Y,,NO,CHATHAM,,,,,,,,,,,,,,,,41,2023-04-26T15:50:00.000Z,2023-04-27T10:40:00.000Z,19.666666666666668,0.8194444444444444,No,No,No,No,No,Yes,No,No,5,1
,INSTALL NEW VALVE,23-36769,1900,1900,,,3-28-23 12:29 PM,2023-03-28T12:29:00.000Z,4-24-23 9:58 PM,2023-04-24T21:58:00.000Z,4-28-23 6:15 AM,2023-04-28T06:15:00.000Z,4,4,,SD,CLOSE,Y,,NO,CHATHAM,,,,,,,,,,,,,,,,41,2023-04-26T15:50:00.000Z,2023-04-27T10:40:00.000Z,19.666666666666668,0.8194444444444444,No,No,No,No,No,Yes,No,No,5,1
,REMOVE SCAFF,23-36771,1900,1900,,,3-28-23 12:29 PM,2023-03-28T12:29:00.000Z,4-24-23 9:58 PM,2023-04-24T21:58:00.000Z,4-28-23 6:15 AM,2023-04-28T06:15:00.000Z,4,4,,SD,CLOSE,Y,,NO,CHATHAM,,,,,,,,,,,,,,,,41,2023-04-26T15:50:00.000Z,2023-04-27T10:40:00.000Z,19.666666666666668,0.8194444444444444,No,No,No,No,No,Yes,No,No,5,1
,RE-INSTALL INSULATION,23-36770,1900,1900,,,3-28-23 12:29 PM,2023-03-28T12:29:00.000Z,4-24-23 9:58 PM,2023-04-24T21:58:00.000Z,4-28-23 6:15 AM,2023-04-28T06:15:00.000Z,4,4,,SD,CLOSE,Y,,NO,CHATHAM,,,,,,,,,,,,,,,,41,2023-04-26T15:50:00.000Z,2023-04-27T10:40:00.000Z,19.666666666666668,0.8194444444444444,No,No,No,No,No,Yes,No,No,5,1
1575,"INSTALL NEW 4\" BUTTERFLY VALVE",23-36785,E-6563,E-6563,,,3-29-23 7:53 AM,2023-03-29T07:53:00.000Z,4-21-23 1:13 PM,2023-04-21T13:13:00.000Z,4-28-23 6:26 AM,2023-04-28T06:26:00.000Z,4,4,,SD,CLOSE,Y,,NO,CHATHAM,,,,,,,,,,,,,,,,41,2023-04-26T15:50:00.000Z,2023-04-27T10:40:00.000Z,19.666666666666668,0.8194444444444444,No,No,No,No,No,Yes,No,No,5,1
1087,INSTALL NEW VALVE,23-37128,P-1560B,P-1560B,,,4-3-23 11:28 AM,2023-04-03T11:28:00.000Z,4-24-23 12:05 PM,2023-04-24T12:05:00.000Z,4-27-23 10:11 AM,2023-04-27T10:11:00.000Z,4,4,,SD,CLOSE,Y,,NO,CHATHAM,,,,,,,,,,,,,,,,41,2023-04-26T15:50:00.000Z,2023-04-27T10:40:00.000Z,19.666666666666668,0.8194444444444444,Yes,No,No,No,No,No,No,No,1,1
1087,REMOVE OLD VALVE,23-37127,P-1560B,P-1560B,,,4-3-23 11:28 AM,2023-04-03T11:28:00.000Z,4-24-23 12:05 PM,2023-04-24T12:05:00.000Z,4-27-23 10:11 AM,2023-04-27T10:11:00.000Z,4,4,,SD,CLOSE,Y,,NO,CHATHAM,,,,,,,,,,,,,,,,41,2023-04-26T15:50:00.000Z,2023-04-27T10:40:00.000Z,19.666666666666668,0.8194444444444444,Yes,No,No,No,No,No,No,No,1,1
1069,,23-37129,P-1511B,P-1511B,,,4-3-23 11:55 AM,2023-04-03T11:55:00.000Z,4-30-23 6:35 AM,2023-04-30T06:35:00.000Z,4-27-23 10:10 AM,2023-04-27T10:10:00.000Z,4,4,,SD,CLOSE,Y,,NO,CHATHAM,,,,,,,,,,,,,,,,41,2023-04-26T15:50:00.000Z,2023-04-27T10:40:00.000Z,19.666666666666668,0.8194444444444444,Yes,No,No,No,No,No,No,No,1,1
1575,MEASURE AND RECORD EXCH DIMENSIONS,23-37169,E-6563,E-6563,,,4-4-23 2:35 PM,2023-04-04T14:35:00.000Z,4-21-23 9:06 AM,2023-04-21T09:06:00.000Z,4-28-23 6:25 AM,2023-04-28T06:25:00.000Z,4,4,,SD,CLOSE,Y,,NO,CHATHAM,,,,,,,,,,,,,,,,41,2023-04-26T15:50:00.000Z,2023-04-27T10:40:00.000Z,19.666666666666668,0.8194444444444444,No,No,No,No,No,Yes,No,No,5,1
1575,COUNT PLATES / REMOVE PLATES,23-37171,E-6563,E-6563,,,4-4-23 2:36 PM,2023-04-04T14:36:00.000Z,4-21-23 9:06 AM,2023-04-21T09:06:00.000Z,4-28-23 6:25 AM,2023-04-28T06:25:00.000Z,4,4,,SD,CLOSE,Y,,NO,CHATHAM,,,,,,,,,,,,,,,,41,2023-04-26T15:50:00.000Z,2023-04-27T10:40:00.000Z,19.666666666666668,0.8194444444444444,No,No,No,No,No,Yes,No,No,5,1
1575,LOOSEN RODS/ EXPAND EXCHANGER,23-37170,E-6563,E-6563,,,4-4-23 2:36 PM,2023-04-04T14:36:00.000Z,4-21-23 9:06 AM,2023-04-21T09:06:00.000Z,4-28-23 6:25 AM,2023-04-28T06:25:00.000Z,4,4,,SD,CLOSE,Y,,NO,CHATHAM,,,,,,,,,,,,,,,,41,2023-04-26T15:50:00.000Z,2023-04-27T10:40:00.000Z,19.666666666666668,0.8194444444444444,No,No,No,No,No,Yes,No,No,5,1
1575,INSTALL NEW PLATES,23-37172,E-6563,E-6563,,,4-4-23 2:37 PM,2023-04-04T14:37:00.000Z,4-21-23 9:06 AM,2023-04-21T09:06:00.000Z,4-28-23 6:25 AM,2023-04-28T06:25:00.000Z,4,4,,SD,CLOSE,Y,,NO,CHATHAM,,,,,,,,,,,,,,,,41,2023-04-26T15:50:00.000Z,2023-04-27T10:40:00.000Z,19.666666666666668,0.8194444444444444,No,No,No,No,No,Yes,No,No,5,1
1575,TIGHTEN EXCH TO SPECS,23-37173,E-6563,E-6563,,,4-4-23 2:38 PM,2023-04-04T14:38:00.000Z,4-21-23 9:06 AM,2023-04-21T09:06:00.000Z,4-28-23 6:25 AM,2023-04-28T06:25:00.000Z,4,4,,SD,CLOSE,Y,,NO,CHATHAM,,,,,,,,,,,,,,,,41,2023-04-26T15:50:00.000Z,2023-04-27T10:40:00.000Z,19.666666666666668,0.8194444444444444,No,No,No,No,No,Yes,No,No,5,1
1575,PUT USED PLATES IN CRATE,23-37174,E-6563,E-6563,,,4-4-23 2:38 PM,2023-04-04T14:38:00.000Z,4-21-23 9:06 AM,2023-04-21T09:06:00.000Z,4-28-23 6:25 AM,2023-04-28T06:25:00.000Z,4,4,,SD,CLOSE,Y,,NO,CHATHAM,,,,,,,,,,,,,,,,41,2023-04-26T15:50:00.000Z,2023-04-27T10:40:00.000Z,19.666666666666668,0.8194444444444444,No,No,No,No,No,Yes,No,No,5,1
1575,PREP PLATES FOR OFF-SITE SHIPPING/REPAIR,23-37175,E-6563,E-6563,,,4-4-23 2:39 PM,2023-04-04T14:39:00.000Z,4-21-23 9:06 AM,2023-04-21T09:06:00.000Z,4-28-23 6:25 AM,2023-04-28T06:25:00.000Z,4,4,,SD,CLOSE,Y,,NO,CHATHAM,,,,,,,,,,,,,,,,41,2023-04-26T15:50:00.000Z,2023-04-27T10:40:00.000Z,19.666666666666668,0.8194444444444444,No,No,No,No,No,Yes,No,No,5,1
1069,P1511B Seal leaking,23-37180,P-1511B,P-1511B,,,4-5-23 7:32 AM,2023-04-05T07:32:00.000Z,4-23-23 2:25 PM,2023-04-23T14:25:00.000Z,4-27-23 10:11 AM,2023-04-27T10:11:00.000Z,4,4,,SD,CLOSE,Y,,NO,CHATHAM,,,,,,,,,,,,,,,,41,2023-04-26T15:50:00.000Z,2023-04-27T10:40:00.000Z,19.666666666666668,0.8194444444444444,Yes,No,No,No,No,No,No,No,1,1
1069,Remove guard & disconnect coupling,23-37193,P-1511B,P-1511B,,,4-5-23 11:55 AM,2023-04-05T11:55:00.000Z,4-23-23 2:25 PM,2023-04-23T14:25:00.000Z,4-27-23 10:11 AM,2023-04-27T10:11:00.000Z,4,4,,SD,CLOSE,Y,,NO,CHATHAM,,,,,,,,,,,,,,,,41,2023-04-26T15:50:00.000Z,2023-04-27T10:40:00.000Z,19.666666666666668,0.8194444444444444,Yes,No,No,No,No,No,No,No,1,1
1069,Remove pump pull-out,23-37194,P-1511B,P-1511B,,,4-5-23 12:02 PM,2023-04-05T12:02:00.000Z,4-23-23 2:25 PM,2023-04-23T14:25:00.000Z,4-27-23 10:11 AM,2023-04-27T10:11:00.000Z,4,4,,SD,CLOSE,Y,,NO,CHATHAM,,,,,,,,,,,,,,,,41,2023-04-26T15:50:00.000Z,2023-04-27T10:40:00.000Z,19.666666666666668,0.8194444444444444,Yes,No,No,No,No,No,No,No,1,1
1069,Clean seal pot debris,23-37195,P-1511B,P-1511B,,,4-5-23 12:03 PM,2023-04-05T12:03:00.000Z,4-23-23 2:25 PM,2023-04-23T14:25:00.000Z,4-27-23 10:11 AM,2023-04-27T10:11:00.000Z,4,4,,SD,CLOSE,Y,,NO,CHATHAM,,,,,,,,,,,,,,,,41,2023-04-26T15:50:00.000Z,2023-04-27T10:40:00.000Z,19.666666666666668,0.8194444444444444,Yes,No,No,No,No,No,No,No,1,1
1069,Inspect bowl & drain piping,23-37196,P-1511B,P-1511B,,,4-5-23 12:04 PM,2023-04-05T12:04:00.000Z,4-23-23 2:25 PM,2023-04-23T14:25:00.000Z,4-27-23 10:11 AM,2023-04-27T10:11:00.000Z,4,4,,SD,CLOSE,Y,,NO,CHATHAM,,,,,,,,,,,,,,,,41,2023-04-26T15:50:00.000Z,2023-04-27T10:40:00.000Z,19.666666666666668,0.8194444444444444,Yes,No,No,No,No,No,No,No,1,1
1069,Install pump in line,23-37198,P-1511B,P-1511B,,,4-5-23 12:04 PM,2023-04-05T12:04:00.000Z,4-23-23 2:25 PM,2023-04-23T14:25:00.000Z,4-27-23 10:11 AM,2023-04-27T10:11:00.000Z,4,4,,SD,CLOSE,Y,,NO,CHATHAM,,,,,,,,,,,,,,,,41,2023-04-26T15:50:00.000Z,2023-04-27T10:40:00.000Z,19.666666666666668,0.8194444444444444,Yes,No,No,No,No,No,No,No,1,1
1069,Replace Pump seal in shop,23-37197,P-1511B,P-1511B,,,4-5-23 12:04 PM,2023-04-05T12:04:00.000Z,4-23-23 2:25 PM,2023-04-23T14:25:00.000Z,4-27-23 10:11 AM,2023-04-27T10:11:00.000Z,4,4,,SD,CLOSE,Y,,NO,CHATHAM,,,,,,,,,,,,,,,,41,2023-04-26T15:50:00.000Z,2023-04-27T10:40:00.000Z,19.666666666666668,0.8194444444444444,Yes,No,No,No,No,No,No,No,1,1
1069,Fill seal pot and bleed lines,23-37199,P-1511B,P-1511B,,,4-5-23 12:04 PM,2023-04-05T12:04:00.000Z,4-23-23 2:25 PM,2023-04-23T14:25:00.000Z,4-27-23 10:11 AM,2023-04-27T10:11:00.000Z,4,4,,SD,CLOSE,Y,,NO,CHATHAM,,,,,,,,,,,,,,,,41,2023-04-26T15:50:00.000Z,2023-04-27T10:40:00.000Z,19.666666666666668,0.8194444444444444,Yes,No,No,No,No,No,No,No,1,1
1069,Align motor to pump & couple,23-37200,P-1511B,P-1511B,,,4-5-23 12:05 PM,2023-04-05T12:05:00.000Z,4-23-23 2:25 PM,2023-04-23T14:25:00.000Z,4-27-23 10:11 AM,2023-04-27T10:11:00.000Z,4,4,,SD,CLOSE,Y,,NO,CHATHAM,,,,,,,,,,,,,,,,41,2023-04-26T15:50:00.000Z,2023-04-27T10:40:00.000Z,19.666666666666668,0.8194444444444444,Yes,No,No,No,No,No,No,No,1,1
1069,Replace coupling guard and turn over,23-37201,P-1511B,P-1511B,,,4-5-23 12:05 PM,2023-04-05T12:05:00.000Z,4-23-23 2:25 PM,2023-04-23T14:25:00.000Z,4-27-23 10:11 AM,2023-04-27T10:11:00.000Z,4,4,,SD,CLOSE,Y,,NO,CHATHAM,,,,,,,,,,,,,,,,41,2023-04-26T15:50:00.000Z,2023-04-27T10:40:00.000Z,19.666666666666668,0.8194444444444444,Yes,No,No,No,No,No,No,No,1,1
1312,Validate levels on grain bins using infared or drop down,23-37206,BN-2105,BN-2105,,,4-5-23 1:24 PM,2023-04-05T13:24:00.000Z,4-9-23 9:31 AM,2023-04-09T09:31:00.000Z,4-27-23 1:28 PM,2023-04-27T13:28:00.000Z,2,2,,CO,CLOSE,Y,,NO,CHATHAM,,,,,,,,,,,,,,,,41,2023-04-26T15:50:00.000Z,2023-04-27T10:40:00.000Z,19.666666666666668,0.8194444444444444,No,No,No,No,No,Yes,No,No,5,1
4865,Corn Probe suction issues; not pulling corn,23-37221,SA-2101,SA-2101,,,4-6-23 11:35 AM,2023-04-06T11:35:00.000Z,4-20-23 10:09 AM,2023-04-20T10:09:00.000Z,4-27-23 1:30 PM,2023-04-27T13:30:00.000Z,2,2,,RM,CLOSE,Y,,NO,CHATHAM,,,,,,,,,,,,,,,,41,2023-04-26T15:50:00.000Z,2023-04-27T10:40:00.000Z,19.666666666666668,0.8194444444444444,No,No,No,No,No,Yes,No,No,5,1
1037,Pre-work TA23 - build scaffold to access P1405 water valve,23-37544,P-1405B,P-1405B,,,4-11-23 9:45 AM,2023-04-11T09:45:00.000Z,4-23-23 9:01 AM,2023-04-23T09:01:00.000Z,4-27-23 9:57 AM,2023-04-27T09:57:00.000Z,4,4,,SD,CLOSE,Y,,NO,CHATHAM,,,,,,,,,,,,,,,,41,2023-04-26T15:50:00.000Z,2023-04-27T10:40:00.000Z,19.666666666666668,0.8194444444444444,Yes,No,No,No,No,No,No,No,1,1
1037,Build scaffold to access P1405 water valve,23-37548,P-1405B,P-1405B,,,4-11-23 9:57 AM,2023-04-11T09:57:00.000Z,4-23-23 9:01 AM,2023-04-23T09:01:00.000Z,4-27-23 9:57 AM,2023-04-27T09:57:00.000Z,4,4,,SD,CLOSE,Y,,NO,CHATHAM,,,,,,,,,,,,,,,,41,2023-04-26T15:50:00.000Z,2023-04-27T10:40:00.000Z,19.666666666666668,0.8194444444444444,Yes,No,No,No,No,No,No,No,1,1
1037,Dismantle Scaff (Keep till OPS says Dismantle),23-37549,P-1405B,P-1405B,,,4-11-23 9:58 AM,2023-04-11T09:58:00.000Z,4-23-23 9:01 AM,2023-04-23T09:01:00.000Z,4-27-23 9:57 AM,2023-04-27T09:57:00.000Z,4,4,,SD,CLOSE,Y,,NO,CHATHAM,,,,,,,,,,,,,,,,41,2023-04-26T15:50:00.000Z,2023-04-27T10:40:00.000Z,19.666666666666668,0.8194444444444444,Yes,No,No,No,No,No,No,No,1,1
,Found Work TA23 - Remove Ladder from Dryer D/Inspect,23-37583,DR-1801D,DR-1801D,,,4-12-23 2:12 PM,2023-04-12T14:12:00.000Z,5-5-23 2:06 PM,2023-05-05T14:06:00.000Z,4-27-23 11:00 AM,2023-04-27T11:00:00.000Z,4,4,,CO,CLOSE,Y,,NO,CHATHAM,"1466, 1597, 7011","ROTARY DRYER, ICM, DR-1801D BURNER MANAGEMENT SYSTEM, GEARBOX, DORRIS, 415TR25, SER# 31396 or SER#27639",,No,DRYER D,CH-DRYER_D,CH-DRYER_D:DR1801D.STAIND,DR-1801D,DR,STAIND,"Status indication (open/closed, run/stop)",Drum/Drive (asset),Equipment status,RECYCLE DRAG CONVEYOR,,41,2023-04-26T15:50:00.000Z,2023-04-27T10:40:00.000Z,19.666666666666668,0.8194444444444444,No,No,No,No,No,Yes,Yes,No,5,1
,Inspect Trunnion Bearing Grease,23-37592,DR-1826,DR-1826,,,4-12-23 5:19 PM,2023-04-12T17:19:00.000Z,4-21-23 5:19 PM,2023-04-21T17:19:00.000Z,4-27-23 11:12 AM,2023-04-27T11:12:00.000Z,4,4,,SD,CLOSE,Y,,NO,CHATHAM,"2541, 2542, 2543, 2544, 2545, 2547, 2549, 2550, 2552, 2553, 2554, 2555, 2556, 2557, 2558, 2559","SWISS COMBI ROTARY DRYER DRUM, SEW GEARBOX - LEFT HAND DRIVE -, SEW GEARBOX - LEFT HAND DRIVE, SEW GEARBOX - RIGHT HAND DRIVE, SEW GEARBOX - RIGHT HAND DRIVE, MOTOR / 25HP / 1800RPM / TEFC / 575V/3PH/60HZ / FRAME# 284TC, MOTOR / 25HP / 1800RPM / TEFC / 575V/3PH/60HZ / FRAME# 284TC, MOTOR / 25HP / 1800RPM / TEFC / 575V/3PH/60HZ / FRAME# 284TC, MOTOR / 25HP / 1800RPM / TEFC / 575V/3PH/60HZ / FRAME# 284TC, TRUNNION (A) - LEFT HAND DRIVE, TRUNNION (B)- RIGHT HAND DRIVE, TRUNNION (D) - LEFT HAND DRIVE, TRUNNION (C) - RIGHT HAND DRIVE, THRUST ROLLER ASSEMBLY, THRUST ROLLER ASSEMBLY, TRUNNION LUBRICATION SYSTEM",,No,DRYER A,CH-DRA_CYCLNS,CH-DRA_CYCLNS:TT18168B.MEAS,TT-18168B,TT,MEAS,Measured value (PV),Temperature transmitter,Measurement,DRUM DR1826 MOTOR A AMPERAGE,DR-1826,41,2023-04-26T15:50:00.000Z,2023-04-27T10:40:00.000Z,19.666666666666668,0.8194444444444444,No,No,No,No,No,Yes,Yes,No,5,1
,Replace Drum Outlet Seal,23-37593,DR-1826,DR-1826,,,4-12-23 5:20 PM,2023-04-12T17:20:00.000Z,4-21-23 5:20 PM,2023-04-21T17:20:00.000Z,4-27-23 11:13 AM,2023-04-27T11:13:00.000Z,4,4,,SD,CLOSE,Y,,NO,CHATHAM,"2541, 2542, 2543, 2544, 2545, 2547, 2549, 2550, 2552, 2553, 2554, 2555, 2556, 2557, 2558, 2559","SWISS COMBI ROTARY DRYER DRUM, SEW GEARBOX - LEFT HAND DRIVE -, SEW GEARBOX - LEFT HAND DRIVE, SEW GEARBOX - RIGHT HAND DRIVE, SEW GEARBOX - RIGHT HAND DRIVE, MOTOR / 25HP / 1800RPM / TEFC / 575V/3PH/60HZ / FRAME# 284TC, MOTOR / 25HP / 1800RPM / TEFC / 575V/3PH/60HZ / FRAME# 284TC, MOTOR / 25HP / 1800RPM / TEFC / 575V/3PH/60HZ / FRAME# 284TC, MOTOR / 25HP / 1800RPM / TEFC / 575V/3PH/60HZ / FRAME# 284TC, TRUNNION (A) - LEFT HAND DRIVE, TRUNNION (B)- RIGHT HAND DRIVE, TRUNNION (D) - LEFT HAND DRIVE, TRUNNION (C) - RIGHT HAND DRIVE, THRUST ROLLER ASSEMBLY, THRUST ROLLER ASSEMBLY, TRUNNION LUBRICATION SYSTEM",,No,DRYER A,CH-DRA_CYCLNS,CH-DRA_CYCLNS:TT18168B.MEAS,TT-18168B,TT,MEAS,Measured value (PV),Temperature transmitter,Measurement,DRUM DR1826 MOTOR A AMPERAGE,DR-1826,41,2023-04-26T15:50:00.000Z,2023-04-27T10:40:00.000Z,19.666666666666668,0.8194444444444444,No,No,No,No,No,Yes,Yes,No,5,1
1315,No water flow through men's Urinal in washroom at alcohol loading,23-37980,BU-ALCO,BU-ALCO,,,4-18-23 3:45 AM,2023-04-18T03:45:00.000Z,4-26-23 12:53 PM,2023-04-26T12:53:00.000Z,4-28-23 7:31 AM,2023-04-28T07:31:00.000Z,4,4,,CO,CLOSE,Y,,NO,CHATHAM,,,,,,,,,,,,,,,,41,2023-04-26T15:50:00.000Z,2023-04-27T10:40:00.000Z,19.666666666666668,0.8194444444444444,No,No,No,No,No,Yes,No,No,5,1
6797,IE PROVING ASSISTANCE APRIL 24-26,23-38007,FT-23125,FT-23125,,,4-19-23 8:51 PM,2023-04-19T20:51:00.000Z,4-26-23 4:00 PM,2023-04-26T16:00:00.000Z,4-26-23 3:29 PM,2023-04-26T15:29:00.000Z,2,2,,CAL,CLOSE,Y,,NO,CHATHAM,,,,,,,,,,,,,,,,41,2023-04-26T15:50:00.000Z,2023-04-27T10:40:00.000Z,19.666666666666668,0.8194444444444444,No,No,No,No,No,No,No,Yes,3,1
,Disconnect wiring to SD  trailers with generators,23-38022,CHATHAM,CHATHAM,,,4-20-23 10:11 PM,2023-04-20T22:11:00.000Z,4-24-23 3:53 PM,2023-04-24T15:53:00.000Z,4-28-23 7:30 AM,2023-04-28T07:30:00.000Z,2,2,,SD,CLOSE,Y,,NO,CHATHAM,,,,,,,,,,,,,,,,41,2023-04-26T15:50:00.000Z,2023-04-27T10:40:00.000Z,19.666666666666668,0.8194444444444444,No,No,No,No,No,Yes,No,No,5,1
1315,A/C in washroom at alcohol loading not working,23-38030,BU-ALCO,BU-ALCO,,,4-20-23 11:17 PM,2023-04-20T23:17:00.000Z,5-15-23 2:25 PM,2023-05-15T14:25:00.000Z,4-28-23 7:29 AM,2023-04-28T07:29:00.000Z,4,4,,CO,CLOSE,Y,,NO,CHATHAM,,,,,,,,,,,,,,,,41,2023-04-26T15:50:00.000Z,2023-04-27T10:40:00.000Z,19.666666666666668,0.8194444444444444,No,No,No,No,No,Yes,No,No,5,1
1293,BL-1804D WEEKLY GREASING,23-38196,BL-1804D,BL-1804D,,,4-24-23 1:48 AM,2023-04-24T01:48:00.000Z,5-22-23 12:00 AM,2023-05-22T00:00:00.000Z,4-27-23 9:52 AM,2023-04-27T09:52:00.000Z,4,4,,PM,CLOSE,Y,,NO,CHATHAM,"1293, 6864","BLOWER, NYB, MODEL 714 SERIES 45, GENERAL INDUSTRIAL, CW/UB, Arrg't 8, MOTOR / 450HP / 1200RPM / TEFC / 2300V/3PH/60HZ / FR# 5808C",,No,DRYER D,CH-DRYER_D_BLR,CH-DRYER_D_BLR:BL1804D.STAIND,BL-1804D,BL,STAIND,"Status indication (open/closed, run/stop)",Blower (asset),Equipment status,CYCLONE INLET PRESSURE,,41,2023-04-26T15:50:00.000Z,2023-04-27T10:40:00.000Z,19.666666666666668,0.8194444444444444,Yes,No,No,No,No,No,No,No,1,1
1293,BL-1804D - WEEKLY BEARING GREASING,23-38195,BL-1804D,BL-1804D,,,4-24-23 1:48 AM,2023-04-24T01:48:00.000Z,5-22-23 12:00 AM,2023-05-22T00:00:00.000Z,4-27-23 9:52 AM,2023-04-27T09:52:00.000Z,4,4,,PM,CLOSE,Y,N,NO,CHATHAM,"1293, 6864","BLOWER, NYB, MODEL 714 SERIES 45, GENERAL INDUSTRIAL, CW/UB, Arrg't 8, MOTOR / 450HP / 1200RPM / TEFC / 2300V/3PH/60HZ / FR# 5808C",,No,DRYER D,CH-DRYER_D_BLR,CH-DRYER_D_BLR:BL1804D.STAIND,BL-1804D,BL,STAIND,"Status indication (open/closed, run/stop)",Blower (asset),Equipment status,CYCLONE INLET PRESSURE,,41,2023-04-26T15:50:00.000Z,2023-04-27T10:40:00.000Z,19.666666666666668,0.8194444444444444,Yes,No,No,No,No,No,No,No,1,1
1386,Clean and Reassemble PCOSS disc stack,23-38403,CE-6601,CE-6601,,,4-24-23 7:49 AM,2023-04-24T07:49:00.000Z,4-26-23 7:04 AM,2023-04-26T07:04:00.000Z,4-27-23 9:51 AM,2023-04-27T09:51:00.000Z,2,2,,CO,CLOSE,Y,,NO,CHATHAM,,,,,,,,,,,,,,,,41,2023-04-26T15:50:00.000Z,2023-04-27T10:40:00.000Z,19.666666666666668,0.8194444444444444,Yes,No,No,No,No,No,No,No,1,1
5464,Install camlock fitting on TK1402 north manway,23-38405,TK-1402,TK-1402,,,4-24-23 8:11 AM,2023-04-24T08:11:00.000Z,5-7-23 3:43 PM,2023-05-07T15:43:00.000Z,4-27-23 10:32 AM,2023-04-27T10:32:00.000Z,4,4,,CO,CLOSE,Y,,NO,CHATHAM,,,,,,,,,,,,,,,,41,2023-04-26T15:50:00.000Z,2023-04-27T10:40:00.000Z,19.666666666666668,0.8194444444444444,Yes,No,No,No,No,No,No,No,1,1
5466,Install camlock fitting on TK1404 north manway,23-38411,TK-1404,TK-1404,,,4-24-23 10:14 AM,2023-04-24T10:14:00.000Z,5-7-23 4:56 PM,2023-05-07T16:56:00.000Z,4-27-23 9:49 AM,2023-04-27T09:49:00.000Z,4,4,,CO,CLOSE,Y,,NO,CHATHAM,,,,,,,,,,,,,,,,41,2023-04-26T15:50:00.000Z,2023-04-27T10:40:00.000Z,19.666666666666668,0.8194444444444444,Yes,No,No,No,No,No,No,No,1,1
5475,TK-1902 access ladder wobbles when you ascend or descend the tank. Needs extra support,23-38412,TK-1902,TK-1902,,,4-24-23 10:16 AM,2023-04-24T10:16:00.000Z,5-31-23 5:22 AM,2023-05-31T05:22:00.000Z,4-27-23 9:49 AM,2023-04-27T09:49:00.000Z,4,4,,CO,CLOSE,Y,,NO,CHATHAM,,,,,,,,,,,,,,,,41,2023-04-26T15:50:00.000Z,2023-04-27T10:40:00.000Z,19.666666666666668,0.8194444444444444,Yes,No,No,No,No,No,No,No,1,1
1069,Rebuild ra 1069,23-38464,P-1511B,P-1511B,,,4-26-23 1:22 PM,2023-04-26T13:22:00.000Z,4-26-24 6:30 AM,2024-04-26T06:30:00.000Z,4-24-24 9:56 PM,2024-04-24T21:56:00.000Z,4,4,,CO,CLOSE,Y,N,NO,CHATHAM,,,,,,,,,,,,,,,,41,2023-04-26T15:50:00.000Z,2023-04-27T10:40:00.000Z,19.666666666666668,0.8194444444444444,No,No,Yes,Yes,No,No,No,No,4,1
1069,Disassemble pump,23-38465,P-1511B,P-1511B,,,4-26-23 1:24 PM,2023-04-26T13:24:00.000Z,,,4-25-24 4:14 PM,2024-04-25T16:14:00.000Z,4,4,,,CLOSE,Y,,NO,CHATHAM,,,,,,,,,,,,,,,,41,2023-04-26T15:50:00.000Z,2023-04-27T10:40:00.000Z,19.666666666666668,0.8194444444444444,No,No,Yes,Yes,No,No,No,No,4,1
1069,Take measurements,23-38468,P-1511B,P-1511B,,,4-26-23 1:24 PM,2023-04-26T13:24:00.000Z,,,4-25-24 4:14 PM,2024-04-25T16:14:00.000Z,4,4,,,CLOSE,Y,,NO,CHATHAM,,,,,,,,,,,,,,,,41,2023-04-26T15:50:00.000Z,2023-04-27T10:40:00.000Z,19.666666666666668,0.8194444444444444,No,No,Yes,Yes,No,No,No,No,4,1
1069,Complete runout and float checks,23-38471,P-1511B,P-1511B,,,4-26-23 1:24 PM,2023-04-26T13:24:00.000Z,,,4-25-24 4:14 PM,2024-04-25T16:14:00.000Z,4,4,,,CLOSE,Y,,NO,CHATHAM,,,,,,,,,,,,,,,,41,2023-04-26T15:50:00.000Z,2023-04-27T10:40:00.000Z,19.666666666666668,0.8194444444444444,No,No,Yes,Yes,No,No,No,No,4,1
1069,Install bearings,23-38469,P-1511B,P-1511B,,,4-26-23 1:24 PM,2023-04-26T13:24:00.000Z,,,4-25-24 4:14 PM,2024-04-25T16:14:00.000Z,4,4,,,CLOSE,Y,,NO,CHATHAM,,,,,,,,,,,,,,,,41,2023-04-26T15:50:00.000Z,2023-04-27T10:40:00.000Z,19.666666666666668,0.8194444444444444,No,No,Yes,Yes,No,No,No,No,4,1
1069,Assemble shaft w/ bearings into housing,23-38470,P-1511B,P-1511B,,,4-26-23 1:24 PM,2023-04-26T13:24:00.000Z,,,4-25-24 4:14 PM,2024-04-25T16:14:00.000Z,4,4,,,CLOSE,Y,,NO,CHATHAM,,,,,,,,,,,,,,,,41,2023-04-26T15:50:00.000Z,2023-04-27T10:40:00.000Z,19.666666666666668,0.8194444444444444,No,No,Yes,Yes,No,No,No,No,4,1
1069,Clean housing,23-38466,P-1511B,P-1511B,,,4-26-23 1:24 PM,2023-04-26T13:24:00.000Z,,,4-25-24 4:14 PM,2024-04-25T16:14:00.000Z,4,4,,,CLOSE,Y,,NO,CHATHAM,,,,,,,,,,,,,,,,41,2023-04-26T15:50:00.000Z,2023-04-27T10:40:00.000Z,19.666666666666668,0.8194444444444444,No,No,Yes,Yes,No,No,No,No,4,1
1069,Wire wheel shaft,23-38467,P-1511B,P-1511B,,,4-26-23 1:24 PM,2023-04-26T13:24:00.000Z,,,4-25-24 4:14 PM,2024-04-25T16:14:00.000Z,4,4,,,CLOSE,Y,,NO,CHATHAM,,,,,,,,,,,,,,,,41,2023-04-26T15:50:00.000Z,2023-04-27T10:40:00.000Z,19.666666666666668,0.8194444444444444,No,No,Yes,Yes,No,No,No,No,4,1
3563,SPLIT MX-1302 TRANSFER CASE FROM GEARBOX FOR REPAIR,23-38478,MX-1302,MX-1302,,,4-26-23 2:10 PM,2023-04-26T14:10:00.000Z,5-7-23 2:10 PM,2023-05-07T14:10:00.000Z,5-3-23 6:48 AM,2023-05-03T06:48:00.000Z,4,4,,CO,CLOSE,Y,,NO,CHATHAM,,,,,,,,,,,,,,,,41,2023-04-26T15:50:00.000Z,2023-04-27T10:40:00.000Z,19.666666666666668,0.8194444444444444,No,No,Yes,Yes,No,No,No,No,4,1
,POST SD MEETING REVIEW,23-38479,0000,0000,,,4-26-23 2:29 PM,2023-04-26T14:29:00.000Z,5-2-23 2:29 PM,2023-05-02T14:29:00.000Z,5-1-23 4:29 PM,2023-05-01T16:29:00.000Z,4,4,,CO,CLOSE,Y,,NO,CHATHAM,,,,,,,,,,,,,,,,41,2023-04-26T15:50:00.000Z,2023-04-27T10:40:00.000Z,19.666666666666668,0.8194444444444444,No,No,Yes,Yes,No,No,No,No,4,1
,Lower flags - National day of mourning,23-38489,0000,0000,,,4-27-23 7:58 AM,2023-04-27T07:58:00.000Z,4-28-23 4:00 PM,2023-04-28T16:00:00.000Z,4-28-23 8:27 AM,2023-04-28T08:27:00.000Z,1,1,,CO,CLOSE,Y,,NO,CHATHAM,,,,,,,,,,,,,,,,41,2023-04-26T15:50:00.000Z,2023-04-27T10:40:00.000Z,19.666666666666668,0.8194444444444444,No,No,No,No,Yes,Yes,No,No,5,1
,Cut up belt from bucket change and dispose,23-38490,BU-QUON,BU-QUON,,,4-27-23 8:15 AM,2023-04-27T08:15:00.000Z,5-7-23 6:40 AM,2023-05-07T06:40:00.000Z,4-27-23 9:43 AM,2023-04-27T09:43:00.000Z,4,4,,CO,CLOSE,Y,,NO,CHATHAM,,,,,,,,,,,,,,,,41,2023-04-26T15:50:00.000Z,2023-04-27T10:40:00.000Z,19.666666666666668,0.8194444444444444,Yes,No,No,No,Yes,No,No,No,1,1
,Repair drain in lunch room sink,23-38495,CHATHAM,CHATHAM,,,4-27-23 9:24 AM,2023-04-27T09:24:00.000Z,4-28-23 9:17 AM,2023-04-28T09:17:00.000Z,4-27-23 11:13 AM,2023-04-27T11:13:00.000Z,4,4,,CO,CLOSE,Y,,NO,CHATHAM,,,,,,,,,,,,,,,,41,2023-04-26T15:50:00.000Z,2023-04-27T10:40:00.000Z,19.666666666666668,0.8194444444444444,No,No,No,No,Yes,Yes,Yes,No,5,1
4865,Corn Probe not closing correctly therefore suction not powerful enough to bring corn to office.,23-38496,SA-2101,SA-2101,,,4-27-23 9:28 AM,2023-04-27T09:28:00.000Z,4-28-23 9:00 AM,2023-04-28T09:00:00.000Z,4-27-23 4:14 PM,2023-04-27T16:14:00.000Z,2,2,,CO,CLOSE,Y,,NO,CHATHAM,,,,,,,,,,,,,,,,41,2023-04-26T15:50:00.000Z,2023-04-27T10:40:00.000Z,19.666666666666668,0.8194444444444444,No,No,No,No,Yes,Yes,No,No,5,1
4675,"PT-57702 is reading out of range. Have night I&E person investigate (Chris G, replaced transmitter)",23-38527,PT-57702,PT-57702,,,4-28-23 7:48 AM,2023-04-28T07:48:00.000Z,4-30-23 6:52 AM,2023-04-30T06:52:00.000Z,4-27-23 8:52 AM,2023-04-27T08:52:00.000Z,2,2,,RM,CLOSE,Y,,NO,CHATHAM,,,,,,,,,,,,,,,,41,2023-04-26T15:50:00.000Z,2023-04-27T10:40:00.000Z,19.666666666666668,0.8194444444444444,Yes,No,No,No,No,No,No,No,1,1
,Replace hydroheater,23-37577,EJ-1302,EJ-1302,,,4-12-23 1:32 PM,2023-04-12T13:32:00.000Z,,,4-28-23 10:12 AM,2023-04-28T10:12:00.000Z,4,4,,SD,CLOSE,Y,,NO,CHATHAM,,,,,,,,,,,,,,,,43,2023-04-28T10:40:00.000Z,2023-04-28T11:30:00.000Z,1.0,0.041666666666666664,No,No,No,No,No,No,No,Yes,3,1
,EJ-1302 HYDROHEATER REPLACEMENT - FE02,23-37576,EJ-1302,EJ-1302,,,4-12-23 1:32 PM,2023-04-12T13:32:00.000Z,,,4-28-23 10:12 AM,2023-04-28T10:12:00.000Z,4,4,,SD,CLOSE,Y,N,NO,CHATHAM,,,,,,,,,,,,,,,,43,2023-04-28T10:40:00.000Z,2023-04-28T11:30:00.000Z,1.0,0.041666666666666664,No,No,No,No,No,No,No,Yes,3,1
5449,Install camlock fitting on TK11402 north manway,23-38499,TK-11402,TK-11402,,,4-27-23 11:08 AM,2023-04-27T11:08:00.000Z,5-5-23 11:06 AM,2023-05-05T11:06:00.000Z,4-27-23 11:08 AM,2023-04-27T11:08:00.000Z,4,4,,CO,CLOSE,Y,,NO,CHATHAM,,,,,,,,,,,,,,,,43,2023-04-28T10:40:00.000Z,2023-04-28T11:30:00.000Z,1.0,0.041666666666666664,No,No,No,Yes,No,No,No,No,4,1
1002,P-1630 Glycol pot and expansion joint replacement,23-38500,P-1630,P-1630,,,4-27-23 11:10 AM,2023-04-27T11:10:00.000Z,10-28-23 1:45 PM,2023-10-28T13:45:00.000Z,10-26-23 10:34 AM,2023-10-26T10:34:00.000Z,4,4,,CO,CLOSE,Y,,NO,CHATHAM,,,,,,,,,,,,,,,,43,2023-04-28T10:40:00.000Z,2023-04-28T11:30:00.000Z,1.0,0.041666666666666664,No,No,No,Yes,No,No,No,No,4,1
1069,Rebuild Unmarked 3175L RA and Stamp,23-38501,P-1511B,P-1511B,,,4-27-23 11:11 AM,2023-04-27T11:11:00.000Z,6-25-23 5:23 PM,2023-06-25T17:23:00.000Z,6-5-24 10:30 AM,2024-06-05T10:30:00.000Z,4,4,,CO,CLOSE,Y,N,NO,CHATHAM,,,,,,,,,,,,,,,,43,2023-04-28T10:40:00.000Z,2023-04-28T11:30:00.000Z,1.0,0.041666666666666664,No,No,No,Yes,No,No,No,No,4,1
1069,Disassemble pump,23-38502,P-1511B,P-1511B,,,4-27-23 11:14 AM,2023-04-27T11:14:00.000Z,5-8-23 7:23 PM,2023-05-08T19:23:00.000Z,6-5-24 10:30 AM,2024-06-05T10:30:00.000Z,4,4,,PM,CLOSE,Y,,NO,CHATHAM,,,,,,,,,,,,,,,,43,2023-04-28T10:40:00.000Z,2023-04-28T11:30:00.000Z,1.0,0.041666666666666664,No,No,No,Yes,No,No,No,No,4,1
1069,Wire wheel shaft,23-38504,P-1511B,P-1511B,,,4-27-23 11:14 AM,2023-04-27T11:14:00.000Z,5-8-23 5:53 PM,2023-05-08T17:53:00.000Z,6-5-24 10:30 AM,2024-06-05T10:30:00.000Z,4,4,,PM,CLOSE,Y,,NO,CHATHAM,,,,,,,,,,,,,,,,43,2023-04-28T10:40:00.000Z,2023-04-28T11:30:00.000Z,1.0,0.041666666666666664,No,No,No,Yes,No,No,No,No,4,1
1069,Take measurements,23-38505,P-1511B,P-1511B,,,4-27-23 11:14 AM,2023-04-27T11:14:00.000Z,5-8-23 6:23 PM,2023-05-08T18:23:00.000Z,6-5-24 10:30 AM,2024-06-05T10:30:00.000Z,4,4,,PM,CLOSE,Y,,NO,CHATHAM,,,,,,,,,,,,,,,,43,2023-04-28T10:40:00.000Z,2023-04-28T11:30:00.000Z,1.0,0.041666666666666664,No,No,No,Yes,No,No,No,No,4,1
1069,Install bearings,23-38506,P-1511B,P-1511B,,,4-27-23 11:14 AM,2023-04-27T11:14:00.000Z,5-8-23 7:53 PM,2023-05-08T19:53:00.000Z,6-5-24 10:30 AM,2024-06-05T10:30:00.000Z,4,4,,PM,CLOSE,Y,,NO,CHATHAM,,,,,,,,,,,,,,,,43,2023-04-28T10:40:00.000Z,2023-04-28T11:30:00.000Z,1.0,0.041666666666666664,No,No,No,Yes,No,No,No,No,4,1
1069,Clean housing,23-38503,P-1511B,P-1511B,,,4-27-23 11:14 AM,2023-04-27T11:14:00.000Z,5-8-23 5:53 PM,2023-05-08T17:53:00.000Z,6-5-24 10:30 AM,2024-06-05T10:30:00.000Z,4,4,,PM,CLOSE,Y,,NO,CHATHAM,,,,,,,,,,,,,,,,43,2023-04-28T10:40:00.000Z,2023-04-28T11:30:00.000Z,1.0,0.041666666666666664,No,No,No,Yes,No,No,No,No,4,1
1069,Assemble shaft w/ bearings into housing,23-38507,P-1511B,P-1511B,,,4-27-23 11:14 AM,2023-04-27T11:14:00.000Z,5-8-23 6:23 PM,2023-05-08T18:23:00.000Z,6-5-24 10:30 AM,2024-06-05T10:30:00.000Z,4,4,,PM,CLOSE,Y,,NO,CHATHAM,,,,,,,,,,,,,,,,43,2023-04-28T10:40:00.000Z,2023-04-28T11:30:00.000Z,1.0,0.041666666666666664,No,No,No,Yes,No,No,No,No,4,1
1069,Complete runout and float checks,23-38508,P-1511B,P-1511B,,,4-27-23 11:14 AM,2023-04-27T11:14:00.000Z,5-8-23 5:53 PM,2023-05-08T17:53:00.000Z,6-5-24 10:30 AM,2024-06-05T10:30:00.000Z,4,4,,PM,CLOSE,Y,,NO,CHATHAM,,,,,,,,,,,,,,,,43,2023-04-28T10:40:00.000Z,2023-04-28T11:30:00.000Z,1.0,0.041666666666666664,No,No,No,Yes,No,No,No,No,4,1
6310,V-1640 Overflow Vent Leak at Threads,23-38509,V-1640,V-1640,,,4-27-23 11:16 AM,2023-04-27T11:16:00.000Z,6-2-23 4:17 PM,2023-06-02T16:17:00.000Z,6-1-23 6:17 PM,2023-06-01T18:17:00.000Z,4,4,,CO,CLOSE,Y,,NO,CHATHAM,,,,,,,,,,,,,,,,43,2023-04-28T10:40:00.000Z,2023-04-28T11:30:00.000Z,1.0,0.041666666666666664,No,No,No,Yes,No,No,No,No,4,1
1166,Rebuild RA 1080,23-38510,P-1603B,P-1603B,,,4-27-23 11:25 AM,2023-04-27T11:25:00.000Z,6-18-23 5:15 PM,2023-06-18T17:15:00.000Z,6-14-23 1:45 AM,2023-06-14T01:45:00.000Z,4,4,,CO,CLOSE,Y,N,NO,CHATHAM,,,,,,,,,,,,,,,,43,2023-04-28T10:40:00.000Z,2023-04-28T11:30:00.000Z,1.0,0.041666666666666664,No,No,No,Yes,No,No,No,No,4,1
,BL-1829 New South Door requires insulation,23-38518,BL-1829,BL-1829,,,4-27-23 11:27 AM,2023-04-27T11:27:00.000Z,5-31-23 10:33 AM,2023-05-31T10:33:00.000Z,8-14-23 12:37 PM,2023-08-14T12:37:00.000Z,4,4,,CO,CLOSE,Y,,NO,CHATHAM,"10034, 2868","BLOWER, HOWDEN, FAN MODEL E40S-8700 SWSI CCW TAU Arrg't7, 600HP / 1200RPM / TEFC / 575V/3PH/60HZ / 5810B FRAME",,Yes,DRYER A,CH-DRYER_A,CH-DRYER_A:SY18153B.OUT,SY-18153B,SY,OUT,Controller output / demand (CO),Speed output (VFD demand),Output/Demand,BL1829 CURRENT INDICATION,BL-1829,43,2023-04-28T10:40:00.000Z,2023-04-28T11:30:00.000Z,1.0,0.041666666666666664,No,No,No,Yes,No,No,No,No,4,1
2324,Found Work TA22 - Syrup to Wet isolation valve replacement,23-38519,FV-83101,FV-83101,,,4-27-23 11:28 AM,2023-04-27T11:28:00.000Z,,,4-27-23 12:51 PM,2023-04-27T12:51:00.000Z,4,4,,SD,CLOSE,Y,,NO,CHATHAM,,,,,,,,,,,,,,,,43,2023-04-28T10:40:00.000Z,2023-04-28T11:30:00.000Z,1.0,0.041666666666666664,No,No,No,Yes,No,No,No,No,4,1
2324,Found Work TA22 - Syrup to Wet isolation valve replacement,23-38521,FV-83101,FV-83101,,,4-27-23 11:37 AM,2023-04-27T11:37:00.000Z,,,5-3-23 7:30 AM,2023-05-03T07:30:00.000Z,1,1,,SD,CLOSE,Y,,NO,CHATHAM,,,,,,,,,,,,,,,,43,2023-04-28T10:40:00.000Z,2023-04-28T11:30:00.000Z,1.0,0.041666666666666664,No,No,No,Yes,No,No,No,No,4,1
,Lift safety railing material to the admin roof w/TriCOunty,23-38522,0000,0000,,,4-27-23 1:48 PM,2023-04-27T13:48:00.000Z,5-2-23 4:00 PM,2023-05-02T16:00:00.000Z,5-2-23 10:00 AM,2023-05-02T10:00:00.000Z,4,4,,CP,CLOSE,Y,,NO,CHATHAM,,,,,,,,,,,,,,,,43,2023-04-28T10:40:00.000Z,2023-04-28T11:30:00.000Z,1.0,0.041666666666666664,No,No,No,Yes,No,No,No,No,4,1
1029,P-6572A Stuffing box modification,23-38526,P-6572A,P-6572A,,,4-28-23 7:46 AM,2023-04-28T07:46:00.000Z,5-2-23 7:34 AM,2023-05-02T07:34:00.000Z,5-9-23 8:42 AM,2023-05-09T08:42:00.000Z,4,4,,PM,CLOSE,Y,,NO,CHATHAM,,,,,,,,,,,,,,,,43,2023-04-28T10:40:00.000Z,2023-04-28T11:30:00.000Z,1.0,0.041666666666666664,No,No,Yes,Yes,No,No,No,No,4,1
4820,Proper Insulation Blankets Needed for PV-15812A/B,23-38528,PY-15812B,PY-15812B,,,4-28-23 7:53 AM,2023-04-28T07:53:00.000Z,6-9-23 10:06 AM,2023-06-09T10:06:00.000Z,9-11-24 10:46 AM,2024-09-11T10:46:00.000Z,4,4,,CO,CLOSE,Y,,NO,CHATHAM,,,,,,,,,,,,,,,,43,2023-04-28T10:40:00.000Z,2023-04-28T11:30:00.000Z,1.0,0.041666666666666664,No,No,Yes,Yes,No,No,No,No,4,1
10036,REWORK HOUSING INSULATION ON BL-1832 TO EXPOSE CASING INSPECTION DOOR,23-38529,BL-1832,BL-1832,,,4-28-23 7:57 AM,2023-04-28T07:57:00.000Z,10-6-23 3:02 PM,2023-10-06T15:02:00.000Z,9-11-24 10:46 AM,2024-09-11T10:46:00.000Z,4,4,,CO,CLOSE,Y,,NO,CHATHAM,"10036, 10037","BLOWER, HOWDEN, FAN MODEL EPB4S-5750, 200HP / 1800RPM / TEFC / 575V/3PH/60HZ / 447T FRAME",,No,DRYER A,CH-DRA_COMB_AIR,CH-DRA_COMB_AIR:BL1832.STAIND,BL-1832,BL,STAIND,"Status indication (open/closed, run/stop)",Blower (asset),Equipment status,COMBUSTION AIR FAN,,43,2023-04-28T10:40:00.000Z,2023-04-28T11:30:00.000Z,1.0,0.041666666666666664,No,No,Yes,Yes,No,No,No,No,4,1
2679,Electricial Wires to Solenoid (HY-15402) not protected,23-38531,HY-15402,HY-15402,,,4-28-23 8:02 AM,2023-04-28T08:02:00.000Z,5-31-23 9:40 AM,2023-05-31T09:40:00.000Z,5-2-23 2:05 PM,2023-05-02T14:05:00.000Z,4,4,,CO,CLOSE,Y,,NO,CHATHAM,,,,,,,,,,,,,,,,43,2023-04-28T10:40:00.000Z,2023-04-28T11:30:00.000Z,1.0,0.041666666666666664,No,No,Yes,Yes,No,No,No,No,4,1
1124,P-2303A Piping Repair needs painting,23-38532,P-2303A,P-2303A,,,4-28-23 8:04 AM,2023-04-28T08:04:00.000Z,5-17-24 10:16 AM,2024-05-17T10:16:00.000Z,6-30-25 1:30 AM,2025-06-30T01:30:00.000Z,4,4,,CO,CLOSE,Y,,NO,CHATHAM,,,,,,,,,,,,,,,,43,2023-04-28T10:40:00.000Z,2023-04-28T11:30:00.000Z,1.0,0.041666666666666664,No,No,Yes,Yes,No,No,No,No,4,1
1636,TA23 Fall - Repair leaking steam valve to EJ-1551,23-38533,EJ-1551,EJ-1551,,,4-28-23 8:49 AM,2023-04-28T08:49:00.000Z,10-25-23 9:45 AM,2023-10-25T09:45:00.000Z,5-23-24 3:26 PM,2024-05-23T15:26:00.000Z,4,4,,CO,CLOSE,Y,,NO,CHATHAM,,,,,,,,,,,,,,,,43,2023-04-28T10:40:00.000Z,2023-04-28T11:30:00.000Z,1.0,0.041666666666666664,No,No,Yes,Yes,No,No,No,No,4,1
5463,Pull and inspect TK1401 GA quill for plug,23-38536,TK-1401,TK-1401,,,4-28-23 12:43 PM,2023-04-28T12:43:00.000Z,5-2-23 11:33 AM,2023-05-02T11:33:00.000Z,4-28-23 1:14 PM,2023-04-28T13:14:00.000Z,2,2,,RM,CLOSE,Y,,NO,CHATHAM,,,,,,,,,,,,,,,,48,2023-04-28T14:20:00.000Z,2023-04-28T14:40:00.000Z,6.833333333333333,0.2847222222222222,No,No,Yes,Yes,No,No,No,No,4,1
1034,Rebuild RA 1006,23-38538,P-1402,P-1402,,,4-28-23 12:48 PM,2023-04-28T12:48:00.000Z,6-18-23 11:29 AM,2023-06-18T11:29:00.000Z,6-6-23 7:59 PM,2023-06-06T19:59:00.000Z,4,4,,CO,CLOSE,Y,N,NO,CHATHAM,,,,,,,,,,,,,,,,48,2023-04-28T14:20:00.000Z,2023-04-28T14:40:00.000Z,6.833333333333333,0.2847222222222222,No,No,Yes,Yes,No,No,No,No,4,1
1034,Disassemble pump,23-38539,P-1402,P-1402,,,4-28-23 12:50 PM,2023-04-28T12:50:00.000Z,5-15-23 1:29 PM,2023-05-15T13:29:00.000Z,6-7-23 3:40 PM,2023-06-07T15:40:00.000Z,4,4,,CO,CLOSE,Y,,NO,CHATHAM,,,,,,,,,,,,,,,,48,2023-04-28T14:20:00.000Z,2023-04-28T14:40:00.000Z,6.833333333333333,0.2847222222222222,No,No,Yes,Yes,No,No,No,No,4,1
1034,Clean housing,23-38540,P-1402,P-1402,,,4-28-23 12:51 PM,2023-04-28T12:51:00.000Z,5-15-23 11:59 AM,2023-05-15T11:59:00.000Z,6-7-23 3:40 PM,2023-06-07T15:40:00.000Z,4,4,,CO,CLOSE,Y,,NO,CHATHAM,,,,,,,,,,,,,,,,48,2023-04-28T14:20:00.000Z,2023-04-28T14:40:00.000Z,6.833333333333333,0.2847222222222222,No,No,Yes,Yes,No,No,No,No,4,1
1034,Take measurements,23-38542,P-1402,P-1402,,,4-28-23 12:51 PM,2023-04-28T12:51:00.000Z,5-15-23 12:29 PM,2023-05-15T12:29:00.000Z,6-7-23 3:40 PM,2023-06-07T15:40:00.000Z,4,4,,CO,CLOSE,Y,,NO,CHATHAM,,,,,,,,,,,,,,,,48,2023-04-28T14:20:00.000Z,2023-04-28T14:40:00.000Z,6.833333333333333,0.2847222222222222,No,No,Yes,Yes,No,No,No,No,4,1
1034,Install bearings,23-38543,P-1402,P-1402,,,4-28-23 12:51 PM,2023-04-28T12:51:00.000Z,5-15-23 1:59 PM,2023-05-15T13:59:00.000Z,6-7-23 3:40 PM,2023-06-07T15:40:00.000Z,4,4,,CO,CLOSE,Y,,NO,CHATHAM,,,,,,,,,,,,,,,,48,2023-04-28T14:20:00.000Z,2023-04-28T14:40:00.000Z,6.833333333333333,0.2847222222222222,No,No,Yes,Yes,No,No,No,No,4,1
1034,Assemble shaft w/ bearings into housing,23-38544,P-1402,P-1402,,,4-28-23 12:51 PM,2023-04-28T12:51:00.000Z,5-15-23 12:29 PM,2023-05-15T12:29:00.000Z,6-7-23 3:40 PM,2023-06-07T15:40:00.000Z,4,4,,CO,CLOSE,Y,,NO,CHATHAM,,,,,,,,,,,,,,,,48,2023-04-28T14:20:00.000Z,2023-04-28T14:40:00.000Z,6.833333333333333,0.2847222222222222,No,No,Yes,Yes,No,No,No,No,4,1
1034,Wire wheel shaft,23-38541,P-1402,P-1402,,,4-28-23 12:51 PM,2023-04-28T12:51:00.000Z,5-15-23 11:59 AM,2023-05-15T11:59:00.000Z,6-7-23 3:40 PM,2023-06-07T15:40:00.000Z,4,4,,CO,CLOSE,Y,,NO,CHATHAM,,,,,,,,,,,,,,,,48,2023-04-28T14:20:00.000Z,2023-04-28T14:40:00.000Z,6.833333333333333,0.2847222222222222,No,No,Yes,Yes,No,No,No,No,4,1
1034,Complete runout and float checks,23-38545,P-1402,P-1402,,,4-28-23 12:51 PM,2023-04-28T12:51:00.000Z,5-15-23 11:59 AM,2023-05-15T11:59:00.000Z,6-7-23 3:40 PM,2023-06-07T15:40:00.000Z,4,4,,CO,CLOSE,Y,,NO,CHATHAM,,,,,,,,,,,,,,,,48,2023-04-28T14:20:00.000Z,2023-04-28T14:40:00.000Z,6.833333333333333,0.2847222222222222,No,No,Yes,Yes,No,No,No,No,4,1
,I/E assist with Ferric Commissioning on Thurs May 4th.,23-38546,4100-26K-02,4100-26K-02,,,4-28-23 2:30 PM,2023-04-28T14:30:00.000Z,5-4-23 11:00 AM,2023-05-04T11:00:00.000Z,5-4-23 10:00 AM,2023-05-04T10:00:00.000Z,4,4,,CP,CLOSE,Y,,NO,CHATHAM,,,,,,,,,,,,,,,,50,2023-04-28T21:30:00.000Z,2023-04-28T22:10:00.000Z,209.16666666666666,8.715277777777779,No,No,No,Yes,No,No,No,No,4,1
,Clean housing,23-38549,,,,,4-28-23 2:58 PM,2023-04-28T14:58:00.000Z,,,5-9-23 8:46 AM,2023-05-09T08:46:00.000Z,4,4,,,CLOSE,Y,,NO,CHATHAM,,,,,,,,,,,,,,,,50,2023-04-28T21:30:00.000Z,2023-04-28T22:10:00.000Z,209.16666666666666,8.715277777777779,No,No,No,Yes,No,No,No,No,4,1
,Install bearings,23-38552,,,,,4-28-23 2:58 PM,2023-04-28T14:58:00.000Z,,,5-9-23 8:46 AM,2023-05-09T08:46:00.000Z,4,4,,,CLOSE,Y,,NO,CHATHAM,,,,,,,,,,,,,,,,50,2023-04-28T21:30:00.000Z,2023-04-28T22:10:00.000Z,209.16666666666666,8.715277777777779,No,No,No,Yes,No,No,No,No,4,1
,Disassemble pump,23-38548,,,,,4-28-23 2:58 PM,2023-04-28T14:58:00.000Z,,,5-9-23 8:46 AM,2023-05-09T08:46:00.000Z,4,4,,,CLOSE,Y,,NO,CHATHAM,,,,,,,,,,,,,,,,50,2023-04-28T21:30:00.000Z,2023-04-28T22:10:00.000Z,209.16666666666666,8.715277777777779,No,No,No,Yes,No,No,No,No,4,1
,Take measurements,23-38551,,,,,4-28-23 2:58 PM,2023-04-28T14:58:00.000Z,,,5-9-23 8:46 AM,2023-05-09T08:46:00.000Z,4,4,,,CLOSE,Y,,NO,CHATHAM,,,,,,,,,,,,,,,,50,2023-04-28T21:30:00.000Z,2023-04-28T22:10:00.000Z,209.16666666666666,8.715277777777779,No,No,No,Yes,No,No,No,No,4,1
,Assemble shaft w/ bearings into housing,23-38553,,,,,4-28-23 2:58 PM,2023-04-28T14:58:00.000Z,,,5-9-23 8:46 AM,2023-05-09T08:46:00.000Z,4,4,,,CLOSE,Y,,NO,CHATHAM,,,,,,,,,,,,,,,,50,2023-04-28T21:30:00.000Z,2023-04-28T22:10:00.000Z,209.16666666666666,8.715277777777779,No,No,No,Yes,No,No,No,No,4,1
,Complete runout and float checks,23-38554,,,,,4-28-23 2:58 PM,2023-04-28T14:58:00.000Z,,,5-9-23 8:46 AM,2023-05-09T08:46:00.000Z,4,4,,,CLOSE,Y,,NO,CHATHAM,,,,,,,,,,,,,,,,50,2023-04-28T21:30:00.000Z,2023-04-28T22:10:00.000Z,209.16666666666666,8.715277777777779,No,No,No,Yes,No,No,No,No,4,1
1035,Replace seal on P11402,23-38547,P-11402,P-11402,,,4-28-23 2:58 PM,2023-04-28T14:58:00.000Z,5-7-23 2:58 PM,2023-05-07T14:58:00.000Z,5-1-23 11:28 PM,2023-05-01T23:28:00.000Z,4,4,,CO,CLOSE,Y,N,NO,CHATHAM,,,,,,,,,,,,,,,,50,2023-04-28T21:30:00.000Z,2023-04-28T22:10:00.000Z,209.16666666666666,8.715277777777779,No,No,No,Yes,No,No,No,No,4,1
,Wire wheel shaft,23-38550,,,,,4-28-23 2:58 PM,2023-04-28T14:58:00.000Z,,,5-9-23 8:46 AM,2023-05-09T08:46:00.000Z,4,4,,,CLOSE,Y,,NO,CHATHAM,,,,,,,,,,,,,,,,50,2023-04-28T21:30:00.000Z,2023-04-28T22:10:00.000Z,209.16666666666666,8.715277777777779,No,No,No,Yes,No,No,No,No,4,1
3581,TA23 Repair leaking welded elbow on P1308 bypass line,23-31267,P-1308,P-1308,,,1-3-23 9:49 AM,2023-01-03T09:49:00.000Z,4-25-23 10:10 AM,2023-04-25T10:10:00.000Z,5-8-23 8:08 AM,2023-05-08T08:08:00.000Z,4,4,,CO,CLOSE,Y,,NO,CHATHAM,,,,,,,,,,,,,,,,53,2023-05-07T15:30:00.000Z,2023-05-07T16:00:00.000Z,23.5,0.9791666666666666,No,No,No,No,No,Yes,No,No,5,1
,Install Vibration sensors  on Mill A/B/C,23-32289,MI-1201A,MI-1201A,,,1-17-23 3:43 PM,2023-01-17T15:43:00.000Z,4-28-23 4:05 PM,2023-04-28T16:05:00.000Z,5-8-23 1:09 PM,2023-05-08T13:09:00.000Z,4,4,,SD,CLOSE,Y,,NO,CHATHAM,,,,,,,,,,,,,,,,53,2023-05-07T15:30:00.000Z,2023-05-07T16:00:00.000Z,23.5,0.9791666666666666,No,No,No,No,No,Yes,No,No,5,1
5450,INSTALL NEW VALVE ON SOUTH END,23-32327,TK-1301,TK-1301,,,1-18-23 10:40 AM,2023-01-18T10:40:00.000Z,,,5-8-23 12:03 PM,2023-05-08T12:03:00.000Z,4,4,,SD,CLOSE,Y,,NO,CHATHAM,,,,,,,,,,,,,,,,53,2023-05-07T15:30:00.000Z,2023-05-07T16:00:00.000Z,23.5,0.9791666666666666,No,No,No,No,No,Yes,No,No,5,1
5450,"TA23 TK-1301 replacement of 4\" 150# GATE VALVES",23-32325,TK-1301,TK-1301,,,1-18-23 10:40 AM,2023-01-18T10:40:00.000Z,4-24-23 10:41 AM,2023-04-24T10:41:00.000Z,5-8-23 12:03 PM,2023-05-08T12:03:00.000Z,4,4,,CO,CLOSE,Y,N,NO,CHATHAM,,,,,,,,,,,,,,,,53,2023-05-07T15:30:00.000Z,2023-05-07T16:00:00.000Z,23.5,0.9791666666666666,No,No,No,No,No,Yes,No,No,5,1
5450,REMOVE VALVE ON SOUTH END,23-32326,TK-1301,TK-1301,,,1-18-23 10:40 AM,2023-01-18T10:40:00.000Z,,,5-8-23 12:03 PM,2023-05-08T12:03:00.000Z,4,4,,SD,CLOSE,Y,,NO,CHATHAM,,,,,,,,,,,,,,,,53,2023-05-07T15:30:00.000Z,2023-05-07T16:00:00.000Z,23.5,0.9791666666666666,No,No,No,No,No,Yes,No,No,5,1
5450,RE-INSTALL INSULATION ON ALL PIPING,23-32341,TK-1301,TK-1301,,,1-19-23 7:13 AM,2023-01-19T07:13:00.000Z,4-24-23 10:41 AM,2023-04-24T10:41:00.000Z,5-8-23 12:03 PM,2023-05-08T12:03:00.000Z,4,4,,PM,CLOSE,Y,,NO,CHATHAM,,,,,,,,,,,,,,,,53,2023-05-07T15:30:00.000Z,2023-05-07T16:00:00.000Z,23.5,0.9791666666666666,No,No,No,No,No,Yes,No,No,5,1
5450,INSTALL NEW VALVE ON NORTH END,23-32340,TK-1301,TK-1301,,,1-19-23 7:13 AM,2023-01-19T07:13:00.000Z,4-24-23 10:41 AM,2023-04-24T10:41:00.000Z,5-8-23 12:03 PM,2023-05-08T12:03:00.000Z,4,4,,PM,CLOSE,Y,,NO,CHATHAM,,,,,,,,,,,,,,,,53,2023-05-07T15:30:00.000Z,2023-05-07T16:00:00.000Z,23.5,0.9791666666666666,No,No,No,No,No,Yes,No,No,5,1
5450,REMOVE VALVE ON NORTH END,23-32339,TK-1301,TK-1301,,,1-19-23 7:13 AM,2023-01-19T07:13:00.000Z,4-24-23 10:41 AM,2023-04-24T10:41:00.000Z,5-8-23 12:03 PM,2023-05-08T12:03:00.000Z,4,4,,PM,CLOSE,Y,,NO,CHATHAM,,,,,,,,,,,,,,,,53,2023-05-07T15:30:00.000Z,2023-05-07T16:00:00.000Z,23.5,0.9791666666666666,No,No,No,No,No,Yes,No,No,5,1
6455,TK1902 CIP Return Control Valve XV-19113 passing,23-34523,XV-19113,XV-19113,,,2-21-23 7:47 AM,2023-02-21T07:47:00.000Z,4-26-23 1:52 PM,2023-04-26T13:52:00.000Z,5-8-23 1:08 PM,2023-05-08T13:08:00.000Z,4,4,,SD,CLOSE,Y,,NO,CHATHAM,,,,,,,,,,,,,,,,53,2023-05-07T15:30:00.000Z,2023-05-07T16:00:00.000Z,23.5,0.9791666666666666,No,No,No,No,No,Yes,No,No,5,1
,REPLACE VALVE,23-35203,1300-PD-13E,1300-PD-13E,,,3-6-23 9:08 AM,2023-03-06T09:08:00.000Z,6-20-22 9:30 PM,2022-06-20T21:30:00.000Z,5-8-23 8:08 AM,2023-05-08T08:08:00.000Z,4,4,,SD,CLOSE,Y,,NO,CHATHAM,,,,,,,,,,,,,,,,53,2023-05-07T15:30:00.000Z,2023-05-07T16:00:00.000Z,23.5,0.9791666666666666,No,No,No,No,No,Yes,No,No,5,1
,RE-INSTALL INSULATION ON VALVE,23-35204,1300-PD-13E,1300-PD-13E,,,3-6-23 9:11 AM,2023-03-06T09:11:00.000Z,6-20-22 9:30 PM,2022-06-20T21:30:00.000Z,5-8-23 8:08 AM,2023-05-08T08:08:00.000Z,4,4,,SD,CLOSE,Y,,NO,CHATHAM,,,,,,,,,,,,,,,,53,2023-05-07T15:30:00.000Z,2023-05-07T16:00:00.000Z,23.5,0.9791666666666666,No,No,No,No,No,Yes,No,No,5,1
5475,REMOVE CHECK VALVES,23-35252,TK-1902,TK-1902,,,3-7-23 2:26 PM,2023-03-07T14:26:00.000Z,,,5-8-23 12:04 PM,2023-05-08T12:04:00.000Z,4,4,,SD,CLOSE,Y,,NO,CHATHAM,,,,,,,,,,,,,,,,53,2023-05-07T15:30:00.000Z,2023-05-07T16:00:00.000Z,23.5,0.9791666666666666,No,No,No,No,No,Yes,No,No,5,1
5475,INSTALL NEW CHECK VALVES,23-35253,TK-1902,TK-1902,,,3-7-23 2:26 PM,2023-03-07T14:26:00.000Z,,,5-8-23 12:04 PM,2023-05-08T12:04:00.000Z,4,4,,SD,CLOSE,Y,,NO,CHATHAM,,,,,,,,,,,,,,,,53,2023-05-07T15:30:00.000Z,2023-05-07T16:00:00.000Z,23.5,0.9791666666666666,No,No,No,No,No,Yes,No,No,5,1
,REMOVE INSULATION TO EXPOSE VALVE,23-35328,1300-PD-13C,1300-PD-13C,,,3-9-23 9:43 AM,2023-03-09T09:43:00.000Z,4-24-23 8:14 AM,2023-04-24T08:14:00.000Z,5-8-23 1:32 PM,2023-05-08T13:32:00.000Z,4,4,,SD,CLOSE,Y,,NO,CHATHAM,,,,,,,,,,,,,,,,53,2023-05-07T15:30:00.000Z,2023-05-07T16:00:00.000Z,23.5,0.9791666666666666,No,No,No,No,No,Yes,No,No,5,1
,REMOVE VALVE,23-35329,1300-PD-13C,1300-PD-13C,,,3-9-23 9:44 AM,2023-03-09T09:44:00.000Z,4-24-23 8:14 AM,2023-04-24T08:14:00.000Z,5-8-23 1:32 PM,2023-05-08T13:32:00.000Z,4,4,,SD,CLOSE,Y,,NO,CHATHAM,,,,,,,,,,,,,,,,53,2023-05-07T15:30:00.000Z,2023-05-07T16:00:00.000Z,23.5,0.9791666666666666,No,No,No,No,No,Yes,No,No,5,1
,INSTALL NEW VALVE,23-35330,1300-PD-13C,1300-PD-13C,,,3-9-23 9:45 AM,2023-03-09T09:45:00.000Z,4-24-23 8:14 AM,2023-04-24T08:14:00.000Z,5-8-23 1:32 PM,2023-05-08T13:32:00.000Z,4,4,,SD,CLOSE,Y,,NO,CHATHAM,,,,,,,,,,,,,,,,53,2023-05-07T15:30:00.000Z,2023-05-07T16:00:00.000Z,23.5,0.9791666666666666,No,No,No,No,No,Yes,No,No,5,1
,RE-INSTALL INSULATION,23-35331,1300-PD-13C,1300-PD-13C,,,3-9-23 9:45 AM,2023-03-09T09:45:00.000Z,4-24-23 8:14 AM,2023-04-24T08:14:00.000Z,5-8-23 1:32 PM,2023-05-08T13:32:00.000Z,4,4,,SD,CLOSE,Y,,NO,CHATHAM,,,,,,,,,,,,,,,,53,2023-05-07T15:30:00.000Z,2023-05-07T16:00:00.000Z,23.5,0.9791666666666666,No,No,No,No,No,Yes,No,No,5,1
1957,REMOVE INSULATION,23-35332,FT-13125,FT-13125,,,3-9-23 9:48 AM,2023-03-09T09:48:00.000Z,11-1-22 11:59 AM,2022-11-01T11:59:00.000Z,5-8-23 1:36 PM,2023-05-08T13:36:00.000Z,4,4,,SD,CLOSE,Y,,NO,CHATHAM,,,,,,,,,,,,,,,,53,2023-05-07T15:30:00.000Z,2023-05-07T16:00:00.000Z,23.5,0.9791666666666666,No,No,No,No,No,Yes,No,No,5,1
1957,MODIFY PIPING,23-35335,FT-13125,FT-13125,,,3-9-23 9:49 AM,2023-03-09T09:49:00.000Z,11-1-22 11:59 AM,2022-11-01T11:59:00.000Z,5-8-23 1:36 PM,2023-05-08T13:36:00.000Z,4,4,,SD,CLOSE,Y,,NO,CHATHAM,,,,,,,,,,,,,,,,53,2023-05-07T15:30:00.000Z,2023-05-07T16:00:00.000Z,23.5,0.9791666666666666,No,No,No,No,No,Yes,No,No,5,1
1957,TEST PIPING FOR TSSA,23-35333,FT-13125,FT-13125,,,3-9-23 9:49 AM,2023-03-09T09:49:00.000Z,11-1-22 11:59 AM,2022-11-01T11:59:00.000Z,5-8-23 1:36 PM,2023-05-08T13:36:00.000Z,4,4,,SD,CLOSE,Y,,NO,CHATHAM,,,,,,,,,,,,,,,,53,2023-05-07T15:30:00.000Z,2023-05-07T16:00:00.000Z,23.5,0.9791666666666666,No,No,No,No,No,Yes,No,No,5,1
1957,DISCONNECT ELEC,23-35334,FT-13125,FT-13125,,,3-9-23 9:49 AM,2023-03-09T09:49:00.000Z,11-1-22 11:59 AM,2022-11-01T11:59:00.000Z,5-8-23 1:36 PM,2023-05-08T13:36:00.000Z,4,4,,SD,CLOSE,Y,,NO,CHATHAM,,,,,,,,,,,,,,,,53,2023-05-07T15:30:00.000Z,2023-05-07T16:00:00.000Z,23.5,0.9791666666666666,No,No,No,No,No,Yes,No,No,5,1
1957,BUILD SCAFF TO ACCESS,23-35337,FT-13125,FT-13125,,,3-9-23 9:57 AM,2023-03-09T09:57:00.000Z,11-1-22 11:59 AM,2022-11-01T11:59:00.000Z,5-8-23 1:36 PM,2023-05-08T13:36:00.000Z,4,4,,SD,CLOSE,Y,,NO,CHATHAM,,,,,,,,,,,,,,,,53,2023-05-07T15:30:00.000Z,2023-05-07T16:00:00.000Z,23.5,0.9791666666666666,No,No,No,No,No,Yes,No,No,5,1
1957,RE-INSTALL ELEC,23-35339,FT-13125,FT-13125,,,3-9-23 9:58 AM,2023-03-09T09:58:00.000Z,11-1-22 11:59 AM,2022-11-01T11:59:00.000Z,5-8-23 1:36 PM,2023-05-08T13:36:00.000Z,4,4,,SD,CLOSE,Y,,NO,CHATHAM,,,,,,,,,,,,,,,,53,2023-05-07T15:30:00.000Z,2023-05-07T16:00:00.000Z,23.5,0.9791666666666666,No,No,No,No,No,Yes,No,No,5,1
1957,COMMISS NEW FT ON DCS,23-35340,FT-13125,FT-13125,,,3-9-23 9:58 AM,2023-03-09T09:58:00.000Z,11-1-22 11:59 AM,2022-11-01T11:59:00.000Z,5-8-23 1:36 PM,2023-05-08T13:36:00.000Z,4,4,,SD,CLOSE,Y,,NO,CHATHAM,,,,,,,,,,,,,,,,53,2023-05-07T15:30:00.000Z,2023-05-07T16:00:00.000Z,23.5,0.9791666666666666,No,No,No,No,No,Yes,No,No,5,1
1957,REMOVE/INSTALL NEW FT-13125,23-35338,FT-13125,FT-13125,,,3-9-23 9:58 AM,2023-03-09T09:58:00.000Z,11-1-22 11:59 AM,2022-11-01T11:59:00.000Z,5-8-23 1:36 PM,2023-05-08T13:36:00.000Z,4,4,,SD,CLOSE,Y,,NO,CHATHAM,,,,,,,,,,,,,,,,53,2023-05-07T15:30:00.000Z,2023-05-07T16:00:00.000Z,23.5,0.9791666666666666,No,No,No,No,No,Yes,No,No,5,1
1957,RE-INSTALL INSUATION,23-35341,FT-13125,FT-13125,,,3-9-23 9:59 AM,2023-03-09T09:59:00.000Z,11-1-22 11:59 AM,2022-11-01T11:59:00.000Z,5-8-23 1:36 PM,2023-05-08T13:36:00.000Z,4,4,,SD,CLOSE,Y,,NO,CHATHAM,,,,,,,,,,,,,,,,53,2023-05-07T15:30:00.000Z,2023-05-07T16:00:00.000Z,23.5,0.9791666666666666,No,No,No,No,No,Yes,No,No,5,1
1957,REMOVE SCAFF,23-35342,FT-13125,FT-13125,,,3-9-23 9:59 AM,2023-03-09T09:59:00.000Z,11-1-22 11:59 AM,2022-11-01T11:59:00.000Z,5-8-23 1:36 PM,2023-05-08T13:36:00.000Z,4,4,,SD,CLOSE,Y,,NO,CHATHAM,,,,,,,,,,,,,,,,53,2023-05-07T15:30:00.000Z,2023-05-07T16:00:00.000Z,23.5,0.9791666666666666,No,No,No,No,No,Yes,No,No,5,1
,INSTALL NEW VALVE,23-35400,EJ-1302,EJ-1302,,,3-10-23 11:49 AM,2023-03-10T11:49:00.000Z,4-23-23 4:34 PM,2023-04-23T16:34:00.000Z,5-8-23 1:33 PM,2023-05-08T13:33:00.000Z,4,4,,SD,CLOSE,Y,,NO,CHATHAM,,,,,,,,,,,,,,,,53,2023-05-07T15:30:00.000Z,2023-05-07T16:00:00.000Z,23.5,0.9791666666666666,No,No,No,No,No,Yes,No,No,5,1
,BUILD SCAFF TO ACCESS VALVE,23-35398,EJ-1302,EJ-1302,,,3-10-23 11:49 AM,2023-03-10T11:49:00.000Z,4-23-23 4:34 PM,2023-04-23T16:34:00.000Z,5-8-23 1:33 PM,2023-05-08T13:33:00.000Z,4,4,,SD,CLOSE,Y,,NO,CHATHAM,,,,,,,,,,,,,,,,53,2023-05-07T15:30:00.000Z,2023-05-07T16:00:00.000Z,23.5,0.9791666666666666,No,No,No,No,No,Yes,No,No,5,1
,REMOVE VALVE,23-35399,EJ-1302,EJ-1302,,,3-10-23 11:49 AM,2023-03-10T11:49:00.000Z,4-23-23 4:34 PM,2023-04-23T16:34:00.000Z,5-8-23 1:33 PM,2023-05-08T13:33:00.000Z,4,4,,SD,CLOSE,Y,,NO,CHATHAM,,,,,,,,,,,,,,,,53,2023-05-07T15:30:00.000Z,2023-05-07T16:00:00.000Z,23.5,0.9791666666666666,No,No,No,No,No,Yes,No,No,5,1
,REMOVE SCAFF,23-35401,EJ-1302,EJ-1302,,,3-10-23 11:50 AM,2023-03-10T11:50:00.000Z,4-23-23 4:34 PM,2023-04-23T16:34:00.000Z,5-8-23 1:33 PM,2023-05-08T13:33:00.000Z,4,4,,SD,CLOSE,Y,,NO,CHATHAM,,,,,,,,,,,,,,,,53,2023-05-07T15:30:00.000Z,2023-05-07T16:00:00.000Z,23.5,0.9791666666666666,No,No,No,No,No,Yes,No,No,5,1
2171,Remove existing control valve for inspection/service,23-35403,FV-13206,FV-13206,,,3-10-23 11:54 AM,2023-03-10T11:54:00.000Z,5-31-23 2:53 PM,2023-05-31T14:53:00.000Z,5-8-23 1:06 PM,2023-05-08T13:06:00.000Z,4,4,,SD,CLOSE,Y,,NO,CHATHAM,,,,,,,,,,,,,,,,53,2023-05-07T15:30:00.000Z,2023-05-07T16:00:00.000Z,23.5,0.9791666666666666,No,No,No,No,No,Yes,No,No,5,1
2171,Replace upstream and downstream isolation valves (city water),23-35402,FV-13206,FV-13206,,,3-10-23 11:54 AM,2023-03-10T11:54:00.000Z,5-31-23 2:53 PM,2023-05-31T14:53:00.000Z,5-8-23 1:06 PM,2023-05-08T13:06:00.000Z,4,4,,SD,CLOSE,Y,,NO,CHATHAM,,,,,,,,,,,,,,,,53,2023-05-07T15:30:00.000Z,2023-05-07T16:00:00.000Z,23.5,0.9791666666666666,No,No,No,No,No,Yes,No,No,5,1
2171,Service in Field (if possible),23-35404,FV-13206,FV-13206,,,3-10-23 11:55 AM,2023-03-10T11:55:00.000Z,5-31-23 2:53 PM,2023-05-31T14:53:00.000Z,5-8-23 1:06 PM,2023-05-08T13:06:00.000Z,4,4,,SD,CLOSE,Y,,NO,CHATHAM,,,,,,,,,,,,,,,,53,2023-05-07T15:30:00.000Z,2023-05-07T16:00:00.000Z,23.5,0.9791666666666666,No,No,No,No,No,Yes,No,No,5,1
1491,SD22 -Mash Feed Forward to E-1403 Passing,23-35744,E-1403,E-1403,,,3-13-23 3:42 PM,2023-03-13T15:42:00.000Z,,,5-8-23 11:38 AM,2023-05-08T11:38:00.000Z,4,4,,CO,CLOSE,Y,,NO,CHATHAM,,,,,,,,,,,,,,,,53,2023-05-07T15:30:00.000Z,2023-05-07T16:00:00.000Z,23.5,0.9791666666666666,No,No,No,No,No,Yes,No,No,5,1
6284,REPLACE RUPTURE DISK,23-35905,V-1305,V-1305,,,3-15-23 8:04 AM,2023-03-15T08:04:00.000Z,4-28-23 1:06 PM,2023-04-28T13:06:00.000Z,5-8-23 1:00 PM,2023-05-08T13:00:00.000Z,4,4,,SD,CLOSE,Y,,NO,CHATHAM,,,,,,,,,,,,,,,,53,2023-05-07T15:30:00.000Z,2023-05-07T16:00:00.000Z,23.5,0.9791666666666666,No,No,No,No,No,Yes,No,No,5,1
1491,REPLACE CIP VALVES,23-35912,E-1403,E-1403,,,3-15-23 9:49 AM,2023-03-15T09:49:00.000Z,6-24-22 4:05 PM,2022-06-24T16:05:00.000Z,5-8-23 11:45 AM,2023-05-08T11:45:00.000Z,4,4,,SD,CLOSE,Y,,NO,CHATHAM,,,,,,,,,,,,,,,,53,2023-05-07T15:30:00.000Z,2023-05-07T16:00:00.000Z,23.5,0.9791666666666666,No,No,No,No,No,Yes,No,No,5,1
6455,REMOVE AIR & CONTROL VALVES,23-36289,XV-19113,XV-19113,,,3-21-23 1:12 PM,2023-03-21T13:12:00.000Z,4-26-23 1:52 PM,2023-04-26T13:52:00.000Z,5-8-23 1:08 PM,2023-05-08T13:08:00.000Z,4,4,,SD,CLOSE,Y,,NO,CHATHAM,,,,,,,,,,,,,,,,53,2023-05-07T15:30:00.000Z,2023-05-07T16:00:00.000Z,23.5,0.9791666666666666,No,No,No,No,No,Yes,No,No,5,1
6455,REMOVE VALVE,23-36290,XV-19113,XV-19113,,,3-21-23 1:12 PM,2023-03-21T13:12:00.000Z,4-26-23 1:52 PM,2023-04-26T13:52:00.000Z,5-8-23 1:08 PM,2023-05-08T13:08:00.000Z,4,4,,SD,CLOSE,Y,,NO,CHATHAM,,,,,,,,,,,,,,,,53,2023-05-07T15:30:00.000Z,2023-05-07T16:00:00.000Z,23.5,0.9791666666666666,No,No,No,No,No,Yes,No,No,5,1
6455,CRANE ASSIST IN REMOVAL OF VALVES,23-36291,XV-19113,XV-19113,,,3-21-23 1:13 PM,2023-03-21T13:13:00.000Z,4-26-23 1:52 PM,2023-04-26T13:52:00.000Z,5-8-23 1:08 PM,2023-05-08T13:08:00.000Z,4,4,,SD,CLOSE,Y,,NO,CHATHAM,,,,,,,,,,,,,,,,53,2023-05-07T15:30:00.000Z,2023-05-07T16:00:00.000Z,23.5,0.9791666666666666,No,No,No,No,No,Yes,No,No,5,1
6455,PREP  VALVES TO SHIP OFF-SITE (EVEREST),23-36292,XV-19113,XV-19113,,,3-21-23 1:13 PM,2023-03-21T13:13:00.000Z,4-26-23 1:52 PM,2023-04-26T13:52:00.000Z,5-8-23 1:08 PM,2023-05-08T13:08:00.000Z,4,4,,SD,CLOSE,Y,,NO,CHATHAM,,,,,,,,,,,,,,,,53,2023-05-07T15:30:00.000Z,2023-05-07T16:00:00.000Z,23.5,0.9791666666666666,No,No,No,No,No,Yes,No,No,5,1
6455,RE-INSTALL AIR & CONTROLS,23-36295,XV-19113,XV-19113,,,3-21-23 1:15 PM,2023-03-21T13:15:00.000Z,4-26-23 1:52 PM,2023-04-26T13:52:00.000Z,5-8-23 1:08 PM,2023-05-08T13:08:00.000Z,4,4,,SD,CLOSE,Y,,NO,CHATHAM,,,,,,,,,,,,,,,,53,2023-05-07T15:30:00.000Z,2023-05-07T16:00:00.000Z,23.5,0.9791666666666666,No,No,No,No,No,Yes,No,No,5,1
6455,CRANE ASSIST IN INSTALL OF VALVES,23-36294,XV-19113,XV-19113,,,3-21-23 1:15 PM,2023-03-21T13:15:00.000Z,4-26-23 1:52 PM,2023-04-26T13:52:00.000Z,5-8-23 1:08 PM,2023-05-08T13:08:00.000Z,4,4,,SD,CLOSE,Y,,NO,CHATHAM,,,,,,,,,,,,,,,,53,2023-05-07T15:30:00.000Z,2023-05-07T16:00:00.000Z,23.5,0.9791666666666666,No,No,No,No,No,Yes,No,No,5,1
6455,INSTALL VALVES INTO SERVICE,23-36293,XV-19113,XV-19113,,,3-21-23 1:15 PM,2023-03-21T13:15:00.000Z,4-26-23 1:52 PM,2023-04-26T13:52:00.000Z,5-8-23 1:08 PM,2023-05-08T13:08:00.000Z,4,4,,SD,CLOSE,Y,,NO,CHATHAM,,,,,,,,,,,,,,,,53,2023-05-07T15:30:00.000Z,2023-05-07T16:00:00.000Z,23.5,0.9791666666666666,No,No,No,No,No,Yes,No,No,5,1
6455,STROKE CHECK VALVES,23-36296,XV-19113,XV-19113,,,3-21-23 1:16 PM,2023-03-21T13:16:00.000Z,4-26-23 1:52 PM,2023-04-26T13:52:00.000Z,5-8-23 1:08 PM,2023-05-08T13:08:00.000Z,4,4,,SD,CLOSE,Y,,NO,CHATHAM,,,,,,,,,,,,,,,,53,2023-05-07T15:30:00.000Z,2023-05-07T16:00:00.000Z,23.5,0.9791666666666666,No,No,No,No,No,Yes,No,No,5,1
,REMOVE INSULATION,23-36321,1300-PD-13E,1300-PD-13E,,,3-22-23 8:55 AM,2023-03-22T08:55:00.000Z,6-20-22 9:30 PM,2022-06-20T21:30:00.000Z,5-8-23 8:08 AM,2023-05-08T08:08:00.000Z,4,4,,SD,CLOSE,Y,,NO,CHATHAM,,,,,,,,,,,,,,,,53,2023-05-07T15:30:00.000Z,2023-05-07T16:00:00.000Z,23.5,0.9791666666666666,No,No,No,No,No,Yes,No,No,5,1
1491,REMOVE VALVE,23-36390,E-1403,E-1403,,,3-24-23 8:36 AM,2023-03-24T08:36:00.000Z,,,5-8-23 11:38 AM,2023-05-08T11:38:00.000Z,4,4,,CO,CLOSE,Y,,NO,CHATHAM,,,,,,,,,,,,,,,,53,2023-05-07T15:30:00.000Z,2023-05-07T16:00:00.000Z,23.5,0.9791666666666666,No,No,No,No,No,Yes,No,No,5,1
1491,INSTALL NEW VALVE,23-36391,E-1403,E-1403,,,3-24-23 8:37 AM,2023-03-24T08:37:00.000Z,,,5-8-23 11:38 AM,2023-05-08T11:38:00.000Z,4,4,,CO,CLOSE,Y,,NO,CHATHAM,,,,,,,,,,,,,,,,53,2023-05-07T15:30:00.000Z,2023-05-07T16:00:00.000Z,23.5,0.9791666666666666,No,No,No,No,No,Yes,No,No,5,1
,DRILL / INSTALL NEW SENSORS,23-36392,MI-1201A,MI-1201A,,,3-24-23 8:41 AM,2023-03-24T08:41:00.000Z,4-28-23 4:05 PM,2023-04-28T16:05:00.000Z,5-8-23 1:09 PM,2023-05-08T13:09:00.000Z,4,4,,SD,CLOSE,Y,,NO,CHATHAM,,,,,,,,,,,,,,,,53,2023-05-07T15:30:00.000Z,2023-05-07T16:00:00.000Z,23.5,0.9791666666666666,No,No,No,No,No,Yes,No,No,5,1
,Hang cork board in loading office,23-36802,0000,0000,,,3-29-23 2:55 PM,2023-03-29T14:55:00.000Z,4-9-23 10:52 PM,2023-04-09T22:52:00.000Z,5-8-23 8:03 AM,2023-05-08T08:03:00.000Z,4,4,,CO,CLOSE,Y,,NO,CHATHAM,,,,,,,,,,,,,,,,53,2023-05-07T15:30:00.000Z,2023-05-07T16:00:00.000Z,23.5,0.9791666666666666,No,No,No,No,No,Yes,No,No,5,1
,Repair damaged unistrut,23-37167,3500,3500,,,4-4-23 1:57 PM,2023-04-04T13:57:00.000Z,4-30-23 4:17 PM,2023-04-30T16:17:00.000Z,5-8-23 8:02 AM,2023-05-08T08:02:00.000Z,4,4,,CO,CLOSE,Y,,NO,CHATHAM,,,,,,,,,,,,,,,,53,2023-05-07T15:30:00.000Z,2023-05-07T16:00:00.000Z,23.5,0.9791666666666666,No,No,No,No,No,Yes,No,No,5,1
,Inspection Drive needs to be set up for chain inspection,23-37192,CV-1719,CV-1719,,,4-5-23 11:36 AM,2023-04-05T11:36:00.000Z,4-16-23 6:16 AM,2023-04-16T06:16:00.000Z,5-8-23 11:09 AM,2023-05-08T11:09:00.000Z,2,2,,CO,CLOSE,Y,,NO,CHATHAM,,,,,,,,,,,,,,,,53,2023-05-07T15:30:00.000Z,2023-05-07T16:00:00.000Z,23.5,0.9791666666666666,No,No,No,No,No,Yes,No,No,5,1
,Pinhole Leak on Fermentation Alley Utility Water Header,23-37599,1400,1400,,,4-13-23 2:47 AM,2023-04-13T02:47:00.000Z,4-21-23 1:37 AM,2023-04-21T01:37:00.000Z,5-8-23 11:11 AM,2023-05-08T11:11:00.000Z,2,2,,RM,CLOSE,Y,,NO,CHATHAM,,,,,,,,,,,,,,,,53,2023-05-07T15:30:00.000Z,2023-05-07T16:00:00.000Z,23.5,0.9791666666666666,No,No,No,No,No,Yes,No,No,5,1
,"Fix pin hole water leak on 4\" utility water 1400 alley",23-37610,1400,1400,,,4-13-23 8:21 AM,2023-04-13T08:21:00.000Z,4-21-23 8:21 AM,2023-04-21T08:21:00.000Z,5-8-23 1:34 PM,2023-05-08T13:34:00.000Z,2,2,,RM,CLOSE,Y,,NO,CHATHAM,,,,,,,,,,,,,,,,53,2023-05-07T15:30:00.000Z,2023-05-07T16:00:00.000Z,23.5,0.9791666666666666,No,No,No,No,No,Yes,No,No,5,1
1575,Found Work TA23 - HPW HC Vacuum System piping,23-37969,E-6563,E-6563,,,4-17-23 1:00 PM,2023-04-17T13:00:00.000Z,4-20-23 12:56 PM,2023-04-20T12:56:00.000Z,5-8-23 1:35 PM,2023-05-08T13:35:00.000Z,4,4,,SD,CLOSE,Y,,NO,CHATHAM,,,,,,,,,,,,,,,,53,2023-05-07T15:30:00.000Z,2023-05-07T16:00:00.000Z,23.5,0.9791666666666666,No,No,No,No,No,Yes,No,No,5,1
,Pull spinners out of tk-1306/1307,23-38494,,,,,4-27-23 9:12 AM,2023-04-27T09:12:00.000Z,5-7-23 9:12 AM,2023-05-07T09:12:00.000Z,5-8-23 11:12 AM,2023-05-08T11:12:00.000Z,4,4,,CO,CLOSE,Y,,NO,CHATHAM,,,,,,,,,,,,,,,,53,2023-05-07T15:30:00.000Z,2023-05-07T16:00:00.000Z,23.5,0.9791666666666666,No,No,No,No,No,Yes,No,No,5,1
3224,Level transmitter not reading properly on TK2373A,23-38886,LT-37202,LT-37202,,,5-4-23 8:22 AM,2023-05-04T08:22:00.000Z,5-12-23 8:08 AM,2023-05-12T08:08:00.000Z,5-8-23 12:08 PM,2023-05-08T12:08:00.000Z,4,4,,CO,CLOSE,Y,,NO,CHATHAM,,,,,,,,,,,,,,,,53,2023-05-07T15:30:00.000Z,2023-05-07T16:00:00.000Z,23.5,0.9791666666666666,No,No,No,No,No,Yes,No,No,5,1
5466,Install Blanks for HPW of TK-1404,23-38898,TK-1404,TK-1404,,,5-5-23 8:38 AM,2023-05-05T08:38:00.000Z,5-8-23 11:00 AM,2023-05-08T11:00:00.000Z,5-8-23 11:00 AM,2023-05-08T11:00:00.000Z,4,4,,CO,CLOSE,Y,,NO,CHATHAM,,,,,,,,,,,,,,,,53,2023-05-07T15:30:00.000Z,2023-05-07T16:00:00.000Z,23.5,0.9791666666666666,No,No,No,No,No,Yes,No,No,5,1
1363,Re-install repaired ladder cage on C-1571,23-38899,C-1571,C-1571,,,5-5-23 8:50 AM,2023-05-05T08:50:00.000Z,5-8-23 3:00 PM,2023-05-08T15:00:00.000Z,5-8-23 3:00 PM,2023-05-08T15:00:00.000Z,4,4,,CO,CLOSE,Y,,NO,CHATHAM,,,,,,,,,,,,,,,,53,2023-05-07T15:30:00.000Z,2023-05-07T16:00:00.000Z,23.5,0.9791666666666666,No,No,No,No,No,Yes,No,No,5,1
3707,Replace gasket on suction line after the strainer,23-38904,P-2401,P-2401,,,5-5-23 9:49 AM,2023-05-05T09:49:00.000Z,5-8-23 10:45 AM,2023-05-08T10:45:00.000Z,5-8-23 10:00 AM,2023-05-08T10:00:00.000Z,2,2,,CO,CLOSE,Y,,NO,CHATHAM,,,,,,,,,,,,,,,,53,2023-05-07T15:30:00.000Z,2023-05-07T16:00:00.000Z,23.5,0.9791666666666666,No,No,No,No,No,Yes,No,No,5,1
1432,(Pre) OPS to Empty / Lower Bin Levels incase need CSE Entry,23-39157,CV-2106,CV-2106,,,5-8-23 7:44 AM,2023-05-08T07:44:00.000Z,4-18-22 10:09 AM,2022-04-18T10:09:00.000Z,5-8-23 8:06 AM,2023-05-08T08:06:00.000Z,4,4,,CO,CLOSE,Y,,NO,CHATHAM,,,,,,,,,,,,,,,,53,2023-05-07T15:30:00.000Z,2023-05-07T16:00:00.000Z,23.5,0.9791666666666666,No,No,No,No,No,Yes,No,No,5,1
1432,(Pre 2 weeks Prior ) Shafts/Sprockets and Keys aligned,23-39159,CV-2106,CV-2106,,,5-8-23 7:45 AM,2023-05-08T07:45:00.000Z,4-18-22 10:09 AM,2022-04-18T10:09:00.000Z,5-8-23 8:06 AM,2023-05-08T08:06:00.000Z,4,4,,CO,CLOSE,Y,,NO,CHATHAM,,,,,,,,,,,,,,,,53,2023-05-07T15:30:00.000Z,2023-05-07T16:00:00.000Z,23.5,0.9791666666666666,No,No,No,No,No,Yes,No,No,5,1
1432,(Pre 2 weeks Prior) Instal Chain on flat rack / running gear,23-39158,CV-2106,CV-2106,,,5-8-23 7:45 AM,2023-05-08T07:45:00.000Z,4-18-22 10:09 AM,2022-04-18T10:09:00.000Z,5-8-23 8:06 AM,2023-05-08T08:06:00.000Z,4,4,,CO,CLOSE,Y,,NO,CHATHAM,,,,,,,,,,,,,,,,53,2023-05-07T15:30:00.000Z,2023-05-07T16:00:00.000Z,23.5,0.9791666666666666,No,No,No,No,No,Yes,No,No,5,1
1432,"(Pre) Pull Lids off, Inspect Head and Clean Tail",23-39160,CV-2106,CV-2106,,,5-8-23 7:46 AM,2023-05-08T07:46:00.000Z,4-18-22 10:09 AM,2022-04-18T10:09:00.000Z,5-8-23 8:06 AM,2023-05-08T08:06:00.000Z,4,4,,CO,CLOSE,Y,,NO,CHATHAM,,,,,,,,,,,,,,,,53,2023-05-07T15:30:00.000Z,2023-05-07T16:00:00.000Z,23.5,0.9791666666666666,No,No,No,No,No,Yes,No,No,5,1
1432,Disconnect Motor and Speed Switch,23-39162,CV-2106,CV-2106,,,5-8-23 7:46 AM,2023-05-08T07:46:00.000Z,4-18-22 10:09 AM,2022-04-18T10:09:00.000Z,5-8-23 8:06 AM,2023-05-08T08:06:00.000Z,4,4,,CO,CLOSE,Y,,NO,CHATHAM,,,,,,,,,,,,,,,,53,2023-05-07T15:30:00.000Z,2023-05-07T16:00:00.000Z,23.5,0.9791666666666666,No,No,No,No,No,Yes,No,No,5,1
1432,(Pre) OPS to set up Water/ Fire Hose,23-39161,CV-2106,CV-2106,,,5-8-23 7:46 AM,2023-05-08T07:46:00.000Z,4-18-22 10:09 AM,2022-04-18T10:09:00.000Z,5-8-23 8:06 AM,2023-05-08T08:06:00.000Z,4,4,,CO,CLOSE,Y,,NO,CHATHAM,,,,,,,,,,,,,,,,53,2023-05-07T15:30:00.000Z,2023-05-07T16:00:00.000Z,23.5,0.9791666666666666,No,No,No,No,No,Yes,No,No,5,1
1432,Attach Crane to Chain & Fish Rope to Chain,23-39164,CV-2106,CV-2106,,,5-8-23 7:47 AM,2023-05-08T07:47:00.000Z,4-18-22 10:09 AM,2022-04-18T10:09:00.000Z,5-8-23 8:06 AM,2023-05-08T08:06:00.000Z,4,4,,CO,CLOSE,Y,,NO,CHATHAM,,,,,,,,,,,,,,,,53,2023-05-07T15:30:00.000Z,2023-05-07T16:00:00.000Z,23.5,0.9791666666666666,No,No,No,No,No,Yes,No,No,5,1
1432,Wet Down Inside the Drag,23-39163,CV-2106,CV-2106,,,5-8-23 7:47 AM,2023-05-08T07:47:00.000Z,4-18-22 10:09 AM,2022-04-18T10:09:00.000Z,5-8-23 8:06 AM,2023-05-08T08:06:00.000Z,4,4,,CO,CLOSE,Y,,NO,CHATHAM,,,,,,,,,,,,,,,,53,2023-05-07T15:30:00.000Z,2023-05-07T16:00:00.000Z,23.5,0.9791666666666666,No,No,No,No,No,Yes,No,No,5,1
1432,Pull out Chain from Head Sprocket,23-39165,CV-2106,CV-2106,,,5-8-23 7:47 AM,2023-05-08T07:47:00.000Z,4-18-22 10:09 AM,2022-04-18T10:09:00.000Z,5-8-23 8:06 AM,2023-05-08T08:06:00.000Z,4,4,,CO,CLOSE,Y,,NO,CHATHAM,,,,,,,,,,,,,,,,53,2023-05-07T15:30:00.000Z,2023-05-07T16:00:00.000Z,23.5,0.9791666666666666,No,No,No,No,No,Yes,No,No,5,1
1432,Use Nissan Fork Lift Rope Tugger for Pulling Chain,23-39167,CV-2106,CV-2106,,,5-8-23 7:48 AM,2023-05-08T07:48:00.000Z,4-18-22 10:09 AM,2022-04-18T10:09:00.000Z,5-8-23 8:06 AM,2023-05-08T08:06:00.000Z,4,4,,CO,CLOSE,Y,,NO,CHATHAM,,,,,,,,,,,,,,,,53,2023-05-07T15:30:00.000Z,2023-05-07T16:00:00.000Z,23.5,0.9791666666666666,No,No,No,No,No,Yes,No,No,5,1
1432,Install Fire Blanket Padded / Wet Down,23-39168,CV-2106,CV-2106,,,5-8-23 7:48 AM,2023-05-08T07:48:00.000Z,4-18-22 10:09 AM,2022-04-18T10:09:00.000Z,5-8-23 8:06 AM,2023-05-08T08:06:00.000Z,4,4,,CO,CLOSE,Y,,NO,CHATHAM,,,,,,,,,,,,,,,,53,2023-05-07T15:30:00.000Z,2023-05-07T16:00:00.000Z,23.5,0.9791666666666666,No,No,No,No,No,Yes,No,No,5,1
1432,Stag Crane at Corn Lift,23-39166,CV-2106,CV-2106,,,5-8-23 7:48 AM,2023-05-08T07:48:00.000Z,4-18-22 10:09 AM,2022-04-18T10:09:00.000Z,5-8-23 8:06 AM,2023-05-08T08:06:00.000Z,4,4,,CO,CLOSE,Y,,NO,CHATHAM,,,,,,,,,,,,,,,,53,2023-05-07T15:30:00.000Z,2023-05-07T16:00:00.000Z,23.5,0.9791666666666666,No,No,No,No,No,Yes,No,No,5,1
1432,Pull In Tug Rope with Fish Rope,23-39173,CV-2106,CV-2106,,,5-8-23 7:49 AM,2023-05-08T07:49:00.000Z,4-18-22 10:09 AM,2022-04-18T10:09:00.000Z,5-8-23 8:06 AM,2023-05-08T08:06:00.000Z,4,4,,CO,CLOSE,Y,,NO,CHATHAM,,,,,,,,,,,,,,,,53,2023-05-07T15:30:00.000Z,2023-05-07T16:00:00.000Z,23.5,0.9791666666666666,No,No,No,No,No,Yes,No,No,5,1
1432,Install new head /tail with Bearing and Sprockets In-set,23-39172,CV-2106,CV-2106,,,5-8-23 7:49 AM,2023-05-08T07:49:00.000Z,4-18-22 10:09 AM,2022-04-18T10:09:00.000Z,5-8-23 8:06 AM,2023-05-08T08:06:00.000Z,4,4,,CO,CLOSE,Y,,NO,CHATHAM,,,,,,,,,,,,,,,,53,2023-05-07T15:30:00.000Z,2023-05-07T16:00:00.000Z,23.5,0.9791666666666666,No,No,No,No,No,Yes,No,No,5,1
1432,Wet Down Head and Tail Sections,23-39169,CV-2106,CV-2106,,,5-8-23 7:49 AM,2023-05-08T07:49:00.000Z,4-18-22 10:09 AM,2022-04-18T10:09:00.000Z,5-8-23 8:06 AM,2023-05-08T08:06:00.000Z,4,4,,CO,CLOSE,Y,,NO,CHATHAM,,,,,,,,,,,,,,,,53,2023-05-07T15:30:00.000Z,2023-05-07T16:00:00.000Z,23.5,0.9791666666666666,No,No,No,No,No,Yes,No,No,5,1
1432,Remove Gear Box,23-39170,CV-2106,CV-2106,,,5-8-23 7:49 AM,2023-05-08T07:49:00.000Z,4-18-22 10:09 AM,2022-04-18T10:09:00.000Z,5-8-23 8:06 AM,2023-05-08T08:06:00.000Z,4,4,,CO,CLOSE,Y,,NO,CHATHAM,,,,,,,,,,,,,,,,53,2023-05-07T15:30:00.000Z,2023-05-07T16:00:00.000Z,23.5,0.9791666666666666,No,No,No,No,No,Yes,No,No,5,1
1432,Cut Head Shaft on Head and Tail On each side of Spockets,23-39171,CV-2106,CV-2106,,,5-8-23 7:49 AM,2023-05-08T07:49:00.000Z,4-18-22 10:09 AM,2022-04-18T10:09:00.000Z,5-8-23 8:06 AM,2023-05-08T08:06:00.000Z,4,4,,CO,CLOSE,Y,,NO,CHATHAM,,,,,,,,,,,,,,,,53,2023-05-07T15:30:00.000Z,2023-05-07T16:00:00.000Z,23.5,0.9791666666666666,No,No,No,No,No,Yes,No,No,5,1
1432,Lift Chain Sections in & Start Pulling 40' sections,23-39174,CV-2106,CV-2106,,,5-8-23 7:50 AM,2023-05-08T07:50:00.000Z,4-18-22 10:09 AM,2022-04-18T10:09:00.000Z,5-8-23 8:06 AM,2023-05-08T08:06:00.000Z,4,4,,CO,CLOSE,Y,,NO,CHATHAM,,,,,,,,,,,,,,,,53,2023-05-07T15:30:00.000Z,2023-05-07T16:00:00.000Z,23.5,0.9791666666666666,No,No,No,No,No,Yes,No,No,5,1
1432,Connect Chain every 40's,23-39175,CV-2106,CV-2106,,,5-8-23 7:50 AM,2023-05-08T07:50:00.000Z,4-18-22 10:09 AM,2022-04-18T10:09:00.000Z,5-8-23 8:06 AM,2023-05-08T08:06:00.000Z,4,4,,CO,CLOSE,Y,,NO,CHATHAM,,,,,,,,,,,,,,,,53,2023-05-07T15:30:00.000Z,2023-05-07T16:00:00.000Z,23.5,0.9791666666666666,No,No,No,No,No,Yes,No,No,5,1
1432,Splice Chain Together,23-39176,CV-2106,CV-2106,,,5-8-23 7:50 AM,2023-05-08T07:50:00.000Z,4-18-22 10:09 AM,2022-04-18T10:09:00.000Z,5-8-23 8:06 AM,2023-05-08T08:06:00.000Z,4,4,,CO,CLOSE,Y,,NO,CHATHAM,,,,,,,,,,,,,,,,53,2023-05-07T15:30:00.000Z,2023-05-07T16:00:00.000Z,23.5,0.9791666666666666,No,No,No,No,No,Yes,No,No,5,1
1432,Install New Gear Box/Repack Bearings,23-39177,CV-2106,CV-2106,,,5-8-23 7:50 AM,2023-05-08T07:50:00.000Z,4-18-22 10:09 AM,2022-04-18T10:09:00.000Z,5-8-23 8:06 AM,2023-05-08T08:06:00.000Z,4,4,,CO,CLOSE,Y,,NO,CHATHAM,,,,,,,,,,,,,,,,53,2023-05-07T15:30:00.000Z,2023-05-07T16:00:00.000Z,23.5,0.9791666666666666,No,No,No,No,No,Yes,No,No,5,1
1432,Install Motor / Speed Switch / Rotate,23-39178,CV-2106,CV-2106,,,5-8-23 7:50 AM,2023-05-08T07:50:00.000Z,4-18-22 10:09 AM,2022-04-18T10:09:00.000Z,5-8-23 8:06 AM,2023-05-08T08:06:00.000Z,4,4,,CO,CLOSE,Y,,NO,CHATHAM,,,,,,,,,,,,,,,,53,2023-05-07T15:30:00.000Z,2023-05-07T16:00:00.000Z,23.5,0.9791666666666666,No,No,No,No,No,Yes,No,No,5,1
1432,Tension Chain to Spec,23-39180,CV-2106,CV-2106,,,5-8-23 7:51 AM,2023-05-08T07:51:00.000Z,4-18-22 10:09 AM,2022-04-18T10:09:00.000Z,5-8-23 8:06 AM,2023-05-08T08:06:00.000Z,4,4,,CO,CLOSE,Y,,NO,CHATHAM,,,,,,,,,,,,,,,,53,2023-05-07T15:30:00.000Z,2023-05-07T16:00:00.000Z,23.5,0.9791666666666666,No,No,No,No,No,Yes,No,No,5,1
1432,Modify the Guard as needed,23-39179,CV-2106,CV-2106,,,5-8-23 7:51 AM,2023-05-08T07:51:00.000Z,4-18-22 10:09 AM,2022-04-18T10:09:00.000Z,5-8-23 8:06 AM,2023-05-08T08:06:00.000Z,4,4,,CO,CLOSE,Y,,NO,CHATHAM,,,,,,,,,,,,,,,,53,2023-05-07T15:30:00.000Z,2023-05-07T16:00:00.000Z,23.5,0.9791666666666666,No,No,No,No,No,Yes,No,No,5,1
1432,Re-Install Guard,23-39181,CV-2106,CV-2106,,,5-8-23 7:52 AM,2023-05-08T07:52:00.000Z,4-18-22 10:09 AM,2022-04-18T10:09:00.000Z,5-8-23 8:06 AM,2023-05-08T08:06:00.000Z,4,4,,CO,CLOSE,Y,,NO,CHATHAM,,,,,,,,,,,,,,,,53,2023-05-07T15:30:00.000Z,2023-05-07T16:00:00.000Z,23.5,0.9791666666666666,No,No,No,No,No,Yes,No,No,5,1
5454,(Pre) Build Access Scaffold,23-39211,TK-1307,TK-1307,,,5-8-23 12:05 PM,2023-05-08T12:05:00.000Z,4-30-23 6:25 AM,2023-04-30T06:25:00.000Z,5-8-23 1:00 PM,2023-05-08T13:00:00.000Z,4,4,,SD,CLOSE,Y,,NO,CHATHAM,,,,,,,,,,,,,,,,53,2023-05-07T15:30:00.000Z,2023-05-07T16:00:00.000Z,23.5,0.9791666666666666,No,No,No,No,No,Yes,No,No,5,1
5454,Remove Insulation,23-39212,TK-1307,TK-1307,,,5-8-23 12:06 PM,2023-05-08T12:06:00.000Z,4-30-23 6:25 AM,2023-04-30T06:25:00.000Z,5-8-23 1:00 PM,2023-05-08T13:00:00.000Z,4,4,,SD,CLOSE,Y,,NO,CHATHAM,,,,,,,,,,,,,,,,53,2023-05-07T15:30:00.000Z,2023-05-07T16:00:00.000Z,23.5,0.9791666666666666,No,No,No,No,No,Yes,No,No,5,1
5454,Blank and Open Manways,23-39213,TK-1307,TK-1307,,,5-8-23 12:06 PM,2023-05-08T12:06:00.000Z,4-30-23 6:25 AM,2023-04-30T06:25:00.000Z,5-8-23 1:00 PM,2023-05-08T13:00:00.000Z,4,4,,SD,CLOSE,Y,,NO,CHATHAM,,,,,,,,,,,,,,,,53,2023-05-07T15:30:00.000Z,2023-05-07T16:00:00.000Z,23.5,0.9791666666666666,No,No,No,No,No,Yes,No,No,5,1
5454,Inspect and Replace Foot Bearing (if needed) - (CSE),23-39214,TK-1307,TK-1307,,,5-8-23 12:06 PM,2023-05-08T12:06:00.000Z,4-30-23 6:25 AM,2023-04-30T06:25:00.000Z,5-8-23 1:00 PM,2023-05-08T13:00:00.000Z,4,4,,SD,CLOSE,Y,,NO,CHATHAM,,,,,,,,,,,,,,,,53,2023-05-07T15:30:00.000Z,2023-05-07T16:00:00.000Z,23.5,0.9791666666666666,No,No,No,No,No,Yes,No,No,5,1
5454,Re-install Insulation,23-39215,TK-1307,TK-1307,,,5-8-23 12:06 PM,2023-05-08T12:06:00.000Z,4-30-23 6:25 AM,2023-04-30T06:25:00.000Z,5-8-23 1:00 PM,2023-05-08T13:00:00.000Z,4,4,,SD,CLOSE,Y,,NO,CHATHAM,,,,,,,,,,,,,,,,53,2023-05-07T15:30:00.000Z,2023-05-07T16:00:00.000Z,23.5,0.9791666666666666,No,No,No,No,No,Yes,No,No,5,1
5454,(Post) Remove Access Scaffold,23-39216,TK-1307,TK-1307,,,5-8-23 12:07 PM,2023-05-08T12:07:00.000Z,4-30-23 6:25 AM,2023-04-30T06:25:00.000Z,5-8-23 1:00 PM,2023-05-08T13:00:00.000Z,4,4,,SD,CLOSE,Y,,NO,CHATHAM,,,,,,,,,,,,,,,,53,2023-05-07T15:30:00.000Z,2023-05-07T16:00:00.000Z,23.5,0.9791666666666666,No,No,No,No,No,Yes,No,No,5,1
2171,Reinstall control valve,23-39225,FV-13206,FV-13206,,,5-8-23 1:03 PM,2023-05-08T13:03:00.000Z,5-31-23 2:53 PM,2023-05-31T14:53:00.000Z,5-8-23 1:06 PM,2023-05-08T13:06:00.000Z,4,4,,SD,CLOSE,Y,,NO,CHATHAM,,,,,,,,,,,,,,,,53,2023-05-07T15:30:00.000Z,2023-05-07T16:00:00.000Z,23.5,0.9791666666666666,No,No,No,No,No,Yes,No,No,5,1
2171,Stroke Check,23-39226,FV-13206,FV-13206,,,5-8-23 1:03 PM,2023-05-08T13:03:00.000Z,5-31-23 2:53 PM,2023-05-31T14:53:00.000Z,5-8-23 1:06 PM,2023-05-08T13:06:00.000Z,4,4,,SD,CLOSE,Y,,NO,CHATHAM,,,,,,,,,,,,,,,,53,2023-05-07T15:30:00.000Z,2023-05-07T16:00:00.000Z,23.5,0.9791666666666666,No,No,No,No,No,Yes,No,No,5,1
,CHANGE BEARINGS,23-39229,MI-1201B,MI-1201B,,,5-8-23 2:50 PM,2023-05-08T14:50:00.000Z,5-7-23 2:48 PM,2023-05-07T14:48:00.000Z,5-8-23 2:57 PM,2023-05-08T14:57:00.000Z,1,1,,RM,CLOSE,Y,,NO,CHATHAM,,,,,,,,,,,,,,,,53,2023-05-07T15:30:00.000Z,2023-05-07T16:00:00.000Z,23.5,0.9791666666666666,No,No,No,No,No,Yes,No,No,5,1
,"Area Asset Checks-1500, 6500",23-37399,1500,1500,,,4-10-23 1:49 AM,2023-04-10T01:49:00.000Z,5-8-23 12:00 AM,2023-05-08T00:00:00.000Z,5-12-23 1:00 AM,2023-05-12T01:00:00.000Z,4,4,,PM,CLOSE,Y,N,NO,CHATHAM,,,,,,,,,,,,,,,,60,2023-05-11T14:50:00.000Z,2023-05-11T15:30:00.000Z,20.833333333333332,0.8680555555555556,No,No,No,No,No,Yes,No,No,5,1
,"Area Asset Checks-2200, 2300, 3200, 3600, 4100",23-37403,2200,2200,,,4-10-23 1:49 AM,2023-04-10T01:49:00.000Z,5-8-23 12:00 AM,2023-05-08T00:00:00.000Z,5-12-23 1:00 AM,2023-05-12T01:00:00.000Z,4,4,,PM,CLOSE,Y,N,NO,CHATHAM,,,,,,,,,,,,,,,,60,2023-05-11T14:50:00.000Z,2023-05-11T15:30:00.000Z,20.833333333333332,0.8680555555555556,No,No,No,No,No,Yes,No,No,5,1
7138,ACCULOAD SCULLY CABLE -PM SERVICE,23-37717,FQIC-2203,FQIC-2203,,,4-17-23 1:47 AM,2023-04-17T01:47:00.000Z,5-12-23 12:30 AM,2023-05-12T00:30:00.000Z,5-12-23 12:30 AM,2023-05-12T00:30:00.000Z,4,4,,PM,CLOSE,Y,N,NO,CHATHAM,,,,,,,,,,,,,,,,60,2023-05-11T14:50:00.000Z,2023-05-11T15:30:00.000Z,20.833333333333332,0.8680555555555556,No,No,No,No,No,Yes,No,No,5,1
,HAMMERMILL WEEKLY PM & ROTATION CHANGE,23-37781,MI-1201A,MI-1201A,,,4-17-23 1:48 AM,2023-04-17T01:48:00.000Z,5-11-23 12:00 AM,2023-05-11T00:00:00.000Z,5-11-23 4:39 PM,2023-05-11T16:39:00.000Z,4,4,,PM,CLOSE,Y,,NO,CHATHAM,,,,,,,,,,,,,,,,60,2023-05-11T14:50:00.000Z,2023-05-11T15:30:00.000Z,20.833333333333332,0.8680555555555556,No,No,No,No,No,Yes,No,No,5,1
,Weekly Vibration check (GFE I/E),23-37782,MI-1201A,MI-1201A,,,4-17-23 1:48 AM,2023-04-17T01:48:00.000Z,5-11-23 12:00 AM,2023-05-11T00:00:00.000Z,5-11-23 4:39 PM,2023-05-11T16:39:00.000Z,4,4,,PM,CLOSE,Y,,NO,CHATHAM,,,,,,,,,,,,,,,,60,2023-05-11T14:50:00.000Z,2023-05-11T15:30:00.000Z,20.833333333333332,0.8680555555555556,No,No,No,No,No,Yes,No,No,5,1
,Heat trace audit of 1800 Area,23-38871,1800,1800,,,5-4-23 7:59 AM,2023-05-04T07:59:00.000Z,5-21-23 7:59 AM,2023-05-21T07:59:00.000Z,5-12-23 9:59 AM,2023-05-12T09:59:00.000Z,4,4,,CO,CLOSE,Y,,NO,CHATHAM,,,,,,,,,,,,,,,,60,2023-05-11T14:50:00.000Z,2023-05-11T15:30:00.000Z,20.833333333333332,0.8680555555555556,No,No,No,No,No,Yes,No,No,5,1
,heat trace audit of Mill area,23-38888,1200,1200,,,5-4-23 8:55 AM,2023-05-04T08:55:00.000Z,5-17-23 8:55 AM,2023-05-17T08:55:00.000Z,5-12-23 9:25 AM,2023-05-12T09:25:00.000Z,4,4,,CO,CLOSE,Y,,NO,CHATHAM,,,,,,,,,,,,,,,,60,2023-05-11T14:50:00.000Z,2023-05-11T15:30:00.000Z,20.833333333333332,0.8680555555555556,No,No,No,No,No,Yes,No,No,5,1
3563,Replace seal kit on MX-1302 NDE,23-38903,MX-1302,MX-1302,,,5-5-23 9:43 AM,2023-05-05T09:43:00.000Z,5-8-23 3:30 PM,2023-05-08T15:30:00.000Z,5-11-23 2:45 PM,2023-05-11T14:45:00.000Z,4,4,,CO,CLOSE,Y,,NO,CHATHAM,,,,,,,,,,,,,,,,60,2023-05-11T14:50:00.000Z,2023-05-11T15:30:00.000Z,20.833333333333332,0.8680555555555556,No,No,No,No,No,No,No,Yes,3,1
1315,disconnect alcohol loading washroom and reconnect new one,23-39261,BU-ALCO,BU-ALCO,,,5-10-23 2:52 PM,2023-05-10T14:52:00.000Z,5-21-23 2:52 PM,2023-05-21T14:52:00.000Z,5-11-23 3:52 PM,2023-05-11T15:52:00.000Z,4,4,,CO,CLOSE,Y,,NO,CHATHAM,,,,,,,,,,,,,,,,60,2023-05-11T14:50:00.000Z,2023-05-11T15:30:00.000Z,20.833333333333332,0.8680555555555556,No,No,No,Yes,No,Yes,Yes,No,4,1
,Disconnect accuren trailer,23-39262,0000,0000,,,5-10-23 3:06 PM,2023-05-10T15:06:00.000Z,5-21-23 3:06 PM,2023-05-21T15:06:00.000Z,5-17-23 7:15 AM,2023-05-17T07:15:00.000Z,4,4,,CO,CLOSE,Y,,NO,CHATHAM,,,,,,,,,,,,,,,,60,2023-05-11T14:50:00.000Z,2023-05-11T15:30:00.000Z,20.833333333333332,0.8680555555555556,No,No,No,Yes,No,No,No,No,4,1
5497,Install fittings on TK2321 for sampling/offloading,23-39263,TK-2321B,TK-2321B,,,5-10-23 4:33 PM,2023-05-10T16:33:00.000Z,5-11-23 10:00 AM,2023-05-11T10:00:00.000Z,5-16-23 6:39 AM,2023-05-16T06:39:00.000Z,1,1,,CO,CLOSE,Y,,NO,CHATHAM,,,,,,,,,,,,,,,,60,2023-05-11T14:50:00.000Z,2023-05-11T15:30:00.000Z,20.833333333333332,0.8680555555555556,No,No,No,Yes,No,No,No,No,4,1
3385,MCC 3816-door handle,23-39264,MCC-3816,MCC-3816,,,5-11-23 6:38 AM,2023-05-11T06:38:00.000Z,5-10-23 11:31 AM,2023-05-10T11:31:00.000Z,8-14-23 1:08 PM,2023-08-14T13:08:00.000Z,4,4,,CO,CLOSE,Y,,NO,CHATHAM,,,,,,,,,,,,,,,,60,2023-05-11T14:50:00.000Z,2023-05-11T15:30:00.000Z,20.833333333333332,0.8680555555555556,No,No,No,Yes,No,No,No,No,4,1
2541,"Dryer A tripped, after multiple restart failures Combustion Techs was called",23-39265,DR-1826,DR-1826,,,5-11-23 6:40 AM,2023-05-11T06:40:00.000Z,5-10-23 5:00 PM,2023-05-10T17:00:00.000Z,5-16-23 8:10 AM,2023-05-16T08:10:00.000Z,2,2,,RM,CLOSE,Y,,NO,CHATHAM,"2541, 2542, 2543, 2544, 2545, 2547, 2549, 2550, 2552, 2553, 2554, 2555, 2556, 2557, 2558, 2559","SWISS COMBI ROTARY DRYER DRUM, SEW GEARBOX - LEFT HAND DRIVE -, SEW GEARBOX - LEFT HAND DRIVE, SEW GEARBOX - RIGHT HAND DRIVE, SEW GEARBOX - RIGHT HAND DRIVE, MOTOR / 25HP / 1800RPM / TEFC / 575V/3PH/60HZ / FRAME# 284TC, MOTOR / 25HP / 1800RPM / TEFC / 575V/3PH/60HZ / FRAME# 284TC, MOTOR / 25HP / 1800RPM / TEFC / 575V/3PH/60HZ / FRAME# 284TC, MOTOR / 25HP / 1800RPM / TEFC / 575V/3PH/60HZ / FRAME# 284TC, TRUNNION (A) - LEFT HAND DRIVE, TRUNNION (B)- RIGHT HAND DRIVE, TRUNNION (D) - LEFT HAND DRIVE, TRUNNION (C) - RIGHT HAND DRIVE, THRUST ROLLER ASSEMBLY, THRUST ROLLER ASSEMBLY, TRUNNION LUBRICATION SYSTEM",,No,DRYER A,CH-DRA_CYCLNS,CH-DRA_CYCLNS:TT18168B.MEAS,TT-18168B,TT,MEAS,Measured value (PV),Temperature transmitter,Measurement,DRUM DR1826 MOTOR A AMPERAGE,DR-1826,60,2023-05-11T14:50:00.000Z,2023-05-11T15:30:00.000Z,20.833333333333332,0.8680555555555556,No,No,No,Yes,No,No,No,No,4,1
,Meeting with Viraj and Neil over Hydrogen peroxide pump,23-39267,0000,0000,,,5-11-23 7:58 AM,2023-05-11T07:58:00.000Z,5-16-23 7:58 AM,2023-05-16T07:58:00.000Z,5-15-23 9:28 AM,2023-05-15T09:28:00.000Z,4,4,,CO,CLOSE,Y,,NO,CHATHAM,,,,,,,,,,,,,,,,60,2023-05-11T14:50:00.000Z,2023-05-11T15:30:00.000Z,20.833333333333332,0.8680555555555556,No,No,No,Yes,No,No,No,No,4,1
,Assist with Generator install and make necessary adjustments,23-39268,ME-3601A,ME-3601A,,,5-11-23 8:07 AM,2023-05-11T08:07:00.000Z,5-21-23 8:07 AM,2023-05-21T08:07:00.000Z,5-15-23 9:07 AM,2023-05-15T09:07:00.000Z,4,4,,CO,CLOSE,Y,,NO,CHATHAM,,,,,,,,,,,,,,,,60,2023-05-11T14:50:00.000Z,2023-05-11T15:30:00.000Z,20.833333333333332,0.8680555555555556,No,No,No,Yes,No,No,No,No,4,1
3382,MCC3806 UPS PM,23-39271,MCC-3806,MCC-3806,,,5-11-23 8:35 AM,2023-05-11T08:35:00.000Z,5-21-23 8:35 AM,2023-05-21T08:35:00.000Z,5-19-23 9:35 AM,2023-05-19T09:35:00.000Z,4,4,,PM,CLOSE,Y,N,NO,CHATHAM,,,,,,,,,,,,,,,,60,2023-05-11T14:50:00.000Z,2023-05-11T15:30:00.000Z,20.833333333333332,0.8680555555555556,No,No,No,Yes,No,No,No,No,4,1
3382,MCC'S UPS ANNUAL PM,23-39272,MCC-3806,MCC-3806,,,5-11-23 8:35 AM,2023-05-11T08:35:00.000Z,,,5-23-23 7:38 AM,2023-05-23T07:38:00.000Z,4,4,,SD,CLOSE,Y,,NO,CHATHAM,,,,,,,,,,,,,,,,60,2023-05-11T14:50:00.000Z,2023-05-11T15:30:00.000Z,20.833333333333332,0.8680555555555556,No,No,No,Yes,No,No,No,No,4,1
3379,MCC3804 UPS  PM,23-39273,MCC-3804,MCC-3804,,,5-11-23 8:37 AM,2023-05-11T08:37:00.000Z,5-21-23 8:37 AM,2023-05-21T08:37:00.000Z,5-19-23 9:37 AM,2023-05-19T09:37:00.000Z,4,4,,PM,CLOSE,Y,N,NO,CHATHAM,,,,,,,,,,,,,,,,60,2023-05-11T14:50:00.000Z,2023-05-11T15:30:00.000Z,20.833333333333332,0.8680555555555556,No,No,No,Yes,No,No,No,No,4,1
3379,MCC'S UPS ANNUAL PM,23-39274,MCC-3804,MCC-3804,,,5-11-23 8:37 AM,2023-05-11T08:37:00.000Z,,,5-23-23 7:38 AM,2023-05-23T07:38:00.000Z,4,4,,SD,CLOSE,Y,,NO,CHATHAM,,,,,,,,,,,,,,,,60,2023-05-11T14:50:00.000Z,2023-05-11T15:30:00.000Z,20.833333333333332,0.8680555555555556,No,No,No,Yes,No,No,No,No,4,1
,Meter Proving Closed Reciever Keith L,23-39275,2390,2390,,,5-11-23 8:46 AM,2023-05-11T08:46:00.000Z,5-21-23 8:46 AM,2023-05-21T08:46:00.000Z,5-18-23 4:46 PM,2023-05-18T16:46:00.000Z,4,4,,CO,CLOSE,Y,,NO,CHATHAM,,,,,,,,,,,,,,,,60,2023-05-11T14:50:00.000Z,2023-05-11T15:30:00.000Z,20.833333333333332,0.8680555555555556,No,No,No,Yes,No,No,No,No,4,1
,FORKLIFT ASSISTANCE FOR INVENTORY,23-39276,0000,0000,,,5-11-23 8:56 AM,2023-05-11T08:56:00.000Z,5-25-23 8:56 AM,2023-05-25T08:56:00.000Z,5-23-23 7:29 AM,2023-05-23T07:29:00.000Z,4,4,,CO,CLOSE,Y,,NO,CHATHAM,,,,,,,,,,,,,,,,60,2023-05-11T14:50:00.000Z,2023-05-11T15:30:00.000Z,20.833333333333332,0.8680555555555556,No,No,Yes,Yes,No,No,No,No,4,1
3404,MILL C PLC SWAP (CONT),23-39277,MI-1201C,MI-1201C,,,5-11-23 9:13 AM,2023-05-11T09:13:00.000Z,,,5-17-23 9:43 AM,2023-05-17T09:43:00.000Z,4,4,,CO,CLOSE,Y,,NO,CHATHAM,,,,,,,,,,,,,,,,60,2023-05-11T14:50:00.000Z,2023-05-11T15:30:00.000Z,20.833333333333332,0.8680555555555556,No,No,Yes,Yes,No,No,No,No,4,1
,BUILD AND INSTALL LIGHTS,23-39279,0000,0000,,,5-11-23 9:16 AM,2023-05-11T09:16:00.000Z,5-21-23 9:16 AM,2023-05-21T09:16:00.000Z,5-15-23 1:16 PM,2023-05-15T13:16:00.000Z,4,4,,CO,CLOSE,Y,,NO,CHATHAM,,,,,,,,,,,,,,,,60,2023-05-11T14:50:00.000Z,2023-05-11T15:30:00.000Z,20.833333333333332,0.8680555555555556,No,No,Yes,Yes,No,No,No,No,4,1
,Air conditioning in the front entrance trailer not working,23-39283,0000,0000,,,5-11-23 10:58 AM,2023-05-11T10:58:00.000Z,5-19-23 10:49 AM,2023-05-19T10:49:00.000Z,5-17-23 7:14 AM,2023-05-17T07:14:00.000Z,4,4,,CO,CLOSE,Y,,NO,CHATHAM,,,,,,,,,,,,,,,,60,2023-05-11T14:50:00.000Z,2023-05-11T15:30:00.000Z,20.833333333333332,0.8680555555555556,No,No,Yes,Yes,No,No,No,No,4,1
1323,PLC lost server will not communicate (Viraj ),23-39284,BU-GHR,BU-GHR,,,5-11-23 11:53 AM,2023-05-11T11:53:00.000Z,5-11-23 2:00 PM,2023-05-11T14:00:00.000Z,5-15-23 11:58 AM,2023-05-15T11:58:00.000Z,1,1,,RM,CLOSE,Y,,NO,CHATHAM,,,,,,,,,,,,,,,,60,2023-05-11T14:50:00.000Z,2023-05-11T15:30:00.000Z,20.833333333333332,0.8680555555555556,No,No,Yes,Yes,No,No,No,No,4,1
,Replace old style wafer valves on TK1404 - list in summary,23-39285,TK-1400,TK-1400,,,5-11-23 12:06 PM,2023-05-11T12:06:00.000Z,5-12-23 11:48 AM,2023-05-12T11:48:00.000Z,5-11-23 2:48 PM,2023-05-11T14:48:00.000Z,2,2,,CO,CLOSE,Y,,NO,CHATHAM,,,,,,,,,,,,,,,,60,2023-05-11T14:50:00.000Z,2023-05-11T15:30:00.000Z,20.833333333333332,0.8680555555555556,No,No,Yes,Yes,No,No,No,Yes,4,1
5466,REPAIR AGITATOR BUSHING IN TANK 1404,23-39286,TK-1404,TK-1404,,,5-11-23 1:07 PM,2023-05-11T13:07:00.000Z,5-21-23 1:07 PM,2023-05-21T13:07:00.000Z,5-15-23 2:37 PM,2023-05-15T14:37:00.000Z,2,2,,CO,CLOSE,Y,,NO,CHATHAM,,,,,,,,,,,,,,,,60,2023-05-11T14:50:00.000Z,2023-05-11T15:30:00.000Z,20.833333333333332,0.8680555555555556,No,No,Yes,Yes,No,No,No,No,4,1
5463,TA23 Fall - Replace C02 valve on TK1401,23-39287,TK-1401,TK-1401,,,5-11-23 1:08 PM,2023-05-11T13:08:00.000Z,4-30-24 1:08 PM,2024-04-30T13:08:00.000Z,11-19-24 1:38 PM,2024-11-19T13:38:00.000Z,4,4,,CO,CLOSE,Y,,NO,CHATHAM,,,,,,,,,,,,,,,,60,2023-05-11T14:50:00.000Z,2023-05-11T15:30:00.000Z,20.833333333333332,0.8680555555555556,No,No,Yes,Yes,No,No,No,No,4,1
5464,TA23 Fall - Replace C02 valve on TK1402,23-39288,TK-1402,TK-1402,,,5-11-23 1:10 PM,2023-05-11T13:10:00.000Z,10-24-23 1:10 PM,2023-10-24T13:10:00.000Z,11-6-25 1:15 PM,2025-11-06T13:15:00.000Z,4,4,,SD,COMP,N,,NO,CHATHAM,,,,,,,,,,,,,,,,60,2023-05-11T14:50:00.000Z,2023-05-11T15:30:00.000Z,20.833333333333332,0.8680555555555556,No,No,Yes,Yes,No,No,No,No,4,1
5465,TA23 Fall - Replace C02 valve on TK1403,23-39289,TK-1403,TK-1403,,,5-11-23 1:11 PM,2023-05-11T13:11:00.000Z,10-2-23 1:11 PM,2023-10-02T13:11:00.000Z,10-3-23 9:20 AM,2023-10-03T09:20:00.000Z,4,4,,CO,CLOSE,Y,,NO,CHATHAM,,,,,,,,,,,,,,,,60,2023-05-11T14:50:00.000Z,2023-05-11T15:30:00.000Z,20.833333333333332,0.8680555555555556,No,No,Yes,Yes,No,No,No,No,4,1
5449,TA23 Fall - Replace C02 valve on TK11402,23-39290,TK-11402,TK-11402,,,5-11-23 1:13 PM,2023-05-11T13:13:00.000Z,10-24-23 1:15 PM,2023-10-24T13:15:00.000Z,7-3-25 3:07 PM,2025-07-03T15:07:00.000Z,4,4,,SD,CLOSE,Y,,NO,CHATHAM,,,,,,,,,,,,,,,,60,2023-05-11T14:50:00.000Z,2023-05-11T15:30:00.000Z,20.833333333333332,0.8680555555555556,No,No,Yes,Yes,No,No,No,No,4,1
7094,Repair/replace CK Hut nitrogen regulator,23-39291,4100,4100,,,5-11-23 2:11 PM,2023-05-11T14:11:00.000Z,7-12-23 5:31 PM,2023-07-12T17:31:00.000Z,12-1-23 1:52 PM,2023-12-01T13:52:00.000Z,4,4,,PM,CLOSE,Y,,NO,CHATHAM,,,,,,,,,,,,,,,,60,2023-05-11T14:50:00.000Z,2023-05-11T15:30:00.000Z,20.833333333333332,0.8680555555555556,No,Yes,Yes,Yes,No,No,No,No,4,1
,Replace broken suction distribution pipe on Softener A,23-39292,3500,3500,,,5-11-23 2:13 PM,2023-05-11T14:13:00.000Z,6-1-23 12:07 PM,2023-06-01T12:07:00.000Z,5-18-23 3:09 PM,2023-05-18T15:09:00.000Z,4,4,,CO,CLOSE,Y,,NO,CHATHAM,,,,,,,,,,,,,,,,60,2023-05-11T14:50:00.000Z,2023-05-11T15:30:00.000Z,20.833333333333332,0.8680555555555556,No,Yes,Yes,Yes,No,No,No,No,4,1
,VIBRATION ANALYSIS,23-36894,CHATHAM,CHATHAM,,,4-3-23 1:45 AM,2023-04-03T01:45:00.000Z,4-28-23 12:00 AM,2023-04-28T00:00:00.000Z,5-12-23 1:00 PM,2023-05-12T13:00:00.000Z,4,4,,PD,CLOSE,Y,N,NO,CHATHAM,,,,,,,,,,,,,,,,61,2023-05-12T11:40:00.000Z,2023-05-12T15:20:00.000Z,387.3333333333333,16.13888888888889,Yes,No,No,No,No,No,No,No,1,1
7138,ACCULOAD SCULLY CABLE BI-WEEKLY PM,23-37718,FQIC-2203,FQIC-2203,,,4-17-23 1:47 AM,2023-04-17T01:47:00.000Z,5-12-23 12:30 AM,2023-05-12T00:30:00.000Z,5-12-23 11:09 AM,2023-05-12T11:09:00.000Z,4,4,,PM,CLOSE,Y,,NO,CHATHAM,,,,,,,,,,,,,,,,61,2023-05-12T11:40:00.000Z,2023-05-12T15:20:00.000Z,387.3333333333333,16.13888888888889,No,No,No,No,No,No,No,Yes,3,1
5497,"Need fittings installed off 2\" tank sample port. Need flange to 3\" Camlock fitting (male)",23-38850,TK-2321B,TK-2321B,,,5-3-23 4:01 PM,2023-05-03T16:01:00.000Z,5-4-23 4:00 PM,2023-05-04T16:00:00.000Z,5-12-23 2:23 PM,2023-05-12T14:23:00.000Z,1,1,,CO,CLOSE,Y,,NO,CHATHAM,,,,,,,,,,,,,,,,61,2023-05-12T11:40:00.000Z,2023-05-12T15:20:00.000Z,387.3333333333333,16.13888888888889,Yes,No,No,No,No,No,No,No,1,1
1323,PLC in grain office-Viraj,23-39199,BU-GHR,BU-GHR,,,5-8-23 9:11 AM,2023-05-08T09:11:00.000Z,5-9-23 9:08 AM,2023-05-09T09:08:00.000Z,5-12-23 2:22 PM,2023-05-12T14:22:00.000Z,1,1,,RM,CLOSE,Y,,NO,CHATHAM,,,,,,,,,,,,,,,,61,2023-05-12T11:40:00.000Z,2023-05-12T15:20:00.000Z,387.3333333333333,16.13888888888889,Yes,No,No,No,No,No,No,No,1,1
3767,Industrial Dover to suck out P-4114 sump.,23-39255,P-4114,P-4114,,,5-10-23 10:05 AM,2023-05-10T10:05:00.000Z,5-15-23 2:22 PM,2023-05-15T14:22:00.000Z,5-12-23 2:52 PM,2023-05-12T14:52:00.000Z,2,2,,CO,CLOSE,Y,,NO,CHATHAM,,,,,,,,,,,,,,,,61,2023-05-12T11:40:00.000Z,2023-05-12T15:20:00.000Z,387.3333333333333,16.13888888888889,Yes,No,No,No,No,No,No,No,1,1
2675,Upstairs HVAC unit is not cooling,23-39293,HVAC-0008,HVAC-0008,,,5-11-23 3:06 PM,2023-05-11T15:06:00.000Z,5-12-23 12:00 AM,2023-05-12T00:00:00.000Z,5-16-23 6:49 AM,2023-05-16T06:49:00.000Z,1,1,,RM,CLOSE,Y,,NO,CHATHAM,,,,,,,,,,,,,,,,61,2023-05-12T11:40:00.000Z,2023-05-12T15:20:00.000Z,387.3333333333333,16.13888888888889,No,No,No,Yes,No,No,No,No,4,1
,Clean Evaporator/Condenser Tubes on Chiller,23-31378,ME-3251,ME-3251,,,1-9-23 1:46 AM,2023-01-09T01:46:00.000Z,2-2-23 6:00 AM,2023-02-02T06:00:00.000Z,5-29-23 11:09 AM,2023-05-29T11:09:00.000Z,4,4,,PM,CLOSE,Y,N,NO,CHATHAM,,,,,,,,,,,,,,,,62,2023-05-28T15:00:00.000Z,2023-05-28T15:30:00.000Z,0.6666666666666666,0.027777777777777776,No,No,No,No,No,Yes,No,No,5,1
,Clean Evaporator Tubes on Chiller,23-31379,ME-3251,ME-3251,,,1-9-23 1:46 AM,2023-01-09T01:46:00.000Z,2-2-23 6:00 AM,2023-02-02T06:00:00.000Z,5-29-23 11:09 AM,2023-05-29T11:09:00.000Z,4,4,,PM,CLOSE,Y,,NO,CHATHAM,,,,,,,,,,,,,,,,62,2023-05-28T15:00:00.000Z,2023-05-28T15:30:00.000Z,0.6666666666666666,0.027777777777777776,No,No,No,No,No,Yes,No,No,5,1
,Annually Clean Condenser Tubes on Chiller,23-31380,ME-3251,ME-3251,,,1-9-23 1:46 AM,2023-01-09T01:46:00.000Z,2-3-23 12:00 PM,2023-02-03T12:00:00.000Z,5-29-23 11:09 AM,2023-05-29T11:09:00.000Z,4,4,,PM,CLOSE,Y,,NO,CHATHAM,,,,,,,,,,,,,,,,62,2023-05-28T15:00:00.000Z,2023-05-28T15:30:00.000Z,0.6666666666666666,0.027777777777777776,No,No,No,No,No,Yes,No,No,5,1
1314,Purchase and install boot cleaners outside Admin building entrance doors,23-32237,BU-ADMIN,BU-ADMIN,,,1-17-23 8:08 AM,2023-01-17T08:08:00.000Z,4-9-23 9:40 AM,2023-04-09T09:40:00.000Z,5-29-23 11:14 AM,2023-05-29T11:14:00.000Z,4,4,,CO,CLOSE,Y,,NO,CHATHAM,,,,,,,,,,,,,,,,62,2023-05-28T15:00:00.000Z,2023-05-28T15:30:00.000Z,0.6666666666666666,0.027777777777777776,No,No,No,No,No,Yes,No,No,5,1
2041,Inspect repaired FT-32101 and install if acceptable,23-32748,FT-32101,FT-32101,,,1-25-23 8:01 AM,2023-01-25T08:01:00.000Z,2-24-23 7:28 AM,2023-02-24T07:28:00.000Z,5-29-23 11:18 AM,2023-05-29T11:18:00.000Z,4,4,,CO,CLOSE,Y,,NO,CHATHAM,,,,,,,,,,,,,,,,62,2023-05-28T15:00:00.000Z,2023-05-28T15:30:00.000Z,0.6666666666666666,0.027777777777777776,No,No,No,No,No,Yes,No,No,5,1
6407,HACH SP150 HARDNESS MONITOR,23-34716,XA-35102,XA-35102,,,2-27-23 1:48 AM,2023-02-27T01:48:00.000Z,3-25-23 12:00 AM,2023-03-25T00:00:00.000Z,5-29-23 1:06 PM,2023-05-29T13:06:00.000Z,4,4,,PM,CLOSE,Y,N,NO,CHATHAM,,,,,,,,,,,,,,,,62,2023-05-28T15:00:00.000Z,2023-05-28T15:30:00.000Z,0.6666666666666666,0.027777777777777776,No,No,No,No,No,Yes,No,No,5,1
6407,HACH SP150 HARDNESS MONITOR 2 MONTH PM,23-34717,XA-35102,XA-35102,,,2-27-23 1:48 AM,2023-02-27T01:48:00.000Z,3-25-23 12:00 AM,2023-03-25T00:00:00.000Z,5-29-23 1:06 PM,2023-05-29T13:06:00.000Z,4,4,,PM,CLOSE,Y,,NO,CHATHAM,,,,,,,,,,,,,,,,62,2023-05-28T15:00:00.000Z,2023-05-28T15:30:00.000Z,0.6666666666666666,0.027777777777777776,No,No,No,No,No,Yes,No,No,5,1
3166,LT-15507 MAGNETIC FLOAT LEVEL TRANSMITTER BLOWDOWN,23-34999,LT-15507,LT-15507,,,3-6-23 1:46 AM,2023-03-06T01:46:00.000Z,5-30-23 1:00 AM,2023-05-30T01:00:00.000Z,5-29-23 1:00 AM,2023-05-29T01:00:00.000Z,4,4,,PM,CLOSE,Y,N,NO,CHATHAM,,,,,,,,,,,,,,,,62,2023-05-28T15:00:00.000Z,2023-05-28T15:30:00.000Z,0.6666666666666666,0.027777777777777776,No,No,No,No,No,Yes,No,No,5,1
3161,AT DCS,23-38098,LT-14607,LT-14607,,,4-24-23 1:47 AM,2023-04-24T01:47:00.000Z,5-22-23 12:00 AM,2023-05-22T00:00:00.000Z,5-29-23 10:04 AM,2023-05-29T10:04:00.000Z,4,4,,PM,CLOSE,Y,,NO,CHATHAM,,,,,,,,,,,,,,,,62,2023-05-28T15:00:00.000Z,2023-05-28T15:30:00.000Z,0.6666666666666666,0.027777777777777776,No,No,No,No,No,Yes,No,No,5,1
3161,AT DCS,23-38100,LT-14607,LT-14607,,,4-24-23 1:47 AM,2023-04-24T01:47:00.000Z,5-22-23 12:00 AM,2023-05-22T00:00:00.000Z,5-29-23 10:04 AM,2023-05-29T10:04:00.000Z,4,4,,PM,CLOSE,Y,,NO,CHATHAM,,,,,,,,,,,,,,,,62,2023-05-28T15:00:00.000Z,2023-05-28T15:30:00.000Z,0.6666666666666666,0.027777777777777776,No,No,No,No,No,Yes,No,No,5,1
3161,IN FIELD,23-38099,LT-14607,LT-14607,,,4-24-23 1:47 AM,2023-04-24T01:47:00.000Z,5-22-23 12:00 AM,2023-05-22T00:00:00.000Z,5-29-23 10:04 AM,2023-05-29T10:04:00.000Z,4,4,,PM,CLOSE,Y,,NO,CHATHAM,,,,,,,,,,,,,,,,62,2023-05-28T15:00:00.000Z,2023-05-28T15:30:00.000Z,0.6666666666666666,0.027777777777777776,No,No,No,No,No,Yes,No,No,5,1
,"Area Asset Checks-1830, 1840, DDG Cooler",23-38216,1800,1800,,,4-24-23 1:49 AM,2023-04-24T01:49:00.000Z,5-22-23 12:00 AM,2023-05-22T00:00:00.000Z,5-29-23 10:42 AM,2023-05-29T10:42:00.000Z,4,4,,PM,CLOSE,Y,,NO,CHATHAM,,,,,,,,,,,,,,,,62,2023-05-28T15:00:00.000Z,2023-05-28T15:30:00.000Z,0.6666666666666666,0.027777777777777776,No,No,No,No,No,Yes,No,No,5,1
3081,BIOTHANE FLOAT OP CHECK- (LSH-41401) - PM SERVICE,23-38567,LSH-41401,LSH-41401,,,5-1-23 1:46 AM,2023-05-01T01:46:00.000Z,5-29-23 12:30 AM,2023-05-29T00:30:00.000Z,5-29-23 12:30 AM,2023-05-29T00:30:00.000Z,4,4,,PM,CLOSE,Y,N,NO,CHATHAM,,,,,,,,,,,,,,,,62,2023-05-28T15:00:00.000Z,2023-05-28T15:30:00.000Z,0.6666666666666666,0.027777777777777776,No,No,No,No,No,Yes,No,No,5,1
4868,SC-1301 - MECHANICAL CHECKS,23-38586,SC-1301,SC-1301,,,5-1-23 1:46 AM,2023-05-01T01:46:00.000Z,5-29-23 1:00 AM,2023-05-29T01:00:00.000Z,5-29-23 12:30 AM,2023-05-29T00:30:00.000Z,4,4,,PM,CLOSE,Y,N,NO,CHATHAM,,,,,,,,,,,,,,,,62,2023-05-28T15:00:00.000Z,2023-05-28T15:30:00.000Z,0.6666666666666666,0.027777777777777776,No,No,No,No,No,Yes,No,No,5,1
,VIBRATION ANALYSIS,23-38588,CHATHAM,CHATHAM,,,5-1-23 1:46 AM,2023-05-01T01:46:00.000Z,5-28-23 12:00 AM,2023-05-28T00:00:00.000Z,5-29-23 10:00 AM,2023-05-29T10:00:00.000Z,4,4,,PD,CLOSE,Y,N,NO,CHATHAM,,,,,,,,,,,,,,,,62,2023-05-28T15:00:00.000Z,2023-05-28T15:30:00.000Z,0.6666666666666666,0.027777777777777776,No,No,No,No,No,Yes,No,No,5,1
3081,Check operation of biothane float in diked area,23-38568,LSH-41401,LSH-41401,,,5-1-23 1:46 AM,2023-05-01T01:46:00.000Z,5-29-23 12:30 AM,2023-05-29T00:30:00.000Z,5-29-23 8:33 AM,2023-05-29T08:33:00.000Z,4,4,,PM,CLOSE,Y,,NO,CHATHAM,,,,,,,,,,,,,,,,62,2023-05-28T15:00:00.000Z,2023-05-28T15:30:00.000Z,0.6666666666666666,0.027777777777777776,No,No,No,No,No,Yes,No,No,5,1
7138,ACCULOAD SCULLY CABLE BI-WEEKLY PM,23-38585,FQIC-2203,FQIC-2203,,,5-1-23 1:46 AM,2023-05-01T01:46:00.000Z,5-26-23 12:30 AM,2023-05-26T00:30:00.000Z,5-29-23 7:27 AM,2023-05-29T07:27:00.000Z,4,4,,PM,CLOSE,Y,,NO,CHATHAM,,,,,,,,,,,,,,,,62,2023-05-28T15:00:00.000Z,2023-05-28T15:30:00.000Z,0.6666666666666666,0.027777777777777776,No,No,No,No,No,Yes,No,No,5,1
4868,SC-1301 MECHANICAL CHECKS,23-38587,SC-1301,SC-1301,,,5-1-23 1:46 AM,2023-05-01T01:46:00.000Z,5-29-23 1:00 AM,2023-05-29T01:00:00.000Z,5-29-23 12:56 PM,2023-05-29T12:56:00.000Z,4,4,,PM,CLOSE,Y,,NO,CHATHAM,,,,,,,,,,,,,,,,62,2023-05-28T15:00:00.000Z,2023-05-28T15:30:00.000Z,0.6666666666666666,0.027777777777777776,No,No,No,No,No,Yes,No,No,5,1
,3600 AREA - ME-3601 AREA - MOTOR GREASING,23-38555,3600,3600,,,5-1-23 1:46 AM,2023-05-01T01:46:00.000Z,5-29-23 1:00 AM,2023-05-29T01:00:00.000Z,5-29-23 12:30 AM,2023-05-29T00:30:00.000Z,4,4,,PM,CLOSE,Y,N,NO,CHATHAM,,,,,,,,,,,,,,,,62,2023-05-28T15:00:00.000Z,2023-05-28T15:30:00.000Z,0.6666666666666666,0.027777777777777776,No,No,No,No,No,Yes,No,No,5,1
1251,L.E.L. TRANSMITTER (AT-41306) MAINTENANCE SHOP GAS DETECTOR CALIBRATION,23-38619,AT-41306,AT-41306,,,5-1-23 1:47 AM,2023-05-01T01:47:00.000Z,5-28-23 1:00 AM,2023-05-28T01:00:00.000Z,5-29-23 12:30 AM,2023-05-29T00:30:00.000Z,4,4,,PM,CLOSE,Y,N,NO,CHATHAM,,,,,,,,,,,,,,,,62,2023-05-28T15:00:00.000Z,2023-05-28T15:30:00.000Z,0.6666666666666666,0.027777777777777776,No,No,No,No,No,Yes,No,No,5,1
1227,PH PROBE CLEANING AND CALIBRATION WEEKLY PM,23-38607,AT-13519,AT-13519,,,5-1-23 1:47 AM,2023-05-01T01:47:00.000Z,5-25-23 1:00 AM,2023-05-25T01:00:00.000Z,5-29-23 7:27 AM,2023-05-29T07:27:00.000Z,4,4,,PM,CLOSE,Y,,NO,CHATHAM,,,,,,,,,,,,,,,,62,2023-05-28T15:00:00.000Z,2023-05-28T15:30:00.000Z,0.6666666666666666,0.027777777777777776,No,No,No,No,No,Yes,No,No,5,1
6407,HACH SP150 HARDNESS MONITOR 2 MONTH PM,23-38605,XA-35102,XA-35102,,,5-1-23 1:47 AM,2023-05-01T01:47:00.000Z,5-25-23 12:00 AM,2023-05-25T00:00:00.000Z,5-29-23 1:06 PM,2023-05-29T13:06:00.000Z,4,4,,PM,CLOSE,Y,,NO,CHATHAM,,,,,,,,,,,,,,,,62,2023-05-28T15:00:00.000Z,2023-05-28T15:30:00.000Z,0.6666666666666666,0.027777777777777776,No,No,No,No,No,Yes,No,No,5,1
1230,PH PROBE CLEANING AND CALIBRATION WEEKLY PM,23-38609,AT-14125,AT-14125,,,5-1-23 1:47 AM,2023-05-01T01:47:00.000Z,5-25-23 1:00 AM,2023-05-25T01:00:00.000Z,5-29-23 7:27 AM,2023-05-29T07:27:00.000Z,4,4,,PM,CLOSE,Y,,NO,CHATHAM,,,,,,,,,,,,,,,,62,2023-05-28T15:00:00.000Z,2023-05-28T15:30:00.000Z,0.6666666666666666,0.027777777777777776,No,No,No,No,No,Yes,No,No,5,1
7174,CONDUCTIVITY METER /PH PROBE CLEAN & CALIBRATE PM,23-38593,AE-84404,AE-84404,,,5-1-23 1:47 AM,2023-05-01T01:47:00.000Z,5-25-23 2:00 AM,2023-05-25T02:00:00.000Z,5-29-23 7:27 AM,2023-05-29T07:27:00.000Z,4,4,,PM,CLOSE,Y,,NO,CHATHAM,,,,,,,,,,,,,,,,62,2023-05-28T15:00:00.000Z,2023-05-28T15:30:00.000Z,0.6666666666666666,0.027777777777777776,No,No,No,No,No,Yes,No,No,5,1
6407,HACH SP150 HARDNESS MONITOR,23-38604,XA-35102,XA-35102,,,5-1-23 1:47 AM,2023-05-01T01:47:00.000Z,5-25-23 12:00 AM,2023-05-25T00:00:00.000Z,5-29-23 1:06 PM,2023-05-29T13:06:00.000Z,4,4,,PM,CLOSE,Y,N,NO,CHATHAM,,,,,,,,,,,,,,,,62,2023-05-28T15:00:00.000Z,2023-05-28T15:30:00.000Z,0.6666666666666666,0.027777777777777776,No,No,No,No,No,Yes,No,No,5,1
1251,L.E.L. TRANSMITTER (AT-41306) MAINTENANCE SHOP GAS DETECTOR CALIBRATION,23-38620,AT-41306,AT-41306,,,5-1-23 1:47 AM,2023-05-01T01:47:00.000Z,5-28-23 1:00 AM,2023-05-28T01:00:00.000Z,5-29-23 8:33 AM,2023-05-29T08:33:00.000Z,4,4,,PM,CLOSE,Y,,NO,CHATHAM,,,,,,,,,,,,,,,,62,2023-05-28T15:00:00.000Z,2023-05-28T15:30:00.000Z,0.6666666666666666,0.027777777777777776,No,No,No,No,No,Yes,No,No,5,1
,"Area Asset Checks-2100, 1200, 1300, 1400 (Corn, Mill, Mash, Fermentation)",23-38624,2100,2100,,,5-1-23 1:48 AM,2023-05-01T01:48:00.000Z,5-29-23 12:00 AM,2023-05-29T00:00:00.000Z,5-29-23 1:00 AM,2023-05-29T01:00:00.000Z,4,4,,PM,CLOSE,Y,N,NO,CHATHAM,,,,,,,,,,,,,,,,62,2023-05-28T15:00:00.000Z,2023-05-28T15:30:00.000Z,0.6666666666666666,0.027777777777777776,No,No,No,No,No,Yes,No,No,5,1
,"Area Asset Checks-1830, 1840, DDG Cooler",23-38632,1800,1800,,,5-1-23 1:48 AM,2023-05-01T01:48:00.000Z,5-29-23 12:00 AM,2023-05-29T00:00:00.000Z,5-29-23 2:30 AM,2023-05-29T02:30:00.000Z,4,4,,PM,CLOSE,Y,N,NO,CHATHAM,,,,,,,,,,,,,,,,62,2023-05-28T15:00:00.000Z,2023-05-28T15:30:00.000Z,0.6666666666666666,0.027777777777777776,No,No,No,No,No,Yes,No,No,5,1
,PH PROBE CLEANING AND CALIBRATION WEEKLY PM,23-38649,AT-84505,AT-84505,,,5-1-23 1:48 AM,2023-05-01T01:48:00.000Z,5-25-23 1:00 AM,2023-05-25T01:00:00.000Z,5-29-23 7:27 AM,2023-05-29T07:27:00.000Z,4,4,,PM,CLOSE,Y,,NO,CHATHAM,,,,,,,,,,,,,,,,62,2023-05-28T15:00:00.000Z,2023-05-28T15:30:00.000Z,0.6666666666666666,0.027777777777777776,No,No,No,No,No,Yes,No,No,5,1
,"Area Asset Checks-2200, 2300, 3200, 3600, 4100",23-38630,2200,2200,,,5-1-23 1:48 AM,2023-05-01T01:48:00.000Z,5-29-23 12:00 AM,2023-05-29T00:00:00.000Z,5-29-23 1:00 AM,2023-05-29T01:00:00.000Z,4,4,,PM,CLOSE,Y,N,NO,CHATHAM,,,,,,,,,,,,,,,,62,2023-05-28T15:00:00.000Z,2023-05-28T15:30:00.000Z,0.6666666666666666,0.027777777777777776,No,No,No,No,No,Yes,No,No,5,1
,"Area Asset Checks-1830, 1840, DDG Cooler",23-38633,1800,1800,,,5-1-23 1:48 AM,2023-05-01T01:48:00.000Z,5-29-23 12:00 AM,2023-05-29T00:00:00.000Z,5-29-23 12:57 PM,2023-05-29T12:57:00.000Z,4,4,,PM,CLOSE,Y,,NO,CHATHAM,,,,,,,,,,,,,,,,62,2023-05-28T15:00:00.000Z,2023-05-28T15:30:00.000Z,0.6666666666666666,0.027777777777777776,No,No,No,No,No,Yes,No,No,5,1
,"Area Asset Checks-1830, 1840, DDG Cooler",23-38642,1800,1800,,,5-1-23 1:48 AM,2023-05-01T01:48:00.000Z,5-29-23 12:00 AM,2023-05-29T00:00:00.000Z,5-29-23 12:30 AM,2023-05-29T00:30:00.000Z,4,4,,PM,CLOSE,Y,N,NO,CHATHAM,,,,,,,,,,,,,,,,62,2023-05-28T15:00:00.000Z,2023-05-28T15:30:00.000Z,0.6666666666666666,0.027777777777777776,No,No,No,No,No,Yes,No,No,5,1
6833,"Install to 1/2\" swaglok needle valves on the Kato Generator oil supply lines",23-38848,ME-3601A,ME-3601A,,,5-3-23 2:59 PM,2023-05-03T14:59:00.000Z,5-2-23 4:00 PM,2023-05-02T16:00:00.000Z,5-29-23 2:57 PM,2023-05-29T14:57:00.000Z,2,2,,CO,CLOSE,Y,,NO,CHATHAM,,,,,,,,,,,,,,,,62,2023-05-28T15:00:00.000Z,2023-05-28T15:30:00.000Z,0.6666666666666666,0.027777777777777776,No,No,No,No,No,Yes,No,No,5,1
1290,As-Build End of Life BL-1802 VFD,23-39194,BL-1802,BL-1802,,,5-8-23 9:03 AM,2023-05-08T09:03:00.000Z,5-21-23 8:11 AM,2023-05-21T08:11:00.000Z,5-29-23 10:11 AM,2023-05-29T10:11:00.000Z,4,4,,CO,CLOSE,Y,,NO,CHATHAM,"1290, 7029","BLOWER, IAP, MODEL XRT SIZE 445, CW/UB, Arrg't 12, 250HP / 1785RPM / TEFC / 575V/3PH/60HZ / 504/5T FRAME",,No,DRYER D,,,,,,,,,,,62,2023-05-28T15:00:00.000Z,2023-05-28T15:30:00.000Z,0.6666666666666666,0.027777777777777776,No,No,No,No,No,Yes,No,No,5,1
,Install new cat 6E cable for MC3 Accuload communications,23-39625,,,,,5-18-23 6:48 AM,2023-05-18T06:48:00.000Z,5-28-23 6:48 AM,2023-05-28T06:48:00.000Z,5-29-23 10:48 AM,2023-05-29T10:48:00.000Z,4,4,,CO,CLOSE,Y,,NO,CHATHAM,,,,,,,,,,,,,,,,62,2023-05-28T15:00:00.000Z,2023-05-28T15:30:00.000Z,0.6666666666666666,0.027777777777777776,No,No,No,No,No,Yes,No,No,5,1
1323,Sign blew off of post in DDG lane,23-39974,BU-GHR,BU-GHR,,,5-23-23 9:30 AM,2023-05-23T09:30:00.000Z,5-31-23 7:49 AM,2023-05-31T07:49:00.000Z,5-29-23 8:50 AM,2023-05-29T08:50:00.000Z,4,4,,SA,CLOSE,Y,,NO,CHATHAM,,,,,,,,,,,,,,,,62,2023-05-28T15:00:00.000Z,2023-05-28T15:30:00.000Z,0.6666666666666666,0.027777777777777776,No,No,No,No,No,Yes,No,No,5,1
1330,Re-install ladder to E-3601,23-39996,BU-UTIL,BU-UTIL,,,5-23-23 10:07 AM,2023-05-23T10:07:00.000Z,5-31-23 8:35 AM,2023-05-31T08:35:00.000Z,5-29-23 11:37 AM,2023-05-29T11:37:00.000Z,4,4,,CO,CLOSE,Y,,NO,CHATHAM,,,,,,,,,,,,,,,,62,2023-05-28T15:00:00.000Z,2023-05-28T15:30:00.000Z,0.6666666666666666,0.027777777777777776,No,No,No,No,No,Yes,No,No,5,1
,REBUILD HYDOHEATER WEEK OF MAY 29TH,23-40016,EJ-1302,EJ-1302,,,5-24-23 8:35 AM,2023-05-24T08:35:00.000Z,6-10-23 8:35 AM,2023-06-10T08:35:00.000Z,5-29-23 2:35 PM,2023-05-29T14:35:00.000Z,2,2,,CO,CLOSE,Y,,NO,CHATHAM,,,,,,,,,,,,,,,,62,2023-05-28T15:00:00.000Z,2023-05-28T15:30:00.000Z,0.6666666666666666,0.027777777777777776,No,No,No,No,No,Yes,No,No,5,1
4847,Getting an air damper mismatch alarm,23-40038,PZT-36801,PZT-36801,,,5-25-23 7:38 AM,2023-05-25T07:38:00.000Z,5-31-23 5:15 PM,2023-05-31T17:15:00.000Z,5-29-23 5:49 AM,2023-05-29T05:49:00.000Z,2,2,,EMCAL,CLOSE,Y,,NO,CHATHAM,,,,,,,,,,,,,,,,62,2023-05-28T15:00:00.000Z,2023-05-28T15:30:00.000Z,0.6666666666666666,0.027777777777777776,No,No,No,No,No,Yes,No,No,5,1
1581,Sample valve on E-6580 leaking alcohol,23-40043,E-6580,E-6580,,,5-25-23 8:39 AM,2023-05-25T08:39:00.000Z,6-2-23 2:21 PM,2023-06-02T14:21:00.000Z,5-29-23 3:21 PM,2023-05-29T15:21:00.000Z,2,2,,RM,CLOSE,Y,,NO,CHATHAM,,,,,,,,,,,,,,,,62,2023-05-28T15:00:00.000Z,2023-05-28T15:30:00.000Z,0.6666666666666666,0.027777777777777776,No,No,No,No,No,Yes,No,No,5,1
5517,"New tank to be secured in place, Piping hooked up, and Gauge glass installed",23-31840,TK-3604,TK-3604,,,1-12-23 10:39 AM,2023-01-12T10:39:00.000Z,2-28-23 9:30 AM,2023-02-28T09:30:00.000Z,5-30-23 7:54 AM,2023-05-30T07:54:00.000Z,4,4,,CO,CLOSE,Y,,NO,CHATHAM,,,,,,,,,,,,,,,,65,2023-05-29T17:10:00.000Z,2023-05-29T18:00:00.000Z,22.666666666666668,0.9444444444444444,No,No,No,No,No,Yes,No,No,5,1
3235,AT DCS,23-34674,LT-56306,LT-56306,,,2-27-23 1:47 AM,2023-02-27T01:47:00.000Z,5-22-23 12:00 AM,2023-05-22T00:00:00.000Z,5-29-23 4:13 PM,2023-05-29T16:13:00.000Z,4,4,,PM,CLOSE,Y,,NO,CHATHAM,,,,,,,,,,,,,,,,65,2023-05-29T17:10:00.000Z,2023-05-29T18:00:00.000Z,22.666666666666668,0.9444444444444444,No,No,No,No,No,No,No,Yes,3,1
,AT DCS,23-34678,LT-36101,LT-36101,,,2-27-23 1:47 AM,2023-02-27T01:47:00.000Z,5-22-23 12:00 AM,2023-05-22T00:00:00.000Z,5-29-23 4:13 PM,2023-05-29T16:13:00.000Z,4,4,,PM,CLOSE,Y,,NO,CHATHAM,,,,,,,,,,,,,,,,65,2023-05-29T17:10:00.000Z,2023-05-29T18:00:00.000Z,22.666666666666668,0.9444444444444444,No,No,No,No,No,No,No,Yes,3,1
,IN FIELD,23-34679,LT-36101,LT-36101,,,2-27-23 1:47 AM,2023-02-27T01:47:00.000Z,5-22-23 12:00 AM,2023-05-22T00:00:00.000Z,5-29-23 4:13 PM,2023-05-29T16:13:00.000Z,4,4,,PM,CLOSE,Y,,NO,CHATHAM,,,,,,,,,,,,,,,,65,2023-05-29T17:10:00.000Z,2023-05-29T18:00:00.000Z,22.666666666666668,0.9444444444444444,No,No,No,No,No,No,No,Yes,3,1
3235,IN FIELD,23-34675,LT-56306,LT-56306,,,2-27-23 1:47 AM,2023-02-27T01:47:00.000Z,5-22-23 12:00 AM,2023-05-22T00:00:00.000Z,5-29-23 4:13 PM,2023-05-29T16:13:00.000Z,4,4,,PM,CLOSE,Y,,NO,CHATHAM,,,,,,,,,,,,,,,,65,2023-05-29T17:10:00.000Z,2023-05-29T18:00:00.000Z,22.666666666666668,0.9444444444444444,No,No,No,No,No,No,No,Yes,3,1
3235,AT DCS,23-34676,LT-56306,LT-56306,,,2-27-23 1:47 AM,2023-02-27T01:47:00.000Z,5-22-23 12:00 AM,2023-05-22T00:00:00.000Z,5-29-23 4:13 PM,2023-05-29T16:13:00.000Z,4,4,,PM,CLOSE,Y,,NO,CHATHAM,,,,,,,,,,,,,,,,65,2023-05-29T17:10:00.000Z,2023-05-29T18:00:00.000Z,22.666666666666668,0.9444444444444444,No,No,No,No,No,No,No,Yes,3,1
,AT DCS,23-34680,LT-36101,LT-36101,,,2-27-23 1:47 AM,2023-02-27T01:47:00.000Z,5-22-23 12:00 AM,2023-05-22T00:00:00.000Z,5-29-23 4:13 PM,2023-05-29T16:13:00.000Z,4,4,,PM,CLOSE,Y,,NO,CHATHAM,,,,,,,,,,,,,,,,65,2023-05-29T17:10:00.000Z,2023-05-29T18:00:00.000Z,22.666666666666668,0.9444444444444444,No,No,No,No,No,No,No,Yes,3,1
3166,IN FIELD,23-35001,LT-15507,LT-15507,,,3-6-23 1:46 AM,2023-03-06T01:46:00.000Z,5-30-23 12:00 AM,2023-05-30T00:00:00.000Z,5-29-23 4:13 PM,2023-05-29T16:13:00.000Z,4,4,,PM,CLOSE,Y,,NO,CHATHAM,,,,,,,,,,,,,,,,65,2023-05-29T17:10:00.000Z,2023-05-29T18:00:00.000Z,22.666666666666668,0.9444444444444444,No,No,No,No,No,No,No,Yes,3,1
3166,AT DCS,23-35002,LT-15507,LT-15507,,,3-6-23 1:46 AM,2023-03-06T01:46:00.000Z,5-30-23 12:00 AM,2023-05-30T00:00:00.000Z,5-29-23 4:13 PM,2023-05-29T16:13:00.000Z,4,4,,PM,CLOSE,Y,,NO,CHATHAM,,,,,,,,,,,,,,,,65,2023-05-29T17:10:00.000Z,2023-05-29T18:00:00.000Z,22.666666666666668,0.9444444444444444,No,No,No,No,No,No,No,Yes,3,1
3166,AT DCS,23-35000,LT-15507,LT-15507,,,3-6-23 1:46 AM,2023-03-06T01:46:00.000Z,5-30-23 12:00 AM,2023-05-30T00:00:00.000Z,5-29-23 4:13 PM,2023-05-29T16:13:00.000Z,4,4,,PM,CLOSE,Y,,NO,CHATHAM,,,,,,,,,,,,,,,,65,2023-05-29T17:10:00.000Z,2023-05-29T18:00:00.000Z,22.666666666666668,0.9444444444444444,No,No,No,No,No,No,No,Yes,3,1
1279,BE-2101 - INSPECTION DRIVE GEARBOX OIL CHANGE,23-36908,BE-2101,BE-2101,,,4-3-23 1:46 AM,2023-04-03T01:46:00.000Z,5-28-23 12:00 AM,2023-05-28T00:00:00.000Z,5-30-23 12:53 PM,2023-05-30T12:53:00.000Z,4,4,,PM,CLOSE,Y,N,NO,CHATHAM,,,,,,,,,,,,,,,,65,2023-05-29T17:10:00.000Z,2023-05-29T18:00:00.000Z,22.666666666666668,0.9444444444444444,No,No,No,No,No,Yes,No,No,5,1
1279,CHANGE INSPECTION DRIVE GEARBOX LUBRICANT,23-36909,BE-2101,BE-2101,,,4-3-23 1:46 AM,2023-04-03T01:46:00.000Z,4-27-23 12:00 AM,2023-04-27T00:00:00.000Z,5-30-23 12:53 PM,2023-05-30T12:53:00.000Z,4,4,,PM,CLOSE,Y,,NO,CHATHAM,,,,,,,,,,,,,,,,65,2023-05-29T17:10:00.000Z,2023-05-29T18:00:00.000Z,22.666666666666668,0.9444444444444444,No,No,No,No,No,Yes,No,No,5,1
,"Area Asset Checks-2200, 2300, 3200, 3600, 4100",23-38214,2200,2200,,,4-24-23 1:49 AM,2023-04-24T01:49:00.000Z,5-22-23 12:00 AM,2023-05-22T00:00:00.000Z,5-29-23 4:13 PM,2023-05-29T16:13:00.000Z,4,4,,PM,CLOSE,Y,,NO,CHATHAM,,,,,,,,,,,,,,,,65,2023-05-29T17:10:00.000Z,2023-05-29T18:00:00.000Z,22.666666666666668,0.9444444444444444,No,No,No,No,No,No,No,Yes,3,1
,"Area Asset Checks-1600, 1660, 1700",23-38201,1600,1600,,,4-24-23 1:49 AM,2023-04-24T01:49:00.000Z,5-22-23 12:00 AM,2023-05-22T00:00:00.000Z,5-30-23 12:53 PM,2023-05-30T12:53:00.000Z,4,4,,PM,CLOSE,Y,N,NO,CHATHAM,,,,,,,,,,,,,,,,65,2023-05-29T17:10:00.000Z,2023-05-29T18:00:00.000Z,22.666666666666668,0.9444444444444444,No,No,No,No,No,Yes,No,No,5,1
,"Area Asset Checks-1600, 1660, 1700 (Evaps, Corn oil, Decanyers)",23-38202,1600,1600,,,4-24-23 1:49 AM,2023-04-24T01:49:00.000Z,5-22-23 12:00 AM,2023-05-22T00:00:00.000Z,5-30-23 12:53 PM,2023-05-30T12:53:00.000Z,4,4,,PM,CLOSE,Y,,NO,CHATHAM,,,,,,,,,,,,,,,,65,2023-05-29T17:10:00.000Z,2023-05-29T18:00:00.000Z,22.666666666666668,0.9444444444444444,No,No,No,No,No,Yes,No,No,5,1
,"Area Asset Checks-1500, 6500 (Distillation)",23-38210,1500,1500,,,4-24-23 1:49 AM,2023-04-24T01:49:00.000Z,5-22-23 12:00 AM,2023-05-22T00:00:00.000Z,5-29-23 4:13 PM,2023-05-29T16:13:00.000Z,4,4,,PM,CLOSE,Y,,NO,CHATHAM,,,,,,,,,,,,,,,,65,2023-05-29T17:10:00.000Z,2023-05-29T18:00:00.000Z,22.666666666666668,0.9444444444444444,No,No,No,No,No,No,No,Yes,3,1
,CHECK PACKING GLAND LUBRICANT.  ADD GREASE  AS NECESSARY,23-38661,CV-1826B,CV-1826B,,,5-1-23 1:48 AM,2023-05-01T01:48:00.000Z,5-23-23 7:00 AM,2023-05-23T07:00:00.000Z,5-30-23 1:07 PM,2023-05-30T13:07:00.000Z,2,2,,PM,CLOSE,Y,,NO,CHATHAM,"2487, 2508","7.5 HP / 3520 RPM / TEFC / 575V/3PH/60HZ / FRAME#213TC, SEW PARALLEL SHAFT HELICAL GEAR UNIT FHZ127 R77 AM213/215",,No,DRYER A,CH-DRA_CYCLNS,CH-DRA_CYCLNS:IT18172.MEAS,IT-18172,IT,MEAS,Measured value (PV),Current transmitter (motor amps),Measurement,CV1826B CURRENT INDICATION,CV-1826B,65,2023-05-29T17:10:00.000Z,2023-05-29T18:00:00.000Z,22.666666666666668,0.9444444444444444,No,No,No,No,No,Yes,No,No,5,1
,INSPECT SCREW CONVEYOR,23-38664,CV-1826B,CV-1826B,,,5-1-23 1:48 AM,2023-05-01T01:48:00.000Z,5-23-23 7:00 AM,2023-05-23T07:00:00.000Z,5-30-23 1:07 PM,2023-05-30T13:07:00.000Z,2,2,,PM,CLOSE,Y,,NO,CHATHAM,"2487, 2508","7.5 HP / 3520 RPM / TEFC / 575V/3PH/60HZ / FRAME#213TC, SEW PARALLEL SHAFT HELICAL GEAR UNIT FHZ127 R77 AM213/215",,No,DRYER A,CH-DRA_CYCLNS,CH-DRA_CYCLNS:IT18172.MEAS,IT-18172,IT,MEAS,Measured value (PV),Current transmitter (motor amps),Measurement,CV1826B CURRENT INDICATION,CV-1826B,65,2023-05-29T17:10:00.000Z,2023-05-29T18:00:00.000Z,22.666666666666668,0.9444444444444444,No,No,No,No,No,Yes,No,No,5,1
,"Area Asset Checks-2200, 2300, 3200, 3600, 4100",23-38631,2200,2200,,,5-1-23 1:48 AM,2023-05-01T01:48:00.000Z,5-29-23 12:00 AM,2023-05-29T00:00:00.000Z,5-29-23 4:37 PM,2023-05-29T16:37:00.000Z,4,4,,PM,CLOSE,Y,,NO,CHATHAM,,,,,,,,,,,,,,,,65,2023-05-29T17:10:00.000Z,2023-05-29T18:00:00.000Z,22.666666666666668,0.9444444444444444,No,No,No,No,No,No,No,Yes,3,1
,"Area Asset Checks-1830, 1840, DDG Cooler",23-38643,1800,1800,,,5-1-23 1:48 AM,2023-05-01T01:48:00.000Z,5-29-23 12:00 AM,2023-05-29T00:00:00.000Z,5-30-23 10:07 AM,2023-05-30T10:07:00.000Z,4,4,,PM,CLOSE,Y,,NO,CHATHAM,,,,,,,,,,,,,,,,65,2023-05-29T17:10:00.000Z,2023-05-29T18:00:00.000Z,22.666666666666668,0.9444444444444444,No,No,No,No,No,Yes,No,No,5,1
,INSPECT PILLOW BLOCK BEARINGS,23-38662,CV-1826B,CV-1826B,,,5-1-23 1:48 AM,2023-05-01T01:48:00.000Z,5-23-23 7:00 AM,2023-05-23T07:00:00.000Z,5-30-23 1:07 PM,2023-05-30T13:07:00.000Z,2,2,,PM,CLOSE,Y,,NO,CHATHAM,"2487, 2508","7.5 HP / 3520 RPM / TEFC / 575V/3PH/60HZ / FRAME#213TC, SEW PARALLEL SHAFT HELICAL GEAR UNIT FHZ127 R77 AM213/215",,No,DRYER A,CH-DRA_CYCLNS,CH-DRA_CYCLNS:IT18172.MEAS,IT-18172,IT,MEAS,Measured value (PV),Current transmitter (motor amps),Measurement,CV1826B CURRENT INDICATION,CV-1826B,65,2023-05-29T17:10:00.000Z,2023-05-29T18:00:00.000Z,22.666666666666668,0.9444444444444444,No,No,No,No,No,Yes,No,No,5,1
,CHECK CONDITION OF THE PACKING IN THE STUFFING BOX,23-38660,CV-1826B,CV-1826B,,,5-1-23 1:48 AM,2023-05-01T01:48:00.000Z,5-23-23 7:00 AM,2023-05-23T07:00:00.000Z,5-30-23 1:07 PM,2023-05-30T13:07:00.000Z,2,2,,PM,CLOSE,Y,,NO,CHATHAM,"2487, 2508","7.5 HP / 3520 RPM / TEFC / 575V/3PH/60HZ / FRAME#213TC, SEW PARALLEL SHAFT HELICAL GEAR UNIT FHZ127 R77 AM213/215",,No,DRYER A,CH-DRA_CYCLNS,CH-DRA_CYCLNS:IT18172.MEAS,IT-18172,IT,MEAS,Measured value (PV),Current transmitter (motor amps),Measurement,CV1826B CURRENT INDICATION,CV-1826B,65,2023-05-29T17:10:00.000Z,2023-05-29T18:00:00.000Z,22.666666666666668,0.9444444444444444,No,No,No,No,No,Yes,No,No,5,1
,INSPECT GEARBOX,23-38663,CV-1826B,CV-1826B,,,5-1-23 1:48 AM,2023-05-01T01:48:00.000Z,5-23-23 7:00 AM,2023-05-23T07:00:00.000Z,5-30-23 1:07 PM,2023-05-30T13:07:00.000Z,2,2,,PM,CLOSE,Y,,NO,CHATHAM,"2487, 2508","7.5 HP / 3520 RPM / TEFC / 575V/3PH/60HZ / FRAME#213TC, SEW PARALLEL SHAFT HELICAL GEAR UNIT FHZ127 R77 AM213/215",,No,DRYER A,CH-DRA_CYCLNS,CH-DRA_CYCLNS:IT18172.MEAS,IT-18172,IT,MEAS,Measured value (PV),Current transmitter (motor amps),Measurement,CV1826B CURRENT INDICATION,CV-1826B,65,2023-05-29T17:10:00.000Z,2023-05-29T18:00:00.000Z,22.666666666666668,0.9444444444444444,No,No,No,No,No,Yes,No,No,5,1
,INSPECT CONVEYOR TROUGH,23-38665,CV-1826B,CV-1826B,,,5-1-23 1:48 AM,2023-05-01T01:48:00.000Z,5-23-23 7:00 AM,2023-05-23T07:00:00.000Z,5-30-23 1:07 PM,2023-05-30T13:07:00.000Z,2,2,,PM,CLOSE,Y,,NO,CHATHAM,"2487, 2508","7.5 HP / 3520 RPM / TEFC / 575V/3PH/60HZ / FRAME#213TC, SEW PARALLEL SHAFT HELICAL GEAR UNIT FHZ127 R77 AM213/215",,No,DRYER A,CH-DRA_CYCLNS,CH-DRA_CYCLNS:IT18172.MEAS,IT-18172,IT,MEAS,Measured value (PV),Current transmitter (motor amps),Measurement,CV1826B CURRENT INDICATION,CV-1826B,65,2023-05-29T17:10:00.000Z,2023-05-29T18:00:00.000Z,22.666666666666668,0.9444444444444444,No,No,No,No,No,Yes,No,No,5,1
1532,DDGS Cooler - Preparation checks before putting online,23-39581,E-1824,E-1824,,,5-16-23 6:42 AM,2023-05-16T06:42:00.000Z,5-18-23 9:29 PM,2023-05-18T21:29:00.000Z,5-30-23 12:50 PM,2023-05-30T12:50:00.000Z,2,2,,CO,CLOSE,Y,,NO,CHATHAM,1532,Geelen Counterflow Product Cooler,,No,DDG,,,,,,,,,,,65,2023-05-29T17:10:00.000Z,2023-05-29T18:00:00.000Z,22.666666666666668,0.9444444444444444,No,No,No,No,No,Yes,No,No,5,1
,Forklift assistance for inventory 9:30am-12pm,23-39627,0000,0000,,,5-18-23 9:00 AM,2023-05-18T09:00:00.000Z,5-28-23 9:00 AM,2023-05-28T09:00:00.000Z,5-30-23 12:49 PM,2023-05-30T12:49:00.000Z,4,4,,CO,CLOSE,Y,,NO,CHATHAM,,,,,,,,,,,,,,,,65,2023-05-29T17:10:00.000Z,2023-05-29T18:00:00.000Z,22.666666666666668,0.9444444444444444,No,No,No,No,No,Yes,No,No,5,1
1145,Check vibrations on P-3501A. SOunds Rough,23-39994,P-3501A,P-3501A,,,5-23-23 10:02 AM,2023-05-23T10:02:00.000Z,5-28-23 5:27 PM,2023-05-28T17:27:00.000Z,5-30-23 12:50 PM,2023-05-30T12:50:00.000Z,2,2,,PD,CLOSE,Y,,NO,CHATHAM,,,,,,,,,,,,,,,,65,2023-05-29T17:10:00.000Z,2023-05-29T18:00:00.000Z,22.666666666666668,0.9444444444444444,No,No,No,No,No,Yes,No,No,5,1
,Disconnect Westhoek Office trailer May29,23-39997,0000,0000,,,5-23-23 10:11 AM,2023-05-23T10:11:00.000Z,5-30-23 12:00 AM,2023-05-30T00:00:00.000Z,5-30-23 10:11 AM,2023-05-30T10:11:00.000Z,4,4,,CP,CLOSE,Y,,NO,CHATHAM,,,,,,,,,,,,,,,,65,2023-05-29T17:10:00.000Z,2023-05-29T18:00:00.000Z,22.666666666666668,0.9444444444444444,No,No,No,No,No,Yes,No,No,5,1
,Forklift Driver to  load Empty Totes,23-40026,BU-ADMIN,BU-ADMIN,,,5-24-23 11:24 AM,2023-05-24T11:24:00.000Z,5-31-23 9:28 AM,2023-05-31T09:28:00.000Z,5-30-23 1:09 PM,2023-05-30T13:09:00.000Z,2,2,,CO,CLOSE,Y,,NO,CHATHAM,,,,,,,,,,,,,,,,65,2023-05-29T17:10:00.000Z,2023-05-29T18:00:00.000Z,22.666666666666668,0.9444444444444444,No,No,No,No,No,Yes,No,No,5,1
1314,Install Dimmer Switch in Janice's Office,23-40040,BU-ADMIN,BU-ADMIN,,,5-25-23 7:47 AM,2023-05-25T07:47:00.000Z,6-2-23 8:55 AM,2023-06-02T08:55:00.000Z,5-30-23 10:25 AM,2023-05-30T10:25:00.000Z,4,4,,CO,CLOSE,Y,,NO,CHATHAM,,,,,,,,,,,,,,,,65,2023-05-29T17:10:00.000Z,2023-05-29T18:00:00.000Z,22.666666666666668,0.9444444444444444,No,No,No,No,No,Yes,No,No,5,1
3081,BIOTHANE FLOAT OP CHECK- (LSH-41401) - PM SERVICE,23-40081,LSH-41401,LSH-41401,,,5-29-23 1:46 AM,2023-05-29T01:46:00.000Z,6-26-23 12:30 AM,2023-06-26T00:30:00.000Z,6-26-23 12:30 AM,2023-06-26T00:30:00.000Z,4,4,,PM,CLOSE,Y,N,NO,CHATHAM,,,,,,,,,,,,,,,,65,2023-05-29T17:10:00.000Z,2023-05-29T18:00:00.000Z,22.666666666666668,0.9444444444444444,No,No,No,Yes,No,No,No,No,4,1
,SAFETY SHOWER FLUSH & CHECK - PM SERVICE,23-40107,CHATHAM,CHATHAM,,,5-29-23 1:46 AM,2023-05-29T01:46:00.000Z,6-26-23 1:30 AM,2023-06-26T01:30:00.000Z,6-29-23 8:09 AM,2023-06-29T08:09:00.000Z,4,4,,PM,CLOSE,Y,N,NO,CHATHAM,,,,,,,,,,,,,,,,65,2023-05-29T17:10:00.000Z,2023-05-29T18:00:00.000Z,22.666666666666668,0.9444444444444444,No,No,No,Yes,No,No,No,No,4,1
1069,P-1511B - OIL SAMPLE,23-40115,P-1511B,P-1511B,,,5-29-23 1:46 AM,2023-05-29T01:46:00.000Z,7-22-23 12:30 AM,2023-07-22T00:30:00.000Z,7-21-23 12:15 AM,2023-07-21T00:15:00.000Z,4,4,,PM,CLOSE,Y,N,NO,CHATHAM,,,,,,,,,,,,,,,,65,2023-05-29T17:10:00.000Z,2023-05-29T18:00:00.000Z,22.666666666666668,0.9444444444444444,No,No,No,Yes,No,No,No,No,4,1
3081,Check operation of biothane float in diked area,23-40082,LSH-41401,LSH-41401,,,5-29-23 1:46 AM,2023-05-29T01:46:00.000Z,6-26-23 12:30 AM,2023-06-26T00:30:00.000Z,6-26-23 10:12 AM,2023-06-26T10:12:00.000Z,4,4,,PM,CLOSE,Y,,NO,CHATHAM,,,,,,,,,,,,,,,,65,2023-05-29T17:10:00.000Z,2023-05-29T18:00:00.000Z,22.666666666666668,0.9444444444444444,No,No,No,Yes,No,No,No,No,4,1
4865,SA-2101 CORN PROBE - MECHANICAL  PM,23-40089,SA-2101,SA-2101,,,5-29-23 1:46 AM,2023-05-29T01:46:00.000Z,6-26-23 7:30 AM,2023-06-26T07:30:00.000Z,6-26-23 8:00 AM,2023-06-26T08:00:00.000Z,4,4,,PM,CLOSE,Y,N,NO,CHATHAM,,,,,,,,,,,,,,,,65,2023-05-29T17:10:00.000Z,2023-05-29T18:00:00.000Z,22.666666666666668,0.9444444444444444,No,No,No,Yes,No,No,No,No,4,1
1285,BL-1202C MECHANICAL PM,23-40085,BL-1201,BL-1201,,,5-29-23 1:46 AM,2023-05-29T01:46:00.000Z,6-26-23 1:00 AM,2023-06-26T01:00:00.000Z,6-26-23 1:00 AM,2023-06-26T01:00:00.000Z,4,4,,PM,CLOSE,Y,N,NO,CHATHAM,,,,,,,,,,,,,,,,65,2023-05-29T17:10:00.000Z,2023-05-29T18:00:00.000Z,22.666666666666668,0.9444444444444444,No,No,No,Yes,No,No,No,No,4,1
,SAFETY SHOWER WEEKLY FLUSH,23-40108,CHATHAM,CHATHAM,,,5-29-23 1:46 AM,2023-05-29T01:46:00.000Z,6-26-23 1:30 AM,2023-06-26T01:30:00.000Z,6-29-23 8:09 AM,2023-06-29T08:09:00.000Z,4,4,,PM,CLOSE,Y,,NO,CHATHAM,,,,,,,,,,,,,,,,65,2023-05-29T17:10:00.000Z,2023-05-29T18:00:00.000Z,22.666666666666668,0.9444444444444444,No,No,No,Yes,No,No,No,No,4,1
4865,Corn Probe Weekly PM,23-40090,SA-2101,SA-2101,,,5-29-23 1:46 AM,2023-05-29T01:46:00.000Z,6-26-23 7:30 AM,2023-06-26T07:30:00.000Z,6-28-23 6:18 AM,2023-06-28T06:18:00.000Z,4,4,,PM,CLOSE,Y,,NO,CHATHAM,,,,,,,,,,,,,,,,65,2023-05-29T17:10:00.000Z,2023-05-29T18:00:00.000Z,22.666666666666668,0.9444444444444444,No,No,No,Yes,No,No,No,No,4,1
4868,SC-1301 - MECHANICAL CHECKS,23-40113,SC-1301,SC-1301,,,5-29-23 1:46 AM,2023-05-29T01:46:00.000Z,6-26-23 1:00 AM,2023-06-26T01:00:00.000Z,6-26-23 1:00 AM,2023-06-26T01:00:00.000Z,4,4,,PM,CLOSE,Y,N,NO,CHATHAM,,,,,,,,,,,,,,,,65,2023-05-29T17:10:00.000Z,2023-05-29T18:00:00.000Z,22.666666666666668,0.9444444444444444,No,No,No,Yes,No,No,No,No,4,1
1285,CENTRIFUGAL BLOWER P.M.,23-40086,BL-1201,BL-1201,,,5-29-23 1:46 AM,2023-05-29T01:46:00.000Z,6-26-23 1:30 AM,2023-06-26T01:30:00.000Z,6-27-23 3:00 PM,2023-06-27T15:00:00.000Z,4,4,,PM,CLOSE,Y,,NO,CHATHAM,,,,,,,,,,,,,,,,65,2023-05-29T17:10:00.000Z,2023-05-29T18:00:00.000Z,22.666666666666668,0.9444444444444444,No,No,No,Yes,No,No,No,No,4,1
7138,ACCULOAD SCULLY CABLE -PM SERVICE,23-40109,FQIC-2203,FQIC-2203,,,5-29-23 1:46 AM,2023-05-29T01:46:00.000Z,6-23-23 12:30 AM,2023-06-23T00:30:00.000Z,6-23-23 12:30 AM,2023-06-23T00:30:00.000Z,4,4,,PM,CLOSE,Y,N,NO,CHATHAM,,,,,,,,,,,,,,,,65,2023-05-29T17:10:00.000Z,2023-05-29T18:00:00.000Z,22.666666666666668,0.9444444444444444,No,No,No,Yes,No,No,No,No,4,1
7138,ACCULOAD SCULLY CABLE BI-WEEKLY PM,23-40110,FQIC-2203,FQIC-2203,,,5-29-23 1:46 AM,2023-05-29T01:46:00.000Z,6-23-23 12:30 AM,2023-06-23T00:30:00.000Z,6-23-23 10:37 AM,2023-06-23T10:37:00.000Z,4,4,,PM,CLOSE,Y,,NO,CHATHAM,,,,,,,,,,,,,,,,65,2023-05-29T17:10:00.000Z,2023-05-29T18:00:00.000Z,22.666666666666668,0.9444444444444444,No,No,No,Yes,No,No,No,No,4,1
4868,SC-1301 MECHANICAL CHECKS,23-40114,SC-1301,SC-1301,,,5-29-23 1:46 AM,2023-05-29T01:46:00.000Z,6-26-23 1:00 AM,2023-06-26T01:00:00.000Z,6-26-23 3:27 PM,2023-06-26T15:27:00.000Z,4,4,,PM,CLOSE,Y,,NO,CHATHAM,,,,,,,,,,,,,,,,65,2023-05-29T17:10:00.000Z,2023-05-29T18:00:00.000Z,22.666666666666668,0.9444444444444444,No,No,No,Yes,No,No,No,No,4,1
1069,WEARCHECK OIL SAMPLING TASK ( FOR ANALYSIS),23-40116,P-1511B,P-1511B,,,5-29-23 1:46 AM,2023-05-29T01:46:00.000Z,7-22-23 12:00 AM,2023-07-22T00:00:00.000Z,7-21-23 3:02 PM,2023-07-21T15:02:00.000Z,4,4,,PM,CLOSE,Y,,NO,CHATHAM,,,,,,,,,,,,,,,,65,2023-05-29T17:10:00.000Z,2023-05-29T18:00:00.000Z,22.666666666666668,0.9444444444444444,No,No,No,Yes,No,No,No,No,4,1
4857,REMOVE EXISTING ROTARY VALVE,23-40133,RV-1807D,RV-1807D,,,5-29-23 1:47 AM,2023-05-29T01:47:00.000Z,10-21-23 1:00 AM,2023-10-21T01:00:00.000Z,10-30-23 7:45 AM,2023-10-30T07:45:00.000Z,4,4,,SD,CLOSE,Y,,NO,CHATHAM,4857,"DRYER D, CV-1812D DISCHARGE AIRLOCK",,No,DRYER D,,,,,,,,,,,65,2023-05-29T17:10:00.000Z,2023-05-29T18:00:00.000Z,22.666666666666668,0.9444444444444444,No,No,No,Yes,No,No,No,No,4,1
4857,INSTALL SPARE ROTARY VALVE,23-40134,RV-1807D,RV-1807D,,,5-29-23 1:47 AM,2023-05-29T01:47:00.000Z,10-21-23 1:00 AM,2023-10-21T01:00:00.000Z,10-30-23 7:45 AM,2023-10-30T07:45:00.000Z,4,4,,SD,CLOSE,Y,,NO,CHATHAM,4857,"DRYER D, CV-1812D DISCHARGE AIRLOCK",,No,DRYER D,,,,,,,,,,,65,2023-05-29T17:10:00.000Z,2023-05-29T18:00:00.000Z,22.666666666666668,0.9444444444444444,No,No,No,Yes,No,No,No,No,4,1
4857,PICKUPS TO BE REMOVED FROM HOLD AND RE-INSTALLED ON NEW,23-40136,RV-1807D,RV-1807D,,,5-29-23 1:47 AM,2023-05-29T01:47:00.000Z,10-21-23 12:00 AM,2023-10-21T00:00:00.000Z,10-30-23 7:45 AM,2023-10-30T07:45:00.000Z,4,4,,SD,CLOSE,Y,,NO,CHATHAM,4857,"DRYER D, CV-1812D DISCHARGE AIRLOCK",,No,DRYER D,,,,,,,,,,,65,2023-05-29T17:10:00.000Z,2023-05-29T18:00:00.000Z,22.666666666666668,0.9444444444444444,No,No,No,Yes,No,No,No,No,4,1
1532,VISUAL INSPECTION OF RAKE/SHAFT,23-40150,E-1824,E-1824,,,5-29-23 1:47 AM,2023-05-29T01:47:00.000Z,9-18-23 12:00 AM,2023-09-18T00:00:00.000Z,8-23-23 6:32 AM,2023-08-23T06:32:00.000Z,4,4,,SD,CLOSE,Y,,NO,CHATHAM,1532,Geelen Counterflow Product Cooler,,No,DDG,,,,,,,,,,,65,2023-05-29T17:10:00.000Z,2023-05-29T18:00:00.000Z,22.666666666666668,0.9444444444444444,No,No,No,Yes,No,No,No,No,4,1
,REMOVE & RE-INSTALL CYCLONE PROBES,23-40152,1840,1840,,,5-29-23 1:47 AM,2023-05-29T01:47:00.000Z,10-23-23 1:00 AM,2023-10-23T01:00:00.000Z,10-30-23 7:45 AM,2023-10-30T07:45:00.000Z,4,4,,SD,CLOSE,Y,,NO,CHATHAM,,,,,,,,,,,,,,,,65,2023-05-29T17:10:00.000Z,2023-05-29T18:00:00.000Z,22.666666666666668,0.9444444444444444,No,No,No,Yes,No,No,No,No,4,1
1436,CV-2110 MECHANICAL PM,23-40123,CV-2110,CV-2110,,,5-29-23 1:47 AM,2023-05-29T01:47:00.000Z,10-23-23 1:30 AM,2023-10-23T01:30:00.000Z,10-30-23 7:45 AM,2023-10-30T07:45:00.000Z,4,4,,PM,CLOSE,Y,N,NO,CHATHAM,,,,,,,,,,,,,,,,65,2023-05-29T17:10:00.000Z,2023-05-29T18:00:00.000Z,22.666666666666668,0.9444444444444444,No,No,No,Yes,No,No,No,No,4,1
4857,RV-1807D - REPLACEMENT,23-40132,RV-1807D,RV-1807D,,,5-29-23 1:47 AM,2023-05-29T01:47:00.000Z,10-21-23 3:00 AM,2023-10-21T03:00:00.000Z,10-30-23 7:45 AM,2023-10-30T07:45:00.000Z,4,4,,PM,CLOSE,Y,N,NO,CHATHAM,4857,"DRYER D, CV-1812D DISCHARGE AIRLOCK",,No,DRYER D,,,,,,,,,,,65,2023-05-29T17:10:00.000Z,2023-05-29T18:00:00.000Z,22.666666666666668,0.9444444444444444,No,No,No,Yes,No,No,No,No,4,1
1454,DC-1201 INSPECT & TEST DUST COLLECTOR VALVES FE02,23-40137,DC-1201,DC-1201,,,5-29-23 1:47 AM,2023-05-29T01:47:00.000Z,10-23-23 1:00 AM,2023-10-23T01:00:00.000Z,10-30-23 7:45 AM,2023-10-30T07:45:00.000Z,4,4,,PM,CLOSE,Y,N,NO,CHATHAM,,,,,,,,,,,,,,,,65,2023-05-29T17:10:00.000Z,2023-05-29T18:00:00.000Z,22.666666666666668,0.9444444444444444,No,No,No,Yes,No,No,No,No,4,1
1112,P-6587A - OIL CHANGE/ PM SERVICE,23-40140,P-6587A,P-6587A,,,5-29-23 1:47 AM,2023-05-29T01:47:00.000Z,12-31-23 1:00 AM,2023-12-31T01:00:00.000Z,12-18-23 12:30 AM,2023-12-18T00:30:00.000Z,4,4,,PM,CLOSE,Y,N,NO,CHATHAM,,,,,,,,,,,,,,,,65,2023-05-29T17:10:00.000Z,2023-05-29T18:00:00.000Z,22.666666666666668,0.9444444444444444,No,No,No,Yes,No,No,No,No,4,1
,1840 Dryer D removal/re-install of cyclone probes DR02,23-40151,1840,1840,,,5-29-23 1:47 AM,2023-05-29T01:47:00.000Z,10-23-23 1:00 AM,2023-10-23T01:00:00.000Z,10-30-23 7:45 AM,2023-10-30T07:45:00.000Z,4,4,,PM,CLOSE,Y,N,NO,CHATHAM,,,,,,,,,,,,,,,,65,2023-05-29T17:10:00.000Z,2023-05-29T18:00:00.000Z,22.666666666666668,0.9444444444444444,No,No,No,Yes,No,No,No,No,4,1
1436,DRAG CONVEYOR  P.M.,23-40124,CV-2110,CV-2110,,,5-29-23 1:47 AM,2023-05-29T01:47:00.000Z,10-23-23 1:30 AM,2023-10-23T01:30:00.000Z,10-30-23 7:45 AM,2023-10-30T07:45:00.000Z,4,4,,SD,CLOSE,Y,,NO,CHATHAM,,,,,,,,,,,,,,,,65,2023-05-29T17:10:00.000Z,2023-05-29T18:00:00.000Z,22.666666666666668,0.9444444444444444,No,No,No,Yes,No,No,No,No,4,1
1432,CV-2106 & CV-2107A- MECHANICAL PM,23-40119,CV-2106,CV-2106,,,5-29-23 1:47 AM,2023-05-29T01:47:00.000Z,6-20-23 1:30 AM,2023-06-20T01:30:00.000Z,6-20-23 1:30 AM,2023-06-20T01:30:00.000Z,4,4,,PM,CLOSE,Y,N,NO,CHATHAM,,,,,,,,,,,,,,,,65,2023-05-29T17:10:00.000Z,2023-05-29T18:00:00.000Z,22.666666666666668,0.9444444444444444,No,No,No,Yes,No,No,No,No,4,1
1432,DRAG CONVEYOR  P.M.,23-40120,CV-2106,CV-2106,,,5-29-23 1:47 AM,2023-05-29T01:47:00.000Z,6-20-23 1:30 AM,2023-06-20T01:30:00.000Z,6-26-23 8:41 AM,2023-06-26T08:41:00.000Z,4,4,,PM,CLOSE,Y,,NO,CHATHAM,,,,,,,,,,,,,,,,65,2023-05-29T17:10:00.000Z,2023-05-29T18:00:00.000Z,22.666666666666668,0.9444444444444444,No,No,No,Yes,No,No,No,No,4,1
1435,CV-2108 - MECHANICAL PM,23-40121,CV-2108,CV-2108,,,5-29-23 1:47 AM,2023-05-29T01:47:00.000Z,10-23-23 1:30 AM,2023-10-23T01:30:00.000Z,10-30-23 7:45 AM,2023-10-30T07:45:00.000Z,4,4,,PM,CLOSE,Y,N,NO,CHATHAM,,,,,,,,,,,,,,,,65,2023-05-29T17:10:00.000Z,2023-05-29T18:00:00.000Z,22.666666666666668,0.9444444444444444,No,No,No,Yes,No,No,No,No,4,1
1435,DRAG CONVEYOR  P.M.,23-40122,CV-2108,CV-2108,,,5-29-23 1:47 AM,2023-05-29T01:47:00.000Z,10-23-23 1:30 AM,2023-10-23T01:30:00.000Z,10-30-23 7:45 AM,2023-10-30T07:45:00.000Z,4,4,,SD,CLOSE,Y,,NO,CHATHAM,,,,,,,,,,,,,,,,65,2023-05-29T17:10:00.000Z,2023-05-29T18:00:00.000Z,22.666666666666668,0.9444444444444444,No,No,No,Yes,No,No,No,No,4,1
4857,REPLACE AND ALIGN SPROCKETS. INSTALL NEW CHAIN,23-40135,RV-1807D,RV-1807D,,,5-29-23 1:47 AM,2023-05-29T01:47:00.000Z,10-21-23 1:00 AM,2023-10-21T01:00:00.000Z,10-30-23 7:45 AM,2023-10-30T07:45:00.000Z,4,4,,SD,CLOSE,Y,,NO,CHATHAM,4857,"DRYER D, CV-1812D DISCHARGE AIRLOCK",,No,DRYER D,,,,,,,,,,,65,2023-05-29T17:10:00.000Z,2023-05-29T18:00:00.000Z,22.666666666666668,0.9444444444444444,No,No,No,Yes,No,No,No,No,4,1
1454,INSPECT DUST COLLECTOR SOLENOID VALVES,23-40138,DC-1201,DC-1201,,,5-29-23 1:47 AM,2023-05-29T01:47:00.000Z,10-23-23 1:00 AM,2023-10-23T01:00:00.000Z,10-30-23 7:45 AM,2023-10-30T07:45:00.000Z,4,4,,SD,CLOSE,Y,,NO,CHATHAM,,,,,,,,,,,,,,,,65,2023-05-29T17:10:00.000Z,2023-05-29T18:00:00.000Z,22.666666666666668,0.9444444444444444,No,No,No,Yes,No,No,No,No,4,1
1454,"INSPECT SOLENOID CONNECTOR FLEX HOSE, CHANGE AS REQUIRED",23-40139,DC-1201,DC-1201,,,5-29-23 1:47 AM,2023-05-29T01:47:00.000Z,10-23-23 12:00 AM,2023-10-23T00:00:00.000Z,10-30-23 7:45 AM,2023-10-30T07:45:00.000Z,4,4,,SD,CLOSE,Y,,NO,CHATHAM,,,,,,,,,,,,,,,,65,2023-05-29T17:10:00.000Z,2023-05-29T18:00:00.000Z,22.666666666666668,0.9444444444444444,No,No,No,Yes,No,No,No,No,4,1
1111,P-6587B - OIL CHANGE/ PM SERVICE,23-40144,P-6587B,P-6587B,,,5-29-23 1:47 AM,2023-05-29T01:47:00.000Z,12-31-23 1:00 AM,2023-12-31T01:00:00.000Z,12-18-23 12:30 AM,2023-12-18T00:30:00.000Z,4,4,,PM,CLOSE,Y,N,NO,CHATHAM,,,,,,,,,,,,,,,,65,2023-05-29T17:10:00.000Z,2023-05-29T18:00:00.000Z,22.666666666666668,0.9444444444444444,No,No,No,Yes,No,No,No,No,4,1
1532,CLEAN (INSIDE) DDG COOLER DR0,23-40148,E-1824,E-1824,,,5-29-23 1:47 AM,2023-05-29T01:47:00.000Z,9-18-23 12:00 AM,2023-09-18T00:00:00.000Z,8-23-23 6:32 AM,2023-08-23T06:32:00.000Z,4,4,,PM,CLOSE,Y,N,NO,CHATHAM,1532,Geelen Counterflow Product Cooler,,No,DDG,,,,,,,,,,,65,2023-05-29T17:10:00.000Z,2023-05-29T18:00:00.000Z,22.666666666666668,0.9444444444444444,No,No,No,Yes,No,No,No,No,4,1
1532,CLEAN COOLER INTERNALS,23-40149,E-1824,E-1824,,,5-29-23 1:47 AM,2023-05-29T01:47:00.000Z,9-18-23 3:00 AM,2023-09-18T03:00:00.000Z,8-23-23 6:32 AM,2023-08-23T06:32:00.000Z,4,4,,SD,CLOSE,Y,,NO,CHATHAM,1532,Geelen Counterflow Product Cooler,,No,DDG,,,,,,,,,,,65,2023-05-29T17:10:00.000Z,2023-05-29T18:00:00.000Z,22.666666666666668,0.9444444444444444,No,No,No,Yes,No,No,No,No,4,1
4871,INSPECT AND CALIBRATE RAIL SCALE,23-40195,SC-2600,SC-2600,,,5-29-23 1:48 AM,2023-05-29T01:48:00.000Z,10-22-23 12:00 AM,2023-10-22T00:00:00.000Z,6-14-23 3:26 PM,2023-06-14T15:26:00.000Z,4,4,,PM,CLOSE,Y,,NO,CHATHAM,,,,,,,,,,,,,,,,65,2023-05-29T17:10:00.000Z,2023-05-29T18:00:00.000Z,22.666666666666668,0.9444444444444444,No,No,No,Yes,No,No,No,No,4,1
1281,REPAIR/REPLACE UHMW & METAL AS REQUIRED,23-40167,BE-2109,BE-2109,,,5-29-23 1:48 AM,2023-05-29T01:48:00.000Z,10-23-23 10:00 AM,2023-10-23T10:00:00.000Z,10-30-23 7:44 AM,2023-10-30T07:44:00.000Z,4,4,,SD,CLOSE,Y,,NO,CHATHAM,,,,,,,,,,,,,,,,65,2023-05-29T17:10:00.000Z,2023-05-29T18:00:00.000Z,22.666666666666668,0.9444444444444444,No,No,No,Yes,No,No,No,No,4,1
1494,Remove heads from exchanger,23-40169,E-1502A,E-1502A,,,5-29-23 1:48 AM,2023-05-29T01:48:00.000Z,10-23-23 4:00 AM,2023-10-23T04:00:00.000Z,7-7-23 9:39 AM,2023-07-07T09:39:00.000Z,4,4,,SD,CLOSE,Y,,NO,CHATHAM,,,,,,,,,,,,,,,,65,2023-05-29T17:10:00.000Z,2023-05-29T18:00:00.000Z,22.666666666666668,0.9444444444444444,No,No,No,Yes,No,No,No,No,4,1
1496,Re-fit heads to exchanger,23-40177,E-1502C,E-1502C,,,5-29-23 1:48 AM,2023-05-29T01:48:00.000Z,10-23-23 4:00 AM,2023-10-23T04:00:00.000Z,,,4,4,,SD,CAN,Y,,NO,CHATHAM,,,,,,,,,,,,,,,,65,2023-05-29T17:10:00.000Z,2023-05-29T18:00:00.000Z,22.666666666666668,0.9444444444444444,No,No,No,Yes,No,No,No,No,4,1
3563,MX-1302 - MECHANICAL PM,23-40184,MX-1302,MX-1302,,,5-29-23 1:48 AM,2023-05-29T01:48:00.000Z,10-23-23 2:00 AM,2023-10-23T02:00:00.000Z,,,4,4,,PM,CAN,Y,N,NO,CHATHAM,,,,,,,,,,,,,,,,65,2023-05-29T17:10:00.000Z,2023-05-29T18:00:00.000Z,22.666666666666668,0.9444444444444444,No,No,No,Yes,No,No,No,No,4,1
3563,INSPECT WRAP-FLEX COUPLINGS (2),23-40189,MX-1302,MX-1302,,,5-29-23 1:48 AM,2023-05-29T01:48:00.000Z,10-23-23 12:00 AM,2023-10-23T00:00:00.000Z,,,4,4,,SD,CAN,Y,,NO,CHATHAM,,,,,,,,,,,,,,,,65,2023-05-29T17:10:00.000Z,2023-05-29T18:00:00.000Z,22.666666666666668,0.9444444444444444,No,No,No,Yes,No,No,No,No,4,1
4870,TRUCK SCALE CALIBRATION PM,23-40196,SC-2001,SC-2001,,,5-29-23 1:48 AM,2023-05-29T01:48:00.000Z,7-22-23 12:00 AM,2023-07-22T00:00:00.000Z,5-30-23 6:53 AM,2023-05-30T06:53:00.000Z,4,4,,PM,CLOSE,Y,N,NO,CHATHAM,,,,,,,,,,,,,,,,65,2023-05-29T17:10:00.000Z,2023-05-29T18:00:00.000Z,22.666666666666668,0.9444444444444444,No,No,No,Yes,No,Yes,No,No,4,1
4870,INSPECT AND CALIBRATE,23-40197,SC-2001,SC-2001,,,5-29-23 1:48 AM,2023-05-29T01:48:00.000Z,7-22-23 12:00 AM,2023-07-22T00:00:00.000Z,5-30-23 6:53 AM,2023-05-30T06:53:00.000Z,4,4,,PM,CLOSE,Y,,NO,CHATHAM,,,,,,,,,,,,,,,,65,2023-05-29T17:10:00.000Z,2023-05-29T18:00:00.000Z,22.666666666666668,0.9444444444444444,No,No,No,Yes,No,Yes,No,No,4,1
1230,PH PROBE CLEANING AND CALIBRATION WEEKLY PM,23-40201,AT-14125,AT-14125,,,5-29-23 1:48 AM,2023-05-29T01:48:00.000Z,6-22-23 1:00 AM,2023-06-22T01:00:00.000Z,6-23-23 10:37 AM,2023-06-23T10:37:00.000Z,4,4,,PM,CLOSE,Y,,NO,CHATHAM,,,,,,,,,,,,,,,,65,2023-05-29T17:10:00.000Z,2023-05-29T18:00:00.000Z,22.666666666666668,0.9444444444444444,No,No,No,Yes,No,No,No,No,4,1
,Weekly Vibration check (GFE I/E),23-40208,MI-1201A,MI-1201A,,,5-29-23 1:48 AM,2023-05-29T01:48:00.000Z,6-22-23 12:00 AM,2023-06-22T00:00:00.000Z,6-26-23 10:55 AM,2023-06-26T10:55:00.000Z,4,4,,PM,CLOSE,Y,,NO,CHATHAM,,,,,,,,,,,,,,,,65,2023-05-29T17:10:00.000Z,2023-05-29T18:00:00.000Z,22.666666666666668,0.9444444444444444,No,No,No,Yes,No,No,No,No,4,1
1494,E-1502A HPW EXCHANGER  PM,23-40168,E-1502A,E-1502A,,,5-29-23 1:48 AM,2023-05-29T01:48:00.000Z,10-23-23 3:00 PM,2023-10-23T15:00:00.000Z,7-7-23 9:39 AM,2023-07-07T09:39:00.000Z,4,4,,SD,CLOSE,Y,N,NO,CHATHAM,,,,,,,,,,,,,,,,65,2023-05-29T17:10:00.000Z,2023-05-29T18:00:00.000Z,22.666666666666668,0.9444444444444444,No,No,No,Yes,No,No,No,No,4,1
1494,Clean exchanger (HPW),23-40170,E-1502A,E-1502A,,,5-29-23 1:48 AM,2023-05-29T01:48:00.000Z,10-23-23 6:00 AM,2023-10-23T06:00:00.000Z,7-7-23 9:39 AM,2023-07-07T09:39:00.000Z,4,4,,SD,CLOSE,Y,,NO,CHATHAM,,,,,,,,,,,,,,,,65,2023-05-29T17:10:00.000Z,2023-05-29T18:00:00.000Z,22.666666666666668,0.9444444444444444,No,No,No,Yes,No,No,No,No,4,1
1496,Remove heads from exchanger,23-40174,E-1502C,E-1502C,,,5-29-23 1:48 AM,2023-05-29T01:48:00.000Z,10-23-23 4:00 AM,2023-10-23T04:00:00.000Z,,,4,4,,SD,CAN,Y,,NO,CHATHAM,,,,,,,,,,,,,,,,65,2023-05-29T17:10:00.000Z,2023-05-29T18:00:00.000Z,22.666666666666668,0.9444444444444444,No,No,No,Yes,No,No,No,No,4,1
3563,INSPECT MIXER INTERNALS,23-40186,MX-1302,MX-1302,,,5-29-23 1:48 AM,2023-05-29T01:48:00.000Z,10-23-23 12:00 AM,2023-10-23T00:00:00.000Z,,,4,4,,SD,CAN,Y,,NO,CHATHAM,,,,,,,,,,,,,,,,65,2023-05-29T17:10:00.000Z,2023-05-29T18:00:00.000Z,22.666666666666668,0.9444444444444444,No,No,No,Yes,No,No,No,No,4,1
1280,BE-2107 INSPECT/REPAIR (UMHW),23-40165,BE-2107,BE-2107,,,5-29-23 1:48 AM,2023-05-29T01:48:00.000Z,10-23-23 12:00 AM,2023-10-23T00:00:00.000Z,10-30-23 7:44 AM,2023-10-30T07:44:00.000Z,4,4,,SD,CLOSE,Y,,NO,CHATHAM,,,,,,,,,,,,,,,,65,2023-05-29T17:10:00.000Z,2023-05-29T18:00:00.000Z,22.666666666666668,0.9444444444444444,No,No,No,Yes,No,No,No,No,4,1
1494,Inspect exchanger (GFE),23-40171,E-1502A,E-1502A,,,5-29-23 1:48 AM,2023-05-29T01:48:00.000Z,10-23-23 12:30 AM,2023-10-23T00:30:00.000Z,7-7-23 9:39 AM,2023-07-07T09:39:00.000Z,4,4,,SD,CLOSE,Y,,NO,CHATHAM,,,,,,,,,,,,,,,,65,2023-05-29T17:10:00.000Z,2023-05-29T18:00:00.000Z,22.666666666666668,0.9444444444444444,No,No,No,Yes,No,No,No,No,4,1
1496,Inspect exchanger (GFE),23-40176,E-1502C,E-1502C,,,5-29-23 1:48 AM,2023-05-29T01:48:00.000Z,10-23-23 12:30 AM,2023-10-23T00:30:00.000Z,,,4,4,,SD,CAN,Y,,NO,CHATHAM,,,,,,,,,,,,,,,,65,2023-05-29T17:10:00.000Z,2023-05-29T18:00:00.000Z,22.666666666666668,0.9444444444444444,No,No,No,Yes,No,No,No,No,4,1
3563,SAFETY,23-40185,MX-1302,MX-1302,,,5-29-23 1:48 AM,2023-05-29T01:48:00.000Z,10-23-23 12:00 AM,2023-10-23T00:00:00.000Z,,,4,4,,SD,CAN,Y,,NO,CHATHAM,,,,,,,,,,,,,,,,65,2023-05-29T17:10:00.000Z,2023-05-29T18:00:00.000Z,22.666666666666668,0.9444444444444444,No,No,No,Yes,No,No,No,No,4,1
,MI-1201B - WEEKLY PM & ROTATION CHANGE,23-40203,MI-1201B,MI-1201B,,,5-29-23 1:48 AM,2023-05-29T01:48:00.000Z,6-26-23 12:00 AM,2023-06-26T00:00:00.000Z,6-28-23 12:35 PM,2023-06-28T12:35:00.000Z,4,4,,PM,CLOSE,Y,,NO,CHATHAM,,,,,,,,,,,,,,,,65,2023-05-29T17:10:00.000Z,2023-05-29T18:00:00.000Z,22.666666666666668,0.9444444444444444,No,No,No,Yes,No,No,No,No,4,1
,Weekly Vibration check (GFE I/E),23-40205,MI-1201B,MI-1201B,,,5-29-23 1:48 AM,2023-05-29T01:48:00.000Z,6-26-23 12:00 AM,2023-06-26T00:00:00.000Z,6-28-23 12:35 PM,2023-06-28T12:35:00.000Z,4,4,,PM,CLOSE,Y,,NO,CHATHAM,,,,,,,,,,,,,,,,65,2023-05-29T17:10:00.000Z,2023-05-29T18:00:00.000Z,22.666666666666668,0.9444444444444444,No,No,No,Yes,No,No,No,No,4,1
1280,BE-2107 - INSPECTION AND REPAIR (RHINO HIDE),23-40164,BE-2107,BE-2107,,,5-29-23 1:48 AM,2023-05-29T01:48:00.000Z,10-23-23 12:00 AM,2023-10-23T00:00:00.000Z,10-30-23 7:44 AM,2023-10-30T07:44:00.000Z,4,4,,PM,CLOSE,Y,N,NO,CHATHAM,,,,,,,,,,,,,,,,65,2023-05-29T17:10:00.000Z,2023-05-29T18:00:00.000Z,22.666666666666668,0.9444444444444444,No,No,No,Yes,No,No,No,No,4,1
1496,E-1502C HPW EXCHANGER PM,23-40173,E-1502C,E-1502C,,,5-29-23 1:48 AM,2023-05-29T01:48:00.000Z,10-23-23 3:00 PM,2023-10-23T15:00:00.000Z,,,4,4,,PM,CAN,Y,N,NO,CHATHAM,,,,,,,,,,,,,,,,65,2023-05-29T17:10:00.000Z,2023-05-29T18:00:00.000Z,22.666666666666668,0.9444444444444444,No,No,No,Yes,No,No,No,No,4,1
1496,Clean exchanger (HPW),23-40175,E-1502C,E-1502C,,,5-29-23 1:48 AM,2023-05-29T01:48:00.000Z,10-23-23 6:00 AM,2023-10-23T06:00:00.000Z,,,4,4,,SD,CAN,Y,,NO,CHATHAM,,,,,,,,,,,,,,,,65,2023-05-29T17:10:00.000Z,2023-05-29T18:00:00.000Z,22.666666666666668,0.9444444444444444,No,No,No,Yes,No,No,No,No,4,1
3563,MOTOR,23-40192,MX-1302,MX-1302,,,5-29-23 1:48 AM,2023-05-29T01:48:00.000Z,10-23-23 12:00 AM,2023-10-23T00:00:00.000Z,,,4,4,,SD,CAN,Y,,NO,CHATHAM,,,,,,,,,,,,,,,,65,2023-05-29T17:10:00.000Z,2023-05-29T18:00:00.000Z,22.666666666666668,0.9444444444444444,No,No,No,Yes,No,No,No,No,4,1
,MI-1201B - MECHANICAL PM,23-40202,MI-1201B,MI-1201B,,,5-29-23 1:48 AM,2023-05-29T01:48:00.000Z,6-26-23 12:30 AM,2023-06-26T00:30:00.000Z,6-28-23 12:35 PM,2023-06-28T12:35:00.000Z,4,4,,PM,CLOSE,Y,N,NO,CHATHAM,,,,,,,,,,,,,,,,65,2023-05-29T17:10:00.000Z,2023-05-29T18:00:00.000Z,22.666666666666668,0.9444444444444444,No,No,No,Yes,No,No,No,No,4,1
,MI-1201B - VISUAL GREASE CHECK,23-40204,MI-1201B,MI-1201B,,,5-29-23 1:48 AM,2023-05-29T01:48:00.000Z,6-26-23 12:00 AM,2023-06-26T00:00:00.000Z,6-28-23 12:35 PM,2023-06-28T12:35:00.000Z,4,4,,PM,CLOSE,Y,,NO,CHATHAM,,,,,,,,,,,,,,,,65,2023-05-29T17:10:00.000Z,2023-05-29T18:00:00.000Z,22.666666666666668,0.9444444444444444,No,No,No,Yes,No,No,No,No,4,1
1281,BE-2109 - INSPECTION AND REPAIR (RHINO HIDE),23-40166,BE-2109,BE-2109,,,5-29-23 1:48 AM,2023-05-29T01:48:00.000Z,10-23-23 10:00 AM,2023-10-23T10:00:00.000Z,10-30-23 7:44 AM,2023-10-30T07:44:00.000Z,4,4,,PM,CLOSE,Y,N,NO,CHATHAM,,,,,,,,,,,,,,,,65,2023-05-29T17:10:00.000Z,2023-05-29T18:00:00.000Z,22.666666666666668,0.9444444444444444,No,No,No,Yes,No,No,No,No,4,1
1494,Re-fit heads to exchanger,23-40172,E-1502A,E-1502A,,,5-29-23 1:48 AM,2023-05-29T01:48:00.000Z,10-23-23 4:00 AM,2023-10-23T04:00:00.000Z,7-7-23 9:39 AM,2023-07-07T09:39:00.000Z,4,4,,SD,CLOSE,Y,,NO,CHATHAM,,,,,,,,,,,,,,,,65,2023-05-29T17:10:00.000Z,2023-05-29T18:00:00.000Z,22.666666666666668,0.9444444444444444,No,No,No,Yes,No,No,No,No,4,1
3563,INSPECT DRIVE BELTS ON SEW DRIVE,23-40187,MX-1302,MX-1302,,,5-29-23 1:48 AM,2023-05-29T01:48:00.000Z,10-23-23 12:00 AM,2023-10-23T00:00:00.000Z,,,4,4,,SD,CAN,Y,,NO,CHATHAM,,,,,,,,,,,,,,,,65,2023-05-29T17:10:00.000Z,2023-05-29T18:00:00.000Z,22.666666666666668,0.9444444444444444,No,No,No,Yes,No,No,No,No,4,1
3563,CHECK MIXER SHAFT PACKING GLANDS,23-40188,MX-1302,MX-1302,,,5-29-23 1:48 AM,2023-05-29T01:48:00.000Z,10-23-23 12:00 AM,2023-10-23T00:00:00.000Z,,,4,4,,SD,CAN,Y,,NO,CHATHAM,,,,,,,,,,,,,,,,65,2023-05-29T17:10:00.000Z,2023-05-29T18:00:00.000Z,22.666666666666668,0.9444444444444444,No,No,No,Yes,No,No,No,No,4,1
3563,CHECK OIL LEVEL IN SEW DRIVE GEARBOX,23-40190,MX-1302,MX-1302,,,5-29-23 1:48 AM,2023-05-29T01:48:00.000Z,10-23-23 12:00 AM,2023-10-23T00:00:00.000Z,,,4,4,,SD,CAN,Y,,NO,CHATHAM,,,,,,,,,,,,,,,,65,2023-05-29T17:10:00.000Z,2023-05-29T18:00:00.000Z,22.666666666666668,0.9444444444444444,No,No,No,Yes,No,No,No,No,4,1
3563,CHECK AD6 INPUT SHAFT FOR OIL LEAKAGE,23-40191,MX-1302,MX-1302,,,5-29-23 1:48 AM,2023-05-29T01:48:00.000Z,10-23-23 12:00 AM,2023-10-23T00:00:00.000Z,,,4,4,,SD,CAN,Y,,NO,CHATHAM,,,,,,,,,,,,,,,,65,2023-05-29T17:10:00.000Z,2023-05-29T18:00:00.000Z,22.666666666666668,0.9444444444444444,No,No,No,Yes,No,No,No,No,4,1
3563,BASE BOLTS,23-40193,MX-1302,MX-1302,,,5-29-23 1:48 AM,2023-05-29T01:48:00.000Z,10-23-23 12:00 AM,2023-10-23T00:00:00.000Z,,,4,4,,SD,CAN,Y,,NO,CHATHAM,,,,,,,,,,,,,,,,65,2023-05-29T17:10:00.000Z,2023-05-29T18:00:00.000Z,22.666666666666668,0.9444444444444444,No,No,No,Yes,No,No,No,No,4,1
4871,RAIL SCALE CALIBRATION  PM,23-40194,SC-2600,SC-2600,,,5-29-23 1:48 AM,2023-05-29T01:48:00.000Z,10-22-23 12:00 AM,2023-10-22T00:00:00.000Z,6-14-23 3:26 PM,2023-06-14T15:26:00.000Z,4,4,,PM,CLOSE,Y,N,NO,CHATHAM,,,,,,,,,,,,,,,,65,2023-05-29T17:10:00.000Z,2023-05-29T18:00:00.000Z,22.666666666666668,0.9444444444444444,No,No,No,Yes,No,No,No,No,4,1
,HAMMERMILL WEEKLY PM & ROTATION CHANGE,23-40207,MI-1201A,MI-1201A,,,5-29-23 1:48 AM,2023-05-29T01:48:00.000Z,6-22-23 12:00 AM,2023-06-22T00:00:00.000Z,6-26-23 10:55 AM,2023-06-26T10:55:00.000Z,4,4,,PM,CLOSE,Y,,NO,CHATHAM,,,,,,,,,,,,,,,,65,2023-05-29T17:10:00.000Z,2023-05-29T18:00:00.000Z,22.666666666666668,0.9444444444444444,No,No,No,Yes,No,No,No,No,4,1
,"Area Asset Checks-2200, 2300, 3200, 3600, 4100",23-40256,2200,2200,,,5-29-23 1:49 AM,2023-05-29T01:49:00.000Z,6-26-23 12:00 AM,2023-06-26T00:00:00.000Z,6-26-23 12:30 AM,2023-06-26T00:30:00.000Z,4,4,,PM,CLOSE,Y,N,NO,CHATHAM,,,,,,,,,,,,,,,,65,2023-05-29T17:10:00.000Z,2023-05-29T18:00:00.000Z,22.666666666666668,0.9444444444444444,No,No,No,Yes,No,No,No,No,4,1
,"Area Asset Checks-1600, 1660, 1700",23-40254,1600,1600,,,5-29-23 1:49 AM,2023-05-29T01:49:00.000Z,6-26-23 12:00 AM,2023-06-26T00:00:00.000Z,6-26-23 12:30 AM,2023-06-26T00:30:00.000Z,4,4,,PM,CLOSE,Y,N,NO,CHATHAM,,,,,,,,,,,,,,,,65,2023-05-29T17:10:00.000Z,2023-05-29T18:00:00.000Z,22.666666666666668,0.9444444444444444,No,No,No,Yes,No,No,No,No,4,1
,"Area Asset Checks-1830, 1840, DDG Cooler",23-40259,1800,1800,,,5-29-23 1:49 AM,2023-05-29T01:49:00.000Z,6-26-23 12:00 AM,2023-06-26T00:00:00.000Z,6-26-23 1:59 PM,2023-06-26T13:59:00.000Z,4,4,,PM,CLOSE,Y,,NO,CHATHAM,,,,,,,,,,,,,,,,65,2023-05-29T17:10:00.000Z,2023-05-29T18:00:00.000Z,22.666666666666668,0.9444444444444444,No,No,No,Yes,No,No,No,No,4,1
5531,REPLACE MANWAY GASKET,23-40215,TK-6610,TK-6610,,,5-29-23 1:49 AM,2023-05-29T01:49:00.000Z,10-23-23 12:00 AM,2023-10-23T00:00:00.000Z,11-26-24 10:52 AM,2024-11-26T10:52:00.000Z,4,4,,SD,CLOSE,Y,,NO,CHATHAM,,,,,,,,,,,,,,,,65,2023-05-29T17:10:00.000Z,2023-05-29T18:00:00.000Z,22.666666666666668,0.9444444444444444,No,No,No,Yes,No,No,No,No,4,1
5532,OPEN MANWAY,23-40219,TK-6611,TK-6611,,,5-29-23 1:49 AM,2023-05-29T01:49:00.000Z,10-23-23 12:00 AM,2023-10-23T00:00:00.000Z,9-12-24 6:37 AM,2024-09-12T06:37:00.000Z,4,4,,SD,CLOSE,Y,,NO,CHATHAM,,,,,,,,,,,,,,,,65,2023-05-29T17:10:00.000Z,2023-05-29T18:00:00.000Z,22.666666666666668,0.9444444444444444,No,No,No,Yes,No,No,No,No,4,1
,"Area Asset Checks-1500, 6500 (Distillation)",23-40243,1500,1500,,,5-29-23 1:49 AM,2023-05-29T01:49:00.000Z,6-26-23 12:00 AM,2023-06-26T00:00:00.000Z,6-26-23 1:31 PM,2023-06-26T13:31:00.000Z,4,4,,PM,CLOSE,Y,,NO,CHATHAM,,,,,,,,,,,,,,,,65,2023-05-29T17:10:00.000Z,2023-05-29T18:00:00.000Z,22.666666666666668,0.9444444444444444,No,No,No,Yes,No,No,No,No,4,1
