Work_Order,Description,Location,Location_Normalized,Asset,Notes,Lead,Reported_Date,Reported_Timestamp,Target_Finish,Target_Finish_Timestamp,Actual_Finish,Actual_Finish_Timestamp,Priority,Priority_Int,Priority_InvalidValue,Work_Type,Status,History,Is_dynamic,Dynamic_Job_Plan_applied,Site
23-54129,INSTALL TRANSMITTER INTO DUCTWORK,,,,,,1-1-24 1:53 AM,2024-01-01T01:53:00.000Z,2-12-24 9:45 AM,2024-02-12T09:45:00.000Z,6-20-24 2:48 PM,2024-06-20T14:48:00.000Z,4,4,,PM,CLOSE,Y,,NO,CHATHAM
23-54128,CLEAN SENSOR,,,,,,1-1-24 1:53 AM,2024-01-01T01:53:00.000Z,2-12-24 10:00 AM,2024-02-12T10:00:00.000Z,6-20-24 2:48 PM,2024-06-20T14:48:00.000Z,4,4,,PM,CLOSE,Y,,NO,CHATHAM
23-54127,PULL TRANSMITTER OUT OF DUCTWORK,,,,,,1-1-24 1:53 AM,2024-01-01T01:53:00.000Z,2-12-24 9:45 AM,2024-02-12T09:45:00.000Z,6-20-24 2:48 PM,2024-06-20T14:48:00.000Z,4,4,,PM,CLOSE,Y,,NO,CHATHAM
23-54126,INSPECT AND CLEAN FLOW/TEMPERATURE SENSOR FOR DRYER A COMBUSTION AIR,,,,,,1-1-24 1:53 AM,2024-01-01T01:53:00.000Z,2-12-24 10:30 AM,2024-02-12T10:30:00.000Z,6-20-24 2:48 PM,2024-06-20T14:48:00.000Z,4,4,,PM,CLOSE,Y,N,NO,CHATHAM
23-54125,PH PROBE CLEANING AND CALIBRATION WEEKLY PM,AT-84505,AT-84505,6885,,,1-1-24 1:52 AM,2024-01-01T01:52:00.000Z,1-25-24 1:00 AM,2024-01-25T01:00:00.000Z,1-25-24 3:03 PM,2024-01-25T15:03:00.000Z,4,4,,PM,CLOSE,Y,,NO,CHATHAM
23-54124,C-1803D pH Meter-Weekly PM,AT-84505,AT-84505,6885,,,1-1-24 1:52 AM,2024-01-01T01:52:00.000Z,1-25-24 12:00 AM,2024-01-25T00:00:00.000Z,1-25-24 12:12 AM,2024-01-25T00:12:00.000Z,4,4,,PM,CLOSE,Y,N,NO,CHATHAM
23-54123,"Area Asset Checks-1830, 1840, DDG Cooler",1800,1800,,,,1-1-24 1:52 AM,2024-01-01T01:52:00.000Z,1-29-24 12:00 AM,2024-01-29T00:00:00.000Z,1-30-24 6:52 AM,2024-01-30T06:52:00.000Z,4,4,,PM,CLOSE,Y,,NO,CHATHAM
23-54122,"Area Asset Checks-1830, 1840, DDG Cooler",1800,1800,,,,1-1-24 1:52 AM,2024-01-01T01:52:00.000Z,1-29-24 12:00 AM,2024-01-29T00:00:00.000Z,1-29-24 1:00 AM,2024-01-29T01:00:00.000Z,4,4,,PM,CLOSE,Y,N,NO,CHATHAM
23-54121,"Area Asset Checks-2200, 2300, 3200, 3600, 4100",2200,2200,,,,1-1-24 1:52 AM,2024-01-01T01:52:00.000Z,1-29-24 12:00 AM,2024-01-29T00:00:00.000Z,1-30-24 7:59 AM,2024-01-30T07:59:00.000Z,4,4,,PM,CLOSE,Y,,NO,CHATHAM
23-54120,"Area Asset Checks-2200, 2300, 3200, 3600, 4100",2200,2200,,,,1-1-24 1:52 AM,2024-01-01T01:52:00.000Z,1-29-24 12:00 AM,2024-01-29T00:00:00.000Z,1-29-24 1:00 AM,2024-01-29T01:00:00.000Z,4,4,,PM,CLOSE,Y,N,NO,CHATHAM
23-54119,"Area Asset Checks-1600, 1660, 1700 (Evaps, Corn oil, Decanyers)",1600,1600,,,,1-1-24 1:52 AM,2024-01-01T01:52:00.000Z,1-29-24 12:00 AM,2024-01-29T00:00:00.000Z,1-30-24 7:23 AM,2024-01-30T07:23:00.000Z,4,4,,PM,CLOSE,Y,,NO,CHATHAM
23-54118,"Area Asset Checks-1600, 1660, 1700",1600,1600,,,,1-1-24 1:52 AM,2024-01-01T01:52:00.000Z,1-29-24 12:00 AM,2024-01-29T00:00:00.000Z,1-29-24 2:00 AM,2024-01-29T02:00:00.000Z,4,4,,PM,CLOSE,Y,N,NO,CHATHAM
23-54117,"Area Asset Checks-1500, 6500 (Distillation)",1500,1500,,,,1-1-24 1:52 AM,2024-01-01T01:52:00.000Z,1-29-24 12:00 AM,2024-01-29T00:00:00.000Z,1-29-24 1:58 PM,2024-01-29T13:58:00.000Z,4,4,,PM,CLOSE,Y,,NO,CHATHAM
23-54116,"Area Asset Checks-1500, 6500",1500,1500,,,,1-1-24 1:52 AM,2024-01-01T01:52:00.000Z,1-29-24 12:00 AM,2024-01-29T00:00:00.000Z,1-29-24 1:00 AM,2024-01-29T01:00:00.000Z,4,4,,PM,CLOSE,Y,N,NO,CHATHAM
23-54115,"Area Asset Checks-2100, 1200, 1300, 1400 (Corn, Mill, Mash, Fermentation)",2100,2100,,,,1-1-24 1:52 AM,2024-01-01T01:52:00.000Z,1-29-24 2:30 AM,2024-01-29T02:30:00.000Z,1-30-24 7:59 AM,2024-01-30T07:59:00.000Z,4,4,,PM,CLOSE,Y,,NO,CHATHAM
23-54114,"Area Asset Checks-2100, 1200, 1300, 1400 (Corn, Mill, Mash, Fermentation)",2100,2100,,,,1-1-24 1:52 AM,2024-01-01T01:52:00.000Z,1-29-24 12:00 AM,2024-01-29T00:00:00.000Z,1-29-24 1:00 AM,2024-01-29T01:00:00.000Z,4,4,,PM,CLOSE,Y,N,NO,CHATHAM
23-54113,"Area Asset Checks-1830, 1840, DDG Cooler",1800,1800,,,,1-1-24 1:52 AM,2024-01-01T01:52:00.000Z,1-29-24 12:00 AM,2024-01-29T00:00:00.000Z,2-5-24 8:52 AM,2024-02-05T08:52:00.000Z,4,4,,PM,CLOSE,Y,,NO,CHATHAM
23-54112,"Area Asset Checks-1830, 1840, DDG Cooler",1800,1800,,,,1-1-24 1:52 AM,2024-01-01T01:52:00.000Z,1-29-24 12:00 AM,2024-01-29T00:00:00.000Z,2-5-24 8:52 AM,2024-02-05T08:52:00.000Z,4,4,,PM,CLOSE,Y,N,NO,CHATHAM
23-54111,"Area Asset Checks-2200, 2300, 3200, 3600, 4100",2200,2200,,,,1-1-24 1:52 AM,2024-01-01T01:52:00.000Z,1-29-24 12:00 AM,2024-01-29T00:00:00.000Z,1-30-24 7:38 AM,2024-01-30T07:38:00.000Z,4,4,,PM,CLOSE,Y,,NO,CHATHAM
23-54110,"Area Asset Checks-2200, 2300, 3200, 3600, 4100",2200,2200,,,,1-1-24 1:52 AM,2024-01-01T01:52:00.000Z,1-29-24 12:00 AM,2024-01-29T00:00:00.000Z,1-29-24 2:30 AM,2024-01-29T02:30:00.000Z,4,4,,PM,CLOSE,Y,N,NO,CHATHAM
23-54109,"Area Asset Checks-1600, 1660, 1700 (Evaps, Corn oil, Decanyers)",1600,1600,,,,1-1-24 1:52 AM,2024-01-01T01:52:00.000Z,1-29-24 12:00 AM,2024-01-29T00:00:00.000Z,1-29-24 10:04 AM,2024-01-29T10:04:00.000Z,4,4,,PM,CLOSE,Y,,NO,CHATHAM
23-54108,"Area Asset Checks-1600, 1660, 1700",1600,1600,,,,1-1-24 1:52 AM,2024-01-01T01:52:00.000Z,1-29-24 12:00 AM,2024-01-29T00:00:00.000Z,1-29-24 1:00 AM,2024-01-29T01:00:00.000Z,4,4,,PM,CLOSE,Y,N,NO,CHATHAM
23-54107,"Area Asset Checks-1500, 6500 (Distillation)",1500,1500,,,,1-1-24 1:52 AM,2024-01-01T01:52:00.000Z,1-29-24 12:00 AM,2024-01-29T00:00:00.000Z,1-29-24 1:42 PM,2024-01-29T13:42:00.000Z,4,4,,PM,CLOSE,Y,,NO,CHATHAM
23-54106,"Area Asset Checks-1500, 6500",1500,1500,,,,1-1-24 1:52 AM,2024-01-01T01:52:00.000Z,1-29-24 12:00 AM,2024-01-29T00:00:00.000Z,1-29-24 3:00 AM,2024-01-29T03:00:00.000Z,4,4,,PM,CLOSE,Y,N,NO,CHATHAM
23-54105,"Area Asset Checks-2100, 1200, 1300, 1400 (Corn, Mill, Mash, Fermentation)",2100,2100,,,,1-1-24 1:52 AM,2024-01-01T01:52:00.000Z,1-29-24 5:00 AM,2024-01-29T05:00:00.000Z,2-2-24 7:53 AM,2024-02-02T07:53:00.000Z,4,4,,PM,CLOSE,Y,,NO,CHATHAM
23-54104,"Area Asset Checks-2100, 1200, 1300, 1400 (Corn, Mill, Mash, Fermentation)",2100,2100,,,,1-1-24 1:52 AM,2024-01-01T01:52:00.000Z,1-29-24 12:00 AM,2024-01-29T00:00:00.000Z,2-1-24 2:30 AM,2024-02-01T02:30:00.000Z,4,4,,PM,CLOSE,Y,N,NO,CHATHAM
23-54103,BL-1804D WEEKLY GREASING,BL-1804D,BL-1804D,,,,1-1-24 1:52 AM,2024-01-01T01:52:00.000Z,1-29-24 12:00 AM,2024-01-29T00:00:00.000Z,2-1-24 6:36 AM,2024-02-01T06:36:00.000Z,4,4,,PM,CLOSE,Y,,NO,CHATHAM
23-54102,BL-1804D - WEEKLY BEARING GREASING,BL-1804D,BL-1804D,,,,1-1-24 1:52 AM,2024-01-01T01:52:00.000Z,1-29-24 12:00 AM,2024-01-29T00:00:00.000Z,1-29-24 1:00 AM,2024-01-29T01:00:00.000Z,4,4,,PM,CLOSE,Y,N,NO,CHATHAM
23-54101,5S AND STOCKROOM AUDIT-WEEKLY PM,MAINTENANCE,MAINTENANCE,,,,1-1-24 1:52 AM,2024-01-01T01:52:00.000Z,1-29-24 12:00 AM,2024-01-29T00:00:00.000Z,2-5-24 8:27 AM,2024-02-05T08:27:00.000Z,4,4,,PM,CLOSE,Y,N,NO,CHATHAM
23-54100,TOTE#5 (4) 100' EXPLOSION PROOF EXTENSION CORDS,CHATHAM,CHATHAM,,,,1-1-24 1:51 AM,2024-01-01T01:51:00.000Z,1-26-24 12:00 AM,2024-01-26T00:00:00.000Z,6-20-24 2:12 PM,2024-06-20T14:12:00.000Z,4,4,,PM,CLOSE,Y,,NO,CHATHAM
23-54099,"TOTE #4 (4) COATS, (4) BIBS, (10) GLOVES, HARD HAT LINERS, NECK WARMERS, (20) INFERNO PACKS",CHATHAM,CHATHAM,,,,1-1-24 1:51 AM,2024-01-01T01:51:00.000Z,1-26-24 12:00 AM,2024-01-26T00:00:00.000Z,6-20-24 2:12 PM,2024-06-20T14:12:00.000Z,4,4,,PM,CLOSE,Y,,NO,CHATHAM
23-54098,TOTE #3 (2) SNAKE INSULATION BLANKETS,CHATHAM,CHATHAM,,,,1-1-24 1:51 AM,2024-01-01T01:51:00.000Z,1-26-24 12:00 AM,2024-01-26T00:00:00.000Z,6-20-24 2:12 PM,2024-06-20T14:12:00.000Z,4,4,,PM,CLOSE,Y,,NO,CHATHAM
23-54097,TOTE #2 (2) SNAKE INSULATION BLANKETS,CHATHAM,CHATHAM,,,,1-1-24 1:51 AM,2024-01-01T01:51:00.000Z,1-26-24 12:00 AM,2024-01-26T00:00:00.000Z,6-20-24 2:12 PM,2024-06-20T14:12:00.000Z,4,4,,PM,CLOSE,Y,,NO,CHATHAM
23-54096,TOTE #1 250' PORTABLE HEAT TRACING,CHATHAM,CHATHAM,,,,1-1-24 1:51 AM,2024-01-01T01:51:00.000Z,1-26-24 12:00 AM,2024-01-26T00:00:00.000Z,6-20-24 2:12 PM,2024-06-20T14:12:00.000Z,4,4,,PM,CLOSE,Y,,NO,CHATHAM
23-54095,COLD WEATHER PLAN (TOTE INSPECTION/AUDIT),CHATHAM,CHATHAM,,,,1-1-24 1:51 AM,2024-01-01T01:51:00.000Z,1-26-24 1:00 AM,2024-01-26T01:00:00.000Z,6-20-24 2:12 PM,2024-06-20T14:12:00.000Z,4,4,,PM,CLOSE,Y,N,NO,CHATHAM
23-54094,Weekly Vibration check (GFE I/E),MI-1201A,MI-1201A,,,,1-1-24 1:51 AM,2024-01-01T01:51:00.000Z,1-25-24 12:00 AM,2024-01-25T00:00:00.000Z,1-29-24 12:17 PM,2024-01-29T12:17:00.000Z,4,4,,PM,CLOSE,Y,,NO,CHATHAM
23-54093,HAMMERMILL WEEKLY PM & ROTATION CHANGE,MI-1201A,MI-1201A,,,,1-1-24 1:51 AM,2024-01-01T01:51:00.000Z,1-25-24 12:00 AM,2024-01-25T00:00:00.000Z,1-29-24 12:17 PM,2024-01-29T12:17:00.000Z,4,4,,PM,CLOSE,Y,,NO,CHATHAM
23-54092,MI-1201A - MECHANICAL PM,MI-1201A,MI-1201A,,,,1-1-24 1:51 AM,2024-01-01T01:51:00.000Z,1-25-24 12:30 AM,2024-01-25T00:30:00.000Z,1-25-24 1:00 AM,2024-01-25T01:00:00.000Z,4,4,,PM,CLOSE,Y,N,NO,CHATHAM
23-54091,Weekly Vibration check (GFE I/E),MI-1201B,MI-1201B,,,,1-1-24 1:51 AM,2024-01-01T01:51:00.000Z,1-29-24 12:00 AM,2024-01-29T00:00:00.000Z,2-5-24 8:19 AM,2024-02-05T08:19:00.000Z,4,4,,PM,CLOSE,Y,,NO,CHATHAM
23-54090,C-MI-1201B - MECHANICAL PM,MI-1201B,MI-1201B,,,,1-1-24 1:51 AM,2024-01-01T01:51:00.000Z,1-29-24 12:00 AM,2024-01-29T00:00:00.000Z,2-5-24 8:19 AM,2024-02-05T08:19:00.000Z,4,4,,PM,CLOSE,Y,,NO,CHATHAM
23-54089,MI-1201B - MECHANICAL PM,MI-1201B,MI-1201B,,,,1-1-24 1:51 AM,2024-01-01T01:51:00.000Z,1-29-24 12:30 AM,2024-01-29T00:30:00.000Z,2-1-24 1:00 AM,2024-02-01T01:00:00.000Z,4,4,,PM,CLOSE,Y,N,NO,CHATHAM
23-54088,PH PROBE CLEANING AND CALIBRATION WEEKLY PM,AT-14125,AT-14125,1230,,,1-1-24 1:51 AM,2024-01-01T01:51:00.000Z,1-25-24 1:00 AM,2024-01-25T01:00:00.000Z,1-25-24 1:57 PM,2024-01-25T13:57:00.000Z,4,4,,PM,CLOSE,Y,,NO,CHATHAM
23-54087,PH PROBE CLEANING AND CALIBRATION PM,AT-14125,AT-14125,1230,,,1-1-24 1:51 AM,2024-01-01T01:51:00.000Z,1-25-24 12:00 AM,2024-01-25T00:00:00.000Z,1-25-24 12:30 AM,2024-01-25T00:30:00.000Z,4,4,,PM,CLOSE,Y,N,NO,CHATHAM
23-54086,PH PROBE CLEANING AND CALIBRATION WEEKLY PM,AT-13519,AT-13519,1227,,,1-1-24 1:51 AM,2024-01-01T01:51:00.000Z,1-25-24 1:00 AM,2024-01-25T01:00:00.000Z,1-25-24 3:03 PM,2024-01-25T15:03:00.000Z,4,4,,PM,CLOSE,Y,,NO,CHATHAM
23-54085,PH PROBE CLEANING AND CALIBRATION PM,AT-13519,AT-13519,1227,,,1-1-24 1:51 AM,2024-01-01T01:51:00.000Z,1-25-24 12:00 AM,2024-01-25T00:00:00.000Z,1-25-24 12:45 AM,2024-01-25T00:45:00.000Z,4,4,,PM,CLOSE,Y,N,NO,CHATHAM
23-54084,HACH SP150 HARDNESS MONITOR 2 MONTH PM,XA-35102,XA-35102,6407,,,1-1-24 1:51 AM,2024-01-01T01:51:00.000Z,1-25-24 12:00 AM,2024-01-25T00:00:00.000Z,6-20-24 2:46 PM,2024-06-20T14:46:00.000Z,4,4,,PM,CLOSE,Y,,NO,CHATHAM
23-54083,HACH SP150 HARDNESS MONITOR,XA-35102,XA-35102,6407,,,1-1-24 1:51 AM,2024-01-01T01:51:00.000Z,1-25-24 12:00 AM,2024-01-25T00:00:00.000Z,6-20-24 2:46 PM,2024-06-20T14:46:00.000Z,4,4,,PM,CLOSE,Y,N,NO,CHATHAM
23-54082,Agitate the Sludge Bed in the Biothane and preform and record the  Sludge Analysis for the Biothane,T-4126,T-4126,5003,,,1-1-24 1:51 AM,2024-01-01T01:51:00.000Z,1-29-24 12:00 AM,2024-01-29T00:00:00.000Z,6-24-24 8:59 AM,2024-06-24T08:59:00.000Z,4,4,,PM,CLOSE,Y,,NO,CHATHAM
23-54081,SLUDGE ANALYSIS FOR BIOTHANE DIGESTER,T-4126,T-4126,5003,,,1-1-24 1:51 AM,2024-01-01T01:51:00.000Z,1-29-24 12:00 AM,2024-01-29T00:00:00.000Z,6-24-24 8:59 AM,2024-06-24T08:59:00.000Z,4,4,,PM,CLOSE,Y,N,NO,CHATHAM
23-54080,Monitor & fill salt boxes,CHATHAM,CHATHAM,,,,1-1-24 1:50 AM,2024-01-01T01:50:00.000Z,1-25-24 1:00 AM,2024-01-25T01:00:00.000Z,1-26-24 11:29 AM,2024-01-26T11:29:00.000Z,4,4,,PM,CLOSE,Y,,NO,CHATHAM
23-54079,Thursday route - Fill plant salt boxes,CHATHAM,CHATHAM,,,,1-1-24 1:50 AM,2024-01-01T01:50:00.000Z,1-25-24 12:00 AM,2024-01-25T00:00:00.000Z,1-25-24 2:00 AM,2024-01-25T02:00:00.000Z,4,4,,PM,CLOSE,Y,N,NO,CHATHAM
23-54078,Monitor & fill salt boxes,CHATHAM,CHATHAM,,,,1-1-24 1:50 AM,2024-01-01T01:50:00.000Z,1-29-24 1:00 AM,2024-01-29T01:00:00.000Z,1-29-24 3:40 PM,2024-01-29T15:40:00.000Z,4,4,,PM,CLOSE,Y,,NO,CHATHAM
23-54077,Monday route - Fill plant salt boxes,CHATHAM,CHATHAM,,,,1-1-24 1:50 AM,2024-01-01T01:50:00.000Z,1-29-24 12:00 AM,2024-01-29T00:00:00.000Z,1-29-24 1:00 AM,2024-01-29T01:00:00.000Z,4,4,,PM,CLOSE,Y,N,NO,CHATHAM
23-54076,SCREW CONVEYOR PM,CV-2111,CV-2111,1437,,,1-1-24 1:50 AM,2024-01-01T01:50:00.000Z,4-23-24 12:00 AM,2024-04-23T00:00:00.000Z,5-16-24 10:01 AM,2024-05-16T10:01:00.000Z,4,4,,SD,CLOSE,Y,,NO,CHATHAM
23-54075,CV-2111 MECHANICAL PM,CV-2111,CV-2111,1437,,,1-1-24 1:50 AM,2024-01-01T01:50:00.000Z,4-23-24 2:00 AM,2024-04-23T02:00:00.000Z,5-16-24 10:01 AM,2024-05-16T10:01:00.000Z,4,4,,SD,CLOSE,Y,N,NO,CHATHAM
23-54074,REMOVE TUNNEL THERMOWELLS ON BOTH DRYERS,DR-1801D,DR-1801D,,,,1-1-24 1:50 AM,2024-01-01T01:50:00.000Z,4-23-24 1:00 AM,2024-04-23T01:00:00.000Z,6-21-24 8:45 AM,2024-06-21T08:45:00.000Z,4,4,,SD,CLOSE,Y,,NO,CHATHAM
23-54073,RE-INSTALL TUNNEL THERMOCOUPLE  - DR02,DR-1801D,DR-1801D,,,,1-1-24 1:50 AM,2024-01-01T01:50:00.000Z,4-23-24 1:00 AM,2024-04-23T01:00:00.000Z,6-21-24 8:45 AM,2024-06-21T08:45:00.000Z,4,4,,SD,CLOSE,Y,N,NO,CHATHAM
23-54072,CONDUCTIVITY METER /PH PROBE CLEAN & CALIBRATE PM,AE-84404,AE-84404,7174,,,1-1-24 1:50 AM,2024-01-01T01:50:00.000Z,1-25-24 2:00 AM,2024-01-25T02:00:00.000Z,1-25-24 3:03 PM,2024-01-25T15:03:00.000Z,4,4,,PM,CLOSE,Y,,NO,CHATHAM
23-54071,DRYER SCRUBBER PH PROBE PM,AE-84404,AE-84404,7174,,,1-1-24 1:50 AM,2024-01-01T01:50:00.000Z,1-25-24 1:00 AM,2024-01-25T01:00:00.000Z,1-25-24 12:45 AM,2024-01-25T00:45:00.000Z,4,4,,PM,CLOSE,Y,N,NO,CHATHAM
23-54070,REMOVE SIDE COVER & CHECK VANE CONDITION,RV-1823,RV-1823,4862,,,1-1-24 1:50 AM,2024-01-01T01:50:00.000Z,4-23-24 12:00 AM,2024-04-23T00:00:00.000Z,6-21-24 11:10 AM,2024-06-21T11:10:00.000Z,4,4,,SD,CLOSE,Y,,NO,CHATHAM
23-54069,CHECK CHAIN & SPROCKETS FOR WEAR,RV-1823,RV-1823,4862,,,1-1-24 1:50 AM,2024-01-01T01:50:00.000Z,4-23-24 12:00 AM,2024-04-23T00:00:00.000Z,6-21-24 11:10 AM,2024-06-21T11:10:00.000Z,4,4,,SD,CLOSE,Y,,NO,CHATHAM
23-54068,CHECK GEARBOX OIL LEVEL,RV-1823,RV-1823,4862,,,1-1-24 1:50 AM,2024-01-01T01:50:00.000Z,4-23-24 12:00 AM,2024-04-23T00:00:00.000Z,6-21-24 11:10 AM,2024-06-21T11:10:00.000Z,4,4,,SD,CLOSE,Y,,NO,CHATHAM
23-54067,RV-1823 - MECHANICAL PM,RV-1823,RV-1823,4862,,,1-1-24 1:50 AM,2024-01-01T01:50:00.000Z,4-23-24 2:00 AM,2024-04-23T02:00:00.000Z,6-21-24 11:10 AM,2024-06-21T11:10:00.000Z,4,4,,SD,CLOSE,Y,N,NO,CHATHAM
23-54066,Inspect bottom seal - replace as required,DR-1801D,DR-1801D,,,,1-1-24 1:50 AM,2024-01-01T01:50:00.000Z,5-22-24 1:00 AM,2024-05-22T01:00:00.000Z,8-12-24 8:49 AM,2024-08-12T08:49:00.000Z,4,4,,SD,CLOSE,Y,,NO,CHATHAM
23-54065,Remove top seal & replace,DR-1801D,DR-1801D,,,,1-1-24 1:50 AM,2024-01-01T01:50:00.000Z,5-22-24 1:00 AM,2024-05-22T01:00:00.000Z,8-12-24 8:49 AM,2024-08-12T08:49:00.000Z,4,4,,SD,CLOSE,Y,,NO,CHATHAM
23-54064,Check for material in stock,DR-1801D,DR-1801D,,,,1-1-24 1:50 AM,2024-01-01T01:50:00.000Z,5-22-24 12:00 AM,2024-05-22T00:00:00.000Z,8-12-24 8:49 AM,2024-08-12T08:49:00.000Z,4,4,,SD,CLOSE,Y,,NO,CHATHAM
23-54063,Seal to be changed out at first scheduled Outage,DR-1801D,DR-1801D,,,,1-1-24 1:50 AM,2024-01-01T01:50:00.000Z,5-22-24 12:00 AM,2024-05-22T00:00:00.000Z,8-12-24 8:49 AM,2024-08-12T08:49:00.000Z,4,4,,SD,CLOSE,Y,,NO,CHATHAM
23-54062,DRYER D INLET SEAL  CHANGE OUT PM DR02,DR-1801D,DR-1801D,,,,1-1-24 1:50 AM,2024-01-01T01:50:00.000Z,10-31-24 2:00 AM,2024-10-31T02:00:00.000Z,8-12-24 8:49 AM,2024-08-12T08:49:00.000Z,4,4,,SD,CLOSE,Y,N,NO,CHATHAM
23-54061,Close Inspection doors and re-seal,E-1824,E-1824,1532,,,1-1-24 1:49 AM,2024-01-01T01:49:00.000Z,4-23-24 12:00 AM,2024-04-23T00:00:00.000Z,6-20-24 2:17 PM,2024-06-20T14:17:00.000Z,4,4,,SD,CLOSE,Y,,NO,CHATHAM
23-54060,Cleaning of Duct work as required,E-1824,E-1824,1532,,,1-1-24 1:49 AM,2024-01-01T01:49:00.000Z,4-23-24 12:00 AM,2024-04-23T00:00:00.000Z,6-20-24 2:17 PM,2024-06-20T14:17:00.000Z,4,4,,SD,CLOSE,Y,,NO,CHATHAM
23-54059,Visual inspection of Duct work,E-1824,E-1824,1532,,,1-1-24 1:49 AM,2024-01-01T01:49:00.000Z,4-23-24 12:00 AM,2024-04-23T00:00:00.000Z,6-20-24 2:17 PM,2024-06-20T14:17:00.000Z,4,4,,SD,CLOSE,Y,,NO,CHATHAM
23-54058,Open Inspection doors,E-1824,E-1824,1532,,,1-1-24 1:49 AM,2024-01-01T01:49:00.000Z,4-23-24 12:00 AM,2024-04-23T00:00:00.000Z,6-20-24 2:17 PM,2024-06-20T14:17:00.000Z,4,4,,SD,CLOSE,Y,,NO,CHATHAM
23-54057,E-1824 Duct work inspection/cleaning DR05,E-1824,E-1824,1532,,,1-1-24 1:49 AM,2024-01-01T01:49:00.000Z,4-23-24 12:00 AM,2024-04-23T00:00:00.000Z,6-20-24 2:17 PM,2024-06-20T14:17:00.000Z,4,4,,SD,CLOSE,Y,N,NO,CHATHAM
23-54056,MI-1801 - MECHANICAL PM,MI-1801,MI-1801,3405,,,1-1-24 1:49 AM,2024-01-01T01:49:00.000Z,1-26-24 1:30 AM,2024-01-26T01:30:00.000Z,1-18-24 8:56 AM,2024-01-18T08:56:00.000Z,4,4,,PM,CLOSE,Y,,NO,CHATHAM
23-54055,MI-1801 - MECHANICAL PM,MI-1801,MI-1801,3405,,,1-1-24 1:49 AM,2024-01-01T01:49:00.000Z,1-26-24 1:30 AM,2024-01-26T01:30:00.000Z,1-18-24 8:56 AM,2024-01-18T08:56:00.000Z,4,4,,PM,CLOSE,Y,N,NO,CHATHAM
23-54054,REMOVE TUNNEL THERMOWELLS ON BOTH DRYERS,DR-1801D,DR-1801D,,,,1-1-24 1:49 AM,2024-01-01T01:49:00.000Z,4-23-24 1:00 AM,2024-04-23T01:00:00.000Z,5-27-24 9:58 AM,2024-05-27T09:58:00.000Z,4,4,,SD,CLOSE,Y,,NO,CHATHAM
23-54053,REMOVE TUNNEL THERMOCOUPLE,DR-1801D,DR-1801D,,,,1-1-24 1:49 AM,2024-01-01T01:49:00.000Z,4-23-24 1:00 AM,2024-04-23T01:00:00.000Z,5-27-24 9:58 AM,2024-05-27T09:58:00.000Z,4,4,,SD,CLOSE,Y,N,NO,CHATHAM
23-54052,Inspect/clean BL-1824 ducting,BL-1824,BL-1824,1294,,,1-1-24 1:49 AM,2024-01-01T01:49:00.000Z,4-23-24 12:00 AM,2024-04-23T00:00:00.000Z,5-27-24 9:51 AM,2024-05-27T09:51:00.000Z,4,4,,SD,CLOSE,Y,,NO,CHATHAM
23-54051,BL-1824  - INSPECT/ CLEAN DUCT WORK,BL-1824,BL-1824,1294,,,1-1-24 1:49 AM,2024-01-01T01:49:00.000Z,4-23-24 1:00 AM,2024-04-23T01:00:00.000Z,5-27-24 9:51 AM,2024-05-27T09:51:00.000Z,4,4,,SD,CLOSE,Y,N,NO,CHATHAM
23-54050,AT DCS,LT-14607,LT-14607,3161,,,1-1-24 1:49 AM,2024-01-01T01:49:00.000Z,1-29-24 12:00 AM,2024-01-29T00:00:00.000Z,1-30-24 9:35 AM,2024-01-30T09:35:00.000Z,4,4,,PM,CLOSE,Y,,NO,CHATHAM
23-54049,IN FIELD,LT-14607,LT-14607,3161,,,1-1-24 1:49 AM,2024-01-01T01:49:00.000Z,1-29-24 12:00 AM,2024-01-29T00:00:00.000Z,1-30-24 9:35 AM,2024-01-30T09:35:00.000Z,4,4,,PM,CLOSE,Y,,NO,CHATHAM
23-54048,AT DCS,LT-14607,LT-14607,3161,,,1-1-24 1:49 AM,2024-01-01T01:49:00.000Z,1-29-24 12:00 AM,2024-01-29T00:00:00.000Z,1-30-24 9:35 AM,2024-01-30T09:35:00.000Z,4,4,,PM,CLOSE,Y,,NO,CHATHAM
23-54047,CO2 MAGNETIC FLOAT LEVEL TRANSMITTER  BLOWDOWN,LT-14607,LT-14607,3161,,,1-1-24 1:49 AM,2024-01-01T01:49:00.000Z,1-29-24 1:00 AM,2024-01-29T01:00:00.000Z,1-30-24 12:30 AM,2024-01-30T00:30:00.000Z,4,4,,PM,CLOSE,Y,N,NO,CHATHAM
23-54046,RETURN DOORS TO DRYER AREA,1800,1800,,,,1-1-24 1:49 AM,2024-01-01T01:49:00.000Z,4-23-24 12:30 AM,2024-04-23T00:30:00.000Z,5-27-24 9:55 AM,2024-05-27T09:55:00.000Z,4,4,,SD,CLOSE,Y,,NO,CHATHAM
23-54045,REPLACE GASKETS,1800,1800,,,,1-1-24 1:49 AM,2024-01-01T01:49:00.000Z,4-23-24 3:00 AM,2024-04-23T03:00:00.000Z,5-27-24 9:55 AM,2024-05-27T09:55:00.000Z,4,4,,SD,CLOSE,Y,,NO,CHATHAM
23-54044,GATHER ALL ACCESS DOORS,1800,1800,,,,1-1-24 1:49 AM,2024-01-01T01:49:00.000Z,4-23-24 1:00 AM,2024-04-23T01:00:00.000Z,5-27-24 9:55 AM,2024-05-27T09:55:00.000Z,4,4,,SD,CLOSE,Y,,NO,CHATHAM
23-54043,1800 - PREPARE ACCESS COVERS - DR01,1800,1800,,,,1-1-24 1:49 AM,2024-01-01T01:49:00.000Z,4-23-24 2:00 AM,2024-04-23T02:00:00.000Z,5-27-24 9:55 AM,2024-05-27T09:55:00.000Z,4,4,,SD,CLOSE,Y,N,NO,CHATHAM
23-54042,SCREW CONVEYOR PM,CV-1824,CV-1824,1428,,,1-1-24 1:49 AM,2024-01-01T01:49:00.000Z,4-23-24 12:00 AM,2024-04-23T00:00:00.000Z,5-27-24 9:51 AM,2024-05-27T09:51:00.000Z,4,4,,SD,CLOSE,Y,,NO,CHATHAM
23-54041,CV-1824 - MECHANICAL PM,CV-1824,CV-1824,1428,,,1-1-24 1:49 AM,2024-01-01T01:49:00.000Z,4-23-24 2:00 AM,2024-04-23T02:00:00.000Z,5-27-24 9:51 AM,2024-05-27T09:51:00.000Z,4,4,,SD,CLOSE,Y,N,NO,CHATHAM
23-54040,CENTRIFUGAL BLOWER PM,BL-1824,BL-1824,1294,,,1-1-24 1:49 AM,2024-01-01T01:49:00.000Z,4-23-24 1:00 AM,2024-04-23T01:00:00.000Z,5-27-24 9:57 AM,2024-05-27T09:57:00.000Z,4,4,,SD,CLOSE,Y,,NO,CHATHAM
23-54039,BL-1824 - MECHANICAL PM,BL-1824,BL-1824,1294,,,1-1-24 1:49 AM,2024-01-01T01:49:00.000Z,4-23-24 1:30 AM,2024-04-23T01:30:00.000Z,5-27-24 9:57 AM,2024-05-27T09:57:00.000Z,4,4,,SD,CLOSE,Y,N,NO,CHATHAM
23-54038,LUBRICATE ETC. & RE-TRY AS REQUIRED.,HY-84308,HY-84308,2717,,,1-1-24 1:49 AM,2024-01-01T01:49:00.000Z,4-23-24 12:00 AM,2024-04-23T00:00:00.000Z,5-27-24 10:43 AM,2024-05-27T10:43:00.000Z,4,4,,SD,CLOSE,Y,,NO,CHATHAM
23-54037,CYCLE DAMPER,HY-84308,HY-84308,2717,,,1-1-24 1:49 AM,2024-01-01T01:49:00.000Z,4-23-24 12:00 AM,2024-04-23T00:00:00.000Z,5-27-24 10:43 AM,2024-05-27T10:43:00.000Z,4,4,,SD,CLOSE,Y,,NO,CHATHAM
23-54036,INSPECT DAMPER EXTERNALLY/INTERNALLY FOR BUILDUP CLEAN AS REQUIRED,HY-84308,HY-84308,2717,,,1-1-24 1:49 AM,2024-01-01T01:49:00.000Z,4-23-24 12:00 AM,2024-04-23T00:00:00.000Z,5-27-24 10:43 AM,2024-05-27T10:43:00.000Z,4,4,,SD,CLOSE,Y,,NO,CHATHAM
23-54035,TEST BEFORE DRYER RE-START,HY-84308,HY-84308,2717,,,1-1-24 1:49 AM,2024-01-01T01:49:00.000Z,4-23-24 12:00 AM,2024-04-23T00:00:00.000Z,5-27-24 10:43 AM,2024-05-27T10:43:00.000Z,4,4,,SD,CLOSE,Y,,NO,CHATHAM
23-54034,HY-84308 DRYER D GAS RECYCLE DAMPER PM DR04,HY-84308,HY-84308,2717,,,1-1-24 1:49 AM,2024-01-01T01:49:00.000Z,4-23-24 12:30 AM,2024-04-23T00:30:00.000Z,5-27-24 10:43 AM,2024-05-27T10:43:00.000Z,4,4,,SD,CLOSE,Y,N,NO,CHATHAM
23-54033,MONTHLY VIBRATION CHECK,CHATHAM,CHATHAM,,,,1-1-24 1:49 AM,2024-01-01T01:49:00.000Z,1-29-24 11:00 AM,2024-01-29T11:00:00.000Z,2-7-24 6:52 AM,2024-02-07T06:52:00.000Z,4,4,,PD,CLOSE,Y,,NO,CHATHAM
23-54032,VIBRATION ANALYSIS,CHATHAM,CHATHAM,,,,1-1-24 1:49 AM,2024-01-01T01:49:00.000Z,1-28-24 12:00 AM,2024-01-28T00:00:00.000Z,2-7-24 6:52 AM,2024-02-07T06:52:00.000Z,4,4,,PD,CLOSE,Y,N,NO,CHATHAM
23-54031,DRYER CYCLONE CLEAN OUT,1840,1840,,,,1-1-24 1:48 AM,2024-01-01T01:48:00.000Z,4-23-24 12:00 AM,2024-04-23T00:00:00.000Z,5-27-24 9:53 AM,2024-05-27T09:53:00.000Z,4,4,,SD,CLOSE,Y,,NO,CHATHAM
23-54030,DR-1801D DRYER PM CYCLONE CLEANING DR02,1840,1840,,,,1-1-24 1:48 AM,2024-01-01T01:48:00.000Z,4-23-24 3:00 AM,2024-04-23T03:00:00.000Z,5-27-24 9:53 AM,2024-05-27T09:53:00.000Z,4,4,,SD,CLOSE,Y,N,NO,CHATHAM
23-54029,SC-1301 MECHANICAL CHECKS,SC-1301,SC-1301,4868,,,1-1-24 1:48 AM,2024-01-01T01:48:00.000Z,1-29-24 1:00 AM,2024-01-29T01:00:00.000Z,2-1-24 5:22 PM,2024-02-01T17:22:00.000Z,4,4,,PM,CLOSE,Y,,NO,CHATHAM
23-54028,SC-1301 - MECHANICAL CHECKS,SC-1301,SC-1301,4868,,,1-1-24 1:48 AM,2024-01-01T01:48:00.000Z,1-29-24 1:00 AM,2024-01-29T01:00:00.000Z,1-29-24 1:00 AM,2024-01-29T01:00:00.000Z,4,4,,PM,CLOSE,Y,N,NO,CHATHAM
23-54027,Remove locks and start up,SE-2101,SE-2101,4876,,,1-1-24 1:48 AM,2024-01-01T01:48:00.000Z,1-29-24 12:10 AM,2024-01-29T00:10:00.000Z,2-1-24 5:22 PM,2024-02-01T17:22:00.000Z,4,4,,PM,CLOSE,Y,,NO,CHATHAM
23-54026,Pump 1 - 2 shots of grease in drive head bearings,SE-2101,SE-2101,4876,,,1-1-24 1:48 AM,2024-01-01T01:48:00.000Z,1-29-24 12:10 AM,2024-01-29T00:10:00.000Z,2-1-24 5:22 PM,2024-02-01T17:22:00.000Z,4,4,,PM,CLOSE,Y,,NO,CHATHAM
23-54025,Pump 1 - 2 shots of grease in crankpin bearing,SE-2101,SE-2101,4876,,,1-1-24 1:48 AM,2024-01-01T01:48:00.000Z,1-29-24 12:10 AM,2024-01-29T00:10:00.000Z,2-1-24 5:22 PM,2024-02-01T17:22:00.000Z,4,4,,PM,CLOSE,Y,,NO,CHATHAM
23-54024,Get operations to shut down separator and lock out,SE-2101,SE-2101,4876,,,1-1-24 1:48 AM,2024-01-01T01:48:00.000Z,1-29-24 12:15 AM,2024-01-29T00:15:00.000Z,2-1-24 5:22 PM,2024-02-01T17:22:00.000Z,4,4,,PM,CLOSE,Y,,NO,CHATHAM
23-54023,SE-2101- CRANKSHAFT GREASING,SE-2101,SE-2101,4876,,,1-1-24 1:48 AM,2024-01-01T01:48:00.000Z,1-29-24 1:00 AM,2024-01-29T01:00:00.000Z,1-29-24 1:00 AM,2024-01-29T01:00:00.000Z,4,4,,PM,CLOSE,Y,N,NO,CHATHAM
23-54022,ACCULOAD SCULLY CABLE BI-WEEKLY PM,FQIC-2203,FQIC-2203,7138,,,1-1-24 1:48 AM,2024-01-01T01:48:00.000Z,1-26-24 12:30 AM,2024-01-26T00:30:00.000Z,1-26-24 3:08 PM,2024-01-26T15:08:00.000Z,4,4,,PM,CLOSE,Y,,NO,CHATHAM
23-54021,ACCULOAD SCULLY CABLE -PM SERVICE,FQIC-2203,FQIC-2203,7138,,,1-1-24 1:48 AM,2024-01-01T01:48:00.000Z,1-26-24 12:30 AM,2024-01-26T00:30:00.000Z,1-26-24 12:30 AM,2024-01-26T00:30:00.000Z,4,4,,PM,CLOSE,Y,N,NO,CHATHAM
23-54020,ROTARY VALVE DRIVE INSPECTION,RV-2101,RV-2101,4864,,,1-1-24 1:48 AM,2024-01-01T01:48:00.000Z,4-23-24 12:30 AM,2024-04-23T00:30:00.000Z,5-16-24 10:09 AM,2024-05-16T10:09:00.000Z,4,4,,SD,CLOSE,Y,,NO,CHATHAM
23-54019,RV-2101 - MECHANICAL PM,RV-2101,RV-2101,4864,,,1-1-24 1:48 AM,2024-01-01T01:48:00.000Z,4-23-24 1:30 AM,2024-04-23T01:30:00.000Z,5-16-24 10:09 AM,2024-05-16T10:09:00.000Z,4,4,,SD,CLOSE,Y,N,NO,CHATHAM
23-54018,GEARBOX  P.M.,RV-1802,RV-1802,4855,,,1-1-24 1:48 AM,2024-01-01T01:48:00.000Z,4-23-24 12:30 AM,2024-04-23T00:30:00.000Z,7-8-24 1:45 PM,2024-07-08T13:45:00.000Z,4,4,,SD,CLOSE,Y,,NO,CHATHAM
23-54017,GEARBOX OIL CHANGE - GENERAL TASK,RV-1802,RV-1802,4855,,,1-1-24 1:48 AM,2024-01-01T01:48:00.000Z,4-23-24 12:30 AM,2024-04-23T00:30:00.000Z,7-8-24 1:45 PM,2024-07-08T13:45:00.000Z,4,4,,SD,CLOSE,Y,,NO,CHATHAM
23-54016,RV-1802 - GEARBOX OIL CHANGE,RV-1802,RV-1802,4855,,,1-1-24 1:48 AM,2024-01-01T01:48:00.000Z,4-23-24 12:30 AM,2024-04-23T00:30:00.000Z,7-8-24 1:45 PM,2024-07-08T13:45:00.000Z,4,4,,SD,CLOSE,Y,N,NO,CHATHAM
23-54015,BASE BOLTS,MX-1801D,MX-1801D,3569,,,1-1-24 1:48 AM,2024-01-01T01:48:00.000Z,4-23-24 12:00 AM,2024-04-23T00:00:00.000Z,5-27-24 10:43 AM,2024-05-27T10:43:00.000Z,4,4,,SD,CLOSE,Y,,NO,CHATHAM
23-54014,MOTOR,MX-1801D,MX-1801D,3569,,,1-1-24 1:48 AM,2024-01-01T01:48:00.000Z,4-23-24 12:00 AM,2024-04-23T00:00:00.000Z,5-27-24 10:43 AM,2024-05-27T10:43:00.000Z,4,4,,SD,CLOSE,Y,,NO,CHATHAM
23-54013,CHECK AD6 INPUT SHAFT FOR OIL LEAKAGE,MX-1801D,MX-1801D,3569,,,1-1-24 1:48 AM,2024-01-01T01:48:00.000Z,4-23-24 12:00 AM,2024-04-23T00:00:00.000Z,5-27-24 10:43 AM,2024-05-27T10:43:00.000Z,4,4,,SD,CLOSE,Y,,NO,CHATHAM
23-54012,CHECK OIL LEVEL IN SEW DRIVE GEARBOX,MX-1801D,MX-1801D,3569,,,1-1-24 1:48 AM,2024-01-01T01:48:00.000Z,4-23-24 12:00 AM,2024-04-23T00:00:00.000Z,5-27-24 10:43 AM,2024-05-27T10:43:00.000Z,4,4,,SD,CLOSE,Y,,NO,CHATHAM
23-54011,INSPECT WRAP-FLEX COUPLINGS (2),MX-1801D,MX-1801D,3569,,,1-1-24 1:48 AM,2024-01-01T01:48:00.000Z,4-23-24 12:00 AM,2024-04-23T00:00:00.000Z,5-27-24 10:43 AM,2024-05-27T10:43:00.000Z,4,4,,SD,CLOSE,Y,,NO,CHATHAM
23-54010,CHECK MIXER SHAFT PACKING GLANDS,MX-1801D,MX-1801D,3569,,,1-1-24 1:48 AM,2024-01-01T01:48:00.000Z,4-23-24 12:00 AM,2024-04-23T00:00:00.000Z,5-27-24 10:43 AM,2024-05-27T10:43:00.000Z,4,4,,SD,CLOSE,Y,,NO,CHATHAM
23-54009,INSPECT DRIVE BELTS ON SEW DRIVE,MX-1801D,MX-1801D,3569,,,1-1-24 1:48 AM,2024-01-01T01:48:00.000Z,4-23-24 12:00 AM,2024-04-23T00:00:00.000Z,5-27-24 10:43 AM,2024-05-27T10:43:00.000Z,4,4,,SD,CLOSE,Y,,NO,CHATHAM
23-54008,INSPECT MIXER INTERNALS,MX-1801D,MX-1801D,3569,,,1-1-24 1:48 AM,2024-01-01T01:48:00.000Z,4-23-24 12:00 AM,2024-04-23T00:00:00.000Z,5-27-24 10:43 AM,2024-05-27T10:43:00.000Z,4,4,,SD,CLOSE,Y,,NO,CHATHAM
23-54007,SAFETY,MX-1801D,MX-1801D,3569,,,1-1-24 1:48 AM,2024-01-01T01:48:00.000Z,4-23-24 12:00 AM,2024-04-23T00:00:00.000Z,5-27-24 10:43 AM,2024-05-27T10:43:00.000Z,4,4,,SD,CLOSE,Y,,NO,CHATHAM
23-54006,MX-1801D - MECHANICAL PM,MX-1801D,MX-1801D,3569,,,1-1-24 1:48 AM,2024-01-01T01:48:00.000Z,4-23-24 2:00 AM,2024-04-23T02:00:00.000Z,5-27-24 10:43 AM,2024-05-27T10:43:00.000Z,4,4,,SD,CLOSE,Y,N,NO,CHATHAM
23-54005,MX-1745 COUPLING 6M REGREASING & PM,MX-1745,MX-1745,3567,,,1-1-24 1:48 AM,2024-01-01T01:48:00.000Z,4-23-24 12:00 AM,2024-04-23T00:00:00.000Z,2-1-24 11:30 AM,2024-02-01T11:30:00.000Z,4,4,,SD,CLOSE,Y,,NO,CHATHAM
23-54004,MIXER GEARBOX 6 MONTH OIL CHANGE,MX-1745,MX-1745,3567,,,1-1-24 1:48 AM,2024-01-01T01:48:00.000Z,4-23-24 12:00 AM,2024-04-23T00:00:00.000Z,2-1-24 11:30 AM,2024-02-01T11:30:00.000Z,4,4,,SD,CLOSE,Y,,NO,CHATHAM
23-54003,SPROUT-MATADOR DOUBLE AGITATOR MIXER P.M.,MX-1745,MX-1745,3567,,,1-1-24 1:48 AM,2024-01-01T01:48:00.000Z,4-23-24 12:00 AM,2024-04-23T00:00:00.000Z,2-1-24 11:30 AM,2024-02-01T11:30:00.000Z,4,4,,SD,CLOSE,Y,,NO,CHATHAM
23-54002,MX-1745 - MECHANICAL PM,MX-1745,MX-1745,3567,,,1-1-24 1:48 AM,2024-01-01T01:48:00.000Z,4-23-24 2:00 AM,2024-04-23T02:00:00.000Z,2-1-24 11:30 AM,2024-02-01T11:30:00.000Z,4,4,,SD,CLOSE,Y,N,NO,CHATHAM
23-54001,WEEKLY JOHN DEER SKID STEER INSPECTION,MTC-006,MTC-006,7050,,,1-1-24 1:48 AM,2024-01-01T01:48:00.000Z,1-29-24 12:45 AM,2024-01-29T00:45:00.000Z,1-29-24 10:04 AM,2024-01-29T10:04:00.000Z,4,4,,PM,CLOSE,Y,,NO,CHATHAM
23-54000,SKID STEER - PM SERVICE,MTC-006,MTC-006,7050,,,1-1-24 1:48 AM,2024-01-01T01:48:00.000Z,1-29-24 12:45 AM,2024-01-29T00:45:00.000Z,1-29-24 1:00 AM,2024-01-29T01:00:00.000Z,4,4,,PM,CLOSE,Y,N,NO,CHATHAM
23-53999,K-3301A/B AIR COMPRESSOR 500 HR/ MONTHLY PM,K-3301B,K-3301B,6670,,,1-1-24 1:48 AM,2024-01-01T01:48:00.000Z,1-28-24 12:30 AM,2024-01-28T00:30:00.000Z,2-9-24 6:53 AM,2024-02-09T06:53:00.000Z,4,4,,PD,CLOSE,Y,,NO,CHATHAM
23-53998,K-3301B - OIL SAMPLE,K-3301B,K-3301B,6670,,,1-1-24 1:48 AM,2024-01-01T01:48:00.000Z,1-28-24 12:30 AM,2024-01-28T00:30:00.000Z,2-9-24 6:53 AM,2024-02-09T06:53:00.000Z,4,4,,PD,CLOSE,Y,N,NO,CHATHAM
23-53997,K-3301A/B AIR COMPRESSOR 500 HR/ MONTHLY PM,K-3301A,K-3301A,6669,,,1-1-24 1:48 AM,2024-01-01T01:48:00.000Z,1-28-24 12:30 AM,2024-01-28T00:30:00.000Z,2-9-24 6:53 AM,2024-02-09T06:53:00.000Z,4,4,,PD,CLOSE,Y,,NO,CHATHAM
23-53996,K-3301A - OIL SAMPLE,K-3301A,K-3301A,6669,,,1-1-24 1:48 AM,2024-01-01T01:48:00.000Z,1-28-24 12:30 AM,2024-01-28T00:30:00.000Z,2-9-24 6:53 AM,2024-02-09T06:53:00.000Z,4,4,,PD,CLOSE,Y,N,NO,CHATHAM
23-53995,DRYER C/D INTERNAL INSPECTION,DR-1801D,DR-1801D,,,,1-1-24 1:48 AM,2024-01-01T01:48:00.000Z,4-23-24 1:30 AM,2024-04-23T01:30:00.000Z,6-20-24 2:14 PM,2024-06-20T14:14:00.000Z,4,4,,SD,CLOSE,Y,,NO,CHATHAM
23-53994,DR-1801D INTERNAL CHECK - PM SERVICE DR02,DR-1801D,DR-1801D,,,,1-1-24 1:48 AM,2024-01-01T01:48:00.000Z,4-23-24 3:00 AM,2024-04-23T03:00:00.000Z,6-20-24 2:14 PM,2024-06-20T14:14:00.000Z,4,4,,SD,CLOSE,Y,N,NO,CHATHAM
23-53993,DRYER D SNUFFING STEAM VALVE 12 WEEK  PM,TV-84208,TV-84208,5902,,,1-1-24 1:48 AM,2024-01-01T01:48:00.000Z,4-23-24 12:30 AM,2024-04-23T00:30:00.000Z,6-24-24 9:18 AM,2024-06-24T09:18:00.000Z,4,4,,SD,CLOSE,Y,,NO,CHATHAM
23-53992,TV-84208 SNUFFING STEAM VALVE - PM SERVICE DR04,TV-84208,TV-84208,5902,,,1-1-24 1:47 AM,2024-01-01T01:47:00.000Z,4-23-24 12:30 AM,2024-04-23T00:30:00.000Z,6-24-24 9:18 AM,2024-06-24T09:18:00.000Z,4,4,,SD,CLOSE,Y,N,NO,CHATHAM
23-53991,SPARK DETECTOR  PM,1840,1840,,,,1-1-24 1:47 AM,2024-01-01T01:47:00.000Z,4-23-24 1:00 AM,2024-04-23T01:00:00.000Z,5-27-24 9:55 AM,2024-05-27T09:55:00.000Z,4,4,,SD,CLOSE,Y,,NO,CHATHAM
23-53990,1840 - SPARK DETECTOR PM SERVICE DR04,1840,1840,,,,1-1-24 1:47 AM,2024-01-01T01:47:00.000Z,4-23-24 1:00 AM,2024-04-23T01:00:00.000Z,5-27-24 9:55 AM,2024-05-27T09:55:00.000Z,4,4,,SD,CLOSE,Y,N,NO,CHATHAM
23-53989,Level Probe cleaning,LSH-18802,LSH-18802,3068,,,1-1-24 1:47 AM,2024-01-01T01:47:00.000Z,4-23-24 12:30 AM,2024-04-23T00:30:00.000Z,5-27-24 10:45 AM,2024-05-27T10:45:00.000Z,4,4,,SD,CLOSE,Y,,NO,CHATHAM
23-53988,LSH-18802 CY-1823 LEVEL PROBE ROUTINE PM - DR04,LSH-18802,LSH-18802,3068,,,1-1-24 1:47 AM,2024-01-01T01:47:00.000Z,4-23-24 12:00 AM,2024-04-23T00:00:00.000Z,5-27-24 10:45 AM,2024-05-27T10:45:00.000Z,4,4,,SD,CLOSE,Y,N,NO,CHATHAM
23-53987,SCREW CONVEYOR PM,CV-2601,CV-2601,1438,,,1-1-24 1:47 AM,2024-01-01T01:47:00.000Z,4-23-24 12:00 AM,2024-04-23T00:00:00.000Z,5-16-24 10:08 AM,2024-05-16T10:08:00.000Z,4,4,,SD,CLOSE,Y,,NO,CHATHAM
23-53986,CV-2601 - MECHANICAL PM,CV-2601,CV-2601,1438,,,1-1-24 1:47 AM,2024-01-01T01:47:00.000Z,4-23-24 2:00 AM,2024-04-23T02:00:00.000Z,5-16-24 10:08 AM,2024-05-16T10:08:00.000Z,4,4,,SD,CLOSE,Y,N,NO,CHATHAM
23-53985,SCREW CONVEYOR PM,CV-1823,CV-1823,1427,,,1-1-24 1:47 AM,2024-01-01T01:47:00.000Z,4-23-24 12:00 AM,2024-04-23T00:00:00.000Z,5-27-24 10:35 AM,2024-05-27T10:35:00.000Z,4,4,,SD,CLOSE,Y,,NO,CHATHAM
23-53984,CV-1823 - MECHANICAL PM,CV-1823,CV-1823,1427,,,1-1-24 1:47 AM,2024-01-01T01:47:00.000Z,4-23-24 2:00 AM,2024-04-23T02:00:00.000Z,5-27-24 10:35 AM,2024-05-27T10:35:00.000Z,4,4,,SD,CLOSE,Y,N,NO,CHATHAM
23-53983,SCREW CONVEYOR PM,CV-1813D,CV-1813D,1426,,,1-1-24 1:47 AM,2024-01-01T01:47:00.000Z,4-23-24 12:00 AM,2024-04-23T00:00:00.000Z,5-27-24 9:50 AM,2024-05-27T09:50:00.000Z,4,4,,SD,CLOSE,Y,,NO,CHATHAM
23-53982,CV-1813D - MECHANICAL PM,CV-1813D,CV-1813D,1426,,,1-1-24 1:47 AM,2024-01-01T01:47:00.000Z,4-23-24 2:00 AM,2024-04-23T02:00:00.000Z,5-27-24 9:50 AM,2024-05-27T09:50:00.000Z,4,4,,SD,CLOSE,Y,N,NO,CHATHAM
23-53981,SCREW CONVEYOR PM,CV-1812D,CV-1812D,1424,,,1-1-24 1:47 AM,2024-01-01T01:47:00.000Z,4-23-24 12:00 AM,2024-04-23T00:00:00.000Z,5-27-24 9:50 AM,2024-05-27T09:50:00.000Z,4,4,,SD,CLOSE,Y,,NO,CHATHAM
23-53980,CV-1812D - MECHANICAL PM,CV-1812D,CV-1812D,1424,,,1-1-24 1:47 AM,2024-01-01T01:47:00.000Z,4-23-24 2:00 AM,2024-04-23T02:00:00.000Z,5-27-24 9:50 AM,2024-05-27T09:50:00.000Z,4,4,,SD,CLOSE,Y,N,NO,CHATHAM
23-53979,SCREW CONVEYOR PM,CV-1807,CV-1807,1422,,,1-1-24 1:47 AM,2024-01-01T01:47:00.000Z,4-23-24 12:00 AM,2024-04-23T00:00:00.000Z,5-27-24 9:49 AM,2024-05-27T09:49:00.000Z,4,4,,SD,CLOSE,Y,,NO,CHATHAM
23-53978,CV-1807 - MECHANICAL PM,CV-1807,CV-1807,1422,,,1-1-24 1:47 AM,2024-01-01T01:47:00.000Z,4-23-24 2:00 AM,2024-04-23T02:00:00.000Z,5-27-24 9:49 AM,2024-05-27T09:49:00.000Z,4,4,,SD,CLOSE,Y,N,NO,CHATHAM
23-53977,SCREW CONVEYOR PM,CV-1805,CV-1805,1421,,,1-1-24 1:47 AM,2024-01-01T01:47:00.000Z,4-23-24 12:00 AM,2024-04-23T00:00:00.000Z,5-27-24 9:49 AM,2024-05-27T09:49:00.000Z,4,4,,SD,CLOSE,Y,,NO,CHATHAM
23-53976,CV-1805 - MECHANICAL PM,CV-1805,CV-1805,1421,,,1-1-24 1:47 AM,2024-01-01T01:47:00.000Z,4-23-24 2:00 AM,2024-04-23T02:00:00.000Z,5-27-24 9:49 AM,2024-05-27T09:49:00.000Z,4,4,,SD,CLOSE,Y,N,NO,CHATHAM
23-53975,SCREW CONVEYOR PM,CV-1804D,CV-1804D,1420,,,1-1-24 1:47 AM,2024-01-01T01:47:00.000Z,4-23-24 12:00 AM,2024-04-23T00:00:00.000Z,5-27-24 9:49 AM,2024-05-27T09:49:00.000Z,4,4,,SD,CLOSE,Y,,NO,CHATHAM
23-53974,CV-1804D - MECHANICAL PM,CV-1804D,CV-1804D,1420,,,1-1-24 1:47 AM,2024-01-01T01:47:00.000Z,4-23-24 2:00 AM,2024-04-23T02:00:00.000Z,5-27-24 9:49 AM,2024-05-27T09:49:00.000Z,4,4,,SD,CLOSE,Y,N,NO,CHATHAM
23-53973,DRAG CONVEYOR  P.M.,CV-1803D,CV-1803D,1418,,,1-1-24 1:47 AM,2024-01-01T01:47:00.000Z,4-23-24 1:30 AM,2024-04-23T01:30:00.000Z,5-27-24 10:16 AM,2024-05-27T10:16:00.000Z,4,4,,SD,CLOSE,Y,,NO,CHATHAM
23-53972,CV-1803D - MECHANICAL PM,CV-1803D,CV-1803D,1418,,,1-1-24 1:47 AM,2024-01-01T01:47:00.000Z,4-23-24 1:30 AM,2024-04-23T01:30:00.000Z,5-27-24 10:16 AM,2024-05-27T10:16:00.000Z,4,4,,SD,CLOSE,Y,N,NO,CHATHAM
23-53971,SCREW CONVEYOR PM,CV-1802D,CV-1802D,1416,,,1-1-24 1:47 AM,2024-01-01T01:47:00.000Z,4-23-24 12:00 AM,2024-04-23T00:00:00.000Z,5-27-24 9:49 AM,2024-05-27T09:49:00.000Z,4,4,,SD,CLOSE,Y,,NO,CHATHAM
23-53970,CV-1802D - MECHANICAL PM,CV-1802D,CV-1802D,1416,,,1-1-24 1:47 AM,2024-01-01T01:47:00.000Z,4-23-24 2:00 AM,2024-04-23T02:00:00.000Z,5-27-24 9:49 AM,2024-05-27T09:49:00.000Z,4,4,,SD,CLOSE,Y,N,NO,CHATHAM
23-53969,FEED SCREW - SCREW CONVEYOR PM,CV-1801D,CV-1801D,1414,,,1-1-24 1:47 AM,2024-01-01T01:47:00.000Z,4-23-24 1:30 AM,2024-04-23T01:30:00.000Z,5-27-24 9:54 AM,2024-05-27T09:54:00.000Z,4,4,,SD,CLOSE,Y,,NO,CHATHAM
23-53968,CV-1801D - MECHANICAL PM,CV-1801D,CV-1801D,1414,,,1-1-24 1:47 AM,2024-01-01T01:47:00.000Z,4-23-24 1:30 AM,2024-04-23T01:30:00.000Z,5-27-24 9:54 AM,2024-05-27T09:54:00.000Z,4,4,,SD,CLOSE,Y,N,NO,CHATHAM
23-53967,SCREW CONVEYOR PM,CV-1747,CV-1747,1412,,,1-1-24 1:47 AM,2024-01-01T01:47:00.000Z,4-23-24 12:00 AM,2024-04-23T00:00:00.000Z,2-1-24 11:29 AM,2024-02-01T11:29:00.000Z,4,4,,SD,CLOSE,Y,,NO,CHATHAM
23-53966,CV-1747 - MECHANICAL PM,CV-1747,CV-1747,1412,,,1-1-24 1:47 AM,2024-01-01T01:47:00.000Z,4-23-24 2:00 AM,2024-04-23T02:00:00.000Z,2-1-24 11:29 AM,2024-02-01T11:29:00.000Z,4,4,,SD,CLOSE,Y,N,NO,CHATHAM
23-53965,SCREW CONVEYOR PM,CV-1746,CV-1746,1411,,,1-1-24 1:47 AM,2024-01-01T01:47:00.000Z,4-23-24 12:00 AM,2024-04-23T00:00:00.000Z,2-1-24 11:29 AM,2024-02-01T11:29:00.000Z,4,4,,SD,CLOSE,Y,,NO,CHATHAM
23-53964,CV-1746 - MECHANICAL PM,CV-1746,CV-1746,1411,,,1-1-24 1:47 AM,2024-01-01T01:47:00.000Z,4-23-24 2:00 AM,2024-04-23T02:00:00.000Z,2-1-24 11:29 AM,2024-02-01T11:29:00.000Z,4,4,,SD,CLOSE,Y,N,NO,CHATHAM
23-53963,DRAG CONVEYOR  P.M.,CV-1744,CV-1744,1410,,,1-1-24 1:47 AM,2024-01-01T01:47:00.000Z,4-23-24 1:30 AM,2024-04-23T01:30:00.000Z,5-27-24 10:24 AM,2024-05-27T10:24:00.000Z,4,4,,SD,CLOSE,Y,,NO,CHATHAM
23-53962,CV-1744 - MECHANCIAL PM,CV-1744,CV-1744,1410,,,1-1-24 1:47 AM,2024-01-01T01:47:00.000Z,4-23-24 1:30 AM,2024-04-23T01:30:00.000Z,5-27-24 10:24 AM,2024-05-27T10:24:00.000Z,4,4,,SD,CLOSE,Y,N,NO,CHATHAM
23-53961,Corn Probe Weekly PM,SA-2101,SA-2101,4865,,,1-1-24 1:47 AM,2024-01-01T01:47:00.000Z,2-5-24 7:30 AM,2024-02-05T07:30:00.000Z,2-8-24 5:21 PM,2024-02-08T17:21:00.000Z,4,4,,PM,CLOSE,Y,,NO,CHATHAM
23-53960,SA-2101 CORN PROBE - MECHANICAL  PM,SA-2101,SA-2101,4865,,,1-1-24 1:47 AM,2024-01-01T01:47:00.000Z,2-5-24 7:30 AM,2024-02-05T07:30:00.000Z,2-5-24 7:30 AM,2024-02-05T07:30:00.000Z,4,4,,PM,CLOSE,Y,N,NO,CHATHAM
23-53959,SPARK DETECTOR  PM,RC-1802,RC-1802,4850,,,1-1-24 1:47 AM,2024-01-01T01:47:00.000Z,4-23-24 1:00 AM,2024-04-23T01:00:00.000Z,6-21-24 8:33 AM,2024-06-21T08:33:00.000Z,4,4,,SD,CLOSE,Y,,NO,CHATHAM
23-53958,RC-1802 COOLING TUBE SPARK DETECTOR PM - DR04,RC-1802,RC-1802,4850,,,1-1-24 1:47 AM,2024-01-01T01:47:00.000Z,4-23-24 1:00 AM,2024-04-23T01:00:00.000Z,6-21-24 8:33 AM,2024-06-21T08:33:00.000Z,4,4,,SD,CLOSE,Y,N,NO,CHATHAM
23-53957,CENTRIFUGAL BLOWER P.M.,BL-2101,BL-2101,1295,,,1-1-24 1:47 AM,2024-01-01T01:47:00.000Z,4-23-24 1:30 AM,2024-04-23T01:30:00.000Z,5-16-24 10:13 AM,2024-05-16T10:13:00.000Z,4,4,,SD,CLOSE,Y,,NO,CHATHAM
23-53956,BL-2101 - MECHANICAL PM,BL-2101,BL-2101,1295,,,1-1-24 1:47 AM,2024-01-01T01:47:00.000Z,4-23-24 1:00 AM,2024-04-23T01:00:00.000Z,5-16-24 10:13 AM,2024-05-16T10:13:00.000Z,4,4,,SD,CLOSE,Y,N,NO,CHATHAM
23-53955,CENTRIFUGAL BLOWER P.M.,BL-1803D,BL-1803D,1292,,,1-1-24 1:46 AM,2024-01-01T01:46:00.000Z,4-23-24 1:30 AM,2024-04-23T01:30:00.000Z,5-16-24 1:57 PM,2024-05-16T13:57:00.000Z,4,4,,SD,CLOSE,Y,,NO,CHATHAM
23-53954,BL-1803D MECHANICAL PM,BL-1803D,BL-1803D,1292,,,1-1-24 1:46 AM,2024-01-01T01:46:00.000Z,4-23-24 1:00 AM,2024-04-23T01:00:00.000Z,5-16-24 1:57 PM,2024-05-16T13:57:00.000Z,4,4,,SD,CLOSE,Y,N,NO,CHATHAM
23-53953,CENTRIFUGAL BLOWER P.M.,BL-1802,BL-1802,1290,,,1-1-24 1:46 AM,2024-01-01T01:46:00.000Z,4-23-24 1:30 AM,2024-04-23T01:30:00.000Z,5-27-24 9:57 AM,2024-05-27T09:57:00.000Z,4,4,,SD,CLOSE,Y,,NO,CHATHAM
23-53952,BL-1802 MECHANICAL PM,BL-1802,BL-1802,1290,,,1-1-24 1:46 AM,2024-01-01T01:46:00.000Z,4-23-24 1:00 AM,2024-04-23T01:00:00.000Z,5-27-24 9:57 AM,2024-05-27T09:57:00.000Z,4,4,,SD,CLOSE,Y,N,NO,CHATHAM
23-53951,CENTRIFUGAL BLOWER PM,BL-1801D,BL-1801D,1289,,,1-1-24 1:46 AM,2024-01-01T01:46:00.000Z,4-23-24 1:00 AM,2024-04-23T01:00:00.000Z,5-27-24 9:57 AM,2024-05-27T09:57:00.000Z,4,4,,SD,CLOSE,Y,,NO,CHATHAM
23-53950,BL-1801D MECHANICAL PM,BL-1801D,BL-1801D,1289,,,1-1-24 1:46 AM,2024-01-01T01:46:00.000Z,4-23-24 1:30 AM,2024-04-23T01:30:00.000Z,5-27-24 9:57 AM,2024-05-27T09:57:00.000Z,4,4,,SD,CLOSE,Y,N,NO,CHATHAM
23-53949,Check operation of biothane float in diked area,LSH-41401,LSH-41401,3081,,,1-1-24 1:46 AM,2024-01-01T01:46:00.000Z,1-29-24 12:30 AM,2024-01-29T00:30:00.000Z,1-30-24 9:35 AM,2024-01-30T09:35:00.000Z,4,4,,PM,CLOSE,Y,,NO,CHATHAM
23-53948,BIOTHANE FLOAT OP CHECK- (LSH-41401) - PM SERVICE,LSH-41401,LSH-41401,3081,,,1-1-24 1:46 AM,2024-01-01T01:46:00.000Z,1-29-24 12:30 AM,2024-01-29T00:30:00.000Z,1-30-24 12:15 AM,2024-01-30T00:15:00.000Z,4,4,,PM,CLOSE,Y,N,NO,CHATHAM
23-53947,BUCKET ELEVATOR  3 MONTH P.M.,BE-1805,BE-1805,1278,,,1-1-24 1:46 AM,2024-01-01T01:46:00.000Z,4-23-24 2:00 AM,2024-04-23T02:00:00.000Z,5-27-24 9:54 AM,2024-05-27T09:54:00.000Z,4,4,,SD,CLOSE,Y,,NO,CHATHAM
23-53946,BE-1805 - MECHANICAL PM,BE-1805,BE-1805,1278,,,1-1-24 1:46 AM,2024-01-01T01:46:00.000Z,4-23-24 2:00 AM,2024-04-23T02:00:00.000Z,5-27-24 9:54 AM,2024-05-27T09:54:00.000Z,4,4,,SD,CLOSE,Y,N,NO,CHATHAM
23-53945,PROCEDURE - REGREASING OPTIM/ TECO INDUCTION MOTOR,3600,3600,,,,1-1-24 1:46 AM,2024-01-01T01:46:00.000Z,1-29-24 12:00 AM,2024-01-29T00:00:00.000Z,2-1-24 6:36 AM,2024-02-01T06:36:00.000Z,4,4,,PM,CLOSE,Y,,NO,CHATHAM
23-53944,3600 MOTOR GREASE PM,3600,3600,,,,1-1-24 1:46 AM,2024-01-01T01:46:00.000Z,1-29-24 1:00 AM,2024-01-29T01:00:00.000Z,2-1-24 6:36 AM,2024-02-01T06:36:00.000Z,4,4,,PM,CLOSE,Y,,NO,CHATHAM
23-53943,3600 AREA - ME-3601 AREA - MOTOR GREASING,3600,3600,,,,1-1-24 1:46 AM,2024-01-01T01:46:00.000Z,1-29-24 1:00 AM,2024-01-29T01:00:00.000Z,1-29-24 1:30 AM,2024-01-29T01:30:00.000Z,4,4,,PM,CLOSE,Y,N,NO,CHATHAM
23-53942,Open blower & damper access doors,1800,1800,,,,1-1-24 1:46 AM,2024-01-01T01:46:00.000Z,4-23-24 1:00 AM,2024-04-23T01:00:00.000Z,5-27-24 9:56 AM,2024-05-27T09:56:00.000Z,4,4,,SD,CLOSE,Y,,NO,CHATHAM
23-53941,Install blanks,1800,1800,,,,1-1-24 1:46 AM,2024-01-01T01:46:00.000Z,4-23-24 12:20 AM,2024-04-23T00:20:00.000Z,5-27-24 9:56 AM,2024-05-27T09:56:00.000Z,4,4,,SD,CLOSE,Y,,NO,CHATHAM
23-53940,1800 - DRYER A&D ISOLATION & PREP - DR01,1800,1800,,,,1-1-24 1:46 AM,2024-01-01T01:46:00.000Z,4-23-24 1:00 AM,2024-04-23T01:00:00.000Z,5-27-24 9:56 AM,2024-05-27T09:56:00.000Z,4,4,,SD,CLOSE,Y,N,NO,CHATHAM
23-53939,Insure that water line for HPW is isolated & drained,1800,1800,,,,1-1-24 1:46 AM,2024-01-01T01:46:00.000Z,4-23-24 12:00 AM,2024-04-23T00:00:00.000Z,5-27-24 9:53 AM,2024-05-27T09:53:00.000Z,4,4,,SD,CLOSE,Y,,NO,CHATHAM
23-53938,Run all mechanical equipment,1800,1800,,,,1-1-24 1:46 AM,2024-01-01T01:46:00.000Z,4-23-24 12:00 AM,2024-04-23T00:00:00.000Z,5-27-24 9:53 AM,2024-05-27T09:53:00.000Z,4,4,,SD,CLOSE,Y,,NO,CHATHAM
23-53937,Insure all blankets have been re-installed,1800,1800,,,,1-1-24 1:46 AM,2024-01-01T01:46:00.000Z,4-23-24 1:00 AM,2024-04-23T01:00:00.000Z,5-27-24 9:53 AM,2024-05-27T09:53:00.000Z,4,4,,SD,CLOSE,Y,,NO,CHATHAM
23-53936,Pump work if duct cleaning has been performed,1800,1800,,,,1-1-24 1:46 AM,2024-01-01T01:46:00.000Z,4-23-24 1:00 AM,2024-04-23T01:00:00.000Z,5-27-24 9:53 AM,2024-05-27T09:53:00.000Z,4,4,,SD,CLOSE,Y,,NO,CHATHAM
23-53935,Insure all dryer access doors are sealed tight,1800,1800,,,,1-1-24 1:46 AM,2024-01-01T01:46:00.000Z,4-23-24 12:30 AM,2024-04-23T00:30:00.000Z,5-27-24 9:53 AM,2024-05-27T09:53:00.000Z,4,4,,SD,CLOSE,Y,,NO,CHATHAM
23-53934,Remove blanks,1800,1800,,,,1-1-24 1:46 AM,2024-01-01T01:46:00.000Z,4-23-24 1:00 AM,2024-04-23T01:00:00.000Z,5-27-24 9:53 AM,2024-05-27T09:53:00.000Z,4,4,,SD,CLOSE,Y,,NO,CHATHAM
23-53933,1800 - DRYER A&D PRE-START WORK- DR01,1800,1800,,,,1-1-24 1:46 AM,2024-01-01T01:46:00.000Z,5-31-24 4:00 AM,2024-05-31T04:00:00.000Z,5-27-24 9:53 AM,2024-05-27T09:53:00.000Z,4,4,,SD,CLOSE,Y,N,NO,CHATHAM
23-53932,LUBRICATE ETC. & RE-TRY AS REQUIRED.,PV-84401,PV-84401,4840,,,1-1-24 1:46 AM,2024-01-01T01:46:00.000Z,4-23-24 12:00 AM,2024-04-23T00:00:00.000Z,5-27-24 9:52 AM,2024-05-27T09:52:00.000Z,4,4,,SD,CLOSE,Y,,NO,CHATHAM
23-53931,CYCLE DAMPER,PV-84401,PV-84401,4840,,,1-1-24 1:46 AM,2024-01-01T01:46:00.000Z,4-23-24 12:00 AM,2024-04-23T00:00:00.000Z,5-27-24 9:52 AM,2024-05-27T09:52:00.000Z,4,4,,SD,CLOSE,Y,,NO,CHATHAM
23-53930,INSPECT DAMPER EXTERNALLY/INTERNALLY FOR BUILDUP CLEAN AS REQUIRED,PV-84401,PV-84401,4840,,,1-1-24 1:46 AM,2024-01-01T01:46:00.000Z,4-23-24 12:00 AM,2024-04-23T00:00:00.000Z,5-27-24 9:52 AM,2024-05-27T09:52:00.000Z,4,4,,SD,CLOSE,Y,,NO,CHATHAM
23-53929,TEST BEFORE DRYER RE-START,PV-84401,PV-84401,4840,,,1-1-24 1:46 AM,2024-01-01T01:46:00.000Z,4-23-24 12:00 AM,2024-04-23T00:00:00.000Z,5-27-24 9:52 AM,2024-05-27T09:52:00.000Z,4,4,,SD,CLOSE,Y,,NO,CHATHAM
23-53928,BL-1804D DRYER BLOWER DAMPER,PV-84401,PV-84401,4840,,,1-1-24 1:46 AM,2024-01-01T01:46:00.000Z,4-23-24 12:30 AM,2024-04-23T00:30:00.000Z,5-27-24 9:52 AM,2024-05-27T09:52:00.000Z,4,4,,SD,CLOSE,Y,N,NO,CHATHAM
23-53927,LUBRICATE ETC. & RE-TRY AS REQUIRED.,PDY-84202,PDY-84202,3955,,,1-1-24 1:46 AM,2024-01-01T01:46:00.000Z,4-23-24 12:00 AM,2024-04-23T00:00:00.000Z,5-27-24 9:51 AM,2024-05-27T09:51:00.000Z,4,4,,SD,CLOSE,Y,,NO,CHATHAM
23-53926,CYCLE DAMPER,PDY-84202,PDY-84202,3955,,,1-1-24 1:46 AM,2024-01-01T01:46:00.000Z,4-23-24 12:00 AM,2024-04-23T00:00:00.000Z,5-27-24 9:51 AM,2024-05-27T09:51:00.000Z,4,4,,SD,CLOSE,Y,,NO,CHATHAM
23-53925,INSPECT DAMPER EXTERNALLY/INTERNALLY FOR BUILDUP CLEAN AS REQUIRED,PDY-84202,PDY-84202,3955,,,1-1-24 1:46 AM,2024-01-01T01:46:00.000Z,4-23-24 12:00 AM,2024-04-23T00:00:00.000Z,5-27-24 9:51 AM,2024-05-27T09:51:00.000Z,4,4,,SD,CLOSE,Y,,NO,CHATHAM
23-53924,TEST BEFORE DRYER RE-START,PDY-84202,PDY-84202,3955,,,1-1-24 1:46 AM,2024-01-01T01:46:00.000Z,4-23-24 12:00 AM,2024-04-23T00:00:00.000Z,5-27-24 9:51 AM,2024-05-27T09:51:00.000Z,4,4,,SD,CLOSE,Y,,NO,CHATHAM
23-53923,PDY-84202 BL-1803D DRYER DAMPER PM  DR04,PDY-84202,PDY-84202,3955,,,1-1-24 1:46 AM,2024-01-01T01:46:00.000Z,4-23-24 12:30 AM,2024-04-23T00:30:00.000Z,5-27-24 9:51 AM,2024-05-27T09:51:00.000Z,4,4,,SD,CLOSE,Y,N,NO,CHATHAM
23-53922,Assist Konecranes with the January 2024 inspection of the cranes as per the service agrement.,CHATHAM,CHATHAM,,,,12-29-23 1:49 PM,2023-12-29T13:49:00.000Z,2-2-24 6:00 PM,2024-02-02T18:00:00.000Z,1-3-24 3:30 PM,2024-01-03T15:30:00.000Z,4,4,,CO,CLOSE,Y,,NO,CHATHAM
23-53921,Biothane Caustic Tank LT-41202 going in and out of range,LT-41202,LT-41202,6702,,,12-29-23 10:39 AM,2023-12-29T10:39:00.000Z,2-6-24 1:55 PM,2024-02-06T13:55:00.000Z,1-4-24 9:02 AM,2024-01-04T09:02:00.000Z,4,4,,CO,CLOSE,Y,,NO,CHATHAM
23-53920,Install new DDG temperature reader and DDG loading spout controls,2600-26K-01,2600-26K-01,,,,12-29-23 10:23 AM,2023-12-29T10:23:00.000Z,2-8-24 12:00 AM,2024-02-08T00:00:00.000Z,1-2-24 8:00 AM,2024-01-02T08:00:00.000Z,4,4,,CO,CLOSE,Y,,NO,CHATHAM
23-53918,TA 2024 - Replace PSV-69204 during SD,PSV-69204,PSV-69204,4576,,,12-28-23 3:32 PM,2023-12-28T15:32:00.000Z,4-22-24 10:40 AM,2024-04-22T10:40:00.000Z,5-16-24 7:07 AM,2024-05-16T07:07:00.000Z,4,4,,CO,CLOSE,Y,,NO,CHATHAM
23-53917,TA 2024 - Replace PSV-69205,PSV-69205,PSV-69205,4577,,,12-28-23 3:30 PM,2023-12-28T15:30:00.000Z,4-22-24 10:45 AM,2024-04-22T10:45:00.000Z,5-16-24 7:06 AM,2024-05-16T07:06:00.000Z,4,4,,CO,CLOSE,Y,,NO,CHATHAM
23-53916,TA 2024 - Replace PSV-69502,PSV-69502,PSV-69502,6712,,,12-28-23 2:49 PM,2023-12-28T14:49:00.000Z,4-22-24 10:46 AM,2024-04-22T10:46:00.000Z,5-16-24 7:01 AM,2024-05-16T07:01:00.000Z,4,4,,CO,CLOSE,Y,,NO,CHATHAM
23-53915,TA 2024 - Replace PSV-69503,PSV-69503,PSV-69503,6713,,,12-28-23 2:46 PM,2023-12-28T14:46:00.000Z,4-22-24 10:51 AM,2024-04-22T10:51:00.000Z,5-16-24 7:01 AM,2024-05-16T07:01:00.000Z,4,4,,CO,CLOSE,Y,,NO,CHATHAM
23-53914,TA24 Spring: V-3301 - Pre TA Inspection,V-3301,V-3301,6318,,,12-28-23 2:45 PM,2023-12-28T14:45:00.000Z,5-20-24 10:40 AM,2024-05-20T10:40:00.000Z,6-6-24 11:22 AM,2024-06-06T11:22:00.000Z,4,4,,CO,CLOSE,Y,,NO,CHATHAM
23-53913,TA25 - Install new MCC3805 Bucket for Corn Cleanout System,MCC-3805,MCC-3805,3381,,,12-28-23 2:43 PM,2023-12-28T14:43:00.000Z,10-31-24 10:55 AM,2024-10-31T10:55:00.000Z,3-5-25 1:51 PM,2025-03-05T13:51:00.000Z,4,4,,CO,CLOSE,Y,,NO,CHATHAM
23-53912,"TA24 Spring - Repair 1\" leaking steam valve (to Ferm)",3600-26K-06,3600-26K-06,,,,12-28-23 2:42 PM,2023-12-28T14:42:00.000Z,5-15-24 10:18 AM,2024-05-15T10:18:00.000Z,3-28-24 10:54 AM,2024-03-28T10:54:00.000Z,4,4,,CO,CLOSE,Y,,NO,CHATHAM
23-53911,Locate terminations of cables that go into enbridge station cabinet,3400-26K-01,3400-26K-01,,,,12-28-23 2:40 PM,2023-12-28T14:40:00.000Z,1-31-24 2:56 PM,2024-01-31T14:56:00.000Z,1-4-24 5:30 PM,2024-01-04T17:30:00.000Z,4,4,,CO,CLOSE,Y,,NO,CHATHAM
23-53910,TA 2024 - CG1 Battery testing,ME-3601A,ME-3601A,,,,12-28-23 2:37 PM,2023-12-28T14:37:00.000Z,4-22-24 4:50 AM,2024-04-22T04:50:00.000Z,5-15-24 8:00 AM,2024-05-15T08:00:00.000Z,4,4,,CO,CLOSE,Y,,NO,CHATHAM
23-53909,TA 2024 - CG2 Battery testing,ME-3602A,ME-3602A,,,,12-28-23 2:36 PM,2023-12-28T14:36:00.000Z,4-22-24 4:54 AM,2024-04-22T04:54:00.000Z,5-15-24 8:04 AM,2024-05-15T08:04:00.000Z,4,4,,CO,CLOSE,Y,,NO,CHATHAM
23-53908,TA 2024 - B3601 Blanking,B-3601,B-3601,1271,,,12-28-23 2:35 PM,2023-12-28T14:35:00.000Z,10-21-24 11:00 AM,2024-10-21T11:00:00.000Z,11-19-24 10:22 AM,2024-11-19T10:22:00.000Z,4,4,,CO,CLOSE,Y,,NO,CHATHAM
23-53907,TA 2024 - B3602 Blanking,B-3602,B-3602,1272,,,12-28-23 2:33 PM,2023-12-28T14:33:00.000Z,10-20-24 11:00 AM,2024-10-20T11:00:00.000Z,11-19-24 10:22 AM,2024-11-19T10:22:00.000Z,4,4,,CO,CLOSE,Y,N,NO,CHATHAM
23-53906,Trip Hazard E-1301B Footings,E-1301B,E-1301B,1479,,,12-28-23 10:12 AM,2023-12-28T10:12:00.000Z,12-29-23 10:06 AM,2023-12-29T10:06:00.000Z,1-9-25 1:44 PM,2025-01-09T13:44:00.000Z,2,2,,SA,CLOSE,Y,,NO,CHATHAM
23-53903,Replace camlock fittings with a union,LSH-18214,LSH-18214,3633,,,12-27-23 2:52 PM,2023-12-27T14:52:00.000Z,1-3-24 7:14 AM,2024-01-03T07:14:00.000Z,1-3-24 8:36 AM,2024-01-03T08:36:00.000Z,2,2,,CO,CLOSE,Y,,NO,CHATHAM
23-53896,Chris G - I/E - Install new power to fiber converter and route new fiber patch,MR-3805,MR-3805,,,,12-27-23 8:50 AM,2023-12-27T08:50:00.000Z,1-4-24 10:51 AM,2024-01-04T10:51:00.000Z,1-2-24 12:15 PM,2024-01-02T12:15:00.000Z,4,4,,CO,CLOSE,Y,,NO,CHATHAM
23-53895,TA 2024 - ME3601 Blanking,ME-3601,ME-3601,3393,,,12-27-23 8:48 AM,2023-12-27T08:48:00.000Z,4-22-24 5:11 AM,2024-04-22T05:11:00.000Z,5-15-24 7:56 AM,2024-05-15T07:56:00.000Z,4,4,,CO,CLOSE,Y,,NO,CHATHAM
23-53894,TA 2024 - DA3601 Blanking,DA-3601,DA-3601,1452,,,12-27-23 8:47 AM,2023-12-27T08:47:00.000Z,4-22-24 5:12 AM,2024-04-22T05:12:00.000Z,5-15-24 7:47 AM,2024-05-15T07:47:00.000Z,4,4,,CO,CLOSE,Y,,NO,CHATHAM
23-53893,TA 2024 - ME3602 Blanking,ME-3602,ME-3602,3395,,,12-27-23 8:45 AM,2023-12-27T08:45:00.000Z,4-22-24 5:09 AM,2024-04-22T05:09:00.000Z,5-15-24 8:01 AM,2024-05-15T08:01:00.000Z,4,4,,CO,CLOSE,Y,,NO,CHATHAM
23-53743,INSTALL TRANSMITTER INTO DUCTWORK,,,,,,12-25-23 1:51 AM,2023-12-25T01:51:00.000Z,1-15-24 9:45 AM,2024-01-15T09:45:00.000Z,6-20-24 2:48 PM,2024-06-20T14:48:00.000Z,4,4,,PM,CLOSE,Y,,NO,CHATHAM
23-53742,CLEAN SENSOR,,,,,,12-25-23 1:51 AM,2023-12-25T01:51:00.000Z,1-15-24 10:00 AM,2024-01-15T10:00:00.000Z,6-20-24 2:48 PM,2024-06-20T14:48:00.000Z,4,4,,PM,CLOSE,Y,,NO,CHATHAM
23-53741,PULL TRANSMITTER OUT OF DUCTWORK,,,,,,12-25-23 1:51 AM,2023-12-25T01:51:00.000Z,1-15-24 9:45 AM,2024-01-15T09:45:00.000Z,6-20-24 2:48 PM,2024-06-20T14:48:00.000Z,4,4,,PM,CLOSE,Y,,NO,CHATHAM
23-53740,INSPECT AND CLEAN FLOW/TEMPERATURE SENSOR FOR DRYER A COMBUSTION AIR,,,,,,12-25-23 1:51 AM,2023-12-25T01:51:00.000Z,1-15-24 10:30 AM,2024-01-15T10:30:00.000Z,6-20-24 2:48 PM,2024-06-20T14:48:00.000Z,4,4,,PM,CLOSE,Y,N,NO,CHATHAM
23-53739,POST- CLOSE CV-1828,CY-1828,CY-1828,2535,,,12-25-23 1:51 AM,2023-12-25T01:51:00.000Z,4-16-24 12:30 AM,2024-04-16T00:30:00.000Z,5-27-24 9:46 AM,2024-05-27T09:46:00.000Z,4,4,,SD,CLOSE,Y,,NO,CHATHAM
23-53738,POST- CLOSE XV-18148,CY-1828,CY-1828,2535,,,12-25-23 1:51 AM,2023-12-25T01:51:00.000Z,4-16-24 1:00 AM,2024-04-16T01:00:00.000Z,5-27-24 9:46 AM,2024-05-27T09:46:00.000Z,4,4,,SD,CLOSE,Y,,NO,CHATHAM
23-53737,POST- CLOSE HATCH ON BL-1829,CY-1828,CY-1828,2535,,,12-25-23 1:51 AM,2023-12-25T01:51:00.000Z,4-16-24 12:30 AM,2024-04-16T00:30:00.000Z,5-27-24 9:46 AM,2024-05-27T09:46:00.000Z,4,4,,SD,CLOSE,Y,,NO,CHATHAM
23-53736,POST- CLOSE CV-1830 DRAIN,CY-1828,CY-1828,2535,,,12-25-23 1:51 AM,2023-12-25T01:51:00.000Z,4-16-24 12:30 AM,2024-04-16T00:30:00.000Z,5-27-24 9:46 AM,2024-05-27T09:46:00.000Z,4,4,,SD,CLOSE,Y,,NO,CHATHAM
23-53735,RE-INSTALL TOP & BOTTOM ACCESS LIDS,CY-1828,CY-1828,2535,,,12-25-23 1:51 AM,2023-12-25T01:51:00.000Z,4-16-24 2:00 AM,2024-04-16T02:00:00.000Z,5-27-24 9:46 AM,2024-05-27T09:46:00.000Z,4,4,,SD,CLOSE,Y,,NO,CHATHAM
23-53734,HPW CYCLONE,CY-1828,CY-1828,2535,,,12-25-23 1:51 AM,2023-12-25T01:51:00.000Z,4-16-24 3:00 AM,2024-04-16T03:00:00.000Z,5-27-24 9:46 AM,2024-05-27T09:46:00.000Z,4,4,,SD,CLOSE,Y,,NO,CHATHAM
23-53733,HPW DUCTING O/T OF CY-1826,CY-1828,CY-1828,2535,,,12-25-23 1:51 AM,2023-12-25T01:51:00.000Z,4-16-24 2:30 AM,2024-04-16T02:30:00.000Z,5-27-24 9:46 AM,2024-05-27T09:46:00.000Z,4,4,,SD,CLOSE,Y,,NO,CHATHAM
23-53732,REMOVE TOP & BOTTOM ACCESS LIDS,CY-1828,CY-1828,2535,,,12-25-23 1:51 AM,2023-12-25T01:51:00.000Z,4-16-24 1:30 AM,2024-04-16T01:30:00.000Z,5-27-24 9:46 AM,2024-05-27T09:46:00.000Z,4,4,,SD,CLOSE,Y,,NO,CHATHAM
23-53731,PRE-OPEN CV-1828 HATCH TO DRAIN,CY-1828,CY-1828,2535,,,12-25-23 1:51 AM,2023-12-25T01:51:00.000Z,4-16-24 12:30 AM,2024-04-16T00:30:00.000Z,5-27-24 9:46 AM,2024-05-27T09:46:00.000Z,4,4,,SD,CLOSE,Y,,NO,CHATHAM
23-53730,PRE-OPEN XV-18148,CY-1828,CY-1828,2535,,,12-25-23 1:51 AM,2023-12-25T01:51:00.000Z,4-16-24 1:00 AM,2024-04-16T01:00:00.000Z,5-27-24 9:46 AM,2024-05-27T09:46:00.000Z,4,4,,SD,CLOSE,Y,,NO,CHATHAM
23-53729,PRE- OPEN TACH ACCESS ON BL-1829,CY-1828,CY-1828,2535,,,12-25-23 1:51 AM,2023-12-25T01:51:00.000Z,4-16-24 12:30 AM,2024-04-16T00:30:00.000Z,5-27-24 9:46 AM,2024-05-27T09:46:00.000Z,4,4,,SD,CLOSE,Y,,NO,CHATHAM
23-53728,PRE-OPEN CV-1830 HATCH TO DRAIN,CY-1828,CY-1828,2535,,,12-25-23 1:51 AM,2023-12-25T01:51:00.000Z,4-16-24 12:30 AM,2024-04-16T00:30:00.000Z,5-27-24 9:46 AM,2024-05-27T09:46:00.000Z,4,4,,SD,CLOSE,Y,,NO,CHATHAM
23-53727,HPW  CY-1828 Cyclone  DR01,CY-1828,CY-1828,2535,,,12-25-23 1:51 AM,2023-12-25T01:51:00.000Z,4-16-24 12:00 AM,2024-04-16T00:00:00.000Z,5-27-24 9:46 AM,2024-05-27T09:46:00.000Z,4,4,,SD,CLOSE,Y,N,NO,CHATHAM
23-53726,PH PROBE CLEANING AND CALIBRATION WEEKLY PM,AT-84505,AT-84505,6885,,,12-25-23 1:51 AM,2023-12-25T01:51:00.000Z,1-18-24 1:00 AM,2024-01-18T01:00:00.000Z,1-18-24 10:03 AM,2024-01-18T10:03:00.000Z,4,4,,PM,CLOSE,Y,,NO,CHATHAM
23-53725,C-1803D pH Meter-Weekly PM,AT-84505,AT-84505,6885,,,12-25-23 1:51 AM,2023-12-25T01:51:00.000Z,1-18-24 12:00 AM,2024-01-18T00:00:00.000Z,1-18-24 12:30 AM,2024-01-18T00:30:00.000Z,4,4,,PM,CLOSE,Y,N,NO,CHATHAM
23-53724,"Area Asset Checks-1830, 1840, DDG Cooler",1800,1800,,,,12-25-23 1:51 AM,2023-12-25T01:51:00.000Z,1-22-24 12:00 AM,2024-01-22T00:00:00.000Z,1-23-24 9:32 AM,2024-01-23T09:32:00.000Z,4,4,,PM,CLOSE,Y,,NO,CHATHAM
23-53723,"Area Asset Checks-1830, 1840, DDG Cooler",1800,1800,,,,12-25-23 1:51 AM,2023-12-25T01:51:00.000Z,1-22-24 12:00 AM,2024-01-22T00:00:00.000Z,1-23-24 1:00 AM,2024-01-23T01:00:00.000Z,4,4,,PM,CLOSE,Y,N,NO,CHATHAM
23-53722,"Area Asset Checks-2200, 2300, 3200, 3600, 4100",2200,2200,,,,12-25-23 1:51 AM,2023-12-25T01:51:00.000Z,1-22-24 12:00 AM,2024-01-22T00:00:00.000Z,1-23-24 9:33 AM,2024-01-23T09:33:00.000Z,4,4,,PM,CLOSE,Y,,NO,CHATHAM
23-53721,"Area Asset Checks-2200, 2300, 3200, 3600, 4100",2200,2200,,,,12-25-23 1:51 AM,2023-12-25T01:51:00.000Z,1-22-24 12:00 AM,2024-01-22T00:00:00.000Z,1-23-24 1:00 AM,2024-01-23T01:00:00.000Z,4,4,,PM,CLOSE,Y,N,NO,CHATHAM
23-53720,"Area Asset Checks-1600, 1660, 1700 (Evaps, Corn oil, Decanyers)",1600,1600,,,,12-25-23 1:51 AM,2023-12-25T01:51:00.000Z,1-22-24 12:00 AM,2024-01-22T00:00:00.000Z,1-23-24 9:32 AM,2024-01-23T09:32:00.000Z,4,4,,PM,CLOSE,Y,,NO,CHATHAM
23-53719,"Area Asset Checks-1600, 1660, 1700",1600,1600,,,,12-25-23 1:51 AM,2023-12-25T01:51:00.000Z,1-22-24 12:00 AM,2024-01-22T00:00:00.000Z,1-23-24 1:00 AM,2024-01-23T01:00:00.000Z,4,4,,PM,CLOSE,Y,N,NO,CHATHAM
23-53718,"Area Asset Checks-1500, 6500 (Distillation)",1500,1500,,,,12-25-23 1:51 AM,2023-12-25T01:51:00.000Z,1-22-24 12:00 AM,2024-01-22T00:00:00.000Z,1-24-24 8:29 AM,2024-01-24T08:29:00.000Z,4,4,,PM,CLOSE,Y,,NO,CHATHAM
23-53717,"Area Asset Checks-1500, 6500",1500,1500,,,,12-25-23 1:51 AM,2023-12-25T01:51:00.000Z,1-22-24 12:00 AM,2024-01-22T00:00:00.000Z,1-24-24 2:00 AM,2024-01-24T02:00:00.000Z,4,4,,PM,CLOSE,Y,N,NO,CHATHAM
23-53716,"Area Asset Checks-2100, 1200, 1300, 1400 (Corn, Mill, Mash, Fermentation)",2100,2100,,,,12-25-23 1:51 AM,2023-12-25T01:51:00.000Z,1-22-24 2:30 AM,2024-01-22T02:30:00.000Z,1-25-24 8:36 AM,2024-01-25T08:36:00.000Z,4,4,,PM,CLOSE,Y,,NO,CHATHAM
23-53715,"Area Asset Checks-2100, 1200, 1300, 1400 (Corn, Mill, Mash, Fermentation)",2100,2100,,,,12-25-23 1:51 AM,2023-12-25T01:51:00.000Z,1-22-24 12:00 AM,2024-01-22T00:00:00.000Z,1-24-24 12:30 AM,2024-01-24T00:30:00.000Z,4,4,,PM,CLOSE,Y,N,NO,CHATHAM
23-53714,"Area Asset Checks-1830, 1840, DDG Cooler",1800,1800,,,,12-25-23 1:51 AM,2023-12-25T01:51:00.000Z,1-22-24 12:00 AM,2024-01-22T00:00:00.000Z,1-22-24 4:08 PM,2024-01-22T16:08:00.000Z,4,4,,PM,CLOSE,Y,,NO,CHATHAM
23-53713,"Area Asset Checks-1830, 1840, DDG Cooler",1800,1800,,,,12-25-23 1:51 AM,2023-12-25T01:51:00.000Z,1-22-24 12:00 AM,2024-01-22T00:00:00.000Z,1-22-24 1:00 AM,2024-01-22T01:00:00.000Z,4,4,,PM,CLOSE,Y,N,NO,CHATHAM
23-53712,"Area Asset Checks-2200, 2300, 3200, 3600, 4100",2200,2200,,,,12-25-23 1:51 AM,2023-12-25T01:51:00.000Z,1-22-24 12:00 AM,2024-01-22T00:00:00.000Z,1-22-24 8:17 AM,2024-01-22T08:17:00.000Z,4,4,,PM,CLOSE,Y,,NO,CHATHAM
23-53711,"Area Asset Checks-2200, 2300, 3200, 3600, 4100",2200,2200,,,,12-25-23 1:50 AM,2023-12-25T01:50:00.000Z,1-22-24 12:00 AM,2024-01-22T00:00:00.000Z,1-22-24 1:00 AM,2024-01-22T01:00:00.000Z,4,4,,PM,CLOSE,Y,N,NO,CHATHAM
23-53710,"Area Asset Checks-1600, 1660, 1700 (Evaps, Corn oil, Decanyers)",1600,1600,,,,12-25-23 1:50 AM,2023-12-25T01:50:00.000Z,1-22-24 12:00 AM,2024-01-22T00:00:00.000Z,1-24-24 5:50 PM,2024-01-24T17:50:00.000Z,4,4,,PM,CLOSE,Y,,NO,CHATHAM
23-53709,"Area Asset Checks-1600, 1660, 1700",1600,1600,,,,12-25-23 1:50 AM,2023-12-25T01:50:00.000Z,1-22-24 12:00 AM,2024-01-22T00:00:00.000Z,1-23-24 1:00 AM,2024-01-23T01:00:00.000Z,4,4,,PM,CLOSE,Y,N,NO,CHATHAM
23-53708,"Area Asset Checks-1500, 6500 (Distillation)",1500,1500,,,,12-25-23 1:50 AM,2023-12-25T01:50:00.000Z,1-22-24 12:00 AM,2024-01-22T00:00:00.000Z,1-22-24 3:20 PM,2024-01-22T15:20:00.000Z,4,4,,PM,CLOSE,Y,,NO,CHATHAM
23-53707,"Area Asset Checks-1500, 6500",1500,1500,,,,12-25-23 1:50 AM,2023-12-25T01:50:00.000Z,1-22-24 12:00 AM,2024-01-22T00:00:00.000Z,1-22-24 2:00 AM,2024-01-22T02:00:00.000Z,4,4,,PM,CLOSE,Y,N,NO,CHATHAM
23-53706,"Area Asset Checks-2100, 1200, 1300, 1400 (Corn, Mill, Mash, Fermentation)",2100,2100,,,,12-25-23 1:50 AM,2023-12-25T01:50:00.000Z,1-22-24 5:00 AM,2024-01-22T05:00:00.000Z,1-24-24 5:50 PM,2024-01-24T17:50:00.000Z,4,4,,PM,CLOSE,Y,,NO,CHATHAM
23-53705,"Area Asset Checks-2100, 1200, 1300, 1400 (Corn, Mill, Mash, Fermentation)",2100,2100,,,,12-25-23 1:50 AM,2023-12-25T01:50:00.000Z,1-22-24 12:00 AM,2024-01-22T00:00:00.000Z,1-23-24 1:30 AM,2024-01-23T01:30:00.000Z,4,4,,PM,CLOSE,Y,N,NO,CHATHAM
23-53704,BL-1804D WEEKLY GREASING,BL-1804D,BL-1804D,,,,12-25-23 1:50 AM,2023-12-25T01:50:00.000Z,1-22-24 12:00 AM,2024-01-22T00:00:00.000Z,1-22-24 8:17 AM,2024-01-22T08:17:00.000Z,4,4,,PM,CLOSE,Y,,NO,CHATHAM
23-53703,BL-1804D - WEEKLY BEARING GREASING,BL-1804D,BL-1804D,,,,12-25-23 1:50 AM,2023-12-25T01:50:00.000Z,1-22-24 12:00 AM,2024-01-22T00:00:00.000Z,1-22-24 12:30 AM,2024-01-22T00:30:00.000Z,4,4,,PM,CLOSE,Y,N,NO,CHATHAM
23-53702,5S AND STOCKROOM AUDIT-WEEKLY PM,MAINTENANCE,MAINTENANCE,,,,12-25-23 1:50 AM,2023-12-25T01:50:00.000Z,1-22-24 12:00 AM,2024-01-22T00:00:00.000Z,1-29-24 12:19 PM,2024-01-29T12:19:00.000Z,4,4,,PM,CLOSE,Y,N,NO,CHATHAM
23-53701,TRANSFORMER  MONTHLY CHECK,3800,3800,,,,12-25-23 1:50 AM,2023-12-25T01:50:00.000Z,1-17-24 12:45 AM,2024-01-17T00:45:00.000Z,1-17-24 4:04 PM,2024-01-17T16:04:00.000Z,4,4,,PM,CLOSE,Y,,NO,CHATHAM
23-53700,TRANSFORMER - (XFMR-3818)  - PM SERVICE,3800,3800,,,,12-25-23 1:50 AM,2023-12-25T01:50:00.000Z,1-17-24 12:45 AM,2024-01-17T00:45:00.000Z,1-17-24 12:30 AM,2024-01-17T00:30:00.000Z,4,4,,PM,CLOSE,Y,N,NO,CHATHAM
23-53699,TRANSFORMER  MONTHLY CHECK,3800,3800,,,,12-25-23 1:50 AM,2023-12-25T01:50:00.000Z,1-17-24 12:45 AM,2024-01-17T00:45:00.000Z,1-17-24 4:04 PM,2024-01-17T16:04:00.000Z,4,4,,PM,CLOSE,Y,,NO,CHATHAM
23-53698,TRANSFORMER - (XFMR-3804B)  - PM SERVICE,3800,3800,,,,12-25-23 1:50 AM,2023-12-25T01:50:00.000Z,1-17-24 12:45 AM,2024-01-17T00:45:00.000Z,1-17-24 12:30 AM,2024-01-17T00:30:00.000Z,4,4,,PM,CLOSE,Y,N,NO,CHATHAM
23-53697,TOTE#5 (4) 100' EXPLOSION PROOF EXTENSION CORDS,CHATHAM,CHATHAM,,,,12-25-23 1:50 AM,2023-12-25T01:50:00.000Z,1-19-24 12:00 AM,2024-01-19T00:00:00.000Z,6-20-24 2:12 PM,2024-06-20T14:12:00.000Z,4,4,,PM,CLOSE,Y,,NO,CHATHAM
23-53696,"TOTE #4 (4) COATS, (4) BIBS, (10) GLOVES, HARD HAT LINERS, NECK WARMERS, (20) INFERNO PACKS",CHATHAM,CHATHAM,,,,12-25-23 1:50 AM,2023-12-25T01:50:00.000Z,1-19-24 12:00 AM,2024-01-19T00:00:00.000Z,6-20-24 2:12 PM,2024-06-20T14:12:00.000Z,4,4,,PM,CLOSE,Y,,NO,CHATHAM
23-53695,TOTE #3 (2) SNAKE INSULATION BLANKETS,CHATHAM,CHATHAM,,,,12-25-23 1:50 AM,2023-12-25T01:50:00.000Z,1-19-24 12:00 AM,2024-01-19T00:00:00.000Z,6-20-24 2:12 PM,2024-06-20T14:12:00.000Z,4,4,,PM,CLOSE,Y,,NO,CHATHAM
23-53694,TOTE #2 (2) SNAKE INSULATION BLANKETS,CHATHAM,CHATHAM,,,,12-25-23 1:50 AM,2023-12-25T01:50:00.000Z,1-19-24 12:00 AM,2024-01-19T00:00:00.000Z,6-20-24 2:12 PM,2024-06-20T14:12:00.000Z,4,4,,PM,CLOSE,Y,,NO,CHATHAM
23-53693,TOTE #1 250' PORTABLE HEAT TRACING,CHATHAM,CHATHAM,,,,12-25-23 1:50 AM,2023-12-25T01:50:00.000Z,1-19-24 12:00 AM,2024-01-19T00:00:00.000Z,6-20-24 2:12 PM,2024-06-20T14:12:00.000Z,4,4,,PM,CLOSE,Y,,NO,CHATHAM
23-53692,COLD WEATHER PLAN (TOTE INSPECTION/AUDIT),CHATHAM,CHATHAM,,,,12-25-23 1:50 AM,2023-12-25T01:50:00.000Z,1-19-24 1:00 AM,2024-01-19T01:00:00.000Z,6-20-24 2:12 PM,2024-06-20T14:12:00.000Z,4,4,,PM,CLOSE,Y,N,NO,CHATHAM
23-53691,Weekly Vibration check (GFE I/E),MI-1201A,MI-1201A,,,,12-25-23 1:50 AM,2023-12-25T01:50:00.000Z,1-18-24 12:00 AM,2024-01-18T00:00:00.000Z,1-23-24 6:28 AM,2024-01-23T06:28:00.000Z,4,4,,PM,CLOSE,Y,,NO,CHATHAM
23-53690,HAMMERMILL WEEKLY PM & ROTATION CHANGE,MI-1201A,MI-1201A,,,,12-25-23 1:50 AM,2023-12-25T01:50:00.000Z,1-18-24 12:00 AM,2024-01-18T00:00:00.000Z,1-23-24 6:28 AM,2024-01-23T06:28:00.000Z,4,4,,PM,CLOSE,Y,,NO,CHATHAM
23-53689,MI-1201A - MECHANICAL PM,MI-1201A,MI-1201A,,,,12-25-23 1:50 AM,2023-12-25T01:50:00.000Z,1-18-24 12:30 AM,2024-01-18T00:30:00.000Z,1-18-24 12:30 AM,2024-01-18T00:30:00.000Z,4,4,,PM,CLOSE,Y,N,NO,CHATHAM
23-53688,Weekly Vibration check (GFE I/E),MI-1201B,MI-1201B,,,,12-25-23 1:50 AM,2023-12-25T01:50:00.000Z,1-22-24 12:00 AM,2024-01-22T00:00:00.000Z,1-29-24 12:06 PM,2024-01-29T12:06:00.000Z,4,4,,PM,CLOSE,Y,,NO,CHATHAM
23-53687,C-MI-1201B - MECHANICAL PM,MI-1201B,MI-1201B,,,,12-25-23 1:50 AM,2023-12-25T01:50:00.000Z,1-22-24 12:00 AM,2024-01-22T00:00:00.000Z,1-29-24 12:06 PM,2024-01-29T12:06:00.000Z,4,4,,PM,CLOSE,Y,,NO,CHATHAM
23-53686,MI-1201B - MECHANICAL PM,MI-1201B,MI-1201B,,,,12-25-23 1:50 AM,2023-12-25T01:50:00.000Z,1-22-24 12:30 AM,2024-01-22T00:30:00.000Z,1-25-24 2:00 AM,2024-01-25T02:00:00.000Z,4,4,,PM,CLOSE,Y,N,NO,CHATHAM
23-53685,GIVE SAMPLE TO SHIPPER/RECEIVER,CV-2603,CV-2603,1441,,,12-25-23 1:49 AM,2023-12-25T01:49:00.000Z,1-18-24 12:00 AM,2024-01-18T00:00:00.000Z,2-5-24 7:55 AM,2024-02-05T07:55:00.000Z,4,4,,PD,CLOSE,Y,,NO,CHATHAM
23-53684,CHECK OIL LEVEL,CV-2603,CV-2603,1441,,,12-25-23 1:49 AM,2023-12-25T01:49:00.000Z,1-18-24 12:30 AM,2024-01-18T00:30:00.000Z,2-5-24 7:55 AM,2024-02-05T07:55:00.000Z,4,4,,PD,CLOSE,Y,,NO,CHATHAM
23-53683,EXTRACT OIL SAMPLE,CV-2603,CV-2603,1441,,,12-25-23 1:49 AM,2023-12-25T01:49:00.000Z,1-18-24 12:30 AM,2024-01-18T00:30:00.000Z,2-5-24 7:55 AM,2024-02-05T07:55:00.000Z,4,4,,PD,CLOSE,Y,,NO,CHATHAM
23-53682,PREPARATION OF CONTAINERS,CV-2603,CV-2603,1441,,,12-25-23 1:49 AM,2023-12-25T01:49:00.000Z,1-18-24 12:00 AM,2024-01-18T00:00:00.000Z,2-5-24 7:55 AM,2024-02-05T07:55:00.000Z,4,4,,PD,CLOSE,Y,,NO,CHATHAM
23-53681,CV-2603-OIL SAMPLING,CV-2603,CV-2603,1441,,,12-25-23 1:49 AM,2023-12-25T01:49:00.000Z,1-18-24 12:30 AM,2024-01-18T00:30:00.000Z,2-1-24 1:00 AM,2024-02-01T01:00:00.000Z,4,4,,PD,CLOSE,Y,N,NO,CHATHAM
23-53680,GIVE SAMPLE TO SHIPPER/RECEIVER,CV-2601,CV-2601,1438,,,12-25-23 1:49 AM,2023-12-25T01:49:00.000Z,1-18-24 12:00 AM,2024-01-18T00:00:00.000Z,1-30-24 10:56 AM,2024-01-30T10:56:00.000Z,4,4,,PD,CLOSE,Y,,NO,CHATHAM
23-53679,CHECK OIL LEVEL,CV-2601,CV-2601,1438,,,12-25-23 1:49 AM,2023-12-25T01:49:00.000Z,1-18-24 12:30 AM,2024-01-18T00:30:00.000Z,1-30-24 10:56 AM,2024-01-30T10:56:00.000Z,4,4,,PD,CLOSE,Y,,NO,CHATHAM
23-53678,EXTRACT OIL SAMPLE,CV-2601,CV-2601,1438,,,12-25-23 1:49 AM,2023-12-25T01:49:00.000Z,1-18-24 12:30 AM,2024-01-18T00:30:00.000Z,1-30-24 10:56 AM,2024-01-30T10:56:00.000Z,4,4,,PD,CLOSE,Y,,NO,CHATHAM
23-53677,PREPARATION OF CONTAINERS,CV-2601,CV-2601,1438,,,12-25-23 1:49 AM,2023-12-25T01:49:00.000Z,1-18-24 12:00 AM,2024-01-18T00:00:00.000Z,1-30-24 10:56 AM,2024-01-30T10:56:00.000Z,4,4,,PD,CLOSE,Y,,NO,CHATHAM
23-53676,CV-2601-OIL SAMPLING,CV-2601,CV-2601,1438,,,12-25-23 1:49 AM,2023-12-25T01:49:00.000Z,1-18-24 12:30 AM,2024-01-18T00:30:00.000Z,1-30-24 12:15 AM,2024-01-30T00:15:00.000Z,4,4,,PD,CLOSE,Y,N,NO,CHATHAM
23-53675,GIVE SAMPLE TO SHIPPER/RECEIVER,CV-2107B,CV-2107B,1434,,,12-25-23 1:49 AM,2023-12-25T01:49:00.000Z,1-18-24 12:00 AM,2024-01-18T00:00:00.000Z,1-30-24 1:22 PM,2024-01-30T13:22:00.000Z,4,4,,PD,CLOSE,Y,,NO,CHATHAM
23-53674,CHECK OIL LEVEL,CV-2107B,CV-2107B,1434,,,12-25-23 1:49 AM,2023-12-25T01:49:00.000Z,1-18-24 12:30 AM,2024-01-18T00:30:00.000Z,1-30-24 1:22 PM,2024-01-30T13:22:00.000Z,4,4,,PD,CLOSE,Y,,NO,CHATHAM
23-53673,EXTRACT OIL SAMPLE,CV-2107B,CV-2107B,1434,,,12-25-23 1:49 AM,2023-12-25T01:49:00.000Z,1-18-24 12:30 AM,2024-01-18T00:30:00.000Z,1-30-24 1:22 PM,2024-01-30T13:22:00.000Z,4,4,,PD,CLOSE,Y,,NO,CHATHAM
23-53672,PREPARATION OF CONTAINERS,CV-2107B,CV-2107B,1434,,,12-25-23 1:49 AM,2023-12-25T01:49:00.000Z,1-18-24 12:00 AM,2024-01-18T00:00:00.000Z,1-30-24 1:22 PM,2024-01-30T13:22:00.000Z,4,4,,PD,CLOSE,Y,,NO,CHATHAM
23-53671,CV-2107B-OIL SAMPLING,CV-2107B,CV-2107B,1434,,,12-25-23 1:49 AM,2023-12-25T01:49:00.000Z,1-18-24 12:30 AM,2024-01-18T00:30:00.000Z,1-30-24 12:30 AM,2024-01-30T00:30:00.000Z,4,4,,PD,CLOSE,Y,N,NO,CHATHAM
23-53670,GIVE SAMPLE TO SHIPPER/RECEIVER,CV-2107A,CV-2107A,1433,,,12-25-23 1:49 AM,2023-12-25T01:49:00.000Z,1-18-24 12:00 AM,2024-01-18T00:00:00.000Z,1-22-24 3:20 PM,2024-01-22T15:20:00.000Z,4,4,,PD,CLOSE,Y,,NO,CHATHAM
23-53669,CHECK OIL LEVEL,CV-2107A,CV-2107A,1433,,,12-25-23 1:49 AM,2023-12-25T01:49:00.000Z,1-18-24 12:30 AM,2024-01-18T00:30:00.000Z,1-22-24 3:20 PM,2024-01-22T15:20:00.000Z,4,4,,PD,CLOSE,Y,,NO,CHATHAM
23-53668,EXTRACT OIL SAMPLE,CV-2107A,CV-2107A,1433,,,12-25-23 1:49 AM,2023-12-25T01:49:00.000Z,1-18-24 12:30 AM,2024-01-18T00:30:00.000Z,1-22-24 3:20 PM,2024-01-22T15:20:00.000Z,4,4,,PD,CLOSE,Y,,NO,CHATHAM
23-53667,PREPARATION OF CONTAINERS,CV-2107A,CV-2107A,1433,,,12-25-23 1:49 AM,2023-12-25T01:49:00.000Z,1-18-24 12:00 AM,2024-01-18T00:00:00.000Z,1-22-24 3:20 PM,2024-01-22T15:20:00.000Z,4,4,,PD,CLOSE,Y,,NO,CHATHAM
23-53666,CV-2107A-OIL SAMPLING,CV-2107A,CV-2107A,1433,,,12-25-23 1:49 AM,2023-12-25T01:49:00.000Z,1-18-24 12:30 AM,2024-01-18T00:30:00.000Z,1-18-24 1:00 AM,2024-01-18T01:00:00.000Z,4,4,,PD,CLOSE,Y,N,NO,CHATHAM
23-53665,GIVE SAMPLE TO SHIPPER/RECEIVER,CV-1824,CV-1824,1428,,,12-25-23 1:49 AM,2023-12-25T01:49:00.000Z,1-18-24 12:00 AM,2024-01-18T00:00:00.000Z,1-22-24 11:33 AM,2024-01-22T11:33:00.000Z,4,4,,PD,CLOSE,Y,,NO,CHATHAM
23-53664,CHECK OIL LEVEL,CV-1824,CV-1824,1428,,,12-25-23 1:49 AM,2023-12-25T01:49:00.000Z,1-18-24 12:30 AM,2024-01-18T00:30:00.000Z,1-22-24 11:33 AM,2024-01-22T11:33:00.000Z,4,4,,PD,CLOSE,Y,,NO,CHATHAM
23-53663,EXTRACT OIL SAMPLE,CV-1824,CV-1824,1428,,,12-25-23 1:49 AM,2023-12-25T01:49:00.000Z,1-18-24 12:30 AM,2024-01-18T00:30:00.000Z,1-22-24 11:33 AM,2024-01-22T11:33:00.000Z,4,4,,PD,CLOSE,Y,,NO,CHATHAM
23-53662,PREPARATION OF CONTAINERS,CV-1824,CV-1824,1428,,,12-25-23 1:49 AM,2023-12-25T01:49:00.000Z,1-18-24 12:00 AM,2024-01-18T00:00:00.000Z,1-22-24 11:33 AM,2024-01-22T11:33:00.000Z,4,4,,PD,CLOSE,Y,,NO,CHATHAM
23-53661,CV-1824-OIL SAMPLING,CV-1824,CV-1824,1428,,,12-25-23 1:49 AM,2023-12-25T01:49:00.000Z,1-18-24 12:30 AM,2024-01-18T00:30:00.000Z,1-18-24 12:30 AM,2024-01-18T00:30:00.000Z,4,4,,PD,CLOSE,Y,N,NO,CHATHAM
23-53660,PH PROBE CLEANING AND CALIBRATION WEEKLY PM,AT-14125,AT-14125,1230,,,12-25-23 1:49 AM,2023-12-25T01:49:00.000Z,1-18-24 1:00 AM,2024-01-18T01:00:00.000Z,1-18-24 10:03 AM,2024-01-18T10:03:00.000Z,4,4,,PM,CLOSE,Y,,NO,CHATHAM
23-53659,PH PROBE CLEANING AND CALIBRATION PM,AT-14125,AT-14125,1230,,,12-25-23 1:49 AM,2023-12-25T01:49:00.000Z,1-18-24 12:00 AM,2024-01-18T00:00:00.000Z,1-18-24 12:30 AM,2024-01-18T00:30:00.000Z,4,4,,PM,CLOSE,Y,N,NO,CHATHAM
23-53658,PH PROBE CLEANING AND CALIBRATION WEEKLY PM,AT-13519,AT-13519,1227,,,12-25-23 1:49 AM,2023-12-25T01:49:00.000Z,1-18-24 1:00 AM,2024-01-18T01:00:00.000Z,1-18-24 10:03 AM,2024-01-18T10:03:00.000Z,4,4,,PM,CLOSE,Y,,NO,CHATHAM
23-53657,PH PROBE CLEANING AND CALIBRATION PM,AT-13519,AT-13519,1227,,,12-25-23 1:49 AM,2023-12-25T01:49:00.000Z,1-18-24 12:00 AM,2024-01-18T00:00:00.000Z,1-18-24 12:30 AM,2024-01-18T00:30:00.000Z,4,4,,PM,CLOSE,Y,N,NO,CHATHAM
23-53656,Monitor & fill salt boxes,CHATHAM,CHATHAM,,,,12-25-23 1:49 AM,2023-12-25T01:49:00.000Z,1-18-24 1:00 AM,2024-01-18T01:00:00.000Z,1-22-24 6:34 AM,2024-01-22T06:34:00.000Z,4,4,,PM,CLOSE,Y,,NO,CHATHAM
23-53655,Thursday route - Fill plant salt boxes,CHATHAM,CHATHAM,,,,12-25-23 1:49 AM,2023-12-25T01:49:00.000Z,1-18-24 12:00 AM,2024-01-18T00:00:00.000Z,1-18-24 2:00 AM,2024-01-18T02:00:00.000Z,4,4,,PM,CLOSE,Y,N,NO,CHATHAM
23-53654,Monitor & fill salt boxes,CHATHAM,CHATHAM,,,,12-25-23 1:49 AM,2023-12-25T01:49:00.000Z,1-22-24 1:00 AM,2024-01-22T01:00:00.000Z,1-24-24 9:45 AM,2024-01-24T09:45:00.000Z,4,4,,PM,CLOSE,Y,,NO,CHATHAM
23-53653,Monday route - Fill plant salt boxes,CHATHAM,CHATHAM,,,,12-25-23 1:49 AM,2023-12-25T01:49:00.000Z,1-22-24 12:00 AM,2024-01-22T00:00:00.000Z,1-22-24 3:00 AM,2024-01-22T03:00:00.000Z,4,4,,PM,CLOSE,Y,N,NO,CHATHAM
23-53652,TRANSFORMER  MONTHLY CHECK,3800,3800,,,,12-25-23 1:49 AM,2023-12-25T01:49:00.000Z,1-17-24 12:45 AM,2024-01-17T00:45:00.000Z,1-17-24 4:04 PM,2024-01-17T16:04:00.000Z,4,4,,PM,CLOSE,Y,,NO,CHATHAM
23-53651,TRANSFORMER - (XFMR-3816)  - PM SERVICE,3800,3800,,,,12-25-23 1:49 AM,2023-12-25T01:49:00.000Z,1-17-24 12:45 AM,2024-01-17T00:45:00.000Z,1-17-24 12:30 AM,2024-01-17T00:30:00.000Z,4,4,,PM,CLOSE,Y,N,NO,CHATHAM
23-53650,Calibration of moisture meter corn receiving 6mth PM,2100,2100,,,,12-25-23 1:49 AM,2023-12-25T01:49:00.000Z,2-19-24 12:00 AM,2024-02-19T00:00:00.000Z,6-24-24 8:22 AM,2024-06-24T08:22:00.000Z,4,4,,PM,CLOSE,Y,,NO,CHATHAM
23-53649,CALIBRATION OF MOISTURE METER,2100,2100,,,,12-25-23 1:49 AM,2023-12-25T01:49:00.000Z,2-19-24 12:00 AM,2024-02-19T00:00:00.000Z,6-24-24 8:22 AM,2024-06-24T08:22:00.000Z,4,4,,PM,CLOSE,Y,N,NO,CHATHAM
23-53648,REPORT ANY IMMEDIATE CONCERNS,LOAD. ARM - SOUTH,LOAD. ARM - SOUTH,3057,,,12-25-23 1:48 AM,2023-12-25T01:48:00.000Z,2-4-24 12:00 AM,2024-02-04T00:00:00.000Z,6-24-24 9:01 AM,2024-06-24T09:01:00.000Z,4,4,,PM,CLOSE,Y,,NO,CHATHAM
23-53647,CHECK FOR SAFETY CONCERNS,LOAD. ARM - SOUTH,LOAD. ARM - SOUTH,3057,,,12-25-23 1:48 AM,2023-12-25T01:48:00.000Z,2-4-24 12:00 AM,2024-02-04T00:00:00.000Z,6-24-24 9:01 AM,2024-06-24T09:01:00.000Z,4,4,,PM,CLOSE,Y,,NO,CHATHAM
23-53646,LUBRICATE WHERE NECESSARY,LOAD. ARM - SOUTH,LOAD. ARM - SOUTH,3057,,,12-25-23 1:48 AM,2023-12-25T01:48:00.000Z,2-4-24 12:00 AM,2024-02-04T00:00:00.000Z,6-24-24 9:01 AM,2024-06-24T09:01:00.000Z,4,4,,PM,CLOSE,Y,,NO,CHATHAM
23-53645,CHECK SCULLY SYSTEM,LOAD. ARM - SOUTH,LOAD. ARM - SOUTH,3057,,,12-25-23 1:48 AM,2023-12-25T01:48:00.000Z,2-4-24 12:00 AM,2024-02-04T00:00:00.000Z,6-24-24 9:01 AM,2024-06-24T09:01:00.000Z,4,4,,PM,CLOSE,Y,,NO,CHATHAM
23-53644,CHECK GROUND SYSTEM,LOAD. ARM - SOUTH,LOAD. ARM - SOUTH,3057,,,12-25-23 1:48 AM,2023-12-25T01:48:00.000Z,2-4-24 12:00 AM,2024-02-04T00:00:00.000Z,6-24-24 9:01 AM,2024-06-24T09:01:00.000Z,4,4,,PM,CLOSE,Y,,NO,CHATHAM
23-53643,CHECK INSULATION & CLEANLINESS,LOAD. ARM - SOUTH,LOAD. ARM - SOUTH,3057,,,12-25-23 1:48 AM,2023-12-25T01:48:00.000Z,2-4-24 12:00 AM,2024-02-04T00:00:00.000Z,6-24-24 9:01 AM,2024-06-24T09:01:00.000Z,4,4,,PM,CLOSE,Y,,NO,CHATHAM
23-53642,CHECK TORSION BALANCE ASSEMBLY,LOAD. ARM - SOUTH,LOAD. ARM - SOUTH,3057,,,12-25-23 1:48 AM,2023-12-25T01:48:00.000Z,2-4-24 12:00 AM,2024-02-04T00:00:00.000Z,6-24-24 9:01 AM,2024-06-24T09:01:00.000Z,4,4,,PM,CLOSE,Y,,NO,CHATHAM
23-53641,CHECK VACUUM BREAKER FOR LEAKS,LOAD. ARM - SOUTH,LOAD. ARM - SOUTH,3057,,,12-25-23 1:48 AM,2023-12-25T01:48:00.000Z,2-4-24 12:00 AM,2024-02-04T00:00:00.000Z,6-24-24 9:01 AM,2024-06-24T09:01:00.000Z,4,4,,PM,CLOSE,Y,,NO,CHATHAM
23-53640,CHECK LOADING VALVE FOR LEAKS,LOAD. ARM - SOUTH,LOAD. ARM - SOUTH,3057,,,12-25-23 1:48 AM,2023-12-25T01:48:00.000Z,2-4-24 12:00 AM,2024-02-04T00:00:00.000Z,6-24-24 9:01 AM,2024-06-24T09:01:00.000Z,4,4,,PM,CLOSE,Y,,NO,CHATHAM
23-53639,CHECK SWIVEL JOINTS,LOAD. ARM - SOUTH,LOAD. ARM - SOUTH,3057,,,12-25-23 1:48 AM,2023-12-25T01:48:00.000Z,2-4-24 12:00 AM,2024-02-04T00:00:00.000Z,6-24-24 9:01 AM,2024-06-24T09:01:00.000Z,4,4,,PM,CLOSE,Y,,NO,CHATHAM
23-53638,CHECK FOR LEAKS,LOAD. ARM - SOUTH,LOAD. ARM - SOUTH,3057,,,12-25-23 1:48 AM,2023-12-25T01:48:00.000Z,2-4-24 12:00 AM,2024-02-04T00:00:00.000Z,6-24-24 9:01 AM,2024-06-24T09:01:00.000Z,4,4,,PM,CLOSE,Y,,NO,CHATHAM
23-53637,SOUTH FUEL LOADING ARM A - PM,LOAD. ARM - SOUTH,LOAD. ARM - SOUTH,3057,,,12-25-23 1:48 AM,2023-12-25T01:48:00.000Z,2-4-24 12:00 AM,2024-02-04T00:00:00.000Z,6-24-24 9:01 AM,2024-06-24T09:01:00.000Z,4,4,,PM,CLOSE,Y,N,NO,CHATHAM
23-53636,REPORT ANY IMMEDIATE CONCERNS,LOAD. ARM - NORTH,LOAD. ARM - NORTH,3056,,,12-25-23 1:48 AM,2023-12-25T01:48:00.000Z,2-4-24 12:00 AM,2024-02-04T00:00:00.000Z,6-24-24 8:34 AM,2024-06-24T08:34:00.000Z,4,4,,PM,CLOSE,Y,,NO,CHATHAM
23-53635,CHECK FOR SAFETY CONCERNS,LOAD. ARM - NORTH,LOAD. ARM - NORTH,3056,,,12-25-23 1:48 AM,2023-12-25T01:48:00.000Z,2-4-24 12:00 AM,2024-02-04T00:00:00.000Z,6-24-24 8:34 AM,2024-06-24T08:34:00.000Z,4,4,,PM,CLOSE,Y,,NO,CHATHAM
23-53634,LUBRICATE WHERE NECESSARY,LOAD. ARM - NORTH,LOAD. ARM - NORTH,3056,,,12-25-23 1:48 AM,2023-12-25T01:48:00.000Z,2-4-24 12:00 AM,2024-02-04T00:00:00.000Z,6-24-24 8:34 AM,2024-06-24T08:34:00.000Z,4,4,,PM,CLOSE,Y,,NO,CHATHAM
23-53633,CHECK SCULLY SYSTEM,LOAD. ARM - NORTH,LOAD. ARM - NORTH,3056,,,12-25-23 1:48 AM,2023-12-25T01:48:00.000Z,2-4-24 12:00 AM,2024-02-04T00:00:00.000Z,6-24-24 8:34 AM,2024-06-24T08:34:00.000Z,4,4,,PM,CLOSE,Y,,NO,CHATHAM
23-53632,CHECK GROUND SYSTEM,LOAD. ARM - NORTH,LOAD. ARM - NORTH,3056,,,12-25-23 1:48 AM,2023-12-25T01:48:00.000Z,2-4-24 12:00 AM,2024-02-04T00:00:00.000Z,6-24-24 8:34 AM,2024-06-24T08:34:00.000Z,4,4,,PM,CLOSE,Y,,NO,CHATHAM
23-53631,CHECK INSULATION & CLEANLINESS,LOAD. ARM - NORTH,LOAD. ARM - NORTH,3056,,,12-25-23 1:48 AM,2023-12-25T01:48:00.000Z,2-4-24 12:00 AM,2024-02-04T00:00:00.000Z,6-24-24 8:34 AM,2024-06-24T08:34:00.000Z,4,4,,PM,CLOSE,Y,,NO,CHATHAM
23-53630,CHECK TORSION BALANCE ASSEMBLY,LOAD. ARM - NORTH,LOAD. ARM - NORTH,3056,,,12-25-23 1:48 AM,2023-12-25T01:48:00.000Z,2-4-24 12:00 AM,2024-02-04T00:00:00.000Z,6-24-24 8:34 AM,2024-06-24T08:34:00.000Z,4,4,,PM,CLOSE,Y,,NO,CHATHAM
23-53629,CHECK VACUUM BREAKER FOR LEAKS,LOAD. ARM - NORTH,LOAD. ARM - NORTH,3056,,,12-25-23 1:48 AM,2023-12-25T01:48:00.000Z,2-4-24 12:00 AM,2024-02-04T00:00:00.000Z,6-24-24 8:34 AM,2024-06-24T08:34:00.000Z,4,4,,PM,CLOSE,Y,,NO,CHATHAM
23-53628,CHECK LOADING VALVE FOR LEAKS,LOAD. ARM - NORTH,LOAD. ARM - NORTH,3056,,,12-25-23 1:48 AM,2023-12-25T01:48:00.000Z,2-4-24 12:00 AM,2024-02-04T00:00:00.000Z,6-24-24 8:34 AM,2024-06-24T08:34:00.000Z,4,4,,PM,CLOSE,Y,,NO,CHATHAM
23-53627,CHECK SWIVEL JOINTS,LOAD. ARM - NORTH,LOAD. ARM - NORTH,3056,,,12-25-23 1:48 AM,2023-12-25T01:48:00.000Z,2-4-24 12:00 AM,2024-02-04T00:00:00.000Z,6-24-24 8:34 AM,2024-06-24T08:34:00.000Z,4,4,,PM,CLOSE,Y,,NO,CHATHAM
23-53626,CHECK FOR LEAKS,LOAD. ARM - NORTH,LOAD. ARM - NORTH,3056,,,12-25-23 1:48 AM,2023-12-25T01:48:00.000Z,2-4-24 12:00 AM,2024-02-04T00:00:00.000Z,6-24-24 8:34 AM,2024-06-24T08:34:00.000Z,4,4,,PM,CLOSE,Y,,NO,CHATHAM
23-53625,NORTH FUEL LOADING ARM B - PM,LOAD. ARM - NORTH,LOAD. ARM - NORTH,3056,,,12-25-23 1:48 AM,2023-12-25T01:48:00.000Z,2-4-24 12:00 AM,2024-02-04T00:00:00.000Z,6-24-24 8:34 AM,2024-06-24T08:34:00.000Z,4,4,,PM,CLOSE,Y,N,NO,CHATHAM
23-53624,CONDUCTIVITY METER /PH PROBE CLEAN & CALIBRATE PM,AE-84404,AE-84404,7174,,,12-25-23 1:48 AM,2023-12-25T01:48:00.000Z,1-18-24 2:00 AM,2024-01-18T02:00:00.000Z,1-18-24 10:03 AM,2024-01-18T10:03:00.000Z,4,4,,PM,CLOSE,Y,,NO,CHATHAM
23-53623,DRYER SCRUBBER PH PROBE PM,AE-84404,AE-84404,7174,,,12-25-23 1:48 AM,2023-12-25T01:48:00.000Z,1-18-24 1:00 AM,2024-01-18T01:00:00.000Z,1-18-24 12:30 AM,2024-01-18T00:30:00.000Z,4,4,,PM,CLOSE,Y,N,NO,CHATHAM
23-53622,AT DCS,LT-16401,LT-16401,3179,,,12-25-23 1:48 AM,2023-12-25T01:48:00.000Z,1-22-24 12:00 AM,2024-01-22T00:00:00.000Z,1-25-24 8:36 AM,2024-01-25T08:36:00.000Z,4,4,,PM,CLOSE,Y,,NO,CHATHAM
23-53621,IN FIELD,LT-16401,LT-16401,3179,,,12-25-23 1:48 AM,2023-12-25T01:48:00.000Z,1-22-24 12:00 AM,2024-01-22T00:00:00.000Z,1-25-24 8:36 AM,2024-01-25T08:36:00.000Z,4,4,,PM,CLOSE,Y,,NO,CHATHAM
23-53620,AT DCS,LT-16401,LT-16401,3179,,,12-25-23 1:48 AM,2023-12-25T01:48:00.000Z,1-22-24 12:00 AM,2024-01-22T00:00:00.000Z,1-25-24 8:36 AM,2024-01-25T08:36:00.000Z,4,4,,PM,CLOSE,Y,,NO,CHATHAM
23-53619,MAGNETIC FLOAT LEVEL TRANSMITTER BLOWDOWN,LT-16401,LT-16401,3179,,,12-25-23 1:48 AM,2023-12-25T01:48:00.000Z,1-22-24 1:00 AM,2024-01-22T01:00:00.000Z,1-24-24 12:30 AM,2024-01-24T00:30:00.000Z,4,4,,PM,CLOSE,Y,N,NO,CHATHAM
23-53618,AT DCS,LT-16304,LT-16304,3178,,,12-25-23 1:48 AM,2023-12-25T01:48:00.000Z,1-22-24 12:00 AM,2024-01-22T00:00:00.000Z,7-3-24 11:11 AM,2024-07-03T11:11:00.000Z,4,4,,PM,CLOSE,Y,,NO,CHATHAM
23-53617,IN FIELD,LT-16304,LT-16304,3178,,,12-25-23 1:48 AM,2023-12-25T01:48:00.000Z,1-22-24 12:00 AM,2024-01-22T00:00:00.000Z,7-3-24 11:11 AM,2024-07-03T11:11:00.000Z,4,4,,PM,CLOSE,Y,,NO,CHATHAM
23-53616,AT DCS,LT-16304,LT-16304,3178,,,12-25-23 1:48 AM,2023-12-25T01:48:00.000Z,1-22-24 12:00 AM,2024-01-22T00:00:00.000Z,7-3-24 11:11 AM,2024-07-03T11:11:00.000Z,4,4,,PM,CLOSE,Y,,NO,CHATHAM
23-53615,MAGNETIC FLOAT LEVEL TRANSMITTER BLOWDOWN,LT-16304,LT-16304,3178,,,12-25-23 1:47 AM,2023-12-25T01:47:00.000Z,1-22-24 1:00 AM,2024-01-22T01:00:00.000Z,7-3-24 12:30 AM,2024-07-03T00:30:00.000Z,4,4,,PM,CLOSE,Y,N,NO,CHATHAM
23-53614,AT DCS,LT-15610,LT-15610,3168,,,12-25-23 1:47 AM,2023-12-25T01:47:00.000Z,1-22-24 12:00 AM,2024-01-22T00:00:00.000Z,5-24-24 8:58 AM,2024-05-24T08:58:00.000Z,4,4,,PM,CLOSE,Y,,NO,CHATHAM
23-53613,IN FIELD,LT-15610,LT-15610,3168,,,12-25-23 1:47 AM,2023-12-25T01:47:00.000Z,1-22-24 12:00 AM,2024-01-22T00:00:00.000Z,5-24-24 8:58 AM,2024-05-24T08:58:00.000Z,4,4,,PM,CLOSE,Y,,NO,CHATHAM
23-53612,AT DCS,LT-15610,LT-15610,3168,,,12-25-23 1:47 AM,2023-12-25T01:47:00.000Z,1-22-24 12:00 AM,2024-01-22T00:00:00.000Z,5-24-24 8:58 AM,2024-05-24T08:58:00.000Z,4,4,,PM,CLOSE,Y,,NO,CHATHAM
23-53611,MAGNETIC FLOAT LEVEL TRANSMITTER BLOWDOWN,LT-15610,LT-15610,3168,,,12-25-23 1:47 AM,2023-12-25T01:47:00.000Z,1-22-24 1:00 AM,2024-01-22T01:00:00.000Z,5-24-24 8:58 AM,2024-05-24T08:58:00.000Z,4,4,,PM,CLOSE,Y,N,NO,CHATHAM
23-53610,AT DCS,LT-15516,LT-15516,3167,,,12-25-23 1:47 AM,2023-12-25T01:47:00.000Z,1-22-24 12:00 AM,2024-01-22T00:00:00.000Z,1-25-24 8:36 AM,2024-01-25T08:36:00.000Z,4,4,,PM,CLOSE,Y,,NO,CHATHAM
23-53609,IN FIELD,LT-15516,LT-15516,3167,,,12-25-23 1:47 AM,2023-12-25T01:47:00.000Z,1-22-24 12:00 AM,2024-01-22T00:00:00.000Z,1-25-24 8:36 AM,2024-01-25T08:36:00.000Z,4,4,,PM,CLOSE,Y,,NO,CHATHAM
23-53608,AT DCS,LT-15516,LT-15516,3167,,,12-25-23 1:47 AM,2023-12-25T01:47:00.000Z,1-22-24 12:00 AM,2024-01-22T00:00:00.000Z,1-25-24 8:36 AM,2024-01-25T08:36:00.000Z,4,4,,PM,CLOSE,Y,,NO,CHATHAM
23-53607,LT-15516 MAGNETIC FLOAT LEVEL TRANSMITTER BLOWDOWN,LT-15516,LT-15516,3167,,,12-25-23 1:47 AM,2023-12-25T01:47:00.000Z,1-22-24 1:00 AM,2024-01-22T01:00:00.000Z,1-24-24 12:30 AM,2024-01-24T00:30:00.000Z,4,4,,PM,CLOSE,Y,N,NO,CHATHAM
23-53606,GIVE SAMPLE TO SHIPPER/RECEIVER,AG-1304,AG-1304,1179,,,12-25-23 1:47 AM,2023-12-25T01:47:00.000Z,1-22-24 12:00 AM,2024-01-22T00:00:00.000Z,1-23-24 8:02 AM,2024-01-23T08:02:00.000Z,4,4,,PD,CLOSE,Y,,NO,CHATHAM
23-53605,CHECK OIL LEVEL,AG-1304,AG-1304,1179,,,12-25-23 1:47 AM,2023-12-25T01:47:00.000Z,1-22-24 12:30 AM,2024-01-22T00:30:00.000Z,1-23-24 8:02 AM,2024-01-23T08:02:00.000Z,4,4,,PD,CLOSE,Y,,NO,CHATHAM
23-53604,EXTRACT OIL SAMPLE,AG-1304,AG-1304,1179,,,12-25-23 1:47 AM,2023-12-25T01:47:00.000Z,1-22-24 12:30 AM,2024-01-22T00:30:00.000Z,1-23-24 8:02 AM,2024-01-23T08:02:00.000Z,4,4,,PD,CLOSE,Y,,NO,CHATHAM
23-53603,PREPARATION OF CONTAINERS,AG-1304,AG-1304,1179,,,12-25-23 1:47 AM,2023-12-25T01:47:00.000Z,1-22-24 12:00 AM,2024-01-22T00:00:00.000Z,1-23-24 8:02 AM,2024-01-23T08:02:00.000Z,4,4,,PD,CLOSE,Y,,NO,CHATHAM
23-53602,AG-1304 - OIL SAMPLING,AG-1304,AG-1304,1179,,,12-25-23 1:47 AM,2023-12-25T01:47:00.000Z,1-22-24 12:30 AM,2024-01-22T00:30:00.000Z,1-22-24 1:00 AM,2024-01-22T01:00:00.000Z,4,4,,PD,CLOSE,Y,N,NO,CHATHAM
23-53601,TRANSFORMER  MONTHLY CHECK,3800,3800,,,,12-25-23 1:47 AM,2023-12-25T01:47:00.000Z,1-17-24 12:45 AM,2024-01-17T00:45:00.000Z,1-17-24 4:04 PM,2024-01-17T16:04:00.000Z,4,4,,PM,CLOSE,Y,,NO,CHATHAM
23-53600,TRANSFORMER - (XFMR-3806)  - PM SERVICE,3800,3800,,,,12-25-23 1:47 AM,2023-12-25T01:47:00.000Z,1-17-24 12:45 AM,2024-01-17T00:45:00.000Z,1-17-24 12:30 AM,2024-01-17T00:30:00.000Z,4,4,,PM,CLOSE,Y,N,NO,CHATHAM
23-53599,TRANSFORMER  MONTHLY CHECK,3800,3800,,,,12-25-23 1:47 AM,2023-12-25T01:47:00.000Z,1-17-24 12:45 AM,2024-01-17T00:45:00.000Z,1-17-24 4:04 PM,2024-01-17T16:04:00.000Z,4,4,,PM,CLOSE,Y,,NO,CHATHAM
23-53598,TRANSFORMER - (XFMR-3805)  - PM SERVICE,3800,3800,,,,12-25-23 1:47 AM,2023-12-25T01:47:00.000Z,1-17-24 12:45 AM,2024-01-17T00:45:00.000Z,1-17-24 12:30 AM,2024-01-17T00:30:00.000Z,4,4,,PM,CLOSE,Y,N,NO,CHATHAM
23-53597,TRANSFORMER  MONTHLY CHECK,3800,3800,,,,12-25-23 1:47 AM,2023-12-25T01:47:00.000Z,1-17-24 12:45 AM,2024-01-17T00:45:00.000Z,1-17-24 4:04 PM,2024-01-17T16:04:00.000Z,4,4,,PM,CLOSE,Y,,NO,CHATHAM
23-53596,TRANSFORMER - (XFMR-3804)  - PM SERVICE,3800,3800,,,,12-25-23 1:47 AM,2023-12-25T01:47:00.000Z,1-17-24 12:45 AM,2024-01-17T00:45:00.000Z,1-17-24 12:30 AM,2024-01-17T00:30:00.000Z,4,4,,PM,CLOSE,Y,N,NO,CHATHAM
23-53595,TRANSFORMER  MONTHLY CHECK,3800,3800,,,,12-25-23 1:47 AM,2023-12-25T01:47:00.000Z,1-17-24 12:45 AM,2024-01-17T00:45:00.000Z,1-17-24 4:04 PM,2024-01-17T16:04:00.000Z,4,4,,PM,CLOSE,Y,,NO,CHATHAM
23-53594,TRANSFORMER - (XFMR-3803)  - PM SERVICE,3800,3800,,,,12-25-23 1:47 AM,2023-12-25T01:47:00.000Z,1-17-24 12:45 AM,2024-01-17T00:45:00.000Z,1-17-24 12:30 AM,2024-01-17T00:30:00.000Z,4,4,,PM,CLOSE,Y,N,NO,CHATHAM
23-53593,TRANSFORMER  MONTHLY CHECK,3800,3800,,,,12-25-23 1:47 AM,2023-12-25T01:47:00.000Z,1-17-24 12:45 AM,2024-01-17T00:45:00.000Z,1-17-24 4:04 PM,2024-01-17T16:04:00.000Z,4,4,,PM,CLOSE,Y,,NO,CHATHAM
23-53592,TRANSFORMER - (XFMR-3802)  - PM SERVICE,3800,3800,,,,12-25-23 1:47 AM,2023-12-25T01:47:00.000Z,1-17-24 12:45 AM,2024-01-17T00:45:00.000Z,1-17-24 12:30 AM,2024-01-17T00:30:00.000Z,4,4,,PM,CLOSE,Y,N,NO,CHATHAM
23-53591,TRANSFORMER  MONTHLY CHECK,3800,3800,,,,12-25-23 1:47 AM,2023-12-25T01:47:00.000Z,1-17-24 12:45 AM,2024-01-17T00:45:00.000Z,1-17-24 4:05 PM,2024-01-17T16:05:00.000Z,4,4,,PM,CLOSE,Y,,NO,CHATHAM
23-53590,TRANSFORMER - (XFMR-3801)  - PM SERVICE,3800,3800,,,,12-25-23 1:47 AM,2023-12-25T01:47:00.000Z,1-17-24 12:45 AM,2024-01-17T00:45:00.000Z,1-17-24 12:30 AM,2024-01-17T00:30:00.000Z,4,4,,PM,CLOSE,Y,N,NO,CHATHAM
23-53589,SC-1301 MECHANICAL CHECKS,SC-1301,SC-1301,4868,,,12-25-23 1:47 AM,2023-12-25T01:47:00.000Z,1-22-24 1:00 AM,2024-01-22T01:00:00.000Z,1-22-24 9:46 AM,2024-01-22T09:46:00.000Z,4,4,,PM,CLOSE,Y,,NO,CHATHAM
23-53588,SC-1301 - MECHANICAL CHECKS,SC-1301,SC-1301,4868,,,12-25-23 1:47 AM,2023-12-25T01:47:00.000Z,1-22-24 1:00 AM,2024-01-22T01:00:00.000Z,1-22-24 1:00 AM,2024-01-22T01:00:00.000Z,4,4,,PM,CLOSE,Y,N,NO,CHATHAM
23-53587,ACCULOAD SCULLY CABLE BI-WEEKLY PM,FQIC-2203,FQIC-2203,7138,,,12-25-23 1:47 AM,2023-12-25T01:47:00.000Z,1-19-24 12:30 AM,2024-01-19T00:30:00.000Z,1-19-24 2:35 PM,2024-01-19T14:35:00.000Z,4,4,,PM,CLOSE,Y,,NO,CHATHAM
23-53586,ACCULOAD SCULLY CABLE -PM SERVICE,FQIC-2203,FQIC-2203,7138,,,12-25-23 1:47 AM,2023-12-25T01:47:00.000Z,1-19-24 12:30 AM,2024-01-19T00:30:00.000Z,1-19-24 12:30 AM,2024-01-19T00:30:00.000Z,4,4,,PM,CLOSE,Y,N,NO,CHATHAM
23-53585,CORN PROBE PM + GREASING,SA-2101,SA-2101,4865,,,12-25-23 1:47 AM,2023-12-25T01:47:00.000Z,1-29-24 8:30 AM,2024-01-29T08:30:00.000Z,1-29-24 1:42 PM,2024-01-29T13:42:00.000Z,4,4,,PM,CLOSE,Y,,NO,CHATHAM
23-53584,SA-2101 CORN PROBE - MECHANICAL  PM,SA-2101,SA-2101,4865,,,12-25-23 1:47 AM,2023-12-25T01:47:00.000Z,1-29-24 8:30 AM,2024-01-29T08:30:00.000Z,1-29-24 9:00 AM,2024-01-29T09:00:00.000Z,4,4,,PM,CLOSE,Y,N,NO,CHATHAM
23-53583,GIVE SAMPLE TO SHIPPER/RECEIVER,ME-3601A,ME-3601A,,,,12-25-23 1:46 AM,2023-12-25T01:46:00.000Z,1-28-24 12:00 AM,2024-01-28T00:00:00.000Z,1-30-24 11:04 AM,2024-01-30T11:04:00.000Z,4,4,,PM,CLOSE,Y,,NO,CHATHAM
23-53582,CHECK OIL LEVEL,ME-3601A,ME-3601A,,,,12-25-23 1:46 AM,2023-12-25T01:46:00.000Z,1-28-24 12:30 AM,2024-01-28T00:30:00.000Z,1-30-24 11:04 AM,2024-01-30T11:04:00.000Z,4,4,,PM,CLOSE,Y,,NO,CHATHAM
23-53581,EXTRACT OIL SAMPLE,ME-3601A,ME-3601A,,,,12-25-23 1:46 AM,2023-12-25T01:46:00.000Z,1-28-24 12:30 AM,2024-01-28T00:30:00.000Z,1-30-24 11:04 AM,2024-01-30T11:04:00.000Z,4,4,,PM,CLOSE,Y,,NO,CHATHAM
23-53580,PREPARATION OF CONTAINERS,ME-3601A,ME-3601A,,,,12-25-23 1:46 AM,2023-12-25T01:46:00.000Z,1-28-24 12:00 AM,2024-01-28T00:00:00.000Z,1-30-24 11:04 AM,2024-01-30T11:04:00.000Z,4,4,,PM,CLOSE,Y,,NO,CHATHAM
23-53579,ME-3601A - LUBE OIL SAMPLE,ME-3601A,ME-3601A,,,,12-25-23 1:46 AM,2023-12-25T01:46:00.000Z,1-28-24 12:30 AM,2024-01-28T00:30:00.000Z,1-30-24 1:00 AM,2024-01-30T01:00:00.000Z,4,4,,PM,CLOSE,Y,N,NO,CHATHAM
23-53578,Check operation of biothane float in diked area,LSH-41401,LSH-41401,3081,,,12-25-23 1:46 AM,2023-12-25T01:46:00.000Z,1-22-24 12:30 AM,2024-01-22T00:30:00.000Z,1-25-24 3:23 PM,2024-01-25T15:23:00.000Z,4,4,,PM,CLOSE,Y,,NO,CHATHAM
23-53577,BIOTHANE FLOAT OP CHECK- (LSH-41401) - PM SERVICE,LSH-41401,LSH-41401,3081,,,12-25-23 1:46 AM,2023-12-25T01:46:00.000Z,1-22-24 12:30 AM,2024-01-22T00:30:00.000Z,1-25-24 12:30 AM,2024-01-25T00:30:00.000Z,4,4,,PM,CLOSE,Y,N,NO,CHATHAM
23-53576,GIVE SAMPLE TO SHIPPER/RECEIVER,AG-1701,AG-1701,1193,,,12-25-23 1:46 AM,2023-12-25T01:46:00.000Z,1-19-24 12:00 AM,2024-01-19T00:00:00.000Z,1-18-24 3:32 PM,2024-01-18T15:32:00.000Z,4,4,,PD,CLOSE,Y,,NO,CHATHAM
23-53575,CHECK OIL LEVEL,AG-1701,AG-1701,1193,,,12-25-23 1:46 AM,2023-12-25T01:46:00.000Z,1-19-24 12:30 AM,2024-01-19T00:30:00.000Z,1-18-24 3:32 PM,2024-01-18T15:32:00.000Z,4,4,,PD,CLOSE,Y,,NO,CHATHAM
23-53574,EXTRACT OIL SAMPLE,AG-1701,AG-1701,1193,,,12-25-23 1:46 AM,2023-12-25T01:46:00.000Z,1-19-24 12:30 AM,2024-01-19T00:30:00.000Z,1-18-24 3:32 PM,2024-01-18T15:32:00.000Z,4,4,,PD,CLOSE,Y,,NO,CHATHAM
23-53573,PREPARATION OF CONTAINERS,AG-1701,AG-1701,1193,,,12-25-23 1:46 AM,2023-12-25T01:46:00.000Z,1-19-24 12:00 AM,2024-01-19T00:00:00.000Z,1-18-24 3:32 PM,2024-01-18T15:32:00.000Z,4,4,,PD,CLOSE,Y,,NO,CHATHAM
23-53572,AG-1701- OIL SAMPLING,AG-1701,AG-1701,1193,,,12-25-23 1:46 AM,2023-12-25T01:46:00.000Z,1-19-24 12:30 AM,2024-01-19T00:30:00.000Z,1-18-24 12:30 AM,2024-01-18T00:30:00.000Z,4,4,,PD,CLOSE,Y,N,NO,CHATHAM
23-53571,PROCEDURE - REGREASING OPTIM/ TECO INDUCTION MOTOR,1900,1900,,,,12-25-23 1:46 AM,2023-12-25T01:46:00.000Z,1-18-24 12:00 AM,2024-01-18T00:00:00.000Z,1-24-24 5:50 PM,2024-01-24T17:50:00.000Z,4,4,,PM,CLOSE,Y,,NO,CHATHAM
23-53570,1900 AREA - GREASE P.M.,1900,1900,,,,12-25-23 1:46 AM,2023-12-25T01:46:00.000Z,1-18-24 1:00 AM,2024-01-18T01:00:00.000Z,1-24-24 5:50 PM,2024-01-24T17:50:00.000Z,4,4,,PM,CLOSE,Y,,NO,CHATHAM
23-53569,1900 AREA - EQUIPMENT GREASING,1900,1900,,,,12-25-23 1:46 AM,2023-12-25T01:46:00.000Z,1-18-24 1:00 AM,2024-01-18T01:00:00.000Z,1-24-24 1:00 AM,2024-01-24T01:00:00.000Z,4,4,,PM,CLOSE,Y,N,NO,CHATHAM
23-53568,PROCEDURE - REGREASING OPTIM/ TECO INDUCTION MOTOR,1500,1500,,,,12-25-23 1:46 AM,2023-12-25T01:46:00.000Z,1-18-24 1:00 AM,2024-01-18T01:00:00.000Z,1-26-24 8:47 AM,2024-01-26T08:47:00.000Z,4,4,,PM,CLOSE,Y,,NO,CHATHAM
23-53567,1500 Area 4 month grease PM routine,1500,1500,,,,12-25-23 1:46 AM,2023-12-25T01:46:00.000Z,1-18-24 12:00 AM,2024-01-18T00:00:00.000Z,1-26-24 8:47 AM,2024-01-26T08:47:00.000Z,4,4,,PM,CLOSE,Y,,NO,CHATHAM
23-53566,1500 AREA - MOTOR GREASING,1500,1500,,,,12-25-23 1:46 AM,2023-12-25T01:46:00.000Z,1-18-24 1:00 AM,2024-01-18T01:00:00.000Z,1-25-24 1:00 AM,2024-01-25T01:00:00.000Z,4,4,,PM,CLOSE,Y,N,NO,CHATHAM
23-53565,GREASE BEARINGS USING ULTRASONIC,1300,1300,,,,12-25-23 1:46 AM,2023-12-25T01:46:00.000Z,1-25-24 12:00 AM,2024-01-25T00:00:00.000Z,1-23-24 6:28 AM,2024-01-23T06:28:00.000Z,4,4,,PM,CLOSE,Y,,NO,CHATHAM
23-53564,CLEAN BLOWER SHAFT GREASE FITTINGS OFF,1300,1300,,,,12-25-23 1:46 AM,2023-12-25T01:46:00.000Z,1-25-24 12:00 AM,2024-01-25T00:00:00.000Z,1-23-24 6:28 AM,2024-01-23T06:28:00.000Z,4,4,,PM,CLOSE,Y,,NO,CHATHAM
23-53563,GREASE NON-DRIVE END BEARING - SEE OPERATION #20,1300,1300,,,,12-25-23 1:46 AM,2023-12-25T01:46:00.000Z,1-25-24 12:00 AM,2024-01-25T00:00:00.000Z,1-23-24 6:28 AM,2024-01-23T06:28:00.000Z,4,4,,PM,CLOSE,Y,,NO,CHATHAM
23-53562,CLEAN NON-DRIVE END BEARING GREASE FITTING OFF,1300,1300,,,,12-25-23 1:46 AM,2023-12-25T01:46:00.000Z,1-25-24 12:00 AM,2024-01-25T00:00:00.000Z,1-23-24 6:28 AM,2024-01-23T06:28:00.000Z,4,4,,PM,CLOSE,Y,,NO,CHATHAM
23-53561,GREASE DRIVE END BEARING,1300,1300,,,,12-25-23 1:46 AM,2023-12-25T01:46:00.000Z,1-25-24 12:00 AM,2024-01-25T00:00:00.000Z,1-23-24 6:28 AM,2024-01-23T06:28:00.000Z,4,4,,PM,CLOSE,Y,,NO,CHATHAM
23-53560,CLEAN DRIVE END BEARING GREASE FITTING OFF,1300,1300,,,,12-25-23 1:46 AM,2023-12-25T01:46:00.000Z,1-25-24 12:00 AM,2024-01-25T00:00:00.000Z,1-23-24 6:28 AM,2024-01-23T06:28:00.000Z,4,4,,PM,CLOSE,Y,,NO,CHATHAM
23-53559,GREASE BEARING USING ULTRASONIC,1300,1300,,,,12-25-23 1:46 AM,2023-12-25T01:46:00.000Z,1-25-24 12:00 AM,2024-01-25T00:00:00.000Z,1-23-24 6:28 AM,2024-01-23T06:28:00.000Z,4,4,,PM,CLOSE,Y,,NO,CHATHAM
23-53558,CLEAN TAIL SHAFT GREASE FITTINGS OFF,1300,1300,,,,12-25-23 1:46 AM,2023-12-25T01:46:00.000Z,1-25-24 12:00 AM,2024-01-25T00:00:00.000Z,1-23-24 6:28 AM,2024-01-23T06:28:00.000Z,4,4,,PM,CLOSE,Y,,NO,CHATHAM
23-53557,GREASE BEARINGS USING ULTRASONIC,1300,1300,,,,12-25-23 1:46 AM,2023-12-25T01:46:00.000Z,1-25-24 12:00 AM,2024-01-25T00:00:00.000Z,1-23-24 6:28 AM,2024-01-23T06:28:00.000Z,4,4,,PM,CLOSE,Y,,NO,CHATHAM
23-53556,CLEAN HEAD SHAFT GREASE FITTINGS OFF,1300,1300,,,,12-25-23 1:46 AM,2023-12-25T01:46:00.000Z,1-25-24 12:00 AM,2024-01-25T00:00:00.000Z,1-23-24 6:28 AM,2024-01-23T06:28:00.000Z,4,4,,PM,CLOSE,Y,,NO,CHATHAM
23-53555,1300 AREA MECHANICAL EQUIPMENT GREASING,1300,1300,,,,12-25-23 1:46 AM,2023-12-25T01:46:00.000Z,1-25-24 6:00 AM,2024-01-25T06:00:00.000Z,1-22-24 2:00 AM,2024-01-22T02:00:00.000Z,4,4,,PM,CLOSE,Y,N,NO,CHATHAM
23-53552,CE-1711 will not stay running without tripping on vibration,CE-1711,CE-1711,,,,12-21-23 2:38 PM,2023-12-21T14:38:00.000Z,12-22-23 1:21 PM,2023-12-22T13:21:00.000Z,1-5-24 8:35 AM,2024-01-05T08:35:00.000Z,2,2,,CO,CLOSE,Y,,NO,CHATHAM
23-53551,P-6608 Corn oil product pump leaks,P-6608,P-6608,3844,,,12-21-23 2:35 PM,2023-12-21T14:35:00.000Z,1-26-24 8:25 PM,2024-01-26T20:25:00.000Z,7-10-24 11:45 AM,2024-07-10T11:45:00.000Z,4,4,,CO,CLOSE,Y,,NO,CHATHAM
23-53550,DROA - Air sweep solenoid sounds bad/leaking,HY-18219B,HY-18219B,6707,,,12-21-23 2:34 PM,2023-12-21T14:34:00.000Z,2-10-24 8:35 PM,2024-02-10T20:35:00.000Z,1-30-24 10:35 PM,2024-01-30T22:35:00.000Z,4,4,,CO,CLOSE,Y,,NO,CHATHAM
23-53549,Condensate leak from steam heater,UH-1800-2,UH-1800-2,6664,,,12-21-23 2:31 PM,2023-12-21T14:31:00.000Z,1-26-24 8:43 PM,2024-01-26T20:43:00.000Z,1-12-24 10:44 AM,2024-01-12T10:44:00.000Z,4,4,,CO,CLOSE,Y,,NO,CHATHAM
23-53547,Water line going to P1405 B suction is leaking - Install seal kit in Valve,P-1405B,P-1405B,1037,,,12-21-23 11:04 AM,2023-12-21T11:04:00.000Z,12-22-23 4:06 AM,2023-12-22T04:06:00.000Z,1-12-24 11:12 AM,2024-01-12T11:12:00.000Z,4,4,,CO,CLOSE,Y,,NO,CHATHAM
23-53539,P-2303B - OIL CHANGE/ PM SERVICE,P-2303B,P-2303B,1120,,,12-20-23 4:14 PM,2023-12-20T16:14:00.000Z,,,6-28-24 12:14 PM,2024-06-28T12:14:00.000Z,4,4,,PM,CLOSE,Y,,NO,CHATHAM
23-53538,I/E - Steve Moore - Asbuild drawings for FE2601/2,FE-2601,FE-2601,1765,,,12-20-23 3:08 PM,2023-12-20T15:08:00.000Z,1-12-24 4:00 PM,2024-01-12T16:00:00.000Z,1-4-24 12:44 PM,2024-01-04T12:44:00.000Z,4,4,,CO,CLOSE,Y,,NO,CHATHAM
23-53537,Emergency light at East end of men's changeroom battery is weak,BU-ADMIN,BU-ADMIN,,,,12-20-23 1:39 PM,2023-12-20T13:39:00.000Z,12-31-23 8:44 AM,2023-12-31T08:44:00.000Z,12-20-23 10:15 AM,2023-12-20T10:15:00.000Z,4,4,,CO,CLOSE,Y,,NO,CHATHAM
23-53536,Readings from the H2S analyzer are erratic and are not matching handheld meter,AIT-41210,AIT-41210,6697,,,12-20-23 1:37 PM,2023-12-20T13:37:00.000Z,12-28-23 8:49 AM,2023-12-28T08:49:00.000Z,1-19-24 11:40 AM,2024-01-19T11:40:00.000Z,4,4,,CO,CLOSE,Y,,NO,CHATHAM
23-53535,Back up scully not connecting,LSHH-39301F,LSHH-39301F,3112,,,12-20-23 1:32 PM,2023-12-20T13:32:00.000Z,12-29-23 2:45 PM,2023-12-29T14:45:00.000Z,12-20-23 3:45 PM,2023-12-20T15:45:00.000Z,4,4,,CO,CLOSE,Y,,NO,CHATHAM
23-53534,Light burnt out by the weigh belt,SC-1301,SC-1301,4868,,,12-20-23 1:24 PM,2023-12-20T13:24:00.000Z,12-29-23 1:41 PM,2023-12-29T13:41:00.000Z,12-26-23 2:13 PM,2023-12-26T14:13:00.000Z,4,4,,CO,CLOSE,Y,,NO,CHATHAM
23-53533,Slow Seal Pot Leak on P-1630,P-1630,P-1630,1002,,,12-20-23 1:21 PM,2023-12-20T13:21:00.000Z,5-31-24 3:48 PM,2024-05-31T15:48:00.000Z,5-27-24 10:09 AM,2024-05-27T10:09:00.000Z,4,4,,CO,CLOSE,Y,,NO,CHATHAM
23-53532,Repair AG-1601 top shaft,AG-1601,AG-1601,1191,,,12-20-23 1:13 PM,2023-12-20T13:13:00.000Z,5-30-24 3:45 PM,2024-05-30T15:45:00.000Z,,,4,4,,CO,CAN,Y,,NO,CHATHAM
23-53531,RECOAT DA-3602 EXTERIOR SURFACES (SEE VT-20230426-TANTOM1-8723-GREENFIELDDA3602),DA-3602,DA-3602,1453,,,12-20-23 1:09 PM,2023-12-20T13:09:00.000Z,5-30-25 3:05 PM,2025-05-30T15:05:00.000Z,,,4,4,,SD,SCHED,N,,NO,CHATHAM
23-53530,TA 2024 - Repair ME3601 casing South end above Mud drum,ME-3601,ME-3601,3393,,,12-20-23 11:50 AM,2023-12-20T11:50:00.000Z,4-22-24 5:32 AM,2024-04-22T05:32:00.000Z,5-15-24 7:56 AM,2024-05-15T07:56:00.000Z,4,4,,CO,CLOSE,Y,,NO,CHATHAM
23-53529,TA 2024 - Replace PSV-36802,PSV-36802,PSV-36802,4447,,,12-20-23 11:48 AM,2023-12-20T11:48:00.000Z,4-22-24 5:42 AM,2024-04-22T05:42:00.000Z,5-15-24 9:05 AM,2024-05-15T09:05:00.000Z,4,4,,CO,CLOSE,Y,,NO,CHATHAM
23-53528,TA 2024 - Replace PSV-36803,PSV-36803,PSV-36803,4448,,,12-20-23 11:43 AM,2023-12-20T11:43:00.000Z,4-22-24 5:42 AM,2024-04-22T05:42:00.000Z,5-16-24 6:59 AM,2024-05-16T06:59:00.000Z,4,4,,CO,CLOSE,Y,,NO,CHATHAM
23-53527,TA 2024 - Service PSV-36400,PSV-36701,PSV-36701,4441,,,12-20-23 11:40 AM,2023-12-20T11:40:00.000Z,4-22-24 5:23 AM,2024-04-22T05:23:00.000Z,5-16-24 6:58 AM,2024-05-16T06:58:00.000Z,4,4,,CO,CLOSE,Y,,NO,CHATHAM
23-53526,"TA24 Spring: E-6571 - Open, Clean and Inspect",E-6571,E-6571,1579,,,12-20-23 11:34 AM,2023-12-20T11:34:00.000Z,5-20-24 9:31 AM,2024-05-20T09:31:00.000Z,5-23-24 3:08 PM,2024-05-23T15:08:00.000Z,4,4,,CO,CLOSE,Y,,NO,CHATHAM
23-53525,"TA24 Spring: C-6571 - Open, Clean and Inspect",C-6571,C-6571,1374,,,12-20-23 11:31 AM,2023-12-20T11:31:00.000Z,5-31-24 9:31 AM,2024-05-31T09:31:00.000Z,5-23-24 1:06 PM,2024-05-23T13:06:00.000Z,4,4,,CO,CLOSE,Y,,NO,CHATHAM
23-53524,TA24 Spring - Install mash building spinners,TK-1301,TK-1301,5450,,,12-20-23 11:29 AM,2023-12-20T11:29:00.000Z,4-30-24 6:00 PM,2024-04-30T18:00:00.000Z,5-22-24 9:28 AM,2024-05-22T09:28:00.000Z,4,4,,CO,CLOSE,Y,,NO,CHATHAM
23-53523,TA24 Spring - Remove TGF pH probe before shutting down unit,AT-84505,AT-84505,6885,,,12-20-23 11:27 AM,2023-12-20T11:27:00.000Z,4-30-24 2:31 PM,2024-04-30T14:31:00.000Z,5-27-24 10:00 AM,2024-05-27T10:00:00.000Z,4,4,,CO,CLOSE,Y,,NO,CHATHAM
23-53522,TA24 Spring - Clean solids from mash building vessels,TK-1301,TK-1301,5450,,,12-20-23 11:23 AM,2023-12-20T11:23:00.000Z,5-3-24 8:00 PM,2024-05-03T20:00:00.000Z,5-22-24 9:27 AM,2024-05-22T09:27:00.000Z,4,4,,CO,CLOSE,Y,,NO,CHATHAM
23-53521,TA24 Spring - Remove scrubber pH probe before shutting down dryers,AE-84404,AE-84404,7174,,,12-20-23 11:21 AM,2023-12-20T11:21:00.000Z,4-30-24 2:39 PM,2024-04-30T14:39:00.000Z,5-27-24 10:00 AM,2024-05-27T10:00:00.000Z,4,4,,CO,CLOSE,Y,,NO,CHATHAM
23-53520,TA24 Spring: V-1591A - Pre T/A Inspection,V-1591A,V-1591A,6300,,,12-20-23 11:18 AM,2023-12-20T11:18:00.000Z,5-20-24 10:34 AM,2024-05-20T10:34:00.000Z,5-24-24 10:08 AM,2024-05-24T10:08:00.000Z,4,4,,CO,CLOSE,Y,,NO,CHATHAM
23-53519,TA24 Spring: V-1529 - Pre T/A Inspection,V-1529,V-1529,6293,,,12-20-23 11:16 AM,2023-12-20T11:16:00.000Z,5-20-24 10:28 AM,2024-05-20T10:28:00.000Z,5-24-24 10:06 AM,2024-05-24T10:06:00.000Z,4,4,,CO,CLOSE,Y,,NO,CHATHAM
23-53518,TA24 Spring: E-6575 - Pre T/A Inspection,E-6575,E-6575,1580,,,12-20-23 11:14 AM,2023-12-20T11:14:00.000Z,5-20-24 10:21 AM,2024-05-20T10:21:00.000Z,5-23-24 3:09 PM,2024-05-23T15:09:00.000Z,4,4,,CO,CLOSE,Y,,NO,CHATHAM
23-53517,TA24 Spring - MOC16-070 - Remove LG-13317,LG-13317,LG-13317,2952,,,12-20-23 11:11 AM,2023-12-20T11:11:00.000Z,5-31-24 10:42 AM,2024-05-31T10:42:00.000Z,8-9-24 9:13 AM,2024-08-09T09:13:00.000Z,4,4,,CO,CLOSE,Y,,NO,CHATHAM
23-53516,TA24-fall-MOC23-042 - LG15414 Removal,LG-15414,LG-15414,2955,,,12-20-23 11:08 AM,2023-12-20T11:08:00.000Z,10-31-24 11:03 AM,2024-10-31T11:03:00.000Z,10-30-24 10:48 AM,2024-10-30T10:48:00.000Z,4,4,,CO,CLOSE,Y,,NO,CHATHAM
23-53515,TA24 Spring - Clean out TK1901 solids,TK-1901,TK-1901,5474,,,12-20-23 10:59 AM,2023-12-20T10:59:00.000Z,5-10-24 3:12 PM,2024-05-10T15:12:00.000Z,5-22-24 10:48 AM,2024-05-22T10:48:00.000Z,4,4,,CO,CLOSE,Y,,NO,CHATHAM
23-53514,TA24 Spring - Clean out TK1902 solids after BC CIP,TK-1902,TK-1902,5475,,,12-20-23 10:57 AM,2023-12-20T10:57:00.000Z,5-2-24 5:00 PM,2024-05-02T17:00:00.000Z,5-22-24 10:49 AM,2024-05-22T10:49:00.000Z,4,4,,CO,CLOSE,Y,,NO,CHATHAM
23-53513,TA24 Spring - Clean out TK1902 solids before shutdown,TK-1902,TK-1902,5475,,,12-20-23 10:47 AM,2023-12-20T10:47:00.000Z,4-29-24 4:00 PM,2024-04-29T16:00:00.000Z,5-22-24 10:49 AM,2024-05-22T10:49:00.000Z,4,4,,CO,CLOSE,Y,,NO,CHATHAM
23-53512,"TA24 Spring: V-6582 - Open, Clean & Inspect",V-6582,V-6582,6337,,,12-20-23 10:45 AM,2023-12-20T10:45:00.000Z,5-20-24 10:54 AM,2024-05-20T10:54:00.000Z,5-24-24 10:09 AM,2024-05-24T10:09:00.000Z,4,4,,CO,CLOSE,Y,,NO,CHATHAM
23-53511,"TA24 Spring: V-6572 - Open, Clean & Inspect",V-6572,V-6572,6334,,,12-20-23 10:43 AM,2023-12-20T10:43:00.000Z,5-20-24 10:47 AM,2024-05-20T10:47:00.000Z,5-24-24 10:09 AM,2024-05-24T10:09:00.000Z,4,4,,CO,CLOSE,Y,,NO,CHATHAM
23-53510,TA 2024 - Replace PSV-69203 during SD,PSV-69203,PSV-69203,4575,,,12-20-23 10:38 AM,2023-12-20T10:38:00.000Z,4-22-24 10:40 AM,2024-04-22T10:40:00.000Z,5-15-24 9:05 AM,2024-05-15T09:05:00.000Z,4,4,,CO,CLOSE,Y,,NO,CHATHAM
23-53509,MOC23-073 MC3 Accuload Batch Weight Change,FT-39605,FT-39605,2074,,,12-20-23 10:07 AM,2023-12-20T10:07:00.000Z,12-29-23 2:13 PM,2023-12-29T14:13:00.000Z,12-19-23 8:00 AM,2023-12-19T08:00:00.000Z,4,4,,CO,CLOSE,Y,,NO,CHATHAM
23-53508,Birds getting into mcc-3806 room (repair flashing),MCC-3806,MCC-3806,3382,,,12-19-23 2:36 PM,2023-12-19T14:36:00.000Z,12-31-23 2:36 PM,2023-12-31T14:36:00.000Z,9-9-24 12:27 PM,2024-09-09T12:27:00.000Z,4,4,,CO,CLOSE,Y,,NO,CHATHAM
23-53506,Scaffold inspections,0000,0000,,,,12-19-23 2:01 PM,2023-12-19T14:01:00.000Z,12-31-24 2:01 PM,2024-12-31T14:01:00.000Z,6-26-25 10:07 PM,2025-06-26T22:07:00.000Z,4,4,,CO,CLOSE,Y,,NO,CHATHAM
23-53505,Test run & clean up work area,P-6562A,P-6562A,1104,,,12-19-23 11:33 AM,2023-12-19T11:33:00.000Z,12-21-23 4:20 PM,2023-12-21T16:20:00.000Z,1-8-24 6:34 AM,2024-01-08T06:34:00.000Z,1,1,,CO,CLOSE,Y,,NO,CHATHAM
23-53504,Re-install guards,P-6562A,P-6562A,1104,,,12-19-23 11:33 AM,2023-12-19T11:33:00.000Z,12-21-23 4:20 PM,2023-12-21T16:20:00.000Z,1-8-24 6:34 AM,2024-01-08T06:34:00.000Z,1,1,,CO,CLOSE,Y,,NO,CHATHAM
23-53503,Perform laser motor alignment as required,P-6562A,P-6562A,1104,,,12-19-23 11:33 AM,2023-12-19T11:33:00.000Z,12-21-23 4:20 PM,2023-12-21T16:20:00.000Z,1-8-24 6:34 AM,2024-01-08T06:34:00.000Z,1,1,,CO,CLOSE,Y,,NO,CHATHAM
23-53502,Re-connect motor electrically and bump test,P-6562A,P-6562A,1104,,,12-19-23 11:33 AM,2023-12-19T11:33:00.000Z,12-21-23 4:20 PM,2023-12-21T16:20:00.000Z,1-8-24 6:34 AM,2024-01-08T06:34:00.000Z,1,1,,CO,CLOSE,Y,,NO,CHATHAM
23-53501,Install replacement motor,P-6562A,P-6562A,1104,,,12-19-23 11:33 AM,2023-12-19T11:33:00.000Z,12-21-23 4:20 PM,2023-12-21T16:20:00.000Z,1-8-24 6:34 AM,2024-01-08T06:34:00.000Z,1,1,,CO,CLOSE,Y,,NO,CHATHAM
23-53500,Remove motor from base,P-6562A,P-6562A,1104,,,12-19-23 11:33 AM,2023-12-19T11:33:00.000Z,12-21-23 4:35 PM,2023-12-21T16:35:00.000Z,1-8-24 6:34 AM,2024-01-08T06:34:00.000Z,1,1,,CO,CLOSE,Y,,NO,CHATHAM
23-53499,Electrically disconnect motor,P-6562A,P-6562A,1104,,,12-19-23 11:33 AM,2023-12-19T11:33:00.000Z,12-21-23 4:50 PM,2023-12-21T16:50:00.000Z,1-8-24 6:34 AM,2024-01-08T06:34:00.000Z,1,1,,CO,CLOSE,Y,,NO,CHATHAM
23-53498,Lock out motor & get work permit,P-6562A,P-6562A,1104,,,12-19-23 11:33 AM,2023-12-19T11:33:00.000Z,12-21-23 4:35 PM,2023-12-21T16:35:00.000Z,1-8-24 6:34 AM,2024-01-08T06:34:00.000Z,1,1,,CO,CLOSE,Y,,NO,CHATHAM
23-53497,P-6562A Change out motor,P-6562A,P-6562A,1104,,,12-19-23 11:31 AM,2023-12-19T11:31:00.000Z,1-22-24 4:20 PM,2024-01-22T16:20:00.000Z,1-4-24 10:20 PM,2024-01-04T22:20:00.000Z,1,1,,CO,CLOSE,Y,N,NO,CHATHAM
23-53496,Troubleshooting Dryer A low temperature - check operating conditions of the gas train,H-1825,H-1825,2566,,,12-19-23 11:26 AM,2023-12-19T11:26:00.000Z,12-19-23 5:00 PM,2023-12-19T17:00:00.000Z,9-13-24 10:46 AM,2024-09-13T10:46:00.000Z,2,2,,CO,CLOSE,Y,,NO,CHATHAM
23-53495,Insulation required around gas regulator,T-4126,T-4126,5003,,,12-19-23 10:43 AM,2023-12-19T10:43:00.000Z,12-31-23 1:04 PM,2023-12-31T13:04:00.000Z,4-15-25 6:55 AM,2025-04-15T06:55:00.000Z,4,4,,CO,CLOSE,Y,,NO,CHATHAM
23-53494,Biothane Caustic Tank Valve Insulation,4100,4100,,,,12-19-23 10:42 AM,2023-12-19T10:42:00.000Z,12-30-23 4:12 PM,2023-12-30T16:12:00.000Z,3-11-25 1:42 PM,2025-03-11T13:42:00.000Z,4,4,,CO,CLOSE,Y,,NO,CHATHAM
23-53493,"Investigation needed to find steam leak in distillation, Elv. 112M",1590-PD-59B,1590-PD-59B,,,,12-19-23 10:40 AM,2023-12-19T10:40:00.000Z,1-12-24 11:08 AM,2024-01-12T11:08:00.000Z,4-6-25 10:49 PM,2025-04-06T22:49:00.000Z,4,4,,CO,CLOSE,Y,,NO,CHATHAM
23-53492,Close Manways,TK-1403,TK-1403,5465,,,12-19-23 8:59 AM,2023-12-19T08:59:00.000Z,,,6-10-24 10:42 AM,2024-06-10T10:42:00.000Z,4,4,,SD,CLOSE,Y,,NO,CHATHAM
23-53491,Remove Scaffold - Isolation #13,TK-1403,TK-1403,5465,,,12-19-23 8:59 AM,2023-12-19T08:59:00.000Z,,,6-10-24 10:42 AM,2024-06-10T10:42:00.000Z,4,4,,SD,CLOSE,Y,,NO,CHATHAM
23-53490,Remove Scaffold - CO2 Header Blanking,TK-1403,TK-1403,5465,,,12-19-23 8:59 AM,2023-12-19T08:59:00.000Z,,,6-10-24 10:42 AM,2024-06-10T10:42:00.000Z,4,4,,SD,CLOSE,Y,,NO,CHATHAM
23-53489,Remove scaffold CSE,TK-1403,TK-1403,5465,,,12-19-23 8:59 AM,2023-12-19T08:59:00.000Z,,,6-10-24 10:42 AM,2024-06-10T10:42:00.000Z,4,4,,SD,CLOSE,Y,,NO,CHATHAM
23-53488,De-blank tank,TK-1403,TK-1403,5465,,,12-19-23 8:59 AM,2023-12-19T08:59:00.000Z,,,6-10-24 10:42 AM,2024-06-10T10:42:00.000Z,4,4,,SD,CLOSE,Y,,NO,CHATHAM
23-53487,Reinstall LT-14504,TK-1403,TK-1403,5465,,,12-19-23 8:59 AM,2023-12-19T08:59:00.000Z,,,6-10-24 10:42 AM,2024-06-10T10:42:00.000Z,4,4,,SD,CLOSE,Y,,NO,CHATHAM
23-53486,Maintenace Inspection of Agitator (CSE),TK-1403,TK-1403,5465,,,12-19-23 8:59 AM,2023-12-19T08:59:00.000Z,,,6-10-24 10:42 AM,2024-06-10T10:42:00.000Z,4,4,,SD,CLOSE,Y,,NO,CHATHAM
23-53485,OPS inspection,TK-1403,TK-1403,5465,,,12-19-23 8:59 AM,2023-12-19T08:59:00.000Z,,,6-10-24 10:42 AM,2024-06-10T10:42:00.000Z,4,4,,SD,CLOSE,Y,,NO,CHATHAM
23-53484,"HPW inside of Tank (30,000psi) - CSE",TK-1403,TK-1403,5465,,,12-19-23 8:59 AM,2023-12-19T08:59:00.000Z,,,6-10-24 10:42 AM,2024-06-10T10:42:00.000Z,4,4,,SD,CLOSE,Y,,NO,CHATHAM
23-53483,Pull LT-14504 for Cleaning/Service/Calibration check,TK-1403,TK-1403,5465,,,12-19-23 8:59 AM,2023-12-19T08:59:00.000Z,,,6-10-24 10:42 AM,2024-06-10T10:42:00.000Z,4,4,,SD,CLOSE,Y,,NO,CHATHAM
23-53482,Blank Tank for Entry,TK-1403,TK-1403,5465,,,12-19-23 8:59 AM,2023-12-19T08:59:00.000Z,,,6-10-24 10:42 AM,2024-06-10T10:42:00.000Z,4,4,,SD,CLOSE,Y,,NO,CHATHAM
23-53481,Clean as much solids out as possible without entry,TK-1403,TK-1403,5465,,,12-19-23 8:59 AM,2023-12-19T08:59:00.000Z,,,6-10-24 10:42 AM,2024-06-10T10:42:00.000Z,4,4,,SD,CLOSE,Y,,NO,CHATHAM
23-53480,Transfer EDTA mixture in TK-1902 to Frac Tank(s),TK-1403,TK-1403,5465,,,12-19-23 8:59 AM,2023-12-19T08:59:00.000Z,,,6-10-24 10:42 AM,2024-06-10T10:42:00.000Z,4,4,,SD,CLOSE,Y,,NO,CHATHAM
23-53479,Install Venturi to help dissipate CO2 in the tank,TK-1403,TK-1403,5465,,,12-19-23 8:59 AM,2023-12-19T08:59:00.000Z,,,6-10-24 10:42 AM,2024-06-10T10:42:00.000Z,4,4,,SD,CLOSE,Y,,NO,CHATHAM
23-53478,Open Front and Back Manways,TK-1403,TK-1403,5465,,,12-19-23 8:59 AM,2023-12-19T08:59:00.000Z,,,6-10-24 10:42 AM,2024-06-10T10:42:00.000Z,4,4,,SD,CLOSE,Y,,NO,CHATHAM
23-53477,(Pre) Build Scaffold - CSE Access,TK-1403,TK-1403,5465,,,12-19-23 8:59 AM,2023-12-19T08:59:00.000Z,,,6-10-24 10:42 AM,2024-06-10T10:42:00.000Z,4,4,,SD,CLOSE,Y,,NO,CHATHAM
23-53476,(Pre) Build Scaffold - Isolation,TK-1403,TK-1403,5465,,,12-19-23 8:59 AM,2023-12-19T08:59:00.000Z,,,6-10-24 10:42 AM,2024-06-10T10:42:00.000Z,4,4,,SD,CLOSE,Y,,NO,CHATHAM
23-53475,(Pre) Build Scaffold - CO2 Header Blanking,TK-1403,TK-1403,5465,,,12-19-23 8:59 AM,2023-12-19T08:59:00.000Z,,,6-10-24 10:42 AM,2024-06-10T10:42:00.000Z,4,4,,SD,CLOSE,Y,,NO,CHATHAM
23-53474,[OPS - PREP] Duration,TK-1403,TK-1403,5465,,,12-19-23 8:59 AM,2023-12-19T08:59:00.000Z,,,6-10-24 10:42 AM,2024-06-10T10:42:00.000Z,4,4,,SD,CLOSE,Y,,NO,CHATHAM
23-53473,TA24 Spring - Internal Tank Inspection (TK-1400),TK-1400,TK-1400,,,,12-19-23 8:59 AM,2023-12-19T08:59:00.000Z,12-16-23 9:00 AM,2023-12-16T09:00:00.000Z,6-10-24 10:42 AM,2024-06-10T10:42:00.000Z,4,4,,CO,CLOSE,Y,N,NO,CHATHAM
23-53472,TA24 Fall- Install new Solenoid for Hammer Mill AB slide gates,BN-1201,BN-1201,1305,,,12-19-23 8:23 AM,2023-12-19T08:23:00.000Z,4-30-24 10:53 AM,2024-04-30T10:53:00.000Z,5-22-24 8:11 AM,2024-05-22T08:11:00.000Z,4,4,,CO,CLOSE,Y,,NO,CHATHAM
23-53471,Pump seal pot empty and air blowing into pump piping/process,P-1509A,P-1509A,1009,,,12-19-23 8:03 AM,2023-12-19T08:03:00.000Z,1-22-24 6:40 AM,2024-01-22T06:40:00.000Z,1-5-24 4:03 PM,2024-01-05T16:03:00.000Z,2,2,,RM,CLOSE,Y,,NO,CHATHAM
23-53470,New DDG camera not working,BU-GHR,BU-GHR,1323,,,12-19-23 6:54 AM,2023-12-19T06:54:00.000Z,12-29-23 12:55 PM,2023-12-29T12:55:00.000Z,4-10-24 9:58 AM,2024-04-10T09:58:00.000Z,4,4,,RM,CLOSE,Y,,NO,CHATHAM
23-53469,Corn Probe hose leaks,SA-2101,SA-2101,4865,,,12-19-23 6:51 AM,2023-12-19T06:51:00.000Z,12-31-23 2:38 PM,2023-12-31T14:38:00.000Z,1-2-24 11:39 AM,2024-01-02T11:39:00.000Z,4,4,,RM,CLOSE,Y,,NO,CHATHAM
23-53468,Gamma Scan RC3 - Suspected Tray Degradation,C-6571,C-6571,,,,12-19-23 6:47 AM,2023-12-19T06:47:00.000Z,1-19-24 11:43 AM,2024-01-19T11:43:00.000Z,,,4,4,,CO,WSCH,N,,NO,CHATHAM
23-53467,TE/TT-57212 out of range high (false reading),TE-57212,TE-57212,5149,,,12-19-23 6:44 AM,2023-12-19T06:44:00.000Z,1-12-24 11:38 AM,2024-01-12T11:38:00.000Z,12-27-23 1:42 PM,2023-12-27T13:42:00.000Z,4,4,,CO,CLOSE,Y,,NO,CHATHAM
23-53466,TA24 Spring - Install lights in permit huts,0000,0000,,,,12-19-23 6:43 AM,2023-12-19T06:43:00.000Z,4-30-24 2:27 PM,2024-04-30T14:27:00.000Z,4-17-24 4:27 PM,2024-04-17T16:27:00.000Z,4,4,,CO,CLOSE,Y,,NO,CHATHAM
23-53465,DROA - Inspect dust collector plenum,DC-1834,DC-1834,,,,12-18-23 3:50 PM,2023-12-18T15:50:00.000Z,4-30-24 2:07 PM,2024-04-30T14:07:00.000Z,1-31-24 4:37 PM,2024-01-31T16:37:00.000Z,4,4,,CO,CLOSE,Y,,NO,CHATHAM
23-53464,I/E - Fuel Accuload Ethernet between HMI and board loose or needs to be replaced.,FQIC-22201,FQIC-22201,1948,,,12-18-23 3:15 PM,2023-12-18T15:15:00.000Z,12-31-23 3:16 PM,2023-12-31T15:16:00.000Z,12-18-23 6:16 PM,2023-12-18T18:16:00.000Z,2,2,,CO,CLOSE,Y,,NO,CHATHAM
23-53463,DROA - Inspect TY-18117A,DR-1826,DR-1826,,,,12-18-23 2:26 PM,2023-12-18T14:26:00.000Z,5-31-24 8:42 AM,2024-05-31T08:42:00.000Z,1-15-24 10:55 AM,2024-01-15T10:55:00.000Z,4,4,,CO,CLOSE,Y,,NO,CHATHAM
23-53462,DROA - I/E -Clean FT18111 and FT18110 (Dryer Temp Troubleshooting),FT-18111,FT-18111,3612,Dryer A struggled to maintain burner temperature since roughly DEC 1 (after an unplanned electrical outage). After trying to troubleshoot the issue while  running the dryer (Unsuccessfully)  these probes caused the dryer to trip due to the discrepancy between the two probe readings. IE cleaned the probes noting a hard caramelized substance that had to be almost chipped off. Once the dryer was restarted the burner temp issue was resolved.,,12-18-23 2:19 PM,2023-12-18T14:19:00.000Z,12-22-23 1:13 PM,2023-12-22T13:13:00.000Z,12-18-23 3:59 PM,2023-12-18T15:59:00.000Z,2,2,,RM,CLOSE,Y,,NO,CHATHAM
23-53461,DROA - BL-1829 inspect aluminum air seal rings,BL-1829,BL-1829,,,,12-18-23 2:17 PM,2023-12-18T14:17:00.000Z,5-31-24 1:27 PM,2024-05-31T13:27:00.000Z,2-1-24 11:39 AM,2024-02-01T11:39:00.000Z,4,4,,CO,CLOSE,Y,,NO,CHATHAM
23-53457,Heavy phase hose needed to be changed out,CE-6601,CE-6601,1386,'-changed out Heavy phase hose,,12-18-23 8:00 AM,2023-12-18T08:00:00.000Z,,,12-18-23 5:00 PM,2023-12-18T17:00:00.000Z,1,1,,RM,CLOSE,Y,,NO,CHATHAM
23-53456,Condensate line on heaters need to be cleaned.,1700,1700,,Condensate lines/ trap/ strainer were clean,,12-18-23 7:50 AM,2023-12-18T07:50:00.000Z,1-21-24 1:10 PM,2024-01-21T13:10:00.000Z,1-29-24 12:30 PM,2024-01-29T12:30:00.000Z,4,4,,CO,CLOSE,Y,,NO,CHATHAM
23-53455,Build shelter around P-1610 while seal on water,P-1610,P-1610,1053,,,12-18-23 7:45 AM,2023-12-18T07:45:00.000Z,12-8-23 11:44 AM,2023-12-08T11:44:00.000Z,12-18-23 7:46 AM,2023-12-18T07:46:00.000Z,2,2,,CO,CLOSE,Y,,NO,CHATHAM
23-53454,Remove and inspect P-1603B,P-1603B,P-1603B,1166,,,12-18-23 7:43 AM,2023-12-18T07:43:00.000Z,12-8-23 2:04 PM,2023-12-08T14:04:00.000Z,12-18-23 7:43 AM,2023-12-18T07:43:00.000Z,2,2,,CO,CLOSE,Y,,NO,CHATHAM
23-53453,Install air maintenance device for distillation deluge,3100,3100,,,,12-18-23 7:41 AM,2023-12-18T07:41:00.000Z,1-21-24 7:45 AM,2024-01-21T07:45:00.000Z,1-2-24 7:33 AM,2024-01-02T07:33:00.000Z,4,4,,CO,CLOSE,Y,,NO,CHATHAM
23-53452,Re-insulate boiler mud drums,B-3601,B-3601,1271,completed under timesheet 100720,,12-18-23 7:34 AM,2023-12-18T07:34:00.000Z,12-28-23 5:17 AM,2023-12-28T05:17:00.000Z,12-21-23 4:16 PM,2023-12-21T16:16:00.000Z,4,4,,CO,CLOSE,Y,,NO,CHATHAM
23-53451,H2S monitor at sewer keeps faulting,AT-41206,AT-41206,,,,12-18-23 7:32 AM,2023-12-18T07:32:00.000Z,12-20-23 4:46 PM,2023-12-20T16:46:00.000Z,12-18-23 8:49 PM,2023-12-18T20:49:00.000Z,2,2,,CO,CLOSE,Y,,NO,CHATHAM
23-53311,SCREW CONVEYOR P.M.,CV-1716,CV-1716,,,,12-18-23 1:51 AM,2023-12-18T01:51:00.000Z,1-10-24 9:00 AM,2024-01-10T09:00:00.000Z,5-27-24 9:31 AM,2024-05-27T09:31:00.000Z,4,4,,PM,CLOSE,Y,,NO,CHATHAM
23-53310,CV-1716 PM and inspection,CV-1716,CV-1716,,,,12-18-23 1:51 AM,2023-12-18T01:51:00.000Z,4-30-24 10:30 AM,2024-04-30T10:30:00.000Z,5-27-24 9:31 AM,2024-05-27T09:31:00.000Z,4,4,,PM,CLOSE,Y,N,NO,CHATHAM
23-53309,INSPECT GEAR REDUCER,CV-1836,CV-1836,,,,12-18-23 1:51 AM,2023-12-18T01:51:00.000Z,1-10-24 7:00 AM,2024-01-10T07:00:00.000Z,5-27-24 9:31 AM,2024-05-27T09:31:00.000Z,4,4,,PM,CLOSE,Y,,NO,CHATHAM
23-53308,"INSPECT SPROCKETS, CHAIN AND TAKEUP",CV-1836,CV-1836,,,,12-18-23 1:51 AM,2023-12-18T01:51:00.000Z,1-10-24 7:00 AM,2024-01-10T07:00:00.000Z,5-27-24 9:31 AM,2024-05-27T09:31:00.000Z,4,4,,PM,CLOSE,Y,,NO,CHATHAM
23-53307,INSPECT NUTS AND BOLTS ON TROUGH SECTIONS,CV-1836,CV-1836,,,,12-18-23 1:51 AM,2023-12-18T01:51:00.000Z,1-10-24 7:00 AM,2024-01-10T07:00:00.000Z,5-27-24 9:31 AM,2024-05-27T09:31:00.000Z,4,4,,PM,CLOSE,Y,,NO,CHATHAM
23-53306,INSPECT FLIGHTS,CV-1836,CV-1836,,,,12-18-23 1:51 AM,2023-12-18T01:51:00.000Z,1-10-24 7:00 AM,2024-01-10T07:00:00.000Z,5-27-24 9:31 AM,2024-05-27T09:31:00.000Z,4,4,,PM,CLOSE,Y,,NO,CHATHAM
23-53305,INSPECT HEAD / TAIL SHAFTS,CV-1836,CV-1836,,,,12-18-23 1:51 AM,2023-12-18T01:51:00.000Z,1-10-24 7:00 AM,2024-01-10T07:00:00.000Z,5-27-24 9:31 AM,2024-05-27T09:31:00.000Z,4,4,,PM,CLOSE,Y,,NO,CHATHAM
23-53304,CHECK TROUGH WEAR / ALIGNMENT AND SEALS,CV-1836,CV-1836,,,,12-18-23 1:51 AM,2023-12-18T01:51:00.000Z,1-10-24 7:00 AM,2024-01-10T07:00:00.000Z,5-27-24 9:31 AM,2024-05-27T09:31:00.000Z,4,4,,PM,CLOSE,Y,,NO,CHATHAM
23-53303,CV-1836 MECHANICAL PM,CV-1836,CV-1836,,,,12-18-23 1:51 AM,2023-12-18T01:51:00.000Z,4-30-24 10:00 AM,2024-04-30T10:00:00.000Z,5-27-24 9:31 AM,2024-05-27T09:31:00.000Z,4,4,,PM,CLOSE,Y,N,NO,CHATHAM
23-53302,INSPECT CONVEYOR TROUGH,CV-1834,CV-1834,,,,12-18-23 1:51 AM,2023-12-18T01:51:00.000Z,1-10-24 7:00 AM,2024-01-10T07:00:00.000Z,5-27-24 9:30 AM,2024-05-27T09:30:00.000Z,4,4,,PM,CLOSE,Y,,NO,CHATHAM
23-53301,INSPECT SCREW CONVEYOR,CV-1834,CV-1834,,,,12-18-23 1:51 AM,2023-12-18T01:51:00.000Z,1-10-24 7:00 AM,2024-01-10T07:00:00.000Z,5-27-24 9:30 AM,2024-05-27T09:30:00.000Z,4,4,,PM,CLOSE,Y,,NO,CHATHAM
23-53300,INSPECT GEARBOX,CV-1834,CV-1834,,,,12-18-23 1:51 AM,2023-12-18T01:51:00.000Z,1-10-24 7:00 AM,2024-01-10T07:00:00.000Z,5-27-24 9:30 AM,2024-05-27T09:30:00.000Z,4,4,,PM,CLOSE,Y,,NO,CHATHAM
23-53299,INSPECT PILLOW BLOCK BEARINGS,CV-1834,CV-1834,,,,12-18-23 1:51 AM,2023-12-18T01:51:00.000Z,1-10-24 7:00 AM,2024-01-10T07:00:00.000Z,5-27-24 9:30 AM,2024-05-27T09:30:00.000Z,4,4,,PM,CLOSE,Y,,NO,CHATHAM
23-53298,INSPECT TROUGH GASKETS FOR LEAKAGE,CV-1834,CV-1834,,,,12-18-23 1:51 AM,2023-12-18T01:51:00.000Z,1-10-24 7:00 AM,2024-01-10T07:00:00.000Z,5-27-24 9:30 AM,2024-05-27T09:30:00.000Z,4,4,,PM,CLOSE,Y,,NO,CHATHAM
23-53297,CHECK COUPLING BOLTS,CV-1834,CV-1834,,,,12-18-23 1:51 AM,2023-12-18T01:51:00.000Z,1-10-24 7:00 AM,2024-01-10T07:00:00.000Z,5-27-24 9:30 AM,2024-05-27T09:30:00.000Z,4,4,,PM,CLOSE,Y,,NO,CHATHAM
23-53296,CV-1834 MECHANICAL PM,CV-1834,CV-1834,,,,12-18-23 1:51 AM,2023-12-18T01:51:00.000Z,4-30-24 10:00 AM,2024-04-30T10:00:00.000Z,5-27-24 9:30 AM,2024-05-27T09:30:00.000Z,4,4,,PM,CLOSE,Y,N,NO,CHATHAM
23-53295,INSPECT GEAR REDUCER,CV-1835,CV-1835,,,,12-18-23 1:51 AM,2023-12-18T01:51:00.000Z,1-10-24 7:00 AM,2024-01-10T07:00:00.000Z,5-27-24 9:30 AM,2024-05-27T09:30:00.000Z,4,4,,PM,CLOSE,Y,,NO,CHATHAM
23-53294,"INSPECT SPROCKETS, CHAIN AND TAKEUP",CV-1835,CV-1835,,,,12-18-23 1:51 AM,2023-12-18T01:51:00.000Z,1-10-24 7:00 AM,2024-01-10T07:00:00.000Z,5-27-24 9:30 AM,2024-05-27T09:30:00.000Z,4,4,,PM,CLOSE,Y,,NO,CHATHAM
23-53293,INSPECT NUTS AND BOLTS ON TROUGH SECTIONS,CV-1835,CV-1835,,,,12-18-23 1:51 AM,2023-12-18T01:51:00.000Z,1-10-24 7:00 AM,2024-01-10T07:00:00.000Z,5-27-24 9:30 AM,2024-05-27T09:30:00.000Z,4,4,,PM,CLOSE,Y,,NO,CHATHAM
23-53292,INSPECT FLIGHTS,CV-1835,CV-1835,,,,12-18-23 1:51 AM,2023-12-18T01:51:00.000Z,1-10-24 7:00 AM,2024-01-10T07:00:00.000Z,5-27-24 9:30 AM,2024-05-27T09:30:00.000Z,4,4,,PM,CLOSE,Y,,NO,CHATHAM
23-53291,INSPECT HEAD / TAIL SHAFTS,CV-1835,CV-1835,,,,12-18-23 1:51 AM,2023-12-18T01:51:00.000Z,1-10-24 7:00 AM,2024-01-10T07:00:00.000Z,5-27-24 9:30 AM,2024-05-27T09:30:00.000Z,4,4,,PM,CLOSE,Y,,NO,CHATHAM
23-53290,CHECK TROUGH WEAR / ALIGNMENT AND SEALS,CV-1835,CV-1835,,,,12-18-23 1:51 AM,2023-12-18T01:51:00.000Z,1-10-24 7:00 AM,2024-01-10T07:00:00.000Z,5-27-24 9:30 AM,2024-05-27T09:30:00.000Z,4,4,,PM,CLOSE,Y,,NO,CHATHAM
23-53289,CV-1835 MECHANICAL PM,CV-1835,CV-1835,,,,12-18-23 1:51 AM,2023-12-18T01:51:00.000Z,4-30-24 10:00 AM,2024-04-30T10:00:00.000Z,5-27-24 9:30 AM,2024-05-27T09:30:00.000Z,4,4,,PM,CLOSE,Y,N,NO,CHATHAM
23-53288,INSPECT CONVEYOR TROUGH,CV-1833,CV-1833,,,,12-18-23 1:51 AM,2023-12-18T01:51:00.000Z,1-10-24 7:00 AM,2024-01-10T07:00:00.000Z,5-27-24 9:29 AM,2024-05-27T09:29:00.000Z,4,4,,PM,CLOSE,Y,,NO,CHATHAM
23-53287,INSPECT SCREW CONVEYOR,CV-1833,CV-1833,,,,12-18-23 1:51 AM,2023-12-18T01:51:00.000Z,1-10-24 7:00 AM,2024-01-10T07:00:00.000Z,5-27-24 9:29 AM,2024-05-27T09:29:00.000Z,4,4,,PM,CLOSE,Y,,NO,CHATHAM
23-53286,INSPECT GEARBOX,CV-1833,CV-1833,,,,12-18-23 1:51 AM,2023-12-18T01:51:00.000Z,1-10-24 7:00 AM,2024-01-10T07:00:00.000Z,5-27-24 9:29 AM,2024-05-27T09:29:00.000Z,4,4,,PM,CLOSE,Y,,NO,CHATHAM
23-53285,INSPECT PILLOW BLOCK BEARINGS,CV-1833,CV-1833,,,,12-18-23 1:51 AM,2023-12-18T01:51:00.000Z,1-10-24 7:00 AM,2024-01-10T07:00:00.000Z,5-27-24 9:29 AM,2024-05-27T09:29:00.000Z,4,4,,PM,CLOSE,Y,,NO,CHATHAM
23-53284,INSPECT TROUGH GASKETS FOR LEAKAGE,CV-1833,CV-1833,,,,12-18-23 1:51 AM,2023-12-18T01:51:00.000Z,1-10-24 7:00 AM,2024-01-10T07:00:00.000Z,5-27-24 9:29 AM,2024-05-27T09:29:00.000Z,4,4,,PM,CLOSE,Y,,NO,CHATHAM
23-53283,CHECK COUPLING BOLTS,CV-1833,CV-1833,,,,12-18-23 1:51 AM,2023-12-18T01:51:00.000Z,1-10-24 7:00 AM,2024-01-10T07:00:00.000Z,5-27-24 9:29 AM,2024-05-27T09:29:00.000Z,4,4,,PM,CLOSE,Y,,NO,CHATHAM
23-53282,CV-1833 MECHANICAL PM,CV-1833,CV-1833,,,,12-18-23 1:51 AM,2023-12-18T01:51:00.000Z,4-30-24 10:00 AM,2024-04-30T10:00:00.000Z,5-27-24 9:29 AM,2024-05-27T09:29:00.000Z,4,4,,PM,CLOSE,Y,N,NO,CHATHAM
23-53281,INSPECT CONVEYOR TROUGH,CV-1832,CV-1832,,,,12-18-23 1:51 AM,2023-12-18T01:51:00.000Z,1-10-24 7:00 AM,2024-01-10T07:00:00.000Z,5-27-24 9:29 AM,2024-05-27T09:29:00.000Z,4,4,,PM,CLOSE,Y,,NO,CHATHAM
23-53280,INSPECT SCREW CONVEYOR,CV-1832,CV-1832,,,,12-18-23 1:51 AM,2023-12-18T01:51:00.000Z,1-10-24 7:00 AM,2024-01-10T07:00:00.000Z,5-27-24 9:29 AM,2024-05-27T09:29:00.000Z,4,4,,PM,CLOSE,Y,,NO,CHATHAM
23-53279,INSPECT GEARBOX,CV-1832,CV-1832,,,,12-18-23 1:51 AM,2023-12-18T01:51:00.000Z,1-10-24 7:00 AM,2024-01-10T07:00:00.000Z,5-27-24 9:29 AM,2024-05-27T09:29:00.000Z,4,4,,PM,CLOSE,Y,,NO,CHATHAM
23-53278,INSPECT PILLOW BLOCK BEARINGS,CV-1832,CV-1832,,,,12-18-23 1:51 AM,2023-12-18T01:51:00.000Z,1-10-24 7:00 AM,2024-01-10T07:00:00.000Z,5-27-24 9:29 AM,2024-05-27T09:29:00.000Z,4,4,,PM,CLOSE,Y,,NO,CHATHAM
23-53277,INSPECT TROUGH GASKETS FOR LEAKAGE,CV-1832,CV-1832,,,,12-18-23 1:51 AM,2023-12-18T01:51:00.000Z,1-10-24 7:00 AM,2024-01-10T07:00:00.000Z,5-27-24 9:29 AM,2024-05-27T09:29:00.000Z,4,4,,PM,CLOSE,Y,,NO,CHATHAM
23-53276,CHECK COUPLING BOLTS,CV-1832,CV-1832,,,,12-18-23 1:51 AM,2023-12-18T01:51:00.000Z,1-10-24 7:00 AM,2024-01-10T07:00:00.000Z,5-27-24 9:29 AM,2024-05-27T09:29:00.000Z,4,4,,PM,CLOSE,Y,,NO,CHATHAM
23-53275,CV-1832 MECHANICAL PM,CV-1832,CV-1832,,,,12-18-23 1:51 AM,2023-12-18T01:51:00.000Z,4-30-24 10:00 AM,2024-04-30T10:00:00.000Z,5-27-24 9:29 AM,2024-05-27T09:29:00.000Z,4,4,,PM,CLOSE,Y,N,NO,CHATHAM
23-53274,INSPECT CONVEYOR TROUGH,CV-1831,CV-1831,,,,12-18-23 1:50 AM,2023-12-18T01:50:00.000Z,1-10-24 7:00 AM,2024-01-10T07:00:00.000Z,5-27-24 9:29 AM,2024-05-27T09:29:00.000Z,4,4,,PM,CLOSE,Y,,NO,CHATHAM
23-53273,INSPECT SCREW CONVEYOR,CV-1831,CV-1831,,,,12-18-23 1:50 AM,2023-12-18T01:50:00.000Z,1-10-24 7:00 AM,2024-01-10T07:00:00.000Z,5-27-24 9:29 AM,2024-05-27T09:29:00.000Z,4,4,,PM,CLOSE,Y,,NO,CHATHAM
23-53272,INSPECT GEARBOX,CV-1831,CV-1831,,,,12-18-23 1:50 AM,2023-12-18T01:50:00.000Z,1-10-24 7:00 AM,2024-01-10T07:00:00.000Z,5-27-24 9:29 AM,2024-05-27T09:29:00.000Z,4,4,,PM,CLOSE,Y,,NO,CHATHAM
23-53271,INSPECT PILLOW BLOCK BEARINGS,CV-1831,CV-1831,,,,12-18-23 1:50 AM,2023-12-18T01:50:00.000Z,1-10-24 7:00 AM,2024-01-10T07:00:00.000Z,5-27-24 9:29 AM,2024-05-27T09:29:00.000Z,4,4,,PM,CLOSE,Y,,NO,CHATHAM
23-53270,INSPECT TROUGH GASKETS FOR LEAKAGE,CV-1831,CV-1831,,,,12-18-23 1:50 AM,2023-12-18T01:50:00.000Z,1-10-24 7:00 AM,2024-01-10T07:00:00.000Z,5-27-24 9:29 AM,2024-05-27T09:29:00.000Z,4,4,,PM,CLOSE,Y,,NO,CHATHAM
23-53269,CHECK COUPLING BOLTS,CV-1831,CV-1831,,,,12-18-23 1:50 AM,2023-12-18T01:50:00.000Z,1-10-24 7:00 AM,2024-01-10T07:00:00.000Z,5-27-24 9:29 AM,2024-05-27T09:29:00.000Z,4,4,,PM,CLOSE,Y,,NO,CHATHAM
23-53268,CV-1831 MECHANICAL PM,CV-1831,CV-1831,,,,12-18-23 1:50 AM,2023-12-18T01:50:00.000Z,4-30-24 10:00 AM,2024-04-30T10:00:00.000Z,5-27-24 9:29 AM,2024-05-27T09:29:00.000Z,4,4,,PM,CLOSE,Y,N,NO,CHATHAM
23-53267,INSPECT CONVEYOR TROUGH,CV-1830,CV-1830,,,,12-18-23 1:50 AM,2023-12-18T01:50:00.000Z,1-10-24 7:00 AM,2024-01-10T07:00:00.000Z,5-27-24 9:28 AM,2024-05-27T09:28:00.000Z,4,4,,PM,CLOSE,Y,,NO,CHATHAM
23-53266,INSPECT SCREW CONVEYOR,CV-1830,CV-1830,,,,12-18-23 1:50 AM,2023-12-18T01:50:00.000Z,1-10-24 7:00 AM,2024-01-10T07:00:00.000Z,5-27-24 9:28 AM,2024-05-27T09:28:00.000Z,4,4,,PM,CLOSE,Y,,NO,CHATHAM
23-53265,INSPECT GEARBOX,CV-1830,CV-1830,,,,12-18-23 1:50 AM,2023-12-18T01:50:00.000Z,1-10-24 7:00 AM,2024-01-10T07:00:00.000Z,5-27-24 9:28 AM,2024-05-27T09:28:00.000Z,4,4,,PM,CLOSE,Y,,NO,CHATHAM
23-53264,INSPECT PILLOW BLOCK BEARINGS,CV-1830,CV-1830,,,,12-18-23 1:50 AM,2023-12-18T01:50:00.000Z,1-10-24 7:00 AM,2024-01-10T07:00:00.000Z,5-27-24 9:28 AM,2024-05-27T09:28:00.000Z,4,4,,PM,CLOSE,Y,,NO,CHATHAM
23-53263,INSPECT TROUGH GASKETS FOR LEAKAGE,CV-1830,CV-1830,,,,12-18-23 1:50 AM,2023-12-18T01:50:00.000Z,1-10-24 7:00 AM,2024-01-10T07:00:00.000Z,5-27-24 9:28 AM,2024-05-27T09:28:00.000Z,4,4,,PM,CLOSE,Y,,NO,CHATHAM
23-53262,CHECK COUPLING BOLTS,CV-1830,CV-1830,,,,12-18-23 1:50 AM,2023-12-18T01:50:00.000Z,1-10-24 7:00 AM,2024-01-10T07:00:00.000Z,5-27-24 9:28 AM,2024-05-27T09:28:00.000Z,4,4,,PM,CLOSE,Y,,NO,CHATHAM
23-53261,CV-1830 MECHANICAL PM,CV-1830,CV-1830,,,,12-18-23 1:50 AM,2023-12-18T01:50:00.000Z,4-30-24 10:00 AM,2024-04-30T10:00:00.000Z,5-27-24 9:28 AM,2024-05-27T09:28:00.000Z,4,4,,PM,CLOSE,Y,N,NO,CHATHAM
23-53260,INSPECT CONVEYOR TROUGH,CV-1828,CV-1828,,,,12-18-23 1:50 AM,2023-12-18T01:50:00.000Z,1-10-24 7:00 AM,2024-01-10T07:00:00.000Z,5-27-24 9:28 AM,2024-05-27T09:28:00.000Z,4,4,,PM,CLOSE,Y,,NO,CHATHAM
23-53259,INSPECT SCREW CONVEYOR,CV-1828,CV-1828,,,,12-18-23 1:50 AM,2023-12-18T01:50:00.000Z,1-10-24 7:00 AM,2024-01-10T07:00:00.000Z,5-27-24 9:28 AM,2024-05-27T09:28:00.000Z,4,4,,PM,CLOSE,Y,,NO,CHATHAM
23-53258,INSPECT GEARBOX,CV-1828,CV-1828,,,,12-18-23 1:50 AM,2023-12-18T01:50:00.000Z,1-10-24 7:00 AM,2024-01-10T07:00:00.000Z,5-27-24 9:28 AM,2024-05-27T09:28:00.000Z,4,4,,PM,CLOSE,Y,,NO,CHATHAM
23-53257,INSPECT PILLOW BLOCK BEARINGS,CV-1828,CV-1828,,,,12-18-23 1:50 AM,2023-12-18T01:50:00.000Z,1-10-24 7:00 AM,2024-01-10T07:00:00.000Z,5-27-24 9:28 AM,2024-05-27T09:28:00.000Z,4,4,,PM,CLOSE,Y,,NO,CHATHAM
23-53256,INSPECT TROUGH GASKETS FOR LEAKAGE,CV-1828,CV-1828,,,,12-18-23 1:50 AM,2023-12-18T01:50:00.000Z,1-10-24 7:00 AM,2024-01-10T07:00:00.000Z,5-27-24 9:28 AM,2024-05-27T09:28:00.000Z,4,4,,PM,CLOSE,Y,,NO,CHATHAM
23-53255,CHECK COUPLING BOLTS,CV-1828,CV-1828,,,,12-18-23 1:50 AM,2023-12-18T01:50:00.000Z,1-10-24 7:00 AM,2024-01-10T07:00:00.000Z,5-27-24 9:28 AM,2024-05-27T09:28:00.000Z,4,4,,PM,CLOSE,Y,,NO,CHATHAM
23-53254,CV-1828 MECHANICAL PM,CV-1828,CV-1828,,,,12-18-23 1:50 AM,2023-12-18T01:50:00.000Z,4-30-24 10:00 AM,2024-04-30T10:00:00.000Z,5-27-24 9:28 AM,2024-05-27T09:28:00.000Z,4,4,,PM,CLOSE,Y,N,NO,CHATHAM
23-53253,INSPECT CONVEYOR TROUGH,CV-1827,CV-1827,,,,12-18-23 1:50 AM,2023-12-18T01:50:00.000Z,1-10-24 7:00 AM,2024-01-10T07:00:00.000Z,5-27-24 9:28 AM,2024-05-27T09:28:00.000Z,4,4,,PM,CLOSE,Y,,NO,CHATHAM
23-53252,INSPECT SCREW CONVEYOR,CV-1827,CV-1827,,,,12-18-23 1:50 AM,2023-12-18T01:50:00.000Z,1-10-24 7:00 AM,2024-01-10T07:00:00.000Z,5-27-24 9:28 AM,2024-05-27T09:28:00.000Z,4,4,,PM,CLOSE,Y,,NO,CHATHAM
23-53251,INSPECT GEARBOX,CV-1827,CV-1827,,,,12-18-23 1:50 AM,2023-12-18T01:50:00.000Z,1-10-24 7:00 AM,2024-01-10T07:00:00.000Z,5-27-24 9:28 AM,2024-05-27T09:28:00.000Z,4,4,,PM,CLOSE,Y,,NO,CHATHAM
23-53250,INSPECT PILLOW BLOCK BEARINGS,CV-1827,CV-1827,,,,12-18-23 1:50 AM,2023-12-18T01:50:00.000Z,1-10-24 7:00 AM,2024-01-10T07:00:00.000Z,5-27-24 9:28 AM,2024-05-27T09:28:00.000Z,4,4,,PM,CLOSE,Y,,NO,CHATHAM
23-53249,INSPECT TROUGH GASKETS FOR LEAKAGE,CV-1827,CV-1827,,,,12-18-23 1:50 AM,2023-12-18T01:50:00.000Z,1-10-24 7:00 AM,2024-01-10T07:00:00.000Z,5-27-24 9:28 AM,2024-05-27T09:28:00.000Z,4,4,,PM,CLOSE,Y,,NO,CHATHAM
23-53248,CHECK COUPLING BOLTS,CV-1827,CV-1827,,,,12-18-23 1:50 AM,2023-12-18T01:50:00.000Z,1-10-24 7:00 AM,2024-01-10T07:00:00.000Z,5-27-24 9:28 AM,2024-05-27T09:28:00.000Z,4,4,,PM,CLOSE,Y,,NO,CHATHAM
23-53247,CV-1827 MECHANICAL PM,CV-1827,CV-1827,,,,12-18-23 1:50 AM,2023-12-18T01:50:00.000Z,4-30-24 10:00 AM,2024-04-30T10:00:00.000Z,5-27-24 9:28 AM,2024-05-27T09:28:00.000Z,4,4,,PM,CLOSE,Y,N,NO,CHATHAM
23-53246,INSPECT CONVEYOR TROUGH,CV-1826A,CV-1826A,,,,12-18-23 1:50 AM,2023-12-18T01:50:00.000Z,1-10-24 7:00 AM,2024-01-10T07:00:00.000Z,5-27-24 9:27 AM,2024-05-27T09:27:00.000Z,4,4,,PM,CLOSE,Y,,NO,CHATHAM
23-53245,INSPECT SCREW CONVEYOR,CV-1826A,CV-1826A,,,,12-18-23 1:50 AM,2023-12-18T01:50:00.000Z,1-10-24 7:00 AM,2024-01-10T07:00:00.000Z,5-27-24 9:27 AM,2024-05-27T09:27:00.000Z,4,4,,PM,CLOSE,Y,,NO,CHATHAM
23-53244,INSPECT GEARBOX,CV-1826A,CV-1826A,,,,12-18-23 1:50 AM,2023-12-18T01:50:00.000Z,1-10-24 7:00 AM,2024-01-10T07:00:00.000Z,5-27-24 9:27 AM,2024-05-27T09:27:00.000Z,4,4,,PM,CLOSE,Y,,NO,CHATHAM
23-53243,INSPECT PILLOW BLOCK BEARINGS,CV-1826A,CV-1826A,,,,12-18-23 1:50 AM,2023-12-18T01:50:00.000Z,1-10-24 7:00 AM,2024-01-10T07:00:00.000Z,5-27-24 9:27 AM,2024-05-27T09:27:00.000Z,4,4,,PM,CLOSE,Y,,NO,CHATHAM
23-53242,CHECK PACKING GLAND LUBRICANT.  ADD GREASE  AS NECESSARY,CV-1826A,CV-1826A,,,,12-18-23 1:50 AM,2023-12-18T01:50:00.000Z,1-10-24 7:00 AM,2024-01-10T07:00:00.000Z,5-27-24 9:27 AM,2024-05-27T09:27:00.000Z,4,4,,PM,CLOSE,Y,,NO,CHATHAM
23-53241,CHECK CONDITION OF THE PACKING IN THE STUFFING BOX,CV-1826A,CV-1826A,,,,12-18-23 1:50 AM,2023-12-18T01:50:00.000Z,1-10-24 7:00 AM,2024-01-10T07:00:00.000Z,5-27-24 9:27 AM,2024-05-27T09:27:00.000Z,4,4,,PM,CLOSE,Y,,NO,CHATHAM
23-53240,CV-1826A MECHANICAL PM,CV-1826A,CV-1826A,,,,12-18-23 1:50 AM,2023-12-18T01:50:00.000Z,4-30-24 10:00 AM,2024-04-30T10:00:00.000Z,5-27-24 9:27 AM,2024-05-27T09:27:00.000Z,4,4,,PM,CLOSE,Y,N,NO,CHATHAM
23-53239,PH PROBE CLEANING AND CALIBRATION WEEKLY PM,AT-84505,AT-84505,6885,,,12-18-23 1:50 AM,2023-12-18T01:50:00.000Z,1-11-24 1:00 AM,2024-01-11T01:00:00.000Z,1-11-24 10:20 AM,2024-01-11T10:20:00.000Z,4,4,,PM,CLOSE,Y,,NO,CHATHAM
23-53238,C-1803D pH Meter-Weekly PM,AT-84505,AT-84505,6885,,,12-18-23 1:50 AM,2023-12-18T01:50:00.000Z,1-11-24 12:00 AM,2024-01-11T00:00:00.000Z,1-11-24 12:45 AM,2024-01-11T00:45:00.000Z,4,4,,PM,CLOSE,Y,N,NO,CHATHAM
23-53237,H2S TRANSMITTER (AT-41208) BIOTHANE BUILDING GAS DETECTOR CALIBRATION,AT-41208,AT-41208,7712,,,12-18-23 1:50 AM,2023-12-18T01:50:00.000Z,1-9-24 1:00 AM,2024-01-09T01:00:00.000Z,1-10-24 8:26 AM,2024-01-10T08:26:00.000Z,4,4,,PM,CLOSE,Y,,NO,CHATHAM
23-53236,H2S  TRANSMITTER (AT-41208) BIOTHANE BUILDING GAS DETECTOR CALIBRATION,AT-41208,AT-41208,7712,,,12-18-23 1:50 AM,2023-12-18T01:50:00.000Z,1-9-24 1:00 AM,2024-01-09T01:00:00.000Z,1-9-24 1:00 AM,2024-01-09T01:00:00.000Z,4,4,,PM,CLOSE,Y,N,NO,CHATHAM
23-53235,"Area Asset Checks-1830, 1840, DDG Cooler",1800,1800,,,,12-18-23 1:50 AM,2023-12-18T01:50:00.000Z,1-15-24 12:00 AM,2024-01-15T00:00:00.000Z,1-17-24 4:03 PM,2024-01-17T16:03:00.000Z,4,4,,PM,CLOSE,Y,,NO,CHATHAM
23-53234,"Area Asset Checks-1830, 1840, DDG Cooler",1800,1800,,,,12-18-23 1:50 AM,2023-12-18T01:50:00.000Z,1-15-24 12:00 AM,2024-01-15T00:00:00.000Z,1-16-24 1:00 AM,2024-01-16T01:00:00.000Z,4,4,,PM,CLOSE,Y,N,NO,CHATHAM
23-53233,"Area Asset Checks-2200, 2300, 3200, 3600, 4100",2200,2200,,,,12-18-23 1:50 AM,2023-12-18T01:50:00.000Z,1-15-24 12:00 AM,2024-01-15T00:00:00.000Z,1-17-24 3:02 PM,2024-01-17T15:02:00.000Z,4,4,,PM,CLOSE,Y,,NO,CHATHAM
23-53232,"Area Asset Checks-2200, 2300, 3200, 3600, 4100",2200,2200,,,,12-18-23 1:50 AM,2023-12-18T01:50:00.000Z,1-15-24 12:00 AM,2024-01-15T00:00:00.000Z,1-17-24 1:00 AM,2024-01-17T01:00:00.000Z,4,4,,PM,CLOSE,Y,N,NO,CHATHAM
23-53231,"Area Asset Checks-1600, 1660, 1700 (Evaps, Corn oil, Decanyers)",1600,1600,,,,12-18-23 1:50 AM,2023-12-18T01:50:00.000Z,1-15-24 12:00 AM,2024-01-15T00:00:00.000Z,1-15-24 12:54 PM,2024-01-15T12:54:00.000Z,4,4,,PM,CLOSE,Y,,NO,CHATHAM
23-53230,"Area Asset Checks-1600, 1660, 1700",1600,1600,,,,12-18-23 1:50 AM,2023-12-18T01:50:00.000Z,1-15-24 12:00 AM,2024-01-15T00:00:00.000Z,1-15-24 1:00 AM,2024-01-15T01:00:00.000Z,4,4,,PM,CLOSE,Y,N,NO,CHATHAM
23-53229,"Area Asset Checks-1500, 6500 (Distillation)",1500,1500,,,,12-18-23 1:50 AM,2023-12-18T01:50:00.000Z,1-15-24 12:00 AM,2024-01-15T00:00:00.000Z,1-16-24 9:59 AM,2024-01-16T09:59:00.000Z,4,4,,PM,CLOSE,Y,,NO,CHATHAM
23-53228,"Area Asset Checks-1500, 6500",1500,1500,,,,12-18-23 1:50 AM,2023-12-18T01:50:00.000Z,1-15-24 12:00 AM,2024-01-15T00:00:00.000Z,1-15-24 12:30 AM,2024-01-15T00:30:00.000Z,4,4,,PM,CLOSE,Y,N,NO,CHATHAM
23-53227,"Area Asset Checks-2100, 1200, 1300, 1400 (Corn, Mill, Mash, Fermentation)",2100,2100,,,,12-18-23 1:50 AM,2023-12-18T01:50:00.000Z,1-15-24 2:30 AM,2024-01-15T02:30:00.000Z,1-17-24 3:02 PM,2024-01-17T15:02:00.000Z,4,4,,PM,CLOSE,Y,,NO,CHATHAM
23-53226,"Area Asset Checks-2100, 1200, 1300, 1400 (Corn, Mill, Mash, Fermentation)",2100,2100,,,,12-18-23 1:50 AM,2023-12-18T01:50:00.000Z,1-15-24 12:00 AM,2024-01-15T00:00:00.000Z,1-17-24 1:00 AM,2024-01-17T01:00:00.000Z,4,4,,PM,CLOSE,Y,N,NO,CHATHAM
23-53225,"Area Asset Checks-1830, 1840, DDG Cooler",1800,1800,,,,12-18-23 1:50 AM,2023-12-18T01:50:00.000Z,1-15-24 12:00 AM,2024-01-15T00:00:00.000Z,1-18-24 6:04 AM,2024-01-18T06:04:00.000Z,4,4,,PM,CLOSE,Y,,NO,CHATHAM
23-53224,"Area Asset Checks-1830, 1840, DDG Cooler",1800,1800,,,,12-18-23 1:50 AM,2023-12-18T01:50:00.000Z,1-15-24 12:00 AM,2024-01-15T00:00:00.000Z,1-16-24 1:00 AM,2024-01-16T01:00:00.000Z,4,4,,PM,CLOSE,Y,N,NO,CHATHAM
23-53223,"Area Asset Checks-2200, 2300, 3200, 3600, 4100",2200,2200,,,,12-18-23 1:50 AM,2023-12-18T01:50:00.000Z,1-15-24 12:00 AM,2024-01-15T00:00:00.000Z,1-16-24 6:17 AM,2024-01-16T06:17:00.000Z,4,4,,PM,CLOSE,Y,,NO,CHATHAM
23-53222,"Area Asset Checks-2200, 2300, 3200, 3600, 4100",2200,2200,,,,12-18-23 1:49 AM,2023-12-18T01:49:00.000Z,1-15-24 12:00 AM,2024-01-15T00:00:00.000Z,1-15-24 1:00 AM,2024-01-15T01:00:00.000Z,4,4,,PM,CLOSE,Y,N,NO,CHATHAM
23-53221,"Area Asset Checks-1600, 1660, 1700 (Evaps, Corn oil, Decanyers)",1600,1600,,,,12-18-23 1:49 AM,2023-12-18T01:49:00.000Z,1-15-24 12:00 AM,2024-01-15T00:00:00.000Z,1-22-24 7:09 AM,2024-01-22T07:09:00.000Z,4,4,,PM,CLOSE,Y,,NO,CHATHAM
23-53220,"Area Asset Checks-1600, 1660, 1700",1600,1600,,,,12-18-23 1:49 AM,2023-12-18T01:49:00.000Z,1-15-24 12:00 AM,2024-01-15T00:00:00.000Z,1-17-24 2:30 AM,2024-01-17T02:30:00.000Z,4,4,,PM,CLOSE,Y,N,NO,CHATHAM
23-53219,"Area Asset Checks-1500, 6500 (Distillation)",1500,1500,,,,12-18-23 1:49 AM,2023-12-18T01:49:00.000Z,1-15-24 12:00 AM,2024-01-15T00:00:00.000Z,1-17-24 3:11 PM,2024-01-17T15:11:00.000Z,4,4,,PM,CLOSE,Y,,NO,CHATHAM
23-53218,"Area Asset Checks-1500, 6500",1500,1500,,,,12-18-23 1:49 AM,2023-12-18T01:49:00.000Z,1-15-24 12:00 AM,2024-01-15T00:00:00.000Z,1-17-24 1:00 AM,2024-01-17T01:00:00.000Z,4,4,,PM,CLOSE,Y,N,NO,CHATHAM
23-53217,"Area Asset Checks-2100, 1200, 1300, 1400 (Corn, Mill, Mash, Fermentation)",2100,2100,,,,12-18-23 1:49 AM,2023-12-18T01:49:00.000Z,1-15-24 5:00 AM,2024-01-15T05:00:00.000Z,1-17-24 3:11 PM,2024-01-17T15:11:00.000Z,4,4,,PM,CLOSE,Y,,NO,CHATHAM
23-53216,"Area Asset Checks-2100, 1200, 1300, 1400 (Corn, Mill, Mash, Fermentation)",2100,2100,,,,12-18-23 1:49 AM,2023-12-18T01:49:00.000Z,1-15-24 12:00 AM,2024-01-15T00:00:00.000Z,1-17-24 2:00 AM,2024-01-17T02:00:00.000Z,4,4,,PM,CLOSE,Y,N,NO,CHATHAM
23-53215,BUCKET ELEVATOR PM,BE-2101,BE-2101,1279,,,12-18-23 1:49 AM,2023-12-18T01:49:00.000Z,4-14-24 12:00 AM,2024-04-14T00:00:00.000Z,5-16-24 9:49 AM,2024-05-16T09:49:00.000Z,4,4,,SD,CLOSE,Y,,NO,CHATHAM
23-53214,BE-2101 - MECHANICAL PM,BE-2101,BE-2101,1279,,,12-18-23 1:49 AM,2023-12-18T01:49:00.000Z,4-14-24 2:30 AM,2024-04-14T02:30:00.000Z,5-16-24 9:49 AM,2024-05-16T09:49:00.000Z,4,4,,SD,CLOSE,Y,N,NO,CHATHAM
23-53213,BL-1804D WEEKLY GREASING,BL-1804D,BL-1804D,,,,12-18-23 1:49 AM,2023-12-18T01:49:00.000Z,1-15-24 12:00 AM,2024-01-15T00:00:00.000Z,1-16-24 3:46 PM,2024-01-16T15:46:00.000Z,4,4,,PM,CLOSE,Y,,NO,CHATHAM
23-53212,BL-1804D - WEEKLY BEARING GREASING,BL-1804D,BL-1804D,,,,12-18-23 1:49 AM,2023-12-18T01:49:00.000Z,1-15-24 12:00 AM,2024-01-15T00:00:00.000Z,1-15-24 12:30 AM,2024-01-15T00:30:00.000Z,4,4,,PM,CLOSE,Y,N,NO,CHATHAM
23-53211,AMMONIA SENSORS BUMP TEST PM,2400,2400,,,,12-18-23 1:49 AM,2023-12-18T01:49:00.000Z,1-11-24 12:00 AM,2024-01-11T00:00:00.000Z,1-11-24 9:59 AM,2024-01-11T09:59:00.000Z,4,4,,PM,CLOSE,Y,,NO,CHATHAM
23-53210,PLANT WIDE AMMONIA SENSORS BUMP TEST PM,2400,2400,,,,12-18-23 1:49 AM,2023-12-18T01:49:00.000Z,1-11-24 12:00 AM,2024-01-11T00:00:00.000Z,1-11-24 12:45 AM,2024-01-11T00:45:00.000Z,4,4,,PM,CLOSE,Y,N,NO,CHATHAM
23-53209,5S AND STOCKROOM AUDIT-WEEKLY PM,MAINTENANCE,MAINTENANCE,,,,12-18-23 1:49 AM,2023-12-18T01:49:00.000Z,1-15-24 12:00 AM,2024-01-15T00:00:00.000Z,1-18-24 8:51 AM,2024-01-18T08:51:00.000Z,4,4,,PM,CLOSE,Y,N,NO,CHATHAM
23-53208,ME-3601A OIL COOLER CHANGE OUT -3Y,E-3602,E-3602,6955,,,12-18-23 1:49 AM,2023-12-18T01:49:00.000Z,5-4-26 12:00 AM,2026-05-04T00:00:00.000Z,,,4,4,,PM,WSCH,N,N,NO,CHATHAM
23-53207,BL-2101 REQUIRES POLYREX EM 24 GRAMS-0.85 OUNCES EVERY 40 DAYS,BL-2101,BL-2101,1295,,,12-18-23 1:49 AM,2023-12-18T01:49:00.000Z,1-15-24 12:00 AM,2024-01-15T00:00:00.000Z,1-17-24 1:38 PM,2024-01-17T13:38:00.000Z,4,4,,PM,CLOSE,Y,,NO,CHATHAM
23-53206,BL-2101 - BEARING GREASE PM,BL-2101,BL-2101,1295,,,12-18-23 1:49 AM,2023-12-18T01:49:00.000Z,1-15-24 12:00 AM,2024-01-15T00:00:00.000Z,1-15-24 2:00 AM,2024-01-15T02:00:00.000Z,4,4,,PM,CLOSE,Y,N,NO,CHATHAM
23-53205,BL-1201 REQUIRES POLYREX EM 24 GRAMS-0.85 OUNCES EVERY 40 DAYS,BL-1201,BL-1201,1285,,,12-18-23 1:49 AM,2023-12-18T01:49:00.000Z,1-15-24 12:00 AM,2024-01-15T00:00:00.000Z,1-17-24 1:38 PM,2024-01-17T13:38:00.000Z,4,4,,PM,CLOSE,Y,,NO,CHATHAM
23-53204,BL-1201 - MOTOR BEARING GREASING,BL-1201,BL-1201,1285,,,12-18-23 1:49 AM,2023-12-18T01:49:00.000Z,1-15-24 12:00 AM,2024-01-15T00:00:00.000Z,1-15-24 2:00 AM,2024-01-15T02:00:00.000Z,4,4,,PM,CLOSE,Y,N,NO,CHATHAM
23-53203,TOTE#5 (4) 100' EXPLOSION PROOF EXTENSION CORDS,CHATHAM,CHATHAM,,,,12-18-23 1:49 AM,2023-12-18T01:49:00.000Z,1-12-24 12:00 AM,2024-01-12T00:00:00.000Z,6-20-24 2:12 PM,2024-06-20T14:12:00.000Z,4,4,,PM,CLOSE,Y,,NO,CHATHAM
23-53202,"TOTE #4 (4) COATS, (4) BIBS, (10) GLOVES, HARD HAT LINERS, NECK WARMERS, (20) INFERNO PACKS",CHATHAM,CHATHAM,,,,12-18-23 1:49 AM,2023-12-18T01:49:00.000Z,1-12-24 12:00 AM,2024-01-12T00:00:00.000Z,6-20-24 2:12 PM,2024-06-20T14:12:00.000Z,4,4,,PM,CLOSE,Y,,NO,CHATHAM
23-53201,TOTE #3 (2) SNAKE INSULATION BLANKETS,CHATHAM,CHATHAM,,,,12-18-23 1:49 AM,2023-12-18T01:49:00.000Z,1-12-24 12:00 AM,2024-01-12T00:00:00.000Z,6-20-24 2:12 PM,2024-06-20T14:12:00.000Z,4,4,,PM,CLOSE,Y,,NO,CHATHAM
23-53200,TOTE #2 (2) SNAKE INSULATION BLANKETS,CHATHAM,CHATHAM,,,,12-18-23 1:49 AM,2023-12-18T01:49:00.000Z,1-12-24 12:00 AM,2024-01-12T00:00:00.000Z,6-20-24 2:12 PM,2024-06-20T14:12:00.000Z,4,4,,PM,CLOSE,Y,,NO,CHATHAM
23-53199,TOTE #1 250' PORTABLE HEAT TRACING,CHATHAM,CHATHAM,,,,12-18-23 1:49 AM,2023-12-18T01:49:00.000Z,1-12-24 12:00 AM,2024-01-12T00:00:00.000Z,6-20-24 2:12 PM,2024-06-20T14:12:00.000Z,4,4,,PM,CLOSE,Y,,NO,CHATHAM
23-53198,COLD WEATHER PLAN (TOTE INSPECTION/AUDIT),CHATHAM,CHATHAM,,,,12-18-23 1:49 AM,2023-12-18T01:49:00.000Z,1-12-24 1:00 AM,2024-01-12T01:00:00.000Z,6-20-24 2:12 PM,2024-06-20T14:12:00.000Z,4,4,,PM,CLOSE,Y,N,NO,CHATHAM
23-53197,Weekly Vibration check (GFE I/E),MI-1201A,MI-1201A,,,,12-18-23 1:49 AM,2023-12-18T01:49:00.000Z,1-11-24 12:00 AM,2024-01-11T00:00:00.000Z,1-12-24 11:07 AM,2024-01-12T11:07:00.000Z,4,4,,PM,CLOSE,Y,,NO,CHATHAM
23-53196,MI-1201A - GREASE CHANGE OUT,MI-1201A,MI-1201A,,,,12-18-23 1:49 AM,2023-12-18T01:49:00.000Z,1-11-24 12:00 AM,2024-01-11T00:00:00.000Z,1-12-24 11:07 AM,2024-01-12T11:07:00.000Z,4,4,,PM,CLOSE,Y,,NO,CHATHAM
23-53195,MI-1201A - WEEKLY PM & ROTATION CHANGE,MI-1201A,MI-1201A,,,,12-18-23 1:49 AM,2023-12-18T01:49:00.000Z,1-11-24 12:00 AM,2024-01-11T00:00:00.000Z,1-12-24 11:07 AM,2024-01-12T11:07:00.000Z,4,4,,PM,CLOSE,Y,,NO,CHATHAM
23-53194,MI-1201A - MECHANICAL PM,MI-1201A,MI-1201A,,,,12-18-23 1:49 AM,2023-12-18T01:49:00.000Z,1-11-24 1:00 AM,2024-01-11T01:00:00.000Z,1-12-24 1:00 AM,2024-01-12T01:00:00.000Z,4,4,,PM,CLOSE,Y,N,NO,CHATHAM
23-53193,Weekly Vibration check (GFE I/E),MI-1201B,MI-1201B,,,,12-18-23 1:49 AM,2023-12-18T01:49:00.000Z,1-15-24 12:00 AM,2024-01-15T00:00:00.000Z,1-23-24 6:28 AM,2024-01-23T06:28:00.000Z,4,4,,PM,CLOSE,Y,,NO,CHATHAM
23-53192,C-MI-1201B - MECHANICAL PM,MI-1201B,MI-1201B,,,,12-18-23 1:49 AM,2023-12-18T01:49:00.000Z,1-15-24 12:00 AM,2024-01-15T00:00:00.000Z,1-23-24 6:28 AM,2024-01-23T06:28:00.000Z,4,4,,PM,CLOSE,Y,,NO,CHATHAM
23-53191,MI-1201B - MECHANICAL PM,MI-1201B,MI-1201B,,,,12-18-23 1:49 AM,2023-12-18T01:49:00.000Z,1-15-24 12:30 AM,2024-01-15T00:30:00.000Z,1-18-24 2:00 AM,2024-01-18T02:00:00.000Z,4,4,,PM,CLOSE,Y,N,NO,CHATHAM
23-53190,GIVE SAMPLE TO SHIPPER/RECEIVER,CV-2111,CV-2111,1437,,,12-18-23 1:49 AM,2023-12-18T01:49:00.000Z,1-14-24 12:00 AM,2024-01-14T00:00:00.000Z,2-7-24 5:23 PM,2024-02-07T17:23:00.000Z,4,4,,PD,CLOSE,Y,,NO,CHATHAM
23-53189,CHECK OIL LEVEL,CV-2111,CV-2111,1437,,,12-18-23 1:49 AM,2023-12-18T01:49:00.000Z,1-14-24 12:30 AM,2024-01-14T00:30:00.000Z,2-7-24 5:23 PM,2024-02-07T17:23:00.000Z,4,4,,PD,CLOSE,Y,,NO,CHATHAM
23-53188,EXTRACT OIL SAMPLE,CV-2111,CV-2111,1437,,,12-18-23 1:49 AM,2023-12-18T01:49:00.000Z,1-14-24 12:30 AM,2024-01-14T00:30:00.000Z,2-7-24 5:23 PM,2024-02-07T17:23:00.000Z,4,4,,PD,CLOSE,Y,,NO,CHATHAM
23-53187,PREPARATION OF CONTAINERS,CV-2111,CV-2111,1437,,,12-18-23 1:49 AM,2023-12-18T01:49:00.000Z,1-14-24 12:00 AM,2024-01-14T00:00:00.000Z,2-7-24 5:23 PM,2024-02-07T17:23:00.000Z,4,4,,PD,CLOSE,Y,,NO,CHATHAM
23-53186,CV-2111-OIL SAMPLING,CV-2111,CV-2111,1437,,,12-18-23 1:49 AM,2023-12-18T01:49:00.000Z,1-14-24 12:30 AM,2024-01-14T00:30:00.000Z,2-7-24 5:23 PM,2024-02-07T17:23:00.000Z,4,4,,PD,CLOSE,Y,N,NO,CHATHAM
23-53185,PH PROBE CLEANING AND CALIBRATION WEEKLY PM,AT-14125,AT-14125,1230,,,12-18-23 1:49 AM,2023-12-18T01:49:00.000Z,1-11-24 1:00 AM,2024-01-11T01:00:00.000Z,1-11-24 10:20 AM,2024-01-11T10:20:00.000Z,4,4,,PM,CLOSE,Y,,NO,CHATHAM
23-53184,PH PROBE CLEANING AND CALIBRATION PM,AT-14125,AT-14125,1230,,,12-18-23 1:49 AM,2023-12-18T01:49:00.000Z,1-11-24 12:00 AM,2024-01-11T00:00:00.000Z,1-11-24 12:45 AM,2024-01-11T00:45:00.000Z,4,4,,PM,CLOSE,Y,N,NO,CHATHAM
23-53183,PH PROBE CLEANING AND CALIBRATION WEEKLY PM,AT-13519,AT-13519,1227,,,12-18-23 1:49 AM,2023-12-18T01:49:00.000Z,1-11-24 1:00 AM,2024-01-11T01:00:00.000Z,1-11-24 7:57 AM,2024-01-11T07:57:00.000Z,4,4,,PM,CLOSE,Y,,NO,CHATHAM
23-53182,PH PROBE CLEANING AND CALIBRATION PM,AT-13519,AT-13519,1227,,,12-18-23 1:49 AM,2023-12-18T01:49:00.000Z,1-11-24 12:00 AM,2024-01-11T00:00:00.000Z,1-11-24 12:12 AM,2024-01-11T00:12:00.000Z,4,4,,PM,CLOSE,Y,N,NO,CHATHAM
23-53181,Agitate the Sludge Bed in the Biothane and preform and record the  Sludge Analysis for the Biothane,T-4126,T-4126,5003,,,12-18-23 1:48 AM,2023-12-18T01:48:00.000Z,1-15-24 12:00 AM,2024-01-15T00:00:00.000Z,6-24-24 8:59 AM,2024-06-24T08:59:00.000Z,4,4,,PM,CLOSE,Y,,NO,CHATHAM
23-53180,SLUDGE ANALYSIS FOR BIOTHANE DIGESTER,T-4126,T-4126,5003,,,12-18-23 1:48 AM,2023-12-18T01:48:00.000Z,1-15-24 12:00 AM,2024-01-15T00:00:00.000Z,6-24-24 8:59 AM,2024-06-24T08:59:00.000Z,4,4,,PM,CLOSE,Y,N,NO,CHATHAM
23-53179,REFRACTORY INSPECTION,DR-1801D,DR-1801D,,,,12-18-23 1:48 AM,2023-12-18T01:48:00.000Z,5-8-24 12:00 AM,2024-05-08T00:00:00.000Z,6-21-24 8:44 AM,2024-06-21T08:44:00.000Z,4,4,,PM,CLOSE,Y,,NO,CHATHAM
23-53178,REFRACTORY INSPECTION,DR-1801D,DR-1801D,,,,12-18-23 1:48 AM,2023-12-18T01:48:00.000Z,5-8-24 12:00 AM,2024-05-08T00:00:00.000Z,6-21-24 8:44 AM,2024-06-21T08:44:00.000Z,4,4,,PM,CLOSE,Y,N,NO,CHATHAM
23-53177,Monitor & fill salt boxes,CHATHAM,CHATHAM,,,,12-18-23 1:48 AM,2023-12-18T01:48:00.000Z,1-11-24 1:00 AM,2024-01-11T01:00:00.000Z,1-15-24 8:28 AM,2024-01-15T08:28:00.000Z,4,4,,PM,CLOSE,Y,,NO,CHATHAM
23-53176,Thursday route - Fill plant salt boxes,CHATHAM,CHATHAM,,,,12-18-23 1:48 AM,2023-12-18T01:48:00.000Z,1-11-24 12:00 AM,2024-01-11T00:00:00.000Z,1-15-24 8:28 AM,2024-01-15T08:28:00.000Z,4,4,,PM,CLOSE,Y,N,NO,CHATHAM
23-53175,Monitor & fill salt boxes,CHATHAM,CHATHAM,,,,12-18-23 1:48 AM,2023-12-18T01:48:00.000Z,1-15-24 1:00 AM,2024-01-15T01:00:00.000Z,1-16-24 8:02 AM,2024-01-16T08:02:00.000Z,4,4,,PM,CLOSE,Y,,NO,CHATHAM
23-53174,Monday route - Fill plant salt boxes,CHATHAM,CHATHAM,,,,12-18-23 1:48 AM,2023-12-18T01:48:00.000Z,1-15-24 12:00 AM,2024-01-15T00:00:00.000Z,1-15-24 1:00 AM,2024-01-15T01:00:00.000Z,4,4,,PM,CLOSE,Y,N,NO,CHATHAM
23-53173,CONDUCTIVITY METER /PH PROBE CLEAN & CALIBRATE PM,AE-84404,AE-84404,7174,,,12-18-23 1:48 AM,2023-12-18T01:48:00.000Z,1-11-24 2:00 AM,2024-01-11T02:00:00.000Z,1-11-24 10:20 AM,2024-01-11T10:20:00.000Z,4,4,,PM,CLOSE,Y,,NO,CHATHAM
23-53172,DRYER SCRUBBER PH PROBE PM,AE-84404,AE-84404,7174,,,12-18-23 1:48 AM,2023-12-18T01:48:00.000Z,1-11-24 1:00 AM,2024-01-11T01:00:00.000Z,1-11-24 12:45 AM,2024-01-11T00:45:00.000Z,4,4,,PM,CLOSE,Y,N,NO,CHATHAM
23-53171,P-2407A 2 MONTH PM,P-2407A,P-2407A,3714,,,12-18-23 1:48 AM,2023-12-18T01:48:00.000Z,1-10-24 12:00 AM,2024-01-10T00:00:00.000Z,1-10-24 8:56 AM,2024-01-10T08:56:00.000Z,4,4,,PM,CLOSE,Y,,NO,CHATHAM
23-53170,P-2407A PM,P-2407A,P-2407A,3714,,,12-18-23 1:48 AM,2023-12-18T01:48:00.000Z,1-10-24 12:00 AM,2024-01-10T00:00:00.000Z,1-10-24 1:00 AM,2024-01-10T01:00:00.000Z,4,4,,PM,CLOSE,Y,N,NO,CHATHAM
23-53169,CHECK THE IMPROSEALS FOR OIL LEAKAGE,P-3503,P-3503,3745,,,12-18-23 1:48 AM,2023-12-18T01:48:00.000Z,1-9-24 12:15 AM,2024-01-09T00:15:00.000Z,4-9-24 10:28 AM,2024-04-09T10:28:00.000Z,4,4,,PM,CLOSE,Y,,NO,CHATHAM
23-53168,REMOVE COUPLING GUARD AND INSPECT OMEGA ELEMENT,P-3503,P-3503,3745,,,12-18-23 1:48 AM,2023-12-18T01:48:00.000Z,1-9-24 12:15 AM,2024-01-09T00:15:00.000Z,4-9-24 10:28 AM,2024-04-09T10:28:00.000Z,4,4,,PM,CLOSE,Y,,NO,CHATHAM
23-53167,OIL CHANGE ON GOULDS PUMPS,P-3503,P-3503,3745,,,12-18-23 1:48 AM,2023-12-18T01:48:00.000Z,1-9-24 12:30 AM,2024-01-09T00:30:00.000Z,4-9-24 10:28 AM,2024-04-09T10:28:00.000Z,4,4,,PM,CLOSE,Y,,NO,CHATHAM
23-53166,P-3503A - OIL CHANGE/ PM SERVICE,P-3503,P-3503,3745,,,12-18-23 1:48 AM,2023-12-18T01:48:00.000Z,5-31-24 1:00 AM,2024-05-31T01:00:00.000Z,4-9-24 10:28 AM,2024-04-09T10:28:00.000Z,4,4,,PM,CLOSE,Y,N,NO,CHATHAM
23-53165,MI-1801 - MECHANICAL PM,MI-1801,MI-1801,3405,,,12-18-23 1:48 AM,2023-12-18T01:48:00.000Z,1-12-24 1:30 AM,2024-01-12T01:30:00.000Z,1-15-24 8:33 AM,2024-01-15T08:33:00.000Z,4,4,,PM,CLOSE,Y,,NO,CHATHAM
23-53164,MI-1801 - MECHANICAL PM,MI-1801,MI-1801,3405,,,12-18-23 1:48 AM,2023-12-18T01:48:00.000Z,1-12-24 1:30 AM,2024-01-12T01:30:00.000Z,1-15-24 8:33 AM,2024-01-15T08:33:00.000Z,4,4,,PM,CLOSE,Y,N,NO,CHATHAM
23-53163,Follow procedure in Scott/Bacharach catalogue,BU-GHR,BU-GHR,1323,,,12-18-23 1:47 AM,2023-12-18T01:47:00.000Z,1-12-24 1:00 AM,2024-01-12T01:00:00.000Z,1-12-24 11:00 AM,2024-01-12T11:00:00.000Z,4,4,,PM,CLOSE,Y,,NO,CHATHAM
23-53162,GAS DETECTOR - (4600 MB) - PM SERVICE,BU-GHR,BU-GHR,1323,,,12-18-23 1:47 AM,2023-12-18T01:47:00.000Z,1-12-24 1:00 AM,2024-01-12T01:00:00.000Z,1-12-24 12:30 AM,2024-01-12T00:30:00.000Z,4,4,,PM,CLOSE,Y,N,NO,CHATHAM
23-53161,AT DCS,LT-14607,LT-14607,3161,,,12-18-23 1:47 AM,2023-12-18T01:47:00.000Z,1-15-24 12:00 AM,2024-01-15T00:00:00.000Z,1-15-24 1:24 PM,2024-01-15T13:24:00.000Z,4,4,,PM,CLOSE,Y,,NO,CHATHAM
23-53160,IN FIELD,LT-14607,LT-14607,3161,,,12-18-23 1:47 AM,2023-12-18T01:47:00.000Z,1-15-24 12:00 AM,2024-01-15T00:00:00.000Z,1-15-24 1:24 PM,2024-01-15T13:24:00.000Z,4,4,,PM,CLOSE,Y,,NO,CHATHAM
23-53159,AT DCS,LT-14607,LT-14607,3161,,,12-18-23 1:47 AM,2023-12-18T01:47:00.000Z,1-15-24 12:00 AM,2024-01-15T00:00:00.000Z,1-15-24 1:24 PM,2024-01-15T13:24:00.000Z,4,4,,PM,CLOSE,Y,,NO,CHATHAM
23-53158,CO2 MAGNETIC FLOAT LEVEL TRANSMITTER  BLOWDOWN,LT-14607,LT-14607,3161,,,12-18-23 1:47 AM,2023-12-18T01:47:00.000Z,1-15-24 1:00 AM,2024-01-15T01:00:00.000Z,1-15-24 12:12 AM,2024-01-15T00:12:00.000Z,4,4,,PM,CLOSE,Y,N,NO,CHATHAM
23-53157,SCREW CONVEYOR PM,CV-2603,CV-2603,1441,,,12-18-23 1:47 AM,2023-12-18T01:47:00.000Z,1-10-24 12:00 AM,2024-01-10T00:00:00.000Z,1-12-24 8:04 AM,2024-01-12T08:04:00.000Z,4,4,,PM,CLOSE,Y,,NO,CHATHAM
23-53156,CV-2603 - MECHANICAL PM,CV-2603,CV-2603,1441,,,12-18-23 1:47 AM,2023-12-18T01:47:00.000Z,1-10-24 2:00 AM,2024-01-10T02:00:00.000Z,1-10-24 1:00 AM,2024-01-10T01:00:00.000Z,4,4,,PM,CLOSE,Y,N,NO,CHATHAM
23-53155,WEARCHECK OIL SAMPLING TASK ( FOR ANALYSIS),P-1511A,P-1511A,1178,,,12-18-23 1:47 AM,2023-12-18T01:47:00.000Z,2-8-24 12:00 AM,2024-02-08T00:00:00.000Z,2-7-24 5:26 PM,2024-02-07T17:26:00.000Z,4,4,,PM,CLOSE,Y,,NO,CHATHAM
23-53154,P-1511A - OIL SAMPLE,P-1511A,P-1511A,1178,,,12-18-23 1:47 AM,2023-12-18T01:47:00.000Z,2-8-24 12:30 AM,2024-02-08T00:30:00.000Z,2-7-24 5:26 PM,2024-02-07T17:26:00.000Z,4,4,,PM,CLOSE,Y,N,NO,CHATHAM
23-53153,SC-1301 MECHANICAL CHECKS,SC-1301,SC-1301,4868,,,12-18-23 1:47 AM,2023-12-18T01:47:00.000Z,1-15-24 1:00 AM,2024-01-15T01:00:00.000Z,1-17-24 1:37 PM,2024-01-17T13:37:00.000Z,4,4,,PM,CLOSE,Y,,NO,CHATHAM
23-53152,SC-1301 - MECHANICAL CHECKS,SC-1301,SC-1301,4868,,,12-18-23 1:47 AM,2023-12-18T01:47:00.000Z,1-15-24 1:00 AM,2024-01-15T01:00:00.000Z,1-15-24 1:00 AM,2024-01-15T01:00:00.000Z,4,4,,PM,CLOSE,Y,N,NO,CHATHAM
23-53151,Remove locks and start up,SE-2101,SE-2101,4876,,,12-18-23 1:47 AM,2023-12-18T01:47:00.000Z,1-15-24 12:10 AM,2024-01-15T00:10:00.000Z,1-17-24 1:39 PM,2024-01-17T13:39:00.000Z,4,4,,PM,CLOSE,Y,,NO,CHATHAM
23-53150,Pump 1 - 2 shots of grease in drive head bearings,SE-2101,SE-2101,4876,,,12-18-23 1:47 AM,2023-12-18T01:47:00.000Z,1-15-24 12:10 AM,2024-01-15T00:10:00.000Z,1-17-24 1:39 PM,2024-01-17T13:39:00.000Z,4,4,,PM,CLOSE,Y,,NO,CHATHAM
23-53149,Pump 1 - 2 shots of grease in crankpin bearing,SE-2101,SE-2101,4876,,,12-18-23 1:47 AM,2023-12-18T01:47:00.000Z,1-15-24 12:10 AM,2024-01-15T00:10:00.000Z,1-17-24 1:39 PM,2024-01-17T13:39:00.000Z,4,4,,PM,CLOSE,Y,,NO,CHATHAM
23-53148,Get operations to shut down separator and lock out,SE-2101,SE-2101,4876,,,12-18-23 1:47 AM,2023-12-18T01:47:00.000Z,1-15-24 12:15 AM,2024-01-15T00:15:00.000Z,1-17-24 1:39 PM,2024-01-17T13:39:00.000Z,4,4,,PM,CLOSE,Y,,NO,CHATHAM
23-53147,SE-2101- CRANKSHAFT GREASING,SE-2101,SE-2101,4876,,,12-18-23 1:47 AM,2023-12-18T01:47:00.000Z,1-15-24 1:00 AM,2024-01-15T01:00:00.000Z,1-15-24 1:00 AM,2024-01-15T01:00:00.000Z,4,4,,PM,CLOSE,Y,N,NO,CHATHAM
23-53146,ACCULOAD SCULLY CABLE BI-WEEKLY PM,FQIC-2203,FQIC-2203,7138,,,12-18-23 1:47 AM,2023-12-18T01:47:00.000Z,1-12-24 12:30 AM,2024-01-12T00:30:00.000Z,1-12-24 8:44 AM,2024-01-12T08:44:00.000Z,4,4,,PM,CLOSE,Y,,NO,CHATHAM
23-53145,ACCULOAD SCULLY CABLE -PM SERVICE,FQIC-2203,FQIC-2203,7138,,,12-18-23 1:47 AM,2023-12-18T01:47:00.000Z,1-12-24 12:30 AM,2024-01-12T00:30:00.000Z,1-12-24 12:30 AM,2024-01-12T00:30:00.000Z,4,4,,PM,CLOSE,Y,N,NO,CHATHAM
23-53144,EMERGENCY/ EXIT LIGHT MONTHLY INSPECTION,CHATHAM,CHATHAM,,,,12-18-23 1:47 AM,2023-12-18T01:47:00.000Z,1-10-24 3:00 AM,2024-01-10T03:00:00.000Z,1-10-24 3:55 PM,2024-01-10T15:55:00.000Z,4,4,,PM,CLOSE,Y,,NO,CHATHAM
23-53143,EMERGENCY LIGHTING - PM SERVICE,CHATHAM,CHATHAM,,,,12-18-23 1:47 AM,2023-12-18T01:47:00.000Z,1-10-24 3:00 AM,2024-01-10T03:00:00.000Z,1-10-24 2:00 AM,2024-01-10T02:00:00.000Z,4,4,,PM,CLOSE,Y,N,NO,CHATHAM
23-53142,Corn Probe Weekly PM,SA-2101,SA-2101,4865,,,12-18-23 1:47 AM,2023-12-18T01:47:00.000Z,1-22-24 7:30 AM,2024-01-22T07:30:00.000Z,1-23-24 8:03 AM,2024-01-23T08:03:00.000Z,4,4,,PM,CLOSE,Y,,NO,CHATHAM
23-53141,SA-2101 CORN PROBE - MECHANICAL  PM,SA-2101,SA-2101,4865,,,12-18-23 1:47 AM,2023-12-18T01:47:00.000Z,1-22-24 7:30 AM,2024-01-22T07:30:00.000Z,1-22-24 8:00 AM,2024-01-22T08:00:00.000Z,4,4,,PM,CLOSE,Y,N,NO,CHATHAM
23-53140,EDDY CURRENT TUBE ANALYSIS -,K-3251,K-3251,,,,12-18-23 1:47 AM,2023-12-18T01:47:00.000Z,4-13-24 12:00 AM,2024-04-13T00:00:00.000Z,1-19-25 8:00 PM,2025-01-19T20:00:00.000Z,4,4,,PM,CLOSE,Y,,NO,CHATHAM
23-53139,K-3251 YORK CENTRIFUGAL CHILLER ANNUAL P.M.I.,K-3251,K-3251,,,,12-18-23 1:47 AM,2023-12-18T01:47:00.000Z,4-13-24 12:00 AM,2024-04-13T00:00:00.000Z,1-19-25 8:00 PM,2025-01-19T20:00:00.000Z,4,4,,PM,CLOSE,Y,,NO,CHATHAM
23-53138,CENTRIFUGAL CHILLER - (K-3251)  PM -1Y,K-3251,K-3251,,,,12-18-23 1:47 AM,2023-12-18T01:47:00.000Z,4-15-24 12:00 AM,2024-04-15T00:00:00.000Z,1-19-25 8:00 PM,2025-01-19T20:00:00.000Z,4,4,,PM,CLOSE,Y,N,NO,CHATHAM
23-53137,Check operation of biothane float in diked area,LSH-41401,LSH-41401,3081,,,12-18-23 1:46 AM,2023-12-18T01:46:00.000Z,1-15-24 12:30 AM,2024-01-15T00:30:00.000Z,1-17-24 3:01 PM,2024-01-17T15:01:00.000Z,4,4,,PM,CLOSE,Y,,NO,CHATHAM
23-53136,BIOTHANE FLOAT OP CHECK- (LSH-41401) - PM SERVICE,LSH-41401,LSH-41401,3081,,,12-18-23 1:46 AM,2023-12-18T01:46:00.000Z,1-15-24 12:30 AM,2024-01-15T00:30:00.000Z,1-15-24 12:30 AM,2024-01-15T00:30:00.000Z,4,4,,PM,CLOSE,Y,N,NO,CHATHAM
23-53135,1600 AREA - TEMPERATURE CHECKS,1600,1600,,,,12-18-23 1:46 AM,2023-12-18T01:46:00.000Z,1-15-24 1:30 AM,2024-01-15T01:30:00.000Z,1-24-24 3:04 PM,2024-01-24T15:04:00.000Z,4,4,,PM,CLOSE,Y,,NO,CHATHAM
23-53134,AGITATOR PM,1600,1600,,,,12-18-23 1:46 AM,2023-12-18T01:46:00.000Z,1-15-24 1:30 AM,2024-01-15T01:30:00.000Z,1-24-24 3:04 PM,2024-01-24T15:04:00.000Z,4,4,,PM,CLOSE,Y,,NO,CHATHAM
23-53133,1600/1700/1900 AREA - AGITATOR MECHANICAL PM,1600,1600,,,,12-18-23 1:46 AM,2023-12-18T01:46:00.000Z,1-15-24 12:20 AM,2024-01-15T00:20:00.000Z,1-24-24 3:00 AM,2024-01-24T03:00:00.000Z,4,4,,PM,CLOSE,Y,N,NO,CHATHAM
23-53132,GIVE SAMPLE TO SHIPPER/RECEIVER,AG-1404,AG-1404,1190,,,12-18-23 1:46 AM,2023-12-18T01:46:00.000Z,1-14-24 12:00 AM,2024-01-14T00:00:00.000Z,1-18-24 3:32 PM,2024-01-18T15:32:00.000Z,4,4,,PD,CLOSE,Y,,NO,CHATHAM
23-53131,CHECK OIL LEVEL,AG-1404,AG-1404,1190,,,12-18-23 1:46 AM,2023-12-18T01:46:00.000Z,1-14-24 12:30 AM,2024-01-14T00:30:00.000Z,1-18-24 3:32 PM,2024-01-18T15:32:00.000Z,4,4,,PD,CLOSE,Y,,NO,CHATHAM
23-53130,EXTRACT OIL SAMPLE,AG-1404,AG-1404,1190,,,12-18-23 1:46 AM,2023-12-18T01:46:00.000Z,1-14-24 12:30 AM,2024-01-14T00:30:00.000Z,1-18-24 3:32 PM,2024-01-18T15:32:00.000Z,4,4,,PD,CLOSE,Y,,NO,CHATHAM
23-53129,PREPARATION OF CONTAINERS,AG-1404,AG-1404,1190,,,12-18-23 1:46 AM,2023-12-18T01:46:00.000Z,1-14-24 12:00 AM,2024-01-14T00:00:00.000Z,1-18-24 3:32 PM,2024-01-18T15:32:00.000Z,4,4,,PD,CLOSE,Y,,NO,CHATHAM
23-53128,AG-1404 - OIL SAMPLING,AG-1404,AG-1404,1190,,,12-18-23 1:46 AM,2023-12-18T01:46:00.000Z,1-14-24 12:30 AM,2024-01-14T00:30:00.000Z,1-18-24 12:30 AM,2024-01-18T00:30:00.000Z,4,4,,PD,CLOSE,Y,N,NO,CHATHAM
23-53127,GIVE SAMPLE TO SHIPPER/RECEIVER,AG-1403,AG-1403,1189,,,12-18-23 1:46 AM,2023-12-18T01:46:00.000Z,1-14-24 12:00 AM,2024-01-14T00:00:00.000Z,1-18-24 3:32 PM,2024-01-18T15:32:00.000Z,4,4,,PD,CLOSE,Y,,NO,CHATHAM
23-53126,CHECK OIL LEVEL,AG-1403,AG-1403,1189,,,12-18-23 1:46 AM,2023-12-18T01:46:00.000Z,1-14-24 12:30 AM,2024-01-14T00:30:00.000Z,1-18-24 3:32 PM,2024-01-18T15:32:00.000Z,4,4,,PD,CLOSE,Y,,NO,CHATHAM
23-53125,EXTRACT OIL SAMPLE,AG-1403,AG-1403,1189,,,12-18-23 1:46 AM,2023-12-18T01:46:00.000Z,1-14-24 12:30 AM,2024-01-14T00:30:00.000Z,1-18-24 3:32 PM,2024-01-18T15:32:00.000Z,4,4,,PD,CLOSE,Y,,NO,CHATHAM
23-53124,PREPARATION OF CONTAINERS,AG-1403,AG-1403,1189,,,12-18-23 1:46 AM,2023-12-18T01:46:00.000Z,1-14-24 12:00 AM,2024-01-14T00:00:00.000Z,1-18-24 3:32 PM,2024-01-18T15:32:00.000Z,4,4,,PD,CLOSE,Y,,NO,CHATHAM
23-53123,AG-1403 - OIL SAMPLING,AG-1403,AG-1403,1189,,,12-18-23 1:46 AM,2023-12-18T01:46:00.000Z,1-14-24 12:30 AM,2024-01-14T00:30:00.000Z,1-18-24 12:30 AM,2024-01-18T00:30:00.000Z,4,4,,PD,CLOSE,Y,N,NO,CHATHAM
23-53122,GIVE SAMPLE TO SHIPPER/RECEIVER,AG-1402,AG-1402,1188,,,12-18-23 1:46 AM,2023-12-18T01:46:00.000Z,1-14-24 12:00 AM,2024-01-14T00:00:00.000Z,1-18-24 3:32 PM,2024-01-18T15:32:00.000Z,4,4,,PD,CLOSE,Y,,NO,CHATHAM
23-53121,CHECK OIL LEVEL,AG-1402,AG-1402,1188,,,12-18-23 1:46 AM,2023-12-18T01:46:00.000Z,1-14-24 12:30 AM,2024-01-14T00:30:00.000Z,1-18-24 3:32 PM,2024-01-18T15:32:00.000Z,4,4,,PD,CLOSE,Y,,NO,CHATHAM
23-53120,EXTRACT OIL SAMPLE,AG-1402,AG-1402,1188,,,12-18-23 1:46 AM,2023-12-18T01:46:00.000Z,1-14-24 12:30 AM,2024-01-14T00:30:00.000Z,1-18-24 3:32 PM,2024-01-18T15:32:00.000Z,4,4,,PD,CLOSE,Y,,NO,CHATHAM
23-53119,PREPARATION OF CONTAINERS,AG-1402,AG-1402,1188,,,12-18-23 1:46 AM,2023-12-18T01:46:00.000Z,1-14-24 12:00 AM,2024-01-14T00:00:00.000Z,1-18-24 3:32 PM,2024-01-18T15:32:00.000Z,4,4,,PD,CLOSE,Y,,NO,CHATHAM
23-53118,AG-1402 - OIL SAMPLING,AG-1402,AG-1402,1188,,,12-18-23 1:46 AM,2023-12-18T01:46:00.000Z,1-14-24 12:30 AM,2024-01-14T00:30:00.000Z,1-18-24 12:30 AM,2024-01-18T00:30:00.000Z,4,4,,PD,CLOSE,Y,N,NO,CHATHAM
23-53117,GIVE SAMPLE TO SHIPPER/RECEIVER,AG-1401,AG-1401,1187,,,12-18-23 1:46 AM,2023-12-18T01:46:00.000Z,1-14-24 12:00 AM,2024-01-14T00:00:00.000Z,1-23-24 6:28 AM,2024-01-23T06:28:00.000Z,4,4,,PD,CLOSE,Y,,NO,CHATHAM
23-53116,CHECK OIL LEVEL,AG-1401,AG-1401,1187,,,12-18-23 1:46 AM,2023-12-18T01:46:00.000Z,1-14-24 12:30 AM,2024-01-14T00:30:00.000Z,1-23-24 6:28 AM,2024-01-23T06:28:00.000Z,4,4,,PD,CLOSE,Y,,NO,CHATHAM
23-53115,EXTRACT OIL SAMPLE,AG-1401,AG-1401,1187,,,12-18-23 1:46 AM,2023-12-18T01:46:00.000Z,1-14-24 12:30 AM,2024-01-14T00:30:00.000Z,1-23-24 6:28 AM,2024-01-23T06:28:00.000Z,4,4,,PD,CLOSE,Y,,NO,CHATHAM
23-53114,PREPARATION OF CONTAINERS,AG-1401,AG-1401,1187,,,12-18-23 1:46 AM,2023-12-18T01:46:00.000Z,1-14-24 12:00 AM,2024-01-14T00:00:00.000Z,1-23-24 6:28 AM,2024-01-23T06:28:00.000Z,4,4,,PD,CLOSE,Y,,NO,CHATHAM
23-53113,AG-1401 - OIL SAMPLING,AG-1401,AG-1401,1187,,,12-18-23 1:46 AM,2023-12-18T01:46:00.000Z,1-14-24 12:30 AM,2024-01-14T00:30:00.000Z,1-23-24 6:28 AM,2024-01-23T06:28:00.000Z,4,4,,PD,CLOSE,Y,N,NO,CHATHAM
23-53112,GIVE SAMPLE TO SHIPPER/RECEIVER,AG-1400,AG-1400,1186,,,12-18-23 1:46 AM,2023-12-18T01:46:00.000Z,1-14-24 12:00 AM,2024-01-14T00:00:00.000Z,1-18-24 3:32 PM,2024-01-18T15:32:00.000Z,4,4,,PD,CLOSE,Y,,NO,CHATHAM
23-53111,CHECK OIL LEVEL,AG-1400,AG-1400,1186,,,12-18-23 1:46 AM,2023-12-18T01:46:00.000Z,1-14-24 12:30 AM,2024-01-14T00:30:00.000Z,1-18-24 3:32 PM,2024-01-18T15:32:00.000Z,4,4,,PD,CLOSE,Y,,NO,CHATHAM
23-53110,EXTRACT OIL SAMPLE,AG-1400,AG-1400,1186,,,12-18-23 1:46 AM,2023-12-18T01:46:00.000Z,1-14-24 12:30 AM,2024-01-14T00:30:00.000Z,1-18-24 3:32 PM,2024-01-18T15:32:00.000Z,4,4,,PD,CLOSE,Y,,NO,CHATHAM
23-53109,PREPARATION OF CONTAINERS,AG-1400,AG-1400,1186,,,12-18-23 1:46 AM,2023-12-18T01:46:00.000Z,1-14-24 12:00 AM,2024-01-14T00:00:00.000Z,1-18-24 3:32 PM,2024-01-18T15:32:00.000Z,4,4,,PD,CLOSE,Y,,NO,CHATHAM
23-53108,AG-1400 - OIL SAMPLING,AG-1400,AG-1400,1186,,,12-18-23 1:46 AM,2023-12-18T01:46:00.000Z,1-14-24 12:30 AM,2024-01-14T00:30:00.000Z,1-18-24 12:30 AM,2024-01-18T00:30:00.000Z,4,4,,PD,CLOSE,Y,N,NO,CHATHAM
23-53107,1400 AREA - AGITATOR TEMPERATURE CHECKS,1400,1400,,,,12-18-23 1:46 AM,2023-12-18T01:46:00.000Z,1-15-24 1:30 AM,2024-01-15T01:30:00.000Z,1-22-24 6:33 AM,2024-01-22T06:33:00.000Z,4,4,,PM,CLOSE,Y,,NO,CHATHAM
23-53106,AGITATOR GEARBOX MONTHLY PM CHECKS,1400,1400,,,,12-18-23 1:46 AM,2023-12-18T01:46:00.000Z,1-15-24 1:30 AM,2024-01-15T01:30:00.000Z,1-22-24 6:33 AM,2024-01-22T06:33:00.000Z,4,4,,PM,CLOSE,Y,,NO,CHATHAM
23-53105,1400 AREA - AGITATOR MECHANICAL PM,1400,1400,,,,12-18-23 1:46 AM,2023-12-18T01:46:00.000Z,1-15-24 3:00 AM,2024-01-15T03:00:00.000Z,1-18-24 2:00 AM,2024-01-18T02:00:00.000Z,4,4,,PM,CLOSE,Y,N,NO,CHATHAM
23-53104,1300 AREA - AGITATOR TEMPERATURE CHECKS,1300,1300,,,,12-18-23 1:46 AM,2023-12-18T01:46:00.000Z,1-15-24 1:30 AM,2024-01-15T01:30:00.000Z,1-19-24 1:11 PM,2024-01-19T13:11:00.000Z,4,4,,PM,CLOSE,Y,,NO,CHATHAM
23-53103,EURODRIVE AGITATOR GEARBOX PM,1300,1300,,,,12-18-23 1:46 AM,2023-12-18T01:46:00.000Z,1-15-24 1:30 AM,2024-01-15T01:30:00.000Z,1-19-24 1:11 PM,2024-01-19T13:11:00.000Z,4,4,,PM,CLOSE,Y,,NO,CHATHAM
23-53102,1300 AREA - AGITATOR MECHANICAL PM,1300,1300,,,,12-18-23 1:46 AM,2023-12-18T01:46:00.000Z,1-15-24 3:00 AM,2024-01-15T03:00:00.000Z,1-19-24 12:30 AM,2024-01-19T00:30:00.000Z,4,4,,PM,CLOSE,Y,N,NO,CHATHAM
23-53101,GIVE SAMPLE TO SHIPPER/RECEIVER,AG-11402,AG-11402,7175,,,12-18-23 1:46 AM,2023-12-18T01:46:00.000Z,1-14-24 12:00 AM,2024-01-14T00:00:00.000Z,1-18-24 3:32 PM,2024-01-18T15:32:00.000Z,4,4,,PD,CLOSE,Y,,NO,CHATHAM
23-53100,CHECK OIL LEVEL,AG-11402,AG-11402,7175,,,12-18-23 1:46 AM,2023-12-18T01:46:00.000Z,1-14-24 12:30 AM,2024-01-14T00:30:00.000Z,1-18-24 3:32 PM,2024-01-18T15:32:00.000Z,4,4,,PD,CLOSE,Y,,NO,CHATHAM
23-53099,EXTRACT OIL SAMPLE,AG-11402,AG-11402,7175,,,12-18-23 1:46 AM,2023-12-18T01:46:00.000Z,1-14-24 12:30 AM,2024-01-14T00:30:00.000Z,1-18-24 3:32 PM,2024-01-18T15:32:00.000Z,4,4,,PD,CLOSE,Y,,NO,CHATHAM
23-53098,PREPARATION OF CONTAINERS,AG-11402,AG-11402,7175,,,12-18-23 1:46 AM,2023-12-18T01:46:00.000Z,1-14-24 12:00 AM,2024-01-14T00:00:00.000Z,1-18-24 3:32 PM,2024-01-18T15:32:00.000Z,4,4,,PD,CLOSE,Y,,NO,CHATHAM
23-53097,AG-11402- OIL SAMPLING,AG-11402,AG-11402,7175,,,12-18-23 1:46 AM,2023-12-18T01:46:00.000Z,1-14-24 12:30 AM,2024-01-14T00:30:00.000Z,1-18-24 12:30 AM,2024-01-18T00:30:00.000Z,4,4,,PD,CLOSE,Y,N,NO,CHATHAM
23-53096,REPLACE RELIEF PLUG (IF EQUIPPED),1400,1400,,,,12-18-23 1:46 AM,2023-12-18T01:46:00.000Z,1-15-24 12:00 AM,2024-01-15T00:00:00.000Z,1-24-24 5:50 PM,2024-01-24T17:50:00.000Z,4,4,,PM,CLOSE,Y,,NO,CHATHAM
23-53095,ENSURE RELIEF PLUG (IF EQUIPPED) IS OPENED,1400,1400,,,,12-18-23 1:46 AM,2023-12-18T01:46:00.000Z,1-15-24 12:00 AM,2024-01-15T00:00:00.000Z,1-24-24 5:50 PM,2024-01-24T17:50:00.000Z,4,4,,PM,CLOSE,Y,,NO,CHATHAM
23-53094,CLEAN FITTINGS,1400,1400,,,,12-18-23 1:46 AM,2023-12-18T01:46:00.000Z,1-15-24 12:00 AM,2024-01-15T00:00:00.000Z,1-24-24 5:50 PM,2024-01-24T17:50:00.000Z,4,4,,PM,CLOSE,Y,,NO,CHATHAM
23-53093,GREASE TYPES,1400,1400,,,,12-18-23 1:46 AM,2023-12-18T01:46:00.000Z,1-15-24 12:00 AM,2024-01-15T00:00:00.000Z,1-24-24 5:50 PM,2024-01-24T17:50:00.000Z,4,4,,PM,CLOSE,Y,,NO,CHATHAM
23-53092,1400 AREA - MOTOR GREASING,1400,1400,,,,12-18-23 1:46 AM,2023-12-18T01:46:00.000Z,1-15-24 12:30 AM,2024-01-15T00:30:00.000Z,1-24-24 2:00 AM,2024-01-24T02:00:00.000Z,4,4,,PM,CLOSE,Y,N,NO,CHATHAM
23-53090,2nd air connection - DDG building,BU-DDG,BU-DDG,1319,,,12-15-23 12:47 PM,2023-12-15T12:47:00.000Z,4-3-24 12:02 PM,2024-04-03T12:02:00.000Z,1-2-24 7:54 AM,2024-01-02T07:54:00.000Z,4,4,,CO,CLOSE,Y,,NO,CHATHAM
23-53089,Broken Doors,1300-PD-13B,1300-PD-13B,,,,12-15-23 12:45 PM,2023-12-15T12:45:00.000Z,1-14-24 10:15 AM,2024-01-14T10:15:00.000Z,5-21-24 7:20 AM,2024-05-21T07:20:00.000Z,4,4,,RM,CLOSE,Y,,NO,CHATHAM
23-53085,TA24 Spring - Replace section of cooling tube,RC-1802,RC-1802,4850,,,12-15-23 8:55 AM,2023-12-15T08:55:00.000Z,4-30-24 1:02 PM,2024-04-30T13:02:00.000Z,5-27-24 10:34 AM,2024-05-27T10:34:00.000Z,4,4,,CO,CLOSE,Y,,NO,CHATHAM
23-53084,SE-2101 Started squealing louder on pad,SE-2101,SE-2101,4876,,,12-15-23 8:53 AM,2023-12-15T08:53:00.000Z,1-12-24 7:36 AM,2024-01-12T07:36:00.000Z,1-2-24 7:40 AM,2024-01-02T07:40:00.000Z,2,2,,CO,CLOSE,Y,,NO,CHATHAM
23-53082,Review the HAC for the testing area,R&D LAB,R&D LAB,,,,12-15-23 8:49 AM,2023-12-15T08:49:00.000Z,12-22-23 11:09 AM,2023-12-22T11:09:00.000Z,12-22-23 7:50 AM,2023-12-22T07:50:00.000Z,2,2,,CO,CLOSE,Y,,NO,CHATHAM
23-53080,Turn heat vent in my office OFF,CHATHAM,CHATHAM,,,,12-15-23 8:46 AM,2023-12-15T08:46:00.000Z,12-18-23 12:46 PM,2023-12-18T12:46:00.000Z,12-18-23 1:46 PM,2023-12-18T13:46:00.000Z,4,4,,CO,CLOSE,Y,,NO,CHATHAM
23-53079,Grade repair for Manhole cover,BU-ALCO,BU-ALCO,1315,,,12-15-23 8:45 AM,2023-12-15T08:45:00.000Z,1-31-24 3:52 PM,2024-01-31T15:52:00.000Z,12-3-24 2:55 PM,2024-12-03T14:55:00.000Z,4,4,,CO,CLOSE,Y,,NO,CHATHAM
23-53078,Assemble two (2) pull carts that will be utilized for Yield improvement trials.,CHATHAM,CHATHAM,,,,12-15-23 8:43 AM,2023-12-15T08:43:00.000Z,12-31-23 7:23 AM,2023-12-31T07:23:00.000Z,12-29-23 9:53 AM,2023-12-29T09:53:00.000Z,4,4,,CO,CLOSE,Y,,NO,CHATHAM
23-53076,Pucks and support plates on the shaker need to be changed,SE-2101,SE-2101,4876,,,12-15-23 7:57 AM,2023-12-15T07:57:00.000Z,1-31-24 4:41 PM,2024-01-31T16:41:00.000Z,1-25-24 7:11 PM,2024-01-25T19:11:00.000Z,4,4,,CO,CLOSE,Y,,NO,CHATHAM
23-53066,Debug,2100,2100,,,,12-14-23 1:44 PM,2023-12-14T13:44:00.000Z,12-31-23 1:40 PM,2023-12-31T13:40:00.000Z,12-19-23 2:10 PM,2023-12-19T14:10:00.000Z,4,4,,CO,CLOSE,Y,,NO,CHATHAM
23-53065,Install Equipment,2100,2100,,,,12-14-23 1:44 PM,2023-12-14T13:44:00.000Z,12-31-23 1:40 PM,2023-12-31T13:40:00.000Z,12-19-23 4:10 PM,2023-12-19T16:10:00.000Z,4,4,,CO,CLOSE,Y,,NO,CHATHAM
23-53064,Install automated telescopes,2100,2100,,,,12-14-23 1:40 PM,2023-12-14T13:40:00.000Z,12-31-23 1:40 PM,2023-12-31T13:40:00.000Z,7-2-24 3:11 PM,2024-07-02T15:11:00.000Z,4,4,,CO,CLOSE,Y,,NO,CHATHAM
23-53063,Ensure proper function,BU-DDG,BU-DDG,1319,,,12-14-23 1:34 PM,2023-12-14T13:34:00.000Z,12-31-23 12:53 PM,2023-12-31T12:53:00.000Z,12-14-23 1:40 PM,2023-12-14T13:40:00.000Z,4,4,,CO,CLOSE,Y,,NO,CHATHAM
23-53062,Install equipment,BU-DDG,BU-DDG,1319,,,12-14-23 1:33 PM,2023-12-14T13:33:00.000Z,12-31-23 12:53 PM,2023-12-31T12:53:00.000Z,12-14-23 1:40 PM,2023-12-14T13:40:00.000Z,4,4,,CO,CLOSE,Y,,NO,CHATHAM
23-53061,"Re-insulate 1\" line on top of EV-1610",0000,0000,,,,12-14-23 1:30 PM,2023-12-14T13:30:00.000Z,12-31-23 12:53 PM,2023-12-31T12:53:00.000Z,12-14-23 12:56 PM,2023-12-14T12:56:00.000Z,4,4,,CO,CLOSE,Y,,NO,CHATHAM
23-53060,"Re-insulate 1\" line on top of EV-1610",EV-1610,EV-1610,1645,Completed under timesheet 100717 & 100716,,12-14-23 12:53 PM,2023-12-14T12:53:00.000Z,12-31-23 12:53 PM,2023-12-31T12:53:00.000Z,12-14-23 12:56 PM,2023-12-14T12:56:00.000Z,4,4,,CO,CLOSE,Y,,NO,CHATHAM
23-53059,Reinstall heat trace and insulation on Sulphuric Acid piping,P-2405A,P-2405A,3712,completed under timesheet 100719,,12-14-23 12:47 PM,2023-12-14T12:47:00.000Z,12-15-23 10:03 AM,2023-12-15T10:03:00.000Z,12-14-23 12:07 PM,2023-12-14T12:07:00.000Z,4,4,,CO,CLOSE,Y,,NO,CHATHAM
23-53058,Install signs on East exterior wall of mill building,BU-MILL2,BU-MILL2,1326,,,12-14-23 11:55 AM,2023-12-14T11:55:00.000Z,12-31-23 11:12 AM,2023-12-31T11:12:00.000Z,12-27-23 7:41 AM,2023-12-27T07:41:00.000Z,2,2,,SA,CLOSE,Y,,NO,CHATHAM
23-53057,Install signs on East exterior wall of mill building,BU-MILL,BU-MILL,1325,,,12-14-23 11:53 AM,2023-12-14T11:53:00.000Z,12-19-23 11:08 AM,2023-12-19T11:08:00.000Z,12-27-23 7:41 AM,2023-12-27T07:41:00.000Z,2,2,,SA,CLOSE,Y,,NO,CHATHAM
23-53050,Flex Boot @ TY18117A has a tear and needs to be replaced,E-1825,E-1825,2560,,,12-14-23 8:25 AM,2023-12-14T08:25:00.000Z,12-21-23 1:20 AM,2023-12-21T01:20:00.000Z,5-27-24 11:52 AM,2024-05-27T11:52:00.000Z,2,2,,RM,CLOSE,Y,,NO,CHATHAM
23-53049,Discard of E-waste bin contents,0000,0000,,,,12-14-23 8:12 AM,2023-12-14T08:12:00.000Z,12-31-23 8:12 AM,2023-12-31T08:12:00.000Z,12-20-23 9:12 AM,2023-12-20T09:12:00.000Z,4,4,,CO,CLOSE,Y,,NO,CHATHAM
23-53048,Replace lights in Utilites,BU-UTIL,BU-UTIL,1330,,,12-14-23 8:09 AM,2023-12-14T08:09:00.000Z,12-31-23 8:09 AM,2023-12-31T08:09:00.000Z,12-21-23 12:43 PM,2023-12-21T12:43:00.000Z,4,4,,CO,CLOSE,Y,,NO,CHATHAM
23-53047,New flushers for women's washroom toilets,BU-ADMIN,BU-ADMIN,1314,,,12-14-23 7:50 AM,2023-12-14T07:50:00.000Z,12-31-23 2:30 PM,2023-12-31T14:30:00.000Z,9-13-24 10:47 AM,2024-09-13T10:47:00.000Z,2,2,,CO,CLOSE,Y,,NO,CHATHAM
23-53046,TA24 Capital Project - E-1400 Replacement,E-1400,E-1400,1487,,,12-13-23 3:32 PM,2023-12-13T15:32:00.000Z,4-26-24 12:00 AM,2024-04-26T00:00:00.000Z,5-22-24 8:28 AM,2024-05-22T08:28:00.000Z,4,4,,CP,CLOSE,Y,,NO,CHATHAM
23-53045,TA24 Capital Project - Flowmeter Replacements,0000,0000,,,,12-13-23 3:30 PM,2023-12-13T15:30:00.000Z,4-26-24 12:00 AM,2024-04-26T00:00:00.000Z,5-23-24 12:57 PM,2024-05-23T12:57:00.000Z,4,4,,CP,CLOSE,Y,,NO,CHATHAM
23-53044,TA24 Capital Project - Dust Collector Upgrades,0000,0000,,,,12-13-23 3:21 PM,2023-12-13T15:21:00.000Z,10-31-24 12:00 AM,2024-10-31T00:00:00.000Z,1-13-25 8:42 AM,2025-01-13T08:42:00.000Z,4,4,,CP,CLOSE,Y,,NO,CHATHAM
23-53043,TA24 Capital Project - Caustic Day Tank Replacement,TK-2403,TK-2403,5504,,,12-13-23 3:17 PM,2023-12-13T15:17:00.000Z,4-26-24 12:00 AM,2024-04-26T00:00:00.000Z,,,4,4,,CO,WSCH,N,,NO,CHATHAM
23-53042,TA24 Capital Project - Control Room Renovation,0000,0000,,,,12-13-23 3:15 PM,2023-12-13T15:15:00.000Z,8-26-24 12:00 AM,2024-08-26T00:00:00.000Z,10-7-24 2:09 PM,2024-10-07T14:09:00.000Z,4,4,,CP,CLOSE,Y,,NO,CHATHAM
23-53041,TA24 Capital Project - DCS IO Replacement MR-3806,MCC-3806,MCC-3806,3382,,,12-13-23 3:02 PM,2023-12-13T15:02:00.000Z,4-26-24 12:00 AM,2024-04-26T00:00:00.000Z,11-19-24 1:35 PM,2024-11-19T13:35:00.000Z,4,4,,CP,CLOSE,Y,,NO,CHATHAM
23-53040,TA24 Capital Project - Utilities Steam Isolation,3600-26K-06,3600-26K-06,,,,12-13-23 3:00 PM,2023-12-13T15:00:00.000Z,4-26-24 12:00 AM,2024-04-26T00:00:00.000Z,,,4,4,,CP,SCHED,N,,NO,CHATHAM
23-53039,TA24 Capital Project - E1630 Retube,E-1630,E-1630,1528,,,12-13-23 2:58 PM,2023-12-13T14:58:00.000Z,10-31-24 12:00 AM,2024-10-31T00:00:00.000Z,,,4,4,,CP,WPLAN,N,,NO,CHATHAM
23-53038,TA24 Capital Project - Grain Bin Clean Out System,2100-26K-01,2100-26K-01,,,,12-13-23 2:55 PM,2023-12-13T14:55:00.000Z,8-26-24 12:00 AM,2024-08-26T00:00:00.000Z,,,4,4,,CP,SCHED,N,,NO,CHATHAM
23-53037,TA 2024 Change pedestal bearings on fan,BL-3604,BL-3604,1302,,,12-13-23 2:52 PM,2023-12-13T14:52:00.000Z,7-10-24 3:31 PM,2024-07-10T15:31:00.000Z,7-11-24 12:01 PM,2024-07-11T12:01:00.000Z,4,4,,CO,CLOSE,Y,,NO,CHATHAM
23-53036,TA 2024 - Add isolation point to igniter wire 526 in CG1 TCM cabinet,ME-3601A,ME-3601A,,WO - 23-53036 Can be closed. We will no longer be doing this.,,12-13-23 2:50 PM,2023-12-13T14:50:00.000Z,4-15-24 4:46 PM,2024-04-15T16:46:00.000Z,,,4,4,,CO,CAN,Y,,NO,CHATHAM
23-53035,TA 2024 - BioGas PM,4100,4100,7094,,,12-13-23 2:48 PM,2023-12-13T14:48:00.000Z,4-15-24 4:40 AM,2024-04-15T04:40:00.000Z,5-15-24 7:31 AM,2024-05-15T07:31:00.000Z,4,4,,CO,CLOSE,Y,,NO,CHATHAM
23-53034,TA 2024 - CG-2 Oil Filteration,ME-3602A,ME-3602A,,,,12-13-23 2:46 PM,2023-12-13T14:46:00.000Z,4-15-24 4:38 AM,2024-04-15T04:38:00.000Z,5-15-24 8:03 AM,2024-05-15T08:03:00.000Z,4,4,,CO,CLOSE,Y,,NO,CHATHAM
23-53033,TA 2024 - Condex 2 Sump Clean Out,E-3609,E-3609,1548,,,12-13-23 2:43 PM,2023-12-13T14:43:00.000Z,4-15-24 4:29 AM,2024-04-15T04:29:00.000Z,5-15-24 7:49 AM,2024-05-15T07:49:00.000Z,4,4,,CO,CLOSE,Y,,NO,CHATHAM
23-53032,TA 2024 - CG-1 Oil Filteration,ME-3601A,ME-3601A,,,,12-13-23 2:28 PM,2023-12-13T14:28:00.000Z,4-15-24 4:35 AM,2024-04-15T04:35:00.000Z,5-15-24 7:59 AM,2024-05-15T07:59:00.000Z,4,4,,CO,CLOSE,Y,,NO,CHATHAM
23-53030,TA 2024 - CT-3201 C Sump Cleaning,CT-3201C,CT-3201C,,,,12-13-23 2:00 PM,2023-12-13T14:00:00.000Z,4-15-24 4:34 AM,2024-04-15T04:34:00.000Z,5-15-24 7:43 AM,2024-05-15T07:43:00.000Z,4,4,,CO,CLOSE,Y,,NO,CHATHAM
23-53029,TA 2024 - CT-3201 A/B Sump Cleaning,CT-3201,CT-3201,,,,12-13-23 1:58 PM,2023-12-13T13:58:00.000Z,4-15-24 4:31 AM,2024-04-15T04:31:00.000Z,5-15-24 7:43 AM,2024-05-15T07:43:00.000Z,4,4,,CO,CLOSE,Y,,NO,CHATHAM
23-53028,TA 2024 - Condex 1 Sump Clean Out,3600-26K-09,3600-26K-09,,,,12-13-23 1:56 PM,2023-12-13T13:56:00.000Z,4-15-24 4:22 AM,2024-04-15T04:22:00.000Z,5-15-24 7:28 AM,2024-05-15T07:28:00.000Z,4,4,,CO,CLOSE,Y,,NO,CHATHAM
23-53027,TA 2024 - P-3201B Seal Replacement,P-3201B,P-3201B,,,,12-13-23 1:55 PM,2023-12-13T13:55:00.000Z,4-15-24 4:20 AM,2024-04-15T04:20:00.000Z,5-15-24 8:07 AM,2024-05-15T08:07:00.000Z,4,4,,CO,CLOSE,Y,,NO,CHATHAM
23-53026,TA 2024 - P-3201B Rotor Replacement,P-3201B,P-3201B,,,,12-13-23 1:48 PM,2023-12-13T13:48:00.000Z,4-15-24 4:18 AM,2024-04-15T04:18:00.000Z,5-15-24 8:07 AM,2024-05-15T08:07:00.000Z,4,4,,CO,CLOSE,Y,,NO,CHATHAM
23-53025,TA24 Fall- CTF3201C Gearbox Oil Change,CTF-3201C,CTF-3201C,,,,12-13-23 1:46 PM,2023-12-13T13:46:00.000Z,4-15-24 4:17 AM,2024-04-15T04:17:00.000Z,,,4,4,,CO,SCHED,N,,NO,CHATHAM
23-53024,TA 2024 - CTF3201B Gearbox Oil Change,CTF-3201B,CTF-3201B,,,,12-13-23 1:45 PM,2023-12-13T13:45:00.000Z,4-15-24 4:15 AM,2024-04-15T04:15:00.000Z,,,4,4,,CO,CAN,Y,,NO,CHATHAM
23-53023,TA24 Fall - CTF3201A Gearbox Oil Change,CTF-3201A,CTF-3201A,1398,,,12-13-23 1:43 PM,2023-12-13T13:43:00.000Z,10-22-24 3:00 PM,2024-10-22T15:00:00.000Z,11-19-24 10:20 AM,2024-11-19T10:20:00.000Z,4,4,,CO,CLOSE,Y,,NO,CHATHAM
23-53022,TA 2024 - CTF3201B Motor Replacement,CTF-3201B,CTF-3201B,,,,12-13-23 1:42 PM,2023-12-13T13:42:00.000Z,4-15-24 4:10 AM,2024-04-15T04:10:00.000Z,5-15-24 7:45 AM,2024-05-15T07:45:00.000Z,4,4,,CO,CLOSE,Y,N,NO,CHATHAM
23-53021,TA 2024 - CTF3201B Gearbox Replacement,CTF-3201B,CTF-3201B,,,,12-13-23 1:40 PM,2023-12-13T13:40:00.000Z,4-15-24 4:02 AM,2024-04-15T04:02:00.000Z,5-15-24 7:45 AM,2024-05-15T07:45:00.000Z,4,4,,CO,CLOSE,Y,,NO,CHATHAM
23-53020,TA 2024 - CTF3201B alignment,CTF-3201B,CTF-3201B,,,,12-13-23 1:38 PM,2023-12-13T13:38:00.000Z,4-15-24 4:01 AM,2024-04-15T04:01:00.000Z,5-15-24 7:44 AM,2024-05-15T07:44:00.000Z,4,4,,CO,CLOSE,Y,,NO,CHATHAM
23-53019,TA 2024 - CG2 Enclosure Cleaning PM,ME-3602A,ME-3602A,,,,12-13-23 1:37 PM,2023-12-13T13:37:00.000Z,4-15-24 3:51 AM,2024-04-15T03:51:00.000Z,5-15-24 8:03 AM,2024-05-15T08:03:00.000Z,4,4,,CO,CLOSE,Y,,NO,CHATHAM
23-53018,TA24 Fall - CTF3201A alignment,CTF-3201A,CTF-3201A,,,,12-13-23 1:31 PM,2023-12-13T13:31:00.000Z,10-25-24 4:00 PM,2024-10-25T16:00:00.000Z,11-19-24 10:20 AM,2024-11-19T10:20:00.000Z,4,4,,CO,CLOSE,Y,,NO,CHATHAM
23-53017,"TA 2024 - CG-2 \"A\" Service",ME-3602A,ME-3602A,,,,12-13-23 1:29 PM,2023-12-13T13:29:00.000Z,4-15-24 3:55 AM,2024-04-15T03:55:00.000Z,5-15-24 8:02 AM,2024-05-15T08:02:00.000Z,4,4,,CO,CLOSE,Y,,NO,CHATHAM
23-53016,"TA 2024 - CG-1 \"A\" Service",ME-3601A,ME-3601A,,,,12-13-23 1:28 PM,2023-12-13T13:28:00.000Z,4-15-24 3:53 AM,2024-04-15T03:53:00.000Z,5-15-24 7:59 AM,2024-05-15T07:59:00.000Z,4,4,,CO,CLOSE,Y,,NO,CHATHAM
23-53015,TA 2024 - CG1 Enclosure Cleaning PM,ME-3601A,ME-3601A,,,,12-13-23 1:26 PM,2023-12-13T13:26:00.000Z,4-15-24 3:49 AM,2024-04-15T03:49:00.000Z,5-15-24 7:59 AM,2024-05-15T07:59:00.000Z,4,4,,CO,CLOSE,Y,,NO,CHATHAM
23-53014,TA 2024 - P-3606B Coupling Check,P-3606B,P-3606B,3758,,,12-13-23 1:25 PM,2023-12-13T13:25:00.000Z,4-15-24 3:40 AM,2024-04-15T03:40:00.000Z,5-15-24 9:04 AM,2024-05-15T09:04:00.000Z,4,4,,CO,CLOSE,Y,,NO,CHATHAM
23-53013,TA 2024 - P-3606A Coupling Check,P-3606A,P-3606A,3757,,,12-13-23 1:24 PM,2023-12-13T13:24:00.000Z,4-15-24 3:39 AM,2024-04-15T03:39:00.000Z,5-15-24 9:04 AM,2024-05-15T09:04:00.000Z,4,4,,CO,CLOSE,Y,,NO,CHATHAM
23-53012,TA 2024 - P3505 Oil Change and Coupling Check,P-3505,P-3505,1146,,,12-13-23 1:22 PM,2023-12-13T13:22:00.000Z,4-15-24 3:37 AM,2024-04-15T03:37:00.000Z,5-15-24 8:11 AM,2024-05-15T08:11:00.000Z,4,4,,CO,CLOSE,Y,,NO,CHATHAM
23-53011,TA 2024 - P-3501A Oil Change and Coupling Check,P-3501A,P-3501A,1145,,,12-13-23 1:20 PM,2023-12-13T13:20:00.000Z,4-15-24 3:34 AM,2024-04-15T03:34:00.000Z,5-15-24 8:10 AM,2024-05-15T08:10:00.000Z,4,4,,CO,CLOSE,Y,,NO,CHATHAM
23-53010,TA 2024 - P-3501B Oil Change and Coupling Check,P-3501B,P-3501B,1144,,,12-13-23 1:19 PM,2023-12-13T13:19:00.000Z,4-15-24 3:36 AM,2024-04-15T03:36:00.000Z,5-15-24 8:10 AM,2024-05-15T08:10:00.000Z,4,4,,CO,CLOSE,Y,,NO,CHATHAM
23-53009,TA 2024 - P-3503 Oil Change and Coupling Check,P-3503,P-3503,3745,,,12-13-23 1:17 PM,2023-12-13T13:17:00.000Z,4-15-24 3:33 AM,2024-04-15T03:33:00.000Z,6-6-24 11:21 AM,2024-06-06T11:21:00.000Z,4,4,,CO,CLOSE,Y,,NO,CHATHAM
23-53008,TA 2024 - P-3506 Oil Change and Coupling Check,P-3506,P-3506,1143,,,12-13-23 1:16 PM,2023-12-13T13:16:00.000Z,4-15-24 3:31 AM,2024-04-15T03:31:00.000Z,5-15-24 8:11 AM,2024-05-15T08:11:00.000Z,4,4,,CO,CLOSE,Y,,NO,CHATHAM
23-53007,TA 2024 - P-4126 Oil Change and Coupling Check,P-4126,P-4126,,,,12-13-23 1:14 PM,2023-12-13T13:14:00.000Z,4-15-24 3:30 AM,2024-04-15T03:30:00.000Z,6-6-24 11:17 AM,2024-06-06T11:17:00.000Z,4,4,,CO,CLOSE,Y,,NO,CHATHAM
23-53006,TA 2024 - P-4105 Oil Change and Coupling Check,P-4105,P-4105,,,,12-13-23 1:13 PM,2023-12-13T13:13:00.000Z,4-15-24 3:29 AM,2024-04-15T03:29:00.000Z,6-6-24 11:18 AM,2024-06-06T11:18:00.000Z,4,4,,CO,CLOSE,Y,,NO,CHATHAM
23-53005,TA 2024 - P-3601B Oil Change and Coupling Check,P-3601B,P-3601B,1151,,,12-13-23 1:10 PM,2023-12-13T13:10:00.000Z,4-15-24 3:27 AM,2024-04-15T03:27:00.000Z,5-15-24 9:03 AM,2024-05-15T09:03:00.000Z,4,4,,CO,CLOSE,Y,,NO,CHATHAM
23-53004,TA 2024 - P-3601A Oil Change and Coupling Check,P-3601A,P-3601A,1090,,,12-13-23 1:08 PM,2023-12-13T13:08:00.000Z,4-15-24 3:25 AM,2024-04-15T03:25:00.000Z,5-15-24 9:03 AM,2024-05-15T09:03:00.000Z,4,4,,CO,CLOSE,Y,,NO,CHATHAM
23-53003,TA 2024 - P-3201B Oil Change and Coupling Check,P-3201B,P-3201B,,,,12-13-23 1:06 PM,2023-12-13T13:06:00.000Z,4-15-24 3:24 AM,2024-04-15T03:24:00.000Z,5-15-24 8:07 AM,2024-05-15T08:07:00.000Z,4,4,,CO,CLOSE,Y,,NO,CHATHAM
23-53002,TA 2024 - P-3201A Oil Change and Coupling Check,P-3201A,P-3201A,,,,12-13-23 1:04 PM,2023-12-13T13:04:00.000Z,4-15-24 3:21 AM,2024-04-15T03:21:00.000Z,5-15-24 8:05 AM,2024-05-15T08:05:00.000Z,4,4,,CO,CLOSE,Y,,NO,CHATHAM
23-53001,TA 2024 - ME-3602 Open/Close PM,ME-3602,ME-3602,3395,,,12-13-23 1:02 PM,2023-12-13T13:02:00.000Z,10-19-24 3:00 PM,2024-10-19T15:00:00.000Z,11-1-24 2:09 PM,2024-11-01T14:09:00.000Z,4,4,,SD,CLOSE,Y,N,NO,CHATHAM
23-53000,TA 2024 - ME-3601 Open/Close PM,ME-3601,ME-3601,3393,,,12-13-23 1:00 PM,2023-12-13T13:00:00.000Z,10-19-24 10:00 AM,2024-10-19T10:00:00.000Z,11-19-24 10:18 AM,2024-11-19T10:18:00.000Z,4,4,,CO,CLOSE,Y,,NO,CHATHAM
23-52998,TA 2024 - B3602 Open/Close PM,B-3602,B-3602,1272,,,12-13-23 12:58 PM,2023-12-13T12:58:00.000Z,4-15-24 4:37 AM,2024-04-15T04:37:00.000Z,5-15-24 7:40 AM,2024-05-15T07:40:00.000Z,4,4,,CO,CLOSE,Y,N,NO,CHATHAM
23-52997,TA 2024 - B3601 Open/Close PM,B-3601,B-3601,1271,,,12-13-23 12:57 PM,2023-12-13T12:57:00.000Z,10-21-24 11:00 AM,2024-10-21T11:00:00.000Z,11-19-24 10:17 AM,2024-11-19T10:17:00.000Z,4,4,,CO,CLOSE,Y,N,NO,CHATHAM
23-52996,TA 2024 - Condex 2 Belt Inspection PM,E-3609,E-3609,1548,,,12-13-23 12:55 PM,2023-12-13T12:55:00.000Z,4-15-24 4:32 AM,2024-04-15T04:32:00.000Z,4-1-24 1:39 PM,2024-04-01T13:39:00.000Z,4,4,,CO,CLOSE,Y,,NO,CHATHAM
23-52995,TA24 Fall - Condex 1 Belt Inspection PM,3600-26K-09,3600-26K-09,,,,12-13-23 12:52 PM,2023-12-13T12:52:00.000Z,6-30-24 4:29 AM,2024-06-30T04:29:00.000Z,10-3-24 2:43 PM,2024-10-03T14:43:00.000Z,4,4,,CO,CLOSE,Y,,NO,CHATHAM
23-52992,'- CG2 Enclosure Fan Belt Replacement PM,ME-3602A,ME-3602A,,,,12-13-23 12:50 PM,2023-12-13T12:50:00.000Z,3-22-24 4:28 AM,2024-03-22T04:28:00.000Z,3-18-24 6:28 AM,2024-03-18T06:28:00.000Z,4,4,,CO,CLOSE,Y,,NO,CHATHAM
23-52991,CG2 Generator Belt Replacement PM,ME-3602A,ME-3602A,,,,12-13-23 12:49 PM,2023-12-13T12:49:00.000Z,3-22-24 4:26 AM,2024-03-22T04:26:00.000Z,3-18-24 6:30 AM,2024-03-18T06:30:00.000Z,4,4,,CO,CLOSE,Y,,NO,CHATHAM
23-52990,TA 2024 - CG1 Enclosure Fan Belt Replacement PM,ME-3601A,ME-3601A,,,,12-13-23 12:47 PM,2023-12-13T12:47:00.000Z,4-15-24 4:23 AM,2024-04-15T04:23:00.000Z,5-15-24 7:58 AM,2024-05-15T07:58:00.000Z,4,4,,CO,CLOSE,Y,,NO,CHATHAM
23-52989,TA 2024 - CG2 HEPA Filters PM,ME-3602A,ME-3602A,,,,12-13-23 12:45 PM,2023-12-13T12:45:00.000Z,4-15-24 4:19 AM,2024-04-15T04:19:00.000Z,4-9-24 10:31 AM,2024-04-09T10:31:00.000Z,4,4,,CO,CLOSE,Y,,NO,CHATHAM
23-52988,TA 2024 - CG2 Inlet Filters PM,ME-3602A,ME-3602A,,,,12-13-23 12:43 PM,2023-12-13T12:43:00.000Z,4-15-24 4:18 AM,2024-04-15T04:18:00.000Z,3-21-24 7:53 AM,2024-03-21T07:53:00.000Z,4,4,,CO,CLOSE,Y,,NO,CHATHAM
23-52987,TA24 Spring - E-1400 leaks after CIP,E-1400B,E-1400B,1488,,,12-13-23 12:41 PM,2023-12-13T12:41:00.000Z,5-1-24 11:39 AM,2024-05-01T11:39:00.000Z,5-22-24 8:27 AM,2024-05-22T08:27:00.000Z,4,4,,CO,CLOSE,Y,,NO,CHATHAM
23-52986,Install receptacle for new mini hot water heater in DDG office trailer,2600,2600,,,,12-13-23 12:38 PM,2023-12-13T12:38:00.000Z,12-31-23 12:00 AM,2023-12-31T00:00:00.000Z,12-19-23 4:00 AM,2023-12-19T04:00:00.000Z,4,4,,CP,CLOSE,Y,,NO,CHATHAM
23-52985,Replace coupling guard and turn over,P-1513A,P-1513A,1072,,,12-13-23 12:32 PM,2023-12-13T12:32:00.000Z,12-4-23 11:30 AM,2023-12-04T11:30:00.000Z,12-22-23 6:53 AM,2023-12-22T06:53:00.000Z,4,4,,CO,CLOSE,Y,,NO,CHATHAM
23-52984,Laser align pump,P-1513A,P-1513A,1072,,,12-13-23 12:32 PM,2023-12-13T12:32:00.000Z,12-4-23 12:15 PM,2023-12-04T12:15:00.000Z,12-22-23 6:53 AM,2023-12-22T06:53:00.000Z,4,4,,CO,CLOSE,Y,,NO,CHATHAM
23-52983,Set impeller clearance,P-1513A,P-1513A,1072,,,12-13-23 12:32 PM,2023-12-13T12:32:00.000Z,12-4-23 11:30 AM,2023-12-04T11:30:00.000Z,12-22-23 6:53 AM,2023-12-22T06:53:00.000Z,4,4,,CO,CLOSE,Y,,NO,CHATHAM
23-52982,Install rebuilt pump pull-out,P-1513A,P-1513A,1072,,,12-13-23 12:32 PM,2023-12-13T12:32:00.000Z,12-4-23 11:45 AM,2023-12-04T11:45:00.000Z,12-22-23 6:53 AM,2023-12-22T06:53:00.000Z,4,4,,CO,CLOSE,Y,,NO,CHATHAM
23-52981,Inspect bowl drain piping.,P-1513A,P-1513A,1072,,,12-13-23 12:32 PM,2023-12-13T12:32:00.000Z,12-4-23 11:30 AM,2023-12-04T11:30:00.000Z,12-22-23 6:53 AM,2023-12-22T06:53:00.000Z,4,4,,CO,CLOSE,Y,,NO,CHATHAM
23-52980,Remove pump pull-out,P-1513A,P-1513A,1072,,,12-13-23 12:32 PM,2023-12-13T12:32:00.000Z,12-4-23 11:30 AM,2023-12-04T11:30:00.000Z,12-22-23 6:53 AM,2023-12-22T06:53:00.000Z,4,4,,CO,CLOSE,Y,,NO,CHATHAM
23-52979,Remove guard & disconnect coupling,P-1513A,P-1513A,1072,,,12-13-23 12:32 PM,2023-12-13T12:32:00.000Z,12-4-23 11:30 AM,2023-12-04T11:30:00.000Z,12-22-23 6:53 AM,2023-12-22T06:53:00.000Z,4,4,,CO,CLOSE,Y,,NO,CHATHAM
23-52978,Isolate pump,P-1513A,P-1513A,1072,,,12-13-23 12:31 PM,2023-12-13T12:31:00.000Z,12-4-23 11:30 AM,2023-12-04T11:30:00.000Z,12-22-23 6:53 AM,2023-12-22T06:53:00.000Z,4,4,,CO,CLOSE,Y,,NO,CHATHAM
23-52962,P-1513A seal leak,P-1513A,P-1513A,1072,,,12-13-23 12:28 PM,2023-12-13T12:28:00.000Z,12-31-23 11:15 AM,2023-12-31T11:15:00.000Z,12-22-23 6:53 AM,2023-12-22T06:53:00.000Z,4,4,,CO,CLOSE,Y,N,NO,CHATHAM
23-52961,ceiling tile falling down,QC LAB,QC LAB,,,,12-13-23 12:26 PM,2023-12-13T12:26:00.000Z,12-31-23 2:35 PM,2023-12-31T14:35:00.000Z,1-2-24 7:59 AM,2024-01-02T07:59:00.000Z,4,4,,CO,CLOSE,Y,,NO,CHATHAM
23-52960,"Wired Outlet out of wall, needs to be fixed",QC LAB,QC LAB,,,,12-13-23 12:24 PM,2023-12-13T12:24:00.000Z,12-31-23 2:35 PM,2023-12-31T14:35:00.000Z,12-21-23 12:44 PM,2023-12-21T12:44:00.000Z,4,4,,CO,CLOSE,Y,,NO,CHATHAM
23-52959,Walking path blocked by AC unit,QC LAB,QC LAB,,,,12-13-23 12:22 PM,2023-12-13T12:22:00.000Z,4-30-24 2:35 PM,2024-04-30T14:35:00.000Z,1-15-25 2:29 PM,2025-01-15T14:29:00.000Z,4,4,,SA,CLOSE,Y,,NO,CHATHAM
23-52958,2 Lights out in new distillation at grade,1500,1500,,,,12-13-23 12:20 PM,2023-12-13T12:20:00.000Z,12-31-23 5:00 PM,2023-12-31T17:00:00.000Z,12-18-23 9:00 AM,2023-12-18T09:00:00.000Z,4,4,,RM,CLOSE,Y,,NO,CHATHAM
23-52957,replace if we have spare,E-1650,E-1650,1531,,,12-13-23 12:18 PM,2023-12-13T12:18:00.000Z,1-5-24 7:10 PM,2024-01-05T19:10:00.000Z,12-18-23 1:24 PM,2023-12-18T13:24:00.000Z,4,4,,CO,CLOSE,Y,,NO,CHATHAM
23-52956,If we do not currently have one supply information to replace,E-1650,E-1650,1531,,,12-13-23 12:17 PM,2023-12-13T12:17:00.000Z,1-5-24 7:10 PM,2024-01-05T19:10:00.000Z,12-18-23 1:24 PM,2023-12-18T13:24:00.000Z,4,4,,CO,CLOSE,Y,,NO,CHATHAM
23-52955,E1650 temperature TT16405 (process cond. to ponds) has failed,E-1650,E-1650,1531,,,12-13-23 12:15 PM,2023-12-13T12:15:00.000Z,1-5-24 7:10 PM,2024-01-05T19:10:00.000Z,12-17-23 9:11 PM,2023-12-17T21:11:00.000Z,4,4,,CO,CLOSE,Y,,NO,CHATHAM
23-52954,Change oil in gearbox,AG-1401,AG-1401,1187,,,12-13-23 12:13 PM,2023-12-13T12:13:00.000Z,12-31-23 8:13 AM,2023-12-31T08:13:00.000Z,1-10-24 9:43 AM,2024-01-10T09:43:00.000Z,2,2,,CO,CLOSE,Y,,NO,CHATHAM
23-52953,Re-torque wheels on company truck,0000,0000,,,,12-13-23 12:09 PM,2023-12-13T12:09:00.000Z,1-14-24 11:02 AM,2024-01-14T11:02:00.000Z,12-28-23 12:02 PM,2023-12-28T12:02:00.000Z,4,4,,CO,CLOSE,Y,,NO,CHATHAM
23-52951,TA 2024 - CG1 Inlet Filters PM,ME-3601A,ME-3601A,,,,12-13-23 11:51 AM,2023-12-13T11:51:00.000Z,10-19-24 11:00 AM,2024-10-19T11:00:00.000Z,11-19-24 10:17 AM,2024-11-19T10:17:00.000Z,4,4,,CO,CLOSE,Y,,NO,CHATHAM
23-52950,TA 2024 - B3602 Exhaust Damper PM,B-3602,B-3602,1272,,,12-13-23 11:49 AM,2023-12-13T11:49:00.000Z,4-15-24 4:10 AM,2024-04-15T04:10:00.000Z,5-15-24 7:39 AM,2024-05-15T07:39:00.000Z,4,4,,CO,CLOSE,Y,,NO,CHATHAM
23-52949,TA 2024 - DA3601 Internal Inspection PM,DA-3601,DA-3601,1452,,,12-13-23 11:48 AM,2023-12-13T11:48:00.000Z,4-15-24 4:08 AM,2024-04-15T04:08:00.000Z,,,4,4,,CO,CAN,Y,,NO,CHATHAM
23-52948,TA 2024 - ME-3602  Internal Inspection PM,ME-3602,ME-3602,3395,,,12-13-23 11:47 AM,2023-12-13T11:47:00.000Z,10-22-24 12:00 PM,2024-10-22T12:00:00.000Z,11-19-24 10:16 AM,2024-11-19T10:16:00.000Z,4,4,,CO,CLOSE,Y,N,NO,CHATHAM
23-52947,TA 2024 - ME-3601  Internal Inspection PM,ME-3601,ME-3601,3393,,,12-13-23 11:45 AM,2023-12-13T11:45:00.000Z,10-22-24 11:00 AM,2024-10-22T11:00:00.000Z,11-19-24 10:15 AM,2024-11-19T10:15:00.000Z,4,4,,CO,CLOSE,Y,N,NO,CHATHAM
23-52946,TA 2024 - B3602  Internal Inspection PM,B-3602,B-3602,1272,,,12-13-23 11:33 AM,2023-12-13T11:33:00.000Z,10-22-24 11:00 AM,2024-10-22T11:00:00.000Z,11-19-24 10:14 AM,2024-11-19T10:14:00.000Z,4,4,,CO,CLOSE,Y,N,NO,CHATHAM
23-52945,TA24 fall (everest) - Replace TV13111 Steam Control Valve to TK1301,TV-13111,TV-13111,5843,,,12-13-23 11:17 AM,2023-12-13T11:17:00.000Z,4-30-24 9:58 AM,2024-04-30T09:58:00.000Z,11-19-24 1:08 PM,2024-11-19T13:08:00.000Z,4,4,,CO,CLOSE,Y,,NO,CHATHAM
23-52944,PCOSS - changing gravity disk,CE-6601,CE-6601,1386,,,12-13-23 10:58 AM,2023-12-13T10:58:00.000Z,12-31-23 3:30 PM,2023-12-31T15:30:00.000Z,12-19-23 12:56 PM,2023-12-19T12:56:00.000Z,2,2,,CO,CLOSE,Y,,NO,CHATHAM
23-52943,I/E - Chris G -Investigate leak detection for TGF Supply,C-1840,C-1840,1367,,,12-13-23 10:57 AM,2023-12-13T10:57:00.000Z,12-31-23 2:34 PM,2023-12-31T14:34:00.000Z,12-18-23 4:37 PM,2023-12-18T16:37:00.000Z,4,4,,CO,CLOSE,Y,,NO,CHATHAM
23-52942,DROA - Verify heat trace is functioning on the syrup line to Dryer A,P-1603A,P-1603A,1041,,,12-13-23 10:56 AM,2023-12-13T10:56:00.000Z,12-31-23 9:36 AM,2023-12-31T09:36:00.000Z,12-19-23 10:39 AM,2023-12-19T10:39:00.000Z,2,2,,CO,CLOSE,Y,,NO,CHATHAM
23-52941,BN1202 Meal Bin AIR PURGE to LT12105 - not working,1200-26K-04,1200-26K-04,,,,12-13-23 8:30 AM,2023-12-13T08:30:00.000Z,1-31-24 7:35 AM,2024-01-31T07:35:00.000Z,9-20-24 7:39 AM,2024-09-20T07:39:00.000Z,4,4,,CO,CLOSE,Y,,NO,CHATHAM
23-52940,Pot holes in wet load out pad,0000,0000,,,,12-13-23 8:29 AM,2023-12-13T08:29:00.000Z,4-5-24 3:49 PM,2024-04-05T15:49:00.000Z,9-20-24 10:48 AM,2024-09-20T10:48:00.000Z,4,4,,SA,CLOSE,Y,,NO,CHATHAM
23-52936,CE-1711 Diverter Overload - cannot restart,CE-1711,CE-1711,,,,12-13-23 7:14 AM,2023-12-13T07:14:00.000Z,12-13-23 6:00 PM,2023-12-13T18:00:00.000Z,12-13-23 8:36 AM,2023-12-13T08:36:00.000Z,1,1,,CO,CLOSE,Y,,NO,CHATHAM
23-52935,TA 2024 - CG1 Enclosure Fan Screen Cleaning PM,ME-3601A,ME-3601A,,,,12-13-23 7:08 AM,2023-12-13T07:08:00.000Z,4-15-24 4:21 AM,2024-04-15T04:21:00.000Z,5-15-24 7:58 AM,2024-05-15T07:58:00.000Z,4,4,,CO,CLOSE,Y,,NO,CHATHAM
23-52934,Mechanical coverage for Friday Dec 15,0000,0000,,,,12-12-23 3:31 PM,2023-12-12T15:31:00.000Z,12-31-23 3:31 PM,2023-12-31T15:31:00.000Z,6-26-25 10:07 PM,2025-06-26T22:07:00.000Z,4,4,,CO,CLOSE,Y,,NO,CHATHAM
23-52933,"company truck, engine light, flat tire, change to winter tires.",CHATHAM,CHATHAM,,,,12-12-23 3:25 PM,2023-12-12T15:25:00.000Z,12-14-23 2:02 PM,2023-12-14T14:02:00.000Z,12-13-23 6:03 PM,2023-12-13T18:03:00.000Z,2,2,,RM,CLOSE,Y,,NO,CHATHAM
23-52929,Close drain on V-1515 inlet line,V-1515,V-1515,6289,,,12-12-23 2:17 PM,2023-12-12T14:17:00.000Z,,,5-24-24 10:02 AM,2024-05-24T10:02:00.000Z,4,4,,SD,CLOSE,Y,,NO,CHATHAM
23-52928,"Close V-1515 manways,close drain flange",V-1515,V-1515,6289,,,12-12-23 2:17 PM,2023-12-12T14:17:00.000Z,,,5-24-24 10:02 AM,2024-05-24T10:02:00.000Z,4,4,,SD,CLOSE,Y,,NO,CHATHAM
23-52927,Clean V-1515,V-1515,V-1515,6289,,,12-12-23 2:17 PM,2023-12-12T14:17:00.000Z,,,5-24-24 10:02 AM,2024-05-24T10:02:00.000Z,4,4,,SD,CLOSE,Y,,NO,CHATHAM
23-52926,Pre-inspection to verify cleaning needed,V-1515,V-1515,6289,,,12-12-23 2:17 PM,2023-12-12T14:17:00.000Z,,,5-24-24 10:02 AM,2024-05-24T10:02:00.000Z,4,4,,SD,CLOSE,Y,,NO,CHATHAM
23-52925,Clean V-1515 inlet line both ways,V-1515,V-1515,6289,,,12-12-23 2:17 PM,2023-12-12T14:17:00.000Z,,,5-24-24 10:02 AM,2024-05-24T10:02:00.000Z,4,4,,SD,CLOSE,Y,,NO,CHATHAM
23-52924,"Open V-1515 manways,open drain flange",V-1515,V-1515,6289,,,12-12-23 2:17 PM,2023-12-12T14:17:00.000Z,,,5-24-24 10:02 AM,2024-05-24T10:02:00.000Z,4,4,,SD,CLOSE,Y,,NO,CHATHAM
23-52923,Open drain on V-1515 inlet line (GFE OPS),V-1515,V-1515,6289,,,12-12-23 2:17 PM,2023-12-12T14:17:00.000Z,,,5-24-24 10:02 AM,2024-05-24T10:02:00.000Z,4,4,,SD,CLOSE,Y,,NO,CHATHAM
23-52922,V-1515 (BEER COLUMN MIST ELIMINATOR) HPW PM and inspection,V-1515,V-1515,6289,,,12-12-23 2:17 PM,2023-12-12T14:17:00.000Z,,,5-24-24 10:02 AM,2024-05-24T10:02:00.000Z,4,4,,PM,CLOSE,Y,N,NO,CHATHAM
23-52921,Complete runout and float checks,P-1601D,P-1601D,3663,,,12-12-23 1:05 PM,2023-12-12T13:05:00.000Z,12-20-23 1:32 PM,2023-12-20T13:32:00.000Z,12-20-23 8:52 AM,2023-12-20T08:52:00.000Z,4,4,,CO,CLOSE,Y,,NO,CHATHAM
23-52920,Assemble shaft w/ bearings into housing,P-1601D,P-1601D,3663,,,12-12-23 1:05 PM,2023-12-12T13:05:00.000Z,12-20-23 2:02 PM,2023-12-20T14:02:00.000Z,12-20-23 8:52 AM,2023-12-20T08:52:00.000Z,4,4,,CO,CLOSE,Y,,NO,CHATHAM
23-52919,Install bearings,P-1601D,P-1601D,3663,,,12-12-23 1:05 PM,2023-12-12T13:05:00.000Z,12-20-23 3:32 PM,2023-12-20T15:32:00.000Z,12-20-23 8:52 AM,2023-12-20T08:52:00.000Z,4,4,,CO,CLOSE,Y,,NO,CHATHAM
23-52918,Take measurements,P-1601D,P-1601D,3663,,,12-12-23 1:05 PM,2023-12-12T13:05:00.000Z,12-20-23 2:02 PM,2023-12-20T14:02:00.000Z,12-20-23 8:52 AM,2023-12-20T08:52:00.000Z,4,4,,CO,CLOSE,Y,,NO,CHATHAM
23-52917,Wire wheel shaft,P-1601D,P-1601D,3663,,,12-12-23 1:05 PM,2023-12-12T13:05:00.000Z,12-20-23 1:32 PM,2023-12-20T13:32:00.000Z,12-20-23 8:52 AM,2023-12-20T08:52:00.000Z,4,4,,CO,CLOSE,Y,,NO,CHATHAM
23-52916,Clean housing,P-1601D,P-1601D,3663,,,12-12-23 1:05 PM,2023-12-12T13:05:00.000Z,12-20-23 1:32 PM,2023-12-20T13:32:00.000Z,12-20-23 8:52 AM,2023-12-20T08:52:00.000Z,4,4,,CO,CLOSE,Y,,NO,CHATHAM
23-52915,Disassemble pump,P-1601D,P-1601D,3663,,,12-12-23 1:05 PM,2023-12-12T13:05:00.000Z,12-20-23 3:02 PM,2023-12-20T15:02:00.000Z,12-20-23 8:52 AM,2023-12-20T08:52:00.000Z,4,4,,CO,CLOSE,Y,,NO,CHATHAM
23-52914,Troubleshoot P-1601D pump repeated seal failure,P-1601D,P-1601D,3663,,,12-12-23 1:02 PM,2023-12-12T13:02:00.000Z,12-31-23 1:02 PM,2023-12-31T13:02:00.000Z,12-20-23 8:52 AM,2023-12-20T08:52:00.000Z,4,4,,CO,CLOSE,Y,N,NO,CHATHAM
23-52913,Replace coupling guard and turn over,P-1601D,P-1601D,3663,,,12-12-23 1:00 PM,2023-12-12T13:00:00.000Z,12-5-23 7:50 AM,2023-12-05T07:50:00.000Z,12-20-23 9:48 AM,2023-12-20T09:48:00.000Z,4,4,,CO,CLOSE,Y,,NO,CHATHAM
23-52912,Laser align pump,P-1601D,P-1601D,3663,,,12-12-23 1:00 PM,2023-12-12T13:00:00.000Z,12-5-23 8:35 AM,2023-12-05T08:35:00.000Z,12-20-23 9:48 AM,2023-12-20T09:48:00.000Z,4,4,,CO,CLOSE,Y,,NO,CHATHAM
23-52911,Set impeller clearance,P-1601D,P-1601D,3663,,,12-12-23 1:00 PM,2023-12-12T13:00:00.000Z,12-5-23 7:50 AM,2023-12-05T07:50:00.000Z,12-20-23 9:48 AM,2023-12-20T09:48:00.000Z,4,4,,CO,CLOSE,Y,,NO,CHATHAM
23-52910,Install rebuilt pump pull-out,P-1601D,P-1601D,3663,,,12-12-23 1:00 PM,2023-12-12T13:00:00.000Z,12-5-23 8:05 AM,2023-12-05T08:05:00.000Z,12-20-23 9:48 AM,2023-12-20T09:48:00.000Z,4,4,,CO,CLOSE,Y,,NO,CHATHAM
23-52909,Inspect bowl drain piping.,P-1601D,P-1601D,3663,,,12-12-23 1:00 PM,2023-12-12T13:00:00.000Z,12-5-23 7:50 AM,2023-12-05T07:50:00.000Z,12-20-23 9:48 AM,2023-12-20T09:48:00.000Z,4,4,,CO,CLOSE,Y,,NO,CHATHAM
23-52908,Remove pump pull-out,P-1601D,P-1601D,3663,,,12-12-23 1:00 PM,2023-12-12T13:00:00.000Z,12-5-23 7:50 AM,2023-12-05T07:50:00.000Z,12-20-23 9:48 AM,2023-12-20T09:48:00.000Z,4,4,,CO,CLOSE,Y,,NO,CHATHAM
23-52907,Remove guard & disconnect coupling,P-1601D,P-1601D,3663,,,12-12-23 1:00 PM,2023-12-12T13:00:00.000Z,12-5-23 7:50 AM,2023-12-05T07:50:00.000Z,12-20-23 9:48 AM,2023-12-20T09:48:00.000Z,4,4,,CO,CLOSE,Y,,NO,CHATHAM
23-52906,Isolate pump,P-1601D,P-1601D,3663,,,12-12-23 1:00 PM,2023-12-12T13:00:00.000Z,12-5-23 7:50 AM,2023-12-05T07:50:00.000Z,12-20-23 9:48 AM,2023-12-20T09:48:00.000Z,4,4,,CO,CLOSE,Y,,NO,CHATHAM
23-52905,P-1601D seal change,P-1601D,P-1601D,3663,,,12-12-23 9:41 AM,2023-12-12T09:41:00.000Z,12-31-23 7:35 AM,2023-12-31T07:35:00.000Z,12-18-23 4:05 PM,2023-12-18T16:05:00.000Z,4,4,,CO,CLOSE,Y,N,NO,CHATHAM
23-52904,Determine if sensor are functioning correctly,BL-1825,BL-1825,10032,,,12-12-23 9:38 AM,2023-12-12T09:38:00.000Z,12-31-23 8:00 AM,2023-12-31T08:00:00.000Z,7-16-24 2:20 PM,2024-07-16T14:20:00.000Z,4,4,,CO,CLOSE,Y,,NO,CHATHAM
23-52903,Check vibes with handheld,BL-1825,BL-1825,10032,,,12-12-23 9:38 AM,2023-12-12T09:38:00.000Z,12-31-23 8:00 AM,2023-12-31T08:00:00.000Z,7-16-24 2:20 PM,2024-07-16T14:20:00.000Z,4,4,,CO,CLOSE,Y,,NO,CHATHAM
23-52902,Service Chino Moisture Meter with technician,MCC-3806,MCC-3806,3382,,,12-12-23 8:22 AM,2023-12-12T08:22:00.000Z,12-31-23 8:22 AM,2023-12-31T08:22:00.000Z,12-13-23 8:00 AM,2023-12-13T08:00:00.000Z,2,2,,CO,CLOSE,Y,,NO,CHATHAM
23-52901,Repair insulation on P-162,P-1621,P-1621,1062,"Work completed 
Timesheet 100723 0n 11 Dec 2023.",,12-12-23 8:01 AM,2023-12-12T08:01:00.000Z,12-31-23 8:01 AM,2023-12-31T08:01:00.000Z,12-21-23 4:02 PM,2023-12-21T16:02:00.000Z,4,4,,CO,CLOSE,Y,,NO,CHATHAM
23-52900,Repair insulation on P-6610,P-6610,P-6610,3845,,,12-12-23 7:59 AM,2023-12-12T07:59:00.000Z,12-31-23 7:59 AM,2023-12-31T07:59:00.000Z,3-11-25 1:42 PM,2025-03-11T13:42:00.000Z,4,4,,CO,CLOSE,Y,,NO,CHATHAM
23-52899,Repair insulation on P-1403,P-1403,P-1403,1036,,,12-12-23 7:57 AM,2023-12-12T07:57:00.000Z,12-31-23 7:57 AM,2023-12-31T07:57:00.000Z,3-11-25 1:42 PM,2025-03-11T13:42:00.000Z,4,4,,CO,CLOSE,Y,,NO,CHATHAM
23-52898,RE insulate P-1803 valve,P-1803D,P-1803D,1116,,,12-12-23 7:53 AM,2023-12-12T07:53:00.000Z,12-31-23 7:53 AM,2023-12-31T07:53:00.000Z,3-11-25 1:42 PM,2025-03-11T13:42:00.000Z,4,4,,CO,CLOSE,Y,,NO,CHATHAM
23-52897,DC2101 bridged,DC-2101,DC-2101,1457,,,12-11-23 1:09 PM,2023-12-11T13:09:00.000Z,12-11-23 2:00 PM,2023-12-11T14:00:00.000Z,1-2-24 7:38 AM,2024-01-02T07:38:00.000Z,1,1,,RM,CLOSE,Y,,NO,CHATHAM
23-52896,TA 2024 - B3601 Internal Inspection PM,B-3601,B-3601,1271,,,12-11-23 12:56 PM,2023-12-11T12:56:00.000Z,10-22-24 4:00 PM,2024-10-22T16:00:00.000Z,11-19-24 10:13 AM,2024-11-19T10:13:00.000Z,4,4,,CO,CLOSE,Y,N,NO,CHATHAM
23-52895,TA 2024 - ME3602 Nat Gas train PM,ME-3602,ME-3602,3395,,,12-11-23 12:54 PM,2023-12-11T12:54:00.000Z,4-15-24 3:59 AM,2024-04-15T03:59:00.000Z,5-15-24 8:01 AM,2024-05-15T08:01:00.000Z,4,4,,CO,CLOSE,Y,,NO,CHATHAM
23-52894,TA 2024 - B3602 Nat Gas train PM,B-3602,B-3602,1272,,,12-11-23 12:52 PM,2023-12-11T12:52:00.000Z,4-15-24 3:56 AM,2024-04-15T03:56:00.000Z,5-15-24 7:39 AM,2024-05-15T07:39:00.000Z,4,4,,CO,CLOSE,Y,,NO,CHATHAM
23-52893,TA 2024 - B3601 Nat Gas train PM,B-3601,B-3601,1271,,,12-11-23 12:51 PM,2023-12-11T12:51:00.000Z,4-15-24 3:53 AM,2024-04-15T03:53:00.000Z,5-15-24 7:36 AM,2024-05-15T07:36:00.000Z,4,4,,CO,CLOSE,Y,,NO,CHATHAM
23-52892,TA 2024 - ME3601 Nat Gas train PM,ME-3601,ME-3601,3393,,,12-11-23 12:50 PM,2023-12-11T12:50:00.000Z,4-15-24 3:58 AM,2024-04-15T03:58:00.000Z,5-15-24 7:55 AM,2024-05-15T07:55:00.000Z,4,4,,CO,CLOSE,Y,,NO,CHATHAM
23-52891,TA 2024 - ME-3602 Instrument PM,ME-3602,ME-3602,3395,,,12-11-23 12:48 PM,2023-12-11T12:48:00.000Z,4-15-24 3:51 AM,2024-04-15T03:51:00.000Z,5-15-24 8:00 AM,2024-05-15T08:00:00.000Z,4,4,,CO,CLOSE,Y,,NO,CHATHAM
23-52890,TA 2024 - ME-3601 Instrument PM,ME-3601,ME-3601,3393,,,12-11-23 12:46 PM,2023-12-11T12:46:00.000Z,4-15-24 3:47 AM,2024-04-15T03:47:00.000Z,5-15-24 7:55 AM,2024-05-15T07:55:00.000Z,4,4,,CO,CLOSE,Y,,NO,CHATHAM
23-52889,TA 2024 - B3602 Instrument PM,B-3602,B-3602,1272,,,12-11-23 12:43 PM,2023-12-11T12:43:00.000Z,4-15-24 3:45 AM,2024-04-15T03:45:00.000Z,5-15-24 7:38 AM,2024-05-15T07:38:00.000Z,4,4,,CO,CLOSE,Y,,NO,CHATHAM
23-52888,TA 2024 - B3601 Instrument PM,B-3601,B-3601,1271,,,12-11-23 12:41 PM,2023-12-11T12:41:00.000Z,4-15-24 3:41 AM,2024-04-15T03:41:00.000Z,5-15-24 7:35 AM,2024-05-15T07:35:00.000Z,4,4,,CO,CLOSE,Y,,NO,CHATHAM
23-52887,TA24 Spring - Nitrogen Purge MSU2,V-1591A,V-1591A,6300,,,12-11-23 12:38 PM,2023-12-11T12:38:00.000Z,4-10-24 3:08 PM,2024-04-10T15:08:00.000Z,5-24-24 10:08 AM,2024-05-24T10:08:00.000Z,4,4,,CO,CLOSE,Y,,NO,CHATHAM
23-52886,TA 2024 I/E- P3201B Multiline termination change,P-3201B,P-3201B,,,,12-11-23 11:54 AM,2023-12-11T11:54:00.000Z,4-26-24 3:30 PM,2024-04-26T15:30:00.000Z,5-15-24 8:07 AM,2024-05-15T08:07:00.000Z,4,4,,CO,CLOSE,Y,,NO,CHATHAM
23-52885,TA24 Spring - Nitrogen Purge MSU3,V-6585A,V-6585A,6338,,,12-11-23 11:52 AM,2023-12-11T11:52:00.000Z,10-31-24 3:17 PM,2024-10-31T15:17:00.000Z,12-2-24 8:58 AM,2024-12-02T08:58:00.000Z,4,4,,CO,CLOSE,Y,,NO,CHATHAM
23-52884,TA24 Fall I/E- P3201B Capacitor snubber cct change,P-3201B,P-3201B,,,,12-11-23 11:50 AM,2023-12-11T11:50:00.000Z,5-24-24 3:25 PM,2024-05-24T15:25:00.000Z,11-19-24 10:13 AM,2024-11-19T10:13:00.000Z,4,4,,CO,CLOSE,Y,,NO,CHATHAM
23-52883,TA24 Fall I/E- P3201A Capacitor snubber cct change,P-3201A,P-3201A,,,,12-11-23 11:45 AM,2023-12-11T11:45:00.000Z,10-31-24 1:46 PM,2024-10-31T13:46:00.000Z,11-19-24 10:13 AM,2024-11-19T10:13:00.000Z,4,4,,SD,CLOSE,Y,,NO,CHATHAM
23-52882,TA24 Spring - Open MSU2 for Visual Inspection of Beads,V-1591A,V-1591A,6300,,,12-11-23 11:37 AM,2023-12-11T11:37:00.000Z,10-31-24 3:26 PM,2024-10-31T15:26:00.000Z,1-13-25 10:10 AM,2025-01-13T10:10:00.000Z,4,4,,CO,CLOSE,Y,,NO,CHATHAM
23-52881,TA 2024- I/E- P3201B Power Supply Overhaul & Wiring,P-3201B,P-3201B,,,,12-11-23 11:35 AM,2023-12-11T11:35:00.000Z,4-26-24 1:43 PM,2024-04-26T13:43:00.000Z,9-19-24 11:47 AM,2024-09-19T11:47:00.000Z,4,4,,CO,CLOSE,Y,,NO,CHATHAM
23-52880,TA 2024 -  I/E- P3201A Power Supply Overhaul & Wiring,P-3201A,P-3201A,,,,12-11-23 11:32 AM,2023-12-11T11:32:00.000Z,4-26-24 1:29 PM,2024-04-26T13:29:00.000Z,9-19-24 11:47 AM,2024-09-19T11:47:00.000Z,4,4,,CO,CLOSE,Y,,NO,CHATHAM
23-52879,TA28 SPRING PSV-33101 - End of life,PSV-33101,PSV-33101,4424,,,12-11-23 11:29 AM,2023-12-11T11:29:00.000Z,12-31-28 3:42 PM,2028-12-31T15:42:00.000Z,,,4,4,,CO,SCHED,N,,NO,CHATHAM
23-52877,TA24 Spring - RV1201B weld repairs,RV-1201B,RV-1201B,4852,,,12-11-23 11:25 AM,2023-12-11T11:25:00.000Z,4-26-24 3:39 PM,2024-04-26T15:39:00.000Z,5-22-24 9:24 AM,2024-05-22T09:24:00.000Z,4,4,,CO,CLOSE,Y,,NO,CHATHAM
23-52876,Inspect Switches on Current Limiting Reactor,3800,3800,,,,12-11-23 11:22 AM,2023-12-11T11:22:00.000Z,4-30-24 4:49 AM,2024-04-30T04:49:00.000Z,5-15-24 7:29 AM,2024-05-15T07:29:00.000Z,4,4,,PM,CLOSE,Y,,NO,CHATHAM
23-52875,PSV-69205 - Drain piping issues,PSV-69205,PSV-69205,4577,,,12-11-23 11:14 AM,2023-12-11T11:14:00.000Z,4-30-24 7:59 AM,2024-04-30T07:59:00.000Z,,,4,4,,CO,CAN,Y,,NO,CHATHAM
23-52874,PSV-69203 - Drain piping issues,PSV-69203,PSV-69203,4575,,,12-11-23 11:09 AM,2023-12-11T11:09:00.000Z,4-30-24 7:54 AM,2024-04-30T07:54:00.000Z,,,4,4,,CO,CAN,Y,,NO,CHATHAM
23-52873,PSV-33301 - Due for servicing,3300-26K-03,3300-26K-03,,,,12-11-23 11:03 AM,2023-12-11T11:03:00.000Z,4-30-24 3:38 PM,2024-04-30T15:38:00.000Z,10-22-24 8:00 PM,2024-10-22T20:00:00.000Z,4,4,,CO,CLOSE,Y,,NO,CHATHAM
23-52872,PSV-22203 - Issue found during inspection,PSV-22203,PSV-22203,4399,,,12-11-23 10:56 AM,2023-12-11T10:56:00.000Z,4-30-24 2:48 PM,2024-04-30T14:48:00.000Z,6-5-25 6:39 PM,2025-06-05T18:39:00.000Z,4,4,,CO,CLOSE,Y,,NO,CHATHAM
23-52871,PSV-14111 - Wrong set pressure set to 157 psi,PSV-14111,PSV-14111,4352,,,12-11-23 10:53 AM,2023-12-11T10:53:00.000Z,10-31-24 11:37 AM,2024-10-31T11:37:00.000Z,5-16-24 9:22 AM,2024-05-16T09:22:00.000Z,4,4,,CO,CLOSE,Y,,NO,CHATHAM
23-52870,PSV-15304 - Short bolting,PSV-15304,PSV-15304,4372,,,12-11-23 10:48 AM,2023-12-11T10:48:00.000Z,4-30-24 12:42 PM,2024-04-30T12:42:00.000Z,,,4,4,,CO,APPR,N,,NO,CHATHAM
23-52869,PSV-16307 - End of life,PSV-16307,PSV-16307,4391,,,12-11-23 10:43 AM,2023-12-11T10:43:00.000Z,4-30-26 12:46 PM,2026-04-30T12:46:00.000Z,,,4,4,,CO,SCHED,N,,NO,CHATHAM
23-52868,Replace 2x6 pieces in CTF-3201B shroud,CTF-3201B,CTF-3201B,,,,12-11-23 10:37 AM,2023-12-11T10:37:00.000Z,4-22-24 3:53 PM,2024-04-22T15:53:00.000Z,5-15-24 7:44 AM,2024-05-15T07:44:00.000Z,4,4,,CO,CLOSE,Y,,NO,CHATHAM
23-52867,Repair Insulation,RV-1832,RV-1832,,,,12-11-23 10:30 AM,2023-12-11T10:30:00.000Z,12-31-23 10:30 AM,2023-12-31T10:30:00.000Z,12-11-23 10:31 AM,2023-12-11T10:31:00.000Z,4,4,,CO,CLOSE,Y,,NO,CHATHAM
23-52866,Replace structural 2x6's in CTF-3201,CTF-3201A,CTF-3201A,,,,12-11-23 10:27 AM,2023-12-11T10:27:00.000Z,4-22-24 4:15 PM,2024-04-22T16:15:00.000Z,,,4,4,,CO,CAN,Y,,NO,CHATHAM
23-52865,SAFETY SHOWER WEEKLY FLUSH,SS-3524,SS-3524,,,,12-11-23 10:01 AM,2023-12-11T10:01:00.000Z,12-18-23 8:30 AM,2023-12-18T08:30:00.000Z,7-8-24 7:35 AM,2024-07-08T07:35:00.000Z,4,4,,PM,CLOSE,Y,,NO,CHATHAM
23-52864,Maintenance safety Shower Inspection,SS-3524,SS-3524,,,,12-11-23 10:01 AM,2023-12-11T10:01:00.000Z,12-18-23 9:30 AM,2023-12-18T09:30:00.000Z,7-8-24 7:35 AM,2024-07-08T07:35:00.000Z,4,4,,PM,CLOSE,Y,N,NO,CHATHAM
23-52863,PSV-16403 - End of life,PSV-16403,PSV-16403,4394,,,12-11-23 8:53 AM,2023-12-11T08:53:00.000Z,4-30-26 2:24 PM,2026-04-30T14:24:00.000Z,,,4,4,,CO,SCHED,N,,NO,CHATHAM
23-52860,replace insulation,LV-16302,LV-16302,3299,,,12-11-23 7:46 AM,2023-12-11T07:46:00.000Z,12-31-23 7:46 AM,2023-12-31T07:46:00.000Z,3-11-25 3:20 PM,2025-03-11T15:20:00.000Z,4,4,,CO,CLOSE,Y,,NO,CHATHAM
23-52859,TA 2024 B3602 Nat gas control valve FY-69202,B-3602,B-3602,1272,,,12-11-23 7:12 AM,2023-12-11T07:12:00.000Z,10-20-23 1:15 PM,2023-10-20T13:15:00.000Z,2-14-24 9:20 AM,2024-02-14T09:20:00.000Z,4,4,,CO,CLOSE,Y,,NO,CHATHAM
23-52858,Clean and inspect AT-16301,AT-16301,AT-16301,1235,,,12-11-23 7:07 AM,2023-12-11T07:07:00.000Z,11-10-23 10:26 AM,2023-11-10T10:26:00.000Z,,,4,4,,SD,WAPPR,N,,NO,CHATHAM
23-52725,PH PROBE CLEANING AND CALIBRATION WEEKLY PM,AT-84505,AT-84505,6885,,,12-11-23 1:49 AM,2023-12-11T01:49:00.000Z,1-4-24 1:00 AM,2024-01-04T01:00:00.000Z,1-4-24 10:47 AM,2024-01-04T10:47:00.000Z,4,4,,PM,CLOSE,Y,,NO,CHATHAM
23-52724,C-1803D pH Meter-Weekly PM,AT-84505,AT-84505,6885,,,12-11-23 1:49 AM,2023-12-11T01:49:00.000Z,1-4-24 12:00 AM,2024-01-04T00:00:00.000Z,1-4-24 1:00 AM,2024-01-04T01:00:00.000Z,4,4,,PM,CLOSE,Y,N,NO,CHATHAM
23-52723,"Area Asset Checks-1830, 1840, DDG Cooler",1800,1800,,,,12-11-23 1:49 AM,2023-12-11T01:49:00.000Z,1-8-24 12:00 AM,2024-01-08T00:00:00.000Z,1-10-24 1:10 PM,2024-01-10T13:10:00.000Z,4,4,,PM,CLOSE,Y,,NO,CHATHAM
23-52722,"Area Asset Checks-1830, 1840, DDG Cooler",1800,1800,,,,12-11-23 1:49 AM,2023-12-11T01:49:00.000Z,1-8-24 12:00 AM,2024-01-08T00:00:00.000Z,1-10-24 1:00 AM,2024-01-10T01:00:00.000Z,4,4,,PM,CLOSE,Y,N,NO,CHATHAM
23-52721,"Area Asset Checks-2200, 2300, 3200, 3600, 4100",2200,2200,,,,12-11-23 1:49 AM,2023-12-11T01:49:00.000Z,1-8-24 12:00 AM,2024-01-08T00:00:00.000Z,1-11-24 7:26 AM,2024-01-11T07:26:00.000Z,4,4,,PM,CLOSE,Y,,NO,CHATHAM
23-52720,"Area Asset Checks-2200, 2300, 3200, 3600, 4100",2200,2200,,,,12-11-23 1:49 AM,2023-12-11T01:49:00.000Z,1-8-24 12:00 AM,2024-01-08T00:00:00.000Z,1-11-24 2:00 AM,2024-01-11T02:00:00.000Z,4,4,,PM,CLOSE,Y,N,NO,CHATHAM
23-52719,"Area Asset Checks-1600, 1660, 1700 (Evaps, Corn oil, Decanyers)",1600,1600,,,,12-11-23 1:49 AM,2023-12-11T01:49:00.000Z,1-8-24 12:00 AM,2024-01-08T00:00:00.000Z,1-10-24 7:31 AM,2024-01-10T07:31:00.000Z,4,4,,PM,CLOSE,Y,,NO,CHATHAM
23-52718,"Area Asset Checks-1600, 1660, 1700",1600,1600,,,,12-11-23 1:49 AM,2023-12-11T01:49:00.000Z,1-8-24 12:00 AM,2024-01-08T00:00:00.000Z,1-10-24 2:00 AM,2024-01-10T02:00:00.000Z,4,4,,PM,CLOSE,Y,N,NO,CHATHAM
23-52717,"Area Asset Checks-1500, 6500 (Distillation)",1500,1500,,,,12-11-23 1:49 AM,2023-12-11T01:49:00.000Z,1-8-24 12:00 AM,2024-01-08T00:00:00.000Z,1-8-24 9:48 AM,2024-01-08T09:48:00.000Z,4,4,,PM,CLOSE,Y,,NO,CHATHAM
23-52716,"Area Asset Checks-1500, 6500",1500,1500,,,,12-11-23 1:49 AM,2023-12-11T01:49:00.000Z,1-8-24 12:00 AM,2024-01-08T00:00:00.000Z,1-8-24 1:00 AM,2024-01-08T01:00:00.000Z,4,4,,PM,CLOSE,Y,N,NO,CHATHAM
23-52715,"Area Asset Checks-2100, 1200, 1300, 1400 (Corn, Mill, Mash, Fermentation)",2100,2100,,,,12-11-23 1:49 AM,2023-12-11T01:49:00.000Z,1-8-24 2:30 AM,2024-01-08T02:30:00.000Z,1-8-24 10:08 AM,2024-01-08T10:08:00.000Z,4,4,,PM,CLOSE,Y,,NO,CHATHAM
23-52714,"Area Asset Checks-2100, 1200, 1300, 1400 (Corn, Mill, Mash, Fermentation)",2100,2100,,,,12-11-23 1:49 AM,2023-12-11T01:49:00.000Z,1-8-24 12:00 AM,2024-01-08T00:00:00.000Z,1-8-24 1:30 AM,2024-01-08T01:30:00.000Z,4,4,,PM,CLOSE,Y,N,NO,CHATHAM
23-52713,"Area Asset Checks-1830, 1840, DDG Cooler",1800,1800,,,,12-11-23 1:49 AM,2023-12-11T01:49:00.000Z,1-8-24 12:00 AM,2024-01-08T00:00:00.000Z,1-12-24 7:08 AM,2024-01-12T07:08:00.000Z,4,4,,PM,CLOSE,Y,,NO,CHATHAM
23-52712,"Area Asset Checks-1830, 1840, DDG Cooler",1800,1800,,,,12-11-23 1:49 AM,2023-12-11T01:49:00.000Z,1-8-24 12:00 AM,2024-01-08T00:00:00.000Z,1-11-24 2:00 AM,2024-01-11T02:00:00.000Z,4,4,,PM,CLOSE,Y,N,NO,CHATHAM
23-52711,"Area Asset Checks-2200, 2300, 3200, 3600, 4100",2200,2200,,,,12-11-23 1:49 AM,2023-12-11T01:49:00.000Z,1-8-24 12:00 AM,2024-01-08T00:00:00.000Z,1-8-24 3:40 PM,2024-01-08T15:40:00.000Z,4,4,,PM,CLOSE,Y,,NO,CHATHAM
23-52710,"Area Asset Checks-2200, 2300, 3200, 3600, 4100",2200,2200,,,,12-11-23 1:49 AM,2023-12-11T01:49:00.000Z,1-8-24 12:00 AM,2024-01-08T00:00:00.000Z,1-8-24 2:00 AM,2024-01-08T02:00:00.000Z,4,4,,PM,CLOSE,Y,N,NO,CHATHAM
23-52709,"Area Asset Checks-1600, 1660, 1700 (Evaps, Corn oil, Decanyers)",1600,1600,,,,12-11-23 1:49 AM,2023-12-11T01:49:00.000Z,1-8-24 12:00 AM,2024-01-08T00:00:00.000Z,1-11-24 5:27 PM,2024-01-11T17:27:00.000Z,4,4,,PM,CLOSE,Y,,NO,CHATHAM
23-52708,"Area Asset Checks-1600, 1660, 1700",1600,1600,,,,12-11-23 1:49 AM,2023-12-11T01:49:00.000Z,1-8-24 12:00 AM,2024-01-08T00:00:00.000Z,1-11-24 1:00 AM,2024-01-11T01:00:00.000Z,4,4,,PM,CLOSE,Y,N,NO,CHATHAM
23-52707,"Area Asset Checks-1500, 6500 (Distillation)",1500,1500,,,,12-11-23 1:49 AM,2023-12-11T01:49:00.000Z,1-8-24 12:00 AM,2024-01-08T00:00:00.000Z,1-10-24 7:26 AM,2024-01-10T07:26:00.000Z,4,4,,PM,CLOSE,Y,,NO,CHATHAM
23-52706,"Area Asset Checks-1500, 6500",1500,1500,,,,12-11-23 1:49 AM,2023-12-11T01:49:00.000Z,1-8-24 12:00 AM,2024-01-08T00:00:00.000Z,1-9-24 3:00 AM,2024-01-09T03:00:00.000Z,4,4,,PM,CLOSE,Y,N,NO,CHATHAM
23-52705,"Area Asset Checks-2100, 1200, 1300, 1400 (Corn, Mill, Mash, Fermentation)",2100,2100,,,,12-11-23 1:49 AM,2023-12-11T01:49:00.000Z,1-8-24 5:00 AM,2024-01-08T05:00:00.000Z,1-8-24 2:56 PM,2024-01-08T14:56:00.000Z,4,4,,PM,CLOSE,Y,,NO,CHATHAM
23-52704,"Area Asset Checks-2100, 1200, 1300, 1400 (Corn, Mill, Mash, Fermentation)",2100,2100,,,,12-11-23 1:49 AM,2023-12-11T01:49:00.000Z,1-8-24 12:00 AM,2024-01-08T00:00:00.000Z,1-8-24 1:00 AM,2024-01-08T01:00:00.000Z,4,4,,PM,CLOSE,Y,N,NO,CHATHAM
23-52703,BL-1804D WEEKLY GREASING,BL-1804D,BL-1804D,,,,12-11-23 1:49 AM,2023-12-11T01:49:00.000Z,1-8-24 12:00 AM,2024-01-08T00:00:00.000Z,1-8-24 8:27 AM,2024-01-08T08:27:00.000Z,4,4,,PM,CLOSE,Y,,NO,CHATHAM
23-52702,BL-1804D - WEEKLY BEARING GREASING,BL-1804D,BL-1804D,,,,12-11-23 1:49 AM,2023-12-11T01:49:00.000Z,1-8-24 12:00 AM,2024-01-08T00:00:00.000Z,1-8-24 12:15 AM,2024-01-08T00:15:00.000Z,4,4,,PM,CLOSE,Y,N,NO,CHATHAM
23-52701,5S AND STOCKROOM AUDIT-WEEKLY PM,MAINTENANCE,MAINTENANCE,,,,12-11-23 1:49 AM,2023-12-11T01:49:00.000Z,1-8-24 12:00 AM,2024-01-08T00:00:00.000Z,1-15-24 8:19 AM,2024-01-15T08:19:00.000Z,4,4,,PM,CLOSE,Y,N,NO,CHATHAM
23-52699,GIVE SAMPLE TO SHIPPER/RECEIVER,ME-3602A,ME-3602A,,,,12-11-23 1:49 AM,2023-12-11T01:49:00.000Z,1-8-24 12:00 AM,2024-01-08T00:00:00.000Z,1-9-24 10:15 AM,2024-01-09T10:15:00.000Z,4,4,,PM,CLOSE,Y,,NO,CHATHAM
23-52698,CHECK OIL LEVEL,ME-3602A,ME-3602A,,,,12-11-23 1:49 AM,2023-12-11T01:49:00.000Z,1-8-24 12:30 AM,2024-01-08T00:30:00.000Z,1-9-24 10:15 AM,2024-01-09T10:15:00.000Z,4,4,,PM,CLOSE,Y,,NO,CHATHAM
23-52697,EXTRACT OIL SAMPLE,ME-3602A,ME-3602A,,,,12-11-23 1:49 AM,2023-12-11T01:49:00.000Z,1-8-24 12:30 AM,2024-01-08T00:30:00.000Z,1-9-24 10:15 AM,2024-01-09T10:15:00.000Z,4,4,,PM,CLOSE,Y,,NO,CHATHAM
23-52696,PREPARATION OF CONTAINERS,ME-3602A,ME-3602A,,,,12-11-23 1:49 AM,2023-12-11T01:49:00.000Z,1-8-24 12:00 AM,2024-01-08T00:00:00.000Z,1-9-24 10:15 AM,2024-01-09T10:15:00.000Z,4,4,,PM,CLOSE,Y,,NO,CHATHAM
23-52695,ME-3602A - LUBE OIL SAMPLE,ME-3602A,ME-3602A,,,,12-11-23 1:48 AM,2023-12-11T01:48:00.000Z,1-8-24 12:30 AM,2024-01-08T00:30:00.000Z,1-8-24 1:00 AM,2024-01-08T01:00:00.000Z,4,4,,PM,CLOSE,Y,N,NO,CHATHAM
23-52694,TOTE#5 (4) 100' EXPLOSION PROOF EXTENSION CORDS,CHATHAM,CHATHAM,,,,12-11-23 1:48 AM,2023-12-11T01:48:00.000Z,1-5-24 12:00 AM,2024-01-05T00:00:00.000Z,6-20-24 2:12 PM,2024-06-20T14:12:00.000Z,4,4,,PM,CLOSE,Y,,NO,CHATHAM
23-52693,"TOTE #4 (4) COATS, (4) BIBS, (10) GLOVES, HARD HAT LINERS, NECK WARMERS, (20) INFERNO PACKS",CHATHAM,CHATHAM,,,,12-11-23 1:48 AM,2023-12-11T01:48:00.000Z,1-5-24 12:00 AM,2024-01-05T00:00:00.000Z,6-20-24 2:12 PM,2024-06-20T14:12:00.000Z,4,4,,PM,CLOSE,Y,,NO,CHATHAM
23-52692,TOTE #3 (2) SNAKE INSULATION BLANKETS,CHATHAM,CHATHAM,,,,12-11-23 1:48 AM,2023-12-11T01:48:00.000Z,1-5-24 12:00 AM,2024-01-05T00:00:00.000Z,6-20-24 2:12 PM,2024-06-20T14:12:00.000Z,4,4,,PM,CLOSE,Y,,NO,CHATHAM
23-52691,TOTE #2 (2) SNAKE INSULATION BLANKETS,CHATHAM,CHATHAM,,,,12-11-23 1:48 AM,2023-12-11T01:48:00.000Z,1-5-24 12:00 AM,2024-01-05T00:00:00.000Z,6-20-24 2:12 PM,2024-06-20T14:12:00.000Z,4,4,,PM,CLOSE,Y,,NO,CHATHAM
23-52690,TOTE #1 250' PORTABLE HEAT TRACING,CHATHAM,CHATHAM,,,,12-11-23 1:48 AM,2023-12-11T01:48:00.000Z,1-5-24 12:00 AM,2024-01-05T00:00:00.000Z,6-20-24 2:12 PM,2024-06-20T14:12:00.000Z,4,4,,PM,CLOSE,Y,,NO,CHATHAM
23-52689,COLD WEATHER PLAN (TOTE INSPECTION/AUDIT),CHATHAM,CHATHAM,,,,12-11-23 1:48 AM,2023-12-11T01:48:00.000Z,1-5-24 1:00 AM,2024-01-05T01:00:00.000Z,6-20-24 2:12 PM,2024-06-20T14:12:00.000Z,4,4,,PM,CLOSE,Y,N,NO,CHATHAM
23-52688,Weekly Vibration check (GFE I/E),MI-1201A,MI-1201A,,,,12-11-23 1:48 AM,2023-12-11T01:48:00.000Z,1-4-24 12:00 AM,2024-01-04T00:00:00.000Z,1-4-24 2:28 PM,2024-01-04T14:28:00.000Z,4,4,,PM,CLOSE,Y,,NO,CHATHAM
23-52687,HAMMERMILL WEEKLY PM & ROTATION CHANGE,MI-1201A,MI-1201A,,,,12-11-23 1:48 AM,2023-12-11T01:48:00.000Z,1-4-24 12:00 AM,2024-01-04T00:00:00.000Z,1-4-24 2:28 PM,2024-01-04T14:28:00.000Z,4,4,,PM,CLOSE,Y,,NO,CHATHAM
23-52686,MI-1201A - MECHANICAL PM,MI-1201A,MI-1201A,,,,12-11-23 1:48 AM,2023-12-11T01:48:00.000Z,1-4-24 12:30 AM,2024-01-04T00:30:00.000Z,1-4-24 1:00 AM,2024-01-04T01:00:00.000Z,4,4,,PM,CLOSE,Y,N,NO,CHATHAM
23-52685,Weekly Vibration check (GFE I/E),MI-1201B,MI-1201B,,,,12-11-23 1:48 AM,2023-12-11T01:48:00.000Z,1-8-24 12:00 AM,2024-01-08T00:00:00.000Z,1-12-24 11:49 AM,2024-01-12T11:49:00.000Z,4,4,,PM,CLOSE,Y,,NO,CHATHAM
23-52684,MI-1201B - GREASE CHANGE OUT,MI-1201B,MI-1201B,,,,12-11-23 1:48 AM,2023-12-11T01:48:00.000Z,1-8-24 12:00 AM,2024-01-08T00:00:00.000Z,1-12-24 11:49 AM,2024-01-12T11:49:00.000Z,4,4,,PM,CLOSE,Y,,NO,CHATHAM
23-52683,MI-1201B - WEEKLY PM & ROTATION CHANGE,MI-1201B,MI-1201B,,,,12-11-23 1:48 AM,2023-12-11T01:48:00.000Z,1-8-24 12:00 AM,2024-01-08T00:00:00.000Z,1-12-24 11:49 AM,2024-01-12T11:49:00.000Z,4,4,,PM,CLOSE,Y,,NO,CHATHAM
23-52682,MI-1201B - MECHANICAL PM,MI-1201B,MI-1201B,,,,12-11-23 1:48 AM,2023-12-11T01:48:00.000Z,1-8-24 1:00 AM,2024-01-08T01:00:00.000Z,1-12-24 1:00 AM,2024-01-12T01:00:00.000Z,4,4,,PM,CLOSE,Y,N,NO,CHATHAM
23-52681,PT-32104 PM TO FLUSH TRANSMITTER (3 MONTH),PT-32104,PT-32104,4622,,,12-11-23 1:48 AM,2023-12-11T01:48:00.000Z,1-3-24 12:00 AM,2024-01-03T00:00:00.000Z,1-3-24 9:45 AM,2024-01-03T09:45:00.000Z,4,4,,PM,CLOSE,Y,,NO,CHATHAM
23-52680,PT-32104 PM TO FLUSH TRANSMITTER,PT-32104,PT-32104,4622,,,12-11-23 1:48 AM,2023-12-11T01:48:00.000Z,1-3-24 12:00 AM,2024-01-03T00:00:00.000Z,1-3-24 12:30 AM,2024-01-03T00:30:00.000Z,4,4,,PM,CLOSE,Y,N,NO,CHATHAM
23-52679,VFD FILTER CLEANING,CHATHAM,CHATHAM,,,,12-11-23 1:48 AM,2023-12-11T01:48:00.000Z,1-8-24 12:00 AM,2024-01-08T00:00:00.000Z,1-8-24 10:58 AM,2024-01-08T10:58:00.000Z,4,4,,PM,CLOSE,Y,,NO,CHATHAM
23-52678,VFD FILTER CLEANING,CHATHAM,CHATHAM,,,,12-11-23 1:48 AM,2023-12-11T01:48:00.000Z,1-8-24 12:00 AM,2024-01-08T00:00:00.000Z,1-8-24 1:30 AM,2024-01-08T01:30:00.000Z,4,4,,PM,CLOSE,Y,N,NO,CHATHAM
23-52677,PH PROBE CLEANING AND CALIBRATION WEEKLY PM,AT-14125,AT-14125,1230,,,12-11-23 1:48 AM,2023-12-11T01:48:00.000Z,1-4-24 1:00 AM,2024-01-04T01:00:00.000Z,1-4-24 8:46 AM,2024-01-04T08:46:00.000Z,4,4,,PM,CLOSE,Y,,NO,CHATHAM
23-52676,PH PROBE CLEANING AND CALIBRATION PM,AT-14125,AT-14125,1230,,,12-11-23 1:48 AM,2023-12-11T01:48:00.000Z,1-4-24 12:00 AM,2024-01-04T00:00:00.000Z,1-4-24 1:00 AM,2024-01-04T01:00:00.000Z,4,4,,PM,CLOSE,Y,N,NO,CHATHAM
23-52675,PH PROBE CLEANING AND CALIBRATION WEEKLY PM,AT-13519,AT-13519,1227,,,12-11-23 1:48 AM,2023-12-11T01:48:00.000Z,1-4-24 1:00 AM,2024-01-04T01:00:00.000Z,1-3-24 11:20 AM,2024-01-03T11:20:00.000Z,4,4,,PM,CLOSE,Y,,NO,CHATHAM
23-52674,PH PROBE CLEANING AND CALIBRATION PM,AT-13519,AT-13519,1227,,,12-11-23 1:48 AM,2023-12-11T01:48:00.000Z,1-4-24 12:00 AM,2024-01-04T00:00:00.000Z,1-3-24 12:30 AM,2024-01-03T00:30:00.000Z,4,4,,PM,CLOSE,Y,N,NO,CHATHAM
23-52673,Monitor & fill salt boxes,CHATHAM,CHATHAM,,,,12-11-23 1:48 AM,2023-12-11T01:48:00.000Z,1-4-24 1:00 AM,2024-01-04T01:00:00.000Z,1-4-24 2:28 PM,2024-01-04T14:28:00.000Z,4,4,,PM,CLOSE,Y,,NO,CHATHAM
23-52672,Thursday route - Fill plant salt boxes,CHATHAM,CHATHAM,,,,12-11-23 1:48 AM,2023-12-11T01:48:00.000Z,1-4-24 12:00 AM,2024-01-04T00:00:00.000Z,1-4-24 1:00 AM,2024-01-04T01:00:00.000Z,4,4,,PM,CLOSE,Y,N,NO,CHATHAM
23-52671,Monitor & fill salt boxes,CHATHAM,CHATHAM,,,,12-11-23 1:48 AM,2023-12-11T01:48:00.000Z,1-8-24 1:00 AM,2024-01-08T01:00:00.000Z,1-9-24 4:38 PM,2024-01-09T16:38:00.000Z,4,4,,PM,CLOSE,Y,,NO,CHATHAM
23-52670,Monday route - Fill plant salt boxes,CHATHAM,CHATHAM,,,,12-11-23 1:48 AM,2023-12-11T01:48:00.000Z,1-8-24 12:00 AM,2024-01-08T00:00:00.000Z,1-8-24 2:00 AM,2024-01-08T02:00:00.000Z,4,4,,PM,CLOSE,Y,N,NO,CHATHAM
23-52669,LUBRICATE MOTOR WHILE RUNNING,MX-1302,MX-1302,3563,,,12-11-23 1:48 AM,2023-12-11T01:48:00.000Z,1-8-24 12:00 AM,2024-01-08T00:00:00.000Z,1-8-24 4:17 PM,2024-01-08T16:17:00.000Z,4,4,,PM,CLOSE,Y,,NO,CHATHAM
23-52668,MX-1302 - MOTOR GREASING,MX-1302,MX-1302,3563,,,12-11-23 1:48 AM,2023-12-11T01:48:00.000Z,1-8-24 12:15 AM,2024-01-08T00:15:00.000Z,1-8-24 1:00 AM,2024-01-08T01:00:00.000Z,4,4,,PM,CLOSE,Y,N,NO,CHATHAM
23-52667,MCC'S HOUSEKEEPING,CHATHAM,CHATHAM,,,,12-11-23 1:48 AM,2023-12-11T01:48:00.000Z,1-8-24 12:00 AM,2024-01-08T00:00:00.000Z,6-21-24 7:41 AM,2024-06-21T07:41:00.000Z,4,4,,PM,CLOSE,Y,,NO,CHATHAM
23-52666,MCC'S HOUSEKEEPING PM,CHATHAM,CHATHAM,,,,12-11-23 1:48 AM,2023-12-11T01:48:00.000Z,1-8-24 12:00 AM,2024-01-08T00:00:00.000Z,6-21-24 7:41 AM,2024-06-21T07:41:00.000Z,4,4,,PM,CLOSE,Y,N,NO,CHATHAM
23-52665,TK-3510 CLEANOUT 1 YR PM,TK-3510,TK-3510,5514,,,12-11-23 1:48 AM,2023-12-11T01:48:00.000Z,5-6-24 12:00 AM,2024-05-06T00:00:00.000Z,4-9-24 10:33 AM,2024-04-09T10:33:00.000Z,4,4,,SD,CLOSE,Y,,NO,CHATHAM
23-52664,TK-3510 CLEANOUT PM,TK-3510,TK-3510,5514,,,12-11-23 1:48 AM,2023-12-11T01:48:00.000Z,5-6-24 12:00 AM,2024-05-06T00:00:00.000Z,4-9-24 10:33 AM,2024-04-09T10:33:00.000Z,4,4,,SD,CLOSE,Y,N,NO,CHATHAM
23-52663,Main aisle,CHATHAM,CHATHAM,,,,12-11-23 1:47 AM,2023-12-11T01:47:00.000Z,2-4-24 8:00 AM,2024-02-04T08:00:00.000Z,12-17-24 11:26 PM,2024-12-17T23:26:00.000Z,4,4,,CO,CLOSE,Y,,NO,CHATHAM
23-52662,Dryer/decanter area,CHATHAM,CHATHAM,,,,12-11-23 1:47 AM,2023-12-11T01:47:00.000Z,2-4-24 12:00 AM,2024-02-04T00:00:00.000Z,12-17-24 11:26 PM,2024-12-17T23:26:00.000Z,4,4,,CO,CLOSE,Y,,NO,CHATHAM
23-52661,Syrup Loading,CHATHAM,CHATHAM,,,,12-11-23 1:47 AM,2023-12-11T01:47:00.000Z,2-4-24 12:00 AM,2024-02-04T00:00:00.000Z,12-17-24 11:26 PM,2024-12-17T23:26:00.000Z,4,4,,CO,CLOSE,Y,,NO,CHATHAM
23-52660,Old distillation,CHATHAM,CHATHAM,,,,12-11-23 1:47 AM,2023-12-11T01:47:00.000Z,2-4-24 12:00 AM,2024-02-04T00:00:00.000Z,12-17-24 11:26 PM,2024-12-17T23:26:00.000Z,4,4,,CO,CLOSE,Y,,NO,CHATHAM
23-52659,Start at new distillation,CHATHAM,CHATHAM,,,,12-11-23 1:47 AM,2023-12-11T01:47:00.000Z,2-4-24 12:00 AM,2024-02-04T00:00:00.000Z,12-17-24 11:26 PM,2024-12-17T23:26:00.000Z,4,4,,CO,CLOSE,Y,,NO,CHATHAM
23-52658,Preparation,CHATHAM,CHATHAM,,,,12-11-23 1:47 AM,2023-12-11T01:47:00.000Z,2-4-24 12:00 AM,2024-02-04T00:00:00.000Z,12-17-24 11:26 PM,2024-12-17T23:26:00.000Z,4,4,,CO,CLOSE,Y,,NO,CHATHAM
23-52657,Underground drain cleanout,CHATHAM,CHATHAM,,,,12-11-23 1:47 AM,2023-12-11T01:47:00.000Z,2-4-24 8:00 AM,2024-02-04T08:00:00.000Z,12-17-24 11:26 PM,2024-12-17T23:26:00.000Z,4,4,,CO,CLOSE,Y,N,NO,CHATHAM
23-52656,VISUAL INSPECTION,GW-2302,GW-2302,2474,,,12-11-23 1:47 AM,2023-12-11T01:47:00.000Z,1-8-24 12:00 AM,2024-01-08T00:00:00.000Z,1-8-24 8:27 AM,2024-01-08T08:27:00.000Z,4,4,,PM,CLOSE,Y,,NO,CHATHAM
23-52655,CHECK NUTS AND BOLTS,GW-2302,GW-2302,2474,,,12-11-23 1:47 AM,2023-12-11T01:47:00.000Z,1-8-24 12:00 AM,2024-01-08T00:00:00.000Z,1-8-24 8:27 AM,2024-01-08T08:27:00.000Z,4,4,,PM,CLOSE,Y,,NO,CHATHAM
23-52654,WEST TRUCK LOADING GANGWAY  PM,GW-2302,GW-2302,2474,,,12-11-23 1:47 AM,2023-12-11T01:47:00.000Z,1-8-24 12:00 AM,2024-01-08T00:00:00.000Z,1-8-24 12:30 AM,2024-01-08T00:30:00.000Z,4,4,,PM,CLOSE,Y,N,NO,CHATHAM
23-52653,VISUAL INSPECTION,GW-2301,GW-2301,2473,,,12-11-23 1:47 AM,2023-12-11T01:47:00.000Z,1-8-24 12:00 AM,2024-01-08T00:00:00.000Z,1-8-24 8:27 AM,2024-01-08T08:27:00.000Z,4,4,,PM,CLOSE,Y,,NO,CHATHAM
23-52652,CHECK NUTS AND BOLTS,GW-2301,GW-2301,2473,,,12-11-23 1:47 AM,2023-12-11T01:47:00.000Z,1-8-24 12:00 AM,2024-01-08T00:00:00.000Z,1-8-24 8:27 AM,2024-01-08T08:27:00.000Z,4,4,,PM,CLOSE,Y,,NO,CHATHAM
23-52651,EAST TRUCK LOADING GANGWAY PM,GW-2301,GW-2301,2473,,,12-11-23 1:47 AM,2023-12-11T01:47:00.000Z,1-8-24 12:00 AM,2024-01-08T00:00:00.000Z,1-8-24 12:30 AM,2024-01-08T00:30:00.000Z,4,4,,PM,CLOSE,Y,N,NO,CHATHAM
23-52650,VISUAL INSPECTION,GW-1601,GW-1601,2472,,,12-11-23 1:47 AM,2023-12-11T01:47:00.000Z,1-8-24 12:00 AM,2024-01-08T00:00:00.000Z,1-8-24 8:27 AM,2024-01-08T08:27:00.000Z,4,4,,PM,CLOSE,Y,,NO,CHATHAM
23-52649,CHECK NUTS AND BOLTS,GW-1601,GW-1601,2472,,,12-11-23 1:47 AM,2023-12-11T01:47:00.000Z,1-8-24 12:00 AM,2024-01-08T00:00:00.000Z,1-8-24 8:27 AM,2024-01-08T08:27:00.000Z,4,4,,PM,CLOSE,Y,,NO,CHATHAM
23-52648,STILLAGE TRUCK GANGWAY PM,GW-1601,GW-1601,2472,,,12-11-23 1:47 AM,2023-12-11T01:47:00.000Z,1-8-24 12:00 AM,2024-01-08T00:00:00.000Z,1-8-24 12:30 AM,2024-01-08T00:30:00.000Z,4,4,,PM,CLOSE,Y,N,NO,CHATHAM
23-52647,GREASE MOTOR COUPLING TO PUMP,P-3201B,P-3201B,,,,12-11-23 1:47 AM,2023-12-11T01:47:00.000Z,5-6-24 1:00 AM,2024-05-06T01:00:00.000Z,4-9-24 10:39 AM,2024-04-09T10:39:00.000Z,4,4,,SD,CLOSE,Y,,NO,CHATHAM
23-52646,GREASE COOLING TOWER  MOTOR COUPLING,P-3201B,P-3201B,,,,12-11-23 1:47 AM,2023-12-11T01:47:00.000Z,5-6-24 12:00 AM,2024-05-06T00:00:00.000Z,4-9-24 10:39 AM,2024-04-09T10:39:00.000Z,4,4,,SD,CLOSE,Y,N,NO,CHATHAM
23-52645,GREASE MOTOR COUPLING TO PUMP,P-3201A,P-3201A,,,,12-11-23 1:47 AM,2023-12-11T01:47:00.000Z,5-6-24 1:00 AM,2024-05-06T01:00:00.000Z,4-9-24 10:40 AM,2024-04-09T10:40:00.000Z,4,4,,SD,CLOSE,Y,,NO,CHATHAM
23-52644,GREASE COOLING TOWER  MOTOR COUPLING,P-3201A,P-3201A,,,,12-11-23 1:47 AM,2023-12-11T01:47:00.000Z,5-6-24 12:00 AM,2024-05-06T00:00:00.000Z,4-9-24 10:40 AM,2024-04-09T10:40:00.000Z,4,4,,SD,CLOSE,Y,N,NO,CHATHAM
23-52643,CONDUCTIVITY METER /PH PROBE CLEAN & CALIBRATE PM,AE-84404,AE-84404,7174,,,12-11-23 1:47 AM,2023-12-11T01:47:00.000Z,1-4-24 2:00 AM,2024-01-04T02:00:00.000Z,1-4-24 8:46 AM,2024-01-04T08:46:00.000Z,4,4,,PM,CLOSE,Y,,NO,CHATHAM
23-52642,DRYER SCRUBBER PH PROBE PM,AE-84404,AE-84404,7174,,,12-11-23 1:47 AM,2023-12-11T01:47:00.000Z,1-4-24 1:00 AM,2024-01-04T01:00:00.000Z,1-4-24 1:00 AM,2024-01-04T01:00:00.000Z,4,4,,PM,CLOSE,Y,N,NO,CHATHAM
23-52641,1 MTH GREASE USING EP-2,FA-7417,FA-7417,3409,,,12-11-23 1:47 AM,2023-12-11T01:47:00.000Z,1-8-24 12:00 AM,2024-01-08T00:00:00.000Z,1-8-24 2:38 PM,2024-01-08T14:38:00.000Z,4,4,,PM,CLOSE,Y,,NO,CHATHAM
23-52640,ME-3601 - ENCLOSURE FAN GREASING,FA-7417,FA-7417,3409,,,12-11-23 1:47 AM,2023-12-11T01:47:00.000Z,1-8-24 12:00 AM,2024-01-08T00:00:00.000Z,1-8-24 1:00 AM,2024-01-08T01:00:00.000Z,4,4,,PM,CLOSE,Y,N,NO,CHATHAM
23-52639,Follow procedure below,MX-1801D,MX-1801D,3569,,,12-11-23 1:47 AM,2023-12-11T01:47:00.000Z,3-6-24 12:00 AM,2024-03-06T00:00:00.000Z,6-3-24 6:35 AM,2024-06-03T06:35:00.000Z,4,4,,SD,CLOSE,Y,,NO,CHATHAM
23-52638,Syrup line H.P Wash - DR02,MX-1801D,MX-1801D,3569,,,12-11-23 1:47 AM,2023-12-11T01:47:00.000Z,3-6-24 1:30 AM,2024-03-06T01:30:00.000Z,6-3-24 6:35 AM,2024-06-03T06:35:00.000Z,4,4,,SD,CLOSE,Y,N,NO,CHATHAM
23-52637,GREASE ALL RAILCAR LOADING ARMS,GW-2303,GW-2303,2475,,,12-11-23 1:47 AM,2023-12-11T01:47:00.000Z,1-8-24 12:00 AM,2024-01-08T00:00:00.000Z,1-8-24 8:27 AM,2024-01-08T08:27:00.000Z,4,4,,PM,CLOSE,Y,,NO,CHATHAM
23-52636,SOUTH UNIT MECHANICAL INSPECTION,GW-2303,GW-2303,2475,,,12-11-23 1:47 AM,2023-12-11T01:47:00.000Z,1-8-24 12:15 AM,2024-01-08T00:15:00.000Z,1-8-24 8:27 AM,2024-01-08T08:27:00.000Z,4,4,,PM,CLOSE,Y,,NO,CHATHAM
23-52635,SOUTH UNIT - PNEUMATIC INSPECTION,GW-2303,GW-2303,2475,,,12-11-23 1:47 AM,2023-12-11T01:47:00.000Z,1-8-24 12:15 AM,2024-01-08T00:15:00.000Z,1-8-24 8:27 AM,2024-01-08T08:27:00.000Z,4,4,,PM,CLOSE,Y,,NO,CHATHAM
23-52634,CENTRE UNIT MECHANICAL INSPECTION,GW-2303,GW-2303,2475,,,12-11-23 1:47 AM,2023-12-11T01:47:00.000Z,1-8-24 12:15 AM,2024-01-08T00:15:00.000Z,1-8-24 8:27 AM,2024-01-08T08:27:00.000Z,4,4,,PM,CLOSE,Y,,NO,CHATHAM
23-52633,CENTRE UNIT - PNEUMATIC INSPECTION,GW-2303,GW-2303,2475,,,12-11-23 1:47 AM,2023-12-11T01:47:00.000Z,1-8-24 12:15 AM,2024-01-08T00:15:00.000Z,1-8-24 8:27 AM,2024-01-08T08:27:00.000Z,4,4,,PM,CLOSE,Y,,NO,CHATHAM
23-52632,NORTH UNIT MECHANICAL INSPECTION,GW-2303,GW-2303,2475,,,12-11-23 1:47 AM,2023-12-11T01:47:00.000Z,1-8-24 12:15 AM,2024-01-08T00:15:00.000Z,1-8-24 8:27 AM,2024-01-08T08:27:00.000Z,4,4,,PM,CLOSE,Y,,NO,CHATHAM
23-52631,NORTH UNIT - PNEUMATIC INSPECTION,GW-2303,GW-2303,2475,,,12-11-23 1:47 AM,2023-12-11T01:47:00.000Z,1-8-24 12:15 AM,2024-01-08T00:15:00.000Z,1-8-24 8:27 AM,2024-01-08T08:27:00.000Z,4,4,,PM,CLOSE,Y,,NO,CHATHAM
23-52630,RAIL LOADING - CARBIS PNEUMATIC GANGWAY,GW-2303,GW-2303,2475,,,12-11-23 1:47 AM,2023-12-11T01:47:00.000Z,1-8-24 2:00 AM,2024-01-08T02:00:00.000Z,1-8-24 1:00 AM,2024-01-08T01:00:00.000Z,4,4,,PM,CLOSE,Y,N,NO,CHATHAM
23-52629,SC-1301 MECHANICAL CHECKS,SC-1301,SC-1301,4868,,,12-11-23 1:46 AM,2023-12-11T01:46:00.000Z,1-8-24 1:00 AM,2024-01-08T01:00:00.000Z,1-8-24 8:27 AM,2024-01-08T08:27:00.000Z,4,4,,PM,CLOSE,Y,,NO,CHATHAM
23-52628,SC-1301 - MECHANICAL CHECKS,SC-1301,SC-1301,4868,,,12-11-23 1:46 AM,2023-12-11T01:46:00.000Z,1-8-24 1:00 AM,2024-01-08T01:00:00.000Z,1-8-24 12:30 AM,2024-01-08T00:30:00.000Z,4,4,,PM,CLOSE,Y,N,NO,CHATHAM
23-52627,ACCULOAD SCULLY CABLE BI-WEEKLY PM,FQIC-2203,FQIC-2203,7138,,,12-11-23 1:46 AM,2023-12-11T01:46:00.000Z,1-5-24 12:30 AM,2024-01-05T00:30:00.000Z,1-4-24 11:39 AM,2024-01-04T11:39:00.000Z,4,4,,PM,CLOSE,Y,,NO,CHATHAM
23-52626,ACCULOAD SCULLY CABLE -PM SERVICE,FQIC-2203,FQIC-2203,7138,,,12-11-23 1:46 AM,2023-12-11T01:46:00.000Z,1-5-24 12:30 AM,2024-01-05T00:30:00.000Z,1-4-24 12:30 AM,2024-01-04T00:30:00.000Z,4,4,,PM,CLOSE,Y,N,NO,CHATHAM
23-52625,Reinstall filter element,P-1630,P-1630,1002,,,12-11-23 1:46 AM,2023-12-11T01:46:00.000Z,1-8-24 12:15 AM,2024-01-08T00:15:00.000Z,1-8-24 3:40 PM,2024-01-08T15:40:00.000Z,4,4,,PM,CLOSE,Y,,NO,CHATHAM
23-52624,Blow out filter element with air,P-1630,P-1630,1002,,,12-11-23 1:46 AM,2023-12-11T01:46:00.000Z,1-8-24 12:20 AM,2024-01-08T00:20:00.000Z,1-8-24 3:40 PM,2024-01-08T15:40:00.000Z,4,4,,PM,CLOSE,Y,,NO,CHATHAM
23-52623,Reinstall covers temporarily,P-1630,P-1630,1002,,,12-11-23 1:46 AM,2023-12-11T01:46:00.000Z,1-8-24 12:10 AM,2024-01-08T00:10:00.000Z,1-8-24 3:40 PM,2024-01-08T15:40:00.000Z,4,4,,PM,CLOSE,Y,,NO,CHATHAM
23-52622,Push filter through from one side,P-1630,P-1630,1002,,,12-11-23 1:46 AM,2023-12-11T01:46:00.000Z,1-8-24 12:05 AM,2024-01-08T00:05:00.000Z,1-8-24 3:40 PM,2024-01-08T15:40:00.000Z,4,4,,PM,CLOSE,Y,,NO,CHATHAM
23-52621,Remove bolts from filter covers on both sides,P-1630,P-1630,1002,,,12-11-23 1:46 AM,2023-12-11T01:46:00.000Z,1-8-24 12:10 AM,2024-01-08T00:10:00.000Z,1-8-24 3:40 PM,2024-01-08T15:40:00.000Z,4,4,,PM,CLOSE,Y,,NO,CHATHAM
23-52620,P-1630A - MOTOR AIR FILTER CLEANING,P-1630,P-1630,1002,,,12-11-23 1:46 AM,2023-12-11T01:46:00.000Z,1-8-24 1:00 AM,2024-01-08T01:00:00.000Z,1-8-24 1:00 AM,2024-01-08T01:00:00.000Z,4,4,,PM,CLOSE,Y,N,NO,CHATHAM
23-52619,DDG AREA EQUIPMENT GREASE P.M.,1800,1800,,,,12-11-23 1:46 AM,2023-12-11T01:46:00.000Z,1-4-24 12:00 AM,2024-01-04T00:00:00.000Z,1-8-24 6:48 AM,2024-01-08T06:48:00.000Z,4,4,,PM,CLOSE,Y,,NO,CHATHAM
23-52618,1800 AREA - EQUIPMENT GREASING - DDG STORAGE AREA,1800,1800,,,,12-11-23 1:46 AM,2023-12-11T01:46:00.000Z,1-4-24 12:00 AM,2024-01-04T00:00:00.000Z,1-4-24 2:30 AM,2024-01-04T02:30:00.000Z,4,4,,PM,CLOSE,Y,N,NO,CHATHAM
23-52617,Corn Probe Weekly PM,SA-2101,SA-2101,4865,,,12-11-23 1:46 AM,2023-12-11T01:46:00.000Z,1-15-24 7:30 AM,2024-01-15T07:30:00.000Z,1-23-24 6:27 AM,2024-01-23T06:27:00.000Z,4,4,,PM,CLOSE,Y,,NO,CHATHAM
23-52616,SA-2101 CORN PROBE - MECHANICAL  PM,SA-2101,SA-2101,4865,,,12-11-23 1:46 AM,2023-12-11T01:46:00.000Z,1-15-24 7:30 AM,2024-01-15T07:30:00.000Z,1-23-24 6:27 AM,2024-01-23T06:27:00.000Z,4,4,,PM,CLOSE,Y,N,NO,CHATHAM
23-52615,Check operation of biothane float in diked area,LSH-41401,LSH-41401,3081,,,12-11-23 1:46 AM,2023-12-11T01:46:00.000Z,1-8-24 12:30 AM,2024-01-08T00:30:00.000Z,1-8-24 8:12 AM,2024-01-08T08:12:00.000Z,4,4,,PM,CLOSE,Y,,NO,CHATHAM
23-52614,BIOTHANE FLOAT OP CHECK- (LSH-41401) - PM SERVICE,LSH-41401,LSH-41401,3081,,,12-11-23 1:46 AM,2023-12-11T01:46:00.000Z,1-8-24 12:30 AM,2024-01-08T00:30:00.000Z,1-8-24 12:15 AM,2024-01-08T00:15:00.000Z,4,4,,PM,CLOSE,Y,N,NO,CHATHAM
23-52613,GIVE SAMPLE TO SHIPPER/RECEIVER,AG-1601,AG-1601,1191,,,12-11-23 1:45 AM,2023-12-11T01:45:00.000Z,1-3-24 12:00 AM,2024-01-03T00:00:00.000Z,1-8-24 1:20 PM,2024-01-08T13:20:00.000Z,4,4,,PD,CLOSE,Y,,NO,CHATHAM
23-52612,CHECK OIL LEVEL,AG-1601,AG-1601,1191,,,12-11-23 1:45 AM,2023-12-11T01:45:00.000Z,1-3-24 12:30 AM,2024-01-03T00:30:00.000Z,1-8-24 1:20 PM,2024-01-08T13:20:00.000Z,4,4,,PD,CLOSE,Y,,NO,CHATHAM
23-52611,EXTRACT OIL SAMPLE,AG-1601,AG-1601,1191,,,12-11-23 1:45 AM,2023-12-11T01:45:00.000Z,1-3-24 12:30 AM,2024-01-03T00:30:00.000Z,1-8-24 1:20 PM,2024-01-08T13:20:00.000Z,4,4,,PD,CLOSE,Y,,NO,CHATHAM
23-52610,PREPARATION OF CONTAINERS,AG-1601,AG-1601,1191,,,12-11-23 1:45 AM,2023-12-11T01:45:00.000Z,1-3-24 12:00 AM,2024-01-03T00:00:00.000Z,1-8-24 1:20 PM,2024-01-08T13:20:00.000Z,4,4,,PD,CLOSE,Y,,NO,CHATHAM
23-52609,AG-1601- OIL SAMPLING,AG-1601,AG-1601,1191,,,12-11-23 1:45 AM,2023-12-11T01:45:00.000Z,1-3-24 12:30 AM,2024-01-03T00:30:00.000Z,1-8-24 1:20 PM,2024-01-08T13:20:00.000Z,4,4,,PD,CLOSE,Y,N,NO,CHATHAM
23-52608,PERFORM INSPECTION OF ALL EQUIPMENT,3800,3800,,,,12-11-23 1:45 AM,2023-12-11T01:45:00.000Z,2-3-24 4:00 PM,2024-02-03T16:00:00.000Z,11-3-24 7:32 PM,2024-11-03T19:32:00.000Z,4,4,,SD,CLOSE,Y,,NO,CHATHAM
23-52607,INFRARED THERMOGRAPHIC - AREA 3800 - PM SERVICE,3800,3800,,,,12-11-23 1:45 AM,2023-12-11T01:45:00.000Z,2-3-24 4:00 PM,2024-02-03T16:00:00.000Z,11-3-24 7:32 PM,2024-11-03T19:32:00.000Z,4,4,,CO,CLOSE,Y,N,NO,CHATHAM
23-52606,PROCEDURE - REGREASING OPTIM/ TECO INDUCTION MOTOR,3300,3300,,,,12-11-23 1:45 AM,2023-12-11T01:45:00.000Z,1-8-24 12:00 AM,2024-01-08T00:00:00.000Z,1-8-24 8:27 AM,2024-01-08T08:27:00.000Z,4,4,,PM,CLOSE,Y,,NO,CHATHAM
23-52605,3300 AREA EQUIPMENT GREASE P.M.,3300,3300,,,,12-11-23 1:45 AM,2023-12-11T01:45:00.000Z,1-8-24 1:00 AM,2024-01-08T01:00:00.000Z,1-8-24 8:27 AM,2024-01-08T08:27:00.000Z,4,4,,PM,CLOSE,Y,,NO,CHATHAM
23-52604,3300 AREA  -  MOTOR GREASING,3300,3300,,,,12-11-23 1:45 AM,2023-12-11T01:45:00.000Z,1-8-24 1:00 AM,2024-01-08T01:00:00.000Z,1-8-24 12:30 AM,2024-01-08T00:30:00.000Z,4,4,,PM,CLOSE,Y,N,NO,CHATHAM
23-52603,PROCEDURE - REGREASING OPTIM/ TECO INDUCTION MOTOR,3200,3200,,,,12-11-23 1:45 AM,2023-12-11T01:45:00.000Z,1-6-24 12:00 AM,2024-01-06T00:00:00.000Z,1-5-24 7:42 AM,2024-01-05T07:42:00.000Z,4,4,,PM,CLOSE,Y,,NO,CHATHAM
23-52602,3200 AREA MOTOR GREASE,3200,3200,,,,12-11-23 1:45 AM,2023-12-11T01:45:00.000Z,1-6-24 1:00 AM,2024-01-06T01:00:00.000Z,1-5-24 7:42 AM,2024-01-05T07:42:00.000Z,4,4,,PM,CLOSE,Y,,NO,CHATHAM
23-52601,3200 AREA - MOTOR GREASING,3200,3200,,,,12-11-23 1:45 AM,2023-12-11T01:45:00.000Z,1-6-24 1:00 AM,2024-01-06T01:00:00.000Z,1-5-24 1:00 AM,2024-01-05T01:00:00.000Z,4,4,,PM,CLOSE,Y,N,NO,CHATHAM
23-52599,I/E Change override pressure from ?? to 360KPAG for FT36402,FT-36402,FT-36402,6832,,,12-8-23 2:46 PM,2023-12-08T14:46:00.000Z,11-30-23 12:50 PM,2023-11-30T12:50:00.000Z,12-8-23 2:52 PM,2023-12-08T14:52:00.000Z,4,4,,CO,CLOSE,Y,,NO,CHATHAM
23-52598,I/E Confirm mA signal to DCS for PZT36801 (the signal seems to have drifed),FV-36801,FV-36801,2239,,,12-8-23 2:45 PM,2023-12-08T14:45:00.000Z,12-5-23 9:43 AM,2023-12-05T09:43:00.000Z,12-8-23 2:52 PM,2023-12-08T14:52:00.000Z,4,4,,RM,CLOSE,Y,,NO,CHATHAM
23-52597,BL1825 Exhaust Fan/BL1529 Main Fan - Vibes,BL-1825,BL-1825,10032,,,12-8-23 2:44 PM,2023-12-08T14:44:00.000Z,12-31-23 8:00 AM,2023-12-31T08:00:00.000Z,7-16-24 2:20 PM,2024-07-16T14:20:00.000Z,4,4,,CO,CLOSE,Y,,NO,CHATHAM
23-52596,Mx 1801 D air regulators both leak air,MX-1801D,MX-1801D,3569,,,12-8-23 2:41 PM,2023-12-08T14:41:00.000Z,12-31-23 7:35 AM,2023-12-31T07:35:00.000Z,12-11-23 4:01 PM,2023-12-11T16:01:00.000Z,2,2,,RM,CLOSE,Y,,NO,CHATHAM
23-52595,BE2101 leaking dust,BE-2101,BE-2101,1279,,,12-8-23 2:39 PM,2023-12-08T14:39:00.000Z,12-13-23 11:22 AM,2023-12-13T11:22:00.000Z,12-11-23 7:06 AM,2023-12-11T07:06:00.000Z,2,2,,CO,CLOSE,Y,,NO,CHATHAM
23-52594,Burnt out light in corn land basement,BU-GHR,BU-GHR,1323,,,12-8-23 2:36 PM,2023-12-08T14:36:00.000Z,12-28-23 11:37 AM,2023-12-28T11:37:00.000Z,2-7-24 3:10 PM,2024-02-07T15:10:00.000Z,4,4,,RM,CLOSE,Y,,NO,CHATHAM
23-52593,Valve mismatch/not performing properly.,PV-58140,PV-58140,4791,,,12-8-23 2:26 PM,2023-12-08T14:26:00.000Z,12-6-23 8:30 AM,2023-12-06T08:30:00.000Z,12-8-23 2:35 PM,2023-12-08T14:35:00.000Z,2,2,,CO,CLOSE,Y,,NO,CHATHAM
23-52592,MEASURE SIZE OF DC-1202C EXPLOSION PANELS,DC-1202C,DC-1202C,1455,,,12-8-23 2:24 PM,2023-12-08T14:24:00.000Z,12-15-23 1:48 PM,2023-12-15T13:48:00.000Z,12-12-23 4:25 PM,2023-12-12T16:25:00.000Z,4,4,,CO,CLOSE,Y,,NO,CHATHAM
23-52591,bent bolt on overfill scully,LSHH-39301F,LSHH-39301F,3112,,,12-8-23 2:11 PM,2023-12-08T14:11:00.000Z,12-15-23 11:34 AM,2023-12-15T11:34:00.000Z,12-8-23 2:54 PM,2023-12-08T14:54:00.000Z,4,4,,RM,CLOSE,Y,,NO,CHATHAM
23-52590,Water tap outside of process lab is leaking (near gas cyclinders).,BU-ADMIN,BU-ADMIN,,,,12-8-23 2:09 PM,2023-12-08T14:09:00.000Z,12-14-23 11:42 AM,2023-12-14T11:42:00.000Z,11-6-24 2:11 AM,2024-11-06T02:11:00.000Z,4,4,,CO,CLOSE,Y,,NO,CHATHAM
23-52589,Alcohol truck loading camera needs cleaned - image not visible,BU-ALCO,BU-ALCO,,,,12-8-23 2:05 PM,2023-12-08T14:05:00.000Z,12-29-23 11:37 AM,2023-12-29T11:37:00.000Z,12-19-23 12:07 PM,2023-12-19T12:07:00.000Z,4,4,,CO,CLOSE,Y,,NO,CHATHAM
23-52582,Change out weigh belt motor and gearbox,SC-1301,SC-1301,4868,,,12-7-23 2:05 PM,2023-12-07T14:05:00.000Z,12-8-23 2:05 PM,2023-12-08T14:05:00.000Z,12-8-23 3:05 PM,2023-12-08T15:05:00.000Z,2,2,,CO,CLOSE,Y,,NO,CHATHAM
23-52581,Verify Weigh Belt motor in good working condition,SC-1301,SC-1301,4868,,,12-7-23 1:40 PM,2023-12-07T13:40:00.000Z,12-8-23 7:32 AM,2023-12-08T07:32:00.000Z,12-7-23 1:43 PM,2023-12-07T13:43:00.000Z,2,2,,CO,CLOSE,Y,,NO,CHATHAM
23-52579,Install Fire Extinguishers at Front Entrance,BU-ADMIN,BU-ADMIN,,,,12-7-23 9:38 AM,2023-12-07T09:38:00.000Z,12-6-23 2:11 PM,2023-12-06T14:11:00.000Z,12-7-23 10:39 AM,2023-12-07T10:39:00.000Z,4,4,,CO,CLOSE,Y,,NO,CHATHAM
23-52570,TA24 Spring - HPW and Acuren Inspection HC Reflux Condenser E6562,E-6562,E-6562,1574,,,12-6-23 3:08 PM,2023-12-06T15:08:00.000Z,4-30-24 8:28 AM,2024-04-30T08:28:00.000Z,5-23-24 1:40 PM,2024-05-23T13:40:00.000Z,4,4,,CO,CLOSE,Y,,NO,CHATHAM
23-52569,Follow procedure below,MX-1801D,MX-1801D,3569,,,12-6-23 1:44 PM,2023-12-06T13:44:00.000Z,12-6-23 12:00 AM,2023-12-06T00:00:00.000Z,6-3-24 6:35 AM,2024-06-03T06:35:00.000Z,4,4,,SD,CLOSE,Y,,NO,CHATHAM
23-52568,Syrup line H.P Wash - DR02,MX-1801D,MX-1801D,3569,,,12-6-23 1:44 PM,2023-12-06T13:44:00.000Z,12-6-23 1:30 AM,2023-12-06T01:30:00.000Z,6-3-24 6:35 AM,2024-06-03T06:35:00.000Z,4,4,,SD,CLOSE,Y,N,NO,CHATHAM
23-52567,Complete runout and float checks,P-1581A,P-1581A,1082,,,12-6-23 11:23 AM,2023-12-06T11:23:00.000Z,12-11-23 8:15 AM,2023-12-11T08:15:00.000Z,1-23-25 2:19 PM,2025-01-23T14:19:00.000Z,4,4,,CO,CLOSE,Y,,NO,CHATHAM
23-52566,Assemble shaft w/ bearings into housing,P-1581A,P-1581A,1082,,,12-6-23 11:23 AM,2023-12-06T11:23:00.000Z,12-11-23 8:45 AM,2023-12-11T08:45:00.000Z,1-23-25 2:19 PM,2025-01-23T14:19:00.000Z,4,4,,CO,CLOSE,Y,,NO,CHATHAM
23-52565,Install bearings,P-1581A,P-1581A,1082,,,12-6-23 11:23 AM,2023-12-06T11:23:00.000Z,12-11-23 10:15 AM,2023-12-11T10:15:00.000Z,1-23-25 2:19 PM,2025-01-23T14:19:00.000Z,4,4,,CO,CLOSE,Y,,NO,CHATHAM
23-52564,Take measurements,P-1581A,P-1581A,1082,,,12-6-23 11:23 AM,2023-12-06T11:23:00.000Z,12-11-23 8:45 AM,2023-12-11T08:45:00.000Z,1-23-25 2:19 PM,2025-01-23T14:19:00.000Z,4,4,,CO,CLOSE,Y,,NO,CHATHAM
23-52563,Wire wheel shaft,P-1581A,P-1581A,1082,,,12-6-23 11:23 AM,2023-12-06T11:23:00.000Z,12-11-23 8:15 AM,2023-12-11T08:15:00.000Z,1-23-25 2:19 PM,2025-01-23T14:19:00.000Z,4,4,,CO,CLOSE,Y,,NO,CHATHAM
23-52562,Clean housing,P-1581A,P-1581A,1082,,,12-6-23 11:23 AM,2023-12-06T11:23:00.000Z,12-11-23 8:15 AM,2023-12-11T08:15:00.000Z,1-23-25 2:19 PM,2025-01-23T14:19:00.000Z,4,4,,CO,CLOSE,Y,,NO,CHATHAM
23-52561,Disassemble pump,P-1581A,P-1581A,1082,,,12-6-23 11:23 AM,2023-12-06T11:23:00.000Z,12-11-23 9:45 AM,2023-12-11T09:45:00.000Z,1-23-25 2:19 PM,2025-01-23T14:19:00.000Z,4,4,,CO,CLOSE,Y,,NO,CHATHAM
23-52560,Rebuild RA 1082,P-1581A,P-1581A,1082,,,12-6-23 11:22 AM,2023-12-06T11:22:00.000Z,3-15-24 7:45 AM,2024-03-15T07:45:00.000Z,1-22-25 4:15 PM,2025-01-22T16:15:00.000Z,4,4,,CO,CLOSE,Y,N,NO,CHATHAM
23-52559,Complete runout and float checks,P-1405B,P-1405B,1037,,,12-6-23 11:21 AM,2023-12-06T11:21:00.000Z,12-11-23 8:18 AM,2023-12-11T08:18:00.000Z,12-14-23 7:16 AM,2023-12-14T07:16:00.000Z,4,4,,CO,CLOSE,Y,,NO,CHATHAM
23-52558,Assemble shaft w/ bearings into housing,P-1405B,P-1405B,1037,,,12-6-23 11:21 AM,2023-12-06T11:21:00.000Z,12-11-23 8:48 AM,2023-12-11T08:48:00.000Z,12-14-23 7:16 AM,2023-12-14T07:16:00.000Z,4,4,,CO,CLOSE,Y,,NO,CHATHAM
23-52557,Install bearings,P-1405B,P-1405B,1037,,,12-6-23 11:21 AM,2023-12-06T11:21:00.000Z,12-11-23 10:18 AM,2023-12-11T10:18:00.000Z,12-14-23 7:16 AM,2023-12-14T07:16:00.000Z,4,4,,CO,CLOSE,Y,,NO,CHATHAM
23-52556,Take measurements,P-1405B,P-1405B,1037,,,12-6-23 11:21 AM,2023-12-06T11:21:00.000Z,12-11-23 8:48 AM,2023-12-11T08:48:00.000Z,12-14-23 7:16 AM,2023-12-14T07:16:00.000Z,4,4,,CO,CLOSE,Y,,NO,CHATHAM
23-52555,Wire wheel shaft,P-1405B,P-1405B,1037,,,12-6-23 11:21 AM,2023-12-06T11:21:00.000Z,12-11-23 8:18 AM,2023-12-11T08:18:00.000Z,12-14-23 7:16 AM,2023-12-14T07:16:00.000Z,4,4,,CO,CLOSE,Y,,NO,CHATHAM
23-52554,Clean housing,P-1405B,P-1405B,1037,,,12-6-23 11:21 AM,2023-12-06T11:21:00.000Z,12-11-23 8:18 AM,2023-12-11T08:18:00.000Z,12-14-23 7:16 AM,2023-12-14T07:16:00.000Z,4,4,,CO,CLOSE,Y,,NO,CHATHAM
23-52553,Disassemble pump,P-1405B,P-1405B,1037,,,12-6-23 11:21 AM,2023-12-06T11:21:00.000Z,12-11-23 9:48 AM,2023-12-11T09:48:00.000Z,12-14-23 7:16 AM,2023-12-14T07:16:00.000Z,4,4,,CO,CLOSE,Y,,NO,CHATHAM
23-52552,Rebuild RA 1193,P-1405B,P-1405B,1037,,,12-6-23 11:21 AM,2023-12-06T11:21:00.000Z,12-31-23 7:48 AM,2023-12-31T07:48:00.000Z,12-13-23 3:48 PM,2023-12-13T15:48:00.000Z,4,4,,CO,CLOSE,Y,N,NO,CHATHAM
23-52550,Complete runout and float checks,P-1610,P-1610,1053,,,12-6-23 10:26 AM,2023-12-06T10:26:00.000Z,12-12-23 8:40 AM,2023-12-12T08:40:00.000Z,8-19-24 11:36 AM,2024-08-19T11:36:00.000Z,4,4,,CO,CLOSE,Y,,NO,CHATHAM
23-52549,Assemble shaft w/ bearings into housing,P-1610,P-1610,1053,,,12-6-23 10:26 AM,2023-12-06T10:26:00.000Z,12-12-23 9:10 AM,2023-12-12T09:10:00.000Z,8-19-24 11:36 AM,2024-08-19T11:36:00.000Z,4,4,,CO,CLOSE,Y,,NO,CHATHAM
23-52548,Install bearings,P-1610,P-1610,1053,,,12-6-23 10:26 AM,2023-12-06T10:26:00.000Z,12-12-23 10:40 AM,2023-12-12T10:40:00.000Z,8-19-24 11:36 AM,2024-08-19T11:36:00.000Z,4,4,,CO,CLOSE,Y,,NO,CHATHAM
23-52547,Take measurements,P-1610,P-1610,1053,,,12-6-23 10:26 AM,2023-12-06T10:26:00.000Z,12-12-23 9:10 AM,2023-12-12T09:10:00.000Z,8-19-24 11:36 AM,2024-08-19T11:36:00.000Z,4,4,,CO,CLOSE,Y,,NO,CHATHAM
23-52546,Wire wheel shaft,P-1610,P-1610,1053,,,12-6-23 10:26 AM,2023-12-06T10:26:00.000Z,12-12-23 8:40 AM,2023-12-12T08:40:00.000Z,8-19-24 11:36 AM,2024-08-19T11:36:00.000Z,4,4,,CO,CLOSE,Y,,NO,CHATHAM
23-52545,Clean housing,P-1610,P-1610,1053,,,12-6-23 10:26 AM,2023-12-06T10:26:00.000Z,12-12-23 8:40 AM,2023-12-12T08:40:00.000Z,8-19-24 11:36 AM,2024-08-19T11:36:00.000Z,4,4,,CO,CLOSE,Y,,NO,CHATHAM
23-52544,Disassemble pump,P-1610,P-1610,1053,,,12-6-23 10:26 AM,2023-12-06T10:26:00.000Z,12-12-23 10:10 AM,2023-12-12T10:10:00.000Z,8-19-24 11:36 AM,2024-08-19T11:36:00.000Z,4,4,,CO,CLOSE,Y,,NO,CHATHAM
23-52543,wilden pump that fills phytase tote is broken,TK-1315,TK-1315,5461,,,12-6-23 9:26 AM,2023-12-06T09:26:00.000Z,12-24-23 9:26 AM,2023-12-24T09:26:00.000Z,12-14-23 10:26 AM,2023-12-14T10:26:00.000Z,4,4,,CO,CLOSE,Y,,NO,CHATHAM
23-52542,Install Lights in shop over Mechanics bench,0000,0000,,,,12-6-23 8:20 AM,2023-12-06T08:20:00.000Z,12-24-23 8:20 AM,2023-12-24T08:20:00.000Z,12-11-23 4:20 PM,2023-12-11T16:20:00.000Z,4,4,,CO,CLOSE,Y,,NO,CHATHAM
23-52541,INSULATION BLANKET AUDIT (PLANT WIDE),CHATHAM,CHATHAM,,Completed under Time sheet 100715,,12-6-23 8:01 AM,2023-12-06T08:01:00.000Z,,,12-21-23 4:13 PM,2023-12-21T16:13:00.000Z,4,4,,PM,CLOSE,Y,,NO,CHATHAM
23-52540,Lights in Distillation,1500,1500,,,,12-6-23 7:50 AM,2023-12-06T07:50:00.000Z,12-24-23 7:50 AM,2023-12-24T07:50:00.000Z,12-13-23 9:50 AM,2023-12-13T09:50:00.000Z,4,4,,CO,CLOSE,Y,,NO,CHATHAM
23-52539,Replace RO-B Conductivity probe,WS-3502B,WS-3502B,6389,,,12-6-23 7:35 AM,2023-12-06T07:35:00.000Z,2-29-24 7:40 AM,2024-02-29T07:40:00.000Z,3-10-24 6:01 AM,2024-03-10T06:01:00.000Z,4,4,,CO,CLOSE,Y,,NO,CHATHAM
23-52534,Demo of C-Can to Set up for Chemical Trial c-Can,0000,0000,,,,12-5-23 1:17 PM,2023-12-05T13:17:00.000Z,12-24-23 1:17 PM,2023-12-24T13:17:00.000Z,12-13-23 1:23 PM,2023-12-13T13:23:00.000Z,4,4,,CO,CLOSE,Y,,NO,CHATHAM
23-52533,MOC22-044: Install Current AMP meter on Agitator TK1602,AG-1602,AG-1602,1192,,,12-5-23 1:12 PM,2023-12-05T13:12:00.000Z,7-31-24 10:15 PM,2024-07-31T22:15:00.000Z,7-2-24 12:16 AM,2024-07-02T00:16:00.000Z,4,4,,CO,CLOSE,Y,,NO,CHATHAM
23-52532,MOC22-044: Install Current AMP meter on Agitator TK1601,AG-1601,AG-1601,1191,,,12-5-23 1:11 PM,2023-12-05T13:11:00.000Z,8-5-24 10:12 PM,2024-08-05T22:12:00.000Z,7-1-24 11:49 AM,2024-07-01T11:49:00.000Z,4,4,,CO,CLOSE,Y,,NO,CHATHAM
23-52531,MOC22-044: Install Current AMP meter on Agitator TK1701,AG-1701,AG-1701,1193,,,12-5-23 1:09 PM,2023-12-05T13:09:00.000Z,7-8-24 10:04 PM,2024-07-08T22:04:00.000Z,7-2-24 12:04 AM,2024-07-02T00:04:00.000Z,4,4,,CO,CLOSE,Y,,NO,CHATHAM
23-52530,PCOSS - Centrifuge Failed to Shoot Fault,SKID-6601,SKID-6601,,,,12-5-23 12:54 PM,2023-12-05T12:54:00.000Z,12-1-23 12:54 PM,2023-12-01T12:54:00.000Z,12-5-23 1:54 PM,2023-12-05T13:54:00.000Z,2,2,,PM,CLOSE,Y,,NO,CHATHAM
23-52529,Heavy Phase braided hose needs replacement,XV-66202,XV-66202,6480,,,12-5-23 12:52 PM,2023-12-05T12:52:00.000Z,12-4-23 3:55 PM,2023-12-04T15:55:00.000Z,8-2-24 2:10 PM,2024-08-02T14:10:00.000Z,2,2,,RM,CLOSE,Y,,NO,CHATHAM
23-52528,DDG cooling tube has a hole in it causing DDG to hit the ground.,RC-1802,RC-1802,4850,,,12-5-23 11:36 AM,2023-12-05T11:36:00.000Z,12-24-23 3:13 PM,2023-12-24T15:13:00.000Z,12-13-23 5:43 PM,2023-12-13T17:43:00.000Z,2,2,,RM,CLOSE,Y,,NO,CHATHAM
23-52527,I/E - Move heater/block heat in MCC3816 away from fiber optics,UH-3816,UH-3816,,,,12-5-23 11:34 AM,2023-12-05T11:34:00.000Z,12-24-23 9:48 AM,2023-12-24T09:48:00.000Z,12-12-23 11:52 AM,2023-12-12T11:52:00.000Z,4,4,,CO,CLOSE,Y,,NO,CHATHAM
23-52526,Replace broken shear pin in biogas trap,4100-26K-02,4100-26K-02,,,,12-5-23 11:18 AM,2023-12-05T11:18:00.000Z,12-8-23 11:02 PM,2023-12-08T23:02:00.000Z,12-11-23 9:29 AM,2023-12-11T09:29:00.000Z,2,2,,RM,CLOSE,Y,,NO,CHATHAM
23-52525,"unnhook level transmitter for tank swap, hook it back up and wire in tank heater",TK-4122,TK-4122,,,,12-5-23 11:10 AM,2023-12-05T11:10:00.000Z,12-6-23 5:00 PM,2023-12-06T17:00:00.000Z,12-8-23 8:14 AM,2023-12-08T08:14:00.000Z,2,2,,CO,CLOSE,Y,,NO,CHATHAM
23-52524,Maximo training  Thursday 1-230pm first fl conference room,0000,0000,,,,12-5-23 11:04 AM,2023-12-05T11:04:00.000Z,12-24-23 11:04 AM,2023-12-24T11:04:00.000Z,12-17-23 12:04 PM,2023-12-17T12:04:00.000Z,4,4,,CO,CLOSE,Y,,NO,CHATHAM
23-52523,remove scaffold,EF-3002,EF-3002,1613,,,12-5-23 10:53 AM,2023-12-05T10:53:00.000Z,12-22-23 12:51 PM,2023-12-22T12:51:00.000Z,1-2-24 7:39 AM,2024-01-02T07:39:00.000Z,4,4,,CO,CLOSE,Y,,NO,CHATHAM
23-52522,DDG Hammermill not milling,MI-1801,MI-1801,3405,,,12-5-23 10:49 AM,2023-12-05T10:49:00.000Z,11-30-23 5:11 PM,2023-11-30T17:11:00.000Z,12-5-23 10:50 AM,2023-12-05T10:50:00.000Z,2,2,,RM,CLOSE,Y,,NO,CHATHAM
23-52521,Plumb ferric tank to digerstor,4100-26K-08,4100-26K-08,,,,12-5-23 10:25 AM,2023-12-05T10:25:00.000Z,12-22-23 11:03 AM,2023-12-22T11:03:00.000Z,12-6-23 1:33 PM,2023-12-06T13:33:00.000Z,2,2,,CO,CLOSE,Y,,NO,CHATHAM
23-52520,urinal in mens change room is plugged,CHATHAM,CHATHAM,,,,12-5-23 10:22 AM,2023-12-05T10:22:00.000Z,12-5-23 8:21 PM,2023-12-05T20:21:00.000Z,12-5-23 11:32 AM,2023-12-05T11:32:00.000Z,2,2,,CO,CLOSE,Y,,NO,CHATHAM
23-52519,ERC meeting Dec 20 (Taylor,0000,0000,,,,12-5-23 9:21 AM,2023-12-05T09:21:00.000Z,12-24-23 9:21 AM,2023-12-24T09:21:00.000Z,12-20-23 11:21 AM,2023-12-20T11:21:00.000Z,4,4,,CO,CLOSE,Y,,NO,CHATHAM
23-52518,INVESTIGATE UTILITY WATER LINE PRESSURE AT PUMP SEAL,P-1511A,P-1511A,1178,,,12-5-23 7:55 AM,2023-12-05T07:55:00.000Z,10-13-23 3:46 PM,2023-10-13T15:46:00.000Z,12-5-23 7:56 AM,2023-12-05T07:56:00.000Z,4,4,,CO,CLOSE,Y,,NO,CHATHAM
23-52517,Outlet on fume hood at Richmond Site Testing Area,FU-0002,FU-0002,7709,,,12-5-23 7:46 AM,2023-12-05T07:46:00.000Z,12-29-23 1:58 PM,2023-12-29T13:58:00.000Z,12-8-23 8:10 AM,2023-12-08T08:10:00.000Z,2,2,,SA,CLOSE,Y,,NO,CHATHAM
23-52516,Assit Chirag in removing and replaceing monitor in the waiting area,0000,0000,,,,12-5-23 6:50 AM,2023-12-05T06:50:00.000Z,12-7-23 12:00 AM,2023-12-07T00:00:00.000Z,12-6-23 1:00 AM,2023-12-06T01:00:00.000Z,2,2,,CO,CLOSE,Y,,NO,CHATHAM
23-52515,Set up racoon trap next to corn oil pumps,MTC-000,MTC-000,7046,,,12-5-23 6:47 AM,2023-12-05T06:47:00.000Z,9-29-23 4:30 PM,2023-09-29T16:30:00.000Z,12-5-23 6:48 AM,2023-12-05T06:48:00.000Z,2,2,,SA,CLOSE,Y,,NO,CHATHAM
23-52514,Need snow clearing station installed at new grain trailer,2100,2100,,,,12-5-23 6:45 AM,2023-12-05T06:45:00.000Z,12-17-23 10:52 AM,2023-12-17T10:52:00.000Z,12-11-23 1:52 PM,2023-12-11T13:52:00.000Z,2,2,,SA,CLOSE,Y,,NO,CHATHAM
23-52510,Seal on bearing failed on east side of mixer.,MX-1302,MX-1302,3563,,,12-4-23 2:30 PM,2023-12-04T14:30:00.000Z,12-24-23 4:41 AM,2023-12-24T04:41:00.000Z,3-5-24 3:36 PM,2024-03-05T15:36:00.000Z,4,4,,CO,CLOSE,Y,,NO,CHATHAM
23-52509,RO B  Conductivity Probe No Good.,WS-3502B,WS-3502B,6389,,,12-4-23 2:22 PM,2023-12-04T14:22:00.000Z,12-24-23 8:36 AM,2023-12-24T08:36:00.000Z,12-5-23 10:07 AM,2023-12-05T10:07:00.000Z,2,2,,CO,CLOSE,Y,,NO,CHATHAM
23-52507,"Replaced gearbox on Dryer \"D\" drum",DR-1801D,DR-1801D,1466,,,12-4-23 11:23 AM,2023-12-04T11:23:00.000Z,12-1-23 6:02 PM,2023-12-01T18:02:00.000Z,12-5-23 4:05 PM,2023-12-05T16:05:00.000Z,2,2,,RM,CLOSE,Y,,NO,CHATHAM
23-52506,Caulking around tap needs to be repalced,QC LAB,QC LAB,,,,12-4-23 11:02 AM,2023-12-04T11:02:00.000Z,12-22-23 2:35 PM,2023-12-22T14:35:00.000Z,12-13-23 4:46 PM,2023-12-13T16:46:00.000Z,4,4,,CO,CLOSE,Y,,NO,CHATHAM
23-52505,"TA24 Spring - CV1823 Gearbox leaking ,should be changed",CV-1823,CV-1823,1427,,,12-4-23 9:24 AM,2023-12-04T09:24:00.000Z,4-30-24 10:53 AM,2024-04-30T10:53:00.000Z,5-27-24 10:34 AM,2024-05-27T10:34:00.000Z,4,4,,CO,CLOSE,Y,,NO,CHATHAM
23-52504,SDA 40B HAZOP,0000,0000,,,,12-4-23 9:22 AM,2023-12-04T09:22:00.000Z,12-15-23 12:00 AM,2023-12-15T00:00:00.000Z,12-15-23 6:00 AM,2023-12-15T06:00:00.000Z,4,4,,CP,CLOSE,Y,,NO,CHATHAM
23-52503,Baseboard Heater in Office,0000,0000,,,,12-4-23 8:52 AM,2023-12-04T08:52:00.000Z,12-17-23 10:22 AM,2023-12-17T10:22:00.000Z,12-4-23 11:22 AM,2023-12-04T11:22:00.000Z,4,4,,CO,CLOSE,Y,,NO,CHATHAM
23-52502,Richmond St Electrical Compliance Review,R&D LAB,R&D LAB,,,,12-4-23 8:50 AM,2023-12-04T08:50:00.000Z,12-8-23 11:57 AM,2023-12-08T11:57:00.000Z,12-4-23 1:12 PM,2023-12-04T13:12:00.000Z,4,4,,SA,CLOSE,Y,,NO,CHATHAM
23-52500,Recalibrate chino,MT-15201,MT-15201,,,,12-4-23 7:21 AM,2023-12-04T07:21:00.000Z,12-5-23 7:21 AM,2023-12-05T07:21:00.000Z,12-4-23 9:23 AM,2023-12-04T09:23:00.000Z,2,2,,CAL,CLOSE,Y,,NO,CHATHAM
23-52499,I/E - Fuel Accuload Ethernet between HMI and board loose or needs to be replaced.,FQIC-22201,FQIC-22201,1948,,,12-4-23 7:10 AM,2023-12-04T07:10:00.000Z,12-5-23 9:51 AM,2023-12-05T09:51:00.000Z,12-4-23 10:21 AM,2023-12-04T10:21:00.000Z,2,2,,RM,CLOSE,Y,,NO,CHATHAM
23-52350,PH PROBE CLEANING AND CALIBRATION WEEKLY PM,AT-84505,AT-84505,6885,,,12-4-23 1:52 AM,2023-12-04T01:52:00.000Z,12-28-23 1:00 AM,2023-12-28T01:00:00.000Z,12-28-23 2:32 PM,2023-12-28T14:32:00.000Z,4,4,,PM,CLOSE,Y,,NO,CHATHAM
23-52349,C-1803D pH Meter-Weekly PM,AT-84505,AT-84505,6885,,,12-4-23 1:52 AM,2023-12-04T01:52:00.000Z,12-28-23 12:00 AM,2023-12-28T00:00:00.000Z,12-28-23 12:30 AM,2023-12-28T00:30:00.000Z,4,4,,PM,CLOSE,Y,N,NO,CHATHAM
23-52348,"Area Asset Checks-1830, 1840, DDG Cooler",1800,1800,,,,12-4-23 1:52 AM,2023-12-04T01:52:00.000Z,1-1-24 12:00 AM,2024-01-01T00:00:00.000Z,1-2-24 11:35 AM,2024-01-02T11:35:00.000Z,4,4,,PM,CLOSE,Y,,NO,CHATHAM
23-52347,"Area Asset Checks-1830, 1840, DDG Cooler",1800,1800,,,,12-4-23 1:52 AM,2023-12-04T01:52:00.000Z,1-1-24 12:00 AM,2024-01-01T00:00:00.000Z,1-2-24 3:00 AM,2024-01-02T03:00:00.000Z,4,4,,PM,CLOSE,Y,N,NO,CHATHAM
23-52346,"Area Asset Checks-2200, 2300, 3200, 3600, 4100",2200,2200,,,,12-4-23 1:52 AM,2023-12-04T01:52:00.000Z,1-1-24 12:00 AM,2024-01-01T00:00:00.000Z,1-2-24 2:54 PM,2024-01-02T14:54:00.000Z,4,4,,PM,CLOSE,Y,,NO,CHATHAM
23-52345,"Area Asset Checks-2200, 2300, 3200, 3600, 4100",2200,2200,,,,12-4-23 1:52 AM,2023-12-04T01:52:00.000Z,1-1-24 12:00 AM,2024-01-01T00:00:00.000Z,1-2-24 2:00 AM,2024-01-02T02:00:00.000Z,4,4,,PM,CLOSE,Y,N,NO,CHATHAM
23-52344,"Area Asset Checks-1600, 1660, 1700 (Evaps, Corn oil, Decanyers)",1600,1600,,,,12-4-23 1:52 AM,2023-12-04T01:52:00.000Z,1-1-24 12:00 AM,2024-01-01T00:00:00.000Z,1-2-24 1:23 PM,2024-01-02T13:23:00.000Z,4,4,,PM,CLOSE,Y,,NO,CHATHAM
23-52343,"Area Asset Checks-1600, 1660, 1700",1600,1600,,,,12-4-23 1:52 AM,2023-12-04T01:52:00.000Z,1-1-24 12:00 AM,2024-01-01T00:00:00.000Z,1-2-24 1:30 AM,2024-01-02T01:30:00.000Z,4,4,,PM,CLOSE,Y,N,NO,CHATHAM
23-52342,"Area Asset Checks-1500, 6500 (Distillation)",1500,1500,,,,12-4-23 1:52 AM,2023-12-04T01:52:00.000Z,1-1-24 12:00 AM,2024-01-01T00:00:00.000Z,1-4-24 8:18 AM,2024-01-04T08:18:00.000Z,4,4,,PM,CLOSE,Y,,NO,CHATHAM
23-52341,"Area Asset Checks-1500, 6500",1500,1500,,,,12-4-23 1:52 AM,2023-12-04T01:52:00.000Z,1-1-24 12:00 AM,2024-01-01T00:00:00.000Z,1-4-24 1:00 AM,2024-01-04T01:00:00.000Z,4,4,,PM,CLOSE,Y,N,NO,CHATHAM
23-52340,"Area Asset Checks-2100, 1200, 1300, 1400 (Corn, Mill, Mash, Fermentation)",2100,2100,,,,12-4-23 1:52 AM,2023-12-04T01:52:00.000Z,1-1-24 2:30 AM,2024-01-01T02:30:00.000Z,1-5-24 2:30 PM,2024-01-05T14:30:00.000Z,4,4,,PM,CLOSE,Y,,NO,CHATHAM
23-52339,"Area Asset Checks-2100, 1200, 1300, 1400 (Corn, Mill, Mash, Fermentation)",2100,2100,,,,12-4-23 1:52 AM,2023-12-04T01:52:00.000Z,1-1-24 12:00 AM,2024-01-01T00:00:00.000Z,1-5-24 12:30 AM,2024-01-05T00:30:00.000Z,4,4,,PM,CLOSE,Y,N,NO,CHATHAM
23-52338,"Area Asset Checks-1830, 1840, DDG Cooler",1800,1800,,,,12-4-23 1:52 AM,2023-12-04T01:52:00.000Z,1-1-24 12:00 AM,2024-01-01T00:00:00.000Z,1-5-24 1:23 PM,2024-01-05T13:23:00.000Z,4,4,,PM,CLOSE,Y,,NO,CHATHAM
23-52337,"Area Asset Checks-1830, 1840, DDG Cooler",1800,1800,,,,12-4-23 1:52 AM,2023-12-04T01:52:00.000Z,1-1-24 12:00 AM,2024-01-01T00:00:00.000Z,1-5-24 1:00 AM,2024-01-05T01:00:00.000Z,4,4,,PM,CLOSE,Y,N,NO,CHATHAM
23-52336,"Area Asset Checks-2200, 2300, 3200, 3600, 4100",2200,2200,,,,12-4-23 1:51 AM,2023-12-04T01:51:00.000Z,1-1-24 12:00 AM,2024-01-01T00:00:00.000Z,1-2-24 12:55 PM,2024-01-02T12:55:00.000Z,4,4,,PM,CLOSE,Y,,NO,CHATHAM
23-52335,"Area Asset Checks-2200, 2300, 3200, 3600, 4100",2200,2200,,,,12-4-23 1:51 AM,2023-12-04T01:51:00.000Z,1-1-24 12:00 AM,2024-01-01T00:00:00.000Z,1-2-24 1:00 AM,2024-01-02T01:00:00.000Z,4,4,,PM,CLOSE,Y,N,NO,CHATHAM
23-52334,"Area Asset Checks-1600, 1660, 1700 (Evaps, Corn oil, Decanyers)",1600,1600,,,,12-4-23 1:51 AM,2023-12-04T01:51:00.000Z,1-1-24 12:00 AM,2024-01-01T00:00:00.000Z,1-2-24 3:00 PM,2024-01-02T15:00:00.000Z,4,4,,PM,CLOSE,Y,,NO,CHATHAM
23-52333,"Area Asset Checks-1600, 1660, 1700",1600,1600,,,,12-4-23 1:51 AM,2023-12-04T01:51:00.000Z,1-1-24 12:00 AM,2024-01-01T00:00:00.000Z,1-2-24 2:00 AM,2024-01-02T02:00:00.000Z,4,4,,PM,CLOSE,Y,N,NO,CHATHAM
23-52332,"Area Asset Checks-1500, 6500 (Distillation)",1500,1500,,,,12-4-23 1:51 AM,2023-12-04T01:51:00.000Z,1-1-24 12:00 AM,2024-01-01T00:00:00.000Z,1-2-24 3:01 PM,2024-01-02T15:01:00.000Z,4,4,,PM,CLOSE,Y,,NO,CHATHAM
23-52331,"Area Asset Checks-1500, 6500",1500,1500,,,,12-4-23 1:51 AM,2023-12-04T01:51:00.000Z,1-1-24 12:00 AM,2024-01-01T00:00:00.000Z,1-2-24 2:00 AM,2024-01-02T02:00:00.000Z,4,4,,PM,CLOSE,Y,N,NO,CHATHAM
23-52330,"Area Asset Checks-2100, 1200, 1300, 1400 (Corn, Mill, Mash, Fermentation)",2100,2100,,,,12-4-23 1:51 AM,2023-12-04T01:51:00.000Z,1-1-24 5:00 AM,2024-01-01T05:00:00.000Z,1-5-24 1:23 PM,2024-01-05T13:23:00.000Z,4,4,,PM,CLOSE,Y,,NO,CHATHAM
23-52329,"Area Asset Checks-2100, 1200, 1300, 1400 (Corn, Mill, Mash, Fermentation)",2100,2100,,,,12-4-23 1:51 AM,2023-12-04T01:51:00.000Z,1-1-24 12:00 AM,2024-01-01T00:00:00.000Z,1-5-24 1:00 AM,2024-01-05T01:00:00.000Z,4,4,,PM,CLOSE,Y,N,NO,CHATHAM
23-52328,BL-1804D WEEKLY GREASING,BL-1804D,BL-1804D,,,,12-4-23 1:51 AM,2023-12-04T01:51:00.000Z,1-1-24 12:00 AM,2024-01-01T00:00:00.000Z,1-8-24 1:21 PM,2024-01-08T13:21:00.000Z,4,4,,PM,CLOSE,Y,,NO,CHATHAM
23-52327,BL-1804D - WEEKLY BEARING GREASING,BL-1804D,BL-1804D,,,,12-4-23 1:51 AM,2023-12-04T01:51:00.000Z,1-1-24 12:00 AM,2024-01-01T00:00:00.000Z,1-8-24 1:21 PM,2024-01-08T13:21:00.000Z,4,4,,PM,CLOSE,Y,N,NO,CHATHAM
23-52326,CENTRIFUGAL BLOWER PM,BL-1804D,BL-1804D,,,,12-4-23 1:51 AM,2023-12-04T01:51:00.000Z,1-30-24 12:00 AM,2024-01-30T00:00:00.000Z,5-27-24 9:32 AM,2024-05-27T09:32:00.000Z,4,4,,SD,CLOSE,Y,,NO,CHATHAM
23-52325,BL-1804D - MECHANICAL PM,BL-1804D,BL-1804D,,,,12-4-23 1:51 AM,2023-12-04T01:51:00.000Z,1-30-24 1:30 AM,2024-01-30T01:30:00.000Z,5-27-24 9:32 AM,2024-05-27T09:32:00.000Z,4,4,,SD,CLOSE,Y,N,NO,CHATHAM
23-52324,MCC'S UPS ANNUAL PM,MCC-3820,MCC-3820,7713,,,12-4-23 1:51 AM,2023-12-04T01:51:00.000Z,4-26-24 12:00 AM,2024-04-26T00:00:00.000Z,12-15-24 6:49 PM,2024-12-15T18:49:00.000Z,4,4,,PM,CLOSE,Y,,NO,CHATHAM
23-52323,MCC3820  UPS PM,MCC-3820,MCC-3820,7713,,,12-4-23 1:51 AM,2023-12-04T01:51:00.000Z,4-26-24 12:00 AM,2024-04-26T00:00:00.000Z,12-15-24 6:49 PM,2024-12-15T18:49:00.000Z,4,4,,PM,CLOSE,Y,N,NO,CHATHAM
23-52322,MCC'S UPS ANNUAL PM,MCC-3818,MCC-3818,3386,,,12-4-23 1:51 AM,2023-12-04T01:51:00.000Z,4-26-24 12:00 AM,2024-04-26T00:00:00.000Z,12-15-24 6:49 PM,2024-12-15T18:49:00.000Z,4,4,,PM,CLOSE,Y,,NO,CHATHAM
23-52321,MCC3818A  UPS PM,MCC-3818,MCC-3818,3386,,,12-4-23 1:51 AM,2023-12-04T01:51:00.000Z,4-26-24 12:00 AM,2024-04-26T00:00:00.000Z,12-15-24 6:49 PM,2024-12-15T18:49:00.000Z,4,4,,PM,CLOSE,Y,N,NO,CHATHAM
23-52320,MCC'S UPS ANNUAL PM,UPS-3818B,UPS-3818B,6187,,,12-4-23 1:51 AM,2023-12-04T01:51:00.000Z,4-26-24 12:00 AM,2024-04-26T00:00:00.000Z,12-15-24 6:49 PM,2024-12-15T18:49:00.000Z,4,4,,PM,CLOSE,Y,,NO,CHATHAM
23-52319,MCC3818B  UPS PM,UPS-3818B,UPS-3818B,6187,,,12-4-23 1:51 AM,2023-12-04T01:51:00.000Z,4-26-24 12:00 AM,2024-04-26T00:00:00.000Z,12-15-24 6:49 PM,2024-12-15T18:49:00.000Z,4,4,,PM,CLOSE,Y,N,NO,CHATHAM
23-52318,DRYER C-D GROUND CLEANUP PRIOR TO ANY WORK (12 WEEK DR0),1800,1800,,,,12-4-23 1:51 AM,2023-12-04T01:51:00.000Z,1-1-24 1:00 AM,2024-01-01T01:00:00.000Z,4-9-24 10:37 AM,2024-04-09T10:37:00.000Z,4,4,,SD,CLOSE,Y,,NO,CHATHAM
23-52317,DRYER C-D GROUND CLEANUP PRIOR TO ANY WORK (12 WEEK PM DR0),1800,1800,,,,12-4-23 1:51 AM,2023-12-04T01:51:00.000Z,1-1-24 12:00 AM,2024-01-01T00:00:00.000Z,4-9-24 10:37 AM,2024-04-09T10:37:00.000Z,4,4,,SD,CLOSE,Y,N,NO,CHATHAM
23-52316,AFTER FILTER ELEMENT CHANGE OUT,DR-3301B,DR-3301B,6672,,,12-4-23 1:51 AM,2023-12-04T01:51:00.000Z,12-28-23 12:00 AM,2023-12-28T00:00:00.000Z,6-20-24 2:16 PM,2024-06-20T14:16:00.000Z,4,4,,PM,CLOSE,Y,,NO,CHATHAM
23-52315,PRE-FILTER ELEMENT CHANGE OUT,DR-3301B,DR-3301B,6672,,,12-4-23 1:51 AM,2023-12-04T01:51:00.000Z,12-28-23 12:00 AM,2023-12-28T00:00:00.000Z,6-20-24 2:16 PM,2024-06-20T14:16:00.000Z,4,4,,PM,CLOSE,Y,,NO,CHATHAM
23-52314,DR-3301B FILTER CHANGE OUT PM,DR-3301B,DR-3301B,6672,,,12-4-23 1:51 AM,2023-12-04T01:51:00.000Z,12-28-23 12:00 AM,2023-12-28T00:00:00.000Z,6-20-24 2:16 PM,2024-06-20T14:16:00.000Z,4,4,,PM,CLOSE,Y,N,NO,CHATHAM
23-52313,AFTER FILTER ELEMENT CHANGE OUT,DR-3301A,DR-3301A,6671,,,12-4-23 1:51 AM,2023-12-04T01:51:00.000Z,12-28-23 12:00 AM,2023-12-28T00:00:00.000Z,6-20-24 2:16 PM,2024-06-20T14:16:00.000Z,4,4,,PM,CLOSE,Y,,NO,CHATHAM
23-52312,PRE-FILTER ELEMENT CHANGE OUT,DR-3301A,DR-3301A,6671,,,12-4-23 1:51 AM,2023-12-04T01:51:00.000Z,12-28-23 12:00 AM,2023-12-28T00:00:00.000Z,6-20-24 2:16 PM,2024-06-20T14:16:00.000Z,4,4,,PM,CLOSE,Y,,NO,CHATHAM
23-52311,DR-3301A FILTER CHANGE OUT PM,DR-3301A,DR-3301A,6671,,,12-4-23 1:51 AM,2023-12-04T01:51:00.000Z,12-28-23 12:00 AM,2023-12-28T00:00:00.000Z,6-20-24 2:16 PM,2024-06-20T14:16:00.000Z,4,4,,PM,CLOSE,Y,N,NO,CHATHAM
23-52310,5S AND STOCKROOM AUDIT-WEEKLY PM,MAINTENANCE,MAINTENANCE,,,,12-4-23 1:51 AM,2023-12-04T01:51:00.000Z,1-1-24 12:00 AM,2024-01-01T00:00:00.000Z,1-8-24 1:21 PM,2024-01-08T13:21:00.000Z,4,4,,PM,CLOSE,Y,N,NO,CHATHAM
23-52309,To be calibrated as per ISO 14001 PM,FT-60902,FT-60902,2145,,,12-4-23 1:51 AM,2023-12-04T01:51:00.000Z,4-29-24 2:00 AM,2024-04-29T02:00:00.000Z,4-9-24 10:38 AM,2024-04-09T10:38:00.000Z,4,4,,SD,CLOSE,Y,,NO,CHATHAM
23-52308,FT-60902 - Calibration for ISO 14001,FT-60902,FT-60902,2145,,,12-4-23 1:51 AM,2023-12-04T01:51:00.000Z,4-29-24 2:00 AM,2024-04-29T02:00:00.000Z,4-9-24 10:38 AM,2024-04-09T10:38:00.000Z,4,4,,SD,CLOSE,Y,N,NO,CHATHAM
23-52307,TEST FIRE SUPPRESSION SYSTEM,ME-3602A,ME-3602A,,,,12-4-23 1:50 AM,2023-12-04T01:50:00.000Z,4-24-24 12:00 AM,2024-04-24T00:00:00.000Z,4-9-24 10:40 AM,2024-04-09T10:40:00.000Z,4,4,,SD,CLOSE,Y,,NO,CHATHAM
23-52306,TEST FIRE SUPPRESSION SYSTEM CG2,ME-3602A,ME-3602A,,,,12-4-23 1:50 AM,2023-12-04T01:50:00.000Z,4-24-24 12:00 AM,2024-04-24T00:00:00.000Z,4-9-24 10:40 AM,2024-04-09T10:40:00.000Z,4,4,,SD,CLOSE,Y,N,NO,CHATHAM
23-52305,TOTE#5 (4) 100' EXPLOSION PROOF EXTENSION CORDS,CHATHAM,CHATHAM,,,,12-4-23 1:50 AM,2023-12-04T01:50:00.000Z,12-29-23 12:00 AM,2023-12-29T00:00:00.000Z,6-20-24 2:10 PM,2024-06-20T14:10:00.000Z,4,4,,PM,CLOSE,Y,,NO,CHATHAM
23-52304,"TOTE #4 (4) COATS, (4) BIBS, (10) GLOVES, HARD HAT LINERS, NECK WARMERS, (20) INFERNO PACKS",CHATHAM,CHATHAM,,,,12-4-23 1:50 AM,2023-12-04T01:50:00.000Z,12-29-23 12:00 AM,2023-12-29T00:00:00.000Z,6-20-24 2:10 PM,2024-06-20T14:10:00.000Z,4,4,,PM,CLOSE,Y,,NO,CHATHAM
23-52303,TOTE #3 (2) SNAKE INSULATION BLANKETS,CHATHAM,CHATHAM,,,,12-4-23 1:50 AM,2023-12-04T01:50:00.000Z,12-29-23 12:00 AM,2023-12-29T00:00:00.000Z,6-20-24 2:10 PM,2024-06-20T14:10:00.000Z,4,4,,PM,CLOSE,Y,,NO,CHATHAM
23-52302,TOTE #2 (2) SNAKE INSULATION BLANKETS,CHATHAM,CHATHAM,,,,12-4-23 1:50 AM,2023-12-04T01:50:00.000Z,12-29-23 12:00 AM,2023-12-29T00:00:00.000Z,6-20-24 2:10 PM,2024-06-20T14:10:00.000Z,4,4,,PM,CLOSE,Y,,NO,CHATHAM
23-52301,TOTE #1 250' PORTABLE HEAT TRACING,CHATHAM,CHATHAM,,,,12-4-23 1:50 AM,2023-12-04T01:50:00.000Z,12-29-23 12:00 AM,2023-12-29T00:00:00.000Z,6-20-24 2:10 PM,2024-06-20T14:10:00.000Z,4,4,,PM,CLOSE,Y,,NO,CHATHAM
23-52300,COLD WEATHER PLAN (TOTE INSPECTION/AUDIT),CHATHAM,CHATHAM,,,,12-4-23 1:50 AM,2023-12-04T01:50:00.000Z,12-29-23 1:00 AM,2023-12-29T01:00:00.000Z,6-20-24 2:10 PM,2024-06-20T14:10:00.000Z,4,4,,PM,CLOSE,Y,N,NO,CHATHAM
23-52299,Weekly Vibration check (GFE I/E),MI-1201A,MI-1201A,,,,12-4-23 1:50 AM,2023-12-04T01:50:00.000Z,12-28-23 12:00 AM,2023-12-28T00:00:00.000Z,1-2-24 7:51 AM,2024-01-02T07:51:00.000Z,4,4,,PM,CLOSE,Y,,NO,CHATHAM
23-52298,HAMMERMILL WEEKLY PM & ROTATION CHANGE,MI-1201A,MI-1201A,,,,12-4-23 1:50 AM,2023-12-04T01:50:00.000Z,12-28-23 12:00 AM,2023-12-28T00:00:00.000Z,1-2-24 7:51 AM,2024-01-02T07:51:00.000Z,4,4,,PM,CLOSE,Y,,NO,CHATHAM
23-52297,MI-1201A - MECHANICAL PM,MI-1201A,MI-1201A,,,,12-4-23 1:50 AM,2023-12-04T01:50:00.000Z,12-28-23 12:30 AM,2023-12-28T00:30:00.000Z,1-2-24 7:50 AM,2024-01-02T07:50:00.000Z,4,4,,PM,CLOSE,Y,N,NO,CHATHAM
23-52296,Weekly Vibration check (GFE I/E),MI-1201B,MI-1201B,,,,12-4-23 1:50 AM,2023-12-04T01:50:00.000Z,1-1-24 12:00 AM,2024-01-01T00:00:00.000Z,1-8-24 6:48 AM,2024-01-08T06:48:00.000Z,4,4,,PM,CLOSE,Y,,NO,CHATHAM
23-52295,C-MI-1201B - MECHANICAL PM,MI-1201B,MI-1201B,,,,12-4-23 1:50 AM,2023-12-04T01:50:00.000Z,1-1-24 12:00 AM,2024-01-01T00:00:00.000Z,1-8-24 6:48 AM,2024-01-08T06:48:00.000Z,4,4,,PM,CLOSE,Y,,NO,CHATHAM
23-52294,MI-1201B - MECHANICAL PM,MI-1201B,MI-1201B,,,,12-4-23 1:50 AM,2023-12-04T01:50:00.000Z,1-1-24 12:30 AM,2024-01-01T00:30:00.000Z,1-4-24 1:30 AM,2024-01-04T01:30:00.000Z,4,4,,PM,CLOSE,Y,N,NO,CHATHAM
23-52293,CHECK THE IMPROSEALS FOR OIL LEAKAGE,P-2303C,P-2303C,1121,,,12-4-23 1:50 AM,2023-12-04T01:50:00.000Z,12-28-23 12:15 AM,2023-12-28T00:15:00.000Z,12-27-23 7:43 AM,2023-12-27T07:43:00.000Z,4,4,,PM,CLOSE,Y,,NO,CHATHAM
23-52292,REMOVE COUPLING GUARD AND INSPECT OMEGA ELEMENT,P-2303C,P-2303C,1121,,,12-4-23 1:50 AM,2023-12-04T01:50:00.000Z,12-28-23 12:15 AM,2023-12-28T00:15:00.000Z,12-27-23 7:43 AM,2023-12-27T07:43:00.000Z,4,4,,PM,CLOSE,Y,,NO,CHATHAM
23-52291,OIL CHANGE ON GOULDS PUMPS,P-2303C,P-2303C,1121,,,12-4-23 1:50 AM,2023-12-04T01:50:00.000Z,12-28-23 12:30 AM,2023-12-28T00:30:00.000Z,12-27-23 7:43 AM,2023-12-27T07:43:00.000Z,4,4,,PM,CLOSE,Y,,NO,CHATHAM
23-52290,P-2303C - OIL CHANGE/ PM SERVICE,P-2303C,P-2303C,1121,,,12-4-23 1:50 AM,2023-12-04T01:50:00.000Z,12-28-23 1:00 AM,2023-12-28T01:00:00.000Z,12-27-23 7:43 AM,2023-12-27T07:43:00.000Z,4,4,,PM,CLOSE,Y,N,NO,CHATHAM
23-52289,CHECK THE IMPROSEALS FOR OIL LEAKAGE,P-2303B,P-2303B,1120,,,12-4-23 1:50 AM,2023-12-04T01:50:00.000Z,12-28-23 12:15 AM,2023-12-28T00:15:00.000Z,12-20-23 4:18 PM,2023-12-20T16:18:00.000Z,4,4,,PM,CLOSE,Y,,NO,CHATHAM
23-52288,REMOVE COUPLING GUARD AND INSPECT OMEGA ELEMENT,P-2303B,P-2303B,1120,,,12-4-23 1:50 AM,2023-12-04T01:50:00.000Z,12-28-23 12:15 AM,2023-12-28T00:15:00.000Z,12-20-23 4:18 PM,2023-12-20T16:18:00.000Z,4,4,,PM,CLOSE,Y,,NO,CHATHAM
23-52287,OIL CHANGE ON GOULDS PUMPS,P-2303B,P-2303B,1120,,,12-4-23 1:50 AM,2023-12-04T01:50:00.000Z,12-28-23 12:30 AM,2023-12-28T00:30:00.000Z,12-20-23 4:18 PM,2023-12-20T16:18:00.000Z,4,4,,PM,CLOSE,Y,,NO,CHATHAM
23-52286,P-2303B - OIL CHANGE/ PM SERVICE,P-2303B,P-2303B,1120,,,12-4-23 1:50 AM,2023-12-04T01:50:00.000Z,12-28-23 1:00 AM,2023-12-28T01:00:00.000Z,12-20-23 1:00 AM,2023-12-20T01:00:00.000Z,4,4,,PM,CLOSE,Y,N,NO,CHATHAM
23-52285,INSULATION BLANKET AUDIT (PLANT WIDE),CHATHAM,CHATHAM,,,,12-4-23 1:50 AM,2023-12-04T01:50:00.000Z,1-1-24 12:00 AM,2024-01-01T00:00:00.000Z,6-20-24 3:31 PM,2024-06-20T15:31:00.000Z,4,4,,PM,CLOSE,Y,,NO,CHATHAM
23-52284,INSULATION BLANKET AUDIT (PLANT WIDE),CHATHAM,CHATHAM,,,,12-4-23 1:50 AM,2023-12-04T01:50:00.000Z,1-1-24 4:00 PM,2024-01-01T16:00:00.000Z,6-20-24 3:31 PM,2024-06-20T15:31:00.000Z,4,4,,PM,CLOSE,Y,N,NO,CHATHAM
23-52283,GIVE SAMPLE TO SHIPPER/RECEIVER,CV-2602,CV-2602,1440,,,12-4-23 1:50 AM,2023-12-04T01:50:00.000Z,12-28-23 12:00 AM,2023-12-28T00:00:00.000Z,12-21-23 11:11 AM,2023-12-21T11:11:00.000Z,4,4,,PD,CLOSE,Y,,NO,CHATHAM
23-52282,CHECK OIL LEVEL,CV-2602,CV-2602,1440,,,12-4-23 1:50 AM,2023-12-04T01:50:00.000Z,12-28-23 12:30 AM,2023-12-28T00:30:00.000Z,12-21-23 11:11 AM,2023-12-21T11:11:00.000Z,4,4,,PD,CLOSE,Y,,NO,CHATHAM
23-52281,EXTRACT OIL SAMPLE,CV-2602,CV-2602,1440,,,12-4-23 1:50 AM,2023-12-04T01:50:00.000Z,12-28-23 12:30 AM,2023-12-28T00:30:00.000Z,12-21-23 11:11 AM,2023-12-21T11:11:00.000Z,4,4,,PD,CLOSE,Y,,NO,CHATHAM
23-52280,PREPARATION OF CONTAINERS,CV-2602,CV-2602,1440,,,12-4-23 1:50 AM,2023-12-04T01:50:00.000Z,12-28-23 12:00 AM,2023-12-28T00:00:00.000Z,12-21-23 11:11 AM,2023-12-21T11:11:00.000Z,4,4,,PD,CLOSE,Y,,NO,CHATHAM
23-52279,CV-2602-OIL SAMPLING,CV-2602,CV-2602,1440,,,12-4-23 1:50 AM,2023-12-04T01:50:00.000Z,12-28-23 12:30 AM,2023-12-28T00:30:00.000Z,12-21-23 1:00 AM,2023-12-21T01:00:00.000Z,4,4,,PD,CLOSE,Y,N,NO,CHATHAM
23-52278,GIVE SAMPLE TO SHIPPER/RECEIVER,CV-2108,CV-2108,1435,,,12-4-23 1:50 AM,2023-12-04T01:50:00.000Z,12-28-23 12:00 AM,2023-12-28T00:00:00.000Z,12-21-23 11:11 AM,2023-12-21T11:11:00.000Z,4,4,,PD,CLOSE,Y,,NO,CHATHAM
23-52277,CHECK OIL LEVEL,CV-2108,CV-2108,1435,,,12-4-23 1:50 AM,2023-12-04T01:50:00.000Z,12-28-23 12:30 AM,2023-12-28T00:30:00.000Z,12-21-23 11:11 AM,2023-12-21T11:11:00.000Z,4,4,,PD,CLOSE,Y,,NO,CHATHAM
23-52276,EXTRACT OIL SAMPLE,CV-2108,CV-2108,1435,,,12-4-23 1:50 AM,2023-12-04T01:50:00.000Z,12-28-23 12:30 AM,2023-12-28T00:30:00.000Z,12-21-23 11:11 AM,2023-12-21T11:11:00.000Z,4,4,,PD,CLOSE,Y,,NO,CHATHAM
23-52275,PREPARATION OF CONTAINERS,CV-2108,CV-2108,1435,,,12-4-23 1:50 AM,2023-12-04T01:50:00.000Z,12-28-23 12:00 AM,2023-12-28T00:00:00.000Z,12-21-23 11:11 AM,2023-12-21T11:11:00.000Z,4,4,,PD,CLOSE,Y,,NO,CHATHAM
23-52274,CV-2108-OIL SAMPLING,CV-2108,CV-2108,1435,,,12-4-23 1:50 AM,2023-12-04T01:50:00.000Z,12-28-23 12:30 AM,2023-12-28T00:30:00.000Z,12-21-23 1:00 AM,2023-12-21T01:00:00.000Z,4,4,,PD,CLOSE,Y,N,NO,CHATHAM
23-52273,PH PROBE CLEANING AND CALIBRATION WEEKLY PM,AT-14125,AT-14125,1230,,,12-4-23 1:50 AM,2023-12-04T01:50:00.000Z,12-28-23 1:00 AM,2023-12-28T01:00:00.000Z,12-28-23 2:32 PM,2023-12-28T14:32:00.000Z,4,4,,PM,CLOSE,Y,,NO,CHATHAM
23-52272,PH PROBE CLEANING AND CALIBRATION PM,AT-14125,AT-14125,1230,,,12-4-23 1:50 AM,2023-12-04T01:50:00.000Z,12-28-23 12:00 AM,2023-12-28T00:00:00.000Z,12-28-23 12:30 AM,2023-12-28T00:30:00.000Z,4,4,,PM,CLOSE,Y,N,NO,CHATHAM
23-52271,PH PROBE CLEANING AND CALIBRATION WEEKLY PM,AT-13519,AT-13519,1227,,,12-4-23 1:50 AM,2023-12-04T01:50:00.000Z,12-28-23 1:00 AM,2023-12-28T01:00:00.000Z,12-28-23 7:47 AM,2023-12-28T07:47:00.000Z,4,4,,PM,CLOSE,Y,,NO,CHATHAM
23-52270,PH PROBE CLEANING AND CALIBRATION PM,AT-13519,AT-13519,1227,,,12-4-23 1:50 AM,2023-12-04T01:50:00.000Z,12-28-23 12:00 AM,2023-12-28T00:00:00.000Z,12-28-23 12:15 AM,2023-12-28T00:15:00.000Z,4,4,,PM,CLOSE,Y,N,NO,CHATHAM
23-52269,Agitate the Sludge Bed in the Biothane and preform and record the  Sludge Analysis for the Biothane,T-4126,T-4126,5003,,,12-4-23 1:50 AM,2023-12-04T01:50:00.000Z,1-1-24 12:00 AM,2024-01-01T00:00:00.000Z,6-24-24 8:59 AM,2024-06-24T08:59:00.000Z,4,4,,PM,CLOSE,Y,,NO,CHATHAM
23-52268,SLUDGE ANALYSIS FOR BIOTHANE DIGESTER,T-4126,T-4126,5003,,,12-4-23 1:50 AM,2023-12-04T01:50:00.000Z,1-1-24 12:00 AM,2024-01-01T00:00:00.000Z,6-24-24 8:59 AM,2024-06-24T08:59:00.000Z,4,4,,PM,CLOSE,Y,N,NO,CHATHAM
23-52267,Re-certify   PSV,PSV-69203,PSV-69203,4575,,,12-4-23 1:49 AM,2023-12-04T01:49:00.000Z,4-25-24 12:00 AM,2024-04-25T00:00:00.000Z,,,4,4,,SD,CAN,Y,,NO,CHATHAM
23-52266,PSV-69203 (B-3602) #1,PSV-69203,PSV-69203,4575,,,12-4-23 1:49 AM,2023-12-04T01:49:00.000Z,4-25-24 4:00 AM,2024-04-25T04:00:00.000Z,,,4,4,,SD,CAN,Y,N,NO,CHATHAM
23-52265,Re-certify   PSV,PSV-36106,PSV-36106,4440,,,12-4-23 1:49 AM,2023-12-04T01:49:00.000Z,4-26-24 12:00 AM,2024-04-26T00:00:00.000Z,9-3-25 10:20 PM,2025-09-03T22:20:00.000Z,4,4,,SD,CLOSE,Y,,NO,CHATHAM
23-52264,PSV-36106 (DA-3601) - 2 X 3 - 1380 KPAG,PSV-36106,PSV-36106,4440,,,12-4-23 1:49 AM,2023-12-04T01:49:00.000Z,4-26-24 4:00 AM,2024-04-26T04:00:00.000Z,9-3-25 10:20 PM,2025-09-03T22:20:00.000Z,4,4,,SD,CLOSE,Y,N,NO,CHATHAM
23-52263,Transfer case oil sample,MX-1302,MX-1302,3563,,,12-4-23 1:49 AM,2023-12-04T01:49:00.000Z,1-27-24 12:15 AM,2024-01-27T00:15:00.000Z,4-9-24 10:42 AM,2024-04-09T10:42:00.000Z,4,4,,SD,CLOSE,Y,,NO,CHATHAM
23-52262,Eurodrive oil sample,MX-1302,MX-1302,3563,,,12-4-23 1:49 AM,2023-12-04T01:49:00.000Z,1-27-24 12:15 AM,2024-01-27T00:15:00.000Z,4-9-24 10:42 AM,2024-04-09T10:42:00.000Z,4,4,,SD,CLOSE,Y,,NO,CHATHAM
23-52261,MX-1302 - OIL SAMPLE,MX-1302,MX-1302,3563,,,12-4-23 1:49 AM,2023-12-04T01:49:00.000Z,1-27-24 12:00 AM,2024-01-27T00:00:00.000Z,4-9-24 10:42 AM,2024-04-09T10:42:00.000Z,4,4,,SD,CLOSE,Y,N,NO,CHATHAM
23-52260,Monitor & fill salt boxes,CHATHAM,CHATHAM,,,,12-4-23 1:49 AM,2023-12-04T01:49:00.000Z,12-28-23 1:00 AM,2023-12-28T01:00:00.000Z,12-28-23 11:00 AM,2023-12-28T11:00:00.000Z,4,4,,PM,CLOSE,Y,,NO,CHATHAM
23-52259,Thursday route - Fill plant salt boxes,CHATHAM,CHATHAM,,,,12-4-23 1:49 AM,2023-12-04T01:49:00.000Z,12-28-23 12:00 AM,2023-12-28T00:00:00.000Z,12-28-23 3:00 AM,2023-12-28T03:00:00.000Z,4,4,,PM,CLOSE,Y,N,NO,CHATHAM
23-52258,Monitor & fill salt boxes,CHATHAM,CHATHAM,,,,12-4-23 1:49 AM,2023-12-04T01:49:00.000Z,1-1-24 1:00 AM,2024-01-01T01:00:00.000Z,1-3-24 8:10 AM,2024-01-03T08:10:00.000Z,4,4,,PM,CLOSE,Y,,NO,CHATHAM
23-52257,Monday route - Fill plant salt boxes,CHATHAM,CHATHAM,,,,12-4-23 1:49 AM,2023-12-04T01:49:00.000Z,1-1-24 12:00 AM,2024-01-01T00:00:00.000Z,1-2-24 1:00 AM,2024-01-02T01:00:00.000Z,4,4,,PM,CLOSE,Y,N,NO,CHATHAM
23-52256,LUBRICATE MIXER SHAFT PILLOW BLOCKS,MX-1302,MX-1302,3563,,,12-4-23 1:49 AM,2023-12-04T01:49:00.000Z,12-28-23 12:15 AM,2023-12-28T00:15:00.000Z,12-27-23 7:42 AM,2023-12-27T07:42:00.000Z,4,4,,PM,CLOSE,Y,,NO,CHATHAM
23-52255,MX-1302 - PILLOW BLOCK BEARING LUBRICATION,MX-1302,MX-1302,3563,,,12-4-23 1:49 AM,2023-12-04T01:49:00.000Z,12-28-23 12:15 AM,2023-12-28T00:15:00.000Z,12-27-23 7:42 AM,2023-12-27T07:42:00.000Z,4,4,,PM,CLOSE,Y,N,NO,CHATHAM
23-52254,REFILL FILTER HOUSING & CHECK FOR LEAKS,F-2204B,F-2204B,1661,,,12-4-23 1:49 AM,2023-12-04T01:49:00.000Z,12-28-23 12:15 AM,2023-12-28T00:15:00.000Z,12-21-23 11:09 AM,2023-12-21T11:09:00.000Z,4,4,,PM,CLOSE,Y,,NO,CHATHAM
23-52253,REINSTALL COVER,F-2204B,F-2204B,1661,,,12-4-23 1:49 AM,2023-12-04T01:49:00.000Z,12-28-23 12:15 AM,2023-12-28T00:15:00.000Z,12-21-23 11:09 AM,2023-12-21T11:09:00.000Z,4,4,,PM,CLOSE,Y,,NO,CHATHAM
23-52252,REPLACE CARTRIDGES,F-2204B,F-2204B,1661,,,12-4-23 1:49 AM,2023-12-04T01:49:00.000Z,12-28-23 12:30 AM,2023-12-28T00:30:00.000Z,12-21-23 11:09 AM,2023-12-21T11:09:00.000Z,4,4,,PM,CLOSE,Y,,NO,CHATHAM
23-52251,REPLACE FILTER CARTRIDGES,F-2204B,F-2204B,1661,,,12-4-23 1:49 AM,2023-12-04T01:49:00.000Z,12-28-23 12:15 AM,2023-12-28T00:15:00.000Z,12-21-23 11:09 AM,2023-12-21T11:09:00.000Z,4,4,,PM,CLOSE,Y,,NO,CHATHAM
23-52250,F-2204B FILTER CHANGE PM,F-2204B,F-2204B,1661,,,12-4-23 1:49 AM,2023-12-04T01:49:00.000Z,12-28-23 1:30 AM,2023-12-28T01:30:00.000Z,12-21-23 11:09 AM,2023-12-21T11:09:00.000Z,4,4,,PM,CLOSE,Y,N,NO,CHATHAM
23-52249,REFILL FILTER HOUSING & CHECK FOR LEAKS,F-2204A,F-2204A,6805,,,12-4-23 1:49 AM,2023-12-04T01:49:00.000Z,12-28-23 12:15 AM,2023-12-28T00:15:00.000Z,12-21-23 11:09 AM,2023-12-21T11:09:00.000Z,4,4,,PM,CLOSE,Y,,NO,CHATHAM
23-52248,REINSTALL COVER,F-2204A,F-2204A,6805,,,12-4-23 1:49 AM,2023-12-04T01:49:00.000Z,12-28-23 12:15 AM,2023-12-28T00:15:00.000Z,12-21-23 11:09 AM,2023-12-21T11:09:00.000Z,4,4,,PM,CLOSE,Y,,NO,CHATHAM
23-52247,REPLACE CARTRIDGES,F-2204A,F-2204A,6805,,,12-4-23 1:49 AM,2023-12-04T01:49:00.000Z,12-28-23 12:30 AM,2023-12-28T00:30:00.000Z,12-21-23 11:09 AM,2023-12-21T11:09:00.000Z,4,4,,PM,CLOSE,Y,,NO,CHATHAM
23-52246,REPLACE FILTER CARTRIDGES,F-2204A,F-2204A,6805,,,12-4-23 1:49 AM,2023-12-04T01:49:00.000Z,12-28-23 12:15 AM,2023-12-28T00:15:00.000Z,12-21-23 11:09 AM,2023-12-21T11:09:00.000Z,4,4,,PM,CLOSE,Y,,NO,CHATHAM
23-52245,F-2204A FILTER CHANGE PM,F-2204A,F-2204A,6805,,,12-4-23 1:49 AM,2023-12-04T01:49:00.000Z,12-28-23 1:30 AM,2023-12-28T01:30:00.000Z,12-18-23 12:30 AM,2023-12-18T00:30:00.000Z,4,4,,PM,CLOSE,Y,N,NO,CHATHAM
23-52244,Re-install protective cover,H-1801D,H-1801D,2481,,,12-4-23 1:49 AM,2023-12-04T01:49:00.000Z,4-24-24 1:00 AM,2024-04-24T01:00:00.000Z,5-27-24 10:30 AM,2024-05-27T10:30:00.000Z,4,4,,SD,CLOSE,Y,,NO,CHATHAM
23-52243,Re-install burner,H-1801D,H-1801D,2481,,,12-4-23 1:49 AM,2023-12-04T01:49:00.000Z,4-24-24 1:00 AM,2024-04-24T01:00:00.000Z,5-27-24 10:30 AM,2024-05-27T10:30:00.000Z,4,4,,SD,CLOSE,Y,,NO,CHATHAM
23-52242,Inspect burner tubes and refractory face (repairs as needed),H-1801D,H-1801D,2481,,,12-4-23 1:49 AM,2023-12-04T01:49:00.000Z,4-24-24 3:00 AM,2024-04-24T03:00:00.000Z,5-27-24 10:30 AM,2024-05-27T10:30:00.000Z,4,4,,SD,CLOSE,Y,,NO,CHATHAM
23-52241,Lift and remove Burner,H-1801D,H-1801D,2481,,,12-4-23 1:49 AM,2023-12-04T01:49:00.000Z,4-24-24 1:00 AM,2024-04-24T01:00:00.000Z,5-27-24 10:30 AM,2024-05-27T10:30:00.000Z,4,4,,SD,CLOSE,Y,,NO,CHATHAM
23-52240,Lift and remove protective covers (to grade),H-1801D,H-1801D,2481,,,12-4-23 1:49 AM,2023-12-04T01:49:00.000Z,4-24-24 1:00 AM,2024-04-24T01:00:00.000Z,5-27-24 10:30 AM,2024-05-27T10:30:00.000Z,4,4,,SD,CLOSE,Y,,NO,CHATHAM
23-52239,DRYER D BURNER TUBE INSPECTION,H-1801D,H-1801D,2481,,,12-4-23 1:49 AM,2023-12-04T01:49:00.000Z,4-24-24 7:00 AM,2024-04-24T07:00:00.000Z,5-27-24 10:30 AM,2024-05-27T10:30:00.000Z,4,4,,SD,CLOSE,Y,N,NO,CHATHAM
23-52238,SA-4102 (CK SAMPLER) CLEANING / CALIBRATION,SA-4102,SA-4102,4867,,,12-4-23 1:49 AM,2023-12-04T01:49:00.000Z,3-29-24 1:00 AM,2024-03-29T01:00:00.000Z,7-2-24 2:59 PM,2024-07-02T14:59:00.000Z,4,4,,PM,CLOSE,Y,,NO,CHATHAM
23-52237,SA-4102 REFRIGERATED SAMPLER CLEANING AND INSPECTION,SA-4102,SA-4102,4867,,,12-4-23 1:49 AM,2023-12-04T01:49:00.000Z,3-29-24 1:00 AM,2024-03-29T01:00:00.000Z,7-2-24 2:59 PM,2024-07-02T14:59:00.000Z,4,4,,PM,CLOSE,Y,N,NO,CHATHAM
23-52236,CONDUCTIVITY METER /PH PROBE CLEAN & CALIBRATE PM,AE-84404,AE-84404,7174,,,12-4-23 1:49 AM,2023-12-04T01:49:00.000Z,12-28-23 2:00 AM,2023-12-28T02:00:00.000Z,12-28-23 2:32 PM,2023-12-28T14:32:00.000Z,4,4,,PM,CLOSE,Y,,NO,CHATHAM
23-52235,DRYER SCRUBBER PH PROBE PM,AE-84404,AE-84404,7174,,,12-4-23 1:49 AM,2023-12-04T01:49:00.000Z,12-28-23 1:00 AM,2023-12-28T01:00:00.000Z,12-28-23 12:30 AM,2023-12-28T00:30:00.000Z,4,4,,PM,CLOSE,Y,N,NO,CHATHAM
23-52234,Inspect And Rotate hammers and pins if Required.,MI-1801,MI-1801,3405,,,12-4-23 1:48 AM,2023-12-04T01:48:00.000Z,12-29-23 2:00 AM,2023-12-29T02:00:00.000Z,6-21-24 7:47 AM,2024-06-21T07:47:00.000Z,4,4,,PM,CLOSE,Y,,NO,CHATHAM
23-52233,MI-1801 - MECHANICAL PM,MI-1801,MI-1801,3405,,,12-4-23 1:48 AM,2023-12-04T01:48:00.000Z,12-29-23 12:30 AM,2023-12-29T00:30:00.000Z,6-21-24 7:47 AM,2024-06-21T07:47:00.000Z,4,4,,PM,CLOSE,Y,,NO,CHATHAM
23-52232,MI-1801 - MECHANICAL PM,MI-1801,MI-1801,3405,,,12-4-23 1:48 AM,2023-12-04T01:48:00.000Z,12-29-23 12:30 AM,2023-12-29T00:30:00.000Z,6-21-24 7:47 AM,2024-06-21T07:47:00.000Z,4,4,,PM,CLOSE,Y,N,NO,CHATHAM
23-52231,Re-certify   PSV,PSV-36703,PSV-36703,4445,,,12-4-23 1:48 AM,2023-12-04T01:48:00.000Z,4-25-24 12:00 AM,2024-04-25T00:00:00.000Z,5-16-24 6:54 AM,2024-05-16T06:54:00.000Z,4,4,,SD,CLOSE,Y,,NO,CHATHAM
23-52230,PSV-36703 (HRSG) - 4 X 6 - 1378 KPAG,PSV-36703,PSV-36703,4445,,,12-4-23 1:48 AM,2023-12-04T01:48:00.000Z,4-25-24 4:00 AM,2024-04-25T04:00:00.000Z,5-16-24 6:54 AM,2024-05-16T06:54:00.000Z,4,4,,SD,CLOSE,Y,N,NO,CHATHAM
23-52229,Re-certify   PSV,PSV-36702,PSV-36702,4444,,,12-4-23 1:48 AM,2023-12-04T01:48:00.000Z,4-25-24 12:00 AM,2024-04-25T00:00:00.000Z,5-16-24 6:52 AM,2024-05-16T06:52:00.000Z,4,4,,SD,CLOSE,Y,,NO,CHATHAM
23-52228,PSV-36702 (HRSG) - 3 X 4 - 1344 KPAG,PSV-36702,PSV-36702,4444,,,12-4-23 1:48 AM,2023-12-04T01:48:00.000Z,4-25-24 4:00 AM,2024-04-25T04:00:00.000Z,5-16-24 6:52 AM,2024-05-16T06:52:00.000Z,4,4,,SD,CLOSE,Y,N,NO,CHATHAM
23-52227,Re-certify   PSV,PSV-36401,PSV-36401,4442,,,12-4-23 1:48 AM,2023-12-04T01:48:00.000Z,4-25-24 12:00 AM,2024-04-25T00:00:00.000Z,,,4,4,,PM,CAN,Y,,NO,CHATHAM
23-52226,PSV-36401 HRSG RELIEF VALVE 3 X 4 -?,PSV-36401,PSV-36401,4442,,,12-4-23 1:48 AM,2023-12-04T01:48:00.000Z,4-25-24 4:00 AM,2024-04-25T04:00:00.000Z,,,4,4,,SD,CAN,Y,N,NO,CHATHAM
23-52225,Pre-Shutdown Check List/ Verification Procedure,DA-3602,DA-3602,1453,,,12-4-23 1:48 AM,2023-12-04T01:48:00.000Z,4-26-24 12:00 AM,2024-04-26T00:00:00.000Z,5-15-24 7:48 AM,2024-05-15T07:48:00.000Z,4,4,,SD,CLOSE,Y,,NO,CHATHAM
23-52224,DA-3602 PRE-SHUTDOWN INSPECTION,DA-3602,DA-3602,1453,,,12-4-23 1:48 AM,2023-12-04T01:48:00.000Z,4-26-24 12:00 AM,2024-04-26T00:00:00.000Z,5-15-24 7:48 AM,2024-05-15T07:48:00.000Z,4,4,,SD,CLOSE,Y,N,NO,CHATHAM
23-52223,AT DCS,LT-14607,LT-14607,3161,,,12-4-23 1:48 AM,2023-12-04T01:48:00.000Z,1-1-24 12:00 AM,2024-01-01T00:00:00.000Z,1-5-24 8:31 AM,2024-01-05T08:31:00.000Z,4,4,,PM,CLOSE,Y,,NO,CHATHAM
23-52222,IN FIELD,LT-14607,LT-14607,3161,,,12-4-23 1:48 AM,2023-12-04T01:48:00.000Z,1-1-24 12:00 AM,2024-01-01T00:00:00.000Z,1-5-24 8:31 AM,2024-01-05T08:31:00.000Z,4,4,,PM,CLOSE,Y,,NO,CHATHAM
23-52221,AT DCS,LT-14607,LT-14607,3161,,,12-4-23 1:48 AM,2023-12-04T01:48:00.000Z,1-1-24 12:00 AM,2024-01-01T00:00:00.000Z,1-5-24 8:31 AM,2024-01-05T08:31:00.000Z,4,4,,PM,CLOSE,Y,,NO,CHATHAM
23-52220,CO2 MAGNETIC FLOAT LEVEL TRANSMITTER  BLOWDOWN,LT-14607,LT-14607,3161,,,12-4-23 1:48 AM,2023-12-04T01:48:00.000Z,1-1-24 1:00 AM,2024-01-01T01:00:00.000Z,1-5-24 1:00 AM,2024-01-05T01:00:00.000Z,4,4,,PM,CLOSE,Y,N,NO,CHATHAM
23-52219,MONTHLY VIBRATION CHECK,CHATHAM,CHATHAM,,,,12-4-23 1:48 AM,2023-12-04T01:48:00.000Z,12-29-23 11:00 AM,2023-12-29T11:00:00.000Z,6-24-24 9:23 AM,2024-06-24T09:23:00.000Z,4,4,,PD,CLOSE,Y,,NO,CHATHAM
23-52218,VIBRATION ANALYSIS,CHATHAM,CHATHAM,,,,12-4-23 1:48 AM,2023-12-04T01:48:00.000Z,12-28-23 12:00 AM,2023-12-28T00:00:00.000Z,6-24-24 9:23 AM,2024-06-24T09:23:00.000Z,4,4,,PD,CLOSE,Y,N,NO,CHATHAM
23-52217,BUCKET ELEVATOR PM,BE-2601,BE-2601,1282,,,12-4-23 1:48 AM,2023-12-04T01:48:00.000Z,12-28-23 12:00 AM,2023-12-28T00:00:00.000Z,12-22-23 6:54 AM,2023-12-22T06:54:00.000Z,4,4,,PM,CLOSE,Y,,NO,CHATHAM
23-52216,BE-2601 - MECHANICAL PM,BE-2601,BE-2601,1282,,,12-4-23 1:48 AM,2023-12-04T01:48:00.000Z,12-28-23 2:00 AM,2023-12-28T02:00:00.000Z,12-21-23 1:00 AM,2023-12-21T01:00:00.000Z,4,4,,PM,CLOSE,Y,N,NO,CHATHAM
23-52215,DRAG CONVEYOR  P.M.,CV-2602,CV-2602,1440,,,12-4-23 1:48 AM,2023-12-04T01:48:00.000Z,12-28-23 1:30 AM,2023-12-28T01:30:00.000Z,12-21-23 4:11 PM,2023-12-21T16:11:00.000Z,4,4,,PM,CLOSE,Y,,NO,CHATHAM
23-52214,CV-2602 - MECHANICAL PM,CV-2602,CV-2602,1440,,,12-4-23 1:48 AM,2023-12-04T01:48:00.000Z,12-28-23 1:30 AM,2023-12-28T01:30:00.000Z,12-21-23 1:00 AM,2023-12-21T01:00:00.000Z,4,4,,PM,CLOSE,Y,N,NO,CHATHAM
23-52213,Pre-Shutdown Check List/ Verification Procedure,DA-3601,DA-3601,1452,,,12-4-23 1:47 AM,2023-12-04T01:47:00.000Z,4-26-24 12:00 AM,2024-04-26T00:00:00.000Z,5-15-24 7:46 AM,2024-05-15T07:46:00.000Z,4,4,,SD,CLOSE,Y,,NO,CHATHAM
23-52212,DA-3601 DEAREATOR PRE-SHUTDOWN P.M.,DA-3601,DA-3601,1452,,,12-4-23 1:47 AM,2023-12-04T01:47:00.000Z,4-26-24 12:00 AM,2024-04-26T00:00:00.000Z,5-15-24 7:46 AM,2024-05-15T07:46:00.000Z,4,4,,SD,CLOSE,Y,N,NO,CHATHAM
23-52211,SC-1301 MECHANICAL CHECKS,SC-1301,SC-1301,4868,,,12-4-23 1:47 AM,2023-12-04T01:47:00.000Z,1-1-24 1:00 AM,2024-01-01T01:00:00.000Z,1-3-24 8:10 AM,2024-01-03T08:10:00.000Z,4,4,,PM,CLOSE,Y,,NO,CHATHAM
23-52210,SC-1301 - MECHANICAL CHECKS,SC-1301,SC-1301,4868,,,12-4-23 1:47 AM,2023-12-04T01:47:00.000Z,1-1-24 1:00 AM,2024-01-01T01:00:00.000Z,1-2-24 1:00 AM,2024-01-02T01:00:00.000Z,4,4,,PM,CLOSE,Y,N,NO,CHATHAM
23-52209,Remove locks and start up,SE-2101,SE-2101,4876,,,12-4-23 1:47 AM,2023-12-04T01:47:00.000Z,1-1-24 12:10 AM,2024-01-01T00:10:00.000Z,1-2-24 12:55 PM,2024-01-02T12:55:00.000Z,4,4,,PM,CLOSE,Y,,NO,CHATHAM
23-52208,Pump 1 - 2 shots of grease in drive head bearings,SE-2101,SE-2101,4876,,,12-4-23 1:47 AM,2023-12-04T01:47:00.000Z,1-1-24 12:10 AM,2024-01-01T00:10:00.000Z,1-2-24 12:55 PM,2024-01-02T12:55:00.000Z,4,4,,PM,CLOSE,Y,,NO,CHATHAM
23-52207,Pump 1 - 2 shots of grease in crankpin bearing,SE-2101,SE-2101,4876,,,12-4-23 1:47 AM,2023-12-04T01:47:00.000Z,1-1-24 12:10 AM,2024-01-01T00:10:00.000Z,1-2-24 12:55 PM,2024-01-02T12:55:00.000Z,4,4,,PM,CLOSE,Y,,NO,CHATHAM
23-52206,Get operations to shut down separator and lock out,SE-2101,SE-2101,4876,,,12-4-23 1:47 AM,2023-12-04T01:47:00.000Z,1-1-24 12:15 AM,2024-01-01T00:15:00.000Z,1-2-24 12:55 PM,2024-01-02T12:55:00.000Z,4,4,,PM,CLOSE,Y,,NO,CHATHAM
23-52205,SE-2101- CRANKSHAFT GREASING,SE-2101,SE-2101,4876,,,12-4-23 1:47 AM,2023-12-04T01:47:00.000Z,1-1-24 1:00 AM,2024-01-01T01:00:00.000Z,1-2-24 12:30 AM,2024-01-02T00:30:00.000Z,4,4,,PM,CLOSE,Y,N,NO,CHATHAM
23-52204,ACCULOAD SCULLY CABLE BI-WEEKLY PM,FQIC-2203,FQIC-2203,7138,,,12-4-23 1:47 AM,2023-12-04T01:47:00.000Z,12-29-23 12:30 AM,2023-12-29T00:30:00.000Z,12-29-23 1:51 PM,2023-12-29T13:51:00.000Z,4,4,,PM,CLOSE,Y,,NO,CHATHAM
23-52203,ACCULOAD SCULLY CABLE -PM SERVICE,FQIC-2203,FQIC-2203,7138,,,12-4-23 1:47 AM,2023-12-04T01:47:00.000Z,12-29-23 12:30 AM,2023-12-29T00:30:00.000Z,12-29-23 12:30 AM,2023-12-29T00:30:00.000Z,4,4,,PM,CLOSE,Y,N,NO,CHATHAM
23-52202,CHECK THE IMPROSEALS FOR OIL LEAKAGE,P-2303A,P-2303A,1124,,,12-4-23 1:47 AM,2023-12-04T01:47:00.000Z,12-28-23 12:15 AM,2023-12-28T00:15:00.000Z,12-27-23 7:43 AM,2023-12-27T07:43:00.000Z,4,4,,PM,CLOSE,Y,,NO,CHATHAM
23-52201,REMOVE COUPLING GUARD AND INSPECT OMEGA ELEMENT,P-2303A,P-2303A,1124,,,12-4-23 1:47 AM,2023-12-04T01:47:00.000Z,12-28-23 12:15 AM,2023-12-28T00:15:00.000Z,12-27-23 7:43 AM,2023-12-27T07:43:00.000Z,4,4,,PM,CLOSE,Y,,NO,CHATHAM
23-52200,OIL CHANGE ON GOULDS PUMPS,P-2303A,P-2303A,1124,,,12-4-23 1:47 AM,2023-12-04T01:47:00.000Z,12-28-23 12:30 AM,2023-12-28T00:30:00.000Z,12-27-23 7:43 AM,2023-12-27T07:43:00.000Z,4,4,,PM,CLOSE,Y,,NO,CHATHAM
23-52199,P-2303A - OIL CHANGE/ PM SERVICE,P-2303A,P-2303A,1124,,,12-4-23 1:47 AM,2023-12-04T01:47:00.000Z,12-28-23 1:00 AM,2023-12-28T01:00:00.000Z,12-27-23 7:43 AM,2023-12-27T07:43:00.000Z,4,4,,PM,CLOSE,Y,N,NO,CHATHAM
23-52198,CHECK THE IMPROSEALS FOR OIL LEAKAGE,P-1902B,P-1902B,1012,,,12-4-23 1:47 AM,2023-12-04T01:47:00.000Z,12-29-23 12:15 AM,2023-12-29T00:15:00.000Z,12-20-23 11:15 AM,2023-12-20T11:15:00.000Z,4,4,,PM,CLOSE,Y,,NO,CHATHAM
23-52197,REMOVE COUPLING GUARD AND INSPECT OMEGA ELEMENT,P-1902B,P-1902B,1012,,,12-4-23 1:47 AM,2023-12-04T01:47:00.000Z,12-29-23 12:15 AM,2023-12-29T00:15:00.000Z,12-20-23 11:15 AM,2023-12-20T11:15:00.000Z,4,4,,PM,CLOSE,Y,,NO,CHATHAM
23-52196,OIL CHANGE ON GOULDS PUMPS,P-1902B,P-1902B,1012,,,12-4-23 1:47 AM,2023-12-04T01:47:00.000Z,12-29-23 12:30 AM,2023-12-29T00:30:00.000Z,12-20-23 11:15 AM,2023-12-20T11:15:00.000Z,4,4,,PM,CLOSE,Y,,NO,CHATHAM
23-52195,P-1902B - OIL CHANGE/ PM SERVICE,P-1902B,P-1902B,1012,,,12-4-23 1:47 AM,2023-12-04T01:47:00.000Z,12-29-23 1:00 AM,2023-12-29T01:00:00.000Z,12-20-23 1:00 AM,2023-12-20T01:00:00.000Z,4,4,,PM,CLOSE,Y,N,NO,CHATHAM
23-52194,CHECK THE IMPROSEALS FOR OIL LEAKAGE,P-1701B,P-1701B,,,,12-4-23 1:47 AM,2023-12-04T01:47:00.000Z,4-26-24 12:15 AM,2024-04-26T00:15:00.000Z,6-3-24 9:20 AM,2024-06-03T09:20:00.000Z,4,4,,PM,CLOSE,Y,,NO,CHATHAM
23-52193,REMOVE COUPLING GUARD AND INSPECT OMEGA ELEMENT,P-1701B,P-1701B,,,,12-4-23 1:47 AM,2023-12-04T01:47:00.000Z,4-26-24 12:15 AM,2024-04-26T00:15:00.000Z,6-3-24 9:20 AM,2024-06-03T09:20:00.000Z,4,4,,PM,CLOSE,Y,,NO,CHATHAM
23-52192,OIL CHANGE ON GOULDS PUMPS,P-1701B,P-1701B,,,,12-4-23 1:47 AM,2023-12-04T01:47:00.000Z,4-26-24 12:30 AM,2024-04-26T00:30:00.000Z,6-3-24 9:20 AM,2024-06-03T09:20:00.000Z,4,4,,PM,CLOSE,Y,,NO,CHATHAM
23-52191,P-1701B - OIL CHANGE/ PM SERVICE,P-1701B,P-1701B,,,,12-4-23 1:47 AM,2023-12-04T01:47:00.000Z,4-26-24 1:00 AM,2024-04-26T01:00:00.000Z,6-3-24 9:20 AM,2024-06-03T09:20:00.000Z,4,4,,PM,CLOSE,Y,N,NO,CHATHAM
23-52190,CHECK THE IMPROSEALS FOR OIL LEAKAGE,P-1701A,P-1701A,,,,12-4-23 1:47 AM,2023-12-04T01:47:00.000Z,4-26-24 12:15 AM,2024-04-26T00:15:00.000Z,6-3-24 9:21 AM,2024-06-03T09:21:00.000Z,4,4,,PM,CLOSE,Y,,NO,CHATHAM
23-52189,REMOVE COUPLING GUARD AND INSPECT OMEGA ELEMENT,P-1701A,P-1701A,,,,12-4-23 1:47 AM,2023-12-04T01:47:00.000Z,4-26-24 12:15 AM,2024-04-26T00:15:00.000Z,6-3-24 9:21 AM,2024-06-03T09:21:00.000Z,4,4,,PM,CLOSE,Y,,NO,CHATHAM
23-52188,OIL CHANGE ON GOULDS PUMPS,P-1701A,P-1701A,,,,12-4-23 1:47 AM,2023-12-04T01:47:00.000Z,4-26-24 12:30 AM,2024-04-26T00:30:00.000Z,6-3-24 9:21 AM,2024-06-03T09:21:00.000Z,4,4,,PM,CLOSE,Y,,NO,CHATHAM
23-52187,P-1701A - OIL CHANGE/ PM SERVICE,P-1701A,P-1701A,,,,12-4-23 1:47 AM,2023-12-04T01:47:00.000Z,4-26-24 1:00 AM,2024-04-26T01:00:00.000Z,6-3-24 9:21 AM,2024-06-03T09:21:00.000Z,4,4,,PM,CLOSE,Y,N,NO,CHATHAM
23-52186,WEEKLY JOHN DEER SKID STEER INSPECTION,MTC-006,MTC-006,7050,,,12-4-23 1:47 AM,2023-12-04T01:47:00.000Z,1-1-24 12:45 AM,2024-01-01T00:45:00.000Z,1-2-24 3:01 PM,2024-01-02T15:01:00.000Z,4,4,,PM,CLOSE,Y,,NO,CHATHAM
23-52185,SKID STEER - PM SERVICE,MTC-006,MTC-006,7050,,,12-4-23 1:47 AM,2023-12-04T01:47:00.000Z,1-1-24 12:45 AM,2024-01-01T00:45:00.000Z,1-2-24 1:00 AM,2024-01-02T01:00:00.000Z,4,4,,PM,CLOSE,Y,N,NO,CHATHAM
23-52184,K-3301A/B AIR COMPRESSOR 500 HR/ MONTHLY PM,K-3301B,K-3301B,6670,,,12-4-23 1:47 AM,2023-12-04T01:47:00.000Z,12-28-23 12:30 AM,2023-12-28T00:30:00.000Z,12-21-23 11:11 AM,2023-12-21T11:11:00.000Z,4,4,,PD,CLOSE,Y,,NO,CHATHAM
23-52183,K-3301B - OIL SAMPLE,K-3301B,K-3301B,6670,,,12-4-23 1:47 AM,2023-12-04T01:47:00.000Z,12-28-23 12:30 AM,2023-12-28T00:30:00.000Z,12-21-23 12:30 AM,2023-12-21T00:30:00.000Z,4,4,,PD,CLOSE,Y,N,NO,CHATHAM
23-52182,K-3301A/B AIR COMPRESSOR 500 HR/ MONTHLY PM,K-3301A,K-3301A,6669,,,12-4-23 1:47 AM,2023-12-04T01:47:00.000Z,12-28-23 12:30 AM,2023-12-28T00:30:00.000Z,12-21-23 11:11 AM,2023-12-21T11:11:00.000Z,4,4,,PD,CLOSE,Y,,NO,CHATHAM
23-52181,K-3301A - OIL SAMPLE,K-3301A,K-3301A,6669,,,12-4-23 1:47 AM,2023-12-04T01:47:00.000Z,12-28-23 12:30 AM,2023-12-28T00:30:00.000Z,12-21-23 12:30 AM,2023-12-21T00:30:00.000Z,4,4,,PD,CLOSE,Y,N,NO,CHATHAM
23-52180,DCS I/O CABINET TEMPERATURE ALARM BI-MONTHLY CHECK,3800,3800,,,,12-4-23 1:47 AM,2023-12-04T01:47:00.000Z,3-29-24 1:00 AM,2024-03-29T01:00:00.000Z,3-26-24 11:46 AM,2024-03-26T11:46:00.000Z,4,4,,PM,CLOSE,Y,,NO,CHATHAM
23-52179,DCS CABINET TEMPERATURE ALARM / AIR FILTER CHANGE / CLEANING,3800,3800,,,,12-4-23 1:47 AM,2023-12-04T01:47:00.000Z,3-29-24 1:00 AM,2024-03-29T01:00:00.000Z,3-26-24 11:46 AM,2024-03-26T11:46:00.000Z,4,4,,PM,CLOSE,Y,N,NO,CHATHAM
23-52178,ELECTRIC HEAT TRACE MONTHLY  CHECKS - ( SEP - APR),3800,3800,,,,12-4-23 1:47 AM,2023-12-04T01:47:00.000Z,1-1-24 8:00 AM,2024-01-01T08:00:00.000Z,1-5-24 9:27 AM,2024-01-05T09:27:00.000Z,4,4,,PM,CLOSE,Y,,NO,CHATHAM
23-52177,ELECTRIC HEAT TRACING CHECK - PM SERVICE,3800,3800,,,,12-4-23 1:47 AM,2023-12-04T01:47:00.000Z,1-1-24 8:00 AM,2024-01-01T08:00:00.000Z,1-5-24 7:45 AM,2024-01-05T07:45:00.000Z,4,4,,PM,CLOSE,Y,N,NO,CHATHAM
23-52176,Corn Probe Weekly PM,SA-2101,SA-2101,4865,,,12-4-23 1:46 AM,2023-12-04T01:46:00.000Z,1-8-24 7:30 AM,2024-01-08T07:30:00.000Z,1-9-24 10:14 AM,2024-01-09T10:14:00.000Z,4,4,,PM,CLOSE,Y,,NO,CHATHAM
23-52175,SA-2101 CORN PROBE - MECHANICAL  PM,SA-2101,SA-2101,4865,,,12-4-23 1:46 AM,2023-12-04T01:46:00.000Z,1-8-24 7:30 AM,2024-01-08T07:30:00.000Z,1-8-24 8:00 AM,2024-01-08T08:00:00.000Z,4,4,,PM,CLOSE,Y,N,NO,CHATHAM
23-52174,PROVIDE CONFINED SPACE WATCH & RESCUE,BN-2104,BN-2104,,,,12-4-23 1:46 AM,2023-12-04T01:46:00.000Z,1-1-24 8:00 AM,2024-01-01T08:00:00.000Z,2-6-24 2:46 PM,2024-02-06T14:46:00.000Z,4,4,,PM,CLOSE,Y,,NO,CHATHAM
23-52173,CORN BIN CLEANOUT,BN-2104,BN-2104,,,,12-4-23 1:46 AM,2023-12-04T01:46:00.000Z,1-1-24 8:00 AM,2024-01-01T08:00:00.000Z,2-6-24 2:46 PM,2024-02-06T14:46:00.000Z,4,4,,PM,CLOSE,Y,,NO,CHATHAM
23-52172,BN-2104 NORTH CORN BIN CLEAN OUT PM,BN-2104,BN-2104,,,,12-4-23 1:46 AM,2023-12-04T01:46:00.000Z,1-1-24 10:00 AM,2024-01-01T10:00:00.000Z,2-6-24 2:46 PM,2024-02-06T14:46:00.000Z,4,4,,PM,CLOSE,Y,N,NO,CHATHAM
23-52171,Check operation of biothane float in diked area,LSH-41401,LSH-41401,3081,,,12-4-23 1:46 AM,2023-12-04T01:46:00.000Z,1-1-24 12:30 AM,2024-01-01T00:30:00.000Z,1-2-24 7:49 AM,2024-01-02T07:49:00.000Z,4,4,,PM,CLOSE,Y,,NO,CHATHAM
23-52170,BIOTHANE FLOAT OP CHECK- (LSH-41401) - PM SERVICE,LSH-41401,LSH-41401,3081,,,12-4-23 1:46 AM,2023-12-04T01:46:00.000Z,1-1-24 12:30 AM,2024-01-01T00:30:00.000Z,1-2-24 12:15 AM,2024-01-02T00:15:00.000Z,4,4,,PM,CLOSE,Y,N,NO,CHATHAM
23-52169,V-3301 AIR RECEIVER 6 MONTH P.M.,V-3301,V-3301,6318,,,12-4-23 1:46 AM,2023-12-04T01:46:00.000Z,12-28-23 12:30 AM,2023-12-28T00:30:00.000Z,1-10-24 8:56 AM,2024-01-10T08:56:00.000Z,4,4,,PM,CLOSE,Y,,NO,CHATHAM
23-52168,AIR RECEIVER TRAP CLEANING- (V-3301) -  PM SERVICE,V-3301,V-3301,6318,,,12-4-23 1:46 AM,2023-12-04T01:46:00.000Z,12-28-23 12:30 AM,2023-12-28T00:30:00.000Z,1-10-24 1:00 AM,2024-01-10T01:00:00.000Z,4,4,,PM,CLOSE,Y,N,NO,CHATHAM
23-52167,MOTOR GREASING,2600,2600,,,,12-4-23 1:46 AM,2023-12-04T01:46:00.000Z,1-8-24 1:30 AM,2024-01-08T01:30:00.000Z,1-12-24 11:07 AM,2024-01-12T11:07:00.000Z,4,4,,PM,CLOSE,Y,,NO,CHATHAM
23-52166,2600 CONVEYOR / BUCKET ELEVATOR GREASING,2600,2600,,,,12-4-23 1:46 AM,2023-12-04T01:46:00.000Z,1-8-24 4:00 AM,2024-01-08T04:00:00.000Z,1-12-24 11:07 AM,2024-01-12T11:07:00.000Z,4,4,,PM,CLOSE,Y,,NO,CHATHAM
23-52165,2600 AREA - EQUIPMENT GREASING,2600,2600,,,,12-4-23 1:46 AM,2023-12-04T01:46:00.000Z,1-8-24 1:00 AM,2024-01-08T01:00:00.000Z,1-12-24 1:00 AM,2024-01-12T01:00:00.000Z,4,4,,PM,CLOSE,Y,N,NO,CHATHAM
23-52164,PROCEDURE - REGREASING OPTIM/ TECO INDUCTION MOTOR,2300,2300,7095,,,12-4-23 1:46 AM,2023-12-04T01:46:00.000Z,12-28-23 12:00 AM,2023-12-28T00:00:00.000Z,12-21-23 2:40 PM,2023-12-21T14:40:00.000Z,4,4,,PM,CLOSE,Y,,NO,CHATHAM
23-52163,2300 AREA - EQUIPMENT GREASE PM,2300,2300,7095,,,12-4-23 1:46 AM,2023-12-04T01:46:00.000Z,12-28-23 12:30 AM,2023-12-28T00:30:00.000Z,12-21-23 2:40 PM,2023-12-21T14:40:00.000Z,4,4,,PM,CLOSE,Y,,NO,CHATHAM
23-52162,2300 AREA - EQUIPTMENT GREASING,2300,2300,7095,,,12-4-23 1:46 AM,2023-12-04T01:46:00.000Z,12-28-23 1:00 AM,2023-12-28T01:00:00.000Z,12-21-23 1:00 AM,2023-12-21T01:00:00.000Z,4,4,,PM,CLOSE,Y,N,NO,CHATHAM
23-52161,PROCEDURE - REGREASING OPTIM/ TECO INDUCTION MOTOR,2200,2200,,,,12-4-23 1:46 AM,2023-12-04T01:46:00.000Z,12-28-23 12:00 AM,2023-12-28T00:00:00.000Z,12-18-23 3:09 PM,2023-12-18T15:09:00.000Z,4,4,,PM,CLOSE,Y,,NO,CHATHAM
23-52160,2200 AREA 6 MONTH EQUIPMENT GREASE PM,2200,2200,,,,12-4-23 1:46 AM,2023-12-04T01:46:00.000Z,12-28-23 12:15 AM,2023-12-28T00:15:00.000Z,12-18-23 3:09 PM,2023-12-18T15:09:00.000Z,4,4,,PM,CLOSE,Y,,NO,CHATHAM
23-52159,2200 AREA - EQUIPTMENT GREASING,2200,2200,,,,12-4-23 1:46 AM,2023-12-04T01:46:00.000Z,12-28-23 1:00 AM,2023-12-28T01:00:00.000Z,12-18-23 12:30 AM,2023-12-18T00:30:00.000Z,4,4,,PM,CLOSE,Y,N,NO,CHATHAM
23-52158,2100 AREA EQUIPTMENT GREASING,2100,2100,,,,12-4-23 1:46 AM,2023-12-04T01:46:00.000Z,1-8-24 6:00 AM,2024-01-08T06:00:00.000Z,1-8-24 4:18 PM,2024-01-08T16:18:00.000Z,4,4,,PM,CLOSE,Y,,NO,CHATHAM
23-52157,2100 AREA - EQUIPMENT GREASING,2100,2100,,,,12-4-23 1:46 AM,2023-12-04T01:46:00.000Z,1-8-24 6:00 AM,2024-01-08T06:00:00.000Z,1-8-24 2:30 AM,2024-01-08T02:30:00.000Z,4,4,,PM,CLOSE,Y,N,NO,CHATHAM
23-52156,REPLACE RELIEF PLUG (IF EQUIPPED),1200,1200,,,,12-4-23 1:46 AM,2023-12-04T01:46:00.000Z,1-8-24 12:00 AM,2024-01-08T00:00:00.000Z,1-12-24 8:26 AM,2024-01-12T08:26:00.000Z,4,4,,PM,CLOSE,Y,,NO,CHATHAM
23-52155,ENSURE RELIEF PLUG (IF EQUIPPED) IS OPENED,1200,1200,,,,12-4-23 1:46 AM,2023-12-04T01:46:00.000Z,1-8-24 12:00 AM,2024-01-08T00:00:00.000Z,1-12-24 8:26 AM,2024-01-12T08:26:00.000Z,4,4,,PM,CLOSE,Y,,NO,CHATHAM
23-52154,CLEAN FITTINGS,1200,1200,,,,12-4-23 1:46 AM,2023-12-04T01:46:00.000Z,1-8-24 12:00 AM,2024-01-08T00:00:00.000Z,1-12-24 8:26 AM,2024-01-12T08:26:00.000Z,4,4,,PM,CLOSE,Y,,NO,CHATHAM
23-52153,GREASE TYPES,1200,1200,,,,12-4-23 1:46 AM,2023-12-04T01:46:00.000Z,1-8-24 12:00 AM,2024-01-08T00:00:00.000Z,1-12-24 8:26 AM,2024-01-12T08:26:00.000Z,4,4,,PM,CLOSE,Y,,NO,CHATHAM
23-52152,1200 AREA - EQUIPMENT GREASING,1200,1200,,,,12-4-23 1:46 AM,2023-12-04T01:46:00.000Z,1-8-24 12:30 AM,2024-01-08T00:30:00.000Z,1-12-24 1:00 AM,2024-01-12T01:00:00.000Z,4,4,,PM,CLOSE,Y,N,NO,CHATHAM
23-52151,excessive steam venting causing visibility issues.,BU-ALCO,BU-ALCO,1315,,,12-1-23 1:53 PM,2023-12-01T13:53:00.000Z,12-8-23 1:10 PM,2023-12-08T13:10:00.000Z,12-4-23 3:05 PM,2023-12-04T15:05:00.000Z,2,2,,SA,CLOSE,Y,,NO,CHATHAM
23-52148,Re-install feed tube on CE-1712,CE-1712,CE-1712,,,,11-30-23 5:07 PM,2023-11-30T17:07:00.000Z,12-1-23 5:07 PM,2023-12-01T17:07:00.000Z,12-4-23 1:11 PM,2023-12-04T13:11:00.000Z,2,2,,CO,CLOSE,Y,,NO,CHATHAM
23-52147,CE-1711 expansion boot leaking at seal,CE-1711,CE-1711,,,,11-30-23 4:52 PM,2023-11-30T16:52:00.000Z,12-8-23 10:48 AM,2023-12-08T10:48:00.000Z,11-30-23 4:52 PM,2023-11-30T16:52:00.000Z,2,2,,CO,CLOSE,Y,,NO,CHATHAM
23-52146,Perform vibration analysis on WS-3502B motor,WS-3502B,WS-3502B,6389,,,11-30-23 4:49 PM,2023-11-30T16:49:00.000Z,11-4-23 6:45 AM,2023-11-04T06:45:00.000Z,11-30-23 4:50 PM,2023-11-30T16:50:00.000Z,2,2,,CO,CLOSE,Y,,NO,CHATHAM
23-52145,PY36706A - ME3601 HRSG Clamp Change,PY-36706A,PY-36706A,4829,,,11-30-23 4:32 PM,2023-11-30T16:32:00.000Z,,,9-3-25 1:58 PM,2025-09-03T13:58:00.000Z,4,4,,EC,CLOSE,Y,,NO,CHATHAM
23-52144,NGS Accuload - post power outage set-up,FT-23125,FT-23125,6797,,,11-30-23 3:16 PM,2023-11-30T15:16:00.000Z,11-30-23 5:00 PM,2023-11-30T17:00:00.000Z,11-30-23 3:47 PM,2023-11-30T15:47:00.000Z,1,1,,CO,CLOSE,Y,,NO,CHATHAM
23-52139,P-1509B sounds off. Different than it normally does.,P-1509B,P-1509B,1045,,,11-30-23 8:29 AM,2023-11-30T08:29:00.000Z,11-30-23 8:45 AM,2023-11-30T08:45:00.000Z,11-30-23 11:16 AM,2023-11-30T11:16:00.000Z,1,1,,CO,CLOSE,Y,,NO,CHATHAM
23-52138,Feed tube repairs for CE-1712,CE-1712,CE-1712,,Feed tube o ring area built up for machining and sent to Thames machine. Temporary spare feed tube repaired to use in mean time while other one is getting fixed. The spare is not installed in CE-1712 yet.,,11-30-23 8:16 AM,2023-11-30T08:16:00.000Z,12-8-23 8:16 AM,2023-12-08T08:16:00.000Z,11-30-23 12:17 PM,2023-11-30T12:17:00.000Z,4,4,,CO,CLOSE,Y,,NO,CHATHAM
23-52136,"Gasket Fail on XV19116, on TK1902. Was doing CIP noticed Fail",XV-19116,XV-19116,6456,,,11-30-23 5:31 AM,2023-11-30T05:31:00.000Z,12-1-23 5:29 AM,2023-12-01T05:29:00.000Z,11-30-23 11:24 AM,2023-11-30T11:24:00.000Z,2,2,,RM,CLOSE,Y,,NO,CHATHAM
23-52135,Hydraulic leak on E300AJP manlift,CHATHAM,CHATHAM,,,,11-30-23 12:44 AM,2023-11-30T00:44:00.000Z,12-1-23 12:36 AM,2023-12-01T00:36:00.000Z,9-25-24 9:41 AM,2024-09-25T09:41:00.000Z,4,4,,RM,CLOSE,Y,,NO,CHATHAM
23-52134,CV-1803D Half Full of Water,CV-1803D,CV-1803D,1418,,,11-29-23 10:44 PM,2023-11-29T22:44:00.000Z,12-1-23 10:39 PM,2023-12-01T22:39:00.000Z,11-30-23 8:38 AM,2023-11-30T08:38:00.000Z,1,1,,RM,CLOSE,Y,,NO,CHATHAM
23-52132,Stairs to Decanter building,BU-DEC-A,BU-DEC-A,6662,,,11-29-23 11:29 AM,2023-11-29T11:29:00.000Z,12-6-23 11:24 AM,2023-12-06T11:24:00.000Z,11-30-23 3:05 PM,2023-11-30T15:05:00.000Z,4,4,,SA,CLOSE,Y,,NO,CHATHAM
23-52131,Shoot main switch gear with Thermal imager.,XFMR-3801,XFMR-3801,6420,,,11-29-23 9:53 AM,2023-11-29T09:53:00.000Z,11-30-23 9:48 AM,2023-11-30T09:48:00.000Z,11-29-23 10:56 AM,2023-11-29T10:56:00.000Z,1,1,,RM,CLOSE,Y,,NO,CHATHAM
23-52121,Clean and rebuild with new bearings and vane tips,RV-1834,RV-1834,,RV is ready to go. Gearbox is apart and input for motor is gone out for machining.,,11-28-23 4:11 PM,2023-11-28T16:11:00.000Z,12-15-23 4:11 PM,2023-12-15T16:11:00.000Z,12-4-23 9:22 PM,2023-12-04T21:22:00.000Z,4,4,,CO,CLOSE,Y,,NO,CHATHAM
23-52120,Install gearbox and motor back on RV-1201A and trial run in shop,RV-1201A,RV-1201A,4851,,,11-28-23 4:00 PM,2023-11-28T16:00:00.000Z,11-29-23 4:04 PM,2023-11-29T16:04:00.000Z,11-30-23 5:04 PM,2023-11-30T17:04:00.000Z,4,4,,CO,CLOSE,Y,,NO,CHATHAM
23-52119,tree growing behind Qhut - needs cut down to prevent future damage to builiding,BU-QUON,BU-QUON,,,,11-28-23 3:53 PM,2023-11-28T15:53:00.000Z,12-7-23 9:41 AM,2023-12-07T09:41:00.000Z,11-30-23 8:43 AM,2023-11-30T08:43:00.000Z,4,4,,CO,CLOSE,Y,,NO,CHATHAM
23-52118,FT36402 Bad IO call in 11/04/2023,FT-36402,FT-36402,6832,,,11-28-23 3:51 PM,2023-11-28T15:51:00.000Z,11-6-23 11:45 AM,2023-11-06T11:45:00.000Z,11-28-23 3:52 PM,2023-11-28T15:52:00.000Z,2,2,,CO,CLOSE,Y,,NO,CHATHAM
23-52117,Closed limit switch on SG-1201B not registering the gate has closed.,SG-1201B,SG-1201B,4884,,,11-28-23 3:49 PM,2023-11-28T15:49:00.000Z,11-24-23 10:06 AM,2023-11-24T10:06:00.000Z,11-29-23 7:36 AM,2023-11-29T07:36:00.000Z,2,2,,CO,CLOSE,Y,,NO,CHATHAM
23-52116,Slide Gate 2608 for DDG loading stalled while closing,SG-2608,SG-2608,4917,,,11-28-23 3:48 PM,2023-11-28T15:48:00.000Z,11-27-23 2:12 PM,2023-11-27T14:12:00.000Z,11-30-23 11:11 AM,2023-11-30T11:11:00.000Z,2,2,,RM,CLOSE,Y,,NO,CHATHAM
23-52115,HV-24313 (Common Ammonia Tank Shutoff Valve) Limit 1 failed,HV-24313,HV-24313,7738,,,11-28-23 3:47 PM,2023-11-28T15:47:00.000Z,11-25-23 1:58 PM,2023-11-25T13:58:00.000Z,11-29-23 8:51 AM,2023-11-29T08:51:00.000Z,2,2,,RM,CLOSE,Y,,NO,CHATHAM
23-52109,CE1711 troubleshoot,CE-1711,CE-1711,,,,11-28-23 2:58 PM,2023-11-28T14:58:00.000Z,12-12-23 3:59 PM,2023-12-12T15:59:00.000Z,11-28-23 8:59 PM,2023-11-28T20:59:00.000Z,2,2,,PM,CLOSE,Y,,NO,CHATHAM
23-52098,BE2601 leak,BE-2601,BE-2601,1282,,,11-28-23 8:46 AM,2023-11-28T08:46:00.000Z,11-29-23 8:29 AM,2023-11-29T08:29:00.000Z,11-30-23 11:10 AM,2023-11-30T11:10:00.000Z,1,1,,RM,CLOSE,Y,,NO,CHATHAM
23-52097,PCOSS open and clean,CE-6601,CE-6601,1386,,,11-27-23 3:07 PM,2023-11-27T15:07:00.000Z,11-28-23 7:43 AM,2023-11-28T07:43:00.000Z,11-28-23 3:09 AM,2023-11-28T03:09:00.000Z,2,2,,RM,CLOSE,Y,,NO,CHATHAM
23-52094,Slide gate 1714 passing water in to conveyer,1700-26K-07,1700-26K-07,,,,11-27-23 10:16 AM,2023-11-27T10:16:00.000Z,12-11-23 4:14 PM,2023-12-11T16:14:00.000Z,11-27-23 10:14 PM,2023-11-27T22:14:00.000Z,2,2,,RM,CLOSE,Y,,NO,CHATHAM
23-51977,Lost Communications Me 3602 (I&E called in),3690-26K-05,3690-26K-05,,,,11-27-23 2:06 AM,2023-11-27T02:06:00.000Z,11-28-23 2:01 AM,2023-11-28T02:01:00.000Z,11-26-23 8:20 AM,2023-11-26T08:20:00.000Z,1,1,,RM,CLOSE,Y,,NO,CHATHAM
23-51976,POST- CLOSE CV-1828,CY-1829,CY-1829,2536,,,11-27-23 1:57 AM,2023-11-27T01:57:00.000Z,3-20-24 12:30 AM,2024-03-20T00:30:00.000Z,5-27-24 9:38 AM,2024-05-27T09:38:00.000Z,4,4,,SD,CLOSE,Y,,NO,CHATHAM
23-51975,POST- CLOSE XV-18148,CY-1829,CY-1829,2536,,,11-27-23 1:57 AM,2023-11-27T01:57:00.000Z,3-20-24 1:00 AM,2024-03-20T01:00:00.000Z,5-27-24 9:38 AM,2024-05-27T09:38:00.000Z,4,4,,SD,CLOSE,Y,,NO,CHATHAM
23-51974,POST- CLOSE HATCH ON BL-1829,CY-1829,CY-1829,2536,,,11-27-23 1:57 AM,2023-11-27T01:57:00.000Z,3-20-24 12:30 AM,2024-03-20T00:30:00.000Z,5-27-24 9:38 AM,2024-05-27T09:38:00.000Z,4,4,,SD,CLOSE,Y,,NO,CHATHAM
23-51973,POST- CLOSE CV-1830 DRAIN,CY-1829,CY-1829,2536,,,11-27-23 1:57 AM,2023-11-27T01:57:00.000Z,3-20-24 12:30 AM,2024-03-20T00:30:00.000Z,5-27-24 9:38 AM,2024-05-27T09:38:00.000Z,4,4,,SD,CLOSE,Y,,NO,CHATHAM
23-51972,RE-INSTALL TOP & BOTTOM ACCESS LIDS,CY-1829,CY-1829,2536,,,11-27-23 1:57 AM,2023-11-27T01:57:00.000Z,3-20-24 2:00 AM,2024-03-20T02:00:00.000Z,5-27-24 9:38 AM,2024-05-27T09:38:00.000Z,4,4,,SD,CLOSE,Y,,NO,CHATHAM
23-51971,HPW CYCLONE,CY-1829,CY-1829,2536,,,11-27-23 1:57 AM,2023-11-27T01:57:00.000Z,3-20-24 3:00 AM,2024-03-20T03:00:00.000Z,5-27-24 9:38 AM,2024-05-27T09:38:00.000Z,4,4,,SD,CLOSE,Y,,NO,CHATHAM
23-51970,HPW DUCTING O/T OF CY-1826,CY-1829,CY-1829,2536,,,11-27-23 1:57 AM,2023-11-27T01:57:00.000Z,3-20-24 2:30 AM,2024-03-20T02:30:00.000Z,5-27-24 9:38 AM,2024-05-27T09:38:00.000Z,4,4,,SD,CLOSE,Y,,NO,CHATHAM
23-51969,REMOVE TOP & BOTTOM ACCESS LIDS,CY-1829,CY-1829,2536,,,11-27-23 1:57 AM,2023-11-27T01:57:00.000Z,3-20-24 1:30 AM,2024-03-20T01:30:00.000Z,5-27-24 9:38 AM,2024-05-27T09:38:00.000Z,4,4,,SD,CLOSE,Y,,NO,CHATHAM
23-51968,PRE-OPEN CV-1828 HATCH TO DRAIN,CY-1829,CY-1829,2536,,,11-27-23 1:57 AM,2023-11-27T01:57:00.000Z,3-20-24 12:30 AM,2024-03-20T00:30:00.000Z,5-27-24 9:38 AM,2024-05-27T09:38:00.000Z,4,4,,SD,CLOSE,Y,,NO,CHATHAM
23-51967,PRE-OPEN XV-18148,CY-1829,CY-1829,2536,,,11-27-23 1:57 AM,2023-11-27T01:57:00.000Z,3-20-24 1:00 AM,2024-03-20T01:00:00.000Z,5-27-24 9:38 AM,2024-05-27T09:38:00.000Z,4,4,,SD,CLOSE,Y,,NO,CHATHAM
23-51966,PRE- OPEN TACH ACCESS ON BL-1829,CY-1829,CY-1829,2536,,,11-27-23 1:57 AM,2023-11-27T01:57:00.000Z,3-20-24 12:30 AM,2024-03-20T00:30:00.000Z,5-27-24 9:38 AM,2024-05-27T09:38:00.000Z,4,4,,SD,CLOSE,Y,,NO,CHATHAM
23-51965,PRE-OPEN CV-1830 HATCH TO DRAIN,CY-1829,CY-1829,2536,,,11-27-23 1:57 AM,2023-11-27T01:57:00.000Z,3-20-24 12:30 AM,2024-03-20T00:30:00.000Z,5-27-24 9:38 AM,2024-05-27T09:38:00.000Z,4,4,,SD,CLOSE,Y,,NO,CHATHAM
23-51964,HPW  CY-1829 Cyclone  DR01,CY-1829,CY-1829,2536,,,11-27-23 1:57 AM,2023-11-27T01:57:00.000Z,4-25-24 12:00 AM,2024-04-25T00:00:00.000Z,5-27-24 9:38 AM,2024-05-27T09:38:00.000Z,4,4,,PM,CLOSE,Y,N,NO,CHATHAM
23-51963,CT-3201 INTERNAL INSPECTION DELUGE SYSTEM 1YR PM,CT-3201C,CT-3201C,,,,11-27-23 1:57 AM,2023-11-27T01:57:00.000Z,4-22-24 8:00 AM,2024-04-22T08:00:00.000Z,4-9-24 10:42 AM,2024-04-09T10:42:00.000Z,4,4,,SD,CLOSE,Y,,NO,CHATHAM
23-51962,CT-3201-C INTERNAL INSPECTION DELUGE SYSTEM PM,CT-3201C,CT-3201C,,,,11-27-23 1:57 AM,2023-11-27T01:57:00.000Z,4-22-24 11:00 AM,2024-04-22T11:00:00.000Z,4-9-24 10:42 AM,2024-04-09T10:42:00.000Z,4,4,,SD,CLOSE,Y,N,NO,CHATHAM
23-51961,POST-Replace fence,BL-1829,BL-1829,,,,11-27-23 1:56 AM,2023-11-27T01:56:00.000Z,4-23-24 1:00 AM,2024-04-23T01:00:00.000Z,5-27-24 10:15 AM,2024-05-27T10:15:00.000Z,4,4,,SD,CLOSE,Y,,NO,CHATHAM
23-51960,POST-Remove Scaffold,BL-1829,BL-1829,,,,11-27-23 1:56 AM,2023-11-27T01:56:00.000Z,4-23-24 2:00 AM,2024-04-23T02:00:00.000Z,5-27-24 10:15 AM,2024-05-27T10:15:00.000Z,4,4,,SD,CLOSE,Y,,NO,CHATHAM
23-51959,Close drain and manways,BL-1829,BL-1829,,,,11-27-23 1:56 AM,2023-11-27T01:56:00.000Z,4-23-24 1:00 AM,2024-04-23T01:00:00.000Z,5-27-24 10:15 AM,2024-05-27T10:15:00.000Z,4,4,,SD,CLOSE,Y,,NO,CHATHAM
23-51958,HPW blades,BL-1829,BL-1829,,,,11-27-23 1:56 AM,2023-11-27T01:56:00.000Z,4-23-24 4:00 AM,2024-04-23T04:00:00.000Z,5-27-24 10:15 AM,2024-05-27T10:15:00.000Z,4,4,,SD,CLOSE,Y,,NO,CHATHAM
23-51957,Open 2 manway doors and open drains,BL-1829,BL-1829,,,,11-27-23 1:56 AM,2023-11-27T01:56:00.000Z,4-23-24 1:00 AM,2024-04-23T01:00:00.000Z,5-27-24 10:15 AM,2024-05-27T10:15:00.000Z,4,4,,SD,CLOSE,Y,,NO,CHATHAM
23-51956,PRE-Build Scaffold required to access East door,BL-1829,BL-1829,,,,11-27-23 1:56 AM,2023-11-27T01:56:00.000Z,4-23-24 2:00 AM,2024-04-23T02:00:00.000Z,5-27-24 10:15 AM,2024-05-27T10:15:00.000Z,4,4,,SD,CLOSE,Y,,NO,CHATHAM
23-51955,PRE-Remove fence section to allow scaffold,BL-1829,BL-1829,,,,11-27-23 1:56 AM,2023-11-27T01:56:00.000Z,4-23-24 1:30 AM,2024-04-23T01:30:00.000Z,5-27-24 10:15 AM,2024-05-27T10:15:00.000Z,4,4,,SD,CLOSE,Y,,NO,CHATHAM
23-51954,HPW BL-1829Main Fan DR01,BL-1829,BL-1829,,,,11-27-23 1:56 AM,2023-11-27T01:56:00.000Z,5-31-24 12:00 AM,2024-05-31T00:00:00.000Z,5-27-24 10:15 AM,2024-05-27T10:15:00.000Z,4,4,,PM,CLOSE,Y,N,NO,CHATHAM
23-51953,PH PROBE CLEANING AND CALIBRATION WEEKLY PM,AT-84505,AT-84505,6885,,,11-27-23 1:56 AM,2023-11-27T01:56:00.000Z,12-21-23 1:00 AM,2023-12-21T01:00:00.000Z,12-21-23 12:52 PM,2023-12-21T12:52:00.000Z,4,4,,PM,CLOSE,Y,,NO,CHATHAM
23-51952,C-1803D pH Meter-Weekly PM,AT-84505,AT-84505,6885,,,11-27-23 1:56 AM,2023-11-27T01:56:00.000Z,12-21-23 12:00 AM,2023-12-21T00:00:00.000Z,12-21-23 1:00 AM,2023-12-21T01:00:00.000Z,4,4,,PM,CLOSE,Y,N,NO,CHATHAM
23-51951,"Area Asset Checks-1830, 1840, DDG Cooler",1800,1800,,,,11-27-23 1:56 AM,2023-11-27T01:56:00.000Z,12-25-23 12:00 AM,2023-12-25T00:00:00.000Z,12-27-23 1:07 PM,2023-12-27T13:07:00.000Z,4,4,,PM,CLOSE,Y,,NO,CHATHAM
23-51950,"Area Asset Checks-1830, 1840, DDG Cooler",1800,1800,,,,11-27-23 1:56 AM,2023-11-27T01:56:00.000Z,12-25-23 12:00 AM,2023-12-25T00:00:00.000Z,12-27-23 1:00 AM,2023-12-27T01:00:00.000Z,4,4,,PM,CLOSE,Y,N,NO,CHATHAM
23-51949,"Area Asset Checks-2200, 2300, 3200, 3600, 4100",2200,2200,,,,11-27-23 1:56 AM,2023-11-27T01:56:00.000Z,12-25-23 12:00 AM,2023-12-25T00:00:00.000Z,12-29-23 12:41 PM,2023-12-29T12:41:00.000Z,4,4,,PM,CLOSE,Y,,NO,CHATHAM
23-51948,"Area Asset Checks-2200, 2300, 3200, 3600, 4100",2200,2200,,,,11-27-23 1:56 AM,2023-11-27T01:56:00.000Z,12-25-23 12:00 AM,2023-12-25T00:00:00.000Z,12-29-23 1:30 AM,2023-12-29T01:30:00.000Z,4,4,,PM,CLOSE,Y,N,NO,CHATHAM
23-51947,"Area Asset Checks-1600, 1660, 1700 (Evaps, Corn oil, Decanyers)",1600,1600,,,,11-27-23 1:56 AM,2023-11-27T01:56:00.000Z,12-25-23 12:00 AM,2023-12-25T00:00:00.000Z,12-28-23 2:32 PM,2023-12-28T14:32:00.000Z,4,4,,PM,CLOSE,Y,,NO,CHATHAM
23-51946,"Area Asset Checks-1600, 1660, 1700",1600,1600,,,,11-27-23 1:56 AM,2023-11-27T01:56:00.000Z,12-25-23 12:00 AM,2023-12-25T00:00:00.000Z,12-28-23 1:00 AM,2023-12-28T01:00:00.000Z,4,4,,PM,CLOSE,Y,N,NO,CHATHAM
23-51945,"Area Asset Checks-1500, 6500 (Distillation)",1500,1500,,,,11-27-23 1:56 AM,2023-11-27T01:56:00.000Z,12-25-23 12:00 AM,2023-12-25T00:00:00.000Z,12-27-23 3:46 PM,2023-12-27T15:46:00.000Z,4,4,,PM,CLOSE,Y,,NO,CHATHAM
23-51944,"Area Asset Checks-1500, 6500",1500,1500,,,,11-27-23 1:56 AM,2023-11-27T01:56:00.000Z,12-25-23 12:00 AM,2023-12-25T00:00:00.000Z,12-27-23 1:00 AM,2023-12-27T01:00:00.000Z,4,4,,PM,CLOSE,Y,N,NO,CHATHAM
23-51943,"Area Asset Checks-2100, 1200, 1300, 1400 (Corn, Mill, Mash, Fermentation)",2100,2100,,,,11-27-23 1:55 AM,2023-11-27T01:55:00.000Z,12-25-23 2:30 AM,2023-12-25T02:30:00.000Z,12-28-23 1:39 PM,2023-12-28T13:39:00.000Z,4,4,,PM,CLOSE,Y,,NO,CHATHAM
23-51942,"Area Asset Checks-2100, 1200, 1300, 1400 (Corn, Mill, Mash, Fermentation)",2100,2100,,,,11-27-23 1:55 AM,2023-11-27T01:55:00.000Z,12-25-23 12:00 AM,2023-12-25T00:00:00.000Z,12-28-23 1:00 AM,2023-12-28T01:00:00.000Z,4,4,,PM,CLOSE,Y,N,NO,CHATHAM
23-51941,"Area Asset Checks-1830, 1840, DDG Cooler",1800,1800,,,,11-27-23 1:55 AM,2023-11-27T01:55:00.000Z,12-25-23 12:00 AM,2023-12-25T00:00:00.000Z,1-2-24 7:59 AM,2024-01-02T07:59:00.000Z,4,4,,PM,CLOSE,Y,,NO,CHATHAM
23-51940,"Area Asset Checks-1830, 1840, DDG Cooler",1800,1800,,,,11-27-23 1:55 AM,2023-11-27T01:55:00.000Z,12-25-23 12:00 AM,2023-12-25T00:00:00.000Z,1-2-24 7:59 AM,2024-01-02T07:59:00.000Z,4,4,,PM,CLOSE,Y,N,NO,CHATHAM
23-51939,"Area Asset Checks-2200, 2300, 3200, 3600, 4100",2200,2200,,,,11-27-23 1:55 AM,2023-11-27T01:55:00.000Z,12-25-23 12:00 AM,2023-12-25T00:00:00.000Z,12-29-23 9:51 AM,2023-12-29T09:51:00.000Z,4,4,,PM,CLOSE,Y,,NO,CHATHAM
23-51938,"Area Asset Checks-2200, 2300, 3200, 3600, 4100",2200,2200,,,,11-27-23 1:55 AM,2023-11-27T01:55:00.000Z,12-25-23 12:00 AM,2023-12-25T00:00:00.000Z,12-29-23 2:00 AM,2023-12-29T02:00:00.000Z,4,4,,PM,CLOSE,Y,N,NO,CHATHAM
23-51937,"Area Asset Checks-1600, 1660, 1700 (Evaps, Corn oil, Decanyers)",1600,1600,,,,11-27-23 1:55 AM,2023-11-27T01:55:00.000Z,12-25-23 12:00 AM,2023-12-25T00:00:00.000Z,12-27-23 3:45 PM,2023-12-27T15:45:00.000Z,4,4,,PM,CLOSE,Y,,NO,CHATHAM
23-51936,"Area Asset Checks-1600, 1660, 1700",1600,1600,,,,11-27-23 1:55 AM,2023-11-27T01:55:00.000Z,12-25-23 12:00 AM,2023-12-25T00:00:00.000Z,12-27-23 2:00 AM,2023-12-27T02:00:00.000Z,4,4,,PM,CLOSE,Y,N,NO,CHATHAM
23-51935,"Area Asset Checks-1500, 6500 (Distillation)",1500,1500,,,,11-27-23 1:55 AM,2023-11-27T01:55:00.000Z,12-25-23 12:00 AM,2023-12-25T00:00:00.000Z,12-27-23 3:44 PM,2023-12-27T15:44:00.000Z,4,4,,PM,CLOSE,Y,,NO,CHATHAM
23-51934,"Area Asset Checks-1500, 6500",1500,1500,,,,11-27-23 1:55 AM,2023-11-27T01:55:00.000Z,12-25-23 12:00 AM,2023-12-25T00:00:00.000Z,12-27-23 2:00 AM,2023-12-27T02:00:00.000Z,4,4,,PM,CLOSE,Y,N,NO,CHATHAM
23-51933,"Area Asset Checks-2100, 1200, 1300, 1400 (Corn, Mill, Mash, Fermentation)",2100,2100,,,,11-27-23 1:55 AM,2023-11-27T01:55:00.000Z,12-25-23 5:00 AM,2023-12-25T05:00:00.000Z,1-2-24 7:53 AM,2024-01-02T07:53:00.000Z,4,4,,PM,CLOSE,Y,,NO,CHATHAM
23-51932,"Area Asset Checks-2100, 1200, 1300, 1400 (Corn, Mill, Mash, Fermentation)",2100,2100,,,,11-27-23 1:55 AM,2023-11-27T01:55:00.000Z,12-25-23 12:00 AM,2023-12-25T00:00:00.000Z,1-2-24 7:53 AM,2024-01-02T07:53:00.000Z,4,4,,PM,CLOSE,Y,N,NO,CHATHAM
23-51931,BUCKET ELEVATOR PM,BE-1201,BE-1201,1274,,,11-27-23 1:55 AM,2023-11-27T01:55:00.000Z,4-20-24 12:00 AM,2024-04-20T00:00:00.000Z,5-16-24 9:47 AM,2024-05-16T09:47:00.000Z,4,4,,SD,CLOSE,Y,,NO,CHATHAM
23-51930,BE-1201 - MECHANICAL PM,BE-1201,BE-1201,1274,,,11-27-23 1:55 AM,2023-11-27T01:55:00.000Z,4-20-24 2:30 AM,2024-04-20T02:30:00.000Z,5-16-24 9:47 AM,2024-05-16T09:47:00.000Z,4,4,,SD,CLOSE,Y,N,NO,CHATHAM
23-51929,BL-1804D WEEKLY GREASING,BL-1804D,BL-1804D,,,,11-27-23 1:55 AM,2023-11-27T01:55:00.000Z,12-25-23 12:00 AM,2023-12-25T00:00:00.000Z,1-2-24 7:52 AM,2024-01-02T07:52:00.000Z,4,4,,PM,CLOSE,Y,,NO,CHATHAM
23-51928,BL-1804D - WEEKLY BEARING GREASING,BL-1804D,BL-1804D,,,,11-27-23 1:55 AM,2023-11-27T01:55:00.000Z,12-25-23 12:00 AM,2023-12-25T00:00:00.000Z,1-2-24 7:52 AM,2024-01-02T07:52:00.000Z,4,4,,PM,CLOSE,Y,N,NO,CHATHAM
23-51927,Install expansion joints,P-1615B,P-1615B,,,,11-27-23 1:55 AM,2023-11-27T01:55:00.000Z,4-17-24 3:00 AM,2024-04-17T03:00:00.000Z,5-27-24 9:48 AM,2024-05-27T09:48:00.000Z,4,4,,PM,CLOSE,Y,,NO,CHATHAM
23-51926,Arrange for installation during fall outage,P-1615B,P-1615B,,,,11-27-23 1:55 AM,2023-11-27T01:55:00.000Z,4-17-24 12:00 AM,2024-04-17T00:00:00.000Z,5-27-24 9:48 AM,2024-05-27T09:48:00.000Z,4,4,,PM,CLOSE,Y,,NO,CHATHAM
23-51925,Order new discharge expansion joints,P-1615B,P-1615B,,,,11-27-23 1:55 AM,2023-11-27T01:55:00.000Z,4-17-24 12:00 AM,2024-04-17T00:00:00.000Z,5-27-24 9:48 AM,2024-05-27T09:48:00.000Z,4,4,,PM,CLOSE,Y,,NO,CHATHAM
23-51924,P-1615B - Replace expansion joints,P-1615B,P-1615B,,,,11-27-23 1:55 AM,2023-11-27T01:55:00.000Z,4-17-24 12:00 AM,2024-04-17T00:00:00.000Z,5-27-24 9:48 AM,2024-05-27T09:48:00.000Z,4,4,,PM,CLOSE,Y,N,NO,CHATHAM
23-51923,Install expansion joints,P-1615A,P-1615A,,,,11-27-23 1:55 AM,2023-11-27T01:55:00.000Z,4-17-24 3:00 AM,2024-04-17T03:00:00.000Z,5-27-24 9:47 AM,2024-05-27T09:47:00.000Z,4,4,,PM,CLOSE,Y,,NO,CHATHAM
23-51922,Arrange for installation during fall outage,P-1615A,P-1615A,,,,11-27-23 1:55 AM,2023-11-27T01:55:00.000Z,4-17-24 12:00 AM,2024-04-17T00:00:00.000Z,5-27-24 9:47 AM,2024-05-27T09:47:00.000Z,4,4,,PM,CLOSE,Y,,NO,CHATHAM
23-51921,Order new discharge expansion joints,P-1615A,P-1615A,,,,11-27-23 1:55 AM,2023-11-27T01:55:00.000Z,4-17-24 12:00 AM,2024-04-17T00:00:00.000Z,5-27-24 9:47 AM,2024-05-27T09:47:00.000Z,4,4,,PM,CLOSE,Y,,NO,CHATHAM
23-51920,P-1615A - Replace expansion joints (discharge),P-1615A,P-1615A,,,,11-27-23 1:55 AM,2023-11-27T01:55:00.000Z,4-17-24 12:00 AM,2024-04-17T00:00:00.000Z,5-27-24 9:47 AM,2024-05-27T09:47:00.000Z,4,4,,PM,CLOSE,Y,N,NO,CHATHAM
23-51919,5S AND STOCKROOM AUDIT-WEEKLY PM,MAINTENANCE,MAINTENANCE,,,,11-27-23 1:55 AM,2023-11-27T01:55:00.000Z,12-25-23 12:00 AM,2023-12-25T00:00:00.000Z,1-2-24 11:38 AM,2024-01-02T11:38:00.000Z,4,4,,PM,CLOSE,Y,N,NO,CHATHAM
23-51918,MCC'S UPS ANNUAL PM,MCC-3841,MCC-3841,3389,,,11-27-23 1:55 AM,2023-11-27T01:55:00.000Z,4-22-24 12:00 AM,2024-04-22T00:00:00.000Z,12-15-24 6:49 PM,2024-12-15T18:49:00.000Z,4,4,,SD,CLOSE,Y,,NO,CHATHAM
23-51917,MCC3841 UPS PM,MCC-3841,MCC-3841,3389,,,11-27-23 1:55 AM,2023-11-27T01:55:00.000Z,4-22-24 12:00 AM,2024-04-22T00:00:00.000Z,12-15-24 6:49 PM,2024-12-15T18:49:00.000Z,4,4,,PM,CLOSE,Y,N,NO,CHATHAM
23-51916,MCC'S UPS ANNUAL PM,MCC-3819,MCC-3819,3388,,,11-27-23 1:55 AM,2023-11-27T01:55:00.000Z,4-22-24 12:00 AM,2024-04-22T00:00:00.000Z,12-15-24 6:49 PM,2024-12-15T18:49:00.000Z,4,4,,SD,CLOSE,Y,,NO,CHATHAM
23-51915,MCC3819 UPS PM,MCC-3819,MCC-3819,3388,,,11-27-23 1:55 AM,2023-11-27T01:55:00.000Z,4-22-24 12:00 AM,2024-04-22T00:00:00.000Z,12-15-24 6:49 PM,2024-12-15T18:49:00.000Z,4,4,,PM,CLOSE,Y,N,NO,CHATHAM
23-51914,MCC'S UPS ANNUAL PM,MCC-3805,MCC-3805,3381,,,11-27-23 1:55 AM,2023-11-27T01:55:00.000Z,4-22-24 12:00 AM,2024-04-22T00:00:00.000Z,12-15-24 6:49 PM,2024-12-15T18:49:00.000Z,4,4,,SD,CLOSE,Y,,NO,CHATHAM
23-51913,MCC3805 UPS PM,MCC-3805,MCC-3805,3381,,,11-27-23 1:55 AM,2023-11-27T01:55:00.000Z,4-22-24 12:00 AM,2024-04-22T00:00:00.000Z,12-15-24 6:49 PM,2024-12-15T18:49:00.000Z,4,4,,PM,CLOSE,Y,N,NO,CHATHAM
23-51912,REMOVE SCAFF,EV-1615B,EV-1615B,1647,,,11-27-23 1:55 AM,2023-11-27T01:55:00.000Z,4-23-24 2:00 AM,2024-04-23T02:00:00.000Z,10-29-24 9:43 AM,2024-10-29T09:43:00.000Z,4,4,,SD,CLOSE,Y,,NO,CHATHAM
23-51911,RE-INSTALL MAY WAY W/T GASKET,EV-1615B,EV-1615B,1647,,,11-27-23 1:55 AM,2023-11-27T01:55:00.000Z,4-23-24 1:30 AM,2024-04-23T01:30:00.000Z,10-29-24 9:43 AM,2024-10-29T09:43:00.000Z,4,4,,SD,CLOSE,Y,,NO,CHATHAM
23-51910,HPW EXCHANGER,EV-1615B,EV-1615B,1647,,,11-27-23 1:55 AM,2023-11-27T01:55:00.000Z,4-24-24 6:00 AM,2024-04-24T06:00:00.000Z,10-29-24 9:43 AM,2024-10-29T09:43:00.000Z,4,4,,SD,CLOSE,Y,,NO,CHATHAM
23-51909,SENTRY FOR CSE FOR DURATION OF JOB,EV-1615B,EV-1615B,1647,,,11-27-23 1:55 AM,2023-11-27T01:55:00.000Z,4-24-24 6:00 AM,2024-04-24T06:00:00.000Z,10-29-24 9:43 AM,2024-10-29T09:43:00.000Z,4,4,,SD,CLOSE,Y,,NO,CHATHAM
23-51908,REMOVE MAYWAY FOR ENTRY,EV-1615B,EV-1615B,1647,,,11-27-23 1:55 AM,2023-11-27T01:55:00.000Z,4-23-24 1:30 AM,2024-04-23T01:30:00.000Z,10-29-24 9:43 AM,2024-10-29T09:43:00.000Z,4,4,,SD,CLOSE,Y,,NO,CHATHAM
23-51907,BUILD SCAFF FOR WINDBREAK,EV-1615B,EV-1615B,1647,,,11-27-23 1:55 AM,2023-11-27T01:55:00.000Z,4-23-24 4:00 AM,2024-04-23T04:00:00.000Z,10-29-24 9:43 AM,2024-10-29T09:43:00.000Z,4,4,,SD,CLOSE,Y,,NO,CHATHAM
23-51906,EV-1615B HPW EXCHANGER,EV-1615B,EV-1615B,1647,,,11-27-23 1:55 AM,2023-11-27T01:55:00.000Z,10-31-24 12:00 AM,2024-10-31T00:00:00.000Z,10-29-24 9:43 AM,2024-10-29T09:43:00.000Z,4,4,,PM,CLOSE,Y,N,NO,CHATHAM
23-51905,REMOVE SCAFF,EV-1615A,EV-1615A,1646,,,11-27-23 1:54 AM,2023-11-27T01:54:00.000Z,4-23-24 2:00 AM,2024-04-23T02:00:00.000Z,2-21-24 2:22 PM,2024-02-21T14:22:00.000Z,4,4,,SD,CLOSE,Y,,NO,CHATHAM
23-51904,RE-INSTALL MAY WAY W/T GASKET,EV-1615A,EV-1615A,1646,,,11-27-23 1:54 AM,2023-11-27T01:54:00.000Z,4-23-24 1:30 AM,2024-04-23T01:30:00.000Z,2-21-24 2:22 PM,2024-02-21T14:22:00.000Z,4,4,,SD,CLOSE,Y,,NO,CHATHAM
23-51903,HPW EXCHANGER,EV-1615A,EV-1615A,1646,,,11-27-23 1:54 AM,2023-11-27T01:54:00.000Z,4-24-24 6:00 AM,2024-04-24T06:00:00.000Z,2-21-24 2:22 PM,2024-02-21T14:22:00.000Z,4,4,,SD,CLOSE,Y,,NO,CHATHAM
23-51902,SENTRY FOR CSE FOR DURATION OF JOB,EV-1615A,EV-1615A,1646,,,11-27-23 1:54 AM,2023-11-27T01:54:00.000Z,4-24-24 6:00 AM,2024-04-24T06:00:00.000Z,2-21-24 2:22 PM,2024-02-21T14:22:00.000Z,4,4,,SD,CLOSE,Y,,NO,CHATHAM
23-51901,REMOVE MAYWAY FOR ENTRY,EV-1615A,EV-1615A,1646,,,11-27-23 1:54 AM,2023-11-27T01:54:00.000Z,4-23-24 1:30 AM,2024-04-23T01:30:00.000Z,2-21-24 2:22 PM,2024-02-21T14:22:00.000Z,4,4,,SD,CLOSE,Y,,NO,CHATHAM
23-51900,BUILD SCAFF FOR WINDBREAK,EV-1615A,EV-1615A,1646,,,11-27-23 1:54 AM,2023-11-27T01:54:00.000Z,4-23-24 4:00 AM,2024-04-23T04:00:00.000Z,2-21-24 2:22 PM,2024-02-21T14:22:00.000Z,4,4,,SD,CLOSE,Y,,NO,CHATHAM
23-51899,EV-1615A HPW EXCHANGER,EV-1615A,EV-1615A,1646,,,11-27-23 1:54 AM,2023-11-27T01:54:00.000Z,4-23-24 12:00 AM,2024-04-23T00:00:00.000Z,2-21-24 2:22 PM,2024-02-21T14:22:00.000Z,4,4,,PM,CLOSE,Y,N,NO,CHATHAM
23-51898,(POST) Remove Scaff,TK-6607,TK-6607,5529,,,11-27-23 1:54 AM,2023-11-27T01:54:00.000Z,4-23-24 4:00 AM,2024-04-23T04:00:00.000Z,5-22-24 10:56 AM,2024-05-22T10:56:00.000Z,4,4,,PM,CLOSE,Y,,NO,CHATHAM
23-51897,Reconnect Spools,TK-6607,TK-6607,5529,,,11-27-23 1:54 AM,2023-11-27T01:54:00.000Z,4-23-24 2:00 AM,2024-04-23T02:00:00.000Z,5-22-24 10:56 AM,2024-05-22T10:56:00.000Z,4,4,,PM,CLOSE,Y,,NO,CHATHAM
23-51896,I/E to revert automatic valves,TK-6607,TK-6607,5529,,,11-27-23 1:54 AM,2023-11-27T01:54:00.000Z,4-23-24 12:30 AM,2024-04-23T00:30:00.000Z,5-22-24 10:56 AM,2024-05-22T10:56:00.000Z,4,4,,PM,CLOSE,Y,,NO,CHATHAM
23-51895,GGI Inspection,TK-6607,TK-6607,5529,,,11-27-23 1:54 AM,2023-11-27T01:54:00.000Z,4-23-24 12:30 AM,2024-04-23T00:30:00.000Z,5-22-24 10:56 AM,2024-05-22T10:56:00.000Z,4,4,,PM,CLOSE,Y,,NO,CHATHAM
23-51894,HPW,TK-6607,TK-6607,5529,,,11-27-23 1:54 AM,2023-11-27T01:54:00.000Z,4-23-24 2:00 AM,2024-04-23T02:00:00.000Z,5-22-24 10:56 AM,2024-05-22T10:56:00.000Z,4,4,,PM,CLOSE,Y,,NO,CHATHAM
23-51893,I/E to open automatic valves to drain,TK-6607,TK-6607,5529,,,11-27-23 1:54 AM,2023-11-27T01:54:00.000Z,4-23-24 12:30 AM,2024-04-23T00:30:00.000Z,5-22-24 10:56 AM,2024-05-22T10:56:00.000Z,4,4,,PM,CLOSE,Y,,NO,CHATHAM
23-51892,Disconnect Spools for cleaning,TK-6607,TK-6607,5529,,,11-27-23 1:54 AM,2023-11-27T01:54:00.000Z,4-23-24 2:00 AM,2024-04-23T02:00:00.000Z,5-22-24 10:56 AM,2024-05-22T10:56:00.000Z,4,4,,PM,CLOSE,Y,,NO,CHATHAM
23-51891,(PRE) BUILD SCAFF TO ACCESS,TK-6607,TK-6607,5529,,,11-27-23 1:54 AM,2023-11-27T01:54:00.000Z,4-23-24 5:00 AM,2024-04-23T05:00:00.000Z,5-22-24 10:56 AM,2024-05-22T10:56:00.000Z,4,4,,PM,CLOSE,Y,,NO,CHATHAM
23-51890,HPW TANK  PM,TK-6607,TK-6607,5529,,,11-27-23 1:54 AM,2023-11-27T01:54:00.000Z,4-23-24 12:00 AM,2024-04-23T00:00:00.000Z,5-22-24 10:56 AM,2024-05-22T10:56:00.000Z,4,4,,PM,CLOSE,Y,N,NO,CHATHAM
23-51889,(POST) Remove Scaff,TK-6606,TK-6606,5528,,,11-27-23 1:54 AM,2023-11-27T01:54:00.000Z,4-23-24 4:00 AM,2024-04-23T04:00:00.000Z,5-22-24 10:56 AM,2024-05-22T10:56:00.000Z,4,4,,PM,CLOSE,Y,,NO,CHATHAM
23-51888,Reconnect Spools,TK-6606,TK-6606,5528,,,11-27-23 1:54 AM,2023-11-27T01:54:00.000Z,4-23-24 2:00 AM,2024-04-23T02:00:00.000Z,5-22-24 10:56 AM,2024-05-22T10:56:00.000Z,4,4,,PM,CLOSE,Y,,NO,CHATHAM
23-51887,I/E to revert automatic valves,TK-6606,TK-6606,5528,,,11-27-23 1:54 AM,2023-11-27T01:54:00.000Z,4-23-24 12:30 AM,2024-04-23T00:30:00.000Z,5-22-24 10:56 AM,2024-05-22T10:56:00.000Z,4,4,,PM,CLOSE,Y,,NO,CHATHAM
23-51886,GGI Inspection,TK-6606,TK-6606,5528,,,11-27-23 1:54 AM,2023-11-27T01:54:00.000Z,4-23-24 12:30 AM,2024-04-23T00:30:00.000Z,5-22-24 10:56 AM,2024-05-22T10:56:00.000Z,4,4,,PM,CLOSE,Y,,NO,CHATHAM
23-51885,HPW,TK-6606,TK-6606,5528,,,11-27-23 1:54 AM,2023-11-27T01:54:00.000Z,4-23-24 2:00 AM,2024-04-23T02:00:00.000Z,5-22-24 10:56 AM,2024-05-22T10:56:00.000Z,4,4,,PM,CLOSE,Y,,NO,CHATHAM
23-51884,I/E to open automatic valves to drain,TK-6606,TK-6606,5528,,,11-27-23 1:54 AM,2023-11-27T01:54:00.000Z,4-23-24 12:30 AM,2024-04-23T00:30:00.000Z,5-22-24 10:56 AM,2024-05-22T10:56:00.000Z,4,4,,PM,CLOSE,Y,,NO,CHATHAM
23-51883,Disconnect Spools for cleaning,TK-6606,TK-6606,5528,,,11-27-23 1:54 AM,2023-11-27T01:54:00.000Z,4-23-24 2:00 AM,2024-04-23T02:00:00.000Z,5-22-24 10:56 AM,2024-05-22T10:56:00.000Z,4,4,,PM,CLOSE,Y,,NO,CHATHAM
23-51882,(PRE) BUILD SCAFF TO ACCESS,TK-6606,TK-6606,5528,,,11-27-23 1:54 AM,2023-11-27T01:54:00.000Z,4-23-24 5:00 AM,2024-04-23T05:00:00.000Z,5-22-24 10:56 AM,2024-05-22T10:56:00.000Z,4,4,,PM,CLOSE,Y,,NO,CHATHAM
23-51881,HPW TANK PM,TK-6606,TK-6606,5528,,,11-27-23 1:54 AM,2023-11-27T01:54:00.000Z,4-23-24 12:00 AM,2024-04-23T00:00:00.000Z,5-22-24 10:56 AM,2024-05-22T10:56:00.000Z,4,4,,PM,CLOSE,Y,N,NO,CHATHAM
23-51880,HRSG Pre-shutdown check list instrumentation.,ME-3602,ME-3602,3395,,,11-27-23 1:54 AM,2023-11-27T01:54:00.000Z,4-22-24 12:00 AM,2024-04-22T00:00:00.000Z,5-15-24 8:00 AM,2024-05-15T08:00:00.000Z,4,4,,SD,CLOSE,Y,,NO,CHATHAM
23-51879,HRSG  Pre-shutdown Check List - Instrument Verification Procedure.,ME-3602,ME-3602,3395,,,11-27-23 1:54 AM,2023-11-27T01:54:00.000Z,4-22-24 4:00 AM,2024-04-22T04:00:00.000Z,5-15-24 8:00 AM,2024-05-15T08:00:00.000Z,4,4,,SD,CLOSE,Y,N,NO,CHATHAM
23-51878,CHECK TRACKING (WHEN ON FULL POWER),BE-2107,BE-2107,1280,,,11-27-23 1:54 AM,2023-11-27T01:54:00.000Z,4-18-24 12:30 AM,2024-04-18T00:30:00.000Z,5-16-24 9:54 AM,2024-05-16T09:54:00.000Z,4,4,,SD,CLOSE,Y,,NO,CHATHAM
23-51877,RUN BUCKET WITH INSP DRIVE END,BE-2107,BE-2107,1280,,,11-27-23 1:54 AM,2023-11-27T01:54:00.000Z,4-18-24 12:30 AM,2024-04-18T00:30:00.000Z,5-16-24 9:54 AM,2024-05-16T09:54:00.000Z,4,4,,SD,CLOSE,Y,,NO,CHATHAM
23-51876,INSTALL HOOD,BE-2107,BE-2107,1280,,,11-27-23 1:54 AM,2023-11-27T01:54:00.000Z,4-18-24 12:30 AM,2024-04-18T00:30:00.000Z,5-16-24 9:54 AM,2024-05-16T09:54:00.000Z,4,4,,SD,CLOSE,Y,,NO,CHATHAM
23-51875,TIGHTEN BELT TO SPEC,BE-2107,BE-2107,1280,,,11-27-23 1:54 AM,2023-11-27T01:54:00.000Z,4-18-24 12:30 AM,2024-04-18T00:30:00.000Z,5-16-24 9:54 AM,2024-05-16T09:54:00.000Z,4,4,,SD,CLOSE,Y,,NO,CHATHAM
23-51874,INSTALL NEW BELT IN PLACE,BE-2107,BE-2107,1280,,,11-27-23 1:54 AM,2023-11-27T01:54:00.000Z,4-18-24 1:00 AM,2024-04-18T01:00:00.000Z,5-16-24 9:54 AM,2024-05-16T09:54:00.000Z,4,4,,SD,CLOSE,Y,,NO,CHATHAM
23-51873,INSTALL LIFTING SLINGS,BE-2107,BE-2107,1280,,,11-27-23 1:54 AM,2023-11-27T01:54:00.000Z,4-18-24 1:00 AM,2024-04-18T01:00:00.000Z,5-16-24 9:54 AM,2024-05-16T09:54:00.000Z,4,4,,SD,CLOSE,Y,,NO,CHATHAM
23-51872,"\"LIFT BELT UP 2\"\" FOR LIFTING SLINGS\"",BE-2107,BE-2107,1280,,,11-27-23 1:54 AM,2023-11-27T01:54:00.000Z,4-18-24 12:30 AM,2024-04-18T00:30:00.000Z,5-16-24 9:54 AM,2024-05-16T09:54:00.000Z,4,4,,SD,CLOSE,Y,,NO,CHATHAM
23-51871,INSTALL TOP LUGS,BE-2107,BE-2107,1280,,,11-27-23 1:54 AM,2023-11-27T01:54:00.000Z,4-18-24 12:30 AM,2024-04-18T00:30:00.000Z,5-16-24 9:54 AM,2024-05-16T09:54:00.000Z,4,4,,SD,CLOSE,Y,,NO,CHATHAM
23-51870,HOOD OFF WITH CRANE,BE-2107,BE-2107,1280,,,11-27-23 1:54 AM,2023-11-27T01:54:00.000Z,4-18-24 12:30 AM,2024-04-18T00:30:00.000Z,5-16-24 9:54 AM,2024-05-16T09:54:00.000Z,4,4,,SD,CLOSE,Y,,NO,CHATHAM
23-51869,BOOT TAKE UP ALL THE WAY,BE-2107,BE-2107,1280,,,11-27-23 1:54 AM,2023-11-27T01:54:00.000Z,4-18-24 12:30 AM,2024-04-18T00:30:00.000Z,5-16-24 9:54 AM,2024-05-16T09:54:00.000Z,4,4,,SD,CLOSE,Y,,NO,CHATHAM
23-51868,REMOVE BOOT PANELS /SPLICE DOOR OPENED,BE-2107,BE-2107,1280,,,11-27-23 1:54 AM,2023-11-27T01:54:00.000Z,4-18-24 12:30 AM,2024-04-18T00:30:00.000Z,5-16-24 9:54 AM,2024-05-16T09:54:00.000Z,4,4,,SD,CLOSE,Y,,NO,CHATHAM
23-51866,(PRE) PREPARE BELT AS PER LAYOUT DRW,BE-2107,BE-2107,1280,,,11-27-23 1:54 AM,2023-11-27T01:54:00.000Z,4-19-24 4:00 PM,2024-04-19T16:00:00.000Z,5-16-24 9:54 AM,2024-05-16T09:54:00.000Z,4,4,,SD,CLOSE,Y,,NO,CHATHAM
23-51867,CRANE SETUP IN DDG LANE,BE-2107,BE-2107,1280,,,11-27-23 1:54 AM,2023-11-27T01:54:00.000Z,4-18-24 1:00 AM,2024-04-18T01:00:00.000Z,5-16-24 9:54 AM,2024-05-16T09:54:00.000Z,4,4,,SD,CLOSE,Y,,NO,CHATHAM
23-51865,BELT AND BUCKETS CHANGEOUT PM,BE-2107,BE-2107,1280,,,11-27-23 1:54 AM,2023-11-27T01:54:00.000Z,4-18-24 8:00 AM,2024-04-18T08:00:00.000Z,5-16-24 9:54 AM,2024-05-16T09:54:00.000Z,4,4,,SD,CLOSE,Y,N,NO,CHATHAM
23-51864,CHECK TRACKING (WHEN ON FULL POWER),BE-1201,BE-1201,1274,,,11-27-23 1:54 AM,2023-11-27T01:54:00.000Z,4-23-24 12:30 AM,2024-04-23T00:30:00.000Z,,,4,4,,SD,CAN,Y,,NO,CHATHAM
23-51863,RUN BUCKET WITH INSP DRIVE END,BE-1201,BE-1201,1274,,,11-27-23 1:54 AM,2023-11-27T01:54:00.000Z,4-23-24 12:30 AM,2024-04-23T00:30:00.000Z,,,4,4,,SD,CAN,Y,,NO,CHATHAM
23-51862,INSTALL HOOD,BE-1201,BE-1201,1274,,,11-27-23 1:54 AM,2023-11-27T01:54:00.000Z,4-23-24 12:30 AM,2024-04-23T00:30:00.000Z,,,4,4,,SD,CAN,Y,,NO,CHATHAM
23-51861,TIGHTEN BELT TO SPEC,BE-1201,BE-1201,1274,,,11-27-23 1:54 AM,2023-11-27T01:54:00.000Z,4-23-24 12:30 AM,2024-04-23T00:30:00.000Z,,,4,4,,SD,CAN,Y,,NO,CHATHAM
23-51860,INSTALL NEW BELT IN PLACE,BE-1201,BE-1201,1274,,,11-27-23 1:54 AM,2023-11-27T01:54:00.000Z,4-23-24 1:00 AM,2024-04-23T01:00:00.000Z,,,4,4,,SD,CAN,Y,,NO,CHATHAM
23-51859,INSTALL LIFTING SLINGS,BE-1201,BE-1201,1274,,,11-27-23 1:54 AM,2023-11-27T01:54:00.000Z,4-23-24 1:00 AM,2024-04-23T01:00:00.000Z,,,4,4,,SD,CAN,Y,,NO,CHATHAM
23-51858,"\"LIFT BELT UP 2\"\" FOR LIFTING SLINGS\"",BE-1201,BE-1201,1274,,,11-27-23 1:54 AM,2023-11-27T01:54:00.000Z,4-23-24 12:30 AM,2024-04-23T00:30:00.000Z,,,4,4,,SD,CAN,Y,,NO,CHATHAM
23-51857,INSTALL TOP LUGS,BE-1201,BE-1201,1274,,,11-27-23 1:54 AM,2023-11-27T01:54:00.000Z,4-23-24 12:30 AM,2024-04-23T00:30:00.000Z,,,4,4,,SD,CAN,Y,,NO,CHATHAM
23-51856,HOOD OFF WITH CRANE,BE-1201,BE-1201,1274,,,11-27-23 1:54 AM,2023-11-27T01:54:00.000Z,4-23-24 12:30 AM,2024-04-23T00:30:00.000Z,,,4,4,,SD,CAN,Y,,NO,CHATHAM
23-51855,BOOT TAKE UP ALL THE WAY,BE-1201,BE-1201,1274,,,11-27-23 1:54 AM,2023-11-27T01:54:00.000Z,4-23-24 12:30 AM,2024-04-23T00:30:00.000Z,,,4,4,,SD,CAN,Y,,NO,CHATHAM
23-51854,REMOVE BOOT PANELS /SPLICE DOOR OPENED,BE-1201,BE-1201,1274,,,11-27-23 1:54 AM,2023-11-27T01:54:00.000Z,4-23-24 12:30 AM,2024-04-23T00:30:00.000Z,,,4,4,,SD,CAN,Y,,NO,CHATHAM
23-51853,CRANE SETUP IN DDG LANE,BE-1201,BE-1201,1274,,,11-27-23 1:54 AM,2023-11-27T01:54:00.000Z,4-23-24 1:00 AM,2024-04-23T01:00:00.000Z,,,4,4,,SD,CAN,Y,,NO,CHATHAM
23-51852,(PRE) PREPARE BELT AS PER LAYOUT DRW,BE-1201,BE-1201,1274,,,11-27-23 1:54 AM,2023-11-27T01:54:00.000Z,4-24-24 4:00 PM,2024-04-24T16:00:00.000Z,,,4,4,,SD,CAN,Y,,NO,CHATHAM
23-51851,BELT AND BUCKETS CHANGEOUT PM,BE-1201,BE-1201,1274,,,11-27-23 1:54 AM,2023-11-27T01:54:00.000Z,10-31-24 8:00 AM,2024-10-31T08:00:00.000Z,,,4,4,,SD,CAN,Y,N,NO,CHATHAM
23-51850,COGEN AIR INLET FILTER CHANGE OUT 1 YR PM,ME-3601A,ME-3601A,,,,11-27-23 1:54 AM,2023-11-27T01:54:00.000Z,4-23-24 12:00 AM,2024-04-23T00:00:00.000Z,4-9-24 10:44 AM,2024-04-09T10:44:00.000Z,4,4,,SD,CLOSE,Y,,NO,CHATHAM
23-51849,ME-3601A AIR INLET FILTER CHANGE OUT  PM,ME-3601A,ME-3601A,,,,11-27-23 1:54 AM,2023-11-27T01:54:00.000Z,4-23-24 4:00 AM,2024-04-23T04:00:00.000Z,4-9-24 10:44 AM,2024-04-09T10:44:00.000Z,4,4,,SD,CLOSE,Y,N,NO,CHATHAM
23-51848,TOTE#5 (4) 100' EXPLOSION PROOF EXTENSION CORDS,CHATHAM,CHATHAM,,,,11-27-23 1:53 AM,2023-11-27T01:53:00.000Z,12-22-23 12:00 AM,2023-12-22T00:00:00.000Z,6-20-24 2:10 PM,2024-06-20T14:10:00.000Z,4,4,,PM,CLOSE,Y,,NO,CHATHAM
23-51847,"TOTE #4 (4) COATS, (4) BIBS, (10) GLOVES, HARD HAT LINERS, NECK WARMERS, (20) INFERNO PACKS",CHATHAM,CHATHAM,,,,11-27-23 1:53 AM,2023-11-27T01:53:00.000Z,12-22-23 12:00 AM,2023-12-22T00:00:00.000Z,6-20-24 2:10 PM,2024-06-20T14:10:00.000Z,4,4,,PM,CLOSE,Y,,NO,CHATHAM
23-51846,TOTE #3 (2) SNAKE INSULATION BLANKETS,CHATHAM,CHATHAM,,,,11-27-23 1:53 AM,2023-11-27T01:53:00.000Z,12-22-23 12:00 AM,2023-12-22T00:00:00.000Z,6-20-24 2:10 PM,2024-06-20T14:10:00.000Z,4,4,,PM,CLOSE,Y,,NO,CHATHAM
23-51845,TOTE #2 (2) SNAKE INSULATION BLANKETS,CHATHAM,CHATHAM,,,,11-27-23 1:53 AM,2023-11-27T01:53:00.000Z,12-22-23 12:00 AM,2023-12-22T00:00:00.000Z,6-20-24 2:10 PM,2024-06-20T14:10:00.000Z,4,4,,PM,CLOSE,Y,,NO,CHATHAM
23-51844,TOTE #1 250' PORTABLE HEAT TRACING,CHATHAM,CHATHAM,,,,11-27-23 1:53 AM,2023-11-27T01:53:00.000Z,12-22-23 12:00 AM,2023-12-22T00:00:00.000Z,6-20-24 2:10 PM,2024-06-20T14:10:00.000Z,4,4,,PM,CLOSE,Y,,NO,CHATHAM
23-51843,COLD WEATHER PLAN (TOTE INSPECTION/AUDIT),CHATHAM,CHATHAM,,,,11-27-23 1:53 AM,2023-11-27T01:53:00.000Z,12-22-23 1:00 AM,2023-12-22T01:00:00.000Z,6-20-24 2:10 PM,2024-06-20T14:10:00.000Z,4,4,,PM,CLOSE,Y,N,NO,CHATHAM
23-51842,Weekly Vibration check (GFE I/E),MI-1201A,MI-1201A,,,,11-27-23 1:53 AM,2023-11-27T01:53:00.000Z,12-21-23 12:00 AM,2023-12-21T00:00:00.000Z,12-22-23 6:54 AM,2023-12-22T06:54:00.000Z,4,4,,PM,CLOSE,Y,,NO,CHATHAM
23-51841,HAMMERMILL WEEKLY PM & ROTATION CHANGE,MI-1201A,MI-1201A,,,,11-27-23 1:53 AM,2023-11-27T01:53:00.000Z,12-21-23 12:00 AM,2023-12-21T00:00:00.000Z,12-22-23 6:54 AM,2023-12-22T06:54:00.000Z,4,4,,PM,CLOSE,Y,,NO,CHATHAM
23-51840,MI-1201A - MECHANICAL PM,MI-1201A,MI-1201A,,,,11-27-23 1:53 AM,2023-11-27T01:53:00.000Z,12-21-23 12:30 AM,2023-12-21T00:30:00.000Z,12-21-23 1:00 AM,2023-12-21T01:00:00.000Z,4,4,,PM,CLOSE,Y,N,NO,CHATHAM
23-51839,Weekly Vibration check (GFE I/E),MI-1201B,MI-1201B,,,,11-27-23 1:53 AM,2023-11-27T01:53:00.000Z,12-25-23 12:00 AM,2023-12-25T00:00:00.000Z,1-2-24 11:37 AM,2024-01-02T11:37:00.000Z,4,4,,PM,CLOSE,Y,,NO,CHATHAM
23-51838,C-MI-1201B - MECHANICAL PM,MI-1201B,MI-1201B,,,,11-27-23 1:53 AM,2023-11-27T01:53:00.000Z,12-25-23 12:00 AM,2023-12-25T00:00:00.000Z,1-2-24 11:37 AM,2024-01-02T11:37:00.000Z,4,4,,PM,CLOSE,Y,,NO,CHATHAM
23-51837,MI-1201B - MECHANICAL PM,MI-1201B,MI-1201B,,,,11-27-23 1:53 AM,2023-11-27T01:53:00.000Z,12-25-23 12:30 AM,2023-12-25T00:30:00.000Z,12-28-23 2:00 AM,2023-12-28T02:00:00.000Z,4,4,,PM,CLOSE,Y,N,NO,CHATHAM
23-51836,PH PROBE CLEANING AND CALIBRATION WEEKLY PM,AT-14125,AT-14125,1230,,,11-27-23 1:53 AM,2023-11-27T01:53:00.000Z,12-21-23 1:00 AM,2023-12-21T01:00:00.000Z,12-21-23 11:55 AM,2023-12-21T11:55:00.000Z,4,4,,PM,CLOSE,Y,,NO,CHATHAM
23-51835,PH PROBE CLEANING AND CALIBRATION PM,AT-14125,AT-14125,1230,,,11-27-23 1:53 AM,2023-11-27T01:53:00.000Z,12-21-23 12:00 AM,2023-12-21T00:00:00.000Z,12-21-23 12:30 AM,2023-12-21T00:30:00.000Z,4,4,,PM,CLOSE,Y,N,NO,CHATHAM
23-51834,PH PROBE CLEANING AND CALIBRATION WEEKLY PM,AT-13519,AT-13519,1227,,,11-27-23 1:53 AM,2023-11-27T01:53:00.000Z,12-21-23 1:00 AM,2023-12-21T01:00:00.000Z,12-21-23 6:55 AM,2023-12-21T06:55:00.000Z,4,4,,PM,CLOSE,Y,,NO,CHATHAM
23-51833,PH PROBE CLEANING AND CALIBRATION PM,AT-13519,AT-13519,1227,,,11-27-23 1:53 AM,2023-11-27T01:53:00.000Z,12-21-23 12:00 AM,2023-12-21T00:00:00.000Z,12-21-23 12:30 AM,2023-12-21T00:30:00.000Z,4,4,,PM,CLOSE,Y,N,NO,CHATHAM
23-51832,Inspect grommets,F-3202H,F-3202H,1685,,,11-27-23 1:53 AM,2023-11-27T01:53:00.000Z,4-23-24 12:00 AM,2024-04-23T00:00:00.000Z,7-19-24 10:01 AM,2024-07-19T10:01:00.000Z,4,4,,PM,CLOSE,Y,,NO,CHATHAM
23-51831,Change out diaphram kits on valves,F-3202H,F-3202H,1685,,,11-27-23 1:53 AM,2023-11-27T01:53:00.000Z,4-23-24 12:00 AM,2024-04-23T00:00:00.000Z,7-19-24 10:01 AM,2024-07-19T10:01:00.000Z,4,4,,PM,CLOSE,Y,,NO,CHATHAM
23-51830,F-3202H  PM,F-3202H,F-3202H,1685,,,11-27-23 1:53 AM,2023-11-27T01:53:00.000Z,4-23-24 12:00 AM,2024-04-23T00:00:00.000Z,7-17-24 1:00 AM,2024-07-17T01:00:00.000Z,4,4,,PM,CLOSE,Y,N,NO,CHATHAM
23-51829,Inspect grommets,F-3202G,F-3202G,1684,,,11-27-23 1:53 AM,2023-11-27T01:53:00.000Z,4-23-24 12:00 AM,2024-04-23T00:00:00.000Z,7-19-24 10:01 AM,2024-07-19T10:01:00.000Z,4,4,,PM,CLOSE,Y,,NO,CHATHAM
23-51828,Change out diaphram kits on valves,F-3202G,F-3202G,1684,,,11-27-23 1:53 AM,2023-11-27T01:53:00.000Z,4-23-24 12:00 AM,2024-04-23T00:00:00.000Z,7-19-24 10:01 AM,2024-07-19T10:01:00.000Z,4,4,,PM,CLOSE,Y,,NO,CHATHAM
23-51827,F-3202G  PM,F-3202G,F-3202G,1684,,,11-27-23 1:53 AM,2023-11-27T01:53:00.000Z,4-23-24 12:00 AM,2024-04-23T00:00:00.000Z,7-17-24 1:00 AM,2024-07-17T01:00:00.000Z,4,4,,PM,CLOSE,Y,N,NO,CHATHAM
23-51826,Inspect grommets,F-3202F,F-3202F,1683,,,11-27-23 1:53 AM,2023-11-27T01:53:00.000Z,4-23-24 12:00 AM,2024-04-23T00:00:00.000Z,7-19-24 10:02 AM,2024-07-19T10:02:00.000Z,4,4,,PM,CLOSE,Y,,NO,CHATHAM
23-51825,Change out diaphram kits on valves,F-3202F,F-3202F,1683,,,11-27-23 1:53 AM,2023-11-27T01:53:00.000Z,4-23-24 12:00 AM,2024-04-23T00:00:00.000Z,7-19-24 10:02 AM,2024-07-19T10:02:00.000Z,4,4,,PM,CLOSE,Y,,NO,CHATHAM
23-51824,F-3202F  PM,F-3202F,F-3202F,1683,,,11-27-23 1:53 AM,2023-11-27T01:53:00.000Z,4-23-24 12:00 AM,2024-04-23T00:00:00.000Z,7-17-24 1:00 AM,2024-07-17T01:00:00.000Z,4,4,,PM,CLOSE,Y,N,NO,CHATHAM
23-51823,Inspect grommets,F-3202E,F-3202E,1682,,,11-27-23 1:53 AM,2023-11-27T01:53:00.000Z,4-23-24 12:00 AM,2024-04-23T00:00:00.000Z,7-22-24 8:15 AM,2024-07-22T08:15:00.000Z,4,4,,PM,CLOSE,Y,,NO,CHATHAM
23-51822,Change out diaphram kits on valves,F-3202E,F-3202E,1682,,,11-27-23 1:53 AM,2023-11-27T01:53:00.000Z,4-23-24 12:00 AM,2024-04-23T00:00:00.000Z,7-22-24 8:15 AM,2024-07-22T08:15:00.000Z,4,4,,PM,CLOSE,Y,,NO,CHATHAM
23-51821,F-3202E  PM,F-3202E,F-3202E,1682,,,11-27-23 1:53 AM,2023-11-27T01:53:00.000Z,4-23-24 12:00 AM,2024-04-23T00:00:00.000Z,7-17-24 1:00 AM,2024-07-17T01:00:00.000Z,4,4,,PM,CLOSE,Y,N,NO,CHATHAM
23-51820,Inspect grommets,F-3202D,F-3202D,1681,,,11-27-23 1:53 AM,2023-11-27T01:53:00.000Z,4-23-24 12:00 AM,2024-04-23T00:00:00.000Z,7-19-24 10:01 AM,2024-07-19T10:01:00.000Z,4,4,,PM,CLOSE,Y,,NO,CHATHAM
23-51819,Change out diaphram kits on valves,F-3202D,F-3202D,1681,,,11-27-23 1:53 AM,2023-11-27T01:53:00.000Z,4-23-24 12:00 AM,2024-04-23T00:00:00.000Z,7-19-24 10:01 AM,2024-07-19T10:01:00.000Z,4,4,,PM,CLOSE,Y,,NO,CHATHAM
23-51818,F-3202D  PM,F-3202D,F-3202D,1681,,,11-27-23 1:53 AM,2023-11-27T01:53:00.000Z,4-23-24 12:00 AM,2024-04-23T00:00:00.000Z,7-17-24 1:00 AM,2024-07-17T01:00:00.000Z,4,4,,PM,CLOSE,Y,N,NO,CHATHAM
23-51817,Inspect grommets,F-3202C,F-3202C,1680,,,11-27-23 1:53 AM,2023-11-27T01:53:00.000Z,4-23-24 12:00 AM,2024-04-23T00:00:00.000Z,7-19-24 10:02 AM,2024-07-19T10:02:00.000Z,4,4,,PM,CLOSE,Y,,NO,CHATHAM
23-51816,Change out diaphram kits on valves,F-3202C,F-3202C,1680,,,11-27-23 1:53 AM,2023-11-27T01:53:00.000Z,4-23-24 12:00 AM,2024-04-23T00:00:00.000Z,7-19-24 10:02 AM,2024-07-19T10:02:00.000Z,4,4,,PM,CLOSE,Y,,NO,CHATHAM
23-51815,F-3202C  PM,F-3202C,F-3202C,1680,,,11-27-23 1:53 AM,2023-11-27T01:53:00.000Z,4-23-24 12:00 AM,2024-04-23T00:00:00.000Z,7-17-24 1:00 AM,2024-07-17T01:00:00.000Z,4,4,,PM,CLOSE,Y,N,NO,CHATHAM
23-51814,Inspect grommets,F-3202B,F-3202B,1679,,,11-27-23 1:53 AM,2023-11-27T01:53:00.000Z,4-23-24 12:00 AM,2024-04-23T00:00:00.000Z,7-19-24 10:02 AM,2024-07-19T10:02:00.000Z,4,4,,PM,CLOSE,Y,,NO,CHATHAM
23-51813,Change out diaphram kits on valves,F-3202B,F-3202B,1679,,,11-27-23 1:53 AM,2023-11-27T01:53:00.000Z,4-23-24 12:00 AM,2024-04-23T00:00:00.000Z,7-19-24 10:02 AM,2024-07-19T10:02:00.000Z,4,4,,PM,CLOSE,Y,,NO,CHATHAM
23-51812,F-3202B PM,F-3202B,F-3202B,1679,,,11-27-23 1:53 AM,2023-11-27T01:53:00.000Z,4-23-24 12:00 AM,2024-04-23T00:00:00.000Z,7-17-24 1:00 AM,2024-07-17T01:00:00.000Z,4,4,,PM,CLOSE,Y,N,NO,CHATHAM
23-51811,Inspect grommets,F-3202A,F-3202A,1678,,,11-27-23 1:53 AM,2023-11-27T01:53:00.000Z,4-23-24 12:00 AM,2024-04-23T00:00:00.000Z,7-19-24 10:02 AM,2024-07-19T10:02:00.000Z,4,4,,PM,CLOSE,Y,,NO,CHATHAM
23-51810,Change out diaphram kits on valves,F-3202A,F-3202A,1678,,,11-27-23 1:53 AM,2023-11-27T01:53:00.000Z,4-23-24 12:00 AM,2024-04-23T00:00:00.000Z,7-19-24 10:02 AM,2024-07-19T10:02:00.000Z,4,4,,PM,CLOSE,Y,,NO,CHATHAM
23-51809,F-3202A  PM,F-3202A,F-3202A,1678,,,11-27-23 1:53 AM,2023-11-27T01:53:00.000Z,4-23-24 12:00 AM,2024-04-23T00:00:00.000Z,7-17-24 1:00 AM,2024-07-17T01:00:00.000Z,4,4,,PM,CLOSE,Y,N,NO,CHATHAM
23-51808,Monitor & fill salt boxes,CHATHAM,CHATHAM,,,,11-27-23 1:52 AM,2023-11-27T01:52:00.000Z,12-21-23 1:00 AM,2023-12-21T01:00:00.000Z,12-27-23 7:42 AM,2023-12-27T07:42:00.000Z,4,4,,PM,CLOSE,Y,,NO,CHATHAM
23-51807,Thursday route - Fill plant salt boxes,CHATHAM,CHATHAM,,,,11-27-23 1:52 AM,2023-11-27T01:52:00.000Z,12-21-23 12:00 AM,2023-12-21T00:00:00.000Z,12-27-23 7:42 AM,2023-12-27T07:42:00.000Z,4,4,,PM,CLOSE,Y,N,NO,CHATHAM
23-51806,Monitor & fill salt boxes,CHATHAM,CHATHAM,,,,11-27-23 1:52 AM,2023-11-27T01:52:00.000Z,12-25-23 1:00 AM,2023-12-25T01:00:00.000Z,1-2-24 7:53 AM,2024-01-02T07:53:00.000Z,4,4,,PM,CLOSE,Y,,NO,CHATHAM
23-51805,Monday route - Fill plant salt boxes,CHATHAM,CHATHAM,,,,11-27-23 1:52 AM,2023-11-27T01:52:00.000Z,12-25-23 12:00 AM,2023-12-25T00:00:00.000Z,1-2-24 7:53 AM,2024-01-02T07:53:00.000Z,4,4,,PM,CLOSE,Y,N,NO,CHATHAM
23-51804,PSV inspection,PVRV-14715,PVRV-14715,4808,,,11-27-23 1:52 AM,2023-11-27T01:52:00.000Z,4-23-24 12:45 AM,2024-04-23T00:45:00.000Z,11-19-24 2:50 PM,2024-11-19T14:50:00.000Z,4,4,,PM,CLOSE,Y,,NO,CHATHAM
23-51803,PVRV-14715 Scheduled Maintenance,PVRV-14715,PVRV-14715,4808,,,11-27-23 1:52 AM,2023-11-27T01:52:00.000Z,4-23-24 12:45 AM,2024-04-23T00:45:00.000Z,11-19-24 2:50 PM,2024-11-19T14:50:00.000Z,4,4,,PM,CLOSE,Y,N,NO,CHATHAM
23-51802,PSV inspection,PVRV-14515,PVRV-14515,4807,,,11-27-23 1:52 AM,2023-11-27T01:52:00.000Z,4-23-24 12:45 AM,2024-04-23T00:45:00.000Z,11-19-24 2:56 PM,2024-11-19T14:56:00.000Z,4,4,,PM,CLOSE,Y,,NO,CHATHAM
23-51801,PVRV-14515 Scheduled Maintenance,PVRV-14515,PVRV-14515,4807,,,11-27-23 1:52 AM,2023-11-27T01:52:00.000Z,4-23-24 12:45 AM,2024-04-23T00:45:00.000Z,11-19-24 2:56 PM,2024-11-19T14:56:00.000Z,4,4,,PM,CLOSE,Y,N,NO,CHATHAM
23-51800,PSV inspection,PVRV-14415,PVRV-14415,4806,,,11-27-23 1:52 AM,2023-11-27T01:52:00.000Z,4-23-24 12:45 AM,2024-04-23T00:45:00.000Z,3-30-25 10:14 PM,2025-03-30T22:14:00.000Z,4,4,,PM,CLOSE,Y,,NO,CHATHAM
23-51799,PVRV-14415 Scheduled Maintenance,PVRV-14415,PVRV-14415,4806,,,11-27-23 1:52 AM,2023-11-27T01:52:00.000Z,4-23-24 12:45 AM,2024-04-23T00:45:00.000Z,3-30-25 10:14 PM,2025-03-30T22:14:00.000Z,4,4,,PM,CLOSE,Y,N,NO,CHATHAM
23-51798,PSV inspection,PVRV-14315,PVRV-14315,4805,,,11-27-23 1:52 AM,2023-11-27T01:52:00.000Z,4-23-24 12:45 AM,2024-04-23T00:45:00.000Z,11-19-24 2:44 PM,2024-11-19T14:44:00.000Z,4,4,,PM,CLOSE,Y,,NO,CHATHAM
23-51797,PVRV-14315 Scheduled Maintenance,PVRV-14315,PVRV-14315,4805,,,11-27-23 1:52 AM,2023-11-27T01:52:00.000Z,4-23-24 12:45 AM,2024-04-23T00:45:00.000Z,11-19-24 2:44 PM,2024-11-19T14:44:00.000Z,4,4,,PM,CLOSE,Y,N,NO,CHATHAM
23-51796,PSV inspection,PVRV-14215,PVRV-14215,4804,,,11-27-23 1:52 AM,2023-11-27T01:52:00.000Z,4-23-24 12:45 AM,2024-04-23T00:45:00.000Z,3-30-25 10:13 PM,2025-03-30T22:13:00.000Z,4,4,,PM,CLOSE,Y,,NO,CHATHAM
23-51795,PVRV-14215 Scheduled Maintenance,PVRV-14215,PVRV-14215,4804,,,11-27-23 1:52 AM,2023-11-27T01:52:00.000Z,4-23-24 12:45 AM,2024-04-23T00:45:00.000Z,3-30-25 10:13 PM,2025-03-30T22:13:00.000Z,4,4,,PM,CLOSE,Y,N,NO,CHATHAM
23-51794,PSV inspection,PVRV-14115,PVRV-14115,4803,,,11-27-23 1:52 AM,2023-11-27T01:52:00.000Z,4-23-24 12:45 AM,2024-04-23T00:45:00.000Z,11-19-24 2:57 PM,2024-11-19T14:57:00.000Z,4,4,,PM,CLOSE,Y,,NO,CHATHAM
23-51793,PVRV-14115 Scheduled Maintenance - GFE,PVRV-14115,PVRV-14115,4803,,,11-27-23 1:52 AM,2023-11-27T01:52:00.000Z,4-23-24 12:45 AM,2024-04-23T00:45:00.000Z,11-19-24 2:57 PM,2024-11-19T14:57:00.000Z,4,4,,PM,CLOSE,Y,N,NO,CHATHAM
23-51792,PSV inspection,PSV-14416,PSV-14416,4359,,,11-27-23 1:52 AM,2023-11-27T01:52:00.000Z,4-23-24 12:45 AM,2024-04-23T00:45:00.000Z,,,4,4,,PM,SCHED,N,,NO,CHATHAM
23-51791,PSV-14416 Scheduled Maintenance - GFE,PSV-14416,PSV-14416,4359,,,11-27-23 1:52 AM,2023-11-27T01:52:00.000Z,4-23-24 12:45 AM,2024-04-23T00:45:00.000Z,,,4,4,,SD,SCHED,N,N,NO,CHATHAM
23-51790,Install expansion joints,P-1620,P-1620,,,,11-27-23 1:52 AM,2023-11-27T01:52:00.000Z,4-22-24 4:00 AM,2024-04-22T04:00:00.000Z,5-27-24 9:48 AM,2024-05-27T09:48:00.000Z,4,4,,SD,CLOSE,Y,,NO,CHATHAM
23-51789,Arrange for installation during fall outage,P-1620,P-1620,,,,11-27-23 1:52 AM,2023-11-27T01:52:00.000Z,4-22-24 12:00 AM,2024-04-22T00:00:00.000Z,5-27-24 9:48 AM,2024-05-27T09:48:00.000Z,4,4,,SD,CLOSE,Y,,NO,CHATHAM
23-51788,Order new expansion joints,P-1620,P-1620,,,,11-27-23 1:52 AM,2023-11-27T01:52:00.000Z,4-22-24 12:00 AM,2024-04-22T00:00:00.000Z,5-27-24 9:48 AM,2024-05-27T09:48:00.000Z,4,4,,SD,CLOSE,Y,,NO,CHATHAM
23-51787,P-1620 Replace expansion joints (Discharge),P-1620,P-1620,,,,11-27-23 1:52 AM,2023-11-27T01:52:00.000Z,4-22-24 8:00 AM,2024-04-22T08:00:00.000Z,5-27-24 9:48 AM,2024-05-27T09:48:00.000Z,4,4,,SD,CLOSE,Y,N,NO,CHATHAM
23-51786,Install expansion joints,P-1610,P-1610,1053,,,11-27-23 1:52 AM,2023-11-27T01:52:00.000Z,4-17-24 3:00 AM,2024-04-17T03:00:00.000Z,11-27-23 6:35 AM,2023-11-27T06:35:00.000Z,4,4,,PM,CLOSE,Y,,NO,CHATHAM
23-51785,Arrange for installation during fall outage,P-1610,P-1610,1053,,,11-27-23 1:52 AM,2023-11-27T01:52:00.000Z,4-17-24 12:00 AM,2024-04-17T00:00:00.000Z,11-27-23 6:35 AM,2023-11-27T06:35:00.000Z,4,4,,PM,CLOSE,Y,,NO,CHATHAM
23-51784,Order new discharge expansion joints,P-1610,P-1610,1053,,,11-27-23 1:52 AM,2023-11-27T01:52:00.000Z,4-17-24 12:00 AM,2024-04-17T00:00:00.000Z,11-27-23 6:35 AM,2023-11-27T06:35:00.000Z,4,4,,PM,CLOSE,Y,,NO,CHATHAM
23-51783,P-1610 - Replace expansion joints,P-1610,P-1610,1053,,,11-27-23 1:52 AM,2023-11-27T01:52:00.000Z,4-17-24 12:00 AM,2024-04-17T00:00:00.000Z,11-27-23 6:35 AM,2023-11-27T06:35:00.000Z,4,4,,PM,CLOSE,Y,N,NO,CHATHAM
23-51782,Install both boots (2 crews x 4 hrs ea),P-1630,P-1630,1002,,,11-27-23 1:52 AM,2023-11-27T01:52:00.000Z,4-17-24 4:00 AM,2024-04-17T04:00:00.000Z,11-12-25 12:33 PM,2025-11-12T12:33:00.000Z,4,4,,SD,COMP,N,,NO,CHATHAM
23-51781,Arrange for installation during fall outage,P-1630,P-1630,1002,,,11-27-23 1:52 AM,2023-11-27T01:52:00.000Z,4-17-24 12:00 AM,2024-04-17T00:00:00.000Z,11-12-25 12:33 PM,2025-11-12T12:33:00.000Z,4,4,,SD,COMP,N,,NO,CHATHAM
23-51780,Order new suction & discharge joints,P-1630,P-1630,1002,,,11-27-23 1:52 AM,2023-11-27T01:52:00.000Z,4-17-24 12:00 AM,2024-04-17T00:00:00.000Z,11-12-25 12:33 PM,2025-11-12T12:33:00.000Z,4,4,,SD,COMP,N,,NO,CHATHAM
23-51779,P-1630 - Replace expansion joints,P-1630,P-1630,1002,,,11-27-23 1:52 AM,2023-11-27T01:52:00.000Z,10-31-24 8:00 AM,2024-10-31T08:00:00.000Z,11-12-25 12:33 PM,2025-11-12T12:33:00.000Z,4,4,,SD,COMP,N,N,NO,CHATHAM
23-51778,INSPECT AND CALIBRATE,SC-2001,SC-2001,4870,,,11-27-23 1:52 AM,2023-11-27T01:52:00.000Z,1-22-24 12:00 AM,2024-01-22T00:00:00.000Z,4-10-24 10:00 AM,2024-04-10T10:00:00.000Z,4,4,,PM,CLOSE,Y,,NO,CHATHAM
23-51777,TRUCK SCALE CALIBRATION PM,SC-2001,SC-2001,4870,,,11-27-23 1:52 AM,2023-11-27T01:52:00.000Z,1-22-24 12:00 AM,2024-01-22T00:00:00.000Z,4-10-24 10:00 AM,2024-04-10T10:00:00.000Z,4,4,,PM,CLOSE,Y,N,NO,CHATHAM
23-51776,INSPECT AND CALIBRATE RAIL SCALE,SC-2600,SC-2600,4871,,,11-27-23 1:52 AM,2023-11-27T01:52:00.000Z,4-22-24 12:00 AM,2024-04-22T00:00:00.000Z,5-14-24 11:30 AM,2024-05-14T11:30:00.000Z,4,4,,PM,CLOSE,Y,,NO,CHATHAM
23-51775,RAIL SCALE CALIBRATION  PM,SC-2600,SC-2600,4871,,,11-27-23 1:52 AM,2023-11-27T01:52:00.000Z,4-30-24 12:00 AM,2024-04-30T00:00:00.000Z,4-30-24 11:30 AM,2024-04-30T11:30:00.000Z,4,4,,PM,CLOSE,Y,N,NO,CHATHAM
23-51774,AIR PRESSURE ADJUSTMENT,MX-1302,MX-1302,3563,,,11-27-23 1:51 AM,2023-11-27T01:51:00.000Z,4-23-24 12:30 AM,2024-04-23T00:30:00.000Z,5-22-24 8:36 AM,2024-05-22T08:36:00.000Z,4,4,,PM,CLOSE,Y,,NO,CHATHAM
23-51773,CLOSE LID/INSTALL GUARDS,MX-1302,MX-1302,3563,,,11-27-23 1:51 AM,2023-11-27T01:51:00.000Z,4-23-24 12:00 AM,2024-04-23T00:00:00.000Z,5-22-24 8:36 AM,2024-05-22T08:36:00.000Z,4,4,,PM,CLOSE,Y,,NO,CHATHAM
23-51772,BASE BOLTS ARE TIGHT TO SPEC,MX-1302,MX-1302,3563,,,11-27-23 1:51 AM,2023-11-27T01:51:00.000Z,4-23-24 12:00 AM,2024-04-23T00:00:00.000Z,5-22-24 8:36 AM,2024-05-22T08:36:00.000Z,4,4,,PM,CLOSE,Y,,NO,CHATHAM
23-51771,INSPECT MOTOR CLEANLINESS,MX-1302,MX-1302,3563,,,11-27-23 1:51 AM,2023-11-27T01:51:00.000Z,4-23-24 12:00 AM,2024-04-23T00:00:00.000Z,5-22-24 8:36 AM,2024-05-22T08:36:00.000Z,4,4,,PM,CLOSE,Y,,NO,CHATHAM
23-51770,CHECK GEAR BOX SHAFT FOR OIL LEAKAGE,MX-1302,MX-1302,3563,,,11-27-23 1:51 AM,2023-11-27T01:51:00.000Z,4-23-24 12:00 AM,2024-04-23T00:00:00.000Z,5-22-24 8:36 AM,2024-05-22T08:36:00.000Z,4,4,,PM,CLOSE,Y,,NO,CHATHAM
23-51769,CHECK OIL LEVEL IN DRIVE GEARBOX,MX-1302,MX-1302,3563,,,11-27-23 1:51 AM,2023-11-27T01:51:00.000Z,4-23-24 12:00 AM,2024-04-23T00:00:00.000Z,5-22-24 8:36 AM,2024-05-22T08:36:00.000Z,4,4,,PM,CLOSE,Y,,NO,CHATHAM
23-51768,INSPECT WRAP-FLEX COUPLINGS (2),MX-1302,MX-1302,3563,,,11-27-23 1:51 AM,2023-11-27T01:51:00.000Z,4-23-24 12:00 AM,2024-04-23T00:00:00.000Z,5-22-24 8:36 AM,2024-05-22T08:36:00.000Z,4,4,,PM,CLOSE,Y,,NO,CHATHAM
23-51767,VISUAL CHECK MIXER CINCH SEALS,MX-1302,MX-1302,3563,,,11-27-23 1:51 AM,2023-11-27T01:51:00.000Z,4-23-24 2:00 AM,2024-04-23T02:00:00.000Z,5-22-24 8:36 AM,2024-05-22T08:36:00.000Z,4,4,,PM,CLOSE,Y,,NO,CHATHAM
23-51766,VISUAL INSPECT DRIVE BELTS ON SEW DRIVE,MX-1302,MX-1302,3563,,,11-27-23 1:51 AM,2023-11-27T01:51:00.000Z,4-23-24 12:00 AM,2024-04-23T00:00:00.000Z,5-22-24 8:36 AM,2024-05-22T08:36:00.000Z,4,4,,PM,CLOSE,Y,,NO,CHATHAM
23-51765,HPW INTERNAL,MX-1302,MX-1302,3563,,,11-27-23 1:51 AM,2023-11-27T01:51:00.000Z,4-23-24 2:00 AM,2024-04-23T02:00:00.000Z,5-22-24 8:36 AM,2024-05-22T08:36:00.000Z,4,4,,PM,CLOSE,Y,,NO,CHATHAM
23-51764,VISUAL INSPECT MIXER INTERNALS,MX-1302,MX-1302,3563,,,11-27-23 1:51 AM,2023-11-27T01:51:00.000Z,4-23-24 12:30 AM,2024-04-23T00:30:00.000Z,5-22-24 8:36 AM,2024-05-22T08:36:00.000Z,4,4,,PM,CLOSE,Y,,NO,CHATHAM
23-51763,MX-1302 - MECHANICAL PM,MX-1302,MX-1302,3563,,,11-27-23 1:51 AM,2023-11-27T01:51:00.000Z,4-23-24 2:00 AM,2024-04-23T02:00:00.000Z,5-22-24 8:36 AM,2024-05-22T08:36:00.000Z,4,4,,PM,CLOSE,Y,N,NO,CHATHAM
23-51762,RECALIBRATE PRESSURE SWITCHES AND TRANSMITTERS,B-3602,B-3602,1272,,,11-27-23 1:51 AM,2023-11-27T01:51:00.000Z,4-23-24 12:00 AM,2024-04-23T00:00:00.000Z,4-9-24 10:46 AM,2024-04-09T10:46:00.000Z,4,4,,SD,CLOSE,Y,,NO,CHATHAM
23-51761,CALIBRATE FLUE GAS ANALYZERS,B-3602,B-3602,1272,,,11-27-23 1:51 AM,2023-11-27T01:51:00.000Z,4-23-24 12:00 AM,2024-04-23T00:00:00.000Z,4-9-24 10:46 AM,2024-04-09T10:46:00.000Z,4,4,,SD,CLOSE,Y,,NO,CHATHAM
23-51760,B-3602 CALIBRATIONS,B-3602,B-3602,1272,,,11-27-23 1:51 AM,2023-11-27T01:51:00.000Z,4-23-24 12:00 AM,2024-04-23T00:00:00.000Z,4-9-24 10:46 AM,2024-04-09T10:46:00.000Z,4,4,,SD,CLOSE,Y,N,NO,CHATHAM
23-51759,RECALIBRATE PRESSURE SWITCHES AND TRANSMITTERS,B-3601,B-3601,1271,,,11-27-23 1:51 AM,2023-11-27T01:51:00.000Z,4-23-24 12:00 AM,2024-04-23T00:00:00.000Z,4-9-24 10:47 AM,2024-04-09T10:47:00.000Z,4,4,,SD,CLOSE,Y,,NO,CHATHAM
23-51758,CALIBRATE FLUE GAS ANALYZERS,B-3601,B-3601,1271,,,11-27-23 1:51 AM,2023-11-27T01:51:00.000Z,4-23-24 12:00 AM,2024-04-23T00:00:00.000Z,4-9-24 10:47 AM,2024-04-09T10:47:00.000Z,4,4,,SD,CLOSE,Y,,NO,CHATHAM
23-51757,B-3601 CALIBRATIONS,B-3601,B-3601,1271,,,11-27-23 1:51 AM,2023-11-27T01:51:00.000Z,4-23-24 12:00 AM,2024-04-23T00:00:00.000Z,4-9-24 10:47 AM,2024-04-09T10:47:00.000Z,4,4,,SD,CLOSE,Y,N,NO,CHATHAM
23-51756,RE-INSTALL MANHOLE COVERS AND CLOSE,DA-3602,DA-3602,1453,,,11-27-23 1:51 AM,2023-11-27T01:51:00.000Z,4-23-24 12:00 AM,2024-04-23T00:00:00.000Z,4-9-24 10:56 AM,2024-04-09T10:56:00.000Z,4,4,,SD,CLOSE,Y,,NO,CHATHAM
23-51755,REMOVE ALL MANHOLE COVERS AND REPLACE GASKETS,DA-3602,DA-3602,1453,,,11-27-23 1:51 AM,2023-11-27T01:51:00.000Z,4-23-24 12:00 AM,2024-04-23T00:00:00.000Z,4-9-24 10:56 AM,2024-04-09T10:56:00.000Z,4,4,,SD,CLOSE,Y,,NO,CHATHAM
23-51754,DA-3602 OPEN/CLOSE PM,DA-3602,DA-3602,1453,,,11-27-23 1:51 AM,2023-11-27T01:51:00.000Z,4-23-24 12:00 AM,2024-04-23T00:00:00.000Z,4-9-24 10:56 AM,2024-04-09T10:56:00.000Z,4,4,,SD,CLOSE,Y,N,NO,CHATHAM
23-51753,P-3201 INSPECT/ REPLACE PUMP ROTOR,P-3201B,P-3201B,,,,11-27-23 1:51 AM,2023-11-27T01:51:00.000Z,4-23-24 12:00 AM,2024-04-23T00:00:00.000Z,4-9-24 10:57 AM,2024-04-09T10:57:00.000Z,4,4,,SD,CLOSE,Y,,NO,CHATHAM
23-51752,P-3201 INSPECT/ REPLACE PUMP ROTOR,P-3201B,P-3201B,,,,11-27-23 1:51 AM,2023-11-27T01:51:00.000Z,4-23-24 12:00 AM,2024-04-23T00:00:00.000Z,4-9-24 10:57 AM,2024-04-09T10:57:00.000Z,4,4,,SD,CLOSE,Y,N,NO,CHATHAM
23-51751,CTF-3201-GB CHANGE OUT FAN GEARBOX PM,CTF-3201A,CTF-3201A,,,,11-27-23 1:51 AM,2023-11-27T01:51:00.000Z,4-23-24 12:00 AM,2024-04-23T00:00:00.000Z,4-9-24 11:00 AM,2024-04-09T11:00:00.000Z,4,4,,SD,CLOSE,Y,,NO,CHATHAM
23-51750,CTF-3201-GB CHANGE OUT FAN GEARBOX PM,CTF-3201A,CTF-3201A,,,,11-27-23 1:51 AM,2023-11-27T01:51:00.000Z,4-23-24 3:00 AM,2024-04-23T03:00:00.000Z,4-9-24 11:00 AM,2024-04-09T11:00:00.000Z,4,4,,SD,CLOSE,Y,N,NO,CHATHAM
23-51749,COPPUS AIR MOVERS S/D PREPARATIONS,CHATHAM,CHATHAM,,,,11-27-23 1:51 AM,2023-11-27T01:51:00.000Z,4-23-24 12:00 AM,2024-04-23T00:00:00.000Z,4-4-24 11:20 AM,2024-04-04T11:20:00.000Z,4,4,,SD,CLOSE,Y,,NO,CHATHAM
23-51748,COPPUS AIR MOVERS S/D PREPARATION,CHATHAM,CHATHAM,,,,11-27-23 1:51 AM,2023-11-27T01:51:00.000Z,4-23-24 1:00 AM,2024-04-23T01:00:00.000Z,4-4-24 11:20 AM,2024-04-04T11:20:00.000Z,4,4,,SD,CLOSE,Y,N,NO,CHATHAM
23-51747,SE-2101 INSPECTION AND REPAIR (UMHW),SE-2101,SE-2101,4876,,,11-27-23 1:51 AM,2023-11-27T01:51:00.000Z,4-23-24 12:00 AM,2024-04-23T00:00:00.000Z,5-22-24 9:26 AM,2024-05-22T09:26:00.000Z,4,4,,SD,CLOSE,Y,,NO,CHATHAM
23-51746,SE-2101 - UHMW INSPECTION/ REPAIR,SE-2101,SE-2101,4876,,,11-27-23 1:51 AM,2023-11-27T01:51:00.000Z,4-23-24 12:00 AM,2024-04-23T00:00:00.000Z,5-22-24 9:26 AM,2024-05-22T09:26:00.000Z,4,4,,SD,CLOSE,Y,N,NO,CHATHAM
23-51745,MCC'S UPS ANNUAL PM,MCC-3816,MCC-3816,3385,,,11-27-23 1:51 AM,2023-11-27T01:51:00.000Z,4-23-24 12:00 AM,2024-04-23T00:00:00.000Z,12-15-24 6:49 PM,2024-12-15T18:49:00.000Z,4,4,,SD,CLOSE,Y,,NO,CHATHAM
23-51744,MCC3816 UPS PM,MCC-3816,MCC-3816,3385,,,11-27-23 1:51 AM,2023-11-27T01:51:00.000Z,4-23-24 12:00 AM,2024-04-23T00:00:00.000Z,12-15-24 6:49 PM,2024-12-15T18:49:00.000Z,4,4,,SD,CLOSE,Y,N,NO,CHATHAM
23-51743,Oil and Gas Analysis (Transformers),3800,3800,,,,11-27-23 1:51 AM,2023-11-27T01:51:00.000Z,4-23-24 12:00 AM,2024-04-23T00:00:00.000Z,4-9-24 11:03 AM,2024-04-09T11:03:00.000Z,4,4,,SD,CLOSE,Y,,NO,CHATHAM
23-51742,Xfrm-3801 Oil and Gas Analysis  PM,3800,3800,,,,11-27-23 1:51 AM,2023-11-27T01:51:00.000Z,4-23-24 12:00 AM,2024-04-23T00:00:00.000Z,4-9-24 11:03 AM,2024-04-09T11:03:00.000Z,4,4,,SD,CLOSE,Y,N,NO,CHATHAM
23-51741,Transformer  PM,3800,3800,,,,11-27-23 1:51 AM,2023-11-27T01:51:00.000Z,4-23-24 12:00 AM,2024-04-23T00:00:00.000Z,4-9-24 11:03 AM,2024-04-09T11:03:00.000Z,4,4,,SD,CLOSE,Y,,NO,CHATHAM
23-51740,Xfrm-3801 PM (Main Transformer),3800,3800,,,,11-27-23 1:51 AM,2023-11-27T01:51:00.000Z,4-23-24 12:00 AM,2024-04-23T00:00:00.000Z,4-9-24 11:03 AM,2024-04-09T11:03:00.000Z,4,4,,SD,CLOSE,Y,N,NO,CHATHAM
23-51739,INSPECT/REPAIR UHMW & MEATAL CONPONENTS,CV-2110,CV-2110,1436,,,11-27-23 1:51 AM,2023-11-27T01:51:00.000Z,4-23-24 6:00 AM,2024-04-23T06:00:00.000Z,3-21-24 9:12 AM,2024-03-21T09:12:00.000Z,4,4,,SD,CLOSE,Y,,NO,CHATHAM
23-51738,CV-2110 UHMW INSPECTION,CV-2110,CV-2110,1436,,,11-27-23 1:51 AM,2023-11-27T01:51:00.000Z,4-23-24 6:00 AM,2024-04-23T06:00:00.000Z,3-21-24 9:12 AM,2024-03-21T09:12:00.000Z,4,4,,SD,CLOSE,Y,N,NO,CHATHAM
23-51737,REPAIR/REPLACE UHMW & METAL AS REQUIRED,BE-2109,BE-2109,1281,,,11-27-23 1:51 AM,2023-11-27T01:51:00.000Z,4-23-24 10:00 AM,2024-04-23T10:00:00.000Z,5-16-24 9:56 AM,2024-05-16T09:56:00.000Z,4,4,,SD,CLOSE,Y,,NO,CHATHAM
23-51736,BE-2109 - INSPECTION AND REPAIR (RHINO HIDE),BE-2109,BE-2109,1281,,,11-27-23 1:51 AM,2023-11-27T01:51:00.000Z,4-23-24 10:00 AM,2024-04-23T10:00:00.000Z,5-16-24 9:56 AM,2024-05-16T09:56:00.000Z,4,4,,SD,CLOSE,Y,N,NO,CHATHAM
23-51735,BE-2107 INSPECT/REPAIR (UMHW),BE-2107,BE-2107,1280,,,11-27-23 1:51 AM,2023-11-27T01:51:00.000Z,4-23-24 12:00 AM,2024-04-23T00:00:00.000Z,5-16-24 9:53 AM,2024-05-16T09:53:00.000Z,4,4,,SD,CLOSE,Y,,NO,CHATHAM
23-51734,BE-2107 - INSPECTION AND REPAIR (RHINO HIDE),BE-2107,BE-2107,1280,,,11-27-23 1:50 AM,2023-11-27T01:50:00.000Z,4-23-24 12:00 AM,2024-04-23T00:00:00.000Z,5-16-24 9:53 AM,2024-05-16T09:53:00.000Z,4,4,,SD,CLOSE,Y,N,NO,CHATHAM
23-51733,LOWER SECTION REPAIR,BE-2101,BE-2101,1279,,,11-27-23 1:50 AM,2023-11-27T01:50:00.000Z,4-23-24 4:00 AM,2024-04-23T04:00:00.000Z,6-11-24 8:30 AM,2024-06-11T08:30:00.000Z,4,4,,SD,CLOSE,Y,,NO,CHATHAM
23-51732,UPPER SECTION REPAIR,BE-2101,BE-2101,1279,,,11-27-23 1:50 AM,2023-11-27T01:50:00.000Z,4-23-24 12:00 PM,2024-04-23T12:00:00.000Z,6-11-24 8:30 AM,2024-06-11T08:30:00.000Z,4,4,,SD,CLOSE,Y,,NO,CHATHAM
23-51731,BE-2101 - INSPECTION AND REPAIR (RHINO HIDE),BE-2101,BE-2101,1279,,,11-27-23 1:50 AM,2023-11-27T01:50:00.000Z,4-23-24 4:00 PM,2024-04-23T16:00:00.000Z,6-11-24 8:30 AM,2024-06-11T08:30:00.000Z,4,4,,SD,CLOSE,Y,N,NO,CHATHAM
23-51730,Replace probe prior to dryer startup,LT-84401,LT-84401,3277,,,11-27-23 1:50 AM,2023-11-27T01:50:00.000Z,4-23-24 1:00 AM,2024-04-23T01:00:00.000Z,5-27-24 9:55 AM,2024-05-27T09:55:00.000Z,4,4,,SD,CLOSE,Y,,NO,CHATHAM
23-51729,Reinstall Dryer scrubber level transmitter DR02,LT-84401,LT-84401,3277,,,11-27-23 1:50 AM,2023-11-27T01:50:00.000Z,4-23-24 1:00 AM,2024-04-23T01:00:00.000Z,5-27-24 9:55 AM,2024-05-27T09:55:00.000Z,4,4,,SD,CLOSE,Y,N,NO,CHATHAM
23-51728,Re-install all level transmitters,1600,1600,,,,11-27-23 1:50 AM,2023-11-27T01:50:00.000Z,4-23-24 12:00 AM,2024-04-23T00:00:00.000Z,5-27-24 10:08 AM,2024-05-27T10:08:00.000Z,4,4,,SD,CLOSE,Y,,NO,CHATHAM
23-51727,Remove LT-16302 prior to high pressure wash,1600,1600,,,,11-27-23 1:50 AM,2023-11-27T01:50:00.000Z,4-23-24 12:00 AM,2024-04-23T00:00:00.000Z,5-27-24 10:08 AM,2024-05-27T10:08:00.000Z,4,4,,SD,CLOSE,Y,,NO,CHATHAM
23-51726,Remove LT-16207B prior to high pressure wash,1600,1600,,,,11-27-23 1:50 AM,2023-11-27T01:50:00.000Z,4-23-24 12:00 AM,2024-04-23T00:00:00.000Z,5-27-24 10:08 AM,2024-05-27T10:08:00.000Z,4,4,,SD,CLOSE,Y,,NO,CHATHAM
23-51725,Remove LT-16207A prior to high pressure wash,1600,1600,,,,11-27-23 1:50 AM,2023-11-27T01:50:00.000Z,4-23-24 12:00 AM,2024-04-23T00:00:00.000Z,5-27-24 10:08 AM,2024-05-27T10:08:00.000Z,4,4,,SD,CLOSE,Y,,NO,CHATHAM
23-51724,Remove LT-16203 prior to high pressure wash,1600,1600,,,,11-27-23 1:50 AM,2023-11-27T01:50:00.000Z,4-23-24 12:00 AM,2024-04-23T00:00:00.000Z,5-27-24 10:08 AM,2024-05-27T10:08:00.000Z,4,4,,SD,CLOSE,Y,,NO,CHATHAM
23-51723,Evap. Shutdown DP cell removal,1600,1600,,,,11-27-23 1:50 AM,2023-11-27T01:50:00.000Z,4-23-24 12:00 AM,2024-04-23T00:00:00.000Z,5-27-24 10:08 AM,2024-05-27T10:08:00.000Z,4,4,,SD,CLOSE,Y,N,NO,CHATHAM
23-51722,CONDUCTIVITY METER /PH PROBE CLEAN & CALIBRATE PM,AE-84404,AE-84404,7174,,,11-27-23 1:50 AM,2023-11-27T01:50:00.000Z,12-21-23 2:00 AM,2023-12-21T02:00:00.000Z,12-21-23 11:55 AM,2023-12-21T11:55:00.000Z,4,4,,PM,CLOSE,Y,,NO,CHATHAM
23-51721,DRYER SCRUBBER PH PROBE PM,AE-84404,AE-84404,7174,,,11-27-23 1:50 AM,2023-11-27T01:50:00.000Z,12-21-23 1:00 AM,2023-12-21T01:00:00.000Z,12-21-23 12:30 AM,2023-12-21T00:30:00.000Z,4,4,,PM,CLOSE,Y,N,NO,CHATHAM
23-51720,TSH-  INSTRUMENT CALIBRATION PROCEDURE (high),TSH-18903,TSH-18903,5540,,,11-27-23 1:50 AM,2023-11-27T01:50:00.000Z,4-23-24 1:00 AM,2024-04-23T01:00:00.000Z,6-24-24 9:17 AM,2024-06-24T09:17:00.000Z,4,4,,SD,CLOSE,Y,,NO,CHATHAM
23-51719,TSH-18903 E-1824 OVERTEMP HI  CAL. DR04,TSH-18903,TSH-18903,5540,,,11-27-23 1:50 AM,2023-11-27T01:50:00.000Z,4-23-24 1:00 AM,2024-04-23T01:00:00.000Z,6-24-24 9:17 AM,2024-06-24T09:17:00.000Z,4,4,,SD,CLOSE,Y,N,NO,CHATHAM
23-51718,B-3602 pre-shutdown check lists,B-3602,B-3602,1272,,,11-27-23 1:50 AM,2023-11-27T01:50:00.000Z,4-22-24 12:00 AM,2024-04-22T00:00:00.000Z,5-15-24 7:38 AM,2024-05-15T07:38:00.000Z,4,4,,SD,CLOSE,Y,,NO,CHATHAM
23-51717,B-3602 Pre-shutdown inspection,B-3602,B-3602,1272,,,11-27-23 1:50 AM,2023-11-27T01:50:00.000Z,4-22-24 4:00 AM,2024-04-22T04:00:00.000Z,5-15-24 7:38 AM,2024-05-15T07:38:00.000Z,4,4,,SD,CLOSE,Y,N,NO,CHATHAM
23-51716,REMOVE & RE-INSTALL CYCLONE PROBES,1840,1840,,,,11-27-23 1:50 AM,2023-11-27T01:50:00.000Z,4-23-24 1:00 AM,2024-04-23T01:00:00.000Z,5-27-24 9:55 AM,2024-05-27T09:55:00.000Z,4,4,,SD,CLOSE,Y,,NO,CHATHAM
23-51715,1840 Dryer D removal of cyclone probes DR02,1840,1840,,,,11-27-23 1:50 AM,2023-11-27T01:50:00.000Z,4-23-24 1:00 AM,2024-04-23T01:00:00.000Z,5-27-24 9:55 AM,2024-05-27T09:55:00.000Z,4,4,,SD,CLOSE,Y,N,NO,CHATHAM
23-51714,VISUAL INSPECTION OF RAKE/SHAFT,E-1824,E-1824,1532,,,11-27-23 1:50 AM,2023-11-27T01:50:00.000Z,3-18-24 12:00 AM,2024-03-18T00:00:00.000Z,6-20-24 2:10 PM,2024-06-20T14:10:00.000Z,4,4,,SD,CLOSE,Y,,NO,CHATHAM
23-51713,CLEAN COOLER INTERNALS,E-1824,E-1824,1532,,,11-27-23 1:50 AM,2023-11-27T01:50:00.000Z,3-18-24 3:00 AM,2024-03-18T03:00:00.000Z,6-20-24 2:10 PM,2024-06-20T14:10:00.000Z,4,4,,SD,CLOSE,Y,,NO,CHATHAM
23-51712,CLEAN (INSIDE) DDG COOLER DR0,E-1824,E-1824,1532,,,11-27-23 1:50 AM,2023-11-27T01:50:00.000Z,3-18-24 12:00 AM,2024-03-18T00:00:00.000Z,6-20-24 2:10 PM,2024-06-20T14:10:00.000Z,4,4,,SD,CLOSE,Y,N,NO,CHATHAM
23-51711,AT DCS,LT-15905,LT-15905,3172,,,11-27-23 1:49 AM,2023-11-27T01:49:00.000Z,4-23-24 12:00 AM,2024-04-23T00:00:00.000Z,4-9-24 11:05 AM,2024-04-09T11:05:00.000Z,4,4,,SD,CLOSE,Y,,NO,CHATHAM
23-51710,IN FIELD,LT-15905,LT-15905,3172,,,11-27-23 1:49 AM,2023-11-27T01:49:00.000Z,4-23-24 12:00 AM,2024-04-23T00:00:00.000Z,4-9-24 11:05 AM,2024-04-09T11:05:00.000Z,4,4,,SD,CLOSE,Y,,NO,CHATHAM
23-51709,AT DCS,LT-15905,LT-15905,3172,,,11-27-23 1:49 AM,2023-11-27T01:49:00.000Z,4-23-24 12:00 AM,2024-04-23T00:00:00.000Z,4-9-24 11:05 AM,2024-04-09T11:05:00.000Z,4,4,,SD,CLOSE,Y,,NO,CHATHAM
23-51708,LT-15905 MAGNETIC FLOAT LEVEL TRANSMITTER BLOWDOWN,LT-15905,LT-15905,3172,,,11-27-23 1:49 AM,2023-11-27T01:49:00.000Z,4-23-24 1:00 AM,2024-04-23T01:00:00.000Z,4-9-24 11:05 AM,2024-04-09T11:05:00.000Z,4,4,,SD,CLOSE,Y,N,NO,CHATHAM
23-51707,PICKUPS TO BE REMOVED FROM HOLD AND RE-INSTALLED ON NEW,RV-1808D,RV-1808D,4859,,,11-27-23 1:49 AM,2023-11-27T01:49:00.000Z,4-20-24 12:00 AM,2024-04-20T00:00:00.000Z,4-9-24 11:05 AM,2024-04-09T11:05:00.000Z,4,4,,SD,CLOSE,Y,,NO,CHATHAM
23-51706,REPLACE AND ALIGN SPROCKETS. INSTALL NEW CHAIN,RV-1808D,RV-1808D,4859,,,11-27-23 1:49 AM,2023-11-27T01:49:00.000Z,4-20-24 1:00 AM,2024-04-20T01:00:00.000Z,4-9-24 11:05 AM,2024-04-09T11:05:00.000Z,4,4,,SD,CLOSE,Y,,NO,CHATHAM
23-51705,INSTALL SPARE ROTARY VALVE,RV-1808D,RV-1808D,4859,,,11-27-23 1:49 AM,2023-11-27T01:49:00.000Z,4-20-24 1:00 AM,2024-04-20T01:00:00.000Z,4-9-24 11:05 AM,2024-04-09T11:05:00.000Z,4,4,,SD,CLOSE,Y,,NO,CHATHAM
23-51704,REMOVE EXISTING ROTARY VALVE,RV-1808D,RV-1808D,4859,,,11-27-23 1:49 AM,2023-11-27T01:49:00.000Z,4-20-24 1:00 AM,2024-04-20T01:00:00.000Z,4-9-24 11:05 AM,2024-04-09T11:05:00.000Z,4,4,,SD,CLOSE,Y,,NO,CHATHAM
23-51703,RV-1808D - REPLACEMENT,RV-1808D,RV-1808D,4859,,,11-27-23 1:49 AM,2023-11-27T01:49:00.000Z,4-20-24 3:00 AM,2024-04-20T03:00:00.000Z,4-9-24 11:05 AM,2024-04-09T11:05:00.000Z,4,4,,SD,CLOSE,Y,N,NO,CHATHAM
23-51702,B-3601 pre-shutdown check lists,B-3601,B-3601,1271,,,11-27-23 1:49 AM,2023-11-27T01:49:00.000Z,4-22-24 12:00 AM,2024-04-22T00:00:00.000Z,5-15-24 7:35 AM,2024-05-15T07:35:00.000Z,4,4,,SD,CLOSE,Y,,NO,CHATHAM
23-51701,B-3601  Pre-Shutdown Check List Instrument Verification Procedure.,B-3601,B-3601,1271,,,11-27-23 1:49 AM,2023-11-27T01:49:00.000Z,4-22-24 4:00 AM,2024-04-22T04:00:00.000Z,5-15-24 7:35 AM,2024-05-15T07:35:00.000Z,4,4,,SD,CLOSE,Y,N,NO,CHATHAM
23-51700,HRSG Pre-shutdown check list instrumentation.,ME-3601,ME-3601,3393,,,11-27-23 1:49 AM,2023-11-27T01:49:00.000Z,4-22-24 12:00 AM,2024-04-22T00:00:00.000Z,5-15-24 7:55 AM,2024-05-15T07:55:00.000Z,4,4,,SD,CLOSE,Y,,NO,CHATHAM
23-51699,HRSG  Pre-shutdown Check List - Instrument Verification Procedure.,ME-3601,ME-3601,3393,,,11-27-23 1:49 AM,2023-11-27T01:49:00.000Z,4-22-24 4:00 AM,2024-04-22T04:00:00.000Z,5-15-24 7:55 AM,2024-05-15T07:55:00.000Z,4,4,,SD,CLOSE,Y,N,NO,CHATHAM
23-51698,C-V-1513 Annual Inspection Check lists.,V-1513,V-1513,6288,,,11-27-23 1:49 AM,2023-11-27T01:49:00.000Z,4-23-24 12:00 AM,2024-04-23T00:00:00.000Z,4-9-24 11:07 AM,2024-04-09T11:07:00.000Z,4,4,,SD,CLOSE,Y,,NO,CHATHAM
23-51697,V-1513  Inspection Check List.,V-1513,V-1513,6288,,,11-27-23 1:49 AM,2023-11-27T01:49:00.000Z,4-23-24 4:00 AM,2024-04-23T04:00:00.000Z,4-9-24 11:07 AM,2024-04-09T11:07:00.000Z,4,4,,SD,CLOSE,Y,N,NO,CHATHAM
23-51696,PERFORM CALIBRATION,AIC-36801,AIC-36801,1212,,,11-27-23 1:49 AM,2023-11-27T01:49:00.000Z,4-23-24 1:00 AM,2024-04-23T01:00:00.000Z,4-9-24 11:08 AM,2024-04-09T11:08:00.000Z,4,4,,SD,CLOSE,Y,,NO,CHATHAM
23-51695,PACKAGE BOILER O2 ANALYZER CALIBRATION,AIC-36801,AIC-36801,1212,,,11-27-23 1:49 AM,2023-11-27T01:49:00.000Z,4-23-24 1:00 AM,2024-04-23T01:00:00.000Z,4-9-24 11:08 AM,2024-04-09T11:08:00.000Z,4,4,,SD,CLOSE,Y,N,NO,CHATHAM
23-51694,Replace check valves,TK-1301,TK-1301,5450,,,11-27-23 1:49 AM,2023-11-27T01:49:00.000Z,4-23-24 2:00 AM,2024-04-23T02:00:00.000Z,5-21-24 1:14 PM,2024-05-21T13:14:00.000Z,4,4,,SD,CLOSE,Y,,NO,CHATHAM
23-51693,Inspect isolation valves,TK-1301,TK-1301,5450,,,11-27-23 1:49 AM,2023-11-27T01:49:00.000Z,4-23-24 1:00 AM,2024-04-23T01:00:00.000Z,5-21-24 1:14 PM,2024-05-21T13:14:00.000Z,4,4,,SD,CLOSE,Y,,NO,CHATHAM
23-51692,TK-1301 replacement of steam check valves,TK-1301,TK-1301,5450,,,11-27-23 1:49 AM,2023-11-27T01:49:00.000Z,4-23-24 4:00 AM,2024-04-23T04:00:00.000Z,5-21-24 1:14 PM,2024-05-21T13:14:00.000Z,4,4,,PM,CLOSE,Y,N,NO,CHATHAM
23-51691,ME-3601A   INSTRUMENT CALIBRATION PROCEDURE,ME-3601A,ME-3601A,,,,11-27-23 1:49 AM,2023-11-27T01:49:00.000Z,4-23-24 2:30 AM,2024-04-23T02:30:00.000Z,4-9-24 11:09 AM,2024-04-09T11:09:00.000Z,4,4,,SD,CLOSE,Y,,NO,CHATHAM
23-51690,ME-3601A ENCLOSURE FAN SEQUENCED PM,ME-3601A,ME-3601A,,,,11-27-23 1:49 AM,2023-11-27T01:49:00.000Z,4-23-24 1:00 AM,2024-04-23T01:00:00.000Z,4-9-24 11:09 AM,2024-04-09T11:09:00.000Z,4,4,,SD,CLOSE,Y,N,NO,CHATHAM
23-51689,SCAFFOLDING STEPS,1840,1840,,,,11-27-23 1:49 AM,2023-11-27T01:49:00.000Z,4-23-24 4:00 AM,2024-04-23T04:00:00.000Z,5-27-24 10:23 AM,2024-05-27T10:23:00.000Z,4,4,,SD,CLOSE,Y,,NO,CHATHAM
23-51688,DUCT INSPECTION AND CLEANING,1840,1840,,,,11-27-23 1:49 AM,2023-11-27T01:49:00.000Z,4-23-24 3:00 AM,2024-04-23T03:00:00.000Z,5-27-24 10:23 AM,2024-05-27T10:23:00.000Z,4,4,,SD,CLOSE,Y,,NO,CHATHAM
23-51687,1840 Inspect and clean ductwork DR02 ISO 14001,1840,1840,,,,11-27-23 1:49 AM,2023-11-27T01:49:00.000Z,5-31-24 3:00 AM,2024-05-31T03:00:00.000Z,5-27-24 10:23 AM,2024-05-27T10:23:00.000Z,4,4,,SD,CLOSE,Y,N,NO,CHATHAM
23-51686,DRAG CONVEYOR  P.M.,CV-2110,CV-2110,1436,,,11-27-23 1:49 AM,2023-11-27T01:49:00.000Z,4-23-24 1:30 AM,2024-04-23T01:30:00.000Z,5-22-24 8:23 AM,2024-05-22T08:23:00.000Z,4,4,,SD,CLOSE,Y,,NO,CHATHAM
23-51685,CV-2110 MECHANICAL PM,CV-2110,CV-2110,1436,,,11-27-23 1:49 AM,2023-11-27T01:49:00.000Z,4-23-24 1:30 AM,2024-04-23T01:30:00.000Z,5-22-24 8:23 AM,2024-05-22T08:23:00.000Z,4,4,,SD,CLOSE,Y,N,NO,CHATHAM
23-51684,TSH-  INSTRUMENT CALIBRATION PROCEDURE (low),TSH-84301,TSH-84301,5555,,,11-27-23 1:49 AM,2023-11-27T01:49:00.000Z,4-23-24 1:00 AM,2024-04-23T01:00:00.000Z,4-9-24 11:09 AM,2024-04-09T11:09:00.000Z,4,4,,SD,CLOSE,Y,,NO,CHATHAM
23-51683,TSH-84301 DRYER D OVERTEMP HI  CAL. DR04 ISO 14001,TSH-84301,TSH-84301,5555,,,11-27-23 1:49 AM,2023-11-27T01:49:00.000Z,4-23-24 1:00 AM,2024-04-23T01:00:00.000Z,4-9-24 11:09 AM,2024-04-09T11:09:00.000Z,4,4,,SD,CLOSE,Y,N,NO,CHATHAM
23-51682,TSH-  INSTRUMENT CALIBRATION PROCEDURE (low),TSH-84208,TSH-84208,5554,,,11-27-23 1:49 AM,2023-11-27T01:49:00.000Z,4-23-24 1:00 AM,2024-04-23T01:00:00.000Z,4-9-24 11:10 AM,2024-04-09T11:10:00.000Z,4,4,,SD,CLOSE,Y,,NO,CHATHAM
23-51681,TSH-84208 DRYER D OVERTEMP Hi CAL.  DR04 ISO 14001,TSH-84208,TSH-84208,5554,,,11-27-23 1:49 AM,2023-11-27T01:49:00.000Z,4-23-24 1:00 AM,2024-04-23T01:00:00.000Z,4-9-24 11:10 AM,2024-04-09T11:10:00.000Z,4,4,,SD,CLOSE,Y,N,NO,CHATHAM
23-51680,TSH-  INSTRUMENT CALIBRATION PROCEDURE (high),TSH-84204,TSH-84204,5552,,,11-27-23 1:49 AM,2023-11-27T01:49:00.000Z,4-23-24 1:00 AM,2024-04-23T01:00:00.000Z,4-9-24 11:11 AM,2024-04-09T11:11:00.000Z,4,4,,SD,CLOSE,Y,,NO,CHATHAM
23-51679,TSH-84204 DRYER D OVERTEMP HI  CAL. DR04 ISO 14001,TSH-84204,TSH-84204,5552,,,11-27-23 1:49 AM,2023-11-27T01:49:00.000Z,4-23-24 1:00 AM,2024-04-23T01:00:00.000Z,4-9-24 11:11 AM,2024-04-09T11:11:00.000Z,4,4,,SD,CLOSE,Y,N,NO,CHATHAM
23-51678,TSH-  INSTRUMENT CALIBRATION PROCEDURE (high),TSH-84202,TSH-84202,5551,,,11-27-23 1:49 AM,2023-11-27T01:49:00.000Z,4-23-24 1:00 AM,2024-04-23T01:00:00.000Z,4-9-24 11:11 AM,2024-04-09T11:11:00.000Z,4,4,,SD,CLOSE,Y,,NO,CHATHAM
23-51677,TSH-84202 DRYER D OVER TEMP HI CAL. DR04 ISO 14001,TSH-84202,TSH-84202,5551,,,11-27-23 1:48 AM,2023-11-27T01:48:00.000Z,4-23-24 1:00 AM,2024-04-23T01:00:00.000Z,4-9-24 11:11 AM,2024-04-09T11:11:00.000Z,4,4,,SD,CLOSE,Y,N,NO,CHATHAM
23-51676,DRAG CONVEYOR  P.M.,CV-2108,CV-2108,1435,,,11-27-23 1:48 AM,2023-11-27T01:48:00.000Z,4-23-24 1:30 AM,2024-04-23T01:30:00.000Z,5-22-24 8:18 AM,2024-05-22T08:18:00.000Z,4,4,,SD,CLOSE,Y,,NO,CHATHAM
23-51675,CV-2108 - MECHANICAL PM,CV-2108,CV-2108,1435,,,11-27-23 1:48 AM,2023-11-27T01:48:00.000Z,4-23-24 1:30 AM,2024-04-23T01:30:00.000Z,5-22-24 8:18 AM,2024-05-22T08:18:00.000Z,4,4,,SD,CLOSE,Y,N,NO,CHATHAM
23-51674,DRAG CONVEYOR  P.M.,CV-2106,CV-2106,1432,,,11-27-23 1:48 AM,2023-11-27T01:48:00.000Z,12-20-23 1:30 AM,2023-12-20T01:30:00.000Z,12-21-23 6:47 AM,2023-12-21T06:47:00.000Z,4,4,,PM,CLOSE,Y,,NO,CHATHAM
23-51673,CV-2106 & CV-2107A- MECHANICAL PM,CV-2106,CV-2106,1432,,,11-27-23 1:48 AM,2023-11-27T01:48:00.000Z,12-20-23 1:30 AM,2023-12-20T01:30:00.000Z,12-20-23 3:00 AM,2023-12-20T03:00:00.000Z,4,4,,PM,CLOSE,Y,N,NO,CHATHAM
23-51672,DRAG CONVEYOR  P.M.,CV-2101,CV-2101,,,,11-27-23 1:48 AM,2023-11-27T01:48:00.000Z,4-23-24 1:30 AM,2024-04-23T01:30:00.000Z,5-16-24 10:00 AM,2024-05-16T10:00:00.000Z,4,4,,SD,CLOSE,Y,,NO,CHATHAM
23-51671,CV-2101 - MECHANICAL PM,CV-2101,CV-2101,,,,11-27-23 1:48 AM,2023-11-27T01:48:00.000Z,4-23-24 1:30 AM,2024-04-23T01:30:00.000Z,5-16-24 10:00 AM,2024-05-16T10:00:00.000Z,4,4,,SD,CLOSE,Y,N,NO,CHATHAM
23-51670,WEARCHECK OIL SAMPLING TASK ( FOR ANALYSIS),P-1511B,P-1511B,1069,,,11-27-23 1:48 AM,2023-11-27T01:48:00.000Z,1-22-24 12:00 AM,2024-01-22T00:00:00.000Z,1-22-24 11:33 AM,2024-01-22T11:33:00.000Z,4,4,,PM,CLOSE,Y,,NO,CHATHAM
23-51669,P-1511B - OIL SAMPLE,P-1511B,P-1511B,1069,,,11-27-23 1:48 AM,2023-11-27T01:48:00.000Z,1-22-24 12:30 AM,2024-01-22T00:30:00.000Z,1-22-24 12:30 AM,2024-01-22T00:30:00.000Z,4,4,,PM,CLOSE,Y,N,NO,CHATHAM
23-51668,SC-1301 MECHANICAL CHECKS,SC-1301,SC-1301,4868,,,11-27-23 1:48 AM,2023-11-27T01:48:00.000Z,12-25-23 1:00 AM,2023-12-25T01:00:00.000Z,1-10-24 7:26 AM,2024-01-10T07:26:00.000Z,4,4,,PM,CLOSE,Y,,NO,CHATHAM
23-51667,SC-1301 - MECHANICAL CHECKS,SC-1301,SC-1301,4868,,,11-27-23 1:48 AM,2023-11-27T01:48:00.000Z,12-25-23 1:00 AM,2023-12-25T01:00:00.000Z,1-9-24 1:00 AM,2024-01-09T01:00:00.000Z,4,4,,PM,CLOSE,Y,N,NO,CHATHAM
23-51666,SC-1301 WEIGH BELT FEEDER MECHANICAL PM,SC-1301,SC-1301,4868,,,11-27-23 1:48 AM,2023-11-27T01:48:00.000Z,4-23-24 2:00 AM,2024-04-23T02:00:00.000Z,6-3-24 8:47 AM,2024-06-03T08:47:00.000Z,4,4,,SD,CLOSE,Y,,NO,CHATHAM
23-51665,SC-1301 - MECHANICAL PM,SC-1301,SC-1301,4868,,,11-27-23 1:48 AM,2023-11-27T01:48:00.000Z,5-31-24 2:00 AM,2024-05-31T02:00:00.000Z,6-3-24 8:47 AM,2024-06-03T08:47:00.000Z,4,4,,CO,CLOSE,Y,N,NO,CHATHAM
23-51664,TEMPERATURE ELEMENT MONTHLY CLEANING,TT-84302,TT-84302,5835,,,11-27-23 1:48 AM,2023-11-27T01:48:00.000Z,4-23-24 12:30 AM,2024-04-23T00:30:00.000Z,4-9-24 11:12 AM,2024-04-09T11:12:00.000Z,4,4,,SD,CLOSE,Y,,NO,CHATHAM
23-51663,TT-84302 ELEMENT CLEANING - DR04 ISO 14001,TT-84302,TT-84302,5835,,,11-27-23 1:48 AM,2023-11-27T01:48:00.000Z,4-23-24 12:30 AM,2024-04-23T00:30:00.000Z,4-9-24 11:12 AM,2024-04-09T11:12:00.000Z,4,4,,SD,CLOSE,Y,N,NO,CHATHAM
23-51662,ACCULOAD SCULLY CABLE BI-WEEKLY PM,FQIC-2203,FQIC-2203,7138,,,11-27-23 1:48 AM,2023-11-27T01:48:00.000Z,12-22-23 12:30 AM,2023-12-22T00:30:00.000Z,12-22-23 7:41 AM,2023-12-22T07:41:00.000Z,4,4,,PM,CLOSE,Y,,NO,CHATHAM
23-51661,ACCULOAD SCULLY CABLE -PM SERVICE,FQIC-2203,FQIC-2203,7138,,,11-27-23 1:48 AM,2023-11-27T01:48:00.000Z,12-22-23 12:30 AM,2023-12-22T00:30:00.000Z,12-22-23 12:30 AM,2023-12-22T00:30:00.000Z,4,4,,PM,CLOSE,Y,N,NO,CHATHAM
23-51660,ROTARY VALVE DRIVE INSPECTION,RV-1203,RV-1203,6721,,,11-27-23 1:48 AM,2023-11-27T01:48:00.000Z,4-23-24 12:30 AM,2024-04-23T00:30:00.000Z,6-21-24 11:09 AM,2024-06-21T11:09:00.000Z,4,4,,SD,CLOSE,Y,,NO,CHATHAM
23-51659,RV-1203 - MECHANICAL PM,RV-1203,RV-1203,6721,,,11-27-23 1:48 AM,2023-11-27T01:48:00.000Z,4-23-24 1:30 AM,2024-04-23T01:30:00.000Z,6-21-24 11:09 AM,2024-06-21T11:09:00.000Z,4,4,,SD,CLOSE,Y,N,NO,CHATHAM
23-51658,ROTARY VALVE,RV-1201A,RV-1201A,4851,,,11-27-23 1:48 AM,2023-11-27T01:48:00.000Z,4-23-24 2:00 AM,2024-04-23T02:00:00.000Z,6-21-24 8:59 AM,2024-06-21T08:59:00.000Z,4,4,,SD,CLOSE,Y,,NO,CHATHAM
23-51657,RV-1201A - ROTARY VALVE PM,RV-1201A,RV-1201A,4851,,,11-27-23 1:48 AM,2023-11-27T01:48:00.000Z,4-23-24 2:00 AM,2024-04-23T02:00:00.000Z,6-21-24 8:59 AM,2024-06-21T08:59:00.000Z,4,4,,SD,CLOSE,Y,N,NO,CHATHAM
23-51656,CHECK THE IMPROSEALS FOR OIL LEAKAGE,P-1522B,P-1522B,1059,,,11-27-23 1:48 AM,2023-11-27T01:48:00.000Z,4-23-24 12:15 AM,2024-04-23T00:15:00.000Z,8-21-24 9:16 AM,2024-08-21T09:16:00.000Z,4,4,,SD,CLOSE,Y,,NO,CHATHAM
23-51655,REMOVE COUPLING GUARD AND INSPECT OMEGA ELEMENT,P-1522B,P-1522B,1059,,,11-27-23 1:48 AM,2023-11-27T01:48:00.000Z,4-23-24 12:15 AM,2024-04-23T00:15:00.000Z,8-21-24 9:16 AM,2024-08-21T09:16:00.000Z,4,4,,SD,CLOSE,Y,,NO,CHATHAM
23-51654,OIL CHANGE ON GOULDS PUMPS,P-1522B,P-1522B,1059,,,11-27-23 1:48 AM,2023-11-27T01:48:00.000Z,4-23-24 12:30 AM,2024-04-23T00:30:00.000Z,8-21-24 9:16 AM,2024-08-21T09:16:00.000Z,4,4,,SD,CLOSE,Y,,NO,CHATHAM
23-51653,P-1522B - OIL CHANGE/ PM SERVICE,P-1522B,P-1522B,1059,,,11-27-23 1:48 AM,2023-11-27T01:48:00.000Z,4-23-24 1:00 AM,2024-04-23T01:00:00.000Z,8-21-24 12:16 PM,2024-08-21T12:16:00.000Z,4,4,,PM,CLOSE,Y,N,NO,CHATHAM
23-51652,CHECK THE IMPROSEALS FOR OIL LEAKAGE,P-1522A,P-1522A,1058,,,11-27-23 1:48 AM,2023-11-27T01:48:00.000Z,4-23-24 12:15 AM,2024-04-23T00:15:00.000Z,1-6-25 11:08 AM,2025-01-06T11:08:00.000Z,4,4,,SD,CLOSE,Y,,NO,CHATHAM
23-51651,REMOVE COUPLING GUARD AND INSPECT OMEGA ELEMENT,P-1522A,P-1522A,1058,,,11-27-23 1:48 AM,2023-11-27T01:48:00.000Z,4-23-24 12:15 AM,2024-04-23T00:15:00.000Z,1-6-25 11:08 AM,2025-01-06T11:08:00.000Z,4,4,,SD,CLOSE,Y,,NO,CHATHAM
23-51650,OIL CHANGE ON GOULDS PUMPS,P-1522A,P-1522A,1058,,,11-27-23 1:48 AM,2023-11-27T01:48:00.000Z,4-23-24 12:30 AM,2024-04-23T00:30:00.000Z,1-6-25 11:08 AM,2025-01-06T11:08:00.000Z,4,4,,SD,CLOSE,Y,,NO,CHATHAM
23-51649,P-1522A - OIL CHANGE/ PM SERVICE,P-1522A,P-1522A,1058,,,11-27-23 1:48 AM,2023-11-27T01:48:00.000Z,4-23-24 1:00 AM,2024-04-23T01:00:00.000Z,1-6-25 11:08 AM,2025-01-06T11:08:00.000Z,4,4,,SD,CLOSE,Y,N,NO,CHATHAM
23-51648,CHECK THE IMPROSEALS FOR OIL LEAKAGE,P-1421,P-1421,1040,,,11-27-23 1:48 AM,2023-11-27T01:48:00.000Z,4-23-24 12:15 AM,2024-04-23T00:15:00.000Z,5-22-24 8:44 AM,2024-05-22T08:44:00.000Z,4,4,,SD,CLOSE,Y,,NO,CHATHAM
23-51647,REMOVE COUPLING GUARD AND INSPECT OMEGA ELEMENT,P-1421,P-1421,1040,,,11-27-23 1:48 AM,2023-11-27T01:48:00.000Z,4-23-24 12:15 AM,2024-04-23T00:15:00.000Z,5-22-24 8:44 AM,2024-05-22T08:44:00.000Z,4,4,,SD,CLOSE,Y,,NO,CHATHAM
23-51646,OIL CHANGE ON GOULDS PUMPS,P-1421,P-1421,1040,,,11-27-23 1:48 AM,2023-11-27T01:48:00.000Z,4-23-24 12:30 AM,2024-04-23T00:30:00.000Z,5-22-24 8:44 AM,2024-05-22T08:44:00.000Z,4,4,,SD,CLOSE,Y,,NO,CHATHAM
23-51645,P-1421A - OIL CHANGE/ PM SERVICE,P-1421,P-1421,1040,,,11-27-23 1:48 AM,2023-11-27T01:48:00.000Z,4-23-24 1:00 AM,2024-04-23T01:00:00.000Z,5-22-24 8:44 AM,2024-05-22T08:44:00.000Z,4,4,,SD,CLOSE,Y,N,NO,CHATHAM
23-51644,CHECK THE IMPROSEALS FOR OIL LEAKAGE,P-1405B,P-1405B,1037,,,11-27-23 1:48 AM,2023-11-27T01:48:00.000Z,4-23-24 12:15 AM,2024-04-23T00:15:00.000Z,5-27-24 11:43 AM,2024-05-27T11:43:00.000Z,4,4,,SD,CLOSE,Y,,NO,CHATHAM
23-51643,REMOVE COUPLING GUARD AND INSPECT OMEGA ELEMENT,P-1405B,P-1405B,1037,,,11-27-23 1:48 AM,2023-11-27T01:48:00.000Z,4-23-24 12:15 AM,2024-04-23T00:15:00.000Z,5-27-24 11:43 AM,2024-05-27T11:43:00.000Z,4,4,,SD,CLOSE,Y,,NO,CHATHAM
23-51642,OIL CHANGE ON GOULDS PUMPS,P-1405B,P-1405B,1037,,,11-27-23 1:48 AM,2023-11-27T01:48:00.000Z,4-23-24 12:30 AM,2024-04-23T00:30:00.000Z,5-27-24 11:43 AM,2024-05-27T11:43:00.000Z,4,4,,SD,CLOSE,Y,,NO,CHATHAM
23-51641,P-1405B - OIL CHANGE/ PM SERVICE,P-1405B,P-1405B,1037,,,11-27-23 1:47 AM,2023-11-27T01:47:00.000Z,4-23-24 1:00 AM,2024-04-23T01:00:00.000Z,5-27-24 11:43 AM,2024-05-27T11:43:00.000Z,4,4,,SD,CLOSE,Y,N,NO,CHATHAM
23-51640,CHECK THE IMPROSEALS FOR OIL LEAKAGE,P-1405A,P-1405A,1038,,,11-27-23 1:47 AM,2023-11-27T01:47:00.000Z,4-23-24 12:15 AM,2024-04-23T00:15:00.000Z,9-9-24 7:58 AM,2024-09-09T07:58:00.000Z,4,4,,SD,CLOSE,Y,,NO,CHATHAM
23-51639,REMOVE COUPLING GUARD AND INSPECT OMEGA ELEMENT,P-1405A,P-1405A,1038,,,11-27-23 1:47 AM,2023-11-27T01:47:00.000Z,4-23-24 12:15 AM,2024-04-23T00:15:00.000Z,9-9-24 7:58 AM,2024-09-09T07:58:00.000Z,4,4,,SD,CLOSE,Y,,NO,CHATHAM
23-51638,OIL CHANGE ON GOULDS PUMPS,P-1405A,P-1405A,1038,,,11-27-23 1:47 AM,2023-11-27T01:47:00.000Z,4-23-24 12:30 AM,2024-04-23T00:30:00.000Z,9-9-24 7:58 AM,2024-09-09T07:58:00.000Z,4,4,,SD,CLOSE,Y,,NO,CHATHAM
23-51637,P-1405A - OIL CHANGE/ PM SERVICE,P-1405A,P-1405A,1038,,,11-27-23 1:47 AM,2023-11-27T01:47:00.000Z,4-23-24 1:00 AM,2024-04-23T01:00:00.000Z,9-9-24 7:58 AM,2024-09-09T07:58:00.000Z,4,4,,PM,CLOSE,Y,N,NO,CHATHAM
23-51636,CHECK THE IMPROSEALS FOR OIL LEAKAGE,P-1404,P-1404,1039,,,11-27-23 1:47 AM,2023-11-27T01:47:00.000Z,4-23-24 12:15 AM,2024-04-23T00:15:00.000Z,6-5-25 7:45 PM,2025-06-05T19:45:00.000Z,4,4,,SD,CLOSE,Y,,NO,CHATHAM
23-51635,REMOVE COUPLING GUARD AND INSPECT OMEGA ELEMENT,P-1404,P-1404,1039,,,11-27-23 1:47 AM,2023-11-27T01:47:00.000Z,4-23-24 12:15 AM,2024-04-23T00:15:00.000Z,6-5-25 7:45 PM,2025-06-05T19:45:00.000Z,4,4,,SD,CLOSE,Y,,NO,CHATHAM
23-51634,OIL CHANGE ON GOULDS PUMPS,P-1404,P-1404,1039,,,11-27-23 1:47 AM,2023-11-27T01:47:00.000Z,4-23-24 12:30 AM,2024-04-23T00:30:00.000Z,6-5-25 7:45 PM,2025-06-05T19:45:00.000Z,4,4,,SD,CLOSE,Y,,NO,CHATHAM
23-51633,TA24 Fall P-1404A - OIL CHANGE/ PM SERVICE,P-1404,P-1404,1039,,CONNER.LOVELL,11-27-23 1:47 AM,2023-11-27T01:47:00.000Z,5-31-24 1:00 AM,2024-05-31T01:00:00.000Z,6-5-25 7:45 PM,2025-06-05T19:45:00.000Z,4,4,,SD,CLOSE,Y,N,NO,CHATHAM
23-51632,CHECK THE IMPROSEALS FOR OIL LEAKAGE,P-1403,P-1403,1036,,,11-27-23 1:47 AM,2023-11-27T01:47:00.000Z,4-23-24 12:15 AM,2024-04-23T00:15:00.000Z,5-27-24 11:42 AM,2024-05-27T11:42:00.000Z,4,4,,SD,CLOSE,Y,,NO,CHATHAM
23-51631,REMOVE COUPLING GUARD AND INSPECT OMEGA ELEMENT,P-1403,P-1403,1036,,,11-27-23 1:47 AM,2023-11-27T01:47:00.000Z,4-23-24 12:15 AM,2024-04-23T00:15:00.000Z,5-27-24 11:42 AM,2024-05-27T11:42:00.000Z,4,4,,SD,CLOSE,Y,,NO,CHATHAM
23-51630,OIL CHANGE ON GOULDS PUMPS,P-1403,P-1403,1036,,,11-27-23 1:47 AM,2023-11-27T01:47:00.000Z,4-23-24 12:30 AM,2024-04-23T00:30:00.000Z,5-27-24 11:42 AM,2024-05-27T11:42:00.000Z,4,4,,SD,CLOSE,Y,,NO,CHATHAM
23-51629,P-1403A - OIL CHANGE/ PM SERVICE,P-1403,P-1403,1036,,,11-27-23 1:47 AM,2023-11-27T01:47:00.000Z,5-31-24 1:00 AM,2024-05-31T01:00:00.000Z,5-27-24 11:42 AM,2024-05-27T11:42:00.000Z,4,4,,SD,CLOSE,Y,N,NO,CHATHAM
23-51628,CHECK THE IMPROSEALS FOR OIL LEAKAGE,P-1402,P-1402,1034,,,11-27-23 1:47 AM,2023-11-27T01:47:00.000Z,4-23-24 12:15 AM,2024-04-23T00:15:00.000Z,5-27-24 11:41 AM,2024-05-27T11:41:00.000Z,4,4,,SD,CLOSE,Y,,NO,CHATHAM
23-51627,REMOVE COUPLING GUARD AND INSPECT OMEGA ELEMENT,P-1402,P-1402,1034,,,11-27-23 1:47 AM,2023-11-27T01:47:00.000Z,4-23-24 12:15 AM,2024-04-23T00:15:00.000Z,5-27-24 11:41 AM,2024-05-27T11:41:00.000Z,4,4,,SD,CLOSE,Y,,NO,CHATHAM
23-51626,OIL CHANGE ON GOULDS PUMPS,P-1402,P-1402,1034,,,11-27-23 1:47 AM,2023-11-27T01:47:00.000Z,4-23-24 12:30 AM,2024-04-23T00:30:00.000Z,5-27-24 11:41 AM,2024-05-27T11:41:00.000Z,4,4,,SD,CLOSE,Y,,NO,CHATHAM
23-51625,P-1402A - OIL CHANGE/ PM SERVICE,P-1402,P-1402,1034,,,11-27-23 1:47 AM,2023-11-27T01:47:00.000Z,5-31-24 1:00 AM,2024-05-31T01:00:00.000Z,5-27-24 11:41 AM,2024-05-27T11:41:00.000Z,4,4,,SD,CLOSE,Y,N,NO,CHATHAM
23-51624,CHECK THE IMPROSEALS FOR OIL LEAKAGE,P-1401,P-1401,1033,,,11-27-23 1:47 AM,2023-11-27T01:47:00.000Z,4-23-24 12:15 AM,2024-04-23T00:15:00.000Z,5-22-24 8:43 AM,2024-05-22T08:43:00.000Z,4,4,,SD,CLOSE,Y,,NO,CHATHAM
23-51623,REMOVE COUPLING GUARD AND INSPECT OMEGA ELEMENT,P-1401,P-1401,1033,,,11-27-23 1:47 AM,2023-11-27T01:47:00.000Z,4-23-24 12:15 AM,2024-04-23T00:15:00.000Z,5-22-24 8:43 AM,2024-05-22T08:43:00.000Z,4,4,,SD,CLOSE,Y,,NO,CHATHAM
23-51622,OIL CHANGE ON GOULDS PUMPS,P-1401,P-1401,1033,,,11-27-23 1:47 AM,2023-11-27T01:47:00.000Z,4-23-24 12:30 AM,2024-04-23T00:30:00.000Z,5-22-24 8:43 AM,2024-05-22T08:43:00.000Z,4,4,,SD,CLOSE,Y,,NO,CHATHAM
23-51621,P-1401A - OIL CHANGE/ PM SERVICE,P-1401,P-1401,1033,,,11-27-23 1:47 AM,2023-11-27T01:47:00.000Z,4-23-24 1:00 AM,2024-04-23T01:00:00.000Z,5-22-24 8:43 AM,2024-05-22T08:43:00.000Z,4,4,,SD,CLOSE,Y,N,NO,CHATHAM
23-51620,CHECK THE IMPROSEALS FOR OIL LEAKAGE,P-1400A,P-1400A,1019,,,11-27-23 1:47 AM,2023-11-27T01:47:00.000Z,4-23-24 12:15 AM,2024-04-23T00:15:00.000Z,4-19-24 8:33 AM,2024-04-19T08:33:00.000Z,4,4,,SD,CLOSE,Y,,NO,CHATHAM
23-51619,REMOVE COUPLING GUARD AND INSPECT OMEGA ELEMENT,P-1400A,P-1400A,1019,,,11-27-23 1:47 AM,2023-11-27T01:47:00.000Z,4-23-24 12:15 AM,2024-04-23T00:15:00.000Z,4-19-24 8:33 AM,2024-04-19T08:33:00.000Z,4,4,,SD,CLOSE,Y,,NO,CHATHAM
23-51618,OIL CHANGE ON GOULDS PUMPS,P-1400A,P-1400A,1019,,,11-27-23 1:47 AM,2023-11-27T01:47:00.000Z,4-23-24 12:30 AM,2024-04-23T00:30:00.000Z,4-19-24 8:33 AM,2024-04-19T08:33:00.000Z,4,4,,SD,CLOSE,Y,,NO,CHATHAM
23-51617,P-1400A - OIL CHANGE/ PM SERVICE,P-1400A,P-1400A,1019,,,11-27-23 1:47 AM,2023-11-27T01:47:00.000Z,5-31-24 1:00 AM,2024-05-31T01:00:00.000Z,4-18-24 12:30 AM,2024-04-18T00:30:00.000Z,4,4,,CO,CLOSE,Y,N,NO,CHATHAM
23-51616,MILTON ROY 24 WEEK PM,P-1310A,P-1310A,3583,,,11-27-23 1:47 AM,2023-11-27T01:47:00.000Z,4-23-24 12:00 AM,2024-04-23T00:00:00.000Z,5-22-24 8:39 AM,2024-05-22T08:39:00.000Z,4,4,,SD,CLOSE,Y,,NO,CHATHAM
23-51615,MILTON ROY 8 WEEK PM,P-1310A,P-1310A,3583,,,11-27-23 1:47 AM,2023-11-27T01:47:00.000Z,4-23-24 12:00 AM,2024-04-23T00:00:00.000Z,5-22-24 8:39 AM,2024-05-22T08:39:00.000Z,4,4,,SD,CLOSE,Y,,NO,CHATHAM
23-51614,P-1310A - ROUTINE PUMP PM SERVICE FE02,P-1310A,P-1310A,3583,,,11-27-23 1:47 AM,2023-11-27T01:47:00.000Z,4-23-24 1:00 AM,2024-04-23T01:00:00.000Z,5-22-24 8:39 AM,2024-05-22T08:39:00.000Z,4,4,,SD,CLOSE,Y,N,NO,CHATHAM
23-51613,MILTON ROY 24 WEEK PM,P-1309,P-1309,3582,,,11-27-23 1:47 AM,2023-11-27T01:47:00.000Z,4-23-24 12:00 AM,2024-04-23T00:00:00.000Z,5-22-24 8:39 AM,2024-05-22T08:39:00.000Z,4,4,,SD,CLOSE,Y,,NO,CHATHAM
23-51612,MILTON ROY 8 WEEK PM,P-1309,P-1309,3582,,,11-27-23 1:47 AM,2023-11-27T01:47:00.000Z,4-23-24 12:00 AM,2024-04-23T00:00:00.000Z,5-22-24 8:39 AM,2024-05-22T08:39:00.000Z,4,4,,SD,CLOSE,Y,,NO,CHATHAM
23-51611,P-1309A ROUTINE PUMP PM SERVICE FE02,P-1309,P-1309,3582,,,11-27-23 1:47 AM,2023-11-27T01:47:00.000Z,4-23-24 1:00 AM,2024-04-23T01:00:00.000Z,5-22-24 8:39 AM,2024-05-22T08:39:00.000Z,4,4,,SD,CLOSE,Y,N,NO,CHATHAM
23-51610,MILTON ROY 24 WEEK PM,P-1308,P-1308,3581,,,11-27-23 1:47 AM,2023-11-27T01:47:00.000Z,4-23-24 12:00 AM,2024-04-23T00:00:00.000Z,5-22-24 8:38 AM,2024-05-22T08:38:00.000Z,4,4,,SD,CLOSE,Y,,NO,CHATHAM
23-51609,MILTON ROY 8 WEEK PM,P-1308,P-1308,3581,,,11-27-23 1:47 AM,2023-11-27T01:47:00.000Z,4-23-24 12:00 AM,2024-04-23T00:00:00.000Z,5-22-24 8:38 AM,2024-05-22T08:38:00.000Z,4,4,,SD,CLOSE,Y,,NO,CHATHAM
23-51608,P-1308A - MILROY PUMP ROUTINE PM SERVICE FE02,P-1308,P-1308,3581,,,11-27-23 1:47 AM,2023-11-27T01:47:00.000Z,4-23-24 1:00 AM,2024-04-23T01:00:00.000Z,5-22-24 8:38 AM,2024-05-22T08:38:00.000Z,4,4,,SD,CLOSE,Y,N,NO,CHATHAM
23-51607,CHECK THE IMPROSEALS FOR OIL LEAKAGE,P-1307A,P-1307A,1007,,,11-27-23 1:47 AM,2023-11-27T01:47:00.000Z,4-23-24 12:15 AM,2024-04-23T00:15:00.000Z,11-4-24 1:31 PM,2024-11-04T13:31:00.000Z,4,4,,SD,CLOSE,Y,,NO,CHATHAM
23-51606,REMOVE COUPLING GUARD AND INSPECT OMEGA ELEMENT,P-1307A,P-1307A,1007,,,11-27-23 1:47 AM,2023-11-27T01:47:00.000Z,4-23-24 12:15 AM,2024-04-23T00:15:00.000Z,11-4-24 1:31 PM,2024-11-04T13:31:00.000Z,4,4,,SD,CLOSE,Y,,NO,CHATHAM
23-51605,OIL CHANGE ON GOULDS PUMPS,P-1307A,P-1307A,1007,,,11-27-23 1:47 AM,2023-11-27T01:47:00.000Z,4-23-24 12:30 AM,2024-04-23T00:30:00.000Z,11-4-24 1:31 PM,2024-11-04T13:31:00.000Z,4,4,,SD,CLOSE,Y,,NO,CHATHAM
23-51604,P-1307A - OIL CHANGE/ PM SERVICE,P-1307A,P-1307A,1007,,,11-27-23 1:47 AM,2023-11-27T01:47:00.000Z,4-23-24 1:00 AM,2024-04-23T01:00:00.000Z,11-4-24 1:31 PM,2024-11-04T13:31:00.000Z,4,4,,SD,CLOSE,Y,N,NO,CHATHAM
23-51603,CHECK THE IMPROSEALS FOR OIL LEAKAGE,P-1306,P-1306,1014,,,11-27-23 1:47 AM,2023-11-27T01:47:00.000Z,4-23-24 12:15 AM,2024-04-23T00:15:00.000Z,5-27-24 11:43 AM,2024-05-27T11:43:00.000Z,4,4,,SD,CLOSE,Y,,NO,CHATHAM
23-51602,REMOVE COUPLING GUARD AND INSPECT OMEGA ELEMENT,P-1306,P-1306,1014,,,11-27-23 1:47 AM,2023-11-27T01:47:00.000Z,4-23-24 12:15 AM,2024-04-23T00:15:00.000Z,5-27-24 11:43 AM,2024-05-27T11:43:00.000Z,4,4,,SD,CLOSE,Y,,NO,CHATHAM
23-51601,OIL CHANGE ON GOULDS PUMPS,P-1306,P-1306,1014,,,11-27-23 1:47 AM,2023-11-27T01:47:00.000Z,4-23-24 12:30 AM,2024-04-23T00:30:00.000Z,5-27-24 11:43 AM,2024-05-27T11:43:00.000Z,4,4,,SD,CLOSE,Y,,NO,CHATHAM
23-51600,P-1306A - OIL CHANGE/ PM SERVICE,P-1306,P-1306,1014,,,11-27-23 1:47 AM,2023-11-27T01:47:00.000Z,4-23-24 1:00 AM,2024-04-23T01:00:00.000Z,5-27-24 11:43 AM,2024-05-27T11:43:00.000Z,4,4,,SD,CLOSE,Y,N,NO,CHATHAM
23-51599,REPLACE OIL FILTERS,ME-3601,ME-3601,3393,,,11-27-23 1:47 AM,2023-11-27T01:47:00.000Z,4-23-24 2:00 AM,2024-04-23T02:00:00.000Z,4-9-24 11:32 AM,2024-04-09T11:32:00.000Z,4,4,,SD,CLOSE,Y,,NO,CHATHAM
23-51598,OIL FILTER CHANGE (ALL) - (ME-3601) - PM SERVICE,ME-3601,ME-3601,3393,,,11-27-23 1:47 AM,2023-11-27T01:47:00.000Z,4-23-24 2:00 AM,2024-04-23T02:00:00.000Z,4-9-24 11:32 AM,2024-04-09T11:32:00.000Z,4,4,,SD,CLOSE,Y,N,NO,CHATHAM
23-51597,(POST) REMOVE SCAFF ON NORTH END,EV-1630,EV-1630,1649,,,11-27-23 1:47 AM,2023-11-27T01:47:00.000Z,4-23-24 1:30 AM,2024-04-23T01:30:00.000Z,2-7-24 12:32 PM,2024-02-07T12:32:00.000Z,4,4,,SD,CLOSE,Y,,NO,CHATHAM
23-51596,(POST) REMOVE SCAFF ON SOUTH END,EV-1630,EV-1630,1649,,,11-27-23 1:47 AM,2023-11-27T01:47:00.000Z,4-23-24 3:30 AM,2024-04-23T03:30:00.000Z,2-7-24 12:32 PM,2024-02-07T12:32:00.000Z,4,4,,SD,CLOSE,Y,,NO,CHATHAM
23-51595,"INSTALL HEADS ON EXCHANGER, REPLACE END GASKETS",EV-1630,EV-1630,1649,,,11-27-23 1:47 AM,2023-11-27T01:47:00.000Z,4-23-24 6:00 AM,2024-04-23T06:00:00.000Z,2-7-24 12:32 PM,2024-02-07T12:32:00.000Z,4,4,,SD,CLOSE,Y,,NO,CHATHAM
23-51594,CRANE TO ASSIST IN LIFT/RE-INSTALL,EV-1630,EV-1630,1649,,,11-27-23 1:47 AM,2023-11-27T01:47:00.000Z,4-23-24 2:00 AM,2024-04-23T02:00:00.000Z,2-7-24 12:32 PM,2024-02-07T12:32:00.000Z,4,4,,SD,CLOSE,Y,,NO,CHATHAM
23-51593,OPS TO INSPECT FOR CLEANLINESS,EV-1630,EV-1630,1649,,,11-27-23 1:47 AM,2023-11-27T01:47:00.000Z,4-23-24 1:00 AM,2024-04-23T01:00:00.000Z,2-7-24 12:32 PM,2024-02-07T12:32:00.000Z,4,4,,SD,CLOSE,Y,,NO,CHATHAM
23-51592,EV-1630 FINISH EVAPORATOR  HIGH PRESSURE WASH,EV-1630,EV-1630,1649,,,11-27-23 1:47 AM,2023-11-27T01:47:00.000Z,4-24-24 9:00 PM,2024-04-24T21:00:00.000Z,2-7-24 12:32 PM,2024-02-07T12:32:00.000Z,4,4,,SD,CLOSE,Y,,NO,CHATHAM
23-51591,CRANE TO SUPPORT,EV-1630,EV-1630,1649,,,11-27-23 1:46 AM,2023-11-27T01:46:00.000Z,4-23-24 1:00 AM,2024-04-23T01:00:00.000Z,2-7-24 12:32 PM,2024-02-07T12:32:00.000Z,4,4,,SD,CLOSE,Y,,NO,CHATHAM
23-51590,"UNBOLT, RIG & REMOVE BOTH END PLATES FROM THE EXCHANGER",EV-1630,EV-1630,1649,,,11-27-23 1:46 AM,2023-11-27T01:46:00.000Z,4-23-24 6:00 AM,2024-04-23T06:00:00.000Z,2-7-24 12:32 PM,2024-02-07T12:32:00.000Z,4,4,,SD,CLOSE,Y,,NO,CHATHAM
23-51589,(PRE) BUILD SCAFF ON NORTH END,EV-1630,EV-1630,1649,,,11-27-23 1:46 AM,2023-11-27T01:46:00.000Z,4-23-24 2:00 AM,2024-04-23T02:00:00.000Z,2-7-24 12:32 PM,2024-02-07T12:32:00.000Z,4,4,,SD,CLOSE,Y,,NO,CHATHAM
23-51588,(PRE) BUILD SCAFF ON SOUTH END,EV-1630,EV-1630,1649,,,11-27-23 1:46 AM,2023-11-27T01:46:00.000Z,4-23-24 4:00 AM,2024-04-23T04:00:00.000Z,2-7-24 12:32 PM,2024-02-07T12:32:00.000Z,4,4,,SD,CLOSE,Y,,NO,CHATHAM
23-51587,EV-1630 HPW WATER CLEANING- PM SERVICE,EV-1630,EV-1630,1649,,,11-27-23 1:46 AM,2023-11-27T01:46:00.000Z,4-23-24 6:00 PM,2024-04-23T18:00:00.000Z,2-7-24 12:32 PM,2024-02-07T12:32:00.000Z,4,4,,SD,CLOSE,Y,N,NO,CHATHAM
23-51586,EJ-1630 THERMOCOMPRESSOR INSPECTION & CLEAN,EJ-1630,EJ-1630,1639,,,11-27-23 1:46 AM,2023-11-27T01:46:00.000Z,4-23-24 12:00 AM,2024-04-23T00:00:00.000Z,1-19-25 9:46 PM,2025-01-19T21:46:00.000Z,4,4,,SD,CLOSE,Y,,NO,CHATHAM
23-51585,EJ-1630 THERMOCOMPRESSOR INPECTION & CLEANING,EJ-1630,EJ-1630,1639,,,11-27-23 1:46 AM,2023-11-27T01:46:00.000Z,10-31-24 6:00 AM,2024-10-31T06:00:00.000Z,1-19-25 9:46 PM,2025-01-19T21:46:00.000Z,4,4,,SD,CLOSE,Y,N,NO,CHATHAM
23-51584,Replace hydroheater,EJ-1302,EJ-1302,,,,11-27-23 1:46 AM,2023-11-27T01:46:00.000Z,4-19-24 12:00 AM,2024-04-19T00:00:00.000Z,1-22-24 7:09 AM,2024-01-22T07:09:00.000Z,4,4,,SD,CLOSE,Y,,NO,CHATHAM
23-51583,EJ-1302 HYDROHEATER REPLACEMENT - FE02,EJ-1302,EJ-1302,,,,11-27-23 1:46 AM,2023-11-27T01:46:00.000Z,1-31-24 2:00 AM,2024-01-31T02:00:00.000Z,1-18-24 2:00 AM,2024-01-18T02:00:00.000Z,4,4,,CO,CLOSE,Y,N,NO,CHATHAM
23-51582,DRAG CONVEYOR  P.M.,CV-1301,CV-1301,1405,,,11-27-23 1:46 AM,2023-11-27T01:46:00.000Z,4-23-24 1:30 AM,2024-04-23T01:30:00.000Z,5-22-24 8:13 AM,2024-05-22T08:13:00.000Z,4,4,,SD,CLOSE,Y,,NO,CHATHAM
23-51581,CV-1301 MECHANICAL PM,CV-1301,CV-1301,1405,,,11-27-23 1:46 AM,2023-11-27T01:46:00.000Z,4-23-24 1:30 AM,2024-04-23T01:30:00.000Z,5-22-24 8:13 AM,2024-05-22T08:13:00.000Z,4,4,,SD,CLOSE,Y,N,NO,CHATHAM
23-51580,SCREW CONVEYOR PM,CV-1201,CV-1201,1402,,,11-27-23 1:46 AM,2023-11-27T01:46:00.000Z,4-23-24 12:00 AM,2024-04-23T00:00:00.000Z,5-22-24 8:12 AM,2024-05-22T08:12:00.000Z,4,4,,SD,CLOSE,Y,,NO,CHATHAM
23-51579,CV-1201 MECHANICAL PM,CV-1201,CV-1201,1402,,,11-27-23 1:46 AM,2023-11-27T01:46:00.000Z,4-23-24 2:00 AM,2024-04-23T02:00:00.000Z,5-22-24 8:12 AM,2024-05-22T08:12:00.000Z,4,4,,SD,CLOSE,Y,N,NO,CHATHAM
23-51578,SE-2101 ROTEX SHAKER SCREEN P.M.,SE-2101,SE-2101,4876,,,11-27-23 1:46 AM,2023-11-27T01:46:00.000Z,4-23-24 1:30 AM,2024-04-23T01:30:00.000Z,5-22-24 9:25 AM,2024-05-22T09:25:00.000Z,4,4,,SD,CLOSE,Y,,NO,CHATHAM
23-51577,SE-2101 MECHANICAL PM,SE-2101,SE-2101,4876,,,11-27-23 1:46 AM,2023-11-27T01:46:00.000Z,4-23-24 12:45 AM,2024-04-23T00:45:00.000Z,5-22-24 9:25 AM,2024-05-22T09:25:00.000Z,4,4,,SD,CLOSE,Y,N,NO,CHATHAM
23-51576,CORN PROBE PM + GREASING,SA-2101,SA-2101,4865,,,11-27-23 1:46 AM,2023-11-27T01:46:00.000Z,1-1-24 8:30 AM,2024-01-01T08:30:00.000Z,1-4-24 7:37 AM,2024-01-04T07:37:00.000Z,4,4,,PM,CLOSE,Y,,NO,CHATHAM
23-51575,SA-2101 CORN PROBE - MECHANICAL  PM,SA-2101,SA-2101,4865,Hydraulic actuator for spear found to have a slow leak. Not leaking bad.,,11-27-23 1:46 AM,2023-11-27T01:46:00.000Z,1-1-24 8:30 AM,2024-01-01T08:30:00.000Z,1-2-24 8:30 AM,2024-01-02T08:30:00.000Z,4,4,,PM,CLOSE,Y,N,NO,CHATHAM
23-51574,GIVE SAMPLE TO SHIPPER/RECEIVER,ME-3601A,ME-3601A,,,,11-27-23 1:46 AM,2023-11-27T01:46:00.000Z,12-28-23 12:00 AM,2023-12-28T00:00:00.000Z,12-21-23 11:11 AM,2023-12-21T11:11:00.000Z,4,4,,PM,CLOSE,Y,,NO,CHATHAM
23-51573,CHECK OIL LEVEL,ME-3601A,ME-3601A,,,,11-27-23 1:46 AM,2023-11-27T01:46:00.000Z,12-28-23 12:30 AM,2023-12-28T00:30:00.000Z,12-21-23 11:11 AM,2023-12-21T11:11:00.000Z,4,4,,PM,CLOSE,Y,,NO,CHATHAM
23-51572,EXTRACT OIL SAMPLE,ME-3601A,ME-3601A,,,,11-27-23 1:46 AM,2023-11-27T01:46:00.000Z,12-28-23 12:30 AM,2023-12-28T00:30:00.000Z,12-21-23 11:11 AM,2023-12-21T11:11:00.000Z,4,4,,PM,CLOSE,Y,,NO,CHATHAM
23-51571,PREPARATION OF CONTAINERS,ME-3601A,ME-3601A,,,,11-27-23 1:46 AM,2023-11-27T01:46:00.000Z,12-28-23 12:00 AM,2023-12-28T00:00:00.000Z,12-21-23 11:11 AM,2023-12-21T11:11:00.000Z,4,4,,PM,CLOSE,Y,,NO,CHATHAM
23-51570,ME-3601A - LUBE OIL SAMPLE,ME-3601A,ME-3601A,,,,11-27-23 1:46 AM,2023-11-27T01:46:00.000Z,12-28-23 12:30 AM,2023-12-28T00:30:00.000Z,12-21-23 1:00 AM,2023-12-21T01:00:00.000Z,4,4,,PM,CLOSE,Y,N,NO,CHATHAM
23-51569,MOTOR SHAFT MOUNTED FAN WHEEL,BL-3602,BL-3602,1299,,,11-27-23 1:46 AM,2023-11-27T01:46:00.000Z,4-23-24 1:30 AM,2024-04-23T01:30:00.000Z,,,4,4,,SD,SCHED,N,,NO,CHATHAM
23-51568,BL-3602 MECHANICAL PM,BL-3602,BL-3602,1299,,,11-27-23 1:46 AM,2023-11-27T01:46:00.000Z,4-23-24 1:30 AM,2024-04-23T01:30:00.000Z,,,4,4,,SD,SCHED,N,N,NO,CHATHAM
23-51567,MOTOR SHAFT MOUNTED FAN WHEEL,BL-3601,BL-3601,1298,,,11-27-23 1:46 AM,2023-11-27T01:46:00.000Z,4-23-24 1:30 AM,2024-04-23T01:30:00.000Z,,,4,4,,SD,SCHED,N,,NO,CHATHAM
23-51566,BL-3601 MECHANICAL PM,BL-3601,BL-3601,1298,,,11-27-23 1:46 AM,2023-11-27T01:46:00.000Z,4-23-24 1:30 AM,2024-04-23T01:30:00.000Z,,,4,4,,SD,SCHED,N,N,NO,CHATHAM
23-51565,EXHAULT/ SUPPLY AIR BLOWER PM,BL-1302,BL-1302,1287,,,11-27-23 1:46 AM,2023-11-27T01:46:00.000Z,4-23-24 1:30 AM,2024-04-23T01:30:00.000Z,5-22-24 7:54 AM,2024-05-22T07:54:00.000Z,4,4,,SD,CLOSE,Y,,NO,CHATHAM
23-51564,BL-1302 MECHANICAL PM,BL-1302,BL-1302,1287,,,11-27-23 1:46 AM,2023-11-27T01:46:00.000Z,4-23-24 1:30 AM,2024-04-23T01:30:00.000Z,5-22-24 7:54 AM,2024-05-22T07:54:00.000Z,4,4,,SD,CLOSE,Y,N,NO,CHATHAM
23-51563,CENTRIFUGAL BLOWER P.M.,BL-1201,BL-1201,1285,,,11-27-23 1:45 AM,2023-11-27T01:45:00.000Z,4-23-24 1:30 AM,2024-04-23T01:30:00.000Z,6-20-24 12:15 PM,2024-06-20T12:15:00.000Z,4,4,,SD,CLOSE,Y,,NO,CHATHAM
23-51562,BL-1201 MECHANICAL PM,BL-1201,BL-1201,1285,,,11-27-23 1:45 AM,2023-11-27T01:45:00.000Z,4-23-24 1:00 AM,2024-04-23T01:00:00.000Z,6-20-24 12:15 PM,2024-06-20T12:15:00.000Z,4,4,,SD,CLOSE,Y,N,NO,CHATHAM
23-51561,Check operation of biothane float in diked area,LSH-41401,LSH-41401,3081,,,11-27-23 1:45 AM,2023-11-27T01:45:00.000Z,12-25-23 12:30 AM,2023-12-25T00:30:00.000Z,12-29-23 8:08 AM,2023-12-29T08:08:00.000Z,4,4,,PM,CLOSE,Y,,NO,CHATHAM
23-51560,BIOTHANE FLOAT OP CHECK- (LSH-41401) - PM SERVICE,LSH-41401,LSH-41401,3081,,,11-27-23 1:45 AM,2023-11-27T01:45:00.000Z,12-25-23 12:30 AM,2023-12-25T00:30:00.000Z,12-29-23 1:00 AM,2023-12-29T01:00:00.000Z,4,4,,PM,CLOSE,Y,N,NO,CHATHAM
23-51559,DISMANTLE SCAFFOLD,B-3601,B-3601,1271,,,11-27-23 1:45 AM,2023-11-27T01:45:00.000Z,4-23-24 1:00 AM,2024-04-23T01:00:00.000Z,11-1-24 2:10 PM,2024-11-01T14:10:00.000Z,4,4,,PM,CLOSE,Y,,NO,CHATHAM
23-51558,REMOVE LOTO,B-3601,B-3601,1271,,,11-27-23 1:45 AM,2023-11-27T01:45:00.000Z,4-23-24 4:00 AM,2024-04-23T04:00:00.000Z,11-1-24 2:10 PM,2024-11-01T14:10:00.000Z,4,4,,PM,CLOSE,Y,,NO,CHATHAM
23-51557,TEST / CHECK / CLEAN WATER COLUMN PROBES,B-3601,B-3601,1271,,,11-27-23 1:45 AM,2023-11-27T01:45:00.000Z,4-23-24 1:00 AM,2024-04-23T01:00:00.000Z,11-1-24 2:10 PM,2024-11-01T14:10:00.000Z,4,4,,PM,CLOSE,Y,,NO,CHATHAM
23-51556,CALIBRATE AIT-36801A/B (FLUE GAS/O2/CO),B-3601,B-3601,1271,,,11-27-23 1:45 AM,2023-11-27T01:45:00.000Z,4-23-24 2:00 AM,2024-04-23T02:00:00.000Z,11-1-24 2:10 PM,2024-11-01T14:10:00.000Z,4,4,,PM,CLOSE,Y,,NO,CHATHAM
23-51555,CALIBRATE PY-36801A (FD FAN DAMPER),B-3601,B-3601,1271,,,11-27-23 1:45 AM,2023-11-27T01:45:00.000Z,4-23-24 1:00 AM,2024-04-23T01:00:00.000Z,11-1-24 2:10 PM,2024-11-01T14:10:00.000Z,4,4,,PM,CLOSE,Y,,NO,CHATHAM
23-51554,CALIBRATE FV-36801 (FEEDWATER CONTROL VALVE),B-3601,B-3601,1271,,,11-27-23 1:45 AM,2023-11-27T01:45:00.000Z,4-23-24 1:00 AM,2024-04-23T01:00:00.000Z,11-1-24 2:10 PM,2024-11-01T14:10:00.000Z,4,4,,PM,CLOSE,Y,,NO,CHATHAM
23-51553,CALIBRATE PY-36801B (GAS CONTROL VALVE),B-3601,B-3601,1271,,,11-27-23 1:45 AM,2023-11-27T01:45:00.000Z,4-23-24 1:00 AM,2024-04-23T01:00:00.000Z,11-1-24 2:10 PM,2024-11-01T14:10:00.000Z,4,4,,PM,CLOSE,Y,,NO,CHATHAM
23-51552,CALIBRATE PT-36807 (STACK PRESSURE),B-3601,B-3601,1271,,,11-27-23 1:45 AM,2023-11-27T01:45:00.000Z,4-23-24 1:00 AM,2024-04-23T01:00:00.000Z,11-1-24 2:10 PM,2024-11-01T14:10:00.000Z,4,4,,PM,CLOSE,Y,,NO,CHATHAM
23-51551,CALIBRATE FT-36502 (COMBUSTION AIR FLOW),B-3601,B-3601,1271,,,11-27-23 1:45 AM,2023-11-27T01:45:00.000Z,4-23-24 1:00 AM,2024-04-23T01:00:00.000Z,11-1-24 2:10 PM,2024-11-01T14:10:00.000Z,4,4,,PM,CLOSE,Y,,NO,CHATHAM
23-51550,CALIBRATE PT-36801 (DRUM STEAM PRESSURE),B-3601,B-3601,1271,,,11-27-23 1:45 AM,2023-11-27T01:45:00.000Z,4-23-24 1:00 AM,2024-04-23T01:00:00.000Z,11-1-24 2:10 PM,2024-11-01T14:10:00.000Z,4,4,,PM,CLOSE,Y,,NO,CHATHAM
23-51549,CALIBRATE FT-36801 (FEEDWATER FLOW),B-3601,B-3601,1271,,,11-27-23 1:45 AM,2023-11-27T01:45:00.000Z,4-23-24 1:00 AM,2024-04-23T01:00:00.000Z,11-1-24 2:10 PM,2024-11-01T14:10:00.000Z,4,4,,PM,CLOSE,Y,,NO,CHATHAM
23-51548,CALIBRATE FT-36802 (STEAM FLOW),B-3601,B-3601,1271,,,11-27-23 1:45 AM,2023-11-27T01:45:00.000Z,4-23-24 1:00 AM,2024-04-23T01:00:00.000Z,11-1-24 2:10 PM,2024-11-01T14:10:00.000Z,4,4,,PM,CLOSE,Y,,NO,CHATHAM
23-51547,CALIBRATE LT-36801 (DRUM LEVEL),B-3601,B-3601,1271,,,11-27-23 1:45 AM,2023-11-27T01:45:00.000Z,4-23-24 1:00 AM,2024-04-23T01:00:00.000Z,11-1-24 2:10 PM,2024-11-01T14:10:00.000Z,4,4,,PM,CLOSE,Y,,NO,CHATHAM
23-51546,LOTO BOILER,B-3601,B-3601,1271,,,11-27-23 1:45 AM,2023-11-27T01:45:00.000Z,4-23-24 4:00 AM,2024-04-23T04:00:00.000Z,11-1-24 2:10 PM,2024-11-01T14:10:00.000Z,4,4,,PM,CLOSE,Y,,NO,CHATHAM
23-51545,SCAFFOLD BUILD AT WATER COLUMN,B-3601,B-3601,1271,,,11-27-23 1:45 AM,2023-11-27T01:45:00.000Z,4-23-24 2:00 AM,2024-04-23T02:00:00.000Z,11-1-24 2:10 PM,2024-11-01T14:10:00.000Z,4,4,,PM,CLOSE,Y,,NO,CHATHAM
23-51544,B-3601 INSTRUMENT CALIBRATIONS,B-3601,B-3601,1271,,,11-27-23 1:45 AM,2023-11-27T01:45:00.000Z,10-21-24 5:00 PM,2024-10-21T17:00:00.000Z,11-1-24 2:10 PM,2024-11-01T14:10:00.000Z,4,4,,SD,CLOSE,Y,N,NO,CHATHAM
23-51543,B-3601 PACKAGE BOILER OVERHAUL 'D' STYLE NEBRASKA,B-3601,B-3601,1271,,,11-27-23 1:45 AM,2023-11-27T01:45:00.000Z,4-23-24 6:00 PM,2024-04-23T18:00:00.000Z,4-9-24 11:35 AM,2024-04-09T11:35:00.000Z,4,4,,SD,CLOSE,Y,,NO,CHATHAM
23-51542,BOILER INSPEC. & OVERHAUL - (3601) - PM SERVICE,B-3601,B-3601,1271,,,11-27-23 1:45 AM,2023-11-27T01:45:00.000Z,4-24-24 12:00 AM,2024-04-24T00:00:00.000Z,4-9-24 11:35 AM,2024-04-09T11:35:00.000Z,4,4,,SD,CLOSE,Y,N,NO,CHATHAM
23-51541,1600 AREA - TEMPERATURE CHECKS,1600,1600,,,,11-27-23 1:45 AM,2023-11-27T01:45:00.000Z,12-25-23 1:30 AM,2023-12-25T01:30:00.000Z,12-22-23 6:58 AM,2023-12-22T06:58:00.000Z,4,4,,PM,CLOSE,Y,,NO,CHATHAM
23-51540,AGITATOR PM,1600,1600,,,,11-27-23 1:45 AM,2023-11-27T01:45:00.000Z,12-25-23 1:30 AM,2023-12-25T01:30:00.000Z,12-22-23 6:58 AM,2023-12-22T06:58:00.000Z,4,4,,PM,CLOSE,Y,,NO,CHATHAM
23-51539,1600/1700/1900 AREA - AGITATOR MECHANICAL PM,1600,1600,,,,11-27-23 1:45 AM,2023-11-27T01:45:00.000Z,12-25-23 12:20 AM,2023-12-25T00:20:00.000Z,12-22-23 6:58 AM,2023-12-22T06:58:00.000Z,4,4,,PM,CLOSE,Y,N,NO,CHATHAM
23-51538,1400 AREA - AGITATOR TEMPERATURE CHECKS,1400,1400,,,,11-27-23 1:45 AM,2023-11-27T01:45:00.000Z,12-25-23 1:30 AM,2023-12-25T01:30:00.000Z,12-21-23 4:03 PM,2023-12-21T16:03:00.000Z,4,4,,PM,CLOSE,Y,,NO,CHATHAM
23-51537,AGITATOR GEARBOX MONTHLY PM CHECKS,1400,1400,,,,11-27-23 1:45 AM,2023-11-27T01:45:00.000Z,12-25-23 1:30 AM,2023-12-25T01:30:00.000Z,12-21-23 4:03 PM,2023-12-21T16:03:00.000Z,4,4,,PM,CLOSE,Y,,NO,CHATHAM
23-51536,1400 AREA - AGITATOR MECHANICAL PM,1400,1400,,,,11-27-23 1:45 AM,2023-11-27T01:45:00.000Z,12-25-23 3:00 AM,2023-12-25T03:00:00.000Z,12-21-23 1:00 AM,2023-12-21T01:00:00.000Z,4,4,,PM,CLOSE,Y,N,NO,CHATHAM
23-51535,1300 AREA - AGITATOR TEMPERATURE CHECKS,1300,1300,,,,11-27-23 1:45 AM,2023-11-27T01:45:00.000Z,12-25-23 1:30 AM,2023-12-25T01:30:00.000Z,12-21-23 6:45 AM,2023-12-21T06:45:00.000Z,4,4,,PM,CLOSE,Y,,NO,CHATHAM
23-51534,EURODRIVE AGITATOR GEARBOX PM,1300,1300,,,,11-27-23 1:45 AM,2023-11-27T01:45:00.000Z,12-25-23 1:30 AM,2023-12-25T01:30:00.000Z,12-21-23 6:45 AM,2023-12-21T06:45:00.000Z,4,4,,PM,CLOSE,Y,,NO,CHATHAM
23-51533,1300 AREA - AGITATOR MECHANICAL PM,1300,1300,,,,11-27-23 1:45 AM,2023-11-27T01:45:00.000Z,12-25-23 3:00 AM,2023-12-25T03:00:00.000Z,12-20-23 2:00 AM,2023-12-20T02:00:00.000Z,4,4,,PM,CLOSE,Y,N,NO,CHATHAM
23-51529,"2024 TA Remove, Service and Replace FY-36701",FY-36701,FY-36701,2406,,,11-24-23 8:13 AM,2023-11-24T08:13:00.000Z,10-23-24 4:30 PM,2024-10-23T16:30:00.000Z,10-30-24 3:18 PM,2024-10-30T15:18:00.000Z,4,4,,CO,CLOSE,Y,N,NO,CHATHAM
23-51526,DROA - TY18615 - Steam Control Valve to M1837- Passing,TCV-18615A,TCV-18615A,,,,11-23-23 11:44 AM,2023-11-23T11:44:00.000Z,12-31-23 9:01 AM,2023-12-31T09:01:00.000Z,1-15-24 10:56 AM,2024-01-15T10:56:00.000Z,4,4,,RM,CLOSE,Y,,NO,CHATHAM
23-51524,Nov 28-30 Support main burner change on Cg2,ME-3602A,ME-3602A,,,,11-23-23 10:11 AM,2023-11-23T10:11:00.000Z,12-16-23 4:00 PM,2023-12-16T16:00:00.000Z,11-28-23 3:37 PM,2023-11-28T15:37:00.000Z,2,2,,CO,CLOSE,Y,,NO,CHATHAM
23-51523,Nov 25-27 Support Burner Change on CG1,ME-3601A,ME-3601A,,,,11-23-23 10:07 AM,2023-11-23T10:07:00.000Z,12-13-23 4:00 PM,2023-12-13T16:00:00.000Z,11-27-23 2:36 PM,2023-11-27T14:36:00.000Z,2,2,,CO,CLOSE,Y,,NO,CHATHAM
23-51518,install PSV -55205 on vent line 4' down from PSV 13603,PSV-55205,PSV-55205,4464,,,11-23-23 9:46 AM,2023-11-23T09:46:00.000Z,12-10-23 4:15 PM,2023-12-10T16:15:00.000Z,12-14-23 4:14 PM,2023-12-14T16:14:00.000Z,2,2,,CO,CLOSE,Y,,NO,CHATHAM
23-51517,Troubleshoot RV-1834 Tripping,RV-1834,RV-1834,,,,11-23-23 9:07 AM,2023-11-23T09:07:00.000Z,11-26-23 9:07 AM,2023-11-26T09:07:00.000Z,11-23-23 4:11 PM,2023-11-23T16:11:00.000Z,2,2,,CO,CLOSE,Y,,NO,CHATHAM
23-51516,assistance in demo hut to organize per meeting with Mohammed,DEMO-PLANT,DEMO-PLANT,6757,,,11-22-23 3:47 PM,2023-11-22T15:47:00.000Z,12-4-23 2:23 PM,2023-12-04T14:23:00.000Z,12-5-23 8:23 PM,2023-12-05T20:23:00.000Z,4,4,,PM,CLOSE,Y,,NO,CHATHAM
23-51515,Ethernet port in Lab Not Working,QC LAB,QC LAB,6796,,,11-22-23 2:10 PM,2023-11-22T14:10:00.000Z,12-1-23 10:20 AM,2023-12-01T10:20:00.000Z,12-4-23 10:00 AM,2023-12-04T10:00:00.000Z,4,4,,CO,CLOSE,Y,,NO,CHATHAM
23-51514,TT55134 has gone Bad IO (MSU1 Bed B outlet temp),TT-55134,TT-55134,5670,,,11-22-23 2:05 PM,2023-11-22T14:05:00.000Z,11-23-23 8:46 AM,2023-11-23T08:46:00.000Z,11-22-23 2:47 PM,2023-11-22T14:47:00.000Z,2,2,,CO,CLOSE,Y,,NO,CHATHAM
23-51513,Install EHT on potable water line to DDG office,2600,2600,,,,11-22-23 1:59 PM,2023-11-22T13:59:00.000Z,12-8-23 12:00 AM,2023-12-08T00:00:00.000Z,11-29-23 4:00 PM,2023-11-29T16:00:00.000Z,4,4,,CP,CLOSE,Y,,NO,CHATHAM
23-51512,Manitou Wiper Blade Malfunction,FLT-002,FLT-002,1919,,,11-22-23 1:51 PM,2023-11-22T13:51:00.000Z,12-5-23 1:25 PM,2023-12-05T13:25:00.000Z,10-8-24 11:14 AM,2024-10-08T11:14:00.000Z,4,4,,CO,CLOSE,Y,,NO,CHATHAM
23-51511,Mount monitor for Genetec in new grain office/lab,BU-ADMIN,BU-ADMIN,1314,,,11-22-23 1:49 PM,2023-11-22T13:49:00.000Z,12-1-23 1:35 PM,2023-12-01T13:35:00.000Z,11-27-23 9:00 AM,2023-11-27T09:00:00.000Z,2,2,,CO,CLOSE,Y,,NO,CHATHAM
23-51510,Disconnect and reconnect trailer,CHATHAM,CHATHAM,,,,11-22-23 1:32 PM,2023-11-22T13:32:00.000Z,11-24-23 3:15 PM,2023-11-24T15:15:00.000Z,11-29-23 10:53 AM,2023-11-29T10:53:00.000Z,4,4,,CO,CLOSE,Y,,NO,CHATHAM
23-51509,DC2101 showing high DP (differential pressure),DC-2101,DC-2101,1457,,,11-22-23 1:29 PM,2023-11-22T13:29:00.000Z,11-27-23 12:49 PM,2023-11-27T12:49:00.000Z,11-27-23 6:30 AM,2023-11-27T06:30:00.000Z,2,2,,CO,CLOSE,Y,,NO,CHATHAM
23-51508,Distillation light repairs,1500,1500,,,,11-22-23 1:08 PM,2023-11-22T13:08:00.000Z,12-17-23 1:08 PM,2023-12-17T13:08:00.000Z,11-30-23 6:15 AM,2023-11-30T06:15:00.000Z,4,4,,CO,CLOSE,Y,,NO,CHATHAM
23-51507,TrackMobile wont start. Try to Jump battery,CP-2000,CP-2000,1391,,,11-22-23 11:31 AM,2023-11-22T11:31:00.000Z,11-22-23 1:30 PM,2023-11-22T13:30:00.000Z,11-23-23 6:38 AM,2023-11-23T06:38:00.000Z,1,1,,RM,CLOSE,Y,,NO,CHATHAM
23-51506,Reinstall cable tray in front of Dryer C,1830,1830,,,,11-22-23 11:03 AM,2023-11-22T11:03:00.000Z,12-17-23 11:03 AM,2023-12-17T11:03:00.000Z,12-4-23 11:00 AM,2023-12-04T11:00:00.000Z,4,4,,CO,CLOSE,Y,,NO,CHATHAM
23-51505,Heat trace waterline going to new trailer,BU-DDG,BU-DDG,1319,,,11-22-23 10:17 AM,2023-11-22T10:17:00.000Z,12-17-23 10:17 AM,2023-12-17T10:17:00.000Z,,,4,4,,CO,CAN,Y,,NO,CHATHAM
23-51504,RV 1834 motor replace (call in),RV-1834,RV-1834,,,,11-22-23 9:32 AM,2023-11-22T09:32:00.000Z,11-23-23 8:55 AM,2023-11-23T08:55:00.000Z,11-22-23 1:49 PM,2023-11-22T13:49:00.000Z,2,2,,RM,CLOSE,Y,,NO,CHATHAM
23-51503,Reconnect new motor and verify rotation,P-6586A,P-6586A,1114,,,11-22-23 9:24 AM,2023-11-22T09:24:00.000Z,12-15-23 1:43 PM,2023-12-15T13:43:00.000Z,2-16-24 2:43 PM,2024-02-16T14:43:00.000Z,4,4,,CO,CLOSE,Y,,NO,CHATHAM
23-51502,Install new motor and laser allign,P-6586A,P-6586A,1114,,,11-22-23 9:23 AM,2023-11-22T09:23:00.000Z,12-15-23 1:43 PM,2023-12-15T13:43:00.000Z,2-16-24 5:43 PM,2024-02-16T17:43:00.000Z,4,4,,CO,CLOSE,Y,,NO,CHATHAM
23-51501,Remove old Motor,P-6586A,P-6586A,1114,,,11-22-23 9:23 AM,2023-11-22T09:23:00.000Z,12-15-23 1:43 PM,2023-12-15T13:43:00.000Z,2-16-24 2:43 PM,2024-02-16T14:43:00.000Z,4,4,,CO,CLOSE,Y,,NO,CHATHAM
23-51500,Disconnect Motor electrically,P-6586A,P-6586A,1114,,,11-22-23 9:23 AM,2023-11-22T09:23:00.000Z,12-15-23 1:43 PM,2023-12-15T13:43:00.000Z,2-16-24 2:43 PM,2024-02-16T14:43:00.000Z,4,4,,CO,CLOSE,Y,,NO,CHATHAM
23-51499,Change out motor on P-6586A,P-6586A,P-6586A,1114,,,11-22-23 9:14 AM,2023-11-22T09:14:00.000Z,4-30-24 4:00 PM,2024-04-30T16:00:00.000Z,4-19-24 11:44 AM,2024-04-19T11:44:00.000Z,4,4,,CO,CLOSE,Y,,NO,CHATHAM
23-51496,Install heat trace,P-1640,P-1640,3656,,,11-22-23 7:48 AM,2023-11-22T07:48:00.000Z,8-31-23 10:24 AM,2023-08-31T10:24:00.000Z,6-27-24 11:04 AM,2024-06-27T11:04:00.000Z,4,4,,CO,CLOSE,Y,,NO,CHATHAM
23-51495,Measure and order necessary components,P-1640,P-1640,3656,,,11-22-23 7:48 AM,2023-11-22T07:48:00.000Z,8-31-23 10:24 AM,2023-08-31T10:24:00.000Z,11-28-23 6:30 AM,2023-11-28T06:30:00.000Z,4,4,,CO,CLOSE,Y,,NO,CHATHAM
23-51494,Review with engineering on what to heat trace,P-1640,P-1640,3656,,,11-22-23 7:47 AM,2023-11-22T07:47:00.000Z,8-31-23 10:24 AM,2023-08-31T10:24:00.000Z,11-28-23 6:30 AM,2023-11-28T06:30:00.000Z,4,4,,CO,CLOSE,Y,,NO,CHATHAM
23-51493,CG2 will not re-lite moving ahead burner Change,ME-3602A,ME-3602A,,,,11-22-23 7:42 AM,2023-11-22T07:42:00.000Z,11-22-23 8:30 AM,2023-11-22T08:30:00.000Z,11-22-23 1:40 PM,2023-11-22T13:40:00.000Z,1,1,,CO,CLOSE,Y,,NO,CHATHAM
23-51492,Call in for CG2 Taylor L Night shift of Nov 21st.,ME-3602A,ME-3602A,,,,11-22-23 6:13 AM,2023-11-22T06:13:00.000Z,11-22-23 7:45 AM,2023-11-22T07:45:00.000Z,11-21-23 10:30 PM,2023-11-21T22:30:00.000Z,1,1,,CO,CLOSE,Y,,NO,CHATHAM
23-51468,Remove end bells for inspection,ME-3251,ME-3251,,,,11-21-23 10:32 AM,2023-11-21T10:32:00.000Z,11-30-23 9:49 AM,2023-11-30T09:49:00.000Z,11-21-23 1:49 PM,2023-11-21T13:49:00.000Z,4,4,,CO,CLOSE,Y,,NO,CHATHAM
23-51467,Disconnect RTD's and flow switches as well as force cv closed and leave 10' poly tube attached with,ME-3251,ME-3251,,,,11-21-23 10:29 AM,2023-11-21T10:29:00.000Z,11-30-23 9:49 AM,2023-11-30T09:49:00.000Z,11-21-23 3:16 PM,2023-11-21T15:16:00.000Z,4,4,,CO,CLOSE,Y,,NO,CHATHAM
23-51464,Bag house high level probe not functioning properly,LSH-18221,LSH-18221,3634,,,11-21-23 7:51 AM,2023-11-21T07:51:00.000Z,11-26-23 7:51 AM,2023-11-26T07:51:00.000Z,11-22-23 2:49 PM,2023-11-22T14:49:00.000Z,2,2,,CO,CLOSE,Y,,NO,CHATHAM
23-51462,Modulating valve not working properly,PY-58140,PY-58140,4837,,,11-21-23 7:42 AM,2023-11-21T07:42:00.000Z,11-26-23 7:42 AM,2023-11-26T07:42:00.000Z,11-20-23 8:00 AM,2023-11-20T08:00:00.000Z,2,2,,CO,CLOSE,Y,,NO,CHATHAM
23-51461,Remove exchanger and wash plates,E-1314,E-1314,1486,,,11-21-23 6:52 AM,2023-11-21T06:52:00.000Z,11-30-23 6:52 AM,2023-11-30T06:52:00.000Z,11-21-23 9:46 AM,2023-11-21T09:46:00.000Z,2,2,,CO,CLOSE,Y,,NO,CHATHAM
23-51460,heaters are not draining condensate ( heaters is not getting warm),BU-ALCO,BU-ALCO,1315,,,11-20-23 4:57 PM,2023-11-20T16:57:00.000Z,,,12-4-23 7:58 AM,2023-12-04T07:58:00.000Z,2,2,,CO,CLOSE,Y,,NO,CHATHAM
23-51457,DRO D While A is running I/E - SSL17403 Trouble Shoot and repair,SSL-17403,SSL-17403,4959,,,11-20-23 3:04 PM,2023-11-20T15:04:00.000Z,11-21-23 10:03 AM,2023-11-21T10:03:00.000Z,1-20-25 12:48 PM,2025-01-20T12:48:00.000Z,4,4,,CO,CLOSE,Y,,NO,CHATHAM
23-51449,Disconnect electric to Vollmer trailer,CHATHAM,CHATHAM,,,,11-20-23 11:21 AM,2023-11-20T11:21:00.000Z,11-20-23 2:00 PM,2023-11-20T14:00:00.000Z,11-20-23 12:25 PM,2023-11-20T12:25:00.000Z,2,2,,CO,CLOSE,Y,,NO,CHATHAM
23-51442,The 1301 strainer closest to P-1301 needs new bolts,F-1301A,F-1301A,1650,,,11-20-23 5:25 AM,2023-11-20T05:25:00.000Z,1-22-24 5:11 AM,2024-01-22T05:11:00.000Z,1-16-24 6:10 AM,2024-01-16T06:10:00.000Z,4,4,,CO,CLOSE,Y,,NO,CHATHAM
23-51256,PH PROBE CLEANING AND CALIBRATION WEEKLY PM,AT-84505,AT-84505,6885,,,11-20-23 1:55 AM,2023-11-20T01:55:00.000Z,12-14-23 1:00 AM,2023-12-14T01:00:00.000Z,12-14-23 11:19 AM,2023-12-14T11:19:00.000Z,4,4,,PM,CLOSE,Y,,NO,CHATHAM
23-51255,C-1803D pH Meter-Weekly PM,AT-84505,AT-84505,6885,,,11-20-23 1:55 AM,2023-11-20T01:55:00.000Z,12-14-23 12:00 AM,2023-12-14T00:00:00.000Z,12-14-23 12:30 AM,2023-12-14T00:30:00.000Z,4,4,,PM,CLOSE,Y,N,NO,CHATHAM
23-51254,Annual Racking Inspection PM,CHATHAM,CHATHAM,,,,11-20-23 1:55 AM,2023-11-20T01:55:00.000Z,12-13-23 1:00 AM,2023-12-13T01:00:00.000Z,12-13-23 3:00 AM,2023-12-13T03:00:00.000Z,4,4,,PM,CLOSE,Y,,NO,CHATHAM
23-51253,Annual Racking Inspection PM,CHATHAM,CHATHAM,,,,11-20-23 1:55 AM,2023-11-20T01:55:00.000Z,12-13-23 12:00 AM,2023-12-13T00:00:00.000Z,6-27-24 11:55 AM,2024-06-27T11:55:00.000Z,4,4,,PM,CLOSE,Y,N,NO,CHATHAM
23-51252,"Area Asset Checks-1830, 1840, DDG Cooler",1800,1800,,,,11-20-23 1:55 AM,2023-11-20T01:55:00.000Z,12-18-23 12:00 AM,2023-12-18T00:00:00.000Z,12-18-23 3:36 PM,2023-12-18T15:36:00.000Z,4,4,,PM,CLOSE,Y,,NO,CHATHAM
23-51251,"Area Asset Checks-1830, 1840, DDG Cooler",1800,1800,,,,11-20-23 1:55 AM,2023-11-20T01:55:00.000Z,12-18-23 12:00 AM,2023-12-18T00:00:00.000Z,12-18-23 12:30 AM,2023-12-18T00:30:00.000Z,4,4,,PM,CLOSE,Y,N,NO,CHATHAM
23-51250,"Area Asset Checks-2200, 2300, 3200, 3600, 4100",2200,2200,,,,11-20-23 1:55 AM,2023-11-20T01:55:00.000Z,12-18-23 12:00 AM,2023-12-18T00:00:00.000Z,12-18-23 11:10 AM,2023-12-18T11:10:00.000Z,4,4,,PM,CLOSE,Y,,NO,CHATHAM
23-51249,"Area Asset Checks-2200, 2300, 3200, 3600, 4100",2200,2200,,,,11-20-23 1:55 AM,2023-11-20T01:55:00.000Z,12-18-23 12:00 AM,2023-12-18T00:00:00.000Z,12-18-23 1:00 AM,2023-12-18T01:00:00.000Z,4,4,,PM,CLOSE,Y,N,NO,CHATHAM
23-51248,"Area Asset Checks-1600, 1660, 1700 (Evaps, Corn oil, Decanyers)",1600,1600,,,,11-20-23 1:55 AM,2023-11-20T01:55:00.000Z,12-18-23 12:00 AM,2023-12-18T00:00:00.000Z,12-18-23 9:48 AM,2023-12-18T09:48:00.000Z,4,4,,PM,CLOSE,Y,,NO,CHATHAM
23-51247,"Area Asset Checks-1600, 1660, 1700",1600,1600,,,,11-20-23 1:55 AM,2023-11-20T01:55:00.000Z,12-18-23 12:00 AM,2023-12-18T00:00:00.000Z,12-18-23 2:00 AM,2023-12-18T02:00:00.000Z,4,4,,PM,CLOSE,Y,N,NO,CHATHAM
23-51246,"Area Asset Checks-1500, 6500 (Distillation)",1500,1500,,,,11-20-23 1:55 AM,2023-11-20T01:55:00.000Z,12-18-23 12:00 AM,2023-12-18T00:00:00.000Z,12-18-23 11:10 AM,2023-12-18T11:10:00.000Z,4,4,,PM,CLOSE,Y,,NO,CHATHAM
23-51245,"Area Asset Checks-1500, 6500",1500,1500,,,,11-20-23 1:55 AM,2023-11-20T01:55:00.000Z,12-18-23 12:00 AM,2023-12-18T00:00:00.000Z,12-18-23 12:30 AM,2023-12-18T00:30:00.000Z,4,4,,PM,CLOSE,Y,N,NO,CHATHAM
23-51244,"Area Asset Checks-2100, 1200, 1300, 1400 (Corn, Mill, Mash, Fermentation)",2100,2100,,,,11-20-23 1:55 AM,2023-11-20T01:55:00.000Z,12-18-23 2:30 AM,2023-12-18T02:30:00.000Z,12-18-23 3:36 PM,2023-12-18T15:36:00.000Z,4,4,,PM,CLOSE,Y,,NO,CHATHAM
23-51243,"Area Asset Checks-2100, 1200, 1300, 1400 (Corn, Mill, Mash, Fermentation)",2100,2100,,,,11-20-23 1:55 AM,2023-11-20T01:55:00.000Z,12-18-23 12:00 AM,2023-12-18T00:00:00.000Z,12-18-23 12:30 AM,2023-12-18T00:30:00.000Z,4,4,,PM,CLOSE,Y,N,NO,CHATHAM
23-51242,"Area Asset Checks-1830, 1840, DDG Cooler",1800,1800,,,,11-20-23 1:55 AM,2023-11-20T01:55:00.000Z,12-18-23 12:00 AM,2023-12-18T00:00:00.000Z,12-22-23 12:56 PM,2023-12-22T12:56:00.000Z,4,4,,PM,CLOSE,Y,,NO,CHATHAM
23-51241,"Area Asset Checks-1830, 1840, DDG Cooler",1800,1800,,,,11-20-23 1:55 AM,2023-11-20T01:55:00.000Z,12-18-23 12:00 AM,2023-12-18T00:00:00.000Z,12-22-23 2:00 AM,2023-12-22T02:00:00.000Z,4,4,,PM,CLOSE,Y,N,NO,CHATHAM
23-51240,"Area Asset Checks-2200, 2300, 3200, 3600, 4100",2200,2200,,,,11-20-23 1:55 AM,2023-11-20T01:55:00.000Z,12-18-23 12:00 AM,2023-12-18T00:00:00.000Z,12-18-23 11:06 AM,2023-12-18T11:06:00.000Z,4,4,,PM,CLOSE,Y,,NO,CHATHAM
23-51239,"Area Asset Checks-2200, 2300, 3200, 3600, 4100",2200,2200,,,,11-20-23 1:55 AM,2023-11-20T01:55:00.000Z,12-18-23 12:00 AM,2023-12-18T00:00:00.000Z,12-18-23 1:00 AM,2023-12-18T01:00:00.000Z,4,4,,PM,CLOSE,Y,N,NO,CHATHAM
23-51238,"Area Asset Checks-1600, 1660, 1700 (Evaps, Corn oil, Decanyers)",1600,1600,,,,11-20-23 1:54 AM,2023-11-20T01:54:00.000Z,12-18-23 12:00 AM,2023-12-18T00:00:00.000Z,12-18-23 11:06 AM,2023-12-18T11:06:00.000Z,4,4,,PM,CLOSE,Y,,NO,CHATHAM
23-51237,"Area Asset Checks-1600, 1660, 1700",1600,1600,,,,11-20-23 1:54 AM,2023-11-20T01:54:00.000Z,12-18-23 12:00 AM,2023-12-18T00:00:00.000Z,12-18-23 1:00 AM,2023-12-18T01:00:00.000Z,4,4,,PM,CLOSE,Y,N,NO,CHATHAM
23-51236,"Area Asset Checks-1500, 6500 (Distillation)",1500,1500,,,,11-20-23 1:54 AM,2023-11-20T01:54:00.000Z,12-18-23 12:00 AM,2023-12-18T00:00:00.000Z,12-18-23 5:29 PM,2023-12-18T17:29:00.000Z,4,4,,PM,CLOSE,Y,,NO,CHATHAM
23-51235,"Area Asset Checks-1500, 6500",1500,1500,,,,11-20-23 1:54 AM,2023-11-20T01:54:00.000Z,12-18-23 12:00 AM,2023-12-18T00:00:00.000Z,12-18-23 2:00 AM,2023-12-18T02:00:00.000Z,4,4,,PM,CLOSE,Y,N,NO,CHATHAM
23-51234,"Area Asset Checks-2100, 1200, 1300, 1400 (Corn, Mill, Mash, Fermentation)",2100,2100,,,,11-20-23 1:54 AM,2023-11-20T01:54:00.000Z,12-18-23 5:00 AM,2023-12-18T05:00:00.000Z,12-22-23 12:56 PM,2023-12-22T12:56:00.000Z,4,4,,PM,CLOSE,Y,,NO,CHATHAM
23-51233,"Area Asset Checks-2100, 1200, 1300, 1400 (Corn, Mill, Mash, Fermentation)",2100,2100,,,,11-20-23 1:54 AM,2023-11-20T01:54:00.000Z,12-18-23 12:00 AM,2023-12-18T00:00:00.000Z,12-22-23 2:00 AM,2023-12-22T02:00:00.000Z,4,4,,PM,CLOSE,Y,N,NO,CHATHAM
23-51232,BUCKET ELEVATOR PM,BE-2109,BE-2109,1281,,,11-20-23 1:54 AM,2023-11-20T01:54:00.000Z,4-14-24 12:00 AM,2024-04-14T00:00:00.000Z,5-16-24 9:56 AM,2024-05-16T09:56:00.000Z,4,4,,SD,CLOSE,Y,,NO,CHATHAM
23-51231,BE-2109 - MECHANICAL PM,BE-2109,BE-2109,1281,,,11-20-23 1:54 AM,2023-11-20T01:54:00.000Z,4-14-24 2:30 AM,2024-04-14T02:30:00.000Z,5-16-24 9:56 AM,2024-05-16T09:56:00.000Z,4,4,,SD,CLOSE,Y,N,NO,CHATHAM
23-51230,BUCKET ELEVATOR PM,BE-2107,BE-2107,1280,,,11-20-23 1:54 AM,2023-11-20T01:54:00.000Z,4-14-24 12:00 AM,2024-04-14T00:00:00.000Z,5-16-24 9:52 AM,2024-05-16T09:52:00.000Z,4,4,,SD,CLOSE,Y,,NO,CHATHAM
23-51229,BE-2107 - MECHANICAL PM,BE-2107,BE-2107,1280,,,11-20-23 1:54 AM,2023-11-20T01:54:00.000Z,4-14-24 2:30 AM,2024-04-14T02:30:00.000Z,5-16-24 9:52 AM,2024-05-16T09:52:00.000Z,4,4,,SD,CLOSE,Y,N,NO,CHATHAM
23-51228,BUCKET ELEVATOR PM,BE-1301,BE-1301,,,,11-20-23 1:54 AM,2023-11-20T01:54:00.000Z,4-14-24 12:00 AM,2024-04-14T00:00:00.000Z,5-22-24 7:53 AM,2024-05-22T07:53:00.000Z,4,4,,SD,CLOSE,Y,,NO,CHATHAM
23-51227,BE-1301 - MECHANICAL PM,BE-1301,BE-1301,,,,11-20-23 1:54 AM,2023-11-20T01:54:00.000Z,4-14-24 2:30 AM,2024-04-14T02:30:00.000Z,5-22-24 7:53 AM,2024-05-22T07:53:00.000Z,4,4,,SD,CLOSE,Y,N,NO,CHATHAM
23-51226,BL-1804D WEEKLY GREASING,BL-1804D,BL-1804D,,,,11-20-23 1:54 AM,2023-11-20T01:54:00.000Z,12-18-23 12:00 AM,2023-12-18T00:00:00.000Z,12-18-23 5:29 PM,2023-12-18T17:29:00.000Z,4,4,,PM,CLOSE,Y,,NO,CHATHAM
23-51225,BL-1804D - WEEKLY BEARING GREASING,BL-1804D,BL-1804D,,,,11-20-23 1:54 AM,2023-11-20T01:54:00.000Z,12-18-23 12:00 AM,2023-12-18T00:00:00.000Z,12-18-23 1:00 AM,2023-12-18T01:00:00.000Z,4,4,,PM,CLOSE,Y,N,NO,CHATHAM
23-51224,REFILL FILTER HOUSING & CHECK FOR LEAKS,F-2317,F-2317,7770,,,11-20-23 1:54 AM,2023-11-20T01:54:00.000Z,1-1-24 12:15 AM,2024-01-01T00:15:00.000Z,1-3-24 8:10 AM,2024-01-03T08:10:00.000Z,4,4,,PM,CLOSE,Y,,NO,CHATHAM
23-51223,REINSTALL COVER,F-2317,F-2317,7770,,,11-20-23 1:54 AM,2023-11-20T01:54:00.000Z,1-1-24 12:15 AM,2024-01-01T00:15:00.000Z,1-3-24 8:10 AM,2024-01-03T08:10:00.000Z,4,4,,PM,CLOSE,Y,,NO,CHATHAM
23-51222,REPLACE CARTRIDGES,F-2317,F-2317,7770,,,11-20-23 1:54 AM,2023-11-20T01:54:00.000Z,1-1-24 12:30 AM,2024-01-01T00:30:00.000Z,1-3-24 8:10 AM,2024-01-03T08:10:00.000Z,4,4,,PM,CLOSE,Y,,NO,CHATHAM
23-51221,REPLACE FILTER CARTRIDGES,F-2317,F-2317,7770,,,11-20-23 1:54 AM,2023-11-20T01:54:00.000Z,1-1-24 12:15 AM,2024-01-01T00:15:00.000Z,1-3-24 8:10 AM,2024-01-03T08:10:00.000Z,4,4,,PM,CLOSE,Y,,NO,CHATHAM
23-51220,ELB FILTER CHANGE,F-2317,F-2317,7770,,,11-20-23 1:54 AM,2023-11-20T01:54:00.000Z,1-1-24 1:30 AM,2024-01-01T01:30:00.000Z,1-2-24 1:00 AM,2024-01-02T01:00:00.000Z,4,4,,PM,CLOSE,Y,N,NO,CHATHAM
23-51219,5S AND STOCKROOM AUDIT-WEEKLY PM,MAINTENANCE,MAINTENANCE,,,,11-20-23 1:54 AM,2023-11-20T01:54:00.000Z,12-18-23 12:00 AM,2023-12-18T00:00:00.000Z,12-27-23 7:42 AM,2023-12-27T07:42:00.000Z,4,4,,PM,CLOSE,Y,N,NO,CHATHAM
23-51218,TRANSFORMER  MONTHLY CHECK,3800,3800,,,,11-20-23 1:54 AM,2023-11-20T01:54:00.000Z,12-17-23 12:45 AM,2023-12-17T00:45:00.000Z,12-20-23 10:17 AM,2023-12-20T10:17:00.000Z,4,4,,PM,CLOSE,Y,,NO,CHATHAM
23-51217,TRANSFORMER - (XFMR-3818)  - PM SERVICE,3800,3800,,,,11-20-23 1:54 AM,2023-11-20T01:54:00.000Z,12-17-23 12:45 AM,2023-12-17T00:45:00.000Z,12-20-23 12:45 AM,2023-12-20T00:45:00.000Z,4,4,,PM,CLOSE,Y,N,NO,CHATHAM
23-51216,REMOVE SCAFFOLD,V-2501,V-2501,6316,,,11-20-23 1:54 AM,2023-11-20T01:54:00.000Z,4-16-24 12:00 AM,2024-04-16T00:00:00.000Z,7-8-24 1:29 PM,2024-07-08T13:29:00.000Z,4,4,,SD,CLOSE,Y,,NO,CHATHAM
23-51215,"CLOSE MANWAY, INSTALL NEW GASKET",V-2501,V-2501,6316,,,11-20-23 1:54 AM,2023-11-20T01:54:00.000Z,4-16-24 12:00 AM,2024-04-16T00:00:00.000Z,7-8-24 1:29 PM,2024-07-08T13:29:00.000Z,4,4,,SD,CLOSE,Y,,NO,CHATHAM
23-51214,REMOVAL ANY DEBRIS FROM BOTTOM OF VESSEL,V-2501,V-2501,6316,,,11-20-23 1:54 AM,2023-11-20T01:54:00.000Z,4-16-24 12:00 AM,2024-04-16T00:00:00.000Z,7-8-24 1:29 PM,2024-07-08T13:29:00.000Z,4,4,,SD,CLOSE,Y,,NO,CHATHAM
23-51213,HPW DEMISTER PAD (BOTTOM SIDE),V-2501,V-2501,6316,,,11-20-23 1:54 AM,2023-11-20T01:54:00.000Z,4-16-24 12:00 AM,2024-04-16T00:00:00.000Z,7-8-24 1:29 PM,2024-07-08T13:29:00.000Z,4,4,,SD,CLOSE,Y,,NO,CHATHAM
23-51212,OPEN MANWAY,V-2501,V-2501,6316,,,11-20-23 1:54 AM,2023-11-20T01:54:00.000Z,4-16-24 12:00 AM,2024-04-16T00:00:00.000Z,7-8-24 1:29 PM,2024-07-08T13:29:00.000Z,4,4,,SD,CLOSE,Y,,NO,CHATHAM
23-51211,SCAFFOLD REQUIRED AT SIDE MANWAY,V-2501,V-2501,6316,,,11-20-23 1:54 AM,2023-11-20T01:54:00.000Z,4-16-24 12:00 AM,2024-04-16T00:00:00.000Z,7-8-24 1:29 PM,2024-07-08T13:29:00.000Z,4,4,,SD,CLOSE,Y,,NO,CHATHAM
23-51210,V-2501 RAW GAS SEPARATOR HPW PM,V-2501,V-2501,6316,,,11-20-23 1:54 AM,2023-11-20T01:54:00.000Z,10-24-24 12:00 AM,2024-10-24T00:00:00.000Z,7-8-24 1:29 PM,2024-07-08T13:29:00.000Z,4,4,,SD,CLOSE,Y,N,NO,CHATHAM
23-51209,Re-certify   PSV,PSV-59145,PSV-59145,4524,,,11-20-23 1:54 AM,2023-11-20T01:54:00.000Z,4-16-24 12:00 AM,2024-04-16T00:00:00.000Z,5-16-24 6:51 AM,2024-05-16T06:51:00.000Z,4,4,,SD,CLOSE,Y,,NO,CHATHAM
23-51208,PSV-59145 (E-1591) - 1 X 1 - 1385 KPA,PSV-59145,PSV-59145,4524,,,11-20-23 1:54 AM,2023-11-20T01:54:00.000Z,4-16-24 4:00 AM,2024-04-16T04:00:00.000Z,5-16-24 6:51 AM,2024-05-16T06:51:00.000Z,4,4,,SD,CLOSE,Y,N,NO,CHATHAM
23-51207,Re-certify   PSV,PSV-55145,PSV-55145,4463,,,11-20-23 1:54 AM,2023-11-20T01:54:00.000Z,4-16-24 12:00 AM,2024-04-16T00:00:00.000Z,5-16-24 6:50 AM,2024-05-16T06:50:00.000Z,4,4,,SD,CLOSE,Y,,NO,CHATHAM
23-51206,55145,PSV-55145,PSV-55145,4463,,,11-20-23 1:54 AM,2023-11-20T01:54:00.000Z,4-16-24 4:00 AM,2024-04-16T04:00:00.000Z,5-16-24 6:50 AM,2024-05-16T06:50:00.000Z,4,4,,SD,CLOSE,Y,N,NO,CHATHAM
23-51205,NALCO INSPECTION FOR EXPIRATION AND CALIBRATION DATES,CHATHAM,CHATHAM,,,,11-20-23 1:54 AM,2023-11-20T01:54:00.000Z,1-14-24 12:00 AM,2024-01-14T00:00:00.000Z,6-21-24 7:58 AM,2024-06-21T07:58:00.000Z,4,4,,PM,CLOSE,Y,,NO,CHATHAM
23-51204,NALCO INSPECTION FOR EXPIRATION AND CALIBRATION DATES,CHATHAM,CHATHAM,,,,11-20-23 1:54 AM,2023-11-20T01:54:00.000Z,1-14-24 12:00 AM,2024-01-14T00:00:00.000Z,6-21-24 7:58 AM,2024-06-21T07:58:00.000Z,4,4,,PM,CLOSE,Y,N,NO,CHATHAM
23-51203,TRANSFORMER  MONTHLY CHECK,3800,3800,,,,11-20-23 1:54 AM,2023-11-20T01:54:00.000Z,12-17-23 12:45 AM,2023-12-17T00:45:00.000Z,12-20-23 10:28 AM,2023-12-20T10:28:00.000Z,4,4,,PM,CLOSE,Y,,NO,CHATHAM
23-51202,TRANSFORMER - (XFMR-3804B)  - PM SERVICE,3800,3800,,,,11-20-23 1:54 AM,2023-11-20T01:54:00.000Z,12-17-23 12:45 AM,2023-12-17T00:45:00.000Z,12-20-23 12:45 AM,2023-12-20T00:45:00.000Z,4,4,,PM,CLOSE,Y,N,NO,CHATHAM
23-51201,TOTE#5 (4) 100' EXPLOSION PROOF EXTENSION CORDS,CHATHAM,CHATHAM,,,,11-20-23 1:54 AM,2023-11-20T01:54:00.000Z,12-15-23 12:00 AM,2023-12-15T00:00:00.000Z,11-24-23 8:10 AM,2023-11-24T08:10:00.000Z,4,4,,PM,CLOSE,Y,,NO,CHATHAM
23-51200,"TOTE #4 (4) COATS, (4) BIBS, (10) GLOVES, HARD HAT LINERS, NECK WARMERS, (20) INFERNO PACKS",CHATHAM,CHATHAM,,,,11-20-23 1:54 AM,2023-11-20T01:54:00.000Z,12-15-23 12:00 AM,2023-12-15T00:00:00.000Z,11-24-23 8:10 AM,2023-11-24T08:10:00.000Z,4,4,,PM,CLOSE,Y,,NO,CHATHAM
23-51199,TOTE #3 (2) SNAKE INSULATION BLANKETS,CHATHAM,CHATHAM,,,,11-20-23 1:54 AM,2023-11-20T01:54:00.000Z,12-15-23 12:00 AM,2023-12-15T00:00:00.000Z,11-24-23 8:10 AM,2023-11-24T08:10:00.000Z,4,4,,PM,CLOSE,Y,,NO,CHATHAM
23-51198,TOTE #2 (2) SNAKE INSULATION BLANKETS,CHATHAM,CHATHAM,,,,11-20-23 1:54 AM,2023-11-20T01:54:00.000Z,12-15-23 12:00 AM,2023-12-15T00:00:00.000Z,11-24-23 8:10 AM,2023-11-24T08:10:00.000Z,4,4,,PM,CLOSE,Y,,NO,CHATHAM
23-51197,TOTE #1 250' PORTABLE HEAT TRACING,CHATHAM,CHATHAM,,,,11-20-23 1:54 AM,2023-11-20T01:54:00.000Z,12-15-23 12:00 AM,2023-12-15T00:00:00.000Z,11-24-23 8:10 AM,2023-11-24T08:10:00.000Z,4,4,,PM,CLOSE,Y,,NO,CHATHAM
23-51196,COLD WEATHER PLAN (TOTE INSPECTION/AUDIT),CHATHAM,CHATHAM,,,,11-20-23 1:54 AM,2023-11-20T01:54:00.000Z,12-15-23 1:00 AM,2023-12-15T01:00:00.000Z,11-24-23 8:10 AM,2023-11-24T08:10:00.000Z,4,4,,PM,CLOSE,Y,N,NO,CHATHAM
23-51195,Weekly Vibration check (GFE I/E),MI-1201A,MI-1201A,,,,11-20-23 1:54 AM,2023-11-20T01:54:00.000Z,12-14-23 12:00 AM,2023-12-14T00:00:00.000Z,12-27-23 3:01 PM,2023-12-27T15:01:00.000Z,4,4,,PM,CLOSE,Y,,NO,CHATHAM
23-51194,MI-1201A - VISUAL GREASE CHECK,MI-1201A,MI-1201A,,,,11-20-23 1:54 AM,2023-11-20T01:54:00.000Z,12-14-23 12:30 AM,2023-12-14T00:30:00.000Z,12-27-23 3:01 PM,2023-12-27T15:01:00.000Z,4,4,,PM,CLOSE,Y,,NO,CHATHAM
23-51193,MI-1201A - WEEKLY PM & ROTATION CHANGE,MI-1201A,MI-1201A,,,,11-20-23 1:54 AM,2023-11-20T01:54:00.000Z,12-14-23 1:30 AM,2023-12-14T01:30:00.000Z,12-27-23 3:01 PM,2023-12-27T15:01:00.000Z,4,4,,PM,CLOSE,Y,,NO,CHATHAM
23-51192,MI-1201A - MECHANICAL PM,MI-1201A,MI-1201A,,,,11-20-23 1:54 AM,2023-11-20T01:54:00.000Z,12-14-23 12:30 AM,2023-12-14T00:30:00.000Z,12-27-23 3:01 PM,2023-12-27T15:01:00.000Z,4,4,,PM,CLOSE,Y,N,NO,CHATHAM
23-51191,Weekly Vibration check (GFE I/E),MI-1201B,MI-1201B,,,,11-20-23 1:54 AM,2023-11-20T01:54:00.000Z,12-18-23 12:00 AM,2023-12-18T00:00:00.000Z,12-27-23 7:42 AM,2023-12-27T07:42:00.000Z,4,4,,PM,CLOSE,Y,,NO,CHATHAM
23-51190,C-MI-1201B - MECHANICAL PM,MI-1201B,MI-1201B,,,,11-20-23 1:54 AM,2023-11-20T01:54:00.000Z,12-18-23 12:00 AM,2023-12-18T00:00:00.000Z,12-27-23 7:42 AM,2023-12-27T07:42:00.000Z,4,4,,PM,CLOSE,Y,,NO,CHATHAM
23-51189,MI-1201B - MECHANICAL PM,MI-1201B,MI-1201B,,,,11-20-23 1:54 AM,2023-11-20T01:54:00.000Z,12-18-23 12:30 AM,2023-12-18T00:30:00.000Z,12-21-23 1:00 AM,2023-12-21T01:00:00.000Z,4,4,,PM,CLOSE,Y,N,NO,CHATHAM
23-51188,"DR-1801D DDGS DRYER DRUM \"D\" (MCC-3806)",DR-1801D,DR-1801D,,,,11-20-23 1:54 AM,2023-11-20T01:54:00.000Z,4-16-24 12:00 AM,2024-04-16T00:00:00.000Z,5-27-24 9:45 AM,2024-05-27T09:45:00.000Z,4,4,,SD,CLOSE,Y,,NO,CHATHAM
23-51187,"CV-1813D DRYER D, CYCLONE 2, 4 DISCHARGE SCREW CV (MCC-3806)",CV-1813D,CV-1813D,1426,,,11-20-23 1:54 AM,2023-11-20T01:54:00.000Z,4-16-24 12:00 AM,2024-04-16T00:00:00.000Z,5-27-24 9:45 AM,2024-05-27T09:45:00.000Z,4,4,,SD,CLOSE,Y,,NO,CHATHAM
23-51186,"CV-1812D DRYER D, CYCLONE 1, 3 DISCHARGE SCREW CV (MCC-3806)",CV-1812D,CV-1812D,1424,,,11-20-23 1:54 AM,2023-11-20T01:54:00.000Z,4-16-24 12:00 AM,2024-04-16T00:00:00.000Z,5-27-24 9:45 AM,2024-05-27T09:45:00.000Z,4,4,,SD,CLOSE,Y,,NO,CHATHAM
23-51185,GIVE SAMPLE TO SHIPPER/RECEIVER,1800,1800,,,,11-20-23 1:54 AM,2023-11-20T01:54:00.000Z,4-16-24 12:00 AM,2024-04-16T00:00:00.000Z,5-27-24 9:45 AM,2024-05-27T09:45:00.000Z,4,4,,SD,CLOSE,Y,,NO,CHATHAM
23-51184,CHECK OIL LEVEL,1800,1800,,,,11-20-23 1:54 AM,2023-11-20T01:54:00.000Z,4-16-24 12:30 AM,2024-04-16T00:30:00.000Z,5-27-24 9:45 AM,2024-05-27T09:45:00.000Z,4,4,,SD,CLOSE,Y,,NO,CHATHAM
23-51183,EXTRACT OIL SAMPLE,1800,1800,,,,11-20-23 1:54 AM,2023-11-20T01:54:00.000Z,4-16-24 12:30 AM,2024-04-16T00:30:00.000Z,5-27-24 9:45 AM,2024-05-27T09:45:00.000Z,4,4,,SD,CLOSE,Y,,NO,CHATHAM
23-51182,PREPARATION OF CONTAINERS,1800,1800,,,,11-20-23 1:54 AM,2023-11-20T01:54:00.000Z,4-16-24 12:00 AM,2024-04-16T00:00:00.000Z,5-27-24 9:45 AM,2024-05-27T09:45:00.000Z,4,4,,SD,CLOSE,Y,,NO,CHATHAM
23-51181,Dryer Area Oil Sampling Route (Prohibited Area),1800,1800,,,,11-20-23 1:54 AM,2023-11-20T01:54:00.000Z,4-16-24 12:30 AM,2024-04-16T00:30:00.000Z,5-27-24 9:45 AM,2024-05-27T09:45:00.000Z,4,4,,PM,CLOSE,Y,N,NO,CHATHAM
23-51180,PH PROBE CLEANING AND CALIBRATION WEEKLY PM,AT-14125,AT-14125,1230,,,11-20-23 1:54 AM,2023-11-20T01:54:00.000Z,12-14-23 1:00 AM,2023-12-14T01:00:00.000Z,12-14-23 11:19 AM,2023-12-14T11:19:00.000Z,4,4,,PM,CLOSE,Y,,NO,CHATHAM
23-51179,PH PROBE CLEANING AND CALIBRATION PM,AT-14125,AT-14125,1230,,,11-20-23 1:54 AM,2023-11-20T01:54:00.000Z,12-14-23 12:00 AM,2023-12-14T00:00:00.000Z,12-14-23 12:30 AM,2023-12-14T00:30:00.000Z,4,4,,PM,CLOSE,Y,N,NO,CHATHAM
23-51178,PH PROBE CLEANING AND CALIBRATION WEEKLY PM,AT-13519,AT-13519,1227,,,11-20-23 1:54 AM,2023-11-20T01:54:00.000Z,12-14-23 1:00 AM,2023-12-14T01:00:00.000Z,12-14-23 11:19 AM,2023-12-14T11:19:00.000Z,4,4,,PM,CLOSE,Y,,NO,CHATHAM
23-51177,PH PROBE CLEANING AND CALIBRATION PM,AT-13519,AT-13519,1227,,,11-20-23 1:54 AM,2023-11-20T01:54:00.000Z,12-14-23 12:00 AM,2023-12-14T00:00:00.000Z,12-14-23 12:12 AM,2023-12-14T00:12:00.000Z,4,4,,PM,CLOSE,Y,N,NO,CHATHAM
23-51176,INSPECT AFTER CLEANING,CT-3201,CT-3201,,,,11-20-23 1:53 AM,2023-11-20T01:53:00.000Z,4-13-24 12:00 AM,2024-04-13T00:00:00.000Z,11-23-23 8:35 AM,2023-11-23T08:35:00.000Z,4,4,,SD,CLOSE,Y,,NO,CHATHAM
23-51175,"CLEAN STACKS AS REQUIRED, ENSURE THAT NO FOREIGN MATERIAL ENTERS FILL",CT-3201,CT-3201,,,,11-20-23 1:53 AM,2023-11-20T01:53:00.000Z,4-13-24 12:00 AM,2024-04-13T00:00:00.000Z,11-23-23 8:35 AM,2023-11-23T08:35:00.000Z,4,4,,SD,CLOSE,Y,,NO,CHATHAM
23-51174,INSPECT COOLING TOWER STACK FOR ANY SIGNS OF OIL,CT-3201,CT-3201,,,,11-20-23 1:53 AM,2023-11-20T01:53:00.000Z,4-13-24 12:00 AM,2024-04-13T00:00:00.000Z,11-23-23 8:35 AM,2023-11-23T08:35:00.000Z,4,4,,SD,CLOSE,Y,,NO,CHATHAM
23-51173,CLEAN AND DISINFECT COOLING TOWER STACK,CT-3201,CT-3201,,,,11-20-23 1:53 AM,2023-11-20T01:53:00.000Z,4-13-24 12:00 AM,2024-04-13T00:00:00.000Z,11-23-23 8:35 AM,2023-11-23T08:35:00.000Z,4,4,,SD,CLOSE,Y,N,NO,CHATHAM
23-51172,DCS 3 MONTH BACKUPS,DCS-CONTROL,DCS-CONTROL,1458,,,11-20-23 1:53 AM,2023-11-20T01:53:00.000Z,12-14-23 12:00 AM,2023-12-14T00:00:00.000Z,6-20-24 2:14 PM,2024-06-20T14:14:00.000Z,4,4,,PM,CLOSE,Y,,NO,CHATHAM
23-51171,DCS BACKUPS,DCS-CONTROL,DCS-CONTROL,1458,,VIRAJ.PATEL,11-20-23 1:53 AM,2023-11-20T01:53:00.000Z,12-14-23 12:00 AM,2023-12-14T00:00:00.000Z,6-20-24 2:14 PM,2024-06-20T14:14:00.000Z,4,4,,PM,CLOSE,Y,N,NO,CHATHAM
23-51170,Agitate the Sludge Bed in the Biothane and preform and record the  Sludge Analysis for the Biothane,T-4126,T-4126,5003,,,11-20-23 1:53 AM,2023-11-20T01:53:00.000Z,12-18-23 12:00 AM,2023-12-18T00:00:00.000Z,11-21-23 7:26 AM,2023-11-21T07:26:00.000Z,4,4,,PM,CLOSE,Y,,NO,CHATHAM
23-51169,SLUDGE ANALYSIS FOR BIOTHANE DIGESTER,T-4126,T-4126,5003,,,11-20-23 1:53 AM,2023-11-20T01:53:00.000Z,12-18-23 12:00 AM,2023-12-18T00:00:00.000Z,11-21-23 7:26 AM,2023-11-21T07:26:00.000Z,4,4,,PM,CLOSE,Y,N,NO,CHATHAM
23-51168,MSU VALVE REBUILD,PV-55105,PV-55105,4787,,,11-20-23 1:53 AM,2023-11-20T01:53:00.000Z,4-11-24 4:00 AM,2024-04-11T04:00:00.000Z,12-2-24 8:55 AM,2024-12-02T08:55:00.000Z,4,4,,SD,CLOSE,Y,,NO,CHATHAM
23-51167,PV-55105 VALVE REBUILD,PV-55105,PV-55105,4787,,,11-20-23 1:53 AM,2023-11-20T01:53:00.000Z,10-31-24 4:00 AM,2024-10-31T04:00:00.000Z,12-2-24 8:55 AM,2024-12-02T08:55:00.000Z,4,4,,SD,CLOSE,Y,N,NO,CHATHAM
23-51166,MSU VALVE REBUILD,XV-55123,XV-55123,6472,,,11-20-23 1:53 AM,2023-11-20T01:53:00.000Z,4-11-24 4:00 AM,2024-04-11T04:00:00.000Z,12-2-24 8:57 AM,2024-12-02T08:57:00.000Z,4,4,,SD,CLOSE,Y,,NO,CHATHAM
23-51165,XV-55123 VALVE REBUILD,XV-55123,XV-55123,6472,,,11-20-23 1:53 AM,2023-11-20T01:53:00.000Z,4-11-24 4:00 AM,2024-04-11T04:00:00.000Z,12-2-24 8:57 AM,2024-12-02T08:57:00.000Z,4,4,,SD,CLOSE,Y,N,NO,CHATHAM
23-51164,MSU VALVE REBUILD,XV-55113,XV-55113,6469,,,11-20-23 1:53 AM,2023-11-20T01:53:00.000Z,4-11-24 4:00 AM,2024-04-11T04:00:00.000Z,12-2-24 8:19 AM,2024-12-02T08:19:00.000Z,4,4,,SD,CLOSE,Y,,NO,CHATHAM
23-51163,XV-55113  VALVE REBUILD,XV-55113,XV-55113,6469,,,11-20-23 1:53 AM,2023-11-20T01:53:00.000Z,4-11-24 4:00 AM,2024-04-11T04:00:00.000Z,12-2-24 8:19 AM,2024-12-02T08:19:00.000Z,4,4,,SD,CLOSE,Y,N,NO,CHATHAM
23-51162,MSU VALVE REBUILD,HV-55114,HV-55114,2644,,,11-20-23 1:53 AM,2023-11-20T01:53:00.000Z,4-11-24 4:00 AM,2024-04-11T04:00:00.000Z,12-2-24 8:19 AM,2024-12-02T08:19:00.000Z,4,4,,SD,CLOSE,Y,,NO,CHATHAM
23-51161,HV-55114  VALVE REBUILD,HV-55114,HV-55114,2644,,,11-20-23 1:53 AM,2023-11-20T01:53:00.000Z,10-31-24 4:00 AM,2024-10-31T04:00:00.000Z,12-2-24 8:19 AM,2024-12-02T08:19:00.000Z,4,4,,SD,CLOSE,Y,N,NO,CHATHAM
23-51160,MSU VALVE REBUILD,HV-55124,HV-55124,2645,,,11-20-23 1:53 AM,2023-11-20T01:53:00.000Z,4-11-24 4:00 AM,2024-04-11T04:00:00.000Z,12-2-24 8:29 AM,2024-12-02T08:29:00.000Z,4,4,,SD,CLOSE,Y,,NO,CHATHAM
23-51159,HV-55124  VALVE REBUILD,HV-55124,HV-55124,2645,,,11-20-23 1:53 AM,2023-11-20T01:53:00.000Z,10-31-24 4:00 AM,2024-10-31T04:00:00.000Z,12-2-24 8:29 AM,2024-12-02T08:29:00.000Z,4,4,,SD,CLOSE,Y,N,NO,CHATHAM
23-51158,MSU VALVE REBUILD,XV-55111,XV-55111,6467,,,11-20-23 1:53 AM,2023-11-20T01:53:00.000Z,4-11-24 4:00 AM,2024-04-11T04:00:00.000Z,12-2-24 8:46 AM,2024-12-02T08:46:00.000Z,4,4,,SD,CLOSE,Y,,NO,CHATHAM
23-51157,XV-55111  VALVE REBUILD,XV-55111,XV-55111,6467,,,11-20-23 1:53 AM,2023-11-20T01:53:00.000Z,4-11-24 4:00 AM,2024-04-11T04:00:00.000Z,12-2-24 8:46 AM,2024-12-02T08:46:00.000Z,4,4,,SD,CLOSE,Y,N,NO,CHATHAM
23-51156,MSU VALVE REBUILD,XV-55112,XV-55112,6468,,,11-20-23 1:53 AM,2023-11-20T01:53:00.000Z,4-11-24 4:00 AM,2024-04-11T04:00:00.000Z,12-2-24 8:19 AM,2024-12-02T08:19:00.000Z,4,4,,SD,CLOSE,Y,,NO,CHATHAM
23-51155,XV-55112  VALVE REBUILD,XV-55112,XV-55112,6468,,,11-20-23 1:53 AM,2023-11-20T01:53:00.000Z,4-11-24 4:00 AM,2024-04-11T04:00:00.000Z,12-2-24 8:19 AM,2024-12-02T08:19:00.000Z,4,4,,SD,CLOSE,Y,N,NO,CHATHAM
23-51154,MSU VALVE REBUILD,XV-55121,XV-55121,6470,,,11-20-23 1:53 AM,2023-11-20T01:53:00.000Z,4-11-24 4:00 AM,2024-04-11T04:00:00.000Z,12-2-24 9:37 AM,2024-12-02T09:37:00.000Z,4,4,,SD,CLOSE,Y,,NO,CHATHAM
23-51153,XV-55121  VALVE REBUILD,XV-55121,XV-55121,6470,,,11-20-23 1:53 AM,2023-11-20T01:53:00.000Z,4-11-24 4:00 AM,2024-04-11T04:00:00.000Z,12-2-24 9:37 AM,2024-12-02T09:37:00.000Z,4,4,,SD,CLOSE,Y,N,NO,CHATHAM
23-51152,MSU VALVE REBUILD,XV-55122,XV-55122,6471,,,11-20-23 1:53 AM,2023-11-20T01:53:00.000Z,4-11-24 4:00 AM,2024-04-11T04:00:00.000Z,12-2-24 8:27 AM,2024-12-02T08:27:00.000Z,4,4,,SD,CLOSE,Y,,NO,CHATHAM
23-51151,XV-55122  VALVE REBUILD,XV-55122,XV-55122,6471,,,11-20-23 1:53 AM,2023-11-20T01:53:00.000Z,4-11-24 4:00 AM,2024-04-11T04:00:00.000Z,12-2-24 8:27 AM,2024-12-02T08:27:00.000Z,4,4,,SD,CLOSE,Y,N,NO,CHATHAM
23-51150,MSU VALVE REBUILD,HV-55141,HV-55141,2646,,,11-20-23 1:53 AM,2023-11-20T01:53:00.000Z,4-11-24 4:00 AM,2024-04-11T04:00:00.000Z,1-13-25 11:18 AM,2025-01-13T11:18:00.000Z,4,4,,SD,CLOSE,Y,,NO,CHATHAM
23-51149,HV-55141  VALVE REBUILD,HV-55141,HV-55141,2646,,,11-20-23 1:53 AM,2023-11-20T01:53:00.000Z,4-11-24 4:00 AM,2024-04-11T04:00:00.000Z,1-13-25 11:18 AM,2025-01-13T11:18:00.000Z,4,4,,SD,CLOSE,Y,N,NO,CHATHAM
23-51148,MSU VALVE REBUILD,HV-55102,HV-55102,2643,,,11-20-23 1:53 AM,2023-11-20T01:53:00.000Z,4-11-24 4:00 AM,2024-04-11T04:00:00.000Z,12-2-24 8:48 AM,2024-12-02T08:48:00.000Z,4,4,,SD,CLOSE,Y,,NO,CHATHAM
23-51147,HV-55102  VALVE REBUILD,HV-55102,HV-55102,2643,,,11-20-23 1:53 AM,2023-11-20T01:53:00.000Z,10-31-24 4:00 AM,2024-10-31T04:00:00.000Z,12-2-24 8:48 AM,2024-12-02T08:48:00.000Z,4,4,,SD,CLOSE,Y,N,NO,CHATHAM
23-51146,RE-INSTALL INSTRUMENT AIR,HV-55102,HV-55102,2643,,,11-20-23 1:53 AM,2023-11-20T01:53:00.000Z,4-11-24 1:00 AM,2024-04-11T01:00:00.000Z,6-28-24 10:39 AM,2024-06-28T10:39:00.000Z,4,4,,SD,CLOSE,Y,,NO,CHATHAM
23-51145,CRANE TO SUPPORT RE-INSTALL,HV-55102,HV-55102,2643,,,11-20-23 1:53 AM,2023-11-20T01:53:00.000Z,4-11-24 1:00 AM,2024-04-11T01:00:00.000Z,6-28-24 10:39 AM,2024-06-28T10:39:00.000Z,4,4,,SD,CLOSE,Y,,NO,CHATHAM
23-51144,RE-INSTALL VALVE,HV-55102,HV-55102,2643,,,11-20-23 1:53 AM,2023-11-20T01:53:00.000Z,4-11-24 1:00 AM,2024-04-11T01:00:00.000Z,6-28-24 10:39 AM,2024-06-28T10:39:00.000Z,4,4,,SD,CLOSE,Y,,NO,CHATHAM
23-51143,MSU VALVE SEAT REPLACEMENT,HV-55102,HV-55102,2643,,,11-20-23 1:53 AM,2023-11-20T01:53:00.000Z,4-11-24 1:00 AM,2024-04-11T01:00:00.000Z,6-28-24 10:39 AM,2024-06-28T10:39:00.000Z,4,4,,SD,CLOSE,Y,,NO,CHATHAM
23-51142,CRANE TO SUPPORT REMOVAL,HV-55102,HV-55102,2643,,,11-20-23 1:53 AM,2023-11-20T01:53:00.000Z,4-11-24 12:30 AM,2024-04-11T00:30:00.000Z,6-28-24 10:39 AM,2024-06-28T10:39:00.000Z,4,4,,SD,CLOSE,Y,,NO,CHATHAM
23-51141,REMOVE VALVE FROM SERVICE,HV-55102,HV-55102,2643,,,11-20-23 1:53 AM,2023-11-20T01:53:00.000Z,4-11-24 5:00 AM,2024-04-11T05:00:00.000Z,6-28-24 10:39 AM,2024-06-28T10:39:00.000Z,4,4,,SD,CLOSE,Y,,NO,CHATHAM
23-51140,REMOVE INSTRUMENT AIR,HV-55102,HV-55102,2643,,,11-20-23 1:53 AM,2023-11-20T01:53:00.000Z,4-11-24 12:30 AM,2024-04-11T00:30:00.000Z,6-28-24 10:39 AM,2024-06-28T10:39:00.000Z,4,4,,SD,CLOSE,Y,,NO,CHATHAM
23-51139,HV-55102  VALVE SEAT REPLACEMENT,HV-55102,HV-55102,2643,,,11-20-23 1:53 AM,2023-11-20T01:53:00.000Z,4-11-24 12:00 AM,2024-04-11T00:00:00.000Z,6-28-24 10:39 AM,2024-06-28T10:39:00.000Z,4,4,,SD,CLOSE,Y,N,NO,CHATHAM
23-51138,RE-INSTALL INSTRUMENT AIR,HV-55141,HV-55141,2646,,,11-20-23 1:53 AM,2023-11-20T01:53:00.000Z,4-11-24 1:00 AM,2024-04-11T01:00:00.000Z,12-2-24 8:19 AM,2024-12-02T08:19:00.000Z,4,4,,SD,CLOSE,Y,,NO,CHATHAM
23-51137,CRANE TO SUPPORT RE-INSTALL,HV-55141,HV-55141,2646,,,11-20-23 1:53 AM,2023-11-20T01:53:00.000Z,4-11-24 1:00 AM,2024-04-11T01:00:00.000Z,12-2-24 8:19 AM,2024-12-02T08:19:00.000Z,4,4,,SD,CLOSE,Y,,NO,CHATHAM
23-51136,RE-INSTALL VALVE,HV-55141,HV-55141,2646,,,11-20-23 1:53 AM,2023-11-20T01:53:00.000Z,4-11-24 1:00 AM,2024-04-11T01:00:00.000Z,12-2-24 8:19 AM,2024-12-02T08:19:00.000Z,4,4,,SD,CLOSE,Y,,NO,CHATHAM
23-51135,MSU VALVE SEAT REPLACEMENT,HV-55141,HV-55141,2646,,,11-20-23 1:53 AM,2023-11-20T01:53:00.000Z,4-11-24 1:00 AM,2024-04-11T01:00:00.000Z,12-2-24 8:19 AM,2024-12-02T08:19:00.000Z,4,4,,SD,CLOSE,Y,,NO,CHATHAM
23-51134,CRANE TO SUPPORT REMOVAL,HV-55141,HV-55141,2646,,,11-20-23 1:53 AM,2023-11-20T01:53:00.000Z,4-11-24 12:30 AM,2024-04-11T00:30:00.000Z,12-2-24 8:19 AM,2024-12-02T08:19:00.000Z,4,4,,SD,CLOSE,Y,,NO,CHATHAM
23-51133,REMOVE VALVE FROM SERVICE,HV-55141,HV-55141,2646,,,11-20-23 1:53 AM,2023-11-20T01:53:00.000Z,4-11-24 5:00 AM,2024-04-11T05:00:00.000Z,12-2-24 8:19 AM,2024-12-02T08:19:00.000Z,4,4,,SD,CLOSE,Y,,NO,CHATHAM
23-51132,REMOVE INSTRUMENT AIR,HV-55141,HV-55141,2646,,,11-20-23 1:53 AM,2023-11-20T01:53:00.000Z,4-11-24 12:30 AM,2024-04-11T00:30:00.000Z,12-2-24 8:19 AM,2024-12-02T08:19:00.000Z,4,4,,SD,CLOSE,Y,,NO,CHATHAM
23-51131,HV-55141  VALVE SEAT REPLACEMENT,HV-55141,HV-55141,2646,,,11-20-23 1:53 AM,2023-11-20T01:53:00.000Z,4-11-24 12:00 AM,2024-04-11T00:00:00.000Z,12-2-24 8:19 AM,2024-12-02T08:19:00.000Z,4,4,,SD,CLOSE,Y,N,NO,CHATHAM
23-51130,RE-INSTALL INSTRUMENT AIR,XV-55122,XV-55122,6471,,,11-20-23 1:53 AM,2023-11-20T01:53:00.000Z,4-11-24 1:00 AM,2024-04-11T01:00:00.000Z,12-2-24 8:45 AM,2024-12-02T08:45:00.000Z,4,4,,SD,CLOSE,Y,,NO,CHATHAM
23-51129,CRANE TO SUPPORT RE-INSTALL,XV-55122,XV-55122,6471,,,11-20-23 1:53 AM,2023-11-20T01:53:00.000Z,4-11-24 1:00 AM,2024-04-11T01:00:00.000Z,12-2-24 8:45 AM,2024-12-02T08:45:00.000Z,4,4,,SD,CLOSE,Y,,NO,CHATHAM
23-51128,RE-INSTALL VALVE,XV-55122,XV-55122,6471,,,11-20-23 1:53 AM,2023-11-20T01:53:00.000Z,4-11-24 1:00 AM,2024-04-11T01:00:00.000Z,12-2-24 8:45 AM,2024-12-02T08:45:00.000Z,4,4,,SD,CLOSE,Y,,NO,CHATHAM
23-51127,MSU VALVE SEAT REPLACEMENT,XV-55122,XV-55122,6471,,,11-20-23 1:53 AM,2023-11-20T01:53:00.000Z,4-11-24 1:00 AM,2024-04-11T01:00:00.000Z,12-2-24 8:45 AM,2024-12-02T08:45:00.000Z,4,4,,SD,CLOSE,Y,,NO,CHATHAM
23-51126,CRANE TO SUPPORT REMOVAL,XV-55122,XV-55122,6471,,,11-20-23 1:53 AM,2023-11-20T01:53:00.000Z,4-11-24 12:30 AM,2024-04-11T00:30:00.000Z,12-2-24 8:45 AM,2024-12-02T08:45:00.000Z,4,4,,SD,CLOSE,Y,,NO,CHATHAM
23-51125,REMOVE VALVE FROM SERVICE,XV-55122,XV-55122,6471,,,11-20-23 1:53 AM,2023-11-20T01:53:00.000Z,4-11-24 5:00 AM,2024-04-11T05:00:00.000Z,12-2-24 8:45 AM,2024-12-02T08:45:00.000Z,4,4,,SD,CLOSE,Y,,NO,CHATHAM
23-51124,REMOVE INSTRUMENT AIR,XV-55122,XV-55122,6471,,,11-20-23 1:53 AM,2023-11-20T01:53:00.000Z,4-11-24 12:30 AM,2024-04-11T00:30:00.000Z,12-2-24 8:45 AM,2024-12-02T08:45:00.000Z,4,4,,SD,CLOSE,Y,,NO,CHATHAM
23-51123,XV-55122  VALVE SEAT REPLACEMENT,XV-55122,XV-55122,6471,,,11-20-23 1:53 AM,2023-11-20T01:53:00.000Z,4-11-24 12:00 AM,2024-04-11T00:00:00.000Z,12-2-24 8:45 AM,2024-12-02T08:45:00.000Z,4,4,,SD,CLOSE,Y,N,NO,CHATHAM
23-51122,RE-INSTALL INSTRUMENT AIR,XV-55112,XV-55112,6468,,,11-20-23 1:53 AM,2023-11-20T01:53:00.000Z,4-11-24 1:00 AM,2024-04-11T01:00:00.000Z,12-2-24 8:47 AM,2024-12-02T08:47:00.000Z,4,4,,SD,CLOSE,Y,,NO,CHATHAM
23-51121,CRANE TO SUPPORT RE-INSTALL,XV-55112,XV-55112,6468,,,11-20-23 1:53 AM,2023-11-20T01:53:00.000Z,4-11-24 1:00 AM,2024-04-11T01:00:00.000Z,12-2-24 8:47 AM,2024-12-02T08:47:00.000Z,4,4,,SD,CLOSE,Y,,NO,CHATHAM
23-51120,RE-INSTALL VALVE,XV-55112,XV-55112,6468,,,11-20-23 1:53 AM,2023-11-20T01:53:00.000Z,4-11-24 1:00 AM,2024-04-11T01:00:00.000Z,12-2-24 8:47 AM,2024-12-02T08:47:00.000Z,4,4,,SD,CLOSE,Y,,NO,CHATHAM
23-51119,MSU VALVE SEAT REPLACEMENT,XV-55112,XV-55112,6468,,,11-20-23 1:53 AM,2023-11-20T01:53:00.000Z,4-11-24 1:00 AM,2024-04-11T01:00:00.000Z,12-2-24 8:47 AM,2024-12-02T08:47:00.000Z,4,4,,SD,CLOSE,Y,,NO,CHATHAM
23-51118,CRANE TO SUPPORT REMOVAL,XV-55112,XV-55112,6468,,,11-20-23 1:53 AM,2023-11-20T01:53:00.000Z,4-11-24 12:30 AM,2024-04-11T00:30:00.000Z,12-2-24 8:47 AM,2024-12-02T08:47:00.000Z,4,4,,SD,CLOSE,Y,,NO,CHATHAM
23-51117,REMOVE VALVE FROM SERVICE,XV-55112,XV-55112,6468,,,11-20-23 1:53 AM,2023-11-20T01:53:00.000Z,4-11-24 5:00 AM,2024-04-11T05:00:00.000Z,12-2-24 8:47 AM,2024-12-02T08:47:00.000Z,4,4,,SD,CLOSE,Y,,NO,CHATHAM
23-51116,REMOVE INSTRUMENT AIR,XV-55112,XV-55112,6468,,,11-20-23 1:53 AM,2023-11-20T01:53:00.000Z,4-11-24 12:30 AM,2024-04-11T00:30:00.000Z,12-2-24 8:47 AM,2024-12-02T08:47:00.000Z,4,4,,SD,CLOSE,Y,,NO,CHATHAM
23-51115,XV-55112  VALVE SEAT REPLACEMENT,XV-55112,XV-55112,6468,,,11-20-23 1:53 AM,2023-11-20T01:53:00.000Z,4-11-24 12:00 AM,2024-04-11T00:00:00.000Z,12-2-24 8:47 AM,2024-12-02T08:47:00.000Z,4,4,,SD,CLOSE,Y,N,NO,CHATHAM
23-51114,RE-INSTALL INSTRUMENT AIR,XV-55111,XV-55111,6467,,,11-20-23 1:53 AM,2023-11-20T01:53:00.000Z,4-11-24 1:00 AM,2024-04-11T01:00:00.000Z,12-2-24 8:27 AM,2024-12-02T08:27:00.000Z,4,4,,SD,CLOSE,Y,,NO,CHATHAM
23-51113,CRANE TO SUPPORT RE-INSTALL,XV-55111,XV-55111,6467,,,11-20-23 1:53 AM,2023-11-20T01:53:00.000Z,4-11-24 1:00 AM,2024-04-11T01:00:00.000Z,12-2-24 8:27 AM,2024-12-02T08:27:00.000Z,4,4,,SD,CLOSE,Y,,NO,CHATHAM
23-51112,RE-INSTALL VALVE,XV-55111,XV-55111,6467,,,11-20-23 1:53 AM,2023-11-20T01:53:00.000Z,4-11-24 1:00 AM,2024-04-11T01:00:00.000Z,12-2-24 8:27 AM,2024-12-02T08:27:00.000Z,4,4,,SD,CLOSE,Y,,NO,CHATHAM
23-51111,MSU VALVE SEAT REPLACEMENT,XV-55111,XV-55111,6467,,,11-20-23 1:53 AM,2023-11-20T01:53:00.000Z,4-11-24 1:00 AM,2024-04-11T01:00:00.000Z,12-2-24 8:27 AM,2024-12-02T08:27:00.000Z,4,4,,SD,CLOSE,Y,,NO,CHATHAM
23-51110,CRANE TO SUPPORT REMOVAL,XV-55111,XV-55111,6467,,,11-20-23 1:53 AM,2023-11-20T01:53:00.000Z,4-11-24 12:30 AM,2024-04-11T00:30:00.000Z,12-2-24 8:27 AM,2024-12-02T08:27:00.000Z,4,4,,SD,CLOSE,Y,,NO,CHATHAM
23-51109,REMOVE VALVE FROM SERVICE,XV-55111,XV-55111,6467,,,11-20-23 1:53 AM,2023-11-20T01:53:00.000Z,4-11-24 5:00 AM,2024-04-11T05:00:00.000Z,12-2-24 8:27 AM,2024-12-02T08:27:00.000Z,4,4,,SD,CLOSE,Y,,NO,CHATHAM
23-51108,REMOVE INSTRUMENT AIR,XV-55111,XV-55111,6467,,,11-20-23 1:53 AM,2023-11-20T01:53:00.000Z,4-11-24 12:30 AM,2024-04-11T00:30:00.000Z,12-2-24 8:27 AM,2024-12-02T08:27:00.000Z,4,4,,SD,CLOSE,Y,,NO,CHATHAM
23-51107,XV-55111  VALVE SEAT REPLACEMENT,XV-55111,XV-55111,6467,,,11-20-23 1:53 AM,2023-11-20T01:53:00.000Z,4-11-24 12:00 AM,2024-04-11T00:00:00.000Z,12-2-24 8:27 AM,2024-12-02T08:27:00.000Z,4,4,,SD,CLOSE,Y,N,NO,CHATHAM
23-51106,RE-INSTALL INSTRUMENT AIR,HV-55124,HV-55124,2645,,,11-20-23 1:52 AM,2023-11-20T01:52:00.000Z,4-11-24 1:00 AM,2024-04-11T01:00:00.000Z,6-28-24 10:34 AM,2024-06-28T10:34:00.000Z,4,4,,SD,CLOSE,Y,,NO,CHATHAM
23-51105,CRANE TO SUPPORT RE-INSTALL,HV-55124,HV-55124,2645,,,11-20-23 1:52 AM,2023-11-20T01:52:00.000Z,4-11-24 1:00 AM,2024-04-11T01:00:00.000Z,6-28-24 10:34 AM,2024-06-28T10:34:00.000Z,4,4,,SD,CLOSE,Y,,NO,CHATHAM
23-51104,RE-INSTALL VALVE,HV-55124,HV-55124,2645,,,11-20-23 1:52 AM,2023-11-20T01:52:00.000Z,4-11-24 1:00 AM,2024-04-11T01:00:00.000Z,6-28-24 10:34 AM,2024-06-28T10:34:00.000Z,4,4,,SD,CLOSE,Y,,NO,CHATHAM
23-51103,MSU VALVE SEAT REPLACEMENT,HV-55124,HV-55124,2645,,,11-20-23 1:52 AM,2023-11-20T01:52:00.000Z,4-11-24 1:00 AM,2024-04-11T01:00:00.000Z,6-28-24 10:34 AM,2024-06-28T10:34:00.000Z,4,4,,SD,CLOSE,Y,,NO,CHATHAM
23-51102,CRANE TO SUPPORT REMOVAL,HV-55124,HV-55124,2645,,,11-20-23 1:52 AM,2023-11-20T01:52:00.000Z,4-11-24 12:30 AM,2024-04-11T00:30:00.000Z,6-28-24 10:34 AM,2024-06-28T10:34:00.000Z,4,4,,SD,CLOSE,Y,,NO,CHATHAM
23-51101,REMOVE VALVE FROM SERVICE,HV-55124,HV-55124,2645,,,11-20-23 1:52 AM,2023-11-20T01:52:00.000Z,4-11-24 5:00 AM,2024-04-11T05:00:00.000Z,6-28-24 10:34 AM,2024-06-28T10:34:00.000Z,4,4,,SD,CLOSE,Y,,NO,CHATHAM
23-51100,REMOVE INSTRUMENT AIR,HV-55124,HV-55124,2645,,,11-20-23 1:52 AM,2023-11-20T01:52:00.000Z,4-11-24 12:30 AM,2024-04-11T00:30:00.000Z,6-28-24 10:34 AM,2024-06-28T10:34:00.000Z,4,4,,SD,CLOSE,Y,,NO,CHATHAM
23-51099,HV-55124  VALVE SEAT REPLACEMENT,HV-55124,HV-55124,2645,,,11-20-23 1:52 AM,2023-11-20T01:52:00.000Z,4-11-24 12:00 AM,2024-04-11T00:00:00.000Z,6-28-24 10:34 AM,2024-06-28T10:34:00.000Z,4,4,,SD,CLOSE,Y,N,NO,CHATHAM
23-51098,RE-INSTALL INSTRUMENT AIR,HV-55114,HV-55114,2644,,,11-20-23 1:52 AM,2023-11-20T01:52:00.000Z,4-11-24 1:00 AM,2024-04-11T01:00:00.000Z,6-28-24 10:36 AM,2024-06-28T10:36:00.000Z,4,4,,SD,CLOSE,Y,,NO,CHATHAM
23-51097,CRANE TO SUPPORT RE-INSTALL,HV-55114,HV-55114,2644,,,11-20-23 1:52 AM,2023-11-20T01:52:00.000Z,4-11-24 1:00 AM,2024-04-11T01:00:00.000Z,6-28-24 10:36 AM,2024-06-28T10:36:00.000Z,4,4,,SD,CLOSE,Y,,NO,CHATHAM
23-51096,RE-INSTALL VALVE,HV-55114,HV-55114,2644,,,11-20-23 1:52 AM,2023-11-20T01:52:00.000Z,4-11-24 1:00 AM,2024-04-11T01:00:00.000Z,6-28-24 10:36 AM,2024-06-28T10:36:00.000Z,4,4,,SD,CLOSE,Y,,NO,CHATHAM
23-51095,MSU VALVE SEAT REPLACEMENT,HV-55114,HV-55114,2644,,,11-20-23 1:52 AM,2023-11-20T01:52:00.000Z,4-11-24 1:00 AM,2024-04-11T01:00:00.000Z,6-28-24 10:36 AM,2024-06-28T10:36:00.000Z,4,4,,SD,CLOSE,Y,,NO,CHATHAM
23-51094,CRANE TO SUPPORT REMOVAL,HV-55114,HV-55114,2644,,,11-20-23 1:52 AM,2023-11-20T01:52:00.000Z,4-11-24 12:30 AM,2024-04-11T00:30:00.000Z,6-28-24 10:36 AM,2024-06-28T10:36:00.000Z,4,4,,SD,CLOSE,Y,,NO,CHATHAM
23-51093,REMOVE VALVE FROM SERVICE,HV-55114,HV-55114,2644,,,11-20-23 1:52 AM,2023-11-20T01:52:00.000Z,4-11-24 5:00 AM,2024-04-11T05:00:00.000Z,6-28-24 10:36 AM,2024-06-28T10:36:00.000Z,4,4,,SD,CLOSE,Y,,NO,CHATHAM
23-51092,REMOVE INSTRUMENT AIR,HV-55114,HV-55114,2644,,,11-20-23 1:52 AM,2023-11-20T01:52:00.000Z,4-11-24 12:30 AM,2024-04-11T00:30:00.000Z,6-28-24 10:36 AM,2024-06-28T10:36:00.000Z,4,4,,SD,CLOSE,Y,,NO,CHATHAM
23-51091,HV-55114  VALVE SEAT REPLACEMENT,HV-55114,HV-55114,2644,,,11-20-23 1:52 AM,2023-11-20T01:52:00.000Z,4-11-24 12:00 AM,2024-04-11T00:00:00.000Z,6-28-24 10:36 AM,2024-06-28T10:36:00.000Z,4,4,,SD,CLOSE,Y,N,NO,CHATHAM
23-51090,RE-INSTALL INSTRUMENT AIR,XV-55113,XV-55113,6469,,,11-20-23 1:52 AM,2023-11-20T01:52:00.000Z,4-11-24 1:00 AM,2024-04-11T01:00:00.000Z,12-2-24 8:27 AM,2024-12-02T08:27:00.000Z,4,4,,SD,CLOSE,Y,,NO,CHATHAM
23-51089,CRANE TO SUPPORT RE-INSTALL,XV-55113,XV-55113,6469,,,11-20-23 1:52 AM,2023-11-20T01:52:00.000Z,4-11-24 1:00 AM,2024-04-11T01:00:00.000Z,12-2-24 8:27 AM,2024-12-02T08:27:00.000Z,4,4,,SD,CLOSE,Y,,NO,CHATHAM
23-51088,RE-INSTALL VALVE,XV-55113,XV-55113,6469,,,11-20-23 1:52 AM,2023-11-20T01:52:00.000Z,4-11-24 1:00 AM,2024-04-11T01:00:00.000Z,12-2-24 8:27 AM,2024-12-02T08:27:00.000Z,4,4,,SD,CLOSE,Y,,NO,CHATHAM
23-51087,MSU VALVE SEAT REPLACEMENT,XV-55113,XV-55113,6469,,,11-20-23 1:52 AM,2023-11-20T01:52:00.000Z,4-11-24 1:00 AM,2024-04-11T01:00:00.000Z,12-2-24 8:27 AM,2024-12-02T08:27:00.000Z,4,4,,SD,CLOSE,Y,,NO,CHATHAM
23-51086,CRANE TO SUPPORT REMOVAL,XV-55113,XV-55113,6469,,,11-20-23 1:52 AM,2023-11-20T01:52:00.000Z,4-11-24 12:30 AM,2024-04-11T00:30:00.000Z,12-2-24 8:27 AM,2024-12-02T08:27:00.000Z,4,4,,SD,CLOSE,Y,,NO,CHATHAM
23-51085,REMOVE VALVE FROM SERVICE,XV-55113,XV-55113,6469,,,11-20-23 1:52 AM,2023-11-20T01:52:00.000Z,4-11-24 5:00 AM,2024-04-11T05:00:00.000Z,12-2-24 8:27 AM,2024-12-02T08:27:00.000Z,4,4,,SD,CLOSE,Y,,NO,CHATHAM
23-51084,REMOVE INSTRUMENT AIR,XV-55113,XV-55113,6469,,,11-20-23 1:52 AM,2023-11-20T01:52:00.000Z,4-11-24 12:30 AM,2024-04-11T00:30:00.000Z,12-2-24 8:27 AM,2024-12-02T08:27:00.000Z,4,4,,SD,CLOSE,Y,,NO,CHATHAM
23-51083,XV-55113  VALVE SEAT REPLACEMENT,XV-55113,XV-55113,6469,,,11-20-23 1:52 AM,2023-11-20T01:52:00.000Z,4-11-24 12:00 AM,2024-04-11T00:00:00.000Z,12-2-24 8:27 AM,2024-12-02T08:27:00.000Z,4,4,,SD,CLOSE,Y,N,NO,CHATHAM
23-51082,RE-INSTALL INSTRUMENT AIR,XV-55123,XV-55123,6472,,,11-20-23 1:52 AM,2023-11-20T01:52:00.000Z,4-11-24 1:00 AM,2024-04-11T01:00:00.000Z,12-2-24 8:55 AM,2024-12-02T08:55:00.000Z,4,4,,SD,CLOSE,Y,,NO,CHATHAM
23-51081,CRANE TO SUPPORT RE-INSTALL,XV-55123,XV-55123,6472,,,11-20-23 1:52 AM,2023-11-20T01:52:00.000Z,4-11-24 1:00 AM,2024-04-11T01:00:00.000Z,12-2-24 8:55 AM,2024-12-02T08:55:00.000Z,4,4,,SD,CLOSE,Y,,NO,CHATHAM
23-51080,RE-INSTALL VALVE,XV-55123,XV-55123,6472,,,11-20-23 1:52 AM,2023-11-20T01:52:00.000Z,4-11-24 1:00 AM,2024-04-11T01:00:00.000Z,12-2-24 8:55 AM,2024-12-02T08:55:00.000Z,4,4,,SD,CLOSE,Y,,NO,CHATHAM
23-51079,MSU VALVE SEAT REPLACEMENT,XV-55123,XV-55123,6472,,,11-20-23 1:52 AM,2023-11-20T01:52:00.000Z,4-11-24 1:00 AM,2024-04-11T01:00:00.000Z,12-2-24 8:55 AM,2024-12-02T08:55:00.000Z,4,4,,SD,CLOSE,Y,,NO,CHATHAM
23-51078,CRANE TO SUPPORT REMOVAL,XV-55123,XV-55123,6472,,,11-20-23 1:52 AM,2023-11-20T01:52:00.000Z,4-11-24 12:30 AM,2024-04-11T00:30:00.000Z,12-2-24 8:55 AM,2024-12-02T08:55:00.000Z,4,4,,SD,CLOSE,Y,,NO,CHATHAM
23-51077,REMOVE VALVE FROM SERVICE,XV-55123,XV-55123,6472,,,11-20-23 1:52 AM,2023-11-20T01:52:00.000Z,4-11-24 5:00 AM,2024-04-11T05:00:00.000Z,12-2-24 8:55 AM,2024-12-02T08:55:00.000Z,4,4,,SD,CLOSE,Y,,NO,CHATHAM
23-51076,REMOVE INSTRUMENT AIR,XV-55123,XV-55123,6472,,,11-20-23 1:52 AM,2023-11-20T01:52:00.000Z,4-11-24 12:30 AM,2024-04-11T00:30:00.000Z,12-2-24 8:55 AM,2024-12-02T08:55:00.000Z,4,4,,SD,CLOSE,Y,,NO,CHATHAM
23-51075,XV-55123 VALVE SEAT REPLACEMENT,XV-55123,XV-55123,6472,,,11-20-23 1:52 AM,2023-11-20T01:52:00.000Z,4-11-24 12:00 AM,2024-04-11T00:00:00.000Z,12-2-24 8:55 AM,2024-12-02T08:55:00.000Z,4,4,,SD,CLOSE,Y,N,NO,CHATHAM
23-51074,RE-INSTALL INSTRUMENT AIR,PV-55105,PV-55105,4787,,,11-20-23 1:52 AM,2023-11-20T01:52:00.000Z,4-11-24 1:00 AM,2024-04-11T01:00:00.000Z,6-28-24 10:38 AM,2024-06-28T10:38:00.000Z,4,4,,SD,CLOSE,Y,,NO,CHATHAM
23-51073,CRANE TO SUPPORT RE-INSTALL,PV-55105,PV-55105,4787,,,11-20-23 1:52 AM,2023-11-20T01:52:00.000Z,4-11-24 1:00 AM,2024-04-11T01:00:00.000Z,6-28-24 10:38 AM,2024-06-28T10:38:00.000Z,4,4,,SD,CLOSE,Y,,NO,CHATHAM
