WorkOrder_Asset,WorkOrder_Description,Work_Order,Location,Location_Normalized,Notes,Lead,Reported_Date,Reported_Timestamp,Target_Finish,Target_Finish_Timestamp,Actual_Finish,Actual_Finish_Timestamp,Priority,Priority_Int,Priority_InvalidValue,Work_Type,Status,History,Is_dynamic,Dynamic_Job_Plan_applied,Site,Assets,Asset_Descriptions,Parent,IsProblematic,Area,Tag_Full,INstrumentation_Location,Instrumentation_Type_,Instrumentation_Data_Type,Instrumentation_Data_Type_Meaning,INstrumentation_Type_Description,Role,Instrumentation_Description,Related_Location_Cleaned
,CIP drain valve solenoid will not close,23-31248,1400,1400,,,1-3-23 8:10 AM,2023-01-03T08:10:00.000Z,1-9-23 11:19 AM,2023-01-09T11:19:00.000Z,1-3-23 2:16 PM,2023-01-03T14:16:00.000Z,2,2,,RM,CLOSE,Y,,NO,CHATHAM,,,,,,,,,,,,,,
,"DC 1834 Air Sweep \"A\" came loose",23-31249,DC-1834,DC-1834,,,1-3-23 8:21 AM,2023-01-03T08:21:00.000Z,1-3-23 5:15 AM,2023-01-03T05:15:00.000Z,1-4-23 7:19 AM,2023-01-04T07:19:00.000Z,4,4,,RM,CLOSE,Y,,NO,CHATHAM,"2538, 2539, 6996","FIKE FLAMELESS VENT - E34-004-3636, FIKE FLAMELESS VENT - E34-004-3636, DUST COLLECTOR, IMF, MODEL XXX",6996,Yes,,,,,,,,,,
,CG-2 All Entry Doors latching mechanisms,23-31250,3690,3690,,,1-3-23 8:26 AM,2023-01-03T08:26:00.000Z,1-24-23 1:32 AM,2023-01-24T01:32:00.000Z,3-30-23 8:41 AM,2023-03-30T08:41:00.000Z,4,4,,CO,CLOSE,Y,,NO,CHATHAM,,,,,,,,,,,,,,
,Steam line to heater leaking in Decanter Building,23-31251,1700,1700,,,1-3-23 8:27 AM,2023-01-03T08:27:00.000Z,1-3-23 5:15 AM,2023-01-03T05:15:00.000Z,1-3-23 3:00 PM,2023-01-03T15:00:00.000Z,4,4,,RM,CLOSE,Y,,NO,CHATHAM,,,,,,,,,,,,,,
1453,DA 3602 PIC 69106 Frozen,23-31252,DA-3602,DA-3602,,,1-3-23 8:27 AM,2023-01-03T08:27:00.000Z,1-28-23 12:39 AM,2023-01-28T00:39:00.000Z,1-12-23 2:11 AM,2023-01-12T02:11:00.000Z,4,4,,CO,CLOSE,Y,,NO,CHATHAM,,,,,,,,,,,,,,
,The CB in the front entrance trailer is no longer working,23-31253,0000,0000,,,1-3-23 8:31 AM,2023-01-03T08:31:00.000Z,1-10-23 2:19 PM,2023-01-10T14:19:00.000Z,3-1-23 3:51 PM,2023-03-01T15:51:00.000Z,4,4,,CO,CLOSE,Y,,NO,CHATHAM,,,,,,,,,,,,,,
4946,Safety Shower in Chem storage bldg valve is leaking,23-31254,SS-3516,SS-3516,,,1-3-23 8:37 AM,2023-01-03T08:37:00.000Z,1-6-23 10:18 AM,2023-01-06T10:18:00.000Z,1-4-23 8:43 AM,2023-01-04T08:43:00.000Z,4,4,,RM,CLOSE,Y,,NO,CHATHAM,,,,,,,,,,,,,,
1272,Flexible seal on exhaust duct is leaking,23-31255,B-3602,B-3602,,,1-3-23 8:40 AM,2023-01-03T08:40:00.000Z,5-1-23 5:26 PM,2023-05-01T17:26:00.000Z,1-8-23 7:26 PM,2023-01-08T19:26:00.000Z,4,4,,CO,CLOSE,Y,,NO,CHATHAM,,,,,,,,,,,,,,
,Steam leaking from trap off RC2 steam feed to reboiler,23-31256,1500-PD-15H,1500-PD-15H,,,1-3-23 9:10 AM,2023-01-03T09:10:00.000Z,1-6-23 1:02 PM,2023-01-06T13:02:00.000Z,1-11-23 7:28 AM,2023-01-11T07:28:00.000Z,4,4,,RM,CLOSE,Y,,NO,CHATHAM,,,,,,,,,,,,,,
,Utility water leak on piping under E-1511s,23-31257,3500-26K-04,3500-26K-04,,TAYLOR.LINDSAY,1-3-23 9:17 AM,2023-01-03T09:17:00.000Z,1-6-23 8:55 AM,2023-01-06T08:55:00.000Z,1-9-23 1:05 PM,2023-01-09T13:05:00.000Z,4,4,,RM,CLOSE,Y,,NO,CHATHAM,,,,,,,,,,,,,,
4868,Weigh belt calibration- Ktron,23-31258,SC-1301,SC-1301,,,1-3-23 9:30 AM,2023-01-03T09:30:00.000Z,4-23-23 9:36 AM,2023-04-23T09:36:00.000Z,5-2-23 1:38 PM,2023-05-02T13:38:00.000Z,4,4,,CAL,CLOSE,Y,,NO,CHATHAM,,,,,,,,,,,,,,
,Re-install EHT to E-11402 CIP Supply/Return pipelines,23-31259,1400-PD-14G,1400-PD-14G,,,1-3-23 9:34 AM,2023-01-03T09:34:00.000Z,,,1-3-23 9:51 AM,2023-01-03T09:51:00.000Z,4,4,,CP,CLOSE,Y,,NO,CHATHAM,,,,,,,,,,,,,,
,Re-install wiring to E-11402 instruments,23-31260,1400-PD-14G,1400-PD-14G,,,1-3-23 9:35 AM,2023-01-03T09:35:00.000Z,,,1-3-23 9:51 AM,2023-01-03T09:51:00.000Z,4,4,,CP,CLOSE,Y,,NO,CHATHAM,,,,,,,,,,,,,,
4448,PSV-36803 - Issues found during inspection,23-31261,PSV-36803,PSV-36803,,,1-3-23 9:39 AM,2023-01-03T09:39:00.000Z,4-30-23 9:07 AM,2023-04-30T09:07:00.000Z,5-2-23 10:38 AM,2023-05-02T10:38:00.000Z,4,4,,CO,CLOSE,Y,,NO,CHATHAM,,,,,,,,,,,,,,
4447,PSV-36802 - Issues found during inspection,23-31262,PSV-36802,PSV-36802,,,1-3-23 9:40 AM,2023-01-03T09:40:00.000Z,4-30-23 9:00 AM,2023-04-30T09:00:00.000Z,5-2-23 10:37 AM,2023-05-02T10:37:00.000Z,4,4,,SD,CLOSE,Y,,NO,CHATHAM,,,,,,,,,,,,,,
4445,PSV-36703 - Issues found during inspection,23-31263,PSV-36703,PSV-36703,,,1-3-23 9:42 AM,2023-01-03T09:42:00.000Z,4-30-23 8:57 AM,2023-04-30T08:57:00.000Z,10-26-23 8:46 AM,2023-10-26T08:46:00.000Z,4,4,,CO,CLOSE,Y,,NO,CHATHAM,,,,,,,,,,,,,,
4444,PSV-36702 - Issues found during inspection,23-31264,PSV-36702,PSV-36702,,,1-3-23 9:43 AM,2023-01-03T09:43:00.000Z,12-31-23 8:53 AM,2023-12-31T08:53:00.000Z,10-26-23 8:45 AM,2023-10-26T08:45:00.000Z,4,4,,CO,CLOSE,Y,,NO,CHATHAM,,,,,,,,,,,,,,
4441,PSV-36400 - Issues found during inspection,23-31265,PSV-36701,PSV-36701,,,1-3-23 9:45 AM,2023-01-03T09:45:00.000Z,4-30-23 8:43 AM,2023-04-30T08:43:00.000Z,10-31-23 2:59 PM,2023-10-31T14:59:00.000Z,4,4,,EC,CLOSE,Y,,NO,CHATHAM,,,,,,,,,,,,,,
,"MOC-052, Seperate main dist and HPA 60 to two manual activation buttons ( in main control room)",23-31266,3100-26K-01,3100-26K-01,,,1-3-23 9:47 AM,2023-01-03T09:47:00.000Z,4-28-23 8:00 PM,2023-04-28T20:00:00.000Z,,,4,4,,EC,CAN,Y,,NO,CHATHAM,,,,,,,,,,,,,,
3581,TA23 Repair leaking welded elbow on P1308 bypass line,23-31267,P-1308,P-1308,,,1-3-23 9:49 AM,2023-01-03T09:49:00.000Z,4-25-23 10:10 AM,2023-04-25T10:10:00.000Z,5-8-23 8:08 AM,2023-05-08T08:08:00.000Z,4,4,,CO,CLOSE,Y,,NO,CHATHAM,,,,,,,,,,,,,,
3151,Level  transmitter on P1308B is acting erratic,23-31268,LT-13712,LT-13712,,,1-3-23 9:51 AM,2023-01-03T09:51:00.000Z,1-6-23 9:07 AM,2023-01-06T09:07:00.000Z,1-3-23 10:55 AM,2023-01-03T10:55:00.000Z,4,4,,CO,CLOSE,Y,,NO,CHATHAM,,,,,,,,,,,,,,
7750,Replace bypass valve for FV14320 on GA to TK1402,23-31269,FV-14320,FV-14320,,,1-3-23 10:00 AM,2023-01-03T10:00:00.000Z,1-31-23 4:04 PM,2023-01-31T16:04:00.000Z,2-28-23 3:31 PM,2023-02-28T15:31:00.000Z,4,4,,RM,CLOSE,Y,,NO,CHATHAM,,,,,,,,,,,,,,
3038,LT13712 on TK1308B reading fluctuation,23-31277,LI-13712,LI-13712,,,1-3-23 10:03 AM,2023-01-03T10:03:00.000Z,6-30-23 10:00 AM,2023-06-30T10:00:00.000Z,1-3-23 12:00 PM,2023-01-03T12:00:00.000Z,4,4,,CO,CLOSE,Y,,NO,CHATHAM,,,,,,,,,,,,,,
6669,Change 600V feed on K-3301A from MCC-3802 to MCC-3816/17,23-31278,K-3301A,K-3301A,,,1-3-23 10:06 AM,2023-01-03T10:06:00.000Z,4-23-23 8:32 AM,2023-04-23T08:32:00.000Z,5-25-23 10:24 AM,2023-05-25T10:24:00.000Z,4,4,,SD,CLOSE,Y,,NO,CHATHAM,,,,,,,,,,,,,,
3174,Water leaking from process water line to scrubber,23-31279,LT-16104,LT-16104,,,1-3-23 10:14 AM,2023-01-03T10:14:00.000Z,1-6-23 3:04 AM,2023-01-06T03:04:00.000Z,1-3-23 7:06 AM,2023-01-03T07:06:00.000Z,4,4,,CO,CLOSE,Y,,NO,CHATHAM,,,,,,,,,,,,,,
5475,City water line to TK-1902 not connected and cracked,23-31280,TK-1902,TK-1902,,,1-3-23 10:16 AM,2023-01-03T10:16:00.000Z,1-6-23 11:11 PM,2023-01-06T23:11:00.000Z,1-4-23 8:43 AM,2023-01-04T08:43:00.000Z,4,4,,RM,CLOSE,Y,,NO,CHATHAM,,,,,,,,,,,,,,
6388,RO-A Primary Pressure Transmitter Not Reading Properly,23-31281,WS-3502A,WS-3502A,,,1-3-23 10:22 AM,2023-01-03T10:22:00.000Z,8-31-23 6:44 AM,2023-08-31T06:44:00.000Z,7-3-24 7:59 AM,2024-07-03T07:59:00.000Z,4,4,,RM,CLOSE,Y,,NO,CHATHAM,,,,,,,,,,,,,,
7094,CK Hut H2S monitor calibration,23-31282,4100,4100,,,1-3-23 10:23 AM,2023-01-03T10:23:00.000Z,1-6-23 4:58 PM,2023-01-06T16:58:00.000Z,2-27-23 3:12 PM,2023-02-27T15:12:00.000Z,4,4,,CO,CLOSE,Y,,NO,CHATHAM,,,,,,,,,,,,,,
2043,FT-32111 not reading correctly and showing empty pipe alarm in the field,23-31283,FT-32111,FT-32111,,,1-3-23 10:25 AM,2023-01-03T10:25:00.000Z,1-19-23 1:03 PM,2023-01-19T13:03:00.000Z,1-3-23 1:43 PM,2023-01-03T13:43:00.000Z,4,4,,CO,CLOSE,Y,,NO,CHATHAM,,,,,,,,,,,,,,
1330,Replace light bulb in fixture on east side of Utilities control room,23-31284,BU-UTIL,BU-UTIL,,,1-3-23 10:27 AM,2023-01-03T10:27:00.000Z,1-6-23 11:43 PM,2023-01-06T23:43:00.000Z,1-3-23 1:44 PM,2023-01-03T13:44:00.000Z,4,4,,CO,CLOSE,Y,,NO,CHATHAM,,,,,,,,,,,,,,
1315,Portable Eyewash Station at Alcohol Loading Rail - power needed to prevent freezing,23-31288,BU-ALCO,BU-ALCO,,,1-3-23 3:58 PM,2023-01-03T15:58:00.000Z,12-23-22 7:14 AM,2022-12-23T07:14:00.000Z,1-3-23 4:04 PM,2023-01-03T16:04:00.000Z,2,2,,SA,CLOSE,Y,,NO,CHATHAM,,,,,,,,,,,,,,
1435,Speed Switch on CV 2108,23-31289,CV-2108,CV-2108,,,1-4-23 4:39 AM,2023-01-04T04:39:00.000Z,1-4-23 8:00 AM,2023-01-04T08:00:00.000Z,1-6-23 7:54 AM,2023-01-06T07:54:00.000Z,1,1,,RM,CLOSE,Y,,NO,CHATHAM,,,,,,,,,,,,,,
,Inspect cooling tower pump inlet screens,23-31290,CT-3201,CT-3201,,,1-4-23 7:13 AM,2023-01-04T07:13:00.000Z,1-31-23 11:05 AM,2023-01-31T11:05:00.000Z,1-5-23 1:07 PM,2023-01-05T13:07:00.000Z,4,4,,PM,CLOSE,Y,,NO,CHATHAM,,,,,,,,,,,,,,
1435,CV2108 junction box,23-31292,CV-2108,CV-2108,,,1-4-23 8:59 AM,2023-01-04T08:59:00.000Z,1-4-23 12:00 PM,2023-01-04T12:00:00.000Z,1-6-23 7:54 AM,2023-01-06T07:54:00.000Z,1,1,,RM,CLOSE,Y,,NO,CHATHAM,,,,,,,,,,,,,,
6669,INSPECT VALVE,23-31293,K-3301A,K-3301A,,,1-4-23 3:02 PM,2023-01-04T15:02:00.000Z,12-9-22 8:59 PM,2022-12-09T20:59:00.000Z,1-9-23 3:42 PM,2023-01-09T15:42:00.000Z,4,4,,CO,CLOSE,Y,,NO,CHATHAM,,,,,,,,,,,,,,
3585,Clean strainer on P-1312 water line,23-31295,P-1312,P-1312,,,1-4-23 5:20 PM,2023-01-04T17:20:00.000Z,,,1-5-23 3:40 PM,2023-01-05T15:40:00.000Z,2,2,,CO,CLOSE,Y,,NO,CHATHAM,,,,,,,,,,,,,,
1316,Repair receptacle and Thermostat in ferric dosing hut,23-31298,BU-BIOTH,BU-BIOTH,,,1-5-23 7:08 AM,2023-01-05T07:08:00.000Z,1-11-23 5:27 AM,2023-01-11T05:27:00.000Z,1-9-23 5:59 AM,2023-01-09T05:59:00.000Z,4,4,,RM,CLOSE,Y,,NO,CHATHAM,,,,,,,,,,,,,,
,Steve M sort DCS components,23-31299,,,,,1-12-23 7:23 AM,2023-01-12T07:23:00.000Z,1-20-23 7:23 AM,2023-01-20T07:23:00.000Z,1-12-23 3:07 PM,2023-01-12T15:07:00.000Z,4,4,,CO,CLOSE,Y,,NO,CHATHAM,,,,,,,,,,,,,,
3404,Install swing gate at top of CMill,23-31300,MI-1201C,MI-1201C,,,1-5-23 7:48 AM,2023-01-05T07:48:00.000Z,,,1-5-23 10:19 AM,2023-01-05T10:19:00.000Z,4,4,,CO,CLOSE,Y,,NO,CHATHAM,,,,,,,,,,,,,,
1314,Install safety treads on the staircase to security trailer,23-31302,BU-ADMIN,BU-ADMIN,,,1-5-23 12:42 PM,2023-01-05T12:42:00.000Z,1-13-23 12:00 PM,2023-01-13T12:00:00.000Z,1-6-23 4:00 PM,2023-01-06T16:00:00.000Z,1,1,,SA,CLOSE,Y,,NO,CHATHAM,,,,,,,,,,,,,,
4868,Clean Weigh Belt,23-31303,SC-1301,SC-1301,,,1-5-23 12:49 PM,2023-01-05T12:49:00.000Z,1-12-23 11:54 AM,2023-01-12T11:54:00.000Z,1-10-23 1:24 PM,2023-01-10T13:24:00.000Z,4,4,,CO,CLOSE,Y,,NO,CHATHAM,,,,,,,,,,,,,,
6309,TA 23 Gasket Failure of Chevron wash to V-1630,23-31310,V-1630,V-1630,,OC-MECH,1-5-23 3:33 PM,2023-01-05T15:33:00.000Z,4-24-23 11:12 AM,2023-04-24T11:12:00.000Z,5-24-23 8:22 AM,2023-05-24T08:22:00.000Z,4,4,,CO,CLOSE,Y,,NO,CHATHAM,,,,,,,,,,,,,,
P-2303A,TA23 replace gate valve at the presure gauge on p-2303,23-31311,CHATHAM,CHATHAM,,,1-5-23 3:34 PM,2023-01-05T15:34:00.000Z,,,4-27-23 10:12 AM,2023-04-27T10:12:00.000Z,4,4,,SD,CLOSE,Y,,NO,CHATHAM,,,,,,,,,,,,,,
1487,SD23 - CIP return v/v to E-1400 is passing,23-31312,E-1400,E-1400,,,1-5-23 3:35 PM,2023-01-05T15:35:00.000Z,,,3-9-23 8:38 AM,2023-03-09T08:38:00.000Z,4,4,,SD,CLOSE,Y,,NO,CHATHAM,,,,,,,,,,,,,,
6728,Steve M/Viraj- Commission P-1308B Monday,23-31313,P-1305B,P-1305B,,,1-5-23 4:09 PM,2023-01-05T16:09:00.000Z,1-9-23 4:09 PM,2023-01-09T16:09:00.000Z,1-9-23 5:39 PM,2023-01-09T17:39:00.000Z,4,4,,CO,CLOSE,Y,,NO,CHATHAM,,,,,,,,,,,,,,
9816,komatsu loader driving issue,23-31314,LD-2100,LD-2100,,,1-6-23 7:13 AM,2023-01-06T07:13:00.000Z,1-6-23 1:00 PM,2023-01-06T13:00:00.000Z,1-6-23 3:13 PM,2023-01-06T15:13:00.000Z,2,2,,RM,CLOSE,Y,,NO,CHATHAM,,,,,,,,,,,,,,
1117,Clean and inspect witches hat upstream of P1844,23-31315,P-1844,P-1844,,,1-6-23 7:24 AM,2023-01-06T07:24:00.000Z,1-13-23 2:58 PM,2023-01-13T14:58:00.000Z,1-11-23 4:58 PM,2023-01-11T16:58:00.000Z,4,4,,CO,CLOSE,Y,,NO,CHATHAM,1117,GOULDS PUMP 3196 MTi,,No,,,,,,,,,,
,Phase 2 Replace all building exterior door knobs with push paddles,23-31318,CHATHAM,CHATHAM,,,1-6-23 7:50 AM,2023-01-06T07:50:00.000Z,,,4-11-23 9:21 AM,2023-04-11T09:21:00.000Z,4,4,,CO,CLOSE,Y,,NO,CHATHAM,,,,,,,,,,,,,,
1117,remove strainer/Clean and inspect,23-31319,P-1844,P-1844,,,1-6-23 8:04 AM,2023-01-06T08:04:00.000Z,1-13-23 2:58 PM,2023-01-13T14:58:00.000Z,1-12-23 6:27 AM,2023-01-12T06:27:00.000Z,4,4,,CO,CLOSE,Y,,NO,CHATHAM,1117,GOULDS PUMP 3196 MTi,,No,,,,,,,,,,
,,23-31320,,,,,1-6-23 8:05 AM,2023-01-06T08:05:00.000Z,1-13-23 2:58 PM,2023-01-13T14:58:00.000Z,1-6-23 3:14 PM,2023-01-06T15:14:00.000Z,4,4,,CO,CLOSE,Y,,NO,CHATHAM,,,,,,,,,,,,,,
1117,reinstall,23-31322,P-1844,P-1844,,,1-6-23 8:06 AM,2023-01-06T08:06:00.000Z,1-13-23 2:58 PM,2023-01-13T14:58:00.000Z,1-12-23 6:27 AM,2023-01-12T06:27:00.000Z,4,4,,CO,CLOSE,Y,,NO,CHATHAM,1117,GOULDS PUMP 3196 MTi,,No,,,,,,,,,,
2536,Reapply silicone around insulation on dryer cyclones,23-31323,CY-1829,CY-1829,,,1-6-23 8:29 AM,2023-01-06T08:29:00.000Z,2-23-23 1:03 PM,2023-02-23T13:03:00.000Z,2-6-23 2:20 PM,2023-02-06T14:20:00.000Z,4,4,,CO,CLOSE,Y,,NO,CHATHAM,2536,"CYCLONE ASSEMBLY, LEFT HAND, DEDERT MODEL# CYCL-12 B",,No,CH-DRYER_A,CH-DRYER_A:SI18152.MEAS,SI-18152,SI,MEAS,Measured value (PV),Speed indication (feedback),Measurement,CY1829 MID TEMP,CY-1829
2536,Reapply silicone around insulation on dryer cyclones,23-31323,CY-1829,CY-1829,,,1-6-23 8:29 AM,2023-01-06T08:29:00.000Z,2-23-23 1:03 PM,2023-02-23T13:03:00.000Z,2-6-23 2:20 PM,2023-02-06T14:20:00.000Z,4,4,,CO,CLOSE,Y,,NO,CHATHAM,2536,"CYCLONE ASSEMBLY, LEFT HAND, DEDERT MODEL# CYCL-12 B",,No,CH-DRYER_A,CH-DRYER_A:IT18152.MEAS,IT-18152,IT,MEAS,Measured value (PV),Current transmitter (motor amps),Measurement,CY1829 TOP TEMP,CY-1829
2536,Reapply silicone around insulation on dryer cyclones,23-31323,CY-1829,CY-1829,,,1-6-23 8:29 AM,2023-01-06T08:29:00.000Z,2-23-23 1:03 PM,2023-02-23T13:03:00.000Z,2-6-23 2:20 PM,2023-02-06T14:20:00.000Z,4,4,,CO,CLOSE,Y,,NO,CHATHAM,2536,"CYCLONE ASSEMBLY, LEFT HAND, DEDERT MODEL# CYCL-12 B",,No,CH-DRYER_A,CH-DRYER_A:SSL18152.CIN,SSL-18152,SSL,CIN,Contact input (discrete),Speed switch (motion proof),Discrete Input,CY1829 BOTTOM TEMP,CY-1829
1491,E-1403 Replacement Project Tie Points,23-31325,E-1403,E-1403,,,1-6-23 8:38 AM,2023-01-06T08:38:00.000Z,4-21-23 2:44 PM,2023-04-21T14:44:00.000Z,5-5-23 3:27 PM,2023-05-05T15:27:00.000Z,4,4,,CP,CLOSE,Y,,NO,CHATHAM,,,,,,,,,,,,,,
5457,Heat Trace/thermostat on GA recirculation line - ON,23-31326,TK-1310A,TK-1310A,,,1-6-23 8:49 AM,2023-01-06T08:49:00.000Z,1-20-23 8:11 AM,2023-01-20T08:11:00.000Z,1-6-23 8:52 AM,2023-01-06T08:52:00.000Z,4,4,,CO,CLOSE,Y,,NO,CHATHAM,,,,,,,,,,,,,,
5468,Internal Inspection TK1601,23-31327,TK-1601,TK-1601,,,1-6-23 8:54 AM,2023-01-06T08:54:00.000Z,4-22-23 8:42 AM,2023-04-22T08:42:00.000Z,5-16-23 2:35 PM,2023-05-16T14:35:00.000Z,4,4,,PM,CLOSE,Y,,NO,CHATHAM,,,,,,,,,,,,,,
5449,Level Transimiter on TK11402,23-31328,TK-11402,TK-11402,,,1-6-23 9:00 AM,2023-01-06T09:00:00.000Z,1-18-23 6:37 AM,2023-01-18T06:37:00.000Z,,,4,4,,CO,CAN,Y,,NO,CHATHAM,,,,,,,,,,,,,,
,Women's washroom toilets are inadequate,23-31329,BU-ADMIN,BU-ADMIN,,,1-6-23 9:05 AM,2023-01-06T09:05:00.000Z,1-11-23 10:10 AM,2023-01-11T10:10:00.000Z,1-31-23 8:15 AM,2023-01-31T08:15:00.000Z,4,4,,RM,CLOSE,Y,,NO,CHATHAM,,,,,,,,,,,,,,
1233,Requesting I/E to investigate RC1 base strength analyzer limits (AT-15816),23-31330,AT-15816,AT-15816,,,1-6-23 9:09 AM,2023-01-06T09:09:00.000Z,1-31-23 11:29 AM,2023-01-31T11:29:00.000Z,1-11-23 12:36 PM,2023-01-11T12:36:00.000Z,4,4,,CO,CLOSE,Y,,NO,CHATHAM,,,,,,,,,,,,,,
1367,Replace leaking gasket on TGF condenser duct,23-31331,C-1840,C-1840,,,1-6-23 9:56 AM,2023-01-06T09:56:00.000Z,10-31-24 9:26 AM,2024-10-31T09:26:00.000Z,11-19-24 8:32 PM,2024-11-19T20:32:00.000Z,4,4,,SD,CLOSE,Y,,NO,CHATHAM,1367,TRULY GREEN FARMS CONDENSER,,No,,,,,,,,,,
,R&D sump  Installation,23-31332,,,,,1-6-23 10:00 AM,2023-01-06T10:00:00.000Z,1-11-23 10:00 AM,2023-01-11T10:00:00.000Z,1-9-23 2:00 PM,2023-01-09T14:00:00.000Z,4,4,,CO,CLOSE,Y,,NO,CHATHAM,,,,,,,,,,,,,,
1367,Inspect TGF Condenser,23-31333,C-1840,C-1840,,,1-6-23 11:15 AM,2023-01-06T11:15:00.000Z,1-13-23 10:10 AM,2023-01-13T10:10:00.000Z,1-10-23 11:13 AM,2023-01-10T11:13:00.000Z,4,4,,CO,CLOSE,Y,,NO,CHATHAM,1367,TRULY GREEN FARMS CONDENSER,,No,,,,,,,,,,
2667,Verify Operation on Actuators/see Mike J,23-31342,HV-84597,HV-84597,,,1-6-23 2:16 PM,2023-01-06T14:16:00.000Z,1-13-23 2:16 PM,2023-01-13T14:16:00.000Z,1-11-23 3:16 PM,2023-01-11T15:16:00.000Z,4,4,,CO,CLOSE,Y,,NO,CHATHAM,,,,,,,,,,,,,,
,1600 AREA - EQUIPMENT GREASING,23-31344,1600,1600,,,1-9-23 1:45 AM,2023-01-09T01:45:00.000Z,2-4-23 1:00 AM,2023-02-04T01:00:00.000Z,2-16-23 1:00 AM,2023-02-16T01:00:00.000Z,4,4,,PM,CLOSE,Y,N,NO,CHATHAM,,,,,,,,,,,,,,
,1600 AREA 4 MONTH EQUIPMENT GREASE PM,23-31345,1600,1600,,,1-9-23 1:45 AM,2023-01-09T01:45:00.000Z,2-4-23 1:00 AM,2023-02-04T01:00:00.000Z,2-21-23 6:12 AM,2023-02-21T06:12:00.000Z,4,4,,PM,CLOSE,Y,,NO,CHATHAM,,,,,,,,,,,,,,
,PROCEDURE - REGREASING OPTIM/ TECO INDUCTION MOTOR,23-31346,1600,1600,,,1-9-23 1:45 AM,2023-01-09T01:45:00.000Z,2-4-23 12:00 AM,2023-02-04T00:00:00.000Z,2-21-23 6:12 AM,2023-02-21T06:12:00.000Z,4,4,,PM,CLOSE,Y,,NO,CHATHAM,,,,,,,,,,,,,,
2481,H-1801D - DRYER D FUEL GAS SYSTEM ROUTINE PM - DR02 ISO 14001,23-31347,H-1801D,H-1801D,,,1-9-23 1:46 AM,2023-01-09T01:46:00.000Z,10-30-23 4:00 AM,2023-10-30T04:00:00.000Z,8-2-23 7:59 AM,2023-08-02T07:59:00.000Z,4,4,,PM,CLOSE,Y,N,NO,CHATHAM,2481,DRYER D COMBUSTION AIR BURNER,,No,,,,,,,,,,
2481,INSPECT FLAME SENSORS,23-31348,H-1801D,H-1801D,,,1-9-23 1:46 AM,2023-01-09T01:46:00.000Z,5-4-23 12:00 AM,2023-05-04T00:00:00.000Z,8-2-23 7:59 AM,2023-08-02T07:59:00.000Z,4,4,,SD,CLOSE,Y,,NO,CHATHAM,2481,DRYER D COMBUSTION AIR BURNER,,No,,,,,,,,,,
2481,TEST ALL ALARMS FOR PROPER SIGNALS,23-31349,H-1801D,H-1801D,,,1-9-23 1:46 AM,2023-01-09T01:46:00.000Z,5-4-23 12:00 AM,2023-05-04T00:00:00.000Z,8-2-23 7:59 AM,2023-08-02T07:59:00.000Z,4,4,,SD,CLOSE,Y,,NO,CHATHAM,2481,DRYER D COMBUSTION AIR BURNER,,No,,,,,,,,,,
2481,CHECK SPARK PROBE,23-31350,H-1801D,H-1801D,,,1-9-23 1:46 AM,2023-01-09T01:46:00.000Z,5-4-23 12:00 AM,2023-05-04T00:00:00.000Z,8-2-23 7:59 AM,2023-08-02T07:59:00.000Z,4,4,,SD,CLOSE,Y,,NO,CHATHAM,2481,DRYER D COMBUSTION AIR BURNER,,No,,,,,,,,,,
2481,CHECK ALL VALVE MOTORS,23-31351,H-1801D,H-1801D,,,1-9-23 1:46 AM,2023-01-09T01:46:00.000Z,5-4-23 12:00 AM,2023-05-04T00:00:00.000Z,8-2-23 7:59 AM,2023-08-02T07:59:00.000Z,4,4,,SD,CLOSE,Y,,NO,CHATHAM,2481,DRYER D COMBUSTION AIR BURNER,,No,,,,,,,,,,
2481,TEST INTERLOCKS,23-31352,H-1801D,H-1801D,,,1-9-23 1:46 AM,2023-01-09T01:46:00.000Z,5-4-23 12:00 AM,2023-05-04T00:00:00.000Z,8-2-23 7:59 AM,2023-08-02T07:59:00.000Z,4,4,,SD,CLOSE,Y,,NO,CHATHAM,2481,DRYER D COMBUSTION AIR BURNER,,No,,,,,,,,,,
2481,TEST MANUAL FUEL VALVES,23-31353,H-1801D,H-1801D,,,1-9-23 1:46 AM,2023-01-09T01:46:00.000Z,5-4-23 12:00 AM,2023-05-04T00:00:00.000Z,8-2-23 7:59 AM,2023-08-02T07:59:00.000Z,4,4,,SD,CLOSE,Y,,NO,CHATHAM,2481,DRYER D COMBUSTION AIR BURNER,,No,,,,,,,,,,
2481,CHECK FILTERS,23-31354,H-1801D,H-1801D,,,1-9-23 1:46 AM,2023-01-09T01:46:00.000Z,5-4-23 12:00 AM,2023-05-04T00:00:00.000Z,8-2-23 7:59 AM,2023-08-02T07:59:00.000Z,4,4,,SD,CLOSE,Y,,NO,CHATHAM,2481,DRYER D COMBUSTION AIR BURNER,,No,,,,,,,,,,
2481,CHECK GAS FILTERS OR STRAINERS,23-31355,H-1801D,H-1801D,,,1-9-23 1:46 AM,2023-01-09T01:46:00.000Z,5-4-23 12:00 AM,2023-05-04T00:00:00.000Z,8-2-23 7:59 AM,2023-08-02T07:59:00.000Z,4,4,,SD,CLOSE,Y,,NO,CHATHAM,2481,DRYER D COMBUSTION AIR BURNER,,No,,,,,,,,,,
2481,PERFORM ALL OTHER WORK DEEMED NECESSARY,23-31356,H-1801D,H-1801D,,,1-9-23 1:46 AM,2023-01-09T01:46:00.000Z,5-4-23 12:00 AM,2023-05-04T00:00:00.000Z,8-2-23 7:59 AM,2023-08-02T07:59:00.000Z,4,4,,SD,CLOSE,Y,,NO,CHATHAM,2481,DRYER D COMBUSTION AIR BURNER,,No,,,,,,,,,,
,2100 AREA - MOTOR BEARING GREASING,23-31357,2100,2100,,,1-9-23 1:46 AM,2023-01-09T01:46:00.000Z,2-1-23 1:00 AM,2023-02-01T01:00:00.000Z,2-1-23 1:00 AM,2023-02-01T01:00:00.000Z,4,4,,PM,CLOSE,Y,N,NO,CHATHAM,,,,,,,,,,,,,,
,2100 AREA 6 MONTH GREASE PM,23-31358,2100,2100,,,1-9-23 1:46 AM,2023-01-09T01:46:00.000Z,2-1-23 1:00 AM,2023-02-01T01:00:00.000Z,2-2-23 5:17 PM,2023-02-02T17:17:00.000Z,4,4,,PM,CLOSE,Y,,NO,CHATHAM,,,,,,,,,,,,,,
,PROCEDURE - REGREASING OPTIM/ TECO INDUCTION MOTOR,23-31359,2100,2100,,,1-9-23 1:46 AM,2023-01-09T01:46:00.000Z,2-1-23 12:00 AM,2023-02-01T00:00:00.000Z,2-2-23 5:17 PM,2023-02-02T17:17:00.000Z,4,4,,PM,CLOSE,Y,,NO,CHATHAM,,,,,,,,,,,,,,
3081,BIOTHANE FLOAT OP CHECK- (LSH-41401) - PM SERVICE,23-31360,LSH-41401,LSH-41401,,,1-9-23 1:46 AM,2023-01-09T01:46:00.000Z,2-6-23 12:30 AM,2023-02-06T00:30:00.000Z,2-6-23 12:30 AM,2023-02-06T00:30:00.000Z,4,4,,PM,CLOSE,Y,N,NO,CHATHAM,,,,,,,,,,,,,,
3081,Check operation of biothane float in diked area,23-31361,LSH-41401,LSH-41401,,,1-9-23 1:46 AM,2023-01-09T01:46:00.000Z,2-6-23 12:30 AM,2023-02-06T00:30:00.000Z,2-7-23 10:29 AM,2023-02-07T10:29:00.000Z,4,4,,PM,CLOSE,Y,,NO,CHATHAM,,,,,,,,,,,,,,
1321,GENERAL EXHAUST FAN - (DEN-GEF) - PM SERVICE,23-31362,BU-DENA,BU-DENA,,,1-9-23 1:46 AM,2023-01-09T01:46:00.000Z,2-4-23 1:30 AM,2023-02-04T01:30:00.000Z,3-16-23 6:54 AM,2023-03-16T06:54:00.000Z,4,4,,PM,CLOSE,Y,N,NO,CHATHAM,,,,,,,,,,,,,,
1321,General fan inspection and cleaning,23-31363,BU-DENA,BU-DENA,,,1-9-23 1:46 AM,2023-01-09T01:46:00.000Z,2-4-23 1:30 AM,2023-02-04T01:30:00.000Z,3-16-23 6:54 AM,2023-03-16T06:54:00.000Z,4,4,,PM,CLOSE,Y,,NO,CHATHAM,,,,,,,,,,,,,,
4865,SA-2101 CORN PROBE - MECHANICAL  PM,23-31364,SA-2101,SA-2101,,,1-9-23 1:46 AM,2023-01-09T01:46:00.000Z,2-6-23 7:30 AM,2023-02-06T07:30:00.000Z,2-10-23 4:25 PM,2023-02-10T16:25:00.000Z,4,4,,PM,CLOSE,Y,N,NO,CHATHAM,,,,,,,,,,,,,,
4865,Corn Probe Weekly PM,23-31365,SA-2101,SA-2101,,,1-9-23 1:46 AM,2023-01-09T01:46:00.000Z,2-6-23 7:30 AM,2023-02-06T07:30:00.000Z,2-10-23 4:25 PM,2023-02-10T16:25:00.000Z,4,4,,PM,CLOSE,Y,,NO,CHATHAM,,,,,,,,,,,,,,
,ELECTRIC HEAT TRACING CHECK - PM SERVICE,23-31366,3800,3800,,,1-9-23 1:46 AM,2023-01-09T01:46:00.000Z,2-1-23 8:00 AM,2023-02-01T08:00:00.000Z,2-1-23 3:00 AM,2023-02-01T03:00:00.000Z,4,4,,PM,CLOSE,Y,N,NO,CHATHAM,,,,,,,,,,,,,,
,ELECTRIC HEAT TRACE MONTHLY  CHECKS - ( SEP - APR),23-31367,3800,3800,,,1-9-23 1:46 AM,2023-01-09T01:46:00.000Z,2-1-23 8:00 AM,2023-02-01T08:00:00.000Z,2-3-23 3:23 PM,2023-02-03T15:23:00.000Z,4,4,,PM,CLOSE,Y,,NO,CHATHAM,,,,,,,,,,,,,,
,P-1702A - OIL CHANGE/ PM SERVICE,23-31368,P-1702A,P-1702A,,,1-9-23 1:46 AM,2023-01-09T01:46:00.000Z,6-1-23 1:00 AM,2023-06-01T01:00:00.000Z,6-1-23 1:00 AM,2023-06-01T01:00:00.000Z,4,4,,PM,CLOSE,Y,N,NO,CHATHAM,,,,,,,,,,,,,,
,OIL CHANGE ON GOULDS PUMPS,23-31369,P-1702A,P-1702A,,,1-9-23 1:46 AM,2023-01-09T01:46:00.000Z,6-1-23 12:30 AM,2023-06-01T00:30:00.000Z,6-6-23 9:56 AM,2023-06-06T09:56:00.000Z,4,4,,PM,CLOSE,Y,,NO,CHATHAM,,,,,,,,,,,,,,
,REMOVE COUPLING GUARD AND INSPECT OMEGA ELEMENT,23-31370,P-1702A,P-1702A,,,1-9-23 1:46 AM,2023-01-09T01:46:00.000Z,6-1-23 12:15 AM,2023-06-01T00:15:00.000Z,6-6-23 9:56 AM,2023-06-06T09:56:00.000Z,4,4,,PM,CLOSE,Y,,NO,CHATHAM,,,,,,,,,,,,,,
,CHECK THE IMPROSEALS FOR OIL LEAKAGE,23-31371,P-1702A,P-1702A,,,1-9-23 1:46 AM,2023-01-09T01:46:00.000Z,6-1-23 12:15 AM,2023-06-01T00:15:00.000Z,6-6-23 9:56 AM,2023-06-06T09:56:00.000Z,4,4,,PM,CLOSE,Y,,NO,CHATHAM,,,,,,,,,,,,,,
,SAFETY SHOWER FLUSH & CHECK - PM SERVICE,23-31372,CHATHAM,CHATHAM,,,1-9-23 1:46 AM,2023-01-09T01:46:00.000Z,2-6-23 1:30 AM,2023-02-06T01:30:00.000Z,2-24-23 8:54 AM,2023-02-24T08:54:00.000Z,4,4,,PM,CLOSE,Y,N,NO,CHATHAM,,,,,,,,,,,,,,
,SAFETY SHOWER WEEKLY FLUSH,23-31373,CHATHAM,CHATHAM,,,1-9-23 1:46 AM,2023-01-09T01:46:00.000Z,2-6-23 1:30 AM,2023-02-06T01:30:00.000Z,2-24-23 8:54 AM,2023-02-24T08:54:00.000Z,4,4,,PM,CLOSE,Y,,NO,CHATHAM,,,,,,,,,,,,,,
7138,ACCULOAD SCULLY CABLE -PM SERVICE,23-31374,FQIC-2203,FQIC-2203,,,1-9-23 1:46 AM,2023-01-09T01:46:00.000Z,2-3-23 12:30 AM,2023-02-03T00:30:00.000Z,2-3-23 12:30 AM,2023-02-03T00:30:00.000Z,4,4,,PM,CLOSE,Y,N,NO,CHATHAM,,,,,,,,,,,,,,
7138,ACCULOAD SCULLY CABLE BI-WEEKLY PM,23-31375,FQIC-2203,FQIC-2203,,,1-9-23 1:46 AM,2023-01-09T01:46:00.000Z,2-3-23 12:30 AM,2023-02-03T00:30:00.000Z,2-7-23 8:37 AM,2023-02-07T08:37:00.000Z,4,4,,PM,CLOSE,Y,,NO,CHATHAM,,,,,,,,,,,,,,
4868,SC-1301 - MECHANICAL CHECKS,23-31376,SC-1301,SC-1301,,,1-9-23 1:46 AM,2023-01-09T01:46:00.000Z,2-6-23 1:00 AM,2023-02-06T01:00:00.000Z,2-22-23 8:05 AM,2023-02-22T08:05:00.000Z,4,4,,PM,CLOSE,Y,N,NO,CHATHAM,,,,,,,,,,,,,,
4868,SC-1301 MECHANICAL CHECKS,23-31377,SC-1301,SC-1301,,,1-9-23 1:46 AM,2023-01-09T01:46:00.000Z,2-6-23 1:00 AM,2023-02-06T01:00:00.000Z,2-22-23 8:05 AM,2023-02-22T08:05:00.000Z,4,4,,PM,CLOSE,Y,,NO,CHATHAM,,,,,,,,,,,,,,
,Clean Evaporator/Condenser Tubes on Chiller,23-31378,ME-3251,ME-3251,,,1-9-23 1:46 AM,2023-01-09T01:46:00.000Z,2-2-23 6:00 AM,2023-02-02T06:00:00.000Z,5-29-23 11:09 AM,2023-05-29T11:09:00.000Z,4,4,,PM,CLOSE,Y,N,NO,CHATHAM,,,,,,,,,,,,,,
,Clean Evaporator Tubes on Chiller,23-31379,ME-3251,ME-3251,,,1-9-23 1:46 AM,2023-01-09T01:46:00.000Z,2-2-23 6:00 AM,2023-02-02T06:00:00.000Z,5-29-23 11:09 AM,2023-05-29T11:09:00.000Z,4,4,,PM,CLOSE,Y,,NO,CHATHAM,,,,,,,,,,,,,,
,Annually Clean Condenser Tubes on Chiller,23-31380,ME-3251,ME-3251,,,1-9-23 1:46 AM,2023-01-09T01:46:00.000Z,2-3-23 12:00 PM,2023-02-03T12:00:00.000Z,5-29-23 11:09 AM,2023-05-29T11:09:00.000Z,4,4,,PM,CLOSE,Y,,NO,CHATHAM,,,,,,,,,,,,,,
,General plant - Fire Alarm Inspection,23-31381,CHATHAM,CHATHAM,,,1-9-23 1:46 AM,2023-01-09T01:46:00.000Z,3-5-23 12:00 AM,2023-03-05T00:00:00.000Z,3-1-23 3:50 PM,2023-03-01T15:50:00.000Z,4,4,,PM,CLOSE,Y,N,NO,CHATHAM,,,,,,,,,,,,,,
,Inspection,23-31382,CHATHAM,CHATHAM,,,1-9-23 1:46 AM,2023-01-09T01:46:00.000Z,3-5-23 12:00 AM,2023-03-05T00:00:00.000Z,3-1-23 3:50 PM,2023-03-01T15:50:00.000Z,4,4,,PM,CLOSE,Y,,NO,CHATHAM,,,,,,,,,,,,,,
2481,BMS testing (prior to start-up) DR01,23-31383,H-1801D,H-1801D,,IAN.FINDLATER,1-9-23 1:47 AM,2023-01-09T01:47:00.000Z,5-4-23 12:00 AM,2023-05-04T00:00:00.000Z,5-19-23 2:04 PM,2023-05-19T14:04:00.000Z,4,4,,PM,CLOSE,Y,N,NO,CHATHAM,2481,DRYER D COMBUSTION AIR BURNER,,No,,,,,,,,,,
2481,BMS testing (prior to start-up),23-31384,H-1801D,H-1801D,,,1-9-23 1:47 AM,2023-01-09T01:47:00.000Z,5-4-23 12:00 AM,2023-05-04T00:00:00.000Z,5-19-23 2:04 PM,2023-05-19T14:04:00.000Z,4,4,,SD,CLOSE,Y,,NO,CHATHAM,2481,DRYER D COMBUSTION AIR BURNER,,No,,,,,,,,,,
2481,Repair any problems found during testing,23-31385,H-1801D,H-1801D,,,1-9-23 1:47 AM,2023-01-09T01:47:00.000Z,5-4-23 12:00 AM,2023-05-04T00:00:00.000Z,5-19-23 2:04 PM,2023-05-19T14:04:00.000Z,4,4,,SD,CLOSE,Y,,NO,CHATHAM,2481,DRYER D COMBUSTION AIR BURNER,,No,,,,,,,,,,
2481,Re-test BMS (if needed),23-31386,H-1801D,H-1801D,,,1-9-23 1:47 AM,2023-01-09T01:47:00.000Z,5-4-23 12:00 AM,2023-05-04T00:00:00.000Z,5-19-23 2:04 PM,2023-05-19T14:04:00.000Z,4,4,,SD,CLOSE,Y,,NO,CHATHAM,2481,DRYER D COMBUSTION AIR BURNER,,No,,,,,,,,,,
1690,BASEMENT VENTILATION BLOWER MECHANICAL PM,23-31387,FA-2115,FA-2115,,,1-9-23 1:47 AM,2023-01-09T01:47:00.000Z,2-4-23 1:30 AM,2023-02-04T01:30:00.000Z,5-18-23 10:09 AM,2023-05-18T10:09:00.000Z,4,4,,PM,CLOSE,Y,N,NO,CHATHAM,,,,,,,,,,,,,,
1690,EXHAULT/ SUPPLY AIR BLOWER PM,23-31388,FA-2115,FA-2115,,,1-9-23 1:47 AM,2023-01-09T01:47:00.000Z,2-4-23 1:30 AM,2023-02-04T01:30:00.000Z,5-18-23 10:09 AM,2023-05-18T10:09:00.000Z,4,4,,PM,CLOSE,Y,,NO,CHATHAM,,,,,,,,,,,,,,
7174,DRYER SCRUBBER PH PROBE PM,23-31389,AE-84404,AE-84404,,,1-9-23 1:47 AM,2023-01-09T01:47:00.000Z,2-2-23 1:00 AM,2023-02-02T01:00:00.000Z,2-2-23 12:30 AM,2023-02-02T00:30:00.000Z,4,4,,PM,CLOSE,Y,N,NO,CHATHAM,,,,,,,,,,,,,,
7174,CONDUCTIVITY METER /PH PROBE CLEAN & CALIBRATE PM,23-31390,AE-84404,AE-84404,,,1-9-23 1:47 AM,2023-01-09T01:47:00.000Z,2-2-23 2:00 AM,2023-02-02T02:00:00.000Z,2-3-23 11:33 AM,2023-02-03T11:33:00.000Z,4,4,,PM,CLOSE,Y,,NO,CHATHAM,,,,,,,,,,,,,,
,Monday route - Fill plant salt boxes,23-31391,CHATHAM,CHATHAM,,,1-9-23 1:47 AM,2023-01-09T01:47:00.000Z,2-6-23 12:00 AM,2023-02-06T00:00:00.000Z,2-10-23 4:14 PM,2023-02-10T16:14:00.000Z,4,4,,PM,CLOSE,Y,N,NO,CHATHAM,,,,,,,,,,,,,,
,Monitor & fill salt boxes,23-31392,CHATHAM,CHATHAM,,,1-9-23 1:47 AM,2023-01-09T01:47:00.000Z,2-6-23 1:00 AM,2023-02-06T01:00:00.000Z,2-10-23 4:14 PM,2023-02-10T16:14:00.000Z,4,4,,PM,CLOSE,Y,,NO,CHATHAM,,,,,,,,,,,,,,
,Thursday route - Fill plant salt boxes,23-31393,CHATHAM,CHATHAM,,,1-9-23 1:47 AM,2023-01-09T01:47:00.000Z,2-2-23 12:00 AM,2023-02-02T00:00:00.000Z,2-2-23 1:00 AM,2023-02-02T01:00:00.000Z,4,4,,PM,CLOSE,Y,N,NO,CHATHAM,,,,,,,,,,,,,,
,Monitor & fill salt boxes,23-31394,CHATHAM,CHATHAM,,,1-9-23 1:47 AM,2023-01-09T01:47:00.000Z,2-2-23 1:00 AM,2023-02-02T01:00:00.000Z,2-7-23 6:06 AM,2023-02-07T06:06:00.000Z,4,4,,PM,CLOSE,Y,,NO,CHATHAM,,,,,,,,,,,,,,
1227,PH PROBE CLEANING AND CALIBRATION PM,23-31395,AT-13519,AT-13519,,,1-9-23 1:47 AM,2023-01-09T01:47:00.000Z,2-2-23 12:00 AM,2023-02-02T00:00:00.000Z,1-31-23 1:00 AM,2023-01-31T01:00:00.000Z,4,4,,PM,CLOSE,Y,N,NO,CHATHAM,,,,,,,,,,,,,,
1227,PH PROBE CLEANING AND CALIBRATION WEEKLY PM,23-31396,AT-13519,AT-13519,,,1-9-23 1:47 AM,2023-01-09T01:47:00.000Z,2-2-23 1:00 AM,2023-02-02T01:00:00.000Z,1-31-23 4:13 PM,2023-01-31T16:13:00.000Z,4,4,,PM,CLOSE,Y,,NO,CHATHAM,,,,,,,,,,,,,,
1230,PH PROBE CLEANING AND CALIBRATION PM,23-31397,AT-14125,AT-14125,,,1-9-23 1:47 AM,2023-01-09T01:47:00.000Z,2-2-23 12:00 AM,2023-02-02T00:00:00.000Z,2-2-23 12:30 AM,2023-02-02T00:30:00.000Z,4,4,,PM,CLOSE,Y,N,NO,CHATHAM,,,,,,,,,,,,,,
1230,PH PROBE CLEANING AND CALIBRATION WEEKLY PM,23-31398,AT-14125,AT-14125,,,1-9-23 1:47 AM,2023-01-09T01:47:00.000Z,2-2-23 1:00 AM,2023-02-02T01:00:00.000Z,2-3-23 11:34 AM,2023-02-03T11:34:00.000Z,4,4,,PM,CLOSE,Y,,NO,CHATHAM,,,,,,,,,,,,,,
,INSULATION BLANKET AUDIT (PLANT WIDE),23-31399,CHATHAM,CHATHAM,,,1-9-23 1:47 AM,2023-01-09T01:47:00.000Z,2-1-23 4:00 PM,2023-02-01T16:00:00.000Z,3-1-23 3:50 PM,2023-03-01T15:50:00.000Z,4,4,,PM,CLOSE,Y,N,NO,CHATHAM,,,,,,,,,,,,,,
,INSULATION BLANKET AUDIT (PLANT WIDE),23-31400,CHATHAM,CHATHAM,,,1-9-23 1:47 AM,2023-01-09T01:47:00.000Z,2-1-23 12:00 AM,2023-02-01T00:00:00.000Z,3-1-23 3:50 PM,2023-03-01T15:50:00.000Z,4,4,,PM,CLOSE,Y,,NO,CHATHAM,,,,,,,,,,,,,,
,MI-1201B - MECHANICAL PM,23-31401,MI-1201B,MI-1201B,,,1-9-23 1:47 AM,2023-01-09T01:47:00.000Z,2-6-23 1:00 AM,2023-02-06T01:00:00.000Z,2-10-23 4:14 PM,2023-02-10T16:14:00.000Z,4,4,,PM,CLOSE,Y,N,NO,CHATHAM,,,,,,,,,,,,,,
,MI-1201B - WEEKLY PM & ROTATION CHANGE,23-31402,MI-1201B,MI-1201B,,,1-9-23 1:47 AM,2023-01-09T01:47:00.000Z,2-6-23 12:00 AM,2023-02-06T00:00:00.000Z,2-10-23 4:14 PM,2023-02-10T16:14:00.000Z,4,4,,PM,CLOSE,Y,,NO,CHATHAM,,,,,,,,,,,,,,
,MI-1201B - GREASE CHANGE OUT,23-31403,MI-1201B,MI-1201B,,,1-9-23 1:47 AM,2023-01-09T01:47:00.000Z,2-6-23 12:00 AM,2023-02-06T00:00:00.000Z,2-10-23 4:14 PM,2023-02-10T16:14:00.000Z,4,4,,PM,CLOSE,Y,,NO,CHATHAM,,,,,,,,,,,,,,
,Weekly Vibration check (GFE I/E),23-31404,MI-1201B,MI-1201B,,,1-9-23 1:47 AM,2023-01-09T01:47:00.000Z,2-6-23 12:00 AM,2023-02-06T00:00:00.000Z,2-10-23 4:14 PM,2023-02-10T16:14:00.000Z,4,4,,PM,CLOSE,Y,,NO,CHATHAM,,,,,,,,,,,,,,
,MI-1201A - MECHANICAL PM,23-31405,MI-1201A,MI-1201A,,,1-9-23 1:47 AM,2023-01-09T01:47:00.000Z,2-2-23 12:30 AM,2023-02-02T00:30:00.000Z,2-2-23 2:00 AM,2023-02-02T02:00:00.000Z,4,4,,PM,CLOSE,Y,N,NO,CHATHAM,,,,,,,,,,,,,,
,HAMMERMILL WEEKLY PM & ROTATION CHANGE,23-31406,MI-1201A,MI-1201A,,,1-9-23 1:47 AM,2023-01-09T01:47:00.000Z,2-2-23 12:00 AM,2023-02-02T00:00:00.000Z,2-2-23 4:51 PM,2023-02-02T16:51:00.000Z,4,4,,PM,CLOSE,Y,,NO,CHATHAM,,,,,,,,,,,,,,
,Weekly Vibration check (GFE I/E),23-31407,MI-1201A,MI-1201A,,,1-9-23 1:47 AM,2023-01-09T01:47:00.000Z,2-2-23 12:00 AM,2023-02-02T00:00:00.000Z,2-2-23 4:51 PM,2023-02-02T16:51:00.000Z,4,4,,PM,CLOSE,Y,,NO,CHATHAM,,,,,,,,,,,,,,
,COLD WEATHER PLAN (TOTE INSPECTION/AUDIT),23-31408,CHATHAM,CHATHAM,,,1-9-23 1:47 AM,2023-01-09T01:47:00.000Z,2-2-23 1:00 AM,2023-02-02T01:00:00.000Z,3-1-23 3:50 PM,2023-03-01T15:50:00.000Z,4,4,,PM,CLOSE,Y,N,NO,CHATHAM,,,,,,,,,,,,,,
,TOTE #1 250' PORTABLE HEAT TRACING,23-31409,CHATHAM,CHATHAM,,,1-9-23 1:47 AM,2023-01-09T01:47:00.000Z,2-2-23 12:00 AM,2023-02-02T00:00:00.000Z,3-1-23 3:50 PM,2023-03-01T15:50:00.000Z,4,4,,PM,CLOSE,Y,,NO,CHATHAM,,,,,,,,,,,,,,
,TOTE #2 (2) SNAKE INSULATION BLANKETS,23-31410,CHATHAM,CHATHAM,,,1-9-23 1:47 AM,2023-01-09T01:47:00.000Z,2-2-23 12:00 AM,2023-02-02T00:00:00.000Z,3-1-23 3:50 PM,2023-03-01T15:50:00.000Z,4,4,,PM,CLOSE,Y,,NO,CHATHAM,,,,,,,,,,,,,,
,TOTE #3 (2) SNAKE INSULATION BLANKETS,23-31411,CHATHAM,CHATHAM,,,1-9-23 1:47 AM,2023-01-09T01:47:00.000Z,2-2-23 12:00 AM,2023-02-02T00:00:00.000Z,3-1-23 3:50 PM,2023-03-01T15:50:00.000Z,4,4,,PM,CLOSE,Y,,NO,CHATHAM,,,,,,,,,,,,,,
,"TOTE #4 (4) COATS, (4) BIBS, (10) GLOVES, HARD HAT LINERS, NECK WARMERS, (20) INFERNO PACKS",23-31412,CHATHAM,CHATHAM,,,1-9-23 1:47 AM,2023-01-09T01:47:00.000Z,2-2-23 12:00 AM,2023-02-02T00:00:00.000Z,3-1-23 3:50 PM,2023-03-01T15:50:00.000Z,4,4,,PM,CLOSE,Y,,NO,CHATHAM,,,,,,,,,,,,,,
,TOTE#5 (4) 100' EXPLOSION PROOF EXTENSION CORDS,23-31413,CHATHAM,CHATHAM,,,1-9-23 1:47 AM,2023-01-09T01:47:00.000Z,2-2-23 12:00 AM,2023-02-02T00:00:00.000Z,3-1-23 3:50 PM,2023-03-01T15:50:00.000Z,4,4,,PM,CLOSE,Y,,NO,CHATHAM,,,,,,,,,,,,,,
,5S AND STOCKROOM AUDIT-WEEKLY PM,23-31414,MAINTENANCE,MAINTENANCE,,,1-9-23 1:47 AM,2023-01-09T01:47:00.000Z,2-6-23 12:00 AM,2023-02-06T00:00:00.000Z,2-9-23 9:38 AM,2023-02-09T09:38:00.000Z,4,4,,PM,CLOSE,Y,N,NO,CHATHAM,,,,,,,,,,,,,,
1293,BL-1804D - WEEKLY BEARING GREASING,23-31415,BL-1804D,BL-1804D,,,1-9-23 1:47 AM,2023-01-09T01:47:00.000Z,2-6-23 12:00 AM,2023-02-06T00:00:00.000Z,2-10-23 4:19 PM,2023-02-10T16:19:00.000Z,4,4,,PM,CLOSE,Y,N,NO,CHATHAM,"1293, 6864","BLOWER, NYB, MODEL 714 SERIES 45, GENERAL INDUSTRIAL, CW/UB, Arrg't 8, MOTOR / 450HP / 1200RPM / TEFC / 2300V/3PH/60HZ / FR# 5808C",,No,CH-DRYER_D_BLR,CH-DRYER_D_BLR:BL1804D.STAIND,BL-1804D,BL,STAIND,"Status indication (open/closed, run/stop)",Blower (asset),Equipment status,CYCLONE INLET PRESSURE,
1293,BL-1804D WEEKLY GREASING,23-31416,BL-1804D,BL-1804D,,,1-9-23 1:47 AM,2023-01-09T01:47:00.000Z,2-6-23 12:00 AM,2023-02-06T00:00:00.000Z,2-10-23 4:19 PM,2023-02-10T16:19:00.000Z,4,4,,PM,CLOSE,Y,,NO,CHATHAM,"1293, 6864","BLOWER, NYB, MODEL 714 SERIES 45, GENERAL INDUSTRIAL, CW/UB, Arrg't 8, MOTOR / 450HP / 1200RPM / TEFC / 2300V/3PH/60HZ / FR# 5808C",,No,CH-DRYER_D_BLR,CH-DRYER_D_BLR:BL1804D.STAIND,BL-1804D,BL,STAIND,"Status indication (open/closed, run/stop)",Blower (asset),Equipment status,CYCLONE INLET PRESSURE,
,"Area Asset Checks-2100, 1200, 1300, 1400 (Corn, Mill, Mash, Fermentation)",23-31417,2100,2100,,,1-9-23 1:48 AM,2023-01-09T01:48:00.000Z,2-6-23 12:00 AM,2023-02-06T00:00:00.000Z,2-9-23 9:38 AM,2023-02-09T09:38:00.000Z,4,4,,PM,CLOSE,Y,N,NO,CHATHAM,,,,,,,,,,,,,,
,"Area Asset Checks-2100, 1200, 1300, 1400 (Corn, Mill, Mash, Fermentation)",23-31418,2100,2100,,,1-9-23 1:48 AM,2023-01-09T01:48:00.000Z,2-6-23 5:00 AM,2023-02-06T05:00:00.000Z,2-9-23 9:38 AM,2023-02-09T09:38:00.000Z,4,4,,PM,CLOSE,Y,,NO,CHATHAM,,,,,,,,,,,,,,
,"Area Asset Checks-1500, 6500",23-31419,1500,1500,,,1-9-23 1:48 AM,2023-01-09T01:48:00.000Z,2-6-23 12:00 AM,2023-02-06T00:00:00.000Z,2-9-23 9:38 AM,2023-02-09T09:38:00.000Z,4,4,,PM,CLOSE,Y,N,NO,CHATHAM,,,,,,,,,,,,,,
,"Area Asset Checks-1500, 6500 (Distillation)",23-31420,1500,1500,,,1-9-23 1:48 AM,2023-01-09T01:48:00.000Z,2-6-23 12:00 AM,2023-02-06T00:00:00.000Z,2-9-23 9:38 AM,2023-02-09T09:38:00.000Z,4,4,,PM,CLOSE,Y,,NO,CHATHAM,,,,,,,,,,,,,,
,"Area Asset Checks-1600, 1660, 1700",23-31421,1600,1600,,,1-9-23 1:48 AM,2023-01-09T01:48:00.000Z,2-6-23 12:00 AM,2023-02-06T00:00:00.000Z,2-9-23 9:39 AM,2023-02-09T09:39:00.000Z,4,4,,PM,CLOSE,Y,N,NO,CHATHAM,,,,,,,,,,,,,,
,"Area Asset Checks-1600, 1660, 1700 (Evaps, Corn oil, Decanyers)",23-31422,1600,1600,,,1-9-23 1:48 AM,2023-01-09T01:48:00.000Z,2-6-23 12:00 AM,2023-02-06T00:00:00.000Z,2-9-23 9:39 AM,2023-02-09T09:39:00.000Z,4,4,,PM,CLOSE,Y,,NO,CHATHAM,,,,,,,,,,,,,,
,"Area Asset Checks-2200, 2300, 3200, 3600, 4100",23-31423,2200,2200,,,1-9-23 1:48 AM,2023-01-09T01:48:00.000Z,2-6-23 12:00 AM,2023-02-06T00:00:00.000Z,2-9-23 9:39 AM,2023-02-09T09:39:00.000Z,4,4,,PM,CLOSE,Y,N,NO,CHATHAM,,,,,,,,,,,,,,
,"Area Asset Checks-2200, 2300, 3200, 3600, 4100",23-31424,2200,2200,,,1-9-23 1:48 AM,2023-01-09T01:48:00.000Z,2-6-23 12:00 AM,2023-02-06T00:00:00.000Z,2-9-23 9:39 AM,2023-02-09T09:39:00.000Z,4,4,,PM,CLOSE,Y,,NO,CHATHAM,,,,,,,,,,,,,,
,"Area Asset Checks-1830, 1840, DDG Cooler",23-31425,1800,1800,,,1-9-23 1:48 AM,2023-01-09T01:48:00.000Z,2-6-23 12:00 AM,2023-02-06T00:00:00.000Z,2-9-23 9:39 AM,2023-02-09T09:39:00.000Z,4,4,,PM,CLOSE,Y,N,NO,CHATHAM,,,,,,,,,,,,,,
,"Area Asset Checks-1830, 1840, DDG Cooler",23-31426,1800,1800,,,1-9-23 1:48 AM,2023-01-09T01:48:00.000Z,2-6-23 12:00 AM,2023-02-06T00:00:00.000Z,2-9-23 9:39 AM,2023-02-09T09:39:00.000Z,4,4,,PM,CLOSE,Y,,NO,CHATHAM,,,,,,,,,,,,,,
,"Area Asset Checks-2100, 1200, 1300, 1400 (Corn, Mill, Mash, Fermentation)",23-31427,2100,2100,,,1-9-23 1:48 AM,2023-01-09T01:48:00.000Z,2-6-23 12:00 AM,2023-02-06T00:00:00.000Z,2-6-23 12:30 AM,2023-02-06T00:30:00.000Z,4,4,,PM,CLOSE,Y,N,NO,CHATHAM,,,,,,,,,,,,,,
,"Area Asset Checks-2100, 1200, 1300, 1400 (Corn, Mill, Mash, Fermentation)",23-31428,2100,2100,,,1-9-23 1:48 AM,2023-01-09T01:48:00.000Z,2-6-23 2:30 AM,2023-02-06T02:30:00.000Z,2-8-23 7:06 AM,2023-02-08T07:06:00.000Z,4,4,,PM,CLOSE,Y,,NO,CHATHAM,,,,,,,,,,,,,,
,"Area Asset Checks-1500, 6500",23-31429,1500,1500,,,1-9-23 1:48 AM,2023-01-09T01:48:00.000Z,2-6-23 12:00 AM,2023-02-06T00:00:00.000Z,2-6-23 12:30 AM,2023-02-06T00:30:00.000Z,4,4,,PM,CLOSE,Y,N,NO,CHATHAM,,,,,,,,,,,,,,
,"Area Asset Checks-1500, 6500 (Distillation)",23-31430,1500,1500,,,1-9-23 1:48 AM,2023-01-09T01:48:00.000Z,2-6-23 12:00 AM,2023-02-06T00:00:00.000Z,2-8-23 7:06 AM,2023-02-08T07:06:00.000Z,4,4,,PM,CLOSE,Y,,NO,CHATHAM,,,,,,,,,,,,,,
,"Area Asset Checks-1600, 1660, 1700",23-31431,1600,1600,,,1-9-23 1:48 AM,2023-01-09T01:48:00.000Z,2-6-23 12:00 AM,2023-02-06T00:00:00.000Z,2-6-23 12:30 AM,2023-02-06T00:30:00.000Z,4,4,,PM,CLOSE,Y,N,NO,CHATHAM,,,,,,,,,,,,,,
,"Area Asset Checks-1600, 1660, 1700 (Evaps, Corn oil, Decanyers)",23-31432,1600,1600,,,1-9-23 1:48 AM,2023-01-09T01:48:00.000Z,2-6-23 12:00 AM,2023-02-06T00:00:00.000Z,2-7-23 10:28 AM,2023-02-07T10:28:00.000Z,4,4,,PM,CLOSE,Y,,NO,CHATHAM,,,,,,,,,,,,,,
,"Area Asset Checks-2200, 2300, 3200, 3600, 4100",23-31433,2200,2200,,,1-9-23 1:48 AM,2023-01-09T01:48:00.000Z,2-6-23 12:00 AM,2023-02-06T00:00:00.000Z,2-6-23 12:12 AM,2023-02-06T00:12:00.000Z,4,4,,PM,CLOSE,Y,N,NO,CHATHAM,,,,,,,,,,,,,,
,"Area Asset Checks-2200, 2300, 3200, 3600, 4100",23-31434,2200,2200,,,1-9-23 1:48 AM,2023-01-09T01:48:00.000Z,2-6-23 12:00 AM,2023-02-06T00:00:00.000Z,2-7-23 8:36 AM,2023-02-07T08:36:00.000Z,4,4,,PM,CLOSE,Y,,NO,CHATHAM,,,,,,,,,,,,,,
,"Area Asset Checks-1830, 1840, DDG Cooler",23-31435,1800,1800,,,1-9-23 1:48 AM,2023-01-09T01:48:00.000Z,2-6-23 12:00 AM,2023-02-06T00:00:00.000Z,2-7-23 12:30 AM,2023-02-07T00:30:00.000Z,4,4,,PM,CLOSE,Y,N,NO,CHATHAM,,,,,,,,,,,,,,
,"Area Asset Checks-1830, 1840, DDG Cooler",23-31436,1800,1800,,,1-9-23 1:48 AM,2023-01-09T01:48:00.000Z,2-6-23 12:00 AM,2023-02-06T00:00:00.000Z,2-8-23 7:05 AM,2023-02-08T07:05:00.000Z,4,4,,PM,CLOSE,Y,,NO,CHATHAM,,,,,,,,,,,,,,
,C-1803D pH Meter-Weekly PM,23-31437,AT-84505,AT-84505,,,1-9-23 1:48 AM,2023-01-09T01:48:00.000Z,2-2-23 12:00 AM,2023-02-02T00:00:00.000Z,2-2-23 12:30 AM,2023-02-02T00:30:00.000Z,4,4,,PM,CLOSE,Y,N,NO,CHATHAM,,,,,,,,,,,,,,
,PH PROBE CLEANING AND CALIBRATION WEEKLY PM,23-31438,AT-84505,AT-84505,,,1-9-23 1:48 AM,2023-01-09T01:48:00.000Z,2-2-23 1:00 AM,2023-02-02T01:00:00.000Z,2-3-23 12:01 PM,2023-02-03T12:01:00.000Z,4,4,,PM,CLOSE,Y,,NO,CHATHAM,,,,,,,,,,,,,,
,CE-1711 Mechanical PM,23-31439,CE-1711,CE-1711,,,1-9-23 1:48 AM,2023-01-09T01:48:00.000Z,2-2-23 10:00 AM,2023-02-02T10:00:00.000Z,2-3-23 12:00 PM,2023-02-03T12:00:00.000Z,4,4,,PM,CLOSE,Y,N,NO,CHATHAM,,,,,,,,,,,,,,
,Housing- Check housing inside and outside for deposits.,23-31440,CE-1711,CE-1711,,,1-9-23 1:48 AM,2023-01-09T01:48:00.000Z,2-2-23 7:00 AM,2023-02-02T07:00:00.000Z,2-10-23 7:38 AM,2023-02-10T07:38:00.000Z,2,2,,PM,CLOSE,Y,,NO,CHATHAM,,,,,,,,,,,,,,
,Gear Box - Check for tightness and arrange refurbish if necessary,23-31441,CE-1711,CE-1711,,,1-9-23 1:48 AM,2023-01-09T01:48:00.000Z,2-2-23 7:00 AM,2023-02-02T07:00:00.000Z,2-10-23 7:38 AM,2023-02-10T07:38:00.000Z,2,2,,PM,CLOSE,Y,,NO,CHATHAM,,,,,,,,,,,,,,
,Rotor- lubricate,23-31442,CE-1711,CE-1711,,,1-9-23 1:48 AM,2023-01-09T01:48:00.000Z,2-2-23 7:00 AM,2023-02-02T07:00:00.000Z,2-10-23 7:38 AM,2023-02-10T07:38:00.000Z,2,2,,PM,CLOSE,Y,,NO,CHATHAM,,,,,,,,,,,,,,
,"Rotor- Check wear protectionat solids discharge for wear, exchange if necessary",23-31443,CE-1711,CE-1711,,,1-9-23 1:48 AM,2023-01-09T01:48:00.000Z,2-2-23 7:00 AM,2023-02-02T07:00:00.000Z,2-10-23 7:38 AM,2023-02-10T07:38:00.000Z,2,2,,PM,CLOSE,Y,,NO,CHATHAM,,,,,,,,,,,,,,
,"Diverter Valve- lubricate spindles, guide bars , bearing",23-31444,CE-1711,CE-1711,,,1-9-23 1:48 AM,2023-01-09T01:48:00.000Z,2-2-23 7:00 AM,2023-02-02T07:00:00.000Z,2-10-23 7:38 AM,2023-02-10T07:38:00.000Z,2,2,,PM,CLOSE,Y,,NO,CHATHAM,,,,,,,,,,,,,,
,CE 1711 Water coming from boot,23-31556,CE-1711,CE-1711,,,1-9-23 3:03 AM,2023-01-09T03:03:00.000Z,1-10-23 2:55 AM,2023-01-10T02:55:00.000Z,2-6-23 1:01 PM,2023-02-06T13:01:00.000Z,1,1,,CO,CLOSE,Y,,NO,CHATHAM,,,,,,,,,,,,,,
,Ammonia alarm on north side of dyke needs to be looked at (AT24321),23-31557,1300,1300,,,1-9-23 7:31 AM,2023-01-09T07:31:00.000Z,1-15-23 6:10 AM,2023-01-15T06:10:00.000Z,1-9-23 7:11 AM,2023-01-09T07:11:00.000Z,4,4,,CO,CLOSE,Y,,NO,CHATHAM,,,,,,,,,,,,,,
1511,Cooling water PSV leak on E-1553,23-31558,E-1553,E-1553,,,1-9-23 7:37 AM,2023-01-09T07:37:00.000Z,1-13-23 8:00 PM,2023-01-13T20:00:00.000Z,1-12-23 4:01 PM,2023-01-12T16:01:00.000Z,4,4,,CO,CLOSE,Y,,NO,CHATHAM,,,,,,,,,,,,,,
,BL-1829- inspect aluminum air seal rings,23-31559,BL-1829,BL-1829,,,1-9-23 7:42 AM,2023-01-09T07:42:00.000Z,1-12-23 5:00 PM,2023-01-12T17:00:00.000Z,1-11-23 7:30 AM,2023-01-11T07:30:00.000Z,4,4,,CO,CLOSE,Y,,NO,CHATHAM,"10034, 2868","BLOWER, HOWDEN, FAN MODEL E40S-8700 SWSI CCW TAU Arrg't7, 600HP / 1200RPM / TEFC / 575V/3PH/60HZ / 5810B FRAME",,Yes,CH-DRA_PROC_AIR,CH-DRA_PROC_AIR:BL1829.STAIND,BL-1829,BL,STAIND,"Status indication (open/closed, run/stop)",Blower (asset),Equipment status,BL1829 - DRYER A MAIN FAN,BL-1829
,BL-1829- inspect aluminum air seal rings,23-31559,BL-1829,BL-1829,,,1-9-23 7:42 AM,2023-01-09T07:42:00.000Z,1-12-23 5:00 PM,2023-01-12T17:00:00.000Z,1-11-23 7:30 AM,2023-01-11T07:30:00.000Z,4,4,,CO,CLOSE,Y,,NO,CHATHAM,"10034, 2868","BLOWER, HOWDEN, FAN MODEL E40S-8700 SWSI CCW TAU Arrg't7, 600HP / 1200RPM / TEFC / 575V/3PH/60HZ / 5810B FRAME",,Yes,CH-DRYER_A,CH-DRYER_A:FIC18161.SPT,FIC-18161,FIC,SPT,Setpoint (SP),Flow indicating controller,Setpoint,BL1829 WINDING TEMP,BL-1829
,BL-1829- inspect aluminum air seal rings,23-31559,BL-1829,BL-1829,,,1-9-23 7:42 AM,2023-01-09T07:42:00.000Z,1-12-23 5:00 PM,2023-01-12T17:00:00.000Z,1-11-23 7:30 AM,2023-01-11T07:30:00.000Z,4,4,,CO,CLOSE,Y,,NO,CHATHAM,"10034, 2868","BLOWER, HOWDEN, FAN MODEL E40S-8700 SWSI CCW TAU Arrg't7, 600HP / 1200RPM / TEFC / 575V/3PH/60HZ / 5810B FRAME",,Yes,CH-DRYER_A,CH-DRYER_A:SY18153B.OUT,SY-18153B,SY,OUT,Controller output / demand (CO),Speed output (VFD demand),Output/Demand,BL1829 CURRENT INDICATION,BL-1829
,BL-1829- inspect aluminum air seal rings,23-31559,BL-1829,BL-1829,,,1-9-23 7:42 AM,2023-01-09T07:42:00.000Z,1-12-23 5:00 PM,2023-01-12T17:00:00.000Z,1-11-23 7:30 AM,2023-01-11T07:30:00.000Z,4,4,,CO,CLOSE,Y,,NO,CHATHAM,"10034, 2868","BLOWER, HOWDEN, FAN MODEL E40S-8700 SWSI CCW TAU Arrg't7, 600HP / 1200RPM / TEFC / 575V/3PH/60HZ / 5810B FRAME",,Yes,CH-DRYER_A,CH-DRYER_A:SSL18155.CIN,SSL-18155,SSL,CIN,Contact input (discrete),Speed switch (motion proof),Discrete Input,BL1829 SPEED INDICATION,BL-1829
,BL-1829- inspect aluminum air seal rings,23-31559,BL-1829,BL-1829,,,1-9-23 7:42 AM,2023-01-09T07:42:00.000Z,1-12-23 5:00 PM,2023-01-12T17:00:00.000Z,1-11-23 7:30 AM,2023-01-11T07:30:00.000Z,4,4,,CO,CLOSE,Y,,NO,CHATHAM,"10034, 2868","BLOWER, HOWDEN, FAN MODEL E40S-8700 SWSI CCW TAU Arrg't7, 600HP / 1200RPM / TEFC / 575V/3PH/60HZ / 5810B FRAME",,Yes,CH-DRYER_A,CH-DRYER_A:PT18160.MEAS,PT-18160,PT,MEAS,Measured value (PV),Pressure transmitter,Measurement,BL1829 BEARING TEMP,BL-1829
,BL-1829- inspect aluminum air seal rings,23-31559,BL-1829,BL-1829,,,1-9-23 7:42 AM,2023-01-09T07:42:00.000Z,1-12-23 5:00 PM,2023-01-12T17:00:00.000Z,1-11-23 7:30 AM,2023-01-11T07:30:00.000Z,4,4,,CO,CLOSE,Y,,NO,CHATHAM,"10034, 2868","BLOWER, HOWDEN, FAN MODEL E40S-8700 SWSI CCW TAU Arrg't7, 600HP / 1200RPM / TEFC / 575V/3PH/60HZ / 5810B FRAME",,Yes,CH-DRYER_A,CH-DRYER_A:FIC18161.MEAS,FIC-18161,FIC,MEAS,Measured value (PV),Flow indicating controller,Measurement,BL1829 BEARING TEMP,BL-1829
,BL-1829- inspect aluminum air seal rings,23-31559,BL-1829,BL-1829,,,1-9-23 7:42 AM,2023-01-09T07:42:00.000Z,1-12-23 5:00 PM,2023-01-12T17:00:00.000Z,1-11-23 7:30 AM,2023-01-11T07:30:00.000Z,4,4,,CO,CLOSE,Y,,NO,CHATHAM,"10034, 2868","BLOWER, HOWDEN, FAN MODEL E40S-8700 SWSI CCW TAU Arrg't7, 600HP / 1200RPM / TEFC / 575V/3PH/60HZ / 5810B FRAME",,Yes,CH-DRYER_A,CH-DRYER_A:FIC18161.OUT,FIC-18161,FIC,OUT,Controller output / demand (CO),Flow indicating controller,Output/Demand,BL1829 WINDING TEMP,BL-1829
,Test auto lube system on A dryer,23-31560,DR-1826,DR-1826,,,1-9-23 7:43 AM,2023-01-09T07:43:00.000Z,1-12-23 5:00 PM,2023-01-12T17:00:00.000Z,1-11-23 9:00 AM,2023-01-11T09:00:00.000Z,4,4,,CO,CLOSE,Y,,NO,CHATHAM,"2541, 2542, 2543, 2544, 2545, 2547, 2549, 2550, 2552, 2553, 2554, 2555, 2556, 2557, 2558, 2559","SWISS COMBI ROTARY DRYER DRUM, SEW GEARBOX - LEFT HAND DRIVE -, SEW GEARBOX - LEFT HAND DRIVE, SEW GEARBOX - RIGHT HAND DRIVE, SEW GEARBOX - RIGHT HAND DRIVE, MOTOR / 25HP / 1800RPM / TEFC / 575V/3PH/60HZ / FRAME# 284TC, MOTOR / 25HP / 1800RPM / TEFC / 575V/3PH/60HZ / FRAME# 284TC, MOTOR / 25HP / 1800RPM / TEFC / 575V/3PH/60HZ / FRAME# 284TC, MOTOR / 25HP / 1800RPM / TEFC / 575V/3PH/60HZ / FRAME# 284TC, TRUNNION (A) - LEFT HAND DRIVE, TRUNNION (B)- RIGHT HAND DRIVE, TRUNNION (D) - LEFT HAND DRIVE, TRUNNION (C) - RIGHT HAND DRIVE, THRUST ROLLER ASSEMBLY, THRUST ROLLER ASSEMBLY, TRUNNION LUBRICATION SYSTEM",,No,CH-DRA_CYCLNS,CH-DRA_CYCLNS:TT18168B.MEAS,TT-18168B,TT,MEAS,Measured value (PV),Temperature transmitter,Measurement,DRUM DR1826 MOTOR A AMPERAGE,DR-1826
,Test auto lube system on A dryer,23-31560,DR-1826,DR-1826,,,1-9-23 7:43 AM,2023-01-09T07:43:00.000Z,1-12-23 5:00 PM,2023-01-12T17:00:00.000Z,1-11-23 9:00 AM,2023-01-11T09:00:00.000Z,4,4,,CO,CLOSE,Y,,NO,CHATHAM,"2541, 2542, 2543, 2544, 2545, 2547, 2549, 2550, 2552, 2553, 2554, 2555, 2556, 2557, 2558, 2559","SWISS COMBI ROTARY DRYER DRUM, SEW GEARBOX - LEFT HAND DRIVE -, SEW GEARBOX - LEFT HAND DRIVE, SEW GEARBOX - RIGHT HAND DRIVE, SEW GEARBOX - RIGHT HAND DRIVE, MOTOR / 25HP / 1800RPM / TEFC / 575V/3PH/60HZ / FRAME# 284TC, MOTOR / 25HP / 1800RPM / TEFC / 575V/3PH/60HZ / FRAME# 284TC, MOTOR / 25HP / 1800RPM / TEFC / 575V/3PH/60HZ / FRAME# 284TC, MOTOR / 25HP / 1800RPM / TEFC / 575V/3PH/60HZ / FRAME# 284TC, TRUNNION (A) - LEFT HAND DRIVE, TRUNNION (B)- RIGHT HAND DRIVE, TRUNNION (D) - LEFT HAND DRIVE, TRUNNION (C) - RIGHT HAND DRIVE, THRUST ROLLER ASSEMBLY, THRUST ROLLER ASSEMBLY, TRUNNION LUBRICATION SYSTEM",,No,CH-DRA_COMB_AIR,CH-DRA_COMB_AIR:PY18180.OUT,PY-18180,PY,OUT,Controller output / demand (CO),Pressure final element demand (valve pos/demand),Output/Demand,DRUM DR1826 SPEED CONTROL,DR-1826
,Test auto lube system on A dryer,23-31560,DR-1826,DR-1826,,,1-9-23 7:43 AM,2023-01-09T07:43:00.000Z,1-12-23 5:00 PM,2023-01-12T17:00:00.000Z,1-11-23 9:00 AM,2023-01-11T09:00:00.000Z,4,4,,CO,CLOSE,Y,,NO,CHATHAM,"2541, 2542, 2543, 2544, 2545, 2547, 2549, 2550, 2552, 2553, 2554, 2555, 2556, 2557, 2558, 2559","SWISS COMBI ROTARY DRYER DRUM, SEW GEARBOX - LEFT HAND DRIVE -, SEW GEARBOX - LEFT HAND DRIVE, SEW GEARBOX - RIGHT HAND DRIVE, SEW GEARBOX - RIGHT HAND DRIVE, MOTOR / 25HP / 1800RPM / TEFC / 575V/3PH/60HZ / FRAME# 284TC, MOTOR / 25HP / 1800RPM / TEFC / 575V/3PH/60HZ / FRAME# 284TC, MOTOR / 25HP / 1800RPM / TEFC / 575V/3PH/60HZ / FRAME# 284TC, MOTOR / 25HP / 1800RPM / TEFC / 575V/3PH/60HZ / FRAME# 284TC, TRUNNION (A) - LEFT HAND DRIVE, TRUNNION (B)- RIGHT HAND DRIVE, TRUNNION (D) - LEFT HAND DRIVE, TRUNNION (C) - RIGHT HAND DRIVE, THRUST ROLLER ASSEMBLY, THRUST ROLLER ASSEMBLY, TRUNNION LUBRICATION SYSTEM",,No,CH-DRA_COMB_AIR,CH-DRA_COMB_AIR:PIC18215.OUT,PIC-18215,PIC,OUT,Controller output / demand (CO),Pressure indicating controller,Output/Demand,DRUM DR1826 MOTOR 1 CONTROL,DR-1826
,Test auto lube system on A dryer,23-31560,DR-1826,DR-1826,,,1-9-23 7:43 AM,2023-01-09T07:43:00.000Z,1-12-23 5:00 PM,2023-01-12T17:00:00.000Z,1-11-23 9:00 AM,2023-01-11T09:00:00.000Z,4,4,,CO,CLOSE,Y,,NO,CHATHAM,"2541, 2542, 2543, 2544, 2545, 2547, 2549, 2550, 2552, 2553, 2554, 2555, 2556, 2557, 2558, 2559","SWISS COMBI ROTARY DRYER DRUM, SEW GEARBOX - LEFT HAND DRIVE -, SEW GEARBOX - LEFT HAND DRIVE, SEW GEARBOX - RIGHT HAND DRIVE, SEW GEARBOX - RIGHT HAND DRIVE, MOTOR / 25HP / 1800RPM / TEFC / 575V/3PH/60HZ / FRAME# 284TC, MOTOR / 25HP / 1800RPM / TEFC / 575V/3PH/60HZ / FRAME# 284TC, MOTOR / 25HP / 1800RPM / TEFC / 575V/3PH/60HZ / FRAME# 284TC, MOTOR / 25HP / 1800RPM / TEFC / 575V/3PH/60HZ / FRAME# 284TC, TRUNNION (A) - LEFT HAND DRIVE, TRUNNION (B)- RIGHT HAND DRIVE, TRUNNION (D) - LEFT HAND DRIVE, TRUNNION (C) - RIGHT HAND DRIVE, THRUST ROLLER ASSEMBLY, THRUST ROLLER ASSEMBLY, TRUNNION LUBRICATION SYSTEM",,No,CH-DRA_COMB_AIR,CH-DRA_COMB_AIR:PIC18215.SPT,PIC-18215,PIC,SPT,Setpoint (SP),Pressure indicating controller,Setpoint,DR1826 MASTR 2 MOTR SPD CTRL,DR-1826
,Test auto lube system on A dryer,23-31560,DR-1826,DR-1826,,,1-9-23 7:43 AM,2023-01-09T07:43:00.000Z,1-12-23 5:00 PM,2023-01-12T17:00:00.000Z,1-11-23 9:00 AM,2023-01-11T09:00:00.000Z,4,4,,CO,CLOSE,Y,,NO,CHATHAM,"2541, 2542, 2543, 2544, 2545, 2547, 2549, 2550, 2552, 2553, 2554, 2555, 2556, 2557, 2558, 2559","SWISS COMBI ROTARY DRYER DRUM, SEW GEARBOX - LEFT HAND DRIVE -, SEW GEARBOX - LEFT HAND DRIVE, SEW GEARBOX - RIGHT HAND DRIVE, SEW GEARBOX - RIGHT HAND DRIVE, MOTOR / 25HP / 1800RPM / TEFC / 575V/3PH/60HZ / FRAME# 284TC, MOTOR / 25HP / 1800RPM / TEFC / 575V/3PH/60HZ / FRAME# 284TC, MOTOR / 25HP / 1800RPM / TEFC / 575V/3PH/60HZ / FRAME# 284TC, MOTOR / 25HP / 1800RPM / TEFC / 575V/3PH/60HZ / FRAME# 284TC, TRUNNION (A) - LEFT HAND DRIVE, TRUNNION (B)- RIGHT HAND DRIVE, TRUNNION (D) - LEFT HAND DRIVE, TRUNNION (C) - RIGHT HAND DRIVE, THRUST ROLLER ASSEMBLY, THRUST ROLLER ASSEMBLY, TRUNNION LUBRICATION SYSTEM",,No,CH-DRA_FIRE_WTR,CH-DRA_FIRE_WTR:TT35445.MEAS,TT-35445,TT,MEAS,Measured value (PV),Temperature transmitter,Measurement,DRUM DR1826 ACCESS DOOR,DR-1826
,Test auto lube system on A dryer,23-31560,DR-1826,DR-1826,,,1-9-23 7:43 AM,2023-01-09T07:43:00.000Z,1-12-23 5:00 PM,2023-01-12T17:00:00.000Z,1-11-23 9:00 AM,2023-01-11T09:00:00.000Z,4,4,,CO,CLOSE,Y,,NO,CHATHAM,"2541, 2542, 2543, 2544, 2545, 2547, 2549, 2550, 2552, 2553, 2554, 2555, 2556, 2557, 2558, 2559","SWISS COMBI ROTARY DRYER DRUM, SEW GEARBOX - LEFT HAND DRIVE -, SEW GEARBOX - LEFT HAND DRIVE, SEW GEARBOX - RIGHT HAND DRIVE, SEW GEARBOX - RIGHT HAND DRIVE, MOTOR / 25HP / 1800RPM / TEFC / 575V/3PH/60HZ / FRAME# 284TC, MOTOR / 25HP / 1800RPM / TEFC / 575V/3PH/60HZ / FRAME# 284TC, MOTOR / 25HP / 1800RPM / TEFC / 575V/3PH/60HZ / FRAME# 284TC, MOTOR / 25HP / 1800RPM / TEFC / 575V/3PH/60HZ / FRAME# 284TC, TRUNNION (A) - LEFT HAND DRIVE, TRUNNION (B)- RIGHT HAND DRIVE, TRUNNION (D) - LEFT HAND DRIVE, TRUNNION (C) - RIGHT HAND DRIVE, THRUST ROLLER ASSEMBLY, THRUST ROLLER ASSEMBLY, TRUNNION LUBRICATION SYSTEM",,No,CH-DRYER_A,CH-DRYER_A:KS18145A.STAIND,KS-18145A,KS,STAIND,"Status indication (open/closed, run/stop)",Limit switch (asset status),Equipment status,DRUM DR1826 FRONT LUBEN TIMER,DR-1826
,Test auto lube system on A dryer,23-31560,DR-1826,DR-1826,,,1-9-23 7:43 AM,2023-01-09T07:43:00.000Z,1-12-23 5:00 PM,2023-01-12T17:00:00.000Z,1-11-23 9:00 AM,2023-01-11T09:00:00.000Z,4,4,,CO,CLOSE,Y,,NO,CHATHAM,"2541, 2542, 2543, 2544, 2545, 2547, 2549, 2550, 2552, 2553, 2554, 2555, 2556, 2557, 2558, 2559","SWISS COMBI ROTARY DRYER DRUM, SEW GEARBOX - LEFT HAND DRIVE -, SEW GEARBOX - LEFT HAND DRIVE, SEW GEARBOX - RIGHT HAND DRIVE, SEW GEARBOX - RIGHT HAND DRIVE, MOTOR / 25HP / 1800RPM / TEFC / 575V/3PH/60HZ / FRAME# 284TC, MOTOR / 25HP / 1800RPM / TEFC / 575V/3PH/60HZ / FRAME# 284TC, MOTOR / 25HP / 1800RPM / TEFC / 575V/3PH/60HZ / FRAME# 284TC, MOTOR / 25HP / 1800RPM / TEFC / 575V/3PH/60HZ / FRAME# 284TC, TRUNNION (A) - LEFT HAND DRIVE, TRUNNION (B)- RIGHT HAND DRIVE, TRUNNION (D) - LEFT HAND DRIVE, TRUNNION (C) - RIGHT HAND DRIVE, THRUST ROLLER ASSEMBLY, THRUST ROLLER ASSEMBLY, TRUNNION LUBRICATION SYSTEM",,No,CH-DRYER_A,CH-DRYER_A:KS18145B.STAIND,KS-18145B,KS,STAIND,"Status indication (open/closed, run/stop)",Limit switch (asset status),Equipment status,DRUM DR1826 REAR LUBE TIMER,DR-1826
,Test auto lube system on A dryer,23-31560,DR-1826,DR-1826,,,1-9-23 7:43 AM,2023-01-09T07:43:00.000Z,1-12-23 5:00 PM,2023-01-12T17:00:00.000Z,1-11-23 9:00 AM,2023-01-11T09:00:00.000Z,4,4,,CO,CLOSE,Y,,NO,CHATHAM,"2541, 2542, 2543, 2544, 2545, 2547, 2549, 2550, 2552, 2553, 2554, 2555, 2556, 2557, 2558, 2559","SWISS COMBI ROTARY DRYER DRUM, SEW GEARBOX - LEFT HAND DRIVE -, SEW GEARBOX - LEFT HAND DRIVE, SEW GEARBOX - RIGHT HAND DRIVE, SEW GEARBOX - RIGHT HAND DRIVE, MOTOR / 25HP / 1800RPM / TEFC / 575V/3PH/60HZ / FRAME# 284TC, MOTOR / 25HP / 1800RPM / TEFC / 575V/3PH/60HZ / FRAME# 284TC, MOTOR / 25HP / 1800RPM / TEFC / 575V/3PH/60HZ / FRAME# 284TC, MOTOR / 25HP / 1800RPM / TEFC / 575V/3PH/60HZ / FRAME# 284TC, TRUNNION (A) - LEFT HAND DRIVE, TRUNNION (B)- RIGHT HAND DRIVE, TRUNNION (D) - LEFT HAND DRIVE, TRUNNION (C) - RIGHT HAND DRIVE, THRUST ROLLER ASSEMBLY, THRUST ROLLER ASSEMBLY, TRUNNION LUBRICATION SYSTEM",,No,CH-DRYER_A,CH-DRYER_A:DR1826.STAIND,DR-1826,DR,STAIND,"Status indication (open/closed, run/stop)",Drum/Drive (asset),Equipment status,DRUM DR1826 MASTER  START,DR-1826
,Test auto lube system on A dryer,23-31560,DR-1826,DR-1826,,,1-9-23 7:43 AM,2023-01-09T07:43:00.000Z,1-12-23 5:00 PM,2023-01-12T17:00:00.000Z,1-11-23 9:00 AM,2023-01-11T09:00:00.000Z,4,4,,CO,CLOSE,Y,,NO,CHATHAM,"2541, 2542, 2543, 2544, 2545, 2547, 2549, 2550, 2552, 2553, 2554, 2555, 2556, 2557, 2558, 2559","SWISS COMBI ROTARY DRYER DRUM, SEW GEARBOX - LEFT HAND DRIVE -, SEW GEARBOX - LEFT HAND DRIVE, SEW GEARBOX - RIGHT HAND DRIVE, SEW GEARBOX - RIGHT HAND DRIVE, MOTOR / 25HP / 1800RPM / TEFC / 575V/3PH/60HZ / FRAME# 284TC, MOTOR / 25HP / 1800RPM / TEFC / 575V/3PH/60HZ / FRAME# 284TC, MOTOR / 25HP / 1800RPM / TEFC / 575V/3PH/60HZ / FRAME# 284TC, MOTOR / 25HP / 1800RPM / TEFC / 575V/3PH/60HZ / FRAME# 284TC, TRUNNION (A) - LEFT HAND DRIVE, TRUNNION (B)- RIGHT HAND DRIVE, TRUNNION (D) - LEFT HAND DRIVE, TRUNNION (C) - RIGHT HAND DRIVE, THRUST ROLLER ASSEMBLY, THRUST ROLLER ASSEMBLY, TRUNNION LUBRICATION SYSTEM",,No,CH-DR_DUSTCOLL,CH-DR_DUSTCOLL:RV1834.STAIND,RV-1834,RV,STAIND,"Status indication (open/closed, run/stop)",Rotary valve (asset),Equipment Status,DRUM DR1826 MASTER START,DR-1826
,Test auto lube system on A dryer,23-31560,DR-1826,DR-1826,,,1-9-23 7:43 AM,2023-01-09T07:43:00.000Z,1-12-23 5:00 PM,2023-01-12T17:00:00.000Z,1-11-23 9:00 AM,2023-01-11T09:00:00.000Z,4,4,,CO,CLOSE,Y,,NO,CHATHAM,"2541, 2542, 2543, 2544, 2545, 2547, 2549, 2550, 2552, 2553, 2554, 2555, 2556, 2557, 2558, 2559","SWISS COMBI ROTARY DRYER DRUM, SEW GEARBOX - LEFT HAND DRIVE -, SEW GEARBOX - LEFT HAND DRIVE, SEW GEARBOX - RIGHT HAND DRIVE, SEW GEARBOX - RIGHT HAND DRIVE, MOTOR / 25HP / 1800RPM / TEFC / 575V/3PH/60HZ / FRAME# 284TC, MOTOR / 25HP / 1800RPM / TEFC / 575V/3PH/60HZ / FRAME# 284TC, MOTOR / 25HP / 1800RPM / TEFC / 575V/3PH/60HZ / FRAME# 284TC, MOTOR / 25HP / 1800RPM / TEFC / 575V/3PH/60HZ / FRAME# 284TC, TRUNNION (A) - LEFT HAND DRIVE, TRUNNION (B)- RIGHT HAND DRIVE, TRUNNION (D) - LEFT HAND DRIVE, TRUNNION (C) - RIGHT HAND DRIVE, THRUST ROLLER ASSEMBLY, THRUST ROLLER ASSEMBLY, TRUNNION LUBRICATION SYSTEM",,No,CH-DR_DUSTCOLL,CH-DR_DUSTCOLL:SI18216.MEAS,SI-18216,SI,MEAS,Measured value (PV),Speed indication (feedback),Measurement,DRUM DR1826 MOTOR A AMPERAGE,DR-1826
,Test auto lube system on A dryer,23-31560,DR-1826,DR-1826,,,1-9-23 7:43 AM,2023-01-09T07:43:00.000Z,1-12-23 5:00 PM,2023-01-12T17:00:00.000Z,1-11-23 9:00 AM,2023-01-11T09:00:00.000Z,4,4,,CO,CLOSE,Y,,NO,CHATHAM,"2541, 2542, 2543, 2544, 2545, 2547, 2549, 2550, 2552, 2553, 2554, 2555, 2556, 2557, 2558, 2559","SWISS COMBI ROTARY DRYER DRUM, SEW GEARBOX - LEFT HAND DRIVE -, SEW GEARBOX - LEFT HAND DRIVE, SEW GEARBOX - RIGHT HAND DRIVE, SEW GEARBOX - RIGHT HAND DRIVE, MOTOR / 25HP / 1800RPM / TEFC / 575V/3PH/60HZ / FRAME# 284TC, MOTOR / 25HP / 1800RPM / TEFC / 575V/3PH/60HZ / FRAME# 284TC, MOTOR / 25HP / 1800RPM / TEFC / 575V/3PH/60HZ / FRAME# 284TC, MOTOR / 25HP / 1800RPM / TEFC / 575V/3PH/60HZ / FRAME# 284TC, TRUNNION (A) - LEFT HAND DRIVE, TRUNNION (B)- RIGHT HAND DRIVE, TRUNNION (D) - LEFT HAND DRIVE, TRUNNION (C) - RIGHT HAND DRIVE, THRUST ROLLER ASSEMBLY, THRUST ROLLER ASSEMBLY, TRUNNION LUBRICATION SYSTEM",,No,CH-DR_DUSTCOLL,CH-DR_DUSTCOLL:SSL18216.CIN,SSL-18216,SSL,CIN,Contact input (discrete),Speed switch (motion proof),Discrete Input,DRUM DR1826 MOTOR B AMPERAGE,DR-1826
,Test auto lube system on A dryer,23-31560,DR-1826,DR-1826,,,1-9-23 7:43 AM,2023-01-09T07:43:00.000Z,1-12-23 5:00 PM,2023-01-12T17:00:00.000Z,1-11-23 9:00 AM,2023-01-11T09:00:00.000Z,4,4,,CO,CLOSE,Y,,NO,CHATHAM,"2541, 2542, 2543, 2544, 2545, 2547, 2549, 2550, 2552, 2553, 2554, 2555, 2556, 2557, 2558, 2559","SWISS COMBI ROTARY DRYER DRUM, SEW GEARBOX - LEFT HAND DRIVE -, SEW GEARBOX - LEFT HAND DRIVE, SEW GEARBOX - RIGHT HAND DRIVE, SEW GEARBOX - RIGHT HAND DRIVE, MOTOR / 25HP / 1800RPM / TEFC / 575V/3PH/60HZ / FRAME# 284TC, MOTOR / 25HP / 1800RPM / TEFC / 575V/3PH/60HZ / FRAME# 284TC, MOTOR / 25HP / 1800RPM / TEFC / 575V/3PH/60HZ / FRAME# 284TC, MOTOR / 25HP / 1800RPM / TEFC / 575V/3PH/60HZ / FRAME# 284TC, TRUNNION (A) - LEFT HAND DRIVE, TRUNNION (B)- RIGHT HAND DRIVE, TRUNNION (D) - LEFT HAND DRIVE, TRUNNION (C) - RIGHT HAND DRIVE, THRUST ROLLER ASSEMBLY, THRUST ROLLER ASSEMBLY, TRUNNION LUBRICATION SYSTEM",,No,CH-DR_DUSTCOLL,CH-DR_DUSTCOLL:SSL18222.CIN,SSL-18222,SSL,CIN,Contact input (discrete),Speed switch (motion proof),Discrete Input,DRUM DR1826 MOTOR C AMPERAGE,DR-1826
,Test auto lube system on A dryer,23-31560,DR-1826,DR-1826,,,1-9-23 7:43 AM,2023-01-09T07:43:00.000Z,1-12-23 5:00 PM,2023-01-12T17:00:00.000Z,1-11-23 9:00 AM,2023-01-11T09:00:00.000Z,4,4,,CO,CLOSE,Y,,NO,CHATHAM,"2541, 2542, 2543, 2544, 2545, 2547, 2549, 2550, 2552, 2553, 2554, 2555, 2556, 2557, 2558, 2559","SWISS COMBI ROTARY DRYER DRUM, SEW GEARBOX - LEFT HAND DRIVE -, SEW GEARBOX - LEFT HAND DRIVE, SEW GEARBOX - RIGHT HAND DRIVE, SEW GEARBOX - RIGHT HAND DRIVE, MOTOR / 25HP / 1800RPM / TEFC / 575V/3PH/60HZ / FRAME# 284TC, MOTOR / 25HP / 1800RPM / TEFC / 575V/3PH/60HZ / FRAME# 284TC, MOTOR / 25HP / 1800RPM / TEFC / 575V/3PH/60HZ / FRAME# 284TC, MOTOR / 25HP / 1800RPM / TEFC / 575V/3PH/60HZ / FRAME# 284TC, TRUNNION (A) - LEFT HAND DRIVE, TRUNNION (B)- RIGHT HAND DRIVE, TRUNNION (D) - LEFT HAND DRIVE, TRUNNION (C) - RIGHT HAND DRIVE, THRUST ROLLER ASSEMBLY, THRUST ROLLER ASSEMBLY, TRUNNION LUBRICATION SYSTEM",,No,CH-DR_DUSTCOLL,CH-DR_DUSTCOLL:SY18211.OUT,SY-18211,SY,OUT,Controller output (CO),Speed output (VFD demand),Output/Demand,DRUM DR1826 MOTOR D AMPERAGE,DR-1826
,Test auto lube system on A dryer,23-31560,DR-1826,DR-1826,,,1-9-23 7:43 AM,2023-01-09T07:43:00.000Z,1-12-23 5:00 PM,2023-01-12T17:00:00.000Z,1-11-23 9:00 AM,2023-01-11T09:00:00.000Z,4,4,,CO,CLOSE,Y,,NO,CHATHAM,"2541, 2542, 2543, 2544, 2545, 2547, 2549, 2550, 2552, 2553, 2554, 2555, 2556, 2557, 2558, 2559","SWISS COMBI ROTARY DRYER DRUM, SEW GEARBOX - LEFT HAND DRIVE -, SEW GEARBOX - LEFT HAND DRIVE, SEW GEARBOX - RIGHT HAND DRIVE, SEW GEARBOX - RIGHT HAND DRIVE, MOTOR / 25HP / 1800RPM / TEFC / 575V/3PH/60HZ / FRAME# 284TC, MOTOR / 25HP / 1800RPM / TEFC / 575V/3PH/60HZ / FRAME# 284TC, MOTOR / 25HP / 1800RPM / TEFC / 575V/3PH/60HZ / FRAME# 284TC, MOTOR / 25HP / 1800RPM / TEFC / 575V/3PH/60HZ / FRAME# 284TC, TRUNNION (A) - LEFT HAND DRIVE, TRUNNION (B)- RIGHT HAND DRIVE, TRUNNION (D) - LEFT HAND DRIVE, TRUNNION (C) - RIGHT HAND DRIVE, THRUST ROLLER ASSEMBLY, THRUST ROLLER ASSEMBLY, TRUNNION LUBRICATION SYSTEM",,No,CH-DR_UTIL_WTR,CH-DR_UTIL_WTR:TT35450.MEAS,TT-35450,TT,MEAS,Measured value (PV),Temperature transmitter,Measurement,DRUM DR1826 FRONT LUBEN TIMER,DR-1826
,Test auto lube system on A dryer,23-31560,DR-1826,DR-1826,,,1-9-23 7:43 AM,2023-01-09T07:43:00.000Z,1-12-23 5:00 PM,2023-01-12T17:00:00.000Z,1-11-23 9:00 AM,2023-01-11T09:00:00.000Z,4,4,,CO,CLOSE,Y,,NO,CHATHAM,"2541, 2542, 2543, 2544, 2545, 2547, 2549, 2550, 2552, 2553, 2554, 2555, 2556, 2557, 2558, 2559","SWISS COMBI ROTARY DRYER DRUM, SEW GEARBOX - LEFT HAND DRIVE -, SEW GEARBOX - LEFT HAND DRIVE, SEW GEARBOX - RIGHT HAND DRIVE, SEW GEARBOX - RIGHT HAND DRIVE, MOTOR / 25HP / 1800RPM / TEFC / 575V/3PH/60HZ / FRAME# 284TC, MOTOR / 25HP / 1800RPM / TEFC / 575V/3PH/60HZ / FRAME# 284TC, MOTOR / 25HP / 1800RPM / TEFC / 575V/3PH/60HZ / FRAME# 284TC, MOTOR / 25HP / 1800RPM / TEFC / 575V/3PH/60HZ / FRAME# 284TC, TRUNNION (A) - LEFT HAND DRIVE, TRUNNION (B)- RIGHT HAND DRIVE, TRUNNION (D) - LEFT HAND DRIVE, TRUNNION (C) - RIGHT HAND DRIVE, THRUST ROLLER ASSEMBLY, THRUST ROLLER ASSEMBLY, TRUNNION LUBRICATION SYSTEM",,No,CH-DR_UTIL_WTR,CH-DR_UTIL_WTR:TT35451.MEAS,TT-35451,TT,MEAS,Measured value (PV),Temperature transmitter,Measurement,DRUM DR1826 REAR LUBE TIMER,DR-1826
,Test auto lube system on A dryer,23-31560,DR-1826,DR-1826,,,1-9-23 7:43 AM,2023-01-09T07:43:00.000Z,1-12-23 5:00 PM,2023-01-12T17:00:00.000Z,1-11-23 9:00 AM,2023-01-11T09:00:00.000Z,4,4,,CO,CLOSE,Y,,NO,CHATHAM,"2541, 2542, 2543, 2544, 2545, 2547, 2549, 2550, 2552, 2553, 2554, 2555, 2556, 2557, 2558, 2559","SWISS COMBI ROTARY DRYER DRUM, SEW GEARBOX - LEFT HAND DRIVE -, SEW GEARBOX - LEFT HAND DRIVE, SEW GEARBOX - RIGHT HAND DRIVE, SEW GEARBOX - RIGHT HAND DRIVE, MOTOR / 25HP / 1800RPM / TEFC / 575V/3PH/60HZ / FRAME# 284TC, MOTOR / 25HP / 1800RPM / TEFC / 575V/3PH/60HZ / FRAME# 284TC, MOTOR / 25HP / 1800RPM / TEFC / 575V/3PH/60HZ / FRAME# 284TC, MOTOR / 25HP / 1800RPM / TEFC / 575V/3PH/60HZ / FRAME# 284TC, TRUNNION (A) - LEFT HAND DRIVE, TRUNNION (B)- RIGHT HAND DRIVE, TRUNNION (D) - LEFT HAND DRIVE, TRUNNION (C) - RIGHT HAND DRIVE, THRUST ROLLER ASSEMBLY, THRUST ROLLER ASSEMBLY, TRUNNION LUBRICATION SYSTEM",,No,CH-DR_DUSTCOLL,CH-DR_DUSTCOLL:RV1834.STAIND,RV-1834,RV,STAIND,"Status indication (open/closed, run/stop)",Rotary valve (asset),Equipment status,DRUM DR1826 MASTER  START,DR-1826
,Test auto lube system on A dryer,23-31560,DR-1826,DR-1826,,,1-9-23 7:43 AM,2023-01-09T07:43:00.000Z,1-12-23 5:00 PM,2023-01-12T17:00:00.000Z,1-11-23 9:00 AM,2023-01-11T09:00:00.000Z,4,4,,CO,CLOSE,Y,,NO,CHATHAM,"2541, 2542, 2543, 2544, 2545, 2547, 2549, 2550, 2552, 2553, 2554, 2555, 2556, 2557, 2558, 2559","SWISS COMBI ROTARY DRYER DRUM, SEW GEARBOX - LEFT HAND DRIVE -, SEW GEARBOX - LEFT HAND DRIVE, SEW GEARBOX - RIGHT HAND DRIVE, SEW GEARBOX - RIGHT HAND DRIVE, MOTOR / 25HP / 1800RPM / TEFC / 575V/3PH/60HZ / FRAME# 284TC, MOTOR / 25HP / 1800RPM / TEFC / 575V/3PH/60HZ / FRAME# 284TC, MOTOR / 25HP / 1800RPM / TEFC / 575V/3PH/60HZ / FRAME# 284TC, MOTOR / 25HP / 1800RPM / TEFC / 575V/3PH/60HZ / FRAME# 284TC, TRUNNION (A) - LEFT HAND DRIVE, TRUNNION (B)- RIGHT HAND DRIVE, TRUNNION (D) - LEFT HAND DRIVE, TRUNNION (C) - RIGHT HAND DRIVE, THRUST ROLLER ASSEMBLY, THRUST ROLLER ASSEMBLY, TRUNNION LUBRICATION SYSTEM",,No,CH-DR_DUSTCOLL,CH-DR_DUSTCOLL:XV18211.STAIND,XV-18211,XV,STAIND,"Status indication (open/closed, run/stop)",Valve/damper/door status (discrete),Equipment status,DRUM DR1826 MOTOR A AMPERAGE,DR-1826
,Test auto lube system on A dryer,23-31560,DR-1826,DR-1826,,,1-9-23 7:43 AM,2023-01-09T07:43:00.000Z,1-12-23 5:00 PM,2023-01-12T17:00:00.000Z,1-11-23 9:00 AM,2023-01-11T09:00:00.000Z,4,4,,CO,CLOSE,Y,,NO,CHATHAM,"2541, 2542, 2543, 2544, 2545, 2547, 2549, 2550, 2552, 2553, 2554, 2555, 2556, 2557, 2558, 2559","SWISS COMBI ROTARY DRYER DRUM, SEW GEARBOX - LEFT HAND DRIVE -, SEW GEARBOX - LEFT HAND DRIVE, SEW GEARBOX - RIGHT HAND DRIVE, SEW GEARBOX - RIGHT HAND DRIVE, MOTOR / 25HP / 1800RPM / TEFC / 575V/3PH/60HZ / FRAME# 284TC, MOTOR / 25HP / 1800RPM / TEFC / 575V/3PH/60HZ / FRAME# 284TC, MOTOR / 25HP / 1800RPM / TEFC / 575V/3PH/60HZ / FRAME# 284TC, MOTOR / 25HP / 1800RPM / TEFC / 575V/3PH/60HZ / FRAME# 284TC, TRUNNION (A) - LEFT HAND DRIVE, TRUNNION (B)- RIGHT HAND DRIVE, TRUNNION (D) - LEFT HAND DRIVE, TRUNNION (C) - RIGHT HAND DRIVE, THRUST ROLLER ASSEMBLY, THRUST ROLLER ASSEMBLY, TRUNNION LUBRICATION SYSTEM",,No,CH-DR_PROC_AIR,CH-DR_PROC_AIR:PT33307.MEAS,PT-33307,PT,MEAS,Measured value (PV),Pressure transmitter,Measurement,DRUM DR1826 MOTOR B AMPERAGE,DR-1826
,Test auto lube system on A dryer,23-31560,DR-1826,DR-1826,,,1-9-23 7:43 AM,2023-01-09T07:43:00.000Z,1-12-23 5:00 PM,2023-01-12T17:00:00.000Z,1-11-23 9:00 AM,2023-01-11T09:00:00.000Z,4,4,,CO,CLOSE,Y,,NO,CHATHAM,"2541, 2542, 2543, 2544, 2545, 2547, 2549, 2550, 2552, 2553, 2554, 2555, 2556, 2557, 2558, 2559","SWISS COMBI ROTARY DRYER DRUM, SEW GEARBOX - LEFT HAND DRIVE -, SEW GEARBOX - LEFT HAND DRIVE, SEW GEARBOX - RIGHT HAND DRIVE, SEW GEARBOX - RIGHT HAND DRIVE, MOTOR / 25HP / 1800RPM / TEFC / 575V/3PH/60HZ / FRAME# 284TC, MOTOR / 25HP / 1800RPM / TEFC / 575V/3PH/60HZ / FRAME# 284TC, MOTOR / 25HP / 1800RPM / TEFC / 575V/3PH/60HZ / FRAME# 284TC, MOTOR / 25HP / 1800RPM / TEFC / 575V/3PH/60HZ / FRAME# 284TC, TRUNNION (A) - LEFT HAND DRIVE, TRUNNION (B)- RIGHT HAND DRIVE, TRUNNION (D) - LEFT HAND DRIVE, TRUNNION (C) - RIGHT HAND DRIVE, THRUST ROLLER ASSEMBLY, THRUST ROLLER ASSEMBLY, TRUNNION LUBRICATION SYSTEM",,No,CH-DR_UTIL_WTR,CH-DR_UTIL_WTR:P1836.STAIND,P-1836,P,STAIND,"Status indication (open/closed, run/stop)",Pump (asset),Equipment status,DRUM DR1826 MOTOR C AMPERAGE,DR-1826
,Test auto lube system on A dryer,23-31560,DR-1826,DR-1826,,,1-9-23 7:43 AM,2023-01-09T07:43:00.000Z,1-12-23 5:00 PM,2023-01-12T17:00:00.000Z,1-11-23 9:00 AM,2023-01-11T09:00:00.000Z,4,4,,CO,CLOSE,Y,,NO,CHATHAM,"2541, 2542, 2543, 2544, 2545, 2547, 2549, 2550, 2552, 2553, 2554, 2555, 2556, 2557, 2558, 2559","SWISS COMBI ROTARY DRYER DRUM, SEW GEARBOX - LEFT HAND DRIVE -, SEW GEARBOX - LEFT HAND DRIVE, SEW GEARBOX - RIGHT HAND DRIVE, SEW GEARBOX - RIGHT HAND DRIVE, MOTOR / 25HP / 1800RPM / TEFC / 575V/3PH/60HZ / FRAME# 284TC, MOTOR / 25HP / 1800RPM / TEFC / 575V/3PH/60HZ / FRAME# 284TC, MOTOR / 25HP / 1800RPM / TEFC / 575V/3PH/60HZ / FRAME# 284TC, MOTOR / 25HP / 1800RPM / TEFC / 575V/3PH/60HZ / FRAME# 284TC, TRUNNION (A) - LEFT HAND DRIVE, TRUNNION (B)- RIGHT HAND DRIVE, TRUNNION (D) - LEFT HAND DRIVE, TRUNNION (C) - RIGHT HAND DRIVE, THRUST ROLLER ASSEMBLY, THRUST ROLLER ASSEMBLY, TRUNNION LUBRICATION SYSTEM",,No,CH-DR_UTIL_WTR,CH-DR_UTIL_WTR:P1837.STAIND,P-1837,P,STAIND,"Status indication (open/closed, run/stop)",Pump (asset),Equipment status,DRUM DR1826 MOTOR D AMPERAGE,DR-1826
,Test auto lube system on A dryer,23-31560,DR-1826,DR-1826,,,1-9-23 7:43 AM,2023-01-09T07:43:00.000Z,1-12-23 5:00 PM,2023-01-12T17:00:00.000Z,1-11-23 9:00 AM,2023-01-11T09:00:00.000Z,4,4,,CO,CLOSE,Y,,NO,CHATHAM,"2541, 2542, 2543, 2544, 2545, 2547, 2549, 2550, 2552, 2553, 2554, 2555, 2556, 2557, 2558, 2559","SWISS COMBI ROTARY DRYER DRUM, SEW GEARBOX - LEFT HAND DRIVE -, SEW GEARBOX - LEFT HAND DRIVE, SEW GEARBOX - RIGHT HAND DRIVE, SEW GEARBOX - RIGHT HAND DRIVE, MOTOR / 25HP / 1800RPM / TEFC / 575V/3PH/60HZ / FRAME# 284TC, MOTOR / 25HP / 1800RPM / TEFC / 575V/3PH/60HZ / FRAME# 284TC, MOTOR / 25HP / 1800RPM / TEFC / 575V/3PH/60HZ / FRAME# 284TC, MOTOR / 25HP / 1800RPM / TEFC / 575V/3PH/60HZ / FRAME# 284TC, TRUNNION (A) - LEFT HAND DRIVE, TRUNNION (B)- RIGHT HAND DRIVE, TRUNNION (D) - LEFT HAND DRIVE, TRUNNION (C) - RIGHT HAND DRIVE, THRUST ROLLER ASSEMBLY, THRUST ROLLER ASSEMBLY, TRUNNION LUBRICATION SYSTEM",,No,CH-DR_UTIL_WTR,CH-DR_UTIL_WTR:TT35455.MEAS,TT-35455,TT,MEAS,Measured value (PV),Temperature transmitter,Measurement,DRUM DR1826 FRONT LUBEN TIMER,DR-1826
,Test auto lube system on A dryer,23-31560,DR-1826,DR-1826,,,1-9-23 7:43 AM,2023-01-09T07:43:00.000Z,1-12-23 5:00 PM,2023-01-12T17:00:00.000Z,1-11-23 9:00 AM,2023-01-11T09:00:00.000Z,4,4,,CO,CLOSE,Y,,NO,CHATHAM,"2541, 2542, 2543, 2544, 2545, 2547, 2549, 2550, 2552, 2553, 2554, 2555, 2556, 2557, 2558, 2559","SWISS COMBI ROTARY DRYER DRUM, SEW GEARBOX - LEFT HAND DRIVE -, SEW GEARBOX - LEFT HAND DRIVE, SEW GEARBOX - RIGHT HAND DRIVE, SEW GEARBOX - RIGHT HAND DRIVE, MOTOR / 25HP / 1800RPM / TEFC / 575V/3PH/60HZ / FRAME# 284TC, MOTOR / 25HP / 1800RPM / TEFC / 575V/3PH/60HZ / FRAME# 284TC, MOTOR / 25HP / 1800RPM / TEFC / 575V/3PH/60HZ / FRAME# 284TC, MOTOR / 25HP / 1800RPM / TEFC / 575V/3PH/60HZ / FRAME# 284TC, TRUNNION (A) - LEFT HAND DRIVE, TRUNNION (B)- RIGHT HAND DRIVE, TRUNNION (D) - LEFT HAND DRIVE, TRUNNION (C) - RIGHT HAND DRIVE, THRUST ROLLER ASSEMBLY, THRUST ROLLER ASSEMBLY, TRUNNION LUBRICATION SYSTEM",,No,CH-DR_UTIL_WTR,CH-DR_UTIL_WTR:TT35456.MEAS,TT-35456,TT,MEAS,Measured value (PV),Temperature transmitter,Measurement,DRUM DR1826 REAR LUBE TIMER,DR-1826
,Test auto lube system on A dryer,23-31560,DR-1826,DR-1826,,,1-9-23 7:43 AM,2023-01-09T07:43:00.000Z,1-12-23 5:00 PM,2023-01-12T17:00:00.000Z,1-11-23 9:00 AM,2023-01-11T09:00:00.000Z,4,4,,CO,CLOSE,Y,,NO,CHATHAM,"2541, 2542, 2543, 2544, 2545, 2547, 2549, 2550, 2552, 2553, 2554, 2555, 2556, 2557, 2558, 2559","SWISS COMBI ROTARY DRYER DRUM, SEW GEARBOX - LEFT HAND DRIVE -, SEW GEARBOX - LEFT HAND DRIVE, SEW GEARBOX - RIGHT HAND DRIVE, SEW GEARBOX - RIGHT HAND DRIVE, MOTOR / 25HP / 1800RPM / TEFC / 575V/3PH/60HZ / FRAME# 284TC, MOTOR / 25HP / 1800RPM / TEFC / 575V/3PH/60HZ / FRAME# 284TC, MOTOR / 25HP / 1800RPM / TEFC / 575V/3PH/60HZ / FRAME# 284TC, MOTOR / 25HP / 1800RPM / TEFC / 575V/3PH/60HZ / FRAME# 284TC, TRUNNION (A) - LEFT HAND DRIVE, TRUNNION (B)- RIGHT HAND DRIVE, TRUNNION (D) - LEFT HAND DRIVE, TRUNNION (C) - RIGHT HAND DRIVE, THRUST ROLLER ASSEMBLY, THRUST ROLLER ASSEMBLY, TRUNNION LUBRICATION SYSTEM",,No,CH-DRYER_D,CH-DRYER_D:FIC84401.OUT,FIC-84401,FIC,OUT,Controller output / demand (CO),Flow indicating controller,Output/Demand,DRUM DR1826 MASTER  START,DR-1826
,Test auto lube system on A dryer,23-31560,DR-1826,DR-1826,,,1-9-23 7:43 AM,2023-01-09T07:43:00.000Z,1-12-23 5:00 PM,2023-01-12T17:00:00.000Z,1-11-23 9:00 AM,2023-01-11T09:00:00.000Z,4,4,,CO,CLOSE,Y,,NO,CHATHAM,"2541, 2542, 2543, 2544, 2545, 2547, 2549, 2550, 2552, 2553, 2554, 2555, 2556, 2557, 2558, 2559","SWISS COMBI ROTARY DRYER DRUM, SEW GEARBOX - LEFT HAND DRIVE -, SEW GEARBOX - LEFT HAND DRIVE, SEW GEARBOX - RIGHT HAND DRIVE, SEW GEARBOX - RIGHT HAND DRIVE, MOTOR / 25HP / 1800RPM / TEFC / 575V/3PH/60HZ / FRAME# 284TC, MOTOR / 25HP / 1800RPM / TEFC / 575V/3PH/60HZ / FRAME# 284TC, MOTOR / 25HP / 1800RPM / TEFC / 575V/3PH/60HZ / FRAME# 284TC, MOTOR / 25HP / 1800RPM / TEFC / 575V/3PH/60HZ / FRAME# 284TC, TRUNNION (A) - LEFT HAND DRIVE, TRUNNION (B)- RIGHT HAND DRIVE, TRUNNION (D) - LEFT HAND DRIVE, TRUNNION (C) - RIGHT HAND DRIVE, THRUST ROLLER ASSEMBLY, THRUST ROLLER ASSEMBLY, TRUNNION LUBRICATION SYSTEM",,No,CH-DRYER_D,CH-DRYER_D:LIC84401.OUT,LIC-84401,LIC,OUT,Controller output / demand (CO),Level indicating controller,Output/Demand,DRUM DR1826 MOTOR A AMPERAGE,DR-1826
,Test auto lube system on A dryer,23-31560,DR-1826,DR-1826,,,1-9-23 7:43 AM,2023-01-09T07:43:00.000Z,1-12-23 5:00 PM,2023-01-12T17:00:00.000Z,1-11-23 9:00 AM,2023-01-11T09:00:00.000Z,4,4,,CO,CLOSE,Y,,NO,CHATHAM,"2541, 2542, 2543, 2544, 2545, 2547, 2549, 2550, 2552, 2553, 2554, 2555, 2556, 2557, 2558, 2559","SWISS COMBI ROTARY DRYER DRUM, SEW GEARBOX - LEFT HAND DRIVE -, SEW GEARBOX - LEFT HAND DRIVE, SEW GEARBOX - RIGHT HAND DRIVE, SEW GEARBOX - RIGHT HAND DRIVE, MOTOR / 25HP / 1800RPM / TEFC / 575V/3PH/60HZ / FRAME# 284TC, MOTOR / 25HP / 1800RPM / TEFC / 575V/3PH/60HZ / FRAME# 284TC, MOTOR / 25HP / 1800RPM / TEFC / 575V/3PH/60HZ / FRAME# 284TC, MOTOR / 25HP / 1800RPM / TEFC / 575V/3PH/60HZ / FRAME# 284TC, TRUNNION (A) - LEFT HAND DRIVE, TRUNNION (B)- RIGHT HAND DRIVE, TRUNNION (D) - LEFT HAND DRIVE, TRUNNION (C) - RIGHT HAND DRIVE, THRUST ROLLER ASSEMBLY, THRUST ROLLER ASSEMBLY, TRUNNION LUBRICATION SYSTEM",,No,CH-DRYER_D,CH-DRYER_D:LIC84401.SPT,LIC-84401,LIC,SPT,Setpoint (SP),Level indicating controller,Setpoint,DRUM DR1826 MOTOR B AMPERAGE,DR-1826
,Test auto lube system on A dryer,23-31560,DR-1826,DR-1826,,,1-9-23 7:43 AM,2023-01-09T07:43:00.000Z,1-12-23 5:00 PM,2023-01-12T17:00:00.000Z,1-11-23 9:00 AM,2023-01-11T09:00:00.000Z,4,4,,CO,CLOSE,Y,,NO,CHATHAM,"2541, 2542, 2543, 2544, 2545, 2547, 2549, 2550, 2552, 2553, 2554, 2555, 2556, 2557, 2558, 2559","SWISS COMBI ROTARY DRYER DRUM, SEW GEARBOX - LEFT HAND DRIVE -, SEW GEARBOX - LEFT HAND DRIVE, SEW GEARBOX - RIGHT HAND DRIVE, SEW GEARBOX - RIGHT HAND DRIVE, MOTOR / 25HP / 1800RPM / TEFC / 575V/3PH/60HZ / FRAME# 284TC, MOTOR / 25HP / 1800RPM / TEFC / 575V/3PH/60HZ / FRAME# 284TC, MOTOR / 25HP / 1800RPM / TEFC / 575V/3PH/60HZ / FRAME# 284TC, MOTOR / 25HP / 1800RPM / TEFC / 575V/3PH/60HZ / FRAME# 284TC, TRUNNION (A) - LEFT HAND DRIVE, TRUNNION (B)- RIGHT HAND DRIVE, TRUNNION (D) - LEFT HAND DRIVE, TRUNNION (C) - RIGHT HAND DRIVE, THRUST ROLLER ASSEMBLY, THRUST ROLLER ASSEMBLY, TRUNNION LUBRICATION SYSTEM",,No,CH-DRYER_D,CH-DRYER_D:LY84401.OUT,LY-84401,LY,OUT,Controller output / demand (CO),Level final element demand,Output/Demand,DRUM DR1826 MOTOR C AMPERAGE,DR-1826
,Test auto lube system on A dryer,23-31560,DR-1826,DR-1826,,,1-9-23 7:43 AM,2023-01-09T07:43:00.000Z,1-12-23 5:00 PM,2023-01-12T17:00:00.000Z,1-11-23 9:00 AM,2023-01-11T09:00:00.000Z,4,4,,CO,CLOSE,Y,,NO,CHATHAM,"2541, 2542, 2543, 2544, 2545, 2547, 2549, 2550, 2552, 2553, 2554, 2555, 2556, 2557, 2558, 2559","SWISS COMBI ROTARY DRYER DRUM, SEW GEARBOX - LEFT HAND DRIVE -, SEW GEARBOX - LEFT HAND DRIVE, SEW GEARBOX - RIGHT HAND DRIVE, SEW GEARBOX - RIGHT HAND DRIVE, MOTOR / 25HP / 1800RPM / TEFC / 575V/3PH/60HZ / FRAME# 284TC, MOTOR / 25HP / 1800RPM / TEFC / 575V/3PH/60HZ / FRAME# 284TC, MOTOR / 25HP / 1800RPM / TEFC / 575V/3PH/60HZ / FRAME# 284TC, MOTOR / 25HP / 1800RPM / TEFC / 575V/3PH/60HZ / FRAME# 284TC, TRUNNION (A) - LEFT HAND DRIVE, TRUNNION (B)- RIGHT HAND DRIVE, TRUNNION (D) - LEFT HAND DRIVE, TRUNNION (C) - RIGHT HAND DRIVE, THRUST ROLLER ASSEMBLY, THRUST ROLLER ASSEMBLY, TRUNNION LUBRICATION SYSTEM",,No,CH-DRYER_D,CH-DRYER_D:MX1801D.STAIND,MX-1801D,MX,STAIND,"Status indication (open/closed, run/stop)",Mixer (asset),Equipment status,DRUM DR1826 MOTOR D AMPERAGE,DR-1826
,Test auto lube system on A dryer,23-31560,DR-1826,DR-1826,,,1-9-23 7:43 AM,2023-01-09T07:43:00.000Z,1-12-23 5:00 PM,2023-01-12T17:00:00.000Z,1-11-23 9:00 AM,2023-01-11T09:00:00.000Z,4,4,,CO,CLOSE,Y,,NO,CHATHAM,"2541, 2542, 2543, 2544, 2545, 2547, 2549, 2550, 2552, 2553, 2554, 2555, 2556, 2557, 2558, 2559","SWISS COMBI ROTARY DRYER DRUM, SEW GEARBOX - LEFT HAND DRIVE -, SEW GEARBOX - LEFT HAND DRIVE, SEW GEARBOX - RIGHT HAND DRIVE, SEW GEARBOX - RIGHT HAND DRIVE, MOTOR / 25HP / 1800RPM / TEFC / 575V/3PH/60HZ / FRAME# 284TC, MOTOR / 25HP / 1800RPM / TEFC / 575V/3PH/60HZ / FRAME# 284TC, MOTOR / 25HP / 1800RPM / TEFC / 575V/3PH/60HZ / FRAME# 284TC, MOTOR / 25HP / 1800RPM / TEFC / 575V/3PH/60HZ / FRAME# 284TC, TRUNNION (A) - LEFT HAND DRIVE, TRUNNION (B)- RIGHT HAND DRIVE, TRUNNION (D) - LEFT HAND DRIVE, TRUNNION (C) - RIGHT HAND DRIVE, THRUST ROLLER ASSEMBLY, THRUST ROLLER ASSEMBLY, TRUNNION LUBRICATION SYSTEM",,No,CH-DRYER_D,CH-DRYER_D:PT84402.PNT,PT-84402,PT,PNT,Point value / indication,Pressure transmitter,Measurement,DRUM DR1826 FRONT LUBEN TIMER,DR-1826
,Test auto lube system on A dryer,23-31560,DR-1826,DR-1826,,,1-9-23 7:43 AM,2023-01-09T07:43:00.000Z,1-12-23 5:00 PM,2023-01-12T17:00:00.000Z,1-11-23 9:00 AM,2023-01-11T09:00:00.000Z,4,4,,CO,CLOSE,Y,,NO,CHATHAM,"2541, 2542, 2543, 2544, 2545, 2547, 2549, 2550, 2552, 2553, 2554, 2555, 2556, 2557, 2558, 2559","SWISS COMBI ROTARY DRYER DRUM, SEW GEARBOX - LEFT HAND DRIVE -, SEW GEARBOX - LEFT HAND DRIVE, SEW GEARBOX - RIGHT HAND DRIVE, SEW GEARBOX - RIGHT HAND DRIVE, MOTOR / 25HP / 1800RPM / TEFC / 575V/3PH/60HZ / FRAME# 284TC, MOTOR / 25HP / 1800RPM / TEFC / 575V/3PH/60HZ / FRAME# 284TC, MOTOR / 25HP / 1800RPM / TEFC / 575V/3PH/60HZ / FRAME# 284TC, MOTOR / 25HP / 1800RPM / TEFC / 575V/3PH/60HZ / FRAME# 284TC, TRUNNION (A) - LEFT HAND DRIVE, TRUNNION (B)- RIGHT HAND DRIVE, TRUNNION (D) - LEFT HAND DRIVE, TRUNNION (C) - RIGHT HAND DRIVE, THRUST ROLLER ASSEMBLY, THRUST ROLLER ASSEMBLY, TRUNNION LUBRICATION SYSTEM",,No,CH-DRYER_D,CH-DRYER_D:SG8403A.STAIND,SG-8403A,SG,STAIND,"Status indication (open/closed, run/stop)",Speed/limit switch,Equipment status,DRUM DR1826 REAR LUBE TIMER,DR-1826
,Test auto lube system on A dryer,23-31560,DR-1826,DR-1826,,,1-9-23 7:43 AM,2023-01-09T07:43:00.000Z,1-12-23 5:00 PM,2023-01-12T17:00:00.000Z,1-11-23 9:00 AM,2023-01-11T09:00:00.000Z,4,4,,CO,CLOSE,Y,,NO,CHATHAM,"2541, 2542, 2543, 2544, 2545, 2547, 2549, 2550, 2552, 2553, 2554, 2555, 2556, 2557, 2558, 2559","SWISS COMBI ROTARY DRYER DRUM, SEW GEARBOX - LEFT HAND DRIVE -, SEW GEARBOX - LEFT HAND DRIVE, SEW GEARBOX - RIGHT HAND DRIVE, SEW GEARBOX - RIGHT HAND DRIVE, MOTOR / 25HP / 1800RPM / TEFC / 575V/3PH/60HZ / FRAME# 284TC, MOTOR / 25HP / 1800RPM / TEFC / 575V/3PH/60HZ / FRAME# 284TC, MOTOR / 25HP / 1800RPM / TEFC / 575V/3PH/60HZ / FRAME# 284TC, MOTOR / 25HP / 1800RPM / TEFC / 575V/3PH/60HZ / FRAME# 284TC, TRUNNION (A) - LEFT HAND DRIVE, TRUNNION (B)- RIGHT HAND DRIVE, TRUNNION (D) - LEFT HAND DRIVE, TRUNNION (C) - RIGHT HAND DRIVE, THRUST ROLLER ASSEMBLY, THRUST ROLLER ASSEMBLY, TRUNNION LUBRICATION SYSTEM",,No,CH-DRYER_D_BMS,CH-DRYER_D_BMS:TIC84302.SPT,TIC-84302,TIC,SPT,Setpoint (SP),Temperature indicating controller,Setpoint,DRUM DR1826 SPEED CONTROL,DR-1826
,Test auto lube system on A dryer,23-31560,DR-1826,DR-1826,,,1-9-23 7:43 AM,2023-01-09T07:43:00.000Z,1-12-23 5:00 PM,2023-01-12T17:00:00.000Z,1-11-23 9:00 AM,2023-01-11T09:00:00.000Z,4,4,,CO,CLOSE,Y,,NO,CHATHAM,"2541, 2542, 2543, 2544, 2545, 2547, 2549, 2550, 2552, 2553, 2554, 2555, 2556, 2557, 2558, 2559","SWISS COMBI ROTARY DRYER DRUM, SEW GEARBOX - LEFT HAND DRIVE -, SEW GEARBOX - LEFT HAND DRIVE, SEW GEARBOX - RIGHT HAND DRIVE, SEW GEARBOX - RIGHT HAND DRIVE, MOTOR / 25HP / 1800RPM / TEFC / 575V/3PH/60HZ / FRAME# 284TC, MOTOR / 25HP / 1800RPM / TEFC / 575V/3PH/60HZ / FRAME# 284TC, MOTOR / 25HP / 1800RPM / TEFC / 575V/3PH/60HZ / FRAME# 284TC, MOTOR / 25HP / 1800RPM / TEFC / 575V/3PH/60HZ / FRAME# 284TC, TRUNNION (A) - LEFT HAND DRIVE, TRUNNION (B)- RIGHT HAND DRIVE, TRUNNION (D) - LEFT HAND DRIVE, TRUNNION (C) - RIGHT HAND DRIVE, THRUST ROLLER ASSEMBLY, THRUST ROLLER ASSEMBLY, TRUNNION LUBRICATION SYSTEM",,No,CH-DRYER_D_BMS,CH-DRYER_D_BMS:TT84201.PNT,TT-84201,TT,PNT,Point value / indication,Temperature transmitter,Measurement,DRUM DR1826 SPEED CONTROL,DR-1826
,Test auto lube system on A dryer,23-31560,DR-1826,DR-1826,,,1-9-23 7:43 AM,2023-01-09T07:43:00.000Z,1-12-23 5:00 PM,2023-01-12T17:00:00.000Z,1-11-23 9:00 AM,2023-01-11T09:00:00.000Z,4,4,,CO,CLOSE,Y,,NO,CHATHAM,"2541, 2542, 2543, 2544, 2545, 2547, 2549, 2550, 2552, 2553, 2554, 2555, 2556, 2557, 2558, 2559","SWISS COMBI ROTARY DRYER DRUM, SEW GEARBOX - LEFT HAND DRIVE -, SEW GEARBOX - LEFT HAND DRIVE, SEW GEARBOX - RIGHT HAND DRIVE, SEW GEARBOX - RIGHT HAND DRIVE, MOTOR / 25HP / 1800RPM / TEFC / 575V/3PH/60HZ / FRAME# 284TC, MOTOR / 25HP / 1800RPM / TEFC / 575V/3PH/60HZ / FRAME# 284TC, MOTOR / 25HP / 1800RPM / TEFC / 575V/3PH/60HZ / FRAME# 284TC, MOTOR / 25HP / 1800RPM / TEFC / 575V/3PH/60HZ / FRAME# 284TC, TRUNNION (A) - LEFT HAND DRIVE, TRUNNION (B)- RIGHT HAND DRIVE, TRUNNION (D) - LEFT HAND DRIVE, TRUNNION (C) - RIGHT HAND DRIVE, THRUST ROLLER ASSEMBLY, THRUST ROLLER ASSEMBLY, TRUNNION LUBRICATION SYSTEM",,No,CH-DRYER_D_BMS,CH-DRYER_D_BMS:TT84203.PNT,TT-84203,TT,PNT,Point value / indication,Temperature transmitter,Measurement,DRUM DR1826 SPEED CONTROL,DR-1826
,Test auto lube system on A dryer,23-31560,DR-1826,DR-1826,,,1-9-23 7:43 AM,2023-01-09T07:43:00.000Z,1-12-23 5:00 PM,2023-01-12T17:00:00.000Z,1-11-23 9:00 AM,2023-01-11T09:00:00.000Z,4,4,,CO,CLOSE,Y,,NO,CHATHAM,"2541, 2542, 2543, 2544, 2545, 2547, 2549, 2550, 2552, 2553, 2554, 2555, 2556, 2557, 2558, 2559","SWISS COMBI ROTARY DRYER DRUM, SEW GEARBOX - LEFT HAND DRIVE -, SEW GEARBOX - LEFT HAND DRIVE, SEW GEARBOX - RIGHT HAND DRIVE, SEW GEARBOX - RIGHT HAND DRIVE, MOTOR / 25HP / 1800RPM / TEFC / 575V/3PH/60HZ / FRAME# 284TC, MOTOR / 25HP / 1800RPM / TEFC / 575V/3PH/60HZ / FRAME# 284TC, MOTOR / 25HP / 1800RPM / TEFC / 575V/3PH/60HZ / FRAME# 284TC, MOTOR / 25HP / 1800RPM / TEFC / 575V/3PH/60HZ / FRAME# 284TC, TRUNNION (A) - LEFT HAND DRIVE, TRUNNION (B)- RIGHT HAND DRIVE, TRUNNION (D) - LEFT HAND DRIVE, TRUNNION (C) - RIGHT HAND DRIVE, THRUST ROLLER ASSEMBLY, THRUST ROLLER ASSEMBLY, TRUNNION LUBRICATION SYSTEM",,No,CH-DRYER_D_BMS,CH-DRYER_D_BMS:TT84205.PNT,TT-84205,TT,PNT,Point value / indication,Temperature transmitter,Measurement,DRUM DR1826 SPEED SWITCH,DR-1826
,Test auto lube system on A dryer,23-31560,DR-1826,DR-1826,,,1-9-23 7:43 AM,2023-01-09T07:43:00.000Z,1-12-23 5:00 PM,2023-01-12T17:00:00.000Z,1-11-23 9:00 AM,2023-01-11T09:00:00.000Z,4,4,,CO,CLOSE,Y,,NO,CHATHAM,"2541, 2542, 2543, 2544, 2545, 2547, 2549, 2550, 2552, 2553, 2554, 2555, 2556, 2557, 2558, 2559","SWISS COMBI ROTARY DRYER DRUM, SEW GEARBOX - LEFT HAND DRIVE -, SEW GEARBOX - LEFT HAND DRIVE, SEW GEARBOX - RIGHT HAND DRIVE, SEW GEARBOX - RIGHT HAND DRIVE, MOTOR / 25HP / 1800RPM / TEFC / 575V/3PH/60HZ / FRAME# 284TC, MOTOR / 25HP / 1800RPM / TEFC / 575V/3PH/60HZ / FRAME# 284TC, MOTOR / 25HP / 1800RPM / TEFC / 575V/3PH/60HZ / FRAME# 284TC, MOTOR / 25HP / 1800RPM / TEFC / 575V/3PH/60HZ / FRAME# 284TC, TRUNNION (A) - LEFT HAND DRIVE, TRUNNION (B)- RIGHT HAND DRIVE, TRUNNION (D) - LEFT HAND DRIVE, TRUNNION (C) - RIGHT HAND DRIVE, THRUST ROLLER ASSEMBLY, THRUST ROLLER ASSEMBLY, TRUNNION LUBRICATION SYSTEM",,No,CH-DRYER_D_CY2,CH-DRYER_D_CY2:TT84317.PNT,TT-84317,TT,PNT,Point value / indication,Temperature transmitter,Measurement,DRUM DR1826 MOTOR 1 CONTROL,DR-1826
,Test auto lube system on A dryer,23-31560,DR-1826,DR-1826,,,1-9-23 7:43 AM,2023-01-09T07:43:00.000Z,1-12-23 5:00 PM,2023-01-12T17:00:00.000Z,1-11-23 9:00 AM,2023-01-11T09:00:00.000Z,4,4,,CO,CLOSE,Y,,NO,CHATHAM,"2541, 2542, 2543, 2544, 2545, 2547, 2549, 2550, 2552, 2553, 2554, 2555, 2556, 2557, 2558, 2559","SWISS COMBI ROTARY DRYER DRUM, SEW GEARBOX - LEFT HAND DRIVE -, SEW GEARBOX - LEFT HAND DRIVE, SEW GEARBOX - RIGHT HAND DRIVE, SEW GEARBOX - RIGHT HAND DRIVE, MOTOR / 25HP / 1800RPM / TEFC / 575V/3PH/60HZ / FRAME# 284TC, MOTOR / 25HP / 1800RPM / TEFC / 575V/3PH/60HZ / FRAME# 284TC, MOTOR / 25HP / 1800RPM / TEFC / 575V/3PH/60HZ / FRAME# 284TC, MOTOR / 25HP / 1800RPM / TEFC / 575V/3PH/60HZ / FRAME# 284TC, TRUNNION (A) - LEFT HAND DRIVE, TRUNNION (B)- RIGHT HAND DRIVE, TRUNNION (D) - LEFT HAND DRIVE, TRUNNION (C) - RIGHT HAND DRIVE, THRUST ROLLER ASSEMBLY, THRUST ROLLER ASSEMBLY, TRUNNION LUBRICATION SYSTEM",,No,CH-DRYER_D_CY2,CH-DRYER_D_CY2:TT84318.PNT,TT-84318,TT,PNT,Point value / indication,Temperature transmitter,Measurement,DR1826 MASTR 2 MOTR SPD CTRL,DR-1826
,Test auto lube system on A dryer,23-31560,DR-1826,DR-1826,,,1-9-23 7:43 AM,2023-01-09T07:43:00.000Z,1-12-23 5:00 PM,2023-01-12T17:00:00.000Z,1-11-23 9:00 AM,2023-01-11T09:00:00.000Z,4,4,,CO,CLOSE,Y,,NO,CHATHAM,"2541, 2542, 2543, 2544, 2545, 2547, 2549, 2550, 2552, 2553, 2554, 2555, 2556, 2557, 2558, 2559","SWISS COMBI ROTARY DRYER DRUM, SEW GEARBOX - LEFT HAND DRIVE -, SEW GEARBOX - LEFT HAND DRIVE, SEW GEARBOX - RIGHT HAND DRIVE, SEW GEARBOX - RIGHT HAND DRIVE, MOTOR / 25HP / 1800RPM / TEFC / 575V/3PH/60HZ / FRAME# 284TC, MOTOR / 25HP / 1800RPM / TEFC / 575V/3PH/60HZ / FRAME# 284TC, MOTOR / 25HP / 1800RPM / TEFC / 575V/3PH/60HZ / FRAME# 284TC, MOTOR / 25HP / 1800RPM / TEFC / 575V/3PH/60HZ / FRAME# 284TC, TRUNNION (A) - LEFT HAND DRIVE, TRUNNION (B)- RIGHT HAND DRIVE, TRUNNION (D) - LEFT HAND DRIVE, TRUNNION (C) - RIGHT HAND DRIVE, THRUST ROLLER ASSEMBLY, THRUST ROLLER ASSEMBLY, TRUNNION LUBRICATION SYSTEM",,No,CH-DRYER_D_CY,CH-DRYER_D_CY:ZTA84308.PNT,ZTA-84308,ZTA,PNT,Point value / indication,Valve/actuator position feedback,Measurement,DRUM DR1826 ACCESS DOOR,DR-1826
,Test auto lube system on A dryer,23-31560,DR-1826,DR-1826,,,1-9-23 7:43 AM,2023-01-09T07:43:00.000Z,1-12-23 5:00 PM,2023-01-12T17:00:00.000Z,1-11-23 9:00 AM,2023-01-11T09:00:00.000Z,4,4,,CO,CLOSE,Y,,NO,CHATHAM,"2541, 2542, 2543, 2544, 2545, 2547, 2549, 2550, 2552, 2553, 2554, 2555, 2556, 2557, 2558, 2559","SWISS COMBI ROTARY DRYER DRUM, SEW GEARBOX - LEFT HAND DRIVE -, SEW GEARBOX - LEFT HAND DRIVE, SEW GEARBOX - RIGHT HAND DRIVE, SEW GEARBOX - RIGHT HAND DRIVE, MOTOR / 25HP / 1800RPM / TEFC / 575V/3PH/60HZ / FRAME# 284TC, MOTOR / 25HP / 1800RPM / TEFC / 575V/3PH/60HZ / FRAME# 284TC, MOTOR / 25HP / 1800RPM / TEFC / 575V/3PH/60HZ / FRAME# 284TC, MOTOR / 25HP / 1800RPM / TEFC / 575V/3PH/60HZ / FRAME# 284TC, TRUNNION (A) - LEFT HAND DRIVE, TRUNNION (B)- RIGHT HAND DRIVE, TRUNNION (D) - LEFT HAND DRIVE, TRUNNION (C) - RIGHT HAND DRIVE, THRUST ROLLER ASSEMBLY, THRUST ROLLER ASSEMBLY, TRUNNION LUBRICATION SYSTEM",,No,CH-DR_DECANT701,CH-DR_DECANT701:ST17703A.MEAS,ST-17703A,ST,MEAS,Measured value (PV),Speed/torque transmitter,Measurement,DRUM DR1826 MASTER  START,DR-1826
,Test auto lube system on A dryer,23-31560,DR-1826,DR-1826,,,1-9-23 7:43 AM,2023-01-09T07:43:00.000Z,1-12-23 5:00 PM,2023-01-12T17:00:00.000Z,1-11-23 9:00 AM,2023-01-11T09:00:00.000Z,4,4,,CO,CLOSE,Y,,NO,CHATHAM,"2541, 2542, 2543, 2544, 2545, 2547, 2549, 2550, 2552, 2553, 2554, 2555, 2556, 2557, 2558, 2559","SWISS COMBI ROTARY DRYER DRUM, SEW GEARBOX - LEFT HAND DRIVE -, SEW GEARBOX - LEFT HAND DRIVE, SEW GEARBOX - RIGHT HAND DRIVE, SEW GEARBOX - RIGHT HAND DRIVE, MOTOR / 25HP / 1800RPM / TEFC / 575V/3PH/60HZ / FRAME# 284TC, MOTOR / 25HP / 1800RPM / TEFC / 575V/3PH/60HZ / FRAME# 284TC, MOTOR / 25HP / 1800RPM / TEFC / 575V/3PH/60HZ / FRAME# 284TC, MOTOR / 25HP / 1800RPM / TEFC / 575V/3PH/60HZ / FRAME# 284TC, TRUNNION (A) - LEFT HAND DRIVE, TRUNNION (B)- RIGHT HAND DRIVE, TRUNNION (D) - LEFT HAND DRIVE, TRUNNION (C) - RIGHT HAND DRIVE, THRUST ROLLER ASSEMBLY, THRUST ROLLER ASSEMBLY, TRUNNION LUBRICATION SYSTEM",,No,CH-DR_DECANT701,CH-DR_DECANT701:XS17703B.CIN,XS-17703B,XS,CIN,Contact input (discrete),Limit/proximity switch (status),Discrete Input,DRUM DR1826 MOTOR A AMPERAGE,DR-1826
,Test auto lube system on A dryer,23-31560,DR-1826,DR-1826,,,1-9-23 7:43 AM,2023-01-09T07:43:00.000Z,1-12-23 5:00 PM,2023-01-12T17:00:00.000Z,1-11-23 9:00 AM,2023-01-11T09:00:00.000Z,4,4,,CO,CLOSE,Y,,NO,CHATHAM,"2541, 2542, 2543, 2544, 2545, 2547, 2549, 2550, 2552, 2553, 2554, 2555, 2556, 2557, 2558, 2559","SWISS COMBI ROTARY DRYER DRUM, SEW GEARBOX - LEFT HAND DRIVE -, SEW GEARBOX - LEFT HAND DRIVE, SEW GEARBOX - RIGHT HAND DRIVE, SEW GEARBOX - RIGHT HAND DRIVE, MOTOR / 25HP / 1800RPM / TEFC / 575V/3PH/60HZ / FRAME# 284TC, MOTOR / 25HP / 1800RPM / TEFC / 575V/3PH/60HZ / FRAME# 284TC, MOTOR / 25HP / 1800RPM / TEFC / 575V/3PH/60HZ / FRAME# 284TC, MOTOR / 25HP / 1800RPM / TEFC / 575V/3PH/60HZ / FRAME# 284TC, TRUNNION (A) - LEFT HAND DRIVE, TRUNNION (B)- RIGHT HAND DRIVE, TRUNNION (D) - LEFT HAND DRIVE, TRUNNION (C) - RIGHT HAND DRIVE, THRUST ROLLER ASSEMBLY, THRUST ROLLER ASSEMBLY, TRUNNION LUBRICATION SYSTEM",,No,CH-DR_DECANT701,CH-DR_DECANT701:XS17703C.CIN,XS-17703C,XS,CIN,Contact input (discrete),Limit/proximity switch (status),Discrete Input,DRUM DR1826 MOTOR B AMPERAGE,DR-1826
,Test auto lube system on A dryer,23-31560,DR-1826,DR-1826,,,1-9-23 7:43 AM,2023-01-09T07:43:00.000Z,1-12-23 5:00 PM,2023-01-12T17:00:00.000Z,1-11-23 9:00 AM,2023-01-11T09:00:00.000Z,4,4,,CO,CLOSE,Y,,NO,CHATHAM,"2541, 2542, 2543, 2544, 2545, 2547, 2549, 2550, 2552, 2553, 2554, 2555, 2556, 2557, 2558, 2559","SWISS COMBI ROTARY DRYER DRUM, SEW GEARBOX - LEFT HAND DRIVE -, SEW GEARBOX - LEFT HAND DRIVE, SEW GEARBOX - RIGHT HAND DRIVE, SEW GEARBOX - RIGHT HAND DRIVE, MOTOR / 25HP / 1800RPM / TEFC / 575V/3PH/60HZ / FRAME# 284TC, MOTOR / 25HP / 1800RPM / TEFC / 575V/3PH/60HZ / FRAME# 284TC, MOTOR / 25HP / 1800RPM / TEFC / 575V/3PH/60HZ / FRAME# 284TC, MOTOR / 25HP / 1800RPM / TEFC / 575V/3PH/60HZ / FRAME# 284TC, TRUNNION (A) - LEFT HAND DRIVE, TRUNNION (B)- RIGHT HAND DRIVE, TRUNNION (D) - LEFT HAND DRIVE, TRUNNION (C) - RIGHT HAND DRIVE, THRUST ROLLER ASSEMBLY, THRUST ROLLER ASSEMBLY, TRUNNION LUBRICATION SYSTEM",,No,CH-DR_DECANT701,CH-DR_DECANT701:XV17702.STAIND,XV-17702,XV,STAIND,"Status indication (open/closed, run/stop)",Valve/damper/door status (discrete),Status,DRUM DR1826 MOTOR C AMPERAGE,DR-1826
,Test auto lube system on A dryer,23-31560,DR-1826,DR-1826,,,1-9-23 7:43 AM,2023-01-09T07:43:00.000Z,1-12-23 5:00 PM,2023-01-12T17:00:00.000Z,1-11-23 9:00 AM,2023-01-11T09:00:00.000Z,4,4,,CO,CLOSE,Y,,NO,CHATHAM,"2541, 2542, 2543, 2544, 2545, 2547, 2549, 2550, 2552, 2553, 2554, 2555, 2556, 2557, 2558, 2559","SWISS COMBI ROTARY DRYER DRUM, SEW GEARBOX - LEFT HAND DRIVE -, SEW GEARBOX - LEFT HAND DRIVE, SEW GEARBOX - RIGHT HAND DRIVE, SEW GEARBOX - RIGHT HAND DRIVE, MOTOR / 25HP / 1800RPM / TEFC / 575V/3PH/60HZ / FRAME# 284TC, MOTOR / 25HP / 1800RPM / TEFC / 575V/3PH/60HZ / FRAME# 284TC, MOTOR / 25HP / 1800RPM / TEFC / 575V/3PH/60HZ / FRAME# 284TC, MOTOR / 25HP / 1800RPM / TEFC / 575V/3PH/60HZ / FRAME# 284TC, TRUNNION (A) - LEFT HAND DRIVE, TRUNNION (B)- RIGHT HAND DRIVE, TRUNNION (D) - LEFT HAND DRIVE, TRUNNION (C) - RIGHT HAND DRIVE, THRUST ROLLER ASSEMBLY, THRUST ROLLER ASSEMBLY, TRUNNION LUBRICATION SYSTEM",,No,CH-DR_DECANT701,CH-DR_DECANT701:XV17732.STAIND,XV-17732,XV,STAIND,"Status indication (open/closed, run/stop)",Valve/damper/door status (discrete),Status,DRUM DR1826 MOTOR D AMPERAGE,DR-1826
,Test auto lube system on A dryer,23-31560,DR-1826,DR-1826,,,1-9-23 7:43 AM,2023-01-09T07:43:00.000Z,1-12-23 5:00 PM,2023-01-12T17:00:00.000Z,1-11-23 9:00 AM,2023-01-11T09:00:00.000Z,4,4,,CO,CLOSE,Y,,NO,CHATHAM,"2541, 2542, 2543, 2544, 2545, 2547, 2549, 2550, 2552, 2553, 2554, 2555, 2556, 2557, 2558, 2559","SWISS COMBI ROTARY DRYER DRUM, SEW GEARBOX - LEFT HAND DRIVE -, SEW GEARBOX - LEFT HAND DRIVE, SEW GEARBOX - RIGHT HAND DRIVE, SEW GEARBOX - RIGHT HAND DRIVE, MOTOR / 25HP / 1800RPM / TEFC / 575V/3PH/60HZ / FRAME# 284TC, MOTOR / 25HP / 1800RPM / TEFC / 575V/3PH/60HZ / FRAME# 284TC, MOTOR / 25HP / 1800RPM / TEFC / 575V/3PH/60HZ / FRAME# 284TC, MOTOR / 25HP / 1800RPM / TEFC / 575V/3PH/60HZ / FRAME# 284TC, TRUNNION (A) - LEFT HAND DRIVE, TRUNNION (B)- RIGHT HAND DRIVE, TRUNNION (D) - LEFT HAND DRIVE, TRUNNION (C) - RIGHT HAND DRIVE, THRUST ROLLER ASSEMBLY, THRUST ROLLER ASSEMBLY, TRUNNION LUBRICATION SYSTEM",,No,CH-DR_DECANT702,CH-DR_DECANT702:ST17706A.MEAS,ST-17706A,ST,MEAS,Measured value (PV),Speed/torque transmitter,Measurement,DRUM DR1826 FRONT LUBEN TIMER,DR-1826
,Test auto lube system on A dryer,23-31560,DR-1826,DR-1826,,,1-9-23 7:43 AM,2023-01-09T07:43:00.000Z,1-12-23 5:00 PM,2023-01-12T17:00:00.000Z,1-11-23 9:00 AM,2023-01-11T09:00:00.000Z,4,4,,CO,CLOSE,Y,,NO,CHATHAM,"2541, 2542, 2543, 2544, 2545, 2547, 2549, 2550, 2552, 2553, 2554, 2555, 2556, 2557, 2558, 2559","SWISS COMBI ROTARY DRYER DRUM, SEW GEARBOX - LEFT HAND DRIVE -, SEW GEARBOX - LEFT HAND DRIVE, SEW GEARBOX - RIGHT HAND DRIVE, SEW GEARBOX - RIGHT HAND DRIVE, MOTOR / 25HP / 1800RPM / TEFC / 575V/3PH/60HZ / FRAME# 284TC, MOTOR / 25HP / 1800RPM / TEFC / 575V/3PH/60HZ / FRAME# 284TC, MOTOR / 25HP / 1800RPM / TEFC / 575V/3PH/60HZ / FRAME# 284TC, MOTOR / 25HP / 1800RPM / TEFC / 575V/3PH/60HZ / FRAME# 284TC, TRUNNION (A) - LEFT HAND DRIVE, TRUNNION (B)- RIGHT HAND DRIVE, TRUNNION (D) - LEFT HAND DRIVE, TRUNNION (C) - RIGHT HAND DRIVE, THRUST ROLLER ASSEMBLY, THRUST ROLLER ASSEMBLY, TRUNNION LUBRICATION SYSTEM",,No,CH-DR_DECANT702,CH-DR_DECANT702:ST17706B.RO01,ST-17706B,ST,RO01,Binary/relay output channel,Speed/torque transmitter,Binary Output,DRUM DR1826 REAR LUBE TIMER,DR-1826
1292,BL-1803D HPW,23-31562,BL-1803D,BL-1803D,,,1-9-23 9:23 AM,2023-01-09T09:23:00.000Z,2-23-23 9:23 AM,2023-02-23T09:23:00.000Z,2-10-23 6:41 AM,2023-02-10T06:41:00.000Z,4,4,,PM,CLOSE,Y,,NO,CHATHAM,1292,"BLOWER, NYB, SERIES 30 GI, MODEL 854, DH, 88,000CFM, 11.4in wg, 735RPM,",,No,CH-DRYER_D_BLR,CH-DRYER_D_BLR:BL1803D.STAIND,BL-1803D,BL,STAIND,"Status indication (open/closed, run/stop)",Blower (asset),Equipment status,HOT WATER PRESSURE,
1292,OPEN MANWAY,23-31563,BL-1803D,BL-1803D,,,1-9-23 9:33 AM,2023-01-09T09:33:00.000Z,2-23-23 9:23 AM,2023-02-23T09:23:00.000Z,2-10-23 6:41 AM,2023-02-10T06:41:00.000Z,4,4,,PM,CLOSE,Y,,NO,CHATHAM,1292,"BLOWER, NYB, SERIES 30 GI, MODEL 854, DH, 88,000CFM, 11.4in wg, 735RPM,",,No,CH-DRYER_D_BLR,CH-DRYER_D_BLR:BL1803D.STAIND,BL-1803D,BL,STAIND,"Status indication (open/closed, run/stop)",Blower (asset),Equipment status,HOT WATER PRESSURE,
1292,ORETC TO CLEAN,23-31564,BL-1803D,BL-1803D,,,1-9-23 9:34 AM,2023-01-09T09:34:00.000Z,2-23-23 9:23 AM,2023-02-23T09:23:00.000Z,2-10-23 6:41 AM,2023-02-10T06:41:00.000Z,4,4,,PM,CLOSE,Y,,NO,CHATHAM,1292,"BLOWER, NYB, SERIES 30 GI, MODEL 854, DH, 88,000CFM, 11.4in wg, 735RPM,",,No,CH-DRYER_D_BLR,CH-DRYER_D_BLR:BL1803D.STAIND,BL-1803D,BL,STAIND,"Status indication (open/closed, run/stop)",Blower (asset),Equipment status,HOT WATER PRESSURE,
1292,CLOSE MANYWAY,23-31565,BL-1803D,BL-1803D,,,1-9-23 9:35 AM,2023-01-09T09:35:00.000Z,2-23-23 9:23 AM,2023-02-23T09:23:00.000Z,2-10-23 6:41 AM,2023-02-10T06:41:00.000Z,4,4,,PM,CLOSE,Y,,NO,CHATHAM,1292,"BLOWER, NYB, SERIES 30 GI, MODEL 854, DH, 88,000CFM, 11.4in wg, 735RPM,",,No,CH-DRYER_D_BLR,CH-DRYER_D_BLR:BL1803D.STAIND,BL-1803D,BL,STAIND,"Status indication (open/closed, run/stop)",Blower (asset),Equipment status,HOT WATER PRESSURE,
1293,BL-1804D HPW,23-31567,BL-1804D,BL-1804D,,OC-MECH,1-9-23 9:44 AM,2023-01-09T09:44:00.000Z,2-23-23 9:44 AM,2023-02-23T09:44:00.000Z,2-10-23 6:41 AM,2023-02-10T06:41:00.000Z,4,4,,PM,CLOSE,Y,,NO,CHATHAM,"1293, 6864","BLOWER, NYB, MODEL 714 SERIES 45, GENERAL INDUSTRIAL, CW/UB, Arrg't 8, MOTOR / 450HP / 1200RPM / TEFC / 2300V/3PH/60HZ / FR# 5808C",,No,CH-DRYER_D_BLR,CH-DRYER_D_BLR:BL1804D.STAIND,BL-1804D,BL,STAIND,"Status indication (open/closed, run/stop)",Blower (asset),Equipment status,CYCLONE INLET PRESSURE,
1293,OPEN MANWAY,23-31568,BL-1804D,BL-1804D,,,1-9-23 9:46 AM,2023-01-09T09:46:00.000Z,2-23-23 9:44 AM,2023-02-23T09:44:00.000Z,2-10-23 6:41 AM,2023-02-10T06:41:00.000Z,4,4,,PM,CLOSE,Y,,NO,CHATHAM,"1293, 6864","BLOWER, NYB, MODEL 714 SERIES 45, GENERAL INDUSTRIAL, CW/UB, Arrg't 8, MOTOR / 450HP / 1200RPM / TEFC / 2300V/3PH/60HZ / FR# 5808C",,No,CH-DRYER_D_BLR,CH-DRYER_D_BLR:BL1804D.STAIND,BL-1804D,BL,STAIND,"Status indication (open/closed, run/stop)",Blower (asset),Equipment status,CYCLONE INLET PRESSURE,
1293,HPW WASH BLOWER,23-31569,BL-1804D,BL-1804D,,,1-9-23 9:47 AM,2023-01-09T09:47:00.000Z,2-23-23 9:44 AM,2023-02-23T09:44:00.000Z,2-10-23 6:41 AM,2023-02-10T06:41:00.000Z,4,4,,PM,CLOSE,Y,,NO,CHATHAM,"1293, 6864","BLOWER, NYB, MODEL 714 SERIES 45, GENERAL INDUSTRIAL, CW/UB, Arrg't 8, MOTOR / 450HP / 1200RPM / TEFC / 2300V/3PH/60HZ / FR# 5808C",,No,CH-DRYER_D_BLR,CH-DRYER_D_BLR:BL1804D.STAIND,BL-1804D,BL,STAIND,"Status indication (open/closed, run/stop)",Blower (asset),Equipment status,CYCLONE INLET PRESSURE,
1293,CLOSE MANWAY,23-31570,BL-1804D,BL-1804D,,,1-9-23 9:47 AM,2023-01-09T09:47:00.000Z,2-23-23 9:44 AM,2023-02-23T09:44:00.000Z,2-10-23 6:41 AM,2023-02-10T06:41:00.000Z,4,4,,PM,CLOSE,Y,,NO,CHATHAM,"1293, 6864","BLOWER, NYB, MODEL 714 SERIES 45, GENERAL INDUSTRIAL, CW/UB, Arrg't 8, MOTOR / 450HP / 1200RPM / TEFC / 2300V/3PH/60HZ / FR# 5808C",,No,CH-DRYER_D_BLR,CH-DRYER_D_BLR:BL1804D.STAIND,BL-1804D,BL,STAIND,"Status indication (open/closed, run/stop)",Blower (asset),Equipment status,CYCLONE INLET PRESSURE,
1293,BL-1804D BLOWER ROUTINE PM - DR02,23-31572,BL-1804D,BL-1804D,,C-MI,1-9-23 9:58 AM,2023-01-09T09:58:00.000Z,,,3-16-23 6:53 AM,2023-03-16T06:53:00.000Z,4,4,,PM,CLOSE,Y,N,NO,CHATHAM,"1293, 6864","BLOWER, NYB, MODEL 714 SERIES 45, GENERAL INDUSTRIAL, CW/UB, Arrg't 8, MOTOR / 450HP / 1200RPM / TEFC / 2300V/3PH/60HZ / FR# 5808C",,No,CH-DRYER_D_BLR,CH-DRYER_D_BLR:BL1804D.STAIND,BL-1804D,BL,STAIND,"Status indication (open/closed, run/stop)",Blower (asset),Equipment status,CYCLONE INLET PRESSURE,
1293,REMOVE BEARING CAP,23-31573,BL-1804D,BL-1804D,,,1-9-23 9:58 AM,2023-01-09T09:58:00.000Z,2-23-23 9:59 AM,2023-02-23T09:59:00.000Z,3-3-23 4:12 PM,2023-03-03T16:12:00.000Z,4,4,,PM,CLOSE,Y,,NO,CHATHAM,"1293, 6864","BLOWER, NYB, MODEL 714 SERIES 45, GENERAL INDUSTRIAL, CW/UB, Arrg't 8, MOTOR / 450HP / 1200RPM / TEFC / 2300V/3PH/60HZ / FR# 5808C",,No,CH-DRYER_D_BLR,CH-DRYER_D_BLR:BL1804D.STAIND,BL-1804D,BL,STAIND,"Status indication (open/closed, run/stop)",Blower (asset),Equipment status,CYCLONE INLET PRESSURE,
1293,INSPECT INTERNALS,23-31574,BL-1804D,BL-1804D,,,1-9-23 10:01 AM,2023-01-09T10:01:00.000Z,,,3-16-23 6:53 AM,2023-03-16T06:53:00.000Z,4,4,,PM,CLOSE,Y,,NO,CHATHAM,"1293, 6864","BLOWER, NYB, MODEL 714 SERIES 45, GENERAL INDUSTRIAL, CW/UB, Arrg't 8, MOTOR / 450HP / 1200RPM / TEFC / 2300V/3PH/60HZ / FR# 5808C",,No,CH-DRYER_D_BLR,CH-DRYER_D_BLR:BL1804D.STAIND,BL-1804D,BL,STAIND,"Status indication (open/closed, run/stop)",Blower (asset),Equipment status,CYCLONE INLET PRESSURE,
1293,RE-INSTALL BEARING CAP,23-31575,BL-1804D,BL-1804D,,,1-9-23 10:02 AM,2023-01-09T10:02:00.000Z,,,3-16-23 6:53 AM,2023-03-16T06:53:00.000Z,4,4,,PM,CLOSE,Y,,NO,CHATHAM,"1293, 6864","BLOWER, NYB, MODEL 714 SERIES 45, GENERAL INDUSTRIAL, CW/UB, Arrg't 8, MOTOR / 450HP / 1200RPM / TEFC / 2300V/3PH/60HZ / FR# 5808C",,No,CH-DRYER_D_BLR,CH-DRYER_D_BLR:BL1804D.STAIND,BL-1804D,BL,STAIND,"Status indication (open/closed, run/stop)",Blower (asset),Equipment status,CYCLONE INLET PRESSURE,
3767,Rebuild rotating assembly,23-31586,P-4114,P-4114,,,1-9-23 11:18 AM,2023-01-09T11:18:00.000Z,1-13-23 11:18 AM,2023-01-13T11:18:00.000Z,1-9-23 4:19 PM,2023-01-09T16:19:00.000Z,4,4,,CO,CLOSE,Y,,NO,CHATHAM,,,,,,,,,,,,,,
6671,Change out purge air blower,23-31587,DR-3301A,DR-3301A,,,1-9-23 11:23 AM,2023-01-09T11:23:00.000Z,1-20-23 11:23 AM,2023-01-20T11:23:00.000Z,1-13-23 3:23 PM,2023-01-13T15:23:00.000Z,4,4,,CO,CLOSE,Y,,NO,CHATHAM,,,,,,,,,,,,,,
,Add second inspection/cleaning door,23-31588,BL-1829,BL-1829,,,1-9-23 11:23 AM,2023-01-09T11:23:00.000Z,2-23-23 5:46 PM,2023-02-23T17:46:00.000Z,4-12-23 3:47 PM,2023-04-12T15:47:00.000Z,4,4,,CO,CLOSE,Y,,NO,CHATHAM,"10034, 2868","BLOWER, HOWDEN, FAN MODEL E40S-8700 SWSI CCW TAU Arrg't7, 600HP / 1200RPM / TEFC / 575V/3PH/60HZ / 5810B FRAME",,Yes,CH-DRYER_A,CH-DRYER_A:SY18153B.OUT,SY-18153B,SY,OUT,Controller output / demand (CO),Speed output (VFD demand),Output/Demand,BL1829 CURRENT INDICATION,BL-1829
,Add second inspection/cleaning door,23-31588,BL-1829,BL-1829,,,1-9-23 11:23 AM,2023-01-09T11:23:00.000Z,2-23-23 5:46 PM,2023-02-23T17:46:00.000Z,4-12-23 3:47 PM,2023-04-12T15:47:00.000Z,4,4,,CO,CLOSE,Y,,NO,CHATHAM,"10034, 2868","BLOWER, HOWDEN, FAN MODEL E40S-8700 SWSI CCW TAU Arrg't7, 600HP / 1200RPM / TEFC / 575V/3PH/60HZ / 5810B FRAME",,Yes,CH-DRYER_A,CH-DRYER_A:SSL18155.CIN,SSL-18155,SSL,CIN,Contact input (discrete),Speed switch (motion proof),Discrete Input,BL1829 SPEED INDICATION,BL-1829
,Add second inspection/cleaning door,23-31588,BL-1829,BL-1829,,,1-9-23 11:23 AM,2023-01-09T11:23:00.000Z,2-23-23 5:46 PM,2023-02-23T17:46:00.000Z,4-12-23 3:47 PM,2023-04-12T15:47:00.000Z,4,4,,CO,CLOSE,Y,,NO,CHATHAM,"10034, 2868","BLOWER, HOWDEN, FAN MODEL E40S-8700 SWSI CCW TAU Arrg't7, 600HP / 1200RPM / TEFC / 575V/3PH/60HZ / 5810B FRAME",,Yes,CH-DRYER_A,CH-DRYER_A:PT18160.MEAS,PT-18160,PT,MEAS,Measured value (PV),Pressure transmitter,Measurement,BL1829 BEARING TEMP,BL-1829
,Add second inspection/cleaning door,23-31588,BL-1829,BL-1829,,,1-9-23 11:23 AM,2023-01-09T11:23:00.000Z,2-23-23 5:46 PM,2023-02-23T17:46:00.000Z,4-12-23 3:47 PM,2023-04-12T15:47:00.000Z,4,4,,CO,CLOSE,Y,,NO,CHATHAM,"10034, 2868","BLOWER, HOWDEN, FAN MODEL E40S-8700 SWSI CCW TAU Arrg't7, 600HP / 1200RPM / TEFC / 575V/3PH/60HZ / 5810B FRAME",,Yes,CH-DRYER_A,CH-DRYER_A:FIC18161.MEAS,FIC-18161,FIC,MEAS,Measured value (PV),Flow indicating controller,Measurement,BL1829 BEARING TEMP,BL-1829
,Add second inspection/cleaning door,23-31588,BL-1829,BL-1829,,,1-9-23 11:23 AM,2023-01-09T11:23:00.000Z,2-23-23 5:46 PM,2023-02-23T17:46:00.000Z,4-12-23 3:47 PM,2023-04-12T15:47:00.000Z,4,4,,CO,CLOSE,Y,,NO,CHATHAM,"10034, 2868","BLOWER, HOWDEN, FAN MODEL E40S-8700 SWSI CCW TAU Arrg't7, 600HP / 1200RPM / TEFC / 575V/3PH/60HZ / 5810B FRAME",,Yes,CH-DRYER_A,CH-DRYER_A:FIC18161.OUT,FIC-18161,FIC,OUT,Controller output / demand (CO),Flow indicating controller,Output/Demand,BL1829 WINDING TEMP,BL-1829
,Add second inspection/cleaning door,23-31588,BL-1829,BL-1829,,,1-9-23 11:23 AM,2023-01-09T11:23:00.000Z,2-23-23 5:46 PM,2023-02-23T17:46:00.000Z,4-12-23 3:47 PM,2023-04-12T15:47:00.000Z,4,4,,CO,CLOSE,Y,,NO,CHATHAM,"10034, 2868","BLOWER, HOWDEN, FAN MODEL E40S-8700 SWSI CCW TAU Arrg't7, 600HP / 1200RPM / TEFC / 575V/3PH/60HZ / 5810B FRAME",,Yes,CH-DRYER_A,CH-DRYER_A:FIC18161.SPT,FIC-18161,FIC,SPT,Setpoint (SP),Flow indicating controller,Setpoint,BL1829 WINDING TEMP,BL-1829
,Add second inspection/cleaning door,23-31588,BL-1829,BL-1829,,,1-9-23 11:23 AM,2023-01-09T11:23:00.000Z,2-23-23 5:46 PM,2023-02-23T17:46:00.000Z,4-12-23 3:47 PM,2023-04-12T15:47:00.000Z,4,4,,CO,CLOSE,Y,,NO,CHATHAM,"10034, 2868","BLOWER, HOWDEN, FAN MODEL E40S-8700 SWSI CCW TAU Arrg't7, 600HP / 1200RPM / TEFC / 575V/3PH/60HZ / 5810B FRAME",,Yes,CH-DRA_PROC_AIR,CH-DRA_PROC_AIR:BL1829.STAIND,BL-1829,BL,STAIND,"Status indication (open/closed, run/stop)",Blower (asset),Equipment status,BL1829 - DRYER A MAIN FAN,BL-1829
,DR0 Dryer A Isolation and Prep.(Gas/Steam),23-31589,DR-1826,DR-1826,,,1-9-23 11:39 AM,2023-01-09T11:39:00.000Z,2-23-23 11:39 AM,2023-02-23T11:39:00.000Z,5-19-23 2:04 PM,2023-05-19T14:04:00.000Z,4,4,,PM,CLOSE,Y,,NO,CHATHAM,"2541, 2542, 2543, 2544, 2545, 2547, 2549, 2550, 2552, 2553, 2554, 2555, 2556, 2557, 2558, 2559","SWISS COMBI ROTARY DRYER DRUM, SEW GEARBOX - LEFT HAND DRIVE -, SEW GEARBOX - LEFT HAND DRIVE, SEW GEARBOX - RIGHT HAND DRIVE, SEW GEARBOX - RIGHT HAND DRIVE, MOTOR / 25HP / 1800RPM / TEFC / 575V/3PH/60HZ / FRAME# 284TC, MOTOR / 25HP / 1800RPM / TEFC / 575V/3PH/60HZ / FRAME# 284TC, MOTOR / 25HP / 1800RPM / TEFC / 575V/3PH/60HZ / FRAME# 284TC, MOTOR / 25HP / 1800RPM / TEFC / 575V/3PH/60HZ / FRAME# 284TC, TRUNNION (A) - LEFT HAND DRIVE, TRUNNION (B)- RIGHT HAND DRIVE, TRUNNION (D) - LEFT HAND DRIVE, TRUNNION (C) - RIGHT HAND DRIVE, THRUST ROLLER ASSEMBLY, THRUST ROLLER ASSEMBLY, TRUNNION LUBRICATION SYSTEM",,No,CH-DRA_FIRE_WTR,CH-DRA_FIRE_WTR:TT35445.MEAS,TT-35445,TT,MEAS,Measured value (PV),Temperature transmitter,Measurement,DRUM DR1826 ACCESS DOOR,DR-1826
,DR0 Dryer A Isolation and Prep.(Gas/Steam),23-31589,DR-1826,DR-1826,,,1-9-23 11:39 AM,2023-01-09T11:39:00.000Z,2-23-23 11:39 AM,2023-02-23T11:39:00.000Z,5-19-23 2:04 PM,2023-05-19T14:04:00.000Z,4,4,,PM,CLOSE,Y,,NO,CHATHAM,"2541, 2542, 2543, 2544, 2545, 2547, 2549, 2550, 2552, 2553, 2554, 2555, 2556, 2557, 2558, 2559","SWISS COMBI ROTARY DRYER DRUM, SEW GEARBOX - LEFT HAND DRIVE -, SEW GEARBOX - LEFT HAND DRIVE, SEW GEARBOX - RIGHT HAND DRIVE, SEW GEARBOX - RIGHT HAND DRIVE, MOTOR / 25HP / 1800RPM / TEFC / 575V/3PH/60HZ / FRAME# 284TC, MOTOR / 25HP / 1800RPM / TEFC / 575V/3PH/60HZ / FRAME# 284TC, MOTOR / 25HP / 1800RPM / TEFC / 575V/3PH/60HZ / FRAME# 284TC, MOTOR / 25HP / 1800RPM / TEFC / 575V/3PH/60HZ / FRAME# 284TC, TRUNNION (A) - LEFT HAND DRIVE, TRUNNION (B)- RIGHT HAND DRIVE, TRUNNION (D) - LEFT HAND DRIVE, TRUNNION (C) - RIGHT HAND DRIVE, THRUST ROLLER ASSEMBLY, THRUST ROLLER ASSEMBLY, TRUNNION LUBRICATION SYSTEM",,No,CH-DRYER_A,CH-DRYER_A:KS18145A.STAIND,KS-18145A,KS,STAIND,"Status indication (open/closed, run/stop)",Limit switch (asset status),Equipment status,DRUM DR1826 FRONT LUBEN TIMER,DR-1826
,DR0 Dryer A Isolation and Prep.(Gas/Steam),23-31589,DR-1826,DR-1826,,,1-9-23 11:39 AM,2023-01-09T11:39:00.000Z,2-23-23 11:39 AM,2023-02-23T11:39:00.000Z,5-19-23 2:04 PM,2023-05-19T14:04:00.000Z,4,4,,PM,CLOSE,Y,,NO,CHATHAM,"2541, 2542, 2543, 2544, 2545, 2547, 2549, 2550, 2552, 2553, 2554, 2555, 2556, 2557, 2558, 2559","SWISS COMBI ROTARY DRYER DRUM, SEW GEARBOX - LEFT HAND DRIVE -, SEW GEARBOX - LEFT HAND DRIVE, SEW GEARBOX - RIGHT HAND DRIVE, SEW GEARBOX - RIGHT HAND DRIVE, MOTOR / 25HP / 1800RPM / TEFC / 575V/3PH/60HZ / FRAME# 284TC, MOTOR / 25HP / 1800RPM / TEFC / 575V/3PH/60HZ / FRAME# 284TC, MOTOR / 25HP / 1800RPM / TEFC / 575V/3PH/60HZ / FRAME# 284TC, MOTOR / 25HP / 1800RPM / TEFC / 575V/3PH/60HZ / FRAME# 284TC, TRUNNION (A) - LEFT HAND DRIVE, TRUNNION (B)- RIGHT HAND DRIVE, TRUNNION (D) - LEFT HAND DRIVE, TRUNNION (C) - RIGHT HAND DRIVE, THRUST ROLLER ASSEMBLY, THRUST ROLLER ASSEMBLY, TRUNNION LUBRICATION SYSTEM",,No,CH-DRYER_A,CH-DRYER_A:KS18145B.STAIND,KS-18145B,KS,STAIND,"Status indication (open/closed, run/stop)",Limit switch (asset status),Equipment status,DRUM DR1826 REAR LUBE TIMER,DR-1826
,DR0 Dryer A Isolation and Prep.(Gas/Steam),23-31589,DR-1826,DR-1826,,,1-9-23 11:39 AM,2023-01-09T11:39:00.000Z,2-23-23 11:39 AM,2023-02-23T11:39:00.000Z,5-19-23 2:04 PM,2023-05-19T14:04:00.000Z,4,4,,PM,CLOSE,Y,,NO,CHATHAM,"2541, 2542, 2543, 2544, 2545, 2547, 2549, 2550, 2552, 2553, 2554, 2555, 2556, 2557, 2558, 2559","SWISS COMBI ROTARY DRYER DRUM, SEW GEARBOX - LEFT HAND DRIVE -, SEW GEARBOX - LEFT HAND DRIVE, SEW GEARBOX - RIGHT HAND DRIVE, SEW GEARBOX - RIGHT HAND DRIVE, MOTOR / 25HP / 1800RPM / TEFC / 575V/3PH/60HZ / FRAME# 284TC, MOTOR / 25HP / 1800RPM / TEFC / 575V/3PH/60HZ / FRAME# 284TC, MOTOR / 25HP / 1800RPM / TEFC / 575V/3PH/60HZ / FRAME# 284TC, MOTOR / 25HP / 1800RPM / TEFC / 575V/3PH/60HZ / FRAME# 284TC, TRUNNION (A) - LEFT HAND DRIVE, TRUNNION (B)- RIGHT HAND DRIVE, TRUNNION (D) - LEFT HAND DRIVE, TRUNNION (C) - RIGHT HAND DRIVE, THRUST ROLLER ASSEMBLY, THRUST ROLLER ASSEMBLY, TRUNNION LUBRICATION SYSTEM",,No,CH-DRYER_A,CH-DRYER_A:DR1826.STAIND,DR-1826,DR,STAIND,"Status indication (open/closed, run/stop)",Drum/Drive (asset),Equipment status,DRUM DR1826 MASTER  START,DR-1826
,DR0 Dryer A Isolation and Prep.(Gas/Steam),23-31589,DR-1826,DR-1826,,,1-9-23 11:39 AM,2023-01-09T11:39:00.000Z,2-23-23 11:39 AM,2023-02-23T11:39:00.000Z,5-19-23 2:04 PM,2023-05-19T14:04:00.000Z,4,4,,PM,CLOSE,Y,,NO,CHATHAM,"2541, 2542, 2543, 2544, 2545, 2547, 2549, 2550, 2552, 2553, 2554, 2555, 2556, 2557, 2558, 2559","SWISS COMBI ROTARY DRYER DRUM, SEW GEARBOX - LEFT HAND DRIVE -, SEW GEARBOX - LEFT HAND DRIVE, SEW GEARBOX - RIGHT HAND DRIVE, SEW GEARBOX - RIGHT HAND DRIVE, MOTOR / 25HP / 1800RPM / TEFC / 575V/3PH/60HZ / FRAME# 284TC, MOTOR / 25HP / 1800RPM / TEFC / 575V/3PH/60HZ / FRAME# 284TC, MOTOR / 25HP / 1800RPM / TEFC / 575V/3PH/60HZ / FRAME# 284TC, MOTOR / 25HP / 1800RPM / TEFC / 575V/3PH/60HZ / FRAME# 284TC, TRUNNION (A) - LEFT HAND DRIVE, TRUNNION (B)- RIGHT HAND DRIVE, TRUNNION (D) - LEFT HAND DRIVE, TRUNNION (C) - RIGHT HAND DRIVE, THRUST ROLLER ASSEMBLY, THRUST ROLLER ASSEMBLY, TRUNNION LUBRICATION SYSTEM",,No,CH-DR_DUSTCOLL,CH-DR_DUSTCOLL:RV1834.STAIND,RV-1834,RV,STAIND,"Status indication (open/closed, run/stop)",Rotary valve (asset),Equipment Status,DRUM DR1826 MASTER START,DR-1826
,DR0 Dryer A Isolation and Prep.(Gas/Steam),23-31589,DR-1826,DR-1826,,,1-9-23 11:39 AM,2023-01-09T11:39:00.000Z,2-23-23 11:39 AM,2023-02-23T11:39:00.000Z,5-19-23 2:04 PM,2023-05-19T14:04:00.000Z,4,4,,PM,CLOSE,Y,,NO,CHATHAM,"2541, 2542, 2543, 2544, 2545, 2547, 2549, 2550, 2552, 2553, 2554, 2555, 2556, 2557, 2558, 2559","SWISS COMBI ROTARY DRYER DRUM, SEW GEARBOX - LEFT HAND DRIVE -, SEW GEARBOX - LEFT HAND DRIVE, SEW GEARBOX - RIGHT HAND DRIVE, SEW GEARBOX - RIGHT HAND DRIVE, MOTOR / 25HP / 1800RPM / TEFC / 575V/3PH/60HZ / FRAME# 284TC, MOTOR / 25HP / 1800RPM / TEFC / 575V/3PH/60HZ / FRAME# 284TC, MOTOR / 25HP / 1800RPM / TEFC / 575V/3PH/60HZ / FRAME# 284TC, MOTOR / 25HP / 1800RPM / TEFC / 575V/3PH/60HZ / FRAME# 284TC, TRUNNION (A) - LEFT HAND DRIVE, TRUNNION (B)- RIGHT HAND DRIVE, TRUNNION (D) - LEFT HAND DRIVE, TRUNNION (C) - RIGHT HAND DRIVE, THRUST ROLLER ASSEMBLY, THRUST ROLLER ASSEMBLY, TRUNNION LUBRICATION SYSTEM",,No,CH-DR_DUSTCOLL,CH-DR_DUSTCOLL:SI18216.MEAS,SI-18216,SI,MEAS,Measured value (PV),Speed indication (feedback),Measurement,DRUM DR1826 MOTOR A AMPERAGE,DR-1826
,DR0 Dryer A Isolation and Prep.(Gas/Steam),23-31589,DR-1826,DR-1826,,,1-9-23 11:39 AM,2023-01-09T11:39:00.000Z,2-23-23 11:39 AM,2023-02-23T11:39:00.000Z,5-19-23 2:04 PM,2023-05-19T14:04:00.000Z,4,4,,PM,CLOSE,Y,,NO,CHATHAM,"2541, 2542, 2543, 2544, 2545, 2547, 2549, 2550, 2552, 2553, 2554, 2555, 2556, 2557, 2558, 2559","SWISS COMBI ROTARY DRYER DRUM, SEW GEARBOX - LEFT HAND DRIVE -, SEW GEARBOX - LEFT HAND DRIVE, SEW GEARBOX - RIGHT HAND DRIVE, SEW GEARBOX - RIGHT HAND DRIVE, MOTOR / 25HP / 1800RPM / TEFC / 575V/3PH/60HZ / FRAME# 284TC, MOTOR / 25HP / 1800RPM / TEFC / 575V/3PH/60HZ / FRAME# 284TC, MOTOR / 25HP / 1800RPM / TEFC / 575V/3PH/60HZ / FRAME# 284TC, MOTOR / 25HP / 1800RPM / TEFC / 575V/3PH/60HZ / FRAME# 284TC, TRUNNION (A) - LEFT HAND DRIVE, TRUNNION (B)- RIGHT HAND DRIVE, TRUNNION (D) - LEFT HAND DRIVE, TRUNNION (C) - RIGHT HAND DRIVE, THRUST ROLLER ASSEMBLY, THRUST ROLLER ASSEMBLY, TRUNNION LUBRICATION SYSTEM",,No,CH-DR_DUSTCOLL,CH-DR_DUSTCOLL:SSL18216.CIN,SSL-18216,SSL,CIN,Contact input (discrete),Speed switch (motion proof),Discrete Input,DRUM DR1826 MOTOR B AMPERAGE,DR-1826
,DR0 Dryer A Isolation and Prep.(Gas/Steam),23-31589,DR-1826,DR-1826,,,1-9-23 11:39 AM,2023-01-09T11:39:00.000Z,2-23-23 11:39 AM,2023-02-23T11:39:00.000Z,5-19-23 2:04 PM,2023-05-19T14:04:00.000Z,4,4,,PM,CLOSE,Y,,NO,CHATHAM,"2541, 2542, 2543, 2544, 2545, 2547, 2549, 2550, 2552, 2553, 2554, 2555, 2556, 2557, 2558, 2559","SWISS COMBI ROTARY DRYER DRUM, SEW GEARBOX - LEFT HAND DRIVE -, SEW GEARBOX - LEFT HAND DRIVE, SEW GEARBOX - RIGHT HAND DRIVE, SEW GEARBOX - RIGHT HAND DRIVE, MOTOR / 25HP / 1800RPM / TEFC / 575V/3PH/60HZ / FRAME# 284TC, MOTOR / 25HP / 1800RPM / TEFC / 575V/3PH/60HZ / FRAME# 284TC, MOTOR / 25HP / 1800RPM / TEFC / 575V/3PH/60HZ / FRAME# 284TC, MOTOR / 25HP / 1800RPM / TEFC / 575V/3PH/60HZ / FRAME# 284TC, TRUNNION (A) - LEFT HAND DRIVE, TRUNNION (B)- RIGHT HAND DRIVE, TRUNNION (D) - LEFT HAND DRIVE, TRUNNION (C) - RIGHT HAND DRIVE, THRUST ROLLER ASSEMBLY, THRUST ROLLER ASSEMBLY, TRUNNION LUBRICATION SYSTEM",,No,CH-DR_DUSTCOLL,CH-DR_DUSTCOLL:SSL18222.CIN,SSL-18222,SSL,CIN,Contact input (discrete),Speed switch (motion proof),Discrete Input,DRUM DR1826 MOTOR C AMPERAGE,DR-1826
,DR0 Dryer A Isolation and Prep.(Gas/Steam),23-31589,DR-1826,DR-1826,,,1-9-23 11:39 AM,2023-01-09T11:39:00.000Z,2-23-23 11:39 AM,2023-02-23T11:39:00.000Z,5-19-23 2:04 PM,2023-05-19T14:04:00.000Z,4,4,,PM,CLOSE,Y,,NO,CHATHAM,"2541, 2542, 2543, 2544, 2545, 2547, 2549, 2550, 2552, 2553, 2554, 2555, 2556, 2557, 2558, 2559","SWISS COMBI ROTARY DRYER DRUM, SEW GEARBOX - LEFT HAND DRIVE -, SEW GEARBOX - LEFT HAND DRIVE, SEW GEARBOX - RIGHT HAND DRIVE, SEW GEARBOX - RIGHT HAND DRIVE, MOTOR / 25HP / 1800RPM / TEFC / 575V/3PH/60HZ / FRAME# 284TC, MOTOR / 25HP / 1800RPM / TEFC / 575V/3PH/60HZ / FRAME# 284TC, MOTOR / 25HP / 1800RPM / TEFC / 575V/3PH/60HZ / FRAME# 284TC, MOTOR / 25HP / 1800RPM / TEFC / 575V/3PH/60HZ / FRAME# 284TC, TRUNNION (A) - LEFT HAND DRIVE, TRUNNION (B)- RIGHT HAND DRIVE, TRUNNION (D) - LEFT HAND DRIVE, TRUNNION (C) - RIGHT HAND DRIVE, THRUST ROLLER ASSEMBLY, THRUST ROLLER ASSEMBLY, TRUNNION LUBRICATION SYSTEM",,No,CH-DR_DUSTCOLL,CH-DR_DUSTCOLL:SY18211.OUT,SY-18211,SY,OUT,Controller output (CO),Speed output (VFD demand),Output/Demand,DRUM DR1826 MOTOR D AMPERAGE,DR-1826
,DR0 Dryer A Isolation and Prep.(Gas/Steam),23-31589,DR-1826,DR-1826,,,1-9-23 11:39 AM,2023-01-09T11:39:00.000Z,2-23-23 11:39 AM,2023-02-23T11:39:00.000Z,5-19-23 2:04 PM,2023-05-19T14:04:00.000Z,4,4,,PM,CLOSE,Y,,NO,CHATHAM,"2541, 2542, 2543, 2544, 2545, 2547, 2549, 2550, 2552, 2553, 2554, 2555, 2556, 2557, 2558, 2559","SWISS COMBI ROTARY DRYER DRUM, SEW GEARBOX - LEFT HAND DRIVE -, SEW GEARBOX - LEFT HAND DRIVE, SEW GEARBOX - RIGHT HAND DRIVE, SEW GEARBOX - RIGHT HAND DRIVE, MOTOR / 25HP / 1800RPM / TEFC / 575V/3PH/60HZ / FRAME# 284TC, MOTOR / 25HP / 1800RPM / TEFC / 575V/3PH/60HZ / FRAME# 284TC, MOTOR / 25HP / 1800RPM / TEFC / 575V/3PH/60HZ / FRAME# 284TC, MOTOR / 25HP / 1800RPM / TEFC / 575V/3PH/60HZ / FRAME# 284TC, TRUNNION (A) - LEFT HAND DRIVE, TRUNNION (B)- RIGHT HAND DRIVE, TRUNNION (D) - LEFT HAND DRIVE, TRUNNION (C) - RIGHT HAND DRIVE, THRUST ROLLER ASSEMBLY, THRUST ROLLER ASSEMBLY, TRUNNION LUBRICATION SYSTEM",,No,CH-DR_UTIL_WTR,CH-DR_UTIL_WTR:TT35450.MEAS,TT-35450,TT,MEAS,Measured value (PV),Temperature transmitter,Measurement,DRUM DR1826 FRONT LUBEN TIMER,DR-1826
,DR0 Dryer A Isolation and Prep.(Gas/Steam),23-31589,DR-1826,DR-1826,,,1-9-23 11:39 AM,2023-01-09T11:39:00.000Z,2-23-23 11:39 AM,2023-02-23T11:39:00.000Z,5-19-23 2:04 PM,2023-05-19T14:04:00.000Z,4,4,,PM,CLOSE,Y,,NO,CHATHAM,"2541, 2542, 2543, 2544, 2545, 2547, 2549, 2550, 2552, 2553, 2554, 2555, 2556, 2557, 2558, 2559","SWISS COMBI ROTARY DRYER DRUM, SEW GEARBOX - LEFT HAND DRIVE -, SEW GEARBOX - LEFT HAND DRIVE, SEW GEARBOX - RIGHT HAND DRIVE, SEW GEARBOX - RIGHT HAND DRIVE, MOTOR / 25HP / 1800RPM / TEFC / 575V/3PH/60HZ / FRAME# 284TC, MOTOR / 25HP / 1800RPM / TEFC / 575V/3PH/60HZ / FRAME# 284TC, MOTOR / 25HP / 1800RPM / TEFC / 575V/3PH/60HZ / FRAME# 284TC, MOTOR / 25HP / 1800RPM / TEFC / 575V/3PH/60HZ / FRAME# 284TC, TRUNNION (A) - LEFT HAND DRIVE, TRUNNION (B)- RIGHT HAND DRIVE, TRUNNION (D) - LEFT HAND DRIVE, TRUNNION (C) - RIGHT HAND DRIVE, THRUST ROLLER ASSEMBLY, THRUST ROLLER ASSEMBLY, TRUNNION LUBRICATION SYSTEM",,No,CH-DR_UTIL_WTR,CH-DR_UTIL_WTR:TT35451.MEAS,TT-35451,TT,MEAS,Measured value (PV),Temperature transmitter,Measurement,DRUM DR1826 REAR LUBE TIMER,DR-1826
,DR0 Dryer A Isolation and Prep.(Gas/Steam),23-31589,DR-1826,DR-1826,,,1-9-23 11:39 AM,2023-01-09T11:39:00.000Z,2-23-23 11:39 AM,2023-02-23T11:39:00.000Z,5-19-23 2:04 PM,2023-05-19T14:04:00.000Z,4,4,,PM,CLOSE,Y,,NO,CHATHAM,"2541, 2542, 2543, 2544, 2545, 2547, 2549, 2550, 2552, 2553, 2554, 2555, 2556, 2557, 2558, 2559","SWISS COMBI ROTARY DRYER DRUM, SEW GEARBOX - LEFT HAND DRIVE -, SEW GEARBOX - LEFT HAND DRIVE, SEW GEARBOX - RIGHT HAND DRIVE, SEW GEARBOX - RIGHT HAND DRIVE, MOTOR / 25HP / 1800RPM / TEFC / 575V/3PH/60HZ / FRAME# 284TC, MOTOR / 25HP / 1800RPM / TEFC / 575V/3PH/60HZ / FRAME# 284TC, MOTOR / 25HP / 1800RPM / TEFC / 575V/3PH/60HZ / FRAME# 284TC, MOTOR / 25HP / 1800RPM / TEFC / 575V/3PH/60HZ / FRAME# 284TC, TRUNNION (A) - LEFT HAND DRIVE, TRUNNION (B)- RIGHT HAND DRIVE, TRUNNION (D) - LEFT HAND DRIVE, TRUNNION (C) - RIGHT HAND DRIVE, THRUST ROLLER ASSEMBLY, THRUST ROLLER ASSEMBLY, TRUNNION LUBRICATION SYSTEM",,No,CH-DR_DUSTCOLL,CH-DR_DUSTCOLL:RV1834.STAIND,RV-1834,RV,STAIND,"Status indication (open/closed, run/stop)",Rotary valve (asset),Equipment status,DRUM DR1826 MASTER  START,DR-1826
,DR0 Dryer A Isolation and Prep.(Gas/Steam),23-31589,DR-1826,DR-1826,,,1-9-23 11:39 AM,2023-01-09T11:39:00.000Z,2-23-23 11:39 AM,2023-02-23T11:39:00.000Z,5-19-23 2:04 PM,2023-05-19T14:04:00.000Z,4,4,,PM,CLOSE,Y,,NO,CHATHAM,"2541, 2542, 2543, 2544, 2545, 2547, 2549, 2550, 2552, 2553, 2554, 2555, 2556, 2557, 2558, 2559","SWISS COMBI ROTARY DRYER DRUM, SEW GEARBOX - LEFT HAND DRIVE -, SEW GEARBOX - LEFT HAND DRIVE, SEW GEARBOX - RIGHT HAND DRIVE, SEW GEARBOX - RIGHT HAND DRIVE, MOTOR / 25HP / 1800RPM / TEFC / 575V/3PH/60HZ / FRAME# 284TC, MOTOR / 25HP / 1800RPM / TEFC / 575V/3PH/60HZ / FRAME# 284TC, MOTOR / 25HP / 1800RPM / TEFC / 575V/3PH/60HZ / FRAME# 284TC, MOTOR / 25HP / 1800RPM / TEFC / 575V/3PH/60HZ / FRAME# 284TC, TRUNNION (A) - LEFT HAND DRIVE, TRUNNION (B)- RIGHT HAND DRIVE, TRUNNION (D) - LEFT HAND DRIVE, TRUNNION (C) - RIGHT HAND DRIVE, THRUST ROLLER ASSEMBLY, THRUST ROLLER ASSEMBLY, TRUNNION LUBRICATION SYSTEM",,No,CH-DR_DUSTCOLL,CH-DR_DUSTCOLL:XV18211.STAIND,XV-18211,XV,STAIND,"Status indication (open/closed, run/stop)",Valve/damper/door status (discrete),Equipment status,DRUM DR1826 MOTOR A AMPERAGE,DR-1826
,DR0 Dryer A Isolation and Prep.(Gas/Steam),23-31589,DR-1826,DR-1826,,,1-9-23 11:39 AM,2023-01-09T11:39:00.000Z,2-23-23 11:39 AM,2023-02-23T11:39:00.000Z,5-19-23 2:04 PM,2023-05-19T14:04:00.000Z,4,4,,PM,CLOSE,Y,,NO,CHATHAM,"2541, 2542, 2543, 2544, 2545, 2547, 2549, 2550, 2552, 2553, 2554, 2555, 2556, 2557, 2558, 2559","SWISS COMBI ROTARY DRYER DRUM, SEW GEARBOX - LEFT HAND DRIVE -, SEW GEARBOX - LEFT HAND DRIVE, SEW GEARBOX - RIGHT HAND DRIVE, SEW GEARBOX - RIGHT HAND DRIVE, MOTOR / 25HP / 1800RPM / TEFC / 575V/3PH/60HZ / FRAME# 284TC, MOTOR / 25HP / 1800RPM / TEFC / 575V/3PH/60HZ / FRAME# 284TC, MOTOR / 25HP / 1800RPM / TEFC / 575V/3PH/60HZ / FRAME# 284TC, MOTOR / 25HP / 1800RPM / TEFC / 575V/3PH/60HZ / FRAME# 284TC, TRUNNION (A) - LEFT HAND DRIVE, TRUNNION (B)- RIGHT HAND DRIVE, TRUNNION (D) - LEFT HAND DRIVE, TRUNNION (C) - RIGHT HAND DRIVE, THRUST ROLLER ASSEMBLY, THRUST ROLLER ASSEMBLY, TRUNNION LUBRICATION SYSTEM",,No,CH-DR_PROC_AIR,CH-DR_PROC_AIR:PT33307.MEAS,PT-33307,PT,MEAS,Measured value (PV),Pressure transmitter,Measurement,DRUM DR1826 MOTOR B AMPERAGE,DR-1826
,DR0 Dryer A Isolation and Prep.(Gas/Steam),23-31589,DR-1826,DR-1826,,,1-9-23 11:39 AM,2023-01-09T11:39:00.000Z,2-23-23 11:39 AM,2023-02-23T11:39:00.000Z,5-19-23 2:04 PM,2023-05-19T14:04:00.000Z,4,4,,PM,CLOSE,Y,,NO,CHATHAM,"2541, 2542, 2543, 2544, 2545, 2547, 2549, 2550, 2552, 2553, 2554, 2555, 2556, 2557, 2558, 2559","SWISS COMBI ROTARY DRYER DRUM, SEW GEARBOX - LEFT HAND DRIVE -, SEW GEARBOX - LEFT HAND DRIVE, SEW GEARBOX - RIGHT HAND DRIVE, SEW GEARBOX - RIGHT HAND DRIVE, MOTOR / 25HP / 1800RPM / TEFC / 575V/3PH/60HZ / FRAME# 284TC, MOTOR / 25HP / 1800RPM / TEFC / 575V/3PH/60HZ / FRAME# 284TC, MOTOR / 25HP / 1800RPM / TEFC / 575V/3PH/60HZ / FRAME# 284TC, MOTOR / 25HP / 1800RPM / TEFC / 575V/3PH/60HZ / FRAME# 284TC, TRUNNION (A) - LEFT HAND DRIVE, TRUNNION (B)- RIGHT HAND DRIVE, TRUNNION (D) - LEFT HAND DRIVE, TRUNNION (C) - RIGHT HAND DRIVE, THRUST ROLLER ASSEMBLY, THRUST ROLLER ASSEMBLY, TRUNNION LUBRICATION SYSTEM",,No,CH-DR_UTIL_WTR,CH-DR_UTIL_WTR:P1836.STAIND,P-1836,P,STAIND,"Status indication (open/closed, run/stop)",Pump (asset),Equipment status,DRUM DR1826 MOTOR C AMPERAGE,DR-1826
,DR0 Dryer A Isolation and Prep.(Gas/Steam),23-31589,DR-1826,DR-1826,,,1-9-23 11:39 AM,2023-01-09T11:39:00.000Z,2-23-23 11:39 AM,2023-02-23T11:39:00.000Z,5-19-23 2:04 PM,2023-05-19T14:04:00.000Z,4,4,,PM,CLOSE,Y,,NO,CHATHAM,"2541, 2542, 2543, 2544, 2545, 2547, 2549, 2550, 2552, 2553, 2554, 2555, 2556, 2557, 2558, 2559","SWISS COMBI ROTARY DRYER DRUM, SEW GEARBOX - LEFT HAND DRIVE -, SEW GEARBOX - LEFT HAND DRIVE, SEW GEARBOX - RIGHT HAND DRIVE, SEW GEARBOX - RIGHT HAND DRIVE, MOTOR / 25HP / 1800RPM / TEFC / 575V/3PH/60HZ / FRAME# 284TC, MOTOR / 25HP / 1800RPM / TEFC / 575V/3PH/60HZ / FRAME# 284TC, MOTOR / 25HP / 1800RPM / TEFC / 575V/3PH/60HZ / FRAME# 284TC, MOTOR / 25HP / 1800RPM / TEFC / 575V/3PH/60HZ / FRAME# 284TC, TRUNNION (A) - LEFT HAND DRIVE, TRUNNION (B)- RIGHT HAND DRIVE, TRUNNION (D) - LEFT HAND DRIVE, TRUNNION (C) - RIGHT HAND DRIVE, THRUST ROLLER ASSEMBLY, THRUST ROLLER ASSEMBLY, TRUNNION LUBRICATION SYSTEM",,No,CH-DR_UTIL_WTR,CH-DR_UTIL_WTR:P1837.STAIND,P-1837,P,STAIND,"Status indication (open/closed, run/stop)",Pump (asset),Equipment status,DRUM DR1826 MOTOR D AMPERAGE,DR-1826
,DR0 Dryer A Isolation and Prep.(Gas/Steam),23-31589,DR-1826,DR-1826,,,1-9-23 11:39 AM,2023-01-09T11:39:00.000Z,2-23-23 11:39 AM,2023-02-23T11:39:00.000Z,5-19-23 2:04 PM,2023-05-19T14:04:00.000Z,4,4,,PM,CLOSE,Y,,NO,CHATHAM,"2541, 2542, 2543, 2544, 2545, 2547, 2549, 2550, 2552, 2553, 2554, 2555, 2556, 2557, 2558, 2559","SWISS COMBI ROTARY DRYER DRUM, SEW GEARBOX - LEFT HAND DRIVE -, SEW GEARBOX - LEFT HAND DRIVE, SEW GEARBOX - RIGHT HAND DRIVE, SEW GEARBOX - RIGHT HAND DRIVE, MOTOR / 25HP / 1800RPM / TEFC / 575V/3PH/60HZ / FRAME# 284TC, MOTOR / 25HP / 1800RPM / TEFC / 575V/3PH/60HZ / FRAME# 284TC, MOTOR / 25HP / 1800RPM / TEFC / 575V/3PH/60HZ / FRAME# 284TC, MOTOR / 25HP / 1800RPM / TEFC / 575V/3PH/60HZ / FRAME# 284TC, TRUNNION (A) - LEFT HAND DRIVE, TRUNNION (B)- RIGHT HAND DRIVE, TRUNNION (D) - LEFT HAND DRIVE, TRUNNION (C) - RIGHT HAND DRIVE, THRUST ROLLER ASSEMBLY, THRUST ROLLER ASSEMBLY, TRUNNION LUBRICATION SYSTEM",,No,CH-DR_UTIL_WTR,CH-DR_UTIL_WTR:TT35455.MEAS,TT-35455,TT,MEAS,Measured value (PV),Temperature transmitter,Measurement,DRUM DR1826 FRONT LUBEN TIMER,DR-1826
,DR0 Dryer A Isolation and Prep.(Gas/Steam),23-31589,DR-1826,DR-1826,,,1-9-23 11:39 AM,2023-01-09T11:39:00.000Z,2-23-23 11:39 AM,2023-02-23T11:39:00.000Z,5-19-23 2:04 PM,2023-05-19T14:04:00.000Z,4,4,,PM,CLOSE,Y,,NO,CHATHAM,"2541, 2542, 2543, 2544, 2545, 2547, 2549, 2550, 2552, 2553, 2554, 2555, 2556, 2557, 2558, 2559","SWISS COMBI ROTARY DRYER DRUM, SEW GEARBOX - LEFT HAND DRIVE -, SEW GEARBOX - LEFT HAND DRIVE, SEW GEARBOX - RIGHT HAND DRIVE, SEW GEARBOX - RIGHT HAND DRIVE, MOTOR / 25HP / 1800RPM / TEFC / 575V/3PH/60HZ / FRAME# 284TC, MOTOR / 25HP / 1800RPM / TEFC / 575V/3PH/60HZ / FRAME# 284TC, MOTOR / 25HP / 1800RPM / TEFC / 575V/3PH/60HZ / FRAME# 284TC, MOTOR / 25HP / 1800RPM / TEFC / 575V/3PH/60HZ / FRAME# 284TC, TRUNNION (A) - LEFT HAND DRIVE, TRUNNION (B)- RIGHT HAND DRIVE, TRUNNION (D) - LEFT HAND DRIVE, TRUNNION (C) - RIGHT HAND DRIVE, THRUST ROLLER ASSEMBLY, THRUST ROLLER ASSEMBLY, TRUNNION LUBRICATION SYSTEM",,No,CH-DR_UTIL_WTR,CH-DR_UTIL_WTR:TT35456.MEAS,TT-35456,TT,MEAS,Measured value (PV),Temperature transmitter,Measurement,DRUM DR1826 REAR LUBE TIMER,DR-1826
,DR0 Dryer A Isolation and Prep.(Gas/Steam),23-31589,DR-1826,DR-1826,,,1-9-23 11:39 AM,2023-01-09T11:39:00.000Z,2-23-23 11:39 AM,2023-02-23T11:39:00.000Z,5-19-23 2:04 PM,2023-05-19T14:04:00.000Z,4,4,,PM,CLOSE,Y,,NO,CHATHAM,"2541, 2542, 2543, 2544, 2545, 2547, 2549, 2550, 2552, 2553, 2554, 2555, 2556, 2557, 2558, 2559","SWISS COMBI ROTARY DRYER DRUM, SEW GEARBOX - LEFT HAND DRIVE -, SEW GEARBOX - LEFT HAND DRIVE, SEW GEARBOX - RIGHT HAND DRIVE, SEW GEARBOX - RIGHT HAND DRIVE, MOTOR / 25HP / 1800RPM / TEFC / 575V/3PH/60HZ / FRAME# 284TC, MOTOR / 25HP / 1800RPM / TEFC / 575V/3PH/60HZ / FRAME# 284TC, MOTOR / 25HP / 1800RPM / TEFC / 575V/3PH/60HZ / FRAME# 284TC, MOTOR / 25HP / 1800RPM / TEFC / 575V/3PH/60HZ / FRAME# 284TC, TRUNNION (A) - LEFT HAND DRIVE, TRUNNION (B)- RIGHT HAND DRIVE, TRUNNION (D) - LEFT HAND DRIVE, TRUNNION (C) - RIGHT HAND DRIVE, THRUST ROLLER ASSEMBLY, THRUST ROLLER ASSEMBLY, TRUNNION LUBRICATION SYSTEM",,No,CH-DRYER_D,CH-DRYER_D:FIC84401.OUT,FIC-84401,FIC,OUT,Controller output / demand (CO),Flow indicating controller,Output/Demand,DRUM DR1826 MASTER  START,DR-1826
,DR0 Dryer A Isolation and Prep.(Gas/Steam),23-31589,DR-1826,DR-1826,,,1-9-23 11:39 AM,2023-01-09T11:39:00.000Z,2-23-23 11:39 AM,2023-02-23T11:39:00.000Z,5-19-23 2:04 PM,2023-05-19T14:04:00.000Z,4,4,,PM,CLOSE,Y,,NO,CHATHAM,"2541, 2542, 2543, 2544, 2545, 2547, 2549, 2550, 2552, 2553, 2554, 2555, 2556, 2557, 2558, 2559","SWISS COMBI ROTARY DRYER DRUM, SEW GEARBOX - LEFT HAND DRIVE -, SEW GEARBOX - LEFT HAND DRIVE, SEW GEARBOX - RIGHT HAND DRIVE, SEW GEARBOX - RIGHT HAND DRIVE, MOTOR / 25HP / 1800RPM / TEFC / 575V/3PH/60HZ / FRAME# 284TC, MOTOR / 25HP / 1800RPM / TEFC / 575V/3PH/60HZ / FRAME# 284TC, MOTOR / 25HP / 1800RPM / TEFC / 575V/3PH/60HZ / FRAME# 284TC, MOTOR / 25HP / 1800RPM / TEFC / 575V/3PH/60HZ / FRAME# 284TC, TRUNNION (A) - LEFT HAND DRIVE, TRUNNION (B)- RIGHT HAND DRIVE, TRUNNION (D) - LEFT HAND DRIVE, TRUNNION (C) - RIGHT HAND DRIVE, THRUST ROLLER ASSEMBLY, THRUST ROLLER ASSEMBLY, TRUNNION LUBRICATION SYSTEM",,No,CH-DRYER_D,CH-DRYER_D:LIC84401.OUT,LIC-84401,LIC,OUT,Controller output / demand (CO),Level indicating controller,Output/Demand,DRUM DR1826 MOTOR A AMPERAGE,DR-1826
,DR0 Dryer A Isolation and Prep.(Gas/Steam),23-31589,DR-1826,DR-1826,,,1-9-23 11:39 AM,2023-01-09T11:39:00.000Z,2-23-23 11:39 AM,2023-02-23T11:39:00.000Z,5-19-23 2:04 PM,2023-05-19T14:04:00.000Z,4,4,,PM,CLOSE,Y,,NO,CHATHAM,"2541, 2542, 2543, 2544, 2545, 2547, 2549, 2550, 2552, 2553, 2554, 2555, 2556, 2557, 2558, 2559","SWISS COMBI ROTARY DRYER DRUM, SEW GEARBOX - LEFT HAND DRIVE -, SEW GEARBOX - LEFT HAND DRIVE, SEW GEARBOX - RIGHT HAND DRIVE, SEW GEARBOX - RIGHT HAND DRIVE, MOTOR / 25HP / 1800RPM / TEFC / 575V/3PH/60HZ / FRAME# 284TC, MOTOR / 25HP / 1800RPM / TEFC / 575V/3PH/60HZ / FRAME# 284TC, MOTOR / 25HP / 1800RPM / TEFC / 575V/3PH/60HZ / FRAME# 284TC, MOTOR / 25HP / 1800RPM / TEFC / 575V/3PH/60HZ / FRAME# 284TC, TRUNNION (A) - LEFT HAND DRIVE, TRUNNION (B)- RIGHT HAND DRIVE, TRUNNION (D) - LEFT HAND DRIVE, TRUNNION (C) - RIGHT HAND DRIVE, THRUST ROLLER ASSEMBLY, THRUST ROLLER ASSEMBLY, TRUNNION LUBRICATION SYSTEM",,No,CH-DRYER_D,CH-DRYER_D:LIC84401.SPT,LIC-84401,LIC,SPT,Setpoint (SP),Level indicating controller,Setpoint,DRUM DR1826 MOTOR B AMPERAGE,DR-1826
,DR0 Dryer A Isolation and Prep.(Gas/Steam),23-31589,DR-1826,DR-1826,,,1-9-23 11:39 AM,2023-01-09T11:39:00.000Z,2-23-23 11:39 AM,2023-02-23T11:39:00.000Z,5-19-23 2:04 PM,2023-05-19T14:04:00.000Z,4,4,,PM,CLOSE,Y,,NO,CHATHAM,"2541, 2542, 2543, 2544, 2545, 2547, 2549, 2550, 2552, 2553, 2554, 2555, 2556, 2557, 2558, 2559","SWISS COMBI ROTARY DRYER DRUM, SEW GEARBOX - LEFT HAND DRIVE -, SEW GEARBOX - LEFT HAND DRIVE, SEW GEARBOX - RIGHT HAND DRIVE, SEW GEARBOX - RIGHT HAND DRIVE, MOTOR / 25HP / 1800RPM / TEFC / 575V/3PH/60HZ / FRAME# 284TC, MOTOR / 25HP / 1800RPM / TEFC / 575V/3PH/60HZ / FRAME# 284TC, MOTOR / 25HP / 1800RPM / TEFC / 575V/3PH/60HZ / FRAME# 284TC, MOTOR / 25HP / 1800RPM / TEFC / 575V/3PH/60HZ / FRAME# 284TC, TRUNNION (A) - LEFT HAND DRIVE, TRUNNION (B)- RIGHT HAND DRIVE, TRUNNION (D) - LEFT HAND DRIVE, TRUNNION (C) - RIGHT HAND DRIVE, THRUST ROLLER ASSEMBLY, THRUST ROLLER ASSEMBLY, TRUNNION LUBRICATION SYSTEM",,No,CH-DRYER_D,CH-DRYER_D:LY84401.OUT,LY-84401,LY,OUT,Controller output / demand (CO),Level final element demand,Output/Demand,DRUM DR1826 MOTOR C AMPERAGE,DR-1826
,DR0 Dryer A Isolation and Prep.(Gas/Steam),23-31589,DR-1826,DR-1826,,,1-9-23 11:39 AM,2023-01-09T11:39:00.000Z,2-23-23 11:39 AM,2023-02-23T11:39:00.000Z,5-19-23 2:04 PM,2023-05-19T14:04:00.000Z,4,4,,PM,CLOSE,Y,,NO,CHATHAM,"2541, 2542, 2543, 2544, 2545, 2547, 2549, 2550, 2552, 2553, 2554, 2555, 2556, 2557, 2558, 2559","SWISS COMBI ROTARY DRYER DRUM, SEW GEARBOX - LEFT HAND DRIVE -, SEW GEARBOX - LEFT HAND DRIVE, SEW GEARBOX - RIGHT HAND DRIVE, SEW GEARBOX - RIGHT HAND DRIVE, MOTOR / 25HP / 1800RPM / TEFC / 575V/3PH/60HZ / FRAME# 284TC, MOTOR / 25HP / 1800RPM / TEFC / 575V/3PH/60HZ / FRAME# 284TC, MOTOR / 25HP / 1800RPM / TEFC / 575V/3PH/60HZ / FRAME# 284TC, MOTOR / 25HP / 1800RPM / TEFC / 575V/3PH/60HZ / FRAME# 284TC, TRUNNION (A) - LEFT HAND DRIVE, TRUNNION (B)- RIGHT HAND DRIVE, TRUNNION (D) - LEFT HAND DRIVE, TRUNNION (C) - RIGHT HAND DRIVE, THRUST ROLLER ASSEMBLY, THRUST ROLLER ASSEMBLY, TRUNNION LUBRICATION SYSTEM",,No,CH-DRYER_D,CH-DRYER_D:MX1801D.STAIND,MX-1801D,MX,STAIND,"Status indication (open/closed, run/stop)",Mixer (asset),Equipment status,DRUM DR1826 MOTOR D AMPERAGE,DR-1826
,DR0 Dryer A Isolation and Prep.(Gas/Steam),23-31589,DR-1826,DR-1826,,,1-9-23 11:39 AM,2023-01-09T11:39:00.000Z,2-23-23 11:39 AM,2023-02-23T11:39:00.000Z,5-19-23 2:04 PM,2023-05-19T14:04:00.000Z,4,4,,PM,CLOSE,Y,,NO,CHATHAM,"2541, 2542, 2543, 2544, 2545, 2547, 2549, 2550, 2552, 2553, 2554, 2555, 2556, 2557, 2558, 2559","SWISS COMBI ROTARY DRYER DRUM, SEW GEARBOX - LEFT HAND DRIVE -, SEW GEARBOX - LEFT HAND DRIVE, SEW GEARBOX - RIGHT HAND DRIVE, SEW GEARBOX - RIGHT HAND DRIVE, MOTOR / 25HP / 1800RPM / TEFC / 575V/3PH/60HZ / FRAME# 284TC, MOTOR / 25HP / 1800RPM / TEFC / 575V/3PH/60HZ / FRAME# 284TC, MOTOR / 25HP / 1800RPM / TEFC / 575V/3PH/60HZ / FRAME# 284TC, MOTOR / 25HP / 1800RPM / TEFC / 575V/3PH/60HZ / FRAME# 284TC, TRUNNION (A) - LEFT HAND DRIVE, TRUNNION (B)- RIGHT HAND DRIVE, TRUNNION (D) - LEFT HAND DRIVE, TRUNNION (C) - RIGHT HAND DRIVE, THRUST ROLLER ASSEMBLY, THRUST ROLLER ASSEMBLY, TRUNNION LUBRICATION SYSTEM",,No,CH-DRYER_D,CH-DRYER_D:PT84402.PNT,PT-84402,PT,PNT,Point value / indication,Pressure transmitter,Measurement,DRUM DR1826 FRONT LUBEN TIMER,DR-1826
,DR0 Dryer A Isolation and Prep.(Gas/Steam),23-31589,DR-1826,DR-1826,,,1-9-23 11:39 AM,2023-01-09T11:39:00.000Z,2-23-23 11:39 AM,2023-02-23T11:39:00.000Z,5-19-23 2:04 PM,2023-05-19T14:04:00.000Z,4,4,,PM,CLOSE,Y,,NO,CHATHAM,"2541, 2542, 2543, 2544, 2545, 2547, 2549, 2550, 2552, 2553, 2554, 2555, 2556, 2557, 2558, 2559","SWISS COMBI ROTARY DRYER DRUM, SEW GEARBOX - LEFT HAND DRIVE -, SEW GEARBOX - LEFT HAND DRIVE, SEW GEARBOX - RIGHT HAND DRIVE, SEW GEARBOX - RIGHT HAND DRIVE, MOTOR / 25HP / 1800RPM / TEFC / 575V/3PH/60HZ / FRAME# 284TC, MOTOR / 25HP / 1800RPM / TEFC / 575V/3PH/60HZ / FRAME# 284TC, MOTOR / 25HP / 1800RPM / TEFC / 575V/3PH/60HZ / FRAME# 284TC, MOTOR / 25HP / 1800RPM / TEFC / 575V/3PH/60HZ / FRAME# 284TC, TRUNNION (A) - LEFT HAND DRIVE, TRUNNION (B)- RIGHT HAND DRIVE, TRUNNION (D) - LEFT HAND DRIVE, TRUNNION (C) - RIGHT HAND DRIVE, THRUST ROLLER ASSEMBLY, THRUST ROLLER ASSEMBLY, TRUNNION LUBRICATION SYSTEM",,No,CH-DRYER_D,CH-DRYER_D:SG8403A.STAIND,SG-8403A,SG,STAIND,"Status indication (open/closed, run/stop)",Speed/limit switch,Equipment status,DRUM DR1826 REAR LUBE TIMER,DR-1826
,DR0 Dryer A Isolation and Prep.(Gas/Steam),23-31589,DR-1826,DR-1826,,,1-9-23 11:39 AM,2023-01-09T11:39:00.000Z,2-23-23 11:39 AM,2023-02-23T11:39:00.000Z,5-19-23 2:04 PM,2023-05-19T14:04:00.000Z,4,4,,PM,CLOSE,Y,,NO,CHATHAM,"2541, 2542, 2543, 2544, 2545, 2547, 2549, 2550, 2552, 2553, 2554, 2555, 2556, 2557, 2558, 2559","SWISS COMBI ROTARY DRYER DRUM, SEW GEARBOX - LEFT HAND DRIVE -, SEW GEARBOX - LEFT HAND DRIVE, SEW GEARBOX - RIGHT HAND DRIVE, SEW GEARBOX - RIGHT HAND DRIVE, MOTOR / 25HP / 1800RPM / TEFC / 575V/3PH/60HZ / FRAME# 284TC, MOTOR / 25HP / 1800RPM / TEFC / 575V/3PH/60HZ / FRAME# 284TC, MOTOR / 25HP / 1800RPM / TEFC / 575V/3PH/60HZ / FRAME# 284TC, MOTOR / 25HP / 1800RPM / TEFC / 575V/3PH/60HZ / FRAME# 284TC, TRUNNION (A) - LEFT HAND DRIVE, TRUNNION (B)- RIGHT HAND DRIVE, TRUNNION (D) - LEFT HAND DRIVE, TRUNNION (C) - RIGHT HAND DRIVE, THRUST ROLLER ASSEMBLY, THRUST ROLLER ASSEMBLY, TRUNNION LUBRICATION SYSTEM",,No,CH-DRYER_D_BMS,CH-DRYER_D_BMS:TIC84302.SPT,TIC-84302,TIC,SPT,Setpoint (SP),Temperature indicating controller,Setpoint,DRUM DR1826 SPEED CONTROL,DR-1826
,DR0 Dryer A Isolation and Prep.(Gas/Steam),23-31589,DR-1826,DR-1826,,,1-9-23 11:39 AM,2023-01-09T11:39:00.000Z,2-23-23 11:39 AM,2023-02-23T11:39:00.000Z,5-19-23 2:04 PM,2023-05-19T14:04:00.000Z,4,4,,PM,CLOSE,Y,,NO,CHATHAM,"2541, 2542, 2543, 2544, 2545, 2547, 2549, 2550, 2552, 2553, 2554, 2555, 2556, 2557, 2558, 2559","SWISS COMBI ROTARY DRYER DRUM, SEW GEARBOX - LEFT HAND DRIVE -, SEW GEARBOX - LEFT HAND DRIVE, SEW GEARBOX - RIGHT HAND DRIVE, SEW GEARBOX - RIGHT HAND DRIVE, MOTOR / 25HP / 1800RPM / TEFC / 575V/3PH/60HZ / FRAME# 284TC, MOTOR / 25HP / 1800RPM / TEFC / 575V/3PH/60HZ / FRAME# 284TC, MOTOR / 25HP / 1800RPM / TEFC / 575V/3PH/60HZ / FRAME# 284TC, MOTOR / 25HP / 1800RPM / TEFC / 575V/3PH/60HZ / FRAME# 284TC, TRUNNION (A) - LEFT HAND DRIVE, TRUNNION (B)- RIGHT HAND DRIVE, TRUNNION (D) - LEFT HAND DRIVE, TRUNNION (C) - RIGHT HAND DRIVE, THRUST ROLLER ASSEMBLY, THRUST ROLLER ASSEMBLY, TRUNNION LUBRICATION SYSTEM",,No,CH-DRYER_D_BMS,CH-DRYER_D_BMS:TT84201.PNT,TT-84201,TT,PNT,Point value / indication,Temperature transmitter,Measurement,DRUM DR1826 SPEED CONTROL,DR-1826
,DR0 Dryer A Isolation and Prep.(Gas/Steam),23-31589,DR-1826,DR-1826,,,1-9-23 11:39 AM,2023-01-09T11:39:00.000Z,2-23-23 11:39 AM,2023-02-23T11:39:00.000Z,5-19-23 2:04 PM,2023-05-19T14:04:00.000Z,4,4,,PM,CLOSE,Y,,NO,CHATHAM,"2541, 2542, 2543, 2544, 2545, 2547, 2549, 2550, 2552, 2553, 2554, 2555, 2556, 2557, 2558, 2559","SWISS COMBI ROTARY DRYER DRUM, SEW GEARBOX - LEFT HAND DRIVE -, SEW GEARBOX - LEFT HAND DRIVE, SEW GEARBOX - RIGHT HAND DRIVE, SEW GEARBOX - RIGHT HAND DRIVE, MOTOR / 25HP / 1800RPM / TEFC / 575V/3PH/60HZ / FRAME# 284TC, MOTOR / 25HP / 1800RPM / TEFC / 575V/3PH/60HZ / FRAME# 284TC, MOTOR / 25HP / 1800RPM / TEFC / 575V/3PH/60HZ / FRAME# 284TC, MOTOR / 25HP / 1800RPM / TEFC / 575V/3PH/60HZ / FRAME# 284TC, TRUNNION (A) - LEFT HAND DRIVE, TRUNNION (B)- RIGHT HAND DRIVE, TRUNNION (D) - LEFT HAND DRIVE, TRUNNION (C) - RIGHT HAND DRIVE, THRUST ROLLER ASSEMBLY, THRUST ROLLER ASSEMBLY, TRUNNION LUBRICATION SYSTEM",,No,CH-DRYER_D_BMS,CH-DRYER_D_BMS:TT84203.PNT,TT-84203,TT,PNT,Point value / indication,Temperature transmitter,Measurement,DRUM DR1826 SPEED CONTROL,DR-1826
,DR0 Dryer A Isolation and Prep.(Gas/Steam),23-31589,DR-1826,DR-1826,,,1-9-23 11:39 AM,2023-01-09T11:39:00.000Z,2-23-23 11:39 AM,2023-02-23T11:39:00.000Z,5-19-23 2:04 PM,2023-05-19T14:04:00.000Z,4,4,,PM,CLOSE,Y,,NO,CHATHAM,"2541, 2542, 2543, 2544, 2545, 2547, 2549, 2550, 2552, 2553, 2554, 2555, 2556, 2557, 2558, 2559","SWISS COMBI ROTARY DRYER DRUM, SEW GEARBOX - LEFT HAND DRIVE -, SEW GEARBOX - LEFT HAND DRIVE, SEW GEARBOX - RIGHT HAND DRIVE, SEW GEARBOX - RIGHT HAND DRIVE, MOTOR / 25HP / 1800RPM / TEFC / 575V/3PH/60HZ / FRAME# 284TC, MOTOR / 25HP / 1800RPM / TEFC / 575V/3PH/60HZ / FRAME# 284TC, MOTOR / 25HP / 1800RPM / TEFC / 575V/3PH/60HZ / FRAME# 284TC, MOTOR / 25HP / 1800RPM / TEFC / 575V/3PH/60HZ / FRAME# 284TC, TRUNNION (A) - LEFT HAND DRIVE, TRUNNION (B)- RIGHT HAND DRIVE, TRUNNION (D) - LEFT HAND DRIVE, TRUNNION (C) - RIGHT HAND DRIVE, THRUST ROLLER ASSEMBLY, THRUST ROLLER ASSEMBLY, TRUNNION LUBRICATION SYSTEM",,No,CH-DRYER_D_BMS,CH-DRYER_D_BMS:TT84205.PNT,TT-84205,TT,PNT,Point value / indication,Temperature transmitter,Measurement,DRUM DR1826 SPEED SWITCH,DR-1826
,DR0 Dryer A Isolation and Prep.(Gas/Steam),23-31589,DR-1826,DR-1826,,,1-9-23 11:39 AM,2023-01-09T11:39:00.000Z,2-23-23 11:39 AM,2023-02-23T11:39:00.000Z,5-19-23 2:04 PM,2023-05-19T14:04:00.000Z,4,4,,PM,CLOSE,Y,,NO,CHATHAM,"2541, 2542, 2543, 2544, 2545, 2547, 2549, 2550, 2552, 2553, 2554, 2555, 2556, 2557, 2558, 2559","SWISS COMBI ROTARY DRYER DRUM, SEW GEARBOX - LEFT HAND DRIVE -, SEW GEARBOX - LEFT HAND DRIVE, SEW GEARBOX - RIGHT HAND DRIVE, SEW GEARBOX - RIGHT HAND DRIVE, MOTOR / 25HP / 1800RPM / TEFC / 575V/3PH/60HZ / FRAME# 284TC, MOTOR / 25HP / 1800RPM / TEFC / 575V/3PH/60HZ / FRAME# 284TC, MOTOR / 25HP / 1800RPM / TEFC / 575V/3PH/60HZ / FRAME# 284TC, MOTOR / 25HP / 1800RPM / TEFC / 575V/3PH/60HZ / FRAME# 284TC, TRUNNION (A) - LEFT HAND DRIVE, TRUNNION (B)- RIGHT HAND DRIVE, TRUNNION (D) - LEFT HAND DRIVE, TRUNNION (C) - RIGHT HAND DRIVE, THRUST ROLLER ASSEMBLY, THRUST ROLLER ASSEMBLY, TRUNNION LUBRICATION SYSTEM",,No,CH-DRYER_D_CY2,CH-DRYER_D_CY2:TT84317.PNT,TT-84317,TT,PNT,Point value / indication,Temperature transmitter,Measurement,DRUM DR1826 MOTOR 1 CONTROL,DR-1826
,DR0 Dryer A Isolation and Prep.(Gas/Steam),23-31589,DR-1826,DR-1826,,,1-9-23 11:39 AM,2023-01-09T11:39:00.000Z,2-23-23 11:39 AM,2023-02-23T11:39:00.000Z,5-19-23 2:04 PM,2023-05-19T14:04:00.000Z,4,4,,PM,CLOSE,Y,,NO,CHATHAM,"2541, 2542, 2543, 2544, 2545, 2547, 2549, 2550, 2552, 2553, 2554, 2555, 2556, 2557, 2558, 2559","SWISS COMBI ROTARY DRYER DRUM, SEW GEARBOX - LEFT HAND DRIVE -, SEW GEARBOX - LEFT HAND DRIVE, SEW GEARBOX - RIGHT HAND DRIVE, SEW GEARBOX - RIGHT HAND DRIVE, MOTOR / 25HP / 1800RPM / TEFC / 575V/3PH/60HZ / FRAME# 284TC, MOTOR / 25HP / 1800RPM / TEFC / 575V/3PH/60HZ / FRAME# 284TC, MOTOR / 25HP / 1800RPM / TEFC / 575V/3PH/60HZ / FRAME# 284TC, MOTOR / 25HP / 1800RPM / TEFC / 575V/3PH/60HZ / FRAME# 284TC, TRUNNION (A) - LEFT HAND DRIVE, TRUNNION (B)- RIGHT HAND DRIVE, TRUNNION (D) - LEFT HAND DRIVE, TRUNNION (C) - RIGHT HAND DRIVE, THRUST ROLLER ASSEMBLY, THRUST ROLLER ASSEMBLY, TRUNNION LUBRICATION SYSTEM",,No,CH-DRYER_D_CY2,CH-DRYER_D_CY2:TT84318.PNT,TT-84318,TT,PNT,Point value / indication,Temperature transmitter,Measurement,DR1826 MASTR 2 MOTR SPD CTRL,DR-1826
,DR0 Dryer A Isolation and Prep.(Gas/Steam),23-31589,DR-1826,DR-1826,,,1-9-23 11:39 AM,2023-01-09T11:39:00.000Z,2-23-23 11:39 AM,2023-02-23T11:39:00.000Z,5-19-23 2:04 PM,2023-05-19T14:04:00.000Z,4,4,,PM,CLOSE,Y,,NO,CHATHAM,"2541, 2542, 2543, 2544, 2545, 2547, 2549, 2550, 2552, 2553, 2554, 2555, 2556, 2557, 2558, 2559","SWISS COMBI ROTARY DRYER DRUM, SEW GEARBOX - LEFT HAND DRIVE -, SEW GEARBOX - LEFT HAND DRIVE, SEW GEARBOX - RIGHT HAND DRIVE, SEW GEARBOX - RIGHT HAND DRIVE, MOTOR / 25HP / 1800RPM / TEFC / 575V/3PH/60HZ / FRAME# 284TC, MOTOR / 25HP / 1800RPM / TEFC / 575V/3PH/60HZ / FRAME# 284TC, MOTOR / 25HP / 1800RPM / TEFC / 575V/3PH/60HZ / FRAME# 284TC, MOTOR / 25HP / 1800RPM / TEFC / 575V/3PH/60HZ / FRAME# 284TC, TRUNNION (A) - LEFT HAND DRIVE, TRUNNION (B)- RIGHT HAND DRIVE, TRUNNION (D) - LEFT HAND DRIVE, TRUNNION (C) - RIGHT HAND DRIVE, THRUST ROLLER ASSEMBLY, THRUST ROLLER ASSEMBLY, TRUNNION LUBRICATION SYSTEM",,No,CH-DRYER_D_CY,CH-DRYER_D_CY:ZTA84308.PNT,ZTA-84308,ZTA,PNT,Point value / indication,Valve/actuator position feedback,Measurement,DRUM DR1826 ACCESS DOOR,DR-1826
,DR0 Dryer A Isolation and Prep.(Gas/Steam),23-31589,DR-1826,DR-1826,,,1-9-23 11:39 AM,2023-01-09T11:39:00.000Z,2-23-23 11:39 AM,2023-02-23T11:39:00.000Z,5-19-23 2:04 PM,2023-05-19T14:04:00.000Z,4,4,,PM,CLOSE,Y,,NO,CHATHAM,"2541, 2542, 2543, 2544, 2545, 2547, 2549, 2550, 2552, 2553, 2554, 2555, 2556, 2557, 2558, 2559","SWISS COMBI ROTARY DRYER DRUM, SEW GEARBOX - LEFT HAND DRIVE -, SEW GEARBOX - LEFT HAND DRIVE, SEW GEARBOX - RIGHT HAND DRIVE, SEW GEARBOX - RIGHT HAND DRIVE, MOTOR / 25HP / 1800RPM / TEFC / 575V/3PH/60HZ / FRAME# 284TC, MOTOR / 25HP / 1800RPM / TEFC / 575V/3PH/60HZ / FRAME# 284TC, MOTOR / 25HP / 1800RPM / TEFC / 575V/3PH/60HZ / FRAME# 284TC, MOTOR / 25HP / 1800RPM / TEFC / 575V/3PH/60HZ / FRAME# 284TC, TRUNNION (A) - LEFT HAND DRIVE, TRUNNION (B)- RIGHT HAND DRIVE, TRUNNION (D) - LEFT HAND DRIVE, TRUNNION (C) - RIGHT HAND DRIVE, THRUST ROLLER ASSEMBLY, THRUST ROLLER ASSEMBLY, TRUNNION LUBRICATION SYSTEM",,No,CH-DR_DECANT701,CH-DR_DECANT701:ST17703A.MEAS,ST-17703A,ST,MEAS,Measured value (PV),Speed/torque transmitter,Measurement,DRUM DR1826 MASTER  START,DR-1826
,DR0 Dryer A Isolation and Prep.(Gas/Steam),23-31589,DR-1826,DR-1826,,,1-9-23 11:39 AM,2023-01-09T11:39:00.000Z,2-23-23 11:39 AM,2023-02-23T11:39:00.000Z,5-19-23 2:04 PM,2023-05-19T14:04:00.000Z,4,4,,PM,CLOSE,Y,,NO,CHATHAM,"2541, 2542, 2543, 2544, 2545, 2547, 2549, 2550, 2552, 2553, 2554, 2555, 2556, 2557, 2558, 2559","SWISS COMBI ROTARY DRYER DRUM, SEW GEARBOX - LEFT HAND DRIVE -, SEW GEARBOX - LEFT HAND DRIVE, SEW GEARBOX - RIGHT HAND DRIVE, SEW GEARBOX - RIGHT HAND DRIVE, MOTOR / 25HP / 1800RPM / TEFC / 575V/3PH/60HZ / FRAME# 284TC, MOTOR / 25HP / 1800RPM / TEFC / 575V/3PH/60HZ / FRAME# 284TC, MOTOR / 25HP / 1800RPM / TEFC / 575V/3PH/60HZ / FRAME# 284TC, MOTOR / 25HP / 1800RPM / TEFC / 575V/3PH/60HZ / FRAME# 284TC, TRUNNION (A) - LEFT HAND DRIVE, TRUNNION (B)- RIGHT HAND DRIVE, TRUNNION (D) - LEFT HAND DRIVE, TRUNNION (C) - RIGHT HAND DRIVE, THRUST ROLLER ASSEMBLY, THRUST ROLLER ASSEMBLY, TRUNNION LUBRICATION SYSTEM",,No,CH-DR_DECANT701,CH-DR_DECANT701:XS17703B.CIN,XS-17703B,XS,CIN,Contact input (discrete),Limit/proximity switch (status),Discrete Input,DRUM DR1826 MOTOR A AMPERAGE,DR-1826
,DR0 Dryer A Isolation and Prep.(Gas/Steam),23-31589,DR-1826,DR-1826,,,1-9-23 11:39 AM,2023-01-09T11:39:00.000Z,2-23-23 11:39 AM,2023-02-23T11:39:00.000Z,5-19-23 2:04 PM,2023-05-19T14:04:00.000Z,4,4,,PM,CLOSE,Y,,NO,CHATHAM,"2541, 2542, 2543, 2544, 2545, 2547, 2549, 2550, 2552, 2553, 2554, 2555, 2556, 2557, 2558, 2559","SWISS COMBI ROTARY DRYER DRUM, SEW GEARBOX - LEFT HAND DRIVE -, SEW GEARBOX - LEFT HAND DRIVE, SEW GEARBOX - RIGHT HAND DRIVE, SEW GEARBOX - RIGHT HAND DRIVE, MOTOR / 25HP / 1800RPM / TEFC / 575V/3PH/60HZ / FRAME# 284TC, MOTOR / 25HP / 1800RPM / TEFC / 575V/3PH/60HZ / FRAME# 284TC, MOTOR / 25HP / 1800RPM / TEFC / 575V/3PH/60HZ / FRAME# 284TC, MOTOR / 25HP / 1800RPM / TEFC / 575V/3PH/60HZ / FRAME# 284TC, TRUNNION (A) - LEFT HAND DRIVE, TRUNNION (B)- RIGHT HAND DRIVE, TRUNNION (D) - LEFT HAND DRIVE, TRUNNION (C) - RIGHT HAND DRIVE, THRUST ROLLER ASSEMBLY, THRUST ROLLER ASSEMBLY, TRUNNION LUBRICATION SYSTEM",,No,CH-DR_DECANT701,CH-DR_DECANT701:XS17703C.CIN,XS-17703C,XS,CIN,Contact input (discrete),Limit/proximity switch (status),Discrete Input,DRUM DR1826 MOTOR B AMPERAGE,DR-1826
,DR0 Dryer A Isolation and Prep.(Gas/Steam),23-31589,DR-1826,DR-1826,,,1-9-23 11:39 AM,2023-01-09T11:39:00.000Z,2-23-23 11:39 AM,2023-02-23T11:39:00.000Z,5-19-23 2:04 PM,2023-05-19T14:04:00.000Z,4,4,,PM,CLOSE,Y,,NO,CHATHAM,"2541, 2542, 2543, 2544, 2545, 2547, 2549, 2550, 2552, 2553, 2554, 2555, 2556, 2557, 2558, 2559","SWISS COMBI ROTARY DRYER DRUM, SEW GEARBOX - LEFT HAND DRIVE -, SEW GEARBOX - LEFT HAND DRIVE, SEW GEARBOX - RIGHT HAND DRIVE, SEW GEARBOX - RIGHT HAND DRIVE, MOTOR / 25HP / 1800RPM / TEFC / 575V/3PH/60HZ / FRAME# 284TC, MOTOR / 25HP / 1800RPM / TEFC / 575V/3PH/60HZ / FRAME# 284TC, MOTOR / 25HP / 1800RPM / TEFC / 575V/3PH/60HZ / FRAME# 284TC, MOTOR / 25HP / 1800RPM / TEFC / 575V/3PH/60HZ / FRAME# 284TC, TRUNNION (A) - LEFT HAND DRIVE, TRUNNION (B)- RIGHT HAND DRIVE, TRUNNION (D) - LEFT HAND DRIVE, TRUNNION (C) - RIGHT HAND DRIVE, THRUST ROLLER ASSEMBLY, THRUST ROLLER ASSEMBLY, TRUNNION LUBRICATION SYSTEM",,No,CH-DR_DECANT701,CH-DR_DECANT701:XV17702.STAIND,XV-17702,XV,STAIND,"Status indication (open/closed, run/stop)",Valve/damper/door status (discrete),Status,DRUM DR1826 MOTOR C AMPERAGE,DR-1826
,DR0 Dryer A Isolation and Prep.(Gas/Steam),23-31589,DR-1826,DR-1826,,,1-9-23 11:39 AM,2023-01-09T11:39:00.000Z,2-23-23 11:39 AM,2023-02-23T11:39:00.000Z,5-19-23 2:04 PM,2023-05-19T14:04:00.000Z,4,4,,PM,CLOSE,Y,,NO,CHATHAM,"2541, 2542, 2543, 2544, 2545, 2547, 2549, 2550, 2552, 2553, 2554, 2555, 2556, 2557, 2558, 2559","SWISS COMBI ROTARY DRYER DRUM, SEW GEARBOX - LEFT HAND DRIVE -, SEW GEARBOX - LEFT HAND DRIVE, SEW GEARBOX - RIGHT HAND DRIVE, SEW GEARBOX - RIGHT HAND DRIVE, MOTOR / 25HP / 1800RPM / TEFC / 575V/3PH/60HZ / FRAME# 284TC, MOTOR / 25HP / 1800RPM / TEFC / 575V/3PH/60HZ / FRAME# 284TC, MOTOR / 25HP / 1800RPM / TEFC / 575V/3PH/60HZ / FRAME# 284TC, MOTOR / 25HP / 1800RPM / TEFC / 575V/3PH/60HZ / FRAME# 284TC, TRUNNION (A) - LEFT HAND DRIVE, TRUNNION (B)- RIGHT HAND DRIVE, TRUNNION (D) - LEFT HAND DRIVE, TRUNNION (C) - RIGHT HAND DRIVE, THRUST ROLLER ASSEMBLY, THRUST ROLLER ASSEMBLY, TRUNNION LUBRICATION SYSTEM",,No,CH-DR_DECANT701,CH-DR_DECANT701:XV17732.STAIND,XV-17732,XV,STAIND,"Status indication (open/closed, run/stop)",Valve/damper/door status (discrete),Status,DRUM DR1826 MOTOR D AMPERAGE,DR-1826
,DR0 Dryer A Isolation and Prep.(Gas/Steam),23-31589,DR-1826,DR-1826,,,1-9-23 11:39 AM,2023-01-09T11:39:00.000Z,2-23-23 11:39 AM,2023-02-23T11:39:00.000Z,5-19-23 2:04 PM,2023-05-19T14:04:00.000Z,4,4,,PM,CLOSE,Y,,NO,CHATHAM,"2541, 2542, 2543, 2544, 2545, 2547, 2549, 2550, 2552, 2553, 2554, 2555, 2556, 2557, 2558, 2559","SWISS COMBI ROTARY DRYER DRUM, SEW GEARBOX - LEFT HAND DRIVE -, SEW GEARBOX - LEFT HAND DRIVE, SEW GEARBOX - RIGHT HAND DRIVE, SEW GEARBOX - RIGHT HAND DRIVE, MOTOR / 25HP / 1800RPM / TEFC / 575V/3PH/60HZ / FRAME# 284TC, MOTOR / 25HP / 1800RPM / TEFC / 575V/3PH/60HZ / FRAME# 284TC, MOTOR / 25HP / 1800RPM / TEFC / 575V/3PH/60HZ / FRAME# 284TC, MOTOR / 25HP / 1800RPM / TEFC / 575V/3PH/60HZ / FRAME# 284TC, TRUNNION (A) - LEFT HAND DRIVE, TRUNNION (B)- RIGHT HAND DRIVE, TRUNNION (D) - LEFT HAND DRIVE, TRUNNION (C) - RIGHT HAND DRIVE, THRUST ROLLER ASSEMBLY, THRUST ROLLER ASSEMBLY, TRUNNION LUBRICATION SYSTEM",,No,CH-DR_DECANT702,CH-DR_DECANT702:ST17706A.MEAS,ST-17706A,ST,MEAS,Measured value (PV),Speed/torque transmitter,Measurement,DRUM DR1826 FRONT LUBEN TIMER,DR-1826
,DR0 Dryer A Isolation and Prep.(Gas/Steam),23-31589,DR-1826,DR-1826,,,1-9-23 11:39 AM,2023-01-09T11:39:00.000Z,2-23-23 11:39 AM,2023-02-23T11:39:00.000Z,5-19-23 2:04 PM,2023-05-19T14:04:00.000Z,4,4,,PM,CLOSE,Y,,NO,CHATHAM,"2541, 2542, 2543, 2544, 2545, 2547, 2549, 2550, 2552, 2553, 2554, 2555, 2556, 2557, 2558, 2559","SWISS COMBI ROTARY DRYER DRUM, SEW GEARBOX - LEFT HAND DRIVE -, SEW GEARBOX - LEFT HAND DRIVE, SEW GEARBOX - RIGHT HAND DRIVE, SEW GEARBOX - RIGHT HAND DRIVE, MOTOR / 25HP / 1800RPM / TEFC / 575V/3PH/60HZ / FRAME# 284TC, MOTOR / 25HP / 1800RPM / TEFC / 575V/3PH/60HZ / FRAME# 284TC, MOTOR / 25HP / 1800RPM / TEFC / 575V/3PH/60HZ / FRAME# 284TC, MOTOR / 25HP / 1800RPM / TEFC / 575V/3PH/60HZ / FRAME# 284TC, TRUNNION (A) - LEFT HAND DRIVE, TRUNNION (B)- RIGHT HAND DRIVE, TRUNNION (D) - LEFT HAND DRIVE, TRUNNION (C) - RIGHT HAND DRIVE, THRUST ROLLER ASSEMBLY, THRUST ROLLER ASSEMBLY, TRUNNION LUBRICATION SYSTEM",,No,CH-DR_DECANT702,CH-DR_DECANT702:ST17706B.RO01,ST-17706B,ST,RO01,Binary/relay output channel,Speed/torque transmitter,Binary Output,DRUM DR1826 REAR LUBE TIMER,DR-1826
,DR0 Dryer A Isolation and Prep.(Gas/Steam),23-31589,DR-1826,DR-1826,,,1-9-23 11:39 AM,2023-01-09T11:39:00.000Z,2-23-23 11:39 AM,2023-02-23T11:39:00.000Z,5-19-23 2:04 PM,2023-05-19T14:04:00.000Z,4,4,,PM,CLOSE,Y,,NO,CHATHAM,"2541, 2542, 2543, 2544, 2545, 2547, 2549, 2550, 2552, 2553, 2554, 2555, 2556, 2557, 2558, 2559","SWISS COMBI ROTARY DRYER DRUM, SEW GEARBOX - LEFT HAND DRIVE -, SEW GEARBOX - LEFT HAND DRIVE, SEW GEARBOX - RIGHT HAND DRIVE, SEW GEARBOX - RIGHT HAND DRIVE, MOTOR / 25HP / 1800RPM / TEFC / 575V/3PH/60HZ / FRAME# 284TC, MOTOR / 25HP / 1800RPM / TEFC / 575V/3PH/60HZ / FRAME# 284TC, MOTOR / 25HP / 1800RPM / TEFC / 575V/3PH/60HZ / FRAME# 284TC, MOTOR / 25HP / 1800RPM / TEFC / 575V/3PH/60HZ / FRAME# 284TC, TRUNNION (A) - LEFT HAND DRIVE, TRUNNION (B)- RIGHT HAND DRIVE, TRUNNION (D) - LEFT HAND DRIVE, TRUNNION (C) - RIGHT HAND DRIVE, THRUST ROLLER ASSEMBLY, THRUST ROLLER ASSEMBLY, TRUNNION LUBRICATION SYSTEM",,No,CH-DRA_COMB_AIR,CH-DRA_COMB_AIR:PIC18215.SPT,PIC-18215,PIC,SPT,Setpoint (SP),Pressure indicating controller,Setpoint,DR1826 MASTR 2 MOTR SPD CTRL,DR-1826
,DR0 Dryer A Isolation and Prep.(Gas/Steam),23-31589,DR-1826,DR-1826,,,1-9-23 11:39 AM,2023-01-09T11:39:00.000Z,2-23-23 11:39 AM,2023-02-23T11:39:00.000Z,5-19-23 2:04 PM,2023-05-19T14:04:00.000Z,4,4,,PM,CLOSE,Y,,NO,CHATHAM,"2541, 2542, 2543, 2544, 2545, 2547, 2549, 2550, 2552, 2553, 2554, 2555, 2556, 2557, 2558, 2559","SWISS COMBI ROTARY DRYER DRUM, SEW GEARBOX - LEFT HAND DRIVE -, SEW GEARBOX - LEFT HAND DRIVE, SEW GEARBOX - RIGHT HAND DRIVE, SEW GEARBOX - RIGHT HAND DRIVE, MOTOR / 25HP / 1800RPM / TEFC / 575V/3PH/60HZ / FRAME# 284TC, MOTOR / 25HP / 1800RPM / TEFC / 575V/3PH/60HZ / FRAME# 284TC, MOTOR / 25HP / 1800RPM / TEFC / 575V/3PH/60HZ / FRAME# 284TC, MOTOR / 25HP / 1800RPM / TEFC / 575V/3PH/60HZ / FRAME# 284TC, TRUNNION (A) - LEFT HAND DRIVE, TRUNNION (B)- RIGHT HAND DRIVE, TRUNNION (D) - LEFT HAND DRIVE, TRUNNION (C) - RIGHT HAND DRIVE, THRUST ROLLER ASSEMBLY, THRUST ROLLER ASSEMBLY, TRUNNION LUBRICATION SYSTEM",,No,CH-DRA_CYCLNS,CH-DRA_CYCLNS:TT18168B.MEAS,TT-18168B,TT,MEAS,Measured value (PV),Temperature transmitter,Measurement,DRUM DR1826 MOTOR A AMPERAGE,DR-1826
,DR0 Dryer A Isolation and Prep.(Gas/Steam),23-31589,DR-1826,DR-1826,,,1-9-23 11:39 AM,2023-01-09T11:39:00.000Z,2-23-23 11:39 AM,2023-02-23T11:39:00.000Z,5-19-23 2:04 PM,2023-05-19T14:04:00.000Z,4,4,,PM,CLOSE,Y,,NO,CHATHAM,"2541, 2542, 2543, 2544, 2545, 2547, 2549, 2550, 2552, 2553, 2554, 2555, 2556, 2557, 2558, 2559","SWISS COMBI ROTARY DRYER DRUM, SEW GEARBOX - LEFT HAND DRIVE -, SEW GEARBOX - LEFT HAND DRIVE, SEW GEARBOX - RIGHT HAND DRIVE, SEW GEARBOX - RIGHT HAND DRIVE, MOTOR / 25HP / 1800RPM / TEFC / 575V/3PH/60HZ / FRAME# 284TC, MOTOR / 25HP / 1800RPM / TEFC / 575V/3PH/60HZ / FRAME# 284TC, MOTOR / 25HP / 1800RPM / TEFC / 575V/3PH/60HZ / FRAME# 284TC, MOTOR / 25HP / 1800RPM / TEFC / 575V/3PH/60HZ / FRAME# 284TC, TRUNNION (A) - LEFT HAND DRIVE, TRUNNION (B)- RIGHT HAND DRIVE, TRUNNION (D) - LEFT HAND DRIVE, TRUNNION (C) - RIGHT HAND DRIVE, THRUST ROLLER ASSEMBLY, THRUST ROLLER ASSEMBLY, TRUNNION LUBRICATION SYSTEM",,No,CH-DRA_COMB_AIR,CH-DRA_COMB_AIR:PY18180.OUT,PY-18180,PY,OUT,Controller output / demand (CO),Pressure final element demand (valve pos/demand),Output/Demand,DRUM DR1826 SPEED CONTROL,DR-1826
,DR0 Dryer A Isolation and Prep.(Gas/Steam),23-31589,DR-1826,DR-1826,,,1-9-23 11:39 AM,2023-01-09T11:39:00.000Z,2-23-23 11:39 AM,2023-02-23T11:39:00.000Z,5-19-23 2:04 PM,2023-05-19T14:04:00.000Z,4,4,,PM,CLOSE,Y,,NO,CHATHAM,"2541, 2542, 2543, 2544, 2545, 2547, 2549, 2550, 2552, 2553, 2554, 2555, 2556, 2557, 2558, 2559","SWISS COMBI ROTARY DRYER DRUM, SEW GEARBOX - LEFT HAND DRIVE -, SEW GEARBOX - LEFT HAND DRIVE, SEW GEARBOX - RIGHT HAND DRIVE, SEW GEARBOX - RIGHT HAND DRIVE, MOTOR / 25HP / 1800RPM / TEFC / 575V/3PH/60HZ / FRAME# 284TC, MOTOR / 25HP / 1800RPM / TEFC / 575V/3PH/60HZ / FRAME# 284TC, MOTOR / 25HP / 1800RPM / TEFC / 575V/3PH/60HZ / FRAME# 284TC, MOTOR / 25HP / 1800RPM / TEFC / 575V/3PH/60HZ / FRAME# 284TC, TRUNNION (A) - LEFT HAND DRIVE, TRUNNION (B)- RIGHT HAND DRIVE, TRUNNION (D) - LEFT HAND DRIVE, TRUNNION (C) - RIGHT HAND DRIVE, THRUST ROLLER ASSEMBLY, THRUST ROLLER ASSEMBLY, TRUNNION LUBRICATION SYSTEM",,No,CH-DRA_COMB_AIR,CH-DRA_COMB_AIR:PIC18215.OUT,PIC-18215,PIC,OUT,Controller output / demand (CO),Pressure indicating controller,Output/Demand,DRUM DR1826 MOTOR 1 CONTROL,DR-1826
,BLIND IN DRYER A (GAS/STEAM LOCATIONS),23-31590,DR-1826,DR-1826,,,1-9-23 11:41 AM,2023-01-09T11:41:00.000Z,2-23-23 11:39 AM,2023-02-23T11:39:00.000Z,3-7-23 8:47 AM,2023-03-07T08:47:00.000Z,4,4,,PM,CLOSE,Y,,NO,CHATHAM,"2541, 2542, 2543, 2544, 2545, 2547, 2549, 2550, 2552, 2553, 2554, 2555, 2556, 2557, 2558, 2559","SWISS COMBI ROTARY DRYER DRUM, SEW GEARBOX - LEFT HAND DRIVE -, SEW GEARBOX - LEFT HAND DRIVE, SEW GEARBOX - RIGHT HAND DRIVE, SEW GEARBOX - RIGHT HAND DRIVE, MOTOR / 25HP / 1800RPM / TEFC / 575V/3PH/60HZ / FRAME# 284TC, MOTOR / 25HP / 1800RPM / TEFC / 575V/3PH/60HZ / FRAME# 284TC, MOTOR / 25HP / 1800RPM / TEFC / 575V/3PH/60HZ / FRAME# 284TC, MOTOR / 25HP / 1800RPM / TEFC / 575V/3PH/60HZ / FRAME# 284TC, TRUNNION (A) - LEFT HAND DRIVE, TRUNNION (B)- RIGHT HAND DRIVE, TRUNNION (D) - LEFT HAND DRIVE, TRUNNION (C) - RIGHT HAND DRIVE, THRUST ROLLER ASSEMBLY, THRUST ROLLER ASSEMBLY, TRUNNION LUBRICATION SYSTEM",,No,CH-DRA_CYCLNS,CH-DRA_CYCLNS:TT18168B.MEAS,TT-18168B,TT,MEAS,Measured value (PV),Temperature transmitter,Measurement,DRUM DR1826 MOTOR A AMPERAGE,DR-1826
,BLIND IN DRYER A (GAS/STEAM LOCATIONS),23-31590,DR-1826,DR-1826,,,1-9-23 11:41 AM,2023-01-09T11:41:00.000Z,2-23-23 11:39 AM,2023-02-23T11:39:00.000Z,3-7-23 8:47 AM,2023-03-07T08:47:00.000Z,4,4,,PM,CLOSE,Y,,NO,CHATHAM,"2541, 2542, 2543, 2544, 2545, 2547, 2549, 2550, 2552, 2553, 2554, 2555, 2556, 2557, 2558, 2559","SWISS COMBI ROTARY DRYER DRUM, SEW GEARBOX - LEFT HAND DRIVE -, SEW GEARBOX - LEFT HAND DRIVE, SEW GEARBOX - RIGHT HAND DRIVE, SEW GEARBOX - RIGHT HAND DRIVE, MOTOR / 25HP / 1800RPM / TEFC / 575V/3PH/60HZ / FRAME# 284TC, MOTOR / 25HP / 1800RPM / TEFC / 575V/3PH/60HZ / FRAME# 284TC, MOTOR / 25HP / 1800RPM / TEFC / 575V/3PH/60HZ / FRAME# 284TC, MOTOR / 25HP / 1800RPM / TEFC / 575V/3PH/60HZ / FRAME# 284TC, TRUNNION (A) - LEFT HAND DRIVE, TRUNNION (B)- RIGHT HAND DRIVE, TRUNNION (D) - LEFT HAND DRIVE, TRUNNION (C) - RIGHT HAND DRIVE, THRUST ROLLER ASSEMBLY, THRUST ROLLER ASSEMBLY, TRUNNION LUBRICATION SYSTEM",,No,CH-DRA_COMB_AIR,CH-DRA_COMB_AIR:PY18180.OUT,PY-18180,PY,OUT,Controller output / demand (CO),Pressure final element demand (valve pos/demand),Output/Demand,DRUM DR1826 SPEED CONTROL,DR-1826
,BLIND IN DRYER A (GAS/STEAM LOCATIONS),23-31590,DR-1826,DR-1826,,,1-9-23 11:41 AM,2023-01-09T11:41:00.000Z,2-23-23 11:39 AM,2023-02-23T11:39:00.000Z,3-7-23 8:47 AM,2023-03-07T08:47:00.000Z,4,4,,PM,CLOSE,Y,,NO,CHATHAM,"2541, 2542, 2543, 2544, 2545, 2547, 2549, 2550, 2552, 2553, 2554, 2555, 2556, 2557, 2558, 2559","SWISS COMBI ROTARY DRYER DRUM, SEW GEARBOX - LEFT HAND DRIVE -, SEW GEARBOX - LEFT HAND DRIVE, SEW GEARBOX - RIGHT HAND DRIVE, SEW GEARBOX - RIGHT HAND DRIVE, MOTOR / 25HP / 1800RPM / TEFC / 575V/3PH/60HZ / FRAME# 284TC, MOTOR / 25HP / 1800RPM / TEFC / 575V/3PH/60HZ / FRAME# 284TC, MOTOR / 25HP / 1800RPM / TEFC / 575V/3PH/60HZ / FRAME# 284TC, MOTOR / 25HP / 1800RPM / TEFC / 575V/3PH/60HZ / FRAME# 284TC, TRUNNION (A) - LEFT HAND DRIVE, TRUNNION (B)- RIGHT HAND DRIVE, TRUNNION (D) - LEFT HAND DRIVE, TRUNNION (C) - RIGHT HAND DRIVE, THRUST ROLLER ASSEMBLY, THRUST ROLLER ASSEMBLY, TRUNNION LUBRICATION SYSTEM",,No,CH-DRA_COMB_AIR,CH-DRA_COMB_AIR:PIC18215.OUT,PIC-18215,PIC,OUT,Controller output / demand (CO),Pressure indicating controller,Output/Demand,DRUM DR1826 MOTOR 1 CONTROL,DR-1826
,BLIND IN DRYER A (GAS/STEAM LOCATIONS),23-31590,DR-1826,DR-1826,,,1-9-23 11:41 AM,2023-01-09T11:41:00.000Z,2-23-23 11:39 AM,2023-02-23T11:39:00.000Z,3-7-23 8:47 AM,2023-03-07T08:47:00.000Z,4,4,,PM,CLOSE,Y,,NO,CHATHAM,"2541, 2542, 2543, 2544, 2545, 2547, 2549, 2550, 2552, 2553, 2554, 2555, 2556, 2557, 2558, 2559","SWISS COMBI ROTARY DRYER DRUM, SEW GEARBOX - LEFT HAND DRIVE -, SEW GEARBOX - LEFT HAND DRIVE, SEW GEARBOX - RIGHT HAND DRIVE, SEW GEARBOX - RIGHT HAND DRIVE, MOTOR / 25HP / 1800RPM / TEFC / 575V/3PH/60HZ / FRAME# 284TC, MOTOR / 25HP / 1800RPM / TEFC / 575V/3PH/60HZ / FRAME# 284TC, MOTOR / 25HP / 1800RPM / TEFC / 575V/3PH/60HZ / FRAME# 284TC, MOTOR / 25HP / 1800RPM / TEFC / 575V/3PH/60HZ / FRAME# 284TC, TRUNNION (A) - LEFT HAND DRIVE, TRUNNION (B)- RIGHT HAND DRIVE, TRUNNION (D) - LEFT HAND DRIVE, TRUNNION (C) - RIGHT HAND DRIVE, THRUST ROLLER ASSEMBLY, THRUST ROLLER ASSEMBLY, TRUNNION LUBRICATION SYSTEM",,No,CH-DRA_COMB_AIR,CH-DRA_COMB_AIR:PIC18215.SPT,PIC-18215,PIC,SPT,Setpoint (SP),Pressure indicating controller,Setpoint,DR1826 MASTR 2 MOTR SPD CTRL,DR-1826
,BLIND IN DRYER A (GAS/STEAM LOCATIONS),23-31590,DR-1826,DR-1826,,,1-9-23 11:41 AM,2023-01-09T11:41:00.000Z,2-23-23 11:39 AM,2023-02-23T11:39:00.000Z,3-7-23 8:47 AM,2023-03-07T08:47:00.000Z,4,4,,PM,CLOSE,Y,,NO,CHATHAM,"2541, 2542, 2543, 2544, 2545, 2547, 2549, 2550, 2552, 2553, 2554, 2555, 2556, 2557, 2558, 2559","SWISS COMBI ROTARY DRYER DRUM, SEW GEARBOX - LEFT HAND DRIVE -, SEW GEARBOX - LEFT HAND DRIVE, SEW GEARBOX - RIGHT HAND DRIVE, SEW GEARBOX - RIGHT HAND DRIVE, MOTOR / 25HP / 1800RPM / TEFC / 575V/3PH/60HZ / FRAME# 284TC, MOTOR / 25HP / 1800RPM / TEFC / 575V/3PH/60HZ / FRAME# 284TC, MOTOR / 25HP / 1800RPM / TEFC / 575V/3PH/60HZ / FRAME# 284TC, MOTOR / 25HP / 1800RPM / TEFC / 575V/3PH/60HZ / FRAME# 284TC, TRUNNION (A) - LEFT HAND DRIVE, TRUNNION (B)- RIGHT HAND DRIVE, TRUNNION (D) - LEFT HAND DRIVE, TRUNNION (C) - RIGHT HAND DRIVE, THRUST ROLLER ASSEMBLY, THRUST ROLLER ASSEMBLY, TRUNNION LUBRICATION SYSTEM",,No,CH-DRA_FIRE_WTR,CH-DRA_FIRE_WTR:TT35445.MEAS,TT-35445,TT,MEAS,Measured value (PV),Temperature transmitter,Measurement,DRUM DR1826 ACCESS DOOR,DR-1826
,BLIND IN DRYER A (GAS/STEAM LOCATIONS),23-31590,DR-1826,DR-1826,,,1-9-23 11:41 AM,2023-01-09T11:41:00.000Z,2-23-23 11:39 AM,2023-02-23T11:39:00.000Z,3-7-23 8:47 AM,2023-03-07T08:47:00.000Z,4,4,,PM,CLOSE,Y,,NO,CHATHAM,"2541, 2542, 2543, 2544, 2545, 2547, 2549, 2550, 2552, 2553, 2554, 2555, 2556, 2557, 2558, 2559","SWISS COMBI ROTARY DRYER DRUM, SEW GEARBOX - LEFT HAND DRIVE -, SEW GEARBOX - LEFT HAND DRIVE, SEW GEARBOX - RIGHT HAND DRIVE, SEW GEARBOX - RIGHT HAND DRIVE, MOTOR / 25HP / 1800RPM / TEFC / 575V/3PH/60HZ / FRAME# 284TC, MOTOR / 25HP / 1800RPM / TEFC / 575V/3PH/60HZ / FRAME# 284TC, MOTOR / 25HP / 1800RPM / TEFC / 575V/3PH/60HZ / FRAME# 284TC, MOTOR / 25HP / 1800RPM / TEFC / 575V/3PH/60HZ / FRAME# 284TC, TRUNNION (A) - LEFT HAND DRIVE, TRUNNION (B)- RIGHT HAND DRIVE, TRUNNION (D) - LEFT HAND DRIVE, TRUNNION (C) - RIGHT HAND DRIVE, THRUST ROLLER ASSEMBLY, THRUST ROLLER ASSEMBLY, TRUNNION LUBRICATION SYSTEM",,No,CH-DRYER_A,CH-DRYER_A:KS18145A.STAIND,KS-18145A,KS,STAIND,"Status indication (open/closed, run/stop)",Limit switch (asset status),Equipment status,DRUM DR1826 FRONT LUBEN TIMER,DR-1826
,BLIND IN DRYER A (GAS/STEAM LOCATIONS),23-31590,DR-1826,DR-1826,,,1-9-23 11:41 AM,2023-01-09T11:41:00.000Z,2-23-23 11:39 AM,2023-02-23T11:39:00.000Z,3-7-23 8:47 AM,2023-03-07T08:47:00.000Z,4,4,,PM,CLOSE,Y,,NO,CHATHAM,"2541, 2542, 2543, 2544, 2545, 2547, 2549, 2550, 2552, 2553, 2554, 2555, 2556, 2557, 2558, 2559","SWISS COMBI ROTARY DRYER DRUM, SEW GEARBOX - LEFT HAND DRIVE -, SEW GEARBOX - LEFT HAND DRIVE, SEW GEARBOX - RIGHT HAND DRIVE, SEW GEARBOX - RIGHT HAND DRIVE, MOTOR / 25HP / 1800RPM / TEFC / 575V/3PH/60HZ / FRAME# 284TC, MOTOR / 25HP / 1800RPM / TEFC / 575V/3PH/60HZ / FRAME# 284TC, MOTOR / 25HP / 1800RPM / TEFC / 575V/3PH/60HZ / FRAME# 284TC, MOTOR / 25HP / 1800RPM / TEFC / 575V/3PH/60HZ / FRAME# 284TC, TRUNNION (A) - LEFT HAND DRIVE, TRUNNION (B)- RIGHT HAND DRIVE, TRUNNION (D) - LEFT HAND DRIVE, TRUNNION (C) - RIGHT HAND DRIVE, THRUST ROLLER ASSEMBLY, THRUST ROLLER ASSEMBLY, TRUNNION LUBRICATION SYSTEM",,No,CH-DRYER_A,CH-DRYER_A:KS18145B.STAIND,KS-18145B,KS,STAIND,"Status indication (open/closed, run/stop)",Limit switch (asset status),Equipment status,DRUM DR1826 REAR LUBE TIMER,DR-1826
,BLIND IN DRYER A (GAS/STEAM LOCATIONS),23-31590,DR-1826,DR-1826,,,1-9-23 11:41 AM,2023-01-09T11:41:00.000Z,2-23-23 11:39 AM,2023-02-23T11:39:00.000Z,3-7-23 8:47 AM,2023-03-07T08:47:00.000Z,4,4,,PM,CLOSE,Y,,NO,CHATHAM,"2541, 2542, 2543, 2544, 2545, 2547, 2549, 2550, 2552, 2553, 2554, 2555, 2556, 2557, 2558, 2559","SWISS COMBI ROTARY DRYER DRUM, SEW GEARBOX - LEFT HAND DRIVE -, SEW GEARBOX - LEFT HAND DRIVE, SEW GEARBOX - RIGHT HAND DRIVE, SEW GEARBOX - RIGHT HAND DRIVE, MOTOR / 25HP / 1800RPM / TEFC / 575V/3PH/60HZ / FRAME# 284TC, MOTOR / 25HP / 1800RPM / TEFC / 575V/3PH/60HZ / FRAME# 284TC, MOTOR / 25HP / 1800RPM / TEFC / 575V/3PH/60HZ / FRAME# 284TC, MOTOR / 25HP / 1800RPM / TEFC / 575V/3PH/60HZ / FRAME# 284TC, TRUNNION (A) - LEFT HAND DRIVE, TRUNNION (B)- RIGHT HAND DRIVE, TRUNNION (D) - LEFT HAND DRIVE, TRUNNION (C) - RIGHT HAND DRIVE, THRUST ROLLER ASSEMBLY, THRUST ROLLER ASSEMBLY, TRUNNION LUBRICATION SYSTEM",,No,CH-DRYER_A,CH-DRYER_A:DR1826.STAIND,DR-1826,DR,STAIND,"Status indication (open/closed, run/stop)",Drum/Drive (asset),Equipment status,DRUM DR1826 MASTER  START,DR-1826
,BLIND IN DRYER A (GAS/STEAM LOCATIONS),23-31590,DR-1826,DR-1826,,,1-9-23 11:41 AM,2023-01-09T11:41:00.000Z,2-23-23 11:39 AM,2023-02-23T11:39:00.000Z,3-7-23 8:47 AM,2023-03-07T08:47:00.000Z,4,4,,PM,CLOSE,Y,,NO,CHATHAM,"2541, 2542, 2543, 2544, 2545, 2547, 2549, 2550, 2552, 2553, 2554, 2555, 2556, 2557, 2558, 2559","SWISS COMBI ROTARY DRYER DRUM, SEW GEARBOX - LEFT HAND DRIVE -, SEW GEARBOX - LEFT HAND DRIVE, SEW GEARBOX - RIGHT HAND DRIVE, SEW GEARBOX - RIGHT HAND DRIVE, MOTOR / 25HP / 1800RPM / TEFC / 575V/3PH/60HZ / FRAME# 284TC, MOTOR / 25HP / 1800RPM / TEFC / 575V/3PH/60HZ / FRAME# 284TC, MOTOR / 25HP / 1800RPM / TEFC / 575V/3PH/60HZ / FRAME# 284TC, MOTOR / 25HP / 1800RPM / TEFC / 575V/3PH/60HZ / FRAME# 284TC, TRUNNION (A) - LEFT HAND DRIVE, TRUNNION (B)- RIGHT HAND DRIVE, TRUNNION (D) - LEFT HAND DRIVE, TRUNNION (C) - RIGHT HAND DRIVE, THRUST ROLLER ASSEMBLY, THRUST ROLLER ASSEMBLY, TRUNNION LUBRICATION SYSTEM",,No,CH-DR_DUSTCOLL,CH-DR_DUSTCOLL:RV1834.STAIND,RV-1834,RV,STAIND,"Status indication (open/closed, run/stop)",Rotary valve (asset),Equipment Status,DRUM DR1826 MASTER START,DR-1826
,BLIND IN DRYER A (GAS/STEAM LOCATIONS),23-31590,DR-1826,DR-1826,,,1-9-23 11:41 AM,2023-01-09T11:41:00.000Z,2-23-23 11:39 AM,2023-02-23T11:39:00.000Z,3-7-23 8:47 AM,2023-03-07T08:47:00.000Z,4,4,,PM,CLOSE,Y,,NO,CHATHAM,"2541, 2542, 2543, 2544, 2545, 2547, 2549, 2550, 2552, 2553, 2554, 2555, 2556, 2557, 2558, 2559","SWISS COMBI ROTARY DRYER DRUM, SEW GEARBOX - LEFT HAND DRIVE -, SEW GEARBOX - LEFT HAND DRIVE, SEW GEARBOX - RIGHT HAND DRIVE, SEW GEARBOX - RIGHT HAND DRIVE, MOTOR / 25HP / 1800RPM / TEFC / 575V/3PH/60HZ / FRAME# 284TC, MOTOR / 25HP / 1800RPM / TEFC / 575V/3PH/60HZ / FRAME# 284TC, MOTOR / 25HP / 1800RPM / TEFC / 575V/3PH/60HZ / FRAME# 284TC, MOTOR / 25HP / 1800RPM / TEFC / 575V/3PH/60HZ / FRAME# 284TC, TRUNNION (A) - LEFT HAND DRIVE, TRUNNION (B)- RIGHT HAND DRIVE, TRUNNION (D) - LEFT HAND DRIVE, TRUNNION (C) - RIGHT HAND DRIVE, THRUST ROLLER ASSEMBLY, THRUST ROLLER ASSEMBLY, TRUNNION LUBRICATION SYSTEM",,No,CH-DR_DUSTCOLL,CH-DR_DUSTCOLL:SI18216.MEAS,SI-18216,SI,MEAS,Measured value (PV),Speed indication (feedback),Measurement,DRUM DR1826 MOTOR A AMPERAGE,DR-1826
,BLIND IN DRYER A (GAS/STEAM LOCATIONS),23-31590,DR-1826,DR-1826,,,1-9-23 11:41 AM,2023-01-09T11:41:00.000Z,2-23-23 11:39 AM,2023-02-23T11:39:00.000Z,3-7-23 8:47 AM,2023-03-07T08:47:00.000Z,4,4,,PM,CLOSE,Y,,NO,CHATHAM,"2541, 2542, 2543, 2544, 2545, 2547, 2549, 2550, 2552, 2553, 2554, 2555, 2556, 2557, 2558, 2559","SWISS COMBI ROTARY DRYER DRUM, SEW GEARBOX - LEFT HAND DRIVE -, SEW GEARBOX - LEFT HAND DRIVE, SEW GEARBOX - RIGHT HAND DRIVE, SEW GEARBOX - RIGHT HAND DRIVE, MOTOR / 25HP / 1800RPM / TEFC / 575V/3PH/60HZ / FRAME# 284TC, MOTOR / 25HP / 1800RPM / TEFC / 575V/3PH/60HZ / FRAME# 284TC, MOTOR / 25HP / 1800RPM / TEFC / 575V/3PH/60HZ / FRAME# 284TC, MOTOR / 25HP / 1800RPM / TEFC / 575V/3PH/60HZ / FRAME# 284TC, TRUNNION (A) - LEFT HAND DRIVE, TRUNNION (B)- RIGHT HAND DRIVE, TRUNNION (D) - LEFT HAND DRIVE, TRUNNION (C) - RIGHT HAND DRIVE, THRUST ROLLER ASSEMBLY, THRUST ROLLER ASSEMBLY, TRUNNION LUBRICATION SYSTEM",,No,CH-DR_DUSTCOLL,CH-DR_DUSTCOLL:SSL18216.CIN,SSL-18216,SSL,CIN,Contact input (discrete),Speed switch (motion proof),Discrete Input,DRUM DR1826 MOTOR B AMPERAGE,DR-1826
,BLIND IN DRYER A (GAS/STEAM LOCATIONS),23-31590,DR-1826,DR-1826,,,1-9-23 11:41 AM,2023-01-09T11:41:00.000Z,2-23-23 11:39 AM,2023-02-23T11:39:00.000Z,3-7-23 8:47 AM,2023-03-07T08:47:00.000Z,4,4,,PM,CLOSE,Y,,NO,CHATHAM,"2541, 2542, 2543, 2544, 2545, 2547, 2549, 2550, 2552, 2553, 2554, 2555, 2556, 2557, 2558, 2559","SWISS COMBI ROTARY DRYER DRUM, SEW GEARBOX - LEFT HAND DRIVE -, SEW GEARBOX - LEFT HAND DRIVE, SEW GEARBOX - RIGHT HAND DRIVE, SEW GEARBOX - RIGHT HAND DRIVE, MOTOR / 25HP / 1800RPM / TEFC / 575V/3PH/60HZ / FRAME# 284TC, MOTOR / 25HP / 1800RPM / TEFC / 575V/3PH/60HZ / FRAME# 284TC, MOTOR / 25HP / 1800RPM / TEFC / 575V/3PH/60HZ / FRAME# 284TC, MOTOR / 25HP / 1800RPM / TEFC / 575V/3PH/60HZ / FRAME# 284TC, TRUNNION (A) - LEFT HAND DRIVE, TRUNNION (B)- RIGHT HAND DRIVE, TRUNNION (D) - LEFT HAND DRIVE, TRUNNION (C) - RIGHT HAND DRIVE, THRUST ROLLER ASSEMBLY, THRUST ROLLER ASSEMBLY, TRUNNION LUBRICATION SYSTEM",,No,CH-DR_DUSTCOLL,CH-DR_DUSTCOLL:SSL18222.CIN,SSL-18222,SSL,CIN,Contact input (discrete),Speed switch (motion proof),Discrete Input,DRUM DR1826 MOTOR C AMPERAGE,DR-1826
,BLIND IN DRYER A (GAS/STEAM LOCATIONS),23-31590,DR-1826,DR-1826,,,1-9-23 11:41 AM,2023-01-09T11:41:00.000Z,2-23-23 11:39 AM,2023-02-23T11:39:00.000Z,3-7-23 8:47 AM,2023-03-07T08:47:00.000Z,4,4,,PM,CLOSE,Y,,NO,CHATHAM,"2541, 2542, 2543, 2544, 2545, 2547, 2549, 2550, 2552, 2553, 2554, 2555, 2556, 2557, 2558, 2559","SWISS COMBI ROTARY DRYER DRUM, SEW GEARBOX - LEFT HAND DRIVE -, SEW GEARBOX - LEFT HAND DRIVE, SEW GEARBOX - RIGHT HAND DRIVE, SEW GEARBOX - RIGHT HAND DRIVE, MOTOR / 25HP / 1800RPM / TEFC / 575V/3PH/60HZ / FRAME# 284TC, MOTOR / 25HP / 1800RPM / TEFC / 575V/3PH/60HZ / FRAME# 284TC, MOTOR / 25HP / 1800RPM / TEFC / 575V/3PH/60HZ / FRAME# 284TC, MOTOR / 25HP / 1800RPM / TEFC / 575V/3PH/60HZ / FRAME# 284TC, TRUNNION (A) - LEFT HAND DRIVE, TRUNNION (B)- RIGHT HAND DRIVE, TRUNNION (D) - LEFT HAND DRIVE, TRUNNION (C) - RIGHT HAND DRIVE, THRUST ROLLER ASSEMBLY, THRUST ROLLER ASSEMBLY, TRUNNION LUBRICATION SYSTEM",,No,CH-DR_DUSTCOLL,CH-DR_DUSTCOLL:SY18211.OUT,SY-18211,SY,OUT,Controller output (CO),Speed output (VFD demand),Output/Demand,DRUM DR1826 MOTOR D AMPERAGE,DR-1826
,BLIND IN DRYER A (GAS/STEAM LOCATIONS),23-31590,DR-1826,DR-1826,,,1-9-23 11:41 AM,2023-01-09T11:41:00.000Z,2-23-23 11:39 AM,2023-02-23T11:39:00.000Z,3-7-23 8:47 AM,2023-03-07T08:47:00.000Z,4,4,,PM,CLOSE,Y,,NO,CHATHAM,"2541, 2542, 2543, 2544, 2545, 2547, 2549, 2550, 2552, 2553, 2554, 2555, 2556, 2557, 2558, 2559","SWISS COMBI ROTARY DRYER DRUM, SEW GEARBOX - LEFT HAND DRIVE -, SEW GEARBOX - LEFT HAND DRIVE, SEW GEARBOX - RIGHT HAND DRIVE, SEW GEARBOX - RIGHT HAND DRIVE, MOTOR / 25HP / 1800RPM / TEFC / 575V/3PH/60HZ / FRAME# 284TC, MOTOR / 25HP / 1800RPM / TEFC / 575V/3PH/60HZ / FRAME# 284TC, MOTOR / 25HP / 1800RPM / TEFC / 575V/3PH/60HZ / FRAME# 284TC, MOTOR / 25HP / 1800RPM / TEFC / 575V/3PH/60HZ / FRAME# 284TC, TRUNNION (A) - LEFT HAND DRIVE, TRUNNION (B)- RIGHT HAND DRIVE, TRUNNION (D) - LEFT HAND DRIVE, TRUNNION (C) - RIGHT HAND DRIVE, THRUST ROLLER ASSEMBLY, THRUST ROLLER ASSEMBLY, TRUNNION LUBRICATION SYSTEM",,No,CH-DR_UTIL_WTR,CH-DR_UTIL_WTR:TT35450.MEAS,TT-35450,TT,MEAS,Measured value (PV),Temperature transmitter,Measurement,DRUM DR1826 FRONT LUBEN TIMER,DR-1826
,BLIND IN DRYER A (GAS/STEAM LOCATIONS),23-31590,DR-1826,DR-1826,,,1-9-23 11:41 AM,2023-01-09T11:41:00.000Z,2-23-23 11:39 AM,2023-02-23T11:39:00.000Z,3-7-23 8:47 AM,2023-03-07T08:47:00.000Z,4,4,,PM,CLOSE,Y,,NO,CHATHAM,"2541, 2542, 2543, 2544, 2545, 2547, 2549, 2550, 2552, 2553, 2554, 2555, 2556, 2557, 2558, 2559","SWISS COMBI ROTARY DRYER DRUM, SEW GEARBOX - LEFT HAND DRIVE -, SEW GEARBOX - LEFT HAND DRIVE, SEW GEARBOX - RIGHT HAND DRIVE, SEW GEARBOX - RIGHT HAND DRIVE, MOTOR / 25HP / 1800RPM / TEFC / 575V/3PH/60HZ / FRAME# 284TC, MOTOR / 25HP / 1800RPM / TEFC / 575V/3PH/60HZ / FRAME# 284TC, MOTOR / 25HP / 1800RPM / TEFC / 575V/3PH/60HZ / FRAME# 284TC, MOTOR / 25HP / 1800RPM / TEFC / 575V/3PH/60HZ / FRAME# 284TC, TRUNNION (A) - LEFT HAND DRIVE, TRUNNION (B)- RIGHT HAND DRIVE, TRUNNION (D) - LEFT HAND DRIVE, TRUNNION (C) - RIGHT HAND DRIVE, THRUST ROLLER ASSEMBLY, THRUST ROLLER ASSEMBLY, TRUNNION LUBRICATION SYSTEM",,No,CH-DR_UTIL_WTR,CH-DR_UTIL_WTR:TT35451.MEAS,TT-35451,TT,MEAS,Measured value (PV),Temperature transmitter,Measurement,DRUM DR1826 REAR LUBE TIMER,DR-1826
,BLIND IN DRYER A (GAS/STEAM LOCATIONS),23-31590,DR-1826,DR-1826,,,1-9-23 11:41 AM,2023-01-09T11:41:00.000Z,2-23-23 11:39 AM,2023-02-23T11:39:00.000Z,3-7-23 8:47 AM,2023-03-07T08:47:00.000Z,4,4,,PM,CLOSE,Y,,NO,CHATHAM,"2541, 2542, 2543, 2544, 2545, 2547, 2549, 2550, 2552, 2553, 2554, 2555, 2556, 2557, 2558, 2559","SWISS COMBI ROTARY DRYER DRUM, SEW GEARBOX - LEFT HAND DRIVE -, SEW GEARBOX - LEFT HAND DRIVE, SEW GEARBOX - RIGHT HAND DRIVE, SEW GEARBOX - RIGHT HAND DRIVE, MOTOR / 25HP / 1800RPM / TEFC / 575V/3PH/60HZ / FRAME# 284TC, MOTOR / 25HP / 1800RPM / TEFC / 575V/3PH/60HZ / FRAME# 284TC, MOTOR / 25HP / 1800RPM / TEFC / 575V/3PH/60HZ / FRAME# 284TC, MOTOR / 25HP / 1800RPM / TEFC / 575V/3PH/60HZ / FRAME# 284TC, TRUNNION (A) - LEFT HAND DRIVE, TRUNNION (B)- RIGHT HAND DRIVE, TRUNNION (D) - LEFT HAND DRIVE, TRUNNION (C) - RIGHT HAND DRIVE, THRUST ROLLER ASSEMBLY, THRUST ROLLER ASSEMBLY, TRUNNION LUBRICATION SYSTEM",,No,CH-DR_DUSTCOLL,CH-DR_DUSTCOLL:RV1834.STAIND,RV-1834,RV,STAIND,"Status indication (open/closed, run/stop)",Rotary valve (asset),Equipment status,DRUM DR1826 MASTER  START,DR-1826
,BLIND IN DRYER A (GAS/STEAM LOCATIONS),23-31590,DR-1826,DR-1826,,,1-9-23 11:41 AM,2023-01-09T11:41:00.000Z,2-23-23 11:39 AM,2023-02-23T11:39:00.000Z,3-7-23 8:47 AM,2023-03-07T08:47:00.000Z,4,4,,PM,CLOSE,Y,,NO,CHATHAM,"2541, 2542, 2543, 2544, 2545, 2547, 2549, 2550, 2552, 2553, 2554, 2555, 2556, 2557, 2558, 2559","SWISS COMBI ROTARY DRYER DRUM, SEW GEARBOX - LEFT HAND DRIVE -, SEW GEARBOX - LEFT HAND DRIVE, SEW GEARBOX - RIGHT HAND DRIVE, SEW GEARBOX - RIGHT HAND DRIVE, MOTOR / 25HP / 1800RPM / TEFC / 575V/3PH/60HZ / FRAME# 284TC, MOTOR / 25HP / 1800RPM / TEFC / 575V/3PH/60HZ / FRAME# 284TC, MOTOR / 25HP / 1800RPM / TEFC / 575V/3PH/60HZ / FRAME# 284TC, MOTOR / 25HP / 1800RPM / TEFC / 575V/3PH/60HZ / FRAME# 284TC, TRUNNION (A) - LEFT HAND DRIVE, TRUNNION (B)- RIGHT HAND DRIVE, TRUNNION (D) - LEFT HAND DRIVE, TRUNNION (C) - RIGHT HAND DRIVE, THRUST ROLLER ASSEMBLY, THRUST ROLLER ASSEMBLY, TRUNNION LUBRICATION SYSTEM",,No,CH-DR_DUSTCOLL,CH-DR_DUSTCOLL:XV18211.STAIND,XV-18211,XV,STAIND,"Status indication (open/closed, run/stop)",Valve/damper/door status (discrete),Equipment status,DRUM DR1826 MOTOR A AMPERAGE,DR-1826
,BLIND IN DRYER A (GAS/STEAM LOCATIONS),23-31590,DR-1826,DR-1826,,,1-9-23 11:41 AM,2023-01-09T11:41:00.000Z,2-23-23 11:39 AM,2023-02-23T11:39:00.000Z,3-7-23 8:47 AM,2023-03-07T08:47:00.000Z,4,4,,PM,CLOSE,Y,,NO,CHATHAM,"2541, 2542, 2543, 2544, 2545, 2547, 2549, 2550, 2552, 2553, 2554, 2555, 2556, 2557, 2558, 2559","SWISS COMBI ROTARY DRYER DRUM, SEW GEARBOX - LEFT HAND DRIVE -, SEW GEARBOX - LEFT HAND DRIVE, SEW GEARBOX - RIGHT HAND DRIVE, SEW GEARBOX - RIGHT HAND DRIVE, MOTOR / 25HP / 1800RPM / TEFC / 575V/3PH/60HZ / FRAME# 284TC, MOTOR / 25HP / 1800RPM / TEFC / 575V/3PH/60HZ / FRAME# 284TC, MOTOR / 25HP / 1800RPM / TEFC / 575V/3PH/60HZ / FRAME# 284TC, MOTOR / 25HP / 1800RPM / TEFC / 575V/3PH/60HZ / FRAME# 284TC, TRUNNION (A) - LEFT HAND DRIVE, TRUNNION (B)- RIGHT HAND DRIVE, TRUNNION (D) - LEFT HAND DRIVE, TRUNNION (C) - RIGHT HAND DRIVE, THRUST ROLLER ASSEMBLY, THRUST ROLLER ASSEMBLY, TRUNNION LUBRICATION SYSTEM",,No,CH-DR_PROC_AIR,CH-DR_PROC_AIR:PT33307.MEAS,PT-33307,PT,MEAS,Measured value (PV),Pressure transmitter,Measurement,DRUM DR1826 MOTOR B AMPERAGE,DR-1826
,BLIND IN DRYER A (GAS/STEAM LOCATIONS),23-31590,DR-1826,DR-1826,,,1-9-23 11:41 AM,2023-01-09T11:41:00.000Z,2-23-23 11:39 AM,2023-02-23T11:39:00.000Z,3-7-23 8:47 AM,2023-03-07T08:47:00.000Z,4,4,,PM,CLOSE,Y,,NO,CHATHAM,"2541, 2542, 2543, 2544, 2545, 2547, 2549, 2550, 2552, 2553, 2554, 2555, 2556, 2557, 2558, 2559","SWISS COMBI ROTARY DRYER DRUM, SEW GEARBOX - LEFT HAND DRIVE -, SEW GEARBOX - LEFT HAND DRIVE, SEW GEARBOX - RIGHT HAND DRIVE, SEW GEARBOX - RIGHT HAND DRIVE, MOTOR / 25HP / 1800RPM / TEFC / 575V/3PH/60HZ / FRAME# 284TC, MOTOR / 25HP / 1800RPM / TEFC / 575V/3PH/60HZ / FRAME# 284TC, MOTOR / 25HP / 1800RPM / TEFC / 575V/3PH/60HZ / FRAME# 284TC, MOTOR / 25HP / 1800RPM / TEFC / 575V/3PH/60HZ / FRAME# 284TC, TRUNNION (A) - LEFT HAND DRIVE, TRUNNION (B)- RIGHT HAND DRIVE, TRUNNION (D) - LEFT HAND DRIVE, TRUNNION (C) - RIGHT HAND DRIVE, THRUST ROLLER ASSEMBLY, THRUST ROLLER ASSEMBLY, TRUNNION LUBRICATION SYSTEM",,No,CH-DR_UTIL_WTR,CH-DR_UTIL_WTR:P1836.STAIND,P-1836,P,STAIND,"Status indication (open/closed, run/stop)",Pump (asset),Equipment status,DRUM DR1826 MOTOR C AMPERAGE,DR-1826
,BLIND IN DRYER A (GAS/STEAM LOCATIONS),23-31590,DR-1826,DR-1826,,,1-9-23 11:41 AM,2023-01-09T11:41:00.000Z,2-23-23 11:39 AM,2023-02-23T11:39:00.000Z,3-7-23 8:47 AM,2023-03-07T08:47:00.000Z,4,4,,PM,CLOSE,Y,,NO,CHATHAM,"2541, 2542, 2543, 2544, 2545, 2547, 2549, 2550, 2552, 2553, 2554, 2555, 2556, 2557, 2558, 2559","SWISS COMBI ROTARY DRYER DRUM, SEW GEARBOX - LEFT HAND DRIVE -, SEW GEARBOX - LEFT HAND DRIVE, SEW GEARBOX - RIGHT HAND DRIVE, SEW GEARBOX - RIGHT HAND DRIVE, MOTOR / 25HP / 1800RPM / TEFC / 575V/3PH/60HZ / FRAME# 284TC, MOTOR / 25HP / 1800RPM / TEFC / 575V/3PH/60HZ / FRAME# 284TC, MOTOR / 25HP / 1800RPM / TEFC / 575V/3PH/60HZ / FRAME# 284TC, MOTOR / 25HP / 1800RPM / TEFC / 575V/3PH/60HZ / FRAME# 284TC, TRUNNION (A) - LEFT HAND DRIVE, TRUNNION (B)- RIGHT HAND DRIVE, TRUNNION (D) - LEFT HAND DRIVE, TRUNNION (C) - RIGHT HAND DRIVE, THRUST ROLLER ASSEMBLY, THRUST ROLLER ASSEMBLY, TRUNNION LUBRICATION SYSTEM",,No,CH-DR_UTIL_WTR,CH-DR_UTIL_WTR:P1837.STAIND,P-1837,P,STAIND,"Status indication (open/closed, run/stop)",Pump (asset),Equipment status,DRUM DR1826 MOTOR D AMPERAGE,DR-1826
,BLIND IN DRYER A (GAS/STEAM LOCATIONS),23-31590,DR-1826,DR-1826,,,1-9-23 11:41 AM,2023-01-09T11:41:00.000Z,2-23-23 11:39 AM,2023-02-23T11:39:00.000Z,3-7-23 8:47 AM,2023-03-07T08:47:00.000Z,4,4,,PM,CLOSE,Y,,NO,CHATHAM,"2541, 2542, 2543, 2544, 2545, 2547, 2549, 2550, 2552, 2553, 2554, 2555, 2556, 2557, 2558, 2559","SWISS COMBI ROTARY DRYER DRUM, SEW GEARBOX - LEFT HAND DRIVE -, SEW GEARBOX - LEFT HAND DRIVE, SEW GEARBOX - RIGHT HAND DRIVE, SEW GEARBOX - RIGHT HAND DRIVE, MOTOR / 25HP / 1800RPM / TEFC / 575V/3PH/60HZ / FRAME# 284TC, MOTOR / 25HP / 1800RPM / TEFC / 575V/3PH/60HZ / FRAME# 284TC, MOTOR / 25HP / 1800RPM / TEFC / 575V/3PH/60HZ / FRAME# 284TC, MOTOR / 25HP / 1800RPM / TEFC / 575V/3PH/60HZ / FRAME# 284TC, TRUNNION (A) - LEFT HAND DRIVE, TRUNNION (B)- RIGHT HAND DRIVE, TRUNNION (D) - LEFT HAND DRIVE, TRUNNION (C) - RIGHT HAND DRIVE, THRUST ROLLER ASSEMBLY, THRUST ROLLER ASSEMBLY, TRUNNION LUBRICATION SYSTEM",,No,CH-DR_UTIL_WTR,CH-DR_UTIL_WTR:TT35455.MEAS,TT-35455,TT,MEAS,Measured value (PV),Temperature transmitter,Measurement,DRUM DR1826 FRONT LUBEN TIMER,DR-1826
,BLIND IN DRYER A (GAS/STEAM LOCATIONS),23-31590,DR-1826,DR-1826,,,1-9-23 11:41 AM,2023-01-09T11:41:00.000Z,2-23-23 11:39 AM,2023-02-23T11:39:00.000Z,3-7-23 8:47 AM,2023-03-07T08:47:00.000Z,4,4,,PM,CLOSE,Y,,NO,CHATHAM,"2541, 2542, 2543, 2544, 2545, 2547, 2549, 2550, 2552, 2553, 2554, 2555, 2556, 2557, 2558, 2559","SWISS COMBI ROTARY DRYER DRUM, SEW GEARBOX - LEFT HAND DRIVE -, SEW GEARBOX - LEFT HAND DRIVE, SEW GEARBOX - RIGHT HAND DRIVE, SEW GEARBOX - RIGHT HAND DRIVE, MOTOR / 25HP / 1800RPM / TEFC / 575V/3PH/60HZ / FRAME# 284TC, MOTOR / 25HP / 1800RPM / TEFC / 575V/3PH/60HZ / FRAME# 284TC, MOTOR / 25HP / 1800RPM / TEFC / 575V/3PH/60HZ / FRAME# 284TC, MOTOR / 25HP / 1800RPM / TEFC / 575V/3PH/60HZ / FRAME# 284TC, TRUNNION (A) - LEFT HAND DRIVE, TRUNNION (B)- RIGHT HAND DRIVE, TRUNNION (D) - LEFT HAND DRIVE, TRUNNION (C) - RIGHT HAND DRIVE, THRUST ROLLER ASSEMBLY, THRUST ROLLER ASSEMBLY, TRUNNION LUBRICATION SYSTEM",,No,CH-DR_UTIL_WTR,CH-DR_UTIL_WTR:TT35456.MEAS,TT-35456,TT,MEAS,Measured value (PV),Temperature transmitter,Measurement,DRUM DR1826 REAR LUBE TIMER,DR-1826
,BLIND IN DRYER A (GAS/STEAM LOCATIONS),23-31590,DR-1826,DR-1826,,,1-9-23 11:41 AM,2023-01-09T11:41:00.000Z,2-23-23 11:39 AM,2023-02-23T11:39:00.000Z,3-7-23 8:47 AM,2023-03-07T08:47:00.000Z,4,4,,PM,CLOSE,Y,,NO,CHATHAM,"2541, 2542, 2543, 2544, 2545, 2547, 2549, 2550, 2552, 2553, 2554, 2555, 2556, 2557, 2558, 2559","SWISS COMBI ROTARY DRYER DRUM, SEW GEARBOX - LEFT HAND DRIVE -, SEW GEARBOX - LEFT HAND DRIVE, SEW GEARBOX - RIGHT HAND DRIVE, SEW GEARBOX - RIGHT HAND DRIVE, MOTOR / 25HP / 1800RPM / TEFC / 575V/3PH/60HZ / FRAME# 284TC, MOTOR / 25HP / 1800RPM / TEFC / 575V/3PH/60HZ / FRAME# 284TC, MOTOR / 25HP / 1800RPM / TEFC / 575V/3PH/60HZ / FRAME# 284TC, MOTOR / 25HP / 1800RPM / TEFC / 575V/3PH/60HZ / FRAME# 284TC, TRUNNION (A) - LEFT HAND DRIVE, TRUNNION (B)- RIGHT HAND DRIVE, TRUNNION (D) - LEFT HAND DRIVE, TRUNNION (C) - RIGHT HAND DRIVE, THRUST ROLLER ASSEMBLY, THRUST ROLLER ASSEMBLY, TRUNNION LUBRICATION SYSTEM",,No,CH-DRYER_D,CH-DRYER_D:FIC84401.OUT,FIC-84401,FIC,OUT,Controller output / demand (CO),Flow indicating controller,Output/Demand,DRUM DR1826 MASTER  START,DR-1826
,BLIND IN DRYER A (GAS/STEAM LOCATIONS),23-31590,DR-1826,DR-1826,,,1-9-23 11:41 AM,2023-01-09T11:41:00.000Z,2-23-23 11:39 AM,2023-02-23T11:39:00.000Z,3-7-23 8:47 AM,2023-03-07T08:47:00.000Z,4,4,,PM,CLOSE,Y,,NO,CHATHAM,"2541, 2542, 2543, 2544, 2545, 2547, 2549, 2550, 2552, 2553, 2554, 2555, 2556, 2557, 2558, 2559","SWISS COMBI ROTARY DRYER DRUM, SEW GEARBOX - LEFT HAND DRIVE -, SEW GEARBOX - LEFT HAND DRIVE, SEW GEARBOX - RIGHT HAND DRIVE, SEW GEARBOX - RIGHT HAND DRIVE, MOTOR / 25HP / 1800RPM / TEFC / 575V/3PH/60HZ / FRAME# 284TC, MOTOR / 25HP / 1800RPM / TEFC / 575V/3PH/60HZ / FRAME# 284TC, MOTOR / 25HP / 1800RPM / TEFC / 575V/3PH/60HZ / FRAME# 284TC, MOTOR / 25HP / 1800RPM / TEFC / 575V/3PH/60HZ / FRAME# 284TC, TRUNNION (A) - LEFT HAND DRIVE, TRUNNION (B)- RIGHT HAND DRIVE, TRUNNION (D) - LEFT HAND DRIVE, TRUNNION (C) - RIGHT HAND DRIVE, THRUST ROLLER ASSEMBLY, THRUST ROLLER ASSEMBLY, TRUNNION LUBRICATION SYSTEM",,No,CH-DRYER_D,CH-DRYER_D:LIC84401.OUT,LIC-84401,LIC,OUT,Controller output / demand (CO),Level indicating controller,Output/Demand,DRUM DR1826 MOTOR A AMPERAGE,DR-1826
,BLIND IN DRYER A (GAS/STEAM LOCATIONS),23-31590,DR-1826,DR-1826,,,1-9-23 11:41 AM,2023-01-09T11:41:00.000Z,2-23-23 11:39 AM,2023-02-23T11:39:00.000Z,3-7-23 8:47 AM,2023-03-07T08:47:00.000Z,4,4,,PM,CLOSE,Y,,NO,CHATHAM,"2541, 2542, 2543, 2544, 2545, 2547, 2549, 2550, 2552, 2553, 2554, 2555, 2556, 2557, 2558, 2559","SWISS COMBI ROTARY DRYER DRUM, SEW GEARBOX - LEFT HAND DRIVE -, SEW GEARBOX - LEFT HAND DRIVE, SEW GEARBOX - RIGHT HAND DRIVE, SEW GEARBOX - RIGHT HAND DRIVE, MOTOR / 25HP / 1800RPM / TEFC / 575V/3PH/60HZ / FRAME# 284TC, MOTOR / 25HP / 1800RPM / TEFC / 575V/3PH/60HZ / FRAME# 284TC, MOTOR / 25HP / 1800RPM / TEFC / 575V/3PH/60HZ / FRAME# 284TC, MOTOR / 25HP / 1800RPM / TEFC / 575V/3PH/60HZ / FRAME# 284TC, TRUNNION (A) - LEFT HAND DRIVE, TRUNNION (B)- RIGHT HAND DRIVE, TRUNNION (D) - LEFT HAND DRIVE, TRUNNION (C) - RIGHT HAND DRIVE, THRUST ROLLER ASSEMBLY, THRUST ROLLER ASSEMBLY, TRUNNION LUBRICATION SYSTEM",,No,CH-DRYER_D,CH-DRYER_D:LIC84401.SPT,LIC-84401,LIC,SPT,Setpoint (SP),Level indicating controller,Setpoint,DRUM DR1826 MOTOR B AMPERAGE,DR-1826
,BLIND IN DRYER A (GAS/STEAM LOCATIONS),23-31590,DR-1826,DR-1826,,,1-9-23 11:41 AM,2023-01-09T11:41:00.000Z,2-23-23 11:39 AM,2023-02-23T11:39:00.000Z,3-7-23 8:47 AM,2023-03-07T08:47:00.000Z,4,4,,PM,CLOSE,Y,,NO,CHATHAM,"2541, 2542, 2543, 2544, 2545, 2547, 2549, 2550, 2552, 2553, 2554, 2555, 2556, 2557, 2558, 2559","SWISS COMBI ROTARY DRYER DRUM, SEW GEARBOX - LEFT HAND DRIVE -, SEW GEARBOX - LEFT HAND DRIVE, SEW GEARBOX - RIGHT HAND DRIVE, SEW GEARBOX - RIGHT HAND DRIVE, MOTOR / 25HP / 1800RPM / TEFC / 575V/3PH/60HZ / FRAME# 284TC, MOTOR / 25HP / 1800RPM / TEFC / 575V/3PH/60HZ / FRAME# 284TC, MOTOR / 25HP / 1800RPM / TEFC / 575V/3PH/60HZ / FRAME# 284TC, MOTOR / 25HP / 1800RPM / TEFC / 575V/3PH/60HZ / FRAME# 284TC, TRUNNION (A) - LEFT HAND DRIVE, TRUNNION (B)- RIGHT HAND DRIVE, TRUNNION (D) - LEFT HAND DRIVE, TRUNNION (C) - RIGHT HAND DRIVE, THRUST ROLLER ASSEMBLY, THRUST ROLLER ASSEMBLY, TRUNNION LUBRICATION SYSTEM",,No,CH-DRYER_D,CH-DRYER_D:LY84401.OUT,LY-84401,LY,OUT,Controller output / demand (CO),Level final element demand,Output/Demand,DRUM DR1826 MOTOR C AMPERAGE,DR-1826
,BLIND IN DRYER A (GAS/STEAM LOCATIONS),23-31590,DR-1826,DR-1826,,,1-9-23 11:41 AM,2023-01-09T11:41:00.000Z,2-23-23 11:39 AM,2023-02-23T11:39:00.000Z,3-7-23 8:47 AM,2023-03-07T08:47:00.000Z,4,4,,PM,CLOSE,Y,,NO,CHATHAM,"2541, 2542, 2543, 2544, 2545, 2547, 2549, 2550, 2552, 2553, 2554, 2555, 2556, 2557, 2558, 2559","SWISS COMBI ROTARY DRYER DRUM, SEW GEARBOX - LEFT HAND DRIVE -, SEW GEARBOX - LEFT HAND DRIVE, SEW GEARBOX - RIGHT HAND DRIVE, SEW GEARBOX - RIGHT HAND DRIVE, MOTOR / 25HP / 1800RPM / TEFC / 575V/3PH/60HZ / FRAME# 284TC, MOTOR / 25HP / 1800RPM / TEFC / 575V/3PH/60HZ / FRAME# 284TC, MOTOR / 25HP / 1800RPM / TEFC / 575V/3PH/60HZ / FRAME# 284TC, MOTOR / 25HP / 1800RPM / TEFC / 575V/3PH/60HZ / FRAME# 284TC, TRUNNION (A) - LEFT HAND DRIVE, TRUNNION (B)- RIGHT HAND DRIVE, TRUNNION (D) - LEFT HAND DRIVE, TRUNNION (C) - RIGHT HAND DRIVE, THRUST ROLLER ASSEMBLY, THRUST ROLLER ASSEMBLY, TRUNNION LUBRICATION SYSTEM",,No,CH-DRYER_D,CH-DRYER_D:MX1801D.STAIND,MX-1801D,MX,STAIND,"Status indication (open/closed, run/stop)",Mixer (asset),Equipment status,DRUM DR1826 MOTOR D AMPERAGE,DR-1826
,BLIND IN DRYER A (GAS/STEAM LOCATIONS),23-31590,DR-1826,DR-1826,,,1-9-23 11:41 AM,2023-01-09T11:41:00.000Z,2-23-23 11:39 AM,2023-02-23T11:39:00.000Z,3-7-23 8:47 AM,2023-03-07T08:47:00.000Z,4,4,,PM,CLOSE,Y,,NO,CHATHAM,"2541, 2542, 2543, 2544, 2545, 2547, 2549, 2550, 2552, 2553, 2554, 2555, 2556, 2557, 2558, 2559","SWISS COMBI ROTARY DRYER DRUM, SEW GEARBOX - LEFT HAND DRIVE -, SEW GEARBOX - LEFT HAND DRIVE, SEW GEARBOX - RIGHT HAND DRIVE, SEW GEARBOX - RIGHT HAND DRIVE, MOTOR / 25HP / 1800RPM / TEFC / 575V/3PH/60HZ / FRAME# 284TC, MOTOR / 25HP / 1800RPM / TEFC / 575V/3PH/60HZ / FRAME# 284TC, MOTOR / 25HP / 1800RPM / TEFC / 575V/3PH/60HZ / FRAME# 284TC, MOTOR / 25HP / 1800RPM / TEFC / 575V/3PH/60HZ / FRAME# 284TC, TRUNNION (A) - LEFT HAND DRIVE, TRUNNION (B)- RIGHT HAND DRIVE, TRUNNION (D) - LEFT HAND DRIVE, TRUNNION (C) - RIGHT HAND DRIVE, THRUST ROLLER ASSEMBLY, THRUST ROLLER ASSEMBLY, TRUNNION LUBRICATION SYSTEM",,No,CH-DRYER_D,CH-DRYER_D:PT84402.PNT,PT-84402,PT,PNT,Point value / indication,Pressure transmitter,Measurement,DRUM DR1826 FRONT LUBEN TIMER,DR-1826
,BLIND IN DRYER A (GAS/STEAM LOCATIONS),23-31590,DR-1826,DR-1826,,,1-9-23 11:41 AM,2023-01-09T11:41:00.000Z,2-23-23 11:39 AM,2023-02-23T11:39:00.000Z,3-7-23 8:47 AM,2023-03-07T08:47:00.000Z,4,4,,PM,CLOSE,Y,,NO,CHATHAM,"2541, 2542, 2543, 2544, 2545, 2547, 2549, 2550, 2552, 2553, 2554, 2555, 2556, 2557, 2558, 2559","SWISS COMBI ROTARY DRYER DRUM, SEW GEARBOX - LEFT HAND DRIVE -, SEW GEARBOX - LEFT HAND DRIVE, SEW GEARBOX - RIGHT HAND DRIVE, SEW GEARBOX - RIGHT HAND DRIVE, MOTOR / 25HP / 1800RPM / TEFC / 575V/3PH/60HZ / FRAME# 284TC, MOTOR / 25HP / 1800RPM / TEFC / 575V/3PH/60HZ / FRAME# 284TC, MOTOR / 25HP / 1800RPM / TEFC / 575V/3PH/60HZ / FRAME# 284TC, MOTOR / 25HP / 1800RPM / TEFC / 575V/3PH/60HZ / FRAME# 284TC, TRUNNION (A) - LEFT HAND DRIVE, TRUNNION (B)- RIGHT HAND DRIVE, TRUNNION (D) - LEFT HAND DRIVE, TRUNNION (C) - RIGHT HAND DRIVE, THRUST ROLLER ASSEMBLY, THRUST ROLLER ASSEMBLY, TRUNNION LUBRICATION SYSTEM",,No,CH-DRYER_D,CH-DRYER_D:SG8403A.STAIND,SG-8403A,SG,STAIND,"Status indication (open/closed, run/stop)",Speed/limit switch,Equipment status,DRUM DR1826 REAR LUBE TIMER,DR-1826
,BLIND IN DRYER A (GAS/STEAM LOCATIONS),23-31590,DR-1826,DR-1826,,,1-9-23 11:41 AM,2023-01-09T11:41:00.000Z,2-23-23 11:39 AM,2023-02-23T11:39:00.000Z,3-7-23 8:47 AM,2023-03-07T08:47:00.000Z,4,4,,PM,CLOSE,Y,,NO,CHATHAM,"2541, 2542, 2543, 2544, 2545, 2547, 2549, 2550, 2552, 2553, 2554, 2555, 2556, 2557, 2558, 2559","SWISS COMBI ROTARY DRYER DRUM, SEW GEARBOX - LEFT HAND DRIVE -, SEW GEARBOX - LEFT HAND DRIVE, SEW GEARBOX - RIGHT HAND DRIVE, SEW GEARBOX - RIGHT HAND DRIVE, MOTOR / 25HP / 1800RPM / TEFC / 575V/3PH/60HZ / FRAME# 284TC, MOTOR / 25HP / 1800RPM / TEFC / 575V/3PH/60HZ / FRAME# 284TC, MOTOR / 25HP / 1800RPM / TEFC / 575V/3PH/60HZ / FRAME# 284TC, MOTOR / 25HP / 1800RPM / TEFC / 575V/3PH/60HZ / FRAME# 284TC, TRUNNION (A) - LEFT HAND DRIVE, TRUNNION (B)- RIGHT HAND DRIVE, TRUNNION (D) - LEFT HAND DRIVE, TRUNNION (C) - RIGHT HAND DRIVE, THRUST ROLLER ASSEMBLY, THRUST ROLLER ASSEMBLY, TRUNNION LUBRICATION SYSTEM",,No,CH-DRYER_D_BMS,CH-DRYER_D_BMS:TIC84302.SPT,TIC-84302,TIC,SPT,Setpoint (SP),Temperature indicating controller,Setpoint,DRUM DR1826 SPEED CONTROL,DR-1826
,BLIND IN DRYER A (GAS/STEAM LOCATIONS),23-31590,DR-1826,DR-1826,,,1-9-23 11:41 AM,2023-01-09T11:41:00.000Z,2-23-23 11:39 AM,2023-02-23T11:39:00.000Z,3-7-23 8:47 AM,2023-03-07T08:47:00.000Z,4,4,,PM,CLOSE,Y,,NO,CHATHAM,"2541, 2542, 2543, 2544, 2545, 2547, 2549, 2550, 2552, 2553, 2554, 2555, 2556, 2557, 2558, 2559","SWISS COMBI ROTARY DRYER DRUM, SEW GEARBOX - LEFT HAND DRIVE -, SEW GEARBOX - LEFT HAND DRIVE, SEW GEARBOX - RIGHT HAND DRIVE, SEW GEARBOX - RIGHT HAND DRIVE, MOTOR / 25HP / 1800RPM / TEFC / 575V/3PH/60HZ / FRAME# 284TC, MOTOR / 25HP / 1800RPM / TEFC / 575V/3PH/60HZ / FRAME# 284TC, MOTOR / 25HP / 1800RPM / TEFC / 575V/3PH/60HZ / FRAME# 284TC, MOTOR / 25HP / 1800RPM / TEFC / 575V/3PH/60HZ / FRAME# 284TC, TRUNNION (A) - LEFT HAND DRIVE, TRUNNION (B)- RIGHT HAND DRIVE, TRUNNION (D) - LEFT HAND DRIVE, TRUNNION (C) - RIGHT HAND DRIVE, THRUST ROLLER ASSEMBLY, THRUST ROLLER ASSEMBLY, TRUNNION LUBRICATION SYSTEM",,No,CH-DRYER_D_BMS,CH-DRYER_D_BMS:TT84201.PNT,TT-84201,TT,PNT,Point value / indication,Temperature transmitter,Measurement,DRUM DR1826 SPEED CONTROL,DR-1826
,BLIND IN DRYER A (GAS/STEAM LOCATIONS),23-31590,DR-1826,DR-1826,,,1-9-23 11:41 AM,2023-01-09T11:41:00.000Z,2-23-23 11:39 AM,2023-02-23T11:39:00.000Z,3-7-23 8:47 AM,2023-03-07T08:47:00.000Z,4,4,,PM,CLOSE,Y,,NO,CHATHAM,"2541, 2542, 2543, 2544, 2545, 2547, 2549, 2550, 2552, 2553, 2554, 2555, 2556, 2557, 2558, 2559","SWISS COMBI ROTARY DRYER DRUM, SEW GEARBOX - LEFT HAND DRIVE -, SEW GEARBOX - LEFT HAND DRIVE, SEW GEARBOX - RIGHT HAND DRIVE, SEW GEARBOX - RIGHT HAND DRIVE, MOTOR / 25HP / 1800RPM / TEFC / 575V/3PH/60HZ / FRAME# 284TC, MOTOR / 25HP / 1800RPM / TEFC / 575V/3PH/60HZ / FRAME# 284TC, MOTOR / 25HP / 1800RPM / TEFC / 575V/3PH/60HZ / FRAME# 284TC, MOTOR / 25HP / 1800RPM / TEFC / 575V/3PH/60HZ / FRAME# 284TC, TRUNNION (A) - LEFT HAND DRIVE, TRUNNION (B)- RIGHT HAND DRIVE, TRUNNION (D) - LEFT HAND DRIVE, TRUNNION (C) - RIGHT HAND DRIVE, THRUST ROLLER ASSEMBLY, THRUST ROLLER ASSEMBLY, TRUNNION LUBRICATION SYSTEM",,No,CH-DRYER_D_BMS,CH-DRYER_D_BMS:TT84203.PNT,TT-84203,TT,PNT,Point value / indication,Temperature transmitter,Measurement,DRUM DR1826 SPEED CONTROL,DR-1826
,BLIND IN DRYER A (GAS/STEAM LOCATIONS),23-31590,DR-1826,DR-1826,,,1-9-23 11:41 AM,2023-01-09T11:41:00.000Z,2-23-23 11:39 AM,2023-02-23T11:39:00.000Z,3-7-23 8:47 AM,2023-03-07T08:47:00.000Z,4,4,,PM,CLOSE,Y,,NO,CHATHAM,"2541, 2542, 2543, 2544, 2545, 2547, 2549, 2550, 2552, 2553, 2554, 2555, 2556, 2557, 2558, 2559","SWISS COMBI ROTARY DRYER DRUM, SEW GEARBOX - LEFT HAND DRIVE -, SEW GEARBOX - LEFT HAND DRIVE, SEW GEARBOX - RIGHT HAND DRIVE, SEW GEARBOX - RIGHT HAND DRIVE, MOTOR / 25HP / 1800RPM / TEFC / 575V/3PH/60HZ / FRAME# 284TC, MOTOR / 25HP / 1800RPM / TEFC / 575V/3PH/60HZ / FRAME# 284TC, MOTOR / 25HP / 1800RPM / TEFC / 575V/3PH/60HZ / FRAME# 284TC, MOTOR / 25HP / 1800RPM / TEFC / 575V/3PH/60HZ / FRAME# 284TC, TRUNNION (A) - LEFT HAND DRIVE, TRUNNION (B)- RIGHT HAND DRIVE, TRUNNION (D) - LEFT HAND DRIVE, TRUNNION (C) - RIGHT HAND DRIVE, THRUST ROLLER ASSEMBLY, THRUST ROLLER ASSEMBLY, TRUNNION LUBRICATION SYSTEM",,No,CH-DRYER_D_BMS,CH-DRYER_D_BMS:TT84205.PNT,TT-84205,TT,PNT,Point value / indication,Temperature transmitter,Measurement,DRUM DR1826 SPEED SWITCH,DR-1826
,BLIND IN DRYER A (GAS/STEAM LOCATIONS),23-31590,DR-1826,DR-1826,,,1-9-23 11:41 AM,2023-01-09T11:41:00.000Z,2-23-23 11:39 AM,2023-02-23T11:39:00.000Z,3-7-23 8:47 AM,2023-03-07T08:47:00.000Z,4,4,,PM,CLOSE,Y,,NO,CHATHAM,"2541, 2542, 2543, 2544, 2545, 2547, 2549, 2550, 2552, 2553, 2554, 2555, 2556, 2557, 2558, 2559","SWISS COMBI ROTARY DRYER DRUM, SEW GEARBOX - LEFT HAND DRIVE -, SEW GEARBOX - LEFT HAND DRIVE, SEW GEARBOX - RIGHT HAND DRIVE, SEW GEARBOX - RIGHT HAND DRIVE, MOTOR / 25HP / 1800RPM / TEFC / 575V/3PH/60HZ / FRAME# 284TC, MOTOR / 25HP / 1800RPM / TEFC / 575V/3PH/60HZ / FRAME# 284TC, MOTOR / 25HP / 1800RPM / TEFC / 575V/3PH/60HZ / FRAME# 284TC, MOTOR / 25HP / 1800RPM / TEFC / 575V/3PH/60HZ / FRAME# 284TC, TRUNNION (A) - LEFT HAND DRIVE, TRUNNION (B)- RIGHT HAND DRIVE, TRUNNION (D) - LEFT HAND DRIVE, TRUNNION (C) - RIGHT HAND DRIVE, THRUST ROLLER ASSEMBLY, THRUST ROLLER ASSEMBLY, TRUNNION LUBRICATION SYSTEM",,No,CH-DRYER_D_CY2,CH-DRYER_D_CY2:TT84317.PNT,TT-84317,TT,PNT,Point value / indication,Temperature transmitter,Measurement,DRUM DR1826 MOTOR 1 CONTROL,DR-1826
,BLIND IN DRYER A (GAS/STEAM LOCATIONS),23-31590,DR-1826,DR-1826,,,1-9-23 11:41 AM,2023-01-09T11:41:00.000Z,2-23-23 11:39 AM,2023-02-23T11:39:00.000Z,3-7-23 8:47 AM,2023-03-07T08:47:00.000Z,4,4,,PM,CLOSE,Y,,NO,CHATHAM,"2541, 2542, 2543, 2544, 2545, 2547, 2549, 2550, 2552, 2553, 2554, 2555, 2556, 2557, 2558, 2559","SWISS COMBI ROTARY DRYER DRUM, SEW GEARBOX - LEFT HAND DRIVE -, SEW GEARBOX - LEFT HAND DRIVE, SEW GEARBOX - RIGHT HAND DRIVE, SEW GEARBOX - RIGHT HAND DRIVE, MOTOR / 25HP / 1800RPM / TEFC / 575V/3PH/60HZ / FRAME# 284TC, MOTOR / 25HP / 1800RPM / TEFC / 575V/3PH/60HZ / FRAME# 284TC, MOTOR / 25HP / 1800RPM / TEFC / 575V/3PH/60HZ / FRAME# 284TC, MOTOR / 25HP / 1800RPM / TEFC / 575V/3PH/60HZ / FRAME# 284TC, TRUNNION (A) - LEFT HAND DRIVE, TRUNNION (B)- RIGHT HAND DRIVE, TRUNNION (D) - LEFT HAND DRIVE, TRUNNION (C) - RIGHT HAND DRIVE, THRUST ROLLER ASSEMBLY, THRUST ROLLER ASSEMBLY, TRUNNION LUBRICATION SYSTEM",,No,CH-DRYER_D_CY2,CH-DRYER_D_CY2:TT84318.PNT,TT-84318,TT,PNT,Point value / indication,Temperature transmitter,Measurement,DR1826 MASTR 2 MOTR SPD CTRL,DR-1826
,BLIND IN DRYER A (GAS/STEAM LOCATIONS),23-31590,DR-1826,DR-1826,,,1-9-23 11:41 AM,2023-01-09T11:41:00.000Z,2-23-23 11:39 AM,2023-02-23T11:39:00.000Z,3-7-23 8:47 AM,2023-03-07T08:47:00.000Z,4,4,,PM,CLOSE,Y,,NO,CHATHAM,"2541, 2542, 2543, 2544, 2545, 2547, 2549, 2550, 2552, 2553, 2554, 2555, 2556, 2557, 2558, 2559","SWISS COMBI ROTARY DRYER DRUM, SEW GEARBOX - LEFT HAND DRIVE -, SEW GEARBOX - LEFT HAND DRIVE, SEW GEARBOX - RIGHT HAND DRIVE, SEW GEARBOX - RIGHT HAND DRIVE, MOTOR / 25HP / 1800RPM / TEFC / 575V/3PH/60HZ / FRAME# 284TC, MOTOR / 25HP / 1800RPM / TEFC / 575V/3PH/60HZ / FRAME# 284TC, MOTOR / 25HP / 1800RPM / TEFC / 575V/3PH/60HZ / FRAME# 284TC, MOTOR / 25HP / 1800RPM / TEFC / 575V/3PH/60HZ / FRAME# 284TC, TRUNNION (A) - LEFT HAND DRIVE, TRUNNION (B)- RIGHT HAND DRIVE, TRUNNION (D) - LEFT HAND DRIVE, TRUNNION (C) - RIGHT HAND DRIVE, THRUST ROLLER ASSEMBLY, THRUST ROLLER ASSEMBLY, TRUNNION LUBRICATION SYSTEM",,No,CH-DRYER_D_CY,CH-DRYER_D_CY:ZTA84308.PNT,ZTA-84308,ZTA,PNT,Point value / indication,Valve/actuator position feedback,Measurement,DRUM DR1826 ACCESS DOOR,DR-1826
,BLIND IN DRYER A (GAS/STEAM LOCATIONS),23-31590,DR-1826,DR-1826,,,1-9-23 11:41 AM,2023-01-09T11:41:00.000Z,2-23-23 11:39 AM,2023-02-23T11:39:00.000Z,3-7-23 8:47 AM,2023-03-07T08:47:00.000Z,4,4,,PM,CLOSE,Y,,NO,CHATHAM,"2541, 2542, 2543, 2544, 2545, 2547, 2549, 2550, 2552, 2553, 2554, 2555, 2556, 2557, 2558, 2559","SWISS COMBI ROTARY DRYER DRUM, SEW GEARBOX - LEFT HAND DRIVE -, SEW GEARBOX - LEFT HAND DRIVE, SEW GEARBOX - RIGHT HAND DRIVE, SEW GEARBOX - RIGHT HAND DRIVE, MOTOR / 25HP / 1800RPM / TEFC / 575V/3PH/60HZ / FRAME# 284TC, MOTOR / 25HP / 1800RPM / TEFC / 575V/3PH/60HZ / FRAME# 284TC, MOTOR / 25HP / 1800RPM / TEFC / 575V/3PH/60HZ / FRAME# 284TC, MOTOR / 25HP / 1800RPM / TEFC / 575V/3PH/60HZ / FRAME# 284TC, TRUNNION (A) - LEFT HAND DRIVE, TRUNNION (B)- RIGHT HAND DRIVE, TRUNNION (D) - LEFT HAND DRIVE, TRUNNION (C) - RIGHT HAND DRIVE, THRUST ROLLER ASSEMBLY, THRUST ROLLER ASSEMBLY, TRUNNION LUBRICATION SYSTEM",,No,CH-DR_DECANT701,CH-DR_DECANT701:ST17703A.MEAS,ST-17703A,ST,MEAS,Measured value (PV),Speed/torque transmitter,Measurement,DRUM DR1826 MASTER  START,DR-1826
,BLIND IN DRYER A (GAS/STEAM LOCATIONS),23-31590,DR-1826,DR-1826,,,1-9-23 11:41 AM,2023-01-09T11:41:00.000Z,2-23-23 11:39 AM,2023-02-23T11:39:00.000Z,3-7-23 8:47 AM,2023-03-07T08:47:00.000Z,4,4,,PM,CLOSE,Y,,NO,CHATHAM,"2541, 2542, 2543, 2544, 2545, 2547, 2549, 2550, 2552, 2553, 2554, 2555, 2556, 2557, 2558, 2559","SWISS COMBI ROTARY DRYER DRUM, SEW GEARBOX - LEFT HAND DRIVE -, SEW GEARBOX - LEFT HAND DRIVE, SEW GEARBOX - RIGHT HAND DRIVE, SEW GEARBOX - RIGHT HAND DRIVE, MOTOR / 25HP / 1800RPM / TEFC / 575V/3PH/60HZ / FRAME# 284TC, MOTOR / 25HP / 1800RPM / TEFC / 575V/3PH/60HZ / FRAME# 284TC, MOTOR / 25HP / 1800RPM / TEFC / 575V/3PH/60HZ / FRAME# 284TC, MOTOR / 25HP / 1800RPM / TEFC / 575V/3PH/60HZ / FRAME# 284TC, TRUNNION (A) - LEFT HAND DRIVE, TRUNNION (B)- RIGHT HAND DRIVE, TRUNNION (D) - LEFT HAND DRIVE, TRUNNION (C) - RIGHT HAND DRIVE, THRUST ROLLER ASSEMBLY, THRUST ROLLER ASSEMBLY, TRUNNION LUBRICATION SYSTEM",,No,CH-DR_DECANT701,CH-DR_DECANT701:XS17703B.CIN,XS-17703B,XS,CIN,Contact input (discrete),Limit/proximity switch (status),Discrete Input,DRUM DR1826 MOTOR A AMPERAGE,DR-1826
,BLIND IN DRYER A (GAS/STEAM LOCATIONS),23-31590,DR-1826,DR-1826,,,1-9-23 11:41 AM,2023-01-09T11:41:00.000Z,2-23-23 11:39 AM,2023-02-23T11:39:00.000Z,3-7-23 8:47 AM,2023-03-07T08:47:00.000Z,4,4,,PM,CLOSE,Y,,NO,CHATHAM,"2541, 2542, 2543, 2544, 2545, 2547, 2549, 2550, 2552, 2553, 2554, 2555, 2556, 2557, 2558, 2559","SWISS COMBI ROTARY DRYER DRUM, SEW GEARBOX - LEFT HAND DRIVE -, SEW GEARBOX - LEFT HAND DRIVE, SEW GEARBOX - RIGHT HAND DRIVE, SEW GEARBOX - RIGHT HAND DRIVE, MOTOR / 25HP / 1800RPM / TEFC / 575V/3PH/60HZ / FRAME# 284TC, MOTOR / 25HP / 1800RPM / TEFC / 575V/3PH/60HZ / FRAME# 284TC, MOTOR / 25HP / 1800RPM / TEFC / 575V/3PH/60HZ / FRAME# 284TC, MOTOR / 25HP / 1800RPM / TEFC / 575V/3PH/60HZ / FRAME# 284TC, TRUNNION (A) - LEFT HAND DRIVE, TRUNNION (B)- RIGHT HAND DRIVE, TRUNNION (D) - LEFT HAND DRIVE, TRUNNION (C) - RIGHT HAND DRIVE, THRUST ROLLER ASSEMBLY, THRUST ROLLER ASSEMBLY, TRUNNION LUBRICATION SYSTEM",,No,CH-DR_DECANT701,CH-DR_DECANT701:XS17703C.CIN,XS-17703C,XS,CIN,Contact input (discrete),Limit/proximity switch (status),Discrete Input,DRUM DR1826 MOTOR B AMPERAGE,DR-1826
,BLIND IN DRYER A (GAS/STEAM LOCATIONS),23-31590,DR-1826,DR-1826,,,1-9-23 11:41 AM,2023-01-09T11:41:00.000Z,2-23-23 11:39 AM,2023-02-23T11:39:00.000Z,3-7-23 8:47 AM,2023-03-07T08:47:00.000Z,4,4,,PM,CLOSE,Y,,NO,CHATHAM,"2541, 2542, 2543, 2544, 2545, 2547, 2549, 2550, 2552, 2553, 2554, 2555, 2556, 2557, 2558, 2559","SWISS COMBI ROTARY DRYER DRUM, SEW GEARBOX - LEFT HAND DRIVE -, SEW GEARBOX - LEFT HAND DRIVE, SEW GEARBOX - RIGHT HAND DRIVE, SEW GEARBOX - RIGHT HAND DRIVE, MOTOR / 25HP / 1800RPM / TEFC / 575V/3PH/60HZ / FRAME# 284TC, MOTOR / 25HP / 1800RPM / TEFC / 575V/3PH/60HZ / FRAME# 284TC, MOTOR / 25HP / 1800RPM / TEFC / 575V/3PH/60HZ / FRAME# 284TC, MOTOR / 25HP / 1800RPM / TEFC / 575V/3PH/60HZ / FRAME# 284TC, TRUNNION (A) - LEFT HAND DRIVE, TRUNNION (B)- RIGHT HAND DRIVE, TRUNNION (D) - LEFT HAND DRIVE, TRUNNION (C) - RIGHT HAND DRIVE, THRUST ROLLER ASSEMBLY, THRUST ROLLER ASSEMBLY, TRUNNION LUBRICATION SYSTEM",,No,CH-DR_DECANT701,CH-DR_DECANT701:XV17702.STAIND,XV-17702,XV,STAIND,"Status indication (open/closed, run/stop)",Valve/damper/door status (discrete),Status,DRUM DR1826 MOTOR C AMPERAGE,DR-1826
,BLIND IN DRYER A (GAS/STEAM LOCATIONS),23-31590,DR-1826,DR-1826,,,1-9-23 11:41 AM,2023-01-09T11:41:00.000Z,2-23-23 11:39 AM,2023-02-23T11:39:00.000Z,3-7-23 8:47 AM,2023-03-07T08:47:00.000Z,4,4,,PM,CLOSE,Y,,NO,CHATHAM,"2541, 2542, 2543, 2544, 2545, 2547, 2549, 2550, 2552, 2553, 2554, 2555, 2556, 2557, 2558, 2559","SWISS COMBI ROTARY DRYER DRUM, SEW GEARBOX - LEFT HAND DRIVE -, SEW GEARBOX - LEFT HAND DRIVE, SEW GEARBOX - RIGHT HAND DRIVE, SEW GEARBOX - RIGHT HAND DRIVE, MOTOR / 25HP / 1800RPM / TEFC / 575V/3PH/60HZ / FRAME# 284TC, MOTOR / 25HP / 1800RPM / TEFC / 575V/3PH/60HZ / FRAME# 284TC, MOTOR / 25HP / 1800RPM / TEFC / 575V/3PH/60HZ / FRAME# 284TC, MOTOR / 25HP / 1800RPM / TEFC / 575V/3PH/60HZ / FRAME# 284TC, TRUNNION (A) - LEFT HAND DRIVE, TRUNNION (B)- RIGHT HAND DRIVE, TRUNNION (D) - LEFT HAND DRIVE, TRUNNION (C) - RIGHT HAND DRIVE, THRUST ROLLER ASSEMBLY, THRUST ROLLER ASSEMBLY, TRUNNION LUBRICATION SYSTEM",,No,CH-DR_DECANT701,CH-DR_DECANT701:XV17732.STAIND,XV-17732,XV,STAIND,"Status indication (open/closed, run/stop)",Valve/damper/door status (discrete),Status,DRUM DR1826 MOTOR D AMPERAGE,DR-1826
,BLIND IN DRYER A (GAS/STEAM LOCATIONS),23-31590,DR-1826,DR-1826,,,1-9-23 11:41 AM,2023-01-09T11:41:00.000Z,2-23-23 11:39 AM,2023-02-23T11:39:00.000Z,3-7-23 8:47 AM,2023-03-07T08:47:00.000Z,4,4,,PM,CLOSE,Y,,NO,CHATHAM,"2541, 2542, 2543, 2544, 2545, 2547, 2549, 2550, 2552, 2553, 2554, 2555, 2556, 2557, 2558, 2559","SWISS COMBI ROTARY DRYER DRUM, SEW GEARBOX - LEFT HAND DRIVE -, SEW GEARBOX - LEFT HAND DRIVE, SEW GEARBOX - RIGHT HAND DRIVE, SEW GEARBOX - RIGHT HAND DRIVE, MOTOR / 25HP / 1800RPM / TEFC / 575V/3PH/60HZ / FRAME# 284TC, MOTOR / 25HP / 1800RPM / TEFC / 575V/3PH/60HZ / FRAME# 284TC, MOTOR / 25HP / 1800RPM / TEFC / 575V/3PH/60HZ / FRAME# 284TC, MOTOR / 25HP / 1800RPM / TEFC / 575V/3PH/60HZ / FRAME# 284TC, TRUNNION (A) - LEFT HAND DRIVE, TRUNNION (B)- RIGHT HAND DRIVE, TRUNNION (D) - LEFT HAND DRIVE, TRUNNION (C) - RIGHT HAND DRIVE, THRUST ROLLER ASSEMBLY, THRUST ROLLER ASSEMBLY, TRUNNION LUBRICATION SYSTEM",,No,CH-DR_DECANT702,CH-DR_DECANT702:ST17706A.MEAS,ST-17706A,ST,MEAS,Measured value (PV),Speed/torque transmitter,Measurement,DRUM DR1826 FRONT LUBEN TIMER,DR-1826
,BLIND IN DRYER A (GAS/STEAM LOCATIONS),23-31590,DR-1826,DR-1826,,,1-9-23 11:41 AM,2023-01-09T11:41:00.000Z,2-23-23 11:39 AM,2023-02-23T11:39:00.000Z,3-7-23 8:47 AM,2023-03-07T08:47:00.000Z,4,4,,PM,CLOSE,Y,,NO,CHATHAM,"2541, 2542, 2543, 2544, 2545, 2547, 2549, 2550, 2552, 2553, 2554, 2555, 2556, 2557, 2558, 2559","SWISS COMBI ROTARY DRYER DRUM, SEW GEARBOX - LEFT HAND DRIVE -, SEW GEARBOX - LEFT HAND DRIVE, SEW GEARBOX - RIGHT HAND DRIVE, SEW GEARBOX - RIGHT HAND DRIVE, MOTOR / 25HP / 1800RPM / TEFC / 575V/3PH/60HZ / FRAME# 284TC, MOTOR / 25HP / 1800RPM / TEFC / 575V/3PH/60HZ / FRAME# 284TC, MOTOR / 25HP / 1800RPM / TEFC / 575V/3PH/60HZ / FRAME# 284TC, MOTOR / 25HP / 1800RPM / TEFC / 575V/3PH/60HZ / FRAME# 284TC, TRUNNION (A) - LEFT HAND DRIVE, TRUNNION (B)- RIGHT HAND DRIVE, TRUNNION (D) - LEFT HAND DRIVE, TRUNNION (C) - RIGHT HAND DRIVE, THRUST ROLLER ASSEMBLY, THRUST ROLLER ASSEMBLY, TRUNNION LUBRICATION SYSTEM",,No,CH-DR_DECANT702,CH-DR_DECANT702:ST17706B.RO01,ST-17706B,ST,RO01,Binary/relay output channel,Speed/torque transmitter,Binary Output,DRUM DR1826 REAR LUBE TIMER,DR-1826
,"BL1802,BL1803D,BL1804D,Demo decanter points,MX1801D",23-31592,,,,,1-9-23 11:51 AM,2023-01-09T11:51:00.000Z,2-23-23 11:51 AM,2023-02-23T11:51:00.000Z,4-5-23 2:01 PM,2023-04-05T14:01:00.000Z,4,4,,PM,CLOSE,Y,,NO,CHATHAM,,,,,,,,,,,,,,
,CLEAN BL-1802 DECANTER POINTS,23-31593,,,,,1-9-23 11:52 AM,2023-01-09T11:52:00.000Z,2-23-23 11:51 AM,2023-02-23T11:51:00.000Z,4-5-23 2:01 PM,2023-04-05T14:01:00.000Z,4,4,,PM,CLOSE,Y,,NO,CHATHAM,,,,,,,,,,,,,,
,CLEAN BL-1803D DECANTER POINTS,23-31594,,,,,1-9-23 11:53 AM,2023-01-09T11:53:00.000Z,2-23-23 11:51 AM,2023-02-23T11:51:00.000Z,4-5-23 2:01 PM,2023-04-05T14:01:00.000Z,4,4,,PM,CLOSE,Y,,NO,CHATHAM,,,,,,,,,,,,,,
,CLEAN BL-1804D DECANTER POINTS,23-31595,,,,,1-9-23 11:53 AM,2023-01-09T11:53:00.000Z,2-23-23 11:51 AM,2023-02-23T11:51:00.000Z,4-5-23 2:01 PM,2023-04-05T14:01:00.000Z,4,4,,PM,CLOSE,Y,,NO,CHATHAM,,,,,,,,,,,,,,
,CLEAN MX1801D POINTS,23-31596,,,,,1-9-23 11:54 AM,2023-01-09T11:54:00.000Z,2-23-23 11:51 AM,2023-02-23T11:51:00.000Z,4-5-23 2:01 PM,2023-04-05T14:01:00.000Z,4,4,,PM,CLOSE,Y,,NO,CHATHAM,,,,,,,,,,,,,,
,ASSIST IN CLEANING POINTS,23-31597,,,,,1-9-23 11:57 AM,2023-01-09T11:57:00.000Z,2-23-23 11:51 AM,2023-02-23T11:51:00.000Z,4-5-23 2:01 PM,2023-04-05T14:01:00.000Z,4,4,,PM,CLOSE,Y,,NO,CHATHAM,,,,,,,,,,,,,,
2561,Isolation for CSE,23-31598,E-1834,E-1834,,,1-9-23 1:57 PM,2023-01-09T13:57:00.000Z,2-23-23 11:34 AM,2023-02-23T11:34:00.000Z,4-5-23 2:01 PM,2023-04-05T14:01:00.000Z,4,4,,CO,CLOSE,Y,,NO,CHATHAM,2561,DRYER A - DDG PRODUCT COOLER,,Yes,CH-DR_DUSTCOLL,CH-DR_DUSTCOLL:E1834.STAIND,E-1834,E,STAIND,"Status indication (open/closed, run/stop)",Equipment device status,Equipment Status,DOSING BIN SCREW CVYR B,
2561,Isolation for CSE,23-31598,E-1834,E-1834,,,1-9-23 1:57 PM,2023-01-09T13:57:00.000Z,2-23-23 11:34 AM,2023-02-23T11:34:00.000Z,4-5-23 2:01 PM,2023-04-05T14:01:00.000Z,4,4,,CO,CLOSE,Y,,NO,CHATHAM,2561,DRYER A - DDG PRODUCT COOLER,,Yes,CH-DR_DUSTCOLL,CH-DR_DUSTCOLL:E1834.STAIND,E-1834,E,STAIND,"Status indication (open/closed, run/stop)",Equipment (general),Status,DOSING BIN SCREW CVYR B,
2561,Inspect shaft and gear box for disconnect,23-31599,E-1834,E-1834,,,1-9-23 1:57 PM,2023-01-09T13:57:00.000Z,2-23-23 11:34 AM,2023-02-23T11:34:00.000Z,4-5-23 2:01 PM,2023-04-05T14:01:00.000Z,4,4,,CO,CLOSE,Y,,NO,CHATHAM,2561,DRYER A - DDG PRODUCT COOLER,,Yes,CH-DR_DUSTCOLL,CH-DR_DUSTCOLL:E1834.STAIND,E-1834,E,STAIND,"Status indication (open/closed, run/stop)",Equipment device status,Equipment Status,DOSING BIN SCREW CVYR B,
2561,Inspect shaft and gear box for disconnect,23-31599,E-1834,E-1834,,,1-9-23 1:57 PM,2023-01-09T13:57:00.000Z,2-23-23 11:34 AM,2023-02-23T11:34:00.000Z,4-5-23 2:01 PM,2023-04-05T14:01:00.000Z,4,4,,CO,CLOSE,Y,,NO,CHATHAM,2561,DRYER A - DDG PRODUCT COOLER,,Yes,CH-DR_DUSTCOLL,CH-DR_DUSTCOLL:E1834.STAIND,E-1834,E,STAIND,"Status indication (open/closed, run/stop)",Equipment (general),Status,DOSING BIN SCREW CVYR B,
2561,Repair if possible or move to SD,23-31600,E-1834,E-1834,,,1-9-23 1:58 PM,2023-01-09T13:58:00.000Z,2-23-23 11:34 AM,2023-02-23T11:34:00.000Z,4-5-23 2:01 PM,2023-04-05T14:01:00.000Z,4,4,,CO,CLOSE,Y,,NO,CHATHAM,2561,DRYER A - DDG PRODUCT COOLER,,Yes,CH-DR_DUSTCOLL,CH-DR_DUSTCOLL:E1834.STAIND,E-1834,E,STAIND,"Status indication (open/closed, run/stop)",Equipment device status,Equipment Status,DOSING BIN SCREW CVYR B,
2561,Repair if possible or move to SD,23-31600,E-1834,E-1834,,,1-9-23 1:58 PM,2023-01-09T13:58:00.000Z,2-23-23 11:34 AM,2023-02-23T11:34:00.000Z,4-5-23 2:01 PM,2023-04-05T14:01:00.000Z,4,4,,CO,CLOSE,Y,,NO,CHATHAM,2561,DRYER A - DDG PRODUCT COOLER,,Yes,CH-DR_DUSTCOLL,CH-DR_DUSTCOLL:E1834.STAIND,E-1834,E,STAIND,"Status indication (open/closed, run/stop)",Equipment (general),Status,DOSING BIN SCREW CVYR B,
2561,Close up manways,23-31601,E-1834,E-1834,,,1-9-23 1:58 PM,2023-01-09T13:58:00.000Z,2-23-23 11:34 AM,2023-02-23T11:34:00.000Z,4-5-23 2:01 PM,2023-04-05T14:01:00.000Z,4,4,,CO,CLOSE,Y,,NO,CHATHAM,2561,DRYER A - DDG PRODUCT COOLER,,Yes,CH-DR_DUSTCOLL,CH-DR_DUSTCOLL:E1834.STAIND,E-1834,E,STAIND,"Status indication (open/closed, run/stop)",Equipment device status,Equipment Status,DOSING BIN SCREW CVYR B,
2561,Close up manways,23-31601,E-1834,E-1834,,,1-9-23 1:58 PM,2023-01-09T13:58:00.000Z,2-23-23 11:34 AM,2023-02-23T11:34:00.000Z,4-5-23 2:01 PM,2023-04-05T14:01:00.000Z,4,4,,CO,CLOSE,Y,,NO,CHATHAM,2561,DRYER A - DDG PRODUCT COOLER,,Yes,CH-DR_DUSTCOLL,CH-DR_DUSTCOLL:E1834.STAIND,E-1834,E,STAIND,"Status indication (open/closed, run/stop)",Equipment (general),Status,DOSING BIN SCREW CVYR B,
6723,Remove spool pieces from E-1303B,23-31602,E-1303B,E-1303B,,,1-9-23 2:02 PM,2023-01-09T14:02:00.000Z,1-11-23 2:02 PM,2023-01-11T14:02:00.000Z,1-10-23 5:02 PM,2023-01-10T17:02:00.000Z,4,4,,CO,CLOSE,Y,,NO,CHATHAM,,,,,,,,,,,,,,
,Fabricate and install new bracket for wireless IT pole and secure to building. Cut off base,23-31603,0000,0000,,,1-9-23 2:29 PM,2023-01-09T14:29:00.000Z,1-11-23 2:26 PM,2023-01-11T14:26:00.000Z,1-11-23 10:16 AM,2023-01-11T10:16:00.000Z,1,1,,CP,CLOSE,Y,,NO,CHATHAM,,,,,,,,,,,,,,
10036,INSPECT BL-1832,23-31604,BL-1832,BL-1832,,,1-9-23 2:59 PM,2023-01-09T14:59:00.000Z,2-23-23 1:57 PM,2023-02-23T13:57:00.000Z,4-5-23 2:01 PM,2023-04-05T14:01:00.000Z,4,4,,SD,CLOSE,Y,,NO,CHATHAM,"10036, 10037","BLOWER, HOWDEN, FAN MODEL EPB4S-5750, 200HP / 1800RPM / TEFC / 575V/3PH/60HZ / 447T FRAME",,No,CH-DRA_COMB_AIR,CH-DRA_COMB_AIR:BL1832.STAIND,BL-1832,BL,STAIND,"Status indication (open/closed, run/stop)",Blower (asset),Equipment status,COMBUSTION AIR FAN,
2533,OPEN MAYWAY,23-31605,CY-1826,CY-1826,,,1-9-23 3:18 PM,2023-01-09T15:18:00.000Z,9-1-22 12:00 AM,2022-09-01T00:00:00.000Z,1-31-23 6:58 AM,2023-01-31T06:58:00.000Z,4,4,,SD,CLOSE,Y,,NO,CHATHAM,2533,"CYCLONE ASSEMBLY, RIGHT HAND, DEDERT MODEL# CYCL-11 A",,No,CH-DRYER_A,CH-DRYER_A:TIC18147B.OUT,TIC-18147B,TIC,OUT,Controller output / demand (CO),Temperature indicating controller,Output/Demand,CY1826 TOP TEMP,CY-1826
2533,OPEN MAYWAY,23-31605,CY-1826,CY-1826,,,1-9-23 3:18 PM,2023-01-09T15:18:00.000Z,9-1-22 12:00 AM,2022-09-01T00:00:00.000Z,1-31-23 6:58 AM,2023-01-31T06:58:00.000Z,4,4,,SD,CLOSE,Y,,NO,CHATHAM,2533,"CYCLONE ASSEMBLY, RIGHT HAND, DEDERT MODEL# CYCL-11 A",,No,CH-DRYER_A,CH-DRYER_A:TIC18147B.SPT,TIC-18147B,TIC,SPT,Setpoint (SP),Temperature indicating controller,Setpoint,CY1826 MID TEMP,CY-1826
2533,OPEN MAYWAY,23-31605,CY-1826,CY-1826,,,1-9-23 3:18 PM,2023-01-09T15:18:00.000Z,9-1-22 12:00 AM,2022-09-01T00:00:00.000Z,1-31-23 6:58 AM,2023-01-31T06:58:00.000Z,4,4,,SD,CLOSE,Y,,NO,CHATHAM,2533,"CYCLONE ASSEMBLY, RIGHT HAND, DEDERT MODEL# CYCL-11 A",,No,CH-DRYER_A,CH-DRYER_A:XV18148.STAIND,XV-18148,XV,STAIND,"Status indication (open/closed, run/stop)",Valve/damper/door status (discrete),Status,CY1826 BOTTOM TEMP,CY-1826
2533,HPW WASH CY-1826 CYCLONE,23-31606,CY-1826,CY-1826,,,1-10-23 8:16 AM,2023-01-10T08:16:00.000Z,9-1-22 12:00 AM,2022-09-01T00:00:00.000Z,1-31-23 6:58 AM,2023-01-31T06:58:00.000Z,4,4,,SD,CLOSE,Y,,NO,CHATHAM,2533,"CYCLONE ASSEMBLY, RIGHT HAND, DEDERT MODEL# CYCL-11 A",,No,CH-DRYER_A,CH-DRYER_A:TIC18147B.OUT,TIC-18147B,TIC,OUT,Controller output / demand (CO),Temperature indicating controller,Output/Demand,CY1826 TOP TEMP,CY-1826
2533,HPW WASH CY-1826 CYCLONE,23-31606,CY-1826,CY-1826,,,1-10-23 8:16 AM,2023-01-10T08:16:00.000Z,9-1-22 12:00 AM,2022-09-01T00:00:00.000Z,1-31-23 6:58 AM,2023-01-31T06:58:00.000Z,4,4,,SD,CLOSE,Y,,NO,CHATHAM,2533,"CYCLONE ASSEMBLY, RIGHT HAND, DEDERT MODEL# CYCL-11 A",,No,CH-DRYER_A,CH-DRYER_A:TIC18147B.SPT,TIC-18147B,TIC,SPT,Setpoint (SP),Temperature indicating controller,Setpoint,CY1826 MID TEMP,CY-1826
2533,HPW WASH CY-1826 CYCLONE,23-31606,CY-1826,CY-1826,,,1-10-23 8:16 AM,2023-01-10T08:16:00.000Z,9-1-22 12:00 AM,2022-09-01T00:00:00.000Z,1-31-23 6:58 AM,2023-01-31T06:58:00.000Z,4,4,,SD,CLOSE,Y,,NO,CHATHAM,2533,"CYCLONE ASSEMBLY, RIGHT HAND, DEDERT MODEL# CYCL-11 A",,No,CH-DRYER_A,CH-DRYER_A:XV18148.STAIND,XV-18148,XV,STAIND,"Status indication (open/closed, run/stop)",Valve/damper/door status (discrete),Status,CY1826 BOTTOM TEMP,CY-1826
2533,CLOSE MANWAY,23-31607,CY-1826,CY-1826,,,1-10-23 8:18 AM,2023-01-10T08:18:00.000Z,9-1-22 12:00 AM,2022-09-01T00:00:00.000Z,1-31-23 6:58 AM,2023-01-31T06:58:00.000Z,4,4,,SD,CLOSE,Y,,NO,CHATHAM,2533,"CYCLONE ASSEMBLY, RIGHT HAND, DEDERT MODEL# CYCL-11 A",,No,CH-DRYER_A,CH-DRYER_A:TIC18147B.OUT,TIC-18147B,TIC,OUT,Controller output / demand (CO),Temperature indicating controller,Output/Demand,CY1826 TOP TEMP,CY-1826
2533,CLOSE MANWAY,23-31607,CY-1826,CY-1826,,,1-10-23 8:18 AM,2023-01-10T08:18:00.000Z,9-1-22 12:00 AM,2022-09-01T00:00:00.000Z,1-31-23 6:58 AM,2023-01-31T06:58:00.000Z,4,4,,SD,CLOSE,Y,,NO,CHATHAM,2533,"CYCLONE ASSEMBLY, RIGHT HAND, DEDERT MODEL# CYCL-11 A",,No,CH-DRYER_A,CH-DRYER_A:TIC18147B.SPT,TIC-18147B,TIC,SPT,Setpoint (SP),Temperature indicating controller,Setpoint,CY1826 MID TEMP,CY-1826
2533,CLOSE MANWAY,23-31607,CY-1826,CY-1826,,,1-10-23 8:18 AM,2023-01-10T08:18:00.000Z,9-1-22 12:00 AM,2022-09-01T00:00:00.000Z,1-31-23 6:58 AM,2023-01-31T06:58:00.000Z,4,4,,SD,CLOSE,Y,,NO,CHATHAM,2533,"CYCLONE ASSEMBLY, RIGHT HAND, DEDERT MODEL# CYCL-11 A",,No,CH-DRYER_A,CH-DRYER_A:XV18148.STAIND,XV-18148,XV,STAIND,"Status indication (open/closed, run/stop)",Valve/damper/door status (discrete),Status,CY1826 BOTTOM TEMP,CY-1826
2534,HPW WASH CYCLONE 1827,23-31618,CY-1827,CY-1827,,,1-10-23 9:15 AM,2023-01-10T09:15:00.000Z,2-23-23 9:17 AM,2023-02-23T09:17:00.000Z,4-12-23 3:38 PM,2023-04-12T15:38:00.000Z,4,4,,PM,CLOSE,Y,N,NO,CHATHAM,2534,"CYCLONE ASSEMBLY, RIGHT HAND, DEDERT MODEL# CYCL-11 B",,No,CH-DRYER_A,CH-DRYER_A:IT18149.MEAS,IT-18149,IT,MEAS,Measured value (PV),Current transmitter (motor amps),Measurement,CY1827 TOP TEMP,CY-1827
2534,HPW WASH CYCLONE 1827,23-31618,CY-1827,CY-1827,,,1-10-23 9:15 AM,2023-01-10T09:15:00.000Z,2-23-23 9:17 AM,2023-02-23T09:17:00.000Z,4-12-23 3:38 PM,2023-04-12T15:38:00.000Z,4,4,,PM,CLOSE,Y,N,NO,CHATHAM,2534,"CYCLONE ASSEMBLY, RIGHT HAND, DEDERT MODEL# CYCL-11 B",,No,CH-DRYER_A,CH-DRYER_A:SSL18149.CIN,SSL-18149,SSL,CIN,Contact input (discrete),Speed switch (motion proof),Discrete Input,CY1827 MID TEMP,CY-1827
2534,HPW WASH CYCLONE 1827,23-31618,CY-1827,CY-1827,,,1-10-23 9:15 AM,2023-01-10T09:15:00.000Z,2-23-23 9:17 AM,2023-02-23T09:17:00.000Z,4-12-23 3:38 PM,2023-04-12T15:38:00.000Z,4,4,,PM,CLOSE,Y,N,NO,CHATHAM,2534,"CYCLONE ASSEMBLY, RIGHT HAND, DEDERT MODEL# CYCL-11 B",,No,CH-DRYER_A,CH-DRYER_A:IT18150.MEAS,IT-18150,IT,MEAS,Measured value (PV),Current transmitter (motor amps),Measurement,CY1827 BOTTOM TEMP,CY-1827
,REMOVE MANWAY,23-31619,,,,,1-10-23 9:15 AM,2023-01-10T09:15:00.000Z,,,4-12-23 3:38 PM,2023-04-12T15:38:00.000Z,,,,,CLOSE,Y,,NO,CHATHAM,,,,,,,,,,,,,,
,HPW CYCLONE,23-31620,,,,,1-10-23 9:15 AM,2023-01-10T09:15:00.000Z,,,4-12-23 3:38 PM,2023-04-12T15:38:00.000Z,,,,,CLOSE,Y,,NO,CHATHAM,,,,,,,,,,,,,,
,RE-INSTALL MAYWAY,23-31621,,,,,1-10-23 9:15 AM,2023-01-10T09:15:00.000Z,,,4-12-23 3:38 PM,2023-04-12T15:38:00.000Z,,,,,CLOSE,Y,,NO,CHATHAM,,,,,,,,,,,,,,
2535,HPW WASH 1828 CYCLONES,23-31622,CY-1828,CY-1828,,,1-10-23 9:20 AM,2023-01-10T09:20:00.000Z,2-23-23 9:20 AM,2023-02-23T09:20:00.000Z,4-12-23 3:37 PM,2023-04-12T15:37:00.000Z,4,4,,PM,CLOSE,Y,N,NO,CHATHAM,2535,"CYCLONE ASSEMBLY, LEFT HAND, DEDERT MODEL #CYCL-12 A",,No,CH-DRYER_A,CH-DRYER_A:IT18151.MEAS,IT-18151,IT,MEAS,Measured value (PV),Current transmitter (motor amps),Measurement,CY1828 MID TEMP,CY-1828
2535,HPW WASH 1828 CYCLONES,23-31622,CY-1828,CY-1828,,,1-10-23 9:20 AM,2023-01-10T09:20:00.000Z,2-23-23 9:20 AM,2023-02-23T09:20:00.000Z,4-12-23 3:37 PM,2023-04-12T15:37:00.000Z,4,4,,PM,CLOSE,Y,N,NO,CHATHAM,2535,"CYCLONE ASSEMBLY, LEFT HAND, DEDERT MODEL #CYCL-12 A",,No,CH-DRYER_A,CH-DRYER_A:SSL18151.CIN,SSL-18151,SSL,CIN,Contact input (discrete),Speed switch (motion proof),Discrete Input,CY1828 BOTTOM TEMP,CY-1828
,REMOVE MANWAY,23-31623,,,,,1-10-23 9:20 AM,2023-01-10T09:20:00.000Z,,,4-12-23 3:37 PM,2023-04-12T15:37:00.000Z,,,,,CLOSE,Y,,NO,CHATHAM,,,,,,,,,,,,,,
,HPW CYCLONE,23-31624,,,,,1-10-23 9:20 AM,2023-01-10T09:20:00.000Z,,,4-12-23 3:37 PM,2023-04-12T15:37:00.000Z,,,,,CLOSE,Y,,NO,CHATHAM,,,,,,,,,,,,,,
,RE-INSTALL MAYWAY,23-31625,,,,,1-10-23 9:20 AM,2023-01-10T09:20:00.000Z,,,4-12-23 3:37 PM,2023-04-12T15:37:00.000Z,,,,,CLOSE,Y,,NO,CHATHAM,,,,,,,,,,,,,,
2536,HPW WASH 1829 CYCLONE,23-31626,CY-1829,CY-1829,,,1-10-23 9:24 AM,2023-01-10T09:24:00.000Z,2-23-23 10:02 AM,2023-02-23T10:02:00.000Z,4-12-23 3:37 PM,2023-04-12T15:37:00.000Z,4,4,,PM,CLOSE,Y,N,NO,CHATHAM,2536,"CYCLONE ASSEMBLY, LEFT HAND, DEDERT MODEL# CYCL-12 B",,No,CH-DRYER_A,CH-DRYER_A:IT18152.MEAS,IT-18152,IT,MEAS,Measured value (PV),Current transmitter (motor amps),Measurement,CY1829 TOP TEMP,CY-1829
2536,HPW WASH 1829 CYCLONE,23-31626,CY-1829,CY-1829,,,1-10-23 9:24 AM,2023-01-10T09:24:00.000Z,2-23-23 10:02 AM,2023-02-23T10:02:00.000Z,4-12-23 3:37 PM,2023-04-12T15:37:00.000Z,4,4,,PM,CLOSE,Y,N,NO,CHATHAM,2536,"CYCLONE ASSEMBLY, LEFT HAND, DEDERT MODEL# CYCL-12 B",,No,CH-DRYER_A,CH-DRYER_A:SI18152.MEAS,SI-18152,SI,MEAS,Measured value (PV),Speed indication (feedback),Measurement,CY1829 MID TEMP,CY-1829
2536,HPW WASH 1829 CYCLONE,23-31626,CY-1829,CY-1829,,,1-10-23 9:24 AM,2023-01-10T09:24:00.000Z,2-23-23 10:02 AM,2023-02-23T10:02:00.000Z,4-12-23 3:37 PM,2023-04-12T15:37:00.000Z,4,4,,PM,CLOSE,Y,N,NO,CHATHAM,2536,"CYCLONE ASSEMBLY, LEFT HAND, DEDERT MODEL# CYCL-12 B",,No,CH-DRYER_A,CH-DRYER_A:SSL18152.CIN,SSL-18152,SSL,CIN,Contact input (discrete),Speed switch (motion proof),Discrete Input,CY1829 BOTTOM TEMP,CY-1829
,REMOVE MANWAY,23-31627,,,,,1-10-23 9:25 AM,2023-01-10T09:25:00.000Z,,,4-12-23 3:37 PM,2023-04-12T15:37:00.000Z,,,,,CLOSE,Y,,NO,CHATHAM,,,,,,,,,,,,,,
,HPW CYCLONE,23-31628,,,,,1-10-23 9:25 AM,2023-01-10T09:25:00.000Z,,,4-12-23 3:37 PM,2023-04-12T15:37:00.000Z,,,,,CLOSE,Y,,NO,CHATHAM,,,,,,,,,,,,,,
,RE-INSTALL MAYWAY,23-31629,,,,,1-10-23 9:25 AM,2023-01-10T09:25:00.000Z,,,4-12-23 3:37 PM,2023-04-12T15:37:00.000Z,,,,,CLOSE,Y,,NO,CHATHAM,,,,,,,,,,,,,,
,CV-1830 Open end for water to drain,23-31639,CV-1830,CV-1830,,,1-10-23 10:08 AM,2023-01-10T10:08:00.000Z,1-11-23 10:08 AM,2023-01-11T10:08:00.000Z,1-10-23 11:36 AM,2023-01-10T11:36:00.000Z,4,4,,CO,CLOSE,Y,,NO,CHATHAM,"2490, 2515","20 HP / 1760 RPM / TEFC / 575V/3PH/60HZ / FRAME#256T, DORRIS 315TR25 SHAFT MOUNTED SPEED REDUCER",,No,CH-DRYER_A,CH-DRYER_A:CV1830.STAIND,CV-1830,CV,STAIND,"Status indication (open/closed, run/stop)",Conveyor (asset),Equipment status,RECYCLE DRAG CONVEYOR,
,OPEN FOR WATER TO DRAIN,23-31640,CV-1830,CV-1830,,,1-10-23 10:09 AM,2023-01-10T10:09:00.000Z,2-23-23 10:08 AM,2023-02-23T10:08:00.000Z,1-10-23 11:36 AM,2023-01-10T11:36:00.000Z,4,4,,CO,CLOSE,Y,,NO,CHATHAM,"2490, 2515","20 HP / 1760 RPM / TEFC / 575V/3PH/60HZ / FRAME#256T, DORRIS 315TR25 SHAFT MOUNTED SPEED REDUCER",,No,CH-DRYER_A,CH-DRYER_A:CV1830.STAIND,CV-1830,CV,STAIND,"Status indication (open/closed, run/stop)",Conveyor (asset),Equipment status,RECYCLE DRAG CONVEYOR,
,CV-1826B MECHANICAL PM,23-31646,CV-1826B,CV-1826B,,,1-10-23 10:48 AM,2023-01-10T10:48:00.000Z,2-23-23 10:00 AM,2023-02-23T10:00:00.000Z,5-19-23 2:03 PM,2023-05-19T14:03:00.000Z,4,4,,PM,CLOSE,Y,N,NO,CHATHAM,"2487, 2508","7.5 HP / 3520 RPM / TEFC / 575V/3PH/60HZ / FRAME#213TC, SEW PARALLEL SHAFT HELICAL GEAR UNIT FHZ127 R77 AM213/215",,No,CH-DRA_CYCLNS,CH-DRA_CYCLNS:IT18172.MEAS,IT-18172,IT,MEAS,Measured value (PV),Current transmitter (motor amps),Measurement,CV1826B CURRENT INDICATION,CV-1826B
,CV-1826B MECHANICAL PM,23-31646,CV-1826B,CV-1826B,,,1-10-23 10:48 AM,2023-01-10T10:48:00.000Z,2-23-23 10:00 AM,2023-02-23T10:00:00.000Z,5-19-23 2:03 PM,2023-05-19T14:03:00.000Z,4,4,,PM,CLOSE,Y,N,NO,CHATHAM,"2487, 2508","7.5 HP / 3520 RPM / TEFC / 575V/3PH/60HZ / FRAME#213TC, SEW PARALLEL SHAFT HELICAL GEAR UNIT FHZ127 R77 AM213/215",,No,CH-DRA_PROC_AIR,CH-DRA_PROC_AIR:TT18179E.MEAS,TT-18179E,TT,MEAS,Measured value (PV),Temperature transmitter,Measurement,CV1826B SPEED INDICATION,CV-1826B
,CV-1826B MECHANICAL PM,23-31646,CV-1826B,CV-1826B,,,1-10-23 10:48 AM,2023-01-10T10:48:00.000Z,2-23-23 10:00 AM,2023-02-23T10:00:00.000Z,5-19-23 2:03 PM,2023-05-19T14:03:00.000Z,4,4,,PM,CLOSE,Y,N,NO,CHATHAM,"2487, 2508","7.5 HP / 3520 RPM / TEFC / 575V/3PH/60HZ / FRAME#213TC, SEW PARALLEL SHAFT HELICAL GEAR UNIT FHZ127 R77 AM213/215",,No,CH-DRA_COMB_AIR,CH-DRA_COMB_AIR:IT18180.MEAS,IT-18180,IT,MEAS,Measured value (PV),Current transmitter (motor amps),Measurement,CV1826B SPEED  INDICATION,CV-1826B
,CV-1826B MECHANICAL PM,23-31646,CV-1826B,CV-1826B,,,1-10-23 10:48 AM,2023-01-10T10:48:00.000Z,2-23-23 10:00 AM,2023-02-23T10:00:00.000Z,5-19-23 2:03 PM,2023-05-19T14:03:00.000Z,4,4,,PM,CLOSE,Y,N,NO,CHATHAM,"2487, 2508","7.5 HP / 3520 RPM / TEFC / 575V/3PH/60HZ / FRAME#213TC, SEW PARALLEL SHAFT HELICAL GEAR UNIT FHZ127 R77 AM213/215",,No,CH-DRA_CYCLNS,CH-DRA_CYCLNS:XV18184.STAIND,XV-18184,XV,STAIND,"Status indication (open/closed, run/stop)",Valve/damper/door status (discrete),Status,CV1826B SPEED SWITCH,CV-1826B
,CV-1826B MECHANICAL PM,23-31646,CV-1826B,CV-1826B,,,1-10-23 10:48 AM,2023-01-10T10:48:00.000Z,2-23-23 10:00 AM,2023-02-23T10:00:00.000Z,5-19-23 2:03 PM,2023-05-19T14:03:00.000Z,4,4,,PM,CLOSE,Y,N,NO,CHATHAM,"2487, 2508","7.5 HP / 3520 RPM / TEFC / 575V/3PH/60HZ / FRAME#213TC, SEW PARALLEL SHAFT HELICAL GEAR UNIT FHZ127 R77 AM213/215",,No,CH-DRA_COMB_AIR,CH-DRA_COMB_AIR:PT18215B.MEAS,PT-18215B,PT,MEAS,Measured value (PV),Pressure transmitter,Measurement,CV1826B SPEEDOUTPUT,CV-1826B
,CV-1826B MECHANICAL PM,23-31646,CV-1826B,CV-1826B,,,1-10-23 10:48 AM,2023-01-10T10:48:00.000Z,2-23-23 10:00 AM,2023-02-23T10:00:00.000Z,5-19-23 2:03 PM,2023-05-19T14:03:00.000Z,4,4,,PM,CLOSE,Y,N,NO,CHATHAM,"2487, 2508","7.5 HP / 3520 RPM / TEFC / 575V/3PH/60HZ / FRAME#213TC, SEW PARALLEL SHAFT HELICAL GEAR UNIT FHZ127 R77 AM213/215",,No,CH-DRYER_A,CH-DRYER_A:CV1826B.STAIND,CV-1826B,CV,STAIND,"Status indication (open/closed, run/stop)",Conveyor (asset),Equipment status,DOSING BIN SCREW CVYR B,
,CV-1826B MECHANICAL PM,23-31646,CV-1826B,CV-1826B,,,1-10-23 10:48 AM,2023-01-10T10:48:00.000Z,2-23-23 10:00 AM,2023-02-23T10:00:00.000Z,5-19-23 2:03 PM,2023-05-19T14:03:00.000Z,4,4,,PM,CLOSE,Y,N,NO,CHATHAM,"2487, 2508","7.5 HP / 3520 RPM / TEFC / 575V/3PH/60HZ / FRAME#213TC, SEW PARALLEL SHAFT HELICAL GEAR UNIT FHZ127 R77 AM213/215",,No,CH-DR_UTIL_WTR,CH-DR_UTIL_WTR:P1837.STAIND,P-1837,P,STAIND,"Status indication (open/closed, run/stop)",Pump (asset),Status,CV1826B CURRENT INDICATION,CV-1826B
,CV-1826B MECHANICAL PM,23-31646,CV-1826B,CV-1826B,,,1-10-23 10:48 AM,2023-01-10T10:48:00.000Z,2-23-23 10:00 AM,2023-02-23T10:00:00.000Z,5-19-23 2:03 PM,2023-05-19T14:03:00.000Z,4,4,,PM,CLOSE,Y,N,NO,CHATHAM,"2487, 2508","7.5 HP / 3520 RPM / TEFC / 575V/3PH/60HZ / FRAME#213TC, SEW PARALLEL SHAFT HELICAL GEAR UNIT FHZ127 R77 AM213/215",,No,CH-DR_UTIL_WTR,CH-DR_UTIL_WTR:TT35451.MEAS,TT-35451,TT,MEAS,Measured value (PV),Temperature transmitter,Measurement,CV1826B CURRENT INDICATION,CV-1826B
,CV-1826B MECHANICAL PM,23-31646,CV-1826B,CV-1826B,,,1-10-23 10:48 AM,2023-01-10T10:48:00.000Z,2-23-23 10:00 AM,2023-02-23T10:00:00.000Z,5-19-23 2:03 PM,2023-05-19T14:03:00.000Z,4,4,,PM,CLOSE,Y,N,NO,CHATHAM,"2487, 2508","7.5 HP / 3520 RPM / TEFC / 575V/3PH/60HZ / FRAME#213TC, SEW PARALLEL SHAFT HELICAL GEAR UNIT FHZ127 R77 AM213/215",,No,CH-DRYER_D,CH-DRYER_D:PIC84401.OUT,PIC-84401,PIC,OUT,Controller output / demand (CO),Pressure indicating controller,Output,D/CV1826B CURRENT INDICATION,CV-1826B
,CV-1826B MECHANICAL PM,23-31646,CV-1826B,CV-1826B,,,1-10-23 10:48 AM,2023-01-10T10:48:00.000Z,2-23-23 10:00 AM,2023-02-23T10:00:00.000Z,5-19-23 2:03 PM,2023-05-19T14:03:00.000Z,4,4,,PM,CLOSE,Y,N,NO,CHATHAM,"2487, 2508","7.5 HP / 3520 RPM / TEFC / 575V/3PH/60HZ / FRAME#213TC, SEW PARALLEL SHAFT HELICAL GEAR UNIT FHZ127 R77 AM213/215",,No,CH-DRYER_D_BMS,CH-DRYER_D_BMS:TIC84302.MEAS,TIC-84302,TIC,MEAS,Measured value (PV),Temperature indicating controller,Measurement,CV1826B SPEED INDICATION,CV-1826B
,CV-1826B MECHANICAL PM,23-31646,CV-1826B,CV-1826B,,,1-10-23 10:48 AM,2023-01-10T10:48:00.000Z,2-23-23 10:00 AM,2023-02-23T10:00:00.000Z,5-19-23 2:03 PM,2023-05-19T14:03:00.000Z,4,4,,PM,CLOSE,Y,N,NO,CHATHAM,"2487, 2508","7.5 HP / 3520 RPM / TEFC / 575V/3PH/60HZ / FRAME#213TC, SEW PARALLEL SHAFT HELICAL GEAR UNIT FHZ127 R77 AM213/215",,No,CH-DRYER_D_BMS,CH-DRYER_D_BMS:TIC84302.OUT,TIC-84302,TIC,OUT,Controller output (CO),Temperature indicating controller,Output,CV1826B SPEED  INDICATION,CV-1826B
,CV-1826B MECHANICAL PM,23-31646,CV-1826B,CV-1826B,,,1-10-23 10:48 AM,2023-01-10T10:48:00.000Z,2-23-23 10:00 AM,2023-02-23T10:00:00.000Z,5-19-23 2:03 PM,2023-05-19T14:03:00.000Z,4,4,,PM,CLOSE,Y,N,NO,CHATHAM,"2487, 2508","7.5 HP / 3520 RPM / TEFC / 575V/3PH/60HZ / FRAME#213TC, SEW PARALLEL SHAFT HELICAL GEAR UNIT FHZ127 R77 AM213/215",,No,CH-DRYER_D_CY2,CH-DRYER_D_CY2:TT84313.PNT,TT-84313,TT,PNT,Point value / indication,Temperature transmitter,Measurement,CV1826B SPEED SWITCH,CV-1826B
,CV-1826B MECHANICAL PM,23-31646,CV-1826B,CV-1826B,,,1-10-23 10:48 AM,2023-01-10T10:48:00.000Z,2-23-23 10:00 AM,2023-02-23T10:00:00.000Z,5-19-23 2:03 PM,2023-05-19T14:03:00.000Z,4,4,,PM,CLOSE,Y,N,NO,CHATHAM,"2487, 2508","7.5 HP / 3520 RPM / TEFC / 575V/3PH/60HZ / FRAME#213TC, SEW PARALLEL SHAFT HELICAL GEAR UNIT FHZ127 R77 AM213/215",,No,CH-DRYER_D_CY2,CH-DRYER_D_CY2:TT84321.MEAS,TT-84321,TT,MEAS,Measured value (PV),Temperature transmitter,Measurement,CV1826B SPEEDOUTPUT,CV-1826B
,CV-1826B MECHANICAL PM,23-31646,CV-1826B,CV-1826B,,,1-10-23 10:48 AM,2023-01-10T10:48:00.000Z,2-23-23 10:00 AM,2023-02-23T10:00:00.000Z,5-19-23 2:03 PM,2023-05-19T14:03:00.000Z,4,4,,PM,CLOSE,Y,N,NO,CHATHAM,"2487, 2508","7.5 HP / 3520 RPM / TEFC / 575V/3PH/60HZ / FRAME#213TC, SEW PARALLEL SHAFT HELICAL GEAR UNIT FHZ127 R77 AM213/215",,No,CH-DR_DECANT702,CH-DR_DECANT702:FY17704.OUT,FY-17704,FY,OUT,Controller output / demand (CO),Flow final element demand,Output/Demand,CV1826B CURRENT INDICATION,CV-1826B
,CHECK CONDITION OF THE PACKING IN THE STUFFING BOX,23-31647,CV-1826B,CV-1826B,,,1-10-23 10:48 AM,2023-01-10T10:48:00.000Z,1-10-23 7:00 AM,2023-01-10T07:00:00.000Z,5-19-23 2:03 PM,2023-05-19T14:03:00.000Z,2,2,,PM,CLOSE,Y,,NO,CHATHAM,"2487, 2508","7.5 HP / 3520 RPM / TEFC / 575V/3PH/60HZ / FRAME#213TC, SEW PARALLEL SHAFT HELICAL GEAR UNIT FHZ127 R77 AM213/215",,No,CH-DRA_CYCLNS,CH-DRA_CYCLNS:IT18172.MEAS,IT-18172,IT,MEAS,Measured value (PV),Current transmitter (motor amps),Measurement,CV1826B CURRENT INDICATION,CV-1826B
,CHECK CONDITION OF THE PACKING IN THE STUFFING BOX,23-31647,CV-1826B,CV-1826B,,,1-10-23 10:48 AM,2023-01-10T10:48:00.000Z,1-10-23 7:00 AM,2023-01-10T07:00:00.000Z,5-19-23 2:03 PM,2023-05-19T14:03:00.000Z,2,2,,PM,CLOSE,Y,,NO,CHATHAM,"2487, 2508","7.5 HP / 3520 RPM / TEFC / 575V/3PH/60HZ / FRAME#213TC, SEW PARALLEL SHAFT HELICAL GEAR UNIT FHZ127 R77 AM213/215",,No,CH-DRA_PROC_AIR,CH-DRA_PROC_AIR:TT18179E.MEAS,TT-18179E,TT,MEAS,Measured value (PV),Temperature transmitter,Measurement,CV1826B SPEED INDICATION,CV-1826B
,CHECK CONDITION OF THE PACKING IN THE STUFFING BOX,23-31647,CV-1826B,CV-1826B,,,1-10-23 10:48 AM,2023-01-10T10:48:00.000Z,1-10-23 7:00 AM,2023-01-10T07:00:00.000Z,5-19-23 2:03 PM,2023-05-19T14:03:00.000Z,2,2,,PM,CLOSE,Y,,NO,CHATHAM,"2487, 2508","7.5 HP / 3520 RPM / TEFC / 575V/3PH/60HZ / FRAME#213TC, SEW PARALLEL SHAFT HELICAL GEAR UNIT FHZ127 R77 AM213/215",,No,CH-DRA_COMB_AIR,CH-DRA_COMB_AIR:IT18180.MEAS,IT-18180,IT,MEAS,Measured value (PV),Current transmitter (motor amps),Measurement,CV1826B SPEED  INDICATION,CV-1826B
,CHECK CONDITION OF THE PACKING IN THE STUFFING BOX,23-31647,CV-1826B,CV-1826B,,,1-10-23 10:48 AM,2023-01-10T10:48:00.000Z,1-10-23 7:00 AM,2023-01-10T07:00:00.000Z,5-19-23 2:03 PM,2023-05-19T14:03:00.000Z,2,2,,PM,CLOSE,Y,,NO,CHATHAM,"2487, 2508","7.5 HP / 3520 RPM / TEFC / 575V/3PH/60HZ / FRAME#213TC, SEW PARALLEL SHAFT HELICAL GEAR UNIT FHZ127 R77 AM213/215",,No,CH-DRA_CYCLNS,CH-DRA_CYCLNS:XV18184.STAIND,XV-18184,XV,STAIND,"Status indication (open/closed, run/stop)",Valve/damper/door status (discrete),Status,CV1826B SPEED SWITCH,CV-1826B
,CHECK CONDITION OF THE PACKING IN THE STUFFING BOX,23-31647,CV-1826B,CV-1826B,,,1-10-23 10:48 AM,2023-01-10T10:48:00.000Z,1-10-23 7:00 AM,2023-01-10T07:00:00.000Z,5-19-23 2:03 PM,2023-05-19T14:03:00.000Z,2,2,,PM,CLOSE,Y,,NO,CHATHAM,"2487, 2508","7.5 HP / 3520 RPM / TEFC / 575V/3PH/60HZ / FRAME#213TC, SEW PARALLEL SHAFT HELICAL GEAR UNIT FHZ127 R77 AM213/215",,No,CH-DRA_COMB_AIR,CH-DRA_COMB_AIR:PT18215B.MEAS,PT-18215B,PT,MEAS,Measured value (PV),Pressure transmitter,Measurement,CV1826B SPEEDOUTPUT,CV-1826B
,CHECK CONDITION OF THE PACKING IN THE STUFFING BOX,23-31647,CV-1826B,CV-1826B,,,1-10-23 10:48 AM,2023-01-10T10:48:00.000Z,1-10-23 7:00 AM,2023-01-10T07:00:00.000Z,5-19-23 2:03 PM,2023-05-19T14:03:00.000Z,2,2,,PM,CLOSE,Y,,NO,CHATHAM,"2487, 2508","7.5 HP / 3520 RPM / TEFC / 575V/3PH/60HZ / FRAME#213TC, SEW PARALLEL SHAFT HELICAL GEAR UNIT FHZ127 R77 AM213/215",,No,CH-DRYER_A,CH-DRYER_A:CV1826B.STAIND,CV-1826B,CV,STAIND,"Status indication (open/closed, run/stop)",Conveyor (asset),Equipment status,DOSING BIN SCREW CVYR B,
,CHECK CONDITION OF THE PACKING IN THE STUFFING BOX,23-31647,CV-1826B,CV-1826B,,,1-10-23 10:48 AM,2023-01-10T10:48:00.000Z,1-10-23 7:00 AM,2023-01-10T07:00:00.000Z,5-19-23 2:03 PM,2023-05-19T14:03:00.000Z,2,2,,PM,CLOSE,Y,,NO,CHATHAM,"2487, 2508","7.5 HP / 3520 RPM / TEFC / 575V/3PH/60HZ / FRAME#213TC, SEW PARALLEL SHAFT HELICAL GEAR UNIT FHZ127 R77 AM213/215",,No,CH-DR_UTIL_WTR,CH-DR_UTIL_WTR:P1837.STAIND,P-1837,P,STAIND,"Status indication (open/closed, run/stop)",Pump (asset),Status,CV1826B CURRENT INDICATION,CV-1826B
,CHECK CONDITION OF THE PACKING IN THE STUFFING BOX,23-31647,CV-1826B,CV-1826B,,,1-10-23 10:48 AM,2023-01-10T10:48:00.000Z,1-10-23 7:00 AM,2023-01-10T07:00:00.000Z,5-19-23 2:03 PM,2023-05-19T14:03:00.000Z,2,2,,PM,CLOSE,Y,,NO,CHATHAM,"2487, 2508","7.5 HP / 3520 RPM / TEFC / 575V/3PH/60HZ / FRAME#213TC, SEW PARALLEL SHAFT HELICAL GEAR UNIT FHZ127 R77 AM213/215",,No,CH-DR_UTIL_WTR,CH-DR_UTIL_WTR:TT35451.MEAS,TT-35451,TT,MEAS,Measured value (PV),Temperature transmitter,Measurement,CV1826B CURRENT INDICATION,CV-1826B
,CHECK CONDITION OF THE PACKING IN THE STUFFING BOX,23-31647,CV-1826B,CV-1826B,,,1-10-23 10:48 AM,2023-01-10T10:48:00.000Z,1-10-23 7:00 AM,2023-01-10T07:00:00.000Z,5-19-23 2:03 PM,2023-05-19T14:03:00.000Z,2,2,,PM,CLOSE,Y,,NO,CHATHAM,"2487, 2508","7.5 HP / 3520 RPM / TEFC / 575V/3PH/60HZ / FRAME#213TC, SEW PARALLEL SHAFT HELICAL GEAR UNIT FHZ127 R77 AM213/215",,No,CH-DRYER_D,CH-DRYER_D:PIC84401.OUT,PIC-84401,PIC,OUT,Controller output / demand (CO),Pressure indicating controller,Output,D/CV1826B CURRENT INDICATION,CV-1826B
,CHECK CONDITION OF THE PACKING IN THE STUFFING BOX,23-31647,CV-1826B,CV-1826B,,,1-10-23 10:48 AM,2023-01-10T10:48:00.000Z,1-10-23 7:00 AM,2023-01-10T07:00:00.000Z,5-19-23 2:03 PM,2023-05-19T14:03:00.000Z,2,2,,PM,CLOSE,Y,,NO,CHATHAM,"2487, 2508","7.5 HP / 3520 RPM / TEFC / 575V/3PH/60HZ / FRAME#213TC, SEW PARALLEL SHAFT HELICAL GEAR UNIT FHZ127 R77 AM213/215",,No,CH-DRYER_D_BMS,CH-DRYER_D_BMS:TIC84302.MEAS,TIC-84302,TIC,MEAS,Measured value (PV),Temperature indicating controller,Measurement,CV1826B SPEED INDICATION,CV-1826B
,CHECK CONDITION OF THE PACKING IN THE STUFFING BOX,23-31647,CV-1826B,CV-1826B,,,1-10-23 10:48 AM,2023-01-10T10:48:00.000Z,1-10-23 7:00 AM,2023-01-10T07:00:00.000Z,5-19-23 2:03 PM,2023-05-19T14:03:00.000Z,2,2,,PM,CLOSE,Y,,NO,CHATHAM,"2487, 2508","7.5 HP / 3520 RPM / TEFC / 575V/3PH/60HZ / FRAME#213TC, SEW PARALLEL SHAFT HELICAL GEAR UNIT FHZ127 R77 AM213/215",,No,CH-DRYER_D_BMS,CH-DRYER_D_BMS:TIC84302.OUT,TIC-84302,TIC,OUT,Controller output (CO),Temperature indicating controller,Output,CV1826B SPEED  INDICATION,CV-1826B
,CHECK CONDITION OF THE PACKING IN THE STUFFING BOX,23-31647,CV-1826B,CV-1826B,,,1-10-23 10:48 AM,2023-01-10T10:48:00.000Z,1-10-23 7:00 AM,2023-01-10T07:00:00.000Z,5-19-23 2:03 PM,2023-05-19T14:03:00.000Z,2,2,,PM,CLOSE,Y,,NO,CHATHAM,"2487, 2508","7.5 HP / 3520 RPM / TEFC / 575V/3PH/60HZ / FRAME#213TC, SEW PARALLEL SHAFT HELICAL GEAR UNIT FHZ127 R77 AM213/215",,No,CH-DRYER_D_CY2,CH-DRYER_D_CY2:TT84313.PNT,TT-84313,TT,PNT,Point value / indication,Temperature transmitter,Measurement,CV1826B SPEED SWITCH,CV-1826B
,CHECK CONDITION OF THE PACKING IN THE STUFFING BOX,23-31647,CV-1826B,CV-1826B,,,1-10-23 10:48 AM,2023-01-10T10:48:00.000Z,1-10-23 7:00 AM,2023-01-10T07:00:00.000Z,5-19-23 2:03 PM,2023-05-19T14:03:00.000Z,2,2,,PM,CLOSE,Y,,NO,CHATHAM,"2487, 2508","7.5 HP / 3520 RPM / TEFC / 575V/3PH/60HZ / FRAME#213TC, SEW PARALLEL SHAFT HELICAL GEAR UNIT FHZ127 R77 AM213/215",,No,CH-DRYER_D_CY2,CH-DRYER_D_CY2:TT84321.MEAS,TT-84321,TT,MEAS,Measured value (PV),Temperature transmitter,Measurement,CV1826B SPEEDOUTPUT,CV-1826B
,CHECK CONDITION OF THE PACKING IN THE STUFFING BOX,23-31647,CV-1826B,CV-1826B,,,1-10-23 10:48 AM,2023-01-10T10:48:00.000Z,1-10-23 7:00 AM,2023-01-10T07:00:00.000Z,5-19-23 2:03 PM,2023-05-19T14:03:00.000Z,2,2,,PM,CLOSE,Y,,NO,CHATHAM,"2487, 2508","7.5 HP / 3520 RPM / TEFC / 575V/3PH/60HZ / FRAME#213TC, SEW PARALLEL SHAFT HELICAL GEAR UNIT FHZ127 R77 AM213/215",,No,CH-DR_DECANT702,CH-DR_DECANT702:FY17704.OUT,FY-17704,FY,OUT,Controller output / demand (CO),Flow final element demand,Output/Demand,CV1826B CURRENT INDICATION,CV-1826B
,CHECK PACKING GLAND LUBRICANT.  ADD GREASE  AS NECESSARY,23-31648,CV-1826B,CV-1826B,,,1-10-23 10:48 AM,2023-01-10T10:48:00.000Z,1-10-23 7:00 AM,2023-01-10T07:00:00.000Z,5-19-23 2:03 PM,2023-05-19T14:03:00.000Z,2,2,,PM,CLOSE,Y,,NO,CHATHAM,"2487, 2508","7.5 HP / 3520 RPM / TEFC / 575V/3PH/60HZ / FRAME#213TC, SEW PARALLEL SHAFT HELICAL GEAR UNIT FHZ127 R77 AM213/215",,No,CH-DRA_CYCLNS,CH-DRA_CYCLNS:IT18172.MEAS,IT-18172,IT,MEAS,Measured value (PV),Current transmitter (motor amps),Measurement,CV1826B CURRENT INDICATION,CV-1826B
,CHECK PACKING GLAND LUBRICANT.  ADD GREASE  AS NECESSARY,23-31648,CV-1826B,CV-1826B,,,1-10-23 10:48 AM,2023-01-10T10:48:00.000Z,1-10-23 7:00 AM,2023-01-10T07:00:00.000Z,5-19-23 2:03 PM,2023-05-19T14:03:00.000Z,2,2,,PM,CLOSE,Y,,NO,CHATHAM,"2487, 2508","7.5 HP / 3520 RPM / TEFC / 575V/3PH/60HZ / FRAME#213TC, SEW PARALLEL SHAFT HELICAL GEAR UNIT FHZ127 R77 AM213/215",,No,CH-DRA_PROC_AIR,CH-DRA_PROC_AIR:TT18179E.MEAS,TT-18179E,TT,MEAS,Measured value (PV),Temperature transmitter,Measurement,CV1826B SPEED INDICATION,CV-1826B
,CHECK PACKING GLAND LUBRICANT.  ADD GREASE  AS NECESSARY,23-31648,CV-1826B,CV-1826B,,,1-10-23 10:48 AM,2023-01-10T10:48:00.000Z,1-10-23 7:00 AM,2023-01-10T07:00:00.000Z,5-19-23 2:03 PM,2023-05-19T14:03:00.000Z,2,2,,PM,CLOSE,Y,,NO,CHATHAM,"2487, 2508","7.5 HP / 3520 RPM / TEFC / 575V/3PH/60HZ / FRAME#213TC, SEW PARALLEL SHAFT HELICAL GEAR UNIT FHZ127 R77 AM213/215",,No,CH-DRA_COMB_AIR,CH-DRA_COMB_AIR:IT18180.MEAS,IT-18180,IT,MEAS,Measured value (PV),Current transmitter (motor amps),Measurement,CV1826B SPEED  INDICATION,CV-1826B
,CHECK PACKING GLAND LUBRICANT.  ADD GREASE  AS NECESSARY,23-31648,CV-1826B,CV-1826B,,,1-10-23 10:48 AM,2023-01-10T10:48:00.000Z,1-10-23 7:00 AM,2023-01-10T07:00:00.000Z,5-19-23 2:03 PM,2023-05-19T14:03:00.000Z,2,2,,PM,CLOSE,Y,,NO,CHATHAM,"2487, 2508","7.5 HP / 3520 RPM / TEFC / 575V/3PH/60HZ / FRAME#213TC, SEW PARALLEL SHAFT HELICAL GEAR UNIT FHZ127 R77 AM213/215",,No,CH-DRA_CYCLNS,CH-DRA_CYCLNS:XV18184.STAIND,XV-18184,XV,STAIND,"Status indication (open/closed, run/stop)",Valve/damper/door status (discrete),Status,CV1826B SPEED SWITCH,CV-1826B
,CHECK PACKING GLAND LUBRICANT.  ADD GREASE  AS NECESSARY,23-31648,CV-1826B,CV-1826B,,,1-10-23 10:48 AM,2023-01-10T10:48:00.000Z,1-10-23 7:00 AM,2023-01-10T07:00:00.000Z,5-19-23 2:03 PM,2023-05-19T14:03:00.000Z,2,2,,PM,CLOSE,Y,,NO,CHATHAM,"2487, 2508","7.5 HP / 3520 RPM / TEFC / 575V/3PH/60HZ / FRAME#213TC, SEW PARALLEL SHAFT HELICAL GEAR UNIT FHZ127 R77 AM213/215",,No,CH-DRA_COMB_AIR,CH-DRA_COMB_AIR:PT18215B.MEAS,PT-18215B,PT,MEAS,Measured value (PV),Pressure transmitter,Measurement,CV1826B SPEEDOUTPUT,CV-1826B
,CHECK PACKING GLAND LUBRICANT.  ADD GREASE  AS NECESSARY,23-31648,CV-1826B,CV-1826B,,,1-10-23 10:48 AM,2023-01-10T10:48:00.000Z,1-10-23 7:00 AM,2023-01-10T07:00:00.000Z,5-19-23 2:03 PM,2023-05-19T14:03:00.000Z,2,2,,PM,CLOSE,Y,,NO,CHATHAM,"2487, 2508","7.5 HP / 3520 RPM / TEFC / 575V/3PH/60HZ / FRAME#213TC, SEW PARALLEL SHAFT HELICAL GEAR UNIT FHZ127 R77 AM213/215",,No,CH-DRYER_A,CH-DRYER_A:CV1826B.STAIND,CV-1826B,CV,STAIND,"Status indication (open/closed, run/stop)",Conveyor (asset),Equipment status,DOSING BIN SCREW CVYR B,
,CHECK PACKING GLAND LUBRICANT.  ADD GREASE  AS NECESSARY,23-31648,CV-1826B,CV-1826B,,,1-10-23 10:48 AM,2023-01-10T10:48:00.000Z,1-10-23 7:00 AM,2023-01-10T07:00:00.000Z,5-19-23 2:03 PM,2023-05-19T14:03:00.000Z,2,2,,PM,CLOSE,Y,,NO,CHATHAM,"2487, 2508","7.5 HP / 3520 RPM / TEFC / 575V/3PH/60HZ / FRAME#213TC, SEW PARALLEL SHAFT HELICAL GEAR UNIT FHZ127 R77 AM213/215",,No,CH-DR_UTIL_WTR,CH-DR_UTIL_WTR:P1837.STAIND,P-1837,P,STAIND,"Status indication (open/closed, run/stop)",Pump (asset),Status,CV1826B CURRENT INDICATION,CV-1826B
,CHECK PACKING GLAND LUBRICANT.  ADD GREASE  AS NECESSARY,23-31648,CV-1826B,CV-1826B,,,1-10-23 10:48 AM,2023-01-10T10:48:00.000Z,1-10-23 7:00 AM,2023-01-10T07:00:00.000Z,5-19-23 2:03 PM,2023-05-19T14:03:00.000Z,2,2,,PM,CLOSE,Y,,NO,CHATHAM,"2487, 2508","7.5 HP / 3520 RPM / TEFC / 575V/3PH/60HZ / FRAME#213TC, SEW PARALLEL SHAFT HELICAL GEAR UNIT FHZ127 R77 AM213/215",,No,CH-DR_UTIL_WTR,CH-DR_UTIL_WTR:TT35451.MEAS,TT-35451,TT,MEAS,Measured value (PV),Temperature transmitter,Measurement,CV1826B CURRENT INDICATION,CV-1826B
,CHECK PACKING GLAND LUBRICANT.  ADD GREASE  AS NECESSARY,23-31648,CV-1826B,CV-1826B,,,1-10-23 10:48 AM,2023-01-10T10:48:00.000Z,1-10-23 7:00 AM,2023-01-10T07:00:00.000Z,5-19-23 2:03 PM,2023-05-19T14:03:00.000Z,2,2,,PM,CLOSE,Y,,NO,CHATHAM,"2487, 2508","7.5 HP / 3520 RPM / TEFC / 575V/3PH/60HZ / FRAME#213TC, SEW PARALLEL SHAFT HELICAL GEAR UNIT FHZ127 R77 AM213/215",,No,CH-DRYER_D,CH-DRYER_D:PIC84401.OUT,PIC-84401,PIC,OUT,Controller output / demand (CO),Pressure indicating controller,Output,D/CV1826B CURRENT INDICATION,CV-1826B
,CHECK PACKING GLAND LUBRICANT.  ADD GREASE  AS NECESSARY,23-31648,CV-1826B,CV-1826B,,,1-10-23 10:48 AM,2023-01-10T10:48:00.000Z,1-10-23 7:00 AM,2023-01-10T07:00:00.000Z,5-19-23 2:03 PM,2023-05-19T14:03:00.000Z,2,2,,PM,CLOSE,Y,,NO,CHATHAM,"2487, 2508","7.5 HP / 3520 RPM / TEFC / 575V/3PH/60HZ / FRAME#213TC, SEW PARALLEL SHAFT HELICAL GEAR UNIT FHZ127 R77 AM213/215",,No,CH-DRYER_D_BMS,CH-DRYER_D_BMS:TIC84302.MEAS,TIC-84302,TIC,MEAS,Measured value (PV),Temperature indicating controller,Measurement,CV1826B SPEED INDICATION,CV-1826B
,CHECK PACKING GLAND LUBRICANT.  ADD GREASE  AS NECESSARY,23-31648,CV-1826B,CV-1826B,,,1-10-23 10:48 AM,2023-01-10T10:48:00.000Z,1-10-23 7:00 AM,2023-01-10T07:00:00.000Z,5-19-23 2:03 PM,2023-05-19T14:03:00.000Z,2,2,,PM,CLOSE,Y,,NO,CHATHAM,"2487, 2508","7.5 HP / 3520 RPM / TEFC / 575V/3PH/60HZ / FRAME#213TC, SEW PARALLEL SHAFT HELICAL GEAR UNIT FHZ127 R77 AM213/215",,No,CH-DRYER_D_BMS,CH-DRYER_D_BMS:TIC84302.OUT,TIC-84302,TIC,OUT,Controller output (CO),Temperature indicating controller,Output,CV1826B SPEED  INDICATION,CV-1826B
,CHECK PACKING GLAND LUBRICANT.  ADD GREASE  AS NECESSARY,23-31648,CV-1826B,CV-1826B,,,1-10-23 10:48 AM,2023-01-10T10:48:00.000Z,1-10-23 7:00 AM,2023-01-10T07:00:00.000Z,5-19-23 2:03 PM,2023-05-19T14:03:00.000Z,2,2,,PM,CLOSE,Y,,NO,CHATHAM,"2487, 2508","7.5 HP / 3520 RPM / TEFC / 575V/3PH/60HZ / FRAME#213TC, SEW PARALLEL SHAFT HELICAL GEAR UNIT FHZ127 R77 AM213/215",,No,CH-DRYER_D_CY2,CH-DRYER_D_CY2:TT84313.PNT,TT-84313,TT,PNT,Point value / indication,Temperature transmitter,Measurement,CV1826B SPEED SWITCH,CV-1826B
,CHECK PACKING GLAND LUBRICANT.  ADD GREASE  AS NECESSARY,23-31648,CV-1826B,CV-1826B,,,1-10-23 10:48 AM,2023-01-10T10:48:00.000Z,1-10-23 7:00 AM,2023-01-10T07:00:00.000Z,5-19-23 2:03 PM,2023-05-19T14:03:00.000Z,2,2,,PM,CLOSE,Y,,NO,CHATHAM,"2487, 2508","7.5 HP / 3520 RPM / TEFC / 575V/3PH/60HZ / FRAME#213TC, SEW PARALLEL SHAFT HELICAL GEAR UNIT FHZ127 R77 AM213/215",,No,CH-DRYER_D_CY2,CH-DRYER_D_CY2:TT84321.MEAS,TT-84321,TT,MEAS,Measured value (PV),Temperature transmitter,Measurement,CV1826B SPEEDOUTPUT,CV-1826B
,CHECK PACKING GLAND LUBRICANT.  ADD GREASE  AS NECESSARY,23-31648,CV-1826B,CV-1826B,,,1-10-23 10:48 AM,2023-01-10T10:48:00.000Z,1-10-23 7:00 AM,2023-01-10T07:00:00.000Z,5-19-23 2:03 PM,2023-05-19T14:03:00.000Z,2,2,,PM,CLOSE,Y,,NO,CHATHAM,"2487, 2508","7.5 HP / 3520 RPM / TEFC / 575V/3PH/60HZ / FRAME#213TC, SEW PARALLEL SHAFT HELICAL GEAR UNIT FHZ127 R77 AM213/215",,No,CH-DR_DECANT702,CH-DR_DECANT702:FY17704.OUT,FY-17704,FY,OUT,Controller output / demand (CO),Flow final element demand,Output/Demand,CV1826B CURRENT INDICATION,CV-1826B
,INSPECT PILLOW BLOCK BEARINGS,23-31649,CV-1826B,CV-1826B,,,1-10-23 10:48 AM,2023-01-10T10:48:00.000Z,1-10-23 7:00 AM,2023-01-10T07:00:00.000Z,5-19-23 2:03 PM,2023-05-19T14:03:00.000Z,2,2,,PM,CLOSE,Y,,NO,CHATHAM,"2487, 2508","7.5 HP / 3520 RPM / TEFC / 575V/3PH/60HZ / FRAME#213TC, SEW PARALLEL SHAFT HELICAL GEAR UNIT FHZ127 R77 AM213/215",,No,CH-DRA_CYCLNS,CH-DRA_CYCLNS:IT18172.MEAS,IT-18172,IT,MEAS,Measured value (PV),Current transmitter (motor amps),Measurement,CV1826B CURRENT INDICATION,CV-1826B
,INSPECT PILLOW BLOCK BEARINGS,23-31649,CV-1826B,CV-1826B,,,1-10-23 10:48 AM,2023-01-10T10:48:00.000Z,1-10-23 7:00 AM,2023-01-10T07:00:00.000Z,5-19-23 2:03 PM,2023-05-19T14:03:00.000Z,2,2,,PM,CLOSE,Y,,NO,CHATHAM,"2487, 2508","7.5 HP / 3520 RPM / TEFC / 575V/3PH/60HZ / FRAME#213TC, SEW PARALLEL SHAFT HELICAL GEAR UNIT FHZ127 R77 AM213/215",,No,CH-DRA_PROC_AIR,CH-DRA_PROC_AIR:TT18179E.MEAS,TT-18179E,TT,MEAS,Measured value (PV),Temperature transmitter,Measurement,CV1826B SPEED INDICATION,CV-1826B
,INSPECT PILLOW BLOCK BEARINGS,23-31649,CV-1826B,CV-1826B,,,1-10-23 10:48 AM,2023-01-10T10:48:00.000Z,1-10-23 7:00 AM,2023-01-10T07:00:00.000Z,5-19-23 2:03 PM,2023-05-19T14:03:00.000Z,2,2,,PM,CLOSE,Y,,NO,CHATHAM,"2487, 2508","7.5 HP / 3520 RPM / TEFC / 575V/3PH/60HZ / FRAME#213TC, SEW PARALLEL SHAFT HELICAL GEAR UNIT FHZ127 R77 AM213/215",,No,CH-DRA_COMB_AIR,CH-DRA_COMB_AIR:IT18180.MEAS,IT-18180,IT,MEAS,Measured value (PV),Current transmitter (motor amps),Measurement,CV1826B SPEED  INDICATION,CV-1826B
,INSPECT PILLOW BLOCK BEARINGS,23-31649,CV-1826B,CV-1826B,,,1-10-23 10:48 AM,2023-01-10T10:48:00.000Z,1-10-23 7:00 AM,2023-01-10T07:00:00.000Z,5-19-23 2:03 PM,2023-05-19T14:03:00.000Z,2,2,,PM,CLOSE,Y,,NO,CHATHAM,"2487, 2508","7.5 HP / 3520 RPM / TEFC / 575V/3PH/60HZ / FRAME#213TC, SEW PARALLEL SHAFT HELICAL GEAR UNIT FHZ127 R77 AM213/215",,No,CH-DRA_CYCLNS,CH-DRA_CYCLNS:XV18184.STAIND,XV-18184,XV,STAIND,"Status indication (open/closed, run/stop)",Valve/damper/door status (discrete),Status,CV1826B SPEED SWITCH,CV-1826B
,INSPECT PILLOW BLOCK BEARINGS,23-31649,CV-1826B,CV-1826B,,,1-10-23 10:48 AM,2023-01-10T10:48:00.000Z,1-10-23 7:00 AM,2023-01-10T07:00:00.000Z,5-19-23 2:03 PM,2023-05-19T14:03:00.000Z,2,2,,PM,CLOSE,Y,,NO,CHATHAM,"2487, 2508","7.5 HP / 3520 RPM / TEFC / 575V/3PH/60HZ / FRAME#213TC, SEW PARALLEL SHAFT HELICAL GEAR UNIT FHZ127 R77 AM213/215",,No,CH-DRA_COMB_AIR,CH-DRA_COMB_AIR:PT18215B.MEAS,PT-18215B,PT,MEAS,Measured value (PV),Pressure transmitter,Measurement,CV1826B SPEEDOUTPUT,CV-1826B
,INSPECT PILLOW BLOCK BEARINGS,23-31649,CV-1826B,CV-1826B,,,1-10-23 10:48 AM,2023-01-10T10:48:00.000Z,1-10-23 7:00 AM,2023-01-10T07:00:00.000Z,5-19-23 2:03 PM,2023-05-19T14:03:00.000Z,2,2,,PM,CLOSE,Y,,NO,CHATHAM,"2487, 2508","7.5 HP / 3520 RPM / TEFC / 575V/3PH/60HZ / FRAME#213TC, SEW PARALLEL SHAFT HELICAL GEAR UNIT FHZ127 R77 AM213/215",,No,CH-DRYER_A,CH-DRYER_A:CV1826B.STAIND,CV-1826B,CV,STAIND,"Status indication (open/closed, run/stop)",Conveyor (asset),Equipment status,DOSING BIN SCREW CVYR B,
,INSPECT PILLOW BLOCK BEARINGS,23-31649,CV-1826B,CV-1826B,,,1-10-23 10:48 AM,2023-01-10T10:48:00.000Z,1-10-23 7:00 AM,2023-01-10T07:00:00.000Z,5-19-23 2:03 PM,2023-05-19T14:03:00.000Z,2,2,,PM,CLOSE,Y,,NO,CHATHAM,"2487, 2508","7.5 HP / 3520 RPM / TEFC / 575V/3PH/60HZ / FRAME#213TC, SEW PARALLEL SHAFT HELICAL GEAR UNIT FHZ127 R77 AM213/215",,No,CH-DR_UTIL_WTR,CH-DR_UTIL_WTR:P1837.STAIND,P-1837,P,STAIND,"Status indication (open/closed, run/stop)",Pump (asset),Status,CV1826B CURRENT INDICATION,CV-1826B
,INSPECT PILLOW BLOCK BEARINGS,23-31649,CV-1826B,CV-1826B,,,1-10-23 10:48 AM,2023-01-10T10:48:00.000Z,1-10-23 7:00 AM,2023-01-10T07:00:00.000Z,5-19-23 2:03 PM,2023-05-19T14:03:00.000Z,2,2,,PM,CLOSE,Y,,NO,CHATHAM,"2487, 2508","7.5 HP / 3520 RPM / TEFC / 575V/3PH/60HZ / FRAME#213TC, SEW PARALLEL SHAFT HELICAL GEAR UNIT FHZ127 R77 AM213/215",,No,CH-DR_UTIL_WTR,CH-DR_UTIL_WTR:TT35451.MEAS,TT-35451,TT,MEAS,Measured value (PV),Temperature transmitter,Measurement,CV1826B CURRENT INDICATION,CV-1826B
,INSPECT PILLOW BLOCK BEARINGS,23-31649,CV-1826B,CV-1826B,,,1-10-23 10:48 AM,2023-01-10T10:48:00.000Z,1-10-23 7:00 AM,2023-01-10T07:00:00.000Z,5-19-23 2:03 PM,2023-05-19T14:03:00.000Z,2,2,,PM,CLOSE,Y,,NO,CHATHAM,"2487, 2508","7.5 HP / 3520 RPM / TEFC / 575V/3PH/60HZ / FRAME#213TC, SEW PARALLEL SHAFT HELICAL GEAR UNIT FHZ127 R77 AM213/215",,No,CH-DRYER_D,CH-DRYER_D:PIC84401.OUT,PIC-84401,PIC,OUT,Controller output / demand (CO),Pressure indicating controller,Output,D/CV1826B CURRENT INDICATION,CV-1826B
,INSPECT PILLOW BLOCK BEARINGS,23-31649,CV-1826B,CV-1826B,,,1-10-23 10:48 AM,2023-01-10T10:48:00.000Z,1-10-23 7:00 AM,2023-01-10T07:00:00.000Z,5-19-23 2:03 PM,2023-05-19T14:03:00.000Z,2,2,,PM,CLOSE,Y,,NO,CHATHAM,"2487, 2508","7.5 HP / 3520 RPM / TEFC / 575V/3PH/60HZ / FRAME#213TC, SEW PARALLEL SHAFT HELICAL GEAR UNIT FHZ127 R77 AM213/215",,No,CH-DRYER_D_BMS,CH-DRYER_D_BMS:TIC84302.MEAS,TIC-84302,TIC,MEAS,Measured value (PV),Temperature indicating controller,Measurement,CV1826B SPEED INDICATION,CV-1826B
,INSPECT PILLOW BLOCK BEARINGS,23-31649,CV-1826B,CV-1826B,,,1-10-23 10:48 AM,2023-01-10T10:48:00.000Z,1-10-23 7:00 AM,2023-01-10T07:00:00.000Z,5-19-23 2:03 PM,2023-05-19T14:03:00.000Z,2,2,,PM,CLOSE,Y,,NO,CHATHAM,"2487, 2508","7.5 HP / 3520 RPM / TEFC / 575V/3PH/60HZ / FRAME#213TC, SEW PARALLEL SHAFT HELICAL GEAR UNIT FHZ127 R77 AM213/215",,No,CH-DRYER_D_BMS,CH-DRYER_D_BMS:TIC84302.OUT,TIC-84302,TIC,OUT,Controller output (CO),Temperature indicating controller,Output,CV1826B SPEED  INDICATION,CV-1826B
,INSPECT PILLOW BLOCK BEARINGS,23-31649,CV-1826B,CV-1826B,,,1-10-23 10:48 AM,2023-01-10T10:48:00.000Z,1-10-23 7:00 AM,2023-01-10T07:00:00.000Z,5-19-23 2:03 PM,2023-05-19T14:03:00.000Z,2,2,,PM,CLOSE,Y,,NO,CHATHAM,"2487, 2508","7.5 HP / 3520 RPM / TEFC / 575V/3PH/60HZ / FRAME#213TC, SEW PARALLEL SHAFT HELICAL GEAR UNIT FHZ127 R77 AM213/215",,No,CH-DRYER_D_CY2,CH-DRYER_D_CY2:TT84313.PNT,TT-84313,TT,PNT,Point value / indication,Temperature transmitter,Measurement,CV1826B SPEED SWITCH,CV-1826B
,INSPECT PILLOW BLOCK BEARINGS,23-31649,CV-1826B,CV-1826B,,,1-10-23 10:48 AM,2023-01-10T10:48:00.000Z,1-10-23 7:00 AM,2023-01-10T07:00:00.000Z,5-19-23 2:03 PM,2023-05-19T14:03:00.000Z,2,2,,PM,CLOSE,Y,,NO,CHATHAM,"2487, 2508","7.5 HP / 3520 RPM / TEFC / 575V/3PH/60HZ / FRAME#213TC, SEW PARALLEL SHAFT HELICAL GEAR UNIT FHZ127 R77 AM213/215",,No,CH-DRYER_D_CY2,CH-DRYER_D_CY2:TT84321.MEAS,TT-84321,TT,MEAS,Measured value (PV),Temperature transmitter,Measurement,CV1826B SPEEDOUTPUT,CV-1826B
,INSPECT PILLOW BLOCK BEARINGS,23-31649,CV-1826B,CV-1826B,,,1-10-23 10:48 AM,2023-01-10T10:48:00.000Z,1-10-23 7:00 AM,2023-01-10T07:00:00.000Z,5-19-23 2:03 PM,2023-05-19T14:03:00.000Z,2,2,,PM,CLOSE,Y,,NO,CHATHAM,"2487, 2508","7.5 HP / 3520 RPM / TEFC / 575V/3PH/60HZ / FRAME#213TC, SEW PARALLEL SHAFT HELICAL GEAR UNIT FHZ127 R77 AM213/215",,No,CH-DR_DECANT702,CH-DR_DECANT702:FY17704.OUT,FY-17704,FY,OUT,Controller output / demand (CO),Flow final element demand,Output/Demand,CV1826B CURRENT INDICATION,CV-1826B
,INSPECT GEARBOX,23-31650,CV-1826B,CV-1826B,,,1-10-23 10:48 AM,2023-01-10T10:48:00.000Z,1-10-23 7:00 AM,2023-01-10T07:00:00.000Z,5-19-23 2:03 PM,2023-05-19T14:03:00.000Z,2,2,,PM,CLOSE,Y,,NO,CHATHAM,"2487, 2508","7.5 HP / 3520 RPM / TEFC / 575V/3PH/60HZ / FRAME#213TC, SEW PARALLEL SHAFT HELICAL GEAR UNIT FHZ127 R77 AM213/215",,No,CH-DRA_CYCLNS,CH-DRA_CYCLNS:IT18172.MEAS,IT-18172,IT,MEAS,Measured value (PV),Current transmitter (motor amps),Measurement,CV1826B CURRENT INDICATION,CV-1826B
,INSPECT GEARBOX,23-31650,CV-1826B,CV-1826B,,,1-10-23 10:48 AM,2023-01-10T10:48:00.000Z,1-10-23 7:00 AM,2023-01-10T07:00:00.000Z,5-19-23 2:03 PM,2023-05-19T14:03:00.000Z,2,2,,PM,CLOSE,Y,,NO,CHATHAM,"2487, 2508","7.5 HP / 3520 RPM / TEFC / 575V/3PH/60HZ / FRAME#213TC, SEW PARALLEL SHAFT HELICAL GEAR UNIT FHZ127 R77 AM213/215",,No,CH-DRA_PROC_AIR,CH-DRA_PROC_AIR:TT18179E.MEAS,TT-18179E,TT,MEAS,Measured value (PV),Temperature transmitter,Measurement,CV1826B SPEED INDICATION,CV-1826B
,INSPECT GEARBOX,23-31650,CV-1826B,CV-1826B,,,1-10-23 10:48 AM,2023-01-10T10:48:00.000Z,1-10-23 7:00 AM,2023-01-10T07:00:00.000Z,5-19-23 2:03 PM,2023-05-19T14:03:00.000Z,2,2,,PM,CLOSE,Y,,NO,CHATHAM,"2487, 2508","7.5 HP / 3520 RPM / TEFC / 575V/3PH/60HZ / FRAME#213TC, SEW PARALLEL SHAFT HELICAL GEAR UNIT FHZ127 R77 AM213/215",,No,CH-DRA_COMB_AIR,CH-DRA_COMB_AIR:IT18180.MEAS,IT-18180,IT,MEAS,Measured value (PV),Current transmitter (motor amps),Measurement,CV1826B SPEED  INDICATION,CV-1826B
,INSPECT GEARBOX,23-31650,CV-1826B,CV-1826B,,,1-10-23 10:48 AM,2023-01-10T10:48:00.000Z,1-10-23 7:00 AM,2023-01-10T07:00:00.000Z,5-19-23 2:03 PM,2023-05-19T14:03:00.000Z,2,2,,PM,CLOSE,Y,,NO,CHATHAM,"2487, 2508","7.5 HP / 3520 RPM / TEFC / 575V/3PH/60HZ / FRAME#213TC, SEW PARALLEL SHAFT HELICAL GEAR UNIT FHZ127 R77 AM213/215",,No,CH-DRA_CYCLNS,CH-DRA_CYCLNS:XV18184.STAIND,XV-18184,XV,STAIND,"Status indication (open/closed, run/stop)",Valve/damper/door status (discrete),Status,CV1826B SPEED SWITCH,CV-1826B
,INSPECT GEARBOX,23-31650,CV-1826B,CV-1826B,,,1-10-23 10:48 AM,2023-01-10T10:48:00.000Z,1-10-23 7:00 AM,2023-01-10T07:00:00.000Z,5-19-23 2:03 PM,2023-05-19T14:03:00.000Z,2,2,,PM,CLOSE,Y,,NO,CHATHAM,"2487, 2508","7.5 HP / 3520 RPM / TEFC / 575V/3PH/60HZ / FRAME#213TC, SEW PARALLEL SHAFT HELICAL GEAR UNIT FHZ127 R77 AM213/215",,No,CH-DRA_COMB_AIR,CH-DRA_COMB_AIR:PT18215B.MEAS,PT-18215B,PT,MEAS,Measured value (PV),Pressure transmitter,Measurement,CV1826B SPEEDOUTPUT,CV-1826B
,INSPECT GEARBOX,23-31650,CV-1826B,CV-1826B,,,1-10-23 10:48 AM,2023-01-10T10:48:00.000Z,1-10-23 7:00 AM,2023-01-10T07:00:00.000Z,5-19-23 2:03 PM,2023-05-19T14:03:00.000Z,2,2,,PM,CLOSE,Y,,NO,CHATHAM,"2487, 2508","7.5 HP / 3520 RPM / TEFC / 575V/3PH/60HZ / FRAME#213TC, SEW PARALLEL SHAFT HELICAL GEAR UNIT FHZ127 R77 AM213/215",,No,CH-DRYER_A,CH-DRYER_A:CV1826B.STAIND,CV-1826B,CV,STAIND,"Status indication (open/closed, run/stop)",Conveyor (asset),Equipment status,DOSING BIN SCREW CVYR B,
,INSPECT GEARBOX,23-31650,CV-1826B,CV-1826B,,,1-10-23 10:48 AM,2023-01-10T10:48:00.000Z,1-10-23 7:00 AM,2023-01-10T07:00:00.000Z,5-19-23 2:03 PM,2023-05-19T14:03:00.000Z,2,2,,PM,CLOSE,Y,,NO,CHATHAM,"2487, 2508","7.5 HP / 3520 RPM / TEFC / 575V/3PH/60HZ / FRAME#213TC, SEW PARALLEL SHAFT HELICAL GEAR UNIT FHZ127 R77 AM213/215",,No,CH-DR_UTIL_WTR,CH-DR_UTIL_WTR:P1837.STAIND,P-1837,P,STAIND,"Status indication (open/closed, run/stop)",Pump (asset),Status,CV1826B CURRENT INDICATION,CV-1826B
,INSPECT GEARBOX,23-31650,CV-1826B,CV-1826B,,,1-10-23 10:48 AM,2023-01-10T10:48:00.000Z,1-10-23 7:00 AM,2023-01-10T07:00:00.000Z,5-19-23 2:03 PM,2023-05-19T14:03:00.000Z,2,2,,PM,CLOSE,Y,,NO,CHATHAM,"2487, 2508","7.5 HP / 3520 RPM / TEFC / 575V/3PH/60HZ / FRAME#213TC, SEW PARALLEL SHAFT HELICAL GEAR UNIT FHZ127 R77 AM213/215",,No,CH-DR_UTIL_WTR,CH-DR_UTIL_WTR:TT35451.MEAS,TT-35451,TT,MEAS,Measured value (PV),Temperature transmitter,Measurement,CV1826B CURRENT INDICATION,CV-1826B
,INSPECT GEARBOX,23-31650,CV-1826B,CV-1826B,,,1-10-23 10:48 AM,2023-01-10T10:48:00.000Z,1-10-23 7:00 AM,2023-01-10T07:00:00.000Z,5-19-23 2:03 PM,2023-05-19T14:03:00.000Z,2,2,,PM,CLOSE,Y,,NO,CHATHAM,"2487, 2508","7.5 HP / 3520 RPM / TEFC / 575V/3PH/60HZ / FRAME#213TC, SEW PARALLEL SHAFT HELICAL GEAR UNIT FHZ127 R77 AM213/215",,No,CH-DRYER_D,CH-DRYER_D:PIC84401.OUT,PIC-84401,PIC,OUT,Controller output / demand (CO),Pressure indicating controller,Output,D/CV1826B CURRENT INDICATION,CV-1826B
,INSPECT GEARBOX,23-31650,CV-1826B,CV-1826B,,,1-10-23 10:48 AM,2023-01-10T10:48:00.000Z,1-10-23 7:00 AM,2023-01-10T07:00:00.000Z,5-19-23 2:03 PM,2023-05-19T14:03:00.000Z,2,2,,PM,CLOSE,Y,,NO,CHATHAM,"2487, 2508","7.5 HP / 3520 RPM / TEFC / 575V/3PH/60HZ / FRAME#213TC, SEW PARALLEL SHAFT HELICAL GEAR UNIT FHZ127 R77 AM213/215",,No,CH-DRYER_D_BMS,CH-DRYER_D_BMS:TIC84302.MEAS,TIC-84302,TIC,MEAS,Measured value (PV),Temperature indicating controller,Measurement,CV1826B SPEED INDICATION,CV-1826B
,INSPECT GEARBOX,23-31650,CV-1826B,CV-1826B,,,1-10-23 10:48 AM,2023-01-10T10:48:00.000Z,1-10-23 7:00 AM,2023-01-10T07:00:00.000Z,5-19-23 2:03 PM,2023-05-19T14:03:00.000Z,2,2,,PM,CLOSE,Y,,NO,CHATHAM,"2487, 2508","7.5 HP / 3520 RPM / TEFC / 575V/3PH/60HZ / FRAME#213TC, SEW PARALLEL SHAFT HELICAL GEAR UNIT FHZ127 R77 AM213/215",,No,CH-DRYER_D_BMS,CH-DRYER_D_BMS:TIC84302.OUT,TIC-84302,TIC,OUT,Controller output (CO),Temperature indicating controller,Output,CV1826B SPEED  INDICATION,CV-1826B
,INSPECT GEARBOX,23-31650,CV-1826B,CV-1826B,,,1-10-23 10:48 AM,2023-01-10T10:48:00.000Z,1-10-23 7:00 AM,2023-01-10T07:00:00.000Z,5-19-23 2:03 PM,2023-05-19T14:03:00.000Z,2,2,,PM,CLOSE,Y,,NO,CHATHAM,"2487, 2508","7.5 HP / 3520 RPM / TEFC / 575V/3PH/60HZ / FRAME#213TC, SEW PARALLEL SHAFT HELICAL GEAR UNIT FHZ127 R77 AM213/215",,No,CH-DRYER_D_CY2,CH-DRYER_D_CY2:TT84313.PNT,TT-84313,TT,PNT,Point value / indication,Temperature transmitter,Measurement,CV1826B SPEED SWITCH,CV-1826B
,INSPECT GEARBOX,23-31650,CV-1826B,CV-1826B,,,1-10-23 10:48 AM,2023-01-10T10:48:00.000Z,1-10-23 7:00 AM,2023-01-10T07:00:00.000Z,5-19-23 2:03 PM,2023-05-19T14:03:00.000Z,2,2,,PM,CLOSE,Y,,NO,CHATHAM,"2487, 2508","7.5 HP / 3520 RPM / TEFC / 575V/3PH/60HZ / FRAME#213TC, SEW PARALLEL SHAFT HELICAL GEAR UNIT FHZ127 R77 AM213/215",,No,CH-DRYER_D_CY2,CH-DRYER_D_CY2:TT84321.MEAS,TT-84321,TT,MEAS,Measured value (PV),Temperature transmitter,Measurement,CV1826B SPEEDOUTPUT,CV-1826B
,INSPECT GEARBOX,23-31650,CV-1826B,CV-1826B,,,1-10-23 10:48 AM,2023-01-10T10:48:00.000Z,1-10-23 7:00 AM,2023-01-10T07:00:00.000Z,5-19-23 2:03 PM,2023-05-19T14:03:00.000Z,2,2,,PM,CLOSE,Y,,NO,CHATHAM,"2487, 2508","7.5 HP / 3520 RPM / TEFC / 575V/3PH/60HZ / FRAME#213TC, SEW PARALLEL SHAFT HELICAL GEAR UNIT FHZ127 R77 AM213/215",,No,CH-DR_DECANT702,CH-DR_DECANT702:FY17704.OUT,FY-17704,FY,OUT,Controller output / demand (CO),Flow final element demand,Output/Demand,CV1826B CURRENT INDICATION,CV-1826B
,INSPECT SCREW CONVEYOR,23-31651,CV-1826B,CV-1826B,,,1-10-23 10:48 AM,2023-01-10T10:48:00.000Z,1-10-23 7:00 AM,2023-01-10T07:00:00.000Z,5-19-23 2:03 PM,2023-05-19T14:03:00.000Z,2,2,,PM,CLOSE,Y,,NO,CHATHAM,"2487, 2508","7.5 HP / 3520 RPM / TEFC / 575V/3PH/60HZ / FRAME#213TC, SEW PARALLEL SHAFT HELICAL GEAR UNIT FHZ127 R77 AM213/215",,No,CH-DRA_CYCLNS,CH-DRA_CYCLNS:IT18172.MEAS,IT-18172,IT,MEAS,Measured value (PV),Current transmitter (motor amps),Measurement,CV1826B CURRENT INDICATION,CV-1826B
,INSPECT SCREW CONVEYOR,23-31651,CV-1826B,CV-1826B,,,1-10-23 10:48 AM,2023-01-10T10:48:00.000Z,1-10-23 7:00 AM,2023-01-10T07:00:00.000Z,5-19-23 2:03 PM,2023-05-19T14:03:00.000Z,2,2,,PM,CLOSE,Y,,NO,CHATHAM,"2487, 2508","7.5 HP / 3520 RPM / TEFC / 575V/3PH/60HZ / FRAME#213TC, SEW PARALLEL SHAFT HELICAL GEAR UNIT FHZ127 R77 AM213/215",,No,CH-DRA_PROC_AIR,CH-DRA_PROC_AIR:TT18179E.MEAS,TT-18179E,TT,MEAS,Measured value (PV),Temperature transmitter,Measurement,CV1826B SPEED INDICATION,CV-1826B
,INSPECT SCREW CONVEYOR,23-31651,CV-1826B,CV-1826B,,,1-10-23 10:48 AM,2023-01-10T10:48:00.000Z,1-10-23 7:00 AM,2023-01-10T07:00:00.000Z,5-19-23 2:03 PM,2023-05-19T14:03:00.000Z,2,2,,PM,CLOSE,Y,,NO,CHATHAM,"2487, 2508","7.5 HP / 3520 RPM / TEFC / 575V/3PH/60HZ / FRAME#213TC, SEW PARALLEL SHAFT HELICAL GEAR UNIT FHZ127 R77 AM213/215",,No,CH-DRA_COMB_AIR,CH-DRA_COMB_AIR:IT18180.MEAS,IT-18180,IT,MEAS,Measured value (PV),Current transmitter (motor amps),Measurement,CV1826B SPEED  INDICATION,CV-1826B
,INSPECT SCREW CONVEYOR,23-31651,CV-1826B,CV-1826B,,,1-10-23 10:48 AM,2023-01-10T10:48:00.000Z,1-10-23 7:00 AM,2023-01-10T07:00:00.000Z,5-19-23 2:03 PM,2023-05-19T14:03:00.000Z,2,2,,PM,CLOSE,Y,,NO,CHATHAM,"2487, 2508","7.5 HP / 3520 RPM / TEFC / 575V/3PH/60HZ / FRAME#213TC, SEW PARALLEL SHAFT HELICAL GEAR UNIT FHZ127 R77 AM213/215",,No,CH-DRA_CYCLNS,CH-DRA_CYCLNS:XV18184.STAIND,XV-18184,XV,STAIND,"Status indication (open/closed, run/stop)",Valve/damper/door status (discrete),Status,CV1826B SPEED SWITCH,CV-1826B
,INSPECT SCREW CONVEYOR,23-31651,CV-1826B,CV-1826B,,,1-10-23 10:48 AM,2023-01-10T10:48:00.000Z,1-10-23 7:00 AM,2023-01-10T07:00:00.000Z,5-19-23 2:03 PM,2023-05-19T14:03:00.000Z,2,2,,PM,CLOSE,Y,,NO,CHATHAM,"2487, 2508","7.5 HP / 3520 RPM / TEFC / 575V/3PH/60HZ / FRAME#213TC, SEW PARALLEL SHAFT HELICAL GEAR UNIT FHZ127 R77 AM213/215",,No,CH-DRA_COMB_AIR,CH-DRA_COMB_AIR:PT18215B.MEAS,PT-18215B,PT,MEAS,Measured value (PV),Pressure transmitter,Measurement,CV1826B SPEEDOUTPUT,CV-1826B
,INSPECT SCREW CONVEYOR,23-31651,CV-1826B,CV-1826B,,,1-10-23 10:48 AM,2023-01-10T10:48:00.000Z,1-10-23 7:00 AM,2023-01-10T07:00:00.000Z,5-19-23 2:03 PM,2023-05-19T14:03:00.000Z,2,2,,PM,CLOSE,Y,,NO,CHATHAM,"2487, 2508","7.5 HP / 3520 RPM / TEFC / 575V/3PH/60HZ / FRAME#213TC, SEW PARALLEL SHAFT HELICAL GEAR UNIT FHZ127 R77 AM213/215",,No,CH-DRYER_A,CH-DRYER_A:CV1826B.STAIND,CV-1826B,CV,STAIND,"Status indication (open/closed, run/stop)",Conveyor (asset),Equipment status,DOSING BIN SCREW CVYR B,
,INSPECT SCREW CONVEYOR,23-31651,CV-1826B,CV-1826B,,,1-10-23 10:48 AM,2023-01-10T10:48:00.000Z,1-10-23 7:00 AM,2023-01-10T07:00:00.000Z,5-19-23 2:03 PM,2023-05-19T14:03:00.000Z,2,2,,PM,CLOSE,Y,,NO,CHATHAM,"2487, 2508","7.5 HP / 3520 RPM / TEFC / 575V/3PH/60HZ / FRAME#213TC, SEW PARALLEL SHAFT HELICAL GEAR UNIT FHZ127 R77 AM213/215",,No,CH-DR_UTIL_WTR,CH-DR_UTIL_WTR:P1837.STAIND,P-1837,P,STAIND,"Status indication (open/closed, run/stop)",Pump (asset),Status,CV1826B CURRENT INDICATION,CV-1826B
,INSPECT SCREW CONVEYOR,23-31651,CV-1826B,CV-1826B,,,1-10-23 10:48 AM,2023-01-10T10:48:00.000Z,1-10-23 7:00 AM,2023-01-10T07:00:00.000Z,5-19-23 2:03 PM,2023-05-19T14:03:00.000Z,2,2,,PM,CLOSE,Y,,NO,CHATHAM,"2487, 2508","7.5 HP / 3520 RPM / TEFC / 575V/3PH/60HZ / FRAME#213TC, SEW PARALLEL SHAFT HELICAL GEAR UNIT FHZ127 R77 AM213/215",,No,CH-DR_UTIL_WTR,CH-DR_UTIL_WTR:TT35451.MEAS,TT-35451,TT,MEAS,Measured value (PV),Temperature transmitter,Measurement,CV1826B CURRENT INDICATION,CV-1826B
,INSPECT SCREW CONVEYOR,23-31651,CV-1826B,CV-1826B,,,1-10-23 10:48 AM,2023-01-10T10:48:00.000Z,1-10-23 7:00 AM,2023-01-10T07:00:00.000Z,5-19-23 2:03 PM,2023-05-19T14:03:00.000Z,2,2,,PM,CLOSE,Y,,NO,CHATHAM,"2487, 2508","7.5 HP / 3520 RPM / TEFC / 575V/3PH/60HZ / FRAME#213TC, SEW PARALLEL SHAFT HELICAL GEAR UNIT FHZ127 R77 AM213/215",,No,CH-DRYER_D,CH-DRYER_D:PIC84401.OUT,PIC-84401,PIC,OUT,Controller output / demand (CO),Pressure indicating controller,Output,D/CV1826B CURRENT INDICATION,CV-1826B
,INSPECT SCREW CONVEYOR,23-31651,CV-1826B,CV-1826B,,,1-10-23 10:48 AM,2023-01-10T10:48:00.000Z,1-10-23 7:00 AM,2023-01-10T07:00:00.000Z,5-19-23 2:03 PM,2023-05-19T14:03:00.000Z,2,2,,PM,CLOSE,Y,,NO,CHATHAM,"2487, 2508","7.5 HP / 3520 RPM / TEFC / 575V/3PH/60HZ / FRAME#213TC, SEW PARALLEL SHAFT HELICAL GEAR UNIT FHZ127 R77 AM213/215",,No,CH-DRYER_D_BMS,CH-DRYER_D_BMS:TIC84302.MEAS,TIC-84302,TIC,MEAS,Measured value (PV),Temperature indicating controller,Measurement,CV1826B SPEED INDICATION,CV-1826B
,INSPECT SCREW CONVEYOR,23-31651,CV-1826B,CV-1826B,,,1-10-23 10:48 AM,2023-01-10T10:48:00.000Z,1-10-23 7:00 AM,2023-01-10T07:00:00.000Z,5-19-23 2:03 PM,2023-05-19T14:03:00.000Z,2,2,,PM,CLOSE,Y,,NO,CHATHAM,"2487, 2508","7.5 HP / 3520 RPM / TEFC / 575V/3PH/60HZ / FRAME#213TC, SEW PARALLEL SHAFT HELICAL GEAR UNIT FHZ127 R77 AM213/215",,No,CH-DRYER_D_BMS,CH-DRYER_D_BMS:TIC84302.OUT,TIC-84302,TIC,OUT,Controller output (CO),Temperature indicating controller,Output,CV1826B SPEED  INDICATION,CV-1826B
,INSPECT SCREW CONVEYOR,23-31651,CV-1826B,CV-1826B,,,1-10-23 10:48 AM,2023-01-10T10:48:00.000Z,1-10-23 7:00 AM,2023-01-10T07:00:00.000Z,5-19-23 2:03 PM,2023-05-19T14:03:00.000Z,2,2,,PM,CLOSE,Y,,NO,CHATHAM,"2487, 2508","7.5 HP / 3520 RPM / TEFC / 575V/3PH/60HZ / FRAME#213TC, SEW PARALLEL SHAFT HELICAL GEAR UNIT FHZ127 R77 AM213/215",,No,CH-DRYER_D_CY2,CH-DRYER_D_CY2:TT84313.PNT,TT-84313,TT,PNT,Point value / indication,Temperature transmitter,Measurement,CV1826B SPEED SWITCH,CV-1826B
,INSPECT SCREW CONVEYOR,23-31651,CV-1826B,CV-1826B,,,1-10-23 10:48 AM,2023-01-10T10:48:00.000Z,1-10-23 7:00 AM,2023-01-10T07:00:00.000Z,5-19-23 2:03 PM,2023-05-19T14:03:00.000Z,2,2,,PM,CLOSE,Y,,NO,CHATHAM,"2487, 2508","7.5 HP / 3520 RPM / TEFC / 575V/3PH/60HZ / FRAME#213TC, SEW PARALLEL SHAFT HELICAL GEAR UNIT FHZ127 R77 AM213/215",,No,CH-DRYER_D_CY2,CH-DRYER_D_CY2:TT84321.MEAS,TT-84321,TT,MEAS,Measured value (PV),Temperature transmitter,Measurement,CV1826B SPEEDOUTPUT,CV-1826B
,INSPECT SCREW CONVEYOR,23-31651,CV-1826B,CV-1826B,,,1-10-23 10:48 AM,2023-01-10T10:48:00.000Z,1-10-23 7:00 AM,2023-01-10T07:00:00.000Z,5-19-23 2:03 PM,2023-05-19T14:03:00.000Z,2,2,,PM,CLOSE,Y,,NO,CHATHAM,"2487, 2508","7.5 HP / 3520 RPM / TEFC / 575V/3PH/60HZ / FRAME#213TC, SEW PARALLEL SHAFT HELICAL GEAR UNIT FHZ127 R77 AM213/215",,No,CH-DR_DECANT702,CH-DR_DECANT702:FY17704.OUT,FY-17704,FY,OUT,Controller output / demand (CO),Flow final element demand,Output/Demand,CV1826B CURRENT INDICATION,CV-1826B
,INSPECT CONVEYOR TROUGH,23-31652,CV-1826B,CV-1826B,,,1-10-23 10:48 AM,2023-01-10T10:48:00.000Z,1-10-23 7:00 AM,2023-01-10T07:00:00.000Z,5-19-23 2:03 PM,2023-05-19T14:03:00.000Z,2,2,,PM,CLOSE,Y,,NO,CHATHAM,"2487, 2508","7.5 HP / 3520 RPM / TEFC / 575V/3PH/60HZ / FRAME#213TC, SEW PARALLEL SHAFT HELICAL GEAR UNIT FHZ127 R77 AM213/215",,No,CH-DRA_CYCLNS,CH-DRA_CYCLNS:IT18172.MEAS,IT-18172,IT,MEAS,Measured value (PV),Current transmitter (motor amps),Measurement,CV1826B CURRENT INDICATION,CV-1826B
,INSPECT CONVEYOR TROUGH,23-31652,CV-1826B,CV-1826B,,,1-10-23 10:48 AM,2023-01-10T10:48:00.000Z,1-10-23 7:00 AM,2023-01-10T07:00:00.000Z,5-19-23 2:03 PM,2023-05-19T14:03:00.000Z,2,2,,PM,CLOSE,Y,,NO,CHATHAM,"2487, 2508","7.5 HP / 3520 RPM / TEFC / 575V/3PH/60HZ / FRAME#213TC, SEW PARALLEL SHAFT HELICAL GEAR UNIT FHZ127 R77 AM213/215",,No,CH-DRA_PROC_AIR,CH-DRA_PROC_AIR:TT18179E.MEAS,TT-18179E,TT,MEAS,Measured value (PV),Temperature transmitter,Measurement,CV1826B SPEED INDICATION,CV-1826B
,INSPECT CONVEYOR TROUGH,23-31652,CV-1826B,CV-1826B,,,1-10-23 10:48 AM,2023-01-10T10:48:00.000Z,1-10-23 7:00 AM,2023-01-10T07:00:00.000Z,5-19-23 2:03 PM,2023-05-19T14:03:00.000Z,2,2,,PM,CLOSE,Y,,NO,CHATHAM,"2487, 2508","7.5 HP / 3520 RPM / TEFC / 575V/3PH/60HZ / FRAME#213TC, SEW PARALLEL SHAFT HELICAL GEAR UNIT FHZ127 R77 AM213/215",,No,CH-DRA_COMB_AIR,CH-DRA_COMB_AIR:IT18180.MEAS,IT-18180,IT,MEAS,Measured value (PV),Current transmitter (motor amps),Measurement,CV1826B SPEED  INDICATION,CV-1826B
,INSPECT CONVEYOR TROUGH,23-31652,CV-1826B,CV-1826B,,,1-10-23 10:48 AM,2023-01-10T10:48:00.000Z,1-10-23 7:00 AM,2023-01-10T07:00:00.000Z,5-19-23 2:03 PM,2023-05-19T14:03:00.000Z,2,2,,PM,CLOSE,Y,,NO,CHATHAM,"2487, 2508","7.5 HP / 3520 RPM / TEFC / 575V/3PH/60HZ / FRAME#213TC, SEW PARALLEL SHAFT HELICAL GEAR UNIT FHZ127 R77 AM213/215",,No,CH-DRA_CYCLNS,CH-DRA_CYCLNS:XV18184.STAIND,XV-18184,XV,STAIND,"Status indication (open/closed, run/stop)",Valve/damper/door status (discrete),Status,CV1826B SPEED SWITCH,CV-1826B
,INSPECT CONVEYOR TROUGH,23-31652,CV-1826B,CV-1826B,,,1-10-23 10:48 AM,2023-01-10T10:48:00.000Z,1-10-23 7:00 AM,2023-01-10T07:00:00.000Z,5-19-23 2:03 PM,2023-05-19T14:03:00.000Z,2,2,,PM,CLOSE,Y,,NO,CHATHAM,"2487, 2508","7.5 HP / 3520 RPM / TEFC / 575V/3PH/60HZ / FRAME#213TC, SEW PARALLEL SHAFT HELICAL GEAR UNIT FHZ127 R77 AM213/215",,No,CH-DRA_COMB_AIR,CH-DRA_COMB_AIR:PT18215B.MEAS,PT-18215B,PT,MEAS,Measured value (PV),Pressure transmitter,Measurement,CV1826B SPEEDOUTPUT,CV-1826B
,INSPECT CONVEYOR TROUGH,23-31652,CV-1826B,CV-1826B,,,1-10-23 10:48 AM,2023-01-10T10:48:00.000Z,1-10-23 7:00 AM,2023-01-10T07:00:00.000Z,5-19-23 2:03 PM,2023-05-19T14:03:00.000Z,2,2,,PM,CLOSE,Y,,NO,CHATHAM,"2487, 2508","7.5 HP / 3520 RPM / TEFC / 575V/3PH/60HZ / FRAME#213TC, SEW PARALLEL SHAFT HELICAL GEAR UNIT FHZ127 R77 AM213/215",,No,CH-DRYER_A,CH-DRYER_A:CV1826B.STAIND,CV-1826B,CV,STAIND,"Status indication (open/closed, run/stop)",Conveyor (asset),Equipment status,DOSING BIN SCREW CVYR B,
,INSPECT CONVEYOR TROUGH,23-31652,CV-1826B,CV-1826B,,,1-10-23 10:48 AM,2023-01-10T10:48:00.000Z,1-10-23 7:00 AM,2023-01-10T07:00:00.000Z,5-19-23 2:03 PM,2023-05-19T14:03:00.000Z,2,2,,PM,CLOSE,Y,,NO,CHATHAM,"2487, 2508","7.5 HP / 3520 RPM / TEFC / 575V/3PH/60HZ / FRAME#213TC, SEW PARALLEL SHAFT HELICAL GEAR UNIT FHZ127 R77 AM213/215",,No,CH-DR_UTIL_WTR,CH-DR_UTIL_WTR:P1837.STAIND,P-1837,P,STAIND,"Status indication (open/closed, run/stop)",Pump (asset),Status,CV1826B CURRENT INDICATION,CV-1826B
,INSPECT CONVEYOR TROUGH,23-31652,CV-1826B,CV-1826B,,,1-10-23 10:48 AM,2023-01-10T10:48:00.000Z,1-10-23 7:00 AM,2023-01-10T07:00:00.000Z,5-19-23 2:03 PM,2023-05-19T14:03:00.000Z,2,2,,PM,CLOSE,Y,,NO,CHATHAM,"2487, 2508","7.5 HP / 3520 RPM / TEFC / 575V/3PH/60HZ / FRAME#213TC, SEW PARALLEL SHAFT HELICAL GEAR UNIT FHZ127 R77 AM213/215",,No,CH-DR_UTIL_WTR,CH-DR_UTIL_WTR:TT35451.MEAS,TT-35451,TT,MEAS,Measured value (PV),Temperature transmitter,Measurement,CV1826B CURRENT INDICATION,CV-1826B
,INSPECT CONVEYOR TROUGH,23-31652,CV-1826B,CV-1826B,,,1-10-23 10:48 AM,2023-01-10T10:48:00.000Z,1-10-23 7:00 AM,2023-01-10T07:00:00.000Z,5-19-23 2:03 PM,2023-05-19T14:03:00.000Z,2,2,,PM,CLOSE,Y,,NO,CHATHAM,"2487, 2508","7.5 HP / 3520 RPM / TEFC / 575V/3PH/60HZ / FRAME#213TC, SEW PARALLEL SHAFT HELICAL GEAR UNIT FHZ127 R77 AM213/215",,No,CH-DRYER_D,CH-DRYER_D:PIC84401.OUT,PIC-84401,PIC,OUT,Controller output / demand (CO),Pressure indicating controller,Output,D/CV1826B CURRENT INDICATION,CV-1826B
,INSPECT CONVEYOR TROUGH,23-31652,CV-1826B,CV-1826B,,,1-10-23 10:48 AM,2023-01-10T10:48:00.000Z,1-10-23 7:00 AM,2023-01-10T07:00:00.000Z,5-19-23 2:03 PM,2023-05-19T14:03:00.000Z,2,2,,PM,CLOSE,Y,,NO,CHATHAM,"2487, 2508","7.5 HP / 3520 RPM / TEFC / 575V/3PH/60HZ / FRAME#213TC, SEW PARALLEL SHAFT HELICAL GEAR UNIT FHZ127 R77 AM213/215",,No,CH-DRYER_D_BMS,CH-DRYER_D_BMS:TIC84302.MEAS,TIC-84302,TIC,MEAS,Measured value (PV),Temperature indicating controller,Measurement,CV1826B SPEED INDICATION,CV-1826B
,INSPECT CONVEYOR TROUGH,23-31652,CV-1826B,CV-1826B,,,1-10-23 10:48 AM,2023-01-10T10:48:00.000Z,1-10-23 7:00 AM,2023-01-10T07:00:00.000Z,5-19-23 2:03 PM,2023-05-19T14:03:00.000Z,2,2,,PM,CLOSE,Y,,NO,CHATHAM,"2487, 2508","7.5 HP / 3520 RPM / TEFC / 575V/3PH/60HZ / FRAME#213TC, SEW PARALLEL SHAFT HELICAL GEAR UNIT FHZ127 R77 AM213/215",,No,CH-DRYER_D_BMS,CH-DRYER_D_BMS:TIC84302.OUT,TIC-84302,TIC,OUT,Controller output (CO),Temperature indicating controller,Output,CV1826B SPEED  INDICATION,CV-1826B
,INSPECT CONVEYOR TROUGH,23-31652,CV-1826B,CV-1826B,,,1-10-23 10:48 AM,2023-01-10T10:48:00.000Z,1-10-23 7:00 AM,2023-01-10T07:00:00.000Z,5-19-23 2:03 PM,2023-05-19T14:03:00.000Z,2,2,,PM,CLOSE,Y,,NO,CHATHAM,"2487, 2508","7.5 HP / 3520 RPM / TEFC / 575V/3PH/60HZ / FRAME#213TC, SEW PARALLEL SHAFT HELICAL GEAR UNIT FHZ127 R77 AM213/215",,No,CH-DRYER_D_CY2,CH-DRYER_D_CY2:TT84313.PNT,TT-84313,TT,PNT,Point value / indication,Temperature transmitter,Measurement,CV1826B SPEED SWITCH,CV-1826B
,INSPECT CONVEYOR TROUGH,23-31652,CV-1826B,CV-1826B,,,1-10-23 10:48 AM,2023-01-10T10:48:00.000Z,1-10-23 7:00 AM,2023-01-10T07:00:00.000Z,5-19-23 2:03 PM,2023-05-19T14:03:00.000Z,2,2,,PM,CLOSE,Y,,NO,CHATHAM,"2487, 2508","7.5 HP / 3520 RPM / TEFC / 575V/3PH/60HZ / FRAME#213TC, SEW PARALLEL SHAFT HELICAL GEAR UNIT FHZ127 R77 AM213/215",,No,CH-DRYER_D_CY2,CH-DRYER_D_CY2:TT84321.MEAS,TT-84321,TT,MEAS,Measured value (PV),Temperature transmitter,Measurement,CV1826B SPEEDOUTPUT,CV-1826B
,INSPECT CONVEYOR TROUGH,23-31652,CV-1826B,CV-1826B,,,1-10-23 10:48 AM,2023-01-10T10:48:00.000Z,1-10-23 7:00 AM,2023-01-10T07:00:00.000Z,5-19-23 2:03 PM,2023-05-19T14:03:00.000Z,2,2,,PM,CLOSE,Y,,NO,CHATHAM,"2487, 2508","7.5 HP / 3520 RPM / TEFC / 575V/3PH/60HZ / FRAME#213TC, SEW PARALLEL SHAFT HELICAL GEAR UNIT FHZ127 R77 AM213/215",,No,CH-DR_DECANT702,CH-DR_DECANT702:FY17704.OUT,FY-17704,FY,OUT,Controller output / demand (CO),Flow final element demand,Output/Demand,CV1826B CURRENT INDICATION,CV-1826B
,CV-1826A MECHANICAL PM,23-31653,CV-1826A,CV-1826A,,,1-10-23 10:51 AM,2023-01-10T10:51:00.000Z,1-10-23 10:00 AM,2023-01-10T10:00:00.000Z,1-10-23 10:53 AM,2023-01-10T10:53:00.000Z,2,2,,PM,CLOSE,Y,N,NO,CHATHAM,"2486, 2507","7.5 HP / 3520 RPM / TEFC / 575V/3PH/60HZ / FRAME#213TC, SEW PARALLEL SHAFT HELICAL GEAR UNIT FHZ127 R77 AM213/215",,No,CH-DRA_CYCLNS,CH-DRA_CYCLNS:SSL18171.CIN,SSL-18171,SSL,CIN,Contact input (discrete),Speed switch (motion proof),Discrete Input,CV1826A CURRENT INDICATION,CV-1826A
,CV-1826A MECHANICAL PM,23-31653,CV-1826A,CV-1826A,,,1-10-23 10:51 AM,2023-01-10T10:51:00.000Z,1-10-23 10:00 AM,2023-01-10T10:00:00.000Z,1-10-23 10:53 AM,2023-01-10T10:53:00.000Z,2,2,,PM,CLOSE,Y,N,NO,CHATHAM,"2486, 2507","7.5 HP / 3520 RPM / TEFC / 575V/3PH/60HZ / FRAME#213TC, SEW PARALLEL SHAFT HELICAL GEAR UNIT FHZ127 R77 AM213/215",,No,CH-DRA_COMB_AIR,CH-DRA_COMB_AIR:XV18183.STAIND,XV-18183,XV,STAIND,"Status indication (open/closed, run/stop)",Valve/damper/door status (discrete),Status,CV1826A SPEED SWITCH,CV-1826A
,CV-1826A MECHANICAL PM,23-31653,CV-1826A,CV-1826A,,,1-10-23 10:51 AM,2023-01-10T10:51:00.000Z,1-10-23 10:00 AM,2023-01-10T10:00:00.000Z,1-10-23 10:53 AM,2023-01-10T10:53:00.000Z,2,2,,PM,CLOSE,Y,N,NO,CHATHAM,"2486, 2507","7.5 HP / 3520 RPM / TEFC / 575V/3PH/60HZ / FRAME#213TC, SEW PARALLEL SHAFT HELICAL GEAR UNIT FHZ127 R77 AM213/215",,No,CH-DRA_COMB_AIR,CH-DRA_COMB_AIR:PT18215A.MEAS,PT-18215A,PT,MEAS,Measured value (PV),Pressure transmitter,Measurement,CV1826A SPEEDOUTPUT,CV-1826A
,CV-1826A MECHANICAL PM,23-31653,CV-1826A,CV-1826A,,,1-10-23 10:51 AM,2023-01-10T10:51:00.000Z,1-10-23 10:00 AM,2023-01-10T10:00:00.000Z,1-10-23 10:53 AM,2023-01-10T10:53:00.000Z,2,2,,PM,CLOSE,Y,N,NO,CHATHAM,"2486, 2507","7.5 HP / 3520 RPM / TEFC / 575V/3PH/60HZ / FRAME#213TC, SEW PARALLEL SHAFT HELICAL GEAR UNIT FHZ127 R77 AM213/215",,No,CH-DRYER_A,CH-DRYER_A:CV1826A.STAIND,CV-1826A,CV,STAIND,"Status indication (open/closed, run/stop)",Conveyor (asset),Equipment status,DOSING BIN SCREW CVYR A,
,CV-1826A MECHANICAL PM,23-31653,CV-1826A,CV-1826A,,,1-10-23 10:51 AM,2023-01-10T10:51:00.000Z,1-10-23 10:00 AM,2023-01-10T10:00:00.000Z,1-10-23 10:53 AM,2023-01-10T10:53:00.000Z,2,2,,PM,CLOSE,Y,N,NO,CHATHAM,"2486, 2507","7.5 HP / 3520 RPM / TEFC / 575V/3PH/60HZ / FRAME#213TC, SEW PARALLEL SHAFT HELICAL GEAR UNIT FHZ127 R77 AM213/215",,No,CH-DR_UTIL_WTR,CH-DR_UTIL_WTR:P1836.STAIND,P-1836,P,STAIND,"Status indication (open/closed, run/stop)",Pump (asset),Status,CV1826A CURRENT INDICATION,CV-1826A
,CV-1826A MECHANICAL PM,23-31653,CV-1826A,CV-1826A,,,1-10-23 10:51 AM,2023-01-10T10:51:00.000Z,1-10-23 10:00 AM,2023-01-10T10:00:00.000Z,1-10-23 10:53 AM,2023-01-10T10:53:00.000Z,2,2,,PM,CLOSE,Y,N,NO,CHATHAM,"2486, 2507","7.5 HP / 3520 RPM / TEFC / 575V/3PH/60HZ / FRAME#213TC, SEW PARALLEL SHAFT HELICAL GEAR UNIT FHZ127 R77 AM213/215",,No,CH-DR_UTIL_WTR,CH-DR_UTIL_WTR:TT35450.MEAS,TT-35450,TT,MEAS,Measured value (PV),Temperature transmitter,Measurement,CV1826A CURRENT INDICATION,CV-1826A
,CV-1826A MECHANICAL PM,23-31653,CV-1826A,CV-1826A,,,1-10-23 10:51 AM,2023-01-10T10:51:00.000Z,1-10-23 10:00 AM,2023-01-10T10:00:00.000Z,1-10-23 10:53 AM,2023-01-10T10:53:00.000Z,2,2,,PM,CLOSE,Y,N,NO,CHATHAM,"2486, 2507","7.5 HP / 3520 RPM / TEFC / 575V/3PH/60HZ / FRAME#213TC, SEW PARALLEL SHAFT HELICAL GEAR UNIT FHZ127 R77 AM213/215",,No,CH-DRYER_D,CH-DRYER_D:PIC84401.MEAS,PIC-84401,PIC,MEAS,Measured value (PV),Pressure indicating controller,Measurement,CV1826A CURRENT INDICATION,CV-1826A
,CV-1826A MECHANICAL PM,23-31653,CV-1826A,CV-1826A,,,1-10-23 10:51 AM,2023-01-10T10:51:00.000Z,1-10-23 10:00 AM,2023-01-10T10:00:00.000Z,1-10-23 10:53 AM,2023-01-10T10:53:00.000Z,2,2,,PM,CLOSE,Y,N,NO,CHATHAM,"2486, 2507","7.5 HP / 3520 RPM / TEFC / 575V/3PH/60HZ / FRAME#213TC, SEW PARALLEL SHAFT HELICAL GEAR UNIT FHZ127 R77 AM213/215",,No,CH-DRYER_D_CY2,CH-DRYER_D_CY2:TT84312.PNT,TT-84312,TT,PNT,Point value / indication,Temperature transmitter,Measurement,CV1826A SPEED SWITCH,CV-1826A
,CV-1826A MECHANICAL PM,23-31653,CV-1826A,CV-1826A,,,1-10-23 10:51 AM,2023-01-10T10:51:00.000Z,1-10-23 10:00 AM,2023-01-10T10:00:00.000Z,1-10-23 10:53 AM,2023-01-10T10:53:00.000Z,2,2,,PM,CLOSE,Y,N,NO,CHATHAM,"2486, 2507","7.5 HP / 3520 RPM / TEFC / 575V/3PH/60HZ / FRAME#213TC, SEW PARALLEL SHAFT HELICAL GEAR UNIT FHZ127 R77 AM213/215",,No,CH-DRYER_D_CY2,CH-DRYER_D_CY2:TT84320.MEAS,TT-84320,TT,MEAS,Measured value (PV),Temperature transmitter,Measurement,CV1826A SPEEDOUTPUT,CV-1826A
,CV-1826A MECHANICAL PM,23-31653,CV-1826A,CV-1826A,,,1-10-23 10:51 AM,2023-01-10T10:51:00.000Z,1-10-23 10:00 AM,2023-01-10T10:00:00.000Z,1-10-23 10:53 AM,2023-01-10T10:53:00.000Z,2,2,,PM,CLOSE,Y,N,NO,CHATHAM,"2486, 2507","7.5 HP / 3520 RPM / TEFC / 575V/3PH/60HZ / FRAME#213TC, SEW PARALLEL SHAFT HELICAL GEAR UNIT FHZ127 R77 AM213/215",,No,CH-DR_DECANT702,CH-DR_DECANT702:FIC17704.SPT,FIC-17704,FIC,SPT,Setpoint (SP),Flow indicating controller,Setpoint,CV1826A CURRENT INDICATION,CV-1826A
,CHECK CONDITION OF THE PACKING IN THE STUFFING BOX,23-31654,CV-1826A,CV-1826A,,,1-10-23 10:51 AM,2023-01-10T10:51:00.000Z,1-10-23 7:00 AM,2023-01-10T07:00:00.000Z,1-10-23 10:53 AM,2023-01-10T10:53:00.000Z,2,2,,PM,CLOSE,Y,,NO,CHATHAM,"2486, 2507","7.5 HP / 3520 RPM / TEFC / 575V/3PH/60HZ / FRAME#213TC, SEW PARALLEL SHAFT HELICAL GEAR UNIT FHZ127 R77 AM213/215",,No,CH-DRA_CYCLNS,CH-DRA_CYCLNS:SSL18171.CIN,SSL-18171,SSL,CIN,Contact input (discrete),Speed switch (motion proof),Discrete Input,CV1826A CURRENT INDICATION,CV-1826A
,CHECK CONDITION OF THE PACKING IN THE STUFFING BOX,23-31654,CV-1826A,CV-1826A,,,1-10-23 10:51 AM,2023-01-10T10:51:00.000Z,1-10-23 7:00 AM,2023-01-10T07:00:00.000Z,1-10-23 10:53 AM,2023-01-10T10:53:00.000Z,2,2,,PM,CLOSE,Y,,NO,CHATHAM,"2486, 2507","7.5 HP / 3520 RPM / TEFC / 575V/3PH/60HZ / FRAME#213TC, SEW PARALLEL SHAFT HELICAL GEAR UNIT FHZ127 R77 AM213/215",,No,CH-DRA_COMB_AIR,CH-DRA_COMB_AIR:XV18183.STAIND,XV-18183,XV,STAIND,"Status indication (open/closed, run/stop)",Valve/damper/door status (discrete),Status,CV1826A SPEED SWITCH,CV-1826A
,CHECK CONDITION OF THE PACKING IN THE STUFFING BOX,23-31654,CV-1826A,CV-1826A,,,1-10-23 10:51 AM,2023-01-10T10:51:00.000Z,1-10-23 7:00 AM,2023-01-10T07:00:00.000Z,1-10-23 10:53 AM,2023-01-10T10:53:00.000Z,2,2,,PM,CLOSE,Y,,NO,CHATHAM,"2486, 2507","7.5 HP / 3520 RPM / TEFC / 575V/3PH/60HZ / FRAME#213TC, SEW PARALLEL SHAFT HELICAL GEAR UNIT FHZ127 R77 AM213/215",,No,CH-DRA_COMB_AIR,CH-DRA_COMB_AIR:PT18215A.MEAS,PT-18215A,PT,MEAS,Measured value (PV),Pressure transmitter,Measurement,CV1826A SPEEDOUTPUT,CV-1826A
,CHECK CONDITION OF THE PACKING IN THE STUFFING BOX,23-31654,CV-1826A,CV-1826A,,,1-10-23 10:51 AM,2023-01-10T10:51:00.000Z,1-10-23 7:00 AM,2023-01-10T07:00:00.000Z,1-10-23 10:53 AM,2023-01-10T10:53:00.000Z,2,2,,PM,CLOSE,Y,,NO,CHATHAM,"2486, 2507","7.5 HP / 3520 RPM / TEFC / 575V/3PH/60HZ / FRAME#213TC, SEW PARALLEL SHAFT HELICAL GEAR UNIT FHZ127 R77 AM213/215",,No,CH-DRYER_A,CH-DRYER_A:CV1826A.STAIND,CV-1826A,CV,STAIND,"Status indication (open/closed, run/stop)",Conveyor (asset),Equipment status,DOSING BIN SCREW CVYR A,
,CHECK CONDITION OF THE PACKING IN THE STUFFING BOX,23-31654,CV-1826A,CV-1826A,,,1-10-23 10:51 AM,2023-01-10T10:51:00.000Z,1-10-23 7:00 AM,2023-01-10T07:00:00.000Z,1-10-23 10:53 AM,2023-01-10T10:53:00.000Z,2,2,,PM,CLOSE,Y,,NO,CHATHAM,"2486, 2507","7.5 HP / 3520 RPM / TEFC / 575V/3PH/60HZ / FRAME#213TC, SEW PARALLEL SHAFT HELICAL GEAR UNIT FHZ127 R77 AM213/215",,No,CH-DR_UTIL_WTR,CH-DR_UTIL_WTR:P1836.STAIND,P-1836,P,STAIND,"Status indication (open/closed, run/stop)",Pump (asset),Status,CV1826A CURRENT INDICATION,CV-1826A
,CHECK CONDITION OF THE PACKING IN THE STUFFING BOX,23-31654,CV-1826A,CV-1826A,,,1-10-23 10:51 AM,2023-01-10T10:51:00.000Z,1-10-23 7:00 AM,2023-01-10T07:00:00.000Z,1-10-23 10:53 AM,2023-01-10T10:53:00.000Z,2,2,,PM,CLOSE,Y,,NO,CHATHAM,"2486, 2507","7.5 HP / 3520 RPM / TEFC / 575V/3PH/60HZ / FRAME#213TC, SEW PARALLEL SHAFT HELICAL GEAR UNIT FHZ127 R77 AM213/215",,No,CH-DR_UTIL_WTR,CH-DR_UTIL_WTR:TT35450.MEAS,TT-35450,TT,MEAS,Measured value (PV),Temperature transmitter,Measurement,CV1826A CURRENT INDICATION,CV-1826A
,CHECK CONDITION OF THE PACKING IN THE STUFFING BOX,23-31654,CV-1826A,CV-1826A,,,1-10-23 10:51 AM,2023-01-10T10:51:00.000Z,1-10-23 7:00 AM,2023-01-10T07:00:00.000Z,1-10-23 10:53 AM,2023-01-10T10:53:00.000Z,2,2,,PM,CLOSE,Y,,NO,CHATHAM,"2486, 2507","7.5 HP / 3520 RPM / TEFC / 575V/3PH/60HZ / FRAME#213TC, SEW PARALLEL SHAFT HELICAL GEAR UNIT FHZ127 R77 AM213/215",,No,CH-DRYER_D,CH-DRYER_D:PIC84401.MEAS,PIC-84401,PIC,MEAS,Measured value (PV),Pressure indicating controller,Measurement,CV1826A CURRENT INDICATION,CV-1826A
,CHECK CONDITION OF THE PACKING IN THE STUFFING BOX,23-31654,CV-1826A,CV-1826A,,,1-10-23 10:51 AM,2023-01-10T10:51:00.000Z,1-10-23 7:00 AM,2023-01-10T07:00:00.000Z,1-10-23 10:53 AM,2023-01-10T10:53:00.000Z,2,2,,PM,CLOSE,Y,,NO,CHATHAM,"2486, 2507","7.5 HP / 3520 RPM / TEFC / 575V/3PH/60HZ / FRAME#213TC, SEW PARALLEL SHAFT HELICAL GEAR UNIT FHZ127 R77 AM213/215",,No,CH-DRYER_D_CY2,CH-DRYER_D_CY2:TT84312.PNT,TT-84312,TT,PNT,Point value / indication,Temperature transmitter,Measurement,CV1826A SPEED SWITCH,CV-1826A
,CHECK CONDITION OF THE PACKING IN THE STUFFING BOX,23-31654,CV-1826A,CV-1826A,,,1-10-23 10:51 AM,2023-01-10T10:51:00.000Z,1-10-23 7:00 AM,2023-01-10T07:00:00.000Z,1-10-23 10:53 AM,2023-01-10T10:53:00.000Z,2,2,,PM,CLOSE,Y,,NO,CHATHAM,"2486, 2507","7.5 HP / 3520 RPM / TEFC / 575V/3PH/60HZ / FRAME#213TC, SEW PARALLEL SHAFT HELICAL GEAR UNIT FHZ127 R77 AM213/215",,No,CH-DRYER_D_CY2,CH-DRYER_D_CY2:TT84320.MEAS,TT-84320,TT,MEAS,Measured value (PV),Temperature transmitter,Measurement,CV1826A SPEEDOUTPUT,CV-1826A
,CHECK CONDITION OF THE PACKING IN THE STUFFING BOX,23-31654,CV-1826A,CV-1826A,,,1-10-23 10:51 AM,2023-01-10T10:51:00.000Z,1-10-23 7:00 AM,2023-01-10T07:00:00.000Z,1-10-23 10:53 AM,2023-01-10T10:53:00.000Z,2,2,,PM,CLOSE,Y,,NO,CHATHAM,"2486, 2507","7.5 HP / 3520 RPM / TEFC / 575V/3PH/60HZ / FRAME#213TC, SEW PARALLEL SHAFT HELICAL GEAR UNIT FHZ127 R77 AM213/215",,No,CH-DR_DECANT702,CH-DR_DECANT702:FIC17704.SPT,FIC-17704,FIC,SPT,Setpoint (SP),Flow indicating controller,Setpoint,CV1826A CURRENT INDICATION,CV-1826A
,CHECK PACKING GLAND LUBRICANT.  ADD GREASE  AS NECESSARY,23-31655,CV-1826A,CV-1826A,,,1-10-23 10:51 AM,2023-01-10T10:51:00.000Z,1-10-23 7:00 AM,2023-01-10T07:00:00.000Z,1-10-23 10:53 AM,2023-01-10T10:53:00.000Z,2,2,,PM,CLOSE,Y,,NO,CHATHAM,"2486, 2507","7.5 HP / 3520 RPM / TEFC / 575V/3PH/60HZ / FRAME#213TC, SEW PARALLEL SHAFT HELICAL GEAR UNIT FHZ127 R77 AM213/215",,No,CH-DRA_CYCLNS,CH-DRA_CYCLNS:SSL18171.CIN,SSL-18171,SSL,CIN,Contact input (discrete),Speed switch (motion proof),Discrete Input,CV1826A CURRENT INDICATION,CV-1826A
,CHECK PACKING GLAND LUBRICANT.  ADD GREASE  AS NECESSARY,23-31655,CV-1826A,CV-1826A,,,1-10-23 10:51 AM,2023-01-10T10:51:00.000Z,1-10-23 7:00 AM,2023-01-10T07:00:00.000Z,1-10-23 10:53 AM,2023-01-10T10:53:00.000Z,2,2,,PM,CLOSE,Y,,NO,CHATHAM,"2486, 2507","7.5 HP / 3520 RPM / TEFC / 575V/3PH/60HZ / FRAME#213TC, SEW PARALLEL SHAFT HELICAL GEAR UNIT FHZ127 R77 AM213/215",,No,CH-DRA_COMB_AIR,CH-DRA_COMB_AIR:XV18183.STAIND,XV-18183,XV,STAIND,"Status indication (open/closed, run/stop)",Valve/damper/door status (discrete),Status,CV1826A SPEED SWITCH,CV-1826A
,CHECK PACKING GLAND LUBRICANT.  ADD GREASE  AS NECESSARY,23-31655,CV-1826A,CV-1826A,,,1-10-23 10:51 AM,2023-01-10T10:51:00.000Z,1-10-23 7:00 AM,2023-01-10T07:00:00.000Z,1-10-23 10:53 AM,2023-01-10T10:53:00.000Z,2,2,,PM,CLOSE,Y,,NO,CHATHAM,"2486, 2507","7.5 HP / 3520 RPM / TEFC / 575V/3PH/60HZ / FRAME#213TC, SEW PARALLEL SHAFT HELICAL GEAR UNIT FHZ127 R77 AM213/215",,No,CH-DRA_COMB_AIR,CH-DRA_COMB_AIR:PT18215A.MEAS,PT-18215A,PT,MEAS,Measured value (PV),Pressure transmitter,Measurement,CV1826A SPEEDOUTPUT,CV-1826A
,CHECK PACKING GLAND LUBRICANT.  ADD GREASE  AS NECESSARY,23-31655,CV-1826A,CV-1826A,,,1-10-23 10:51 AM,2023-01-10T10:51:00.000Z,1-10-23 7:00 AM,2023-01-10T07:00:00.000Z,1-10-23 10:53 AM,2023-01-10T10:53:00.000Z,2,2,,PM,CLOSE,Y,,NO,CHATHAM,"2486, 2507","7.5 HP / 3520 RPM / TEFC / 575V/3PH/60HZ / FRAME#213TC, SEW PARALLEL SHAFT HELICAL GEAR UNIT FHZ127 R77 AM213/215",,No,CH-DRYER_A,CH-DRYER_A:CV1826A.STAIND,CV-1826A,CV,STAIND,"Status indication (open/closed, run/stop)",Conveyor (asset),Equipment status,DOSING BIN SCREW CVYR A,
,CHECK PACKING GLAND LUBRICANT.  ADD GREASE  AS NECESSARY,23-31655,CV-1826A,CV-1826A,,,1-10-23 10:51 AM,2023-01-10T10:51:00.000Z,1-10-23 7:00 AM,2023-01-10T07:00:00.000Z,1-10-23 10:53 AM,2023-01-10T10:53:00.000Z,2,2,,PM,CLOSE,Y,,NO,CHATHAM,"2486, 2507","7.5 HP / 3520 RPM / TEFC / 575V/3PH/60HZ / FRAME#213TC, SEW PARALLEL SHAFT HELICAL GEAR UNIT FHZ127 R77 AM213/215",,No,CH-DR_UTIL_WTR,CH-DR_UTIL_WTR:P1836.STAIND,P-1836,P,STAIND,"Status indication (open/closed, run/stop)",Pump (asset),Status,CV1826A CURRENT INDICATION,CV-1826A
,CHECK PACKING GLAND LUBRICANT.  ADD GREASE  AS NECESSARY,23-31655,CV-1826A,CV-1826A,,,1-10-23 10:51 AM,2023-01-10T10:51:00.000Z,1-10-23 7:00 AM,2023-01-10T07:00:00.000Z,1-10-23 10:53 AM,2023-01-10T10:53:00.000Z,2,2,,PM,CLOSE,Y,,NO,CHATHAM,"2486, 2507","7.5 HP / 3520 RPM / TEFC / 575V/3PH/60HZ / FRAME#213TC, SEW PARALLEL SHAFT HELICAL GEAR UNIT FHZ127 R77 AM213/215",,No,CH-DR_UTIL_WTR,CH-DR_UTIL_WTR:TT35450.MEAS,TT-35450,TT,MEAS,Measured value (PV),Temperature transmitter,Measurement,CV1826A CURRENT INDICATION,CV-1826A
,CHECK PACKING GLAND LUBRICANT.  ADD GREASE  AS NECESSARY,23-31655,CV-1826A,CV-1826A,,,1-10-23 10:51 AM,2023-01-10T10:51:00.000Z,1-10-23 7:00 AM,2023-01-10T07:00:00.000Z,1-10-23 10:53 AM,2023-01-10T10:53:00.000Z,2,2,,PM,CLOSE,Y,,NO,CHATHAM,"2486, 2507","7.5 HP / 3520 RPM / TEFC / 575V/3PH/60HZ / FRAME#213TC, SEW PARALLEL SHAFT HELICAL GEAR UNIT FHZ127 R77 AM213/215",,No,CH-DRYER_D,CH-DRYER_D:PIC84401.MEAS,PIC-84401,PIC,MEAS,Measured value (PV),Pressure indicating controller,Measurement,CV1826A CURRENT INDICATION,CV-1826A
,CHECK PACKING GLAND LUBRICANT.  ADD GREASE  AS NECESSARY,23-31655,CV-1826A,CV-1826A,,,1-10-23 10:51 AM,2023-01-10T10:51:00.000Z,1-10-23 7:00 AM,2023-01-10T07:00:00.000Z,1-10-23 10:53 AM,2023-01-10T10:53:00.000Z,2,2,,PM,CLOSE,Y,,NO,CHATHAM,"2486, 2507","7.5 HP / 3520 RPM / TEFC / 575V/3PH/60HZ / FRAME#213TC, SEW PARALLEL SHAFT HELICAL GEAR UNIT FHZ127 R77 AM213/215",,No,CH-DRYER_D_CY2,CH-DRYER_D_CY2:TT84312.PNT,TT-84312,TT,PNT,Point value / indication,Temperature transmitter,Measurement,CV1826A SPEED SWITCH,CV-1826A
,CHECK PACKING GLAND LUBRICANT.  ADD GREASE  AS NECESSARY,23-31655,CV-1826A,CV-1826A,,,1-10-23 10:51 AM,2023-01-10T10:51:00.000Z,1-10-23 7:00 AM,2023-01-10T07:00:00.000Z,1-10-23 10:53 AM,2023-01-10T10:53:00.000Z,2,2,,PM,CLOSE,Y,,NO,CHATHAM,"2486, 2507","7.5 HP / 3520 RPM / TEFC / 575V/3PH/60HZ / FRAME#213TC, SEW PARALLEL SHAFT HELICAL GEAR UNIT FHZ127 R77 AM213/215",,No,CH-DRYER_D_CY2,CH-DRYER_D_CY2:TT84320.MEAS,TT-84320,TT,MEAS,Measured value (PV),Temperature transmitter,Measurement,CV1826A SPEEDOUTPUT,CV-1826A
,CHECK PACKING GLAND LUBRICANT.  ADD GREASE  AS NECESSARY,23-31655,CV-1826A,CV-1826A,,,1-10-23 10:51 AM,2023-01-10T10:51:00.000Z,1-10-23 7:00 AM,2023-01-10T07:00:00.000Z,1-10-23 10:53 AM,2023-01-10T10:53:00.000Z,2,2,,PM,CLOSE,Y,,NO,CHATHAM,"2486, 2507","7.5 HP / 3520 RPM / TEFC / 575V/3PH/60HZ / FRAME#213TC, SEW PARALLEL SHAFT HELICAL GEAR UNIT FHZ127 R77 AM213/215",,No,CH-DR_DECANT702,CH-DR_DECANT702:FIC17704.SPT,FIC-17704,FIC,SPT,Setpoint (SP),Flow indicating controller,Setpoint,CV1826A CURRENT INDICATION,CV-1826A
,INSPECT PILLOW BLOCK BEARINGS,23-31656,CV-1826A,CV-1826A,,,1-10-23 10:51 AM,2023-01-10T10:51:00.000Z,1-10-23 7:00 AM,2023-01-10T07:00:00.000Z,1-10-23 10:53 AM,2023-01-10T10:53:00.000Z,2,2,,PM,CLOSE,Y,,NO,CHATHAM,"2486, 2507","7.5 HP / 3520 RPM / TEFC / 575V/3PH/60HZ / FRAME#213TC, SEW PARALLEL SHAFT HELICAL GEAR UNIT FHZ127 R77 AM213/215",,No,CH-DRA_CYCLNS,CH-DRA_CYCLNS:SSL18171.CIN,SSL-18171,SSL,CIN,Contact input (discrete),Speed switch (motion proof),Discrete Input,CV1826A CURRENT INDICATION,CV-1826A
,INSPECT PILLOW BLOCK BEARINGS,23-31656,CV-1826A,CV-1826A,,,1-10-23 10:51 AM,2023-01-10T10:51:00.000Z,1-10-23 7:00 AM,2023-01-10T07:00:00.000Z,1-10-23 10:53 AM,2023-01-10T10:53:00.000Z,2,2,,PM,CLOSE,Y,,NO,CHATHAM,"2486, 2507","7.5 HP / 3520 RPM / TEFC / 575V/3PH/60HZ / FRAME#213TC, SEW PARALLEL SHAFT HELICAL GEAR UNIT FHZ127 R77 AM213/215",,No,CH-DRA_COMB_AIR,CH-DRA_COMB_AIR:XV18183.STAIND,XV-18183,XV,STAIND,"Status indication (open/closed, run/stop)",Valve/damper/door status (discrete),Status,CV1826A SPEED SWITCH,CV-1826A
,INSPECT PILLOW BLOCK BEARINGS,23-31656,CV-1826A,CV-1826A,,,1-10-23 10:51 AM,2023-01-10T10:51:00.000Z,1-10-23 7:00 AM,2023-01-10T07:00:00.000Z,1-10-23 10:53 AM,2023-01-10T10:53:00.000Z,2,2,,PM,CLOSE,Y,,NO,CHATHAM,"2486, 2507","7.5 HP / 3520 RPM / TEFC / 575V/3PH/60HZ / FRAME#213TC, SEW PARALLEL SHAFT HELICAL GEAR UNIT FHZ127 R77 AM213/215",,No,CH-DRA_COMB_AIR,CH-DRA_COMB_AIR:PT18215A.MEAS,PT-18215A,PT,MEAS,Measured value (PV),Pressure transmitter,Measurement,CV1826A SPEEDOUTPUT,CV-1826A
,INSPECT PILLOW BLOCK BEARINGS,23-31656,CV-1826A,CV-1826A,,,1-10-23 10:51 AM,2023-01-10T10:51:00.000Z,1-10-23 7:00 AM,2023-01-10T07:00:00.000Z,1-10-23 10:53 AM,2023-01-10T10:53:00.000Z,2,2,,PM,CLOSE,Y,,NO,CHATHAM,"2486, 2507","7.5 HP / 3520 RPM / TEFC / 575V/3PH/60HZ / FRAME#213TC, SEW PARALLEL SHAFT HELICAL GEAR UNIT FHZ127 R77 AM213/215",,No,CH-DRYER_A,CH-DRYER_A:CV1826A.STAIND,CV-1826A,CV,STAIND,"Status indication (open/closed, run/stop)",Conveyor (asset),Equipment status,DOSING BIN SCREW CVYR A,
,INSPECT PILLOW BLOCK BEARINGS,23-31656,CV-1826A,CV-1826A,,,1-10-23 10:51 AM,2023-01-10T10:51:00.000Z,1-10-23 7:00 AM,2023-01-10T07:00:00.000Z,1-10-23 10:53 AM,2023-01-10T10:53:00.000Z,2,2,,PM,CLOSE,Y,,NO,CHATHAM,"2486, 2507","7.5 HP / 3520 RPM / TEFC / 575V/3PH/60HZ / FRAME#213TC, SEW PARALLEL SHAFT HELICAL GEAR UNIT FHZ127 R77 AM213/215",,No,CH-DR_UTIL_WTR,CH-DR_UTIL_WTR:P1836.STAIND,P-1836,P,STAIND,"Status indication (open/closed, run/stop)",Pump (asset),Status,CV1826A CURRENT INDICATION,CV-1826A
,INSPECT PILLOW BLOCK BEARINGS,23-31656,CV-1826A,CV-1826A,,,1-10-23 10:51 AM,2023-01-10T10:51:00.000Z,1-10-23 7:00 AM,2023-01-10T07:00:00.000Z,1-10-23 10:53 AM,2023-01-10T10:53:00.000Z,2,2,,PM,CLOSE,Y,,NO,CHATHAM,"2486, 2507","7.5 HP / 3520 RPM / TEFC / 575V/3PH/60HZ / FRAME#213TC, SEW PARALLEL SHAFT HELICAL GEAR UNIT FHZ127 R77 AM213/215",,No,CH-DR_UTIL_WTR,CH-DR_UTIL_WTR:TT35450.MEAS,TT-35450,TT,MEAS,Measured value (PV),Temperature transmitter,Measurement,CV1826A CURRENT INDICATION,CV-1826A
,INSPECT PILLOW BLOCK BEARINGS,23-31656,CV-1826A,CV-1826A,,,1-10-23 10:51 AM,2023-01-10T10:51:00.000Z,1-10-23 7:00 AM,2023-01-10T07:00:00.000Z,1-10-23 10:53 AM,2023-01-10T10:53:00.000Z,2,2,,PM,CLOSE,Y,,NO,CHATHAM,"2486, 2507","7.5 HP / 3520 RPM / TEFC / 575V/3PH/60HZ / FRAME#213TC, SEW PARALLEL SHAFT HELICAL GEAR UNIT FHZ127 R77 AM213/215",,No,CH-DRYER_D,CH-DRYER_D:PIC84401.MEAS,PIC-84401,PIC,MEAS,Measured value (PV),Pressure indicating controller,Measurement,CV1826A CURRENT INDICATION,CV-1826A
,INSPECT PILLOW BLOCK BEARINGS,23-31656,CV-1826A,CV-1826A,,,1-10-23 10:51 AM,2023-01-10T10:51:00.000Z,1-10-23 7:00 AM,2023-01-10T07:00:00.000Z,1-10-23 10:53 AM,2023-01-10T10:53:00.000Z,2,2,,PM,CLOSE,Y,,NO,CHATHAM,"2486, 2507","7.5 HP / 3520 RPM / TEFC / 575V/3PH/60HZ / FRAME#213TC, SEW PARALLEL SHAFT HELICAL GEAR UNIT FHZ127 R77 AM213/215",,No,CH-DRYER_D_CY2,CH-DRYER_D_CY2:TT84312.PNT,TT-84312,TT,PNT,Point value / indication,Temperature transmitter,Measurement,CV1826A SPEED SWITCH,CV-1826A
,INSPECT PILLOW BLOCK BEARINGS,23-31656,CV-1826A,CV-1826A,,,1-10-23 10:51 AM,2023-01-10T10:51:00.000Z,1-10-23 7:00 AM,2023-01-10T07:00:00.000Z,1-10-23 10:53 AM,2023-01-10T10:53:00.000Z,2,2,,PM,CLOSE,Y,,NO,CHATHAM,"2486, 2507","7.5 HP / 3520 RPM / TEFC / 575V/3PH/60HZ / FRAME#213TC, SEW PARALLEL SHAFT HELICAL GEAR UNIT FHZ127 R77 AM213/215",,No,CH-DRYER_D_CY2,CH-DRYER_D_CY2:TT84320.MEAS,TT-84320,TT,MEAS,Measured value (PV),Temperature transmitter,Measurement,CV1826A SPEEDOUTPUT,CV-1826A
,INSPECT PILLOW BLOCK BEARINGS,23-31656,CV-1826A,CV-1826A,,,1-10-23 10:51 AM,2023-01-10T10:51:00.000Z,1-10-23 7:00 AM,2023-01-10T07:00:00.000Z,1-10-23 10:53 AM,2023-01-10T10:53:00.000Z,2,2,,PM,CLOSE,Y,,NO,CHATHAM,"2486, 2507","7.5 HP / 3520 RPM / TEFC / 575V/3PH/60HZ / FRAME#213TC, SEW PARALLEL SHAFT HELICAL GEAR UNIT FHZ127 R77 AM213/215",,No,CH-DR_DECANT702,CH-DR_DECANT702:FIC17704.SPT,FIC-17704,FIC,SPT,Setpoint (SP),Flow indicating controller,Setpoint,CV1826A CURRENT INDICATION,CV-1826A
,INSPECT GEARBOX,23-31657,CV-1826A,CV-1826A,,,1-10-23 10:51 AM,2023-01-10T10:51:00.000Z,1-10-23 7:00 AM,2023-01-10T07:00:00.000Z,1-10-23 10:53 AM,2023-01-10T10:53:00.000Z,2,2,,PM,CLOSE,Y,,NO,CHATHAM,"2486, 2507","7.5 HP / 3520 RPM / TEFC / 575V/3PH/60HZ / FRAME#213TC, SEW PARALLEL SHAFT HELICAL GEAR UNIT FHZ127 R77 AM213/215",,No,CH-DRA_CYCLNS,CH-DRA_CYCLNS:SSL18171.CIN,SSL-18171,SSL,CIN,Contact input (discrete),Speed switch (motion proof),Discrete Input,CV1826A CURRENT INDICATION,CV-1826A
,INSPECT GEARBOX,23-31657,CV-1826A,CV-1826A,,,1-10-23 10:51 AM,2023-01-10T10:51:00.000Z,1-10-23 7:00 AM,2023-01-10T07:00:00.000Z,1-10-23 10:53 AM,2023-01-10T10:53:00.000Z,2,2,,PM,CLOSE,Y,,NO,CHATHAM,"2486, 2507","7.5 HP / 3520 RPM / TEFC / 575V/3PH/60HZ / FRAME#213TC, SEW PARALLEL SHAFT HELICAL GEAR UNIT FHZ127 R77 AM213/215",,No,CH-DRA_COMB_AIR,CH-DRA_COMB_AIR:XV18183.STAIND,XV-18183,XV,STAIND,"Status indication (open/closed, run/stop)",Valve/damper/door status (discrete),Status,CV1826A SPEED SWITCH,CV-1826A
,INSPECT GEARBOX,23-31657,CV-1826A,CV-1826A,,,1-10-23 10:51 AM,2023-01-10T10:51:00.000Z,1-10-23 7:00 AM,2023-01-10T07:00:00.000Z,1-10-23 10:53 AM,2023-01-10T10:53:00.000Z,2,2,,PM,CLOSE,Y,,NO,CHATHAM,"2486, 2507","7.5 HP / 3520 RPM / TEFC / 575V/3PH/60HZ / FRAME#213TC, SEW PARALLEL SHAFT HELICAL GEAR UNIT FHZ127 R77 AM213/215",,No,CH-DRA_COMB_AIR,CH-DRA_COMB_AIR:PT18215A.MEAS,PT-18215A,PT,MEAS,Measured value (PV),Pressure transmitter,Measurement,CV1826A SPEEDOUTPUT,CV-1826A
,INSPECT GEARBOX,23-31657,CV-1826A,CV-1826A,,,1-10-23 10:51 AM,2023-01-10T10:51:00.000Z,1-10-23 7:00 AM,2023-01-10T07:00:00.000Z,1-10-23 10:53 AM,2023-01-10T10:53:00.000Z,2,2,,PM,CLOSE,Y,,NO,CHATHAM,"2486, 2507","7.5 HP / 3520 RPM / TEFC / 575V/3PH/60HZ / FRAME#213TC, SEW PARALLEL SHAFT HELICAL GEAR UNIT FHZ127 R77 AM213/215",,No,CH-DRYER_A,CH-DRYER_A:CV1826A.STAIND,CV-1826A,CV,STAIND,"Status indication (open/closed, run/stop)",Conveyor (asset),Equipment status,DOSING BIN SCREW CVYR A,
,INSPECT GEARBOX,23-31657,CV-1826A,CV-1826A,,,1-10-23 10:51 AM,2023-01-10T10:51:00.000Z,1-10-23 7:00 AM,2023-01-10T07:00:00.000Z,1-10-23 10:53 AM,2023-01-10T10:53:00.000Z,2,2,,PM,CLOSE,Y,,NO,CHATHAM,"2486, 2507","7.5 HP / 3520 RPM / TEFC / 575V/3PH/60HZ / FRAME#213TC, SEW PARALLEL SHAFT HELICAL GEAR UNIT FHZ127 R77 AM213/215",,No,CH-DR_UTIL_WTR,CH-DR_UTIL_WTR:P1836.STAIND,P-1836,P,STAIND,"Status indication (open/closed, run/stop)",Pump (asset),Status,CV1826A CURRENT INDICATION,CV-1826A
,INSPECT GEARBOX,23-31657,CV-1826A,CV-1826A,,,1-10-23 10:51 AM,2023-01-10T10:51:00.000Z,1-10-23 7:00 AM,2023-01-10T07:00:00.000Z,1-10-23 10:53 AM,2023-01-10T10:53:00.000Z,2,2,,PM,CLOSE,Y,,NO,CHATHAM,"2486, 2507","7.5 HP / 3520 RPM / TEFC / 575V/3PH/60HZ / FRAME#213TC, SEW PARALLEL SHAFT HELICAL GEAR UNIT FHZ127 R77 AM213/215",,No,CH-DR_UTIL_WTR,CH-DR_UTIL_WTR:TT35450.MEAS,TT-35450,TT,MEAS,Measured value (PV),Temperature transmitter,Measurement,CV1826A CURRENT INDICATION,CV-1826A
,INSPECT GEARBOX,23-31657,CV-1826A,CV-1826A,,,1-10-23 10:51 AM,2023-01-10T10:51:00.000Z,1-10-23 7:00 AM,2023-01-10T07:00:00.000Z,1-10-23 10:53 AM,2023-01-10T10:53:00.000Z,2,2,,PM,CLOSE,Y,,NO,CHATHAM,"2486, 2507","7.5 HP / 3520 RPM / TEFC / 575V/3PH/60HZ / FRAME#213TC, SEW PARALLEL SHAFT HELICAL GEAR UNIT FHZ127 R77 AM213/215",,No,CH-DRYER_D,CH-DRYER_D:PIC84401.MEAS,PIC-84401,PIC,MEAS,Measured value (PV),Pressure indicating controller,Measurement,CV1826A CURRENT INDICATION,CV-1826A
,INSPECT GEARBOX,23-31657,CV-1826A,CV-1826A,,,1-10-23 10:51 AM,2023-01-10T10:51:00.000Z,1-10-23 7:00 AM,2023-01-10T07:00:00.000Z,1-10-23 10:53 AM,2023-01-10T10:53:00.000Z,2,2,,PM,CLOSE,Y,,NO,CHATHAM,"2486, 2507","7.5 HP / 3520 RPM / TEFC / 575V/3PH/60HZ / FRAME#213TC, SEW PARALLEL SHAFT HELICAL GEAR UNIT FHZ127 R77 AM213/215",,No,CH-DRYER_D_CY2,CH-DRYER_D_CY2:TT84312.PNT,TT-84312,TT,PNT,Point value / indication,Temperature transmitter,Measurement,CV1826A SPEED SWITCH,CV-1826A
,INSPECT GEARBOX,23-31657,CV-1826A,CV-1826A,,,1-10-23 10:51 AM,2023-01-10T10:51:00.000Z,1-10-23 7:00 AM,2023-01-10T07:00:00.000Z,1-10-23 10:53 AM,2023-01-10T10:53:00.000Z,2,2,,PM,CLOSE,Y,,NO,CHATHAM,"2486, 2507","7.5 HP / 3520 RPM / TEFC / 575V/3PH/60HZ / FRAME#213TC, SEW PARALLEL SHAFT HELICAL GEAR UNIT FHZ127 R77 AM213/215",,No,CH-DRYER_D_CY2,CH-DRYER_D_CY2:TT84320.MEAS,TT-84320,TT,MEAS,Measured value (PV),Temperature transmitter,Measurement,CV1826A SPEEDOUTPUT,CV-1826A
,INSPECT GEARBOX,23-31657,CV-1826A,CV-1826A,,,1-10-23 10:51 AM,2023-01-10T10:51:00.000Z,1-10-23 7:00 AM,2023-01-10T07:00:00.000Z,1-10-23 10:53 AM,2023-01-10T10:53:00.000Z,2,2,,PM,CLOSE,Y,,NO,CHATHAM,"2486, 2507","7.5 HP / 3520 RPM / TEFC / 575V/3PH/60HZ / FRAME#213TC, SEW PARALLEL SHAFT HELICAL GEAR UNIT FHZ127 R77 AM213/215",,No,CH-DR_DECANT702,CH-DR_DECANT702:FIC17704.SPT,FIC-17704,FIC,SPT,Setpoint (SP),Flow indicating controller,Setpoint,CV1826A CURRENT INDICATION,CV-1826A
,INSPECT SCREW CONVEYOR,23-31658,CV-1826A,CV-1826A,,,1-10-23 10:51 AM,2023-01-10T10:51:00.000Z,1-10-23 7:00 AM,2023-01-10T07:00:00.000Z,1-10-23 10:53 AM,2023-01-10T10:53:00.000Z,2,2,,PM,CLOSE,Y,,NO,CHATHAM,"2486, 2507","7.5 HP / 3520 RPM / TEFC / 575V/3PH/60HZ / FRAME#213TC, SEW PARALLEL SHAFT HELICAL GEAR UNIT FHZ127 R77 AM213/215",,No,CH-DRA_CYCLNS,CH-DRA_CYCLNS:SSL18171.CIN,SSL-18171,SSL,CIN,Contact input (discrete),Speed switch (motion proof),Discrete Input,CV1826A CURRENT INDICATION,CV-1826A
,INSPECT SCREW CONVEYOR,23-31658,CV-1826A,CV-1826A,,,1-10-23 10:51 AM,2023-01-10T10:51:00.000Z,1-10-23 7:00 AM,2023-01-10T07:00:00.000Z,1-10-23 10:53 AM,2023-01-10T10:53:00.000Z,2,2,,PM,CLOSE,Y,,NO,CHATHAM,"2486, 2507","7.5 HP / 3520 RPM / TEFC / 575V/3PH/60HZ / FRAME#213TC, SEW PARALLEL SHAFT HELICAL GEAR UNIT FHZ127 R77 AM213/215",,No,CH-DRA_COMB_AIR,CH-DRA_COMB_AIR:XV18183.STAIND,XV-18183,XV,STAIND,"Status indication (open/closed, run/stop)",Valve/damper/door status (discrete),Status,CV1826A SPEED SWITCH,CV-1826A
,INSPECT SCREW CONVEYOR,23-31658,CV-1826A,CV-1826A,,,1-10-23 10:51 AM,2023-01-10T10:51:00.000Z,1-10-23 7:00 AM,2023-01-10T07:00:00.000Z,1-10-23 10:53 AM,2023-01-10T10:53:00.000Z,2,2,,PM,CLOSE,Y,,NO,CHATHAM,"2486, 2507","7.5 HP / 3520 RPM / TEFC / 575V/3PH/60HZ / FRAME#213TC, SEW PARALLEL SHAFT HELICAL GEAR UNIT FHZ127 R77 AM213/215",,No,CH-DRA_COMB_AIR,CH-DRA_COMB_AIR:PT18215A.MEAS,PT-18215A,PT,MEAS,Measured value (PV),Pressure transmitter,Measurement,CV1826A SPEEDOUTPUT,CV-1826A
,INSPECT SCREW CONVEYOR,23-31658,CV-1826A,CV-1826A,,,1-10-23 10:51 AM,2023-01-10T10:51:00.000Z,1-10-23 7:00 AM,2023-01-10T07:00:00.000Z,1-10-23 10:53 AM,2023-01-10T10:53:00.000Z,2,2,,PM,CLOSE,Y,,NO,CHATHAM,"2486, 2507","7.5 HP / 3520 RPM / TEFC / 575V/3PH/60HZ / FRAME#213TC, SEW PARALLEL SHAFT HELICAL GEAR UNIT FHZ127 R77 AM213/215",,No,CH-DRYER_A,CH-DRYER_A:CV1826A.STAIND,CV-1826A,CV,STAIND,"Status indication (open/closed, run/stop)",Conveyor (asset),Equipment status,DOSING BIN SCREW CVYR A,
,INSPECT SCREW CONVEYOR,23-31658,CV-1826A,CV-1826A,,,1-10-23 10:51 AM,2023-01-10T10:51:00.000Z,1-10-23 7:00 AM,2023-01-10T07:00:00.000Z,1-10-23 10:53 AM,2023-01-10T10:53:00.000Z,2,2,,PM,CLOSE,Y,,NO,CHATHAM,"2486, 2507","7.5 HP / 3520 RPM / TEFC / 575V/3PH/60HZ / FRAME#213TC, SEW PARALLEL SHAFT HELICAL GEAR UNIT FHZ127 R77 AM213/215",,No,CH-DR_UTIL_WTR,CH-DR_UTIL_WTR:P1836.STAIND,P-1836,P,STAIND,"Status indication (open/closed, run/stop)",Pump (asset),Status,CV1826A CURRENT INDICATION,CV-1826A
,INSPECT SCREW CONVEYOR,23-31658,CV-1826A,CV-1826A,,,1-10-23 10:51 AM,2023-01-10T10:51:00.000Z,1-10-23 7:00 AM,2023-01-10T07:00:00.000Z,1-10-23 10:53 AM,2023-01-10T10:53:00.000Z,2,2,,PM,CLOSE,Y,,NO,CHATHAM,"2486, 2507","7.5 HP / 3520 RPM / TEFC / 575V/3PH/60HZ / FRAME#213TC, SEW PARALLEL SHAFT HELICAL GEAR UNIT FHZ127 R77 AM213/215",,No,CH-DR_UTIL_WTR,CH-DR_UTIL_WTR:TT35450.MEAS,TT-35450,TT,MEAS,Measured value (PV),Temperature transmitter,Measurement,CV1826A CURRENT INDICATION,CV-1826A
,INSPECT SCREW CONVEYOR,23-31658,CV-1826A,CV-1826A,,,1-10-23 10:51 AM,2023-01-10T10:51:00.000Z,1-10-23 7:00 AM,2023-01-10T07:00:00.000Z,1-10-23 10:53 AM,2023-01-10T10:53:00.000Z,2,2,,PM,CLOSE,Y,,NO,CHATHAM,"2486, 2507","7.5 HP / 3520 RPM / TEFC / 575V/3PH/60HZ / FRAME#213TC, SEW PARALLEL SHAFT HELICAL GEAR UNIT FHZ127 R77 AM213/215",,No,CH-DRYER_D,CH-DRYER_D:PIC84401.MEAS,PIC-84401,PIC,MEAS,Measured value (PV),Pressure indicating controller,Measurement,CV1826A CURRENT INDICATION,CV-1826A
,INSPECT SCREW CONVEYOR,23-31658,CV-1826A,CV-1826A,,,1-10-23 10:51 AM,2023-01-10T10:51:00.000Z,1-10-23 7:00 AM,2023-01-10T07:00:00.000Z,1-10-23 10:53 AM,2023-01-10T10:53:00.000Z,2,2,,PM,CLOSE,Y,,NO,CHATHAM,"2486, 2507","7.5 HP / 3520 RPM / TEFC / 575V/3PH/60HZ / FRAME#213TC, SEW PARALLEL SHAFT HELICAL GEAR UNIT FHZ127 R77 AM213/215",,No,CH-DRYER_D_CY2,CH-DRYER_D_CY2:TT84312.PNT,TT-84312,TT,PNT,Point value / indication,Temperature transmitter,Measurement,CV1826A SPEED SWITCH,CV-1826A
,INSPECT SCREW CONVEYOR,23-31658,CV-1826A,CV-1826A,,,1-10-23 10:51 AM,2023-01-10T10:51:00.000Z,1-10-23 7:00 AM,2023-01-10T07:00:00.000Z,1-10-23 10:53 AM,2023-01-10T10:53:00.000Z,2,2,,PM,CLOSE,Y,,NO,CHATHAM,"2486, 2507","7.5 HP / 3520 RPM / TEFC / 575V/3PH/60HZ / FRAME#213TC, SEW PARALLEL SHAFT HELICAL GEAR UNIT FHZ127 R77 AM213/215",,No,CH-DRYER_D_CY2,CH-DRYER_D_CY2:TT84320.MEAS,TT-84320,TT,MEAS,Measured value (PV),Temperature transmitter,Measurement,CV1826A SPEEDOUTPUT,CV-1826A
,INSPECT SCREW CONVEYOR,23-31658,CV-1826A,CV-1826A,,,1-10-23 10:51 AM,2023-01-10T10:51:00.000Z,1-10-23 7:00 AM,2023-01-10T07:00:00.000Z,1-10-23 10:53 AM,2023-01-10T10:53:00.000Z,2,2,,PM,CLOSE,Y,,NO,CHATHAM,"2486, 2507","7.5 HP / 3520 RPM / TEFC / 575V/3PH/60HZ / FRAME#213TC, SEW PARALLEL SHAFT HELICAL GEAR UNIT FHZ127 R77 AM213/215",,No,CH-DR_DECANT702,CH-DR_DECANT702:FIC17704.SPT,FIC-17704,FIC,SPT,Setpoint (SP),Flow indicating controller,Setpoint,CV1826A CURRENT INDICATION,CV-1826A
,INSPECT CONVEYOR TROUGH,23-31659,CV-1826A,CV-1826A,,,1-10-23 10:51 AM,2023-01-10T10:51:00.000Z,1-10-23 7:00 AM,2023-01-10T07:00:00.000Z,1-10-23 10:53 AM,2023-01-10T10:53:00.000Z,2,2,,PM,CLOSE,Y,,NO,CHATHAM,"2486, 2507","7.5 HP / 3520 RPM / TEFC / 575V/3PH/60HZ / FRAME#213TC, SEW PARALLEL SHAFT HELICAL GEAR UNIT FHZ127 R77 AM213/215",,No,CH-DRA_CYCLNS,CH-DRA_CYCLNS:SSL18171.CIN,SSL-18171,SSL,CIN,Contact input (discrete),Speed switch (motion proof),Discrete Input,CV1826A CURRENT INDICATION,CV-1826A
,INSPECT CONVEYOR TROUGH,23-31659,CV-1826A,CV-1826A,,,1-10-23 10:51 AM,2023-01-10T10:51:00.000Z,1-10-23 7:00 AM,2023-01-10T07:00:00.000Z,1-10-23 10:53 AM,2023-01-10T10:53:00.000Z,2,2,,PM,CLOSE,Y,,NO,CHATHAM,"2486, 2507","7.5 HP / 3520 RPM / TEFC / 575V/3PH/60HZ / FRAME#213TC, SEW PARALLEL SHAFT HELICAL GEAR UNIT FHZ127 R77 AM213/215",,No,CH-DRA_COMB_AIR,CH-DRA_COMB_AIR:XV18183.STAIND,XV-18183,XV,STAIND,"Status indication (open/closed, run/stop)",Valve/damper/door status (discrete),Status,CV1826A SPEED SWITCH,CV-1826A
,INSPECT CONVEYOR TROUGH,23-31659,CV-1826A,CV-1826A,,,1-10-23 10:51 AM,2023-01-10T10:51:00.000Z,1-10-23 7:00 AM,2023-01-10T07:00:00.000Z,1-10-23 10:53 AM,2023-01-10T10:53:00.000Z,2,2,,PM,CLOSE,Y,,NO,CHATHAM,"2486, 2507","7.5 HP / 3520 RPM / TEFC / 575V/3PH/60HZ / FRAME#213TC, SEW PARALLEL SHAFT HELICAL GEAR UNIT FHZ127 R77 AM213/215",,No,CH-DRA_COMB_AIR,CH-DRA_COMB_AIR:PT18215A.MEAS,PT-18215A,PT,MEAS,Measured value (PV),Pressure transmitter,Measurement,CV1826A SPEEDOUTPUT,CV-1826A
,INSPECT CONVEYOR TROUGH,23-31659,CV-1826A,CV-1826A,,,1-10-23 10:51 AM,2023-01-10T10:51:00.000Z,1-10-23 7:00 AM,2023-01-10T07:00:00.000Z,1-10-23 10:53 AM,2023-01-10T10:53:00.000Z,2,2,,PM,CLOSE,Y,,NO,CHATHAM,"2486, 2507","7.5 HP / 3520 RPM / TEFC / 575V/3PH/60HZ / FRAME#213TC, SEW PARALLEL SHAFT HELICAL GEAR UNIT FHZ127 R77 AM213/215",,No,CH-DRYER_A,CH-DRYER_A:CV1826A.STAIND,CV-1826A,CV,STAIND,"Status indication (open/closed, run/stop)",Conveyor (asset),Equipment status,DOSING BIN SCREW CVYR A,
,INSPECT CONVEYOR TROUGH,23-31659,CV-1826A,CV-1826A,,,1-10-23 10:51 AM,2023-01-10T10:51:00.000Z,1-10-23 7:00 AM,2023-01-10T07:00:00.000Z,1-10-23 10:53 AM,2023-01-10T10:53:00.000Z,2,2,,PM,CLOSE,Y,,NO,CHATHAM,"2486, 2507","7.5 HP / 3520 RPM / TEFC / 575V/3PH/60HZ / FRAME#213TC, SEW PARALLEL SHAFT HELICAL GEAR UNIT FHZ127 R77 AM213/215",,No,CH-DR_UTIL_WTR,CH-DR_UTIL_WTR:P1836.STAIND,P-1836,P,STAIND,"Status indication (open/closed, run/stop)",Pump (asset),Status,CV1826A CURRENT INDICATION,CV-1826A
,INSPECT CONVEYOR TROUGH,23-31659,CV-1826A,CV-1826A,,,1-10-23 10:51 AM,2023-01-10T10:51:00.000Z,1-10-23 7:00 AM,2023-01-10T07:00:00.000Z,1-10-23 10:53 AM,2023-01-10T10:53:00.000Z,2,2,,PM,CLOSE,Y,,NO,CHATHAM,"2486, 2507","7.5 HP / 3520 RPM / TEFC / 575V/3PH/60HZ / FRAME#213TC, SEW PARALLEL SHAFT HELICAL GEAR UNIT FHZ127 R77 AM213/215",,No,CH-DR_UTIL_WTR,CH-DR_UTIL_WTR:TT35450.MEAS,TT-35450,TT,MEAS,Measured value (PV),Temperature transmitter,Measurement,CV1826A CURRENT INDICATION,CV-1826A
,INSPECT CONVEYOR TROUGH,23-31659,CV-1826A,CV-1826A,,,1-10-23 10:51 AM,2023-01-10T10:51:00.000Z,1-10-23 7:00 AM,2023-01-10T07:00:00.000Z,1-10-23 10:53 AM,2023-01-10T10:53:00.000Z,2,2,,PM,CLOSE,Y,,NO,CHATHAM,"2486, 2507","7.5 HP / 3520 RPM / TEFC / 575V/3PH/60HZ / FRAME#213TC, SEW PARALLEL SHAFT HELICAL GEAR UNIT FHZ127 R77 AM213/215",,No,CH-DRYER_D,CH-DRYER_D:PIC84401.MEAS,PIC-84401,PIC,MEAS,Measured value (PV),Pressure indicating controller,Measurement,CV1826A CURRENT INDICATION,CV-1826A
,INSPECT CONVEYOR TROUGH,23-31659,CV-1826A,CV-1826A,,,1-10-23 10:51 AM,2023-01-10T10:51:00.000Z,1-10-23 7:00 AM,2023-01-10T07:00:00.000Z,1-10-23 10:53 AM,2023-01-10T10:53:00.000Z,2,2,,PM,CLOSE,Y,,NO,CHATHAM,"2486, 2507","7.5 HP / 3520 RPM / TEFC / 575V/3PH/60HZ / FRAME#213TC, SEW PARALLEL SHAFT HELICAL GEAR UNIT FHZ127 R77 AM213/215",,No,CH-DRYER_D_CY2,CH-DRYER_D_CY2:TT84312.PNT,TT-84312,TT,PNT,Point value / indication,Temperature transmitter,Measurement,CV1826A SPEED SWITCH,CV-1826A
,INSPECT CONVEYOR TROUGH,23-31659,CV-1826A,CV-1826A,,,1-10-23 10:51 AM,2023-01-10T10:51:00.000Z,1-10-23 7:00 AM,2023-01-10T07:00:00.000Z,1-10-23 10:53 AM,2023-01-10T10:53:00.000Z,2,2,,PM,CLOSE,Y,,NO,CHATHAM,"2486, 2507","7.5 HP / 3520 RPM / TEFC / 575V/3PH/60HZ / FRAME#213TC, SEW PARALLEL SHAFT HELICAL GEAR UNIT FHZ127 R77 AM213/215",,No,CH-DRYER_D_CY2,CH-DRYER_D_CY2:TT84320.MEAS,TT-84320,TT,MEAS,Measured value (PV),Temperature transmitter,Measurement,CV1826A SPEEDOUTPUT,CV-1826A
,INSPECT CONVEYOR TROUGH,23-31659,CV-1826A,CV-1826A,,,1-10-23 10:51 AM,2023-01-10T10:51:00.000Z,1-10-23 7:00 AM,2023-01-10T07:00:00.000Z,1-10-23 10:53 AM,2023-01-10T10:53:00.000Z,2,2,,PM,CLOSE,Y,,NO,CHATHAM,"2486, 2507","7.5 HP / 3520 RPM / TEFC / 575V/3PH/60HZ / FRAME#213TC, SEW PARALLEL SHAFT HELICAL GEAR UNIT FHZ127 R77 AM213/215",,No,CH-DR_DECANT702,CH-DR_DECANT702:FIC17704.SPT,FIC-17704,FIC,SPT,Setpoint (SP),Flow indicating controller,Setpoint,CV1826A CURRENT INDICATION,CV-1826A
,CV-1826A MECHANICAL PM,23-31660,CV-1826A,CV-1826A,,,1-10-23 10:51 AM,2023-01-10T10:51:00.000Z,2-23-23 10:00 AM,2023-02-23T10:00:00.000Z,3-16-23 8:56 AM,2023-03-16T08:56:00.000Z,4,4,,PM,CLOSE,Y,N,NO,CHATHAM,"2486, 2507","7.5 HP / 3520 RPM / TEFC / 575V/3PH/60HZ / FRAME#213TC, SEW PARALLEL SHAFT HELICAL GEAR UNIT FHZ127 R77 AM213/215",,No,CH-DRA_CYCLNS,CH-DRA_CYCLNS:SSL18171.CIN,SSL-18171,SSL,CIN,Contact input (discrete),Speed switch (motion proof),Discrete Input,CV1826A CURRENT INDICATION,CV-1826A
,CV-1826A MECHANICAL PM,23-31660,CV-1826A,CV-1826A,,,1-10-23 10:51 AM,2023-01-10T10:51:00.000Z,2-23-23 10:00 AM,2023-02-23T10:00:00.000Z,3-16-23 8:56 AM,2023-03-16T08:56:00.000Z,4,4,,PM,CLOSE,Y,N,NO,CHATHAM,"2486, 2507","7.5 HP / 3520 RPM / TEFC / 575V/3PH/60HZ / FRAME#213TC, SEW PARALLEL SHAFT HELICAL GEAR UNIT FHZ127 R77 AM213/215",,No,CH-DRA_COMB_AIR,CH-DRA_COMB_AIR:XV18183.STAIND,XV-18183,XV,STAIND,"Status indication (open/closed, run/stop)",Valve/damper/door status (discrete),Status,CV1826A SPEED SWITCH,CV-1826A
,CV-1826A MECHANICAL PM,23-31660,CV-1826A,CV-1826A,,,1-10-23 10:51 AM,2023-01-10T10:51:00.000Z,2-23-23 10:00 AM,2023-02-23T10:00:00.000Z,3-16-23 8:56 AM,2023-03-16T08:56:00.000Z,4,4,,PM,CLOSE,Y,N,NO,CHATHAM,"2486, 2507","7.5 HP / 3520 RPM / TEFC / 575V/3PH/60HZ / FRAME#213TC, SEW PARALLEL SHAFT HELICAL GEAR UNIT FHZ127 R77 AM213/215",,No,CH-DRA_COMB_AIR,CH-DRA_COMB_AIR:PT18215A.MEAS,PT-18215A,PT,MEAS,Measured value (PV),Pressure transmitter,Measurement,CV1826A SPEEDOUTPUT,CV-1826A
,CV-1826A MECHANICAL PM,23-31660,CV-1826A,CV-1826A,,,1-10-23 10:51 AM,2023-01-10T10:51:00.000Z,2-23-23 10:00 AM,2023-02-23T10:00:00.000Z,3-16-23 8:56 AM,2023-03-16T08:56:00.000Z,4,4,,PM,CLOSE,Y,N,NO,CHATHAM,"2486, 2507","7.5 HP / 3520 RPM / TEFC / 575V/3PH/60HZ / FRAME#213TC, SEW PARALLEL SHAFT HELICAL GEAR UNIT FHZ127 R77 AM213/215",,No,CH-DRYER_A,CH-DRYER_A:CV1826A.STAIND,CV-1826A,CV,STAIND,"Status indication (open/closed, run/stop)",Conveyor (asset),Equipment status,DOSING BIN SCREW CVYR A,
,CV-1826A MECHANICAL PM,23-31660,CV-1826A,CV-1826A,,,1-10-23 10:51 AM,2023-01-10T10:51:00.000Z,2-23-23 10:00 AM,2023-02-23T10:00:00.000Z,3-16-23 8:56 AM,2023-03-16T08:56:00.000Z,4,4,,PM,CLOSE,Y,N,NO,CHATHAM,"2486, 2507","7.5 HP / 3520 RPM / TEFC / 575V/3PH/60HZ / FRAME#213TC, SEW PARALLEL SHAFT HELICAL GEAR UNIT FHZ127 R77 AM213/215",,No,CH-DR_UTIL_WTR,CH-DR_UTIL_WTR:P1836.STAIND,P-1836,P,STAIND,"Status indication (open/closed, run/stop)",Pump (asset),Status,CV1826A CURRENT INDICATION,CV-1826A
,CV-1826A MECHANICAL PM,23-31660,CV-1826A,CV-1826A,,,1-10-23 10:51 AM,2023-01-10T10:51:00.000Z,2-23-23 10:00 AM,2023-02-23T10:00:00.000Z,3-16-23 8:56 AM,2023-03-16T08:56:00.000Z,4,4,,PM,CLOSE,Y,N,NO,CHATHAM,"2486, 2507","7.5 HP / 3520 RPM / TEFC / 575V/3PH/60HZ / FRAME#213TC, SEW PARALLEL SHAFT HELICAL GEAR UNIT FHZ127 R77 AM213/215",,No,CH-DR_UTIL_WTR,CH-DR_UTIL_WTR:TT35450.MEAS,TT-35450,TT,MEAS,Measured value (PV),Temperature transmitter,Measurement,CV1826A CURRENT INDICATION,CV-1826A
,CV-1826A MECHANICAL PM,23-31660,CV-1826A,CV-1826A,,,1-10-23 10:51 AM,2023-01-10T10:51:00.000Z,2-23-23 10:00 AM,2023-02-23T10:00:00.000Z,3-16-23 8:56 AM,2023-03-16T08:56:00.000Z,4,4,,PM,CLOSE,Y,N,NO,CHATHAM,"2486, 2507","7.5 HP / 3520 RPM / TEFC / 575V/3PH/60HZ / FRAME#213TC, SEW PARALLEL SHAFT HELICAL GEAR UNIT FHZ127 R77 AM213/215",,No,CH-DRYER_D,CH-DRYER_D:PIC84401.MEAS,PIC-84401,PIC,MEAS,Measured value (PV),Pressure indicating controller,Measurement,CV1826A CURRENT INDICATION,CV-1826A
,CV-1826A MECHANICAL PM,23-31660,CV-1826A,CV-1826A,,,1-10-23 10:51 AM,2023-01-10T10:51:00.000Z,2-23-23 10:00 AM,2023-02-23T10:00:00.000Z,3-16-23 8:56 AM,2023-03-16T08:56:00.000Z,4,4,,PM,CLOSE,Y,N,NO,CHATHAM,"2486, 2507","7.5 HP / 3520 RPM / TEFC / 575V/3PH/60HZ / FRAME#213TC, SEW PARALLEL SHAFT HELICAL GEAR UNIT FHZ127 R77 AM213/215",,No,CH-DRYER_D_CY2,CH-DRYER_D_CY2:TT84312.PNT,TT-84312,TT,PNT,Point value / indication,Temperature transmitter,Measurement,CV1826A SPEED SWITCH,CV-1826A
,CV-1826A MECHANICAL PM,23-31660,CV-1826A,CV-1826A,,,1-10-23 10:51 AM,2023-01-10T10:51:00.000Z,2-23-23 10:00 AM,2023-02-23T10:00:00.000Z,3-16-23 8:56 AM,2023-03-16T08:56:00.000Z,4,4,,PM,CLOSE,Y,N,NO,CHATHAM,"2486, 2507","7.5 HP / 3520 RPM / TEFC / 575V/3PH/60HZ / FRAME#213TC, SEW PARALLEL SHAFT HELICAL GEAR UNIT FHZ127 R77 AM213/215",,No,CH-DRYER_D_CY2,CH-DRYER_D_CY2:TT84320.MEAS,TT-84320,TT,MEAS,Measured value (PV),Temperature transmitter,Measurement,CV1826A SPEEDOUTPUT,CV-1826A
,CV-1826A MECHANICAL PM,23-31660,CV-1826A,CV-1826A,,,1-10-23 10:51 AM,2023-01-10T10:51:00.000Z,2-23-23 10:00 AM,2023-02-23T10:00:00.000Z,3-16-23 8:56 AM,2023-03-16T08:56:00.000Z,4,4,,PM,CLOSE,Y,N,NO,CHATHAM,"2486, 2507","7.5 HP / 3520 RPM / TEFC / 575V/3PH/60HZ / FRAME#213TC, SEW PARALLEL SHAFT HELICAL GEAR UNIT FHZ127 R77 AM213/215",,No,CH-DR_DECANT702,CH-DR_DECANT702:FIC17704.SPT,FIC-17704,FIC,SPT,Setpoint (SP),Flow indicating controller,Setpoint,CV1826A CURRENT INDICATION,CV-1826A
,CHECK CONDITION OF THE PACKING IN THE STUFFING BOX,23-31661,CV-1826A,CV-1826A,,,1-10-23 10:51 AM,2023-01-10T10:51:00.000Z,1-10-23 7:00 AM,2023-01-10T07:00:00.000Z,3-16-23 8:56 AM,2023-03-16T08:56:00.000Z,2,2,,PM,CLOSE,Y,,NO,CHATHAM,"2486, 2507","7.5 HP / 3520 RPM / TEFC / 575V/3PH/60HZ / FRAME#213TC, SEW PARALLEL SHAFT HELICAL GEAR UNIT FHZ127 R77 AM213/215",,No,CH-DRA_CYCLNS,CH-DRA_CYCLNS:SSL18171.CIN,SSL-18171,SSL,CIN,Contact input (discrete),Speed switch (motion proof),Discrete Input,CV1826A CURRENT INDICATION,CV-1826A
,CHECK CONDITION OF THE PACKING IN THE STUFFING BOX,23-31661,CV-1826A,CV-1826A,,,1-10-23 10:51 AM,2023-01-10T10:51:00.000Z,1-10-23 7:00 AM,2023-01-10T07:00:00.000Z,3-16-23 8:56 AM,2023-03-16T08:56:00.000Z,2,2,,PM,CLOSE,Y,,NO,CHATHAM,"2486, 2507","7.5 HP / 3520 RPM / TEFC / 575V/3PH/60HZ / FRAME#213TC, SEW PARALLEL SHAFT HELICAL GEAR UNIT FHZ127 R77 AM213/215",,No,CH-DRA_COMB_AIR,CH-DRA_COMB_AIR:XV18183.STAIND,XV-18183,XV,STAIND,"Status indication (open/closed, run/stop)",Valve/damper/door status (discrete),Status,CV1826A SPEED SWITCH,CV-1826A
,CHECK CONDITION OF THE PACKING IN THE STUFFING BOX,23-31661,CV-1826A,CV-1826A,,,1-10-23 10:51 AM,2023-01-10T10:51:00.000Z,1-10-23 7:00 AM,2023-01-10T07:00:00.000Z,3-16-23 8:56 AM,2023-03-16T08:56:00.000Z,2,2,,PM,CLOSE,Y,,NO,CHATHAM,"2486, 2507","7.5 HP / 3520 RPM / TEFC / 575V/3PH/60HZ / FRAME#213TC, SEW PARALLEL SHAFT HELICAL GEAR UNIT FHZ127 R77 AM213/215",,No,CH-DRA_COMB_AIR,CH-DRA_COMB_AIR:PT18215A.MEAS,PT-18215A,PT,MEAS,Measured value (PV),Pressure transmitter,Measurement,CV1826A SPEEDOUTPUT,CV-1826A
,CHECK CONDITION OF THE PACKING IN THE STUFFING BOX,23-31661,CV-1826A,CV-1826A,,,1-10-23 10:51 AM,2023-01-10T10:51:00.000Z,1-10-23 7:00 AM,2023-01-10T07:00:00.000Z,3-16-23 8:56 AM,2023-03-16T08:56:00.000Z,2,2,,PM,CLOSE,Y,,NO,CHATHAM,"2486, 2507","7.5 HP / 3520 RPM / TEFC / 575V/3PH/60HZ / FRAME#213TC, SEW PARALLEL SHAFT HELICAL GEAR UNIT FHZ127 R77 AM213/215",,No,CH-DRYER_A,CH-DRYER_A:CV1826A.STAIND,CV-1826A,CV,STAIND,"Status indication (open/closed, run/stop)",Conveyor (asset),Equipment status,DOSING BIN SCREW CVYR A,
,CHECK CONDITION OF THE PACKING IN THE STUFFING BOX,23-31661,CV-1826A,CV-1826A,,,1-10-23 10:51 AM,2023-01-10T10:51:00.000Z,1-10-23 7:00 AM,2023-01-10T07:00:00.000Z,3-16-23 8:56 AM,2023-03-16T08:56:00.000Z,2,2,,PM,CLOSE,Y,,NO,CHATHAM,"2486, 2507","7.5 HP / 3520 RPM / TEFC / 575V/3PH/60HZ / FRAME#213TC, SEW PARALLEL SHAFT HELICAL GEAR UNIT FHZ127 R77 AM213/215",,No,CH-DR_UTIL_WTR,CH-DR_UTIL_WTR:P1836.STAIND,P-1836,P,STAIND,"Status indication (open/closed, run/stop)",Pump (asset),Status,CV1826A CURRENT INDICATION,CV-1826A
,CHECK CONDITION OF THE PACKING IN THE STUFFING BOX,23-31661,CV-1826A,CV-1826A,,,1-10-23 10:51 AM,2023-01-10T10:51:00.000Z,1-10-23 7:00 AM,2023-01-10T07:00:00.000Z,3-16-23 8:56 AM,2023-03-16T08:56:00.000Z,2,2,,PM,CLOSE,Y,,NO,CHATHAM,"2486, 2507","7.5 HP / 3520 RPM / TEFC / 575V/3PH/60HZ / FRAME#213TC, SEW PARALLEL SHAFT HELICAL GEAR UNIT FHZ127 R77 AM213/215",,No,CH-DR_UTIL_WTR,CH-DR_UTIL_WTR:TT35450.MEAS,TT-35450,TT,MEAS,Measured value (PV),Temperature transmitter,Measurement,CV1826A CURRENT INDICATION,CV-1826A
,CHECK CONDITION OF THE PACKING IN THE STUFFING BOX,23-31661,CV-1826A,CV-1826A,,,1-10-23 10:51 AM,2023-01-10T10:51:00.000Z,1-10-23 7:00 AM,2023-01-10T07:00:00.000Z,3-16-23 8:56 AM,2023-03-16T08:56:00.000Z,2,2,,PM,CLOSE,Y,,NO,CHATHAM,"2486, 2507","7.5 HP / 3520 RPM / TEFC / 575V/3PH/60HZ / FRAME#213TC, SEW PARALLEL SHAFT HELICAL GEAR UNIT FHZ127 R77 AM213/215",,No,CH-DRYER_D,CH-DRYER_D:PIC84401.MEAS,PIC-84401,PIC,MEAS,Measured value (PV),Pressure indicating controller,Measurement,CV1826A CURRENT INDICATION,CV-1826A
,CHECK CONDITION OF THE PACKING IN THE STUFFING BOX,23-31661,CV-1826A,CV-1826A,,,1-10-23 10:51 AM,2023-01-10T10:51:00.000Z,1-10-23 7:00 AM,2023-01-10T07:00:00.000Z,3-16-23 8:56 AM,2023-03-16T08:56:00.000Z,2,2,,PM,CLOSE,Y,,NO,CHATHAM,"2486, 2507","7.5 HP / 3520 RPM / TEFC / 575V/3PH/60HZ / FRAME#213TC, SEW PARALLEL SHAFT HELICAL GEAR UNIT FHZ127 R77 AM213/215",,No,CH-DRYER_D_CY2,CH-DRYER_D_CY2:TT84312.PNT,TT-84312,TT,PNT,Point value / indication,Temperature transmitter,Measurement,CV1826A SPEED SWITCH,CV-1826A
,CHECK CONDITION OF THE PACKING IN THE STUFFING BOX,23-31661,CV-1826A,CV-1826A,,,1-10-23 10:51 AM,2023-01-10T10:51:00.000Z,1-10-23 7:00 AM,2023-01-10T07:00:00.000Z,3-16-23 8:56 AM,2023-03-16T08:56:00.000Z,2,2,,PM,CLOSE,Y,,NO,CHATHAM,"2486, 2507","7.5 HP / 3520 RPM / TEFC / 575V/3PH/60HZ / FRAME#213TC, SEW PARALLEL SHAFT HELICAL GEAR UNIT FHZ127 R77 AM213/215",,No,CH-DRYER_D_CY2,CH-DRYER_D_CY2:TT84320.MEAS,TT-84320,TT,MEAS,Measured value (PV),Temperature transmitter,Measurement,CV1826A SPEEDOUTPUT,CV-1826A
,CHECK CONDITION OF THE PACKING IN THE STUFFING BOX,23-31661,CV-1826A,CV-1826A,,,1-10-23 10:51 AM,2023-01-10T10:51:00.000Z,1-10-23 7:00 AM,2023-01-10T07:00:00.000Z,3-16-23 8:56 AM,2023-03-16T08:56:00.000Z,2,2,,PM,CLOSE,Y,,NO,CHATHAM,"2486, 2507","7.5 HP / 3520 RPM / TEFC / 575V/3PH/60HZ / FRAME#213TC, SEW PARALLEL SHAFT HELICAL GEAR UNIT FHZ127 R77 AM213/215",,No,CH-DR_DECANT702,CH-DR_DECANT702:FIC17704.SPT,FIC-17704,FIC,SPT,Setpoint (SP),Flow indicating controller,Setpoint,CV1826A CURRENT INDICATION,CV-1826A
,CHECK PACKING GLAND LUBRICANT.  ADD GREASE  AS NECESSARY,23-31662,CV-1826A,CV-1826A,,,1-10-23 10:51 AM,2023-01-10T10:51:00.000Z,1-10-23 7:00 AM,2023-01-10T07:00:00.000Z,3-16-23 8:56 AM,2023-03-16T08:56:00.000Z,2,2,,PM,CLOSE,Y,,NO,CHATHAM,"2486, 2507","7.5 HP / 3520 RPM / TEFC / 575V/3PH/60HZ / FRAME#213TC, SEW PARALLEL SHAFT HELICAL GEAR UNIT FHZ127 R77 AM213/215",,No,CH-DRA_CYCLNS,CH-DRA_CYCLNS:SSL18171.CIN,SSL-18171,SSL,CIN,Contact input (discrete),Speed switch (motion proof),Discrete Input,CV1826A CURRENT INDICATION,CV-1826A
,CHECK PACKING GLAND LUBRICANT.  ADD GREASE  AS NECESSARY,23-31662,CV-1826A,CV-1826A,,,1-10-23 10:51 AM,2023-01-10T10:51:00.000Z,1-10-23 7:00 AM,2023-01-10T07:00:00.000Z,3-16-23 8:56 AM,2023-03-16T08:56:00.000Z,2,2,,PM,CLOSE,Y,,NO,CHATHAM,"2486, 2507","7.5 HP / 3520 RPM / TEFC / 575V/3PH/60HZ / FRAME#213TC, SEW PARALLEL SHAFT HELICAL GEAR UNIT FHZ127 R77 AM213/215",,No,CH-DRA_COMB_AIR,CH-DRA_COMB_AIR:XV18183.STAIND,XV-18183,XV,STAIND,"Status indication (open/closed, run/stop)",Valve/damper/door status (discrete),Status,CV1826A SPEED SWITCH,CV-1826A
,CHECK PACKING GLAND LUBRICANT.  ADD GREASE  AS NECESSARY,23-31662,CV-1826A,CV-1826A,,,1-10-23 10:51 AM,2023-01-10T10:51:00.000Z,1-10-23 7:00 AM,2023-01-10T07:00:00.000Z,3-16-23 8:56 AM,2023-03-16T08:56:00.000Z,2,2,,PM,CLOSE,Y,,NO,CHATHAM,"2486, 2507","7.5 HP / 3520 RPM / TEFC / 575V/3PH/60HZ / FRAME#213TC, SEW PARALLEL SHAFT HELICAL GEAR UNIT FHZ127 R77 AM213/215",,No,CH-DRA_COMB_AIR,CH-DRA_COMB_AIR:PT18215A.MEAS,PT-18215A,PT,MEAS,Measured value (PV),Pressure transmitter,Measurement,CV1826A SPEEDOUTPUT,CV-1826A
,CHECK PACKING GLAND LUBRICANT.  ADD GREASE  AS NECESSARY,23-31662,CV-1826A,CV-1826A,,,1-10-23 10:51 AM,2023-01-10T10:51:00.000Z,1-10-23 7:00 AM,2023-01-10T07:00:00.000Z,3-16-23 8:56 AM,2023-03-16T08:56:00.000Z,2,2,,PM,CLOSE,Y,,NO,CHATHAM,"2486, 2507","7.5 HP / 3520 RPM / TEFC / 575V/3PH/60HZ / FRAME#213TC, SEW PARALLEL SHAFT HELICAL GEAR UNIT FHZ127 R77 AM213/215",,No,CH-DRYER_A,CH-DRYER_A:CV1826A.STAIND,CV-1826A,CV,STAIND,"Status indication (open/closed, run/stop)",Conveyor (asset),Equipment status,DOSING BIN SCREW CVYR A,
,CHECK PACKING GLAND LUBRICANT.  ADD GREASE  AS NECESSARY,23-31662,CV-1826A,CV-1826A,,,1-10-23 10:51 AM,2023-01-10T10:51:00.000Z,1-10-23 7:00 AM,2023-01-10T07:00:00.000Z,3-16-23 8:56 AM,2023-03-16T08:56:00.000Z,2,2,,PM,CLOSE,Y,,NO,CHATHAM,"2486, 2507","7.5 HP / 3520 RPM / TEFC / 575V/3PH/60HZ / FRAME#213TC, SEW PARALLEL SHAFT HELICAL GEAR UNIT FHZ127 R77 AM213/215",,No,CH-DR_UTIL_WTR,CH-DR_UTIL_WTR:P1836.STAIND,P-1836,P,STAIND,"Status indication (open/closed, run/stop)",Pump (asset),Status,CV1826A CURRENT INDICATION,CV-1826A
,CHECK PACKING GLAND LUBRICANT.  ADD GREASE  AS NECESSARY,23-31662,CV-1826A,CV-1826A,,,1-10-23 10:51 AM,2023-01-10T10:51:00.000Z,1-10-23 7:00 AM,2023-01-10T07:00:00.000Z,3-16-23 8:56 AM,2023-03-16T08:56:00.000Z,2,2,,PM,CLOSE,Y,,NO,CHATHAM,"2486, 2507","7.5 HP / 3520 RPM / TEFC / 575V/3PH/60HZ / FRAME#213TC, SEW PARALLEL SHAFT HELICAL GEAR UNIT FHZ127 R77 AM213/215",,No,CH-DR_UTIL_WTR,CH-DR_UTIL_WTR:TT35450.MEAS,TT-35450,TT,MEAS,Measured value (PV),Temperature transmitter,Measurement,CV1826A CURRENT INDICATION,CV-1826A
,CHECK PACKING GLAND LUBRICANT.  ADD GREASE  AS NECESSARY,23-31662,CV-1826A,CV-1826A,,,1-10-23 10:51 AM,2023-01-10T10:51:00.000Z,1-10-23 7:00 AM,2023-01-10T07:00:00.000Z,3-16-23 8:56 AM,2023-03-16T08:56:00.000Z,2,2,,PM,CLOSE,Y,,NO,CHATHAM,"2486, 2507","7.5 HP / 3520 RPM / TEFC / 575V/3PH/60HZ / FRAME#213TC, SEW PARALLEL SHAFT HELICAL GEAR UNIT FHZ127 R77 AM213/215",,No,CH-DRYER_D,CH-DRYER_D:PIC84401.MEAS,PIC-84401,PIC,MEAS,Measured value (PV),Pressure indicating controller,Measurement,CV1826A CURRENT INDICATION,CV-1826A
,CHECK PACKING GLAND LUBRICANT.  ADD GREASE  AS NECESSARY,23-31662,CV-1826A,CV-1826A,,,1-10-23 10:51 AM,2023-01-10T10:51:00.000Z,1-10-23 7:00 AM,2023-01-10T07:00:00.000Z,3-16-23 8:56 AM,2023-03-16T08:56:00.000Z,2,2,,PM,CLOSE,Y,,NO,CHATHAM,"2486, 2507","7.5 HP / 3520 RPM / TEFC / 575V/3PH/60HZ / FRAME#213TC, SEW PARALLEL SHAFT HELICAL GEAR UNIT FHZ127 R77 AM213/215",,No,CH-DRYER_D_CY2,CH-DRYER_D_CY2:TT84312.PNT,TT-84312,TT,PNT,Point value / indication,Temperature transmitter,Measurement,CV1826A SPEED SWITCH,CV-1826A
,CHECK PACKING GLAND LUBRICANT.  ADD GREASE  AS NECESSARY,23-31662,CV-1826A,CV-1826A,,,1-10-23 10:51 AM,2023-01-10T10:51:00.000Z,1-10-23 7:00 AM,2023-01-10T07:00:00.000Z,3-16-23 8:56 AM,2023-03-16T08:56:00.000Z,2,2,,PM,CLOSE,Y,,NO,CHATHAM,"2486, 2507","7.5 HP / 3520 RPM / TEFC / 575V/3PH/60HZ / FRAME#213TC, SEW PARALLEL SHAFT HELICAL GEAR UNIT FHZ127 R77 AM213/215",,No,CH-DRYER_D_CY2,CH-DRYER_D_CY2:TT84320.MEAS,TT-84320,TT,MEAS,Measured value (PV),Temperature transmitter,Measurement,CV1826A SPEEDOUTPUT,CV-1826A
,CHECK PACKING GLAND LUBRICANT.  ADD GREASE  AS NECESSARY,23-31662,CV-1826A,CV-1826A,,,1-10-23 10:51 AM,2023-01-10T10:51:00.000Z,1-10-23 7:00 AM,2023-01-10T07:00:00.000Z,3-16-23 8:56 AM,2023-03-16T08:56:00.000Z,2,2,,PM,CLOSE,Y,,NO,CHATHAM,"2486, 2507","7.5 HP / 3520 RPM / TEFC / 575V/3PH/60HZ / FRAME#213TC, SEW PARALLEL SHAFT HELICAL GEAR UNIT FHZ127 R77 AM213/215",,No,CH-DR_DECANT702,CH-DR_DECANT702:FIC17704.SPT,FIC-17704,FIC,SPT,Setpoint (SP),Flow indicating controller,Setpoint,CV1826A CURRENT INDICATION,CV-1826A
,INSPECT PILLOW BLOCK BEARINGS,23-31663,CV-1826A,CV-1826A,,,1-10-23 10:51 AM,2023-01-10T10:51:00.000Z,1-10-23 7:00 AM,2023-01-10T07:00:00.000Z,3-16-23 8:56 AM,2023-03-16T08:56:00.000Z,2,2,,PM,CLOSE,Y,,NO,CHATHAM,"2486, 2507","7.5 HP / 3520 RPM / TEFC / 575V/3PH/60HZ / FRAME#213TC, SEW PARALLEL SHAFT HELICAL GEAR UNIT FHZ127 R77 AM213/215",,No,CH-DRA_CYCLNS,CH-DRA_CYCLNS:SSL18171.CIN,SSL-18171,SSL,CIN,Contact input (discrete),Speed switch (motion proof),Discrete Input,CV1826A CURRENT INDICATION,CV-1826A
,INSPECT PILLOW BLOCK BEARINGS,23-31663,CV-1826A,CV-1826A,,,1-10-23 10:51 AM,2023-01-10T10:51:00.000Z,1-10-23 7:00 AM,2023-01-10T07:00:00.000Z,3-16-23 8:56 AM,2023-03-16T08:56:00.000Z,2,2,,PM,CLOSE,Y,,NO,CHATHAM,"2486, 2507","7.5 HP / 3520 RPM / TEFC / 575V/3PH/60HZ / FRAME#213TC, SEW PARALLEL SHAFT HELICAL GEAR UNIT FHZ127 R77 AM213/215",,No,CH-DRA_COMB_AIR,CH-DRA_COMB_AIR:XV18183.STAIND,XV-18183,XV,STAIND,"Status indication (open/closed, run/stop)",Valve/damper/door status (discrete),Status,CV1826A SPEED SWITCH,CV-1826A
,INSPECT PILLOW BLOCK BEARINGS,23-31663,CV-1826A,CV-1826A,,,1-10-23 10:51 AM,2023-01-10T10:51:00.000Z,1-10-23 7:00 AM,2023-01-10T07:00:00.000Z,3-16-23 8:56 AM,2023-03-16T08:56:00.000Z,2,2,,PM,CLOSE,Y,,NO,CHATHAM,"2486, 2507","7.5 HP / 3520 RPM / TEFC / 575V/3PH/60HZ / FRAME#213TC, SEW PARALLEL SHAFT HELICAL GEAR UNIT FHZ127 R77 AM213/215",,No,CH-DRA_COMB_AIR,CH-DRA_COMB_AIR:PT18215A.MEAS,PT-18215A,PT,MEAS,Measured value (PV),Pressure transmitter,Measurement,CV1826A SPEEDOUTPUT,CV-1826A
,INSPECT PILLOW BLOCK BEARINGS,23-31663,CV-1826A,CV-1826A,,,1-10-23 10:51 AM,2023-01-10T10:51:00.000Z,1-10-23 7:00 AM,2023-01-10T07:00:00.000Z,3-16-23 8:56 AM,2023-03-16T08:56:00.000Z,2,2,,PM,CLOSE,Y,,NO,CHATHAM,"2486, 2507","7.5 HP / 3520 RPM / TEFC / 575V/3PH/60HZ / FRAME#213TC, SEW PARALLEL SHAFT HELICAL GEAR UNIT FHZ127 R77 AM213/215",,No,CH-DRYER_A,CH-DRYER_A:CV1826A.STAIND,CV-1826A,CV,STAIND,"Status indication (open/closed, run/stop)",Conveyor (asset),Equipment status,DOSING BIN SCREW CVYR A,
,INSPECT PILLOW BLOCK BEARINGS,23-31663,CV-1826A,CV-1826A,,,1-10-23 10:51 AM,2023-01-10T10:51:00.000Z,1-10-23 7:00 AM,2023-01-10T07:00:00.000Z,3-16-23 8:56 AM,2023-03-16T08:56:00.000Z,2,2,,PM,CLOSE,Y,,NO,CHATHAM,"2486, 2507","7.5 HP / 3520 RPM / TEFC / 575V/3PH/60HZ / FRAME#213TC, SEW PARALLEL SHAFT HELICAL GEAR UNIT FHZ127 R77 AM213/215",,No,CH-DR_UTIL_WTR,CH-DR_UTIL_WTR:P1836.STAIND,P-1836,P,STAIND,"Status indication (open/closed, run/stop)",Pump (asset),Status,CV1826A CURRENT INDICATION,CV-1826A
,INSPECT PILLOW BLOCK BEARINGS,23-31663,CV-1826A,CV-1826A,,,1-10-23 10:51 AM,2023-01-10T10:51:00.000Z,1-10-23 7:00 AM,2023-01-10T07:00:00.000Z,3-16-23 8:56 AM,2023-03-16T08:56:00.000Z,2,2,,PM,CLOSE,Y,,NO,CHATHAM,"2486, 2507","7.5 HP / 3520 RPM / TEFC / 575V/3PH/60HZ / FRAME#213TC, SEW PARALLEL SHAFT HELICAL GEAR UNIT FHZ127 R77 AM213/215",,No,CH-DR_UTIL_WTR,CH-DR_UTIL_WTR:TT35450.MEAS,TT-35450,TT,MEAS,Measured value (PV),Temperature transmitter,Measurement,CV1826A CURRENT INDICATION,CV-1826A
,INSPECT PILLOW BLOCK BEARINGS,23-31663,CV-1826A,CV-1826A,,,1-10-23 10:51 AM,2023-01-10T10:51:00.000Z,1-10-23 7:00 AM,2023-01-10T07:00:00.000Z,3-16-23 8:56 AM,2023-03-16T08:56:00.000Z,2,2,,PM,CLOSE,Y,,NO,CHATHAM,"2486, 2507","7.5 HP / 3520 RPM / TEFC / 575V/3PH/60HZ / FRAME#213TC, SEW PARALLEL SHAFT HELICAL GEAR UNIT FHZ127 R77 AM213/215",,No,CH-DRYER_D,CH-DRYER_D:PIC84401.MEAS,PIC-84401,PIC,MEAS,Measured value (PV),Pressure indicating controller,Measurement,CV1826A CURRENT INDICATION,CV-1826A
,INSPECT PILLOW BLOCK BEARINGS,23-31663,CV-1826A,CV-1826A,,,1-10-23 10:51 AM,2023-01-10T10:51:00.000Z,1-10-23 7:00 AM,2023-01-10T07:00:00.000Z,3-16-23 8:56 AM,2023-03-16T08:56:00.000Z,2,2,,PM,CLOSE,Y,,NO,CHATHAM,"2486, 2507","7.5 HP / 3520 RPM / TEFC / 575V/3PH/60HZ / FRAME#213TC, SEW PARALLEL SHAFT HELICAL GEAR UNIT FHZ127 R77 AM213/215",,No,CH-DRYER_D_CY2,CH-DRYER_D_CY2:TT84312.PNT,TT-84312,TT,PNT,Point value / indication,Temperature transmitter,Measurement,CV1826A SPEED SWITCH,CV-1826A
,INSPECT PILLOW BLOCK BEARINGS,23-31663,CV-1826A,CV-1826A,,,1-10-23 10:51 AM,2023-01-10T10:51:00.000Z,1-10-23 7:00 AM,2023-01-10T07:00:00.000Z,3-16-23 8:56 AM,2023-03-16T08:56:00.000Z,2,2,,PM,CLOSE,Y,,NO,CHATHAM,"2486, 2507","7.5 HP / 3520 RPM / TEFC / 575V/3PH/60HZ / FRAME#213TC, SEW PARALLEL SHAFT HELICAL GEAR UNIT FHZ127 R77 AM213/215",,No,CH-DRYER_D_CY2,CH-DRYER_D_CY2:TT84320.MEAS,TT-84320,TT,MEAS,Measured value (PV),Temperature transmitter,Measurement,CV1826A SPEEDOUTPUT,CV-1826A
,INSPECT PILLOW BLOCK BEARINGS,23-31663,CV-1826A,CV-1826A,,,1-10-23 10:51 AM,2023-01-10T10:51:00.000Z,1-10-23 7:00 AM,2023-01-10T07:00:00.000Z,3-16-23 8:56 AM,2023-03-16T08:56:00.000Z,2,2,,PM,CLOSE,Y,,NO,CHATHAM,"2486, 2507","7.5 HP / 3520 RPM / TEFC / 575V/3PH/60HZ / FRAME#213TC, SEW PARALLEL SHAFT HELICAL GEAR UNIT FHZ127 R77 AM213/215",,No,CH-DR_DECANT702,CH-DR_DECANT702:FIC17704.SPT,FIC-17704,FIC,SPT,Setpoint (SP),Flow indicating controller,Setpoint,CV1826A CURRENT INDICATION,CV-1826A
,INSPECT GEARBOX,23-31664,CV-1826A,CV-1826A,,,1-10-23 10:51 AM,2023-01-10T10:51:00.000Z,1-10-23 7:00 AM,2023-01-10T07:00:00.000Z,3-16-23 8:56 AM,2023-03-16T08:56:00.000Z,2,2,,PM,CLOSE,Y,,NO,CHATHAM,"2486, 2507","7.5 HP / 3520 RPM / TEFC / 575V/3PH/60HZ / FRAME#213TC, SEW PARALLEL SHAFT HELICAL GEAR UNIT FHZ127 R77 AM213/215",,No,CH-DRA_CYCLNS,CH-DRA_CYCLNS:SSL18171.CIN,SSL-18171,SSL,CIN,Contact input (discrete),Speed switch (motion proof),Discrete Input,CV1826A CURRENT INDICATION,CV-1826A
,INSPECT GEARBOX,23-31664,CV-1826A,CV-1826A,,,1-10-23 10:51 AM,2023-01-10T10:51:00.000Z,1-10-23 7:00 AM,2023-01-10T07:00:00.000Z,3-16-23 8:56 AM,2023-03-16T08:56:00.000Z,2,2,,PM,CLOSE,Y,,NO,CHATHAM,"2486, 2507","7.5 HP / 3520 RPM / TEFC / 575V/3PH/60HZ / FRAME#213TC, SEW PARALLEL SHAFT HELICAL GEAR UNIT FHZ127 R77 AM213/215",,No,CH-DRA_COMB_AIR,CH-DRA_COMB_AIR:XV18183.STAIND,XV-18183,XV,STAIND,"Status indication (open/closed, run/stop)",Valve/damper/door status (discrete),Status,CV1826A SPEED SWITCH,CV-1826A
,INSPECT GEARBOX,23-31664,CV-1826A,CV-1826A,,,1-10-23 10:51 AM,2023-01-10T10:51:00.000Z,1-10-23 7:00 AM,2023-01-10T07:00:00.000Z,3-16-23 8:56 AM,2023-03-16T08:56:00.000Z,2,2,,PM,CLOSE,Y,,NO,CHATHAM,"2486, 2507","7.5 HP / 3520 RPM / TEFC / 575V/3PH/60HZ / FRAME#213TC, SEW PARALLEL SHAFT HELICAL GEAR UNIT FHZ127 R77 AM213/215",,No,CH-DRA_COMB_AIR,CH-DRA_COMB_AIR:PT18215A.MEAS,PT-18215A,PT,MEAS,Measured value (PV),Pressure transmitter,Measurement,CV1826A SPEEDOUTPUT,CV-1826A
,INSPECT GEARBOX,23-31664,CV-1826A,CV-1826A,,,1-10-23 10:51 AM,2023-01-10T10:51:00.000Z,1-10-23 7:00 AM,2023-01-10T07:00:00.000Z,3-16-23 8:56 AM,2023-03-16T08:56:00.000Z,2,2,,PM,CLOSE,Y,,NO,CHATHAM,"2486, 2507","7.5 HP / 3520 RPM / TEFC / 575V/3PH/60HZ / FRAME#213TC, SEW PARALLEL SHAFT HELICAL GEAR UNIT FHZ127 R77 AM213/215",,No,CH-DRYER_A,CH-DRYER_A:CV1826A.STAIND,CV-1826A,CV,STAIND,"Status indication (open/closed, run/stop)",Conveyor (asset),Equipment status,DOSING BIN SCREW CVYR A,
,INSPECT GEARBOX,23-31664,CV-1826A,CV-1826A,,,1-10-23 10:51 AM,2023-01-10T10:51:00.000Z,1-10-23 7:00 AM,2023-01-10T07:00:00.000Z,3-16-23 8:56 AM,2023-03-16T08:56:00.000Z,2,2,,PM,CLOSE,Y,,NO,CHATHAM,"2486, 2507","7.5 HP / 3520 RPM / TEFC / 575V/3PH/60HZ / FRAME#213TC, SEW PARALLEL SHAFT HELICAL GEAR UNIT FHZ127 R77 AM213/215",,No,CH-DR_UTIL_WTR,CH-DR_UTIL_WTR:P1836.STAIND,P-1836,P,STAIND,"Status indication (open/closed, run/stop)",Pump (asset),Status,CV1826A CURRENT INDICATION,CV-1826A
,INSPECT GEARBOX,23-31664,CV-1826A,CV-1826A,,,1-10-23 10:51 AM,2023-01-10T10:51:00.000Z,1-10-23 7:00 AM,2023-01-10T07:00:00.000Z,3-16-23 8:56 AM,2023-03-16T08:56:00.000Z,2,2,,PM,CLOSE,Y,,NO,CHATHAM,"2486, 2507","7.5 HP / 3520 RPM / TEFC / 575V/3PH/60HZ / FRAME#213TC, SEW PARALLEL SHAFT HELICAL GEAR UNIT FHZ127 R77 AM213/215",,No,CH-DR_UTIL_WTR,CH-DR_UTIL_WTR:TT35450.MEAS,TT-35450,TT,MEAS,Measured value (PV),Temperature transmitter,Measurement,CV1826A CURRENT INDICATION,CV-1826A
,INSPECT GEARBOX,23-31664,CV-1826A,CV-1826A,,,1-10-23 10:51 AM,2023-01-10T10:51:00.000Z,1-10-23 7:00 AM,2023-01-10T07:00:00.000Z,3-16-23 8:56 AM,2023-03-16T08:56:00.000Z,2,2,,PM,CLOSE,Y,,NO,CHATHAM,"2486, 2507","7.5 HP / 3520 RPM / TEFC / 575V/3PH/60HZ / FRAME#213TC, SEW PARALLEL SHAFT HELICAL GEAR UNIT FHZ127 R77 AM213/215",,No,CH-DRYER_D,CH-DRYER_D:PIC84401.MEAS,PIC-84401,PIC,MEAS,Measured value (PV),Pressure indicating controller,Measurement,CV1826A CURRENT INDICATION,CV-1826A
,INSPECT GEARBOX,23-31664,CV-1826A,CV-1826A,,,1-10-23 10:51 AM,2023-01-10T10:51:00.000Z,1-10-23 7:00 AM,2023-01-10T07:00:00.000Z,3-16-23 8:56 AM,2023-03-16T08:56:00.000Z,2,2,,PM,CLOSE,Y,,NO,CHATHAM,"2486, 2507","7.5 HP / 3520 RPM / TEFC / 575V/3PH/60HZ / FRAME#213TC, SEW PARALLEL SHAFT HELICAL GEAR UNIT FHZ127 R77 AM213/215",,No,CH-DRYER_D_CY2,CH-DRYER_D_CY2:TT84312.PNT,TT-84312,TT,PNT,Point value / indication,Temperature transmitter,Measurement,CV1826A SPEED SWITCH,CV-1826A
,INSPECT GEARBOX,23-31664,CV-1826A,CV-1826A,,,1-10-23 10:51 AM,2023-01-10T10:51:00.000Z,1-10-23 7:00 AM,2023-01-10T07:00:00.000Z,3-16-23 8:56 AM,2023-03-16T08:56:00.000Z,2,2,,PM,CLOSE,Y,,NO,CHATHAM,"2486, 2507","7.5 HP / 3520 RPM / TEFC / 575V/3PH/60HZ / FRAME#213TC, SEW PARALLEL SHAFT HELICAL GEAR UNIT FHZ127 R77 AM213/215",,No,CH-DRYER_D_CY2,CH-DRYER_D_CY2:TT84320.MEAS,TT-84320,TT,MEAS,Measured value (PV),Temperature transmitter,Measurement,CV1826A SPEEDOUTPUT,CV-1826A
,INSPECT GEARBOX,23-31664,CV-1826A,CV-1826A,,,1-10-23 10:51 AM,2023-01-10T10:51:00.000Z,1-10-23 7:00 AM,2023-01-10T07:00:00.000Z,3-16-23 8:56 AM,2023-03-16T08:56:00.000Z,2,2,,PM,CLOSE,Y,,NO,CHATHAM,"2486, 2507","7.5 HP / 3520 RPM / TEFC / 575V/3PH/60HZ / FRAME#213TC, SEW PARALLEL SHAFT HELICAL GEAR UNIT FHZ127 R77 AM213/215",,No,CH-DR_DECANT702,CH-DR_DECANT702:FIC17704.SPT,FIC-17704,FIC,SPT,Setpoint (SP),Flow indicating controller,Setpoint,CV1826A CURRENT INDICATION,CV-1826A
,INSPECT SCREW CONVEYOR,23-31665,CV-1826A,CV-1826A,,,1-10-23 10:51 AM,2023-01-10T10:51:00.000Z,1-10-23 7:00 AM,2023-01-10T07:00:00.000Z,3-16-23 8:56 AM,2023-03-16T08:56:00.000Z,2,2,,PM,CLOSE,Y,,NO,CHATHAM,"2486, 2507","7.5 HP / 3520 RPM / TEFC / 575V/3PH/60HZ / FRAME#213TC, SEW PARALLEL SHAFT HELICAL GEAR UNIT FHZ127 R77 AM213/215",,No,CH-DRA_CYCLNS,CH-DRA_CYCLNS:SSL18171.CIN,SSL-18171,SSL,CIN,Contact input (discrete),Speed switch (motion proof),Discrete Input,CV1826A CURRENT INDICATION,CV-1826A
,INSPECT SCREW CONVEYOR,23-31665,CV-1826A,CV-1826A,,,1-10-23 10:51 AM,2023-01-10T10:51:00.000Z,1-10-23 7:00 AM,2023-01-10T07:00:00.000Z,3-16-23 8:56 AM,2023-03-16T08:56:00.000Z,2,2,,PM,CLOSE,Y,,NO,CHATHAM,"2486, 2507","7.5 HP / 3520 RPM / TEFC / 575V/3PH/60HZ / FRAME#213TC, SEW PARALLEL SHAFT HELICAL GEAR UNIT FHZ127 R77 AM213/215",,No,CH-DRA_COMB_AIR,CH-DRA_COMB_AIR:XV18183.STAIND,XV-18183,XV,STAIND,"Status indication (open/closed, run/stop)",Valve/damper/door status (discrete),Status,CV1826A SPEED SWITCH,CV-1826A
,INSPECT SCREW CONVEYOR,23-31665,CV-1826A,CV-1826A,,,1-10-23 10:51 AM,2023-01-10T10:51:00.000Z,1-10-23 7:00 AM,2023-01-10T07:00:00.000Z,3-16-23 8:56 AM,2023-03-16T08:56:00.000Z,2,2,,PM,CLOSE,Y,,NO,CHATHAM,"2486, 2507","7.5 HP / 3520 RPM / TEFC / 575V/3PH/60HZ / FRAME#213TC, SEW PARALLEL SHAFT HELICAL GEAR UNIT FHZ127 R77 AM213/215",,No,CH-DRA_COMB_AIR,CH-DRA_COMB_AIR:PT18215A.MEAS,PT-18215A,PT,MEAS,Measured value (PV),Pressure transmitter,Measurement,CV1826A SPEEDOUTPUT,CV-1826A
,INSPECT SCREW CONVEYOR,23-31665,CV-1826A,CV-1826A,,,1-10-23 10:51 AM,2023-01-10T10:51:00.000Z,1-10-23 7:00 AM,2023-01-10T07:00:00.000Z,3-16-23 8:56 AM,2023-03-16T08:56:00.000Z,2,2,,PM,CLOSE,Y,,NO,CHATHAM,"2486, 2507","7.5 HP / 3520 RPM / TEFC / 575V/3PH/60HZ / FRAME#213TC, SEW PARALLEL SHAFT HELICAL GEAR UNIT FHZ127 R77 AM213/215",,No,CH-DRYER_A,CH-DRYER_A:CV1826A.STAIND,CV-1826A,CV,STAIND,"Status indication (open/closed, run/stop)",Conveyor (asset),Equipment status,DOSING BIN SCREW CVYR A,
,INSPECT SCREW CONVEYOR,23-31665,CV-1826A,CV-1826A,,,1-10-23 10:51 AM,2023-01-10T10:51:00.000Z,1-10-23 7:00 AM,2023-01-10T07:00:00.000Z,3-16-23 8:56 AM,2023-03-16T08:56:00.000Z,2,2,,PM,CLOSE,Y,,NO,CHATHAM,"2486, 2507","7.5 HP / 3520 RPM / TEFC / 575V/3PH/60HZ / FRAME#213TC, SEW PARALLEL SHAFT HELICAL GEAR UNIT FHZ127 R77 AM213/215",,No,CH-DR_UTIL_WTR,CH-DR_UTIL_WTR:P1836.STAIND,P-1836,P,STAIND,"Status indication (open/closed, run/stop)",Pump (asset),Status,CV1826A CURRENT INDICATION,CV-1826A
,INSPECT SCREW CONVEYOR,23-31665,CV-1826A,CV-1826A,,,1-10-23 10:51 AM,2023-01-10T10:51:00.000Z,1-10-23 7:00 AM,2023-01-10T07:00:00.000Z,3-16-23 8:56 AM,2023-03-16T08:56:00.000Z,2,2,,PM,CLOSE,Y,,NO,CHATHAM,"2486, 2507","7.5 HP / 3520 RPM / TEFC / 575V/3PH/60HZ / FRAME#213TC, SEW PARALLEL SHAFT HELICAL GEAR UNIT FHZ127 R77 AM213/215",,No,CH-DR_UTIL_WTR,CH-DR_UTIL_WTR:TT35450.MEAS,TT-35450,TT,MEAS,Measured value (PV),Temperature transmitter,Measurement,CV1826A CURRENT INDICATION,CV-1826A
,INSPECT SCREW CONVEYOR,23-31665,CV-1826A,CV-1826A,,,1-10-23 10:51 AM,2023-01-10T10:51:00.000Z,1-10-23 7:00 AM,2023-01-10T07:00:00.000Z,3-16-23 8:56 AM,2023-03-16T08:56:00.000Z,2,2,,PM,CLOSE,Y,,NO,CHATHAM,"2486, 2507","7.5 HP / 3520 RPM / TEFC / 575V/3PH/60HZ / FRAME#213TC, SEW PARALLEL SHAFT HELICAL GEAR UNIT FHZ127 R77 AM213/215",,No,CH-DRYER_D,CH-DRYER_D:PIC84401.MEAS,PIC-84401,PIC,MEAS,Measured value (PV),Pressure indicating controller,Measurement,CV1826A CURRENT INDICATION,CV-1826A
,INSPECT SCREW CONVEYOR,23-31665,CV-1826A,CV-1826A,,,1-10-23 10:51 AM,2023-01-10T10:51:00.000Z,1-10-23 7:00 AM,2023-01-10T07:00:00.000Z,3-16-23 8:56 AM,2023-03-16T08:56:00.000Z,2,2,,PM,CLOSE,Y,,NO,CHATHAM,"2486, 2507","7.5 HP / 3520 RPM / TEFC / 575V/3PH/60HZ / FRAME#213TC, SEW PARALLEL SHAFT HELICAL GEAR UNIT FHZ127 R77 AM213/215",,No,CH-DRYER_D_CY2,CH-DRYER_D_CY2:TT84312.PNT,TT-84312,TT,PNT,Point value / indication,Temperature transmitter,Measurement,CV1826A SPEED SWITCH,CV-1826A
,INSPECT SCREW CONVEYOR,23-31665,CV-1826A,CV-1826A,,,1-10-23 10:51 AM,2023-01-10T10:51:00.000Z,1-10-23 7:00 AM,2023-01-10T07:00:00.000Z,3-16-23 8:56 AM,2023-03-16T08:56:00.000Z,2,2,,PM,CLOSE,Y,,NO,CHATHAM,"2486, 2507","7.5 HP / 3520 RPM / TEFC / 575V/3PH/60HZ / FRAME#213TC, SEW PARALLEL SHAFT HELICAL GEAR UNIT FHZ127 R77 AM213/215",,No,CH-DRYER_D_CY2,CH-DRYER_D_CY2:TT84320.MEAS,TT-84320,TT,MEAS,Measured value (PV),Temperature transmitter,Measurement,CV1826A SPEEDOUTPUT,CV-1826A
,INSPECT SCREW CONVEYOR,23-31665,CV-1826A,CV-1826A,,,1-10-23 10:51 AM,2023-01-10T10:51:00.000Z,1-10-23 7:00 AM,2023-01-10T07:00:00.000Z,3-16-23 8:56 AM,2023-03-16T08:56:00.000Z,2,2,,PM,CLOSE,Y,,NO,CHATHAM,"2486, 2507","7.5 HP / 3520 RPM / TEFC / 575V/3PH/60HZ / FRAME#213TC, SEW PARALLEL SHAFT HELICAL GEAR UNIT FHZ127 R77 AM213/215",,No,CH-DR_DECANT702,CH-DR_DECANT702:FIC17704.SPT,FIC-17704,FIC,SPT,Setpoint (SP),Flow indicating controller,Setpoint,CV1826A CURRENT INDICATION,CV-1826A
,INSPECT CONVEYOR TROUGH,23-31666,CV-1826A,CV-1826A,,,1-10-23 10:51 AM,2023-01-10T10:51:00.000Z,1-10-23 7:00 AM,2023-01-10T07:00:00.000Z,3-16-23 8:56 AM,2023-03-16T08:56:00.000Z,2,2,,PM,CLOSE,Y,,NO,CHATHAM,"2486, 2507","7.5 HP / 3520 RPM / TEFC / 575V/3PH/60HZ / FRAME#213TC, SEW PARALLEL SHAFT HELICAL GEAR UNIT FHZ127 R77 AM213/215",,No,CH-DRA_CYCLNS,CH-DRA_CYCLNS:SSL18171.CIN,SSL-18171,SSL,CIN,Contact input (discrete),Speed switch (motion proof),Discrete Input,CV1826A CURRENT INDICATION,CV-1826A
,INSPECT CONVEYOR TROUGH,23-31666,CV-1826A,CV-1826A,,,1-10-23 10:51 AM,2023-01-10T10:51:00.000Z,1-10-23 7:00 AM,2023-01-10T07:00:00.000Z,3-16-23 8:56 AM,2023-03-16T08:56:00.000Z,2,2,,PM,CLOSE,Y,,NO,CHATHAM,"2486, 2507","7.5 HP / 3520 RPM / TEFC / 575V/3PH/60HZ / FRAME#213TC, SEW PARALLEL SHAFT HELICAL GEAR UNIT FHZ127 R77 AM213/215",,No,CH-DRA_COMB_AIR,CH-DRA_COMB_AIR:XV18183.STAIND,XV-18183,XV,STAIND,"Status indication (open/closed, run/stop)",Valve/damper/door status (discrete),Status,CV1826A SPEED SWITCH,CV-1826A
,INSPECT CONVEYOR TROUGH,23-31666,CV-1826A,CV-1826A,,,1-10-23 10:51 AM,2023-01-10T10:51:00.000Z,1-10-23 7:00 AM,2023-01-10T07:00:00.000Z,3-16-23 8:56 AM,2023-03-16T08:56:00.000Z,2,2,,PM,CLOSE,Y,,NO,CHATHAM,"2486, 2507","7.5 HP / 3520 RPM / TEFC / 575V/3PH/60HZ / FRAME#213TC, SEW PARALLEL SHAFT HELICAL GEAR UNIT FHZ127 R77 AM213/215",,No,CH-DRA_COMB_AIR,CH-DRA_COMB_AIR:PT18215A.MEAS,PT-18215A,PT,MEAS,Measured value (PV),Pressure transmitter,Measurement,CV1826A SPEEDOUTPUT,CV-1826A
,INSPECT CONVEYOR TROUGH,23-31666,CV-1826A,CV-1826A,,,1-10-23 10:51 AM,2023-01-10T10:51:00.000Z,1-10-23 7:00 AM,2023-01-10T07:00:00.000Z,3-16-23 8:56 AM,2023-03-16T08:56:00.000Z,2,2,,PM,CLOSE,Y,,NO,CHATHAM,"2486, 2507","7.5 HP / 3520 RPM / TEFC / 575V/3PH/60HZ / FRAME#213TC, SEW PARALLEL SHAFT HELICAL GEAR UNIT FHZ127 R77 AM213/215",,No,CH-DRYER_A,CH-DRYER_A:CV1826A.STAIND,CV-1826A,CV,STAIND,"Status indication (open/closed, run/stop)",Conveyor (asset),Equipment status,DOSING BIN SCREW CVYR A,
,INSPECT CONVEYOR TROUGH,23-31666,CV-1826A,CV-1826A,,,1-10-23 10:51 AM,2023-01-10T10:51:00.000Z,1-10-23 7:00 AM,2023-01-10T07:00:00.000Z,3-16-23 8:56 AM,2023-03-16T08:56:00.000Z,2,2,,PM,CLOSE,Y,,NO,CHATHAM,"2486, 2507","7.5 HP / 3520 RPM / TEFC / 575V/3PH/60HZ / FRAME#213TC, SEW PARALLEL SHAFT HELICAL GEAR UNIT FHZ127 R77 AM213/215",,No,CH-DR_UTIL_WTR,CH-DR_UTIL_WTR:P1836.STAIND,P-1836,P,STAIND,"Status indication (open/closed, run/stop)",Pump (asset),Status,CV1826A CURRENT INDICATION,CV-1826A
,INSPECT CONVEYOR TROUGH,23-31666,CV-1826A,CV-1826A,,,1-10-23 10:51 AM,2023-01-10T10:51:00.000Z,1-10-23 7:00 AM,2023-01-10T07:00:00.000Z,3-16-23 8:56 AM,2023-03-16T08:56:00.000Z,2,2,,PM,CLOSE,Y,,NO,CHATHAM,"2486, 2507","7.5 HP / 3520 RPM / TEFC / 575V/3PH/60HZ / FRAME#213TC, SEW PARALLEL SHAFT HELICAL GEAR UNIT FHZ127 R77 AM213/215",,No,CH-DR_UTIL_WTR,CH-DR_UTIL_WTR:TT35450.MEAS,TT-35450,TT,MEAS,Measured value (PV),Temperature transmitter,Measurement,CV1826A CURRENT INDICATION,CV-1826A
,INSPECT CONVEYOR TROUGH,23-31666,CV-1826A,CV-1826A,,,1-10-23 10:51 AM,2023-01-10T10:51:00.000Z,1-10-23 7:00 AM,2023-01-10T07:00:00.000Z,3-16-23 8:56 AM,2023-03-16T08:56:00.000Z,2,2,,PM,CLOSE,Y,,NO,CHATHAM,"2486, 2507","7.5 HP / 3520 RPM / TEFC / 575V/3PH/60HZ / FRAME#213TC, SEW PARALLEL SHAFT HELICAL GEAR UNIT FHZ127 R77 AM213/215",,No,CH-DRYER_D,CH-DRYER_D:PIC84401.MEAS,PIC-84401,PIC,MEAS,Measured value (PV),Pressure indicating controller,Measurement,CV1826A CURRENT INDICATION,CV-1826A
,INSPECT CONVEYOR TROUGH,23-31666,CV-1826A,CV-1826A,,,1-10-23 10:51 AM,2023-01-10T10:51:00.000Z,1-10-23 7:00 AM,2023-01-10T07:00:00.000Z,3-16-23 8:56 AM,2023-03-16T08:56:00.000Z,2,2,,PM,CLOSE,Y,,NO,CHATHAM,"2486, 2507","7.5 HP / 3520 RPM / TEFC / 575V/3PH/60HZ / FRAME#213TC, SEW PARALLEL SHAFT HELICAL GEAR UNIT FHZ127 R77 AM213/215",,No,CH-DRYER_D_CY2,CH-DRYER_D_CY2:TT84312.PNT,TT-84312,TT,PNT,Point value / indication,Temperature transmitter,Measurement,CV1826A SPEED SWITCH,CV-1826A
,INSPECT CONVEYOR TROUGH,23-31666,CV-1826A,CV-1826A,,,1-10-23 10:51 AM,2023-01-10T10:51:00.000Z,1-10-23 7:00 AM,2023-01-10T07:00:00.000Z,3-16-23 8:56 AM,2023-03-16T08:56:00.000Z,2,2,,PM,CLOSE,Y,,NO,CHATHAM,"2486, 2507","7.5 HP / 3520 RPM / TEFC / 575V/3PH/60HZ / FRAME#213TC, SEW PARALLEL SHAFT HELICAL GEAR UNIT FHZ127 R77 AM213/215",,No,CH-DRYER_D_CY2,CH-DRYER_D_CY2:TT84320.MEAS,TT-84320,TT,MEAS,Measured value (PV),Temperature transmitter,Measurement,CV1826A SPEEDOUTPUT,CV-1826A
,INSPECT CONVEYOR TROUGH,23-31666,CV-1826A,CV-1826A,,,1-10-23 10:51 AM,2023-01-10T10:51:00.000Z,1-10-23 7:00 AM,2023-01-10T07:00:00.000Z,3-16-23 8:56 AM,2023-03-16T08:56:00.000Z,2,2,,PM,CLOSE,Y,,NO,CHATHAM,"2486, 2507","7.5 HP / 3520 RPM / TEFC / 575V/3PH/60HZ / FRAME#213TC, SEW PARALLEL SHAFT HELICAL GEAR UNIT FHZ127 R77 AM213/215",,No,CH-DR_DECANT702,CH-DR_DECANT702:FIC17704.SPT,FIC-17704,FIC,SPT,Setpoint (SP),Flow indicating controller,Setpoint,CV1826A CURRENT INDICATION,CV-1826A
7742,Heat trace on pH probe line is off,23-31667,AT-13522,AT-13522,,,1-10-23 11:00 AM,2023-01-10T11:00:00.000Z,1-11-23 2:31 PM,2023-01-11T14:31:00.000Z,1-10-23 11:01 AM,2023-01-10T11:01:00.000Z,4,4,,CO,CLOSE,Y,,NO,CHATHAM,,,,,,,,,,,,,,
2522,MODIFY GRATING AS NEEDED,23-31668,CV-1827,CV-1827,,,1-10-23 11:01 AM,2023-01-10T11:01:00.000Z,2-23-23 2:11 AM,2023-02-23T02:11:00.000Z,,,4,4,,CO,CAN,Y,,NO,CHATHAM,"2488, 2509","5 HP / 1800 RPM / TEFC / 575V/3PH/60HZ / FRAME#184T, DORRIS 115TR25 SHAFT MOUNTED SPEED REDUCER",,No,CH-DRA_CYCLNS,CH-DRA_CYCLNS:SSL18172.CIN,SSL-18172,SSL,CIN,Contact input (discrete),Speed switch (motion proof),Discrete Input,CV1827 CURRENT INDICATION,CV-1827
2522,MODIFY GRATING AS NEEDED,23-31668,CV-1827,CV-1827,,,1-10-23 11:01 AM,2023-01-10T11:01:00.000Z,2-23-23 2:11 AM,2023-02-23T02:11:00.000Z,,,4,4,,CO,CAN,Y,,NO,CHATHAM,"2488, 2509","5 HP / 1800 RPM / TEFC / 575V/3PH/60HZ / FRAME#184T, DORRIS 115TR25 SHAFT MOUNTED SPEED REDUCER",,No,CH-DRA_COMB_AIR,CH-DRA_COMB_AIR:PD18215.PNT,PD-18215,PD,PNT,Point value / indication,Pressure indication,Indication,CV1827 SPEED SWITCH,CV-1827
2522,MODIFY GRATING AS NEEDED,23-31668,CV-1827,CV-1827,,,1-10-23 11:01 AM,2023-01-10T11:01:00.000Z,2-23-23 2:11 AM,2023-02-23T02:11:00.000Z,,,4,4,,CO,CAN,Y,,NO,CHATHAM,"2488, 2509","5 HP / 1800 RPM / TEFC / 575V/3PH/60HZ / FRAME#184T, DORRIS 115TR25 SHAFT MOUNTED SPEED REDUCER",,No,CH-DRYER_A,CH-DRYER_A:CV1827.STAIND,CV-1827,CV,STAIND,"Status indication (open/closed, run/stop)",Conveyor (asset),Equipment status,INFEED CONVEYOR,
2522,MODIFY GRATING AS NEEDED,23-31668,CV-1827,CV-1827,,,1-10-23 11:01 AM,2023-01-10T11:01:00.000Z,2-23-23 2:11 AM,2023-02-23T02:11:00.000Z,,,4,4,,CO,CAN,Y,,NO,CHATHAM,"2488, 2509","5 HP / 1800 RPM / TEFC / 575V/3PH/60HZ / FRAME#184T, DORRIS 115TR25 SHAFT MOUNTED SPEED REDUCER",,No,CH-DR_UTIL_WTR,CH-DR_UTIL_WTR:PT35405.MEAS,PT-35405,PT,MEAS,Measured value (PV),Pressure transmitter,Measurement,CV1827 CURRENT INDICATION,CV-1827
2522,MODIFY GRATING AS NEEDED,23-31668,CV-1827,CV-1827,,,1-10-23 11:01 AM,2023-01-10T11:01:00.000Z,2-23-23 2:11 AM,2023-02-23T02:11:00.000Z,,,4,4,,CO,CAN,Y,,NO,CHATHAM,"2488, 2509","5 HP / 1800 RPM / TEFC / 575V/3PH/60HZ / FRAME#184T, DORRIS 115TR25 SHAFT MOUNTED SPEED REDUCER",,No,CH-DR_UTIL_WTR,CH-DR_UTIL_WTR:TT35452.MEAS,TT-35452,TT,MEAS,Measured value (PV),Temperature transmitter,Measurement,CV1827 CURRENT INDICATION,CV-1827
2522,MODIFY GRATING AS NEEDED,23-31668,CV-1827,CV-1827,,,1-10-23 11:01 AM,2023-01-10T11:01:00.000Z,2-23-23 2:11 AM,2023-02-23T02:11:00.000Z,,,4,4,,CO,CAN,Y,,NO,CHATHAM,"2488, 2509","5 HP / 1800 RPM / TEFC / 575V/3PH/60HZ / FRAME#184T, DORRIS 115TR25 SHAFT MOUNTED SPEED REDUCER",,No,CH-DRYER_D,CH-DRYER_D:PIC84401.SPT,PIC-84401,PIC,SPT,Setpoint (SP),Pressure indicating controller,Setpoint,CV1827 CURRENT INDICATION,CV-1827
2522,MODIFY GRATING AS NEEDED,23-31668,CV-1827,CV-1827,,,1-10-23 11:01 AM,2023-01-10T11:01:00.000Z,2-23-23 2:11 AM,2023-02-23T02:11:00.000Z,,,4,4,,CO,CAN,Y,,NO,CHATHAM,"2488, 2509","5 HP / 1800 RPM / TEFC / 575V/3PH/60HZ / FRAME#184T, DORRIS 115TR25 SHAFT MOUNTED SPEED REDUCER",,No,CH-DRYER_D_CY2,CH-DRYER_D_CY2:TT84314.PNT,TT-84314,TT,PNT,Point value / indication,Temperature transmitter,Measurement,CV1827 SPEED SWITCH,CV-1827
2522,MODIFY GRATING AS NEEDED,23-31668,CV-1827,CV-1827,,,1-10-23 11:01 AM,2023-01-10T11:01:00.000Z,2-23-23 2:11 AM,2023-02-23T02:11:00.000Z,,,4,4,,CO,CAN,Y,,NO,CHATHAM,"2488, 2509","5 HP / 1800 RPM / TEFC / 575V/3PH/60HZ / FRAME#184T, DORRIS 115TR25 SHAFT MOUNTED SPEED REDUCER",,No,CH-DR_DECANT702,CH-DR_DECANT702:HV17744.STAIND,HV-17744,HV,STAIND,"Status indication (open/closed, run/stop)",Hand/hood valve or device (asset),Status,CV1827 CURRENT INDICATION,CV-1827
1103,Inspect and clean suction piping for HC reflux pumps (P6562A&B),23-31669,P-6562B,P-6562B,,,1-10-23 11:02 AM,2023-01-10T11:02:00.000Z,4-21-23 10:39 AM,2023-04-21T10:39:00.000Z,4-28-23 6:23 AM,2023-04-28T06:23:00.000Z,4,4,,SD,CLOSE,Y,,NO,CHATHAM,,,,,,,,,,,,,,
1643,"SD23 - remove, inspect, reinstall HC eductor EJ6562",23-31671,EJ-6562,EJ-6562,,,1-10-23 11:04 AM,2023-01-10T11:04:00.000Z,4-21-23 10:38 AM,2023-04-21T10:38:00.000Z,4-28-23 6:23 AM,2023-04-28T06:23:00.000Z,4,4,,SD,CLOSE,Y,,NO,CHATHAM,,,,,,,,,,,,,,
2522,CLEAN HATCH,23-31672,CV-1827,CV-1827,,,1-10-23 11:05 AM,2023-01-10T11:05:00.000Z,2-23-23 2:11 AM,2023-02-23T02:11:00.000Z,,,4,4,,CO,CAN,Y,,NO,CHATHAM,"2488, 2509","5 HP / 1800 RPM / TEFC / 575V/3PH/60HZ / FRAME#184T, DORRIS 115TR25 SHAFT MOUNTED SPEED REDUCER",,No,CH-DRA_CYCLNS,CH-DRA_CYCLNS:SSL18172.CIN,SSL-18172,SSL,CIN,Contact input (discrete),Speed switch (motion proof),Discrete Input,CV1827 CURRENT INDICATION,CV-1827
2522,CLEAN HATCH,23-31672,CV-1827,CV-1827,,,1-10-23 11:05 AM,2023-01-10T11:05:00.000Z,2-23-23 2:11 AM,2023-02-23T02:11:00.000Z,,,4,4,,CO,CAN,Y,,NO,CHATHAM,"2488, 2509","5 HP / 1800 RPM / TEFC / 575V/3PH/60HZ / FRAME#184T, DORRIS 115TR25 SHAFT MOUNTED SPEED REDUCER",,No,CH-DRA_COMB_AIR,CH-DRA_COMB_AIR:PD18215.PNT,PD-18215,PD,PNT,Point value / indication,Pressure indication,Indication,CV1827 SPEED SWITCH,CV-1827
2522,CLEAN HATCH,23-31672,CV-1827,CV-1827,,,1-10-23 11:05 AM,2023-01-10T11:05:00.000Z,2-23-23 2:11 AM,2023-02-23T02:11:00.000Z,,,4,4,,CO,CAN,Y,,NO,CHATHAM,"2488, 2509","5 HP / 1800 RPM / TEFC / 575V/3PH/60HZ / FRAME#184T, DORRIS 115TR25 SHAFT MOUNTED SPEED REDUCER",,No,CH-DRYER_A,CH-DRYER_A:CV1827.STAIND,CV-1827,CV,STAIND,"Status indication (open/closed, run/stop)",Conveyor (asset),Equipment status,INFEED CONVEYOR,
2522,CLEAN HATCH,23-31672,CV-1827,CV-1827,,,1-10-23 11:05 AM,2023-01-10T11:05:00.000Z,2-23-23 2:11 AM,2023-02-23T02:11:00.000Z,,,4,4,,CO,CAN,Y,,NO,CHATHAM,"2488, 2509","5 HP / 1800 RPM / TEFC / 575V/3PH/60HZ / FRAME#184T, DORRIS 115TR25 SHAFT MOUNTED SPEED REDUCER",,No,CH-DR_UTIL_WTR,CH-DR_UTIL_WTR:PT35405.MEAS,PT-35405,PT,MEAS,Measured value (PV),Pressure transmitter,Measurement,CV1827 CURRENT INDICATION,CV-1827
2522,CLEAN HATCH,23-31672,CV-1827,CV-1827,,,1-10-23 11:05 AM,2023-01-10T11:05:00.000Z,2-23-23 2:11 AM,2023-02-23T02:11:00.000Z,,,4,4,,CO,CAN,Y,,NO,CHATHAM,"2488, 2509","5 HP / 1800 RPM / TEFC / 575V/3PH/60HZ / FRAME#184T, DORRIS 115TR25 SHAFT MOUNTED SPEED REDUCER",,No,CH-DR_UTIL_WTR,CH-DR_UTIL_WTR:TT35452.MEAS,TT-35452,TT,MEAS,Measured value (PV),Temperature transmitter,Measurement,CV1827 CURRENT INDICATION,CV-1827
2522,CLEAN HATCH,23-31672,CV-1827,CV-1827,,,1-10-23 11:05 AM,2023-01-10T11:05:00.000Z,2-23-23 2:11 AM,2023-02-23T02:11:00.000Z,,,4,4,,CO,CAN,Y,,NO,CHATHAM,"2488, 2509","5 HP / 1800 RPM / TEFC / 575V/3PH/60HZ / FRAME#184T, DORRIS 115TR25 SHAFT MOUNTED SPEED REDUCER",,No,CH-DRYER_D,CH-DRYER_D:PIC84401.SPT,PIC-84401,PIC,SPT,Setpoint (SP),Pressure indicating controller,Setpoint,CV1827 CURRENT INDICATION,CV-1827
2522,CLEAN HATCH,23-31672,CV-1827,CV-1827,,,1-10-23 11:05 AM,2023-01-10T11:05:00.000Z,2-23-23 2:11 AM,2023-02-23T02:11:00.000Z,,,4,4,,CO,CAN,Y,,NO,CHATHAM,"2488, 2509","5 HP / 1800 RPM / TEFC / 575V/3PH/60HZ / FRAME#184T, DORRIS 115TR25 SHAFT MOUNTED SPEED REDUCER",,No,CH-DRYER_D_CY2,CH-DRYER_D_CY2:TT84314.PNT,TT-84314,TT,PNT,Point value / indication,Temperature transmitter,Measurement,CV1827 SPEED SWITCH,CV-1827
2522,CLEAN HATCH,23-31672,CV-1827,CV-1827,,,1-10-23 11:05 AM,2023-01-10T11:05:00.000Z,2-23-23 2:11 AM,2023-02-23T02:11:00.000Z,,,4,4,,CO,CAN,Y,,NO,CHATHAM,"2488, 2509","5 HP / 1800 RPM / TEFC / 575V/3PH/60HZ / FRAME#184T, DORRIS 115TR25 SHAFT MOUNTED SPEED REDUCER",,No,CH-DR_DECANT702,CH-DR_DECANT702:HV17744.STAIND,HV-17744,HV,STAIND,"Status indication (open/closed, run/stop)",Hand/hood valve or device (asset),Status,CV1827 CURRENT INDICATION,CV-1827
,Inspect and repair as needed Cooling tower Basin,23-31673,CT-3201,CT-3201,,,1-10-23 11:05 AM,2023-01-10T11:05:00.000Z,4-14-23 11:07 AM,2023-04-14T11:07:00.000Z,5-2-23 9:18 AM,2023-05-02T09:18:00.000Z,4,4,,CO,CLOSE,Y,,NO,CHATHAM,,,,,,,,,,,,,,
1575,SD23 - Replace HC reflux cooler plate pack (E6563),23-31674,E-6563,E-6563,,,1-10-23 11:06 AM,2023-01-10T11:06:00.000Z,4-21-23 9:06 AM,2023-04-21T09:06:00.000Z,4-28-23 6:25 AM,2023-04-28T06:25:00.000Z,4,4,,SD,CLOSE,Y,,NO,CHATHAM,,,,,,,,,,,,,,
,Open man ways on TGF condenser,23-31675,,,,,1-10-23 11:07 AM,2023-01-10T11:07:00.000Z,1-11-23 4:30 PM,2023-01-11T16:30:00.000Z,1-11-23 2:09 PM,2023-01-11T14:09:00.000Z,4,4,,CO,CLOSE,Y,,NO,CHATHAM,,,,,,,,,,,,,,
1575,Remove spade from E6563 (HC reflux cooler) bypass,23-31676,E-6563,E-6563,,,1-10-23 11:08 AM,2023-01-10T11:08:00.000Z,4-21-23 9:02 AM,2023-04-21T09:02:00.000Z,4-28-23 6:25 AM,2023-04-28T06:25:00.000Z,4,4,,SD,CLOSE,Y,,NO,CHATHAM,,,,,,,,,,,,,,
,CV-1827 MECHANICAL PM,23-31677,CV-1827,CV-1827,,,1-10-23 11:08 AM,2023-01-10T11:08:00.000Z,2-28-23 10:00 AM,2023-02-28T10:00:00.000Z,4-5-23 2:01 PM,2023-04-05T14:01:00.000Z,4,4,,PM,CLOSE,Y,N,NO,CHATHAM,"2488, 2509","5 HP / 1800 RPM / TEFC / 575V/3PH/60HZ / FRAME#184T, DORRIS 115TR25 SHAFT MOUNTED SPEED REDUCER",,No,CH-DRA_CYCLNS,CH-DRA_CYCLNS:SSL18172.CIN,SSL-18172,SSL,CIN,Contact input (discrete),Speed switch (motion proof),Discrete Input,CV1827 CURRENT INDICATION,CV-1827
,CV-1827 MECHANICAL PM,23-31677,CV-1827,CV-1827,,,1-10-23 11:08 AM,2023-01-10T11:08:00.000Z,2-28-23 10:00 AM,2023-02-28T10:00:00.000Z,4-5-23 2:01 PM,2023-04-05T14:01:00.000Z,4,4,,PM,CLOSE,Y,N,NO,CHATHAM,"2488, 2509","5 HP / 1800 RPM / TEFC / 575V/3PH/60HZ / FRAME#184T, DORRIS 115TR25 SHAFT MOUNTED SPEED REDUCER",,No,CH-DRA_COMB_AIR,CH-DRA_COMB_AIR:PD18215.PNT,PD-18215,PD,PNT,Point value / indication,Pressure indication,Indication,CV1827 SPEED SWITCH,CV-1827
,CV-1827 MECHANICAL PM,23-31677,CV-1827,CV-1827,,,1-10-23 11:08 AM,2023-01-10T11:08:00.000Z,2-28-23 10:00 AM,2023-02-28T10:00:00.000Z,4-5-23 2:01 PM,2023-04-05T14:01:00.000Z,4,4,,PM,CLOSE,Y,N,NO,CHATHAM,"2488, 2509","5 HP / 1800 RPM / TEFC / 575V/3PH/60HZ / FRAME#184T, DORRIS 115TR25 SHAFT MOUNTED SPEED REDUCER",,No,CH-DRYER_A,CH-DRYER_A:CV1827.STAIND,CV-1827,CV,STAIND,"Status indication (open/closed, run/stop)",Conveyor (asset),Equipment status,INFEED CONVEYOR,
,CV-1827 MECHANICAL PM,23-31677,CV-1827,CV-1827,,,1-10-23 11:08 AM,2023-01-10T11:08:00.000Z,2-28-23 10:00 AM,2023-02-28T10:00:00.000Z,4-5-23 2:01 PM,2023-04-05T14:01:00.000Z,4,4,,PM,CLOSE,Y,N,NO,CHATHAM,"2488, 2509","5 HP / 1800 RPM / TEFC / 575V/3PH/60HZ / FRAME#184T, DORRIS 115TR25 SHAFT MOUNTED SPEED REDUCER",,No,CH-DR_UTIL_WTR,CH-DR_UTIL_WTR:PT35405.MEAS,PT-35405,PT,MEAS,Measured value (PV),Pressure transmitter,Measurement,CV1827 CURRENT INDICATION,CV-1827
,CV-1827 MECHANICAL PM,23-31677,CV-1827,CV-1827,,,1-10-23 11:08 AM,2023-01-10T11:08:00.000Z,2-28-23 10:00 AM,2023-02-28T10:00:00.000Z,4-5-23 2:01 PM,2023-04-05T14:01:00.000Z,4,4,,PM,CLOSE,Y,N,NO,CHATHAM,"2488, 2509","5 HP / 1800 RPM / TEFC / 575V/3PH/60HZ / FRAME#184T, DORRIS 115TR25 SHAFT MOUNTED SPEED REDUCER",,No,CH-DR_UTIL_WTR,CH-DR_UTIL_WTR:TT35452.MEAS,TT-35452,TT,MEAS,Measured value (PV),Temperature transmitter,Measurement,CV1827 CURRENT INDICATION,CV-1827
,CV-1827 MECHANICAL PM,23-31677,CV-1827,CV-1827,,,1-10-23 11:08 AM,2023-01-10T11:08:00.000Z,2-28-23 10:00 AM,2023-02-28T10:00:00.000Z,4-5-23 2:01 PM,2023-04-05T14:01:00.000Z,4,4,,PM,CLOSE,Y,N,NO,CHATHAM,"2488, 2509","5 HP / 1800 RPM / TEFC / 575V/3PH/60HZ / FRAME#184T, DORRIS 115TR25 SHAFT MOUNTED SPEED REDUCER",,No,CH-DRYER_D,CH-DRYER_D:PIC84401.SPT,PIC-84401,PIC,SPT,Setpoint (SP),Pressure indicating controller,Setpoint,CV1827 CURRENT INDICATION,CV-1827
,CV-1827 MECHANICAL PM,23-31677,CV-1827,CV-1827,,,1-10-23 11:08 AM,2023-01-10T11:08:00.000Z,2-28-23 10:00 AM,2023-02-28T10:00:00.000Z,4-5-23 2:01 PM,2023-04-05T14:01:00.000Z,4,4,,PM,CLOSE,Y,N,NO,CHATHAM,"2488, 2509","5 HP / 1800 RPM / TEFC / 575V/3PH/60HZ / FRAME#184T, DORRIS 115TR25 SHAFT MOUNTED SPEED REDUCER",,No,CH-DRYER_D_CY2,CH-DRYER_D_CY2:TT84314.PNT,TT-84314,TT,PNT,Point value / indication,Temperature transmitter,Measurement,CV1827 SPEED SWITCH,CV-1827
,CV-1827 MECHANICAL PM,23-31677,CV-1827,CV-1827,,,1-10-23 11:08 AM,2023-01-10T11:08:00.000Z,2-28-23 10:00 AM,2023-02-28T10:00:00.000Z,4-5-23 2:01 PM,2023-04-05T14:01:00.000Z,4,4,,PM,CLOSE,Y,N,NO,CHATHAM,"2488, 2509","5 HP / 1800 RPM / TEFC / 575V/3PH/60HZ / FRAME#184T, DORRIS 115TR25 SHAFT MOUNTED SPEED REDUCER",,No,CH-DR_DECANT702,CH-DR_DECANT702:HV17744.STAIND,HV-17744,HV,STAIND,"Status indication (open/closed, run/stop)",Hand/hood valve or device (asset),Status,CV1827 CURRENT INDICATION,CV-1827
,CHECK COUPLING BOLTS,23-31678,CV-1827,CV-1827,,,1-10-23 11:08 AM,2023-01-10T11:08:00.000Z,1-10-23 7:00 AM,2023-01-10T07:00:00.000Z,4-5-23 2:01 PM,2023-04-05T14:01:00.000Z,4,4,,PM,CLOSE,Y,,NO,CHATHAM,"2488, 2509","5 HP / 1800 RPM / TEFC / 575V/3PH/60HZ / FRAME#184T, DORRIS 115TR25 SHAFT MOUNTED SPEED REDUCER",,No,CH-DRA_CYCLNS,CH-DRA_CYCLNS:SSL18172.CIN,SSL-18172,SSL,CIN,Contact input (discrete),Speed switch (motion proof),Discrete Input,CV1827 CURRENT INDICATION,CV-1827
,CHECK COUPLING BOLTS,23-31678,CV-1827,CV-1827,,,1-10-23 11:08 AM,2023-01-10T11:08:00.000Z,1-10-23 7:00 AM,2023-01-10T07:00:00.000Z,4-5-23 2:01 PM,2023-04-05T14:01:00.000Z,4,4,,PM,CLOSE,Y,,NO,CHATHAM,"2488, 2509","5 HP / 1800 RPM / TEFC / 575V/3PH/60HZ / FRAME#184T, DORRIS 115TR25 SHAFT MOUNTED SPEED REDUCER",,No,CH-DRA_COMB_AIR,CH-DRA_COMB_AIR:PD18215.PNT,PD-18215,PD,PNT,Point value / indication,Pressure indication,Indication,CV1827 SPEED SWITCH,CV-1827
,CHECK COUPLING BOLTS,23-31678,CV-1827,CV-1827,,,1-10-23 11:08 AM,2023-01-10T11:08:00.000Z,1-10-23 7:00 AM,2023-01-10T07:00:00.000Z,4-5-23 2:01 PM,2023-04-05T14:01:00.000Z,4,4,,PM,CLOSE,Y,,NO,CHATHAM,"2488, 2509","5 HP / 1800 RPM / TEFC / 575V/3PH/60HZ / FRAME#184T, DORRIS 115TR25 SHAFT MOUNTED SPEED REDUCER",,No,CH-DRYER_A,CH-DRYER_A:CV1827.STAIND,CV-1827,CV,STAIND,"Status indication (open/closed, run/stop)",Conveyor (asset),Equipment status,INFEED CONVEYOR,
,CHECK COUPLING BOLTS,23-31678,CV-1827,CV-1827,,,1-10-23 11:08 AM,2023-01-10T11:08:00.000Z,1-10-23 7:00 AM,2023-01-10T07:00:00.000Z,4-5-23 2:01 PM,2023-04-05T14:01:00.000Z,4,4,,PM,CLOSE,Y,,NO,CHATHAM,"2488, 2509","5 HP / 1800 RPM / TEFC / 575V/3PH/60HZ / FRAME#184T, DORRIS 115TR25 SHAFT MOUNTED SPEED REDUCER",,No,CH-DR_UTIL_WTR,CH-DR_UTIL_WTR:PT35405.MEAS,PT-35405,PT,MEAS,Measured value (PV),Pressure transmitter,Measurement,CV1827 CURRENT INDICATION,CV-1827
,CHECK COUPLING BOLTS,23-31678,CV-1827,CV-1827,,,1-10-23 11:08 AM,2023-01-10T11:08:00.000Z,1-10-23 7:00 AM,2023-01-10T07:00:00.000Z,4-5-23 2:01 PM,2023-04-05T14:01:00.000Z,4,4,,PM,CLOSE,Y,,NO,CHATHAM,"2488, 2509","5 HP / 1800 RPM / TEFC / 575V/3PH/60HZ / FRAME#184T, DORRIS 115TR25 SHAFT MOUNTED SPEED REDUCER",,No,CH-DR_UTIL_WTR,CH-DR_UTIL_WTR:TT35452.MEAS,TT-35452,TT,MEAS,Measured value (PV),Temperature transmitter,Measurement,CV1827 CURRENT INDICATION,CV-1827
,CHECK COUPLING BOLTS,23-31678,CV-1827,CV-1827,,,1-10-23 11:08 AM,2023-01-10T11:08:00.000Z,1-10-23 7:00 AM,2023-01-10T07:00:00.000Z,4-5-23 2:01 PM,2023-04-05T14:01:00.000Z,4,4,,PM,CLOSE,Y,,NO,CHATHAM,"2488, 2509","5 HP / 1800 RPM / TEFC / 575V/3PH/60HZ / FRAME#184T, DORRIS 115TR25 SHAFT MOUNTED SPEED REDUCER",,No,CH-DRYER_D,CH-DRYER_D:PIC84401.SPT,PIC-84401,PIC,SPT,Setpoint (SP),Pressure indicating controller,Setpoint,CV1827 CURRENT INDICATION,CV-1827
,CHECK COUPLING BOLTS,23-31678,CV-1827,CV-1827,,,1-10-23 11:08 AM,2023-01-10T11:08:00.000Z,1-10-23 7:00 AM,2023-01-10T07:00:00.000Z,4-5-23 2:01 PM,2023-04-05T14:01:00.000Z,4,4,,PM,CLOSE,Y,,NO,CHATHAM,"2488, 2509","5 HP / 1800 RPM / TEFC / 575V/3PH/60HZ / FRAME#184T, DORRIS 115TR25 SHAFT MOUNTED SPEED REDUCER",,No,CH-DRYER_D_CY2,CH-DRYER_D_CY2:TT84314.PNT,TT-84314,TT,PNT,Point value / indication,Temperature transmitter,Measurement,CV1827 SPEED SWITCH,CV-1827
,CHECK COUPLING BOLTS,23-31678,CV-1827,CV-1827,,,1-10-23 11:08 AM,2023-01-10T11:08:00.000Z,1-10-23 7:00 AM,2023-01-10T07:00:00.000Z,4-5-23 2:01 PM,2023-04-05T14:01:00.000Z,4,4,,PM,CLOSE,Y,,NO,CHATHAM,"2488, 2509","5 HP / 1800 RPM / TEFC / 575V/3PH/60HZ / FRAME#184T, DORRIS 115TR25 SHAFT MOUNTED SPEED REDUCER",,No,CH-DR_DECANT702,CH-DR_DECANT702:HV17744.STAIND,HV-17744,HV,STAIND,"Status indication (open/closed, run/stop)",Hand/hood valve or device (asset),Status,CV1827 CURRENT INDICATION,CV-1827
,INSPECT TROUGH GASKETS FOR LEAKAGE,23-31679,CV-1827,CV-1827,,,1-10-23 11:08 AM,2023-01-10T11:08:00.000Z,1-10-23 7:00 AM,2023-01-10T07:00:00.000Z,4-5-23 2:01 PM,2023-04-05T14:01:00.000Z,4,4,,PM,CLOSE,Y,,NO,CHATHAM,"2488, 2509","5 HP / 1800 RPM / TEFC / 575V/3PH/60HZ / FRAME#184T, DORRIS 115TR25 SHAFT MOUNTED SPEED REDUCER",,No,CH-DRA_CYCLNS,CH-DRA_CYCLNS:SSL18172.CIN,SSL-18172,SSL,CIN,Contact input (discrete),Speed switch (motion proof),Discrete Input,CV1827 CURRENT INDICATION,CV-1827
,INSPECT TROUGH GASKETS FOR LEAKAGE,23-31679,CV-1827,CV-1827,,,1-10-23 11:08 AM,2023-01-10T11:08:00.000Z,1-10-23 7:00 AM,2023-01-10T07:00:00.000Z,4-5-23 2:01 PM,2023-04-05T14:01:00.000Z,4,4,,PM,CLOSE,Y,,NO,CHATHAM,"2488, 2509","5 HP / 1800 RPM / TEFC / 575V/3PH/60HZ / FRAME#184T, DORRIS 115TR25 SHAFT MOUNTED SPEED REDUCER",,No,CH-DRA_COMB_AIR,CH-DRA_COMB_AIR:PD18215.PNT,PD-18215,PD,PNT,Point value / indication,Pressure indication,Indication,CV1827 SPEED SWITCH,CV-1827
,INSPECT TROUGH GASKETS FOR LEAKAGE,23-31679,CV-1827,CV-1827,,,1-10-23 11:08 AM,2023-01-10T11:08:00.000Z,1-10-23 7:00 AM,2023-01-10T07:00:00.000Z,4-5-23 2:01 PM,2023-04-05T14:01:00.000Z,4,4,,PM,CLOSE,Y,,NO,CHATHAM,"2488, 2509","5 HP / 1800 RPM / TEFC / 575V/3PH/60HZ / FRAME#184T, DORRIS 115TR25 SHAFT MOUNTED SPEED REDUCER",,No,CH-DRYER_A,CH-DRYER_A:CV1827.STAIND,CV-1827,CV,STAIND,"Status indication (open/closed, run/stop)",Conveyor (asset),Equipment status,INFEED CONVEYOR,
,INSPECT TROUGH GASKETS FOR LEAKAGE,23-31679,CV-1827,CV-1827,,,1-10-23 11:08 AM,2023-01-10T11:08:00.000Z,1-10-23 7:00 AM,2023-01-10T07:00:00.000Z,4-5-23 2:01 PM,2023-04-05T14:01:00.000Z,4,4,,PM,CLOSE,Y,,NO,CHATHAM,"2488, 2509","5 HP / 1800 RPM / TEFC / 575V/3PH/60HZ / FRAME#184T, DORRIS 115TR25 SHAFT MOUNTED SPEED REDUCER",,No,CH-DR_UTIL_WTR,CH-DR_UTIL_WTR:PT35405.MEAS,PT-35405,PT,MEAS,Measured value (PV),Pressure transmitter,Measurement,CV1827 CURRENT INDICATION,CV-1827
,INSPECT TROUGH GASKETS FOR LEAKAGE,23-31679,CV-1827,CV-1827,,,1-10-23 11:08 AM,2023-01-10T11:08:00.000Z,1-10-23 7:00 AM,2023-01-10T07:00:00.000Z,4-5-23 2:01 PM,2023-04-05T14:01:00.000Z,4,4,,PM,CLOSE,Y,,NO,CHATHAM,"2488, 2509","5 HP / 1800 RPM / TEFC / 575V/3PH/60HZ / FRAME#184T, DORRIS 115TR25 SHAFT MOUNTED SPEED REDUCER",,No,CH-DR_UTIL_WTR,CH-DR_UTIL_WTR:TT35452.MEAS,TT-35452,TT,MEAS,Measured value (PV),Temperature transmitter,Measurement,CV1827 CURRENT INDICATION,CV-1827
,INSPECT TROUGH GASKETS FOR LEAKAGE,23-31679,CV-1827,CV-1827,,,1-10-23 11:08 AM,2023-01-10T11:08:00.000Z,1-10-23 7:00 AM,2023-01-10T07:00:00.000Z,4-5-23 2:01 PM,2023-04-05T14:01:00.000Z,4,4,,PM,CLOSE,Y,,NO,CHATHAM,"2488, 2509","5 HP / 1800 RPM / TEFC / 575V/3PH/60HZ / FRAME#184T, DORRIS 115TR25 SHAFT MOUNTED SPEED REDUCER",,No,CH-DRYER_D,CH-DRYER_D:PIC84401.SPT,PIC-84401,PIC,SPT,Setpoint (SP),Pressure indicating controller,Setpoint,CV1827 CURRENT INDICATION,CV-1827
,INSPECT TROUGH GASKETS FOR LEAKAGE,23-31679,CV-1827,CV-1827,,,1-10-23 11:08 AM,2023-01-10T11:08:00.000Z,1-10-23 7:00 AM,2023-01-10T07:00:00.000Z,4-5-23 2:01 PM,2023-04-05T14:01:00.000Z,4,4,,PM,CLOSE,Y,,NO,CHATHAM,"2488, 2509","5 HP / 1800 RPM / TEFC / 575V/3PH/60HZ / FRAME#184T, DORRIS 115TR25 SHAFT MOUNTED SPEED REDUCER",,No,CH-DRYER_D_CY2,CH-DRYER_D_CY2:TT84314.PNT,TT-84314,TT,PNT,Point value / indication,Temperature transmitter,Measurement,CV1827 SPEED SWITCH,CV-1827
,INSPECT TROUGH GASKETS FOR LEAKAGE,23-31679,CV-1827,CV-1827,,,1-10-23 11:08 AM,2023-01-10T11:08:00.000Z,1-10-23 7:00 AM,2023-01-10T07:00:00.000Z,4-5-23 2:01 PM,2023-04-05T14:01:00.000Z,4,4,,PM,CLOSE,Y,,NO,CHATHAM,"2488, 2509","5 HP / 1800 RPM / TEFC / 575V/3PH/60HZ / FRAME#184T, DORRIS 115TR25 SHAFT MOUNTED SPEED REDUCER",,No,CH-DR_DECANT702,CH-DR_DECANT702:HV17744.STAIND,HV-17744,HV,STAIND,"Status indication (open/closed, run/stop)",Hand/hood valve or device (asset),Status,CV1827 CURRENT INDICATION,CV-1827
,INSPECT PILLOW BLOCK BEARINGS,23-31680,CV-1827,CV-1827,,,1-10-23 11:08 AM,2023-01-10T11:08:00.000Z,1-10-23 7:00 AM,2023-01-10T07:00:00.000Z,4-5-23 2:01 PM,2023-04-05T14:01:00.000Z,4,4,,PM,CLOSE,Y,,NO,CHATHAM,"2488, 2509","5 HP / 1800 RPM / TEFC / 575V/3PH/60HZ / FRAME#184T, DORRIS 115TR25 SHAFT MOUNTED SPEED REDUCER",,No,CH-DRA_CYCLNS,CH-DRA_CYCLNS:SSL18172.CIN,SSL-18172,SSL,CIN,Contact input (discrete),Speed switch (motion proof),Discrete Input,CV1827 CURRENT INDICATION,CV-1827
,INSPECT PILLOW BLOCK BEARINGS,23-31680,CV-1827,CV-1827,,,1-10-23 11:08 AM,2023-01-10T11:08:00.000Z,1-10-23 7:00 AM,2023-01-10T07:00:00.000Z,4-5-23 2:01 PM,2023-04-05T14:01:00.000Z,4,4,,PM,CLOSE,Y,,NO,CHATHAM,"2488, 2509","5 HP / 1800 RPM / TEFC / 575V/3PH/60HZ / FRAME#184T, DORRIS 115TR25 SHAFT MOUNTED SPEED REDUCER",,No,CH-DRA_COMB_AIR,CH-DRA_COMB_AIR:PD18215.PNT,PD-18215,PD,PNT,Point value / indication,Pressure indication,Indication,CV1827 SPEED SWITCH,CV-1827
,INSPECT PILLOW BLOCK BEARINGS,23-31680,CV-1827,CV-1827,,,1-10-23 11:08 AM,2023-01-10T11:08:00.000Z,1-10-23 7:00 AM,2023-01-10T07:00:00.000Z,4-5-23 2:01 PM,2023-04-05T14:01:00.000Z,4,4,,PM,CLOSE,Y,,NO,CHATHAM,"2488, 2509","5 HP / 1800 RPM / TEFC / 575V/3PH/60HZ / FRAME#184T, DORRIS 115TR25 SHAFT MOUNTED SPEED REDUCER",,No,CH-DRYER_A,CH-DRYER_A:CV1827.STAIND,CV-1827,CV,STAIND,"Status indication (open/closed, run/stop)",Conveyor (asset),Equipment status,INFEED CONVEYOR,
,INSPECT PILLOW BLOCK BEARINGS,23-31680,CV-1827,CV-1827,,,1-10-23 11:08 AM,2023-01-10T11:08:00.000Z,1-10-23 7:00 AM,2023-01-10T07:00:00.000Z,4-5-23 2:01 PM,2023-04-05T14:01:00.000Z,4,4,,PM,CLOSE,Y,,NO,CHATHAM,"2488, 2509","5 HP / 1800 RPM / TEFC / 575V/3PH/60HZ / FRAME#184T, DORRIS 115TR25 SHAFT MOUNTED SPEED REDUCER",,No,CH-DR_UTIL_WTR,CH-DR_UTIL_WTR:PT35405.MEAS,PT-35405,PT,MEAS,Measured value (PV),Pressure transmitter,Measurement,CV1827 CURRENT INDICATION,CV-1827
,INSPECT PILLOW BLOCK BEARINGS,23-31680,CV-1827,CV-1827,,,1-10-23 11:08 AM,2023-01-10T11:08:00.000Z,1-10-23 7:00 AM,2023-01-10T07:00:00.000Z,4-5-23 2:01 PM,2023-04-05T14:01:00.000Z,4,4,,PM,CLOSE,Y,,NO,CHATHAM,"2488, 2509","5 HP / 1800 RPM / TEFC / 575V/3PH/60HZ / FRAME#184T, DORRIS 115TR25 SHAFT MOUNTED SPEED REDUCER",,No,CH-DR_UTIL_WTR,CH-DR_UTIL_WTR:TT35452.MEAS,TT-35452,TT,MEAS,Measured value (PV),Temperature transmitter,Measurement,CV1827 CURRENT INDICATION,CV-1827
,INSPECT PILLOW BLOCK BEARINGS,23-31680,CV-1827,CV-1827,,,1-10-23 11:08 AM,2023-01-10T11:08:00.000Z,1-10-23 7:00 AM,2023-01-10T07:00:00.000Z,4-5-23 2:01 PM,2023-04-05T14:01:00.000Z,4,4,,PM,CLOSE,Y,,NO,CHATHAM,"2488, 2509","5 HP / 1800 RPM / TEFC / 575V/3PH/60HZ / FRAME#184T, DORRIS 115TR25 SHAFT MOUNTED SPEED REDUCER",,No,CH-DRYER_D,CH-DRYER_D:PIC84401.SPT,PIC-84401,PIC,SPT,Setpoint (SP),Pressure indicating controller,Setpoint,CV1827 CURRENT INDICATION,CV-1827
,INSPECT PILLOW BLOCK BEARINGS,23-31680,CV-1827,CV-1827,,,1-10-23 11:08 AM,2023-01-10T11:08:00.000Z,1-10-23 7:00 AM,2023-01-10T07:00:00.000Z,4-5-23 2:01 PM,2023-04-05T14:01:00.000Z,4,4,,PM,CLOSE,Y,,NO,CHATHAM,"2488, 2509","5 HP / 1800 RPM / TEFC / 575V/3PH/60HZ / FRAME#184T, DORRIS 115TR25 SHAFT MOUNTED SPEED REDUCER",,No,CH-DRYER_D_CY2,CH-DRYER_D_CY2:TT84314.PNT,TT-84314,TT,PNT,Point value / indication,Temperature transmitter,Measurement,CV1827 SPEED SWITCH,CV-1827
,INSPECT PILLOW BLOCK BEARINGS,23-31680,CV-1827,CV-1827,,,1-10-23 11:08 AM,2023-01-10T11:08:00.000Z,1-10-23 7:00 AM,2023-01-10T07:00:00.000Z,4-5-23 2:01 PM,2023-04-05T14:01:00.000Z,4,4,,PM,CLOSE,Y,,NO,CHATHAM,"2488, 2509","5 HP / 1800 RPM / TEFC / 575V/3PH/60HZ / FRAME#184T, DORRIS 115TR25 SHAFT MOUNTED SPEED REDUCER",,No,CH-DR_DECANT702,CH-DR_DECANT702:HV17744.STAIND,HV-17744,HV,STAIND,"Status indication (open/closed, run/stop)",Hand/hood valve or device (asset),Status,CV1827 CURRENT INDICATION,CV-1827
,INSPECT GEARBOX,23-31681,CV-1827,CV-1827,,,1-10-23 11:08 AM,2023-01-10T11:08:00.000Z,1-10-23 7:00 AM,2023-01-10T07:00:00.000Z,4-5-23 2:01 PM,2023-04-05T14:01:00.000Z,4,4,,PM,CLOSE,Y,,NO,CHATHAM,"2488, 2509","5 HP / 1800 RPM / TEFC / 575V/3PH/60HZ / FRAME#184T, DORRIS 115TR25 SHAFT MOUNTED SPEED REDUCER",,No,CH-DRA_CYCLNS,CH-DRA_CYCLNS:SSL18172.CIN,SSL-18172,SSL,CIN,Contact input (discrete),Speed switch (motion proof),Discrete Input,CV1827 CURRENT INDICATION,CV-1827
,INSPECT GEARBOX,23-31681,CV-1827,CV-1827,,,1-10-23 11:08 AM,2023-01-10T11:08:00.000Z,1-10-23 7:00 AM,2023-01-10T07:00:00.000Z,4-5-23 2:01 PM,2023-04-05T14:01:00.000Z,4,4,,PM,CLOSE,Y,,NO,CHATHAM,"2488, 2509","5 HP / 1800 RPM / TEFC / 575V/3PH/60HZ / FRAME#184T, DORRIS 115TR25 SHAFT MOUNTED SPEED REDUCER",,No,CH-DRA_COMB_AIR,CH-DRA_COMB_AIR:PD18215.PNT,PD-18215,PD,PNT,Point value / indication,Pressure indication,Indication,CV1827 SPEED SWITCH,CV-1827
,INSPECT GEARBOX,23-31681,CV-1827,CV-1827,,,1-10-23 11:08 AM,2023-01-10T11:08:00.000Z,1-10-23 7:00 AM,2023-01-10T07:00:00.000Z,4-5-23 2:01 PM,2023-04-05T14:01:00.000Z,4,4,,PM,CLOSE,Y,,NO,CHATHAM,"2488, 2509","5 HP / 1800 RPM / TEFC / 575V/3PH/60HZ / FRAME#184T, DORRIS 115TR25 SHAFT MOUNTED SPEED REDUCER",,No,CH-DRYER_A,CH-DRYER_A:CV1827.STAIND,CV-1827,CV,STAIND,"Status indication (open/closed, run/stop)",Conveyor (asset),Equipment status,INFEED CONVEYOR,
,INSPECT GEARBOX,23-31681,CV-1827,CV-1827,,,1-10-23 11:08 AM,2023-01-10T11:08:00.000Z,1-10-23 7:00 AM,2023-01-10T07:00:00.000Z,4-5-23 2:01 PM,2023-04-05T14:01:00.000Z,4,4,,PM,CLOSE,Y,,NO,CHATHAM,"2488, 2509","5 HP / 1800 RPM / TEFC / 575V/3PH/60HZ / FRAME#184T, DORRIS 115TR25 SHAFT MOUNTED SPEED REDUCER",,No,CH-DR_UTIL_WTR,CH-DR_UTIL_WTR:PT35405.MEAS,PT-35405,PT,MEAS,Measured value (PV),Pressure transmitter,Measurement,CV1827 CURRENT INDICATION,CV-1827
,INSPECT GEARBOX,23-31681,CV-1827,CV-1827,,,1-10-23 11:08 AM,2023-01-10T11:08:00.000Z,1-10-23 7:00 AM,2023-01-10T07:00:00.000Z,4-5-23 2:01 PM,2023-04-05T14:01:00.000Z,4,4,,PM,CLOSE,Y,,NO,CHATHAM,"2488, 2509","5 HP / 1800 RPM / TEFC / 575V/3PH/60HZ / FRAME#184T, DORRIS 115TR25 SHAFT MOUNTED SPEED REDUCER",,No,CH-DR_UTIL_WTR,CH-DR_UTIL_WTR:TT35452.MEAS,TT-35452,TT,MEAS,Measured value (PV),Temperature transmitter,Measurement,CV1827 CURRENT INDICATION,CV-1827
,INSPECT GEARBOX,23-31681,CV-1827,CV-1827,,,1-10-23 11:08 AM,2023-01-10T11:08:00.000Z,1-10-23 7:00 AM,2023-01-10T07:00:00.000Z,4-5-23 2:01 PM,2023-04-05T14:01:00.000Z,4,4,,PM,CLOSE,Y,,NO,CHATHAM,"2488, 2509","5 HP / 1800 RPM / TEFC / 575V/3PH/60HZ / FRAME#184T, DORRIS 115TR25 SHAFT MOUNTED SPEED REDUCER",,No,CH-DRYER_D,CH-DRYER_D:PIC84401.SPT,PIC-84401,PIC,SPT,Setpoint (SP),Pressure indicating controller,Setpoint,CV1827 CURRENT INDICATION,CV-1827
,INSPECT GEARBOX,23-31681,CV-1827,CV-1827,,,1-10-23 11:08 AM,2023-01-10T11:08:00.000Z,1-10-23 7:00 AM,2023-01-10T07:00:00.000Z,4-5-23 2:01 PM,2023-04-05T14:01:00.000Z,4,4,,PM,CLOSE,Y,,NO,CHATHAM,"2488, 2509","5 HP / 1800 RPM / TEFC / 575V/3PH/60HZ / FRAME#184T, DORRIS 115TR25 SHAFT MOUNTED SPEED REDUCER",,No,CH-DRYER_D_CY2,CH-DRYER_D_CY2:TT84314.PNT,TT-84314,TT,PNT,Point value / indication,Temperature transmitter,Measurement,CV1827 SPEED SWITCH,CV-1827
,INSPECT GEARBOX,23-31681,CV-1827,CV-1827,,,1-10-23 11:08 AM,2023-01-10T11:08:00.000Z,1-10-23 7:00 AM,2023-01-10T07:00:00.000Z,4-5-23 2:01 PM,2023-04-05T14:01:00.000Z,4,4,,PM,CLOSE,Y,,NO,CHATHAM,"2488, 2509","5 HP / 1800 RPM / TEFC / 575V/3PH/60HZ / FRAME#184T, DORRIS 115TR25 SHAFT MOUNTED SPEED REDUCER",,No,CH-DR_DECANT702,CH-DR_DECANT702:HV17744.STAIND,HV-17744,HV,STAIND,"Status indication (open/closed, run/stop)",Hand/hood valve or device (asset),Status,CV1827 CURRENT INDICATION,CV-1827
,INSPECT SCREW CONVEYOR,23-31682,CV-1827,CV-1827,,,1-10-23 11:08 AM,2023-01-10T11:08:00.000Z,1-10-23 7:00 AM,2023-01-10T07:00:00.000Z,4-5-23 2:01 PM,2023-04-05T14:01:00.000Z,4,4,,PM,CLOSE,Y,,NO,CHATHAM,"2488, 2509","5 HP / 1800 RPM / TEFC / 575V/3PH/60HZ / FRAME#184T, DORRIS 115TR25 SHAFT MOUNTED SPEED REDUCER",,No,CH-DRA_CYCLNS,CH-DRA_CYCLNS:SSL18172.CIN,SSL-18172,SSL,CIN,Contact input (discrete),Speed switch (motion proof),Discrete Input,CV1827 CURRENT INDICATION,CV-1827
,INSPECT SCREW CONVEYOR,23-31682,CV-1827,CV-1827,,,1-10-23 11:08 AM,2023-01-10T11:08:00.000Z,1-10-23 7:00 AM,2023-01-10T07:00:00.000Z,4-5-23 2:01 PM,2023-04-05T14:01:00.000Z,4,4,,PM,CLOSE,Y,,NO,CHATHAM,"2488, 2509","5 HP / 1800 RPM / TEFC / 575V/3PH/60HZ / FRAME#184T, DORRIS 115TR25 SHAFT MOUNTED SPEED REDUCER",,No,CH-DRA_COMB_AIR,CH-DRA_COMB_AIR:PD18215.PNT,PD-18215,PD,PNT,Point value / indication,Pressure indication,Indication,CV1827 SPEED SWITCH,CV-1827
,INSPECT SCREW CONVEYOR,23-31682,CV-1827,CV-1827,,,1-10-23 11:08 AM,2023-01-10T11:08:00.000Z,1-10-23 7:00 AM,2023-01-10T07:00:00.000Z,4-5-23 2:01 PM,2023-04-05T14:01:00.000Z,4,4,,PM,CLOSE,Y,,NO,CHATHAM,"2488, 2509","5 HP / 1800 RPM / TEFC / 575V/3PH/60HZ / FRAME#184T, DORRIS 115TR25 SHAFT MOUNTED SPEED REDUCER",,No,CH-DRYER_A,CH-DRYER_A:CV1827.STAIND,CV-1827,CV,STAIND,"Status indication (open/closed, run/stop)",Conveyor (asset),Equipment status,INFEED CONVEYOR,
,INSPECT SCREW CONVEYOR,23-31682,CV-1827,CV-1827,,,1-10-23 11:08 AM,2023-01-10T11:08:00.000Z,1-10-23 7:00 AM,2023-01-10T07:00:00.000Z,4-5-23 2:01 PM,2023-04-05T14:01:00.000Z,4,4,,PM,CLOSE,Y,,NO,CHATHAM,"2488, 2509","5 HP / 1800 RPM / TEFC / 575V/3PH/60HZ / FRAME#184T, DORRIS 115TR25 SHAFT MOUNTED SPEED REDUCER",,No,CH-DR_UTIL_WTR,CH-DR_UTIL_WTR:PT35405.MEAS,PT-35405,PT,MEAS,Measured value (PV),Pressure transmitter,Measurement,CV1827 CURRENT INDICATION,CV-1827
,INSPECT SCREW CONVEYOR,23-31682,CV-1827,CV-1827,,,1-10-23 11:08 AM,2023-01-10T11:08:00.000Z,1-10-23 7:00 AM,2023-01-10T07:00:00.000Z,4-5-23 2:01 PM,2023-04-05T14:01:00.000Z,4,4,,PM,CLOSE,Y,,NO,CHATHAM,"2488, 2509","5 HP / 1800 RPM / TEFC / 575V/3PH/60HZ / FRAME#184T, DORRIS 115TR25 SHAFT MOUNTED SPEED REDUCER",,No,CH-DR_UTIL_WTR,CH-DR_UTIL_WTR:TT35452.MEAS,TT-35452,TT,MEAS,Measured value (PV),Temperature transmitter,Measurement,CV1827 CURRENT INDICATION,CV-1827
,INSPECT SCREW CONVEYOR,23-31682,CV-1827,CV-1827,,,1-10-23 11:08 AM,2023-01-10T11:08:00.000Z,1-10-23 7:00 AM,2023-01-10T07:00:00.000Z,4-5-23 2:01 PM,2023-04-05T14:01:00.000Z,4,4,,PM,CLOSE,Y,,NO,CHATHAM,"2488, 2509","5 HP / 1800 RPM / TEFC / 575V/3PH/60HZ / FRAME#184T, DORRIS 115TR25 SHAFT MOUNTED SPEED REDUCER",,No,CH-DRYER_D,CH-DRYER_D:PIC84401.SPT,PIC-84401,PIC,SPT,Setpoint (SP),Pressure indicating controller,Setpoint,CV1827 CURRENT INDICATION,CV-1827
,INSPECT SCREW CONVEYOR,23-31682,CV-1827,CV-1827,,,1-10-23 11:08 AM,2023-01-10T11:08:00.000Z,1-10-23 7:00 AM,2023-01-10T07:00:00.000Z,4-5-23 2:01 PM,2023-04-05T14:01:00.000Z,4,4,,PM,CLOSE,Y,,NO,CHATHAM,"2488, 2509","5 HP / 1800 RPM / TEFC / 575V/3PH/60HZ / FRAME#184T, DORRIS 115TR25 SHAFT MOUNTED SPEED REDUCER",,No,CH-DRYER_D_CY2,CH-DRYER_D_CY2:TT84314.PNT,TT-84314,TT,PNT,Point value / indication,Temperature transmitter,Measurement,CV1827 SPEED SWITCH,CV-1827
,INSPECT SCREW CONVEYOR,23-31682,CV-1827,CV-1827,,,1-10-23 11:08 AM,2023-01-10T11:08:00.000Z,1-10-23 7:00 AM,2023-01-10T07:00:00.000Z,4-5-23 2:01 PM,2023-04-05T14:01:00.000Z,4,4,,PM,CLOSE,Y,,NO,CHATHAM,"2488, 2509","5 HP / 1800 RPM / TEFC / 575V/3PH/60HZ / FRAME#184T, DORRIS 115TR25 SHAFT MOUNTED SPEED REDUCER",,No,CH-DR_DECANT702,CH-DR_DECANT702:HV17744.STAIND,HV-17744,HV,STAIND,"Status indication (open/closed, run/stop)",Hand/hood valve or device (asset),Status,CV1827 CURRENT INDICATION,CV-1827
,INSPECT CONVEYOR TROUGH,23-31683,CV-1827,CV-1827,,,1-10-23 11:08 AM,2023-01-10T11:08:00.000Z,2-23-23 12:00 PM,2023-02-23T12:00:00.000Z,4-5-23 2:01 PM,2023-04-05T14:01:00.000Z,4,4,,PM,CLOSE,Y,,NO,CHATHAM,"2488, 2509","5 HP / 1800 RPM / TEFC / 575V/3PH/60HZ / FRAME#184T, DORRIS 115TR25 SHAFT MOUNTED SPEED REDUCER",,No,CH-DRA_CYCLNS,CH-DRA_CYCLNS:SSL18172.CIN,SSL-18172,SSL,CIN,Contact input (discrete),Speed switch (motion proof),Discrete Input,CV1827 CURRENT INDICATION,CV-1827
,INSPECT CONVEYOR TROUGH,23-31683,CV-1827,CV-1827,,,1-10-23 11:08 AM,2023-01-10T11:08:00.000Z,2-23-23 12:00 PM,2023-02-23T12:00:00.000Z,4-5-23 2:01 PM,2023-04-05T14:01:00.000Z,4,4,,PM,CLOSE,Y,,NO,CHATHAM,"2488, 2509","5 HP / 1800 RPM / TEFC / 575V/3PH/60HZ / FRAME#184T, DORRIS 115TR25 SHAFT MOUNTED SPEED REDUCER",,No,CH-DRA_COMB_AIR,CH-DRA_COMB_AIR:PD18215.PNT,PD-18215,PD,PNT,Point value / indication,Pressure indication,Indication,CV1827 SPEED SWITCH,CV-1827
,INSPECT CONVEYOR TROUGH,23-31683,CV-1827,CV-1827,,,1-10-23 11:08 AM,2023-01-10T11:08:00.000Z,2-23-23 12:00 PM,2023-02-23T12:00:00.000Z,4-5-23 2:01 PM,2023-04-05T14:01:00.000Z,4,4,,PM,CLOSE,Y,,NO,CHATHAM,"2488, 2509","5 HP / 1800 RPM / TEFC / 575V/3PH/60HZ / FRAME#184T, DORRIS 115TR25 SHAFT MOUNTED SPEED REDUCER",,No,CH-DRYER_A,CH-DRYER_A:CV1827.STAIND,CV-1827,CV,STAIND,"Status indication (open/closed, run/stop)",Conveyor (asset),Equipment status,INFEED CONVEYOR,
,INSPECT CONVEYOR TROUGH,23-31683,CV-1827,CV-1827,,,1-10-23 11:08 AM,2023-01-10T11:08:00.000Z,2-23-23 12:00 PM,2023-02-23T12:00:00.000Z,4-5-23 2:01 PM,2023-04-05T14:01:00.000Z,4,4,,PM,CLOSE,Y,,NO,CHATHAM,"2488, 2509","5 HP / 1800 RPM / TEFC / 575V/3PH/60HZ / FRAME#184T, DORRIS 115TR25 SHAFT MOUNTED SPEED REDUCER",,No,CH-DR_UTIL_WTR,CH-DR_UTIL_WTR:PT35405.MEAS,PT-35405,PT,MEAS,Measured value (PV),Pressure transmitter,Measurement,CV1827 CURRENT INDICATION,CV-1827
,INSPECT CONVEYOR TROUGH,23-31683,CV-1827,CV-1827,,,1-10-23 11:08 AM,2023-01-10T11:08:00.000Z,2-23-23 12:00 PM,2023-02-23T12:00:00.000Z,4-5-23 2:01 PM,2023-04-05T14:01:00.000Z,4,4,,PM,CLOSE,Y,,NO,CHATHAM,"2488, 2509","5 HP / 1800 RPM / TEFC / 575V/3PH/60HZ / FRAME#184T, DORRIS 115TR25 SHAFT MOUNTED SPEED REDUCER",,No,CH-DR_UTIL_WTR,CH-DR_UTIL_WTR:TT35452.MEAS,TT-35452,TT,MEAS,Measured value (PV),Temperature transmitter,Measurement,CV1827 CURRENT INDICATION,CV-1827
,INSPECT CONVEYOR TROUGH,23-31683,CV-1827,CV-1827,,,1-10-23 11:08 AM,2023-01-10T11:08:00.000Z,2-23-23 12:00 PM,2023-02-23T12:00:00.000Z,4-5-23 2:01 PM,2023-04-05T14:01:00.000Z,4,4,,PM,CLOSE,Y,,NO,CHATHAM,"2488, 2509","5 HP / 1800 RPM / TEFC / 575V/3PH/60HZ / FRAME#184T, DORRIS 115TR25 SHAFT MOUNTED SPEED REDUCER",,No,CH-DRYER_D,CH-DRYER_D:PIC84401.SPT,PIC-84401,PIC,SPT,Setpoint (SP),Pressure indicating controller,Setpoint,CV1827 CURRENT INDICATION,CV-1827
,INSPECT CONVEYOR TROUGH,23-31683,CV-1827,CV-1827,,,1-10-23 11:08 AM,2023-01-10T11:08:00.000Z,2-23-23 12:00 PM,2023-02-23T12:00:00.000Z,4-5-23 2:01 PM,2023-04-05T14:01:00.000Z,4,4,,PM,CLOSE,Y,,NO,CHATHAM,"2488, 2509","5 HP / 1800 RPM / TEFC / 575V/3PH/60HZ / FRAME#184T, DORRIS 115TR25 SHAFT MOUNTED SPEED REDUCER",,No,CH-DRYER_D_CY2,CH-DRYER_D_CY2:TT84314.PNT,TT-84314,TT,PNT,Point value / indication,Temperature transmitter,Measurement,CV1827 SPEED SWITCH,CV-1827
,INSPECT CONVEYOR TROUGH,23-31683,CV-1827,CV-1827,,,1-10-23 11:08 AM,2023-01-10T11:08:00.000Z,2-23-23 12:00 PM,2023-02-23T12:00:00.000Z,4-5-23 2:01 PM,2023-04-05T14:01:00.000Z,4,4,,PM,CLOSE,Y,,NO,CHATHAM,"2488, 2509","5 HP / 1800 RPM / TEFC / 575V/3PH/60HZ / FRAME#184T, DORRIS 115TR25 SHAFT MOUNTED SPEED REDUCER",,No,CH-DR_DECANT702,CH-DR_DECANT702:HV17744.STAIND,HV-17744,HV,STAIND,"Status indication (open/closed, run/stop)",Hand/hood valve or device (asset),Status,CV1827 CURRENT INDICATION,CV-1827
,"2023 TA Remove, inspect, and clean CG1 oil cooler",23-31684,ME-3601A,ME-3601A,,,1-10-23 11:08 AM,2023-01-10T11:08:00.000Z,5-26-23 9:46 AM,2023-05-26T09:46:00.000Z,5-2-23 9:00 AM,2023-05-02T09:00:00.000Z,4,4,,SD,CLOSE,Y,,NO,CHATHAM,,,,,,,,,,,,,,
,CV-1828 MECHANICAL PM,23-31686,CV-1828,CV-1828,,,1-10-23 11:13 AM,2023-01-10T11:13:00.000Z,2-23-23 10:00 AM,2023-02-23T10:00:00.000Z,3-16-23 8:57 AM,2023-03-16T08:57:00.000Z,4,4,,PM,CLOSE,Y,N,NO,CHATHAM,"2489, 2514","40 HP / 1800 RPM / TEFC / 575V/3PH/60HZ / FRAME#324T, DORRIS 307TR25F2 SHAFT MOUNTED SPEED REDUCER",,Yes,CH-DRA_CYCLNS,CH-DRA_CYCLNS:TT18169C.MEAS,TT-18169C,TT,MEAS,Measured value (PV),Temperature transmitter,Measurement,CV1828 CURRENT INDICATION,CV-1828
,CV-1828 MECHANICAL PM,23-31686,CV-1828,CV-1828,,,1-10-23 11:13 AM,2023-01-10T11:13:00.000Z,2-23-23 10:00 AM,2023-02-23T10:00:00.000Z,3-16-23 8:57 AM,2023-03-16T08:57:00.000Z,4,4,,PM,CLOSE,Y,N,NO,CHATHAM,"2489, 2514","40 HP / 1800 RPM / TEFC / 575V/3PH/60HZ / FRAME#324T, DORRIS 307TR25F2 SHAFT MOUNTED SPEED REDUCER",,Yes,CH-DRA_COMB_AIR,CH-DRA_COMB_AIR:TT18180C.MEAS,TT-18180C,TT,MEAS,Measured value (PV),Temperature transmitter,Measurement,CV1828 SPEED SWITCH,CV-1828
,CV-1828 MECHANICAL PM,23-31686,CV-1828,CV-1828,,,1-10-23 11:13 AM,2023-01-10T11:13:00.000Z,2-23-23 10:00 AM,2023-02-23T10:00:00.000Z,3-16-23 8:57 AM,2023-03-16T08:57:00.000Z,4,4,,PM,CLOSE,Y,N,NO,CHATHAM,"2489, 2514","40 HP / 1800 RPM / TEFC / 575V/3PH/60HZ / FRAME#324T, DORRIS 307TR25F2 SHAFT MOUNTED SPEED REDUCER",,Yes,CH-DRYER_A,CH-DRYER_A:CV1828.STAIND,CV-1828,CV,STAIND,"Status indication (open/closed, run/stop)",Conveyor (asset),Equipment status,DRUM DISCHARGE SCREW CVYR,
,CV-1828 MECHANICAL PM,23-31686,CV-1828,CV-1828,,,1-10-23 11:13 AM,2023-01-10T11:13:00.000Z,2-23-23 10:00 AM,2023-02-23T10:00:00.000Z,3-16-23 8:57 AM,2023-03-16T08:57:00.000Z,4,4,,PM,CLOSE,Y,N,NO,CHATHAM,"2489, 2514","40 HP / 1800 RPM / TEFC / 575V/3PH/60HZ / FRAME#324T, DORRIS 307TR25F2 SHAFT MOUNTED SPEED REDUCER",,Yes,CH-DR_DUSTCOLL,CH-DR_DUSTCOLL:SY18216.OUT,SY-18216,SY,OUT,Controller output (CO),Speed output (VFD demand),Output/Demand,CV1828 CURRENT INDICATION,CV-1828
,CV-1828 MECHANICAL PM,23-31686,CV-1828,CV-1828,,,1-10-23 11:13 AM,2023-01-10T11:13:00.000Z,2-23-23 10:00 AM,2023-02-23T10:00:00.000Z,3-16-23 8:57 AM,2023-03-16T08:57:00.000Z,4,4,,PM,CLOSE,Y,N,NO,CHATHAM,"2489, 2514","40 HP / 1800 RPM / TEFC / 575V/3PH/60HZ / FRAME#324T, DORRIS 307TR25F2 SHAFT MOUNTED SPEED REDUCER",,Yes,CH-DR_UTIL_WTR,CH-DR_UTIL_WTR:PT35405.MEAS,PT-35405,PT,MEAS,Measured value (PV),Pressure transmitter,Measurement,CV1828 CURRENT INDICATION,CV-1828
,CV-1828 MECHANICAL PM,23-31686,CV-1828,CV-1828,,,1-10-23 11:13 AM,2023-01-10T11:13:00.000Z,2-23-23 10:00 AM,2023-02-23T10:00:00.000Z,3-16-23 8:57 AM,2023-03-16T08:57:00.000Z,4,4,,PM,CLOSE,Y,N,NO,CHATHAM,"2489, 2514","40 HP / 1800 RPM / TEFC / 575V/3PH/60HZ / FRAME#324T, DORRIS 307TR25F2 SHAFT MOUNTED SPEED REDUCER",,Yes,CH-DRYER_D,CH-DRYER_D:P1803D.STAIND,P-1803D,P,STAIND,"Status indication (open/closed, run/stop)",Pump (asset),Equipment status,CV1828 CURRENT INDICATION,CV-1828
,CV-1828 MECHANICAL PM,23-31686,CV-1828,CV-1828,,,1-10-23 11:13 AM,2023-01-10T11:13:00.000Z,2-23-23 10:00 AM,2023-02-23T10:00:00.000Z,3-16-23 8:57 AM,2023-03-16T08:57:00.000Z,4,4,,PM,CLOSE,Y,N,NO,CHATHAM,"2489, 2514","40 HP / 1800 RPM / TEFC / 575V/3PH/60HZ / FRAME#324T, DORRIS 307TR25F2 SHAFT MOUNTED SPEED REDUCER",,Yes,CH-DRYER_D_BMS,CH-DRYER_D_BMS:TT84207.PNT,TT-84207,TT,PNT,Point value / indication,Temperature transmitter,Measurement,CV1828 SPEED SWITCH,CV-1828
,CV-1828 MECHANICAL PM,23-31686,CV-1828,CV-1828,,,1-10-23 11:13 AM,2023-01-10T11:13:00.000Z,2-23-23 10:00 AM,2023-02-23T10:00:00.000Z,3-16-23 8:57 AM,2023-03-16T08:57:00.000Z,4,4,,PM,CLOSE,Y,N,NO,CHATHAM,"2489, 2514","40 HP / 1800 RPM / TEFC / 575V/3PH/60HZ / FRAME#324T, DORRIS 307TR25F2 SHAFT MOUNTED SPEED REDUCER",,Yes,CH-DR_DECANT701,CH-DR_DECANT701:XZSC17703A.CIN,XZSC-17703A,XZSC,CIN,Contact input (discrete),Sequence status (combined),Discrete Input,CV1828 CURRENT INDICATION,CV-1828
,CHECK COUPLING BOLTS,23-31687,CV-1828,CV-1828,,,1-10-23 11:13 AM,2023-01-10T11:13:00.000Z,1-10-23 7:00 AM,2023-01-10T07:00:00.000Z,3-16-23 8:57 AM,2023-03-16T08:57:00.000Z,4,4,,PM,CLOSE,Y,,NO,CHATHAM,"2489, 2514","40 HP / 1800 RPM / TEFC / 575V/3PH/60HZ / FRAME#324T, DORRIS 307TR25F2 SHAFT MOUNTED SPEED REDUCER",,Yes,CH-DRA_CYCLNS,CH-DRA_CYCLNS:TT18169C.MEAS,TT-18169C,TT,MEAS,Measured value (PV),Temperature transmitter,Measurement,CV1828 CURRENT INDICATION,CV-1828
,CHECK COUPLING BOLTS,23-31687,CV-1828,CV-1828,,,1-10-23 11:13 AM,2023-01-10T11:13:00.000Z,1-10-23 7:00 AM,2023-01-10T07:00:00.000Z,3-16-23 8:57 AM,2023-03-16T08:57:00.000Z,4,4,,PM,CLOSE,Y,,NO,CHATHAM,"2489, 2514","40 HP / 1800 RPM / TEFC / 575V/3PH/60HZ / FRAME#324T, DORRIS 307TR25F2 SHAFT MOUNTED SPEED REDUCER",,Yes,CH-DRA_COMB_AIR,CH-DRA_COMB_AIR:TT18180C.MEAS,TT-18180C,TT,MEAS,Measured value (PV),Temperature transmitter,Measurement,CV1828 SPEED SWITCH,CV-1828
,CHECK COUPLING BOLTS,23-31687,CV-1828,CV-1828,,,1-10-23 11:13 AM,2023-01-10T11:13:00.000Z,1-10-23 7:00 AM,2023-01-10T07:00:00.000Z,3-16-23 8:57 AM,2023-03-16T08:57:00.000Z,4,4,,PM,CLOSE,Y,,NO,CHATHAM,"2489, 2514","40 HP / 1800 RPM / TEFC / 575V/3PH/60HZ / FRAME#324T, DORRIS 307TR25F2 SHAFT MOUNTED SPEED REDUCER",,Yes,CH-DRYER_A,CH-DRYER_A:CV1828.STAIND,CV-1828,CV,STAIND,"Status indication (open/closed, run/stop)",Conveyor (asset),Equipment status,DRUM DISCHARGE SCREW CVYR,
,CHECK COUPLING BOLTS,23-31687,CV-1828,CV-1828,,,1-10-23 11:13 AM,2023-01-10T11:13:00.000Z,1-10-23 7:00 AM,2023-01-10T07:00:00.000Z,3-16-23 8:57 AM,2023-03-16T08:57:00.000Z,4,4,,PM,CLOSE,Y,,NO,CHATHAM,"2489, 2514","40 HP / 1800 RPM / TEFC / 575V/3PH/60HZ / FRAME#324T, DORRIS 307TR25F2 SHAFT MOUNTED SPEED REDUCER",,Yes,CH-DR_DUSTCOLL,CH-DR_DUSTCOLL:SY18216.OUT,SY-18216,SY,OUT,Controller output (CO),Speed output (VFD demand),Output/Demand,CV1828 CURRENT INDICATION,CV-1828
,CHECK COUPLING BOLTS,23-31687,CV-1828,CV-1828,,,1-10-23 11:13 AM,2023-01-10T11:13:00.000Z,1-10-23 7:00 AM,2023-01-10T07:00:00.000Z,3-16-23 8:57 AM,2023-03-16T08:57:00.000Z,4,4,,PM,CLOSE,Y,,NO,CHATHAM,"2489, 2514","40 HP / 1800 RPM / TEFC / 575V/3PH/60HZ / FRAME#324T, DORRIS 307TR25F2 SHAFT MOUNTED SPEED REDUCER",,Yes,CH-DR_UTIL_WTR,CH-DR_UTIL_WTR:PT35405.MEAS,PT-35405,PT,MEAS,Measured value (PV),Pressure transmitter,Measurement,CV1828 CURRENT INDICATION,CV-1828
,CHECK COUPLING BOLTS,23-31687,CV-1828,CV-1828,,,1-10-23 11:13 AM,2023-01-10T11:13:00.000Z,1-10-23 7:00 AM,2023-01-10T07:00:00.000Z,3-16-23 8:57 AM,2023-03-16T08:57:00.000Z,4,4,,PM,CLOSE,Y,,NO,CHATHAM,"2489, 2514","40 HP / 1800 RPM / TEFC / 575V/3PH/60HZ / FRAME#324T, DORRIS 307TR25F2 SHAFT MOUNTED SPEED REDUCER",,Yes,CH-DRYER_D,CH-DRYER_D:P1803D.STAIND,P-1803D,P,STAIND,"Status indication (open/closed, run/stop)",Pump (asset),Equipment status,CV1828 CURRENT INDICATION,CV-1828
,CHECK COUPLING BOLTS,23-31687,CV-1828,CV-1828,,,1-10-23 11:13 AM,2023-01-10T11:13:00.000Z,1-10-23 7:00 AM,2023-01-10T07:00:00.000Z,3-16-23 8:57 AM,2023-03-16T08:57:00.000Z,4,4,,PM,CLOSE,Y,,NO,CHATHAM,"2489, 2514","40 HP / 1800 RPM / TEFC / 575V/3PH/60HZ / FRAME#324T, DORRIS 307TR25F2 SHAFT MOUNTED SPEED REDUCER",,Yes,CH-DRYER_D_BMS,CH-DRYER_D_BMS:TT84207.PNT,TT-84207,TT,PNT,Point value / indication,Temperature transmitter,Measurement,CV1828 SPEED SWITCH,CV-1828
,CHECK COUPLING BOLTS,23-31687,CV-1828,CV-1828,,,1-10-23 11:13 AM,2023-01-10T11:13:00.000Z,1-10-23 7:00 AM,2023-01-10T07:00:00.000Z,3-16-23 8:57 AM,2023-03-16T08:57:00.000Z,4,4,,PM,CLOSE,Y,,NO,CHATHAM,"2489, 2514","40 HP / 1800 RPM / TEFC / 575V/3PH/60HZ / FRAME#324T, DORRIS 307TR25F2 SHAFT MOUNTED SPEED REDUCER",,Yes,CH-DR_DECANT701,CH-DR_DECANT701:XZSC17703A.CIN,XZSC-17703A,XZSC,CIN,Contact input (discrete),Sequence status (combined),Discrete Input,CV1828 CURRENT INDICATION,CV-1828
,INSPECT TROUGH GASKETS FOR LEAKAGE,23-31688,CV-1828,CV-1828,,,1-10-23 11:13 AM,2023-01-10T11:13:00.000Z,1-10-23 7:00 AM,2023-01-10T07:00:00.000Z,3-16-23 8:57 AM,2023-03-16T08:57:00.000Z,4,4,,PM,CLOSE,Y,,NO,CHATHAM,"2489, 2514","40 HP / 1800 RPM / TEFC / 575V/3PH/60HZ / FRAME#324T, DORRIS 307TR25F2 SHAFT MOUNTED SPEED REDUCER",,Yes,CH-DRA_CYCLNS,CH-DRA_CYCLNS:TT18169C.MEAS,TT-18169C,TT,MEAS,Measured value (PV),Temperature transmitter,Measurement,CV1828 CURRENT INDICATION,CV-1828
,INSPECT TROUGH GASKETS FOR LEAKAGE,23-31688,CV-1828,CV-1828,,,1-10-23 11:13 AM,2023-01-10T11:13:00.000Z,1-10-23 7:00 AM,2023-01-10T07:00:00.000Z,3-16-23 8:57 AM,2023-03-16T08:57:00.000Z,4,4,,PM,CLOSE,Y,,NO,CHATHAM,"2489, 2514","40 HP / 1800 RPM / TEFC / 575V/3PH/60HZ / FRAME#324T, DORRIS 307TR25F2 SHAFT MOUNTED SPEED REDUCER",,Yes,CH-DRA_COMB_AIR,CH-DRA_COMB_AIR:TT18180C.MEAS,TT-18180C,TT,MEAS,Measured value (PV),Temperature transmitter,Measurement,CV1828 SPEED SWITCH,CV-1828
,INSPECT TROUGH GASKETS FOR LEAKAGE,23-31688,CV-1828,CV-1828,,,1-10-23 11:13 AM,2023-01-10T11:13:00.000Z,1-10-23 7:00 AM,2023-01-10T07:00:00.000Z,3-16-23 8:57 AM,2023-03-16T08:57:00.000Z,4,4,,PM,CLOSE,Y,,NO,CHATHAM,"2489, 2514","40 HP / 1800 RPM / TEFC / 575V/3PH/60HZ / FRAME#324T, DORRIS 307TR25F2 SHAFT MOUNTED SPEED REDUCER",,Yes,CH-DRYER_A,CH-DRYER_A:CV1828.STAIND,CV-1828,CV,STAIND,"Status indication (open/closed, run/stop)",Conveyor (asset),Equipment status,DRUM DISCHARGE SCREW CVYR,
,INSPECT TROUGH GASKETS FOR LEAKAGE,23-31688,CV-1828,CV-1828,,,1-10-23 11:13 AM,2023-01-10T11:13:00.000Z,1-10-23 7:00 AM,2023-01-10T07:00:00.000Z,3-16-23 8:57 AM,2023-03-16T08:57:00.000Z,4,4,,PM,CLOSE,Y,,NO,CHATHAM,"2489, 2514","40 HP / 1800 RPM / TEFC / 575V/3PH/60HZ / FRAME#324T, DORRIS 307TR25F2 SHAFT MOUNTED SPEED REDUCER",,Yes,CH-DR_DUSTCOLL,CH-DR_DUSTCOLL:SY18216.OUT,SY-18216,SY,OUT,Controller output (CO),Speed output (VFD demand),Output/Demand,CV1828 CURRENT INDICATION,CV-1828
,INSPECT TROUGH GASKETS FOR LEAKAGE,23-31688,CV-1828,CV-1828,,,1-10-23 11:13 AM,2023-01-10T11:13:00.000Z,1-10-23 7:00 AM,2023-01-10T07:00:00.000Z,3-16-23 8:57 AM,2023-03-16T08:57:00.000Z,4,4,,PM,CLOSE,Y,,NO,CHATHAM,"2489, 2514","40 HP / 1800 RPM / TEFC / 575V/3PH/60HZ / FRAME#324T, DORRIS 307TR25F2 SHAFT MOUNTED SPEED REDUCER",,Yes,CH-DR_UTIL_WTR,CH-DR_UTIL_WTR:PT35405.MEAS,PT-35405,PT,MEAS,Measured value (PV),Pressure transmitter,Measurement,CV1828 CURRENT INDICATION,CV-1828
,INSPECT TROUGH GASKETS FOR LEAKAGE,23-31688,CV-1828,CV-1828,,,1-10-23 11:13 AM,2023-01-10T11:13:00.000Z,1-10-23 7:00 AM,2023-01-10T07:00:00.000Z,3-16-23 8:57 AM,2023-03-16T08:57:00.000Z,4,4,,PM,CLOSE,Y,,NO,CHATHAM,"2489, 2514","40 HP / 1800 RPM / TEFC / 575V/3PH/60HZ / FRAME#324T, DORRIS 307TR25F2 SHAFT MOUNTED SPEED REDUCER",,Yes,CH-DRYER_D,CH-DRYER_D:P1803D.STAIND,P-1803D,P,STAIND,"Status indication (open/closed, run/stop)",Pump (asset),Equipment status,CV1828 CURRENT INDICATION,CV-1828
,INSPECT TROUGH GASKETS FOR LEAKAGE,23-31688,CV-1828,CV-1828,,,1-10-23 11:13 AM,2023-01-10T11:13:00.000Z,1-10-23 7:00 AM,2023-01-10T07:00:00.000Z,3-16-23 8:57 AM,2023-03-16T08:57:00.000Z,4,4,,PM,CLOSE,Y,,NO,CHATHAM,"2489, 2514","40 HP / 1800 RPM / TEFC / 575V/3PH/60HZ / FRAME#324T, DORRIS 307TR25F2 SHAFT MOUNTED SPEED REDUCER",,Yes,CH-DRYER_D_BMS,CH-DRYER_D_BMS:TT84207.PNT,TT-84207,TT,PNT,Point value / indication,Temperature transmitter,Measurement,CV1828 SPEED SWITCH,CV-1828
,INSPECT TROUGH GASKETS FOR LEAKAGE,23-31688,CV-1828,CV-1828,,,1-10-23 11:13 AM,2023-01-10T11:13:00.000Z,1-10-23 7:00 AM,2023-01-10T07:00:00.000Z,3-16-23 8:57 AM,2023-03-16T08:57:00.000Z,4,4,,PM,CLOSE,Y,,NO,CHATHAM,"2489, 2514","40 HP / 1800 RPM / TEFC / 575V/3PH/60HZ / FRAME#324T, DORRIS 307TR25F2 SHAFT MOUNTED SPEED REDUCER",,Yes,CH-DR_DECANT701,CH-DR_DECANT701:XZSC17703A.CIN,XZSC-17703A,XZSC,CIN,Contact input (discrete),Sequence status (combined),Discrete Input,CV1828 CURRENT INDICATION,CV-1828
,INSPECT PILLOW BLOCK BEARINGS,23-31689,CV-1828,CV-1828,,,1-10-23 11:13 AM,2023-01-10T11:13:00.000Z,1-10-23 7:00 AM,2023-01-10T07:00:00.000Z,3-16-23 8:57 AM,2023-03-16T08:57:00.000Z,4,4,,PM,CLOSE,Y,,NO,CHATHAM,"2489, 2514","40 HP / 1800 RPM / TEFC / 575V/3PH/60HZ / FRAME#324T, DORRIS 307TR25F2 SHAFT MOUNTED SPEED REDUCER",,Yes,CH-DRA_CYCLNS,CH-DRA_CYCLNS:TT18169C.MEAS,TT-18169C,TT,MEAS,Measured value (PV),Temperature transmitter,Measurement,CV1828 CURRENT INDICATION,CV-1828
,INSPECT PILLOW BLOCK BEARINGS,23-31689,CV-1828,CV-1828,,,1-10-23 11:13 AM,2023-01-10T11:13:00.000Z,1-10-23 7:00 AM,2023-01-10T07:00:00.000Z,3-16-23 8:57 AM,2023-03-16T08:57:00.000Z,4,4,,PM,CLOSE,Y,,NO,CHATHAM,"2489, 2514","40 HP / 1800 RPM / TEFC / 575V/3PH/60HZ / FRAME#324T, DORRIS 307TR25F2 SHAFT MOUNTED SPEED REDUCER",,Yes,CH-DRA_COMB_AIR,CH-DRA_COMB_AIR:TT18180C.MEAS,TT-18180C,TT,MEAS,Measured value (PV),Temperature transmitter,Measurement,CV1828 SPEED SWITCH,CV-1828
,INSPECT PILLOW BLOCK BEARINGS,23-31689,CV-1828,CV-1828,,,1-10-23 11:13 AM,2023-01-10T11:13:00.000Z,1-10-23 7:00 AM,2023-01-10T07:00:00.000Z,3-16-23 8:57 AM,2023-03-16T08:57:00.000Z,4,4,,PM,CLOSE,Y,,NO,CHATHAM,"2489, 2514","40 HP / 1800 RPM / TEFC / 575V/3PH/60HZ / FRAME#324T, DORRIS 307TR25F2 SHAFT MOUNTED SPEED REDUCER",,Yes,CH-DRYER_A,CH-DRYER_A:CV1828.STAIND,CV-1828,CV,STAIND,"Status indication (open/closed, run/stop)",Conveyor (asset),Equipment status,DRUM DISCHARGE SCREW CVYR,
,INSPECT PILLOW BLOCK BEARINGS,23-31689,CV-1828,CV-1828,,,1-10-23 11:13 AM,2023-01-10T11:13:00.000Z,1-10-23 7:00 AM,2023-01-10T07:00:00.000Z,3-16-23 8:57 AM,2023-03-16T08:57:00.000Z,4,4,,PM,CLOSE,Y,,NO,CHATHAM,"2489, 2514","40 HP / 1800 RPM / TEFC / 575V/3PH/60HZ / FRAME#324T, DORRIS 307TR25F2 SHAFT MOUNTED SPEED REDUCER",,Yes,CH-DR_DUSTCOLL,CH-DR_DUSTCOLL:SY18216.OUT,SY-18216,SY,OUT,Controller output (CO),Speed output (VFD demand),Output/Demand,CV1828 CURRENT INDICATION,CV-1828
,INSPECT PILLOW BLOCK BEARINGS,23-31689,CV-1828,CV-1828,,,1-10-23 11:13 AM,2023-01-10T11:13:00.000Z,1-10-23 7:00 AM,2023-01-10T07:00:00.000Z,3-16-23 8:57 AM,2023-03-16T08:57:00.000Z,4,4,,PM,CLOSE,Y,,NO,CHATHAM,"2489, 2514","40 HP / 1800 RPM / TEFC / 575V/3PH/60HZ / FRAME#324T, DORRIS 307TR25F2 SHAFT MOUNTED SPEED REDUCER",,Yes,CH-DR_UTIL_WTR,CH-DR_UTIL_WTR:PT35405.MEAS,PT-35405,PT,MEAS,Measured value (PV),Pressure transmitter,Measurement,CV1828 CURRENT INDICATION,CV-1828
,INSPECT PILLOW BLOCK BEARINGS,23-31689,CV-1828,CV-1828,,,1-10-23 11:13 AM,2023-01-10T11:13:00.000Z,1-10-23 7:00 AM,2023-01-10T07:00:00.000Z,3-16-23 8:57 AM,2023-03-16T08:57:00.000Z,4,4,,PM,CLOSE,Y,,NO,CHATHAM,"2489, 2514","40 HP / 1800 RPM / TEFC / 575V/3PH/60HZ / FRAME#324T, DORRIS 307TR25F2 SHAFT MOUNTED SPEED REDUCER",,Yes,CH-DRYER_D,CH-DRYER_D:P1803D.STAIND,P-1803D,P,STAIND,"Status indication (open/closed, run/stop)",Pump (asset),Equipment status,CV1828 CURRENT INDICATION,CV-1828
,INSPECT PILLOW BLOCK BEARINGS,23-31689,CV-1828,CV-1828,,,1-10-23 11:13 AM,2023-01-10T11:13:00.000Z,1-10-23 7:00 AM,2023-01-10T07:00:00.000Z,3-16-23 8:57 AM,2023-03-16T08:57:00.000Z,4,4,,PM,CLOSE,Y,,NO,CHATHAM,"2489, 2514","40 HP / 1800 RPM / TEFC / 575V/3PH/60HZ / FRAME#324T, DORRIS 307TR25F2 SHAFT MOUNTED SPEED REDUCER",,Yes,CH-DRYER_D_BMS,CH-DRYER_D_BMS:TT84207.PNT,TT-84207,TT,PNT,Point value / indication,Temperature transmitter,Measurement,CV1828 SPEED SWITCH,CV-1828
,INSPECT PILLOW BLOCK BEARINGS,23-31689,CV-1828,CV-1828,,,1-10-23 11:13 AM,2023-01-10T11:13:00.000Z,1-10-23 7:00 AM,2023-01-10T07:00:00.000Z,3-16-23 8:57 AM,2023-03-16T08:57:00.000Z,4,4,,PM,CLOSE,Y,,NO,CHATHAM,"2489, 2514","40 HP / 1800 RPM / TEFC / 575V/3PH/60HZ / FRAME#324T, DORRIS 307TR25F2 SHAFT MOUNTED SPEED REDUCER",,Yes,CH-DR_DECANT701,CH-DR_DECANT701:XZSC17703A.CIN,XZSC-17703A,XZSC,CIN,Contact input (discrete),Sequence status (combined),Discrete Input,CV1828 CURRENT INDICATION,CV-1828
,INSPECT GEARBOX,23-31690,CV-1828,CV-1828,,,1-10-23 11:13 AM,2023-01-10T11:13:00.000Z,1-10-23 7:00 AM,2023-01-10T07:00:00.000Z,3-16-23 8:57 AM,2023-03-16T08:57:00.000Z,4,4,,PM,CLOSE,Y,,NO,CHATHAM,"2489, 2514","40 HP / 1800 RPM / TEFC / 575V/3PH/60HZ / FRAME#324T, DORRIS 307TR25F2 SHAFT MOUNTED SPEED REDUCER",,Yes,CH-DRA_CYCLNS,CH-DRA_CYCLNS:TT18169C.MEAS,TT-18169C,TT,MEAS,Measured value (PV),Temperature transmitter,Measurement,CV1828 CURRENT INDICATION,CV-1828
,INSPECT GEARBOX,23-31690,CV-1828,CV-1828,,,1-10-23 11:13 AM,2023-01-10T11:13:00.000Z,1-10-23 7:00 AM,2023-01-10T07:00:00.000Z,3-16-23 8:57 AM,2023-03-16T08:57:00.000Z,4,4,,PM,CLOSE,Y,,NO,CHATHAM,"2489, 2514","40 HP / 1800 RPM / TEFC / 575V/3PH/60HZ / FRAME#324T, DORRIS 307TR25F2 SHAFT MOUNTED SPEED REDUCER",,Yes,CH-DRA_COMB_AIR,CH-DRA_COMB_AIR:TT18180C.MEAS,TT-18180C,TT,MEAS,Measured value (PV),Temperature transmitter,Measurement,CV1828 SPEED SWITCH,CV-1828
,INSPECT GEARBOX,23-31690,CV-1828,CV-1828,,,1-10-23 11:13 AM,2023-01-10T11:13:00.000Z,1-10-23 7:00 AM,2023-01-10T07:00:00.000Z,3-16-23 8:57 AM,2023-03-16T08:57:00.000Z,4,4,,PM,CLOSE,Y,,NO,CHATHAM,"2489, 2514","40 HP / 1800 RPM / TEFC / 575V/3PH/60HZ / FRAME#324T, DORRIS 307TR25F2 SHAFT MOUNTED SPEED REDUCER",,Yes,CH-DRYER_A,CH-DRYER_A:CV1828.STAIND,CV-1828,CV,STAIND,"Status indication (open/closed, run/stop)",Conveyor (asset),Equipment status,DRUM DISCHARGE SCREW CVYR,
,INSPECT GEARBOX,23-31690,CV-1828,CV-1828,,,1-10-23 11:13 AM,2023-01-10T11:13:00.000Z,1-10-23 7:00 AM,2023-01-10T07:00:00.000Z,3-16-23 8:57 AM,2023-03-16T08:57:00.000Z,4,4,,PM,CLOSE,Y,,NO,CHATHAM,"2489, 2514","40 HP / 1800 RPM / TEFC / 575V/3PH/60HZ / FRAME#324T, DORRIS 307TR25F2 SHAFT MOUNTED SPEED REDUCER",,Yes,CH-DR_DUSTCOLL,CH-DR_DUSTCOLL:SY18216.OUT,SY-18216,SY,OUT,Controller output (CO),Speed output (VFD demand),Output/Demand,CV1828 CURRENT INDICATION,CV-1828
,INSPECT GEARBOX,23-31690,CV-1828,CV-1828,,,1-10-23 11:13 AM,2023-01-10T11:13:00.000Z,1-10-23 7:00 AM,2023-01-10T07:00:00.000Z,3-16-23 8:57 AM,2023-03-16T08:57:00.000Z,4,4,,PM,CLOSE,Y,,NO,CHATHAM,"2489, 2514","40 HP / 1800 RPM / TEFC / 575V/3PH/60HZ / FRAME#324T, DORRIS 307TR25F2 SHAFT MOUNTED SPEED REDUCER",,Yes,CH-DR_UTIL_WTR,CH-DR_UTIL_WTR:PT35405.MEAS,PT-35405,PT,MEAS,Measured value (PV),Pressure transmitter,Measurement,CV1828 CURRENT INDICATION,CV-1828
,INSPECT GEARBOX,23-31690,CV-1828,CV-1828,,,1-10-23 11:13 AM,2023-01-10T11:13:00.000Z,1-10-23 7:00 AM,2023-01-10T07:00:00.000Z,3-16-23 8:57 AM,2023-03-16T08:57:00.000Z,4,4,,PM,CLOSE,Y,,NO,CHATHAM,"2489, 2514","40 HP / 1800 RPM / TEFC / 575V/3PH/60HZ / FRAME#324T, DORRIS 307TR25F2 SHAFT MOUNTED SPEED REDUCER",,Yes,CH-DRYER_D,CH-DRYER_D:P1803D.STAIND,P-1803D,P,STAIND,"Status indication (open/closed, run/stop)",Pump (asset),Equipment status,CV1828 CURRENT INDICATION,CV-1828
,INSPECT GEARBOX,23-31690,CV-1828,CV-1828,,,1-10-23 11:13 AM,2023-01-10T11:13:00.000Z,1-10-23 7:00 AM,2023-01-10T07:00:00.000Z,3-16-23 8:57 AM,2023-03-16T08:57:00.000Z,4,4,,PM,CLOSE,Y,,NO,CHATHAM,"2489, 2514","40 HP / 1800 RPM / TEFC / 575V/3PH/60HZ / FRAME#324T, DORRIS 307TR25F2 SHAFT MOUNTED SPEED REDUCER",,Yes,CH-DRYER_D_BMS,CH-DRYER_D_BMS:TT84207.PNT,TT-84207,TT,PNT,Point value / indication,Temperature transmitter,Measurement,CV1828 SPEED SWITCH,CV-1828
,INSPECT GEARBOX,23-31690,CV-1828,CV-1828,,,1-10-23 11:13 AM,2023-01-10T11:13:00.000Z,1-10-23 7:00 AM,2023-01-10T07:00:00.000Z,3-16-23 8:57 AM,2023-03-16T08:57:00.000Z,4,4,,PM,CLOSE,Y,,NO,CHATHAM,"2489, 2514","40 HP / 1800 RPM / TEFC / 575V/3PH/60HZ / FRAME#324T, DORRIS 307TR25F2 SHAFT MOUNTED SPEED REDUCER",,Yes,CH-DR_DECANT701,CH-DR_DECANT701:XZSC17703A.CIN,XZSC-17703A,XZSC,CIN,Contact input (discrete),Sequence status (combined),Discrete Input,CV1828 CURRENT INDICATION,CV-1828
,INSPECT SCREW CONVEYOR,23-31691,CV-1828,CV-1828,,,1-10-23 11:13 AM,2023-01-10T11:13:00.000Z,1-10-23 7:00 AM,2023-01-10T07:00:00.000Z,3-16-23 8:57 AM,2023-03-16T08:57:00.000Z,4,4,,PM,CLOSE,Y,,NO,CHATHAM,"2489, 2514","40 HP / 1800 RPM / TEFC / 575V/3PH/60HZ / FRAME#324T, DORRIS 307TR25F2 SHAFT MOUNTED SPEED REDUCER",,Yes,CH-DRA_CYCLNS,CH-DRA_CYCLNS:TT18169C.MEAS,TT-18169C,TT,MEAS,Measured value (PV),Temperature transmitter,Measurement,CV1828 CURRENT INDICATION,CV-1828
,INSPECT SCREW CONVEYOR,23-31691,CV-1828,CV-1828,,,1-10-23 11:13 AM,2023-01-10T11:13:00.000Z,1-10-23 7:00 AM,2023-01-10T07:00:00.000Z,3-16-23 8:57 AM,2023-03-16T08:57:00.000Z,4,4,,PM,CLOSE,Y,,NO,CHATHAM,"2489, 2514","40 HP / 1800 RPM / TEFC / 575V/3PH/60HZ / FRAME#324T, DORRIS 307TR25F2 SHAFT MOUNTED SPEED REDUCER",,Yes,CH-DRA_COMB_AIR,CH-DRA_COMB_AIR:TT18180C.MEAS,TT-18180C,TT,MEAS,Measured value (PV),Temperature transmitter,Measurement,CV1828 SPEED SWITCH,CV-1828
,INSPECT SCREW CONVEYOR,23-31691,CV-1828,CV-1828,,,1-10-23 11:13 AM,2023-01-10T11:13:00.000Z,1-10-23 7:00 AM,2023-01-10T07:00:00.000Z,3-16-23 8:57 AM,2023-03-16T08:57:00.000Z,4,4,,PM,CLOSE,Y,,NO,CHATHAM,"2489, 2514","40 HP / 1800 RPM / TEFC / 575V/3PH/60HZ / FRAME#324T, DORRIS 307TR25F2 SHAFT MOUNTED SPEED REDUCER",,Yes,CH-DRYER_A,CH-DRYER_A:CV1828.STAIND,CV-1828,CV,STAIND,"Status indication (open/closed, run/stop)",Conveyor (asset),Equipment status,DRUM DISCHARGE SCREW CVYR,
,INSPECT SCREW CONVEYOR,23-31691,CV-1828,CV-1828,,,1-10-23 11:13 AM,2023-01-10T11:13:00.000Z,1-10-23 7:00 AM,2023-01-10T07:00:00.000Z,3-16-23 8:57 AM,2023-03-16T08:57:00.000Z,4,4,,PM,CLOSE,Y,,NO,CHATHAM,"2489, 2514","40 HP / 1800 RPM / TEFC / 575V/3PH/60HZ / FRAME#324T, DORRIS 307TR25F2 SHAFT MOUNTED SPEED REDUCER",,Yes,CH-DR_DUSTCOLL,CH-DR_DUSTCOLL:SY18216.OUT,SY-18216,SY,OUT,Controller output (CO),Speed output (VFD demand),Output/Demand,CV1828 CURRENT INDICATION,CV-1828
,INSPECT SCREW CONVEYOR,23-31691,CV-1828,CV-1828,,,1-10-23 11:13 AM,2023-01-10T11:13:00.000Z,1-10-23 7:00 AM,2023-01-10T07:00:00.000Z,3-16-23 8:57 AM,2023-03-16T08:57:00.000Z,4,4,,PM,CLOSE,Y,,NO,CHATHAM,"2489, 2514","40 HP / 1800 RPM / TEFC / 575V/3PH/60HZ / FRAME#324T, DORRIS 307TR25F2 SHAFT MOUNTED SPEED REDUCER",,Yes,CH-DR_UTIL_WTR,CH-DR_UTIL_WTR:PT35405.MEAS,PT-35405,PT,MEAS,Measured value (PV),Pressure transmitter,Measurement,CV1828 CURRENT INDICATION,CV-1828
,INSPECT SCREW CONVEYOR,23-31691,CV-1828,CV-1828,,,1-10-23 11:13 AM,2023-01-10T11:13:00.000Z,1-10-23 7:00 AM,2023-01-10T07:00:00.000Z,3-16-23 8:57 AM,2023-03-16T08:57:00.000Z,4,4,,PM,CLOSE,Y,,NO,CHATHAM,"2489, 2514","40 HP / 1800 RPM / TEFC / 575V/3PH/60HZ / FRAME#324T, DORRIS 307TR25F2 SHAFT MOUNTED SPEED REDUCER",,Yes,CH-DRYER_D,CH-DRYER_D:P1803D.STAIND,P-1803D,P,STAIND,"Status indication (open/closed, run/stop)",Pump (asset),Equipment status,CV1828 CURRENT INDICATION,CV-1828
,INSPECT SCREW CONVEYOR,23-31691,CV-1828,CV-1828,,,1-10-23 11:13 AM,2023-01-10T11:13:00.000Z,1-10-23 7:00 AM,2023-01-10T07:00:00.000Z,3-16-23 8:57 AM,2023-03-16T08:57:00.000Z,4,4,,PM,CLOSE,Y,,NO,CHATHAM,"2489, 2514","40 HP / 1800 RPM / TEFC / 575V/3PH/60HZ / FRAME#324T, DORRIS 307TR25F2 SHAFT MOUNTED SPEED REDUCER",,Yes,CH-DRYER_D_BMS,CH-DRYER_D_BMS:TT84207.PNT,TT-84207,TT,PNT,Point value / indication,Temperature transmitter,Measurement,CV1828 SPEED SWITCH,CV-1828
,INSPECT SCREW CONVEYOR,23-31691,CV-1828,CV-1828,,,1-10-23 11:13 AM,2023-01-10T11:13:00.000Z,1-10-23 7:00 AM,2023-01-10T07:00:00.000Z,3-16-23 8:57 AM,2023-03-16T08:57:00.000Z,4,4,,PM,CLOSE,Y,,NO,CHATHAM,"2489, 2514","40 HP / 1800 RPM / TEFC / 575V/3PH/60HZ / FRAME#324T, DORRIS 307TR25F2 SHAFT MOUNTED SPEED REDUCER",,Yes,CH-DR_DECANT701,CH-DR_DECANT701:XZSC17703A.CIN,XZSC-17703A,XZSC,CIN,Contact input (discrete),Sequence status (combined),Discrete Input,CV1828 CURRENT INDICATION,CV-1828
,INSPECT CONVEYOR TROUGH,23-31692,CV-1828,CV-1828,,,1-10-23 11:13 AM,2023-01-10T11:13:00.000Z,1-10-23 7:00 AM,2023-01-10T07:00:00.000Z,3-16-23 8:57 AM,2023-03-16T08:57:00.000Z,4,4,,PM,CLOSE,Y,,NO,CHATHAM,"2489, 2514","40 HP / 1800 RPM / TEFC / 575V/3PH/60HZ / FRAME#324T, DORRIS 307TR25F2 SHAFT MOUNTED SPEED REDUCER",,Yes,CH-DRA_CYCLNS,CH-DRA_CYCLNS:TT18169C.MEAS,TT-18169C,TT,MEAS,Measured value (PV),Temperature transmitter,Measurement,CV1828 CURRENT INDICATION,CV-1828
,INSPECT CONVEYOR TROUGH,23-31692,CV-1828,CV-1828,,,1-10-23 11:13 AM,2023-01-10T11:13:00.000Z,1-10-23 7:00 AM,2023-01-10T07:00:00.000Z,3-16-23 8:57 AM,2023-03-16T08:57:00.000Z,4,4,,PM,CLOSE,Y,,NO,CHATHAM,"2489, 2514","40 HP / 1800 RPM / TEFC / 575V/3PH/60HZ / FRAME#324T, DORRIS 307TR25F2 SHAFT MOUNTED SPEED REDUCER",,Yes,CH-DRA_COMB_AIR,CH-DRA_COMB_AIR:TT18180C.MEAS,TT-18180C,TT,MEAS,Measured value (PV),Temperature transmitter,Measurement,CV1828 SPEED SWITCH,CV-1828
,INSPECT CONVEYOR TROUGH,23-31692,CV-1828,CV-1828,,,1-10-23 11:13 AM,2023-01-10T11:13:00.000Z,1-10-23 7:00 AM,2023-01-10T07:00:00.000Z,3-16-23 8:57 AM,2023-03-16T08:57:00.000Z,4,4,,PM,CLOSE,Y,,NO,CHATHAM,"2489, 2514","40 HP / 1800 RPM / TEFC / 575V/3PH/60HZ / FRAME#324T, DORRIS 307TR25F2 SHAFT MOUNTED SPEED REDUCER",,Yes,CH-DRYER_A,CH-DRYER_A:CV1828.STAIND,CV-1828,CV,STAIND,"Status indication (open/closed, run/stop)",Conveyor (asset),Equipment status,DRUM DISCHARGE SCREW CVYR,
,INSPECT CONVEYOR TROUGH,23-31692,CV-1828,CV-1828,,,1-10-23 11:13 AM,2023-01-10T11:13:00.000Z,1-10-23 7:00 AM,2023-01-10T07:00:00.000Z,3-16-23 8:57 AM,2023-03-16T08:57:00.000Z,4,4,,PM,CLOSE,Y,,NO,CHATHAM,"2489, 2514","40 HP / 1800 RPM / TEFC / 575V/3PH/60HZ / FRAME#324T, DORRIS 307TR25F2 SHAFT MOUNTED SPEED REDUCER",,Yes,CH-DR_DUSTCOLL,CH-DR_DUSTCOLL:SY18216.OUT,SY-18216,SY,OUT,Controller output (CO),Speed output (VFD demand),Output/Demand,CV1828 CURRENT INDICATION,CV-1828
,INSPECT CONVEYOR TROUGH,23-31692,CV-1828,CV-1828,,,1-10-23 11:13 AM,2023-01-10T11:13:00.000Z,1-10-23 7:00 AM,2023-01-10T07:00:00.000Z,3-16-23 8:57 AM,2023-03-16T08:57:00.000Z,4,4,,PM,CLOSE,Y,,NO,CHATHAM,"2489, 2514","40 HP / 1800 RPM / TEFC / 575V/3PH/60HZ / FRAME#324T, DORRIS 307TR25F2 SHAFT MOUNTED SPEED REDUCER",,Yes,CH-DR_UTIL_WTR,CH-DR_UTIL_WTR:PT35405.MEAS,PT-35405,PT,MEAS,Measured value (PV),Pressure transmitter,Measurement,CV1828 CURRENT INDICATION,CV-1828
,INSPECT CONVEYOR TROUGH,23-31692,CV-1828,CV-1828,,,1-10-23 11:13 AM,2023-01-10T11:13:00.000Z,1-10-23 7:00 AM,2023-01-10T07:00:00.000Z,3-16-23 8:57 AM,2023-03-16T08:57:00.000Z,4,4,,PM,CLOSE,Y,,NO,CHATHAM,"2489, 2514","40 HP / 1800 RPM / TEFC / 575V/3PH/60HZ / FRAME#324T, DORRIS 307TR25F2 SHAFT MOUNTED SPEED REDUCER",,Yes,CH-DRYER_D,CH-DRYER_D:P1803D.STAIND,P-1803D,P,STAIND,"Status indication (open/closed, run/stop)",Pump (asset),Equipment status,CV1828 CURRENT INDICATION,CV-1828
,INSPECT CONVEYOR TROUGH,23-31692,CV-1828,CV-1828,,,1-10-23 11:13 AM,2023-01-10T11:13:00.000Z,1-10-23 7:00 AM,2023-01-10T07:00:00.000Z,3-16-23 8:57 AM,2023-03-16T08:57:00.000Z,4,4,,PM,CLOSE,Y,,NO,CHATHAM,"2489, 2514","40 HP / 1800 RPM / TEFC / 575V/3PH/60HZ / FRAME#324T, DORRIS 307TR25F2 SHAFT MOUNTED SPEED REDUCER",,Yes,CH-DRYER_D_BMS,CH-DRYER_D_BMS:TT84207.PNT,TT-84207,TT,PNT,Point value / indication,Temperature transmitter,Measurement,CV1828 SPEED SWITCH,CV-1828
,INSPECT CONVEYOR TROUGH,23-31692,CV-1828,CV-1828,,,1-10-23 11:13 AM,2023-01-10T11:13:00.000Z,1-10-23 7:00 AM,2023-01-10T07:00:00.000Z,3-16-23 8:57 AM,2023-03-16T08:57:00.000Z,4,4,,PM,CLOSE,Y,,NO,CHATHAM,"2489, 2514","40 HP / 1800 RPM / TEFC / 575V/3PH/60HZ / FRAME#324T, DORRIS 307TR25F2 SHAFT MOUNTED SPEED REDUCER",,Yes,CH-DR_DECANT701,CH-DR_DECANT701:XZSC17703A.CIN,XZSC-17703A,XZSC,CIN,Contact input (discrete),Sequence status (combined),Discrete Input,CV1828 CURRENT INDICATION,CV-1828
,CV-1830 MECHANICAL PM,23-31693,CV-1830,CV-1830,,,1-10-23 11:15 AM,2023-01-10T11:15:00.000Z,2-23-23 10:00 AM,2023-02-23T10:00:00.000Z,4-5-23 2:01 PM,2023-04-05T14:01:00.000Z,4,4,,PM,CLOSE,Y,N,NO,CHATHAM,"2490, 2515","20 HP / 1760 RPM / TEFC / 575V/3PH/60HZ / FRAME#256T, DORRIS 315TR25 SHAFT MOUNTED SPEED REDUCER",,No,CH-DRYER_A,CH-DRYER_A:CV1830.STAIND,CV-1830,CV,STAIND,"Status indication (open/closed, run/stop)",Conveyor (asset),Equipment status,RECYCLE DRAG CONVEYOR,
,CHECK COUPLING BOLTS,23-31694,CV-1830,CV-1830,,,1-10-23 11:15 AM,2023-01-10T11:15:00.000Z,1-10-23 7:00 AM,2023-01-10T07:00:00.000Z,4-5-23 2:01 PM,2023-04-05T14:01:00.000Z,4,4,,PM,CLOSE,Y,,NO,CHATHAM,"2490, 2515","20 HP / 1760 RPM / TEFC / 575V/3PH/60HZ / FRAME#256T, DORRIS 315TR25 SHAFT MOUNTED SPEED REDUCER",,No,CH-DRYER_A,CH-DRYER_A:CV1830.STAIND,CV-1830,CV,STAIND,"Status indication (open/closed, run/stop)",Conveyor (asset),Equipment status,RECYCLE DRAG CONVEYOR,
,INSPECT TROUGH GASKETS FOR LEAKAGE,23-31695,CV-1830,CV-1830,,,1-10-23 11:15 AM,2023-01-10T11:15:00.000Z,1-10-23 7:00 AM,2023-01-10T07:00:00.000Z,4-5-23 2:01 PM,2023-04-05T14:01:00.000Z,4,4,,PM,CLOSE,Y,,NO,CHATHAM,"2490, 2515","20 HP / 1760 RPM / TEFC / 575V/3PH/60HZ / FRAME#256T, DORRIS 315TR25 SHAFT MOUNTED SPEED REDUCER",,No,CH-DRYER_A,CH-DRYER_A:CV1830.STAIND,CV-1830,CV,STAIND,"Status indication (open/closed, run/stop)",Conveyor (asset),Equipment status,RECYCLE DRAG CONVEYOR,
,INSPECT PILLOW BLOCK BEARINGS,23-31696,CV-1830,CV-1830,,,1-10-23 11:15 AM,2023-01-10T11:15:00.000Z,1-10-23 7:00 AM,2023-01-10T07:00:00.000Z,4-5-23 2:01 PM,2023-04-05T14:01:00.000Z,4,4,,PM,CLOSE,Y,,NO,CHATHAM,"2490, 2515","20 HP / 1760 RPM / TEFC / 575V/3PH/60HZ / FRAME#256T, DORRIS 315TR25 SHAFT MOUNTED SPEED REDUCER",,No,CH-DRYER_A,CH-DRYER_A:CV1830.STAIND,CV-1830,CV,STAIND,"Status indication (open/closed, run/stop)",Conveyor (asset),Equipment status,RECYCLE DRAG CONVEYOR,
,INSPECT GEARBOX,23-31697,CV-1830,CV-1830,,,1-10-23 11:15 AM,2023-01-10T11:15:00.000Z,1-10-23 7:00 AM,2023-01-10T07:00:00.000Z,4-5-23 2:01 PM,2023-04-05T14:01:00.000Z,4,4,,PM,CLOSE,Y,,NO,CHATHAM,"2490, 2515","20 HP / 1760 RPM / TEFC / 575V/3PH/60HZ / FRAME#256T, DORRIS 315TR25 SHAFT MOUNTED SPEED REDUCER",,No,CH-DRYER_A,CH-DRYER_A:CV1830.STAIND,CV-1830,CV,STAIND,"Status indication (open/closed, run/stop)",Conveyor (asset),Equipment status,RECYCLE DRAG CONVEYOR,
,INSPECT SCREW CONVEYOR,23-31698,CV-1830,CV-1830,,,1-10-23 11:15 AM,2023-01-10T11:15:00.000Z,1-10-23 7:00 AM,2023-01-10T07:00:00.000Z,4-5-23 2:01 PM,2023-04-05T14:01:00.000Z,4,4,,PM,CLOSE,Y,,NO,CHATHAM,"2490, 2515","20 HP / 1760 RPM / TEFC / 575V/3PH/60HZ / FRAME#256T, DORRIS 315TR25 SHAFT MOUNTED SPEED REDUCER",,No,CH-DRYER_A,CH-DRYER_A:CV1830.STAIND,CV-1830,CV,STAIND,"Status indication (open/closed, run/stop)",Conveyor (asset),Equipment status,RECYCLE DRAG CONVEYOR,
,INSPECT CONVEYOR TROUGH,23-31699,CV-1830,CV-1830,,,1-10-23 11:15 AM,2023-01-10T11:15:00.000Z,1-10-23 7:00 AM,2023-01-10T07:00:00.000Z,4-5-23 2:01 PM,2023-04-05T14:01:00.000Z,4,4,,PM,CLOSE,Y,,NO,CHATHAM,"2490, 2515","20 HP / 1760 RPM / TEFC / 575V/3PH/60HZ / FRAME#256T, DORRIS 315TR25 SHAFT MOUNTED SPEED REDUCER",,No,CH-DRYER_A,CH-DRYER_A:CV1830.STAIND,CV-1830,CV,STAIND,"Status indication (open/closed, run/stop)",Conveyor (asset),Equipment status,RECYCLE DRAG CONVEYOR,
,CV-1831 MECHANICAL PM,23-31700,CV-1831,CV-1831,,,1-10-23 11:18 AM,2023-01-10T11:18:00.000Z,2-23-23 10:00 AM,2023-02-23T10:00:00.000Z,4-5-23 2:01 PM,2023-04-05T14:01:00.000Z,4,4,,PM,CLOSE,Y,N,NO,CHATHAM,"2491, 2516","10 HP / 1800 RPM / TEFC / 575V/3PH/60HZ / FRAME#215T, DORRIS 207TR25 SHAFT MOUNTED SPEED REDUCER",,No,CH-DRYER_A,CH-DRYER_A:IT18143D.MEAS,IT-18143D,IT,MEAS,Measured value (PV),Current transmitter (motor amps),Measurement,CV1831 CURRENT INDICATION,CV-1831
,CV-1831 MECHANICAL PM,23-31700,CV-1831,CV-1831,,,1-10-23 11:18 AM,2023-01-10T11:18:00.000Z,2-23-23 10:00 AM,2023-02-23T10:00:00.000Z,4-5-23 2:01 PM,2023-04-05T14:01:00.000Z,4,4,,PM,CLOSE,Y,N,NO,CHATHAM,"2491, 2516","10 HP / 1800 RPM / TEFC / 575V/3PH/60HZ / FRAME#215T, DORRIS 207TR25 SHAFT MOUNTED SPEED REDUCER",,No,CH-DRYER_A,CH-DRYER_A:TIC18147A.MEAS,TIC-18147A,TIC,MEAS,Measured value (PV),Temperature indicating controller,Measurement,CV1831 SPEED SWITCH,CV-1831
,CV-1831 MECHANICAL PM,23-31700,CV-1831,CV-1831,,,1-10-23 11:18 AM,2023-01-10T11:18:00.000Z,2-23-23 10:00 AM,2023-02-23T10:00:00.000Z,4-5-23 2:01 PM,2023-04-05T14:01:00.000Z,4,4,,PM,CLOSE,Y,N,NO,CHATHAM,"2491, 2516","10 HP / 1800 RPM / TEFC / 575V/3PH/60HZ / FRAME#215T, DORRIS 207TR25 SHAFT MOUNTED SPEED REDUCER",,No,CH-DRA_CYCLNS,CH-DRA_CYCLNS:CV1831.STAIND,CV-1831,CV,STAIND,"Status indication (open/closed, run/stop)",Conveyor (asset),Equipment status,CYCLONE SCREW CONVEYOR,
,CHECK COUPLING BOLTS,23-31701,CV-1831,CV-1831,,,1-10-23 11:18 AM,2023-01-10T11:18:00.000Z,1-10-23 7:00 AM,2023-01-10T07:00:00.000Z,4-5-23 2:01 PM,2023-04-05T14:01:00.000Z,4,4,,PM,CLOSE,Y,,NO,CHATHAM,"2491, 2516","10 HP / 1800 RPM / TEFC / 575V/3PH/60HZ / FRAME#215T, DORRIS 207TR25 SHAFT MOUNTED SPEED REDUCER",,No,CH-DRYER_A,CH-DRYER_A:IT18143D.MEAS,IT-18143D,IT,MEAS,Measured value (PV),Current transmitter (motor amps),Measurement,CV1831 CURRENT INDICATION,CV-1831
,CHECK COUPLING BOLTS,23-31701,CV-1831,CV-1831,,,1-10-23 11:18 AM,2023-01-10T11:18:00.000Z,1-10-23 7:00 AM,2023-01-10T07:00:00.000Z,4-5-23 2:01 PM,2023-04-05T14:01:00.000Z,4,4,,PM,CLOSE,Y,,NO,CHATHAM,"2491, 2516","10 HP / 1800 RPM / TEFC / 575V/3PH/60HZ / FRAME#215T, DORRIS 207TR25 SHAFT MOUNTED SPEED REDUCER",,No,CH-DRYER_A,CH-DRYER_A:TIC18147A.MEAS,TIC-18147A,TIC,MEAS,Measured value (PV),Temperature indicating controller,Measurement,CV1831 SPEED SWITCH,CV-1831
,CHECK COUPLING BOLTS,23-31701,CV-1831,CV-1831,,,1-10-23 11:18 AM,2023-01-10T11:18:00.000Z,1-10-23 7:00 AM,2023-01-10T07:00:00.000Z,4-5-23 2:01 PM,2023-04-05T14:01:00.000Z,4,4,,PM,CLOSE,Y,,NO,CHATHAM,"2491, 2516","10 HP / 1800 RPM / TEFC / 575V/3PH/60HZ / FRAME#215T, DORRIS 207TR25 SHAFT MOUNTED SPEED REDUCER",,No,CH-DRA_CYCLNS,CH-DRA_CYCLNS:CV1831.STAIND,CV-1831,CV,STAIND,"Status indication (open/closed, run/stop)",Conveyor (asset),Equipment status,CYCLONE SCREW CONVEYOR,
,INSPECT TROUGH GASKETS FOR LEAKAGE,23-31702,CV-1831,CV-1831,,,1-10-23 11:18 AM,2023-01-10T11:18:00.000Z,1-10-23 7:00 AM,2023-01-10T07:00:00.000Z,4-5-23 2:01 PM,2023-04-05T14:01:00.000Z,4,4,,PM,CLOSE,Y,,NO,CHATHAM,"2491, 2516","10 HP / 1800 RPM / TEFC / 575V/3PH/60HZ / FRAME#215T, DORRIS 207TR25 SHAFT MOUNTED SPEED REDUCER",,No,CH-DRYER_A,CH-DRYER_A:IT18143D.MEAS,IT-18143D,IT,MEAS,Measured value (PV),Current transmitter (motor amps),Measurement,CV1831 CURRENT INDICATION,CV-1831
,INSPECT TROUGH GASKETS FOR LEAKAGE,23-31702,CV-1831,CV-1831,,,1-10-23 11:18 AM,2023-01-10T11:18:00.000Z,1-10-23 7:00 AM,2023-01-10T07:00:00.000Z,4-5-23 2:01 PM,2023-04-05T14:01:00.000Z,4,4,,PM,CLOSE,Y,,NO,CHATHAM,"2491, 2516","10 HP / 1800 RPM / TEFC / 575V/3PH/60HZ / FRAME#215T, DORRIS 207TR25 SHAFT MOUNTED SPEED REDUCER",,No,CH-DRYER_A,CH-DRYER_A:TIC18147A.MEAS,TIC-18147A,TIC,MEAS,Measured value (PV),Temperature indicating controller,Measurement,CV1831 SPEED SWITCH,CV-1831
,INSPECT TROUGH GASKETS FOR LEAKAGE,23-31702,CV-1831,CV-1831,,,1-10-23 11:18 AM,2023-01-10T11:18:00.000Z,1-10-23 7:00 AM,2023-01-10T07:00:00.000Z,4-5-23 2:01 PM,2023-04-05T14:01:00.000Z,4,4,,PM,CLOSE,Y,,NO,CHATHAM,"2491, 2516","10 HP / 1800 RPM / TEFC / 575V/3PH/60HZ / FRAME#215T, DORRIS 207TR25 SHAFT MOUNTED SPEED REDUCER",,No,CH-DRA_CYCLNS,CH-DRA_CYCLNS:CV1831.STAIND,CV-1831,CV,STAIND,"Status indication (open/closed, run/stop)",Conveyor (asset),Equipment status,CYCLONE SCREW CONVEYOR,
,INSPECT PILLOW BLOCK BEARINGS,23-31703,CV-1831,CV-1831,,,1-10-23 11:18 AM,2023-01-10T11:18:00.000Z,1-10-23 7:00 AM,2023-01-10T07:00:00.000Z,4-5-23 2:01 PM,2023-04-05T14:01:00.000Z,4,4,,PM,CLOSE,Y,,NO,CHATHAM,"2491, 2516","10 HP / 1800 RPM / TEFC / 575V/3PH/60HZ / FRAME#215T, DORRIS 207TR25 SHAFT MOUNTED SPEED REDUCER",,No,CH-DRYER_A,CH-DRYER_A:IT18143D.MEAS,IT-18143D,IT,MEAS,Measured value (PV),Current transmitter (motor amps),Measurement,CV1831 CURRENT INDICATION,CV-1831
,INSPECT PILLOW BLOCK BEARINGS,23-31703,CV-1831,CV-1831,,,1-10-23 11:18 AM,2023-01-10T11:18:00.000Z,1-10-23 7:00 AM,2023-01-10T07:00:00.000Z,4-5-23 2:01 PM,2023-04-05T14:01:00.000Z,4,4,,PM,CLOSE,Y,,NO,CHATHAM,"2491, 2516","10 HP / 1800 RPM / TEFC / 575V/3PH/60HZ / FRAME#215T, DORRIS 207TR25 SHAFT MOUNTED SPEED REDUCER",,No,CH-DRYER_A,CH-DRYER_A:TIC18147A.MEAS,TIC-18147A,TIC,MEAS,Measured value (PV),Temperature indicating controller,Measurement,CV1831 SPEED SWITCH,CV-1831
,INSPECT PILLOW BLOCK BEARINGS,23-31703,CV-1831,CV-1831,,,1-10-23 11:18 AM,2023-01-10T11:18:00.000Z,1-10-23 7:00 AM,2023-01-10T07:00:00.000Z,4-5-23 2:01 PM,2023-04-05T14:01:00.000Z,4,4,,PM,CLOSE,Y,,NO,CHATHAM,"2491, 2516","10 HP / 1800 RPM / TEFC / 575V/3PH/60HZ / FRAME#215T, DORRIS 207TR25 SHAFT MOUNTED SPEED REDUCER",,No,CH-DRA_CYCLNS,CH-DRA_CYCLNS:CV1831.STAIND,CV-1831,CV,STAIND,"Status indication (open/closed, run/stop)",Conveyor (asset),Equipment status,CYCLONE SCREW CONVEYOR,
,INSPECT GEARBOX,23-31704,CV-1831,CV-1831,,,1-10-23 11:18 AM,2023-01-10T11:18:00.000Z,1-10-23 7:00 AM,2023-01-10T07:00:00.000Z,4-5-23 2:01 PM,2023-04-05T14:01:00.000Z,4,4,,PM,CLOSE,Y,,NO,CHATHAM,"2491, 2516","10 HP / 1800 RPM / TEFC / 575V/3PH/60HZ / FRAME#215T, DORRIS 207TR25 SHAFT MOUNTED SPEED REDUCER",,No,CH-DRYER_A,CH-DRYER_A:IT18143D.MEAS,IT-18143D,IT,MEAS,Measured value (PV),Current transmitter (motor amps),Measurement,CV1831 CURRENT INDICATION,CV-1831
,INSPECT GEARBOX,23-31704,CV-1831,CV-1831,,,1-10-23 11:18 AM,2023-01-10T11:18:00.000Z,1-10-23 7:00 AM,2023-01-10T07:00:00.000Z,4-5-23 2:01 PM,2023-04-05T14:01:00.000Z,4,4,,PM,CLOSE,Y,,NO,CHATHAM,"2491, 2516","10 HP / 1800 RPM / TEFC / 575V/3PH/60HZ / FRAME#215T, DORRIS 207TR25 SHAFT MOUNTED SPEED REDUCER",,No,CH-DRYER_A,CH-DRYER_A:TIC18147A.MEAS,TIC-18147A,TIC,MEAS,Measured value (PV),Temperature indicating controller,Measurement,CV1831 SPEED SWITCH,CV-1831
,INSPECT GEARBOX,23-31704,CV-1831,CV-1831,,,1-10-23 11:18 AM,2023-01-10T11:18:00.000Z,1-10-23 7:00 AM,2023-01-10T07:00:00.000Z,4-5-23 2:01 PM,2023-04-05T14:01:00.000Z,4,4,,PM,CLOSE,Y,,NO,CHATHAM,"2491, 2516","10 HP / 1800 RPM / TEFC / 575V/3PH/60HZ / FRAME#215T, DORRIS 207TR25 SHAFT MOUNTED SPEED REDUCER",,No,CH-DRA_CYCLNS,CH-DRA_CYCLNS:CV1831.STAIND,CV-1831,CV,STAIND,"Status indication (open/closed, run/stop)",Conveyor (asset),Equipment status,CYCLONE SCREW CONVEYOR,
,INSPECT SCREW CONVEYOR,23-31705,CV-1831,CV-1831,,,1-10-23 11:18 AM,2023-01-10T11:18:00.000Z,1-10-23 7:00 AM,2023-01-10T07:00:00.000Z,4-5-23 2:01 PM,2023-04-05T14:01:00.000Z,4,4,,PM,CLOSE,Y,,NO,CHATHAM,"2491, 2516","10 HP / 1800 RPM / TEFC / 575V/3PH/60HZ / FRAME#215T, DORRIS 207TR25 SHAFT MOUNTED SPEED REDUCER",,No,CH-DRYER_A,CH-DRYER_A:IT18143D.MEAS,IT-18143D,IT,MEAS,Measured value (PV),Current transmitter (motor amps),Measurement,CV1831 CURRENT INDICATION,CV-1831
,INSPECT SCREW CONVEYOR,23-31705,CV-1831,CV-1831,,,1-10-23 11:18 AM,2023-01-10T11:18:00.000Z,1-10-23 7:00 AM,2023-01-10T07:00:00.000Z,4-5-23 2:01 PM,2023-04-05T14:01:00.000Z,4,4,,PM,CLOSE,Y,,NO,CHATHAM,"2491, 2516","10 HP / 1800 RPM / TEFC / 575V/3PH/60HZ / FRAME#215T, DORRIS 207TR25 SHAFT MOUNTED SPEED REDUCER",,No,CH-DRYER_A,CH-DRYER_A:TIC18147A.MEAS,TIC-18147A,TIC,MEAS,Measured value (PV),Temperature indicating controller,Measurement,CV1831 SPEED SWITCH,CV-1831
,INSPECT SCREW CONVEYOR,23-31705,CV-1831,CV-1831,,,1-10-23 11:18 AM,2023-01-10T11:18:00.000Z,1-10-23 7:00 AM,2023-01-10T07:00:00.000Z,4-5-23 2:01 PM,2023-04-05T14:01:00.000Z,4,4,,PM,CLOSE,Y,,NO,CHATHAM,"2491, 2516","10 HP / 1800 RPM / TEFC / 575V/3PH/60HZ / FRAME#215T, DORRIS 207TR25 SHAFT MOUNTED SPEED REDUCER",,No,CH-DRA_CYCLNS,CH-DRA_CYCLNS:CV1831.STAIND,CV-1831,CV,STAIND,"Status indication (open/closed, run/stop)",Conveyor (asset),Equipment status,CYCLONE SCREW CONVEYOR,
,INSPECT CONVEYOR TROUGH,23-31706,CV-1831,CV-1831,,,1-10-23 11:18 AM,2023-01-10T11:18:00.000Z,1-10-23 7:00 AM,2023-01-10T07:00:00.000Z,4-5-23 2:01 PM,2023-04-05T14:01:00.000Z,4,4,,PM,CLOSE,Y,,NO,CHATHAM,"2491, 2516","10 HP / 1800 RPM / TEFC / 575V/3PH/60HZ / FRAME#215T, DORRIS 207TR25 SHAFT MOUNTED SPEED REDUCER",,No,CH-DRYER_A,CH-DRYER_A:IT18143D.MEAS,IT-18143D,IT,MEAS,Measured value (PV),Current transmitter (motor amps),Measurement,CV1831 CURRENT INDICATION,CV-1831
,INSPECT CONVEYOR TROUGH,23-31706,CV-1831,CV-1831,,,1-10-23 11:18 AM,2023-01-10T11:18:00.000Z,1-10-23 7:00 AM,2023-01-10T07:00:00.000Z,4-5-23 2:01 PM,2023-04-05T14:01:00.000Z,4,4,,PM,CLOSE,Y,,NO,CHATHAM,"2491, 2516","10 HP / 1800 RPM / TEFC / 575V/3PH/60HZ / FRAME#215T, DORRIS 207TR25 SHAFT MOUNTED SPEED REDUCER",,No,CH-DRYER_A,CH-DRYER_A:TIC18147A.MEAS,TIC-18147A,TIC,MEAS,Measured value (PV),Temperature indicating controller,Measurement,CV1831 SPEED SWITCH,CV-1831
,INSPECT CONVEYOR TROUGH,23-31706,CV-1831,CV-1831,,,1-10-23 11:18 AM,2023-01-10T11:18:00.000Z,1-10-23 7:00 AM,2023-01-10T07:00:00.000Z,4-5-23 2:01 PM,2023-04-05T14:01:00.000Z,4,4,,PM,CLOSE,Y,,NO,CHATHAM,"2491, 2516","10 HP / 1800 RPM / TEFC / 575V/3PH/60HZ / FRAME#215T, DORRIS 207TR25 SHAFT MOUNTED SPEED REDUCER",,No,CH-DRA_CYCLNS,CH-DRA_CYCLNS:CV1831.STAIND,CV-1831,CV,STAIND,"Status indication (open/closed, run/stop)",Conveyor (asset),Equipment status,CYCLONE SCREW CONVEYOR,
,CV-1832 MECHANICAL PM,23-31707,CV-1832,CV-1832,,,1-10-23 11:20 AM,2023-01-10T11:20:00.000Z,2-23-23 10:00 AM,2023-02-23T10:00:00.000Z,4-5-23 2:01 PM,2023-04-05T14:01:00.000Z,4,4,,PM,CLOSE,Y,N,NO,CHATHAM,"2492, 2517","10 HP / 1800 RPM / TEFC / 575V/3PH/60HZ / FRAME#215T, DORRIS 207TR25 SHAFT MOUNTED SPEED REDUCER",,No,CH-DRYER_A,CH-DRYER_A:SI18143D.MEAS,SI-18143D,SI,MEAS,Measured value (PV),Speed indication (feedback),Measurement,CV1832 CURRENT INDICATION,CV-1832
,CV-1832 MECHANICAL PM,23-31707,CV-1832,CV-1832,,,1-10-23 11:20 AM,2023-01-10T11:20:00.000Z,2-23-23 10:00 AM,2023-02-23T10:00:00.000Z,4-5-23 2:01 PM,2023-04-05T14:01:00.000Z,4,4,,PM,CLOSE,Y,N,NO,CHATHAM,"2492, 2517","10 HP / 1800 RPM / TEFC / 575V/3PH/60HZ / FRAME#215T, DORRIS 207TR25 SHAFT MOUNTED SPEED REDUCER",,No,CH-DRYER_A,CH-DRYER_A:TIC18147A.OUT,TIC-18147A,TIC,OUT,Controller output / demand (CO),Temperature indicating controller,Output/Demand,CV1832 SPEED SWITCH,CV-1832
,CV-1832 MECHANICAL PM,23-31707,CV-1832,CV-1832,,,1-10-23 11:20 AM,2023-01-10T11:20:00.000Z,2-23-23 10:00 AM,2023-02-23T10:00:00.000Z,4-5-23 2:01 PM,2023-04-05T14:01:00.000Z,4,4,,PM,CLOSE,Y,N,NO,CHATHAM,"2492, 2517","10 HP / 1800 RPM / TEFC / 575V/3PH/60HZ / FRAME#215T, DORRIS 207TR25 SHAFT MOUNTED SPEED REDUCER",,No,CH-DRA_CYCLNS,CH-DRA_CYCLNS:CV1832.STAIND,CV-1832,CV,STAIND,"Status indication (open/closed, run/stop)",Conveyor (asset),Equipment status,CYCLONE SCREW CONVEYOR,
,CHECK COUPLING BOLTS,23-31708,CV-1832,CV-1832,,,1-10-23 11:20 AM,2023-01-10T11:20:00.000Z,1-10-23 7:00 AM,2023-01-10T07:00:00.000Z,4-5-23 2:01 PM,2023-04-05T14:01:00.000Z,4,4,,PM,CLOSE,Y,,NO,CHATHAM,"2492, 2517","10 HP / 1800 RPM / TEFC / 575V/3PH/60HZ / FRAME#215T, DORRIS 207TR25 SHAFT MOUNTED SPEED REDUCER",,No,CH-DRYER_A,CH-DRYER_A:SI18143D.MEAS,SI-18143D,SI,MEAS,Measured value (PV),Speed indication (feedback),Measurement,CV1832 CURRENT INDICATION,CV-1832
,CHECK COUPLING BOLTS,23-31708,CV-1832,CV-1832,,,1-10-23 11:20 AM,2023-01-10T11:20:00.000Z,1-10-23 7:00 AM,2023-01-10T07:00:00.000Z,4-5-23 2:01 PM,2023-04-05T14:01:00.000Z,4,4,,PM,CLOSE,Y,,NO,CHATHAM,"2492, 2517","10 HP / 1800 RPM / TEFC / 575V/3PH/60HZ / FRAME#215T, DORRIS 207TR25 SHAFT MOUNTED SPEED REDUCER",,No,CH-DRYER_A,CH-DRYER_A:TIC18147A.OUT,TIC-18147A,TIC,OUT,Controller output / demand (CO),Temperature indicating controller,Output/Demand,CV1832 SPEED SWITCH,CV-1832
,CHECK COUPLING BOLTS,23-31708,CV-1832,CV-1832,,,1-10-23 11:20 AM,2023-01-10T11:20:00.000Z,1-10-23 7:00 AM,2023-01-10T07:00:00.000Z,4-5-23 2:01 PM,2023-04-05T14:01:00.000Z,4,4,,PM,CLOSE,Y,,NO,CHATHAM,"2492, 2517","10 HP / 1800 RPM / TEFC / 575V/3PH/60HZ / FRAME#215T, DORRIS 207TR25 SHAFT MOUNTED SPEED REDUCER",,No,CH-DRA_CYCLNS,CH-DRA_CYCLNS:CV1832.STAIND,CV-1832,CV,STAIND,"Status indication (open/closed, run/stop)",Conveyor (asset),Equipment status,CYCLONE SCREW CONVEYOR,
,INSPECT TROUGH GASKETS FOR LEAKAGE,23-31709,CV-1832,CV-1832,,,1-10-23 11:20 AM,2023-01-10T11:20:00.000Z,1-10-23 7:00 AM,2023-01-10T07:00:00.000Z,4-5-23 2:01 PM,2023-04-05T14:01:00.000Z,4,4,,PM,CLOSE,Y,,NO,CHATHAM,"2492, 2517","10 HP / 1800 RPM / TEFC / 575V/3PH/60HZ / FRAME#215T, DORRIS 207TR25 SHAFT MOUNTED SPEED REDUCER",,No,CH-DRYER_A,CH-DRYER_A:SI18143D.MEAS,SI-18143D,SI,MEAS,Measured value (PV),Speed indication (feedback),Measurement,CV1832 CURRENT INDICATION,CV-1832
,INSPECT TROUGH GASKETS FOR LEAKAGE,23-31709,CV-1832,CV-1832,,,1-10-23 11:20 AM,2023-01-10T11:20:00.000Z,1-10-23 7:00 AM,2023-01-10T07:00:00.000Z,4-5-23 2:01 PM,2023-04-05T14:01:00.000Z,4,4,,PM,CLOSE,Y,,NO,CHATHAM,"2492, 2517","10 HP / 1800 RPM / TEFC / 575V/3PH/60HZ / FRAME#215T, DORRIS 207TR25 SHAFT MOUNTED SPEED REDUCER",,No,CH-DRYER_A,CH-DRYER_A:TIC18147A.OUT,TIC-18147A,TIC,OUT,Controller output / demand (CO),Temperature indicating controller,Output/Demand,CV1832 SPEED SWITCH,CV-1832
,INSPECT TROUGH GASKETS FOR LEAKAGE,23-31709,CV-1832,CV-1832,,,1-10-23 11:20 AM,2023-01-10T11:20:00.000Z,1-10-23 7:00 AM,2023-01-10T07:00:00.000Z,4-5-23 2:01 PM,2023-04-05T14:01:00.000Z,4,4,,PM,CLOSE,Y,,NO,CHATHAM,"2492, 2517","10 HP / 1800 RPM / TEFC / 575V/3PH/60HZ / FRAME#215T, DORRIS 207TR25 SHAFT MOUNTED SPEED REDUCER",,No,CH-DRA_CYCLNS,CH-DRA_CYCLNS:CV1832.STAIND,CV-1832,CV,STAIND,"Status indication (open/closed, run/stop)",Conveyor (asset),Equipment status,CYCLONE SCREW CONVEYOR,
,INSPECT PILLOW BLOCK BEARINGS,23-31710,CV-1832,CV-1832,,,1-10-23 11:20 AM,2023-01-10T11:20:00.000Z,1-10-23 7:00 AM,2023-01-10T07:00:00.000Z,4-5-23 2:01 PM,2023-04-05T14:01:00.000Z,4,4,,PM,CLOSE,Y,,NO,CHATHAM,"2492, 2517","10 HP / 1800 RPM / TEFC / 575V/3PH/60HZ / FRAME#215T, DORRIS 207TR25 SHAFT MOUNTED SPEED REDUCER",,No,CH-DRYER_A,CH-DRYER_A:SI18143D.MEAS,SI-18143D,SI,MEAS,Measured value (PV),Speed indication (feedback),Measurement,CV1832 CURRENT INDICATION,CV-1832
,INSPECT PILLOW BLOCK BEARINGS,23-31710,CV-1832,CV-1832,,,1-10-23 11:20 AM,2023-01-10T11:20:00.000Z,1-10-23 7:00 AM,2023-01-10T07:00:00.000Z,4-5-23 2:01 PM,2023-04-05T14:01:00.000Z,4,4,,PM,CLOSE,Y,,NO,CHATHAM,"2492, 2517","10 HP / 1800 RPM / TEFC / 575V/3PH/60HZ / FRAME#215T, DORRIS 207TR25 SHAFT MOUNTED SPEED REDUCER",,No,CH-DRYER_A,CH-DRYER_A:TIC18147A.OUT,TIC-18147A,TIC,OUT,Controller output / demand (CO),Temperature indicating controller,Output/Demand,CV1832 SPEED SWITCH,CV-1832
,INSPECT PILLOW BLOCK BEARINGS,23-31710,CV-1832,CV-1832,,,1-10-23 11:20 AM,2023-01-10T11:20:00.000Z,1-10-23 7:00 AM,2023-01-10T07:00:00.000Z,4-5-23 2:01 PM,2023-04-05T14:01:00.000Z,4,4,,PM,CLOSE,Y,,NO,CHATHAM,"2492, 2517","10 HP / 1800 RPM / TEFC / 575V/3PH/60HZ / FRAME#215T, DORRIS 207TR25 SHAFT MOUNTED SPEED REDUCER",,No,CH-DRA_CYCLNS,CH-DRA_CYCLNS:CV1832.STAIND,CV-1832,CV,STAIND,"Status indication (open/closed, run/stop)",Conveyor (asset),Equipment status,CYCLONE SCREW CONVEYOR,
,INSPECT GEARBOX,23-31711,CV-1832,CV-1832,,,1-10-23 11:20 AM,2023-01-10T11:20:00.000Z,1-10-23 7:00 AM,2023-01-10T07:00:00.000Z,4-5-23 2:01 PM,2023-04-05T14:01:00.000Z,4,4,,PM,CLOSE,Y,,NO,CHATHAM,"2492, 2517","10 HP / 1800 RPM / TEFC / 575V/3PH/60HZ / FRAME#215T, DORRIS 207TR25 SHAFT MOUNTED SPEED REDUCER",,No,CH-DRYER_A,CH-DRYER_A:SI18143D.MEAS,SI-18143D,SI,MEAS,Measured value (PV),Speed indication (feedback),Measurement,CV1832 CURRENT INDICATION,CV-1832
,INSPECT GEARBOX,23-31711,CV-1832,CV-1832,,,1-10-23 11:20 AM,2023-01-10T11:20:00.000Z,1-10-23 7:00 AM,2023-01-10T07:00:00.000Z,4-5-23 2:01 PM,2023-04-05T14:01:00.000Z,4,4,,PM,CLOSE,Y,,NO,CHATHAM,"2492, 2517","10 HP / 1800 RPM / TEFC / 575V/3PH/60HZ / FRAME#215T, DORRIS 207TR25 SHAFT MOUNTED SPEED REDUCER",,No,CH-DRYER_A,CH-DRYER_A:TIC18147A.OUT,TIC-18147A,TIC,OUT,Controller output / demand (CO),Temperature indicating controller,Output/Demand,CV1832 SPEED SWITCH,CV-1832
,INSPECT GEARBOX,23-31711,CV-1832,CV-1832,,,1-10-23 11:20 AM,2023-01-10T11:20:00.000Z,1-10-23 7:00 AM,2023-01-10T07:00:00.000Z,4-5-23 2:01 PM,2023-04-05T14:01:00.000Z,4,4,,PM,CLOSE,Y,,NO,CHATHAM,"2492, 2517","10 HP / 1800 RPM / TEFC / 575V/3PH/60HZ / FRAME#215T, DORRIS 207TR25 SHAFT MOUNTED SPEED REDUCER",,No,CH-DRA_CYCLNS,CH-DRA_CYCLNS:CV1832.STAIND,CV-1832,CV,STAIND,"Status indication (open/closed, run/stop)",Conveyor (asset),Equipment status,CYCLONE SCREW CONVEYOR,
,INSPECT SCREW CONVEYOR,23-31712,CV-1832,CV-1832,,,1-10-23 11:20 AM,2023-01-10T11:20:00.000Z,1-10-23 7:00 AM,2023-01-10T07:00:00.000Z,4-5-23 2:01 PM,2023-04-05T14:01:00.000Z,4,4,,PM,CLOSE,Y,,NO,CHATHAM,"2492, 2517","10 HP / 1800 RPM / TEFC / 575V/3PH/60HZ / FRAME#215T, DORRIS 207TR25 SHAFT MOUNTED SPEED REDUCER",,No,CH-DRYER_A,CH-DRYER_A:SI18143D.MEAS,SI-18143D,SI,MEAS,Measured value (PV),Speed indication (feedback),Measurement,CV1832 CURRENT INDICATION,CV-1832
,INSPECT SCREW CONVEYOR,23-31712,CV-1832,CV-1832,,,1-10-23 11:20 AM,2023-01-10T11:20:00.000Z,1-10-23 7:00 AM,2023-01-10T07:00:00.000Z,4-5-23 2:01 PM,2023-04-05T14:01:00.000Z,4,4,,PM,CLOSE,Y,,NO,CHATHAM,"2492, 2517","10 HP / 1800 RPM / TEFC / 575V/3PH/60HZ / FRAME#215T, DORRIS 207TR25 SHAFT MOUNTED SPEED REDUCER",,No,CH-DRYER_A,CH-DRYER_A:TIC18147A.OUT,TIC-18147A,TIC,OUT,Controller output / demand (CO),Temperature indicating controller,Output/Demand,CV1832 SPEED SWITCH,CV-1832
,INSPECT SCREW CONVEYOR,23-31712,CV-1832,CV-1832,,,1-10-23 11:20 AM,2023-01-10T11:20:00.000Z,1-10-23 7:00 AM,2023-01-10T07:00:00.000Z,4-5-23 2:01 PM,2023-04-05T14:01:00.000Z,4,4,,PM,CLOSE,Y,,NO,CHATHAM,"2492, 2517","10 HP / 1800 RPM / TEFC / 575V/3PH/60HZ / FRAME#215T, DORRIS 207TR25 SHAFT MOUNTED SPEED REDUCER",,No,CH-DRA_CYCLNS,CH-DRA_CYCLNS:CV1832.STAIND,CV-1832,CV,STAIND,"Status indication (open/closed, run/stop)",Conveyor (asset),Equipment status,CYCLONE SCREW CONVEYOR,
,INSPECT CONVEYOR TROUGH,23-31713,CV-1832,CV-1832,,,1-10-23 11:20 AM,2023-01-10T11:20:00.000Z,1-10-23 7:00 AM,2023-01-10T07:00:00.000Z,4-5-23 2:01 PM,2023-04-05T14:01:00.000Z,4,4,,PM,CLOSE,Y,,NO,CHATHAM,"2492, 2517","10 HP / 1800 RPM / TEFC / 575V/3PH/60HZ / FRAME#215T, DORRIS 207TR25 SHAFT MOUNTED SPEED REDUCER",,No,CH-DRYER_A,CH-DRYER_A:SI18143D.MEAS,SI-18143D,SI,MEAS,Measured value (PV),Speed indication (feedback),Measurement,CV1832 CURRENT INDICATION,CV-1832
,INSPECT CONVEYOR TROUGH,23-31713,CV-1832,CV-1832,,,1-10-23 11:20 AM,2023-01-10T11:20:00.000Z,1-10-23 7:00 AM,2023-01-10T07:00:00.000Z,4-5-23 2:01 PM,2023-04-05T14:01:00.000Z,4,4,,PM,CLOSE,Y,,NO,CHATHAM,"2492, 2517","10 HP / 1800 RPM / TEFC / 575V/3PH/60HZ / FRAME#215T, DORRIS 207TR25 SHAFT MOUNTED SPEED REDUCER",,No,CH-DRYER_A,CH-DRYER_A:TIC18147A.OUT,TIC-18147A,TIC,OUT,Controller output / demand (CO),Temperature indicating controller,Output/Demand,CV1832 SPEED SWITCH,CV-1832
,INSPECT CONVEYOR TROUGH,23-31713,CV-1832,CV-1832,,,1-10-23 11:20 AM,2023-01-10T11:20:00.000Z,1-10-23 7:00 AM,2023-01-10T07:00:00.000Z,4-5-23 2:01 PM,2023-04-05T14:01:00.000Z,4,4,,PM,CLOSE,Y,,NO,CHATHAM,"2492, 2517","10 HP / 1800 RPM / TEFC / 575V/3PH/60HZ / FRAME#215T, DORRIS 207TR25 SHAFT MOUNTED SPEED REDUCER",,No,CH-DRA_CYCLNS,CH-DRA_CYCLNS:CV1832.STAIND,CV-1832,CV,STAIND,"Status indication (open/closed, run/stop)",Conveyor (asset),Equipment status,CYCLONE SCREW CONVEYOR,
,CV-1830 Open end for water to drain,23-31714,CV-1830,CV-1830,,,1-10-23 11:20 AM,2023-01-10T11:20:00.000Z,,,1-10-23 11:22 AM,2023-01-10T11:22:00.000Z,4,4,,CO,CLOSE,Y,,NO,CHATHAM,"2490, 2515","20 HP / 1760 RPM / TEFC / 575V/3PH/60HZ / FRAME#256T, DORRIS 315TR25 SHAFT MOUNTED SPEED REDUCER",,No,CH-DRYER_A,CH-DRYER_A:CV1830.STAIND,CV-1830,CV,STAIND,"Status indication (open/closed, run/stop)",Conveyor (asset),Equipment status,RECYCLE DRAG CONVEYOR,
,OPEN FOR WATER TO DRAIN,23-31715,CV-1830,CV-1830,,,1-10-23 11:20 AM,2023-01-10T11:20:00.000Z,,,1-10-23 11:22 AM,2023-01-10T11:22:00.000Z,4,4,,CO,CLOSE,Y,,NO,CHATHAM,"2490, 2515","20 HP / 1760 RPM / TEFC / 575V/3PH/60HZ / FRAME#256T, DORRIS 315TR25 SHAFT MOUNTED SPEED REDUCER",,No,CH-DRYER_A,CH-DRYER_A:CV1830.STAIND,CV-1830,CV,STAIND,"Status indication (open/closed, run/stop)",Conveyor (asset),Equipment status,RECYCLE DRAG CONVEYOR,
,Remove end plate to allow for drainage.,23-31716,CV-1830,CV-1830,,,1-10-23 11:23 AM,2023-01-10T11:23:00.000Z,2-23-23 4:30 PM,2023-02-23T16:30:00.000Z,4-5-23 3:26 PM,2023-04-05T15:26:00.000Z,4,4,,SD,CLOSE,Y,,NO,CHATHAM,"2490, 2515","20 HP / 1760 RPM / TEFC / 575V/3PH/60HZ / FRAME#256T, DORRIS 315TR25 SHAFT MOUNTED SPEED REDUCER",,No,CH-DRYER_A,CH-DRYER_A:CV1830.STAIND,CV-1830,CV,STAIND,"Status indication (open/closed, run/stop)",Conveyor (asset),Equipment status,RECYCLE DRAG CONVEYOR,
,CV-1833 MECHANICAL PM,23-31717,CV-1833,CV-1833,,,1-10-23 11:23 AM,2023-01-10T11:23:00.000Z,2-23-23 10:00 AM,2023-02-23T10:00:00.000Z,4-5-23 2:01 PM,2023-04-05T14:01:00.000Z,4,4,,PM,CLOSE,Y,N,NO,CHATHAM,"2493, 2518","7.5 HP / 1800 RPM / TEFC / 575V/3PH/60HZ / FRAME#213T, DORRIS 207TR25 SHAFT MOUNTED SPEED REDUCER",,No,CH-DRA_CYCLNS,CH-DRA_CYCLNS:IT18171.MEAS,IT-18171,IT,MEAS,Measured value (PV),Current transmitter (motor amps),Measurement,CV1833 MOTOR CURRENT,CV-1833
,CV-1833 MECHANICAL PM,23-31717,CV-1833,CV-1833,,,1-10-23 11:23 AM,2023-01-10T11:23:00.000Z,2-23-23 10:00 AM,2023-02-23T10:00:00.000Z,4-5-23 2:01 PM,2023-04-05T14:01:00.000Z,4,4,,PM,CLOSE,Y,N,NO,CHATHAM,"2493, 2518","7.5 HP / 1800 RPM / TEFC / 575V/3PH/60HZ / FRAME#213T, DORRIS 207TR25 SHAFT MOUNTED SPEED REDUCER",,No,CH-DRA_PROC_AIR,CH-DRA_PROC_AIR:TT18179D.MEAS,TT-18179D,TT,MEAS,Measured value (PV),Temperature transmitter,Measurement,CV1833 SPEED INDICATION,CV-1833
,CV-1833 MECHANICAL PM,23-31717,CV-1833,CV-1833,,,1-10-23 11:23 AM,2023-01-10T11:23:00.000Z,2-23-23 10:00 AM,2023-02-23T10:00:00.000Z,4-5-23 2:01 PM,2023-04-05T14:01:00.000Z,4,4,,PM,CLOSE,Y,N,NO,CHATHAM,"2493, 2518","7.5 HP / 1800 RPM / TEFC / 575V/3PH/60HZ / FRAME#213T, DORRIS 207TR25 SHAFT MOUNTED SPEED REDUCER",,No,CH-DRA_COMB_AIR,CH-DRA_COMB_AIR:XV18182.STAIND,XV-18182,XV,STAIND,"Status indication (open/closed, run/stop)",Valve/damper/door status (discrete),Status,CV1833 SPEED SWITCH,CV-1833
,CV-1833 MECHANICAL PM,23-31717,CV-1833,CV-1833,,,1-10-23 11:23 AM,2023-01-10T11:23:00.000Z,2-23-23 10:00 AM,2023-02-23T10:00:00.000Z,4-5-23 2:01 PM,2023-04-05T14:01:00.000Z,4,4,,PM,CLOSE,Y,N,NO,CHATHAM,"2493, 2518","7.5 HP / 1800 RPM / TEFC / 575V/3PH/60HZ / FRAME#213T, DORRIS 207TR25 SHAFT MOUNTED SPEED REDUCER",,No,CH-DRA_COMB_AIR,CH-DRA_COMB_AIR:ZT18215.MEAS,ZT-18215,ZT,MEAS,Measured value (PV),Valve/actuator position feedback,Measurement,CV1833 SPEED CONTROL,CV-1833
,CV-1833 MECHANICAL PM,23-31717,CV-1833,CV-1833,,,1-10-23 11:23 AM,2023-01-10T11:23:00.000Z,2-23-23 10:00 AM,2023-02-23T10:00:00.000Z,4-5-23 2:01 PM,2023-04-05T14:01:00.000Z,4,4,,PM,CLOSE,Y,N,NO,CHATHAM,"2493, 2518","7.5 HP / 1800 RPM / TEFC / 575V/3PH/60HZ / FRAME#213T, DORRIS 207TR25 SHAFT MOUNTED SPEED REDUCER",,No,CH-DRYER_A,CH-DRYER_A:CV1833.STAIND,CV-1833,CV,STAIND,"Status indication (open/closed, run/stop)",Conveyor (asset),Equipment status,RECYCLE SCREW CVYR,
,CV-1833 MECHANICAL PM,23-31717,CV-1833,CV-1833,,,1-10-23 11:23 AM,2023-01-10T11:23:00.000Z,2-23-23 10:00 AM,2023-02-23T10:00:00.000Z,4-5-23 2:01 PM,2023-04-05T14:01:00.000Z,4,4,,PM,CLOSE,Y,N,NO,CHATHAM,"2493, 2518","7.5 HP / 1800 RPM / TEFC / 575V/3PH/60HZ / FRAME#213T, DORRIS 207TR25 SHAFT MOUNTED SPEED REDUCER",,No,CH-DR_PROC_AIR,CH-DR_PROC_AIR:PT33307.MEAS,PT-33307,PT,MEAS,Measured value (PV),Pressure transmitter,Measurement,CV1833 MOTOR CURRENT,CV-1833
,CV-1833 MECHANICAL PM,23-31717,CV-1833,CV-1833,,,1-10-23 11:23 AM,2023-01-10T11:23:00.000Z,2-23-23 10:00 AM,2023-02-23T10:00:00.000Z,4-5-23 2:01 PM,2023-04-05T14:01:00.000Z,4,4,,PM,CLOSE,Y,N,NO,CHATHAM,"2493, 2518","7.5 HP / 1800 RPM / TEFC / 575V/3PH/60HZ / FRAME#213T, DORRIS 207TR25 SHAFT MOUNTED SPEED REDUCER",,No,CH-DR_UTIL_WTR,CH-DR_UTIL_WTR:SY18642.OUT,SY-18642,SY,OUT,Controller output / demand (CO),Speed output (VFD demand),Output/Demand,CV1833 MOTOR CURRENT,CV-1833
,CV-1833 MECHANICAL PM,23-31717,CV-1833,CV-1833,,,1-10-23 11:23 AM,2023-01-10T11:23:00.000Z,2-23-23 10:00 AM,2023-02-23T10:00:00.000Z,4-5-23 2:01 PM,2023-04-05T14:01:00.000Z,4,4,,PM,CLOSE,Y,N,NO,CHATHAM,"2493, 2518","7.5 HP / 1800 RPM / TEFC / 575V/3PH/60HZ / FRAME#213T, DORRIS 207TR25 SHAFT MOUNTED SPEED REDUCER",,No,CH-DRYER_D,CH-DRYER_D:PDY84403.RO01,PDY-84403,PDY,RO01,Binary/relay output channel,Differential pressure relay output,Output,CV1833 MOTOR CURRENT,CV-1833
,CV-1833 MECHANICAL PM,23-31717,CV-1833,CV-1833,,,1-10-23 11:23 AM,2023-01-10T11:23:00.000Z,2-23-23 10:00 AM,2023-02-23T10:00:00.000Z,4-5-23 2:01 PM,2023-04-05T14:01:00.000Z,4,4,,PM,CLOSE,Y,N,NO,CHATHAM,"2493, 2518","7.5 HP / 1800 RPM / TEFC / 575V/3PH/60HZ / FRAME#213T, DORRIS 207TR25 SHAFT MOUNTED SPEED REDUCER",,No,CH-DRYER_D_BMS,CH-DRYER_D_BMS:IT84201.PNT,IT-84201,IT,PNT,Point value / indication,Current transmitter,Indication,CV1833 SPEED INDICATION,CV-1833
,CV-1833 MECHANICAL PM,23-31717,CV-1833,CV-1833,,,1-10-23 11:23 AM,2023-01-10T11:23:00.000Z,2-23-23 10:00 AM,2023-02-23T10:00:00.000Z,4-5-23 2:01 PM,2023-04-05T14:01:00.000Z,4,4,,PM,CLOSE,Y,N,NO,CHATHAM,"2493, 2518","7.5 HP / 1800 RPM / TEFC / 575V/3PH/60HZ / FRAME#213T, DORRIS 207TR25 SHAFT MOUNTED SPEED REDUCER",,No,CH-DRYER_D_CY2,CH-DRYER_D_CY2:TT84311.PNT,TT-84311,TT,PNT,Point value / indication,Temperature transmitter,Measurement,CV1833 SPEED SWITCH,CV-1833
,CV-1833 MECHANICAL PM,23-31717,CV-1833,CV-1833,,,1-10-23 11:23 AM,2023-01-10T11:23:00.000Z,2-23-23 10:00 AM,2023-02-23T10:00:00.000Z,4-5-23 2:01 PM,2023-04-05T14:01:00.000Z,4,4,,PM,CLOSE,Y,N,NO,CHATHAM,"2493, 2518","7.5 HP / 1800 RPM / TEFC / 575V/3PH/60HZ / FRAME#213T, DORRIS 207TR25 SHAFT MOUNTED SPEED REDUCER",,No,CH-DRYER_D_CY2,CH-DRYER_D_CY2:TT84319.MEAS,TT-84319,TT,MEAS,Measured value (PV),Temperature transmitter,Measurement,CV1833 SPEED CONTROL,CV-1833
,CV-1833 MECHANICAL PM,23-31717,CV-1833,CV-1833,,,1-10-23 11:23 AM,2023-01-10T11:23:00.000Z,2-23-23 10:00 AM,2023-02-23T10:00:00.000Z,4-5-23 2:01 PM,2023-04-05T14:01:00.000Z,4,4,,PM,CLOSE,Y,N,NO,CHATHAM,"2493, 2518","7.5 HP / 1800 RPM / TEFC / 575V/3PH/60HZ / FRAME#213T, DORRIS 207TR25 SHAFT MOUNTED SPEED REDUCER",,No,CH-DR_DECANT702,CH-DR_DECANT702:FIC17704.OUT,FIC-17704,FIC,OUT,Controller output / demand (CO),Flow indicating controller,Output/Demand,CV1833 MOTOR CURRENT,CV-1833
,CHECK COUPLING BOLTS,23-31718,CV-1833,CV-1833,,,1-10-23 11:23 AM,2023-01-10T11:23:00.000Z,1-10-23 7:00 AM,2023-01-10T07:00:00.000Z,4-5-23 2:01 PM,2023-04-05T14:01:00.000Z,4,4,,PM,CLOSE,Y,,NO,CHATHAM,"2493, 2518","7.5 HP / 1800 RPM / TEFC / 575V/3PH/60HZ / FRAME#213T, DORRIS 207TR25 SHAFT MOUNTED SPEED REDUCER",,No,CH-DRA_CYCLNS,CH-DRA_CYCLNS:IT18171.MEAS,IT-18171,IT,MEAS,Measured value (PV),Current transmitter (motor amps),Measurement,CV1833 MOTOR CURRENT,CV-1833
,CHECK COUPLING BOLTS,23-31718,CV-1833,CV-1833,,,1-10-23 11:23 AM,2023-01-10T11:23:00.000Z,1-10-23 7:00 AM,2023-01-10T07:00:00.000Z,4-5-23 2:01 PM,2023-04-05T14:01:00.000Z,4,4,,PM,CLOSE,Y,,NO,CHATHAM,"2493, 2518","7.5 HP / 1800 RPM / TEFC / 575V/3PH/60HZ / FRAME#213T, DORRIS 207TR25 SHAFT MOUNTED SPEED REDUCER",,No,CH-DRA_PROC_AIR,CH-DRA_PROC_AIR:TT18179D.MEAS,TT-18179D,TT,MEAS,Measured value (PV),Temperature transmitter,Measurement,CV1833 SPEED INDICATION,CV-1833
,CHECK COUPLING BOLTS,23-31718,CV-1833,CV-1833,,,1-10-23 11:23 AM,2023-01-10T11:23:00.000Z,1-10-23 7:00 AM,2023-01-10T07:00:00.000Z,4-5-23 2:01 PM,2023-04-05T14:01:00.000Z,4,4,,PM,CLOSE,Y,,NO,CHATHAM,"2493, 2518","7.5 HP / 1800 RPM / TEFC / 575V/3PH/60HZ / FRAME#213T, DORRIS 207TR25 SHAFT MOUNTED SPEED REDUCER",,No,CH-DRA_COMB_AIR,CH-DRA_COMB_AIR:XV18182.STAIND,XV-18182,XV,STAIND,"Status indication (open/closed, run/stop)",Valve/damper/door status (discrete),Status,CV1833 SPEED SWITCH,CV-1833
,CHECK COUPLING BOLTS,23-31718,CV-1833,CV-1833,,,1-10-23 11:23 AM,2023-01-10T11:23:00.000Z,1-10-23 7:00 AM,2023-01-10T07:00:00.000Z,4-5-23 2:01 PM,2023-04-05T14:01:00.000Z,4,4,,PM,CLOSE,Y,,NO,CHATHAM,"2493, 2518","7.5 HP / 1800 RPM / TEFC / 575V/3PH/60HZ / FRAME#213T, DORRIS 207TR25 SHAFT MOUNTED SPEED REDUCER",,No,CH-DRA_COMB_AIR,CH-DRA_COMB_AIR:ZT18215.MEAS,ZT-18215,ZT,MEAS,Measured value (PV),Valve/actuator position feedback,Measurement,CV1833 SPEED CONTROL,CV-1833
,CHECK COUPLING BOLTS,23-31718,CV-1833,CV-1833,,,1-10-23 11:23 AM,2023-01-10T11:23:00.000Z,1-10-23 7:00 AM,2023-01-10T07:00:00.000Z,4-5-23 2:01 PM,2023-04-05T14:01:00.000Z,4,4,,PM,CLOSE,Y,,NO,CHATHAM,"2493, 2518","7.5 HP / 1800 RPM / TEFC / 575V/3PH/60HZ / FRAME#213T, DORRIS 207TR25 SHAFT MOUNTED SPEED REDUCER",,No,CH-DRYER_A,CH-DRYER_A:CV1833.STAIND,CV-1833,CV,STAIND,"Status indication (open/closed, run/stop)",Conveyor (asset),Equipment status,RECYCLE SCREW CVYR,
,CHECK COUPLING BOLTS,23-31718,CV-1833,CV-1833,,,1-10-23 11:23 AM,2023-01-10T11:23:00.000Z,1-10-23 7:00 AM,2023-01-10T07:00:00.000Z,4-5-23 2:01 PM,2023-04-05T14:01:00.000Z,4,4,,PM,CLOSE,Y,,NO,CHATHAM,"2493, 2518","7.5 HP / 1800 RPM / TEFC / 575V/3PH/60HZ / FRAME#213T, DORRIS 207TR25 SHAFT MOUNTED SPEED REDUCER",,No,CH-DR_PROC_AIR,CH-DR_PROC_AIR:PT33307.MEAS,PT-33307,PT,MEAS,Measured value (PV),Pressure transmitter,Measurement,CV1833 MOTOR CURRENT,CV-1833
,CHECK COUPLING BOLTS,23-31718,CV-1833,CV-1833,,,1-10-23 11:23 AM,2023-01-10T11:23:00.000Z,1-10-23 7:00 AM,2023-01-10T07:00:00.000Z,4-5-23 2:01 PM,2023-04-05T14:01:00.000Z,4,4,,PM,CLOSE,Y,,NO,CHATHAM,"2493, 2518","7.5 HP / 1800 RPM / TEFC / 575V/3PH/60HZ / FRAME#213T, DORRIS 207TR25 SHAFT MOUNTED SPEED REDUCER",,No,CH-DR_UTIL_WTR,CH-DR_UTIL_WTR:SY18642.OUT,SY-18642,SY,OUT,Controller output / demand (CO),Speed output (VFD demand),Output/Demand,CV1833 MOTOR CURRENT,CV-1833
,CHECK COUPLING BOLTS,23-31718,CV-1833,CV-1833,,,1-10-23 11:23 AM,2023-01-10T11:23:00.000Z,1-10-23 7:00 AM,2023-01-10T07:00:00.000Z,4-5-23 2:01 PM,2023-04-05T14:01:00.000Z,4,4,,PM,CLOSE,Y,,NO,CHATHAM,"2493, 2518","7.5 HP / 1800 RPM / TEFC / 575V/3PH/60HZ / FRAME#213T, DORRIS 207TR25 SHAFT MOUNTED SPEED REDUCER",,No,CH-DRYER_D,CH-DRYER_D:PDY84403.RO01,PDY-84403,PDY,RO01,Binary/relay output channel,Differential pressure relay output,Output,CV1833 MOTOR CURRENT,CV-1833
,CHECK COUPLING BOLTS,23-31718,CV-1833,CV-1833,,,1-10-23 11:23 AM,2023-01-10T11:23:00.000Z,1-10-23 7:00 AM,2023-01-10T07:00:00.000Z,4-5-23 2:01 PM,2023-04-05T14:01:00.000Z,4,4,,PM,CLOSE,Y,,NO,CHATHAM,"2493, 2518","7.5 HP / 1800 RPM / TEFC / 575V/3PH/60HZ / FRAME#213T, DORRIS 207TR25 SHAFT MOUNTED SPEED REDUCER",,No,CH-DRYER_D_BMS,CH-DRYER_D_BMS:IT84201.PNT,IT-84201,IT,PNT,Point value / indication,Current transmitter,Indication,CV1833 SPEED INDICATION,CV-1833
,CHECK COUPLING BOLTS,23-31718,CV-1833,CV-1833,,,1-10-23 11:23 AM,2023-01-10T11:23:00.000Z,1-10-23 7:00 AM,2023-01-10T07:00:00.000Z,4-5-23 2:01 PM,2023-04-05T14:01:00.000Z,4,4,,PM,CLOSE,Y,,NO,CHATHAM,"2493, 2518","7.5 HP / 1800 RPM / TEFC / 575V/3PH/60HZ / FRAME#213T, DORRIS 207TR25 SHAFT MOUNTED SPEED REDUCER",,No,CH-DRYER_D_CY2,CH-DRYER_D_CY2:TT84311.PNT,TT-84311,TT,PNT,Point value / indication,Temperature transmitter,Measurement,CV1833 SPEED SWITCH,CV-1833
,CHECK COUPLING BOLTS,23-31718,CV-1833,CV-1833,,,1-10-23 11:23 AM,2023-01-10T11:23:00.000Z,1-10-23 7:00 AM,2023-01-10T07:00:00.000Z,4-5-23 2:01 PM,2023-04-05T14:01:00.000Z,4,4,,PM,CLOSE,Y,,NO,CHATHAM,"2493, 2518","7.5 HP / 1800 RPM / TEFC / 575V/3PH/60HZ / FRAME#213T, DORRIS 207TR25 SHAFT MOUNTED SPEED REDUCER",,No,CH-DRYER_D_CY2,CH-DRYER_D_CY2:TT84319.MEAS,TT-84319,TT,MEAS,Measured value (PV),Temperature transmitter,Measurement,CV1833 SPEED CONTROL,CV-1833
,CHECK COUPLING BOLTS,23-31718,CV-1833,CV-1833,,,1-10-23 11:23 AM,2023-01-10T11:23:00.000Z,1-10-23 7:00 AM,2023-01-10T07:00:00.000Z,4-5-23 2:01 PM,2023-04-05T14:01:00.000Z,4,4,,PM,CLOSE,Y,,NO,CHATHAM,"2493, 2518","7.5 HP / 1800 RPM / TEFC / 575V/3PH/60HZ / FRAME#213T, DORRIS 207TR25 SHAFT MOUNTED SPEED REDUCER",,No,CH-DR_DECANT702,CH-DR_DECANT702:FIC17704.OUT,FIC-17704,FIC,OUT,Controller output / demand (CO),Flow indicating controller,Output/Demand,CV1833 MOTOR CURRENT,CV-1833
,INSPECT TROUGH GASKETS FOR LEAKAGE,23-31719,CV-1833,CV-1833,,,1-10-23 11:23 AM,2023-01-10T11:23:00.000Z,1-10-23 7:00 AM,2023-01-10T07:00:00.000Z,4-5-23 2:01 PM,2023-04-05T14:01:00.000Z,4,4,,PM,CLOSE,Y,,NO,CHATHAM,"2493, 2518","7.5 HP / 1800 RPM / TEFC / 575V/3PH/60HZ / FRAME#213T, DORRIS 207TR25 SHAFT MOUNTED SPEED REDUCER",,No,CH-DRA_CYCLNS,CH-DRA_CYCLNS:IT18171.MEAS,IT-18171,IT,MEAS,Measured value (PV),Current transmitter (motor amps),Measurement,CV1833 MOTOR CURRENT,CV-1833
,INSPECT TROUGH GASKETS FOR LEAKAGE,23-31719,CV-1833,CV-1833,,,1-10-23 11:23 AM,2023-01-10T11:23:00.000Z,1-10-23 7:00 AM,2023-01-10T07:00:00.000Z,4-5-23 2:01 PM,2023-04-05T14:01:00.000Z,4,4,,PM,CLOSE,Y,,NO,CHATHAM,"2493, 2518","7.5 HP / 1800 RPM / TEFC / 575V/3PH/60HZ / FRAME#213T, DORRIS 207TR25 SHAFT MOUNTED SPEED REDUCER",,No,CH-DRA_PROC_AIR,CH-DRA_PROC_AIR:TT18179D.MEAS,TT-18179D,TT,MEAS,Measured value (PV),Temperature transmitter,Measurement,CV1833 SPEED INDICATION,CV-1833
,INSPECT TROUGH GASKETS FOR LEAKAGE,23-31719,CV-1833,CV-1833,,,1-10-23 11:23 AM,2023-01-10T11:23:00.000Z,1-10-23 7:00 AM,2023-01-10T07:00:00.000Z,4-5-23 2:01 PM,2023-04-05T14:01:00.000Z,4,4,,PM,CLOSE,Y,,NO,CHATHAM,"2493, 2518","7.5 HP / 1800 RPM / TEFC / 575V/3PH/60HZ / FRAME#213T, DORRIS 207TR25 SHAFT MOUNTED SPEED REDUCER",,No,CH-DRA_COMB_AIR,CH-DRA_COMB_AIR:XV18182.STAIND,XV-18182,XV,STAIND,"Status indication (open/closed, run/stop)",Valve/damper/door status (discrete),Status,CV1833 SPEED SWITCH,CV-1833
,INSPECT TROUGH GASKETS FOR LEAKAGE,23-31719,CV-1833,CV-1833,,,1-10-23 11:23 AM,2023-01-10T11:23:00.000Z,1-10-23 7:00 AM,2023-01-10T07:00:00.000Z,4-5-23 2:01 PM,2023-04-05T14:01:00.000Z,4,4,,PM,CLOSE,Y,,NO,CHATHAM,"2493, 2518","7.5 HP / 1800 RPM / TEFC / 575V/3PH/60HZ / FRAME#213T, DORRIS 207TR25 SHAFT MOUNTED SPEED REDUCER",,No,CH-DRA_COMB_AIR,CH-DRA_COMB_AIR:ZT18215.MEAS,ZT-18215,ZT,MEAS,Measured value (PV),Valve/actuator position feedback,Measurement,CV1833 SPEED CONTROL,CV-1833
,INSPECT TROUGH GASKETS FOR LEAKAGE,23-31719,CV-1833,CV-1833,,,1-10-23 11:23 AM,2023-01-10T11:23:00.000Z,1-10-23 7:00 AM,2023-01-10T07:00:00.000Z,4-5-23 2:01 PM,2023-04-05T14:01:00.000Z,4,4,,PM,CLOSE,Y,,NO,CHATHAM,"2493, 2518","7.5 HP / 1800 RPM / TEFC / 575V/3PH/60HZ / FRAME#213T, DORRIS 207TR25 SHAFT MOUNTED SPEED REDUCER",,No,CH-DRYER_A,CH-DRYER_A:CV1833.STAIND,CV-1833,CV,STAIND,"Status indication (open/closed, run/stop)",Conveyor (asset),Equipment status,RECYCLE SCREW CVYR,
,INSPECT TROUGH GASKETS FOR LEAKAGE,23-31719,CV-1833,CV-1833,,,1-10-23 11:23 AM,2023-01-10T11:23:00.000Z,1-10-23 7:00 AM,2023-01-10T07:00:00.000Z,4-5-23 2:01 PM,2023-04-05T14:01:00.000Z,4,4,,PM,CLOSE,Y,,NO,CHATHAM,"2493, 2518","7.5 HP / 1800 RPM / TEFC / 575V/3PH/60HZ / FRAME#213T, DORRIS 207TR25 SHAFT MOUNTED SPEED REDUCER",,No,CH-DR_PROC_AIR,CH-DR_PROC_AIR:PT33307.MEAS,PT-33307,PT,MEAS,Measured value (PV),Pressure transmitter,Measurement,CV1833 MOTOR CURRENT,CV-1833
,INSPECT TROUGH GASKETS FOR LEAKAGE,23-31719,CV-1833,CV-1833,,,1-10-23 11:23 AM,2023-01-10T11:23:00.000Z,1-10-23 7:00 AM,2023-01-10T07:00:00.000Z,4-5-23 2:01 PM,2023-04-05T14:01:00.000Z,4,4,,PM,CLOSE,Y,,NO,CHATHAM,"2493, 2518","7.5 HP / 1800 RPM / TEFC / 575V/3PH/60HZ / FRAME#213T, DORRIS 207TR25 SHAFT MOUNTED SPEED REDUCER",,No,CH-DR_UTIL_WTR,CH-DR_UTIL_WTR:SY18642.OUT,SY-18642,SY,OUT,Controller output / demand (CO),Speed output (VFD demand),Output/Demand,CV1833 MOTOR CURRENT,CV-1833
,INSPECT TROUGH GASKETS FOR LEAKAGE,23-31719,CV-1833,CV-1833,,,1-10-23 11:23 AM,2023-01-10T11:23:00.000Z,1-10-23 7:00 AM,2023-01-10T07:00:00.000Z,4-5-23 2:01 PM,2023-04-05T14:01:00.000Z,4,4,,PM,CLOSE,Y,,NO,CHATHAM,"2493, 2518","7.5 HP / 1800 RPM / TEFC / 575V/3PH/60HZ / FRAME#213T, DORRIS 207TR25 SHAFT MOUNTED SPEED REDUCER",,No,CH-DRYER_D,CH-DRYER_D:PDY84403.RO01,PDY-84403,PDY,RO01,Binary/relay output channel,Differential pressure relay output,Output,CV1833 MOTOR CURRENT,CV-1833
,INSPECT TROUGH GASKETS FOR LEAKAGE,23-31719,CV-1833,CV-1833,,,1-10-23 11:23 AM,2023-01-10T11:23:00.000Z,1-10-23 7:00 AM,2023-01-10T07:00:00.000Z,4-5-23 2:01 PM,2023-04-05T14:01:00.000Z,4,4,,PM,CLOSE,Y,,NO,CHATHAM,"2493, 2518","7.5 HP / 1800 RPM / TEFC / 575V/3PH/60HZ / FRAME#213T, DORRIS 207TR25 SHAFT MOUNTED SPEED REDUCER",,No,CH-DRYER_D_BMS,CH-DRYER_D_BMS:IT84201.PNT,IT-84201,IT,PNT,Point value / indication,Current transmitter,Indication,CV1833 SPEED INDICATION,CV-1833
,INSPECT TROUGH GASKETS FOR LEAKAGE,23-31719,CV-1833,CV-1833,,,1-10-23 11:23 AM,2023-01-10T11:23:00.000Z,1-10-23 7:00 AM,2023-01-10T07:00:00.000Z,4-5-23 2:01 PM,2023-04-05T14:01:00.000Z,4,4,,PM,CLOSE,Y,,NO,CHATHAM,"2493, 2518","7.5 HP / 1800 RPM / TEFC / 575V/3PH/60HZ / FRAME#213T, DORRIS 207TR25 SHAFT MOUNTED SPEED REDUCER",,No,CH-DRYER_D_CY2,CH-DRYER_D_CY2:TT84311.PNT,TT-84311,TT,PNT,Point value / indication,Temperature transmitter,Measurement,CV1833 SPEED SWITCH,CV-1833
,INSPECT TROUGH GASKETS FOR LEAKAGE,23-31719,CV-1833,CV-1833,,,1-10-23 11:23 AM,2023-01-10T11:23:00.000Z,1-10-23 7:00 AM,2023-01-10T07:00:00.000Z,4-5-23 2:01 PM,2023-04-05T14:01:00.000Z,4,4,,PM,CLOSE,Y,,NO,CHATHAM,"2493, 2518","7.5 HP / 1800 RPM / TEFC / 575V/3PH/60HZ / FRAME#213T, DORRIS 207TR25 SHAFT MOUNTED SPEED REDUCER",,No,CH-DRYER_D_CY2,CH-DRYER_D_CY2:TT84319.MEAS,TT-84319,TT,MEAS,Measured value (PV),Temperature transmitter,Measurement,CV1833 SPEED CONTROL,CV-1833
,INSPECT TROUGH GASKETS FOR LEAKAGE,23-31719,CV-1833,CV-1833,,,1-10-23 11:23 AM,2023-01-10T11:23:00.000Z,1-10-23 7:00 AM,2023-01-10T07:00:00.000Z,4-5-23 2:01 PM,2023-04-05T14:01:00.000Z,4,4,,PM,CLOSE,Y,,NO,CHATHAM,"2493, 2518","7.5 HP / 1800 RPM / TEFC / 575V/3PH/60HZ / FRAME#213T, DORRIS 207TR25 SHAFT MOUNTED SPEED REDUCER",,No,CH-DR_DECANT702,CH-DR_DECANT702:FIC17704.OUT,FIC-17704,FIC,OUT,Controller output / demand (CO),Flow indicating controller,Output/Demand,CV1833 MOTOR CURRENT,CV-1833
,INSPECT PILLOW BLOCK BEARINGS,23-31720,CV-1833,CV-1833,,,1-10-23 11:23 AM,2023-01-10T11:23:00.000Z,1-10-23 7:00 AM,2023-01-10T07:00:00.000Z,4-5-23 2:01 PM,2023-04-05T14:01:00.000Z,4,4,,PM,CLOSE,Y,,NO,CHATHAM,"2493, 2518","7.5 HP / 1800 RPM / TEFC / 575V/3PH/60HZ / FRAME#213T, DORRIS 207TR25 SHAFT MOUNTED SPEED REDUCER",,No,CH-DRA_CYCLNS,CH-DRA_CYCLNS:IT18171.MEAS,IT-18171,IT,MEAS,Measured value (PV),Current transmitter (motor amps),Measurement,CV1833 MOTOR CURRENT,CV-1833
,INSPECT PILLOW BLOCK BEARINGS,23-31720,CV-1833,CV-1833,,,1-10-23 11:23 AM,2023-01-10T11:23:00.000Z,1-10-23 7:00 AM,2023-01-10T07:00:00.000Z,4-5-23 2:01 PM,2023-04-05T14:01:00.000Z,4,4,,PM,CLOSE,Y,,NO,CHATHAM,"2493, 2518","7.5 HP / 1800 RPM / TEFC / 575V/3PH/60HZ / FRAME#213T, DORRIS 207TR25 SHAFT MOUNTED SPEED REDUCER",,No,CH-DRA_PROC_AIR,CH-DRA_PROC_AIR:TT18179D.MEAS,TT-18179D,TT,MEAS,Measured value (PV),Temperature transmitter,Measurement,CV1833 SPEED INDICATION,CV-1833
,INSPECT PILLOW BLOCK BEARINGS,23-31720,CV-1833,CV-1833,,,1-10-23 11:23 AM,2023-01-10T11:23:00.000Z,1-10-23 7:00 AM,2023-01-10T07:00:00.000Z,4-5-23 2:01 PM,2023-04-05T14:01:00.000Z,4,4,,PM,CLOSE,Y,,NO,CHATHAM,"2493, 2518","7.5 HP / 1800 RPM / TEFC / 575V/3PH/60HZ / FRAME#213T, DORRIS 207TR25 SHAFT MOUNTED SPEED REDUCER",,No,CH-DRA_COMB_AIR,CH-DRA_COMB_AIR:XV18182.STAIND,XV-18182,XV,STAIND,"Status indication (open/closed, run/stop)",Valve/damper/door status (discrete),Status,CV1833 SPEED SWITCH,CV-1833
,INSPECT PILLOW BLOCK BEARINGS,23-31720,CV-1833,CV-1833,,,1-10-23 11:23 AM,2023-01-10T11:23:00.000Z,1-10-23 7:00 AM,2023-01-10T07:00:00.000Z,4-5-23 2:01 PM,2023-04-05T14:01:00.000Z,4,4,,PM,CLOSE,Y,,NO,CHATHAM,"2493, 2518","7.5 HP / 1800 RPM / TEFC / 575V/3PH/60HZ / FRAME#213T, DORRIS 207TR25 SHAFT MOUNTED SPEED REDUCER",,No,CH-DRA_COMB_AIR,CH-DRA_COMB_AIR:ZT18215.MEAS,ZT-18215,ZT,MEAS,Measured value (PV),Valve/actuator position feedback,Measurement,CV1833 SPEED CONTROL,CV-1833
,INSPECT PILLOW BLOCK BEARINGS,23-31720,CV-1833,CV-1833,,,1-10-23 11:23 AM,2023-01-10T11:23:00.000Z,1-10-23 7:00 AM,2023-01-10T07:00:00.000Z,4-5-23 2:01 PM,2023-04-05T14:01:00.000Z,4,4,,PM,CLOSE,Y,,NO,CHATHAM,"2493, 2518","7.5 HP / 1800 RPM / TEFC / 575V/3PH/60HZ / FRAME#213T, DORRIS 207TR25 SHAFT MOUNTED SPEED REDUCER",,No,CH-DRYER_A,CH-DRYER_A:CV1833.STAIND,CV-1833,CV,STAIND,"Status indication (open/closed, run/stop)",Conveyor (asset),Equipment status,RECYCLE SCREW CVYR,
,INSPECT PILLOW BLOCK BEARINGS,23-31720,CV-1833,CV-1833,,,1-10-23 11:23 AM,2023-01-10T11:23:00.000Z,1-10-23 7:00 AM,2023-01-10T07:00:00.000Z,4-5-23 2:01 PM,2023-04-05T14:01:00.000Z,4,4,,PM,CLOSE,Y,,NO,CHATHAM,"2493, 2518","7.5 HP / 1800 RPM / TEFC / 575V/3PH/60HZ / FRAME#213T, DORRIS 207TR25 SHAFT MOUNTED SPEED REDUCER",,No,CH-DR_PROC_AIR,CH-DR_PROC_AIR:PT33307.MEAS,PT-33307,PT,MEAS,Measured value (PV),Pressure transmitter,Measurement,CV1833 MOTOR CURRENT,CV-1833
,INSPECT PILLOW BLOCK BEARINGS,23-31720,CV-1833,CV-1833,,,1-10-23 11:23 AM,2023-01-10T11:23:00.000Z,1-10-23 7:00 AM,2023-01-10T07:00:00.000Z,4-5-23 2:01 PM,2023-04-05T14:01:00.000Z,4,4,,PM,CLOSE,Y,,NO,CHATHAM,"2493, 2518","7.5 HP / 1800 RPM / TEFC / 575V/3PH/60HZ / FRAME#213T, DORRIS 207TR25 SHAFT MOUNTED SPEED REDUCER",,No,CH-DR_UTIL_WTR,CH-DR_UTIL_WTR:SY18642.OUT,SY-18642,SY,OUT,Controller output / demand (CO),Speed output (VFD demand),Output/Demand,CV1833 MOTOR CURRENT,CV-1833
,INSPECT PILLOW BLOCK BEARINGS,23-31720,CV-1833,CV-1833,,,1-10-23 11:23 AM,2023-01-10T11:23:00.000Z,1-10-23 7:00 AM,2023-01-10T07:00:00.000Z,4-5-23 2:01 PM,2023-04-05T14:01:00.000Z,4,4,,PM,CLOSE,Y,,NO,CHATHAM,"2493, 2518","7.5 HP / 1800 RPM / TEFC / 575V/3PH/60HZ / FRAME#213T, DORRIS 207TR25 SHAFT MOUNTED SPEED REDUCER",,No,CH-DRYER_D,CH-DRYER_D:PDY84403.RO01,PDY-84403,PDY,RO01,Binary/relay output channel,Differential pressure relay output,Output,CV1833 MOTOR CURRENT,CV-1833
,INSPECT PILLOW BLOCK BEARINGS,23-31720,CV-1833,CV-1833,,,1-10-23 11:23 AM,2023-01-10T11:23:00.000Z,1-10-23 7:00 AM,2023-01-10T07:00:00.000Z,4-5-23 2:01 PM,2023-04-05T14:01:00.000Z,4,4,,PM,CLOSE,Y,,NO,CHATHAM,"2493, 2518","7.5 HP / 1800 RPM / TEFC / 575V/3PH/60HZ / FRAME#213T, DORRIS 207TR25 SHAFT MOUNTED SPEED REDUCER",,No,CH-DRYER_D_BMS,CH-DRYER_D_BMS:IT84201.PNT,IT-84201,IT,PNT,Point value / indication,Current transmitter,Indication,CV1833 SPEED INDICATION,CV-1833
,INSPECT PILLOW BLOCK BEARINGS,23-31720,CV-1833,CV-1833,,,1-10-23 11:23 AM,2023-01-10T11:23:00.000Z,1-10-23 7:00 AM,2023-01-10T07:00:00.000Z,4-5-23 2:01 PM,2023-04-05T14:01:00.000Z,4,4,,PM,CLOSE,Y,,NO,CHATHAM,"2493, 2518","7.5 HP / 1800 RPM / TEFC / 575V/3PH/60HZ / FRAME#213T, DORRIS 207TR25 SHAFT MOUNTED SPEED REDUCER",,No,CH-DRYER_D_CY2,CH-DRYER_D_CY2:TT84311.PNT,TT-84311,TT,PNT,Point value / indication,Temperature transmitter,Measurement,CV1833 SPEED SWITCH,CV-1833
,INSPECT PILLOW BLOCK BEARINGS,23-31720,CV-1833,CV-1833,,,1-10-23 11:23 AM,2023-01-10T11:23:00.000Z,1-10-23 7:00 AM,2023-01-10T07:00:00.000Z,4-5-23 2:01 PM,2023-04-05T14:01:00.000Z,4,4,,PM,CLOSE,Y,,NO,CHATHAM,"2493, 2518","7.5 HP / 1800 RPM / TEFC / 575V/3PH/60HZ / FRAME#213T, DORRIS 207TR25 SHAFT MOUNTED SPEED REDUCER",,No,CH-DRYER_D_CY2,CH-DRYER_D_CY2:TT84319.MEAS,TT-84319,TT,MEAS,Measured value (PV),Temperature transmitter,Measurement,CV1833 SPEED CONTROL,CV-1833
,INSPECT PILLOW BLOCK BEARINGS,23-31720,CV-1833,CV-1833,,,1-10-23 11:23 AM,2023-01-10T11:23:00.000Z,1-10-23 7:00 AM,2023-01-10T07:00:00.000Z,4-5-23 2:01 PM,2023-04-05T14:01:00.000Z,4,4,,PM,CLOSE,Y,,NO,CHATHAM,"2493, 2518","7.5 HP / 1800 RPM / TEFC / 575V/3PH/60HZ / FRAME#213T, DORRIS 207TR25 SHAFT MOUNTED SPEED REDUCER",,No,CH-DR_DECANT702,CH-DR_DECANT702:FIC17704.OUT,FIC-17704,FIC,OUT,Controller output / demand (CO),Flow indicating controller,Output/Demand,CV1833 MOTOR CURRENT,CV-1833
,INSPECT GEARBOX,23-31721,CV-1833,CV-1833,,,1-10-23 11:23 AM,2023-01-10T11:23:00.000Z,1-10-23 7:00 AM,2023-01-10T07:00:00.000Z,4-5-23 2:01 PM,2023-04-05T14:01:00.000Z,4,4,,PM,CLOSE,Y,,NO,CHATHAM,"2493, 2518","7.5 HP / 1800 RPM / TEFC / 575V/3PH/60HZ / FRAME#213T, DORRIS 207TR25 SHAFT MOUNTED SPEED REDUCER",,No,CH-DRA_CYCLNS,CH-DRA_CYCLNS:IT18171.MEAS,IT-18171,IT,MEAS,Measured value (PV),Current transmitter (motor amps),Measurement,CV1833 MOTOR CURRENT,CV-1833
,INSPECT GEARBOX,23-31721,CV-1833,CV-1833,,,1-10-23 11:23 AM,2023-01-10T11:23:00.000Z,1-10-23 7:00 AM,2023-01-10T07:00:00.000Z,4-5-23 2:01 PM,2023-04-05T14:01:00.000Z,4,4,,PM,CLOSE,Y,,NO,CHATHAM,"2493, 2518","7.5 HP / 1800 RPM / TEFC / 575V/3PH/60HZ / FRAME#213T, DORRIS 207TR25 SHAFT MOUNTED SPEED REDUCER",,No,CH-DRA_PROC_AIR,CH-DRA_PROC_AIR:TT18179D.MEAS,TT-18179D,TT,MEAS,Measured value (PV),Temperature transmitter,Measurement,CV1833 SPEED INDICATION,CV-1833
,INSPECT GEARBOX,23-31721,CV-1833,CV-1833,,,1-10-23 11:23 AM,2023-01-10T11:23:00.000Z,1-10-23 7:00 AM,2023-01-10T07:00:00.000Z,4-5-23 2:01 PM,2023-04-05T14:01:00.000Z,4,4,,PM,CLOSE,Y,,NO,CHATHAM,"2493, 2518","7.5 HP / 1800 RPM / TEFC / 575V/3PH/60HZ / FRAME#213T, DORRIS 207TR25 SHAFT MOUNTED SPEED REDUCER",,No,CH-DRA_COMB_AIR,CH-DRA_COMB_AIR:XV18182.STAIND,XV-18182,XV,STAIND,"Status indication (open/closed, run/stop)",Valve/damper/door status (discrete),Status,CV1833 SPEED SWITCH,CV-1833
,INSPECT GEARBOX,23-31721,CV-1833,CV-1833,,,1-10-23 11:23 AM,2023-01-10T11:23:00.000Z,1-10-23 7:00 AM,2023-01-10T07:00:00.000Z,4-5-23 2:01 PM,2023-04-05T14:01:00.000Z,4,4,,PM,CLOSE,Y,,NO,CHATHAM,"2493, 2518","7.5 HP / 1800 RPM / TEFC / 575V/3PH/60HZ / FRAME#213T, DORRIS 207TR25 SHAFT MOUNTED SPEED REDUCER",,No,CH-DRA_COMB_AIR,CH-DRA_COMB_AIR:ZT18215.MEAS,ZT-18215,ZT,MEAS,Measured value (PV),Valve/actuator position feedback,Measurement,CV1833 SPEED CONTROL,CV-1833
,INSPECT GEARBOX,23-31721,CV-1833,CV-1833,,,1-10-23 11:23 AM,2023-01-10T11:23:00.000Z,1-10-23 7:00 AM,2023-01-10T07:00:00.000Z,4-5-23 2:01 PM,2023-04-05T14:01:00.000Z,4,4,,PM,CLOSE,Y,,NO,CHATHAM,"2493, 2518","7.5 HP / 1800 RPM / TEFC / 575V/3PH/60HZ / FRAME#213T, DORRIS 207TR25 SHAFT MOUNTED SPEED REDUCER",,No,CH-DRYER_A,CH-DRYER_A:CV1833.STAIND,CV-1833,CV,STAIND,"Status indication (open/closed, run/stop)",Conveyor (asset),Equipment status,RECYCLE SCREW CVYR,
,INSPECT GEARBOX,23-31721,CV-1833,CV-1833,,,1-10-23 11:23 AM,2023-01-10T11:23:00.000Z,1-10-23 7:00 AM,2023-01-10T07:00:00.000Z,4-5-23 2:01 PM,2023-04-05T14:01:00.000Z,4,4,,PM,CLOSE,Y,,NO,CHATHAM,"2493, 2518","7.5 HP / 1800 RPM / TEFC / 575V/3PH/60HZ / FRAME#213T, DORRIS 207TR25 SHAFT MOUNTED SPEED REDUCER",,No,CH-DR_PROC_AIR,CH-DR_PROC_AIR:PT33307.MEAS,PT-33307,PT,MEAS,Measured value (PV),Pressure transmitter,Measurement,CV1833 MOTOR CURRENT,CV-1833
,INSPECT GEARBOX,23-31721,CV-1833,CV-1833,,,1-10-23 11:23 AM,2023-01-10T11:23:00.000Z,1-10-23 7:00 AM,2023-01-10T07:00:00.000Z,4-5-23 2:01 PM,2023-04-05T14:01:00.000Z,4,4,,PM,CLOSE,Y,,NO,CHATHAM,"2493, 2518","7.5 HP / 1800 RPM / TEFC / 575V/3PH/60HZ / FRAME#213T, DORRIS 207TR25 SHAFT MOUNTED SPEED REDUCER",,No,CH-DR_UTIL_WTR,CH-DR_UTIL_WTR:SY18642.OUT,SY-18642,SY,OUT,Controller output / demand (CO),Speed output (VFD demand),Output/Demand,CV1833 MOTOR CURRENT,CV-1833
,INSPECT GEARBOX,23-31721,CV-1833,CV-1833,,,1-10-23 11:23 AM,2023-01-10T11:23:00.000Z,1-10-23 7:00 AM,2023-01-10T07:00:00.000Z,4-5-23 2:01 PM,2023-04-05T14:01:00.000Z,4,4,,PM,CLOSE,Y,,NO,CHATHAM,"2493, 2518","7.5 HP / 1800 RPM / TEFC / 575V/3PH/60HZ / FRAME#213T, DORRIS 207TR25 SHAFT MOUNTED SPEED REDUCER",,No,CH-DRYER_D,CH-DRYER_D:PDY84403.RO01,PDY-84403,PDY,RO01,Binary/relay output channel,Differential pressure relay output,Output,CV1833 MOTOR CURRENT,CV-1833
,INSPECT GEARBOX,23-31721,CV-1833,CV-1833,,,1-10-23 11:23 AM,2023-01-10T11:23:00.000Z,1-10-23 7:00 AM,2023-01-10T07:00:00.000Z,4-5-23 2:01 PM,2023-04-05T14:01:00.000Z,4,4,,PM,CLOSE,Y,,NO,CHATHAM,"2493, 2518","7.5 HP / 1800 RPM / TEFC / 575V/3PH/60HZ / FRAME#213T, DORRIS 207TR25 SHAFT MOUNTED SPEED REDUCER",,No,CH-DRYER_D_BMS,CH-DRYER_D_BMS:IT84201.PNT,IT-84201,IT,PNT,Point value / indication,Current transmitter,Indication,CV1833 SPEED INDICATION,CV-1833
,INSPECT GEARBOX,23-31721,CV-1833,CV-1833,,,1-10-23 11:23 AM,2023-01-10T11:23:00.000Z,1-10-23 7:00 AM,2023-01-10T07:00:00.000Z,4-5-23 2:01 PM,2023-04-05T14:01:00.000Z,4,4,,PM,CLOSE,Y,,NO,CHATHAM,"2493, 2518","7.5 HP / 1800 RPM / TEFC / 575V/3PH/60HZ / FRAME#213T, DORRIS 207TR25 SHAFT MOUNTED SPEED REDUCER",,No,CH-DRYER_D_CY2,CH-DRYER_D_CY2:TT84311.PNT,TT-84311,TT,PNT,Point value / indication,Temperature transmitter,Measurement,CV1833 SPEED SWITCH,CV-1833
,INSPECT GEARBOX,23-31721,CV-1833,CV-1833,,,1-10-23 11:23 AM,2023-01-10T11:23:00.000Z,1-10-23 7:00 AM,2023-01-10T07:00:00.000Z,4-5-23 2:01 PM,2023-04-05T14:01:00.000Z,4,4,,PM,CLOSE,Y,,NO,CHATHAM,"2493, 2518","7.5 HP / 1800 RPM / TEFC / 575V/3PH/60HZ / FRAME#213T, DORRIS 207TR25 SHAFT MOUNTED SPEED REDUCER",,No,CH-DRYER_D_CY2,CH-DRYER_D_CY2:TT84319.MEAS,TT-84319,TT,MEAS,Measured value (PV),Temperature transmitter,Measurement,CV1833 SPEED CONTROL,CV-1833
,INSPECT GEARBOX,23-31721,CV-1833,CV-1833,,,1-10-23 11:23 AM,2023-01-10T11:23:00.000Z,1-10-23 7:00 AM,2023-01-10T07:00:00.000Z,4-5-23 2:01 PM,2023-04-05T14:01:00.000Z,4,4,,PM,CLOSE,Y,,NO,CHATHAM,"2493, 2518","7.5 HP / 1800 RPM / TEFC / 575V/3PH/60HZ / FRAME#213T, DORRIS 207TR25 SHAFT MOUNTED SPEED REDUCER",,No,CH-DR_DECANT702,CH-DR_DECANT702:FIC17704.OUT,FIC-17704,FIC,OUT,Controller output / demand (CO),Flow indicating controller,Output/Demand,CV1833 MOTOR CURRENT,CV-1833
,INSPECT SCREW CONVEYOR,23-31722,CV-1833,CV-1833,,,1-10-23 11:23 AM,2023-01-10T11:23:00.000Z,1-10-23 7:00 AM,2023-01-10T07:00:00.000Z,4-5-23 2:01 PM,2023-04-05T14:01:00.000Z,4,4,,PM,CLOSE,Y,,NO,CHATHAM,"2493, 2518","7.5 HP / 1800 RPM / TEFC / 575V/3PH/60HZ / FRAME#213T, DORRIS 207TR25 SHAFT MOUNTED SPEED REDUCER",,No,CH-DRA_CYCLNS,CH-DRA_CYCLNS:IT18171.MEAS,IT-18171,IT,MEAS,Measured value (PV),Current transmitter (motor amps),Measurement,CV1833 MOTOR CURRENT,CV-1833
,INSPECT SCREW CONVEYOR,23-31722,CV-1833,CV-1833,,,1-10-23 11:23 AM,2023-01-10T11:23:00.000Z,1-10-23 7:00 AM,2023-01-10T07:00:00.000Z,4-5-23 2:01 PM,2023-04-05T14:01:00.000Z,4,4,,PM,CLOSE,Y,,NO,CHATHAM,"2493, 2518","7.5 HP / 1800 RPM / TEFC / 575V/3PH/60HZ / FRAME#213T, DORRIS 207TR25 SHAFT MOUNTED SPEED REDUCER",,No,CH-DRA_PROC_AIR,CH-DRA_PROC_AIR:TT18179D.MEAS,TT-18179D,TT,MEAS,Measured value (PV),Temperature transmitter,Measurement,CV1833 SPEED INDICATION,CV-1833
,INSPECT SCREW CONVEYOR,23-31722,CV-1833,CV-1833,,,1-10-23 11:23 AM,2023-01-10T11:23:00.000Z,1-10-23 7:00 AM,2023-01-10T07:00:00.000Z,4-5-23 2:01 PM,2023-04-05T14:01:00.000Z,4,4,,PM,CLOSE,Y,,NO,CHATHAM,"2493, 2518","7.5 HP / 1800 RPM / TEFC / 575V/3PH/60HZ / FRAME#213T, DORRIS 207TR25 SHAFT MOUNTED SPEED REDUCER",,No,CH-DRA_COMB_AIR,CH-DRA_COMB_AIR:XV18182.STAIND,XV-18182,XV,STAIND,"Status indication (open/closed, run/stop)",Valve/damper/door status (discrete),Status,CV1833 SPEED SWITCH,CV-1833
,INSPECT SCREW CONVEYOR,23-31722,CV-1833,CV-1833,,,1-10-23 11:23 AM,2023-01-10T11:23:00.000Z,1-10-23 7:00 AM,2023-01-10T07:00:00.000Z,4-5-23 2:01 PM,2023-04-05T14:01:00.000Z,4,4,,PM,CLOSE,Y,,NO,CHATHAM,"2493, 2518","7.5 HP / 1800 RPM / TEFC / 575V/3PH/60HZ / FRAME#213T, DORRIS 207TR25 SHAFT MOUNTED SPEED REDUCER",,No,CH-DRA_COMB_AIR,CH-DRA_COMB_AIR:ZT18215.MEAS,ZT-18215,ZT,MEAS,Measured value (PV),Valve/actuator position feedback,Measurement,CV1833 SPEED CONTROL,CV-1833
,INSPECT SCREW CONVEYOR,23-31722,CV-1833,CV-1833,,,1-10-23 11:23 AM,2023-01-10T11:23:00.000Z,1-10-23 7:00 AM,2023-01-10T07:00:00.000Z,4-5-23 2:01 PM,2023-04-05T14:01:00.000Z,4,4,,PM,CLOSE,Y,,NO,CHATHAM,"2493, 2518","7.5 HP / 1800 RPM / TEFC / 575V/3PH/60HZ / FRAME#213T, DORRIS 207TR25 SHAFT MOUNTED SPEED REDUCER",,No,CH-DRYER_A,CH-DRYER_A:CV1833.STAIND,CV-1833,CV,STAIND,"Status indication (open/closed, run/stop)",Conveyor (asset),Equipment status,RECYCLE SCREW CVYR,
,INSPECT SCREW CONVEYOR,23-31722,CV-1833,CV-1833,,,1-10-23 11:23 AM,2023-01-10T11:23:00.000Z,1-10-23 7:00 AM,2023-01-10T07:00:00.000Z,4-5-23 2:01 PM,2023-04-05T14:01:00.000Z,4,4,,PM,CLOSE,Y,,NO,CHATHAM,"2493, 2518","7.5 HP / 1800 RPM / TEFC / 575V/3PH/60HZ / FRAME#213T, DORRIS 207TR25 SHAFT MOUNTED SPEED REDUCER",,No,CH-DR_PROC_AIR,CH-DR_PROC_AIR:PT33307.MEAS,PT-33307,PT,MEAS,Measured value (PV),Pressure transmitter,Measurement,CV1833 MOTOR CURRENT,CV-1833
,INSPECT SCREW CONVEYOR,23-31722,CV-1833,CV-1833,,,1-10-23 11:23 AM,2023-01-10T11:23:00.000Z,1-10-23 7:00 AM,2023-01-10T07:00:00.000Z,4-5-23 2:01 PM,2023-04-05T14:01:00.000Z,4,4,,PM,CLOSE,Y,,NO,CHATHAM,"2493, 2518","7.5 HP / 1800 RPM / TEFC / 575V/3PH/60HZ / FRAME#213T, DORRIS 207TR25 SHAFT MOUNTED SPEED REDUCER",,No,CH-DR_UTIL_WTR,CH-DR_UTIL_WTR:SY18642.OUT,SY-18642,SY,OUT,Controller output / demand (CO),Speed output (VFD demand),Output/Demand,CV1833 MOTOR CURRENT,CV-1833
,INSPECT SCREW CONVEYOR,23-31722,CV-1833,CV-1833,,,1-10-23 11:23 AM,2023-01-10T11:23:00.000Z,1-10-23 7:00 AM,2023-01-10T07:00:00.000Z,4-5-23 2:01 PM,2023-04-05T14:01:00.000Z,4,4,,PM,CLOSE,Y,,NO,CHATHAM,"2493, 2518","7.5 HP / 1800 RPM / TEFC / 575V/3PH/60HZ / FRAME#213T, DORRIS 207TR25 SHAFT MOUNTED SPEED REDUCER",,No,CH-DRYER_D,CH-DRYER_D:PDY84403.RO01,PDY-84403,PDY,RO01,Binary/relay output channel,Differential pressure relay output,Output,CV1833 MOTOR CURRENT,CV-1833
,INSPECT SCREW CONVEYOR,23-31722,CV-1833,CV-1833,,,1-10-23 11:23 AM,2023-01-10T11:23:00.000Z,1-10-23 7:00 AM,2023-01-10T07:00:00.000Z,4-5-23 2:01 PM,2023-04-05T14:01:00.000Z,4,4,,PM,CLOSE,Y,,NO,CHATHAM,"2493, 2518","7.5 HP / 1800 RPM / TEFC / 575V/3PH/60HZ / FRAME#213T, DORRIS 207TR25 SHAFT MOUNTED SPEED REDUCER",,No,CH-DRYER_D_BMS,CH-DRYER_D_BMS:IT84201.PNT,IT-84201,IT,PNT,Point value / indication,Current transmitter,Indication,CV1833 SPEED INDICATION,CV-1833
,INSPECT SCREW CONVEYOR,23-31722,CV-1833,CV-1833,,,1-10-23 11:23 AM,2023-01-10T11:23:00.000Z,1-10-23 7:00 AM,2023-01-10T07:00:00.000Z,4-5-23 2:01 PM,2023-04-05T14:01:00.000Z,4,4,,PM,CLOSE,Y,,NO,CHATHAM,"2493, 2518","7.5 HP / 1800 RPM / TEFC / 575V/3PH/60HZ / FRAME#213T, DORRIS 207TR25 SHAFT MOUNTED SPEED REDUCER",,No,CH-DRYER_D_CY2,CH-DRYER_D_CY2:TT84311.PNT,TT-84311,TT,PNT,Point value / indication,Temperature transmitter,Measurement,CV1833 SPEED SWITCH,CV-1833
,INSPECT SCREW CONVEYOR,23-31722,CV-1833,CV-1833,,,1-10-23 11:23 AM,2023-01-10T11:23:00.000Z,1-10-23 7:00 AM,2023-01-10T07:00:00.000Z,4-5-23 2:01 PM,2023-04-05T14:01:00.000Z,4,4,,PM,CLOSE,Y,,NO,CHATHAM,"2493, 2518","7.5 HP / 1800 RPM / TEFC / 575V/3PH/60HZ / FRAME#213T, DORRIS 207TR25 SHAFT MOUNTED SPEED REDUCER",,No,CH-DRYER_D_CY2,CH-DRYER_D_CY2:TT84319.MEAS,TT-84319,TT,MEAS,Measured value (PV),Temperature transmitter,Measurement,CV1833 SPEED CONTROL,CV-1833
,INSPECT SCREW CONVEYOR,23-31722,CV-1833,CV-1833,,,1-10-23 11:23 AM,2023-01-10T11:23:00.000Z,1-10-23 7:00 AM,2023-01-10T07:00:00.000Z,4-5-23 2:01 PM,2023-04-05T14:01:00.000Z,4,4,,PM,CLOSE,Y,,NO,CHATHAM,"2493, 2518","7.5 HP / 1800 RPM / TEFC / 575V/3PH/60HZ / FRAME#213T, DORRIS 207TR25 SHAFT MOUNTED SPEED REDUCER",,No,CH-DR_DECANT702,CH-DR_DECANT702:FIC17704.OUT,FIC-17704,FIC,OUT,Controller output / demand (CO),Flow indicating controller,Output/Demand,CV1833 MOTOR CURRENT,CV-1833
,INSPECT CONVEYOR TROUGH,23-31723,CV-1833,CV-1833,,,1-10-23 11:23 AM,2023-01-10T11:23:00.000Z,1-10-23 7:00 AM,2023-01-10T07:00:00.000Z,4-5-23 2:01 PM,2023-04-05T14:01:00.000Z,4,4,,PM,CLOSE,Y,,NO,CHATHAM,"2493, 2518","7.5 HP / 1800 RPM / TEFC / 575V/3PH/60HZ / FRAME#213T, DORRIS 207TR25 SHAFT MOUNTED SPEED REDUCER",,No,CH-DRA_CYCLNS,CH-DRA_CYCLNS:IT18171.MEAS,IT-18171,IT,MEAS,Measured value (PV),Current transmitter (motor amps),Measurement,CV1833 MOTOR CURRENT,CV-1833
,INSPECT CONVEYOR TROUGH,23-31723,CV-1833,CV-1833,,,1-10-23 11:23 AM,2023-01-10T11:23:00.000Z,1-10-23 7:00 AM,2023-01-10T07:00:00.000Z,4-5-23 2:01 PM,2023-04-05T14:01:00.000Z,4,4,,PM,CLOSE,Y,,NO,CHATHAM,"2493, 2518","7.5 HP / 1800 RPM / TEFC / 575V/3PH/60HZ / FRAME#213T, DORRIS 207TR25 SHAFT MOUNTED SPEED REDUCER",,No,CH-DRA_PROC_AIR,CH-DRA_PROC_AIR:TT18179D.MEAS,TT-18179D,TT,MEAS,Measured value (PV),Temperature transmitter,Measurement,CV1833 SPEED INDICATION,CV-1833
,INSPECT CONVEYOR TROUGH,23-31723,CV-1833,CV-1833,,,1-10-23 11:23 AM,2023-01-10T11:23:00.000Z,1-10-23 7:00 AM,2023-01-10T07:00:00.000Z,4-5-23 2:01 PM,2023-04-05T14:01:00.000Z,4,4,,PM,CLOSE,Y,,NO,CHATHAM,"2493, 2518","7.5 HP / 1800 RPM / TEFC / 575V/3PH/60HZ / FRAME#213T, DORRIS 207TR25 SHAFT MOUNTED SPEED REDUCER",,No,CH-DRA_COMB_AIR,CH-DRA_COMB_AIR:XV18182.STAIND,XV-18182,XV,STAIND,"Status indication (open/closed, run/stop)",Valve/damper/door status (discrete),Status,CV1833 SPEED SWITCH,CV-1833
,INSPECT CONVEYOR TROUGH,23-31723,CV-1833,CV-1833,,,1-10-23 11:23 AM,2023-01-10T11:23:00.000Z,1-10-23 7:00 AM,2023-01-10T07:00:00.000Z,4-5-23 2:01 PM,2023-04-05T14:01:00.000Z,4,4,,PM,CLOSE,Y,,NO,CHATHAM,"2493, 2518","7.5 HP / 1800 RPM / TEFC / 575V/3PH/60HZ / FRAME#213T, DORRIS 207TR25 SHAFT MOUNTED SPEED REDUCER",,No,CH-DRA_COMB_AIR,CH-DRA_COMB_AIR:ZT18215.MEAS,ZT-18215,ZT,MEAS,Measured value (PV),Valve/actuator position feedback,Measurement,CV1833 SPEED CONTROL,CV-1833
,INSPECT CONVEYOR TROUGH,23-31723,CV-1833,CV-1833,,,1-10-23 11:23 AM,2023-01-10T11:23:00.000Z,1-10-23 7:00 AM,2023-01-10T07:00:00.000Z,4-5-23 2:01 PM,2023-04-05T14:01:00.000Z,4,4,,PM,CLOSE,Y,,NO,CHATHAM,"2493, 2518","7.5 HP / 1800 RPM / TEFC / 575V/3PH/60HZ / FRAME#213T, DORRIS 207TR25 SHAFT MOUNTED SPEED REDUCER",,No,CH-DRYER_A,CH-DRYER_A:CV1833.STAIND,CV-1833,CV,STAIND,"Status indication (open/closed, run/stop)",Conveyor (asset),Equipment status,RECYCLE SCREW CVYR,
,INSPECT CONVEYOR TROUGH,23-31723,CV-1833,CV-1833,,,1-10-23 11:23 AM,2023-01-10T11:23:00.000Z,1-10-23 7:00 AM,2023-01-10T07:00:00.000Z,4-5-23 2:01 PM,2023-04-05T14:01:00.000Z,4,4,,PM,CLOSE,Y,,NO,CHATHAM,"2493, 2518","7.5 HP / 1800 RPM / TEFC / 575V/3PH/60HZ / FRAME#213T, DORRIS 207TR25 SHAFT MOUNTED SPEED REDUCER",,No,CH-DR_PROC_AIR,CH-DR_PROC_AIR:PT33307.MEAS,PT-33307,PT,MEAS,Measured value (PV),Pressure transmitter,Measurement,CV1833 MOTOR CURRENT,CV-1833
,INSPECT CONVEYOR TROUGH,23-31723,CV-1833,CV-1833,,,1-10-23 11:23 AM,2023-01-10T11:23:00.000Z,1-10-23 7:00 AM,2023-01-10T07:00:00.000Z,4-5-23 2:01 PM,2023-04-05T14:01:00.000Z,4,4,,PM,CLOSE,Y,,NO,CHATHAM,"2493, 2518","7.5 HP / 1800 RPM / TEFC / 575V/3PH/60HZ / FRAME#213T, DORRIS 207TR25 SHAFT MOUNTED SPEED REDUCER",,No,CH-DR_UTIL_WTR,CH-DR_UTIL_WTR:SY18642.OUT,SY-18642,SY,OUT,Controller output / demand (CO),Speed output (VFD demand),Output/Demand,CV1833 MOTOR CURRENT,CV-1833
,INSPECT CONVEYOR TROUGH,23-31723,CV-1833,CV-1833,,,1-10-23 11:23 AM,2023-01-10T11:23:00.000Z,1-10-23 7:00 AM,2023-01-10T07:00:00.000Z,4-5-23 2:01 PM,2023-04-05T14:01:00.000Z,4,4,,PM,CLOSE,Y,,NO,CHATHAM,"2493, 2518","7.5 HP / 1800 RPM / TEFC / 575V/3PH/60HZ / FRAME#213T, DORRIS 207TR25 SHAFT MOUNTED SPEED REDUCER",,No,CH-DRYER_D,CH-DRYER_D:PDY84403.RO01,PDY-84403,PDY,RO01,Binary/relay output channel,Differential pressure relay output,Output,CV1833 MOTOR CURRENT,CV-1833
,INSPECT CONVEYOR TROUGH,23-31723,CV-1833,CV-1833,,,1-10-23 11:23 AM,2023-01-10T11:23:00.000Z,1-10-23 7:00 AM,2023-01-10T07:00:00.000Z,4-5-23 2:01 PM,2023-04-05T14:01:00.000Z,4,4,,PM,CLOSE,Y,,NO,CHATHAM,"2493, 2518","7.5 HP / 1800 RPM / TEFC / 575V/3PH/60HZ / FRAME#213T, DORRIS 207TR25 SHAFT MOUNTED SPEED REDUCER",,No,CH-DRYER_D_BMS,CH-DRYER_D_BMS:IT84201.PNT,IT-84201,IT,PNT,Point value / indication,Current transmitter,Indication,CV1833 SPEED INDICATION,CV-1833
,INSPECT CONVEYOR TROUGH,23-31723,CV-1833,CV-1833,,,1-10-23 11:23 AM,2023-01-10T11:23:00.000Z,1-10-23 7:00 AM,2023-01-10T07:00:00.000Z,4-5-23 2:01 PM,2023-04-05T14:01:00.000Z,4,4,,PM,CLOSE,Y,,NO,CHATHAM,"2493, 2518","7.5 HP / 1800 RPM / TEFC / 575V/3PH/60HZ / FRAME#213T, DORRIS 207TR25 SHAFT MOUNTED SPEED REDUCER",,No,CH-DRYER_D_CY2,CH-DRYER_D_CY2:TT84311.PNT,TT-84311,TT,PNT,Point value / indication,Temperature transmitter,Measurement,CV1833 SPEED SWITCH,CV-1833
,INSPECT CONVEYOR TROUGH,23-31723,CV-1833,CV-1833,,,1-10-23 11:23 AM,2023-01-10T11:23:00.000Z,1-10-23 7:00 AM,2023-01-10T07:00:00.000Z,4-5-23 2:01 PM,2023-04-05T14:01:00.000Z,4,4,,PM,CLOSE,Y,,NO,CHATHAM,"2493, 2518","7.5 HP / 1800 RPM / TEFC / 575V/3PH/60HZ / FRAME#213T, DORRIS 207TR25 SHAFT MOUNTED SPEED REDUCER",,No,CH-DRYER_D_CY2,CH-DRYER_D_CY2:TT84319.MEAS,TT-84319,TT,MEAS,Measured value (PV),Temperature transmitter,Measurement,CV1833 SPEED CONTROL,CV-1833
,INSPECT CONVEYOR TROUGH,23-31723,CV-1833,CV-1833,,,1-10-23 11:23 AM,2023-01-10T11:23:00.000Z,1-10-23 7:00 AM,2023-01-10T07:00:00.000Z,4-5-23 2:01 PM,2023-04-05T14:01:00.000Z,4,4,,PM,CLOSE,Y,,NO,CHATHAM,"2493, 2518","7.5 HP / 1800 RPM / TEFC / 575V/3PH/60HZ / FRAME#213T, DORRIS 207TR25 SHAFT MOUNTED SPEED REDUCER",,No,CH-DR_DECANT702,CH-DR_DECANT702:FIC17704.OUT,FIC-17704,FIC,OUT,Controller output / demand (CO),Flow indicating controller,Output/Demand,CV1833 MOTOR CURRENT,CV-1833
,CV-1834 MECHANICAL PM,23-31724,CV-1834,CV-1834,,,1-10-23 11:26 AM,2023-01-10T11:26:00.000Z,2-23-23 10:00 AM,2023-02-23T10:00:00.000Z,4-5-23 2:01 PM,2023-04-05T14:01:00.000Z,4,4,,PM,CLOSE,Y,N,NO,CHATHAM,"2494, 2519","7.5 HP / 1800 RPM / TEFC / 575V/3PH/60HZ / FRAME#213T, DORRIS 203TR25 SHAFT MOUNTED SPEED REDUCER",,No,CH-DR_DUSTCOLL,CH-DR_DUSTCOLL:CV1834.STAIND,CV-1834,CV,STAIND,"Status indication (open/closed, run/stop)",Conveyor (asset),Equipment Status,DOSING BIN SCREW CVYR A,
,CV-1834 MECHANICAL PM,23-31724,CV-1834,CV-1834,,,1-10-23 11:26 AM,2023-01-10T11:26:00.000Z,2-23-23 10:00 AM,2023-02-23T10:00:00.000Z,4-5-23 2:01 PM,2023-04-05T14:01:00.000Z,4,4,,PM,CLOSE,Y,N,NO,CHATHAM,"2494, 2519","7.5 HP / 1800 RPM / TEFC / 575V/3PH/60HZ / FRAME#213T, DORRIS 203TR25 SHAFT MOUNTED SPEED REDUCER",,No,CH-DR_DUSTCOLL,CH-DR_DUSTCOLL:CV1834.STAIND,CV-1834,CV,STAIND,"Status indication (open/closed, run/stop)",Conveyor (asset),Equipment status,DOSING BIN SCREW CVYR A,
,CHECK COUPLING BOLTS,23-31725,CV-1834,CV-1834,,,1-10-23 11:26 AM,2023-01-10T11:26:00.000Z,1-10-23 7:00 AM,2023-01-10T07:00:00.000Z,4-5-23 2:01 PM,2023-04-05T14:01:00.000Z,4,4,,PM,CLOSE,Y,,NO,CHATHAM,"2494, 2519","7.5 HP / 1800 RPM / TEFC / 575V/3PH/60HZ / FRAME#213T, DORRIS 203TR25 SHAFT MOUNTED SPEED REDUCER",,No,CH-DR_DUSTCOLL,CH-DR_DUSTCOLL:CV1834.STAIND,CV-1834,CV,STAIND,"Status indication (open/closed, run/stop)",Conveyor (asset),Equipment Status,DOSING BIN SCREW CVYR A,
,CHECK COUPLING BOLTS,23-31725,CV-1834,CV-1834,,,1-10-23 11:26 AM,2023-01-10T11:26:00.000Z,1-10-23 7:00 AM,2023-01-10T07:00:00.000Z,4-5-23 2:01 PM,2023-04-05T14:01:00.000Z,4,4,,PM,CLOSE,Y,,NO,CHATHAM,"2494, 2519","7.5 HP / 1800 RPM / TEFC / 575V/3PH/60HZ / FRAME#213T, DORRIS 203TR25 SHAFT MOUNTED SPEED REDUCER",,No,CH-DR_DUSTCOLL,CH-DR_DUSTCOLL:CV1834.STAIND,CV-1834,CV,STAIND,"Status indication (open/closed, run/stop)",Conveyor (asset),Equipment status,DOSING BIN SCREW CVYR A,
,INSPECT TROUGH GASKETS FOR LEAKAGE,23-31726,CV-1834,CV-1834,,,1-10-23 11:26 AM,2023-01-10T11:26:00.000Z,1-10-23 7:00 AM,2023-01-10T07:00:00.000Z,4-5-23 2:01 PM,2023-04-05T14:01:00.000Z,4,4,,PM,CLOSE,Y,,NO,CHATHAM,"2494, 2519","7.5 HP / 1800 RPM / TEFC / 575V/3PH/60HZ / FRAME#213T, DORRIS 203TR25 SHAFT MOUNTED SPEED REDUCER",,No,CH-DR_DUSTCOLL,CH-DR_DUSTCOLL:CV1834.STAIND,CV-1834,CV,STAIND,"Status indication (open/closed, run/stop)",Conveyor (asset),Equipment Status,DOSING BIN SCREW CVYR A,
,INSPECT TROUGH GASKETS FOR LEAKAGE,23-31726,CV-1834,CV-1834,,,1-10-23 11:26 AM,2023-01-10T11:26:00.000Z,1-10-23 7:00 AM,2023-01-10T07:00:00.000Z,4-5-23 2:01 PM,2023-04-05T14:01:00.000Z,4,4,,PM,CLOSE,Y,,NO,CHATHAM,"2494, 2519","7.5 HP / 1800 RPM / TEFC / 575V/3PH/60HZ / FRAME#213T, DORRIS 203TR25 SHAFT MOUNTED SPEED REDUCER",,No,CH-DR_DUSTCOLL,CH-DR_DUSTCOLL:CV1834.STAIND,CV-1834,CV,STAIND,"Status indication (open/closed, run/stop)",Conveyor (asset),Equipment status,DOSING BIN SCREW CVYR A,
,INSPECT PILLOW BLOCK BEARINGS,23-31727,CV-1834,CV-1834,,,1-10-23 11:26 AM,2023-01-10T11:26:00.000Z,1-10-23 7:00 AM,2023-01-10T07:00:00.000Z,4-5-23 2:01 PM,2023-04-05T14:01:00.000Z,4,4,,PM,CLOSE,Y,,NO,CHATHAM,"2494, 2519","7.5 HP / 1800 RPM / TEFC / 575V/3PH/60HZ / FRAME#213T, DORRIS 203TR25 SHAFT MOUNTED SPEED REDUCER",,No,CH-DR_DUSTCOLL,CH-DR_DUSTCOLL:CV1834.STAIND,CV-1834,CV,STAIND,"Status indication (open/closed, run/stop)",Conveyor (asset),Equipment Status,DOSING BIN SCREW CVYR A,
,INSPECT PILLOW BLOCK BEARINGS,23-31727,CV-1834,CV-1834,,,1-10-23 11:26 AM,2023-01-10T11:26:00.000Z,1-10-23 7:00 AM,2023-01-10T07:00:00.000Z,4-5-23 2:01 PM,2023-04-05T14:01:00.000Z,4,4,,PM,CLOSE,Y,,NO,CHATHAM,"2494, 2519","7.5 HP / 1800 RPM / TEFC / 575V/3PH/60HZ / FRAME#213T, DORRIS 203TR25 SHAFT MOUNTED SPEED REDUCER",,No,CH-DR_DUSTCOLL,CH-DR_DUSTCOLL:CV1834.STAIND,CV-1834,CV,STAIND,"Status indication (open/closed, run/stop)",Conveyor (asset),Equipment status,DOSING BIN SCREW CVYR A,
,INSPECT GEARBOX,23-31728,CV-1834,CV-1834,,,1-10-23 11:26 AM,2023-01-10T11:26:00.000Z,1-10-23 7:00 AM,2023-01-10T07:00:00.000Z,4-5-23 2:01 PM,2023-04-05T14:01:00.000Z,4,4,,PM,CLOSE,Y,,NO,CHATHAM,"2494, 2519","7.5 HP / 1800 RPM / TEFC / 575V/3PH/60HZ / FRAME#213T, DORRIS 203TR25 SHAFT MOUNTED SPEED REDUCER",,No,CH-DR_DUSTCOLL,CH-DR_DUSTCOLL:CV1834.STAIND,CV-1834,CV,STAIND,"Status indication (open/closed, run/stop)",Conveyor (asset),Equipment Status,DOSING BIN SCREW CVYR A,
,INSPECT GEARBOX,23-31728,CV-1834,CV-1834,,,1-10-23 11:26 AM,2023-01-10T11:26:00.000Z,1-10-23 7:00 AM,2023-01-10T07:00:00.000Z,4-5-23 2:01 PM,2023-04-05T14:01:00.000Z,4,4,,PM,CLOSE,Y,,NO,CHATHAM,"2494, 2519","7.5 HP / 1800 RPM / TEFC / 575V/3PH/60HZ / FRAME#213T, DORRIS 203TR25 SHAFT MOUNTED SPEED REDUCER",,No,CH-DR_DUSTCOLL,CH-DR_DUSTCOLL:CV1834.STAIND,CV-1834,CV,STAIND,"Status indication (open/closed, run/stop)",Conveyor (asset),Equipment status,DOSING BIN SCREW CVYR A,
,INSPECT SCREW CONVEYOR,23-31729,CV-1834,CV-1834,,,1-10-23 11:26 AM,2023-01-10T11:26:00.000Z,1-10-23 7:00 AM,2023-01-10T07:00:00.000Z,4-5-23 2:01 PM,2023-04-05T14:01:00.000Z,4,4,,PM,CLOSE,Y,,NO,CHATHAM,"2494, 2519","7.5 HP / 1800 RPM / TEFC / 575V/3PH/60HZ / FRAME#213T, DORRIS 203TR25 SHAFT MOUNTED SPEED REDUCER",,No,CH-DR_DUSTCOLL,CH-DR_DUSTCOLL:CV1834.STAIND,CV-1834,CV,STAIND,"Status indication (open/closed, run/stop)",Conveyor (asset),Equipment Status,DOSING BIN SCREW CVYR A,
,INSPECT SCREW CONVEYOR,23-31729,CV-1834,CV-1834,,,1-10-23 11:26 AM,2023-01-10T11:26:00.000Z,1-10-23 7:00 AM,2023-01-10T07:00:00.000Z,4-5-23 2:01 PM,2023-04-05T14:01:00.000Z,4,4,,PM,CLOSE,Y,,NO,CHATHAM,"2494, 2519","7.5 HP / 1800 RPM / TEFC / 575V/3PH/60HZ / FRAME#213T, DORRIS 203TR25 SHAFT MOUNTED SPEED REDUCER",,No,CH-DR_DUSTCOLL,CH-DR_DUSTCOLL:CV1834.STAIND,CV-1834,CV,STAIND,"Status indication (open/closed, run/stop)",Conveyor (asset),Equipment status,DOSING BIN SCREW CVYR A,
,INSPECT CONVEYOR TROUGH,23-31730,CV-1834,CV-1834,,,1-10-23 11:26 AM,2023-01-10T11:26:00.000Z,1-10-23 7:00 AM,2023-01-10T07:00:00.000Z,4-5-23 2:01 PM,2023-04-05T14:01:00.000Z,4,4,,PM,CLOSE,Y,,NO,CHATHAM,"2494, 2519","7.5 HP / 1800 RPM / TEFC / 575V/3PH/60HZ / FRAME#213T, DORRIS 203TR25 SHAFT MOUNTED SPEED REDUCER",,No,CH-DR_DUSTCOLL,CH-DR_DUSTCOLL:CV1834.STAIND,CV-1834,CV,STAIND,"Status indication (open/closed, run/stop)",Conveyor (asset),Equipment Status,DOSING BIN SCREW CVYR A,
,INSPECT CONVEYOR TROUGH,23-31730,CV-1834,CV-1834,,,1-10-23 11:26 AM,2023-01-10T11:26:00.000Z,1-10-23 7:00 AM,2023-01-10T07:00:00.000Z,4-5-23 2:01 PM,2023-04-05T14:01:00.000Z,4,4,,PM,CLOSE,Y,,NO,CHATHAM,"2494, 2519","7.5 HP / 1800 RPM / TEFC / 575V/3PH/60HZ / FRAME#213T, DORRIS 203TR25 SHAFT MOUNTED SPEED REDUCER",,No,CH-DR_DUSTCOLL,CH-DR_DUSTCOLL:CV1834.STAIND,CV-1834,CV,STAIND,"Status indication (open/closed, run/stop)",Conveyor (asset),Equipment status,DOSING BIN SCREW CVYR A,
,Remove Blank and Re-install spool on Exhaust Ducting,23-31731,DR-1826,DR-1826,,,1-10-23 11:27 AM,2023-01-10T11:27:00.000Z,,,1-11-23 3:27 PM,2023-01-11T15:27:00.000Z,4,4,,CO,CLOSE,Y,,NO,CHATHAM,"2541, 2542, 2543, 2544, 2545, 2547, 2549, 2550, 2552, 2553, 2554, 2555, 2556, 2557, 2558, 2559","SWISS COMBI ROTARY DRYER DRUM, SEW GEARBOX - LEFT HAND DRIVE -, SEW GEARBOX - LEFT HAND DRIVE, SEW GEARBOX - RIGHT HAND DRIVE, SEW GEARBOX - RIGHT HAND DRIVE, MOTOR / 25HP / 1800RPM / TEFC / 575V/3PH/60HZ / FRAME# 284TC, MOTOR / 25HP / 1800RPM / TEFC / 575V/3PH/60HZ / FRAME# 284TC, MOTOR / 25HP / 1800RPM / TEFC / 575V/3PH/60HZ / FRAME# 284TC, MOTOR / 25HP / 1800RPM / TEFC / 575V/3PH/60HZ / FRAME# 284TC, TRUNNION (A) - LEFT HAND DRIVE, TRUNNION (B)- RIGHT HAND DRIVE, TRUNNION (D) - LEFT HAND DRIVE, TRUNNION (C) - RIGHT HAND DRIVE, THRUST ROLLER ASSEMBLY, THRUST ROLLER ASSEMBLY, TRUNNION LUBRICATION SYSTEM",,No,CH-DRA_CYCLNS,CH-DRA_CYCLNS:TT18168B.MEAS,TT-18168B,TT,MEAS,Measured value (PV),Temperature transmitter,Measurement,DRUM DR1826 MOTOR A AMPERAGE,DR-1826
,Remove Blank and Re-install spool on Exhaust Ducting,23-31731,DR-1826,DR-1826,,,1-10-23 11:27 AM,2023-01-10T11:27:00.000Z,,,1-11-23 3:27 PM,2023-01-11T15:27:00.000Z,4,4,,CO,CLOSE,Y,,NO,CHATHAM,"2541, 2542, 2543, 2544, 2545, 2547, 2549, 2550, 2552, 2553, 2554, 2555, 2556, 2557, 2558, 2559","SWISS COMBI ROTARY DRYER DRUM, SEW GEARBOX - LEFT HAND DRIVE -, SEW GEARBOX - LEFT HAND DRIVE, SEW GEARBOX - RIGHT HAND DRIVE, SEW GEARBOX - RIGHT HAND DRIVE, MOTOR / 25HP / 1800RPM / TEFC / 575V/3PH/60HZ / FRAME# 284TC, MOTOR / 25HP / 1800RPM / TEFC / 575V/3PH/60HZ / FRAME# 284TC, MOTOR / 25HP / 1800RPM / TEFC / 575V/3PH/60HZ / FRAME# 284TC, MOTOR / 25HP / 1800RPM / TEFC / 575V/3PH/60HZ / FRAME# 284TC, TRUNNION (A) - LEFT HAND DRIVE, TRUNNION (B)- RIGHT HAND DRIVE, TRUNNION (D) - LEFT HAND DRIVE, TRUNNION (C) - RIGHT HAND DRIVE, THRUST ROLLER ASSEMBLY, THRUST ROLLER ASSEMBLY, TRUNNION LUBRICATION SYSTEM",,No,CH-DRA_COMB_AIR,CH-DRA_COMB_AIR:PY18180.OUT,PY-18180,PY,OUT,Controller output / demand (CO),Pressure final element demand (valve pos/demand),Output/Demand,DRUM DR1826 SPEED CONTROL,DR-1826
,Remove Blank and Re-install spool on Exhaust Ducting,23-31731,DR-1826,DR-1826,,,1-10-23 11:27 AM,2023-01-10T11:27:00.000Z,,,1-11-23 3:27 PM,2023-01-11T15:27:00.000Z,4,4,,CO,CLOSE,Y,,NO,CHATHAM,"2541, 2542, 2543, 2544, 2545, 2547, 2549, 2550, 2552, 2553, 2554, 2555, 2556, 2557, 2558, 2559","SWISS COMBI ROTARY DRYER DRUM, SEW GEARBOX - LEFT HAND DRIVE -, SEW GEARBOX - LEFT HAND DRIVE, SEW GEARBOX - RIGHT HAND DRIVE, SEW GEARBOX - RIGHT HAND DRIVE, MOTOR / 25HP / 1800RPM / TEFC / 575V/3PH/60HZ / FRAME# 284TC, MOTOR / 25HP / 1800RPM / TEFC / 575V/3PH/60HZ / FRAME# 284TC, MOTOR / 25HP / 1800RPM / TEFC / 575V/3PH/60HZ / FRAME# 284TC, MOTOR / 25HP / 1800RPM / TEFC / 575V/3PH/60HZ / FRAME# 284TC, TRUNNION (A) - LEFT HAND DRIVE, TRUNNION (B)- RIGHT HAND DRIVE, TRUNNION (D) - LEFT HAND DRIVE, TRUNNION (C) - RIGHT HAND DRIVE, THRUST ROLLER ASSEMBLY, THRUST ROLLER ASSEMBLY, TRUNNION LUBRICATION SYSTEM",,No,CH-DRA_COMB_AIR,CH-DRA_COMB_AIR:PIC18215.OUT,PIC-18215,PIC,OUT,Controller output / demand (CO),Pressure indicating controller,Output/Demand,DRUM DR1826 MOTOR 1 CONTROL,DR-1826
,Remove Blank and Re-install spool on Exhaust Ducting,23-31731,DR-1826,DR-1826,,,1-10-23 11:27 AM,2023-01-10T11:27:00.000Z,,,1-11-23 3:27 PM,2023-01-11T15:27:00.000Z,4,4,,CO,CLOSE,Y,,NO,CHATHAM,"2541, 2542, 2543, 2544, 2545, 2547, 2549, 2550, 2552, 2553, 2554, 2555, 2556, 2557, 2558, 2559","SWISS COMBI ROTARY DRYER DRUM, SEW GEARBOX - LEFT HAND DRIVE -, SEW GEARBOX - LEFT HAND DRIVE, SEW GEARBOX - RIGHT HAND DRIVE, SEW GEARBOX - RIGHT HAND DRIVE, MOTOR / 25HP / 1800RPM / TEFC / 575V/3PH/60HZ / FRAME# 284TC, MOTOR / 25HP / 1800RPM / TEFC / 575V/3PH/60HZ / FRAME# 284TC, MOTOR / 25HP / 1800RPM / TEFC / 575V/3PH/60HZ / FRAME# 284TC, MOTOR / 25HP / 1800RPM / TEFC / 575V/3PH/60HZ / FRAME# 284TC, TRUNNION (A) - LEFT HAND DRIVE, TRUNNION (B)- RIGHT HAND DRIVE, TRUNNION (D) - LEFT HAND DRIVE, TRUNNION (C) - RIGHT HAND DRIVE, THRUST ROLLER ASSEMBLY, THRUST ROLLER ASSEMBLY, TRUNNION LUBRICATION SYSTEM",,No,CH-DRA_COMB_AIR,CH-DRA_COMB_AIR:PIC18215.SPT,PIC-18215,PIC,SPT,Setpoint (SP),Pressure indicating controller,Setpoint,DR1826 MASTR 2 MOTR SPD CTRL,DR-1826
,Remove Blank and Re-install spool on Exhaust Ducting,23-31731,DR-1826,DR-1826,,,1-10-23 11:27 AM,2023-01-10T11:27:00.000Z,,,1-11-23 3:27 PM,2023-01-11T15:27:00.000Z,4,4,,CO,CLOSE,Y,,NO,CHATHAM,"2541, 2542, 2543, 2544, 2545, 2547, 2549, 2550, 2552, 2553, 2554, 2555, 2556, 2557, 2558, 2559","SWISS COMBI ROTARY DRYER DRUM, SEW GEARBOX - LEFT HAND DRIVE -, SEW GEARBOX - LEFT HAND DRIVE, SEW GEARBOX - RIGHT HAND DRIVE, SEW GEARBOX - RIGHT HAND DRIVE, MOTOR / 25HP / 1800RPM / TEFC / 575V/3PH/60HZ / FRAME# 284TC, MOTOR / 25HP / 1800RPM / TEFC / 575V/3PH/60HZ / FRAME# 284TC, MOTOR / 25HP / 1800RPM / TEFC / 575V/3PH/60HZ / FRAME# 284TC, MOTOR / 25HP / 1800RPM / TEFC / 575V/3PH/60HZ / FRAME# 284TC, TRUNNION (A) - LEFT HAND DRIVE, TRUNNION (B)- RIGHT HAND DRIVE, TRUNNION (D) - LEFT HAND DRIVE, TRUNNION (C) - RIGHT HAND DRIVE, THRUST ROLLER ASSEMBLY, THRUST ROLLER ASSEMBLY, TRUNNION LUBRICATION SYSTEM",,No,CH-DRA_FIRE_WTR,CH-DRA_FIRE_WTR:TT35445.MEAS,TT-35445,TT,MEAS,Measured value (PV),Temperature transmitter,Measurement,DRUM DR1826 ACCESS DOOR,DR-1826
,Remove Blank and Re-install spool on Exhaust Ducting,23-31731,DR-1826,DR-1826,,,1-10-23 11:27 AM,2023-01-10T11:27:00.000Z,,,1-11-23 3:27 PM,2023-01-11T15:27:00.000Z,4,4,,CO,CLOSE,Y,,NO,CHATHAM,"2541, 2542, 2543, 2544, 2545, 2547, 2549, 2550, 2552, 2553, 2554, 2555, 2556, 2557, 2558, 2559","SWISS COMBI ROTARY DRYER DRUM, SEW GEARBOX - LEFT HAND DRIVE -, SEW GEARBOX - LEFT HAND DRIVE, SEW GEARBOX - RIGHT HAND DRIVE, SEW GEARBOX - RIGHT HAND DRIVE, MOTOR / 25HP / 1800RPM / TEFC / 575V/3PH/60HZ / FRAME# 284TC, MOTOR / 25HP / 1800RPM / TEFC / 575V/3PH/60HZ / FRAME# 284TC, MOTOR / 25HP / 1800RPM / TEFC / 575V/3PH/60HZ / FRAME# 284TC, MOTOR / 25HP / 1800RPM / TEFC / 575V/3PH/60HZ / FRAME# 284TC, TRUNNION (A) - LEFT HAND DRIVE, TRUNNION (B)- RIGHT HAND DRIVE, TRUNNION (D) - LEFT HAND DRIVE, TRUNNION (C) - RIGHT HAND DRIVE, THRUST ROLLER ASSEMBLY, THRUST ROLLER ASSEMBLY, TRUNNION LUBRICATION SYSTEM",,No,CH-DRYER_A,CH-DRYER_A:KS18145A.STAIND,KS-18145A,KS,STAIND,"Status indication (open/closed, run/stop)",Limit switch (asset status),Equipment status,DRUM DR1826 FRONT LUBEN TIMER,DR-1826
,Remove Blank and Re-install spool on Exhaust Ducting,23-31731,DR-1826,DR-1826,,,1-10-23 11:27 AM,2023-01-10T11:27:00.000Z,,,1-11-23 3:27 PM,2023-01-11T15:27:00.000Z,4,4,,CO,CLOSE,Y,,NO,CHATHAM,"2541, 2542, 2543, 2544, 2545, 2547, 2549, 2550, 2552, 2553, 2554, 2555, 2556, 2557, 2558, 2559","SWISS COMBI ROTARY DRYER DRUM, SEW GEARBOX - LEFT HAND DRIVE -, SEW GEARBOX - LEFT HAND DRIVE, SEW GEARBOX - RIGHT HAND DRIVE, SEW GEARBOX - RIGHT HAND DRIVE, MOTOR / 25HP / 1800RPM / TEFC / 575V/3PH/60HZ / FRAME# 284TC, MOTOR / 25HP / 1800RPM / TEFC / 575V/3PH/60HZ / FRAME# 284TC, MOTOR / 25HP / 1800RPM / TEFC / 575V/3PH/60HZ / FRAME# 284TC, MOTOR / 25HP / 1800RPM / TEFC / 575V/3PH/60HZ / FRAME# 284TC, TRUNNION (A) - LEFT HAND DRIVE, TRUNNION (B)- RIGHT HAND DRIVE, TRUNNION (D) - LEFT HAND DRIVE, TRUNNION (C) - RIGHT HAND DRIVE, THRUST ROLLER ASSEMBLY, THRUST ROLLER ASSEMBLY, TRUNNION LUBRICATION SYSTEM",,No,CH-DRYER_A,CH-DRYER_A:KS18145B.STAIND,KS-18145B,KS,STAIND,"Status indication (open/closed, run/stop)",Limit switch (asset status),Equipment status,DRUM DR1826 REAR LUBE TIMER,DR-1826
,Remove Blank and Re-install spool on Exhaust Ducting,23-31731,DR-1826,DR-1826,,,1-10-23 11:27 AM,2023-01-10T11:27:00.000Z,,,1-11-23 3:27 PM,2023-01-11T15:27:00.000Z,4,4,,CO,CLOSE,Y,,NO,CHATHAM,"2541, 2542, 2543, 2544, 2545, 2547, 2549, 2550, 2552, 2553, 2554, 2555, 2556, 2557, 2558, 2559","SWISS COMBI ROTARY DRYER DRUM, SEW GEARBOX - LEFT HAND DRIVE -, SEW GEARBOX - LEFT HAND DRIVE, SEW GEARBOX - RIGHT HAND DRIVE, SEW GEARBOX - RIGHT HAND DRIVE, MOTOR / 25HP / 1800RPM / TEFC / 575V/3PH/60HZ / FRAME# 284TC, MOTOR / 25HP / 1800RPM / TEFC / 575V/3PH/60HZ / FRAME# 284TC, MOTOR / 25HP / 1800RPM / TEFC / 575V/3PH/60HZ / FRAME# 284TC, MOTOR / 25HP / 1800RPM / TEFC / 575V/3PH/60HZ / FRAME# 284TC, TRUNNION (A) - LEFT HAND DRIVE, TRUNNION (B)- RIGHT HAND DRIVE, TRUNNION (D) - LEFT HAND DRIVE, TRUNNION (C) - RIGHT HAND DRIVE, THRUST ROLLER ASSEMBLY, THRUST ROLLER ASSEMBLY, TRUNNION LUBRICATION SYSTEM",,No,CH-DRYER_A,CH-DRYER_A:DR1826.STAIND,DR-1826,DR,STAIND,"Status indication (open/closed, run/stop)",Drum/Drive (asset),Equipment status,DRUM DR1826 MASTER  START,DR-1826
,Remove Blank and Re-install spool on Exhaust Ducting,23-31731,DR-1826,DR-1826,,,1-10-23 11:27 AM,2023-01-10T11:27:00.000Z,,,1-11-23 3:27 PM,2023-01-11T15:27:00.000Z,4,4,,CO,CLOSE,Y,,NO,CHATHAM,"2541, 2542, 2543, 2544, 2545, 2547, 2549, 2550, 2552, 2553, 2554, 2555, 2556, 2557, 2558, 2559","SWISS COMBI ROTARY DRYER DRUM, SEW GEARBOX - LEFT HAND DRIVE -, SEW GEARBOX - LEFT HAND DRIVE, SEW GEARBOX - RIGHT HAND DRIVE, SEW GEARBOX - RIGHT HAND DRIVE, MOTOR / 25HP / 1800RPM / TEFC / 575V/3PH/60HZ / FRAME# 284TC, MOTOR / 25HP / 1800RPM / TEFC / 575V/3PH/60HZ / FRAME# 284TC, MOTOR / 25HP / 1800RPM / TEFC / 575V/3PH/60HZ / FRAME# 284TC, MOTOR / 25HP / 1800RPM / TEFC / 575V/3PH/60HZ / FRAME# 284TC, TRUNNION (A) - LEFT HAND DRIVE, TRUNNION (B)- RIGHT HAND DRIVE, TRUNNION (D) - LEFT HAND DRIVE, TRUNNION (C) - RIGHT HAND DRIVE, THRUST ROLLER ASSEMBLY, THRUST ROLLER ASSEMBLY, TRUNNION LUBRICATION SYSTEM",,No,CH-DR_DUSTCOLL,CH-DR_DUSTCOLL:RV1834.STAIND,RV-1834,RV,STAIND,"Status indication (open/closed, run/stop)",Rotary valve (asset),Equipment Status,DRUM DR1826 MASTER START,DR-1826
,Remove Blank and Re-install spool on Exhaust Ducting,23-31731,DR-1826,DR-1826,,,1-10-23 11:27 AM,2023-01-10T11:27:00.000Z,,,1-11-23 3:27 PM,2023-01-11T15:27:00.000Z,4,4,,CO,CLOSE,Y,,NO,CHATHAM,"2541, 2542, 2543, 2544, 2545, 2547, 2549, 2550, 2552, 2553, 2554, 2555, 2556, 2557, 2558, 2559","SWISS COMBI ROTARY DRYER DRUM, SEW GEARBOX - LEFT HAND DRIVE -, SEW GEARBOX - LEFT HAND DRIVE, SEW GEARBOX - RIGHT HAND DRIVE, SEW GEARBOX - RIGHT HAND DRIVE, MOTOR / 25HP / 1800RPM / TEFC / 575V/3PH/60HZ / FRAME# 284TC, MOTOR / 25HP / 1800RPM / TEFC / 575V/3PH/60HZ / FRAME# 284TC, MOTOR / 25HP / 1800RPM / TEFC / 575V/3PH/60HZ / FRAME# 284TC, MOTOR / 25HP / 1800RPM / TEFC / 575V/3PH/60HZ / FRAME# 284TC, TRUNNION (A) - LEFT HAND DRIVE, TRUNNION (B)- RIGHT HAND DRIVE, TRUNNION (D) - LEFT HAND DRIVE, TRUNNION (C) - RIGHT HAND DRIVE, THRUST ROLLER ASSEMBLY, THRUST ROLLER ASSEMBLY, TRUNNION LUBRICATION SYSTEM",,No,CH-DR_DUSTCOLL,CH-DR_DUSTCOLL:SI18216.MEAS,SI-18216,SI,MEAS,Measured value (PV),Speed indication (feedback),Measurement,DRUM DR1826 MOTOR A AMPERAGE,DR-1826
,Remove Blank and Re-install spool on Exhaust Ducting,23-31731,DR-1826,DR-1826,,,1-10-23 11:27 AM,2023-01-10T11:27:00.000Z,,,1-11-23 3:27 PM,2023-01-11T15:27:00.000Z,4,4,,CO,CLOSE,Y,,NO,CHATHAM,"2541, 2542, 2543, 2544, 2545, 2547, 2549, 2550, 2552, 2553, 2554, 2555, 2556, 2557, 2558, 2559","SWISS COMBI ROTARY DRYER DRUM, SEW GEARBOX - LEFT HAND DRIVE -, SEW GEARBOX - LEFT HAND DRIVE, SEW GEARBOX - RIGHT HAND DRIVE, SEW GEARBOX - RIGHT HAND DRIVE, MOTOR / 25HP / 1800RPM / TEFC / 575V/3PH/60HZ / FRAME# 284TC, MOTOR / 25HP / 1800RPM / TEFC / 575V/3PH/60HZ / FRAME# 284TC, MOTOR / 25HP / 1800RPM / TEFC / 575V/3PH/60HZ / FRAME# 284TC, MOTOR / 25HP / 1800RPM / TEFC / 575V/3PH/60HZ / FRAME# 284TC, TRUNNION (A) - LEFT HAND DRIVE, TRUNNION (B)- RIGHT HAND DRIVE, TRUNNION (D) - LEFT HAND DRIVE, TRUNNION (C) - RIGHT HAND DRIVE, THRUST ROLLER ASSEMBLY, THRUST ROLLER ASSEMBLY, TRUNNION LUBRICATION SYSTEM",,No,CH-DR_DUSTCOLL,CH-DR_DUSTCOLL:SSL18216.CIN,SSL-18216,SSL,CIN,Contact input (discrete),Speed switch (motion proof),Discrete Input,DRUM DR1826 MOTOR B AMPERAGE,DR-1826
,Remove Blank and Re-install spool on Exhaust Ducting,23-31731,DR-1826,DR-1826,,,1-10-23 11:27 AM,2023-01-10T11:27:00.000Z,,,1-11-23 3:27 PM,2023-01-11T15:27:00.000Z,4,4,,CO,CLOSE,Y,,NO,CHATHAM,"2541, 2542, 2543, 2544, 2545, 2547, 2549, 2550, 2552, 2553, 2554, 2555, 2556, 2557, 2558, 2559","SWISS COMBI ROTARY DRYER DRUM, SEW GEARBOX - LEFT HAND DRIVE -, SEW GEARBOX - LEFT HAND DRIVE, SEW GEARBOX - RIGHT HAND DRIVE, SEW GEARBOX - RIGHT HAND DRIVE, MOTOR / 25HP / 1800RPM / TEFC / 575V/3PH/60HZ / FRAME# 284TC, MOTOR / 25HP / 1800RPM / TEFC / 575V/3PH/60HZ / FRAME# 284TC, MOTOR / 25HP / 1800RPM / TEFC / 575V/3PH/60HZ / FRAME# 284TC, MOTOR / 25HP / 1800RPM / TEFC / 575V/3PH/60HZ / FRAME# 284TC, TRUNNION (A) - LEFT HAND DRIVE, TRUNNION (B)- RIGHT HAND DRIVE, TRUNNION (D) - LEFT HAND DRIVE, TRUNNION (C) - RIGHT HAND DRIVE, THRUST ROLLER ASSEMBLY, THRUST ROLLER ASSEMBLY, TRUNNION LUBRICATION SYSTEM",,No,CH-DR_DUSTCOLL,CH-DR_DUSTCOLL:SSL18222.CIN,SSL-18222,SSL,CIN,Contact input (discrete),Speed switch (motion proof),Discrete Input,DRUM DR1826 MOTOR C AMPERAGE,DR-1826
,Remove Blank and Re-install spool on Exhaust Ducting,23-31731,DR-1826,DR-1826,,,1-10-23 11:27 AM,2023-01-10T11:27:00.000Z,,,1-11-23 3:27 PM,2023-01-11T15:27:00.000Z,4,4,,CO,CLOSE,Y,,NO,CHATHAM,"2541, 2542, 2543, 2544, 2545, 2547, 2549, 2550, 2552, 2553, 2554, 2555, 2556, 2557, 2558, 2559","SWISS COMBI ROTARY DRYER DRUM, SEW GEARBOX - LEFT HAND DRIVE -, SEW GEARBOX - LEFT HAND DRIVE, SEW GEARBOX - RIGHT HAND DRIVE, SEW GEARBOX - RIGHT HAND DRIVE, MOTOR / 25HP / 1800RPM / TEFC / 575V/3PH/60HZ / FRAME# 284TC, MOTOR / 25HP / 1800RPM / TEFC / 575V/3PH/60HZ / FRAME# 284TC, MOTOR / 25HP / 1800RPM / TEFC / 575V/3PH/60HZ / FRAME# 284TC, MOTOR / 25HP / 1800RPM / TEFC / 575V/3PH/60HZ / FRAME# 284TC, TRUNNION (A) - LEFT HAND DRIVE, TRUNNION (B)- RIGHT HAND DRIVE, TRUNNION (D) - LEFT HAND DRIVE, TRUNNION (C) - RIGHT HAND DRIVE, THRUST ROLLER ASSEMBLY, THRUST ROLLER ASSEMBLY, TRUNNION LUBRICATION SYSTEM",,No,CH-DR_DUSTCOLL,CH-DR_DUSTCOLL:SY18211.OUT,SY-18211,SY,OUT,Controller output (CO),Speed output (VFD demand),Output/Demand,DRUM DR1826 MOTOR D AMPERAGE,DR-1826
,Remove Blank and Re-install spool on Exhaust Ducting,23-31731,DR-1826,DR-1826,,,1-10-23 11:27 AM,2023-01-10T11:27:00.000Z,,,1-11-23 3:27 PM,2023-01-11T15:27:00.000Z,4,4,,CO,CLOSE,Y,,NO,CHATHAM,"2541, 2542, 2543, 2544, 2545, 2547, 2549, 2550, 2552, 2553, 2554, 2555, 2556, 2557, 2558, 2559","SWISS COMBI ROTARY DRYER DRUM, SEW GEARBOX - LEFT HAND DRIVE -, SEW GEARBOX - LEFT HAND DRIVE, SEW GEARBOX - RIGHT HAND DRIVE, SEW GEARBOX - RIGHT HAND DRIVE, MOTOR / 25HP / 1800RPM / TEFC / 575V/3PH/60HZ / FRAME# 284TC, MOTOR / 25HP / 1800RPM / TEFC / 575V/3PH/60HZ / FRAME# 284TC, MOTOR / 25HP / 1800RPM / TEFC / 575V/3PH/60HZ / FRAME# 284TC, MOTOR / 25HP / 1800RPM / TEFC / 575V/3PH/60HZ / FRAME# 284TC, TRUNNION (A) - LEFT HAND DRIVE, TRUNNION (B)- RIGHT HAND DRIVE, TRUNNION (D) - LEFT HAND DRIVE, TRUNNION (C) - RIGHT HAND DRIVE, THRUST ROLLER ASSEMBLY, THRUST ROLLER ASSEMBLY, TRUNNION LUBRICATION SYSTEM",,No,CH-DR_UTIL_WTR,CH-DR_UTIL_WTR:TT35450.MEAS,TT-35450,TT,MEAS,Measured value (PV),Temperature transmitter,Measurement,DRUM DR1826 FRONT LUBEN TIMER,DR-1826
,Remove Blank and Re-install spool on Exhaust Ducting,23-31731,DR-1826,DR-1826,,,1-10-23 11:27 AM,2023-01-10T11:27:00.000Z,,,1-11-23 3:27 PM,2023-01-11T15:27:00.000Z,4,4,,CO,CLOSE,Y,,NO,CHATHAM,"2541, 2542, 2543, 2544, 2545, 2547, 2549, 2550, 2552, 2553, 2554, 2555, 2556, 2557, 2558, 2559","SWISS COMBI ROTARY DRYER DRUM, SEW GEARBOX - LEFT HAND DRIVE -, SEW GEARBOX - LEFT HAND DRIVE, SEW GEARBOX - RIGHT HAND DRIVE, SEW GEARBOX - RIGHT HAND DRIVE, MOTOR / 25HP / 1800RPM / TEFC / 575V/3PH/60HZ / FRAME# 284TC, MOTOR / 25HP / 1800RPM / TEFC / 575V/3PH/60HZ / FRAME# 284TC, MOTOR / 25HP / 1800RPM / TEFC / 575V/3PH/60HZ / FRAME# 284TC, MOTOR / 25HP / 1800RPM / TEFC / 575V/3PH/60HZ / FRAME# 284TC, TRUNNION (A) - LEFT HAND DRIVE, TRUNNION (B)- RIGHT HAND DRIVE, TRUNNION (D) - LEFT HAND DRIVE, TRUNNION (C) - RIGHT HAND DRIVE, THRUST ROLLER ASSEMBLY, THRUST ROLLER ASSEMBLY, TRUNNION LUBRICATION SYSTEM",,No,CH-DR_UTIL_WTR,CH-DR_UTIL_WTR:TT35451.MEAS,TT-35451,TT,MEAS,Measured value (PV),Temperature transmitter,Measurement,DRUM DR1826 REAR LUBE TIMER,DR-1826
,Remove Blank and Re-install spool on Exhaust Ducting,23-31731,DR-1826,DR-1826,,,1-10-23 11:27 AM,2023-01-10T11:27:00.000Z,,,1-11-23 3:27 PM,2023-01-11T15:27:00.000Z,4,4,,CO,CLOSE,Y,,NO,CHATHAM,"2541, 2542, 2543, 2544, 2545, 2547, 2549, 2550, 2552, 2553, 2554, 2555, 2556, 2557, 2558, 2559","SWISS COMBI ROTARY DRYER DRUM, SEW GEARBOX - LEFT HAND DRIVE -, SEW GEARBOX - LEFT HAND DRIVE, SEW GEARBOX - RIGHT HAND DRIVE, SEW GEARBOX - RIGHT HAND DRIVE, MOTOR / 25HP / 1800RPM / TEFC / 575V/3PH/60HZ / FRAME# 284TC, MOTOR / 25HP / 1800RPM / TEFC / 575V/3PH/60HZ / FRAME# 284TC, MOTOR / 25HP / 1800RPM / TEFC / 575V/3PH/60HZ / FRAME# 284TC, MOTOR / 25HP / 1800RPM / TEFC / 575V/3PH/60HZ / FRAME# 284TC, TRUNNION (A) - LEFT HAND DRIVE, TRUNNION (B)- RIGHT HAND DRIVE, TRUNNION (D) - LEFT HAND DRIVE, TRUNNION (C) - RIGHT HAND DRIVE, THRUST ROLLER ASSEMBLY, THRUST ROLLER ASSEMBLY, TRUNNION LUBRICATION SYSTEM",,No,CH-DR_DUSTCOLL,CH-DR_DUSTCOLL:RV1834.STAIND,RV-1834,RV,STAIND,"Status indication (open/closed, run/stop)",Rotary valve (asset),Equipment status,DRUM DR1826 MASTER  START,DR-1826
,Remove Blank and Re-install spool on Exhaust Ducting,23-31731,DR-1826,DR-1826,,,1-10-23 11:27 AM,2023-01-10T11:27:00.000Z,,,1-11-23 3:27 PM,2023-01-11T15:27:00.000Z,4,4,,CO,CLOSE,Y,,NO,CHATHAM,"2541, 2542, 2543, 2544, 2545, 2547, 2549, 2550, 2552, 2553, 2554, 2555, 2556, 2557, 2558, 2559","SWISS COMBI ROTARY DRYER DRUM, SEW GEARBOX - LEFT HAND DRIVE -, SEW GEARBOX - LEFT HAND DRIVE, SEW GEARBOX - RIGHT HAND DRIVE, SEW GEARBOX - RIGHT HAND DRIVE, MOTOR / 25HP / 1800RPM / TEFC / 575V/3PH/60HZ / FRAME# 284TC, MOTOR / 25HP / 1800RPM / TEFC / 575V/3PH/60HZ / FRAME# 284TC, MOTOR / 25HP / 1800RPM / TEFC / 575V/3PH/60HZ / FRAME# 284TC, MOTOR / 25HP / 1800RPM / TEFC / 575V/3PH/60HZ / FRAME# 284TC, TRUNNION (A) - LEFT HAND DRIVE, TRUNNION (B)- RIGHT HAND DRIVE, TRUNNION (D) - LEFT HAND DRIVE, TRUNNION (C) - RIGHT HAND DRIVE, THRUST ROLLER ASSEMBLY, THRUST ROLLER ASSEMBLY, TRUNNION LUBRICATION SYSTEM",,No,CH-DR_DUSTCOLL,CH-DR_DUSTCOLL:XV18211.STAIND,XV-18211,XV,STAIND,"Status indication (open/closed, run/stop)",Valve/damper/door status (discrete),Equipment status,DRUM DR1826 MOTOR A AMPERAGE,DR-1826
,Remove Blank and Re-install spool on Exhaust Ducting,23-31731,DR-1826,DR-1826,,,1-10-23 11:27 AM,2023-01-10T11:27:00.000Z,,,1-11-23 3:27 PM,2023-01-11T15:27:00.000Z,4,4,,CO,CLOSE,Y,,NO,CHATHAM,"2541, 2542, 2543, 2544, 2545, 2547, 2549, 2550, 2552, 2553, 2554, 2555, 2556, 2557, 2558, 2559","SWISS COMBI ROTARY DRYER DRUM, SEW GEARBOX - LEFT HAND DRIVE -, SEW GEARBOX - LEFT HAND DRIVE, SEW GEARBOX - RIGHT HAND DRIVE, SEW GEARBOX - RIGHT HAND DRIVE, MOTOR / 25HP / 1800RPM / TEFC / 575V/3PH/60HZ / FRAME# 284TC, MOTOR / 25HP / 1800RPM / TEFC / 575V/3PH/60HZ / FRAME# 284TC, MOTOR / 25HP / 1800RPM / TEFC / 575V/3PH/60HZ / FRAME# 284TC, MOTOR / 25HP / 1800RPM / TEFC / 575V/3PH/60HZ / FRAME# 284TC, TRUNNION (A) - LEFT HAND DRIVE, TRUNNION (B)- RIGHT HAND DRIVE, TRUNNION (D) - LEFT HAND DRIVE, TRUNNION (C) - RIGHT HAND DRIVE, THRUST ROLLER ASSEMBLY, THRUST ROLLER ASSEMBLY, TRUNNION LUBRICATION SYSTEM",,No,CH-DR_PROC_AIR,CH-DR_PROC_AIR:PT33307.MEAS,PT-33307,PT,MEAS,Measured value (PV),Pressure transmitter,Measurement,DRUM DR1826 MOTOR B AMPERAGE,DR-1826
,Remove Blank and Re-install spool on Exhaust Ducting,23-31731,DR-1826,DR-1826,,,1-10-23 11:27 AM,2023-01-10T11:27:00.000Z,,,1-11-23 3:27 PM,2023-01-11T15:27:00.000Z,4,4,,CO,CLOSE,Y,,NO,CHATHAM,"2541, 2542, 2543, 2544, 2545, 2547, 2549, 2550, 2552, 2553, 2554, 2555, 2556, 2557, 2558, 2559","SWISS COMBI ROTARY DRYER DRUM, SEW GEARBOX - LEFT HAND DRIVE -, SEW GEARBOX - LEFT HAND DRIVE, SEW GEARBOX - RIGHT HAND DRIVE, SEW GEARBOX - RIGHT HAND DRIVE, MOTOR / 25HP / 1800RPM / TEFC / 575V/3PH/60HZ / FRAME# 284TC, MOTOR / 25HP / 1800RPM / TEFC / 575V/3PH/60HZ / FRAME# 284TC, MOTOR / 25HP / 1800RPM / TEFC / 575V/3PH/60HZ / FRAME# 284TC, MOTOR / 25HP / 1800RPM / TEFC / 575V/3PH/60HZ / FRAME# 284TC, TRUNNION (A) - LEFT HAND DRIVE, TRUNNION (B)- RIGHT HAND DRIVE, TRUNNION (D) - LEFT HAND DRIVE, TRUNNION (C) - RIGHT HAND DRIVE, THRUST ROLLER ASSEMBLY, THRUST ROLLER ASSEMBLY, TRUNNION LUBRICATION SYSTEM",,No,CH-DR_UTIL_WTR,CH-DR_UTIL_WTR:P1836.STAIND,P-1836,P,STAIND,"Status indication (open/closed, run/stop)",Pump (asset),Equipment status,DRUM DR1826 MOTOR C AMPERAGE,DR-1826
,Remove Blank and Re-install spool on Exhaust Ducting,23-31731,DR-1826,DR-1826,,,1-10-23 11:27 AM,2023-01-10T11:27:00.000Z,,,1-11-23 3:27 PM,2023-01-11T15:27:00.000Z,4,4,,CO,CLOSE,Y,,NO,CHATHAM,"2541, 2542, 2543, 2544, 2545, 2547, 2549, 2550, 2552, 2553, 2554, 2555, 2556, 2557, 2558, 2559","SWISS COMBI ROTARY DRYER DRUM, SEW GEARBOX - LEFT HAND DRIVE -, SEW GEARBOX - LEFT HAND DRIVE, SEW GEARBOX - RIGHT HAND DRIVE, SEW GEARBOX - RIGHT HAND DRIVE, MOTOR / 25HP / 1800RPM / TEFC / 575V/3PH/60HZ / FRAME# 284TC, MOTOR / 25HP / 1800RPM / TEFC / 575V/3PH/60HZ / FRAME# 284TC, MOTOR / 25HP / 1800RPM / TEFC / 575V/3PH/60HZ / FRAME# 284TC, MOTOR / 25HP / 1800RPM / TEFC / 575V/3PH/60HZ / FRAME# 284TC, TRUNNION (A) - LEFT HAND DRIVE, TRUNNION (B)- RIGHT HAND DRIVE, TRUNNION (D) - LEFT HAND DRIVE, TRUNNION (C) - RIGHT HAND DRIVE, THRUST ROLLER ASSEMBLY, THRUST ROLLER ASSEMBLY, TRUNNION LUBRICATION SYSTEM",,No,CH-DR_UTIL_WTR,CH-DR_UTIL_WTR:P1837.STAIND,P-1837,P,STAIND,"Status indication (open/closed, run/stop)",Pump (asset),Equipment status,DRUM DR1826 MOTOR D AMPERAGE,DR-1826
,Remove Blank and Re-install spool on Exhaust Ducting,23-31731,DR-1826,DR-1826,,,1-10-23 11:27 AM,2023-01-10T11:27:00.000Z,,,1-11-23 3:27 PM,2023-01-11T15:27:00.000Z,4,4,,CO,CLOSE,Y,,NO,CHATHAM,"2541, 2542, 2543, 2544, 2545, 2547, 2549, 2550, 2552, 2553, 2554, 2555, 2556, 2557, 2558, 2559","SWISS COMBI ROTARY DRYER DRUM, SEW GEARBOX - LEFT HAND DRIVE -, SEW GEARBOX - LEFT HAND DRIVE, SEW GEARBOX - RIGHT HAND DRIVE, SEW GEARBOX - RIGHT HAND DRIVE, MOTOR / 25HP / 1800RPM / TEFC / 575V/3PH/60HZ / FRAME# 284TC, MOTOR / 25HP / 1800RPM / TEFC / 575V/3PH/60HZ / FRAME# 284TC, MOTOR / 25HP / 1800RPM / TEFC / 575V/3PH/60HZ / FRAME# 284TC, MOTOR / 25HP / 1800RPM / TEFC / 575V/3PH/60HZ / FRAME# 284TC, TRUNNION (A) - LEFT HAND DRIVE, TRUNNION (B)- RIGHT HAND DRIVE, TRUNNION (D) - LEFT HAND DRIVE, TRUNNION (C) - RIGHT HAND DRIVE, THRUST ROLLER ASSEMBLY, THRUST ROLLER ASSEMBLY, TRUNNION LUBRICATION SYSTEM",,No,CH-DR_UTIL_WTR,CH-DR_UTIL_WTR:TT35455.MEAS,TT-35455,TT,MEAS,Measured value (PV),Temperature transmitter,Measurement,DRUM DR1826 FRONT LUBEN TIMER,DR-1826
,Remove Blank and Re-install spool on Exhaust Ducting,23-31731,DR-1826,DR-1826,,,1-10-23 11:27 AM,2023-01-10T11:27:00.000Z,,,1-11-23 3:27 PM,2023-01-11T15:27:00.000Z,4,4,,CO,CLOSE,Y,,NO,CHATHAM,"2541, 2542, 2543, 2544, 2545, 2547, 2549, 2550, 2552, 2553, 2554, 2555, 2556, 2557, 2558, 2559","SWISS COMBI ROTARY DRYER DRUM, SEW GEARBOX - LEFT HAND DRIVE -, SEW GEARBOX - LEFT HAND DRIVE, SEW GEARBOX - RIGHT HAND DRIVE, SEW GEARBOX - RIGHT HAND DRIVE, MOTOR / 25HP / 1800RPM / TEFC / 575V/3PH/60HZ / FRAME# 284TC, MOTOR / 25HP / 1800RPM / TEFC / 575V/3PH/60HZ / FRAME# 284TC, MOTOR / 25HP / 1800RPM / TEFC / 575V/3PH/60HZ / FRAME# 284TC, MOTOR / 25HP / 1800RPM / TEFC / 575V/3PH/60HZ / FRAME# 284TC, TRUNNION (A) - LEFT HAND DRIVE, TRUNNION (B)- RIGHT HAND DRIVE, TRUNNION (D) - LEFT HAND DRIVE, TRUNNION (C) - RIGHT HAND DRIVE, THRUST ROLLER ASSEMBLY, THRUST ROLLER ASSEMBLY, TRUNNION LUBRICATION SYSTEM",,No,CH-DR_UTIL_WTR,CH-DR_UTIL_WTR:TT35456.MEAS,TT-35456,TT,MEAS,Measured value (PV),Temperature transmitter,Measurement,DRUM DR1826 REAR LUBE TIMER,DR-1826
,Remove Blank and Re-install spool on Exhaust Ducting,23-31731,DR-1826,DR-1826,,,1-10-23 11:27 AM,2023-01-10T11:27:00.000Z,,,1-11-23 3:27 PM,2023-01-11T15:27:00.000Z,4,4,,CO,CLOSE,Y,,NO,CHATHAM,"2541, 2542, 2543, 2544, 2545, 2547, 2549, 2550, 2552, 2553, 2554, 2555, 2556, 2557, 2558, 2559","SWISS COMBI ROTARY DRYER DRUM, SEW GEARBOX - LEFT HAND DRIVE -, SEW GEARBOX - LEFT HAND DRIVE, SEW GEARBOX - RIGHT HAND DRIVE, SEW GEARBOX - RIGHT HAND DRIVE, MOTOR / 25HP / 1800RPM / TEFC / 575V/3PH/60HZ / FRAME# 284TC, MOTOR / 25HP / 1800RPM / TEFC / 575V/3PH/60HZ / FRAME# 284TC, MOTOR / 25HP / 1800RPM / TEFC / 575V/3PH/60HZ / FRAME# 284TC, MOTOR / 25HP / 1800RPM / TEFC / 575V/3PH/60HZ / FRAME# 284TC, TRUNNION (A) - LEFT HAND DRIVE, TRUNNION (B)- RIGHT HAND DRIVE, TRUNNION (D) - LEFT HAND DRIVE, TRUNNION (C) - RIGHT HAND DRIVE, THRUST ROLLER ASSEMBLY, THRUST ROLLER ASSEMBLY, TRUNNION LUBRICATION SYSTEM",,No,CH-DRYER_D,CH-DRYER_D:FIC84401.OUT,FIC-84401,FIC,OUT,Controller output / demand (CO),Flow indicating controller,Output/Demand,DRUM DR1826 MASTER  START,DR-1826
,Remove Blank and Re-install spool on Exhaust Ducting,23-31731,DR-1826,DR-1826,,,1-10-23 11:27 AM,2023-01-10T11:27:00.000Z,,,1-11-23 3:27 PM,2023-01-11T15:27:00.000Z,4,4,,CO,CLOSE,Y,,NO,CHATHAM,"2541, 2542, 2543, 2544, 2545, 2547, 2549, 2550, 2552, 2553, 2554, 2555, 2556, 2557, 2558, 2559","SWISS COMBI ROTARY DRYER DRUM, SEW GEARBOX - LEFT HAND DRIVE -, SEW GEARBOX - LEFT HAND DRIVE, SEW GEARBOX - RIGHT HAND DRIVE, SEW GEARBOX - RIGHT HAND DRIVE, MOTOR / 25HP / 1800RPM / TEFC / 575V/3PH/60HZ / FRAME# 284TC, MOTOR / 25HP / 1800RPM / TEFC / 575V/3PH/60HZ / FRAME# 284TC, MOTOR / 25HP / 1800RPM / TEFC / 575V/3PH/60HZ / FRAME# 284TC, MOTOR / 25HP / 1800RPM / TEFC / 575V/3PH/60HZ / FRAME# 284TC, TRUNNION (A) - LEFT HAND DRIVE, TRUNNION (B)- RIGHT HAND DRIVE, TRUNNION (D) - LEFT HAND DRIVE, TRUNNION (C) - RIGHT HAND DRIVE, THRUST ROLLER ASSEMBLY, THRUST ROLLER ASSEMBLY, TRUNNION LUBRICATION SYSTEM",,No,CH-DRYER_D,CH-DRYER_D:LIC84401.OUT,LIC-84401,LIC,OUT,Controller output / demand (CO),Level indicating controller,Output/Demand,DRUM DR1826 MOTOR A AMPERAGE,DR-1826
,Remove Blank and Re-install spool on Exhaust Ducting,23-31731,DR-1826,DR-1826,,,1-10-23 11:27 AM,2023-01-10T11:27:00.000Z,,,1-11-23 3:27 PM,2023-01-11T15:27:00.000Z,4,4,,CO,CLOSE,Y,,NO,CHATHAM,"2541, 2542, 2543, 2544, 2545, 2547, 2549, 2550, 2552, 2553, 2554, 2555, 2556, 2557, 2558, 2559","SWISS COMBI ROTARY DRYER DRUM, SEW GEARBOX - LEFT HAND DRIVE -, SEW GEARBOX - LEFT HAND DRIVE, SEW GEARBOX - RIGHT HAND DRIVE, SEW GEARBOX - RIGHT HAND DRIVE, MOTOR / 25HP / 1800RPM / TEFC / 575V/3PH/60HZ / FRAME# 284TC, MOTOR / 25HP / 1800RPM / TEFC / 575V/3PH/60HZ / FRAME# 284TC, MOTOR / 25HP / 1800RPM / TEFC / 575V/3PH/60HZ / FRAME# 284TC, MOTOR / 25HP / 1800RPM / TEFC / 575V/3PH/60HZ / FRAME# 284TC, TRUNNION (A) - LEFT HAND DRIVE, TRUNNION (B)- RIGHT HAND DRIVE, TRUNNION (D) - LEFT HAND DRIVE, TRUNNION (C) - RIGHT HAND DRIVE, THRUST ROLLER ASSEMBLY, THRUST ROLLER ASSEMBLY, TRUNNION LUBRICATION SYSTEM",,No,CH-DRYER_D,CH-DRYER_D:LIC84401.SPT,LIC-84401,LIC,SPT,Setpoint (SP),Level indicating controller,Setpoint,DRUM DR1826 MOTOR B AMPERAGE,DR-1826
,Remove Blank and Re-install spool on Exhaust Ducting,23-31731,DR-1826,DR-1826,,,1-10-23 11:27 AM,2023-01-10T11:27:00.000Z,,,1-11-23 3:27 PM,2023-01-11T15:27:00.000Z,4,4,,CO,CLOSE,Y,,NO,CHATHAM,"2541, 2542, 2543, 2544, 2545, 2547, 2549, 2550, 2552, 2553, 2554, 2555, 2556, 2557, 2558, 2559","SWISS COMBI ROTARY DRYER DRUM, SEW GEARBOX - LEFT HAND DRIVE -, SEW GEARBOX - LEFT HAND DRIVE, SEW GEARBOX - RIGHT HAND DRIVE, SEW GEARBOX - RIGHT HAND DRIVE, MOTOR / 25HP / 1800RPM / TEFC / 575V/3PH/60HZ / FRAME# 284TC, MOTOR / 25HP / 1800RPM / TEFC / 575V/3PH/60HZ / FRAME# 284TC, MOTOR / 25HP / 1800RPM / TEFC / 575V/3PH/60HZ / FRAME# 284TC, MOTOR / 25HP / 1800RPM / TEFC / 575V/3PH/60HZ / FRAME# 284TC, TRUNNION (A) - LEFT HAND DRIVE, TRUNNION (B)- RIGHT HAND DRIVE, TRUNNION (D) - LEFT HAND DRIVE, TRUNNION (C) - RIGHT HAND DRIVE, THRUST ROLLER ASSEMBLY, THRUST ROLLER ASSEMBLY, TRUNNION LUBRICATION SYSTEM",,No,CH-DRYER_D,CH-DRYER_D:LY84401.OUT,LY-84401,LY,OUT,Controller output / demand (CO),Level final element demand,Output/Demand,DRUM DR1826 MOTOR C AMPERAGE,DR-1826
,Remove Blank and Re-install spool on Exhaust Ducting,23-31731,DR-1826,DR-1826,,,1-10-23 11:27 AM,2023-01-10T11:27:00.000Z,,,1-11-23 3:27 PM,2023-01-11T15:27:00.000Z,4,4,,CO,CLOSE,Y,,NO,CHATHAM,"2541, 2542, 2543, 2544, 2545, 2547, 2549, 2550, 2552, 2553, 2554, 2555, 2556, 2557, 2558, 2559","SWISS COMBI ROTARY DRYER DRUM, SEW GEARBOX - LEFT HAND DRIVE -, SEW GEARBOX - LEFT HAND DRIVE, SEW GEARBOX - RIGHT HAND DRIVE, SEW GEARBOX - RIGHT HAND DRIVE, MOTOR / 25HP / 1800RPM / TEFC / 575V/3PH/60HZ / FRAME# 284TC, MOTOR / 25HP / 1800RPM / TEFC / 575V/3PH/60HZ / FRAME# 284TC, MOTOR / 25HP / 1800RPM / TEFC / 575V/3PH/60HZ / FRAME# 284TC, MOTOR / 25HP / 1800RPM / TEFC / 575V/3PH/60HZ / FRAME# 284TC, TRUNNION (A) - LEFT HAND DRIVE, TRUNNION (B)- RIGHT HAND DRIVE, TRUNNION (D) - LEFT HAND DRIVE, TRUNNION (C) - RIGHT HAND DRIVE, THRUST ROLLER ASSEMBLY, THRUST ROLLER ASSEMBLY, TRUNNION LUBRICATION SYSTEM",,No,CH-DRYER_D,CH-DRYER_D:MX1801D.STAIND,MX-1801D,MX,STAIND,"Status indication (open/closed, run/stop)",Mixer (asset),Equipment status,DRUM DR1826 MOTOR D AMPERAGE,DR-1826
,Remove Blank and Re-install spool on Exhaust Ducting,23-31731,DR-1826,DR-1826,,,1-10-23 11:27 AM,2023-01-10T11:27:00.000Z,,,1-11-23 3:27 PM,2023-01-11T15:27:00.000Z,4,4,,CO,CLOSE,Y,,NO,CHATHAM,"2541, 2542, 2543, 2544, 2545, 2547, 2549, 2550, 2552, 2553, 2554, 2555, 2556, 2557, 2558, 2559","SWISS COMBI ROTARY DRYER DRUM, SEW GEARBOX - LEFT HAND DRIVE -, SEW GEARBOX - LEFT HAND DRIVE, SEW GEARBOX - RIGHT HAND DRIVE, SEW GEARBOX - RIGHT HAND DRIVE, MOTOR / 25HP / 1800RPM / TEFC / 575V/3PH/60HZ / FRAME# 284TC, MOTOR / 25HP / 1800RPM / TEFC / 575V/3PH/60HZ / FRAME# 284TC, MOTOR / 25HP / 1800RPM / TEFC / 575V/3PH/60HZ / FRAME# 284TC, MOTOR / 25HP / 1800RPM / TEFC / 575V/3PH/60HZ / FRAME# 284TC, TRUNNION (A) - LEFT HAND DRIVE, TRUNNION (B)- RIGHT HAND DRIVE, TRUNNION (D) - LEFT HAND DRIVE, TRUNNION (C) - RIGHT HAND DRIVE, THRUST ROLLER ASSEMBLY, THRUST ROLLER ASSEMBLY, TRUNNION LUBRICATION SYSTEM",,No,CH-DRYER_D,CH-DRYER_D:PT84402.PNT,PT-84402,PT,PNT,Point value / indication,Pressure transmitter,Measurement,DRUM DR1826 FRONT LUBEN TIMER,DR-1826
,Remove Blank and Re-install spool on Exhaust Ducting,23-31731,DR-1826,DR-1826,,,1-10-23 11:27 AM,2023-01-10T11:27:00.000Z,,,1-11-23 3:27 PM,2023-01-11T15:27:00.000Z,4,4,,CO,CLOSE,Y,,NO,CHATHAM,"2541, 2542, 2543, 2544, 2545, 2547, 2549, 2550, 2552, 2553, 2554, 2555, 2556, 2557, 2558, 2559","SWISS COMBI ROTARY DRYER DRUM, SEW GEARBOX - LEFT HAND DRIVE -, SEW GEARBOX - LEFT HAND DRIVE, SEW GEARBOX - RIGHT HAND DRIVE, SEW GEARBOX - RIGHT HAND DRIVE, MOTOR / 25HP / 1800RPM / TEFC / 575V/3PH/60HZ / FRAME# 284TC, MOTOR / 25HP / 1800RPM / TEFC / 575V/3PH/60HZ / FRAME# 284TC, MOTOR / 25HP / 1800RPM / TEFC / 575V/3PH/60HZ / FRAME# 284TC, MOTOR / 25HP / 1800RPM / TEFC / 575V/3PH/60HZ / FRAME# 284TC, TRUNNION (A) - LEFT HAND DRIVE, TRUNNION (B)- RIGHT HAND DRIVE, TRUNNION (D) - LEFT HAND DRIVE, TRUNNION (C) - RIGHT HAND DRIVE, THRUST ROLLER ASSEMBLY, THRUST ROLLER ASSEMBLY, TRUNNION LUBRICATION SYSTEM",,No,CH-DRYER_D,CH-DRYER_D:SG8403A.STAIND,SG-8403A,SG,STAIND,"Status indication (open/closed, run/stop)",Speed/limit switch,Equipment status,DRUM DR1826 REAR LUBE TIMER,DR-1826
,Remove Blank and Re-install spool on Exhaust Ducting,23-31731,DR-1826,DR-1826,,,1-10-23 11:27 AM,2023-01-10T11:27:00.000Z,,,1-11-23 3:27 PM,2023-01-11T15:27:00.000Z,4,4,,CO,CLOSE,Y,,NO,CHATHAM,"2541, 2542, 2543, 2544, 2545, 2547, 2549, 2550, 2552, 2553, 2554, 2555, 2556, 2557, 2558, 2559","SWISS COMBI ROTARY DRYER DRUM, SEW GEARBOX - LEFT HAND DRIVE -, SEW GEARBOX - LEFT HAND DRIVE, SEW GEARBOX - RIGHT HAND DRIVE, SEW GEARBOX - RIGHT HAND DRIVE, MOTOR / 25HP / 1800RPM / TEFC / 575V/3PH/60HZ / FRAME# 284TC, MOTOR / 25HP / 1800RPM / TEFC / 575V/3PH/60HZ / FRAME# 284TC, MOTOR / 25HP / 1800RPM / TEFC / 575V/3PH/60HZ / FRAME# 284TC, MOTOR / 25HP / 1800RPM / TEFC / 575V/3PH/60HZ / FRAME# 284TC, TRUNNION (A) - LEFT HAND DRIVE, TRUNNION (B)- RIGHT HAND DRIVE, TRUNNION (D) - LEFT HAND DRIVE, TRUNNION (C) - RIGHT HAND DRIVE, THRUST ROLLER ASSEMBLY, THRUST ROLLER ASSEMBLY, TRUNNION LUBRICATION SYSTEM",,No,CH-DRYER_D_BMS,CH-DRYER_D_BMS:TIC84302.SPT,TIC-84302,TIC,SPT,Setpoint (SP),Temperature indicating controller,Setpoint,DRUM DR1826 SPEED CONTROL,DR-1826
,Remove Blank and Re-install spool on Exhaust Ducting,23-31731,DR-1826,DR-1826,,,1-10-23 11:27 AM,2023-01-10T11:27:00.000Z,,,1-11-23 3:27 PM,2023-01-11T15:27:00.000Z,4,4,,CO,CLOSE,Y,,NO,CHATHAM,"2541, 2542, 2543, 2544, 2545, 2547, 2549, 2550, 2552, 2553, 2554, 2555, 2556, 2557, 2558, 2559","SWISS COMBI ROTARY DRYER DRUM, SEW GEARBOX - LEFT HAND DRIVE -, SEW GEARBOX - LEFT HAND DRIVE, SEW GEARBOX - RIGHT HAND DRIVE, SEW GEARBOX - RIGHT HAND DRIVE, MOTOR / 25HP / 1800RPM / TEFC / 575V/3PH/60HZ / FRAME# 284TC, MOTOR / 25HP / 1800RPM / TEFC / 575V/3PH/60HZ / FRAME# 284TC, MOTOR / 25HP / 1800RPM / TEFC / 575V/3PH/60HZ / FRAME# 284TC, MOTOR / 25HP / 1800RPM / TEFC / 575V/3PH/60HZ / FRAME# 284TC, TRUNNION (A) - LEFT HAND DRIVE, TRUNNION (B)- RIGHT HAND DRIVE, TRUNNION (D) - LEFT HAND DRIVE, TRUNNION (C) - RIGHT HAND DRIVE, THRUST ROLLER ASSEMBLY, THRUST ROLLER ASSEMBLY, TRUNNION LUBRICATION SYSTEM",,No,CH-DRYER_D_BMS,CH-DRYER_D_BMS:TT84201.PNT,TT-84201,TT,PNT,Point value / indication,Temperature transmitter,Measurement,DRUM DR1826 SPEED CONTROL,DR-1826
,Remove Blank and Re-install spool on Exhaust Ducting,23-31731,DR-1826,DR-1826,,,1-10-23 11:27 AM,2023-01-10T11:27:00.000Z,,,1-11-23 3:27 PM,2023-01-11T15:27:00.000Z,4,4,,CO,CLOSE,Y,,NO,CHATHAM,"2541, 2542, 2543, 2544, 2545, 2547, 2549, 2550, 2552, 2553, 2554, 2555, 2556, 2557, 2558, 2559","SWISS COMBI ROTARY DRYER DRUM, SEW GEARBOX - LEFT HAND DRIVE -, SEW GEARBOX - LEFT HAND DRIVE, SEW GEARBOX - RIGHT HAND DRIVE, SEW GEARBOX - RIGHT HAND DRIVE, MOTOR / 25HP / 1800RPM / TEFC / 575V/3PH/60HZ / FRAME# 284TC, MOTOR / 25HP / 1800RPM / TEFC / 575V/3PH/60HZ / FRAME# 284TC, MOTOR / 25HP / 1800RPM / TEFC / 575V/3PH/60HZ / FRAME# 284TC, MOTOR / 25HP / 1800RPM / TEFC / 575V/3PH/60HZ / FRAME# 284TC, TRUNNION (A) - LEFT HAND DRIVE, TRUNNION (B)- RIGHT HAND DRIVE, TRUNNION (D) - LEFT HAND DRIVE, TRUNNION (C) - RIGHT HAND DRIVE, THRUST ROLLER ASSEMBLY, THRUST ROLLER ASSEMBLY, TRUNNION LUBRICATION SYSTEM",,No,CH-DRYER_D_BMS,CH-DRYER_D_BMS:TT84203.PNT,TT-84203,TT,PNT,Point value / indication,Temperature transmitter,Measurement,DRUM DR1826 SPEED CONTROL,DR-1826
,Remove Blank and Re-install spool on Exhaust Ducting,23-31731,DR-1826,DR-1826,,,1-10-23 11:27 AM,2023-01-10T11:27:00.000Z,,,1-11-23 3:27 PM,2023-01-11T15:27:00.000Z,4,4,,CO,CLOSE,Y,,NO,CHATHAM,"2541, 2542, 2543, 2544, 2545, 2547, 2549, 2550, 2552, 2553, 2554, 2555, 2556, 2557, 2558, 2559","SWISS COMBI ROTARY DRYER DRUM, SEW GEARBOX - LEFT HAND DRIVE -, SEW GEARBOX - LEFT HAND DRIVE, SEW GEARBOX - RIGHT HAND DRIVE, SEW GEARBOX - RIGHT HAND DRIVE, MOTOR / 25HP / 1800RPM / TEFC / 575V/3PH/60HZ / FRAME# 284TC, MOTOR / 25HP / 1800RPM / TEFC / 575V/3PH/60HZ / FRAME# 284TC, MOTOR / 25HP / 1800RPM / TEFC / 575V/3PH/60HZ / FRAME# 284TC, MOTOR / 25HP / 1800RPM / TEFC / 575V/3PH/60HZ / FRAME# 284TC, TRUNNION (A) - LEFT HAND DRIVE, TRUNNION (B)- RIGHT HAND DRIVE, TRUNNION (D) - LEFT HAND DRIVE, TRUNNION (C) - RIGHT HAND DRIVE, THRUST ROLLER ASSEMBLY, THRUST ROLLER ASSEMBLY, TRUNNION LUBRICATION SYSTEM",,No,CH-DRYER_D_BMS,CH-DRYER_D_BMS:TT84205.PNT,TT-84205,TT,PNT,Point value / indication,Temperature transmitter,Measurement,DRUM DR1826 SPEED SWITCH,DR-1826
